"No.","Time","Source","Destination","Protocol","Length","Info"
"1","0.000000","104.244.42.65","192.168.0.183","TLSv1.2","229","Application Data"
"2","0.049418","192.168.0.183","104.244.42.65","TCP","54","50717  >  443 [ACK] Seq=1 Ack=176 Win=1040 Len=0"
"3","2.037180","192.168.0.183","104.244.42.65","TCP","1414","50717  >  443 [ACK] Seq=1 Ack=176 Win=1040 Len=1360 [TCP segment of a reassembled PDU]"
"4","2.037180","192.168.0.183","104.244.42.65","TLSv1.2","174","Application Data"
"5","2.038015","192.168.0.183","104.244.42.65","TLSv1.2","239","Application Data"
"6","2.069972","104.244.42.65","192.168.0.183","TCP","60","443  >  50717 [ACK] Seq=176 Ack=1481 Win=5731 Len=0"
"7","2.118372","104.244.42.65","192.168.0.183","TCP","60","443  >  50717 [ACK] Seq=176 Ack=1666 Win=5735 Len=0"
"8","2.359992","104.244.42.65","192.168.0.183","TLSv1.2","182","Application Data"
"9","2.402501","192.168.0.183","104.244.42.65","TCP","54","50717  >  443 [ACK] Seq=1666 Ack=304 Win=1040 Len=0"
"10","3.318743","104.244.42.65","192.168.0.183","TCP","1414","443  >  50717 [ACK] Seq=304 Ack=1666 Win=5735 Len=1360 [TCP segment of a reassembled PDU]"
"11","3.318743","104.244.42.65","192.168.0.183","TCP","1414","443  >  50717 [ACK] Seq=1664 Ack=1666 Win=5735 Len=1360 [TCP segment of a reassembled PDU]"
"12","3.318743","104.244.42.65","192.168.0.183","TCP","1414","443  >  50717 [PSH, ACK] Seq=3024 Ack=1666 Win=5735 Len=1360 [TCP segment of a reassembled PDU]"
"13","3.318743","104.244.42.65","192.168.0.183","TCP","1414","443  >  50717 [ACK] Seq=4384 Ack=1666 Win=5735 Len=1360 [TCP segment of a reassembled PDU]"
"14","3.318743","104.244.42.65","192.168.0.183","TCP","1414","443  >  50717 [ACK] Seq=5744 Ack=1666 Win=5735 Len=1360 [TCP segment of a reassembled PDU]"
"15","3.318743","104.244.42.65","192.168.0.183","TCP","1414","443  >  50717 [PSH, ACK] Seq=7104 Ack=1666 Win=5735 Len=1360 [TCP segment of a reassembled PDU]"
"16","3.318743","104.244.42.65","192.168.0.183","TCP","1414","443  >  50717 [ACK] Seq=8464 Ack=1666 Win=5735 Len=1360 [TCP segment of a reassembled PDU]"
"17","3.318743","104.244.42.65","192.168.0.183","TCP","1414","443  >  50717 [ACK] Seq=9824 Ack=1666 Win=5735 Len=1360 [TCP segment of a reassembled PDU]"
"18","3.318743","104.244.42.65","192.168.0.183","TCP","1414","443  >  50717 [PSH, ACK] Seq=11184 Ack=1666 Win=5735 Len=1360 [TCP segment of a reassembled PDU]"
"19","3.318743","104.244.42.65","192.168.0.183","TCP","1414","443  >  50717 [ACK] Seq=12544 Ack=1666 Win=5735 Len=1360 [TCP segment of a reassembled PDU]"
"20","3.318743","104.244.42.65","192.168.0.183","TLSv1.2","1029","Application Data"
"21","3.318805","192.168.0.183","104.244.42.65","TCP","54","50717  >  443 [ACK] Seq=1666 Ack=14879 Win=1041 Len=0"
"22","3.319547","192.168.0.183","104.244.42.65","TLSv1.2","89","Application Data"
"23","3.363375","104.244.42.65","192.168.0.183","TCP","60","443  >  50717 [ACK] Seq=14879 Ack=1701 Win=5735 Len=0"
"24","3.363375","104.244.42.65","192.168.0.183","TCP","60","[TCP Dup ACK 23#1] 443  >  50717 [ACK] Seq=14879 Ack=1701 Win=5735 Len=0"
"25","3.567711","192.168.0.183","104.244.42.65","TLSv1.2","728","Application Data"
"26","3.567843","192.168.0.183","104.244.42.65","TCP","1414","50717  >  443 [ACK] Seq=2375 Ack=14879 Win=1041 Len=1360 [TCP segment of a reassembled PDU]"
"27","3.567843","192.168.0.183","104.244.42.65","TCP","1414","50717  >  443 [ACK] Seq=3735 Ack=14879 Win=1041 Len=1360 [TCP segment of a reassembled PDU]"
"28","3.567843","192.168.0.183","104.244.42.65","TCP","1414","50717  >  443 [ACK] Seq=5095 Ack=14879 Win=1041 Len=1360 [TCP segment of a reassembled PDU]"
"29","3.567843","192.168.0.183","104.244.42.65","TCP","1414","50717  >  443 [ACK] Seq=6455 Ack=14879 Win=1041 Len=1360 [TCP segment of a reassembled PDU]"
"30","3.567843","192.168.0.183","104.244.42.65","TCP","1414","50717  >  443 [ACK] Seq=7815 Ack=14879 Win=1041 Len=1360 [TCP segment of a reassembled PDU]"
"31","3.567843","192.168.0.183","104.244.42.65","TCP","1414","50717  >  443 [ACK] Seq=9175 Ack=14879 Win=1041 Len=1360 [TCP segment of a reassembled PDU]"
"32","3.567843","192.168.0.183","104.244.42.65","TCP","1414","50717  >  443 [ACK] Seq=10535 Ack=14879 Win=1041 Len=1360 [TCP segment of a reassembled PDU]"
"33","3.567843","192.168.0.183","104.244.42.65","TCP","1414","50717  >  443 [ACK] Seq=11895 Ack=14879 Win=1041 Len=1360 [TCP segment of a reassembled PDU]"
"34","3.567843","192.168.0.183","104.244.42.65","TCP","1414","50717  >  443 [ACK] Seq=13255 Ack=14879 Win=1041 Len=1360 [TCP segment of a reassembled PDU]"
"35","3.567843","192.168.0.183","104.244.42.65","TCP","1414","50717  >  443 [ACK] Seq=14615 Ack=14879 Win=1041 Len=1360 [TCP segment of a reassembled PDU]"
"36","3.567843","192.168.0.183","104.244.42.65","TCP","1414","50717  >  443 [ACK] Seq=15975 Ack=14879 Win=1041 Len=1360 [TCP segment of a reassembled PDU]"
"37","3.567843","192.168.0.183","104.244.42.65","TCP","1414","50717  >  443 [ACK] Seq=17335 Ack=14879 Win=1041 Len=1360 [TCP segment of a reassembled PDU]"
"38","3.567843","192.168.0.183","104.244.42.65","TLSv1.2","140","Application Data"
"39","3.568044","192.168.0.183","104.244.42.65","TCP","1414","50717  >  443 [ACK] Seq=18781 Ack=14879 Win=1041 Len=1360 [TCP segment of a reassembled PDU]"
"40","3.568044","192.168.0.183","104.244.42.65","TCP","1414","50717  >  443 [ACK] Seq=20141 Ack=14879 Win=1041 Len=1360 [TCP segment of a reassembled PDU]"
"41","3.568044","192.168.0.183","104.244.42.65","TCP","1414","50717  >  443 [ACK] Seq=21501 Ack=14879 Win=1041 Len=1360 [TCP segment of a reassembled PDU]"
"42","3.568044","192.168.0.183","104.244.42.65","TCP","1414","50717  >  443 [ACK] Seq=22861 Ack=14879 Win=1041 Len=1360 [TCP segment of a reassembled PDU]"
"43","3.568044","192.168.0.183","104.244.42.65","TCP","1414","50717  >  443 [ACK] Seq=24221 Ack=14879 Win=1041 Len=1360 [TCP segment of a reassembled PDU]"
"44","3.568044","192.168.0.183","104.244.42.65","TCP","1414","50717  >  443 [ACK] Seq=25581 Ack=14879 Win=1041 Len=1360 [TCP segment of a reassembled PDU]"
"45","3.568044","192.168.0.183","104.244.42.65","TCP","1414","50717  >  443 [ACK] Seq=26941 Ack=14879 Win=1041 Len=1360 [TCP segment of a reassembled PDU]"
"46","3.568044","192.168.0.183","104.244.42.65","TCP","1414","50717  >  443 [ACK] Seq=28301 Ack=14879 Win=1041 Len=1360 [TCP segment of a reassembled PDU]"
"47","3.568044","192.168.0.183","104.244.42.65","TCP","1414","50717  >  443 [ACK] Seq=29661 Ack=14879 Win=1041 Len=1360 [TCP segment of a reassembled PDU]"
"48","3.568044","192.168.0.183","104.244.42.65","TCP","1414","50717  >  443 [ACK] Seq=31021 Ack=14879 Win=1041 Len=1360 [TCP segment of a reassembled PDU]"
"49","3.568044","192.168.0.183","104.244.42.65","TLSv1.2","197","Application Data"
"50","3.599742","104.244.42.65","192.168.0.183","TCP","60","443  >  50717 [ACK] Seq=14879 Ack=32524 Win=5702 Len=0"
"51","3.641649","104.244.42.65","192.168.0.183","TLSv1.2","182","Application Data"
"52","3.693451","192.168.0.183","104.244.42.65","TCP","54","50717  >  443 [ACK] Seq=32524 Ack=15007 Win=1040 Len=0"
"53","6.510604","192.168.0.183","104.244.42.65","TLSv1.2","236","Application Data"
"54","6.510761","192.168.0.183","104.244.42.65","TCP","1414","50717  >  443 [ACK] Seq=32706 Ack=15007 Win=1040 Len=1360 [TCP segment of a reassembled PDU]"
"55","6.510761","192.168.0.183","104.244.42.65","TCP","1414","50717  >  443 [ACK] Seq=34066 Ack=15007 Win=1040 Len=1360 [TCP segment of a reassembled PDU]"
"56","6.510761","192.168.0.183","104.244.42.65","TCP","1414","50717  >  443 [ACK] Seq=35426 Ack=15007 Win=1040 Len=1360 [TCP segment of a reassembled PDU]"
"57","6.510761","192.168.0.183","104.244.42.65","TCP","1414","50717  >  443 [ACK] Seq=36786 Ack=15007 Win=1040 Len=1360 [TCP segment of a reassembled PDU]"
"58","6.510761","192.168.0.183","104.244.42.65","TCP","1414","50717  >  443 [ACK] Seq=38146 Ack=15007 Win=1040 Len=1360 [TCP segment of a reassembled PDU]"
"59","6.510761","192.168.0.183","104.244.42.65","TCP","1414","50717  >  443 [ACK] Seq=39506 Ack=15007 Win=1040 Len=1360 [TCP segment of a reassembled PDU]"
"60","6.510761","192.168.0.183","104.244.42.65","TCP","1414","50717  >  443 [ACK] Seq=40866 Ack=15007 Win=1040 Len=1360 [TCP segment of a reassembled PDU]"
"61","6.510761","192.168.0.183","104.244.42.65","TCP","1414","50717  >  443 [ACK] Seq=42226 Ack=15007 Win=1040 Len=1360 [TCP segment of a reassembled PDU]"
"62","6.510761","192.168.0.183","104.244.42.65","TCP","1414","50717  >  443 [ACK] Seq=43586 Ack=15007 Win=1040 Len=1360 [TCP segment of a reassembled PDU]"
"63","6.510761","192.168.0.183","104.244.42.65","TLSv1.2","1346","Application Data"
"64","6.542574","104.244.42.65","192.168.0.183","TCP","60","443  >  50717 [ACK] Seq=15007 Ack=35426 Win=5729 Len=0"
"65","6.549258","104.244.42.65","192.168.0.183","TCP","60","443  >  50717 [ACK] Seq=15007 Ack=46238 Win=5711 Len=0"
"66","6.569601","104.244.42.65","192.168.0.183","TLSv1.2","180","Application Data"
"67","6.621519","192.168.0.183","104.244.42.65","TCP","54","50717  >  443 [ACK] Seq=46238 Ack=15133 Win=1040 Len=0"
"68","7.877295","192.168.0.183","104.244.42.65","TCP","1414","50717  >  443 [ACK] Seq=46238 Ack=15133 Win=1040 Len=1360 [TCP segment of a reassembled PDU]"
"69","7.877295","192.168.0.183","104.244.42.65","TLSv1.2","466","Application Data"
"70","7.878088","192.168.0.183","104.244.42.65","TLSv1.2","403","Application Data"
"71","7.908427","104.244.42.65","192.168.0.183","TCP","60","443  >  50717 [ACK] Seq=15133 Ack=48010 Win=5735 Len=0"
"72","7.952305","104.244.42.65","192.168.0.183","TCP","60","443  >  50717 [ACK] Seq=15133 Ack=48359 Win=5735 Len=0"
"73","8.210169","104.244.42.65","192.168.0.183","TLSv1.2","174","Application Data"
"74","8.255589","192.168.0.183","104.244.42.65","TCP","54","50717  >  443 [ACK] Seq=48359 Ack=15253 Win=1039 Len=0"
"75","8.554141","104.244.42.65","192.168.0.183","TCP","1414","443  >  50717 [ACK] Seq=15253 Ack=48359 Win=5735 Len=1360 [TCP segment of a reassembled PDU]"
"76","8.554141","104.244.42.65","192.168.0.183","TCP","1414","443  >  50717 [ACK] Seq=16613 Ack=48359 Win=5735 Len=1360 [TCP segment of a reassembled PDU]"
"77","8.554141","104.244.42.65","192.168.0.183","TCP","1414","443  >  50717 [PSH, ACK] Seq=17973 Ack=48359 Win=5735 Len=1360 [TCP segment of a reassembled PDU]"
"78","8.554141","104.244.42.65","192.168.0.183","TCP","1414","443  >  50717 [ACK] Seq=19333 Ack=48359 Win=5735 Len=1360 [TCP segment of a reassembled PDU]"
"79","8.554141","104.244.42.65","192.168.0.183","TCP","1414","443  >  50717 [ACK] Seq=20693 Ack=48359 Win=5735 Len=1360 [TCP segment of a reassembled PDU]"
"80","8.554141","104.244.42.65","192.168.0.183","TCP","1414","443  >  50717 [PSH, ACK] Seq=22053 Ack=48359 Win=5735 Len=1360 [TCP segment of a reassembled PDU]"
"81","8.554141","104.244.42.65","192.168.0.183","TLSv1.2","101","Application Data"
"82","8.554192","192.168.0.183","104.244.42.65","TCP","54","50717  >  443 [ACK] Seq=48359 Ack=23460 Win=1041 Len=0"
"83","8.555039","192.168.0.183","104.244.42.65","TLSv1.2","89","Application Data"
"84","8.598631","104.244.42.65","192.168.0.183","TCP","60","443  >  50717 [ACK] Seq=23460 Ack=48394 Win=5735 Len=0"
"85","9.504025","192.168.0.183","104.244.42.65","TLSv1.2","626","Application Data"
"86","9.504217","192.168.0.183","104.244.42.65","TCP","1414","50717  >  443 [ACK] Seq=48966 Ack=23460 Win=1041 Len=1360 [TCP segment of a reassembled PDU]"
"87","9.504217","192.168.0.183","104.244.42.65","TCP","1414","50717  >  443 [ACK] Seq=50326 Ack=23460 Win=1041 Len=1360 [TCP segment of a reassembled PDU]"
"88","9.504217","192.168.0.183","104.244.42.65","TCP","1414","50717  >  443 [ACK] Seq=51686 Ack=23460 Win=1041 Len=1360 [TCP segment of a reassembled PDU]"
"89","9.504217","192.168.0.183","104.244.42.65","TCP","1414","50717  >  443 [ACK] Seq=53046 Ack=23460 Win=1041 Len=1360 [TCP segment of a reassembled PDU]"
"90","9.504217","192.168.0.183","104.244.42.65","TCP","1414","50717  >  443 [ACK] Seq=54406 Ack=23460 Win=1041 Len=1360 [TCP segment of a reassembled PDU]"
"91","9.504217","192.168.0.183","104.244.42.65","TCP","1414","50717  >  443 [ACK] Seq=55766 Ack=23460 Win=1041 Len=1360 [TCP segment of a reassembled PDU]"
"92","9.504217","192.168.0.183","104.244.42.65","TCP","1414","50717  >  443 [ACK] Seq=57126 Ack=23460 Win=1041 Len=1360 [TCP segment of a reassembled PDU]"
"93","9.504217","192.168.0.183","104.244.42.65","TCP","1414","50717  >  443 [ACK] Seq=58486 Ack=23460 Win=1041 Len=1360 [TCP segment of a reassembled PDU]"
"94","9.504217","192.168.0.183","104.244.42.65","TCP","1414","50717  >  443 [ACK] Seq=59846 Ack=23460 Win=1041 Len=1360 [TCP segment of a reassembled PDU]"
"95","9.504217","192.168.0.183","104.244.42.65","TCP","1414","50717  >  443 [ACK] Seq=61206 Ack=23460 Win=1041 Len=1360 [TCP segment of a reassembled PDU]"
"96","9.504217","192.168.0.183","104.244.42.65","TCP","1414","50717  >  443 [ACK] Seq=62566 Ack=23460 Win=1041 Len=1360 [TCP segment of a reassembled PDU]"
"97","9.504217","192.168.0.183","104.244.42.65","TCP","1414","50717  >  443 [ACK] Seq=63926 Ack=23460 Win=1041 Len=1360 [TCP segment of a reassembled PDU]"
"98","9.504217","192.168.0.183","104.244.42.65","TLSv1.2","140","Application Data"
"99","9.504570","192.168.0.183","104.244.42.65","TCP","1414","50717  >  443 [ACK] Seq=65372 Ack=23460 Win=1041 Len=1360 [TCP segment of a reassembled PDU]"
"100","9.504570","192.168.0.183","104.244.42.65","TCP","1414","50717  >  443 [ACK] Seq=66732 Ack=23460 Win=1041 Len=1360 [TCP segment of a reassembled PDU]"
"101","9.504570","192.168.0.183","104.244.42.65","TCP","1414","50717  >  443 [ACK] Seq=68092 Ack=23460 Win=1041 Len=1360 [TCP segment of a reassembled PDU]"
"102","9.504570","192.168.0.183","104.244.42.65","TCP","1414","50717  >  443 [ACK] Seq=69452 Ack=23460 Win=1041 Len=1360 [TCP segment of a reassembled PDU]"
"103","9.504570","192.168.0.183","104.244.42.65","TCP","1414","50717  >  443 [ACK] Seq=70812 Ack=23460 Win=1041 Len=1360 [TCP segment of a reassembled PDU]"
"104","9.504570","192.168.0.183","104.244.42.65","TCP","1414","50717  >  443 [ACK] Seq=72172 Ack=23460 Win=1041 Len=1360 [TCP segment of a reassembled PDU]"
"105","9.504570","192.168.0.183","104.244.42.65","TCP","1414","50717  >  443 [ACK] Seq=73532 Ack=23460 Win=1041 Len=1360 [TCP segment of a reassembled PDU]"
"106","9.504570","192.168.0.183","104.244.42.65","TCP","1414","50717  >  443 [ACK] Seq=74892 Ack=23460 Win=1041 Len=1360 [TCP segment of a reassembled PDU]"
"107","9.504570","192.168.0.183","104.244.42.65","TCP","1414","50717  >  443 [ACK] Seq=76252 Ack=23460 Win=1041 Len=1360 [TCP segment of a reassembled PDU]"
"108","9.504570","192.168.0.183","104.244.42.65","TCP","1414","50717  >  443 [ACK] Seq=77612 Ack=23460 Win=1041 Len=1360 [TCP segment of a reassembled PDU]"
"109","9.504570","192.168.0.183","104.244.42.65","TCP","1414","50717  >  443 [ACK] Seq=78972 Ack=23460 Win=1041 Len=1360 [TCP segment of a reassembled PDU]"
"110","9.504570","192.168.0.183","104.244.42.65","TCP","1414","50717  >  443 [ACK] Seq=80332 Ack=23460 Win=1041 Len=1360 [TCP segment of a reassembled PDU]"
"111","9.504570","192.168.0.183","104.244.42.65","TLSv1.2","140","Application Data"
"112","9.504772","192.168.0.183","104.244.42.65","TCP","1414","50717  >  443 [ACK] Seq=81778 Ack=23460 Win=1041 Len=1360 [TCP segment of a reassembled PDU]"
"113","9.504772","192.168.0.183","104.244.42.65","TCP","1414","50717  >  443 [ACK] Seq=83138 Ack=23460 Win=1041 Len=1360 [TCP segment of a reassembled PDU]"
"114","9.504772","192.168.0.183","104.244.42.65","TCP","1414","50717  >  443 [ACK] Seq=84498 Ack=23460 Win=1041 Len=1360 [TCP segment of a reassembled PDU]"
"115","9.504772","192.168.0.183","104.244.42.65","TCP","1414","50717  >  443 [ACK] Seq=85858 Ack=23460 Win=1041 Len=1360 [TCP segment of a reassembled PDU]"
"116","9.504772","192.168.0.183","104.244.42.65","TLSv1.2","985","Application Data"
"117","9.533601","104.244.42.65","192.168.0.183","TCP","60","443  >  50717 [ACK] Seq=23460 Ack=50326 Win=5730 Len=0"
"118","9.540065","104.244.42.65","192.168.0.183","TCP","60","443  >  50717 [ACK] Seq=23460 Ack=88149 Win=5719 Len=0"
"119","9.540065","104.244.42.65","192.168.0.183","TLSv1.2","89","Application Data"
"120","9.582478","192.168.0.183","104.244.42.65","TCP","54","50717  >  443 [ACK] Seq=88149 Ack=23495 Win=1041 Len=0"
"121","9.609207","104.244.42.65","192.168.0.183","TLSv1.2","184","Application Data"
"122","9.659679","192.168.0.183","104.244.42.65","TCP","54","50717  >  443 [ACK] Seq=88149 Ack=23625 Win=1040 Len=0"
"123","10.378087","192.168.0.183","104.244.42.193","TCP","55","50715  >  443 [ACK] Seq=1 Ack=1 Win=260 Len=1 [TCP segment of a reassembled PDU]"
"124","10.407877","104.244.42.193","192.168.0.183","TCP","66","443  >  50715 [ACK] Seq=1 Ack=2 Win=288 Len=0 SLE=1 SRE=2"
"125","10.558052","192.168.0.183","104.244.42.65","TLSv1.2","274","Application Data"
"126","10.558141","192.168.0.183","104.244.42.65","TLSv1.2","946","Application Data"
"127","10.587847","104.244.42.65","192.168.0.183","TCP","60","443  >  50717 [ACK] Seq=23625 Ack=89261 Win=5735 Len=0"
"128","10.615803","104.244.42.65","192.168.0.183","TLSv1.2","372","Application Data"
"129","10.670719","192.168.0.183","104.244.42.65","TCP","54","50717  >  443 [ACK] Seq=89261 Ack=23943 Win=1039 Len=0"
"130","11.146625","192.168.0.183","104.244.42.65","TLSv1.2","928","Application Data"
"131","11.146745","192.168.0.183","104.244.42.65","TLSv1.2","245","Application Data"
"132","11.202166","104.244.42.65","192.168.0.183","TCP","60","443  >  50717 [ACK] Seq=23943 Ack=90326 Win=5735 Len=0"
"133","11.202166","104.244.42.65","192.168.0.183","TLSv1.2","488","Application Data"
"134","11.202166","104.244.42.65","192.168.0.183","TLSv1.2","245","Application Data"
"135","11.202212","192.168.0.183","104.244.42.65","TCP","54","50717  >  443 [ACK] Seq=90326 Ack=24568 Win=1036 Len=0"
"136","12.483857","192.168.0.183","104.244.42.65","TLSv1.2","617","Application Data"
"137","12.557531","104.244.42.65","192.168.0.183","TCP","60","443  >  50717 [ACK] Seq=24568 Ack=90889 Win=5735 Len=0"
"138","12.563220","192.168.0.183","104.244.42.65","TLSv1.2","413","Application Data"
"139","12.563391","192.168.0.183","104.244.42.65","TCP","1414","50717  >  443 [ACK] Seq=91248 Ack=24568 Win=1036 Len=1360 [TCP segment of a reassembled PDU]"
"140","12.563391","192.168.0.183","104.244.42.65","TCP","1414","50717  >  443 [ACK] Seq=92608 Ack=24568 Win=1036 Len=1360 [TCP segment of a reassembled PDU]"
"141","12.563391","192.168.0.183","104.244.42.65","TCP","1414","50717  >  443 [ACK] Seq=93968 Ack=24568 Win=1036 Len=1360 [TCP segment of a reassembled PDU]"
"142","12.563391","192.168.0.183","104.244.42.65","TCP","1414","50717  >  443 [ACK] Seq=95328 Ack=24568 Win=1036 Len=1360 [TCP segment of a reassembled PDU]"
"143","12.563391","192.168.0.183","104.244.42.65","TCP","1414","50717  >  443 [ACK] Seq=96688 Ack=24568 Win=1036 Len=1360 [TCP segment of a reassembled PDU]"
"144","12.563391","192.168.0.183","104.244.42.65","TCP","1414","50717  >  443 [ACK] Seq=98048 Ack=24568 Win=1036 Len=1360 [TCP segment of a reassembled PDU]"
"145","12.563391","192.168.0.183","104.244.42.65","TCP","1414","50717  >  443 [ACK] Seq=99408 Ack=24568 Win=1036 Len=1360 [TCP segment of a reassembled PDU]"
"146","12.563391","192.168.0.183","104.244.42.65","TCP","1414","50717  >  443 [ACK] Seq=100768 Ack=24568 Win=1036 Len=1360 [TCP segment of a reassembled PDU]"
"147","12.563391","192.168.0.183","104.244.42.65","TCP","1414","50717  >  443 [ACK] Seq=102128 Ack=24568 Win=1036 Len=1360 [TCP segment of a reassembled PDU]"
"148","12.563391","192.168.0.183","104.244.42.65","TCP","1414","50717  >  443 [ACK] Seq=103488 Ack=24568 Win=1036 Len=1360 [TCP segment of a reassembled PDU]"
"149","12.563391","192.168.0.183","104.244.42.65","TCP","1414","50717  >  443 [ACK] Seq=104848 Ack=24568 Win=1036 Len=1360 [TCP segment of a reassembled PDU]"
"150","12.563391","192.168.0.183","104.244.42.65","TCP","1414","50717  >  443 [ACK] Seq=106208 Ack=24568 Win=1036 Len=1360 [TCP segment of a reassembled PDU]"
"151","12.563391","192.168.0.183","104.244.42.65","TLSv1.2","140","Application Data"
"152","12.563621","192.168.0.183","104.244.42.65","TCP","1414","50717  >  443 [ACK] Seq=107654 Ack=24568 Win=1036 Len=1360 [TCP segment of a reassembled PDU]"
"153","12.563621","192.168.0.183","104.244.42.65","TCP","1414","50717  >  443 [ACK] Seq=109014 Ack=24568 Win=1036 Len=1360 [TCP segment of a reassembled PDU]"
"154","12.563621","192.168.0.183","104.244.42.65","TCP","1414","50717  >  443 [ACK] Seq=110374 Ack=24568 Win=1036 Len=1360 [TCP segment of a reassembled PDU]"
"155","12.563621","192.168.0.183","104.244.42.65","TCP","1414","50717  >  443 [ACK] Seq=111734 Ack=24568 Win=1036 Len=1360 [TCP segment of a reassembled PDU]"
"156","12.563621","192.168.0.183","104.244.42.65","TCP","1414","50717  >  443 [ACK] Seq=113094 Ack=24568 Win=1036 Len=1360 [TCP segment of a reassembled PDU]"
"157","12.563621","192.168.0.183","104.244.42.65","TCP","1414","50717  >  443 [ACK] Seq=114454 Ack=24568 Win=1036 Len=1360 [TCP segment of a reassembled PDU]"
"158","12.563621","192.168.0.183","104.244.42.65","TCP","1414","50717  >  443 [ACK] Seq=115814 Ack=24568 Win=1036 Len=1360 [TCP segment of a reassembled PDU]"
"159","12.563621","192.168.0.183","104.244.42.65","TCP","1414","50717  >  443 [ACK] Seq=117174 Ack=24568 Win=1036 Len=1360 [TCP segment of a reassembled PDU]"
"160","12.563621","192.168.0.183","104.244.42.65","TCP","1414","50717  >  443 [ACK] Seq=118534 Ack=24568 Win=1036 Len=1360 [TCP segment of a reassembled PDU]"
"161","12.563621","192.168.0.183","104.244.42.65","TCP","1414","50717  >  443 [ACK] Seq=119894 Ack=24568 Win=1036 Len=1360 [TCP segment of a reassembled PDU]"
"162","12.563621","192.168.0.183","104.244.42.65","TCP","1414","50717  >  443 [ACK] Seq=121254 Ack=24568 Win=1036 Len=1360 [TCP segment of a reassembled PDU]"
"163","12.563621","192.168.0.183","104.244.42.65","TCP","1414","50717  >  443 [ACK] Seq=122614 Ack=24568 Win=1036 Len=1360 [TCP segment of a reassembled PDU]"
"164","12.563621","192.168.0.183","104.244.42.65","TLSv1.2","140","Application Data"
"165","12.563815","192.168.0.183","104.244.42.65","TCP","1414","50717  >  443 [ACK] Seq=124060 Ack=24568 Win=1036 Len=1360 [TCP segment of a reassembled PDU]"
"166","12.563815","192.168.0.183","104.244.42.65","TCP","1414","50717  >  443 [ACK] Seq=125420 Ack=24568 Win=1036 Len=1360 [TCP segment of a reassembled PDU]"
"167","12.563815","192.168.0.183","104.244.42.65","TLSv1.2","1015","Application Data"
"168","12.595764","104.244.42.65","192.168.0.183","TCP","60","443  >  50717 [ACK] Seq=24568 Ack=92608 Win=5732 Len=0"
"169","12.598478","104.244.42.65","192.168.0.183","TCP","60","443  >  50717 [ACK] Seq=24568 Ack=104848 Win=5725 Len=0"
"170","12.600089","104.244.42.65","192.168.0.183","TCP","60","443  >  50717 [ACK] Seq=24568 Ack=127741 Win=5721 Len=0"
"171","12.600089","104.244.42.65","192.168.0.183","TLSv1.2","102","Application Data"
"172","12.644083","104.244.42.65","192.168.0.183","TLSv1.2","206","Application Data"
"173","12.644119","192.168.0.183","104.244.42.65","TCP","54","50717  >  443 [ACK] Seq=127741 Ack=24768 Win=1036 Len=0"
"174","12.804585","104.244.42.65","192.168.0.183","TLSv1.2","178","Application Data"
"175","12.851268","192.168.0.183","104.244.42.65","TCP","54","50717  >  443 [ACK] Seq=127741 Ack=24892 Win=1041 Len=0"
"176","15.538966","192.168.0.183","104.244.42.65","TLSv1.2","257","Application Data"
"177","15.539064","192.168.0.183","104.244.42.65","TCP","1414","50717  >  443 [ACK] Seq=127944 Ack=24892 Win=1041 Len=1360 [TCP segment of a reassembled PDU]"
"178","15.539064","192.168.0.183","104.244.42.65","TCP","1414","50717  >  443 [ACK] Seq=129304 Ack=24892 Win=1041 Len=1360 [TCP segment of a reassembled PDU]"
"179","15.539064","192.168.0.183","104.244.42.65","TCP","1414","50717  >  443 [ACK] Seq=130664 Ack=24892 Win=1041 Len=1360 [TCP segment of a reassembled PDU]"
"180","15.539064","192.168.0.183","104.244.42.65","TCP","1414","50717  >  443 [ACK] Seq=132024 Ack=24892 Win=1041 Len=1360 [TCP segment of a reassembled PDU]"
"181","15.539064","192.168.0.183","104.244.42.65","TCP","1414","50717  >  443 [ACK] Seq=133384 Ack=24892 Win=1041 Len=1360 [TCP segment of a reassembled PDU]"
"182","15.539064","192.168.0.183","104.244.42.65","TCP","1414","50717  >  443 [ACK] Seq=134744 Ack=24892 Win=1041 Len=1360 [TCP segment of a reassembled PDU]"
"183","15.539064","192.168.0.183","104.244.42.65","TLSv1.2","1400","Application Data"
"184","15.575655","104.244.42.65","192.168.0.183","TCP","60","443  >  50717 [ACK] Seq=24892 Ack=134744 Win=5735 Len=0"
"185","15.584356","104.244.42.65","192.168.0.183","TCP","60","443  >  50717 [ACK] Seq=24892 Ack=137450 Win=5735 Len=0"
"186","15.611796","104.244.42.65","192.168.0.183","TLSv1.2","210","Application Data"
"187","15.663037","192.168.0.183","104.244.42.65","TCP","54","50717  >  443 [ACK] Seq=137450 Ack=25048 Win=1040 Len=0"
"188","16.578397","192.168.0.183","104.244.42.65","TCP","1414","50717  >  443 [ACK] Seq=137450 Ack=25048 Win=1040 Len=1360 [TCP segment of a reassembled PDU]"
"189","16.578397","192.168.0.183","104.244.42.65","TLSv1.2","989","Application Data"
"190","16.578582","192.168.0.183","104.244.42.65","TLSv1.2","262","Application Data"
"191","16.610047","104.244.42.65","192.168.0.183","TCP","60","443  >  50717 [ACK] Seq=25048 Ack=139953 Win=5728 Len=0"
"192","16.990098","104.244.42.65","192.168.0.183","TLSv1.2","175","Application Data"
"193","17.035469","192.168.0.183","104.244.42.65","TCP","54","50717  >  443 [ACK] Seq=139953 Ack=25169 Win=1040 Len=0"
"194","17.444883","104.244.42.65","192.168.0.183","TCP","1414","443  >  50717 [ACK] Seq=25169 Ack=139953 Win=5735 Len=1360 [TCP segment of a reassembled PDU]"
"195","17.444883","104.244.42.65","192.168.0.183","TCP","1414","443  >  50717 [ACK] Seq=26529 Ack=139953 Win=5735 Len=1360 [TCP segment of a reassembled PDU]"
"196","17.444883","104.244.42.65","192.168.0.183","TCP","1414","443  >  50717 [PSH, ACK] Seq=27889 Ack=139953 Win=5735 Len=1360 [TCP segment of a reassembled PDU]"
"197","17.444883","104.244.42.65","192.168.0.183","TCP","1414","443  >  50717 [ACK] Seq=29249 Ack=139953 Win=5735 Len=1360 [TCP segment of a reassembled PDU]"
"198","17.444883","104.244.42.65","192.168.0.183","TCP","1414","443  >  50717 [ACK] Seq=30609 Ack=139953 Win=5735 Len=1360 [TCP segment of a reassembled PDU]"
"199","17.444883","104.244.42.65","192.168.0.183","TLSv1.2","904","Application Data"
"200","17.444933","192.168.0.183","104.244.42.65","TCP","54","50717  >  443 [ACK] Seq=139953 Ack=32819 Win=1041 Len=0"
"201","17.445726","192.168.0.183","104.244.42.65","TLSv1.2","89","Application Data"
"202","17.518933","104.244.42.65","192.168.0.183","TCP","60","443  >  50717 [ACK] Seq=32819 Ack=139988 Win=5735 Len=0"
"203","18.993444","192.168.0.183","104.244.42.65","TLSv1.2","275","Application Data"
"204","18.993533","192.168.0.183","104.244.42.65","TLSv1.2","948","Application Data"
"205","19.025126","104.244.42.65","192.168.0.183","TCP","60","443  >  50717 [ACK] Seq=32819 Ack=141103 Win=5733 Len=0"
"206","19.047858","104.244.42.65","192.168.0.183","TLSv1.2","184","Application Data"
"207","19.095315","192.168.0.183","104.244.42.65","TCP","54","50717  >  443 [ACK] Seq=141103 Ack=32949 Win=1040 Len=0"
"208","19.366619","192.168.0.183","104.244.42.65","TLSv1.2","237","Application Data"
"209","19.366750","192.168.0.183","104.244.42.65","TCP","1414","50717  >  443 [ACK] Seq=141286 Ack=32949 Win=1040 Len=1360 [TCP segment of a reassembled PDU]"
"210","19.366750","192.168.0.183","104.244.42.65","TCP","1414","50717  >  443 [ACK] Seq=142646 Ack=32949 Win=1040 Len=1360 [TCP segment of a reassembled PDU]"
"211","19.366750","192.168.0.183","104.244.42.65","TCP","1414","50717  >  443 [ACK] Seq=144006 Ack=32949 Win=1040 Len=1360 [TCP segment of a reassembled PDU]"
"212","19.366750","192.168.0.183","104.244.42.65","TCP","1414","50717  >  443 [ACK] Seq=145366 Ack=32949 Win=1040 Len=1360 [TCP segment of a reassembled PDU]"
"213","19.366750","192.168.0.183","104.244.42.65","TCP","1414","50717  >  443 [ACK] Seq=146726 Ack=32949 Win=1040 Len=1360 [TCP segment of a reassembled PDU]"
"214","19.366750","192.168.0.183","104.244.42.65","TCP","1414","50717  >  443 [ACK] Seq=148086 Ack=32949 Win=1040 Len=1360 [TCP segment of a reassembled PDU]"
"215","19.366750","192.168.0.183","104.244.42.65","TCP","1414","50717  >  443 [ACK] Seq=149446 Ack=32949 Win=1040 Len=1360 [TCP segment of a reassembled PDU]"
"216","19.366750","192.168.0.183","104.244.42.65","TCP","1414","50717  >  443 [ACK] Seq=150806 Ack=32949 Win=1040 Len=1360 [TCP segment of a reassembled PDU]"
"217","19.366750","192.168.0.183","104.244.42.65","TCP","1414","50717  >  443 [ACK] Seq=152166 Ack=32949 Win=1040 Len=1360 [TCP segment of a reassembled PDU]"
"218","19.366750","192.168.0.183","104.244.42.65","TCP","1414","50717  >  443 [ACK] Seq=153526 Ack=32949 Win=1040 Len=1360 [TCP segment of a reassembled PDU]"
"219","19.366750","192.168.0.183","104.244.42.65","TCP","1414","50717  >  443 [ACK] Seq=154886 Ack=32949 Win=1040 Len=1360 [TCP segment of a reassembled PDU]"
"220","19.366750","192.168.0.183","104.244.42.65","TCP","1414","50717  >  443 [ACK] Seq=156246 Ack=32949 Win=1040 Len=1360 [TCP segment of a reassembled PDU]"
"221","19.366750","192.168.0.183","104.244.42.65","TLSv1.2","140","Application Data"
"222","19.366903","192.168.0.183","104.244.42.65","TCP","1414","50717  >  443 [ACK] Seq=157692 Ack=32949 Win=1040 Len=1360 [TCP segment of a reassembled PDU]"
"223","19.366903","192.168.0.183","104.244.42.65","TCP","1414","50717  >  443 [ACK] Seq=159052 Ack=32949 Win=1040 Len=1360 [TCP segment of a reassembled PDU]"
"224","19.366903","192.168.0.183","104.244.42.65","TCP","1414","50717  >  443 [ACK] Seq=160412 Ack=32949 Win=1040 Len=1360 [TCP segment of a reassembled PDU]"
"225","19.366903","192.168.0.183","104.244.42.65","TCP","1414","50717  >  443 [ACK] Seq=161772 Ack=32949 Win=1040 Len=1360 [TCP segment of a reassembled PDU]"
"226","19.366903","192.168.0.183","104.244.42.65","TCP","1414","50717  >  443 [ACK] Seq=163132 Ack=32949 Win=1040 Len=1360 [TCP segment of a reassembled PDU]"
"227","19.366903","192.168.0.183","104.244.42.65","TCP","1414","50717  >  443 [ACK] Seq=164492 Ack=32949 Win=1040 Len=1360 [TCP segment of a reassembled PDU]"
"228","19.366903","192.168.0.183","104.244.42.65","TCP","1414","50717  >  443 [ACK] Seq=165852 Ack=32949 Win=1040 Len=1360 [TCP segment of a reassembled PDU]"
"229","19.366903","192.168.0.183","104.244.42.65","TCP","1414","50717  >  443 [ACK] Seq=167212 Ack=32949 Win=1040 Len=1360 [TCP segment of a reassembled PDU]"
"230","19.366903","192.168.0.183","104.244.42.65","TCP","1414","50717  >  443 [ACK] Seq=168572 Ack=32949 Win=1040 Len=1360 [TCP segment of a reassembled PDU]"
"231","19.366903","192.168.0.183","104.244.42.65","TCP","1414","50717  >  443 [ACK] Seq=169932 Ack=32949 Win=1040 Len=1360 [TCP segment of a reassembled PDU]"
"232","19.366903","192.168.0.183","104.244.42.65","TCP","1414","50717  >  443 [ACK] Seq=171292 Ack=32949 Win=1040 Len=1360 [TCP segment of a reassembled PDU]"
"233","19.366903","192.168.0.183","104.244.42.65","TCP","1414","50717  >  443 [ACK] Seq=172652 Ack=32949 Win=1040 Len=1360 [TCP segment of a reassembled PDU]"
"234","19.366903","192.168.0.183","104.244.42.65","TLSv1.2","140","Application Data"
"235","19.367140","192.168.0.183","104.244.42.65","TCP","1414","50717  >  443 [ACK] Seq=174098 Ack=32949 Win=1040 Len=1360 [TCP segment of a reassembled PDU]"
"236","19.367140","192.168.0.183","104.244.42.65","TCP","1414","50717  >  443 [ACK] Seq=175458 Ack=32949 Win=1040 Len=1360 [TCP segment of a reassembled PDU]"
"237","19.367140","192.168.0.183","104.244.42.65","TCP","1414","50717  >  443 [ACK] Seq=176818 Ack=32949 Win=1040 Len=1360 [TCP segment of a reassembled PDU]"
"238","19.367140","192.168.0.183","104.244.42.65","TCP","1414","50717  >  443 [ACK] Seq=178178 Ack=32949 Win=1040 Len=1360 [TCP segment of a reassembled PDU]"
"239","19.367140","192.168.0.183","104.244.42.65","TCP","1414","50717  >  443 [ACK] Seq=179538 Ack=32949 Win=1040 Len=1360 [TCP segment of a reassembled PDU]"
"240","19.367140","192.168.0.183","104.244.42.65","TCP","1414","50717  >  443 [ACK] Seq=180898 Ack=32949 Win=1040 Len=1360 [TCP segment of a reassembled PDU]"
"241","19.367140","192.168.0.183","104.244.42.65","TCP","1414","50717  >  443 [ACK] Seq=182258 Ack=32949 Win=1040 Len=1360 [TCP segment of a reassembled PDU]"
"242","19.367140","192.168.0.183","104.244.42.65","TCP","1414","50717  >  443 [ACK] Seq=183618 Ack=32949 Win=1040 Len=1360 [TCP segment of a reassembled PDU]"
"243","19.367140","192.168.0.183","104.244.42.65","TCP","1414","50717  >  443 [ACK] Seq=184978 Ack=32949 Win=1040 Len=1360 [TCP segment of a reassembled PDU]"
"244","19.367140","192.168.0.183","104.244.42.65","TCP","1414","50717  >  443 [ACK] Seq=186338 Ack=32949 Win=1040 Len=1360 [TCP segment of a reassembled PDU]"
"245","19.367140","192.168.0.183","104.244.42.65","TCP","1414","50717  >  443 [ACK] Seq=187698 Ack=32949 Win=1040 Len=1360 [TCP segment of a reassembled PDU]"
"246","19.367140","192.168.0.183","104.244.42.65","TCP","1414","50717  >  443 [ACK] Seq=189058 Ack=32949 Win=1040 Len=1360 [TCP segment of a reassembled PDU]"
"247","19.367140","192.168.0.183","104.244.42.65","TLSv1.2","140","Application Data"
"248","19.367266","192.168.0.183","104.244.42.65","TCP","1414","50717  >  443 [ACK] Seq=190504 Ack=32949 Win=1040 Len=1360 [TCP segment of a reassembled PDU]"
"249","19.367266","192.168.0.183","104.244.42.65","TCP","1414","50717  >  443 [ACK] Seq=191864 Ack=32949 Win=1040 Len=1360 [TCP segment of a reassembled PDU]"
"250","19.367266","192.168.0.183","104.244.42.65","TLSv1.2","866","Application Data"
"251","19.367531","192.168.0.183","104.244.42.65","TLSv1.2","619","Application Data"
"252","19.398942","104.244.42.65","192.168.0.183","TCP","60","443  >  50717 [ACK] Seq=32949 Ack=142646 Win=5732 Len=0"
"253","19.401682","104.244.42.65","192.168.0.183","TCP","60","443  >  50717 [ACK] Seq=32949 Ack=194601 Win=5712 Len=0"
"254","19.401682","104.244.42.65","192.168.0.183","TLSv1.2","89","Application Data"
"255","19.452124","104.244.42.65","192.168.0.183","TLSv1.2","161","Application Data"
"256","19.452183","192.168.0.183","104.244.42.65","TCP","54","50717  >  443 [ACK] Seq=194601 Ack=33091 Win=1040 Len=0"
"257","19.846238","104.244.42.65","192.168.0.183","TLSv1.2","152","Application Data"
"258","19.893014","192.168.0.183","104.244.42.65","TCP","54","50717  >  443 [ACK] Seq=194601 Ack=33189 Win=1039 Len=0"
"259","22.277463","192.168.0.183","104.244.42.65","TLSv1.2","414","Application Data"
"260","22.277586","192.168.0.183","104.244.42.65","TCP","1414","50717  >  443 [ACK] Seq=194961 Ack=33189 Win=1039 Len=1360 [TCP segment of a reassembled PDU]"
"261","22.277586","192.168.0.183","104.244.42.65","TCP","1414","50717  >  443 [ACK] Seq=196321 Ack=33189 Win=1039 Len=1360 [TCP segment of a reassembled PDU]"
"262","22.277586","192.168.0.183","104.244.42.65","TCP","1414","50717  >  443 [ACK] Seq=197681 Ack=33189 Win=1039 Len=1360 [TCP segment of a reassembled PDU]"
"263","22.277586","192.168.0.183","104.244.42.65","TCP","1414","50717  >  443 [ACK] Seq=199041 Ack=33189 Win=1039 Len=1360 [TCP segment of a reassembled PDU]"
"264","22.277586","192.168.0.183","104.244.42.65","TCP","1414","50717  >  443 [ACK] Seq=200401 Ack=33189 Win=1039 Len=1360 [TCP segment of a reassembled PDU]"
"265","22.277586","192.168.0.183","104.244.42.65","TCP","1414","50717  >  443 [ACK] Seq=201761 Ack=33189 Win=1039 Len=1360 [TCP segment of a reassembled PDU]"
"266","22.277586","192.168.0.183","104.244.42.65","TCP","1414","50717  >  443 [ACK] Seq=203121 Ack=33189 Win=1039 Len=1360 [TCP segment of a reassembled PDU]"
"267","22.277586","192.168.0.183","104.244.42.65","TCP","1414","50717  >  443 [ACK] Seq=204481 Ack=33189 Win=1039 Len=1360 [TCP segment of a reassembled PDU]"
"268","22.277586","192.168.0.183","104.244.42.65","TCP","1414","50717  >  443 [ACK] Seq=205841 Ack=33189 Win=1039 Len=1360 [TCP segment of a reassembled PDU]"
"269","22.277586","192.168.0.183","104.244.42.65","TCP","1414","50717  >  443 [ACK] Seq=207201 Ack=33189 Win=1039 Len=1360 [TCP segment of a reassembled PDU]"
"270","22.277586","192.168.0.183","104.244.42.65","TCP","1414","50717  >  443 [ACK] Seq=208561 Ack=33189 Win=1039 Len=1360 [TCP segment of a reassembled PDU]"
"271","22.277586","192.168.0.183","104.244.42.65","TCP","1414","50717  >  443 [ACK] Seq=209921 Ack=33189 Win=1039 Len=1360 [TCP segment of a reassembled PDU]"
"272","22.277586","192.168.0.183","104.244.42.65","TLSv1.2","140","Application Data"
"273","22.277728","192.168.0.183","104.244.42.65","TCP","1414","50717  >  443 [ACK] Seq=211367 Ack=33189 Win=1039 Len=1360 [TCP segment of a reassembled PDU]"
"274","22.277728","192.168.0.183","104.244.42.65","TCP","1414","50717  >  443 [ACK] Seq=212727 Ack=33189 Win=1039 Len=1360 [TCP segment of a reassembled PDU]"
"275","22.277728","192.168.0.183","104.244.42.65","TCP","1414","50717  >  443 [ACK] Seq=214087 Ack=33189 Win=1039 Len=1360 [TCP segment of a reassembled PDU]"
"276","22.277728","192.168.0.183","104.244.42.65","TCP","1414","50717  >  443 [ACK] Seq=215447 Ack=33189 Win=1039 Len=1360 [TCP segment of a reassembled PDU]"
"277","22.277728","192.168.0.183","104.244.42.65","TCP","1414","50717  >  443 [ACK] Seq=216807 Ack=33189 Win=1039 Len=1360 [TCP segment of a reassembled PDU]"
"278","22.277728","192.168.0.183","104.244.42.65","TCP","1414","50717  >  443 [ACK] Seq=218167 Ack=33189 Win=1039 Len=1360 [TCP segment of a reassembled PDU]"
"279","22.277728","192.168.0.183","104.244.42.65","TCP","1414","50717  >  443 [ACK] Seq=219527 Ack=33189 Win=1039 Len=1360 [TCP segment of a reassembled PDU]"
"280","22.277728","192.168.0.183","104.244.42.65","TCP","1414","50717  >  443 [ACK] Seq=220887 Ack=33189 Win=1039 Len=1360 [TCP segment of a reassembled PDU]"
"281","22.277728","192.168.0.183","104.244.42.65","TCP","1414","50717  >  443 [ACK] Seq=222247 Ack=33189 Win=1039 Len=1360 [TCP segment of a reassembled PDU]"
"282","22.277728","192.168.0.183","104.244.42.65","TCP","1414","50717  >  443 [ACK] Seq=223607 Ack=33189 Win=1039 Len=1360 [TCP segment of a reassembled PDU]"
"283","22.277728","192.168.0.183","104.244.42.65","TCP","1414","50717  >  443 [ACK] Seq=224967 Ack=33189 Win=1039 Len=1360 [TCP segment of a reassembled PDU]"
"284","22.277728","192.168.0.183","104.244.42.65","TCP","1414","50717  >  443 [ACK] Seq=226327 Ack=33189 Win=1039 Len=1360 [TCP segment of a reassembled PDU]"
"285","22.277728","192.168.0.183","104.244.42.65","TLSv1.2","140","Application Data"
"286","22.277852","192.168.0.183","104.244.42.65","TCP","1414","50717  >  443 [ACK] Seq=227773 Ack=33189 Win=1039 Len=1360 [TCP segment of a reassembled PDU]"
"287","22.277852","192.168.0.183","104.244.42.65","TCP","1414","50717  >  443 [ACK] Seq=229133 Ack=33189 Win=1039 Len=1360 [TCP segment of a reassembled PDU]"
"288","22.277852","192.168.0.183","104.244.42.65","TCP","1414","50717  >  443 [ACK] Seq=230493 Ack=33189 Win=1039 Len=1360 [TCP segment of a reassembled PDU]"
"289","22.277852","192.168.0.183","104.244.42.65","TCP","1414","50717  >  443 [ACK] Seq=231853 Ack=33189 Win=1039 Len=1360 [TCP segment of a reassembled PDU]"
"290","22.277852","192.168.0.183","104.244.42.65","TCP","1414","50717  >  443 [ACK] Seq=233213 Ack=33189 Win=1039 Len=1360 [TCP segment of a reassembled PDU]"
"291","22.277852","192.168.0.183","104.244.42.65","TCP","1414","50717  >  443 [ACK] Seq=234573 Ack=33189 Win=1039 Len=1360 [TCP segment of a reassembled PDU]"
"292","22.277852","192.168.0.183","104.244.42.65","TCP","1414","50717  >  443 [ACK] Seq=235933 Ack=33189 Win=1039 Len=1360 [TCP segment of a reassembled PDU]"
"293","22.277852","192.168.0.183","104.244.42.65","TCP","1414","50717  >  443 [ACK] Seq=237293 Ack=33189 Win=1039 Len=1360 [TCP segment of a reassembled PDU]"
"294","22.277852","192.168.0.183","104.244.42.65","TCP","1414","50717  >  443 [ACK] Seq=238653 Ack=33189 Win=1039 Len=1360 [TCP segment of a reassembled PDU]"
"295","22.277852","192.168.0.183","104.244.42.65","TCP","1414","50717  >  443 [ACK] Seq=240013 Ack=33189 Win=1039 Len=1360 [TCP segment of a reassembled PDU]"
"296","22.277852","192.168.0.183","104.244.42.65","TLSv1.2","1169","Application Data"
"297","22.312604","104.244.42.65","192.168.0.183","TCP","60","443  >  50717 [ACK] Seq=33189 Ack=196321 Win=5731 Len=0"
"298","22.316250","104.244.42.65","192.168.0.183","TCP","60","443  >  50717 [ACK] Seq=33189 Ack=237293 Win=5711 Len=0"
"299","22.322733","104.244.42.65","192.168.0.183","TCP","60","443  >  50717 [ACK] Seq=33189 Ack=242488 Win=5722 Len=0"
"300","22.322733","104.244.42.65","192.168.0.183","TLSv1.2","89","Application Data"
"301","22.359791","104.244.42.65","192.168.0.183","TLSv1.2","372","Application Data"
"302","22.359829","192.168.0.183","104.244.42.65","TCP","54","50717  >  443 [ACK] Seq=242488 Ack=33542 Win=1038 Len=0"
"303","22.899932","192.168.0.183","104.244.42.65","TLSv1.2","279","Application Data"
"304","22.949906","192.168.0.183","104.244.42.65","TLSv1.2","797","Application Data"
"305","22.950005","192.168.0.183","104.244.42.65","TCP","1414","50717  >  443 [ACK] Seq=243456 Ack=33542 Win=1038 Len=1360 [TCP segment of a reassembled PDU]"
"306","22.950005","192.168.0.183","104.244.42.65","TLSv1.2","310","Application Data"
"307","22.966350","192.168.0.183","104.244.42.65","TLSv1.2","234","Application Data"
"308","22.966475","192.168.0.183","104.244.42.65","TLSv1.2","489","Application Data"
"309","22.970700","104.244.42.65","192.168.0.183","TCP","60","443  >  50717 [ACK] Seq=33542 Ack=242713 Win=5735 Len=0"
"310","22.979697","104.244.42.65","192.168.0.183","TCP","60","443  >  50717 [ACK] Seq=33542 Ack=244816 Win=5730 Len=0"
"311","22.985103","104.244.42.65","192.168.0.183","TCP","60","443  >  50717 [ACK] Seq=33542 Ack=245072 Win=5735 Len=0"
"312","23.008542","104.244.42.65","192.168.0.183","TCP","60","443  >  50717 [ACK] Seq=33542 Ack=245687 Win=5734 Len=0"
"313","23.025076","104.244.42.65","192.168.0.183","TLSv1.2","184","Application Data"
"314","23.072330","192.168.0.183","104.244.42.65","TCP","54","50717  >  443 [ACK] Seq=245687 Ack=33672 Win=1037 Len=0"
"315","23.379704","104.244.42.65","192.168.0.183","TLSv1.2","175","Application Data"
"316","23.428571","192.168.0.183","104.244.42.65","TCP","54","50717  >  443 [ACK] Seq=245687 Ack=33793 Win=1037 Len=0"
"317","24.995613","104.244.42.65","192.168.0.183","TCP","1414","443  >  50717 [ACK] Seq=33793 Ack=245687 Win=5735 Len=1360 [TCP segment of a reassembled PDU]"
"318","24.995613","104.244.42.65","192.168.0.183","TCP","1414","443  >  50717 [ACK] Seq=35153 Ack=245687 Win=5735 Len=1360 [TCP segment of a reassembled PDU]"
"319","24.995613","104.244.42.65","192.168.0.183","TCP","1414","443  >  50717 [PSH, ACK] Seq=36513 Ack=245687 Win=5735 Len=1360 [TCP segment of a reassembled PDU]"
"320","24.995613","104.244.42.65","192.168.0.183","TCP","1414","443  >  50717 [ACK] Seq=37873 Ack=245687 Win=5735 Len=1360 [TCP segment of a reassembled PDU]"
"321","24.995613","104.244.42.65","192.168.0.183","TCP","1414","443  >  50717 [ACK] Seq=39233 Ack=245687 Win=5735 Len=1360 [TCP segment of a reassembled PDU]"
"322","24.995613","104.244.42.65","192.168.0.183","TCP","1414","443  >  50717 [PSH, ACK] Seq=40593 Ack=245687 Win=5735 Len=1360 [TCP segment of a reassembled PDU]"
"323","24.995613","104.244.42.65","192.168.0.183","TCP","1414","443  >  50717 [ACK] Seq=41953 Ack=245687 Win=5735 Len=1360 [TCP segment of a reassembled PDU]"
"324","24.995613","104.244.42.65","192.168.0.183","TCP","1414","443  >  50717 [ACK] Seq=43313 Ack=245687 Win=5735 Len=1360 [TCP segment of a reassembled PDU]"
"325","24.995613","104.244.42.65","192.168.0.183","TCP","1414","443  >  50717 [PSH, ACK] Seq=44673 Ack=245687 Win=5735 Len=1360 [TCP segment of a reassembled PDU]"
"326","24.995613","104.244.42.65","192.168.0.183","TCP","1414","443  >  50717 [ACK] Seq=46033 Ack=245687 Win=5735 Len=1360 [TCP segment of a reassembled PDU]"
"327","24.995613","104.244.42.65","192.168.0.183","TCP","1414","443  >  50717 [ACK] Seq=47393 Ack=245687 Win=5735 Len=1360 [TCP segment of a reassembled PDU]"
"328","24.995613","104.244.42.65","192.168.0.183","TCP","1414","443  >  50717 [PSH, ACK] Seq=48753 Ack=245687 Win=5735 Len=1360 [TCP segment of a reassembled PDU]"
"329","24.995613","104.244.42.65","192.168.0.183","TLSv1.2","1414","Application Data"
"330","24.995613","104.244.42.65","192.168.0.183","TCP","1414","443  >  50717 [ACK] Seq=51473 Ack=245687 Win=5735 Len=1360 [TCP segment of a reassembled PDU]"
"331","24.995613","104.244.42.65","192.168.0.183","TCP","1414","443  >  50717 [PSH, ACK] Seq=52833 Ack=245687 Win=5735 Len=1360 [TCP segment of a reassembled PDU]"
"332","24.995613","104.244.42.65","192.168.0.183","TCP","1414","443  >  50717 [ACK] Seq=54193 Ack=245687 Win=5735 Len=1360 [TCP segment of a reassembled PDU]"
"333","24.995613","104.244.42.65","192.168.0.183","TCP","1414","443  >  50717 [ACK] Seq=55553 Ack=245687 Win=5735 Len=1360 [TCP segment of a reassembled PDU]"
"334","24.995613","104.244.42.65","192.168.0.183","TCP","1414","443  >  50717 [PSH, ACK] Seq=56913 Ack=245687 Win=5735 Len=1360 [TCP segment of a reassembled PDU]"
"335","24.995613","104.244.42.65","192.168.0.183","TCP","1414","443  >  50717 [ACK] Seq=58273 Ack=245687 Win=5735 Len=1360 [TCP segment of a reassembled PDU]"
"336","24.995613","104.244.42.65","192.168.0.183","TCP","1414","443  >  50717 [ACK] Seq=59633 Ack=245687 Win=5735 Len=1360 [TCP segment of a reassembled PDU]"
"337","24.995613","104.244.42.65","192.168.0.183","TCP","1414","443  >  50717 [PSH, ACK] Seq=60993 Ack=245687 Win=5735 Len=1360 [TCP segment of a reassembled PDU]"
"338","24.995613","104.244.42.65","192.168.0.183","TCP","1414","443  >  50717 [ACK] Seq=62353 Ack=245687 Win=5735 Len=1360 [TCP segment of a reassembled PDU]"
"339","24.995613","104.244.42.65","192.168.0.183","TCP","1414","443  >  50717 [ACK] Seq=63713 Ack=245687 Win=5735 Len=1360 [TCP segment of a reassembled PDU]"
"340","24.995613","104.244.42.65","192.168.0.183","TCP","1414","443  >  50717 [PSH, ACK] Seq=65073 Ack=245687 Win=5735 Len=1360 [TCP segment of a reassembled PDU]"
"341","24.995613","104.244.42.65","192.168.0.183","TLSv1.2","226","Application Data"
"342","24.995613","104.244.42.65","192.168.0.183","TCP","1414","443  >  50717 [ACK] Seq=66605 Ack=245687 Win=5735 Len=1360 [TCP segment of a reassembled PDU]"
"343","24.995613","104.244.42.65","192.168.0.183","TLSv1.2","345","Application Data"
"344","24.995840","192.168.0.183","104.244.42.65","TCP","54","50717  >  443 [ACK] Seq=245687 Ack=68256 Win=1041 Len=0"
"345","24.996744","192.168.0.183","104.244.42.65","TLSv1.2","89","Application Data"
"346","25.080335","104.244.42.65","192.168.0.183","TCP","60","443  >  50717 [ACK] Seq=68256 Ack=245722 Win=5735 Len=0"
"347","25.290364","192.168.0.183","104.244.42.65","TLSv1.2","273","Application Data"
"348","25.290477","192.168.0.183","104.244.42.65","TCP","1414","50717  >  443 [ACK] Seq=245941 Ack=68256 Win=1041 Len=1360 [TCP segment of a reassembled PDU]"
"349","25.290477","192.168.0.183","104.244.42.65","TCP","1414","50717  >  443 [ACK] Seq=247301 Ack=68256 Win=1041 Len=1360 [TCP segment of a reassembled PDU]"
"350","25.290477","192.168.0.183","104.244.42.65","TCP","1414","50717  >  443 [ACK] Seq=248661 Ack=68256 Win=1041 Len=1360 [TCP segment of a reassembled PDU]"
"351","25.290477","192.168.0.183","104.244.42.65","TCP","1414","50717  >  443 [ACK] Seq=250021 Ack=68256 Win=1041 Len=1360 [TCP segment of a reassembled PDU]"
"352","25.290477","192.168.0.183","104.244.42.65","TCP","1414","50717  >  443 [ACK] Seq=251381 Ack=68256 Win=1041 Len=1360 [TCP segment of a reassembled PDU]"
"353","25.290477","192.168.0.183","104.244.42.65","TCP","1414","50717  >  443 [ACK] Seq=252741 Ack=68256 Win=1041 Len=1360 [TCP segment of a reassembled PDU]"
"354","25.290477","192.168.0.183","104.244.42.65","TCP","1414","50717  >  443 [ACK] Seq=254101 Ack=68256 Win=1041 Len=1360 [TCP segment of a reassembled PDU]"
"355","25.290477","192.168.0.183","104.244.42.65","TCP","1414","50717  >  443 [ACK] Seq=255461 Ack=68256 Win=1041 Len=1360 [TCP segment of a reassembled PDU]"
"356","25.290477","192.168.0.183","104.244.42.65","TCP","1414","50717  >  443 [ACK] Seq=256821 Ack=68256 Win=1041 Len=1360 [TCP segment of a reassembled PDU]"
"357","25.290477","192.168.0.183","104.244.42.65","TCP","1414","50717  >  443 [ACK] Seq=258181 Ack=68256 Win=1041 Len=1360 [TCP segment of a reassembled PDU]"
"358","25.290477","192.168.0.183","104.244.42.65","TCP","1414","50717  >  443 [ACK] Seq=259541 Ack=68256 Win=1041 Len=1360 [TCP segment of a reassembled PDU]"
"359","25.290477","192.168.0.183","104.244.42.65","TCP","1414","50717  >  443 [ACK] Seq=260901 Ack=68256 Win=1041 Len=1360 [TCP segment of a reassembled PDU]"
"360","25.290477","192.168.0.183","104.244.42.65","TLSv1.2","140","Application Data"
"361","25.290601","192.168.0.183","104.244.42.65","TCP","1414","50717  >  443 [ACK] Seq=262347 Ack=68256 Win=1041 Len=1360 [TCP segment of a reassembled PDU]"
"362","25.290601","192.168.0.183","104.244.42.65","TCP","1414","50717  >  443 [ACK] Seq=263707 Ack=68256 Win=1041 Len=1360 [TCP segment of a reassembled PDU]"
"363","25.290601","192.168.0.183","104.244.42.65","TCP","1414","50717  >  443 [ACK] Seq=265067 Ack=68256 Win=1041 Len=1360 [TCP segment of a reassembled PDU]"
"364","25.290601","192.168.0.183","104.244.42.65","TCP","1414","50717  >  443 [ACK] Seq=266427 Ack=68256 Win=1041 Len=1360 [TCP segment of a reassembled PDU]"
"365","25.290601","192.168.0.183","104.244.42.65","TCP","1414","50717  >  443 [ACK] Seq=267787 Ack=68256 Win=1041 Len=1360 [TCP segment of a reassembled PDU]"
"366","25.290601","192.168.0.183","104.244.42.65","TCP","1414","50717  >  443 [ACK] Seq=269147 Ack=68256 Win=1041 Len=1360 [TCP segment of a reassembled PDU]"
"367","25.290601","192.168.0.183","104.244.42.65","TCP","1414","50717  >  443 [ACK] Seq=270507 Ack=68256 Win=1041 Len=1360 [TCP segment of a reassembled PDU]"
"368","25.290601","192.168.0.183","104.244.42.65","TCP","1414","50717  >  443 [ACK] Seq=271867 Ack=68256 Win=1041 Len=1360 [TCP segment of a reassembled PDU]"
"369","25.290601","192.168.0.183","104.244.42.65","TCP","1414","50717  >  443 [ACK] Seq=273227 Ack=68256 Win=1041 Len=1360 [TCP segment of a reassembled PDU]"
"370","25.290601","192.168.0.183","104.244.42.65","TCP","1414","50717  >  443 [ACK] Seq=274587 Ack=68256 Win=1041 Len=1360 [TCP segment of a reassembled PDU]"
"371","25.290601","192.168.0.183","104.244.42.65","TCP","1414","50717  >  443 [ACK] Seq=275947 Ack=68256 Win=1041 Len=1360 [TCP segment of a reassembled PDU]"
"372","25.290601","192.168.0.183","104.244.42.65","TCP","1414","50717  >  443 [ACK] Seq=277307 Ack=68256 Win=1041 Len=1360 [TCP segment of a reassembled PDU]"
"373","25.290601","192.168.0.183","104.244.42.65","TLSv1.2","140","Application Data"
"374","25.290723","192.168.0.183","104.244.42.65","TCP","1414","50717  >  443 [ACK] Seq=278753 Ack=68256 Win=1041 Len=1360 [TCP segment of a reassembled PDU]"
"375","25.290723","192.168.0.183","104.244.42.65","TCP","1414","50717  >  443 [ACK] Seq=280113 Ack=68256 Win=1041 Len=1360 [TCP segment of a reassembled PDU]"
"376","25.290723","192.168.0.183","104.244.42.65","TCP","1414","50717  >  443 [ACK] Seq=281473 Ack=68256 Win=1041 Len=1360 [TCP segment of a reassembled PDU]"
"377","25.290723","192.168.0.183","104.244.42.65","TCP","1414","50717  >  443 [ACK] Seq=282833 Ack=68256 Win=1041 Len=1360 [TCP segment of a reassembled PDU]"
"378","25.290723","192.168.0.183","104.244.42.65","TCP","1414","50717  >  443 [ACK] Seq=284193 Ack=68256 Win=1041 Len=1360 [TCP segment of a reassembled PDU]"
"379","25.290723","192.168.0.183","104.244.42.65","TCP","1414","50717  >  443 [ACK] Seq=285553 Ack=68256 Win=1041 Len=1360 [TCP segment of a reassembled PDU]"
"380","25.290723","192.168.0.183","104.244.42.65","TCP","1414","50717  >  443 [ACK] Seq=286913 Ack=68256 Win=1041 Len=1360 [TCP segment of a reassembled PDU]"
"381","25.290723","192.168.0.183","104.244.42.65","TCP","1414","50717  >  443 [ACK] Seq=288273 Ack=68256 Win=1041 Len=1360 [TCP segment of a reassembled PDU]"
"382","25.290723","192.168.0.183","104.244.42.65","TCP","1414","50717  >  443 [ACK] Seq=289633 Ack=68256 Win=1041 Len=1360 [TCP segment of a reassembled PDU]"
"383","25.290723","192.168.0.183","104.244.42.65","TCP","1414","50717  >  443 [ACK] Seq=290993 Ack=68256 Win=1041 Len=1360 [TCP segment of a reassembled PDU]"
"384","25.290723","192.168.0.183","104.244.42.65","TCP","1414","50717  >  443 [ACK] Seq=292353 Ack=68256 Win=1041 Len=1360 [TCP segment of a reassembled PDU]"
"385","25.290723","192.168.0.183","104.244.42.65","TCP","1414","50717  >  443 [ACK] Seq=293713 Ack=68256 Win=1041 Len=1360 [TCP segment of a reassembled PDU]"
"386","25.290723","192.168.0.183","104.244.42.65","TLSv1.2","140","Application Data"
"387","25.290837","192.168.0.183","104.244.42.65","TCP","1414","50717  >  443 [ACK] Seq=295159 Ack=68256 Win=1041 Len=1360 [TCP segment of a reassembled PDU]"
"388","25.290837","192.168.0.183","104.244.42.65","TCP","1414","50717  >  443 [ACK] Seq=296519 Ack=68256 Win=1041 Len=1360 [TCP segment of a reassembled PDU]"
"389","25.290837","192.168.0.183","104.244.42.65","TCP","1414","50717  >  443 [ACK] Seq=297879 Ack=68256 Win=1041 Len=1360 [TCP segment of a reassembled PDU]"
"390","25.290837","192.168.0.183","104.244.42.65","TCP","1414","50717  >  443 [ACK] Seq=299239 Ack=68256 Win=1041 Len=1360 [TCP segment of a reassembled PDU]"
"391","25.290837","192.168.0.183","104.244.42.65","TCP","1414","50717  >  443 [ACK] Seq=300599 Ack=68256 Win=1041 Len=1360 [TCP segment of a reassembled PDU]"
"392","25.290837","192.168.0.183","104.244.42.65","TCP","1414","50717  >  443 [ACK] Seq=301959 Ack=68256 Win=1041 Len=1360 [TCP segment of a reassembled PDU]"
"393","25.290837","192.168.0.183","104.244.42.65","TLSv1.2","396","Application Data"
"394","25.319626","104.244.42.65","192.168.0.183","TCP","60","443  >  50717 [ACK] Seq=68256 Ack=245941 Win=5735 Len=0"
"395","25.321450","104.244.42.65","192.168.0.183","TCP","60","443  >  50717 [ACK] Seq=68256 Ack=247301 Win=5732 Len=0"
"396","25.326546","104.244.42.65","192.168.0.183","TCP","60","443  >  50717 [ACK] Seq=68256 Ack=289633 Win=5721 Len=0"
"397","25.327693","104.244.42.65","192.168.0.183","TCP","60","443  >  50717 [ACK] Seq=68256 Ack=303661 Win=5704 Len=0"
"398","25.327693","104.244.42.65","192.168.0.183","TLSv1.2","89","Application Data"
"399","25.375366","192.168.0.183","104.244.42.65","TCP","54","50717  >  443 [ACK] Seq=303661 Ack=68291 Win=1041 Len=0"
"400","25.406846","104.244.42.65","192.168.0.183","TLSv1.2","161","Application Data"
"401","25.453480","192.168.0.183","104.244.42.65","TCP","54","50717  >  443 [ACK] Seq=303661 Ack=68398 Win=1040 Len=0"
