"No.","Time","Source","Destination","Protocol","Length","Info"
"1","0.000000","192.168.0.183","104.244.42.65","TLSv1.2","1026","Application Data"
"2","0.000109","192.168.0.183","104.244.42.65","TLSv1.2","246","Application Data"
"3","0.039082","104.244.42.65","192.168.0.183","TCP","60","443  >  50717 [ACK] Seq=1 Ack=1165 Win=6204 Len=0"
"4","0.062575","104.244.42.65","192.168.0.183","TLSv1.2","593","Application Data"
"5","0.063162","192.168.0.183","104.244.42.65","TLSv1.2","89","Application Data"
"6","0.066419","104.244.42.65","192.168.0.183","TLSv1.2","298","Application Data"
"7","0.116617","192.168.0.183","104.244.42.65","TCP","54","50717  >  443 [ACK] Seq=1200 Ack=784 Win=1038 Len=0"
"8","0.141834","104.244.42.65","192.168.0.183","TCP","60","443  >  50717 [ACK] Seq=784 Ack=1200 Win=6204 Len=0"
"9","0.628526","192.168.0.183","104.244.42.65","TLSv1.2","706","Application Data"
"10","0.628634","192.168.0.183","104.244.42.65","TCP","1414","50717  >  443 [ACK] Seq=1852 Ack=784 Win=1038 Len=1360 [TCP segment of a reassembled PDU]"
"11","0.628634","192.168.0.183","104.244.42.65","TCP","1414","50717  >  443 [ACK] Seq=3212 Ack=784 Win=1038 Len=1360 [TCP segment of a reassembled PDU]"
"12","0.628634","192.168.0.183","104.244.42.65","TLSv1.2","372","Application Data"
"13","0.673898","104.244.42.65","192.168.0.183","TCP","60","443  >  50717 [ACK] Seq=784 Ack=1852 Win=6215 Len=0"
"14","0.673898","104.244.42.65","192.168.0.183","TCP","60","443  >  50717 [ACK] Seq=784 Ack=3212 Win=6225 Len=0"
"15","0.673898","104.244.42.65","192.168.0.183","TCP","60","443  >  50717 [ACK] Seq=784 Ack=4890 Win=6239 Len=0"
"16","0.691939","104.244.42.65","192.168.0.183","TLSv1.2","161","Application Data"
"17","0.739325","192.168.0.183","104.244.42.65","TCP","54","50717  >  443 [ACK] Seq=4890 Ack=891 Win=1037 Len=0"
"18","3.607495","192.168.0.183","104.244.42.65","TLSv1.2","672","Application Data"
"19","3.607627","192.168.0.183","104.244.42.65","TCP","1414","50717  >  443 [ACK] Seq=5508 Ack=891 Win=1037 Len=1360 [TCP segment of a reassembled PDU]"
"20","3.607627","192.168.0.183","104.244.42.65","TCP","1414","50717  >  443 [ACK] Seq=6868 Ack=891 Win=1037 Len=1360 [TCP segment of a reassembled PDU]"
"21","3.607627","192.168.0.183","104.244.42.65","TCP","1414","50717  >  443 [ACK] Seq=8228 Ack=891 Win=1037 Len=1360 [TCP segment of a reassembled PDU]"
"22","3.607627","192.168.0.183","104.244.42.65","TCP","1414","50717  >  443 [ACK] Seq=9588 Ack=891 Win=1037 Len=1360 [TCP segment of a reassembled PDU]"
"23","3.607627","192.168.0.183","104.244.42.65","TCP","1414","50717  >  443 [ACK] Seq=10948 Ack=891 Win=1037 Len=1360 [TCP segment of a reassembled PDU]"
"24","3.607627","192.168.0.183","104.244.42.65","TCP","1414","50717  >  443 [ACK] Seq=12308 Ack=891 Win=1037 Len=1360 [TCP segment of a reassembled PDU]"
"25","3.607627","192.168.0.183","104.244.42.65","TCP","1414","50717  >  443 [ACK] Seq=13668 Ack=891 Win=1037 Len=1360 [TCP segment of a reassembled PDU]"
"26","3.607627","192.168.0.183","104.244.42.65","TCP","1414","50717  >  443 [ACK] Seq=15028 Ack=891 Win=1037 Len=1360 [TCP segment of a reassembled PDU]"
"27","3.607627","192.168.0.183","104.244.42.65","TCP","1414","50717  >  443 [ACK] Seq=16388 Ack=891 Win=1037 Len=1360 [TCP segment of a reassembled PDU]"
"28","3.607627","192.168.0.183","104.244.42.65","TCP","1414","50717  >  443 [ACK] Seq=17748 Ack=891 Win=1037 Len=1360 [TCP segment of a reassembled PDU]"
"29","3.607627","192.168.0.183","104.244.42.65","TCP","1414","50717  >  443 [ACK] Seq=19108 Ack=891 Win=1037 Len=1360 [TCP segment of a reassembled PDU]"
"30","3.607627","192.168.0.183","104.244.42.65","TCP","1414","50717  >  443 [ACK] Seq=20468 Ack=891 Win=1037 Len=1360 [TCP segment of a reassembled PDU]"
"31","3.607627","192.168.0.183","104.244.42.65","TLSv1.2","140","Application Data"
"32","3.607759","192.168.0.183","104.244.42.65","TCP","1414","50717  >  443 [ACK] Seq=21914 Ack=891 Win=1037 Len=1360 [TCP segment of a reassembled PDU]"
"33","3.607759","192.168.0.183","104.244.42.65","TCP","1414","50717  >  443 [ACK] Seq=23274 Ack=891 Win=1037 Len=1360 [TCP segment of a reassembled PDU]"
"34","3.607759","192.168.0.183","104.244.42.65","TCP","1414","50717  >  443 [ACK] Seq=24634 Ack=891 Win=1037 Len=1360 [TCP segment of a reassembled PDU]"
"35","3.607759","192.168.0.183","104.244.42.65","TCP","1414","50717  >  443 [ACK] Seq=25994 Ack=891 Win=1037 Len=1360 [TCP segment of a reassembled PDU]"
"36","3.607759","192.168.0.183","104.244.42.65","TCP","1414","50717  >  443 [ACK] Seq=27354 Ack=891 Win=1037 Len=1360 [TCP segment of a reassembled PDU]"
"37","3.607759","192.168.0.183","104.244.42.65","TCP","1414","50717  >  443 [ACK] Seq=28714 Ack=891 Win=1037 Len=1360 [TCP segment of a reassembled PDU]"
"38","3.607759","192.168.0.183","104.244.42.65","TCP","1414","50717  >  443 [ACK] Seq=30074 Ack=891 Win=1037 Len=1360 [TCP segment of a reassembled PDU]"
"39","3.607759","192.168.0.183","104.244.42.65","TCP","1414","50717  >  443 [ACK] Seq=31434 Ack=891 Win=1037 Len=1360 [TCP segment of a reassembled PDU]"
"40","3.607759","192.168.0.183","104.244.42.65","TCP","1414","50717  >  443 [ACK] Seq=32794 Ack=891 Win=1037 Len=1360 [TCP segment of a reassembled PDU]"
"41","3.607759","192.168.0.183","104.244.42.65","TCP","1414","50717  >  443 [ACK] Seq=34154 Ack=891 Win=1037 Len=1360 [TCP segment of a reassembled PDU]"
"42","3.607759","192.168.0.183","104.244.42.65","TCP","1414","50717  >  443 [ACK] Seq=35514 Ack=891 Win=1037 Len=1360 [TCP segment of a reassembled PDU]"
"43","3.607759","192.168.0.183","104.244.42.65","TCP","1414","50717  >  443 [ACK] Seq=36874 Ack=891 Win=1037 Len=1360 [TCP segment of a reassembled PDU]"
"44","3.607759","192.168.0.183","104.244.42.65","TLSv1.2","140","Application Data"
"45","3.607891","192.168.0.183","104.244.42.65","TCP","1414","50717  >  443 [ACK] Seq=38320 Ack=891 Win=1037 Len=1360 [TCP segment of a reassembled PDU]"
"46","3.607891","192.168.0.183","104.244.42.65","TCP","1414","50717  >  443 [ACK] Seq=39680 Ack=891 Win=1037 Len=1360 [TCP segment of a reassembled PDU]"
"47","3.607891","192.168.0.183","104.244.42.65","TCP","1414","50717  >  443 [ACK] Seq=41040 Ack=891 Win=1037 Len=1360 [TCP segment of a reassembled PDU]"
"48","3.607891","192.168.0.183","104.244.42.65","TCP","1414","50717  >  443 [ACK] Seq=42400 Ack=891 Win=1037 Len=1360 [TCP segment of a reassembled PDU]"
"49","3.607891","192.168.0.183","104.244.42.65","TCP","1414","50717  >  443 [ACK] Seq=43760 Ack=891 Win=1037 Len=1360 [TCP segment of a reassembled PDU]"
"50","3.607891","192.168.0.183","104.244.42.65","TCP","1414","50717  >  443 [ACK] Seq=45120 Ack=891 Win=1037 Len=1360 [TCP segment of a reassembled PDU]"
"51","3.607891","192.168.0.183","104.244.42.65","TCP","1414","50717  >  443 [ACK] Seq=46480 Ack=891 Win=1037 Len=1360 [TCP segment of a reassembled PDU]"
"52","3.607891","192.168.0.183","104.244.42.65","TCP","1414","50717  >  443 [ACK] Seq=47840 Ack=891 Win=1037 Len=1360 [TCP segment of a reassembled PDU]"
"53","3.607891","192.168.0.183","104.244.42.65","TCP","1414","50717  >  443 [ACK] Seq=49200 Ack=891 Win=1037 Len=1360 [TCP segment of a reassembled PDU]"
"54","3.607891","192.168.0.183","104.244.42.65","TCP","1414","50717  >  443 [ACK] Seq=50560 Ack=891 Win=1037 Len=1360 [TCP segment of a reassembled PDU]"
"55","3.607891","192.168.0.183","104.244.42.65","TCP","1414","50717  >  443 [ACK] Seq=51920 Ack=891 Win=1037 Len=1360 [TCP segment of a reassembled PDU]"
"56","3.607891","192.168.0.183","104.244.42.65","TCP","1414","50717  >  443 [ACK] Seq=53280 Ack=891 Win=1037 Len=1360 [TCP segment of a reassembled PDU]"
"57","3.607891","192.168.0.183","104.244.42.65","TLSv1.2","140","Application Data"
"58","3.608028","192.168.0.183","104.244.42.65","TCP","1414","50717  >  443 [ACK] Seq=54726 Ack=891 Win=1037 Len=1360 [TCP segment of a reassembled PDU]"
"59","3.608028","192.168.0.183","104.244.42.65","TCP","1414","50717  >  443 [ACK] Seq=56086 Ack=891 Win=1037 Len=1360 [TCP segment of a reassembled PDU]"
"60","3.608028","192.168.0.183","104.244.42.65","TCP","1414","50717  >  443 [ACK] Seq=57446 Ack=891 Win=1037 Len=1360 [TCP segment of a reassembled PDU]"
"61","3.608028","192.168.0.183","104.244.42.65","TCP","1414","50717  >  443 [ACK] Seq=58806 Ack=891 Win=1037 Len=1360 [TCP segment of a reassembled PDU]"
"62","3.608028","192.168.0.183","104.244.42.65","TCP","1414","50717  >  443 [ACK] Seq=60166 Ack=891 Win=1037 Len=1360 [TCP segment of a reassembled PDU]"
"63","3.608028","192.168.0.183","104.244.42.65","TCP","1414","50717  >  443 [ACK] Seq=61526 Ack=891 Win=1037 Len=1360 [TCP segment of a reassembled PDU]"
"64","3.608028","192.168.0.183","104.244.42.65","TCP","1414","50717  >  443 [ACK] Seq=62886 Ack=891 Win=1037 Len=1360 [TCP segment of a reassembled PDU]"
"65","3.608028","192.168.0.183","104.244.42.65","TCP","1414","50717  >  443 [ACK] Seq=64246 Ack=891 Win=1037 Len=1360 [TCP segment of a reassembled PDU]"
"66","3.608028","192.168.0.183","104.244.42.65","TCP","1414","50717  >  443 [ACK] Seq=65606 Ack=891 Win=1037 Len=1360 [TCP segment of a reassembled PDU]"
"67","3.608028","192.168.0.183","104.244.42.65","TCP","1414","50717  >  443 [ACK] Seq=66966 Ack=891 Win=1037 Len=1360 [TCP segment of a reassembled PDU]"
"68","3.608028","192.168.0.183","104.244.42.65","TCP","1414","50717  >  443 [ACK] Seq=68326 Ack=891 Win=1037 Len=1360 [TCP segment of a reassembled PDU]"
"69","3.608028","192.168.0.183","104.244.42.65","TCP","1414","50717  >  443 [ACK] Seq=69686 Ack=891 Win=1037 Len=1360 [TCP segment of a reassembled PDU]"
"70","3.608028","192.168.0.183","104.244.42.65","TLSv1.2","140","Application Data"
"71","3.608203","192.168.0.183","104.244.42.65","TLSv1.2","121","Application Data"
"72","3.644436","104.244.42.65","192.168.0.183","TCP","60","443  >  50717 [ACK] Seq=891 Ack=6868 Win=6260 Len=0"
"73","3.649766","104.244.42.65","192.168.0.183","TCP","60","443  >  50717 [ACK] Seq=891 Ack=60166 Win=6676 Len=0"
"74","3.649766","104.244.42.65","192.168.0.183","TLSv1.2","89","Application Data"
"75","3.649766","104.244.42.65","192.168.0.183","TCP","60","443  >  50717 [ACK] Seq=926 Ack=71132 Win=6762 Len=0"
"76","3.650005","192.168.0.183","104.244.42.65","TCP","1414","50717  >  443 [ACK] Seq=71199 Ack=926 Win=1037 Len=1360 [TCP segment of a reassembled PDU]"
"77","3.650005","192.168.0.183","104.244.42.65","TCP","1414","50717  >  443 [ACK] Seq=72559 Ack=926 Win=1037 Len=1360 [TCP segment of a reassembled PDU]"
"78","3.650005","192.168.0.183","104.244.42.65","TCP","1414","50717  >  443 [ACK] Seq=73919 Ack=926 Win=1037 Len=1360 [TCP segment of a reassembled PDU]"
"79","3.650005","192.168.0.183","104.244.42.65","TCP","1414","50717  >  443 [ACK] Seq=75279 Ack=926 Win=1037 Len=1360 [TCP segment of a reassembled PDU]"
"80","3.650005","192.168.0.183","104.244.42.65","TCP","1414","50717  >  443 [ACK] Seq=76639 Ack=926 Win=1037 Len=1360 [TCP segment of a reassembled PDU]"
"81","3.650005","192.168.0.183","104.244.42.65","TCP","1414","50717  >  443 [ACK] Seq=77999 Ack=926 Win=1037 Len=1360 [TCP segment of a reassembled PDU]"
"82","3.650005","192.168.0.183","104.244.42.65","TCP","1414","50717  >  443 [ACK] Seq=79359 Ack=926 Win=1037 Len=1360 [TCP segment of a reassembled PDU]"
"83","3.650005","192.168.0.183","104.244.42.65","TCP","1414","50717  >  443 [ACK] Seq=80719 Ack=926 Win=1037 Len=1360 [TCP segment of a reassembled PDU]"
"84","3.650005","192.168.0.183","104.244.42.65","TLSv1.2","709","Application Data"
"85","3.689384","104.244.42.65","192.168.0.183","TCP","60","443  >  50717 [ACK] Seq=926 Ack=72559 Win=6773 Len=0"
"86","3.689384","104.244.42.65","192.168.0.183","TCP","60","443  >  50717 [ACK] Seq=926 Ack=75279 Win=6794 Len=0"
"87","3.693269","104.244.42.65","192.168.0.183","TCP","60","443  >  50717 [ACK] Seq=926 Ack=82734 Win=6852 Len=0"
"88","3.739204","104.244.42.65","192.168.0.183","TLSv1.2","220","Application Data"
"89","3.783537","192.168.0.183","104.244.42.65","TCP","54","50717  >  443 [ACK] Seq=82734 Ack=1092 Win=1036 Len=0"
"90","6.815324","192.168.0.183","104.244.42.65","TLSv1.2","237","Application Data"
"91","6.815633","192.168.0.183","104.244.42.65","TCP","1414","50717  >  443 [ACK] Seq=82917 Ack=1092 Win=1036 Len=1360 [TCP segment of a reassembled PDU]"
"92","6.815633","192.168.0.183","104.244.42.65","TCP","1414","50717  >  443 [ACK] Seq=84277 Ack=1092 Win=1036 Len=1360 [TCP segment of a reassembled PDU]"
"93","6.815633","192.168.0.183","104.244.42.65","TCP","1414","50717  >  443 [ACK] Seq=85637 Ack=1092 Win=1036 Len=1360 [TCP segment of a reassembled PDU]"
"94","6.815633","192.168.0.183","104.244.42.65","TCP","1414","50717  >  443 [ACK] Seq=86997 Ack=1092 Win=1036 Len=1360 [TCP segment of a reassembled PDU]"
"95","6.815633","192.168.0.183","104.244.42.65","TCP","1414","50717  >  443 [ACK] Seq=88357 Ack=1092 Win=1036 Len=1360 [TCP segment of a reassembled PDU]"
"96","6.815633","192.168.0.183","104.244.42.65","TCP","1414","50717  >  443 [ACK] Seq=89717 Ack=1092 Win=1036 Len=1360 [TCP segment of a reassembled PDU]"
"97","6.815633","192.168.0.183","104.244.42.65","TCP","1414","50717  >  443 [ACK] Seq=91077 Ack=1092 Win=1036 Len=1360 [TCP segment of a reassembled PDU]"
"98","6.815633","192.168.0.183","104.244.42.65","TCP","1414","50717  >  443 [ACK] Seq=92437 Ack=1092 Win=1036 Len=1360 [TCP segment of a reassembled PDU]"
"99","6.815633","192.168.0.183","104.244.42.65","TCP","1414","50717  >  443 [ACK] Seq=93797 Ack=1092 Win=1036 Len=1360 [TCP segment of a reassembled PDU]"
"100","6.815633","192.168.0.183","104.244.42.65","TCP","1414","50717  >  443 [ACK] Seq=95157 Ack=1092 Win=1036 Len=1360 [TCP segment of a reassembled PDU]"
"101","6.815633","192.168.0.183","104.244.42.65","TCP","1414","50717  >  443 [ACK] Seq=96517 Ack=1092 Win=1036 Len=1360 [TCP segment of a reassembled PDU]"
"102","6.815633","192.168.0.183","104.244.42.65","TCP","1414","50717  >  443 [ACK] Seq=97877 Ack=1092 Win=1036 Len=1360 [TCP segment of a reassembled PDU]"
"103","6.815633","192.168.0.183","104.244.42.65","TLSv1.2","140","Application Data"
"104","6.815862","192.168.0.183","104.244.42.65","TCP","1414","50717  >  443 [ACK] Seq=99323 Ack=1092 Win=1036 Len=1360 [TCP segment of a reassembled PDU]"
"105","6.815862","192.168.0.183","104.244.42.65","TCP","1414","50717  >  443 [ACK] Seq=100683 Ack=1092 Win=1036 Len=1360 [TCP segment of a reassembled PDU]"
"106","6.815862","192.168.0.183","104.244.42.65","TCP","1414","50717  >  443 [ACK] Seq=102043 Ack=1092 Win=1036 Len=1360 [TCP segment of a reassembled PDU]"
"107","6.815862","192.168.0.183","104.244.42.65","TCP","1414","50717  >  443 [ACK] Seq=103403 Ack=1092 Win=1036 Len=1360 [TCP segment of a reassembled PDU]"
"108","6.815862","192.168.0.183","104.244.42.65","TLSv1.2","726","Application Data"
"109","6.851784","104.244.42.65","192.168.0.183","TCP","60","443  >  50717 [ACK] Seq=1092 Ack=84277 Win=6863 Len=0"
"110","6.858472","104.244.42.65","192.168.0.183","TCP","60","443  >  50717 [ACK] Seq=1092 Ack=99323 Win=6980 Len=0"
"111","6.858472","104.244.42.65","192.168.0.183","TCP","60","443  >  50717 [ACK] Seq=1092 Ack=104763 Win=7023 Len=0"
"112","6.888084","104.244.42.65","192.168.0.183","TLSv1.2","184","Application Data"
"113","6.938080","192.168.0.183","104.244.42.65","TCP","54","50717  >  443 [ACK] Seq=105435 Ack=1222 Win=1036 Len=0"
"114","6.958264","192.168.0.183","104.244.42.65","TLSv1.2","307","Application Data"
"115","7.039543","104.244.42.65","192.168.0.183","TCP","60","443  >  50717 [ACK] Seq=1222 Ack=105688 Win=7044 Len=0"
"116","7.309343","104.244.42.65","192.168.0.183","TLSv1.2","212","Application Data"
"117","7.360474","192.168.0.183","104.244.42.65","TCP","54","50717  >  443 [ACK] Seq=105688 Ack=1380 Win=1041 Len=0"
"118","9.814530","192.168.0.183","104.244.42.65","TLSv1.2","244","Application Data"
"119","9.814952","192.168.0.183","104.244.42.65","TCP","1414","50717  >  443 [ACK] Seq=105878 Ack=1380 Win=1041 Len=1360 [TCP segment of a reassembled PDU]"
"120","9.814952","192.168.0.183","104.244.42.65","TCP","1414","50717  >  443 [ACK] Seq=107238 Ack=1380 Win=1041 Len=1360 [TCP segment of a reassembled PDU]"
"121","9.814952","192.168.0.183","104.244.42.65","TCP","1414","50717  >  443 [ACK] Seq=108598 Ack=1380 Win=1041 Len=1360 [TCP segment of a reassembled PDU]"
"122","9.814952","192.168.0.183","104.244.42.65","TCP","1414","50717  >  443 [ACK] Seq=109958 Ack=1380 Win=1041 Len=1360 [TCP segment of a reassembled PDU]"
"123","9.814952","192.168.0.183","104.244.42.65","TCP","1414","50717  >  443 [ACK] Seq=111318 Ack=1380 Win=1041 Len=1360 [TCP segment of a reassembled PDU]"
"124","9.814952","192.168.0.183","104.244.42.65","TCP","1414","50717  >  443 [ACK] Seq=112678 Ack=1380 Win=1041 Len=1360 [TCP segment of a reassembled PDU]"
"125","9.814952","192.168.0.183","104.244.42.65","TCP","1414","50717  >  443 [ACK] Seq=114038 Ack=1380 Win=1041 Len=1360 [TCP segment of a reassembled PDU]"
"126","9.814952","192.168.0.183","104.244.42.65","TCP","1414","50717  >  443 [ACK] Seq=115398 Ack=1380 Win=1041 Len=1360 [TCP segment of a reassembled PDU]"
"127","9.814952","192.168.0.183","104.244.42.65","TCP","1414","50717  >  443 [ACK] Seq=116758 Ack=1380 Win=1041 Len=1360 [TCP segment of a reassembled PDU]"
"128","9.814952","192.168.0.183","104.244.42.65","TCP","1414","50717  >  443 [ACK] Seq=118118 Ack=1380 Win=1041 Len=1360 [TCP segment of a reassembled PDU]"
"129","9.814952","192.168.0.183","104.244.42.65","TCP","1414","50717  >  443 [ACK] Seq=119478 Ack=1380 Win=1041 Len=1360 [TCP segment of a reassembled PDU]"
"130","9.814952","192.168.0.183","104.244.42.65","TCP","1414","50717  >  443 [ACK] Seq=120838 Ack=1380 Win=1041 Len=1360 [TCP segment of a reassembled PDU]"
"131","9.814952","192.168.0.183","104.244.42.65","TLSv1.2","140","Application Data"
"132","9.815193","192.168.0.183","104.244.42.65","TCP","1414","50717  >  443 [ACK] Seq=122284 Ack=1380 Win=1041 Len=1360 [TCP segment of a reassembled PDU]"
"133","9.815193","192.168.0.183","104.244.42.65","TCP","1414","50717  >  443 [ACK] Seq=123644 Ack=1380 Win=1041 Len=1360 [TCP segment of a reassembled PDU]"
"134","9.815193","192.168.0.183","104.244.42.65","TCP","1414","50717  >  443 [ACK] Seq=125004 Ack=1380 Win=1041 Len=1360 [TCP segment of a reassembled PDU]"
"135","9.815193","192.168.0.183","104.244.42.65","TCP","1414","50717  >  443 [ACK] Seq=126364 Ack=1380 Win=1041 Len=1360 [TCP segment of a reassembled PDU]"
"136","9.815193","192.168.0.183","104.244.42.65","TCP","1414","50717  >  443 [ACK] Seq=127724 Ack=1380 Win=1041 Len=1360 [TCP segment of a reassembled PDU]"
"137","9.815193","192.168.0.183","104.244.42.65","TCP","1414","50717  >  443 [ACK] Seq=129084 Ack=1380 Win=1041 Len=1360 [TCP segment of a reassembled PDU]"
"138","9.815193","192.168.0.183","104.244.42.65","TLSv1.2","740","Application Data"
"139","9.851569","104.244.42.65","192.168.0.183","TCP","60","443  >  50717 [ACK] Seq=1380 Ack=107238 Win=7055 Len=0"
"140","9.858622","104.244.42.65","192.168.0.183","TCP","60","443  >  50717 [ACK] Seq=1380 Ack=131130 Win=7241 Len=0"
"141","9.885355","104.244.42.65","192.168.0.183","TLSv1.2","266","Application Data"
"142","9.933854","192.168.0.183","104.244.42.65","TCP","54","50717  >  443 [ACK] Seq=131130 Ack=1592 Win=1040 Len=0"
"143","12.715473","192.168.0.183","104.244.42.65","TLSv1.2","304","Application Data"
"144","12.715613","192.168.0.183","104.244.42.65","TLSv1.2","168","Application Data"
"145","12.756995","104.244.42.65","192.168.0.183","TCP","60","443  >  50717 [ACK] Seq=1592 Ack=131494 Win=7252 Len=0"
"146","12.828077","192.168.0.183","104.244.42.65","TLSv1.2","329","Application Data"
"147","12.828197","192.168.0.183","104.244.42.65","TCP","1414","50717  >  443 [ACK] Seq=131769 Ack=1592 Win=1040 Len=1360 [TCP segment of a reassembled PDU]"
"148","12.828197","192.168.0.183","104.244.42.65","TCP","1414","50717  >  443 [ACK] Seq=133129 Ack=1592 Win=1040 Len=1360 [TCP segment of a reassembled PDU]"
"149","12.828197","192.168.0.183","104.244.42.65","TCP","1414","50717  >  443 [ACK] Seq=134489 Ack=1592 Win=1040 Len=1360 [TCP segment of a reassembled PDU]"
"150","12.828197","192.168.0.183","104.244.42.65","TLSv1.2","496","Application Data"
"151","12.833050","104.244.42.65","192.168.0.183","TLSv1.2","334","Application Data"
"152","12.833697","192.168.0.183","104.244.42.65","TLSv1.2","89","Application Data"
"153","12.875385","104.244.42.65","192.168.0.183","TCP","60","443  >  50717 [ACK] Seq=1872 Ack=133129 Win=7273 Len=0"
"154","12.875385","104.244.42.65","192.168.0.183","TCP","60","443  >  50717 [ACK] Seq=1872 Ack=136291 Win=7298 Len=0"
"155","12.894142","104.244.42.65","192.168.0.183","TLSv1.2","138","Application Data"
"156","12.942874","192.168.0.183","104.244.42.65","TCP","54","50717  >  443 [ACK] Seq=136326 Ack=1956 Win=1039 Len=0"
"157","12.992127","192.168.0.183","104.244.42.65","TLSv1.2","708","Application Data"
"158","12.992271","192.168.0.183","104.244.42.65","TLSv1.2","1058","Application Data"
"159","13.030154","104.244.42.65","192.168.0.183","TCP","60","443  >  50717 [ACK] Seq=1956 Ack=137984 Win=7319 Len=0"
"160","13.057514","104.244.42.65","192.168.0.183","TLSv1.2","157","Application Data"
"161","13.098798","192.168.0.183","104.244.42.65","TCP","54","50717  >  443 [ACK] Seq=137984 Ack=2059 Win=1038 Len=0"
"162","15.974224","192.168.0.183","104.244.42.65","TLSv1.2","671","Application Data"
"163","15.974358","192.168.0.183","104.244.42.65","TCP","1414","50717  >  443 [ACK] Seq=138601 Ack=2059 Win=1038 Len=1360 [TCP segment of a reassembled PDU]"
"164","15.974358","192.168.0.183","104.244.42.65","TCP","1414","50717  >  443 [ACK] Seq=139961 Ack=2059 Win=1038 Len=1360 [TCP segment of a reassembled PDU]"
"165","15.974358","192.168.0.183","104.244.42.65","TCP","1414","50717  >  443 [ACK] Seq=141321 Ack=2059 Win=1038 Len=1360 [TCP segment of a reassembled PDU]"
"166","15.974358","192.168.0.183","104.244.42.65","TCP","1414","50717  >  443 [ACK] Seq=142681 Ack=2059 Win=1038 Len=1360 [TCP segment of a reassembled PDU]"
"167","15.974358","192.168.0.183","104.244.42.65","TCP","1414","50717  >  443 [ACK] Seq=144041 Ack=2059 Win=1038 Len=1360 [TCP segment of a reassembled PDU]"
"168","15.974358","192.168.0.183","104.244.42.65","TCP","1414","50717  >  443 [ACK] Seq=145401 Ack=2059 Win=1038 Len=1360 [TCP segment of a reassembled PDU]"
"169","15.974358","192.168.0.183","104.244.42.65","TCP","1414","50717  >  443 [ACK] Seq=146761 Ack=2059 Win=1038 Len=1360 [TCP segment of a reassembled PDU]"
"170","15.974358","192.168.0.183","104.244.42.65","TCP","1414","50717  >  443 [ACK] Seq=148121 Ack=2059 Win=1038 Len=1360 [TCP segment of a reassembled PDU]"
"171","15.974358","192.168.0.183","104.244.42.65","TCP","1414","50717  >  443 [ACK] Seq=149481 Ack=2059 Win=1038 Len=1360 [TCP segment of a reassembled PDU]"
"172","15.974358","192.168.0.183","104.244.42.65","TCP","1414","50717  >  443 [ACK] Seq=150841 Ack=2059 Win=1038 Len=1360 [TCP segment of a reassembled PDU]"
"173","15.974358","192.168.0.183","104.244.42.65","TCP","1414","50717  >  443 [ACK] Seq=152201 Ack=2059 Win=1038 Len=1360 [TCP segment of a reassembled PDU]"
"174","15.974358","192.168.0.183","104.244.42.65","TCP","1414","50717  >  443 [ACK] Seq=153561 Ack=2059 Win=1038 Len=1360 [TCP segment of a reassembled PDU]"
"175","15.974358","192.168.0.183","104.244.42.65","TLSv1.2","140","Application Data"
"176","15.974531","192.168.0.183","104.244.42.65","TCP","1414","50717  >  443 [ACK] Seq=155007 Ack=2059 Win=1038 Len=1360 [TCP segment of a reassembled PDU]"
"177","15.974531","192.168.0.183","104.244.42.65","TCP","1414","50717  >  443 [ACK] Seq=156367 Ack=2059 Win=1038 Len=1360 [TCP segment of a reassembled PDU]"
"178","15.974531","192.168.0.183","104.244.42.65","TCP","1414","50717  >  443 [ACK] Seq=157727 Ack=2059 Win=1038 Len=1360 [TCP segment of a reassembled PDU]"
"179","15.974531","192.168.0.183","104.244.42.65","TCP","1414","50717  >  443 [ACK] Seq=159087 Ack=2059 Win=1038 Len=1360 [TCP segment of a reassembled PDU]"
"180","15.974531","192.168.0.183","104.244.42.65","TCP","1414","50717  >  443 [ACK] Seq=160447 Ack=2059 Win=1038 Len=1360 [TCP segment of a reassembled PDU]"
"181","15.974531","192.168.0.183","104.244.42.65","TCP","1414","50717  >  443 [ACK] Seq=161807 Ack=2059 Win=1038 Len=1360 [TCP segment of a reassembled PDU]"
"182","15.974531","192.168.0.183","104.244.42.65","TLSv1.2","1267","Application Data"
"183","16.016562","104.244.42.65","192.168.0.183","TCP","60","443  >  50717 [ACK] Seq=2059 Ack=164380 Win=7531 Len=0"
"184","16.050457","104.244.42.65","192.168.0.183","TLSv1.2","184","Application Data"
"185","16.105593","192.168.0.183","104.244.42.65","TCP","54","50717  >  443 [ACK] Seq=164380 Ack=2189 Win=1038 Len=0"
"186","18.972519","192.168.0.183","104.244.42.65","TLSv1.2","238","Application Data"
"187","18.972666","192.168.0.183","104.244.42.65","TCP","1414","50717  >  443 [ACK] Seq=164564 Ack=2189 Win=1038 Len=1360 [TCP segment of a reassembled PDU]"
"188","18.972666","192.168.0.183","104.244.42.65","TCP","1414","50717  >  443 [ACK] Seq=165924 Ack=2189 Win=1038 Len=1360 [TCP segment of a reassembled PDU]"
"189","18.972666","192.168.0.183","104.244.42.65","TCP","1414","50717  >  443 [ACK] Seq=167284 Ack=2189 Win=1038 Len=1360 [TCP segment of a reassembled PDU]"
"190","18.972666","192.168.0.183","104.244.42.65","TCP","1414","50717  >  443 [ACK] Seq=168644 Ack=2189 Win=1038 Len=1360 [TCP segment of a reassembled PDU]"
"191","18.972666","192.168.0.183","104.244.42.65","TCP","1414","50717  >  443 [ACK] Seq=170004 Ack=2189 Win=1038 Len=1360 [TCP segment of a reassembled PDU]"
"192","18.972666","192.168.0.183","104.244.42.65","TCP","1414","50717  >  443 [ACK] Seq=171364 Ack=2189 Win=1038 Len=1360 [TCP segment of a reassembled PDU]"
"193","18.972666","192.168.0.183","104.244.42.65","TCP","1414","50717  >  443 [ACK] Seq=172724 Ack=2189 Win=1038 Len=1360 [TCP segment of a reassembled PDU]"
"194","18.972666","192.168.0.183","104.244.42.65","TCP","1414","50717  >  443 [ACK] Seq=174084 Ack=2189 Win=1038 Len=1360 [TCP segment of a reassembled PDU]"
"195","18.972666","192.168.0.183","104.244.42.65","TCP","1414","50717  >  443 [ACK] Seq=175444 Ack=2189 Win=1038 Len=1360 [TCP segment of a reassembled PDU]"
"196","18.972666","192.168.0.183","104.244.42.65","TCP","1414","50717  >  443 [ACK] Seq=176804 Ack=2189 Win=1038 Len=1360 [TCP segment of a reassembled PDU]"
"197","18.972666","192.168.0.183","104.244.42.65","TCP","1414","50717  >  443 [ACK] Seq=178164 Ack=2189 Win=1038 Len=1360 [TCP segment of a reassembled PDU]"
"198","18.972666","192.168.0.183","104.244.42.65","TCP","1414","50717  >  443 [ACK] Seq=179524 Ack=2189 Win=1038 Len=1360 [TCP segment of a reassembled PDU]"
"199","18.972666","192.168.0.183","104.244.42.65","TLSv1.2","140","Application Data"
"200","18.972793","192.168.0.183","104.244.42.65","TCP","1414","50717  >  443 [ACK] Seq=180970 Ack=2189 Win=1038 Len=1360 [TCP segment of a reassembled PDU]"
"201","18.972793","192.168.0.183","104.244.42.65","TCP","1414","50717  >  443 [ACK] Seq=182330 Ack=2189 Win=1038 Len=1360 [TCP segment of a reassembled PDU]"
"202","18.972793","192.168.0.183","104.244.42.65","TCP","1414","50717  >  443 [ACK] Seq=183690 Ack=2189 Win=1038 Len=1360 [TCP segment of a reassembled PDU]"
"203","18.972793","192.168.0.183","104.244.42.65","TCP","1414","50717  >  443 [ACK] Seq=185050 Ack=2189 Win=1038 Len=1360 [TCP segment of a reassembled PDU]"
"204","18.972793","192.168.0.183","104.244.42.65","TCP","1414","50717  >  443 [ACK] Seq=186410 Ack=2189 Win=1038 Len=1360 [TCP segment of a reassembled PDU]"
"205","18.972793","192.168.0.183","104.244.42.65","TCP","1414","50717  >  443 [ACK] Seq=187770 Ack=2189 Win=1038 Len=1360 [TCP segment of a reassembled PDU]"
"206","18.972793","192.168.0.183","104.244.42.65","TCP","1414","50717  >  443 [ACK] Seq=189130 Ack=2189 Win=1038 Len=1360 [TCP segment of a reassembled PDU]"
"207","18.972793","192.168.0.183","104.244.42.65","TLSv1.2","754","Application Data"
"208","19.010062","104.244.42.65","192.168.0.183","TCP","60","443  >  50717 [ACK] Seq=2189 Ack=165924 Win=7542 Len=0"
"209","19.017790","104.244.42.65","192.168.0.183","TCP","60","443  >  50717 [ACK] Seq=2189 Ack=191190 Win=7739 Len=0"
"210","19.054125","104.244.42.65","192.168.0.183","TLSv1.2","228","Application Data"
"211","19.106419","192.168.0.183","104.244.42.65","TCP","54","50717  >  443 [ACK] Seq=191190 Ack=2363 Win=1037 Len=0"
"212","21.971717","192.168.0.183","104.244.42.65","TLSv1.2","280","Application Data"
"213","21.971831","192.168.0.183","104.244.42.65","TCP","1414","50717  >  443 [ACK] Seq=191416 Ack=2363 Win=1037 Len=1360 [TCP segment of a reassembled PDU]"
"214","21.971831","192.168.0.183","104.244.42.65","TCP","1414","50717  >  443 [ACK] Seq=192776 Ack=2363 Win=1037 Len=1360 [TCP segment of a reassembled PDU]"
"215","21.971831","192.168.0.183","104.244.42.65","TCP","1414","50717  >  443 [ACK] Seq=194136 Ack=2363 Win=1037 Len=1360 [TCP segment of a reassembled PDU]"
"216","21.971831","192.168.0.183","104.244.42.65","TCP","1414","50717  >  443 [ACK] Seq=195496 Ack=2363 Win=1037 Len=1360 [TCP segment of a reassembled PDU]"
"217","21.971831","192.168.0.183","104.244.42.65","TCP","1414","50717  >  443 [ACK] Seq=196856 Ack=2363 Win=1037 Len=1360 [TCP segment of a reassembled PDU]"
"218","21.971831","192.168.0.183","104.244.42.65","TCP","1414","50717  >  443 [ACK] Seq=198216 Ack=2363 Win=1037 Len=1360 [TCP segment of a reassembled PDU]"
"219","21.971831","192.168.0.183","104.244.42.65","TLSv1.2","169","Application Data"
"220","22.009463","104.244.42.65","192.168.0.183","TCP","60","443  >  50717 [ACK] Seq=2363 Ack=195496 Win=7771 Len=0"
"221","22.016248","104.244.42.65","192.168.0.183","TCP","60","443  >  50717 [ACK] Seq=2363 Ack=199691 Win=7804 Len=0"
"222","22.043858","104.244.42.65","192.168.0.183","TLSv1.2","244","Application Data"
"223","22.087661","192.168.0.183","104.244.42.65","TCP","54","50717  >  443 [ACK] Seq=199691 Ack=2553 Win=1036 Len=0"
"224","25.440864","192.168.0.183","104.244.42.65","TLSv1.2","245","Application Data"
"225","25.441060","192.168.0.183","104.244.42.65","TCP","1414","50717  >  443 [ACK] Seq=199882 Ack=2553 Win=1036 Len=1360 [TCP segment of a reassembled PDU]"
"226","25.441060","192.168.0.183","104.244.42.65","TCP","1414","50717  >  443 [ACK] Seq=201242 Ack=2553 Win=1036 Len=1360 [TCP segment of a reassembled PDU]"
"227","25.441060","192.168.0.183","104.244.42.65","TCP","1414","50717  >  443 [ACK] Seq=202602 Ack=2553 Win=1036 Len=1360 [TCP segment of a reassembled PDU]"
"228","25.441060","192.168.0.183","104.244.42.65","TCP","1414","50717  >  443 [ACK] Seq=203962 Ack=2553 Win=1036 Len=1360 [TCP segment of a reassembled PDU]"
"229","25.441060","192.168.0.183","104.244.42.65","TCP","1414","50717  >  443 [ACK] Seq=205322 Ack=2553 Win=1036 Len=1360 [TCP segment of a reassembled PDU]"
"230","25.441060","192.168.0.183","104.244.42.65","TCP","1414","50717  >  443 [ACK] Seq=206682 Ack=2553 Win=1036 Len=1360 [TCP segment of a reassembled PDU]"
"231","25.441060","192.168.0.183","104.244.42.65","TCP","1414","50717  >  443 [ACK] Seq=208042 Ack=2553 Win=1036 Len=1360 [TCP segment of a reassembled PDU]"
"232","25.441060","192.168.0.183","104.244.42.65","TCP","1414","50717  >  443 [ACK] Seq=209402 Ack=2553 Win=1036 Len=1360 [TCP segment of a reassembled PDU]"
"233","25.441060","192.168.0.183","104.244.42.65","TCP","1414","50717  >  443 [ACK] Seq=210762 Ack=2553 Win=1036 Len=1360 [TCP segment of a reassembled PDU]"
"234","25.441060","192.168.0.183","104.244.42.65","TCP","1414","50717  >  443 [ACK] Seq=212122 Ack=2553 Win=1036 Len=1360 [TCP segment of a reassembled PDU]"
"235","25.441060","192.168.0.183","104.244.42.65","TCP","1414","50717  >  443 [ACK] Seq=213482 Ack=2553 Win=1036 Len=1360 [TCP segment of a reassembled PDU]"
"236","25.441060","192.168.0.183","104.244.42.65","TCP","1414","50717  >  443 [ACK] Seq=214842 Ack=2553 Win=1036 Len=1360 [TCP segment of a reassembled PDU]"
"237","25.441060","192.168.0.183","104.244.42.65","TLSv1.2","140","Application Data"
"238","25.441225","192.168.0.183","104.244.42.65","TCP","1414","50717  >  443 [ACK] Seq=216288 Ack=2553 Win=1036 Len=1360 [TCP segment of a reassembled PDU]"
"239","25.441225","192.168.0.183","104.244.42.65","TCP","1414","50717  >  443 [ACK] Seq=217648 Ack=2553 Win=1036 Len=1360 [TCP segment of a reassembled PDU]"
"240","25.441225","192.168.0.183","104.244.42.65","TCP","1414","50717  >  443 [ACK] Seq=219008 Ack=2553 Win=1036 Len=1360 [TCP segment of a reassembled PDU]"
"241","25.441225","192.168.0.183","104.244.42.65","TCP","1414","50717  >  443 [ACK] Seq=220368 Ack=2553 Win=1036 Len=1360 [TCP segment of a reassembled PDU]"
"242","25.441225","192.168.0.183","104.244.42.65","TCP","1414","50717  >  443 [ACK] Seq=221728 Ack=2553 Win=1036 Len=1360 [TCP segment of a reassembled PDU]"
"243","25.441225","192.168.0.183","104.244.42.65","TLSv1.2","1367","Application Data"
"244","25.477249","104.244.42.65","192.168.0.183","TCP","60","443  >  50717 [ACK] Seq=2553 Ack=201242 Win=7814 Len=0"
"245","25.483499","104.244.42.65","192.168.0.183","TCP","60","443  >  50717 [ACK] Seq=2553 Ack=216288 Win=7910 Len=0"
"246","25.483499","104.244.42.65","192.168.0.183","TCP","60","443  >  50717 [ACK] Seq=2553 Ack=224401 Win=7910 Len=0"
"247","25.483499","104.244.42.65","192.168.0.183","TLSv1.2","89","Application Data"
"248","25.514928","104.244.42.65","192.168.0.183","TLSv1.2","182","Application Data"
"249","25.514964","192.168.0.183","104.244.42.65","TCP","54","50717  >  443 [ACK] Seq=224401 Ack=2716 Win=1036 Len=0"
"250","26.352224","192.168.0.183","104.244.42.65","TCP","1414","50717  >  443 [ACK] Seq=224401 Ack=2716 Win=1036 Len=1360 [TCP segment of a reassembled PDU]"
"251","26.352224","192.168.0.183","104.244.42.65","TLSv1.2","416","Application Data"
"252","26.352386","192.168.0.183","104.244.42.65","TLSv1.2","285","Application Data"
"253","26.390247","104.244.42.65","192.168.0.183","TCP","60","443  >  50717 [ACK] Seq=2716 Ack=226123 Win=7927 Len=0"
"254","26.431696","104.244.42.65","192.168.0.183","TCP","60","443  >  50717 [ACK] Seq=2716 Ack=226354 Win=7927 Len=0"
"255","26.714710","104.244.42.65","192.168.0.183","TLSv1.2","175","Application Data"
"256","26.763565","192.168.0.183","104.244.42.65","TCP","54","50717  >  443 [ACK] Seq=226354 Ack=2837 Win=1041 Len=0"
"257","27.449786","104.244.42.65","192.168.0.183","TCP","1414","443  >  50717 [ACK] Seq=2837 Ack=226354 Win=7927 Len=1360 [TCP segment of a reassembled PDU]"
"258","27.449786","104.244.42.65","192.168.0.183","TCP","1414","443  >  50717 [PSH, ACK] Seq=4197 Ack=226354 Win=7927 Len=1360 [TCP segment of a reassembled PDU]"
"259","27.449786","104.244.42.65","192.168.0.183","TCP","1414","443  >  50717 [ACK] Seq=5557 Ack=226354 Win=7927 Len=1360 [TCP segment of a reassembled PDU]"
"260","27.449786","104.244.42.65","192.168.0.183","TCP","1414","443  >  50717 [PSH, ACK] Seq=6917 Ack=226354 Win=7927 Len=1360 [TCP segment of a reassembled PDU]"
"261","27.449786","104.244.42.65","192.168.0.183","TCP","1414","443  >  50717 [ACK] Seq=8277 Ack=226354 Win=7927 Len=1360 [TCP segment of a reassembled PDU]"
"262","27.449786","104.244.42.65","192.168.0.183","TCP","1414","443  >  50717 [PSH, ACK] Seq=9637 Ack=226354 Win=7927 Len=1360 [TCP segment of a reassembled PDU]"
"263","27.449786","104.244.42.65","192.168.0.183","TLSv1.2","865","Application Data"
"264","27.449841","192.168.0.183","104.244.42.65","TCP","54","50717  >  443 [ACK] Seq=226354 Ack=11808 Win=1041 Len=0"
"265","27.450490","192.168.0.183","104.244.42.65","TLSv1.2","89","Application Data"
"266","27.500167","104.244.42.65","192.168.0.183","TCP","60","443  >  50717 [ACK] Seq=11808 Ack=226389 Win=7927 Len=0"
"267","27.500167","104.244.42.65","192.168.0.183","TCP","60","[TCP Dup ACK 266#1] 443  >  50717 [ACK] Seq=11808 Ack=226389 Win=7927 Len=0"
"268","27.789654","192.168.0.183","104.244.42.65","TCP","1414","50717  >  443 [ACK] Seq=226389 Ack=11808 Win=1041 Len=1360 [TCP segment of a reassembled PDU]"
"269","27.789654","192.168.0.183","104.244.42.65","TLSv1.2","611","Application Data"
"270","27.836758","104.244.42.65","192.168.0.183","TCP","60","443  >  50717 [ACK] Seq=11808 Ack=228306 Win=7926 Len=0"
"271","28.452521","192.168.0.183","104.244.42.65","TLSv1.2","712","Application Data"
"272","28.452670","192.168.0.183","104.244.42.65","TCP","1414","50717  >  443 [ACK] Seq=228964 Ack=11808 Win=1041 Len=1360 [TCP segment of a reassembled PDU]"
"273","28.452670","192.168.0.183","104.244.42.65","TCP","1414","50717  >  443 [ACK] Seq=230324 Ack=11808 Win=1041 Len=1360 [TCP segment of a reassembled PDU]"
"274","28.452670","192.168.0.183","104.244.42.65","TCP","1414","50717  >  443 [ACK] Seq=231684 Ack=11808 Win=1041 Len=1360 [TCP segment of a reassembled PDU]"
"275","28.452670","192.168.0.183","104.244.42.65","TCP","1414","50717  >  443 [ACK] Seq=233044 Ack=11808 Win=1041 Len=1360 [TCP segment of a reassembled PDU]"
"276","28.452670","192.168.0.183","104.244.42.65","TCP","1414","50717  >  443 [ACK] Seq=234404 Ack=11808 Win=1041 Len=1360 [TCP segment of a reassembled PDU]"
"277","28.452670","192.168.0.183","104.244.42.65","TCP","1414","50717  >  443 [ACK] Seq=235764 Ack=11808 Win=1041 Len=1360 [TCP segment of a reassembled PDU]"
"278","28.452670","192.168.0.183","104.244.42.65","TCP","1414","50717  >  443 [ACK] Seq=237124 Ack=11808 Win=1041 Len=1360 [TCP segment of a reassembled PDU]"
"279","28.452670","192.168.0.183","104.244.42.65","TCP","1414","50717  >  443 [ACK] Seq=238484 Ack=11808 Win=1041 Len=1360 [TCP segment of a reassembled PDU]"
"280","28.452670","192.168.0.183","104.244.42.65","TCP","1414","50717  >  443 [ACK] Seq=239844 Ack=11808 Win=1041 Len=1360 [TCP segment of a reassembled PDU]"
"281","28.452670","192.168.0.183","104.244.42.65","TCP","1414","50717  >  443 [ACK] Seq=241204 Ack=11808 Win=1041 Len=1360 [TCP segment of a reassembled PDU]"
"282","28.452670","192.168.0.183","104.244.42.65","TCP","1414","50717  >  443 [ACK] Seq=242564 Ack=11808 Win=1041 Len=1360 [TCP segment of a reassembled PDU]"
"283","28.452670","192.168.0.183","104.244.42.65","TCP","1414","50717  >  443 [ACK] Seq=243924 Ack=11808 Win=1041 Len=1360 [TCP segment of a reassembled PDU]"
"284","28.452670","192.168.0.183","104.244.42.65","TLSv1.2","140","Application Data"
"285","28.452871","192.168.0.183","104.244.42.65","TCP","1414","50717  >  443 [ACK] Seq=245370 Ack=11808 Win=1041 Len=1360 [TCP segment of a reassembled PDU]"
"286","28.452871","192.168.0.183","104.244.42.65","TCP","1414","50717  >  443 [ACK] Seq=246730 Ack=11808 Win=1041 Len=1360 [TCP segment of a reassembled PDU]"
"287","28.452871","192.168.0.183","104.244.42.65","TCP","1414","50717  >  443 [ACK] Seq=248090 Ack=11808 Win=1041 Len=1360 [TCP segment of a reassembled PDU]"
"288","28.452871","192.168.0.183","104.244.42.65","TCP","1414","50717  >  443 [ACK] Seq=249450 Ack=11808 Win=1041 Len=1360 [TCP segment of a reassembled PDU]"
"289","28.452871","192.168.0.183","104.244.42.65","TCP","1414","50717  >  443 [ACK] Seq=250810 Ack=11808 Win=1041 Len=1360 [TCP segment of a reassembled PDU]"
"290","28.452871","192.168.0.183","104.244.42.65","TCP","1414","50717  >  443 [ACK] Seq=252170 Ack=11808 Win=1041 Len=1360 [TCP segment of a reassembled PDU]"
"291","28.452871","192.168.0.183","104.244.42.65","TCP","1414","50717  >  443 [ACK] Seq=253530 Ack=11808 Win=1041 Len=1360 [TCP segment of a reassembled PDU]"
"292","28.452871","192.168.0.183","104.244.42.65","TCP","1414","50717  >  443 [ACK] Seq=254890 Ack=11808 Win=1041 Len=1360 [TCP segment of a reassembled PDU]"
"293","28.452871","192.168.0.183","104.244.42.65","TCP","1414","50717  >  443 [ACK] Seq=256250 Ack=11808 Win=1041 Len=1360 [TCP segment of a reassembled PDU]"
"294","28.452871","192.168.0.183","104.244.42.65","TCP","1414","50717  >  443 [ACK] Seq=257610 Ack=11808 Win=1041 Len=1360 [TCP segment of a reassembled PDU]"
"295","28.452871","192.168.0.183","104.244.42.65","TCP","1414","50717  >  443 [ACK] Seq=258970 Ack=11808 Win=1041 Len=1360 [TCP segment of a reassembled PDU]"
"296","28.452871","192.168.0.183","104.244.42.65","TCP","1414","50717  >  443 [ACK] Seq=260330 Ack=11808 Win=1041 Len=1360 [TCP segment of a reassembled PDU]"
"297","28.452871","192.168.0.183","104.244.42.65","TLSv1.2","140","Application Data"
"298","28.453028","192.168.0.183","104.244.42.65","TCP","1414","50717  >  443 [ACK] Seq=261776 Ack=11808 Win=1041 Len=1360 [TCP segment of a reassembled PDU]"
"299","28.453028","192.168.0.183","104.244.42.65","TCP","1414","50717  >  443 [ACK] Seq=263136 Ack=11808 Win=1041 Len=1360 [TCP segment of a reassembled PDU]"
"300","28.453028","192.168.0.183","104.244.42.65","TCP","1414","50717  >  443 [ACK] Seq=264496 Ack=11808 Win=1041 Len=1360 [TCP segment of a reassembled PDU]"
"301","28.453028","192.168.0.183","104.244.42.65","TCP","1414","50717  >  443 [ACK] Seq=265856 Ack=11808 Win=1041 Len=1360 [TCP segment of a reassembled PDU]"
"302","28.453028","192.168.0.183","104.244.42.65","TCP","1414","50717  >  443 [ACK] Seq=267216 Ack=11808 Win=1041 Len=1360 [TCP segment of a reassembled PDU]"
"303","28.453028","192.168.0.183","104.244.42.65","TCP","1414","50717  >  443 [ACK] Seq=268576 Ack=11808 Win=1041 Len=1360 [TCP segment of a reassembled PDU]"
"304","28.453028","192.168.0.183","104.244.42.65","TCP","1414","50717  >  443 [ACK] Seq=269936 Ack=11808 Win=1041 Len=1360 [TCP segment of a reassembled PDU]"
"305","28.453028","192.168.0.183","104.244.42.65","TCP","1414","50717  >  443 [ACK] Seq=271296 Ack=11808 Win=1041 Len=1360 [TCP segment of a reassembled PDU]"
"306","28.453028","192.168.0.183","104.244.42.65","TCP","1414","50717  >  443 [ACK] Seq=272656 Ack=11808 Win=1041 Len=1360 [TCP segment of a reassembled PDU]"
"307","28.453028","192.168.0.183","104.244.42.65","TCP","1414","50717  >  443 [ACK] Seq=274016 Ack=11808 Win=1041 Len=1360 [TCP segment of a reassembled PDU]"
"308","28.453028","192.168.0.183","104.244.42.65","TCP","1414","50717  >  443 [ACK] Seq=275376 Ack=11808 Win=1041 Len=1360 [TCP segment of a reassembled PDU]"
"309","28.453028","192.168.0.183","104.244.42.65","TCP","1414","50717  >  443 [ACK] Seq=276736 Ack=11808 Win=1041 Len=1360 [TCP segment of a reassembled PDU]"
"310","28.453028","192.168.0.183","104.244.42.65","TLSv1.2","140","Application Data"
"311","28.453339","192.168.0.183","104.244.42.65","TCP","1414","50717  >  443 [ACK] Seq=278182 Ack=11808 Win=1041 Len=1360 [TCP segment of a reassembled PDU]"
"312","28.453339","192.168.0.183","104.244.42.65","TCP","1414","50717  >  443 [ACK] Seq=279542 Ack=11808 Win=1041 Len=1360 [TCP segment of a reassembled PDU]"
"313","28.453339","192.168.0.183","104.244.42.65","TCP","1414","50717  >  443 [ACK] Seq=280902 Ack=11808 Win=1041 Len=1360 [TCP segment of a reassembled PDU]"
"314","28.453339","192.168.0.183","104.244.42.65","TCP","1414","50717  >  443 [ACK] Seq=282262 Ack=11808 Win=1041 Len=1360 [TCP segment of a reassembled PDU]"
"315","28.453339","192.168.0.183","104.244.42.65","TCP","1414","50717  >  443 [ACK] Seq=283622 Ack=11808 Win=1041 Len=1360 [TCP segment of a reassembled PDU]"
"316","28.453339","192.168.0.183","104.244.42.65","TCP","1414","50717  >  443 [ACK] Seq=284982 Ack=11808 Win=1041 Len=1360 [TCP segment of a reassembled PDU]"
"317","28.453339","192.168.0.183","104.244.42.65","TCP","1414","50717  >  443 [ACK] Seq=286342 Ack=11808 Win=1041 Len=1360 [TCP segment of a reassembled PDU]"
"318","28.453339","192.168.0.183","104.244.42.65","TCP","1414","50717  >  443 [ACK] Seq=287702 Ack=11808 Win=1041 Len=1360 [TCP segment of a reassembled PDU]"
"319","28.453339","192.168.0.183","104.244.42.65","TCP","1414","50717  >  443 [ACK] Seq=289062 Ack=11808 Win=1041 Len=1360 [TCP segment of a reassembled PDU]"
"320","28.453339","192.168.0.183","104.244.42.65","TCP","1414","50717  >  443 [ACK] Seq=290422 Ack=11808 Win=1041 Len=1360 [TCP segment of a reassembled PDU]"
"321","28.453339","192.168.0.183","104.244.42.65","TCP","1414","50717  >  443 [ACK] Seq=291782 Ack=11808 Win=1041 Len=1360 [TCP segment of a reassembled PDU]"
"322","28.453339","192.168.0.183","104.244.42.65","TCP","1414","50717  >  443 [ACK] Seq=293142 Ack=11808 Win=1041 Len=1360 [TCP segment of a reassembled PDU]"
"323","28.453339","192.168.0.183","104.244.42.65","TLSv1.2","140","Application Data"
"324","28.453511","192.168.0.183","104.244.42.65","TLSv1.2","121","Application Data"
"325","28.494924","104.244.42.65","192.168.0.183","TCP","60","443  >  50717 [ACK] Seq=11808 Ack=228964 Win=7930 Len=0"
"326","28.494924","104.244.42.65","192.168.0.183","TCP","1414","443  >  50717 [ACK] Seq=11808 Ack=228964 Win=7930 Len=1360 [TCP segment of a reassembled PDU]"
"327","28.494924","104.244.42.65","192.168.0.183","TCP","1414","443  >  50717 [ACK] Seq=13168 Ack=228964 Win=7930 Len=1360 [TCP segment of a reassembled PDU]"
"328","28.494924","104.244.42.65","192.168.0.183","TCP","1414","443  >  50717 [PSH, ACK] Seq=14528 Ack=228964 Win=7930 Len=1360 [TCP segment of a reassembled PDU]"
"329","28.494924","104.244.42.65","192.168.0.183","TCP","1414","443  >  50717 [ACK] Seq=15888 Ack=228964 Win=7930 Len=1360 [TCP segment of a reassembled PDU]"
"330","28.494924","104.244.42.65","192.168.0.183","TCP","1414","443  >  50717 [ACK] Seq=17248 Ack=228964 Win=7930 Len=1360 [TCP segment of a reassembled PDU]"
"331","28.494924","104.244.42.65","192.168.0.183","TCP","1414","443  >  50717 [PSH, ACK] Seq=18608 Ack=228964 Win=7930 Len=1360 [TCP segment of a reassembled PDU]"
"332","28.494924","104.244.42.65","192.168.0.183","TLSv1.2","97","Application Data"
"333","28.494984","192.168.0.183","104.244.42.65","TCP","54","50717  >  443 [ACK] Seq=294655 Ack=20011 Win=1041 Len=0"
"334","28.495710","104.244.42.65","192.168.0.183","TCP","60","443  >  50717 [ACK] Seq=20011 Ack=272656 Win=7891 Len=0"
"335","28.497403","104.244.42.65","192.168.0.183","TCP","60","443  >  50717 [ACK] Seq=20011 Ack=294655 Win=7870 Len=0"
"336","28.497403","104.244.42.65","192.168.0.183","TLSv1.2","89","Application Data"
"337","28.497465","192.168.0.183","104.244.42.65","TCP","54","50717  >  443 [ACK] Seq=294655 Ack=20046 Win=1041 Len=0"
"338","28.497683","192.168.0.183","104.244.42.65","TCP","1414","50717  >  443 [ACK] Seq=294655 Ack=20046 Win=1041 Len=1360 [TCP segment of a reassembled PDU]"
"339","28.497683","192.168.0.183","104.244.42.65","TCP","1414","50717  >  443 [ACK] Seq=296015 Ack=20046 Win=1041 Len=1360 [TCP segment of a reassembled PDU]"
"340","28.497683","192.168.0.183","104.244.42.65","TCP","1414","50717  >  443 [ACK] Seq=297375 Ack=20046 Win=1041 Len=1360 [TCP segment of a reassembled PDU]"
"341","28.497683","192.168.0.183","104.244.42.65","TCP","1414","50717  >  443 [ACK] Seq=298735 Ack=20046 Win=1041 Len=1360 [TCP segment of a reassembled PDU]"
"342","28.497683","192.168.0.183","104.244.42.65","TCP","1414","50717  >  443 [ACK] Seq=300095 Ack=20046 Win=1041 Len=1360 [TCP segment of a reassembled PDU]"
"343","28.497683","192.168.0.183","104.244.42.65","TCP","1414","50717  >  443 [ACK] Seq=301455 Ack=20046 Win=1041 Len=1360 [TCP segment of a reassembled PDU]"
"344","28.497683","192.168.0.183","104.244.42.65","TCP","1414","50717  >  443 [ACK] Seq=302815 Ack=20046 Win=1041 Len=1360 [TCP segment of a reassembled PDU]"
"345","28.497683","192.168.0.183","104.244.42.65","TCP","1414","50717  >  443 [ACK] Seq=304175 Ack=20046 Win=1041 Len=1360 [TCP segment of a reassembled PDU]"
"346","28.497683","192.168.0.183","104.244.42.65","TCP","1414","50717  >  443 [ACK] Seq=305535 Ack=20046 Win=1041 Len=1360 [TCP segment of a reassembled PDU]"
"347","28.497683","192.168.0.183","104.244.42.65","TCP","1414","50717  >  443 [ACK] Seq=306895 Ack=20046 Win=1041 Len=1360 [TCP segment of a reassembled PDU]"
"348","28.497683","192.168.0.183","104.244.42.65","TLSv1.2","1200","Application Data"
"349","28.545847","104.244.42.65","192.168.0.183","TCP","60","443  >  50717 [ACK] Seq=20046 Ack=308255 Win=7896 Len=0"
"350","28.584669","104.244.42.65","192.168.0.183","TCP","60","443  >  50717 [ACK] Seq=20046 Ack=309401 Win=7930 Len=0"
"351","28.629306","104.244.42.65","192.168.0.183","TLSv1.2","150","Application Data"
"352","28.672591","192.168.0.183","104.244.42.65","TCP","54","50717  >  443 [ACK] Seq=309401 Ack=20142 Win=1040 Len=0"
"353","29.414005","192.168.0.183","104.244.42.65","TLSv1.2","675","Application Data"
"354","29.414098","192.168.0.183","104.244.42.65","TLSv1.2","1379","Application Data"
"355","29.459698","104.244.42.65","192.168.0.183","TCP","60","443  >  50717 [ACK] Seq=20142 Ack=311347 Win=7926 Len=0"
"356","29.482759","104.244.42.65","192.168.0.183","TLSv1.2","207","Application Data"
"357","29.527999","192.168.0.183","104.244.42.65","TCP","54","50717  >  443 [ACK] Seq=311347 Ack=20295 Win=1040 Len=0"
"358","29.985698","192.168.0.183","104.244.42.65","TLSv1.2","929","Application Data"
"359","29.985895","192.168.0.183","104.244.42.65","TLSv1.2","292","Application Data"
"360","30.023546","104.244.42.65","192.168.0.183","TCP","60","443  >  50717 [ACK] Seq=20295 Ack=312460 Win=7930 Len=0"
"361","30.049145","104.244.42.65","192.168.0.183","TLSv1.2","488","Application Data"
"362","30.049145","104.244.42.65","192.168.0.183","TLSv1.2","233","Application Data"
"363","30.049186","192.168.0.183","104.244.42.65","TCP","54","50717  >  443 [ACK] Seq=312460 Ack=20908 Win=1037 Len=0"
"364","31.445653","192.168.0.183","104.244.42.65","TLSv1.2","245","Application Data"
"365","31.445788","192.168.0.183","104.244.42.65","TCP","1414","50717  >  443 [ACK] Seq=312651 Ack=20908 Win=1037 Len=1360 [TCP segment of a reassembled PDU]"
"366","31.445788","192.168.0.183","104.244.42.65","TCP","1414","50717  >  443 [ACK] Seq=314011 Ack=20908 Win=1037 Len=1360 [TCP segment of a reassembled PDU]"
"367","31.445788","192.168.0.183","104.244.42.65","TCP","1414","50717  >  443 [ACK] Seq=315371 Ack=20908 Win=1037 Len=1360 [TCP segment of a reassembled PDU]"
"368","31.445788","192.168.0.183","104.244.42.65","TCP","1414","50717  >  443 [ACK] Seq=316731 Ack=20908 Win=1037 Len=1360 [TCP segment of a reassembled PDU]"
"369","31.445788","192.168.0.183","104.244.42.65","TCP","1414","50717  >  443 [ACK] Seq=318091 Ack=20908 Win=1037 Len=1360 [TCP segment of a reassembled PDU]"
"370","31.445788","192.168.0.183","104.244.42.65","TCP","1414","50717  >  443 [ACK] Seq=319451 Ack=20908 Win=1037 Len=1360 [TCP segment of a reassembled PDU]"
"371","31.445788","192.168.0.183","104.244.42.65","TCP","1414","50717  >  443 [ACK] Seq=320811 Ack=20908 Win=1037 Len=1360 [TCP segment of a reassembled PDU]"
"372","31.445788","192.168.0.183","104.244.42.65","TCP","1414","50717  >  443 [ACK] Seq=322171 Ack=20908 Win=1037 Len=1360 [TCP segment of a reassembled PDU]"
"373","31.445788","192.168.0.183","104.244.42.65","TCP","1414","50717  >  443 [ACK] Seq=323531 Ack=20908 Win=1037 Len=1360 [TCP segment of a reassembled PDU]"
"374","31.445788","192.168.0.183","104.244.42.65","TCP","1414","50717  >  443 [ACK] Seq=324891 Ack=20908 Win=1037 Len=1360 [TCP segment of a reassembled PDU]"
"375","31.445788","192.168.0.183","104.244.42.65","TCP","1414","50717  >  443 [ACK] Seq=326251 Ack=20908 Win=1037 Len=1360 [TCP segment of a reassembled PDU]"
"376","31.445788","192.168.0.183","104.244.42.65","TCP","1414","50717  >  443 [ACK] Seq=327611 Ack=20908 Win=1037 Len=1360 [TCP segment of a reassembled PDU]"
"377","31.445788","192.168.0.183","104.244.42.65","TLSv1.2","140","Application Data"
"378","31.445964","192.168.0.183","104.244.42.65","TCP","1414","50717  >  443 [ACK] Seq=329057 Ack=20908 Win=1037 Len=1360 [TCP segment of a reassembled PDU]"
"379","31.445964","192.168.0.183","104.244.42.65","TCP","1414","50717  >  443 [ACK] Seq=330417 Ack=20908 Win=1037 Len=1360 [TCP segment of a reassembled PDU]"
"380","31.445964","192.168.0.183","104.244.42.65","TCP","1414","50717  >  443 [ACK] Seq=331777 Ack=20908 Win=1037 Len=1360 [TCP segment of a reassembled PDU]"
"381","31.445964","192.168.0.183","104.244.42.65","TCP","1414","50717  >  443 [ACK] Seq=333137 Ack=20908 Win=1037 Len=1360 [TCP segment of a reassembled PDU]"
"382","31.445964","192.168.0.183","104.244.42.65","TCP","1414","50717  >  443 [ACK] Seq=334497 Ack=20908 Win=1037 Len=1360 [TCP segment of a reassembled PDU]"
"383","31.445964","192.168.0.183","104.244.42.65","TCP","1414","50717  >  443 [ACK] Seq=335857 Ack=20908 Win=1037 Len=1360 [TCP segment of a reassembled PDU]"
"384","31.445964","192.168.0.183","104.244.42.65","TCP","1414","50717  >  443 [ACK] Seq=337217 Ack=20908 Win=1037 Len=1360 [TCP segment of a reassembled PDU]"
"385","31.445964","192.168.0.183","104.244.42.65","TLSv1.2","88","Application Data"
"386","31.486212","104.244.42.65","192.168.0.183","TCP","60","443  >  50717 [ACK] Seq=20908 Ack=315371 Win=7923 Len=0"
"387","31.491772","104.244.42.65","192.168.0.183","TCP","60","443  >  50717 [ACK] Seq=20908 Ack=338611 Win=7893 Len=0"
"388","31.644556","104.244.42.65","192.168.0.183","TLSv1.2","184","Application Data"
"389","31.693831","192.168.0.183","104.244.42.65","TCP","54","50717  >  443 [ACK] Seq=338611 Ack=21038 Win=1037 Len=0"
"390","31.847828","192.168.0.183","104.244.42.65","TCP","1414","50717  >  443 [ACK] Seq=338611 Ack=21038 Win=1037 Len=1360 [TCP segment of a reassembled PDU]"
"391","31.847828","192.168.0.183","104.244.42.65","TLSv1.2","353","Application Data"
"392","31.943928","192.168.0.183","104.244.42.65","TCP","1414","[TCP Retransmission] 50717  >  443 [PSH, ACK] Seq=338910 Ack=21038 Win=1037 Len=1360 [TCP segment of a reassembled PDU]"
"393","32.092809","104.244.42.65","192.168.0.183","TCP","60","443  >  50717 [ACK] Seq=21038 Ack=340270 Win=7927 Len=0"
"394","32.092809","104.244.42.65","192.168.0.183","TCP","66","[TCP Window Update] 443  >  50717 [ACK] Seq=21038 Ack=340270 Win=7930 Len=0 SLE=338910 SRE=340270"
"395","32.679642","104.244.42.65","192.168.0.183","TCP","1414","443  >  50717 [ACK] Seq=21038 Ack=340270 Win=7930 Len=1360 [TCP segment of a reassembled PDU]"
"396","32.679642","104.244.42.65","192.168.0.183","TCP","1414","443  >  50717 [PSH, ACK] Seq=22398 Ack=340270 Win=7930 Len=1360 [TCP segment of a reassembled PDU]"
"397","32.679642","104.244.42.65","192.168.0.183","TCP","1414","443  >  50717 [ACK] Seq=23758 Ack=340270 Win=7930 Len=1360 [TCP segment of a reassembled PDU]"
"398","32.679642","104.244.42.65","192.168.0.183","TCP","1414","443  >  50717 [PSH, ACK] Seq=25118 Ack=340270 Win=7930 Len=1360 [TCP segment of a reassembled PDU]"
"399","32.679642","104.244.42.65","192.168.0.183","TCP","1414","443  >  50717 [ACK] Seq=26478 Ack=340270 Win=7930 Len=1360 [TCP segment of a reassembled PDU]"
"400","32.679642","104.244.42.65","192.168.0.183","TCP","1414","443  >  50717 [PSH, ACK] Seq=27838 Ack=340270 Win=7930 Len=1360 [TCP segment of a reassembled PDU]"
"401","32.679642","104.244.42.65","192.168.0.183","TLSv1.2","167","Application Data"
"402","32.679694","192.168.0.183","104.244.42.65","TCP","54","50717  >  443 [ACK] Seq=340270 Ack=29311 Win=1041 Len=0"
"403","32.680693","192.168.0.183","104.244.42.65","TLSv1.2","89","Application Data"
"404","32.724480","104.244.42.65","192.168.0.183","TCP","60","443  >  50717 [ACK] Seq=29311 Ack=340305 Win=7930 Len=0"
"405","33.100918","192.168.0.183","104.244.42.65","TCP","1414","50717  >  443 [ACK] Seq=340305 Ack=29311 Win=1041 Len=1360 [TCP segment of a reassembled PDU]"
"406","33.100918","192.168.0.183","104.244.42.65","TLSv1.2","464","Application Data"
"407","33.108393","192.168.0.183","104.244.42.65","TLSv1.2","326","Application Data"
"408","33.108569","192.168.0.183","104.244.42.65","TLSv1.2","944","Application Data"
"409","33.137387","104.244.42.65","192.168.0.183","TCP","60","443  >  50717 [ACK] Seq=29311 Ack=342075 Win=7926 Len=0"
"410","33.144695","104.244.42.65","192.168.0.183","TCP","60","443  >  50717 [ACK] Seq=29311 Ack=343237 Win=7929 Len=0"
"411","33.168923","104.244.42.65","192.168.0.183","TLSv1.2","196","Application Data"
"412","33.220217","192.168.0.183","104.244.42.65","TCP","54","50717  >  443 [ACK] Seq=343237 Ack=29453 Win=1040 Len=0"
"413","33.741904","104.244.42.65","192.168.0.183","TCP","1414","443  >  50717 [ACK] Seq=29453 Ack=343237 Win=7930 Len=1360 [TCP segment of a reassembled PDU]"
"414","33.741904","104.244.42.65","192.168.0.183","TCP","1414","443  >  50717 [PSH, ACK] Seq=30813 Ack=343237 Win=7930 Len=1360 [TCP segment of a reassembled PDU]"
"415","33.741904","104.244.42.65","192.168.0.183","TCP","1414","443  >  50717 [ACK] Seq=32173 Ack=343237 Win=7930 Len=1360 [TCP segment of a reassembled PDU]"
"416","33.741904","104.244.42.65","192.168.0.183","TCP","1414","443  >  50717 [PSH, ACK] Seq=33533 Ack=343237 Win=7930 Len=1360 [TCP segment of a reassembled PDU]"
"417","33.741904","104.244.42.65","192.168.0.183","TLSv1.2","182","Application Data"
"418","33.741949","192.168.0.183","104.244.42.65","TCP","54","50717  >  443 [ACK] Seq=343237 Ack=35021 Win=1041 Len=0"
"419","34.713871","192.168.0.183","104.244.42.65","TLSv1.2","712","Application Data"
"420","34.714004","192.168.0.183","104.244.42.65","TCP","1414","50717  >  443 [ACK] Seq=343895 Ack=35021 Win=1041 Len=1360 [TCP segment of a reassembled PDU]"
"421","34.714004","192.168.0.183","104.244.42.65","TCP","1414","50717  >  443 [ACK] Seq=345255 Ack=35021 Win=1041 Len=1360 [TCP segment of a reassembled PDU]"
"422","34.714004","192.168.0.183","104.244.42.65","TCP","1414","50717  >  443 [ACK] Seq=346615 Ack=35021 Win=1041 Len=1360 [TCP segment of a reassembled PDU]"
"423","34.714004","192.168.0.183","104.244.42.65","TCP","1414","50717  >  443 [ACK] Seq=347975 Ack=35021 Win=1041 Len=1360 [TCP segment of a reassembled PDU]"
"424","34.714004","192.168.0.183","104.244.42.65","TCP","1414","50717  >  443 [ACK] Seq=349335 Ack=35021 Win=1041 Len=1360 [TCP segment of a reassembled PDU]"
"425","34.714004","192.168.0.183","104.244.42.65","TCP","1414","50717  >  443 [ACK] Seq=350695 Ack=35021 Win=1041 Len=1360 [TCP segment of a reassembled PDU]"
"426","34.714004","192.168.0.183","104.244.42.65","TCP","1414","50717  >  443 [ACK] Seq=352055 Ack=35021 Win=1041 Len=1360 [TCP segment of a reassembled PDU]"
"427","34.714004","192.168.0.183","104.244.42.65","TCP","1414","50717  >  443 [ACK] Seq=353415 Ack=35021 Win=1041 Len=1360 [TCP segment of a reassembled PDU]"
"428","34.714004","192.168.0.183","104.244.42.65","TCP","1414","50717  >  443 [ACK] Seq=354775 Ack=35021 Win=1041 Len=1360 [TCP segment of a reassembled PDU]"
"429","34.714004","192.168.0.183","104.244.42.65","TCP","1414","50717  >  443 [ACK] Seq=356135 Ack=35021 Win=1041 Len=1360 [TCP segment of a reassembled PDU]"
"430","34.714004","192.168.0.183","104.244.42.65","TCP","1414","50717  >  443 [ACK] Seq=357495 Ack=35021 Win=1041 Len=1360 [TCP segment of a reassembled PDU]"
"431","34.714004","192.168.0.183","104.244.42.65","TCP","1414","50717  >  443 [ACK] Seq=358855 Ack=35021 Win=1041 Len=1360 [TCP segment of a reassembled PDU]"
"432","34.714004","192.168.0.183","104.244.42.65","TLSv1.2","140","Application Data"
"433","34.714134","192.168.0.183","104.244.42.65","TCP","1414","50717  >  443 [ACK] Seq=360301 Ack=35021 Win=1041 Len=1360 [TCP segment of a reassembled PDU]"
"434","34.714134","192.168.0.183","104.244.42.65","TCP","1414","50717  >  443 [ACK] Seq=361661 Ack=35021 Win=1041 Len=1360 [TCP segment of a reassembled PDU]"
"435","34.714134","192.168.0.183","104.244.42.65","TCP","1414","50717  >  443 [ACK] Seq=363021 Ack=35021 Win=1041 Len=1360 [TCP segment of a reassembled PDU]"
"436","34.714134","192.168.0.183","104.244.42.65","TCP","1414","50717  >  443 [ACK] Seq=364381 Ack=35021 Win=1041 Len=1360 [TCP segment of a reassembled PDU]"
"437","34.714134","192.168.0.183","104.244.42.65","TCP","1414","50717  >  443 [ACK] Seq=365741 Ack=35021 Win=1041 Len=1360 [TCP segment of a reassembled PDU]"
"438","34.714134","192.168.0.183","104.244.42.65","TCP","1414","50717  >  443 [ACK] Seq=367101 Ack=35021 Win=1041 Len=1360 [TCP segment of a reassembled PDU]"
"439","34.714134","192.168.0.183","104.244.42.65","TCP","1414","50717  >  443 [ACK] Seq=368461 Ack=35021 Win=1041 Len=1360 [TCP segment of a reassembled PDU]"
"440","34.714134","192.168.0.183","104.244.42.65","TCP","1414","50717  >  443 [ACK] Seq=369821 Ack=35021 Win=1041 Len=1360 [TCP segment of a reassembled PDU]"
"441","34.714134","192.168.0.183","104.244.42.65","TCP","1414","50717  >  443 [ACK] Seq=371181 Ack=35021 Win=1041 Len=1360 [TCP segment of a reassembled PDU]"
"442","34.714134","192.168.0.183","104.244.42.65","TCP","1414","50717  >  443 [ACK] Seq=372541 Ack=35021 Win=1041 Len=1360 [TCP segment of a reassembled PDU]"
"443","34.714134","192.168.0.183","104.244.42.65","TCP","1414","50717  >  443 [ACK] Seq=373901 Ack=35021 Win=1041 Len=1360 [TCP segment of a reassembled PDU]"
"444","34.714134","192.168.0.183","104.244.42.65","TCP","1414","50717  >  443 [ACK] Seq=375261 Ack=35021 Win=1041 Len=1360 [TCP segment of a reassembled PDU]"
"445","34.714134","192.168.0.183","104.244.42.65","TLSv1.2","140","Application Data"
"446","34.714354","192.168.0.183","104.244.42.65","TCP","1414","50717  >  443 [ACK] Seq=376707 Ack=35021 Win=1041 Len=1360 [TCP segment of a reassembled PDU]"
"447","34.714354","192.168.0.183","104.244.42.65","TCP","1414","50717  >  443 [ACK] Seq=378067 Ack=35021 Win=1041 Len=1360 [TCP segment of a reassembled PDU]"
"448","34.714354","192.168.0.183","104.244.42.65","TCP","1414","50717  >  443 [ACK] Seq=379427 Ack=35021 Win=1041 Len=1360 [TCP segment of a reassembled PDU]"
"449","34.714354","192.168.0.183","104.244.42.65","TCP","1414","50717  >  443 [ACK] Seq=380787 Ack=35021 Win=1041 Len=1360 [TCP segment of a reassembled PDU]"
"450","34.714354","192.168.0.183","104.244.42.65","TCP","1414","50717  >  443 [ACK] Seq=382147 Ack=35021 Win=1041 Len=1360 [TCP segment of a reassembled PDU]"
"451","34.714354","192.168.0.183","104.244.42.65","TCP","1414","50717  >  443 [ACK] Seq=383507 Ack=35021 Win=1041 Len=1360 [TCP segment of a reassembled PDU]"
"452","34.714354","192.168.0.183","104.244.42.65","TCP","1414","50717  >  443 [ACK] Seq=384867 Ack=35021 Win=1041 Len=1360 [TCP segment of a reassembled PDU]"
"453","34.714354","192.168.0.183","104.244.42.65","TCP","1414","50717  >  443 [ACK] Seq=386227 Ack=35021 Win=1041 Len=1360 [TCP segment of a reassembled PDU]"
"454","34.714354","192.168.0.183","104.244.42.65","TCP","1414","50717  >  443 [ACK] Seq=387587 Ack=35021 Win=1041 Len=1360 [TCP segment of a reassembled PDU]"
"455","34.714354","192.168.0.183","104.244.42.65","TCP","1414","50717  >  443 [ACK] Seq=388947 Ack=35021 Win=1041 Len=1360 [TCP segment of a reassembled PDU]"
"456","34.714354","192.168.0.183","104.244.42.65","TCP","1414","50717  >  443 [ACK] Seq=390307 Ack=35021 Win=1041 Len=1360 [TCP segment of a reassembled PDU]"
"457","34.714354","192.168.0.183","104.244.42.65","TCP","1414","50717  >  443 [ACK] Seq=391667 Ack=35021 Win=1041 Len=1360 [TCP segment of a reassembled PDU]"
"458","34.714354","192.168.0.183","104.244.42.65","TLSv1.2","140","Application Data"
"459","34.714545","192.168.0.183","104.244.42.65","TCP","1414","50717  >  443 [ACK] Seq=393113 Ack=35021 Win=1041 Len=1360 [TCP segment of a reassembled PDU]"
"460","34.714545","192.168.0.183","104.244.42.65","TCP","1414","50717  >  443 [ACK] Seq=394473 Ack=35021 Win=1041 Len=1360 [TCP segment of a reassembled PDU]"
"461","34.714545","192.168.0.183","104.244.42.65","TCP","1414","50717  >  443 [ACK] Seq=395833 Ack=35021 Win=1041 Len=1360 [TCP segment of a reassembled PDU]"
"462","34.714545","192.168.0.183","104.244.42.65","TCP","1414","50717  >  443 [ACK] Seq=397193 Ack=35021 Win=1041 Len=1360 [TCP segment of a reassembled PDU]"
"463","34.714545","192.168.0.183","104.244.42.65","TCP","1414","50717  >  443 [ACK] Seq=398553 Ack=35021 Win=1041 Len=1360 [TCP segment of a reassembled PDU]"
"464","34.714545","192.168.0.183","104.244.42.65","TLSv1.2","493","Application Data"
"465","34.753107","104.244.42.65","192.168.0.183","TCP","60","443  >  50717 [ACK] Seq=35021 Ack=345255 Win=7928 Len=0"
"466","34.758387","104.244.42.65","192.168.0.183","TCP","60","443  >  50717 [ACK] Seq=35021 Ack=397193 Win=7902 Len=0"
"467","34.758387","104.244.42.65","192.168.0.183","TLSv1.2","89","Application Data"
"468","34.758387","104.244.42.65","192.168.0.183","TCP","60","443  >  50717 [ACK] Seq=35056 Ack=400352 Win=7930 Len=0"
"469","34.808602","104.244.42.65","192.168.0.183","TLSv1.2","161","Application Data"
"470","34.808651","192.168.0.183","104.244.42.65","TCP","54","50717  >  443 [ACK] Seq=400352 Ack=35163 Win=1040 Len=0"
"471","35.969172","192.168.0.183","104.244.42.65","TCP","1414","50717  >  443 [ACK] Seq=400352 Ack=35163 Win=1040 Len=1360 [TCP segment of a reassembled PDU]"
"472","35.969172","192.168.0.183","104.244.42.65","TLSv1.2","667","Application Data"
"473","36.012131","104.244.42.65","192.168.0.183","TCP","60","443  >  50717 [ACK] Seq=35163 Ack=402325 Win=7926 Len=0"
"474","36.725809","104.244.42.65","192.168.0.183","TCP","1414","443  >  50717 [ACK] Seq=35163 Ack=402325 Win=7930 Len=1360 [TCP segment of a reassembled PDU]"
"475","36.725809","104.244.42.65","192.168.0.183","TCP","1414","443  >  50717 [PSH, ACK] Seq=36523 Ack=402325 Win=7930 Len=1360 [TCP segment of a reassembled PDU]"
"476","36.725809","104.244.42.65","192.168.0.183","TCP","1414","443  >  50717 [ACK] Seq=37883 Ack=402325 Win=7930 Len=1360 [TCP segment of a reassembled PDU]"
"477","36.725809","104.244.42.65","192.168.0.183","TCP","1414","443  >  50717 [PSH, ACK] Seq=39243 Ack=402325 Win=7930 Len=1360 [TCP segment of a reassembled PDU]"
"478","36.725809","104.244.42.65","192.168.0.183","TCP","1414","443  >  50717 [ACK] Seq=40603 Ack=402325 Win=7930 Len=1360 [TCP segment of a reassembled PDU]"
"479","36.725809","104.244.42.65","192.168.0.183","TLSv1.2","1213","Application Data"
"480","36.725904","192.168.0.183","104.244.42.65","TCP","54","50717  >  443 [ACK] Seq=402325 Ack=43122 Win=1041 Len=0"
"481","38.587735","192.168.0.183","104.244.42.65","TLSv1.2","738","Application Data"
"482","38.587889","192.168.0.183","104.244.42.65","TCP","1414","50717  >  443 [ACK] Seq=403009 Ack=43122 Win=1041 Len=1360 [TCP segment of a reassembled PDU]"
"483","38.587889","192.168.0.183","104.244.42.65","TCP","1414","50717  >  443 [ACK] Seq=404369 Ack=43122 Win=1041 Len=1360 [TCP segment of a reassembled PDU]"
"484","38.587889","192.168.0.183","104.244.42.65","TCP","1414","50717  >  443 [ACK] Seq=405729 Ack=43122 Win=1041 Len=1360 [TCP segment of a reassembled PDU]"
"485","38.587889","192.168.0.183","104.244.42.65","TCP","1414","50717  >  443 [ACK] Seq=407089 Ack=43122 Win=1041 Len=1360 [TCP segment of a reassembled PDU]"
"486","38.587889","192.168.0.183","104.244.42.65","TCP","1414","50717  >  443 [ACK] Seq=408449 Ack=43122 Win=1041 Len=1360 [TCP segment of a reassembled PDU]"
"487","38.587889","192.168.0.183","104.244.42.65","TCP","1414","50717  >  443 [ACK] Seq=409809 Ack=43122 Win=1041 Len=1360 [TCP segment of a reassembled PDU]"
"488","38.587889","192.168.0.183","104.244.42.65","TCP","1414","50717  >  443 [ACK] Seq=411169 Ack=43122 Win=1041 Len=1360 [TCP segment of a reassembled PDU]"
"489","38.587889","192.168.0.183","104.244.42.65","TCP","1414","50717  >  443 [ACK] Seq=412529 Ack=43122 Win=1041 Len=1360 [TCP segment of a reassembled PDU]"
"490","38.587889","192.168.0.183","104.244.42.65","TCP","1414","50717  >  443 [ACK] Seq=413889 Ack=43122 Win=1041 Len=1360 [TCP segment of a reassembled PDU]"
"491","38.587889","192.168.0.183","104.244.42.65","TCP","1414","50717  >  443 [ACK] Seq=415249 Ack=43122 Win=1041 Len=1360 [TCP segment of a reassembled PDU]"
"492","38.587889","192.168.0.183","104.244.42.65","TCP","1414","50717  >  443 [ACK] Seq=416609 Ack=43122 Win=1041 Len=1360 [TCP segment of a reassembled PDU]"
"493","38.587889","192.168.0.183","104.244.42.65","TCP","1414","50717  >  443 [ACK] Seq=417969 Ack=43122 Win=1041 Len=1360 [TCP segment of a reassembled PDU]"
"494","38.587889","192.168.0.183","104.244.42.65","TLSv1.2","140","Application Data"
"495","38.588047","192.168.0.183","104.244.42.65","TCP","1414","50717  >  443 [ACK] Seq=419415 Ack=43122 Win=1041 Len=1360 [TCP segment of a reassembled PDU]"
"496","38.588047","192.168.0.183","104.244.42.65","TCP","1414","50717  >  443 [ACK] Seq=420775 Ack=43122 Win=1041 Len=1360 [TCP segment of a reassembled PDU]"
"497","38.588047","192.168.0.183","104.244.42.65","TCP","1414","50717  >  443 [ACK] Seq=422135 Ack=43122 Win=1041 Len=1360 [TCP segment of a reassembled PDU]"
"498","38.588047","192.168.0.183","104.244.42.65","TCP","1414","50717  >  443 [ACK] Seq=423495 Ack=43122 Win=1041 Len=1360 [TCP segment of a reassembled PDU]"
"499","38.588047","192.168.0.183","104.244.42.65","TCP","1414","50717  >  443 [ACK] Seq=424855 Ack=43122 Win=1041 Len=1360 [TCP segment of a reassembled PDU]"
"500","38.588047","192.168.0.183","104.244.42.65","TCP","1414","50717  >  443 [ACK] Seq=426215 Ack=43122 Win=1041 Len=1360 [TCP segment of a reassembled PDU]"
"501","38.588047","192.168.0.183","104.244.42.65","TCP","1414","50717  >  443 [ACK] Seq=427575 Ack=43122 Win=1041 Len=1360 [TCP segment of a reassembled PDU]"
"502","38.588047","192.168.0.183","104.244.42.65","TCP","1414","50717  >  443 [ACK] Seq=428935 Ack=43122 Win=1041 Len=1360 [TCP segment of a reassembled PDU]"
"503","38.588047","192.168.0.183","104.244.42.65","TCP","1414","50717  >  443 [ACK] Seq=430295 Ack=43122 Win=1041 Len=1360 [TCP segment of a reassembled PDU]"
"504","38.588047","192.168.0.183","104.244.42.65","TCP","1414","50717  >  443 [ACK] Seq=431655 Ack=43122 Win=1041 Len=1360 [TCP segment of a reassembled PDU]"
"505","38.588047","192.168.0.183","104.244.42.65","TCP","1414","50717  >  443 [ACK] Seq=433015 Ack=43122 Win=1041 Len=1360 [TCP segment of a reassembled PDU]"
"506","38.588047","192.168.0.183","104.244.42.65","TCP","1414","50717  >  443 [ACK] Seq=434375 Ack=43122 Win=1041 Len=1360 [TCP segment of a reassembled PDU]"
"507","38.588047","192.168.0.183","104.244.42.65","TLSv1.2","140","Application Data"
"508","38.588207","192.168.0.183","104.244.42.65","TCP","1414","50717  >  443 [ACK] Seq=435821 Ack=43122 Win=1041 Len=1360 [TCP segment of a reassembled PDU]"
"509","38.588207","192.168.0.183","104.244.42.65","TCP","1414","50717  >  443 [ACK] Seq=437181 Ack=43122 Win=1041 Len=1360 [TCP segment of a reassembled PDU]"
"510","38.588207","192.168.0.183","104.244.42.65","TCP","1414","50717  >  443 [ACK] Seq=438541 Ack=43122 Win=1041 Len=1360 [TCP segment of a reassembled PDU]"
"511","38.588207","192.168.0.183","104.244.42.65","TCP","1414","50717  >  443 [ACK] Seq=439901 Ack=43122 Win=1041 Len=1360 [TCP segment of a reassembled PDU]"
"512","38.588207","192.168.0.183","104.244.42.65","TCP","1414","50717  >  443 [ACK] Seq=441261 Ack=43122 Win=1041 Len=1360 [TCP segment of a reassembled PDU]"
"513","38.588207","192.168.0.183","104.244.42.65","TCP","1414","50717  >  443 [ACK] Seq=442621 Ack=43122 Win=1041 Len=1360 [TCP segment of a reassembled PDU]"
"514","38.588207","192.168.0.183","104.244.42.65","TCP","1414","50717  >  443 [ACK] Seq=443981 Ack=43122 Win=1041 Len=1360 [TCP segment of a reassembled PDU]"
"515","38.588207","192.168.0.183","104.244.42.65","TCP","1414","50717  >  443 [ACK] Seq=445341 Ack=43122 Win=1041 Len=1360 [TCP segment of a reassembled PDU]"
"516","38.588207","192.168.0.183","104.244.42.65","TCP","1414","50717  >  443 [ACK] Seq=446701 Ack=43122 Win=1041 Len=1360 [TCP segment of a reassembled PDU]"
"517","38.588207","192.168.0.183","104.244.42.65","TCP","1414","50717  >  443 [ACK] Seq=448061 Ack=43122 Win=1041 Len=1360 [TCP segment of a reassembled PDU]"
"518","38.588207","192.168.0.183","104.244.42.65","TCP","1414","50717  >  443 [ACK] Seq=449421 Ack=43122 Win=1041 Len=1360 [TCP segment of a reassembled PDU]"
"519","38.588207","192.168.0.183","104.244.42.65","TCP","1414","50717  >  443 [ACK] Seq=450781 Ack=43122 Win=1041 Len=1360 [TCP segment of a reassembled PDU]"
"520","38.588207","192.168.0.183","104.244.42.65","TLSv1.2","140","Application Data"
"521","38.588445","192.168.0.183","104.244.42.65","TCP","1414","50717  >  443 [ACK] Seq=452227 Ack=43122 Win=1041 Len=1360 [TCP segment of a reassembled PDU]"
"522","38.588445","192.168.0.183","104.244.42.65","TCP","1414","50717  >  443 [ACK] Seq=453587 Ack=43122 Win=1041 Len=1360 [TCP segment of a reassembled PDU]"
"523","38.588445","192.168.0.183","104.244.42.65","TCP","1414","50717  >  443 [ACK] Seq=454947 Ack=43122 Win=1041 Len=1360 [TCP segment of a reassembled PDU]"
"524","38.588445","192.168.0.183","104.244.42.65","TCP","1414","50717  >  443 [ACK] Seq=456307 Ack=43122 Win=1041 Len=1360 [TCP segment of a reassembled PDU]"
"525","38.588445","192.168.0.183","104.244.42.65","TCP","1414","50717  >  443 [ACK] Seq=457667 Ack=43122 Win=1041 Len=1360 [TCP segment of a reassembled PDU]"
"526","38.588445","192.168.0.183","104.244.42.65","TCP","1414","50717  >  443 [ACK] Seq=459027 Ack=43122 Win=1041 Len=1360 [TCP segment of a reassembled PDU]"
"527","38.588445","192.168.0.183","104.244.42.65","TCP","1414","50717  >  443 [ACK] Seq=460387 Ack=43122 Win=1041 Len=1360 [TCP segment of a reassembled PDU]"
"528","38.588445","192.168.0.183","104.244.42.65","TCP","1414","50717  >  443 [ACK] Seq=461747 Ack=43122 Win=1041 Len=1360 [TCP segment of a reassembled PDU]"
"529","38.588445","192.168.0.183","104.244.42.65","TCP","1414","50717  >  443 [ACK] Seq=463107 Ack=43122 Win=1041 Len=1360 [TCP segment of a reassembled PDU]"
"530","38.588445","192.168.0.183","104.244.42.65","TCP","1414","50717  >  443 [ACK] Seq=464467 Ack=43122 Win=1041 Len=1360 [TCP segment of a reassembled PDU]"
"531","38.588445","192.168.0.183","104.244.42.65","TCP","1414","50717  >  443 [ACK] Seq=465827 Ack=43122 Win=1041 Len=1360 [TCP segment of a reassembled PDU]"
"532","38.588445","192.168.0.183","104.244.42.65","TCP","1414","50717  >  443 [ACK] Seq=467187 Ack=43122 Win=1041 Len=1360 [TCP segment of a reassembled PDU]"
"533","38.588445","192.168.0.183","104.244.42.65","TLSv1.2","140","Application Data"
"534","38.588654","192.168.0.183","104.244.42.65","TLSv1.2","121","Application Data"
"535","38.600892","192.168.0.183","104.244.42.65","TLSv1.2","270","Application Data"
"536","38.627596","104.244.42.65","192.168.0.183","TCP","60","443  >  50717 [ACK] Seq=43122 Ack=404369 Win=7928 Len=0"
"537","38.632747","104.244.42.65","192.168.0.183","TCP","60","443  >  50717 [ACK] Seq=43122 Ack=457667 Win=7917 Len=0"
"538","38.632747","104.244.42.65","192.168.0.183","TLSv1.2","89","Application Data"
"539","38.632747","104.244.42.65","192.168.0.183","TCP","60","443  >  50717 [ACK] Seq=43157 Ack=468700 Win=7901 Len=0"
"540","38.633011","192.168.0.183","104.244.42.65","TCP","1414","50717  >  443 [ACK] Seq=468916 Ack=43157 Win=1041 Len=1360 [TCP segment of a reassembled PDU]"
"541","38.633011","192.168.0.183","104.244.42.65","TCP","1414","50717  >  443 [ACK] Seq=470276 Ack=43157 Win=1041 Len=1360 [TCP segment of a reassembled PDU]"
"542","38.633011","192.168.0.183","104.244.42.65","TCP","1414","50717  >  443 [ACK] Seq=471636 Ack=43157 Win=1041 Len=1360 [TCP segment of a reassembled PDU]"
"543","38.633011","192.168.0.183","104.244.42.65","TCP","1414","50717  >  443 [ACK] Seq=472996 Ack=43157 Win=1041 Len=1360 [TCP segment of a reassembled PDU]"
"544","38.633011","192.168.0.183","104.244.42.65","TCP","1414","50717  >  443 [ACK] Seq=474356 Ack=43157 Win=1041 Len=1360 [TCP segment of a reassembled PDU]"
"545","38.633011","192.168.0.183","104.244.42.65","TCP","1414","50717  >  443 [ACK] Seq=475716 Ack=43157 Win=1041 Len=1360 [TCP segment of a reassembled PDU]"
"546","38.633011","192.168.0.183","104.244.42.65","TCP","1414","50717  >  443 [ACK] Seq=477076 Ack=43157 Win=1041 Len=1360 [TCP segment of a reassembled PDU]"
"547","38.633011","192.168.0.183","104.244.42.65","TLSv1.2","855","Application Data"
"548","38.673239","104.244.42.65","192.168.0.183","TCP","60","443  >  50717 [ACK] Seq=43157 Ack=472996 Win=7921 Len=0"
"549","38.678440","104.244.42.65","192.168.0.183","TCP","60","443  >  50717 [ACK] Seq=43157 Ack=479237 Win=7930 Len=0"
"550","38.740722","192.168.0.183","104.244.42.65","TLSv1.2","251","Application Data"
"551","38.740881","192.168.0.183","104.244.42.65","TCP","1414","50717  >  443 [ACK] Seq=479434 Ack=43157 Win=1041 Len=1360 [TCP segment of a reassembled PDU]"
"552","38.740881","192.168.0.183","104.244.42.65","TLSv1.2","552","Application Data"
"553","38.741517","192.168.0.183","104.244.42.65","TLSv1.2","258","Application Data"
"554","38.741614","192.168.0.183","104.244.42.65","TLSv1.2","1096","Application Data"
"555","38.773534","104.244.42.65","192.168.0.183","TLSv1.2","220","Application Data"
"556","38.777724","104.244.42.65","192.168.0.183","TCP","60","443  >  50717 [ACK] Seq=43323 Ack=480794 Win=7927 Len=0"
"557","38.786841","104.244.42.65","192.168.0.183","TCP","60","443  >  50717 [ACK] Seq=43323 Ack=482538 Win=7926 Len=0"
"558","38.812591","104.244.42.65","192.168.0.183","TLSv1.2","159","Application Data"
"559","38.812636","192.168.0.183","104.244.42.65","TCP","54","50717  >  443 [ACK] Seq=482538 Ack=43428 Win=1040 Len=0"
"560","38.991419","104.244.42.65","192.168.0.183","TLSv1.2","188","Application Data"
"561","39.036573","192.168.0.183","104.244.42.65","TCP","54","50717  >  443 [ACK] Seq=482538 Ack=43562 Win=1039 Len=0"
"562","40.251296","104.244.42.65","192.168.0.183","TCP","1414","443  >  50717 [ACK] Seq=43562 Ack=482538 Win=7930 Len=1360 [TCP segment of a reassembled PDU]"
"563","40.251296","104.244.42.65","192.168.0.183","TCP","1414","443  >  50717 [ACK] Seq=44922 Ack=482538 Win=7930 Len=1360 [TCP segment of a reassembled PDU]"
"564","40.251296","104.244.42.65","192.168.0.183","TCP","1414","443  >  50717 [PSH, ACK] Seq=46282 Ack=482538 Win=7930 Len=1360 [TCP segment of a reassembled PDU]"
"565","40.251296","104.244.42.65","192.168.0.183","TCP","1414","443  >  50717 [ACK] Seq=47642 Ack=482538 Win=7930 Len=1360 [TCP segment of a reassembled PDU]"
"566","40.251296","104.244.42.65","192.168.0.183","TCP","1414","443  >  50717 [ACK] Seq=49002 Ack=482538 Win=7930 Len=1360 [TCP segment of a reassembled PDU]"
"567","40.251296","104.244.42.65","192.168.0.183","TCP","1414","443  >  50717 [PSH, ACK] Seq=50362 Ack=482538 Win=7930 Len=1360 [TCP segment of a reassembled PDU]"
"568","40.251296","104.244.42.65","192.168.0.183","TCP","1414","443  >  50717 [ACK] Seq=51722 Ack=482538 Win=7930 Len=1360 [TCP segment of a reassembled PDU]"
"569","40.251296","104.244.42.65","192.168.0.183","TCP","1414","443  >  50717 [ACK] Seq=53082 Ack=482538 Win=7930 Len=1360 [TCP segment of a reassembled PDU]"
"570","40.251296","104.244.42.65","192.168.0.183","TCP","1414","443  >  50717 [PSH, ACK] Seq=54442 Ack=482538 Win=7930 Len=1360 [TCP segment of a reassembled PDU]"
"571","40.251296","104.244.42.65","192.168.0.183","TCP","1414","443  >  50717 [ACK] Seq=55802 Ack=482538 Win=7930 Len=1360 [TCP segment of a reassembled PDU]"
"572","40.251296","104.244.42.65","192.168.0.183","TCP","1414","443  >  50717 [ACK] Seq=57162 Ack=482538 Win=7930 Len=1360 [TCP segment of a reassembled PDU]"
"573","40.251296","104.244.42.65","192.168.0.183","TCP","1414","443  >  50717 [PSH, ACK] Seq=58522 Ack=482538 Win=7930 Len=1360 [TCP segment of a reassembled PDU]"
"574","40.251296","104.244.42.65","192.168.0.183","TLSv1.2","1414","Application Data"
"575","40.251296","104.244.42.65","192.168.0.183","TCP","1414","443  >  50717 [ACK] Seq=61242 Ack=482538 Win=7930 Len=1360 [TCP segment of a reassembled PDU]"
"576","40.251296","104.244.42.65","192.168.0.183","TCP","1414","443  >  50717 [PSH, ACK] Seq=62602 Ack=482538 Win=7930 Len=1360 [TCP segment of a reassembled PDU]"
"577","40.251296","104.244.42.65","192.168.0.183","TCP","1414","443  >  50717 [ACK] Seq=63962 Ack=482538 Win=7930 Len=1360 [TCP segment of a reassembled PDU]"
"578","40.251296","104.244.42.65","192.168.0.183","TCP","1414","443  >  50717 [ACK] Seq=65322 Ack=482538 Win=7930 Len=1360 [TCP segment of a reassembled PDU]"
"579","40.251296","104.244.42.65","192.168.0.183","TCP","1414","443  >  50717 [PSH, ACK] Seq=66682 Ack=482538 Win=7930 Len=1360 [TCP segment of a reassembled PDU]"
"580","40.251296","104.244.42.65","192.168.0.183","TCP","1414","443  >  50717 [ACK] Seq=68042 Ack=482538 Win=7930 Len=1360 [TCP segment of a reassembled PDU]"
"581","40.251296","104.244.42.65","192.168.0.183","TCP","1414","443  >  50717 [ACK] Seq=69402 Ack=482538 Win=7930 Len=1360 [TCP segment of a reassembled PDU]"
"582","40.251296","104.244.42.65","192.168.0.183","TCP","1414","443  >  50717 [PSH, ACK] Seq=70762 Ack=482538 Win=7930 Len=1360 [TCP segment of a reassembled PDU]"
"583","40.251296","104.244.42.65","192.168.0.183","TCP","1414","443  >  50717 [ACK] Seq=72122 Ack=482538 Win=7930 Len=1360 [TCP segment of a reassembled PDU]"
"584","40.251296","104.244.42.65","192.168.0.183","TCP","1414","443  >  50717 [ACK] Seq=73482 Ack=482538 Win=7930 Len=1360 [TCP segment of a reassembled PDU]"
"585","40.251296","104.244.42.65","192.168.0.183","TCP","1414","443  >  50717 [PSH, ACK] Seq=74842 Ack=482538 Win=7930 Len=1360 [TCP segment of a reassembled PDU]"
"586","40.251296","104.244.42.65","192.168.0.183","TLSv1.2","1414","Application Data"
"587","40.251296","104.244.42.65","192.168.0.183","TCP","1414","443  >  50717 [ACK] Seq=77562 Ack=482538 Win=7930 Len=1360 [TCP segment of a reassembled PDU]"
"588","40.251296","104.244.42.65","192.168.0.183","TLSv1.2","417","Application Data"
"589","40.251405","192.168.0.183","104.244.42.65","TCP","54","50717  >  443 [ACK] Seq=482538 Ack=79285 Win=1041 Len=0"
"590","40.252518","192.168.0.183","104.244.42.65","TLSv1.2","89","Application Data"
"591","40.328800","104.244.42.65","192.168.0.183","TCP","60","443  >  50717 [ACK] Seq=79285 Ack=482573 Win=7930 Len=0"
"592","41.429117","192.168.0.183","104.244.42.65","TLSv1.2","330","Application Data"
"593","41.429275","192.168.0.183","104.244.42.65","TCP","1414","50717  >  443 [ACK] Seq=482849 Ack=79285 Win=1041 Len=1360 [TCP segment of a reassembled PDU]"
"594","41.429275","192.168.0.183","104.244.42.65","TCP","1414","50717  >  443 [ACK] Seq=484209 Ack=79285 Win=1041 Len=1360 [TCP segment of a reassembled PDU]"
"595","41.429275","192.168.0.183","104.244.42.65","TCP","1414","50717  >  443 [ACK] Seq=485569 Ack=79285 Win=1041 Len=1360 [TCP segment of a reassembled PDU]"
"596","41.429275","192.168.0.183","104.244.42.65","TCP","1414","50717  >  443 [ACK] Seq=486929 Ack=79285 Win=1041 Len=1360 [TCP segment of a reassembled PDU]"
"597","41.429275","192.168.0.183","104.244.42.65","TCP","1414","50717  >  443 [ACK] Seq=488289 Ack=79285 Win=1041 Len=1360 [TCP segment of a reassembled PDU]"
"598","41.429275","192.168.0.183","104.244.42.65","TCP","1414","50717  >  443 [ACK] Seq=489649 Ack=79285 Win=1041 Len=1360 [TCP segment of a reassembled PDU]"
"599","41.429275","192.168.0.183","104.244.42.65","TCP","1414","50717  >  443 [ACK] Seq=491009 Ack=79285 Win=1041 Len=1360 [TCP segment of a reassembled PDU]"
"600","41.429275","192.168.0.183","104.244.42.65","TCP","1414","50717  >  443 [ACK] Seq=492369 Ack=79285 Win=1041 Len=1360 [TCP segment of a reassembled PDU]"
"601","41.429275","192.168.0.183","104.244.42.65","TCP","1414","50717  >  443 [ACK] Seq=493729 Ack=79285 Win=1041 Len=1360 [TCP segment of a reassembled PDU]"
"602","41.429275","192.168.0.183","104.244.42.65","TCP","1414","50717  >  443 [ACK] Seq=495089 Ack=79285 Win=1041 Len=1360 [TCP segment of a reassembled PDU]"
"603","41.429275","192.168.0.183","104.244.42.65","TCP","1414","50717  >  443 [ACK] Seq=496449 Ack=79285 Win=1041 Len=1360 [TCP segment of a reassembled PDU]"
"604","41.429275","192.168.0.183","104.244.42.65","TCP","1414","50717  >  443 [ACK] Seq=497809 Ack=79285 Win=1041 Len=1360 [TCP segment of a reassembled PDU]"
"605","41.429275","192.168.0.183","104.244.42.65","TLSv1.2","140","Application Data"
"606","41.429496","192.168.0.183","104.244.42.65","TCP","1414","50717  >  443 [ACK] Seq=499255 Ack=79285 Win=1041 Len=1360 [TCP segment of a reassembled PDU]"
"607","41.429496","192.168.0.183","104.244.42.65","TCP","1414","50717  >  443 [ACK] Seq=500615 Ack=79285 Win=1041 Len=1360 [TCP segment of a reassembled PDU]"
"608","41.429496","192.168.0.183","104.244.42.65","TCP","1414","50717  >  443 [ACK] Seq=501975 Ack=79285 Win=1041 Len=1360 [TCP segment of a reassembled PDU]"
"609","41.429496","192.168.0.183","104.244.42.65","TCP","1414","50717  >  443 [ACK] Seq=503335 Ack=79285 Win=1041 Len=1360 [TCP segment of a reassembled PDU]"
"610","41.429496","192.168.0.183","104.244.42.65","TCP","1414","50717  >  443 [ACK] Seq=504695 Ack=79285 Win=1041 Len=1360 [TCP segment of a reassembled PDU]"
"611","41.429496","192.168.0.183","104.244.42.65","TCP","1414","50717  >  443 [ACK] Seq=506055 Ack=79285 Win=1041 Len=1360 [TCP segment of a reassembled PDU]"
"612","41.429496","192.168.0.183","104.244.42.65","TCP","1414","50717  >  443 [ACK] Seq=507415 Ack=79285 Win=1041 Len=1360 [TCP segment of a reassembled PDU]"
"613","41.429496","192.168.0.183","104.244.42.65","TCP","1414","50717  >  443 [ACK] Seq=508775 Ack=79285 Win=1041 Len=1360 [TCP segment of a reassembled PDU]"
"614","41.429496","192.168.0.183","104.244.42.65","TCP","1414","50717  >  443 [ACK] Seq=510135 Ack=79285 Win=1041 Len=1360 [TCP segment of a reassembled PDU]"
"615","41.429496","192.168.0.183","104.244.42.65","TCP","1414","50717  >  443 [ACK] Seq=511495 Ack=79285 Win=1041 Len=1360 [TCP segment of a reassembled PDU]"
"616","41.429496","192.168.0.183","104.244.42.65","TCP","1414","50717  >  443 [ACK] Seq=512855 Ack=79285 Win=1041 Len=1360 [TCP segment of a reassembled PDU]"
"617","41.429496","192.168.0.183","104.244.42.65","TCP","1414","50717  >  443 [ACK] Seq=514215 Ack=79285 Win=1041 Len=1360 [TCP segment of a reassembled PDU]"
"618","41.429496","192.168.0.183","104.244.42.65","TLSv1.2","140","Application Data"
"619","41.429693","192.168.0.183","104.244.42.65","TCP","1414","50717  >  443 [ACK] Seq=515661 Ack=79285 Win=1041 Len=1360 [TCP segment of a reassembled PDU]"
"620","41.429693","192.168.0.183","104.244.42.65","TCP","1414","50717  >  443 [ACK] Seq=517021 Ack=79285 Win=1041 Len=1360 [TCP segment of a reassembled PDU]"
"621","41.429693","192.168.0.183","104.244.42.65","TCP","1414","50717  >  443 [ACK] Seq=518381 Ack=79285 Win=1041 Len=1360 [TCP segment of a reassembled PDU]"
"622","41.429693","192.168.0.183","104.244.42.65","TCP","1414","50717  >  443 [ACK] Seq=519741 Ack=79285 Win=1041 Len=1360 [TCP segment of a reassembled PDU]"
"623","41.429693","192.168.0.183","104.244.42.65","TCP","1414","50717  >  443 [ACK] Seq=521101 Ack=79285 Win=1041 Len=1360 [TCP segment of a reassembled PDU]"
"624","41.429693","192.168.0.183","104.244.42.65","TCP","1414","50717  >  443 [ACK] Seq=522461 Ack=79285 Win=1041 Len=1360 [TCP segment of a reassembled PDU]"
"625","41.429693","192.168.0.183","104.244.42.65","TCP","1414","50717  >  443 [ACK] Seq=523821 Ack=79285 Win=1041 Len=1360 [TCP segment of a reassembled PDU]"
"626","41.429693","192.168.0.183","104.244.42.65","TCP","1414","50717  >  443 [ACK] Seq=525181 Ack=79285 Win=1041 Len=1360 [TCP segment of a reassembled PDU]"
"627","41.429693","192.168.0.183","104.244.42.65","TCP","1414","50717  >  443 [ACK] Seq=526541 Ack=79285 Win=1041 Len=1360 [TCP segment of a reassembled PDU]"
"628","41.429693","192.168.0.183","104.244.42.65","TCP","1414","50717  >  443 [ACK] Seq=527901 Ack=79285 Win=1041 Len=1360 [TCP segment of a reassembled PDU]"
"629","41.429693","192.168.0.183","104.244.42.65","TCP","1414","50717  >  443 [ACK] Seq=529261 Ack=79285 Win=1041 Len=1360 [TCP segment of a reassembled PDU]"
"630","41.429693","192.168.0.183","104.244.42.65","TCP","1414","50717  >  443 [ACK] Seq=530621 Ack=79285 Win=1041 Len=1360 [TCP segment of a reassembled PDU]"
"631","41.429693","192.168.0.183","104.244.42.65","TLSv1.2","140","Application Data"
"632","41.429892","192.168.0.183","104.244.42.65","TCP","1414","50717  >  443 [ACK] Seq=532067 Ack=79285 Win=1041 Len=1360 [TCP segment of a reassembled PDU]"
"633","41.429892","192.168.0.183","104.244.42.65","TCP","1414","50717  >  443 [ACK] Seq=533427 Ack=79285 Win=1041 Len=1360 [TCP segment of a reassembled PDU]"
"634","41.429892","192.168.0.183","104.244.42.65","TCP","1414","50717  >  443 [ACK] Seq=534787 Ack=79285 Win=1041 Len=1360 [TCP segment of a reassembled PDU]"
"635","41.429892","192.168.0.183","104.244.42.65","TCP","1414","50717  >  443 [ACK] Seq=536147 Ack=79285 Win=1041 Len=1360 [TCP segment of a reassembled PDU]"
"636","41.429892","192.168.0.183","104.244.42.65","TCP","1414","50717  >  443 [ACK] Seq=537507 Ack=79285 Win=1041 Len=1360 [TCP segment of a reassembled PDU]"
"637","41.429892","192.168.0.183","104.244.42.65","TCP","1414","50717  >  443 [ACK] Seq=538867 Ack=79285 Win=1041 Len=1360 [TCP segment of a reassembled PDU]"
"638","41.429892","192.168.0.183","104.244.42.65","TCP","1414","50717  >  443 [ACK] Seq=540227 Ack=79285 Win=1041 Len=1360 [TCP segment of a reassembled PDU]"
"639","41.429892","192.168.0.183","104.244.42.65","TCP","1414","50717  >  443 [ACK] Seq=541587 Ack=79285 Win=1041 Len=1360 [TCP segment of a reassembled PDU]"
"640","41.429892","192.168.0.183","104.244.42.65","TCP","1414","50717  >  443 [ACK] Seq=542947 Ack=79285 Win=1041 Len=1360 [TCP segment of a reassembled PDU]"
"641","41.429892","192.168.0.183","104.244.42.65","TCP","1414","50717  >  443 [ACK] Seq=544307 Ack=79285 Win=1041 Len=1360 [TCP segment of a reassembled PDU]"
"642","41.429892","192.168.0.183","104.244.42.65","TCP","1414","50717  >  443 [ACK] Seq=545667 Ack=79285 Win=1041 Len=1360 [TCP segment of a reassembled PDU]"
"643","41.429892","192.168.0.183","104.244.42.65","TCP","1414","50717  >  443 [ACK] Seq=547027 Ack=79285 Win=1041 Len=1360 [TCP segment of a reassembled PDU]"
"644","41.429892","192.168.0.183","104.244.42.65","TLSv1.2","140","Application Data"
"645","41.430047","192.168.0.183","104.244.42.65","TLSv1.2","121","Application Data"
"646","41.474333","104.244.42.65","192.168.0.183","TCP","60","443  >  50717 [ACK] Seq=79285 Ack=548473 Win=7902 Len=0"
"647","41.474333","104.244.42.65","192.168.0.183","TLSv1.2","89","Application Data"
"648","41.475552","192.168.0.183","104.244.42.65","TCP","1414","50717  >  443 [ACK] Seq=548540 Ack=79320 Win=1041 Len=1360 [TCP segment of a reassembled PDU]"
"649","41.475552","192.168.0.183","104.244.42.65","TCP","1414","50717  >  443 [ACK] Seq=549900 Ack=79320 Win=1041 Len=1360 [TCP segment of a reassembled PDU]"
"650","41.475552","192.168.0.183","104.244.42.65","TCP","1414","50717  >  443 [ACK] Seq=551260 Ack=79320 Win=1041 Len=1360 [TCP segment of a reassembled PDU]"
"651","41.475552","192.168.0.183","104.244.42.65","TCP","1414","50717  >  443 [ACK] Seq=552620 Ack=79320 Win=1041 Len=1360 [TCP segment of a reassembled PDU]"
"652","41.475552","192.168.0.183","104.244.42.65","TCP","1414","50717  >  443 [ACK] Seq=553980 Ack=79320 Win=1041 Len=1360 [TCP segment of a reassembled PDU]"
"653","41.475552","192.168.0.183","104.244.42.65","TCP","1414","50717  >  443 [ACK] Seq=555340 Ack=79320 Win=1041 Len=1360 [TCP segment of a reassembled PDU]"
"654","41.475552","192.168.0.183","104.244.42.65","TCP","1414","50717  >  443 [ACK] Seq=556700 Ack=79320 Win=1041 Len=1360 [TCP segment of a reassembled PDU]"
"655","41.475552","192.168.0.183","104.244.42.65","TCP","1414","50717  >  443 [ACK] Seq=558060 Ack=79320 Win=1041 Len=1360 [TCP segment of a reassembled PDU]"
"656","41.475552","192.168.0.183","104.244.42.65","TLSv1.2","826","Application Data"
"657","41.517196","104.244.42.65","192.168.0.183","TCP","60","443  >  50717 [ACK] Seq=79320 Ack=560192 Win=7919 Len=0"
"658","41.590425","104.244.42.65","192.168.0.183","TLSv1.2","211","Application Data"
"659","41.647464","192.168.0.183","104.244.42.65","TCP","54","50717  >  443 [ACK] Seq=560192 Ack=79477 Win=1040 Len=0"
"660","44.140569","192.168.0.183","104.244.42.65","TLSv1.2","703","Application Data"
"661","44.140658","192.168.0.183","104.244.42.65","TLSv1.2","168","Application Data"
"662","44.178112","104.244.42.65","192.168.0.183","TCP","60","443  >  50717 [ACK] Seq=79477 Ack=560955 Win=7930 Len=0"
"663","44.400497","104.244.42.65","192.168.0.183","TLSv1.2","335","Application Data"
"664","44.442549","192.168.0.183","104.244.42.65","TCP","54","50717  >  443 [ACK] Seq=560955 Ack=79758 Win=1039 Len=0"
"665","44.622767","192.168.0.183","104.244.42.65","TLSv1.2","262","Application Data"
"666","44.622901","192.168.0.183","104.244.42.65","TCP","1414","50717  >  443 [ACK] Seq=561163 Ack=79758 Win=1039 Len=1360 [TCP segment of a reassembled PDU]"
"667","44.622901","192.168.0.183","104.244.42.65","TCP","1414","50717  >  443 [ACK] Seq=562523 Ack=79758 Win=1039 Len=1360 [TCP segment of a reassembled PDU]"
"668","44.622901","192.168.0.183","104.244.42.65","TCP","1414","50717  >  443 [ACK] Seq=563883 Ack=79758 Win=1039 Len=1360 [TCP segment of a reassembled PDU]"
"669","44.622901","192.168.0.183","104.244.42.65","TCP","1414","50717  >  443 [ACK] Seq=565243 Ack=79758 Win=1039 Len=1360 [TCP segment of a reassembled PDU]"
"670","44.622901","192.168.0.183","104.244.42.65","TCP","1414","50717  >  443 [ACK] Seq=566603 Ack=79758 Win=1039 Len=1360 [TCP segment of a reassembled PDU]"
"671","44.622901","192.168.0.183","104.244.42.65","TCP","1414","50717  >  443 [ACK] Seq=567963 Ack=79758 Win=1039 Len=1360 [TCP segment of a reassembled PDU]"
"672","44.622901","192.168.0.183","104.244.42.65","TCP","1414","50717  >  443 [ACK] Seq=569323 Ack=79758 Win=1039 Len=1360 [TCP segment of a reassembled PDU]"
"673","44.622901","192.168.0.183","104.244.42.65","TCP","1414","50717  >  443 [ACK] Seq=570683 Ack=79758 Win=1039 Len=1360 [TCP segment of a reassembled PDU]"
"674","44.622901","192.168.0.183","104.244.42.65","TLSv1.2","203","Application Data"
"675","44.662553","104.244.42.65","192.168.0.183","TCP","60","443  >  50717 [ACK] Seq=79758 Ack=562523 Win=7927 Len=0"
"676","44.665526","104.244.42.65","192.168.0.183","TCP","60","443  >  50717 [ACK] Seq=79758 Ack=572192 Win=7930 Len=0"
"677","44.690545","104.244.42.65","192.168.0.183","TLSv1.2","221","Application Data"
"678","44.739970","192.168.0.183","104.244.42.65","TCP","54","50717  >  443 [ACK] Seq=572192 Ack=79925 Win=1038 Len=0"
