"No.","Time","Source","Destination","Protocol","Length","Info"
"1","0.000000","192.168.0.183","104.244.42.65","TLSv1.2","259","Application Data"
"2","0.000088","192.168.0.183","104.244.42.65","TCP","1414","50717  >  443 [ACK] Seq=206 Ack=1 Win=1040 Len=1360 [TCP segment of a reassembled PDU]"
"3","0.000088","192.168.0.183","104.244.42.65","TLSv1.2","540","Application Data"
"4","0.037058","104.244.42.65","192.168.0.183","TCP","60","443  >  50717 [ACK] Seq=1 Ack=1566 Win=7928 Len=0"
"5","0.065543","104.244.42.65","192.168.0.183","TLSv1.2","184","Application Data"
"6","0.111853","192.168.0.183","104.244.42.65","TCP","54","50717  >  443 [ACK] Seq=2052 Ack=131 Win=1040 Len=0"
"7","0.645778","192.168.0.183","104.244.42.65","TLSv1.2","356","Application Data"
"8","0.724641","104.244.42.65","192.168.0.183","TCP","60","443  >  50717 [ACK] Seq=131 Ack=2354 Win=7930 Len=0"
"9","1.011632","104.244.42.65","192.168.0.183","TLSv1.2","211","Application Data"
"10","1.059083","192.168.0.183","104.244.42.65","TCP","54","50717  >  443 [ACK] Seq=2354 Ack=288 Win=1039 Len=0"
"11","1.595612","192.168.0.183","104.244.42.65","TCP","1414","50717  >  443 [ACK] Seq=2354 Ack=288 Win=1039 Len=1360 [TCP segment of a reassembled PDU]"
"12","1.595612","192.168.0.183","104.244.42.65","TLSv1.2","857","Application Data"
"13","1.596125","192.168.0.183","104.244.42.65","TLSv1.2","237","Application Data"
"14","1.632561","104.244.42.65","192.168.0.183","TCP","60","443  >  50717 [ACK] Seq=288 Ack=4517 Win=7926 Len=0"
"15","1.640338","104.244.42.65","192.168.0.183","TCP","60","443  >  50717 [ACK] Seq=288 Ack=4700 Win=7930 Len=0"
"16","2.088799","104.244.42.65","192.168.0.183","TLSv1.2","175","Application Data"
"17","2.132146","192.168.0.183","104.244.42.65","TCP","54","50717  >  443 [ACK] Seq=4700 Ack=409 Win=1039 Len=0"
"18","2.461966","104.244.42.65","192.168.0.183","TCP","1414","443  >  50717 [ACK] Seq=409 Ack=4700 Win=7930 Len=1360 [TCP segment of a reassembled PDU]"
"19","2.461966","104.244.42.65","192.168.0.183","TCP","1414","443  >  50717 [PSH, ACK] Seq=1769 Ack=4700 Win=7930 Len=1360 [TCP segment of a reassembled PDU]"
"20","2.461966","104.244.42.65","192.168.0.183","TCP","1414","443  >  50717 [ACK] Seq=3129 Ack=4700 Win=7930 Len=1360 [TCP segment of a reassembled PDU]"
"21","2.461966","104.244.42.65","192.168.0.183","TCP","1414","443  >  50717 [PSH, ACK] Seq=4489 Ack=4700 Win=7930 Len=1360 [TCP segment of a reassembled PDU]"
"22","2.461966","104.244.42.65","192.168.0.183","TCP","1414","443  >  50717 [ACK] Seq=5849 Ack=4700 Win=7930 Len=1360 [TCP segment of a reassembled PDU]"
"23","2.461966","104.244.42.65","192.168.0.183","TCP","1414","443  >  50717 [PSH, ACK] Seq=7209 Ack=4700 Win=7930 Len=1360 [TCP segment of a reassembled PDU]"
"24","2.461966","104.244.42.65","192.168.0.183","TLSv1.2","379","Application Data"
"25","2.462020","192.168.0.183","104.244.42.65","TCP","54","50717  >  443 [ACK] Seq=4700 Ack=8894 Win=1041 Len=0"
"26","2.463365","192.168.0.183","104.244.42.65","TLSv1.2","89","Application Data"
"27","2.506620","104.244.42.65","192.168.0.183","TCP","60","443  >  50717 [ACK] Seq=8894 Ack=4735 Win=7930 Len=0"
"28","2.871331","192.168.0.183","104.244.42.65","TCP","1414","50717  >  443 [ACK] Seq=4735 Ack=8894 Win=1041 Len=1360 [TCP segment of a reassembled PDU]"
"29","2.871331","192.168.0.183","104.244.42.65","TLSv1.2","512","Application Data"
"30","2.908720","104.244.42.65","192.168.0.183","TCP","60","443  >  50717 [ACK] Seq=8894 Ack=6553 Win=7926 Len=0"
"31","3.006285","192.168.0.183","104.244.42.65","TLSv1.2","765","Application Data"
"32","3.006441","192.168.0.183","104.244.42.65","TCP","1414","50717  >  443 [ACK] Seq=7264 Ack=8894 Win=1041 Len=1360 [TCP segment of a reassembled PDU]"
"33","3.006441","192.168.0.183","104.244.42.65","TCP","1414","50717  >  443 [ACK] Seq=8624 Ack=8894 Win=1041 Len=1360 [TCP segment of a reassembled PDU]"
"34","3.006441","192.168.0.183","104.244.42.65","TCP","1414","50717  >  443 [ACK] Seq=9984 Ack=8894 Win=1041 Len=1360 [TCP segment of a reassembled PDU]"
"35","3.006441","192.168.0.183","104.244.42.65","TCP","1414","50717  >  443 [ACK] Seq=11344 Ack=8894 Win=1041 Len=1360 [TCP segment of a reassembled PDU]"
"36","3.006441","192.168.0.183","104.244.42.65","TCP","1414","50717  >  443 [ACK] Seq=12704 Ack=8894 Win=1041 Len=1360 [TCP segment of a reassembled PDU]"
"37","3.006441","192.168.0.183","104.244.42.65","TCP","1414","50717  >  443 [ACK] Seq=14064 Ack=8894 Win=1041 Len=1360 [TCP segment of a reassembled PDU]"
"38","3.006441","192.168.0.183","104.244.42.65","TCP","1414","50717  >  443 [ACK] Seq=15424 Ack=8894 Win=1041 Len=1360 [TCP segment of a reassembled PDU]"
"39","3.006441","192.168.0.183","104.244.42.65","TCP","1414","50717  >  443 [ACK] Seq=16784 Ack=8894 Win=1041 Len=1360 [TCP segment of a reassembled PDU]"
"40","3.006441","192.168.0.183","104.244.42.65","TCP","1414","50717  >  443 [ACK] Seq=18144 Ack=8894 Win=1041 Len=1360 [TCP segment of a reassembled PDU]"
"41","3.006441","192.168.0.183","104.244.42.65","TCP","1414","50717  >  443 [ACK] Seq=19504 Ack=8894 Win=1041 Len=1360 [TCP segment of a reassembled PDU]"
"42","3.006441","192.168.0.183","104.244.42.65","TCP","1414","50717  >  443 [ACK] Seq=20864 Ack=8894 Win=1041 Len=1360 [TCP segment of a reassembled PDU]"
"43","3.006441","192.168.0.183","104.244.42.65","TCP","1414","50717  >  443 [ACK] Seq=22224 Ack=8894 Win=1041 Len=1360 [TCP segment of a reassembled PDU]"
"44","3.006441","192.168.0.183","104.244.42.65","TLSv1.2","140","Application Data"
"45","3.006695","192.168.0.183","104.244.42.65","TCP","1414","50717  >  443 [ACK] Seq=23670 Ack=8894 Win=1041 Len=1360 [TCP segment of a reassembled PDU]"
"46","3.006695","192.168.0.183","104.244.42.65","TCP","1414","50717  >  443 [ACK] Seq=25030 Ack=8894 Win=1041 Len=1360 [TCP segment of a reassembled PDU]"
"47","3.006695","192.168.0.183","104.244.42.65","TCP","1414","50717  >  443 [ACK] Seq=26390 Ack=8894 Win=1041 Len=1360 [TCP segment of a reassembled PDU]"
"48","3.006695","192.168.0.183","104.244.42.65","TCP","1414","50717  >  443 [ACK] Seq=27750 Ack=8894 Win=1041 Len=1360 [TCP segment of a reassembled PDU]"
"49","3.006695","192.168.0.183","104.244.42.65","TCP","1414","50717  >  443 [ACK] Seq=29110 Ack=8894 Win=1041 Len=1360 [TCP segment of a reassembled PDU]"
"50","3.006695","192.168.0.183","104.244.42.65","TCP","1414","50717  >  443 [ACK] Seq=30470 Ack=8894 Win=1041 Len=1360 [TCP segment of a reassembled PDU]"
"51","3.006695","192.168.0.183","104.244.42.65","TCP","1414","50717  >  443 [ACK] Seq=31830 Ack=8894 Win=1041 Len=1360 [TCP segment of a reassembled PDU]"
"52","3.006695","192.168.0.183","104.244.42.65","TCP","1414","50717  >  443 [ACK] Seq=33190 Ack=8894 Win=1041 Len=1360 [TCP segment of a reassembled PDU]"
"53","3.006695","192.168.0.183","104.244.42.65","TCP","1414","50717  >  443 [ACK] Seq=34550 Ack=8894 Win=1041 Len=1360 [TCP segment of a reassembled PDU]"
"54","3.006695","192.168.0.183","104.244.42.65","TCP","1414","50717  >  443 [ACK] Seq=35910 Ack=8894 Win=1041 Len=1360 [TCP segment of a reassembled PDU]"
"55","3.006695","192.168.0.183","104.244.42.65","TCP","1414","50717  >  443 [ACK] Seq=37270 Ack=8894 Win=1041 Len=1360 [TCP segment of a reassembled PDU]"
"56","3.006695","192.168.0.183","104.244.42.65","TCP","1414","50717  >  443 [ACK] Seq=38630 Ack=8894 Win=1041 Len=1360 [TCP segment of a reassembled PDU]"
"57","3.006695","192.168.0.183","104.244.42.65","TLSv1.2","140","Application Data"
"58","3.006893","192.168.0.183","104.244.42.65","TCP","1414","50717  >  443 [ACK] Seq=40076 Ack=8894 Win=1041 Len=1360 [TCP segment of a reassembled PDU]"
"59","3.006893","192.168.0.183","104.244.42.65","TCP","1414","50717  >  443 [ACK] Seq=41436 Ack=8894 Win=1041 Len=1360 [TCP segment of a reassembled PDU]"
"60","3.006893","192.168.0.183","104.244.42.65","TCP","1414","50717  >  443 [ACK] Seq=42796 Ack=8894 Win=1041 Len=1360 [TCP segment of a reassembled PDU]"
"61","3.006893","192.168.0.183","104.244.42.65","TCP","1414","50717  >  443 [ACK] Seq=44156 Ack=8894 Win=1041 Len=1360 [TCP segment of a reassembled PDU]"
"62","3.006893","192.168.0.183","104.244.42.65","TCP","1414","50717  >  443 [ACK] Seq=45516 Ack=8894 Win=1041 Len=1360 [TCP segment of a reassembled PDU]"
"63","3.006893","192.168.0.183","104.244.42.65","TCP","1414","50717  >  443 [ACK] Seq=46876 Ack=8894 Win=1041 Len=1360 [TCP segment of a reassembled PDU]"
"64","3.006893","192.168.0.183","104.244.42.65","TCP","1414","50717  >  443 [ACK] Seq=48236 Ack=8894 Win=1041 Len=1360 [TCP segment of a reassembled PDU]"
"65","3.006893","192.168.0.183","104.244.42.65","TCP","1414","50717  >  443 [ACK] Seq=49596 Ack=8894 Win=1041 Len=1360 [TCP segment of a reassembled PDU]"
"66","3.006893","192.168.0.183","104.244.42.65","TCP","1414","50717  >  443 [ACK] Seq=50956 Ack=8894 Win=1041 Len=1360 [TCP segment of a reassembled PDU]"
"67","3.006893","192.168.0.183","104.244.42.65","TCP","1414","50717  >  443 [ACK] Seq=52316 Ack=8894 Win=1041 Len=1360 [TCP segment of a reassembled PDU]"
"68","3.006893","192.168.0.183","104.244.42.65","TCP","1414","50717  >  443 [ACK] Seq=53676 Ack=8894 Win=1041 Len=1360 [TCP segment of a reassembled PDU]"
"69","3.006893","192.168.0.183","104.244.42.65","TCP","1414","50717  >  443 [ACK] Seq=55036 Ack=8894 Win=1041 Len=1360 [TCP segment of a reassembled PDU]"
"70","3.006893","192.168.0.183","104.244.42.65","TLSv1.2","140","Application Data"
"71","3.007161","192.168.0.183","104.244.42.65","TCP","1414","50717  >  443 [ACK] Seq=56482 Ack=8894 Win=1041 Len=1360 [TCP segment of a reassembled PDU]"
"72","3.007161","192.168.0.183","104.244.42.65","TCP","1414","50717  >  443 [ACK] Seq=57842 Ack=8894 Win=1041 Len=1360 [TCP segment of a reassembled PDU]"
"73","3.007161","192.168.0.183","104.244.42.65","TCP","1414","50717  >  443 [ACK] Seq=59202 Ack=8894 Win=1041 Len=1360 [TCP segment of a reassembled PDU]"
"74","3.007161","192.168.0.183","104.244.42.65","TCP","1414","50717  >  443 [ACK] Seq=60562 Ack=8894 Win=1041 Len=1360 [TCP segment of a reassembled PDU]"
"75","3.007161","192.168.0.183","104.244.42.65","TCP","1414","50717  >  443 [ACK] Seq=61922 Ack=8894 Win=1041 Len=1360 [TCP segment of a reassembled PDU]"
"76","3.007161","192.168.0.183","104.244.42.65","TCP","1414","50717  >  443 [ACK] Seq=63282 Ack=8894 Win=1041 Len=1360 [TCP segment of a reassembled PDU]"
"77","3.007161","192.168.0.183","104.244.42.65","TCP","1414","50717  >  443 [ACK] Seq=64642 Ack=8894 Win=1041 Len=1360 [TCP segment of a reassembled PDU]"
"78","3.007161","192.168.0.183","104.244.42.65","TCP","1414","50717  >  443 [ACK] Seq=66002 Ack=8894 Win=1041 Len=1360 [TCP segment of a reassembled PDU]"
"79","3.007161","192.168.0.183","104.244.42.65","TLSv1.2","414","Application Data"
"80","3.042584","104.244.42.65","192.168.0.183","TCP","60","443  >  50717 [ACK] Seq=8894 Ack=7264 Win=7930 Len=0"
"81","3.048738","104.244.42.65","192.168.0.183","TCP","60","443  >  50717 [ACK] Seq=8894 Ack=64642 Win=7873 Len=0"
"82","3.048738","104.244.42.65","192.168.0.183","TLSv1.2","89","Application Data"
"83","3.048738","104.244.42.65","192.168.0.183","TCP","60","443  >  50717 [ACK] Seq=8929 Ack=67722 Win=7930 Len=0"
"84","3.099881","192.168.0.183","104.244.42.65","TCP","54","50717  >  443 [ACK] Seq=67722 Ack=8929 Win=1041 Len=0"
"85","3.101602","104.244.42.65","192.168.0.183","TLSv1.2","234","Application Data"
"86","3.146794","192.168.0.183","104.244.42.65","TCP","54","50717  >  443 [ACK] Seq=67722 Ack=9109 Win=1040 Len=0"
"87","3.570900","104.244.42.65","192.168.0.183","TCP","1414","443  >  50717 [ACK] Seq=9109 Ack=67722 Win=7930 Len=1360 [TCP segment of a reassembled PDU]"
"88","3.570900","104.244.42.65","192.168.0.183","TCP","1414","443  >  50717 [ACK] Seq=10469 Ack=67722 Win=7930 Len=1360 [TCP segment of a reassembled PDU]"
"89","3.570900","104.244.42.65","192.168.0.183","TCP","1414","443  >  50717 [PSH, ACK] Seq=11829 Ack=67722 Win=7930 Len=1360 [TCP segment of a reassembled PDU]"
"90","3.570900","104.244.42.65","192.168.0.183","TCP","1414","443  >  50717 [ACK] Seq=13189 Ack=67722 Win=7930 Len=1360 [TCP segment of a reassembled PDU]"
"91","3.570900","104.244.42.65","192.168.0.183","TCP","1414","443  >  50717 [ACK] Seq=14549 Ack=67722 Win=7930 Len=1360 [TCP segment of a reassembled PDU]"
"92","3.570900","104.244.42.65","192.168.0.183","TLSv1.2","60","Application Data"
"93","3.571645","192.168.0.183","104.244.42.65","TCP","54","50717  >  443 [ACK] Seq=67722 Ack=15911 Win=1041 Len=0"
"94","4.654046","192.168.0.183","104.244.42.65","TLSv1.2","245","Application Data"
"95","4.654139","192.168.0.183","104.244.42.65","TCP","1414","50717  >  443 [ACK] Seq=67913 Ack=15911 Win=1041 Len=1360 [TCP segment of a reassembled PDU]"
"96","4.654139","192.168.0.183","104.244.42.65","TLSv1.2","288","Application Data"
"97","4.692783","104.244.42.65","192.168.0.183","TCP","60","443  >  50717 [ACK] Seq=15911 Ack=69507 Win=7926 Len=0"
"98","4.718888","104.244.42.65","192.168.0.183","TLSv1.2","184","Application Data"
"99","4.765100","192.168.0.183","104.244.42.65","TCP","54","50717  >  443 [ACK] Seq=69507 Ack=16041 Win=1040 Len=0"
"100","6.584554","192.168.0.183","104.244.42.65","TLSv1.2","236","Application Data"
"101","6.584854","192.168.0.183","104.244.42.65","TCP","1414","50717  >  443 [ACK] Seq=69689 Ack=16041 Win=1040 Len=1360 [TCP segment of a reassembled PDU]"
"102","6.584854","192.168.0.183","104.244.42.65","TCP","1414","50717  >  443 [ACK] Seq=71049 Ack=16041 Win=1040 Len=1360 [TCP segment of a reassembled PDU]"
"103","6.584854","192.168.0.183","104.244.42.65","TCP","1414","50717  >  443 [ACK] Seq=72409 Ack=16041 Win=1040 Len=1360 [TCP segment of a reassembled PDU]"
"104","6.584854","192.168.0.183","104.244.42.65","TCP","1414","50717  >  443 [ACK] Seq=73769 Ack=16041 Win=1040 Len=1360 [TCP segment of a reassembled PDU]"
"105","6.584854","192.168.0.183","104.244.42.65","TCP","1414","50717  >  443 [ACK] Seq=75129 Ack=16041 Win=1040 Len=1360 [TCP segment of a reassembled PDU]"
"106","6.584854","192.168.0.183","104.244.42.65","TCP","1414","50717  >  443 [ACK] Seq=76489 Ack=16041 Win=1040 Len=1360 [TCP segment of a reassembled PDU]"
"107","6.584854","192.168.0.183","104.244.42.65","TCP","1414","50717  >  443 [ACK] Seq=77849 Ack=16041 Win=1040 Len=1360 [TCP segment of a reassembled PDU]"
"108","6.584854","192.168.0.183","104.244.42.65","TCP","1414","50717  >  443 [ACK] Seq=79209 Ack=16041 Win=1040 Len=1360 [TCP segment of a reassembled PDU]"
"109","6.584854","192.168.0.183","104.244.42.65","TCP","1414","50717  >  443 [ACK] Seq=80569 Ack=16041 Win=1040 Len=1360 [TCP segment of a reassembled PDU]"
"110","6.584854","192.168.0.183","104.244.42.65","TCP","1414","50717  >  443 [ACK] Seq=81929 Ack=16041 Win=1040 Len=1360 [TCP segment of a reassembled PDU]"
"111","6.584854","192.168.0.183","104.244.42.65","TCP","1414","50717  >  443 [ACK] Seq=83289 Ack=16041 Win=1040 Len=1360 [TCP segment of a reassembled PDU]"
"112","6.584854","192.168.0.183","104.244.42.65","TCP","1414","50717  >  443 [ACK] Seq=84649 Ack=16041 Win=1040 Len=1360 [TCP segment of a reassembled PDU]"
"113","6.584854","192.168.0.183","104.244.42.65","TLSv1.2","140","Application Data"
"114","6.585141","192.168.0.183","104.244.42.65","TCP","1414","50717  >  443 [ACK] Seq=86095 Ack=16041 Win=1040 Len=1360 [TCP segment of a reassembled PDU]"
"115","6.585141","192.168.0.183","104.244.42.65","TCP","1414","50717  >  443 [ACK] Seq=87455 Ack=16041 Win=1040 Len=1360 [TCP segment of a reassembled PDU]"
"116","6.585141","192.168.0.183","104.244.42.65","TCP","1414","50717  >  443 [ACK] Seq=88815 Ack=16041 Win=1040 Len=1360 [TCP segment of a reassembled PDU]"
"117","6.585141","192.168.0.183","104.244.42.65","TCP","1414","50717  >  443 [ACK] Seq=90175 Ack=16041 Win=1040 Len=1360 [TCP segment of a reassembled PDU]"
"118","6.585141","192.168.0.183","104.244.42.65","TCP","1414","50717  >  443 [ACK] Seq=91535 Ack=16041 Win=1040 Len=1360 [TCP segment of a reassembled PDU]"
"119","6.585141","192.168.0.183","104.244.42.65","TCP","1414","50717  >  443 [ACK] Seq=92895 Ack=16041 Win=1040 Len=1360 [TCP segment of a reassembled PDU]"
"120","6.585141","192.168.0.183","104.244.42.65","TCP","1414","50717  >  443 [ACK] Seq=94255 Ack=16041 Win=1040 Len=1360 [TCP segment of a reassembled PDU]"
"121","6.585141","192.168.0.183","104.244.42.65","TCP","1414","50717  >  443 [ACK] Seq=95615 Ack=16041 Win=1040 Len=1360 [TCP segment of a reassembled PDU]"
"122","6.585141","192.168.0.183","104.244.42.65","TCP","1414","50717  >  443 [ACK] Seq=96975 Ack=16041 Win=1040 Len=1360 [TCP segment of a reassembled PDU]"
"123","6.585141","192.168.0.183","104.244.42.65","TCP","1414","50717  >  443 [ACK] Seq=98335 Ack=16041 Win=1040 Len=1360 [TCP segment of a reassembled PDU]"
"124","6.585141","192.168.0.183","104.244.42.65","TCP","1414","50717  >  443 [ACK] Seq=99695 Ack=16041 Win=1040 Len=1360 [TCP segment of a reassembled PDU]"
"125","6.585141","192.168.0.183","104.244.42.65","TCP","1414","50717  >  443 [ACK] Seq=101055 Ack=16041 Win=1040 Len=1360 [TCP segment of a reassembled PDU]"
"126","6.585141","192.168.0.183","104.244.42.65","TLSv1.2","140","Application Data"
"127","6.585341","192.168.0.183","104.244.42.65","TCP","1414","50717  >  443 [ACK] Seq=102501 Ack=16041 Win=1040 Len=1360 [TCP segment of a reassembled PDU]"
"128","6.585341","192.168.0.183","104.244.42.65","TCP","1414","50717  >  443 [ACK] Seq=103861 Ack=16041 Win=1040 Len=1360 [TCP segment of a reassembled PDU]"
"129","6.585341","192.168.0.183","104.244.42.65","TCP","1414","50717  >  443 [ACK] Seq=105221 Ack=16041 Win=1040 Len=1360 [TCP segment of a reassembled PDU]"
"130","6.585341","192.168.0.183","104.244.42.65","TCP","1414","50717  >  443 [ACK] Seq=106581 Ack=16041 Win=1040 Len=1360 [TCP segment of a reassembled PDU]"
"131","6.585341","192.168.0.183","104.244.42.65","TCP","1414","50717  >  443 [ACK] Seq=107941 Ack=16041 Win=1040 Len=1360 [TCP segment of a reassembled PDU]"
"132","6.585341","192.168.0.183","104.244.42.65","TCP","1414","50717  >  443 [ACK] Seq=109301 Ack=16041 Win=1040 Len=1360 [TCP segment of a reassembled PDU]"
"133","6.585341","192.168.0.183","104.244.42.65","TCP","1414","50717  >  443 [ACK] Seq=110661 Ack=16041 Win=1040 Len=1360 [TCP segment of a reassembled PDU]"
"134","6.585341","192.168.0.183","104.244.42.65","TCP","1414","50717  >  443 [ACK] Seq=112021 Ack=16041 Win=1040 Len=1360 [TCP segment of a reassembled PDU]"
"135","6.585341","192.168.0.183","104.244.42.65","TCP","1414","50717  >  443 [ACK] Seq=113381 Ack=16041 Win=1040 Len=1360 [TCP segment of a reassembled PDU]"
"136","6.585341","192.168.0.183","104.244.42.65","TCP","1414","50717  >  443 [ACK] Seq=114741 Ack=16041 Win=1040 Len=1360 [TCP segment of a reassembled PDU]"
"137","6.585341","192.168.0.183","104.244.42.65","TCP","1414","50717  >  443 [ACK] Seq=116101 Ack=16041 Win=1040 Len=1360 [TCP segment of a reassembled PDU]"
"138","6.585341","192.168.0.183","104.244.42.65","TCP","1414","50717  >  443 [ACK] Seq=117461 Ack=16041 Win=1040 Len=1360 [TCP segment of a reassembled PDU]"
"139","6.585341","192.168.0.183","104.244.42.65","TLSv1.2","140","Application Data"
"140","6.585565","192.168.0.183","104.244.42.65","TCP","1414","50717  >  443 [ACK] Seq=118907 Ack=16041 Win=1040 Len=1360 [TCP segment of a reassembled PDU]"
"141","6.585565","192.168.0.183","104.244.42.65","TLSv1.2","238","Application Data"
"142","6.624629","104.244.42.65","192.168.0.183","TCP","60","443  >  50717 [ACK] Seq=16041 Ack=72409 Win=7925 Len=0"
"143","6.628948","104.244.42.65","192.168.0.183","TCP","60","443  >  50717 [ACK] Seq=16041 Ack=102501 Win=7898 Len=0"
"144","6.638028","104.244.42.65","192.168.0.183","TCP","60","443  >  50717 [ACK] Seq=16041 Ack=120267 Win=7916 Len=0"
"145","6.638028","104.244.42.65","192.168.0.183","TLSv1.2","89","Application Data"
"146","6.689710","192.168.0.183","104.244.42.65","TCP","54","50717  >  443 [ACK] Seq=120451 Ack=16076 Win=1040 Len=0"
"147","6.692549","104.244.42.65","192.168.0.183","TLSv1.2","211","Application Data"
"148","6.737631","192.168.0.183","104.244.42.65","TCP","54","50717  >  443 [ACK] Seq=120451 Ack=16233 Win=1039 Len=0"
"149","9.304804","192.168.0.183","104.244.42.65","TLSv1.2","280","Application Data"
"150","9.389644","104.244.42.65","192.168.0.183","TCP","60","443  >  50717 [ACK] Seq=16233 Ack=120677 Win=7930 Len=0"
"151","9.502040","192.168.0.183","104.244.42.65","TLSv1.2","345","Application Data"
"152","9.502193","192.168.0.183","104.244.42.65","TCP","1414","50717  >  443 [ACK] Seq=120968 Ack=16233 Win=1039 Len=1360 [TCP segment of a reassembled PDU]"
"153","9.502193","192.168.0.183","104.244.42.65","TLSv1.2","354","Application Data"
"154","9.502846","192.168.0.183","104.244.42.65","TLSv1.2","662","Application Data"
"155","9.503013","192.168.0.183","104.244.42.65","TLSv1.2","352","Application Data"
"156","9.542876","104.244.42.65","192.168.0.183","TCP","60","443  >  50717 [ACK] Seq=16233 Ack=123534 Win=7924 Len=0"
"157","9.581471","104.244.42.65","192.168.0.183","TLSv1.2","286","Application Data"
"158","9.624733","192.168.0.183","104.244.42.65","TCP","54","50717  >  443 [ACK] Seq=123534 Ack=16465 Win=1039 Len=0"
"159","9.728601","104.244.42.65","192.168.0.183","TLSv1.2","152","Application Data"
"160","9.779730","192.168.0.183","104.244.42.65","TCP","54","50717  >  443 [ACK] Seq=123534 Ack=16563 Win=1038 Len=0"
"161","9.943329","192.168.0.183","104.244.42.65","TLSv1.2","235","Application Data"
"162","9.943566","192.168.0.183","104.244.42.65","TCP","1414","50717  >  443 [ACK] Seq=123715 Ack=16563 Win=1038 Len=1360 [TCP segment of a reassembled PDU]"
"163","9.943566","192.168.0.183","104.244.42.65","TCP","1414","50717  >  443 [ACK] Seq=125075 Ack=16563 Win=1038 Len=1360 [TCP segment of a reassembled PDU]"
"164","9.943566","192.168.0.183","104.244.42.65","TCP","1414","50717  >  443 [ACK] Seq=126435 Ack=16563 Win=1038 Len=1360 [TCP segment of a reassembled PDU]"
"165","9.943566","192.168.0.183","104.244.42.65","TCP","1414","50717  >  443 [ACK] Seq=127795 Ack=16563 Win=1038 Len=1360 [TCP segment of a reassembled PDU]"
"166","9.943566","192.168.0.183","104.244.42.65","TCP","1414","50717  >  443 [ACK] Seq=129155 Ack=16563 Win=1038 Len=1360 [TCP segment of a reassembled PDU]"
"167","9.943566","192.168.0.183","104.244.42.65","TCP","1414","50717  >  443 [ACK] Seq=130515 Ack=16563 Win=1038 Len=1360 [TCP segment of a reassembled PDU]"
"168","9.943566","192.168.0.183","104.244.42.65","TCP","1414","50717  >  443 [ACK] Seq=131875 Ack=16563 Win=1038 Len=1360 [TCP segment of a reassembled PDU]"
"169","9.943566","192.168.0.183","104.244.42.65","TCP","1414","50717  >  443 [ACK] Seq=133235 Ack=16563 Win=1038 Len=1360 [TCP segment of a reassembled PDU]"
"170","9.943566","192.168.0.183","104.244.42.65","TCP","1414","50717  >  443 [ACK] Seq=134595 Ack=16563 Win=1038 Len=1360 [TCP segment of a reassembled PDU]"
"171","9.943566","192.168.0.183","104.244.42.65","TCP","1414","50717  >  443 [ACK] Seq=135955 Ack=16563 Win=1038 Len=1360 [TCP segment of a reassembled PDU]"
"172","9.943566","192.168.0.183","104.244.42.65","TCP","1414","50717  >  443 [ACK] Seq=137315 Ack=16563 Win=1038 Len=1360 [TCP segment of a reassembled PDU]"
"173","9.943566","192.168.0.183","104.244.42.65","TCP","1414","50717  >  443 [ACK] Seq=138675 Ack=16563 Win=1038 Len=1360 [TCP segment of a reassembled PDU]"
"174","9.943566","192.168.0.183","104.244.42.65","TLSv1.2","140","Application Data"
"175","9.943767","192.168.0.183","104.244.42.65","TCP","1414","50717  >  443 [ACK] Seq=140121 Ack=16563 Win=1038 Len=1360 [TCP segment of a reassembled PDU]"
"176","9.943767","192.168.0.183","104.244.42.65","TCP","1414","50717  >  443 [ACK] Seq=141481 Ack=16563 Win=1038 Len=1360 [TCP segment of a reassembled PDU]"
"177","9.943767","192.168.0.183","104.244.42.65","TCP","1414","50717  >  443 [ACK] Seq=142841 Ack=16563 Win=1038 Len=1360 [TCP segment of a reassembled PDU]"
"178","9.943767","192.168.0.183","104.244.42.65","TCP","1414","50717  >  443 [ACK] Seq=144201 Ack=16563 Win=1038 Len=1360 [TCP segment of a reassembled PDU]"
"179","9.943767","192.168.0.183","104.244.42.65","TCP","1414","50717  >  443 [ACK] Seq=145561 Ack=16563 Win=1038 Len=1360 [TCP segment of a reassembled PDU]"
"180","9.943767","192.168.0.183","104.244.42.65","TCP","1414","50717  >  443 [ACK] Seq=146921 Ack=16563 Win=1038 Len=1360 [TCP segment of a reassembled PDU]"
"181","9.943767","192.168.0.183","104.244.42.65","TCP","1414","50717  >  443 [ACK] Seq=148281 Ack=16563 Win=1038 Len=1360 [TCP segment of a reassembled PDU]"
"182","9.943767","192.168.0.183","104.244.42.65","TCP","1414","50717  >  443 [ACK] Seq=149641 Ack=16563 Win=1038 Len=1360 [TCP segment of a reassembled PDU]"
"183","9.943767","192.168.0.183","104.244.42.65","TCP","1414","50717  >  443 [ACK] Seq=151001 Ack=16563 Win=1038 Len=1360 [TCP segment of a reassembled PDU]"
"184","9.943767","192.168.0.183","104.244.42.65","TCP","1414","50717  >  443 [ACK] Seq=152361 Ack=16563 Win=1038 Len=1360 [TCP segment of a reassembled PDU]"
"185","9.943767","192.168.0.183","104.244.42.65","TCP","1414","50717  >  443 [ACK] Seq=153721 Ack=16563 Win=1038 Len=1360 [TCP segment of a reassembled PDU]"
"186","9.943767","192.168.0.183","104.244.42.65","TCP","1414","50717  >  443 [ACK] Seq=155081 Ack=16563 Win=1038 Len=1360 [TCP segment of a reassembled PDU]"
"187","9.943767","192.168.0.183","104.244.42.65","TLSv1.2","140","Application Data"
"188","9.943965","192.168.0.183","104.244.42.65","TCP","1414","50717  >  443 [ACK] Seq=156527 Ack=16563 Win=1038 Len=1360 [TCP segment of a reassembled PDU]"
"189","9.943965","192.168.0.183","104.244.42.65","TCP","1414","50717  >  443 [ACK] Seq=157887 Ack=16563 Win=1038 Len=1360 [TCP segment of a reassembled PDU]"
"190","9.943965","192.168.0.183","104.244.42.65","TCP","1414","50717  >  443 [ACK] Seq=159247 Ack=16563 Win=1038 Len=1360 [TCP segment of a reassembled PDU]"
"191","9.943965","192.168.0.183","104.244.42.65","TCP","1414","50717  >  443 [ACK] Seq=160607 Ack=16563 Win=1038 Len=1360 [TCP segment of a reassembled PDU]"
"192","9.943965","192.168.0.183","104.244.42.65","TCP","1414","50717  >  443 [ACK] Seq=161967 Ack=16563 Win=1038 Len=1360 [TCP segment of a reassembled PDU]"
"193","9.943965","192.168.0.183","104.244.42.65","TCP","1414","50717  >  443 [ACK] Seq=163327 Ack=16563 Win=1038 Len=1360 [TCP segment of a reassembled PDU]"
"194","9.943965","192.168.0.183","104.244.42.65","TCP","1414","50717  >  443 [ACK] Seq=164687 Ack=16563 Win=1038 Len=1360 [TCP segment of a reassembled PDU]"
"195","9.943965","192.168.0.183","104.244.42.65","TCP","1414","50717  >  443 [ACK] Seq=166047 Ack=16563 Win=1038 Len=1360 [TCP segment of a reassembled PDU]"
"196","9.943965","192.168.0.183","104.244.42.65","TCP","1414","50717  >  443 [ACK] Seq=167407 Ack=16563 Win=1038 Len=1360 [TCP segment of a reassembled PDU]"
"197","9.943965","192.168.0.183","104.244.42.65","TCP","1414","50717  >  443 [ACK] Seq=168767 Ack=16563 Win=1038 Len=1360 [TCP segment of a reassembled PDU]"
"198","9.943965","192.168.0.183","104.244.42.65","TCP","1414","50717  >  443 [ACK] Seq=170127 Ack=16563 Win=1038 Len=1360 [TCP segment of a reassembled PDU]"
"199","9.943965","192.168.0.183","104.244.42.65","TCP","1414","50717  >  443 [ACK] Seq=171487 Ack=16563 Win=1038 Len=1360 [TCP segment of a reassembled PDU]"
"200","9.943965","192.168.0.183","104.244.42.65","TLSv1.2","140","Application Data"
"201","9.944123","192.168.0.183","104.244.42.65","TCP","1414","50717  >  443 [ACK] Seq=172933 Ack=16563 Win=1038 Len=1360 [TCP segment of a reassembled PDU]"
"202","9.944123","192.168.0.183","104.244.42.65","TCP","1414","50717  >  443 [ACK] Seq=174293 Ack=16563 Win=1038 Len=1360 [TCP segment of a reassembled PDU]"
"203","9.944123","192.168.0.183","104.244.42.65","TLSv1.2","955","Application Data"
"204","9.987422","104.244.42.65","192.168.0.183","TCP","60","443  >  50717 [ACK] Seq=16563 Ack=140121 Win=7930 Len=0"
"205","9.987422","104.244.42.65","192.168.0.183","TLSv1.2","89","Application Data"
"206","9.987422","104.244.42.65","192.168.0.183","TCP","60","443  >  50717 [ACK] Seq=16598 Ack=174293 Win=7905 Len=0"
"207","9.987422","104.244.42.65","192.168.0.183","TLSv1.2","89","Application Data"
"208","9.987548","192.168.0.183","104.244.42.65","TCP","54","50717  >  443 [ACK] Seq=176554 Ack=16633 Win=1038 Len=0"
"209","10.029906","104.244.42.65","192.168.0.183","TCP","60","443  >  50717 [ACK] Seq=16633 Ack=176554 Win=7930 Len=0"
"210","10.039969","104.244.42.65","192.168.0.183","TLSv1.2","161","Application Data"
"211","10.092742","192.168.0.183","104.244.42.65","TCP","54","50717  >  443 [ACK] Seq=176554 Ack=16740 Win=1038 Len=0"
"212","10.898888","104.244.42.65","192.168.0.183","TCP","1414","443  >  50717 [ACK] Seq=16740 Ack=176554 Win=7930 Len=1360 [TCP segment of a reassembled PDU]"
"213","10.898888","104.244.42.65","192.168.0.183","TCP","1414","443  >  50717 [PSH, ACK] Seq=18100 Ack=176554 Win=7930 Len=1360 [TCP segment of a reassembled PDU]"
"214","10.898888","104.244.42.65","192.168.0.183","TCP","1414","443  >  50717 [ACK] Seq=19460 Ack=176554 Win=7930 Len=1360 [TCP segment of a reassembled PDU]"
"215","10.898888","104.244.42.65","192.168.0.183","TCP","1414","443  >  50717 [PSH, ACK] Seq=20820 Ack=176554 Win=7930 Len=1360 [TCP segment of a reassembled PDU]"
"216","10.898888","104.244.42.65","192.168.0.183","TCP","1414","443  >  50717 [ACK] Seq=22180 Ack=176554 Win=7930 Len=1360 [TCP segment of a reassembled PDU]"
"217","10.898888","104.244.42.65","192.168.0.183","TCP","1414","443  >  50717 [PSH, ACK] Seq=23540 Ack=176554 Win=7930 Len=1360 [TCP segment of a reassembled PDU]"
"218","10.898888","104.244.42.65","192.168.0.183","TCP","1414","443  >  50717 [ACK] Seq=24900 Ack=176554 Win=7930 Len=1360 [TCP segment of a reassembled PDU]"
"219","10.898888","104.244.42.65","192.168.0.183","TCP","1414","443  >  50717 [PSH, ACK] Seq=26260 Ack=176554 Win=7930 Len=1360 [TCP segment of a reassembled PDU]"
"220","10.898888","104.244.42.65","192.168.0.183","TCP","1414","443  >  50717 [ACK] Seq=27620 Ack=176554 Win=7930 Len=1360 [TCP segment of a reassembled PDU]"
"221","10.898888","104.244.42.65","192.168.0.183","TCP","1414","443  >  50717 [PSH, ACK] Seq=28980 Ack=176554 Win=7930 Len=1360 [TCP segment of a reassembled PDU]"
"222","10.898888","104.244.42.65","192.168.0.183","TCP","1414","443  >  50717 [ACK] Seq=30340 Ack=176554 Win=7930 Len=1360 [TCP segment of a reassembled PDU]"
"223","10.898888","104.244.42.65","192.168.0.183","TCP","1414","443  >  50717 [PSH, ACK] Seq=31700 Ack=176554 Win=7930 Len=1360 [TCP segment of a reassembled PDU]"
"224","10.898888","104.244.42.65","192.168.0.183","TLSv1.2","1414","Application Data"
"225","10.898888","104.244.42.65","192.168.0.183","TCP","1414","443  >  50717 [PSH, ACK] Seq=34420 Ack=176554 Win=7930 Len=1360 [TCP segment of a reassembled PDU]"
"226","10.898888","104.244.42.65","192.168.0.183","TCP","1414","443  >  50717 [ACK] Seq=35780 Ack=176554 Win=7930 Len=1360 [TCP segment of a reassembled PDU]"
"227","10.898888","104.244.42.65","192.168.0.183","TCP","1414","443  >  50717 [PSH, ACK] Seq=37140 Ack=176554 Win=7930 Len=1360 [TCP segment of a reassembled PDU]"
"228","10.898888","104.244.42.65","192.168.0.183","TCP","1414","443  >  50717 [ACK] Seq=38500 Ack=176554 Win=7930 Len=1360 [TCP segment of a reassembled PDU]"
"229","10.898888","104.244.42.65","192.168.0.183","TCP","1414","443  >  50717 [PSH, ACK] Seq=39860 Ack=176554 Win=7930 Len=1360 [TCP segment of a reassembled PDU]"
"230","10.898888","104.244.42.65","192.168.0.183","TCP","1414","443  >  50717 [ACK] Seq=41220 Ack=176554 Win=7930 Len=1360 [TCP segment of a reassembled PDU]"
"231","10.898888","104.244.42.65","192.168.0.183","TCP","1414","443  >  50717 [PSH, ACK] Seq=42580 Ack=176554 Win=7930 Len=1360 [TCP segment of a reassembled PDU]"
"232","10.898888","104.244.42.65","192.168.0.183","TCP","1414","443  >  50717 [ACK] Seq=43940 Ack=176554 Win=7930 Len=1360 [TCP segment of a reassembled PDU]"
"233","10.898888","104.244.42.65","192.168.0.183","TCP","1414","443  >  50717 [PSH, ACK] Seq=45300 Ack=176554 Win=7930 Len=1360 [TCP segment of a reassembled PDU]"
"234","10.898888","104.244.42.65","192.168.0.183","TCP","1414","443  >  50717 [ACK] Seq=46660 Ack=176554 Win=7930 Len=1360 [TCP segment of a reassembled PDU]"
"235","10.898888","104.244.42.65","192.168.0.183","TLSv1.2","517","Application Data"
"236","10.899010","192.168.0.183","104.244.42.65","TCP","54","50717  >  443 [ACK] Seq=176554 Ack=48483 Win=1041 Len=0"
"237","10.900133","192.168.0.183","104.244.42.65","TLSv1.2","89","Application Data"
"238","10.940850","104.244.42.65","192.168.0.183","TCP","60","443  >  50717 [ACK] Seq=48483 Ack=176589 Win=7930 Len=0"
"239","12.881035","192.168.0.183","104.244.42.65","TLSv1.2","235","Application Data"
"240","12.881187","192.168.0.183","104.244.42.65","TCP","1414","50717  >  443 [ACK] Seq=176770 Ack=48483 Win=1041 Len=1360 [TCP segment of a reassembled PDU]"
"241","12.881187","192.168.0.183","104.244.42.65","TCP","1414","50717  >  443 [ACK] Seq=178130 Ack=48483 Win=1041 Len=1360 [TCP segment of a reassembled PDU]"
"242","12.881187","192.168.0.183","104.244.42.65","TCP","1414","50717  >  443 [ACK] Seq=179490 Ack=48483 Win=1041 Len=1360 [TCP segment of a reassembled PDU]"
"243","12.881187","192.168.0.183","104.244.42.65","TCP","1414","50717  >  443 [ACK] Seq=180850 Ack=48483 Win=1041 Len=1360 [TCP segment of a reassembled PDU]"
"244","12.881187","192.168.0.183","104.244.42.65","TCP","1414","50717  >  443 [ACK] Seq=182210 Ack=48483 Win=1041 Len=1360 [TCP segment of a reassembled PDU]"
"245","12.881187","192.168.0.183","104.244.42.65","TLSv1.2","837","Application Data"
"246","12.921315","104.244.42.65","192.168.0.183","TCP","60","443  >  50717 [ACK] Seq=48483 Ack=178130 Win=7928 Len=0"
"247","12.924791","104.244.42.65","192.168.0.183","TCP","60","443  >  50717 [ACK] Seq=48483 Ack=184353 Win=7918 Len=0"
"248","12.952582","104.244.42.65","192.168.0.183","TLSv1.2","184","Application Data"
"249","13.002741","192.168.0.183","104.244.42.65","TCP","54","50717  >  443 [ACK] Seq=184353 Ack=48613 Win=1040 Len=0"
"250","15.879394","192.168.0.183","104.244.42.65","TLSv1.2","764","Application Data"
"251","15.879530","192.168.0.183","104.244.42.65","TCP","1414","50717  >  443 [ACK] Seq=185063 Ack=48613 Win=1040 Len=1360 [TCP segment of a reassembled PDU]"
"252","15.879530","192.168.0.183","104.244.42.65","TCP","1414","50717  >  443 [ACK] Seq=186423 Ack=48613 Win=1040 Len=1360 [TCP segment of a reassembled PDU]"
"253","15.879530","192.168.0.183","104.244.42.65","TCP","1414","50717  >  443 [ACK] Seq=187783 Ack=48613 Win=1040 Len=1360 [TCP segment of a reassembled PDU]"
"254","15.879530","192.168.0.183","104.244.42.65","TCP","1414","50717  >  443 [ACK] Seq=189143 Ack=48613 Win=1040 Len=1360 [TCP segment of a reassembled PDU]"
"255","15.879530","192.168.0.183","104.244.42.65","TCP","1414","50717  >  443 [ACK] Seq=190503 Ack=48613 Win=1040 Len=1360 [TCP segment of a reassembled PDU]"
"256","15.879530","192.168.0.183","104.244.42.65","TCP","1414","50717  >  443 [ACK] Seq=191863 Ack=48613 Win=1040 Len=1360 [TCP segment of a reassembled PDU]"
"257","15.879530","192.168.0.183","104.244.42.65","TCP","1414","50717  >  443 [ACK] Seq=193223 Ack=48613 Win=1040 Len=1360 [TCP segment of a reassembled PDU]"
"258","15.879530","192.168.0.183","104.244.42.65","TCP","1414","50717  >  443 [ACK] Seq=194583 Ack=48613 Win=1040 Len=1360 [TCP segment of a reassembled PDU]"
"259","15.879530","192.168.0.183","104.244.42.65","TCP","1414","50717  >  443 [ACK] Seq=195943 Ack=48613 Win=1040 Len=1360 [TCP segment of a reassembled PDU]"
"260","15.879530","192.168.0.183","104.244.42.65","TCP","1414","50717  >  443 [ACK] Seq=197303 Ack=48613 Win=1040 Len=1360 [TCP segment of a reassembled PDU]"
"261","15.879530","192.168.0.183","104.244.42.65","TCP","1414","50717  >  443 [ACK] Seq=198663 Ack=48613 Win=1040 Len=1360 [TCP segment of a reassembled PDU]"
"262","15.879530","192.168.0.183","104.244.42.65","TCP","1414","50717  >  443 [ACK] Seq=200023 Ack=48613 Win=1040 Len=1360 [TCP segment of a reassembled PDU]"
"263","15.879530","192.168.0.183","104.244.42.65","TLSv1.2","140","Application Data"
"264","15.879729","192.168.0.183","104.244.42.65","TCP","1414","50717  >  443 [ACK] Seq=201469 Ack=48613 Win=1040 Len=1360 [TCP segment of a reassembled PDU]"
"265","15.879729","192.168.0.183","104.244.42.65","TCP","1414","50717  >  443 [ACK] Seq=202829 Ack=48613 Win=1040 Len=1360 [TCP segment of a reassembled PDU]"
"266","15.879729","192.168.0.183","104.244.42.65","TCP","1414","50717  >  443 [ACK] Seq=204189 Ack=48613 Win=1040 Len=1360 [TCP segment of a reassembled PDU]"
"267","15.879729","192.168.0.183","104.244.42.65","TCP","1414","50717  >  443 [ACK] Seq=205549 Ack=48613 Win=1040 Len=1360 [TCP segment of a reassembled PDU]"
"268","15.879729","192.168.0.183","104.244.42.65","TCP","1414","50717  >  443 [ACK] Seq=206909 Ack=48613 Win=1040 Len=1360 [TCP segment of a reassembled PDU]"
"269","15.879729","192.168.0.183","104.244.42.65","TCP","1414","50717  >  443 [ACK] Seq=208269 Ack=48613 Win=1040 Len=1360 [TCP segment of a reassembled PDU]"
"270","15.879729","192.168.0.183","104.244.42.65","TCP","1414","50717  >  443 [ACK] Seq=209629 Ack=48613 Win=1040 Len=1360 [TCP segment of a reassembled PDU]"
"271","15.879729","192.168.0.183","104.244.42.65","TCP","1414","50717  >  443 [ACK] Seq=210989 Ack=48613 Win=1040 Len=1360 [TCP segment of a reassembled PDU]"
"272","15.879729","192.168.0.183","104.244.42.65","TCP","1414","50717  >  443 [ACK] Seq=212349 Ack=48613 Win=1040 Len=1360 [TCP segment of a reassembled PDU]"
"273","15.879729","192.168.0.183","104.244.42.65","TCP","1414","50717  >  443 [ACK] Seq=213709 Ack=48613 Win=1040 Len=1360 [TCP segment of a reassembled PDU]"
"274","15.879729","192.168.0.183","104.244.42.65","TCP","1414","50717  >  443 [ACK] Seq=215069 Ack=48613 Win=1040 Len=1360 [TCP segment of a reassembled PDU]"
"275","15.879729","192.168.0.183","104.244.42.65","TCP","1414","50717  >  443 [ACK] Seq=216429 Ack=48613 Win=1040 Len=1360 [TCP segment of a reassembled PDU]"
"276","15.879729","192.168.0.183","104.244.42.65","TLSv1.2","140","Application Data"
"277","15.879926","192.168.0.183","104.244.42.65","TCP","1414","50717  >  443 [ACK] Seq=217875 Ack=48613 Win=1040 Len=1360 [TCP segment of a reassembled PDU]"
"278","15.879926","192.168.0.183","104.244.42.65","TCP","1414","50717  >  443 [ACK] Seq=219235 Ack=48613 Win=1040 Len=1360 [TCP segment of a reassembled PDU]"
"279","15.879926","192.168.0.183","104.244.42.65","TCP","1414","50717  >  443 [ACK] Seq=220595 Ack=48613 Win=1040 Len=1360 [TCP segment of a reassembled PDU]"
"280","15.879926","192.168.0.183","104.244.42.65","TCP","1414","50717  >  443 [ACK] Seq=221955 Ack=48613 Win=1040 Len=1360 [TCP segment of a reassembled PDU]"
"281","15.879926","192.168.0.183","104.244.42.65","TCP","1414","50717  >  443 [ACK] Seq=223315 Ack=48613 Win=1040 Len=1360 [TCP segment of a reassembled PDU]"
"282","15.879926","192.168.0.183","104.244.42.65","TCP","1414","50717  >  443 [ACK] Seq=224675 Ack=48613 Win=1040 Len=1360 [TCP segment of a reassembled PDU]"
"283","15.879926","192.168.0.183","104.244.42.65","TCP","1414","50717  >  443 [ACK] Seq=226035 Ack=48613 Win=1040 Len=1360 [TCP segment of a reassembled PDU]"
"284","15.879926","192.168.0.183","104.244.42.65","TCP","1414","50717  >  443 [ACK] Seq=227395 Ack=48613 Win=1040 Len=1360 [TCP segment of a reassembled PDU]"
"285","15.879926","192.168.0.183","104.244.42.65","TLSv1.2","330","Application Data"
"286","15.924555","104.244.42.65","192.168.0.183","TCP","60","443  >  50717 [ACK] Seq=48613 Ack=186423 Win=7928 Len=0"
"287","15.930300","104.244.42.65","192.168.0.183","TCP","60","443  >  50717 [ACK] Seq=48613 Ack=229031 Win=7930 Len=0"
"288","15.930300","104.244.42.65","192.168.0.183","TLSv1.2","89","Application Data"
"289","15.973900","104.244.42.65","192.168.0.183","TLSv1.2","184","Application Data"
"290","15.973935","192.168.0.183","104.244.42.65","TCP","54","50717  >  443 [ACK] Seq=229031 Ack=48778 Win=1040 Len=0"
"291","18.012048","192.168.0.183","104.244.42.65","TLSv1.2","243","Application Data"
"292","18.012141","192.168.0.183","104.244.42.65","TCP","1414","50717  >  443 [ACK] Seq=229220 Ack=48778 Win=1040 Len=1360 [TCP segment of a reassembled PDU]"
"293","18.012141","192.168.0.183","104.244.42.65","TCP","1414","50717  >  443 [ACK] Seq=230580 Ack=48778 Win=1040 Len=1360 [TCP segment of a reassembled PDU]"
"294","18.012141","192.168.0.183","104.244.42.65","TLSv1.2","280","Application Data"
"295","18.050917","104.244.42.65","192.168.0.183","TCP","60","443  >  50717 [ACK] Seq=48778 Ack=231940 Win=7923 Len=0"
"296","18.076768","104.244.42.65","192.168.0.183","TLSv1.2","220","Application Data"
"297","18.118823","192.168.0.183","104.244.42.65","TCP","54","50717  >  443 [ACK] Seq=232166 Ack=48944 Win=1039 Len=0"
"298","19.341723","192.168.0.183","104.244.42.65","TLSv1.2","305","Application Data"
"299","19.341789","192.168.0.183","104.244.42.65","TLSv1.2","168","Application Data"
"300","19.378579","104.244.42.65","192.168.0.183","TCP","60","443  >  50717 [ACK] Seq=48944 Ack=232531 Win=7930 Len=0"
"301","19.447412","104.244.42.65","192.168.0.183","TLSv1.2","339","Application Data"
"302","19.448746","192.168.0.183","104.244.42.65","TLSv1.2","89","Application Data"
"303","19.525501","104.244.42.65","192.168.0.183","TCP","60","443  >  50717 [ACK] Seq=49229 Ack=232566 Win=7930 Len=0"
"304","21.025612","192.168.0.183","104.244.42.65","TLSv1.2","328","Application Data"
"305","21.025753","192.168.0.183","104.244.42.65","TCP","1414","50717  >  443 [ACK] Seq=232840 Ack=49229 Win=1038 Len=1360 [TCP segment of a reassembled PDU]"
"306","21.025753","192.168.0.183","104.244.42.65","TCP","1414","50717  >  443 [ACK] Seq=234200 Ack=49229 Win=1038 Len=1360 [TCP segment of a reassembled PDU]"
"307","21.025753","192.168.0.183","104.244.42.65","TCP","1414","50717  >  443 [ACK] Seq=235560 Ack=49229 Win=1038 Len=1360 [TCP segment of a reassembled PDU]"
"308","21.025753","192.168.0.183","104.244.42.65","TCP","1414","50717  >  443 [ACK] Seq=236920 Ack=49229 Win=1038 Len=1360 [TCP segment of a reassembled PDU]"
"309","21.025753","192.168.0.183","104.244.42.65","TCP","1414","50717  >  443 [ACK] Seq=238280 Ack=49229 Win=1038 Len=1360 [TCP segment of a reassembled PDU]"
"310","21.025753","192.168.0.183","104.244.42.65","TCP","1414","50717  >  443 [ACK] Seq=239640 Ack=49229 Win=1038 Len=1360 [TCP segment of a reassembled PDU]"
"311","21.025753","192.168.0.183","104.244.42.65","TCP","1414","50717  >  443 [ACK] Seq=241000 Ack=49229 Win=1038 Len=1360 [TCP segment of a reassembled PDU]"
"312","21.025753","192.168.0.183","104.244.42.65","TCP","1414","50717  >  443 [ACK] Seq=242360 Ack=49229 Win=1038 Len=1360 [TCP segment of a reassembled PDU]"
"313","21.025753","192.168.0.183","104.244.42.65","TCP","1414","50717  >  443 [ACK] Seq=243720 Ack=49229 Win=1038 Len=1360 [TCP segment of a reassembled PDU]"
"314","21.025753","192.168.0.183","104.244.42.65","TCP","1414","50717  >  443 [ACK] Seq=245080 Ack=49229 Win=1038 Len=1360 [TCP segment of a reassembled PDU]"
"315","21.025753","192.168.0.183","104.244.42.65","TCP","1414","50717  >  443 [ACK] Seq=246440 Ack=49229 Win=1038 Len=1360 [TCP segment of a reassembled PDU]"
"316","21.025753","192.168.0.183","104.244.42.65","TCP","1414","50717  >  443 [ACK] Seq=247800 Ack=49229 Win=1038 Len=1360 [TCP segment of a reassembled PDU]"
"317","21.025753","192.168.0.183","104.244.42.65","TLSv1.2","140","Application Data"
"318","21.025900","192.168.0.183","104.244.42.65","TCP","1414","50717  >  443 [ACK] Seq=249246 Ack=49229 Win=1038 Len=1360 [TCP segment of a reassembled PDU]"
"319","21.025900","192.168.0.183","104.244.42.65","TCP","1414","50717  >  443 [ACK] Seq=250606 Ack=49229 Win=1038 Len=1360 [TCP segment of a reassembled PDU]"
"320","21.025900","192.168.0.183","104.244.42.65","TCP","1414","50717  >  443 [ACK] Seq=251966 Ack=49229 Win=1038 Len=1360 [TCP segment of a reassembled PDU]"
"321","21.025900","192.168.0.183","104.244.42.65","TCP","1414","50717  >  443 [ACK] Seq=253326 Ack=49229 Win=1038 Len=1360 [TCP segment of a reassembled PDU]"
"322","21.025900","192.168.0.183","104.244.42.65","TCP","1414","50717  >  443 [ACK] Seq=254686 Ack=49229 Win=1038 Len=1360 [TCP segment of a reassembled PDU]"
"323","21.025900","192.168.0.183","104.244.42.65","TCP","1414","50717  >  443 [ACK] Seq=256046 Ack=49229 Win=1038 Len=1360 [TCP segment of a reassembled PDU]"
"324","21.025900","192.168.0.183","104.244.42.65","TCP","1414","50717  >  443 [ACK] Seq=257406 Ack=49229 Win=1038 Len=1360 [TCP segment of a reassembled PDU]"
"325","21.025900","192.168.0.183","104.244.42.65","TCP","1414","50717  >  443 [ACK] Seq=258766 Ack=49229 Win=1038 Len=1360 [TCP segment of a reassembled PDU]"
"326","21.025900","192.168.0.183","104.244.42.65","TCP","1414","50717  >  443 [ACK] Seq=260126 Ack=49229 Win=1038 Len=1360 [TCP segment of a reassembled PDU]"
"327","21.025900","192.168.0.183","104.244.42.65","TCP","1414","50717  >  443 [ACK] Seq=261486 Ack=49229 Win=1038 Len=1360 [TCP segment of a reassembled PDU]"
"328","21.025900","192.168.0.183","104.244.42.65","TCP","1414","50717  >  443 [ACK] Seq=262846 Ack=49229 Win=1038 Len=1360 [TCP segment of a reassembled PDU]"
"329","21.025900","192.168.0.183","104.244.42.65","TCP","1414","50717  >  443 [ACK] Seq=264206 Ack=49229 Win=1038 Len=1360 [TCP segment of a reassembled PDU]"
"330","21.025900","192.168.0.183","104.244.42.65","TLSv1.2","140","Application Data"
"331","21.026045","192.168.0.183","104.244.42.65","TCP","1414","50717  >  443 [ACK] Seq=265652 Ack=49229 Win=1038 Len=1360 [TCP segment of a reassembled PDU]"
"332","21.026045","192.168.0.183","104.244.42.65","TCP","1414","50717  >  443 [ACK] Seq=267012 Ack=49229 Win=1038 Len=1360 [TCP segment of a reassembled PDU]"
"333","21.026045","192.168.0.183","104.244.42.65","TCP","1414","50717  >  443 [ACK] Seq=268372 Ack=49229 Win=1038 Len=1360 [TCP segment of a reassembled PDU]"
"334","21.026045","192.168.0.183","104.244.42.65","TCP","1414","50717  >  443 [ACK] Seq=269732 Ack=49229 Win=1038 Len=1360 [TCP segment of a reassembled PDU]"
"335","21.026045","192.168.0.183","104.244.42.65","TCP","1414","50717  >  443 [ACK] Seq=271092 Ack=49229 Win=1038 Len=1360 [TCP segment of a reassembled PDU]"
"336","21.026045","192.168.0.183","104.244.42.65","TCP","1414","50717  >  443 [ACK] Seq=272452 Ack=49229 Win=1038 Len=1360 [TCP segment of a reassembled PDU]"
"337","21.026045","192.168.0.183","104.244.42.65","TLSv1.2","1037","Application Data"
"338","21.058566","192.168.0.183","104.244.42.65","TLSv1.2","667","Application Data"
"339","21.058665","192.168.0.183","104.244.42.65","TLSv1.2","1066","Application Data"
"340","21.063255","104.244.42.65","192.168.0.183","TCP","60","443  >  50717 [ACK] Seq=49229 Ack=235560 Win=7923 Len=0"
"341","21.069105","104.244.42.65","192.168.0.183","TCP","60","443  >  50717 [ACK] Seq=49229 Ack=274795 Win=7925 Len=0"
"342","21.069105","104.244.42.65","192.168.0.183","TLSv1.2","89","Application Data"
"343","21.096164","104.244.42.65","192.168.0.183","TCP","60","443  >  50717 [ACK] Seq=49264 Ack=276420 Win=7929 Len=0"
"344","21.111309","104.244.42.65","192.168.0.183","TLSv1.2","207","Application Data"
"345","21.111346","192.168.0.183","104.244.42.65","TCP","54","50717  >  443 [ACK] Seq=276420 Ack=49417 Win=1037 Len=0"
"346","21.122536","104.244.42.65","192.168.0.183","TLSv1.2","138","Application Data"
"347","21.175410","192.168.0.183","104.244.42.65","TCP","54","50717  >  443 [ACK] Seq=276420 Ack=49501 Win=1037 Len=0"
"348","21.639112","192.168.0.183","104.244.42.65","TLSv1.2","929","Application Data"
"349","21.639369","192.168.0.183","104.244.42.65","TLSv1.2","248","Application Data"
"350","21.676780","104.244.42.65","192.168.0.183","TCP","60","443  >  50717 [ACK] Seq=49501 Ack=277489 Win=7930 Len=0"
"351","21.703461","104.244.42.65","192.168.0.183","TLSv1.2","334","Application Data"
"352","21.712444","104.244.42.65","192.168.0.183","TLSv1.2","565","Application Data"
"353","21.712481","192.168.0.183","104.244.42.65","TCP","54","50717  >  443 [ACK] Seq=277489 Ack=50292 Win=1041 Len=0"
"354","24.465317","192.168.0.183","104.244.42.65","TLSv1.2","246","Application Data"
"355","24.465481","192.168.0.183","104.244.42.65","TLSv1.2","168","Application Data"
"356","24.467299","192.168.0.183","104.244.42.65","TLSv1.2","765","Application Data"
"357","24.467457","192.168.0.183","104.244.42.65","TCP","1414","50717  >  443 [ACK] Seq=278506 Ack=50292 Win=1041 Len=1360 [TCP segment of a reassembled PDU]"
"358","24.467457","192.168.0.183","104.244.42.65","TCP","1414","50717  >  443 [ACK] Seq=279866 Ack=50292 Win=1041 Len=1360 [TCP segment of a reassembled PDU]"
"359","24.467457","192.168.0.183","104.244.42.65","TCP","1414","50717  >  443 [ACK] Seq=281226 Ack=50292 Win=1041 Len=1360 [TCP segment of a reassembled PDU]"
"360","24.467457","192.168.0.183","104.244.42.65","TCP","1414","50717  >  443 [ACK] Seq=282586 Ack=50292 Win=1041 Len=1360 [TCP segment of a reassembled PDU]"
"361","24.467457","192.168.0.183","104.244.42.65","TCP","1414","50717  >  443 [ACK] Seq=283946 Ack=50292 Win=1041 Len=1360 [TCP segment of a reassembled PDU]"
"362","24.467457","192.168.0.183","104.244.42.65","TCP","1414","50717  >  443 [ACK] Seq=285306 Ack=50292 Win=1041 Len=1360 [TCP segment of a reassembled PDU]"
"363","24.467457","192.168.0.183","104.244.42.65","TCP","1414","50717  >  443 [ACK] Seq=286666 Ack=50292 Win=1041 Len=1360 [TCP segment of a reassembled PDU]"
"364","24.467457","192.168.0.183","104.244.42.65","TCP","1414","50717  >  443 [ACK] Seq=288026 Ack=50292 Win=1041 Len=1360 [TCP segment of a reassembled PDU]"
"365","24.467457","192.168.0.183","104.244.42.65","TCP","1414","50717  >  443 [ACK] Seq=289386 Ack=50292 Win=1041 Len=1360 [TCP segment of a reassembled PDU]"
"366","24.467457","192.168.0.183","104.244.42.65","TCP","1414","50717  >  443 [ACK] Seq=290746 Ack=50292 Win=1041 Len=1360 [TCP segment of a reassembled PDU]"
"367","24.467457","192.168.0.183","104.244.42.65","TCP","1414","50717  >  443 [ACK] Seq=292106 Ack=50292 Win=1041 Len=1360 [TCP segment of a reassembled PDU]"
"368","24.467457","192.168.0.183","104.244.42.65","TCP","1414","50717  >  443 [ACK] Seq=293466 Ack=50292 Win=1041 Len=1360 [TCP segment of a reassembled PDU]"
"369","24.467457","192.168.0.183","104.244.42.65","TLSv1.2","140","Application Data"
"370","24.467626","192.168.0.183","104.244.42.65","TCP","1414","50717  >  443 [ACK] Seq=294912 Ack=50292 Win=1041 Len=1360 [TCP segment of a reassembled PDU]"
"371","24.467626","192.168.0.183","104.244.42.65","TCP","1414","50717  >  443 [ACK] Seq=296272 Ack=50292 Win=1041 Len=1360 [TCP segment of a reassembled PDU]"
"372","24.467626","192.168.0.183","104.244.42.65","TCP","1414","50717  >  443 [ACK] Seq=297632 Ack=50292 Win=1041 Len=1360 [TCP segment of a reassembled PDU]"
"373","24.467626","192.168.0.183","104.244.42.65","TLSv1.2","410","Application Data"
"374","24.504321","104.244.42.65","192.168.0.183","TCP","60","443  >  50717 [ACK] Seq=50292 Ack=277795 Win=7930 Len=0"
"375","24.508501","104.244.42.65","192.168.0.183","TCP","60","443  >  50717 [ACK] Seq=50292 Ack=299348 Win=7930 Len=0"
"376","24.537059","104.244.42.65","192.168.0.183","TLSv1.2","180","Application Data"
"377","24.577234","104.244.42.65","192.168.0.183","TLSv1.2","229","Application Data"
"378","24.577291","192.168.0.183","104.244.42.65","TCP","54","50717  >  443 [ACK] Seq=299348 Ack=50593 Win=1040 Len=0"
"379","24.578394","192.168.0.183","104.244.42.65","TLSv1.2","89","Application Data"
"380","24.660383","104.244.42.65","192.168.0.183","TCP","60","443  >  50717 [ACK] Seq=50593 Ack=299383 Win=7930 Len=0"
"381","24.774215","192.168.0.183","104.244.42.65","TLSv1.2","245","Application Data"
"382","24.774322","192.168.0.183","104.244.42.65","TLSv1.2","393","Application Data"
"383","24.816484","104.244.42.65","192.168.0.183","TCP","60","443  >  50717 [ACK] Seq=50593 Ack=299913 Win=7929 Len=0"
"384","24.831838","104.244.42.65","192.168.0.183","TLSv1.2","138","Application Data"
"385","24.877615","192.168.0.183","104.244.42.65","TCP","54","50717  >  443 [ACK] Seq=299913 Ack=50677 Win=1039 Len=0"
"386","26.531041","192.168.0.183","104.244.42.65","TCP","1414","50717  >  443 [ACK] Seq=299913 Ack=50677 Win=1039 Len=1360 [TCP segment of a reassembled PDU]"
"387","26.531041","192.168.0.183","104.244.42.65","TLSv1.2","283","Application Data"
"388","26.571609","104.244.42.65","192.168.0.183","TCP","60","443  >  50717 [ACK] Seq=50677 Ack=301502 Win=7927 Len=0"
"389","27.412815","104.244.42.65","192.168.0.183","TCP","1414","443  >  50717 [ACK] Seq=50677 Ack=301502 Win=7930 Len=1360 [TCP segment of a reassembled PDU]"
"390","27.412815","104.244.42.65","192.168.0.183","TCP","1414","443  >  50717 [ACK] Seq=52037 Ack=301502 Win=7930 Len=1360 [TCP segment of a reassembled PDU]"
"391","27.412815","104.244.42.65","192.168.0.183","TCP","1414","443  >  50717 [PSH, ACK] Seq=53397 Ack=301502 Win=7930 Len=1360 [TCP segment of a reassembled PDU]"
"392","27.412815","104.244.42.65","192.168.0.183","TCP","1414","443  >  50717 [ACK] Seq=54757 Ack=301502 Win=7930 Len=1360 [TCP segment of a reassembled PDU]"
"393","27.412815","104.244.42.65","192.168.0.183","TCP","1414","443  >  50717 [ACK] Seq=56117 Ack=301502 Win=7930 Len=1360 [TCP segment of a reassembled PDU]"
"394","27.412815","104.244.42.65","192.168.0.183","TLSv1.2","1153","Application Data"
"395","27.413054","192.168.0.183","104.244.42.65","TCP","54","50717  >  443 [ACK] Seq=301502 Ack=58576 Win=1041 Len=0"
"396","27.886261","192.168.0.183","104.244.42.65","TLSv1.2","328","Application Data"
"397","27.886526","192.168.0.183","104.244.42.65","TCP","1414","50717  >  443 [ACK] Seq=301776 Ack=58576 Win=1041 Len=1360 [TCP segment of a reassembled PDU]"
"398","27.886526","192.168.0.183","104.244.42.65","TCP","1414","50717  >  443 [ACK] Seq=303136 Ack=58576 Win=1041 Len=1360 [TCP segment of a reassembled PDU]"
"399","27.886526","192.168.0.183","104.244.42.65","TCP","1414","50717  >  443 [ACK] Seq=304496 Ack=58576 Win=1041 Len=1360 [TCP segment of a reassembled PDU]"
"400","27.886526","192.168.0.183","104.244.42.65","TCP","1414","50717  >  443 [ACK] Seq=305856 Ack=58576 Win=1041 Len=1360 [TCP segment of a reassembled PDU]"
"401","27.886526","192.168.0.183","104.244.42.65","TCP","1414","50717  >  443 [ACK] Seq=307216 Ack=58576 Win=1041 Len=1360 [TCP segment of a reassembled PDU]"
"402","27.886526","192.168.0.183","104.244.42.65","TCP","1414","50717  >  443 [ACK] Seq=308576 Ack=58576 Win=1041 Len=1360 [TCP segment of a reassembled PDU]"
"403","27.886526","192.168.0.183","104.244.42.65","TCP","1414","50717  >  443 [ACK] Seq=309936 Ack=58576 Win=1041 Len=1360 [TCP segment of a reassembled PDU]"
"404","27.886526","192.168.0.183","104.244.42.65","TCP","1414","50717  >  443 [ACK] Seq=311296 Ack=58576 Win=1041 Len=1360 [TCP segment of a reassembled PDU]"
"405","27.886526","192.168.0.183","104.244.42.65","TCP","1414","50717  >  443 [ACK] Seq=312656 Ack=58576 Win=1041 Len=1360 [TCP segment of a reassembled PDU]"
"406","27.886526","192.168.0.183","104.244.42.65","TLSv1.2","1395","Application Data"
"407","27.933360","104.244.42.65","192.168.0.183","TCP","60","443  >  50717 [ACK] Seq=58576 Ack=303136 Win=7927 Len=0"
"408","27.933360","104.244.42.65","192.168.0.183","TCP","60","443  >  50717 [ACK] Seq=58576 Ack=315357 Win=7930 Len=0"
"409","27.961309","104.244.42.65","192.168.0.183","TLSv1.2","138","Application Data"
"410","28.007824","192.168.0.183","104.244.42.65","TCP","54","50717  >  443 [ACK] Seq=315357 Ack=58660 Win=1040 Len=0"
"411","28.041393","192.168.0.183","104.244.42.65","TCP","1414","50717  >  443 [ACK] Seq=315357 Ack=58660 Win=1040 Len=1360 [TCP segment of a reassembled PDU]"
"412","28.041393","192.168.0.183","104.244.42.65","TLSv1.2","741","Application Data"
"413","28.070358","192.168.0.183","104.244.42.65","TLSv1.2","250","Application Data"
"414","28.070520","192.168.0.183","104.244.42.65","TLSv1.2","168","Application Data"
"415","28.085141","104.244.42.65","192.168.0.183","TCP","60","443  >  50717 [ACK] Seq=58660 Ack=317404 Win=7926 Len=0"
"416","28.117938","104.244.42.65","192.168.0.183","TCP","60","443  >  50717 [ACK] Seq=58660 Ack=317714 Win=7930 Len=0"
"417","28.190363","104.244.42.65","192.168.0.183","TLSv1.2","233","Application Data"
"418","28.241818","192.168.0.183","104.244.42.65","TCP","54","50717  >  443 [ACK] Seq=317714 Ack=58839 Win=1040 Len=0"
"419","28.806726","104.244.42.65","192.168.0.183","TCP","1414","443  >  50717 [ACK] Seq=58839 Ack=317714 Win=7930 Len=1360 [TCP segment of a reassembled PDU]"
"420","28.806726","104.244.42.65","192.168.0.183","TCP","1414","443  >  50717 [ACK] Seq=60199 Ack=317714 Win=7930 Len=1360 [TCP segment of a reassembled PDU]"
"421","28.806726","104.244.42.65","192.168.0.183","TCP","1414","443  >  50717 [PSH, ACK] Seq=61559 Ack=317714 Win=7930 Len=1360 [TCP segment of a reassembled PDU]"
"422","28.806726","104.244.42.65","192.168.0.183","TCP","1414","443  >  50717 [ACK] Seq=62919 Ack=317714 Win=7930 Len=1360 [TCP segment of a reassembled PDU]"
"423","28.806726","104.244.42.65","192.168.0.183","TCP","1414","443  >  50717 [ACK] Seq=64279 Ack=317714 Win=7930 Len=1360 [TCP segment of a reassembled PDU]"
"424","28.806726","104.244.42.65","192.168.0.183","TCP","1414","443  >  50717 [PSH, ACK] Seq=65639 Ack=317714 Win=7930 Len=1360 [TCP segment of a reassembled PDU]"
"425","28.806726","104.244.42.65","192.168.0.183","TLSv1.2","1157","Application Data"
"426","28.806769","192.168.0.183","104.244.42.65","TCP","54","50717  >  443 [ACK] Seq=317714 Ack=68102 Win=1041 Len=0"
"427","30.518669","192.168.0.183","104.244.42.65","TLSv1.2","282","Application Data"
"428","30.518789","192.168.0.183","104.244.42.65","TCP","1414","50717  >  443 [ACK] Seq=317942 Ack=68102 Win=1041 Len=1360 [TCP segment of a reassembled PDU]"
"429","30.518789","192.168.0.183","104.244.42.65","TCP","1414","50717  >  443 [ACK] Seq=319302 Ack=68102 Win=1041 Len=1360 [TCP segment of a reassembled PDU]"
"430","30.518789","192.168.0.183","104.244.42.65","TCP","1414","50717  >  443 [ACK] Seq=320662 Ack=68102 Win=1041 Len=1360 [TCP segment of a reassembled PDU]"
"431","30.518789","192.168.0.183","104.244.42.65","TCP","1414","50717  >  443 [ACK] Seq=322022 Ack=68102 Win=1041 Len=1360 [TCP segment of a reassembled PDU]"
"432","30.518789","192.168.0.183","104.244.42.65","TCP","1414","50717  >  443 [ACK] Seq=323382 Ack=68102 Win=1041 Len=1360 [TCP segment of a reassembled PDU]"
"433","30.518789","192.168.0.183","104.244.42.65","TCP","1414","50717  >  443 [ACK] Seq=324742 Ack=68102 Win=1041 Len=1360 [TCP segment of a reassembled PDU]"
"434","30.518789","192.168.0.183","104.244.42.65","TCP","1414","50717  >  443 [ACK] Seq=326102 Ack=68102 Win=1041 Len=1360 [TCP segment of a reassembled PDU]"
"435","30.518789","192.168.0.183","104.244.42.65","TCP","1414","50717  >  443 [ACK] Seq=327462 Ack=68102 Win=1041 Len=1360 [TCP segment of a reassembled PDU]"
"436","30.518789","192.168.0.183","104.244.42.65","TCP","1414","50717  >  443 [ACK] Seq=328822 Ack=68102 Win=1041 Len=1360 [TCP segment of a reassembled PDU]"
"437","30.518789","192.168.0.183","104.244.42.65","TCP","1414","50717  >  443 [ACK] Seq=330182 Ack=68102 Win=1041 Len=1360 [TCP segment of a reassembled PDU]"
"438","30.518789","192.168.0.183","104.244.42.65","TCP","1414","50717  >  443 [ACK] Seq=331542 Ack=68102 Win=1041 Len=1360 [TCP segment of a reassembled PDU]"
"439","30.518789","192.168.0.183","104.244.42.65","TCP","1414","50717  >  443 [ACK] Seq=332902 Ack=68102 Win=1041 Len=1360 [TCP segment of a reassembled PDU]"
"440","30.518789","192.168.0.183","104.244.42.65","TLSv1.2","140","Application Data"
"441","30.518915","192.168.0.183","104.244.42.65","TCP","1414","50717  >  443 [ACK] Seq=334348 Ack=68102 Win=1041 Len=1360 [TCP segment of a reassembled PDU]"
"442","30.518915","192.168.0.183","104.244.42.65","TCP","1414","50717  >  443 [ACK] Seq=335708 Ack=68102 Win=1041 Len=1360 [TCP segment of a reassembled PDU]"
"443","30.518915","192.168.0.183","104.244.42.65","TCP","1414","50717  >  443 [ACK] Seq=337068 Ack=68102 Win=1041 Len=1360 [TCP segment of a reassembled PDU]"
"444","30.518915","192.168.0.183","104.244.42.65","TCP","1414","50717  >  443 [ACK] Seq=338428 Ack=68102 Win=1041 Len=1360 [TCP segment of a reassembled PDU]"
"445","30.518915","192.168.0.183","104.244.42.65","TCP","1414","50717  >  443 [ACK] Seq=339788 Ack=68102 Win=1041 Len=1360 [TCP segment of a reassembled PDU]"
"446","30.518915","192.168.0.183","104.244.42.65","TCP","1414","50717  >  443 [ACK] Seq=341148 Ack=68102 Win=1041 Len=1360 [TCP segment of a reassembled PDU]"
"447","30.518915","192.168.0.183","104.244.42.65","TLSv1.2","1364","Application Data"
"448","30.557201","104.244.42.65","192.168.0.183","TCP","60","443  >  50717 [ACK] Seq=68102 Ack=319302 Win=7928 Len=0"
"449","30.564144","104.244.42.65","192.168.0.183","TCP","60","443  >  50717 [ACK] Seq=68102 Ack=343818 Win=7930 Len=0"
"450","30.621971","104.244.42.65","192.168.0.183","TLSv1.2","255","Application Data"
"451","30.675900","192.168.0.183","104.244.42.65","TCP","54","50717  >  443 [ACK] Seq=343818 Ack=68303 Win=1040 Len=0"
"452","33.527197","192.168.0.183","104.244.42.65","TLSv1.2","811","Application Data"
"453","33.527459","192.168.0.183","104.244.42.65","TCP","1414","50717  >  443 [ACK] Seq=344575 Ack=68303 Win=1040 Len=1360 [TCP segment of a reassembled PDU]"
"454","33.527459","192.168.0.183","104.244.42.65","TCP","1414","50717  >  443 [ACK] Seq=345935 Ack=68303 Win=1040 Len=1360 [TCP segment of a reassembled PDU]"
"455","33.527459","192.168.0.183","104.244.42.65","TCP","1414","50717  >  443 [ACK] Seq=347295 Ack=68303 Win=1040 Len=1360 [TCP segment of a reassembled PDU]"
"456","33.527459","192.168.0.183","104.244.42.65","TLSv1.2","226","Application Data"
"457","33.565048","104.244.42.65","192.168.0.183","TCP","60","443  >  50717 [ACK] Seq=68303 Ack=345935 Win=7926 Len=0"
"458","33.571079","104.244.42.65","192.168.0.183","TCP","60","443  >  50717 [ACK] Seq=68303 Ack=348827 Win=7930 Len=0"
"459","33.596142","104.244.42.65","192.168.0.183","TLSv1.2","203","Application Data"
"460","33.645186","192.168.0.183","104.244.42.65","TCP","54","50717  >  443 [ACK] Seq=348827 Ack=68452 Win=1039 Len=0"
"461","36.612874","192.168.0.183","104.244.42.65","TLSv1.2","264","Application Data"
"462","36.613120","192.168.0.183","104.244.42.65","TCP","1414","50717  >  443 [ACK] Seq=349037 Ack=68452 Win=1039 Len=1360 [TCP segment of a reassembled PDU]"
"463","36.613120","192.168.0.183","104.244.42.65","TCP","1414","50717  >  443 [ACK] Seq=350397 Ack=68452 Win=1039 Len=1360 [TCP segment of a reassembled PDU]"
"464","36.613120","192.168.0.183","104.244.42.65","TCP","1414","50717  >  443 [ACK] Seq=351757 Ack=68452 Win=1039 Len=1360 [TCP segment of a reassembled PDU]"
"465","36.613120","192.168.0.183","104.244.42.65","TCP","1414","50717  >  443 [ACK] Seq=353117 Ack=68452 Win=1039 Len=1360 [TCP segment of a reassembled PDU]"
"466","36.613120","192.168.0.183","104.244.42.65","TCP","1414","50717  >  443 [ACK] Seq=354477 Ack=68452 Win=1039 Len=1360 [TCP segment of a reassembled PDU]"
"467","36.613120","192.168.0.183","104.244.42.65","TCP","1414","50717  >  443 [ACK] Seq=355837 Ack=68452 Win=1039 Len=1360 [TCP segment of a reassembled PDU]"
"468","36.613120","192.168.0.183","104.244.42.65","TCP","1414","50717  >  443 [ACK] Seq=357197 Ack=68452 Win=1039 Len=1360 [TCP segment of a reassembled PDU]"
"469","36.613120","192.168.0.183","104.244.42.65","TCP","1414","50717  >  443 [ACK] Seq=358557 Ack=68452 Win=1039 Len=1360 [TCP segment of a reassembled PDU]"
"470","36.613120","192.168.0.183","104.244.42.65","TCP","1414","50717  >  443 [ACK] Seq=359917 Ack=68452 Win=1039 Len=1360 [TCP segment of a reassembled PDU]"
"471","36.613120","192.168.0.183","104.244.42.65","TCP","1414","50717  >  443 [ACK] Seq=361277 Ack=68452 Win=1039 Len=1360 [TCP segment of a reassembled PDU]"
"472","36.613120","192.168.0.183","104.244.42.65","TCP","1414","50717  >  443 [ACK] Seq=362637 Ack=68452 Win=1039 Len=1360 [TCP segment of a reassembled PDU]"
"473","36.613120","192.168.0.183","104.244.42.65","TCP","1414","50717  >  443 [ACK] Seq=363997 Ack=68452 Win=1039 Len=1360 [TCP segment of a reassembled PDU]"
"474","36.613120","192.168.0.183","104.244.42.65","TLSv1.2","140","Application Data"
"475","36.613339","192.168.0.183","104.244.42.65","TCP","1414","50717  >  443 [ACK] Seq=365443 Ack=68452 Win=1039 Len=1360 [TCP segment of a reassembled PDU]"
"476","36.613339","192.168.0.183","104.244.42.65","TCP","1414","50717  >  443 [ACK] Seq=366803 Ack=68452 Win=1039 Len=1360 [TCP segment of a reassembled PDU]"
"477","36.613339","192.168.0.183","104.244.42.65","TCP","1414","50717  >  443 [ACK] Seq=368163 Ack=68452 Win=1039 Len=1360 [TCP segment of a reassembled PDU]"
"478","36.613339","192.168.0.183","104.244.42.65","TCP","1414","50717  >  443 [ACK] Seq=369523 Ack=68452 Win=1039 Len=1360 [TCP segment of a reassembled PDU]"
"479","36.613339","192.168.0.183","104.244.42.65","TCP","1414","50717  >  443 [ACK] Seq=370883 Ack=68452 Win=1039 Len=1360 [TCP segment of a reassembled PDU]"
"480","36.613339","192.168.0.183","104.244.42.65","TCP","1414","50717  >  443 [ACK] Seq=372243 Ack=68452 Win=1039 Len=1360 [TCP segment of a reassembled PDU]"
"481","36.613339","192.168.0.183","104.244.42.65","TCP","1414","50717  >  443 [ACK] Seq=373603 Ack=68452 Win=1039 Len=1360 [TCP segment of a reassembled PDU]"
"482","36.613339","192.168.0.183","104.244.42.65","TCP","1414","50717  >  443 [ACK] Seq=374963 Ack=68452 Win=1039 Len=1360 [TCP segment of a reassembled PDU]"
"483","36.613339","192.168.0.183","104.244.42.65","TCP","1414","50717  >  443 [ACK] Seq=376323 Ack=68452 Win=1039 Len=1360 [TCP segment of a reassembled PDU]"
"484","36.613339","192.168.0.183","104.244.42.65","TLSv1.2","70","Application Data"
"485","36.650662","104.244.42.65","192.168.0.183","TCP","60","443  >  50717 [ACK] Seq=68452 Ack=350397 Win=7927 Len=0"
"486","36.658336","104.244.42.65","192.168.0.183","TCP","60","443  >  50717 [ACK] Seq=68452 Ack=377699 Win=7930 Len=0"
"487","36.700194","104.244.42.65","192.168.0.183","TLSv1.2","184","Application Data"
"488","36.754984","192.168.0.183","104.244.42.65","TCP","54","50717  >  443 [ACK] Seq=377699 Ack=68582 Win=1039 Len=0"
"489","39.738143","192.168.0.183","104.244.42.65","TLSv1.2","288","Application Data"
"490","39.817462","104.244.42.65","192.168.0.183","TCP","60","443  >  50717 [ACK] Seq=68582 Ack=377933 Win=7930 Len=0"
"491","40.245375","104.244.42.65","192.168.0.183","TLSv1.2","217","Application Data"
"492","40.287995","192.168.0.183","104.244.42.65","TCP","54","50717  >  443 [ACK] Seq=377933 Ack=68745 Win=1038 Len=0"
