"No.","Time","Source","Destination","Protocol","Length","Info"
"1","0.000000","104.244.42.65","192.168.0.183","TCP","60","443  >  50717 [ACK] Seq=1 Ack=1 Win=5735 Len=0"
"2","0.022356","104.244.42.65","192.168.0.183","TLSv1.2","180","Application Data"
"3","0.063548","192.168.0.183","104.244.42.65","TCP","54","50717  >  443 [ACK] Seq=1203 Ack=127 Win=1038 Len=0"
"4","1.809032","192.168.0.183","104.244.42.65","TCP","1414","50717  >  443 [ACK] Seq=1203 Ack=127 Win=1038 Len=1360 [TCP segment of a reassembled PDU]"
"5","1.809032","192.168.0.183","104.244.42.65","TLSv1.2","421","Application Data"
"6","1.809892","192.168.0.183","104.244.42.65","TLSv1.2","663","Application Data"
"7","1.846257","104.244.42.65","192.168.0.183","TCP","60","443  >  50717 [ACK] Seq=127 Ack=2930 Win=5731 Len=0"
"8","1.888853","104.244.42.65","192.168.0.183","TCP","60","443  >  50717 [ACK] Seq=127 Ack=3539 Win=5735 Len=0"
"9","2.257372","104.244.42.65","192.168.0.183","TLSv1.2","175","Application Data"
"10","2.301643","192.168.0.183","104.244.42.65","TCP","54","50717  >  443 [ACK] Seq=3539 Ack=248 Win=1038 Len=0"
"11","2.776179","104.244.42.65","192.168.0.183","TCP","1414","443  >  50717 [ACK] Seq=248 Ack=3539 Win=5735 Len=1360 [TCP segment of a reassembled PDU]"
"12","2.776179","104.244.42.65","192.168.0.183","TCP","1414","443  >  50717 [PSH, ACK] Seq=1608 Ack=3539 Win=5735 Len=1360 [TCP segment of a reassembled PDU]"
"13","2.776179","104.244.42.65","192.168.0.183","TCP","1414","443  >  50717 [ACK] Seq=2968 Ack=3539 Win=5735 Len=1360 [TCP segment of a reassembled PDU]"
"14","2.776179","104.244.42.65","192.168.0.183","TCP","1414","443  >  50717 [PSH, ACK] Seq=4328 Ack=3539 Win=5735 Len=1360 [TCP segment of a reassembled PDU]"
"15","2.776179","104.244.42.65","192.168.0.183","TCP","1414","443  >  50717 [ACK] Seq=5688 Ack=3539 Win=5735 Len=1360 [TCP segment of a reassembled PDU]"
"16","2.776179","104.244.42.65","192.168.0.183","TCP","1414","443  >  50717 [PSH, ACK] Seq=7048 Ack=3539 Win=5735 Len=1360 [TCP segment of a reassembled PDU]"
"17","2.776179","104.244.42.65","192.168.0.183","TCP","1414","443  >  50717 [ACK] Seq=8408 Ack=3539 Win=5735 Len=1360 [TCP segment of a reassembled PDU]"
"18","2.776179","104.244.42.65","192.168.0.183","TLSv1.2","102","Application Data"
"19","2.776288","192.168.0.183","104.244.42.65","TCP","54","50717  >  443 [ACK] Seq=3539 Ack=9816 Win=1041 Len=0"
"20","2.777210","192.168.0.183","104.244.42.65","TLSv1.2","89","Application Data"
"21","2.812128","104.244.42.65","192.168.0.183","TCP","60","443  >  50717 [ACK] Seq=9816 Ack=3574 Win=5735 Len=0"
"22","2.812128","104.244.42.65","192.168.0.183","TCP","60","[TCP Dup ACK 21#1] 443  >  50717 [ACK] Seq=9816 Ack=3574 Win=5735 Len=0"
"23","3.038031","192.168.0.183","104.244.42.65","TLSv1.2","572","Application Data"
"24","3.038314","192.168.0.183","104.244.42.65","TCP","1414","50717  >  443 [ACK] Seq=4092 Ack=9816 Win=1041 Len=1360 [TCP segment of a reassembled PDU]"
"25","3.038314","192.168.0.183","104.244.42.65","TCP","1414","50717  >  443 [ACK] Seq=5452 Ack=9816 Win=1041 Len=1360 [TCP segment of a reassembled PDU]"
"26","3.038314","192.168.0.183","104.244.42.65","TCP","1414","50717  >  443 [ACK] Seq=6812 Ack=9816 Win=1041 Len=1360 [TCP segment of a reassembled PDU]"
"27","3.038314","192.168.0.183","104.244.42.65","TCP","1414","50717  >  443 [ACK] Seq=8172 Ack=9816 Win=1041 Len=1360 [TCP segment of a reassembled PDU]"
"28","3.038314","192.168.0.183","104.244.42.65","TCP","1414","50717  >  443 [ACK] Seq=9532 Ack=9816 Win=1041 Len=1360 [TCP segment of a reassembled PDU]"
"29","3.038314","192.168.0.183","104.244.42.65","TCP","1414","50717  >  443 [ACK] Seq=10892 Ack=9816 Win=1041 Len=1360 [TCP segment of a reassembled PDU]"
"30","3.038314","192.168.0.183","104.244.42.65","TCP","1414","50717  >  443 [ACK] Seq=12252 Ack=9816 Win=1041 Len=1360 [TCP segment of a reassembled PDU]"
"31","3.038314","192.168.0.183","104.244.42.65","TCP","1414","50717  >  443 [ACK] Seq=13612 Ack=9816 Win=1041 Len=1360 [TCP segment of a reassembled PDU]"
"32","3.038314","192.168.0.183","104.244.42.65","TCP","1414","50717  >  443 [ACK] Seq=14972 Ack=9816 Win=1041 Len=1360 [TCP segment of a reassembled PDU]"
"33","3.038314","192.168.0.183","104.244.42.65","TCP","1414","50717  >  443 [ACK] Seq=16332 Ack=9816 Win=1041 Len=1360 [TCP segment of a reassembled PDU]"
"34","3.038314","192.168.0.183","104.244.42.65","TCP","1414","50717  >  443 [ACK] Seq=17692 Ack=9816 Win=1041 Len=1360 [TCP segment of a reassembled PDU]"
"35","3.038314","192.168.0.183","104.244.42.65","TCP","1414","50717  >  443 [ACK] Seq=19052 Ack=9816 Win=1041 Len=1360 [TCP segment of a reassembled PDU]"
"36","3.038314","192.168.0.183","104.244.42.65","TLSv1.2","140","Application Data"
"37","3.038650","192.168.0.183","104.244.42.65","TCP","1414","50717  >  443 [ACK] Seq=20498 Ack=9816 Win=1041 Len=1360 [TCP segment of a reassembled PDU]"
"38","3.038650","192.168.0.183","104.244.42.65","TCP","1414","50717  >  443 [ACK] Seq=21858 Ack=9816 Win=1041 Len=1360 [TCP segment of a reassembled PDU]"
"39","3.038650","192.168.0.183","104.244.42.65","TCP","1414","50717  >  443 [ACK] Seq=23218 Ack=9816 Win=1041 Len=1360 [TCP segment of a reassembled PDU]"
"40","3.038650","192.168.0.183","104.244.42.65","TCP","1414","50717  >  443 [ACK] Seq=24578 Ack=9816 Win=1041 Len=1360 [TCP segment of a reassembled PDU]"
"41","3.038650","192.168.0.183","104.244.42.65","TCP","1414","50717  >  443 [ACK] Seq=25938 Ack=9816 Win=1041 Len=1360 [TCP segment of a reassembled PDU]"
"42","3.038650","192.168.0.183","104.244.42.65","TCP","1414","50717  >  443 [ACK] Seq=27298 Ack=9816 Win=1041 Len=1360 [TCP segment of a reassembled PDU]"
"43","3.038650","192.168.0.183","104.244.42.65","TCP","1414","50717  >  443 [ACK] Seq=28658 Ack=9816 Win=1041 Len=1360 [TCP segment of a reassembled PDU]"
"44","3.038650","192.168.0.183","104.244.42.65","TCP","1414","50717  >  443 [ACK] Seq=30018 Ack=9816 Win=1041 Len=1360 [TCP segment of a reassembled PDU]"
"45","3.038650","192.168.0.183","104.244.42.65","TCP","1414","50717  >  443 [ACK] Seq=31378 Ack=9816 Win=1041 Len=1360 [TCP segment of a reassembled PDU]"
"46","3.038650","192.168.0.183","104.244.42.65","TCP","1414","50717  >  443 [ACK] Seq=32738 Ack=9816 Win=1041 Len=1360 [TCP segment of a reassembled PDU]"
"47","3.038650","192.168.0.183","104.244.42.65","TCP","1414","50717  >  443 [ACK] Seq=34098 Ack=9816 Win=1041 Len=1360 [TCP segment of a reassembled PDU]"
"48","3.038650","192.168.0.183","104.244.42.65","TCP","1414","50717  >  443 [ACK] Seq=35458 Ack=9816 Win=1041 Len=1360 [TCP segment of a reassembled PDU]"
"49","3.038650","192.168.0.183","104.244.42.65","TLSv1.2","140","Application Data"
"50","3.038799","192.168.0.183","104.244.42.65","TCP","1414","50717  >  443 [ACK] Seq=36904 Ack=9816 Win=1041 Len=1360 [TCP segment of a reassembled PDU]"
"51","3.038799","192.168.0.183","104.244.42.65","TCP","1414","50717  >  443 [ACK] Seq=38264 Ack=9816 Win=1041 Len=1360 [TCP segment of a reassembled PDU]"
"52","3.038799","192.168.0.183","104.244.42.65","TCP","1414","50717  >  443 [ACK] Seq=39624 Ack=9816 Win=1041 Len=1360 [TCP segment of a reassembled PDU]"
"53","3.038799","192.168.0.183","104.244.42.65","TCP","1414","50717  >  443 [ACK] Seq=40984 Ack=9816 Win=1041 Len=1360 [TCP segment of a reassembled PDU]"
"54","3.038799","192.168.0.183","104.244.42.65","TCP","1414","50717  >  443 [ACK] Seq=42344 Ack=9816 Win=1041 Len=1360 [TCP segment of a reassembled PDU]"
"55","3.038799","192.168.0.183","104.244.42.65","TCP","1414","50717  >  443 [ACK] Seq=43704 Ack=9816 Win=1041 Len=1360 [TCP segment of a reassembled PDU]"
"56","3.038799","192.168.0.183","104.244.42.65","TCP","1414","50717  >  443 [ACK] Seq=45064 Ack=9816 Win=1041 Len=1360 [TCP segment of a reassembled PDU]"
"57","3.038799","192.168.0.183","104.244.42.65","TCP","1414","50717  >  443 [ACK] Seq=46424 Ack=9816 Win=1041 Len=1360 [TCP segment of a reassembled PDU]"
"58","3.038799","192.168.0.183","104.244.42.65","TCP","1414","50717  >  443 [ACK] Seq=47784 Ack=9816 Win=1041 Len=1360 [TCP segment of a reassembled PDU]"
"59","3.038799","192.168.0.183","104.244.42.65","TCP","1414","50717  >  443 [ACK] Seq=49144 Ack=9816 Win=1041 Len=1360 [TCP segment of a reassembled PDU]"
"60","3.038799","192.168.0.183","104.244.42.65","TCP","1414","50717  >  443 [ACK] Seq=50504 Ack=9816 Win=1041 Len=1360 [TCP segment of a reassembled PDU]"
"61","3.038799","192.168.0.183","104.244.42.65","TLSv1.2","1186","Application Data"
"62","3.078088","104.244.42.65","192.168.0.183","TCP","60","443  >  50717 [ACK] Seq=9816 Ack=52996 Win=5704 Len=0"
"63","3.079534","104.244.42.65","192.168.0.183","TLSv1.2","89","Application Data"
"64","3.127087","192.168.0.183","104.244.42.65","TCP","54","50717  >  443 [ACK] Seq=52996 Ack=9851 Win=1041 Len=0"
"65","3.129707","104.244.42.65","192.168.0.183","TLSv1.2","218","Application Data"
"66","3.174036","192.168.0.183","104.244.42.65","TCP","54","50717  >  443 [ACK] Seq=52996 Ack=10015 Win=1040 Len=0"
"67","3.482079","192.168.0.183","104.244.42.65","TLSv1.2","369","Application Data"
"68","3.482155","192.168.0.183","104.244.42.65","TLSv1.2","168","Application Data"
"69","3.518169","104.244.42.65","192.168.0.183","TCP","60","443  >  50717 [ACK] Seq=10015 Ack=53425 Win=5735 Len=0"
"70","3.594442","104.244.42.65","192.168.0.183","TLSv1.2","256","Application Data"
"71","3.641562","192.168.0.183","104.244.42.65","TCP","54","50717  >  443 [ACK] Seq=53425 Ack=10217 Win=1039 Len=0"
"72","5.971569","192.168.0.183","104.244.42.65","TLSv1.2","236","Application Data"
"73","5.971704","192.168.0.183","104.244.42.65","TCP","1414","50717  >  443 [ACK] Seq=53607 Ack=10217 Win=1039 Len=1360 [TCP segment of a reassembled PDU]"
"74","5.971704","192.168.0.183","104.244.42.65","TCP","1414","50717  >  443 [ACK] Seq=54967 Ack=10217 Win=1039 Len=1360 [TCP segment of a reassembled PDU]"
"75","5.971704","192.168.0.183","104.244.42.65","TCP","1414","50717  >  443 [ACK] Seq=56327 Ack=10217 Win=1039 Len=1360 [TCP segment of a reassembled PDU]"
"76","5.971704","192.168.0.183","104.244.42.65","TCP","1414","50717  >  443 [ACK] Seq=57687 Ack=10217 Win=1039 Len=1360 [TCP segment of a reassembled PDU]"
"77","5.971704","192.168.0.183","104.244.42.65","TCP","1414","50717  >  443 [ACK] Seq=59047 Ack=10217 Win=1039 Len=1360 [TCP segment of a reassembled PDU]"
"78","5.971704","192.168.0.183","104.244.42.65","TCP","1414","50717  >  443 [ACK] Seq=60407 Ack=10217 Win=1039 Len=1360 [TCP segment of a reassembled PDU]"
"79","5.971704","192.168.0.183","104.244.42.65","TCP","1414","50717  >  443 [ACK] Seq=61767 Ack=10217 Win=1039 Len=1360 [TCP segment of a reassembled PDU]"
"80","5.971704","192.168.0.183","104.244.42.65","TCP","1414","50717  >  443 [ACK] Seq=63127 Ack=10217 Win=1039 Len=1360 [TCP segment of a reassembled PDU]"
"81","5.971704","192.168.0.183","104.244.42.65","TCP","1414","50717  >  443 [ACK] Seq=64487 Ack=10217 Win=1039 Len=1360 [TCP segment of a reassembled PDU]"
"82","5.971704","192.168.0.183","104.244.42.65","TCP","1414","50717  >  443 [ACK] Seq=65847 Ack=10217 Win=1039 Len=1360 [TCP segment of a reassembled PDU]"
"83","5.971704","192.168.0.183","104.244.42.65","TCP","1414","50717  >  443 [ACK] Seq=67207 Ack=10217 Win=1039 Len=1360 [TCP segment of a reassembled PDU]"
"84","5.971704","192.168.0.183","104.244.42.65","TCP","1414","50717  >  443 [ACK] Seq=68567 Ack=10217 Win=1039 Len=1360 [TCP segment of a reassembled PDU]"
"85","5.971704","192.168.0.183","104.244.42.65","TLSv1.2","140","Application Data"
"86","5.971847","192.168.0.183","104.244.42.65","TCP","1414","50717  >  443 [ACK] Seq=70013 Ack=10217 Win=1039 Len=1360 [TCP segment of a reassembled PDU]"
"87","5.971847","192.168.0.183","104.244.42.65","TCP","1414","50717  >  443 [ACK] Seq=71373 Ack=10217 Win=1039 Len=1360 [TCP segment of a reassembled PDU]"
"88","5.971847","192.168.0.183","104.244.42.65","TCP","1414","50717  >  443 [ACK] Seq=72733 Ack=10217 Win=1039 Len=1360 [TCP segment of a reassembled PDU]"
"89","5.971847","192.168.0.183","104.244.42.65","TCP","1414","50717  >  443 [ACK] Seq=74093 Ack=10217 Win=1039 Len=1360 [TCP segment of a reassembled PDU]"
"90","5.971847","192.168.0.183","104.244.42.65","TCP","1414","50717  >  443 [ACK] Seq=75453 Ack=10217 Win=1039 Len=1360 [TCP segment of a reassembled PDU]"
"91","5.971847","192.168.0.183","104.244.42.65","TCP","1414","50717  >  443 [ACK] Seq=76813 Ack=10217 Win=1039 Len=1360 [TCP segment of a reassembled PDU]"
"92","5.971847","192.168.0.183","104.244.42.65","TCP","1414","50717  >  443 [ACK] Seq=78173 Ack=10217 Win=1039 Len=1360 [TCP segment of a reassembled PDU]"
"93","5.971847","192.168.0.183","104.244.42.65","TCP","1414","50717  >  443 [ACK] Seq=79533 Ack=10217 Win=1039 Len=1360 [TCP segment of a reassembled PDU]"
"94","5.971847","192.168.0.183","104.244.42.65","TCP","1414","50717  >  443 [ACK] Seq=80893 Ack=10217 Win=1039 Len=1360 [TCP segment of a reassembled PDU]"
"95","5.971847","192.168.0.183","104.244.42.65","TCP","1414","50717  >  443 [ACK] Seq=82253 Ack=10217 Win=1039 Len=1360 [TCP segment of a reassembled PDU]"
"96","5.971847","192.168.0.183","104.244.42.65","TLSv1.2","862","Application Data"
"97","6.009731","104.244.42.65","192.168.0.183","TCP","60","443  >  50717 [ACK] Seq=10217 Ack=72733 Win=5695 Len=0"
"98","6.009731","104.244.42.65","192.168.0.183","TLSv1.2","89","Application Data"
"99","6.013746","104.244.42.65","192.168.0.183","TCP","60","443  >  50717 [ACK] Seq=10252 Ack=84421 Win=5735 Len=0"
"100","6.055250","104.244.42.65","192.168.0.183","TLSv1.2","220","Application Data"
"101","6.055278","192.168.0.183","104.244.42.65","TCP","54","50717  >  443 [ACK] Seq=84421 Ack=10418 Win=1038 Len=0"
"102","7.552983","192.168.0.183","104.244.42.65","TCP","1414","50717  >  443 [ACK] Seq=84421 Ack=10418 Win=1038 Len=1360 [TCP segment of a reassembled PDU]"
"103","7.552983","192.168.0.183","104.244.42.65","TLSv1.2","419","Application Data"
"104","7.592627","104.244.42.65","192.168.0.183","TCP","60","443  >  50717 [ACK] Seq=10418 Ack=86146 Win=5731 Len=0"
"105","8.251338","104.244.42.65","192.168.0.183","TCP","1414","443  >  50717 [ACK] Seq=10418 Ack=86146 Win=5735 Len=1360 [TCP segment of a reassembled PDU]"
"106","8.251338","104.244.42.65","192.168.0.183","TCP","1414","443  >  50717 [ACK] Seq=11778 Ack=86146 Win=5735 Len=1360 [TCP segment of a reassembled PDU]"
"107","8.251338","104.244.42.65","192.168.0.183","TCP","1414","443  >  50717 [PSH, ACK] Seq=13138 Ack=86146 Win=5735 Len=1360 [TCP segment of a reassembled PDU]"
"108","8.251338","104.244.42.65","192.168.0.183","TCP","1414","443  >  50717 [ACK] Seq=14498 Ack=86146 Win=5735 Len=1360 [TCP segment of a reassembled PDU]"
"109","8.251338","104.244.42.65","192.168.0.183","TLSv1.2","730","Application Data"
"110","8.251406","192.168.0.183","104.244.42.65","TCP","54","50717  >  443 [ACK] Seq=86146 Ack=16534 Win=1041 Len=0"
"111","8.252091","192.168.0.183","104.244.42.65","TLSv1.2","89","Application Data"
"112","8.329028","104.244.42.65","192.168.0.183","TCP","60","443  >  50717 [ACK] Seq=16534 Ack=86181 Win=5735 Len=0"
"113","8.974982","192.168.0.183","104.244.42.65","TLSv1.2","294","Application Data"
"114","8.975153","192.168.0.183","104.244.42.65","TCP","1414","50717  >  443 [ACK] Seq=86421 Ack=16534 Win=1041 Len=1360 [TCP segment of a reassembled PDU]"
"115","8.975153","192.168.0.183","104.244.42.65","TCP","1414","50717  >  443 [ACK] Seq=87781 Ack=16534 Win=1041 Len=1360 [TCP segment of a reassembled PDU]"
"116","8.975153","192.168.0.183","104.244.42.65","TCP","1414","50717  >  443 [ACK] Seq=89141 Ack=16534 Win=1041 Len=1360 [TCP segment of a reassembled PDU]"
"117","8.975153","192.168.0.183","104.244.42.65","TCP","1414","50717  >  443 [ACK] Seq=90501 Ack=16534 Win=1041 Len=1360 [TCP segment of a reassembled PDU]"
"118","8.975153","192.168.0.183","104.244.42.65","TCP","1414","50717  >  443 [ACK] Seq=91861 Ack=16534 Win=1041 Len=1360 [TCP segment of a reassembled PDU]"
"119","8.975153","192.168.0.183","104.244.42.65","TCP","1414","50717  >  443 [ACK] Seq=93221 Ack=16534 Win=1041 Len=1360 [TCP segment of a reassembled PDU]"
"120","8.975153","192.168.0.183","104.244.42.65","TCP","1414","50717  >  443 [ACK] Seq=94581 Ack=16534 Win=1041 Len=1360 [TCP segment of a reassembled PDU]"
"121","8.975153","192.168.0.183","104.244.42.65","TCP","1414","50717  >  443 [ACK] Seq=95941 Ack=16534 Win=1041 Len=1360 [TCP segment of a reassembled PDU]"
"122","8.975153","192.168.0.183","104.244.42.65","TCP","1414","50717  >  443 [ACK] Seq=97301 Ack=16534 Win=1041 Len=1360 [TCP segment of a reassembled PDU]"
"123","8.975153","192.168.0.183","104.244.42.65","TCP","1414","50717  >  443 [ACK] Seq=98661 Ack=16534 Win=1041 Len=1360 [TCP segment of a reassembled PDU]"
"124","8.975153","192.168.0.183","104.244.42.65","TCP","1414","50717  >  443 [ACK] Seq=100021 Ack=16534 Win=1041 Len=1360 [TCP segment of a reassembled PDU]"
"125","8.975153","192.168.0.183","104.244.42.65","TCP","1414","50717  >  443 [ACK] Seq=101381 Ack=16534 Win=1041 Len=1360 [TCP segment of a reassembled PDU]"
"126","8.975153","192.168.0.183","104.244.42.65","TLSv1.2","140","Application Data"
"127","8.975351","192.168.0.183","104.244.42.65","TCP","1414","50717  >  443 [ACK] Seq=102827 Ack=16534 Win=1041 Len=1360 [TCP segment of a reassembled PDU]"
"128","8.975351","192.168.0.183","104.244.42.65","TCP","1414","50717  >  443 [ACK] Seq=104187 Ack=16534 Win=1041 Len=1360 [TCP segment of a reassembled PDU]"
"129","8.975351","192.168.0.183","104.244.42.65","TCP","1414","50717  >  443 [ACK] Seq=105547 Ack=16534 Win=1041 Len=1360 [TCP segment of a reassembled PDU]"
"130","8.975351","192.168.0.183","104.244.42.65","TCP","1414","50717  >  443 [ACK] Seq=106907 Ack=16534 Win=1041 Len=1360 [TCP segment of a reassembled PDU]"
"131","8.975351","192.168.0.183","104.244.42.65","TCP","1414","50717  >  443 [ACK] Seq=108267 Ack=16534 Win=1041 Len=1360 [TCP segment of a reassembled PDU]"
"132","8.975351","192.168.0.183","104.244.42.65","TCP","1414","50717  >  443 [ACK] Seq=109627 Ack=16534 Win=1041 Len=1360 [TCP segment of a reassembled PDU]"
"133","8.975351","192.168.0.183","104.244.42.65","TCP","1414","50717  >  443 [ACK] Seq=110987 Ack=16534 Win=1041 Len=1360 [TCP segment of a reassembled PDU]"
"134","8.975351","192.168.0.183","104.244.42.65","TCP","1414","50717  >  443 [ACK] Seq=112347 Ack=16534 Win=1041 Len=1360 [TCP segment of a reassembled PDU]"
"135","8.975351","192.168.0.183","104.244.42.65","TCP","1414","50717  >  443 [ACK] Seq=113707 Ack=16534 Win=1041 Len=1360 [TCP segment of a reassembled PDU]"
"136","8.975351","192.168.0.183","104.244.42.65","TLSv1.2","1403","Application Data"
"137","9.020162","104.244.42.65","192.168.0.183","TCP","60","443  >  50717 [ACK] Seq=16534 Ack=90501 Win=5724 Len=0"
"138","9.026218","104.244.42.65","192.168.0.183","TCP","60","443  >  50717 [ACK] Seq=16534 Ack=116416 Win=5725 Len=0"
"139","9.063185","104.244.42.65","192.168.0.183","TLSv1.2","206","Application Data"
"140","9.116416","192.168.0.183","104.244.42.65","TCP","54","50717  >  443 [ACK] Seq=116416 Ack=16686 Win=1040 Len=0"
"141","10.406403","192.168.0.183","104.244.42.65","TLSv1.2","329","Application Data"
"142","10.406558","192.168.0.183","104.244.42.65","TLSv1.2","1243","Application Data"
"143","10.478957","104.244.42.65","192.168.0.183","TCP","60","443  >  50717 [ACK] Seq=16686 Ack=117880 Win=5731 Len=0"
"144","10.478957","104.244.42.65","192.168.0.183","TLSv1.2","184","Application Data"
"145","10.530278","192.168.0.183","104.244.42.65","TCP","54","50717  >  443 [ACK] Seq=117880 Ack=16816 Win=1040 Len=0"
"146","11.984120","192.168.0.183","104.244.42.65","TLSv1.2","276","Application Data"
"147","11.984294","192.168.0.183","104.244.42.65","TCP","1414","50717  >  443 [ACK] Seq=118102 Ack=16816 Win=1040 Len=1360 [TCP segment of a reassembled PDU]"
"148","11.984294","192.168.0.183","104.244.42.65","TCP","1414","50717  >  443 [ACK] Seq=119462 Ack=16816 Win=1040 Len=1360 [TCP segment of a reassembled PDU]"
"149","11.984294","192.168.0.183","104.244.42.65","TCP","1414","50717  >  443 [ACK] Seq=120822 Ack=16816 Win=1040 Len=1360 [TCP segment of a reassembled PDU]"
"150","11.984294","192.168.0.183","104.244.42.65","TCP","1414","50717  >  443 [ACK] Seq=122182 Ack=16816 Win=1040 Len=1360 [TCP segment of a reassembled PDU]"
"151","11.984294","192.168.0.183","104.244.42.65","TCP","1414","50717  >  443 [ACK] Seq=123542 Ack=16816 Win=1040 Len=1360 [TCP segment of a reassembled PDU]"
"152","11.984294","192.168.0.183","104.244.42.65","TCP","1414","50717  >  443 [ACK] Seq=124902 Ack=16816 Win=1040 Len=1360 [TCP segment of a reassembled PDU]"
"153","11.984294","192.168.0.183","104.244.42.65","TCP","1414","50717  >  443 [ACK] Seq=126262 Ack=16816 Win=1040 Len=1360 [TCP segment of a reassembled PDU]"
"154","11.984294","192.168.0.183","104.244.42.65","TCP","1414","50717  >  443 [ACK] Seq=127622 Ack=16816 Win=1040 Len=1360 [TCP segment of a reassembled PDU]"
"155","11.984294","192.168.0.183","104.244.42.65","TCP","1414","50717  >  443 [ACK] Seq=128982 Ack=16816 Win=1040 Len=1360 [TCP segment of a reassembled PDU]"
"156","11.984294","192.168.0.183","104.244.42.65","TCP","1414","50717  >  443 [ACK] Seq=130342 Ack=16816 Win=1040 Len=1360 [TCP segment of a reassembled PDU]"
"157","11.984294","192.168.0.183","104.244.42.65","TCP","1414","50717  >  443 [ACK] Seq=131702 Ack=16816 Win=1040 Len=1360 [TCP segment of a reassembled PDU]"
"158","11.984294","192.168.0.183","104.244.42.65","TCP","1414","50717  >  443 [ACK] Seq=133062 Ack=16816 Win=1040 Len=1360 [TCP segment of a reassembled PDU]"
"159","11.984294","192.168.0.183","104.244.42.65","TLSv1.2","140","Application Data"
"160","11.984433","192.168.0.183","104.244.42.65","TCP","1414","50717  >  443 [ACK] Seq=134508 Ack=16816 Win=1040 Len=1360 [TCP segment of a reassembled PDU]"
"161","11.984433","192.168.0.183","104.244.42.65","TCP","1414","50717  >  443 [ACK] Seq=135868 Ack=16816 Win=1040 Len=1360 [TCP segment of a reassembled PDU]"
"162","11.984433","192.168.0.183","104.244.42.65","TCP","1414","50717  >  443 [ACK] Seq=137228 Ack=16816 Win=1040 Len=1360 [TCP segment of a reassembled PDU]"
"163","11.984433","192.168.0.183","104.244.42.65","TCP","1414","50717  >  443 [ACK] Seq=138588 Ack=16816 Win=1040 Len=1360 [TCP segment of a reassembled PDU]"
"164","11.984433","192.168.0.183","104.244.42.65","TCP","1414","50717  >  443 [ACK] Seq=139948 Ack=16816 Win=1040 Len=1360 [TCP segment of a reassembled PDU]"
"165","11.984433","192.168.0.183","104.244.42.65","TCP","1414","50717  >  443 [ACK] Seq=141308 Ack=16816 Win=1040 Len=1360 [TCP segment of a reassembled PDU]"
"166","11.984433","192.168.0.183","104.244.42.65","TCP","1414","50717  >  443 [ACK] Seq=142668 Ack=16816 Win=1040 Len=1360 [TCP segment of a reassembled PDU]"
"167","11.984433","192.168.0.183","104.244.42.65","TCP","1414","50717  >  443 [ACK] Seq=144028 Ack=16816 Win=1040 Len=1360 [TCP segment of a reassembled PDU]"
"168","11.984433","192.168.0.183","104.244.42.65","TCP","1414","50717  >  443 [ACK] Seq=145388 Ack=16816 Win=1040 Len=1360 [TCP segment of a reassembled PDU]"
"169","11.984433","192.168.0.183","104.244.42.65","TCP","1414","50717  >  443 [ACK] Seq=146748 Ack=16816 Win=1040 Len=1360 [TCP segment of a reassembled PDU]"
"170","11.984433","192.168.0.183","104.244.42.65","TCP","1414","50717  >  443 [ACK] Seq=148108 Ack=16816 Win=1040 Len=1360 [TCP segment of a reassembled PDU]"
"171","11.984433","192.168.0.183","104.244.42.65","TCP","1414","50717  >  443 [ACK] Seq=149468 Ack=16816 Win=1040 Len=1360 [TCP segment of a reassembled PDU]"
"172","11.984433","192.168.0.183","104.244.42.65","TLSv1.2","140","Application Data"
"173","11.984564","192.168.0.183","104.244.42.65","TCP","1414","50717  >  443 [ACK] Seq=150914 Ack=16816 Win=1040 Len=1360 [TCP segment of a reassembled PDU]"
"174","11.984564","192.168.0.183","104.244.42.65","TCP","1414","50717  >  443 [ACK] Seq=152274 Ack=16816 Win=1040 Len=1360 [TCP segment of a reassembled PDU]"
"175","11.984564","192.168.0.183","104.244.42.65","TCP","1414","50717  >  443 [ACK] Seq=153634 Ack=16816 Win=1040 Len=1360 [TCP segment of a reassembled PDU]"
"176","11.984564","192.168.0.183","104.244.42.65","TLSv1.2","998","Application Data"
"177","12.022205","104.244.42.65","192.168.0.183","TCP","60","443  >  50717 [ACK] Seq=16816 Ack=119462 Win=5732 Len=0"
"178","12.025166","104.244.42.65","192.168.0.183","TCP","60","443  >  50717 [ACK] Seq=16816 Ack=131702 Win=5735 Len=0"
"179","12.026495","104.244.42.65","192.168.0.183","TCP","60","443  >  50717 [ACK] Seq=16816 Ack=155938 Win=5730 Len=0"
"180","12.026495","104.244.42.65","192.168.0.183","TLSv1.2","89","Application Data"
"181","12.070407","192.168.0.183","104.244.42.65","TCP","54","50717  >  443 [ACK] Seq=155938 Ack=16851 Win=1040 Len=0"
"182","12.074838","104.244.42.65","192.168.0.183","TLSv1.2","201","Application Data"
"183","12.130262","192.168.0.183","104.244.42.65","TCP","54","50717  >  443 [ACK] Seq=155938 Ack=16998 Win=1039 Len=0"
"184","14.396254","192.168.0.183","104.244.42.65","TLSv1.2","661","Application Data"
"185","14.396342","192.168.0.183","104.244.42.65","TLSv1.2","235","Application Data"
"186","14.437384","104.244.42.65","192.168.0.183","TCP","60","443  >  50717 [ACK] Seq=16998 Ack=156726 Win=5735 Len=0"
"187","14.451757","104.244.42.65","192.168.0.183","TLSv1.2","184","Application Data"
"188","14.499447","192.168.0.183","104.244.42.65","TCP","54","50717  >  443 [ACK] Seq=156726 Ack=17128 Win=1038 Len=0"
"189","14.839050","192.168.0.183","104.244.42.65","TCP","1414","50717  >  443 [ACK] Seq=156726 Ack=17128 Win=1038 Len=1360 [TCP segment of a reassembled PDU]"
"190","14.839050","192.168.0.183","104.244.42.65","TLSv1.2","834","Application Data"
"191","14.876557","104.244.42.65","192.168.0.183","TCP","60","443  >  50717 [ACK] Seq=17128 Ack=158866 Win=5730 Len=0"
"192","14.973775","192.168.0.183","104.244.42.65","TLSv1.2","1052","Application Data"
"193","14.973945","192.168.0.183","104.244.42.65","TLSv1.2","247","Application Data"
"194","15.009771","104.244.42.65","192.168.0.183","TCP","60","443  >  50717 [ACK] Seq=17128 Ack=160057 Win=5735 Len=0"
"195","15.039633","104.244.42.65","192.168.0.183","TLSv1.2","234","Application Data"
"196","15.039633","104.244.42.65","192.168.0.183","TLSv1.2","461","Application Data"
"197","15.039681","192.168.0.183","104.244.42.65","TCP","54","50717  >  443 [ACK] Seq=160057 Ack=17715 Win=1036 Len=0"
"198","15.040565","192.168.0.183","104.244.42.65","TLSv1.2","89","Application Data"
"199","15.081197","192.168.0.183","104.244.42.65","TLSv1.2","303","Application Data"
"200","15.081302","192.168.0.183","104.244.42.65","TCP","1414","50717  >  443 [ACK] Seq=160341 Ack=17715 Win=1036 Len=1360 [TCP segment of a reassembled PDU]"
"201","15.081302","192.168.0.183","104.244.42.65","TCP","1414","50717  >  443 [ACK] Seq=161701 Ack=17715 Win=1036 Len=1360 [TCP segment of a reassembled PDU]"
"202","15.081302","192.168.0.183","104.244.42.65","TCP","1414","50717  >  443 [ACK] Seq=163061 Ack=17715 Win=1036 Len=1360 [TCP segment of a reassembled PDU]"
"203","15.081302","192.168.0.183","104.244.42.65","TCP","1414","50717  >  443 [ACK] Seq=164421 Ack=17715 Win=1036 Len=1360 [TCP segment of a reassembled PDU]"
"204","15.081302","192.168.0.183","104.244.42.65","TCP","1414","50717  >  443 [ACK] Seq=165781 Ack=17715 Win=1036 Len=1360 [TCP segment of a reassembled PDU]"
"205","15.081302","192.168.0.183","104.244.42.65","TCP","1414","50717  >  443 [ACK] Seq=167141 Ack=17715 Win=1036 Len=1360 [TCP segment of a reassembled PDU]"
"206","15.081302","192.168.0.183","104.244.42.65","TCP","1414","50717  >  443 [ACK] Seq=168501 Ack=17715 Win=1036 Len=1360 [TCP segment of a reassembled PDU]"
"207","15.081302","192.168.0.183","104.244.42.65","TLSv1.2","114","Application Data"
"208","15.124067","104.244.42.65","192.168.0.183","TCP","60","443  >  50717 [ACK] Seq=17715 Ack=161701 Win=5731 Len=0"
"209","15.124067","104.244.42.65","192.168.0.183","TCP","60","443  >  50717 [ACK] Seq=17715 Ack=169921 Win=5728 Len=0"
"210","15.152289","104.244.42.65","192.168.0.183","TLSv1.2","134","Application Data"
"211","15.197445","192.168.0.183","104.244.42.65","TCP","54","50717  >  443 [ACK] Seq=169921 Ack=17795 Win=1036 Len=0"
"212","15.569546","104.244.42.65","192.168.0.183","TCP","1414","443  >  50717 [ACK] Seq=17795 Ack=169921 Win=5735 Len=1360 [TCP segment of a reassembled PDU]"
"213","15.569546","104.244.42.65","192.168.0.183","TCP","1414","443  >  50717 [ACK] Seq=19155 Ack=169921 Win=5735 Len=1360 [TCP segment of a reassembled PDU]"
"214","15.569546","104.244.42.65","192.168.0.183","TCP","1414","443  >  50717 [PSH, ACK] Seq=20515 Ack=169921 Win=5735 Len=1360 [TCP segment of a reassembled PDU]"
"215","15.569546","104.244.42.65","192.168.0.183","TCP","1414","443  >  50717 [ACK] Seq=21875 Ack=169921 Win=5735 Len=1360 [TCP segment of a reassembled PDU]"
"216","15.569546","104.244.42.65","192.168.0.183","TCP","1414","443  >  50717 [ACK] Seq=23235 Ack=169921 Win=5735 Len=1360 [TCP segment of a reassembled PDU]"
"217","15.569546","104.244.42.65","192.168.0.183","TLSv1.2","1406","Application Data"
"218","15.569618","192.168.0.183","104.244.42.65","TCP","54","50717  >  443 [ACK] Seq=169921 Ack=25947 Win=1041 Len=0"
"219","18.083494","192.168.0.183","104.244.42.65","TLSv1.2","298","Application Data"
"220","18.083642","192.168.0.183","104.244.42.65","TCP","1414","50717  >  443 [ACK] Seq=170165 Ack=25947 Win=1041 Len=1360 [TCP segment of a reassembled PDU]"
"221","18.083642","192.168.0.183","104.244.42.65","TCP","1414","50717  >  443 [ACK] Seq=171525 Ack=25947 Win=1041 Len=1360 [TCP segment of a reassembled PDU]"
"222","18.083642","192.168.0.183","104.244.42.65","TCP","1414","50717  >  443 [ACK] Seq=172885 Ack=25947 Win=1041 Len=1360 [TCP segment of a reassembled PDU]"
"223","18.083642","192.168.0.183","104.244.42.65","TCP","1414","50717  >  443 [ACK] Seq=174245 Ack=25947 Win=1041 Len=1360 [TCP segment of a reassembled PDU]"
"224","18.083642","192.168.0.183","104.244.42.65","TCP","1414","50717  >  443 [ACK] Seq=175605 Ack=25947 Win=1041 Len=1360 [TCP segment of a reassembled PDU]"
"225","18.083642","192.168.0.183","104.244.42.65","TCP","1414","50717  >  443 [ACK] Seq=176965 Ack=25947 Win=1041 Len=1360 [TCP segment of a reassembled PDU]"
"226","18.083642","192.168.0.183","104.244.42.65","TCP","1414","50717  >  443 [ACK] Seq=178325 Ack=25947 Win=1041 Len=1360 [TCP segment of a reassembled PDU]"
"227","18.083642","192.168.0.183","104.244.42.65","TCP","1414","50717  >  443 [ACK] Seq=179685 Ack=25947 Win=1041 Len=1360 [TCP segment of a reassembled PDU]"
"228","18.083642","192.168.0.183","104.244.42.65","TCP","1414","50717  >  443 [ACK] Seq=181045 Ack=25947 Win=1041 Len=1360 [TCP segment of a reassembled PDU]"
"229","18.083642","192.168.0.183","104.244.42.65","TCP","1414","50717  >  443 [ACK] Seq=182405 Ack=25947 Win=1041 Len=1360 [TCP segment of a reassembled PDU]"
"230","18.083642","192.168.0.183","104.244.42.65","TCP","1414","50717  >  443 [ACK] Seq=183765 Ack=25947 Win=1041 Len=1360 [TCP segment of a reassembled PDU]"
"231","18.083642","192.168.0.183","104.244.42.65","TCP","1414","50717  >  443 [ACK] Seq=185125 Ack=25947 Win=1041 Len=1360 [TCP segment of a reassembled PDU]"
"232","18.083642","192.168.0.183","104.244.42.65","TLSv1.2","140","Application Data"
"233","18.083800","192.168.0.183","104.244.42.65","TCP","1414","50717  >  443 [ACK] Seq=186571 Ack=25947 Win=1041 Len=1360 [TCP segment of a reassembled PDU]"
"234","18.083800","192.168.0.183","104.244.42.65","TCP","1414","50717  >  443 [ACK] Seq=187931 Ack=25947 Win=1041 Len=1360 [TCP segment of a reassembled PDU]"
"235","18.083800","192.168.0.183","104.244.42.65","TCP","1414","50717  >  443 [ACK] Seq=189291 Ack=25947 Win=1041 Len=1360 [TCP segment of a reassembled PDU]"
"236","18.083800","192.168.0.183","104.244.42.65","TCP","1414","50717  >  443 [ACK] Seq=190651 Ack=25947 Win=1041 Len=1360 [TCP segment of a reassembled PDU]"
"237","18.083800","192.168.0.183","104.244.42.65","TCP","1414","50717  >  443 [ACK] Seq=192011 Ack=25947 Win=1041 Len=1360 [TCP segment of a reassembled PDU]"
"238","18.083800","192.168.0.183","104.244.42.65","TCP","1414","50717  >  443 [ACK] Seq=193371 Ack=25947 Win=1041 Len=1360 [TCP segment of a reassembled PDU]"
"239","18.083800","192.168.0.183","104.244.42.65","TCP","1414","50717  >  443 [ACK] Seq=194731 Ack=25947 Win=1041 Len=1360 [TCP segment of a reassembled PDU]"
"240","18.083800","192.168.0.183","104.244.42.65","TCP","1414","50717  >  443 [ACK] Seq=196091 Ack=25947 Win=1041 Len=1360 [TCP segment of a reassembled PDU]"
"241","18.083800","192.168.0.183","104.244.42.65","TCP","1414","50717  >  443 [ACK] Seq=197451 Ack=25947 Win=1041 Len=1360 [TCP segment of a reassembled PDU]"
"242","18.083800","192.168.0.183","104.244.42.65","TCP","1414","50717  >  443 [ACK] Seq=198811 Ack=25947 Win=1041 Len=1360 [TCP segment of a reassembled PDU]"
"243","18.083800","192.168.0.183","104.244.42.65","TCP","1414","50717  >  443 [ACK] Seq=200171 Ack=25947 Win=1041 Len=1360 [TCP segment of a reassembled PDU]"
"244","18.083800","192.168.0.183","104.244.42.65","TCP","1414","50717  >  443 [ACK] Seq=201531 Ack=25947 Win=1041 Len=1360 [TCP segment of a reassembled PDU]"
"245","18.083800","192.168.0.183","104.244.42.65","TLSv1.2","140","Application Data"
"246","18.083952","192.168.0.183","104.244.42.65","TLSv1.2","967","Application Data"
"247","18.120802","104.244.42.65","192.168.0.183","TCP","60","443  >  50717 [ACK] Seq=25947 Ack=174245 Win=5725 Len=0"
"248","18.125661","104.244.42.65","192.168.0.183","TCP","60","443  >  50717 [ACK] Seq=25947 Ack=202977 Win=5731 Len=0"
"249","18.125661","104.244.42.65","192.168.0.183","TLSv1.2","89","Application Data"
"250","18.166563","104.244.42.65","192.168.0.183","TLSv1.2","266","Application Data"
"251","18.166588","192.168.0.183","104.244.42.65","TCP","54","50717  >  443 [ACK] Seq=203890 Ack=26194 Win=1040 Len=0"
"252","20.516834","192.168.0.183","104.244.42.65","TLSv1.2","353","Application Data"
"253","20.516904","192.168.0.183","104.244.42.65","TLSv1.2","168","Application Data"
"254","20.517625","192.168.0.183","104.244.42.65","TLSv1.2","276","Application Data"
"255","20.517692","192.168.0.183","104.244.42.65","TCP","1414","50717  >  443 [ACK] Seq=204525 Ack=26194 Win=1040 Len=1360 [TCP segment of a reassembled PDU]"
"256","20.517692","192.168.0.183","104.244.42.65","TCP","1414","50717  >  443 [ACK] Seq=205885 Ack=26194 Win=1040 Len=1360 [TCP segment of a reassembled PDU]"
"257","20.517692","192.168.0.183","104.244.42.65","TLSv1.2","55","Application Data"
"258","20.554318","104.244.42.65","192.168.0.183","TCP","66","443  >  50717 [ACK] Seq=26194 Ack=204189 Win=5734 Len=0 SLE=207245 SRE=207246"
"259","20.554318","104.244.42.65","192.168.0.183","TCP","66","443  >  50717 [ACK] Seq=26194 Ack=204303 Win=5734 Len=0 SLE=207245 SRE=207246"
"260","20.554318","104.244.42.65","192.168.0.183","TCP","66","443  >  50717 [ACK] Seq=26194 Ack=204525 Win=5734 Len=0 SLE=207245 SRE=207246"
"261","20.560113","104.244.42.65","192.168.0.183","TCP","60","443  >  50717 [ACK] Seq=26194 Ack=207246 Win=5728 Len=0"
"262","20.580726","104.244.42.65","192.168.0.183","TLSv1.2","222","Application Data"
"263","20.635458","192.168.0.183","104.244.42.65","TCP","54","50717  >  443 [ACK] Seq=207246 Ack=26362 Win=1039 Len=0"
"264","20.639263","104.244.42.65","192.168.0.183","TLSv1.2","224","Application Data"
"265","20.640984","192.168.0.183","104.244.42.65","TLSv1.2","89","Application Data"
"266","20.728353","104.244.42.65","192.168.0.183","TCP","60","443  >  50717 [ACK] Seq=26532 Ack=207281 Win=5735 Len=0"
"267","21.061424","192.168.0.183","104.244.42.65","TCP","1414","50717  >  443 [ACK] Seq=207281 Ack=26532 Win=1038 Len=1360 [TCP segment of a reassembled PDU]"
"268","21.061424","192.168.0.183","104.244.42.65","TLSv1.2","1056","Application Data"
"269","21.098379","104.244.42.65","192.168.0.183","TCP","60","443  >  50717 [ACK] Seq=26532 Ack=209643 Win=5729 Len=0"
"270","21.734581","104.244.42.65","192.168.0.183","TCP","1414","443  >  50717 [ACK] Seq=26532 Ack=209643 Win=5735 Len=1360 [TCP segment of a reassembled PDU]"
"271","21.734581","104.244.42.65","192.168.0.183","TCP","1414","443  >  50717 [ACK] Seq=27892 Ack=209643 Win=5735 Len=1360 [TCP segment of a reassembled PDU]"
"272","21.734581","104.244.42.65","192.168.0.183","TCP","1414","443  >  50717 [PSH, ACK] Seq=29252 Ack=209643 Win=5735 Len=1360 [TCP segment of a reassembled PDU]"
"273","21.734581","104.244.42.65","192.168.0.183","TCP","1414","443  >  50717 [ACK] Seq=30612 Ack=209643 Win=5735 Len=1360 [TCP segment of a reassembled PDU]"
"274","21.734581","104.244.42.65","192.168.0.183","TLSv1.2","1246","Application Data"
"275","21.734692","192.168.0.183","104.244.42.65","TCP","54","50717  >  443 [ACK] Seq=209643 Ack=33164 Win=1041 Len=0"
"276","23.187112","192.168.0.183","104.244.42.65","TCP","1414","50717  >  443 [ACK] Seq=209643 Ack=33164 Win=1041 Len=1360 [TCP segment of a reassembled PDU]"
"277","23.187112","192.168.0.183","104.244.42.65","TLSv1.2","1056","Application Data"
"278","23.238694","104.244.42.65","192.168.0.183","TCP","60","443  >  50717 [ACK] Seq=33164 Ack=212005 Win=5729 Len=0"
"279","23.463822","192.168.0.183","104.244.42.65","TLSv1.2","360","Application Data"
"280","23.463952","192.168.0.183","104.244.42.65","TCP","1414","50717  >  443 [ACK] Seq=212311 Ack=33164 Win=1041 Len=1360 [TCP segment of a reassembled PDU]"
"281","23.463952","192.168.0.183","104.244.42.65","TCP","1414","50717  >  443 [ACK] Seq=213671 Ack=33164 Win=1041 Len=1360 [TCP segment of a reassembled PDU]"
"282","23.463952","192.168.0.183","104.244.42.65","TCP","1414","50717  >  443 [ACK] Seq=215031 Ack=33164 Win=1041 Len=1360 [TCP segment of a reassembled PDU]"
"283","23.463952","192.168.0.183","104.244.42.65","TCP","1414","50717  >  443 [ACK] Seq=216391 Ack=33164 Win=1041 Len=1360 [TCP segment of a reassembled PDU]"
"284","23.463952","192.168.0.183","104.244.42.65","TCP","1414","50717  >  443 [ACK] Seq=217751 Ack=33164 Win=1041 Len=1360 [TCP segment of a reassembled PDU]"
"285","23.463952","192.168.0.183","104.244.42.65","TCP","1414","50717  >  443 [ACK] Seq=219111 Ack=33164 Win=1041 Len=1360 [TCP segment of a reassembled PDU]"
"286","23.463952","192.168.0.183","104.244.42.65","TCP","1414","50717  >  443 [ACK] Seq=220471 Ack=33164 Win=1041 Len=1360 [TCP segment of a reassembled PDU]"
"287","23.463952","192.168.0.183","104.244.42.65","TCP","1414","50717  >  443 [ACK] Seq=221831 Ack=33164 Win=1041 Len=1360 [TCP segment of a reassembled PDU]"
"288","23.463952","192.168.0.183","104.244.42.65","TCP","1414","50717  >  443 [ACK] Seq=223191 Ack=33164 Win=1041 Len=1360 [TCP segment of a reassembled PDU]"
"289","23.463952","192.168.0.183","104.244.42.65","TCP","1414","50717  >  443 [ACK] Seq=224551 Ack=33164 Win=1041 Len=1360 [TCP segment of a reassembled PDU]"
"290","23.463952","192.168.0.183","104.244.42.65","TCP","1414","50717  >  443 [ACK] Seq=225911 Ack=33164 Win=1041 Len=1360 [TCP segment of a reassembled PDU]"
"291","23.463952","192.168.0.183","104.244.42.65","TCP","1414","50717  >  443 [ACK] Seq=227271 Ack=33164 Win=1041 Len=1360 [TCP segment of a reassembled PDU]"
"292","23.463952","192.168.0.183","104.244.42.65","TLSv1.2","140","Application Data"
"293","23.464084","192.168.0.183","104.244.42.65","TCP","1414","50717  >  443 [ACK] Seq=228717 Ack=33164 Win=1041 Len=1360 [TCP segment of a reassembled PDU]"
"294","23.464084","192.168.0.183","104.244.42.65","TCP","1414","50717  >  443 [ACK] Seq=230077 Ack=33164 Win=1041 Len=1360 [TCP segment of a reassembled PDU]"
"295","23.464084","192.168.0.183","104.244.42.65","TCP","1414","50717  >  443 [ACK] Seq=231437 Ack=33164 Win=1041 Len=1360 [TCP segment of a reassembled PDU]"
"296","23.464084","192.168.0.183","104.244.42.65","TCP","1414","50717  >  443 [ACK] Seq=232797 Ack=33164 Win=1041 Len=1360 [TCP segment of a reassembled PDU]"
"297","23.464084","192.168.0.183","104.244.42.65","TCP","1414","50717  >  443 [ACK] Seq=234157 Ack=33164 Win=1041 Len=1360 [TCP segment of a reassembled PDU]"
"298","23.464084","192.168.0.183","104.244.42.65","TCP","1414","50717  >  443 [ACK] Seq=235517 Ack=33164 Win=1041 Len=1360 [TCP segment of a reassembled PDU]"
"299","23.464084","192.168.0.183","104.244.42.65","TCP","1414","50717  >  443 [ACK] Seq=236877 Ack=33164 Win=1041 Len=1360 [TCP segment of a reassembled PDU]"
"300","23.464084","192.168.0.183","104.244.42.65","TCP","1414","50717  >  443 [ACK] Seq=238237 Ack=33164 Win=1041 Len=1360 [TCP segment of a reassembled PDU]"
"301","23.464084","192.168.0.183","104.244.42.65","TCP","1414","50717  >  443 [ACK] Seq=239597 Ack=33164 Win=1041 Len=1360 [TCP segment of a reassembled PDU]"
"302","23.464084","192.168.0.183","104.244.42.65","TCP","1414","50717  >  443 [ACK] Seq=240957 Ack=33164 Win=1041 Len=1360 [TCP segment of a reassembled PDU]"
"303","23.464084","192.168.0.183","104.244.42.65","TCP","1414","50717  >  443 [ACK] Seq=242317 Ack=33164 Win=1041 Len=1360 [TCP segment of a reassembled PDU]"
"304","23.464084","192.168.0.183","104.244.42.65","TCP","1414","50717  >  443 [ACK] Seq=243677 Ack=33164 Win=1041 Len=1360 [TCP segment of a reassembled PDU]"
"305","23.464084","192.168.0.183","104.244.42.65","TLSv1.2","140","Application Data"
"306","23.464223","192.168.0.183","104.244.42.65","TCP","1414","50717  >  443 [ACK] Seq=245123 Ack=33164 Win=1041 Len=1360 [TCP segment of a reassembled PDU]"
"307","23.464223","192.168.0.183","104.244.42.65","TCP","1414","50717  >  443 [ACK] Seq=246483 Ack=33164 Win=1041 Len=1360 [TCP segment of a reassembled PDU]"
"308","23.464223","192.168.0.183","104.244.42.65","TCP","1414","50717  >  443 [ACK] Seq=247843 Ack=33164 Win=1041 Len=1360 [TCP segment of a reassembled PDU]"
"309","23.464223","192.168.0.183","104.244.42.65","TCP","1414","50717  >  443 [ACK] Seq=249203 Ack=33164 Win=1041 Len=1360 [TCP segment of a reassembled PDU]"
"310","23.464223","192.168.0.183","104.244.42.65","TCP","1414","50717  >  443 [ACK] Seq=250563 Ack=33164 Win=1041 Len=1360 [TCP segment of a reassembled PDU]"
"311","23.464223","192.168.0.183","104.244.42.65","TCP","1414","50717  >  443 [ACK] Seq=251923 Ack=33164 Win=1041 Len=1360 [TCP segment of a reassembled PDU]"
"312","23.464223","192.168.0.183","104.244.42.65","TCP","1414","50717  >  443 [ACK] Seq=253283 Ack=33164 Win=1041 Len=1360 [TCP segment of a reassembled PDU]"
"313","23.464223","192.168.0.183","104.244.42.65","TCP","1414","50717  >  443 [ACK] Seq=254643 Ack=33164 Win=1041 Len=1360 [TCP segment of a reassembled PDU]"
"314","23.464223","192.168.0.183","104.244.42.65","TCP","1414","50717  >  443 [ACK] Seq=256003 Ack=33164 Win=1041 Len=1360 [TCP segment of a reassembled PDU]"
"315","23.464223","192.168.0.183","104.244.42.65","TCP","1414","50717  >  443 [ACK] Seq=257363 Ack=33164 Win=1041 Len=1360 [TCP segment of a reassembled PDU]"
"316","23.464223","192.168.0.183","104.244.42.65","TCP","1414","50717  >  443 [ACK] Seq=258723 Ack=33164 Win=1041 Len=1360 [TCP segment of a reassembled PDU]"
"317","23.464223","192.168.0.183","104.244.42.65","TLSv1.2","1163","Application Data"
"318","23.500577","104.244.42.65","192.168.0.183","TCP","60","443  >  50717 [ACK] Seq=33164 Ack=213671 Win=5729 Len=0"
"319","23.506031","104.244.42.65","192.168.0.183","TCP","60","443  >  50717 [ACK] Seq=33164 Ack=261192 Win=5726 Len=0"
"320","23.507399","104.244.42.65","192.168.0.183","TLSv1.2","89","Application Data"
"321","23.551539","192.168.0.183","104.244.42.65","TCP","54","50717  >  443 [ACK] Seq=261192 Ack=33199 Win=1041 Len=0"
"322","23.565000","104.244.42.65","192.168.0.183","TLSv1.2","204","Application Data"
"323","23.613397","192.168.0.183","104.244.42.65","TCP","54","50717  >  443 [ACK] Seq=261192 Ack=33349 Win=1040 Len=0"
"324","23.838234","104.244.42.65","192.168.0.183","TCP","1414","443  >  50717 [ACK] Seq=33349 Ack=261192 Win=5735 Len=1360 [TCP segment of a reassembled PDU]"
"325","23.838234","104.244.42.65","192.168.0.183","TCP","1414","443  >  50717 [ACK] Seq=34709 Ack=261192 Win=5735 Len=1360 [TCP segment of a reassembled PDU]"
"326","23.838234","104.244.42.65","192.168.0.183","TCP","1414","443  >  50717 [PSH, ACK] Seq=36069 Ack=261192 Win=5735 Len=1360 [TCP segment of a reassembled PDU]"
"327","23.838234","104.244.42.65","192.168.0.183","TCP","1414","443  >  50717 [ACK] Seq=37429 Ack=261192 Win=5735 Len=1360 [TCP segment of a reassembled PDU]"
"328","23.838234","104.244.42.65","192.168.0.183","TCP","1414","443  >  50717 [ACK] Seq=38789 Ack=261192 Win=5735 Len=1360 [TCP segment of a reassembled PDU]"
"329","23.838234","104.244.42.65","192.168.0.183","TLSv1.2","531","Application Data"
"330","23.838286","192.168.0.183","104.244.42.65","TCP","54","50717  >  443 [ACK] Seq=261192 Ack=40626 Win=1041 Len=0"
"331","25.199743","192.168.0.183","104.244.42.65","TLSv1.2","280","Application Data"
"332","25.277854","104.244.42.65","192.168.0.183","TCP","60","443  >  50717 [ACK] Seq=40626 Ack=261418 Win=5735 Len=0"
"333","25.326058","192.168.0.183","104.244.42.65","TLSv1.2","302","Application Data"
"334","25.326171","192.168.0.183","104.244.42.65","TCP","1414","50717  >  443 [ACK] Seq=261666 Ack=40626 Win=1041 Len=1360 [TCP segment of a reassembled PDU]"
"335","25.326171","192.168.0.183","104.244.42.65","TLSv1.2","196","Application Data"
"336","25.362233","104.244.42.65","192.168.0.183","TCP","60","443  >  50717 [ACK] Seq=40626 Ack=261666 Win=5735 Len=0"
"337","25.363941","104.244.42.65","192.168.0.183","TCP","60","443  >  50717 [ACK] Seq=40626 Ack=263168 Win=5731 Len=0"
"338","25.388937","104.244.42.65","192.168.0.183","TLSv1.2","161","Application Data"
"339","25.436801","192.168.0.183","104.244.42.65","TCP","54","50717  >  443 [ACK] Seq=263168 Ack=40733 Win=1040 Len=0"
"340","25.507714","104.244.42.65","192.168.0.183","TLSv1.2","211","Application Data"
"341","25.561510","192.168.0.183","104.244.42.65","TCP","54","50717  >  443 [ACK] Seq=263168 Ack=40890 Win=1040 Len=0"
"342","26.798203","192.168.0.183","104.244.42.65","TLSv1.2","298","Application Data"
"343","26.798332","192.168.0.183","104.244.42.65","TCP","1414","50717  >  443 [ACK] Seq=263412 Ack=40890 Win=1040 Len=1360 [TCP segment of a reassembled PDU]"
"344","26.798332","192.168.0.183","104.244.42.65","TCP","1414","50717  >  443 [ACK] Seq=264772 Ack=40890 Win=1040 Len=1360 [TCP segment of a reassembled PDU]"
"345","26.798332","192.168.0.183","104.244.42.65","TCP","1414","50717  >  443 [ACK] Seq=266132 Ack=40890 Win=1040 Len=1360 [TCP segment of a reassembled PDU]"
"346","26.798332","192.168.0.183","104.244.42.65","TCP","1414","50717  >  443 [ACK] Seq=267492 Ack=40890 Win=1040 Len=1360 [TCP segment of a reassembled PDU]"
"347","26.798332","192.168.0.183","104.244.42.65","TCP","1414","50717  >  443 [ACK] Seq=268852 Ack=40890 Win=1040 Len=1360 [TCP segment of a reassembled PDU]"
"348","26.798332","192.168.0.183","104.244.42.65","TCP","1414","50717  >  443 [ACK] Seq=270212 Ack=40890 Win=1040 Len=1360 [TCP segment of a reassembled PDU]"
"349","26.798332","192.168.0.183","104.244.42.65","TCP","1414","50717  >  443 [ACK] Seq=271572 Ack=40890 Win=1040 Len=1360 [TCP segment of a reassembled PDU]"
"350","26.798332","192.168.0.183","104.244.42.65","TCP","1414","50717  >  443 [ACK] Seq=272932 Ack=40890 Win=1040 Len=1360 [TCP segment of a reassembled PDU]"
"351","26.798332","192.168.0.183","104.244.42.65","TCP","1414","50717  >  443 [ACK] Seq=274292 Ack=40890 Win=1040 Len=1360 [TCP segment of a reassembled PDU]"
"352","26.798332","192.168.0.183","104.244.42.65","TCP","1414","50717  >  443 [ACK] Seq=275652 Ack=40890 Win=1040 Len=1360 [TCP segment of a reassembled PDU]"
"353","26.798332","192.168.0.183","104.244.42.65","TCP","1414","50717  >  443 [ACK] Seq=277012 Ack=40890 Win=1040 Len=1360 [TCP segment of a reassembled PDU]"
"354","26.798332","192.168.0.183","104.244.42.65","TCP","1414","50717  >  443 [ACK] Seq=278372 Ack=40890 Win=1040 Len=1360 [TCP segment of a reassembled PDU]"
"355","26.798332","192.168.0.183","104.244.42.65","TLSv1.2","140","Application Data"
"356","26.798489","192.168.0.183","104.244.42.65","TCP","1414","50717  >  443 [ACK] Seq=279818 Ack=40890 Win=1040 Len=1360 [TCP segment of a reassembled PDU]"
"357","26.798489","192.168.0.183","104.244.42.65","TCP","1414","50717  >  443 [ACK] Seq=281178 Ack=40890 Win=1040 Len=1360 [TCP segment of a reassembled PDU]"
"358","26.798489","192.168.0.183","104.244.42.65","TCP","1414","50717  >  443 [ACK] Seq=282538 Ack=40890 Win=1040 Len=1360 [TCP segment of a reassembled PDU]"
"359","26.798489","192.168.0.183","104.244.42.65","TCP","1414","50717  >  443 [ACK] Seq=283898 Ack=40890 Win=1040 Len=1360 [TCP segment of a reassembled PDU]"
"360","26.798489","192.168.0.183","104.244.42.65","TCP","1414","50717  >  443 [ACK] Seq=285258 Ack=40890 Win=1040 Len=1360 [TCP segment of a reassembled PDU]"
"361","26.798489","192.168.0.183","104.244.42.65","TCP","1414","50717  >  443 [ACK] Seq=286618 Ack=40890 Win=1040 Len=1360 [TCP segment of a reassembled PDU]"
"362","26.798489","192.168.0.183","104.244.42.65","TCP","1414","50717  >  443 [ACK] Seq=287978 Ack=40890 Win=1040 Len=1360 [TCP segment of a reassembled PDU]"
"363","26.798489","192.168.0.183","104.244.42.65","TCP","1414","50717  >  443 [ACK] Seq=289338 Ack=40890 Win=1040 Len=1360 [TCP segment of a reassembled PDU]"
"364","26.798489","192.168.0.183","104.244.42.65","TCP","1414","50717  >  443 [ACK] Seq=290698 Ack=40890 Win=1040 Len=1360 [TCP segment of a reassembled PDU]"
"365","26.798489","192.168.0.183","104.244.42.65","TCP","1414","50717  >  443 [ACK] Seq=292058 Ack=40890 Win=1040 Len=1360 [TCP segment of a reassembled PDU]"
"366","26.798489","192.168.0.183","104.244.42.65","TCP","1414","50717  >  443 [ACK] Seq=293418 Ack=40890 Win=1040 Len=1360 [TCP segment of a reassembled PDU]"
"367","26.798489","192.168.0.183","104.244.42.65","TCP","1414","50717  >  443 [ACK] Seq=294778 Ack=40890 Win=1040 Len=1360 [TCP segment of a reassembled PDU]"
"368","26.798489","192.168.0.183","104.244.42.65","TLSv1.2","140","Application Data"
"369","26.798646","192.168.0.183","104.244.42.65","TCP","1414","50717  >  443 [ACK] Seq=296224 Ack=40890 Win=1040 Len=1360 [TCP segment of a reassembled PDU]"
"370","26.798646","192.168.0.183","104.244.42.65","TCP","1414","50717  >  443 [ACK] Seq=297584 Ack=40890 Win=1040 Len=1360 [TCP segment of a reassembled PDU]"
"371","26.798646","192.168.0.183","104.244.42.65","TCP","1414","50717  >  443 [ACK] Seq=298944 Ack=40890 Win=1040 Len=1360 [TCP segment of a reassembled PDU]"
"372","26.798646","192.168.0.183","104.244.42.65","TCP","1414","50717  >  443 [ACK] Seq=300304 Ack=40890 Win=1040 Len=1360 [TCP segment of a reassembled PDU]"
"373","26.798646","192.168.0.183","104.244.42.65","TCP","1414","50717  >  443 [ACK] Seq=301664 Ack=40890 Win=1040 Len=1360 [TCP segment of a reassembled PDU]"
"374","26.798646","192.168.0.183","104.244.42.65","TCP","1414","50717  >  443 [ACK] Seq=303024 Ack=40890 Win=1040 Len=1360 [TCP segment of a reassembled PDU]"
"375","26.798646","192.168.0.183","104.244.42.65","TCP","1414","50717  >  443 [ACK] Seq=304384 Ack=40890 Win=1040 Len=1360 [TCP segment of a reassembled PDU]"
"376","26.798646","192.168.0.183","104.244.42.65","TCP","1414","50717  >  443 [ACK] Seq=305744 Ack=40890 Win=1040 Len=1360 [TCP segment of a reassembled PDU]"
"377","26.798646","192.168.0.183","104.244.42.65","TCP","1414","50717  >  443 [ACK] Seq=307104 Ack=40890 Win=1040 Len=1360 [TCP segment of a reassembled PDU]"
"378","26.798646","192.168.0.183","104.244.42.65","TCP","1414","50717  >  443 [ACK] Seq=308464 Ack=40890 Win=1040 Len=1360 [TCP segment of a reassembled PDU]"
"379","26.798646","192.168.0.183","104.244.42.65","TCP","1414","50717  >  443 [ACK] Seq=309824 Ack=40890 Win=1040 Len=1360 [TCP segment of a reassembled PDU]"
"380","26.798646","192.168.0.183","104.244.42.65","TCP","1414","50717  >  443 [ACK] Seq=311184 Ack=40890 Win=1040 Len=1360 [TCP segment of a reassembled PDU]"
"381","26.798646","192.168.0.183","104.244.42.65","TLSv1.2","140","Application Data"
"382","26.798798","192.168.0.183","104.244.42.65","TCP","1414","50717  >  443 [ACK] Seq=312630 Ack=40890 Win=1040 Len=1360 [TCP segment of a reassembled PDU]"
"383","26.798798","192.168.0.183","104.244.42.65","TCP","1414","50717  >  443 [ACK] Seq=313990 Ack=40890 Win=1040 Len=1360 [TCP segment of a reassembled PDU]"
"384","26.798798","192.168.0.183","104.244.42.65","TCP","1414","50717  >  443 [ACK] Seq=315350 Ack=40890 Win=1040 Len=1360 [TCP segment of a reassembled PDU]"
"385","26.798798","192.168.0.183","104.244.42.65","TCP","1414","50717  >  443 [ACK] Seq=316710 Ack=40890 Win=1040 Len=1360 [TCP segment of a reassembled PDU]"
"386","26.798798","192.168.0.183","104.244.42.65","TCP","1414","50717  >  443 [ACK] Seq=318070 Ack=40890 Win=1040 Len=1360 [TCP segment of a reassembled PDU]"
"387","26.798798","192.168.0.183","104.244.42.65","TCP","1414","50717  >  443 [ACK] Seq=319430 Ack=40890 Win=1040 Len=1360 [TCP segment of a reassembled PDU]"
"388","26.798798","192.168.0.183","104.244.42.65","TCP","1414","50717  >  443 [ACK] Seq=320790 Ack=40890 Win=1040 Len=1360 [TCP segment of a reassembled PDU]"
"389","26.798798","192.168.0.183","104.244.42.65","TCP","1414","50717  >  443 [ACK] Seq=322150 Ack=40890 Win=1040 Len=1360 [TCP segment of a reassembled PDU]"
"390","26.798798","192.168.0.183","104.244.42.65","TCP","1414","50717  >  443 [ACK] Seq=323510 Ack=40890 Win=1040 Len=1360 [TCP segment of a reassembled PDU]"
"391","26.798798","192.168.0.183","104.244.42.65","TCP","1414","50717  >  443 [ACK] Seq=324870 Ack=40890 Win=1040 Len=1360 [TCP segment of a reassembled PDU]"
"392","26.798798","192.168.0.183","104.244.42.65","TCP","1414","50717  >  443 [ACK] Seq=326230 Ack=40890 Win=1040 Len=1360 [TCP segment of a reassembled PDU]"
"393","26.798798","192.168.0.183","104.244.42.65","TCP","1414","50717  >  443 [ACK] Seq=327590 Ack=40890 Win=1040 Len=1360 [TCP segment of a reassembled PDU]"
"394","26.798798","192.168.0.183","104.244.42.65","TLSv1.2","140","Application Data"
"395","26.799173","192.168.0.183","104.244.42.65","TLSv1.2","121","Application Data"
"396","26.840074","104.244.42.65","192.168.0.183","TCP","60","443  >  50717 [ACK] Seq=40890 Ack=329103 Win=5678 Len=0"
"397","26.840074","104.244.42.65","192.168.0.183","TLSv1.2","89","Application Data"
"398","26.840360","192.168.0.183","104.244.42.65","TCP","1414","50717  >  443 [ACK] Seq=329103 Ack=40925 Win=1040 Len=1360 [TCP segment of a reassembled PDU]"
"399","26.840360","192.168.0.183","104.244.42.65","TCP","1414","50717  >  443 [ACK] Seq=330463 Ack=40925 Win=1040 Len=1360 [TCP segment of a reassembled PDU]"
"400","26.840360","192.168.0.183","104.244.42.65","TCP","1414","50717  >  443 [ACK] Seq=331823 Ack=40925 Win=1040 Len=1360 [TCP segment of a reassembled PDU]"
"401","26.840360","192.168.0.183","104.244.42.65","TCP","1414","50717  >  443 [ACK] Seq=333183 Ack=40925 Win=1040 Len=1360 [TCP segment of a reassembled PDU]"
"402","26.840360","192.168.0.183","104.244.42.65","TCP","1414","50717  >  443 [ACK] Seq=334543 Ack=40925 Win=1040 Len=1360 [TCP segment of a reassembled PDU]"
"403","26.840360","192.168.0.183","104.244.42.65","TCP","1414","50717  >  443 [ACK] Seq=335903 Ack=40925 Win=1040 Len=1360 [TCP segment of a reassembled PDU]"
"404","26.840360","192.168.0.183","104.244.42.65","TCP","1414","50717  >  443 [ACK] Seq=337263 Ack=40925 Win=1040 Len=1360 [TCP segment of a reassembled PDU]"
"405","26.840360","192.168.0.183","104.244.42.65","TCP","1414","50717  >  443 [ACK] Seq=338623 Ack=40925 Win=1040 Len=1360 [TCP segment of a reassembled PDU]"
"406","26.840360","192.168.0.183","104.244.42.65","TLSv1.2","787","Application Data"
"407","26.889179","104.244.42.65","192.168.0.183","TCP","60","443  >  50717 [ACK] Seq=40925 Ack=334543 Win=5721 Len=0"
"408","26.889179","104.244.42.65","192.168.0.183","TCP","60","443  >  50717 [ACK] Seq=40925 Ack=339983 Win=5725 Len=0"
"409","26.929265","104.244.42.65","192.168.0.183","TCP","60","443  >  50717 [ACK] Seq=40925 Ack=340716 Win=5735 Len=0"
"410","26.945658","104.244.42.65","192.168.0.183","TLSv1.2","184","Application Data"
"411","26.988374","192.168.0.183","104.244.42.65","TCP","54","50717  >  443 [ACK] Seq=340716 Ack=41055 Win=1039 Len=0"
"412","29.109921","192.168.0.183","104.244.42.65","TCP","1414","50717  >  443 [ACK] Seq=340716 Ack=41055 Win=1039 Len=1360 [TCP segment of a reassembled PDU]"
"413","29.109921","192.168.0.183","104.244.42.65","TLSv1.2","351","Application Data"
"414","29.146659","104.244.42.65","192.168.0.183","TCP","60","443  >  50717 [ACK] Seq=41055 Ack=342373 Win=5731 Len=0"
"415","29.764885","192.168.0.183","104.244.42.65","TLSv1.2","664","Application Data"
"416","29.765003","192.168.0.183","104.244.42.65","TCP","1414","50717  >  443 [ACK] Seq=342983 Ack=41055 Win=1039 Len=1360 [TCP segment of a reassembled PDU]"
"417","29.765003","192.168.0.183","104.244.42.65","TCP","1414","50717  >  443 [ACK] Seq=344343 Ack=41055 Win=1039 Len=1360 [TCP segment of a reassembled PDU]"
"418","29.765003","192.168.0.183","104.244.42.65","TCP","1414","50717  >  443 [ACK] Seq=345703 Ack=41055 Win=1039 Len=1360 [TCP segment of a reassembled PDU]"
"419","29.765003","192.168.0.183","104.244.42.65","TCP","1414","50717  >  443 [ACK] Seq=347063 Ack=41055 Win=1039 Len=1360 [TCP segment of a reassembled PDU]"
"420","29.765003","192.168.0.183","104.244.42.65","TCP","1414","50717  >  443 [ACK] Seq=348423 Ack=41055 Win=1039 Len=1360 [TCP segment of a reassembled PDU]"
"421","29.765003","192.168.0.183","104.244.42.65","TCP","1414","50717  >  443 [ACK] Seq=349783 Ack=41055 Win=1039 Len=1360 [TCP segment of a reassembled PDU]"
"422","29.765003","192.168.0.183","104.244.42.65","TCP","1414","50717  >  443 [ACK] Seq=351143 Ack=41055 Win=1039 Len=1360 [TCP segment of a reassembled PDU]"
"423","29.765003","192.168.0.183","104.244.42.65","TCP","1414","50717  >  443 [ACK] Seq=352503 Ack=41055 Win=1039 Len=1360 [TCP segment of a reassembled PDU]"
"424","29.765003","192.168.0.183","104.244.42.65","TCP","1414","50717  >  443 [ACK] Seq=353863 Ack=41055 Win=1039 Len=1360 [TCP segment of a reassembled PDU]"
"425","29.765003","192.168.0.183","104.244.42.65","TCP","1414","50717  >  443 [ACK] Seq=355223 Ack=41055 Win=1039 Len=1360 [TCP segment of a reassembled PDU]"
"426","29.765003","192.168.0.183","104.244.42.65","TCP","1414","50717  >  443 [ACK] Seq=356583 Ack=41055 Win=1039 Len=1360 [TCP segment of a reassembled PDU]"
"427","29.765003","192.168.0.183","104.244.42.65","TCP","1414","50717  >  443 [ACK] Seq=357943 Ack=41055 Win=1039 Len=1360 [TCP segment of a reassembled PDU]"
"428","29.765003","192.168.0.183","104.244.42.65","TLSv1.2","140","Application Data"
"429","29.765128","192.168.0.183","104.244.42.65","TCP","1414","50717  >  443 [ACK] Seq=359389 Ack=41055 Win=1039 Len=1360 [TCP segment of a reassembled PDU]"
"430","29.765128","192.168.0.183","104.244.42.65","TCP","1414","50717  >  443 [ACK] Seq=360749 Ack=41055 Win=1039 Len=1360 [TCP segment of a reassembled PDU]"
"431","29.765128","192.168.0.183","104.244.42.65","TCP","1414","50717  >  443 [ACK] Seq=362109 Ack=41055 Win=1039 Len=1360 [TCP segment of a reassembled PDU]"
"432","29.765128","192.168.0.183","104.244.42.65","TCP","1414","50717  >  443 [ACK] Seq=363469 Ack=41055 Win=1039 Len=1360 [TCP segment of a reassembled PDU]"
"433","29.765128","192.168.0.183","104.244.42.65","TCP","1414","50717  >  443 [ACK] Seq=364829 Ack=41055 Win=1039 Len=1360 [TCP segment of a reassembled PDU]"
"434","29.765128","192.168.0.183","104.244.42.65","TCP","1414","50717  >  443 [ACK] Seq=366189 Ack=41055 Win=1039 Len=1360 [TCP segment of a reassembled PDU]"
"435","29.765128","192.168.0.183","104.244.42.65","TCP","1414","50717  >  443 [ACK] Seq=367549 Ack=41055 Win=1039 Len=1360 [TCP segment of a reassembled PDU]"
"436","29.765128","192.168.0.183","104.244.42.65","TCP","1414","50717  >  443 [ACK] Seq=368909 Ack=41055 Win=1039 Len=1360 [TCP segment of a reassembled PDU]"
"437","29.765128","192.168.0.183","104.244.42.65","TCP","1414","50717  >  443 [ACK] Seq=370269 Ack=41055 Win=1039 Len=1360 [TCP segment of a reassembled PDU]"
"438","29.765128","192.168.0.183","104.244.42.65","TCP","1414","50717  >  443 [ACK] Seq=371629 Ack=41055 Win=1039 Len=1360 [TCP segment of a reassembled PDU]"
"439","29.765128","192.168.0.183","104.244.42.65","TCP","1414","50717  >  443 [ACK] Seq=372989 Ack=41055 Win=1039 Len=1360 [TCP segment of a reassembled PDU]"
"440","29.765128","192.168.0.183","104.244.42.65","TCP","1414","50717  >  443 [ACK] Seq=374349 Ack=41055 Win=1039 Len=1360 [TCP segment of a reassembled PDU]"
"441","29.765128","192.168.0.183","104.244.42.65","TLSv1.2","140","Application Data"
"442","29.765223","192.168.0.183","104.244.42.65","TCP","1414","50717  >  443 [ACK] Seq=375795 Ack=41055 Win=1039 Len=1360 [TCP segment of a reassembled PDU]"
"443","29.765223","192.168.0.183","104.244.42.65","TLSv1.2","1224","Application Data"
"444","29.802384","104.244.42.65","192.168.0.183","TCP","60","443  >  50717 [ACK] Seq=41055 Ack=344343 Win=5730 Len=0"
"445","29.807589","104.244.42.65","192.168.0.183","TCP","60","443  >  50717 [ACK] Seq=41055 Ack=378325 Win=5684 Len=0"
"446","29.807589","104.244.42.65","192.168.0.183","TLSv1.2","89","Application Data"
"447","29.850379","192.168.0.183","104.244.42.65","TCP","54","50717  >  443 [ACK] Seq=378325 Ack=41090 Win=1039 Len=0"
"448","29.856338","104.244.42.65","192.168.0.183","TLSv1.2","184","Application Data"
"449","29.877618","104.244.42.65","192.168.0.183","TCP","1414","443  >  50717 [ACK] Seq=41220 Ack=378325 Win=5735 Len=1360 [TCP segment of a reassembled PDU]"
"450","29.877618","104.244.42.65","192.168.0.183","TCP","1414","443  >  50717 [ACK] Seq=42580 Ack=378325 Win=5735 Len=1360 [TCP segment of a reassembled PDU]"
"451","29.877618","104.244.42.65","192.168.0.183","TCP","1414","443  >  50717 [PSH, ACK] Seq=43940 Ack=378325 Win=5735 Len=1360 [TCP segment of a reassembled PDU]"
"452","29.877618","104.244.42.65","192.168.0.183","TCP","1414","443  >  50717 [ACK] Seq=45300 Ack=378325 Win=5735 Len=1360 [TCP segment of a reassembled PDU]"
"453","29.877618","104.244.42.65","192.168.0.183","TCP","1414","443  >  50717 [ACK] Seq=46660 Ack=378325 Win=5735 Len=1360 [TCP segment of a reassembled PDU]"
"454","29.877618","104.244.42.65","192.168.0.183","TLSv1.2","1248","Application Data"
"455","29.877660","192.168.0.183","104.244.42.65","TCP","54","50717  >  443 [ACK] Seq=378325 Ack=49214 Win=1041 Len=0"
"456","29.878873","192.168.0.183","104.244.42.65","TLSv1.2","89","Application Data"
"457","29.956491","104.244.42.65","192.168.0.183","TCP","60","443  >  50717 [ACK] Seq=49214 Ack=378360 Win=5735 Len=0"
"458","30.287932","192.168.0.183","104.244.42.65","TCP","1414","50717  >  443 [ACK] Seq=378360 Ack=49214 Win=1041 Len=1360 [TCP segment of a reassembled PDU]"
"459","30.287932","192.168.0.183","104.244.42.65","TLSv1.2","630","Application Data"
"460","30.323231","104.244.42.65","192.168.0.183","TCP","60","443  >  50717 [ACK] Seq=49214 Ack=380296 Win=5730 Len=0"
"461","30.412921","192.168.0.183","104.244.42.65","TLSv1.2","359","Application Data"
"462","30.413010","192.168.0.183","104.244.42.65","TLSv1.2","669","Application Data"
"463","30.449686","104.244.42.65","192.168.0.183","TCP","60","443  >  50717 [ACK] Seq=49214 Ack=381216 Win=5732 Len=0"
"464","30.473253","104.244.42.65","192.168.0.183","TLSv1.2","281","Application Data"
"465","30.526645","192.168.0.183","104.244.42.65","TCP","54","50717  >  443 [ACK] Seq=381216 Ack=49441 Win=1040 Len=0"
"466","31.197798","104.244.42.65","192.168.0.183","TCP","1414","443  >  50717 [ACK] Seq=49441 Ack=381216 Win=5735 Len=1360 [TCP segment of a reassembled PDU]"
"467","31.197798","104.244.42.65","192.168.0.183","TCP","1414","443  >  50717 [ACK] Seq=50801 Ack=381216 Win=5735 Len=1360 [TCP segment of a reassembled PDU]"
"468","31.197798","104.244.42.65","192.168.0.183","TCP","1414","443  >  50717 [PSH, ACK] Seq=52161 Ack=381216 Win=5735 Len=1360 [TCP segment of a reassembled PDU]"
"469","31.197798","104.244.42.65","192.168.0.183","TCP","1414","443  >  50717 [ACK] Seq=53521 Ack=381216 Win=5735 Len=1360 [TCP segment of a reassembled PDU]"
"470","31.197798","104.244.42.65","192.168.0.183","TCP","1414","443  >  50717 [ACK] Seq=54881 Ack=381216 Win=5735 Len=1360 [TCP segment of a reassembled PDU]"
"471","31.197798","104.244.42.65","192.168.0.183","TLSv1.2","187","Application Data"
"472","31.197841","192.168.0.183","104.244.42.65","TCP","54","50717  >  443 [ACK] Seq=381216 Ack=56374 Win=1041 Len=0"
"473","32.768828","192.168.0.183","104.244.42.65","TLSv1.2","235","Application Data"
"474","32.769034","192.168.0.183","104.244.42.65","TCP","1414","50717  >  443 [ACK] Seq=381397 Ack=56374 Win=1041 Len=1360 [TCP segment of a reassembled PDU]"
"475","32.769034","192.168.0.183","104.244.42.65","TCP","1414","50717  >  443 [ACK] Seq=382757 Ack=56374 Win=1041 Len=1360 [TCP segment of a reassembled PDU]"
"476","32.769034","192.168.0.183","104.244.42.65","TCP","1414","50717  >  443 [ACK] Seq=384117 Ack=56374 Win=1041 Len=1360 [TCP segment of a reassembled PDU]"
"477","32.769034","192.168.0.183","104.244.42.65","TCP","1414","50717  >  443 [ACK] Seq=385477 Ack=56374 Win=1041 Len=1360 [TCP segment of a reassembled PDU]"
"478","32.769034","192.168.0.183","104.244.42.65","TCP","1414","50717  >  443 [ACK] Seq=386837 Ack=56374 Win=1041 Len=1360 [TCP segment of a reassembled PDU]"
"479","32.769034","192.168.0.183","104.244.42.65","TCP","1414","50717  >  443 [ACK] Seq=388197 Ack=56374 Win=1041 Len=1360 [TCP segment of a reassembled PDU]"
"480","32.769034","192.168.0.183","104.244.42.65","TCP","1414","50717  >  443 [ACK] Seq=389557 Ack=56374 Win=1041 Len=1360 [TCP segment of a reassembled PDU]"
"481","32.769034","192.168.0.183","104.244.42.65","TCP","1414","50717  >  443 [ACK] Seq=390917 Ack=56374 Win=1041 Len=1360 [TCP segment of a reassembled PDU]"
"482","32.769034","192.168.0.183","104.244.42.65","TCP","1414","50717  >  443 [ACK] Seq=392277 Ack=56374 Win=1041 Len=1360 [TCP segment of a reassembled PDU]"
"483","32.769034","192.168.0.183","104.244.42.65","TCP","1414","50717  >  443 [ACK] Seq=393637 Ack=56374 Win=1041 Len=1360 [TCP segment of a reassembled PDU]"
"484","32.769034","192.168.0.183","104.244.42.65","TCP","1414","50717  >  443 [ACK] Seq=394997 Ack=56374 Win=1041 Len=1360 [TCP segment of a reassembled PDU]"
"485","32.769034","192.168.0.183","104.244.42.65","TCP","1414","50717  >  443 [ACK] Seq=396357 Ack=56374 Win=1041 Len=1360 [TCP segment of a reassembled PDU]"
"486","32.769034","192.168.0.183","104.244.42.65","TLSv1.2","140","Application Data"
"487","32.769313","192.168.0.183","104.244.42.65","TCP","1414","50717  >  443 [ACK] Seq=397803 Ack=56374 Win=1041 Len=1360 [TCP segment of a reassembled PDU]"
"488","32.769313","192.168.0.183","104.244.42.65","TCP","1414","50717  >  443 [ACK] Seq=399163 Ack=56374 Win=1041 Len=1360 [TCP segment of a reassembled PDU]"
"489","32.769313","192.168.0.183","104.244.42.65","TCP","1414","50717  >  443 [ACK] Seq=400523 Ack=56374 Win=1041 Len=1360 [TCP segment of a reassembled PDU]"
"490","32.769313","192.168.0.183","104.244.42.65","TCP","1414","50717  >  443 [ACK] Seq=401883 Ack=56374 Win=1041 Len=1360 [TCP segment of a reassembled PDU]"
"491","32.769313","192.168.0.183","104.244.42.65","TCP","1414","50717  >  443 [ACK] Seq=403243 Ack=56374 Win=1041 Len=1360 [TCP segment of a reassembled PDU]"
"492","32.769313","192.168.0.183","104.244.42.65","TCP","1414","50717  >  443 [ACK] Seq=404603 Ack=56374 Win=1041 Len=1360 [TCP segment of a reassembled PDU]"
"493","32.769313","192.168.0.183","104.244.42.65","TCP","1414","50717  >  443 [ACK] Seq=405963 Ack=56374 Win=1041 Len=1360 [TCP segment of a reassembled PDU]"
"494","32.769313","192.168.0.183","104.244.42.65","TCP","1414","50717  >  443 [ACK] Seq=407323 Ack=56374 Win=1041 Len=1360 [TCP segment of a reassembled PDU]"
"495","32.769313","192.168.0.183","104.244.42.65","TCP","1414","50717  >  443 [ACK] Seq=408683 Ack=56374 Win=1041 Len=1360 [TCP segment of a reassembled PDU]"
"496","32.769313","192.168.0.183","104.244.42.65","TCP","1414","50717  >  443 [ACK] Seq=410043 Ack=56374 Win=1041 Len=1360 [TCP segment of a reassembled PDU]"
"497","32.769313","192.168.0.183","104.244.42.65","TCP","1414","50717  >  443 [ACK] Seq=411403 Ack=56374 Win=1041 Len=1360 [TCP segment of a reassembled PDU]"
"498","32.769313","192.168.0.183","104.244.42.65","TCP","1414","50717  >  443 [ACK] Seq=412763 Ack=56374 Win=1041 Len=1360 [TCP segment of a reassembled PDU]"
"499","32.769313","192.168.0.183","104.244.42.65","TLSv1.2","140","Application Data"
"500","32.769522","192.168.0.183","104.244.42.65","TCP","1414","50717  >  443 [ACK] Seq=414209 Ack=56374 Win=1041 Len=1360 [TCP segment of a reassembled PDU]"
"501","32.769522","192.168.0.183","104.244.42.65","TCP","1414","50717  >  443 [ACK] Seq=415569 Ack=56374 Win=1041 Len=1360 [TCP segment of a reassembled PDU]"
"502","32.769522","192.168.0.183","104.244.42.65","TCP","1414","50717  >  443 [ACK] Seq=416929 Ack=56374 Win=1041 Len=1360 [TCP segment of a reassembled PDU]"
"503","32.769522","192.168.0.183","104.244.42.65","TCP","1414","50717  >  443 [ACK] Seq=418289 Ack=56374 Win=1041 Len=1360 [TCP segment of a reassembled PDU]"
"504","32.769522","192.168.0.183","104.244.42.65","TCP","1414","50717  >  443 [ACK] Seq=419649 Ack=56374 Win=1041 Len=1360 [TCP segment of a reassembled PDU]"
"505","32.769522","192.168.0.183","104.244.42.65","TCP","1414","50717  >  443 [ACK] Seq=421009 Ack=56374 Win=1041 Len=1360 [TCP segment of a reassembled PDU]"
"506","32.769522","192.168.0.183","104.244.42.65","TCP","1414","50717  >  443 [ACK] Seq=422369 Ack=56374 Win=1041 Len=1360 [TCP segment of a reassembled PDU]"
"507","32.769522","192.168.0.183","104.244.42.65","TCP","1414","50717  >  443 [ACK] Seq=423729 Ack=56374 Win=1041 Len=1360 [TCP segment of a reassembled PDU]"
"508","32.769522","192.168.0.183","104.244.42.65","TCP","1414","50717  >  443 [ACK] Seq=425089 Ack=56374 Win=1041 Len=1360 [TCP segment of a reassembled PDU]"
"509","32.769522","192.168.0.183","104.244.42.65","TCP","1414","50717  >  443 [ACK] Seq=426449 Ack=56374 Win=1041 Len=1360 [TCP segment of a reassembled PDU]"
"510","32.769522","192.168.0.183","104.244.42.65","TCP","1414","50717  >  443 [ACK] Seq=427809 Ack=56374 Win=1041 Len=1360 [TCP segment of a reassembled PDU]"
"511","32.769522","192.168.0.183","104.244.42.65","TCP","1414","50717  >  443 [ACK] Seq=429169 Ack=56374 Win=1041 Len=1360 [TCP segment of a reassembled PDU]"
"512","32.769522","192.168.0.183","104.244.42.65","TLSv1.2","140","Application Data"
"513","32.769658","192.168.0.183","104.244.42.65","TCP","1414","50717  >  443 [ACK] Seq=430615 Ack=56374 Win=1041 Len=1360 [TCP segment of a reassembled PDU]"
"514","32.769658","192.168.0.183","104.244.42.65","TCP","1414","50717  >  443 [ACK] Seq=431975 Ack=56374 Win=1041 Len=1360 [TCP segment of a reassembled PDU]"
"515","32.769658","192.168.0.183","104.244.42.65","TCP","1414","50717  >  443 [ACK] Seq=433335 Ack=56374 Win=1041 Len=1360 [TCP segment of a reassembled PDU]"
"516","32.769658","192.168.0.183","104.244.42.65","TCP","1414","50717  >  443 [ACK] Seq=434695 Ack=56374 Win=1041 Len=1360 [TCP segment of a reassembled PDU]"
"517","32.769658","192.168.0.183","104.244.42.65","TCP","1414","50717  >  443 [ACK] Seq=436055 Ack=56374 Win=1041 Len=1360 [TCP segment of a reassembled PDU]"
"518","32.769658","192.168.0.183","104.244.42.65","TCP","1414","50717  >  443 [ACK] Seq=437415 Ack=56374 Win=1041 Len=1360 [TCP segment of a reassembled PDU]"
"519","32.769658","192.168.0.183","104.244.42.65","TCP","1414","50717  >  443 [ACK] Seq=438775 Ack=56374 Win=1041 Len=1360 [TCP segment of a reassembled PDU]"
"520","32.769658","192.168.0.183","104.244.42.65","TCP","1414","50717  >  443 [ACK] Seq=440135 Ack=56374 Win=1041 Len=1360 [TCP segment of a reassembled PDU]"
"521","32.769658","192.168.0.183","104.244.42.65","TCP","1414","50717  >  443 [ACK] Seq=441495 Ack=56374 Win=1041 Len=1360 [TCP segment of a reassembled PDU]"
"522","32.769658","192.168.0.183","104.244.42.65","TCP","1414","50717  >  443 [ACK] Seq=442855 Ack=56374 Win=1041 Len=1360 [TCP segment of a reassembled PDU]"
"523","32.769658","192.168.0.183","104.244.42.65","TCP","1414","50717  >  443 [ACK] Seq=444215 Ack=56374 Win=1041 Len=1360 [TCP segment of a reassembled PDU]"
"524","32.769658","192.168.0.183","104.244.42.65","TLSv1.2","105","Application Data"
"525","32.806528","104.244.42.65","192.168.0.183","TCP","60","443  >  50717 [ACK] Seq=56374 Ack=382757 Win=5731 Len=0"
"526","32.812194","104.244.42.65","192.168.0.183","TCP","60","443  >  50717 [ACK] Seq=56374 Ack=445626 Win=5690 Len=0"
"527","32.812194","104.244.42.65","192.168.0.183","TLSv1.2","89","Application Data"
"528","32.855694","192.168.0.183","104.244.42.65","TCP","54","50717  >  443 [ACK] Seq=445626 Ack=56409 Win=1041 Len=0"
"529","32.876693","104.244.42.65","192.168.0.183","TLSv1.2","182","Application Data"
"530","32.932003","192.168.0.183","104.244.42.65","TCP","54","50717  >  443 [ACK] Seq=445626 Ack=56537 Win=1040 Len=0"
"531","35.765190","192.168.0.183","104.244.42.65","TLSv1.2","268","Application Data"
"532","35.765265","192.168.0.183","104.244.42.65","TLSv1.2","168","Application Data"
"533","35.802068","192.168.0.183","104.244.42.65","TLSv1.2","304","Application Data"
"534","35.802217","192.168.0.183","104.244.42.65","TCP","1414","50717  >  443 [ACK] Seq=446204 Ack=56537 Win=1040 Len=1360 [TCP segment of a reassembled PDU]"
"535","35.802217","192.168.0.183","104.244.42.65","TCP","1414","50717  >  443 [ACK] Seq=447564 Ack=56537 Win=1040 Len=1360 [TCP segment of a reassembled PDU]"
"536","35.802217","192.168.0.183","104.244.42.65","TCP","1414","50717  >  443 [ACK] Seq=448924 Ack=56537 Win=1040 Len=1360 [TCP segment of a reassembled PDU]"
"537","35.802217","192.168.0.183","104.244.42.65","TCP","1414","50717  >  443 [ACK] Seq=450284 Ack=56537 Win=1040 Len=1360 [TCP segment of a reassembled PDU]"
"538","35.802217","192.168.0.183","104.244.42.65","TCP","1414","50717  >  443 [ACK] Seq=451644 Ack=56537 Win=1040 Len=1360 [TCP segment of a reassembled PDU]"
"539","35.802217","192.168.0.183","104.244.42.65","TCP","1414","50717  >  443 [ACK] Seq=453004 Ack=56537 Win=1040 Len=1360 [TCP segment of a reassembled PDU]"
"540","35.802217","192.168.0.183","104.244.42.65","TCP","1414","50717  >  443 [ACK] Seq=454364 Ack=56537 Win=1040 Len=1360 [TCP segment of a reassembled PDU]"
"541","35.802217","192.168.0.183","104.244.42.65","TCP","1414","50717  >  443 [ACK] Seq=455724 Ack=56537 Win=1040 Len=1360 [TCP segment of a reassembled PDU]"
"542","35.802217","192.168.0.183","104.244.42.65","TCP","1414","50717  >  443 [ACK] Seq=457084 Ack=56537 Win=1040 Len=1360 [TCP segment of a reassembled PDU]"
"543","35.802217","192.168.0.183","104.244.42.65","TCP","1414","50717  >  443 [ACK] Seq=458444 Ack=56537 Win=1040 Len=1360 [TCP segment of a reassembled PDU]"
"544","35.802217","192.168.0.183","104.244.42.65","TCP","1414","50717  >  443 [ACK] Seq=459804 Ack=56537 Win=1040 Len=1360 [TCP segment of a reassembled PDU]"
"545","35.802217","192.168.0.183","104.244.42.65","TCP","1414","50717  >  443 [ACK] Seq=461164 Ack=56537 Win=1040 Len=1360 [TCP segment of a reassembled PDU]"
"546","35.802217","192.168.0.183","104.244.42.65","TLSv1.2","140","Application Data"
"547","35.802298","104.244.42.65","192.168.0.183","TCP","60","443  >  50717 [ACK] Seq=56537 Ack=445954 Win=5735 Len=0"
"548","35.802441","192.168.0.183","104.244.42.65","TCP","1414","50717  >  443 [ACK] Seq=462610 Ack=56537 Win=1040 Len=1360 [TCP segment of a reassembled PDU]"
"549","35.802441","192.168.0.183","104.244.42.65","TCP","1414","50717  >  443 [ACK] Seq=463970 Ack=56537 Win=1040 Len=1360 [TCP segment of a reassembled PDU]"
"550","35.802441","192.168.0.183","104.244.42.65","TCP","1414","50717  >  443 [ACK] Seq=465330 Ack=56537 Win=1040 Len=1360 [TCP segment of a reassembled PDU]"
"551","35.802441","192.168.0.183","104.244.42.65","TCP","1414","50717  >  443 [ACK] Seq=466690 Ack=56537 Win=1040 Len=1360 [TCP segment of a reassembled PDU]"
"552","35.802441","192.168.0.183","104.244.42.65","TCP","1414","50717  >  443 [ACK] Seq=468050 Ack=56537 Win=1040 Len=1360 [TCP segment of a reassembled PDU]"
"553","35.802441","192.168.0.183","104.244.42.65","TCP","1414","50717  >  443 [ACK] Seq=469410 Ack=56537 Win=1040 Len=1360 [TCP segment of a reassembled PDU]"
"554","35.802441","192.168.0.183","104.244.42.65","TLSv1.2","600","Application Data"
"555","35.846497","104.244.42.65","192.168.0.183","TCP","60","443  >  50717 [ACK] Seq=56537 Ack=447564 Win=5732 Len=0"
"556","35.846497","104.244.42.65","192.168.0.183","TCP","60","443  >  50717 [ACK] Seq=56537 Ack=471316 Win=5727 Len=0"
"557","35.878836","104.244.42.65","192.168.0.183","TLSv1.2","270","Application Data"
"558","35.879661","192.168.0.183","104.244.42.65","TLSv1.2","89","Application Data"
"559","35.881255","104.244.42.65","192.168.0.183","TLSv1.2","198","Application Data"
"560","35.933321","192.168.0.183","104.244.42.65","TCP","54","50717  >  443 [ACK] Seq=471351 Ack=56897 Win=1039 Len=0"
"561","35.957434","104.244.42.65","192.168.0.183","TCP","60","443  >  50717 [ACK] Seq=56897 Ack=471351 Win=5735 Len=0"
"562","36.919554","192.168.0.183","104.244.42.65","TCP","1414","50717  >  443 [ACK] Seq=471351 Ack=56897 Win=1039 Len=1360 [TCP segment of a reassembled PDU]"
"563","36.919554","192.168.0.183","104.244.42.65","TLSv1.2","463","Application Data"
"564","36.919921","192.168.0.183","104.244.42.65","TLSv1.2","353","Application Data"
"565","36.958582","104.244.42.65","192.168.0.183","TCP","60","443  >  50717 [ACK] Seq=56897 Ack=473120 Win=5731 Len=0"
"566","36.964825","104.244.42.65","192.168.0.183","TCP","60","443  >  50717 [ACK] Seq=56897 Ack=473419 Win=5734 Len=0"
"567","37.242194","104.244.42.65","192.168.0.183","TLSv1.2","173","Application Data"
"568","37.286470","192.168.0.183","104.244.42.65","TCP","54","50717  >  443 [ACK] Seq=473419 Ack=57016 Win=1038 Len=0"
"569","37.705220","104.244.42.65","192.168.0.183","TCP","1414","443  >  50717 [ACK] Seq=57016 Ack=473419 Win=5735 Len=1360 [TCP segment of a reassembled PDU]"
"570","37.705220","104.244.42.65","192.168.0.183","TCP","1414","443  >  50717 [ACK] Seq=58376 Ack=473419 Win=5735 Len=1360 [TCP segment of a reassembled PDU]"
"571","37.705220","104.244.42.65","192.168.0.183","TCP","1414","443  >  50717 [PSH, ACK] Seq=59736 Ack=473419 Win=5735 Len=1360 [TCP segment of a reassembled PDU]"
"572","37.705220","104.244.42.65","192.168.0.183","TCP","1414","443  >  50717 [ACK] Seq=61096 Ack=473419 Win=5735 Len=1360 [TCP segment of a reassembled PDU]"
"573","37.705220","104.244.42.65","192.168.0.183","TCP","1414","443  >  50717 [ACK] Seq=62456 Ack=473419 Win=5735 Len=1360 [TCP segment of a reassembled PDU]"
"574","37.705220","104.244.42.65","192.168.0.183","TLSv1.2","1058","Application Data"
"575","37.705266","192.168.0.183","104.244.42.65","TCP","54","50717  >  443 [ACK] Seq=473419 Ack=64820 Win=1041 Len=0"
"576","39.759824","192.168.0.183","104.244.42.65","TLSv1.2","686","Application Data"
"577","39.759947","192.168.0.183","104.244.42.65","TCP","1414","50717  >  443 [ACK] Seq=474051 Ack=64820 Win=1041 Len=1360 [TCP segment of a reassembled PDU]"
"578","39.759947","192.168.0.183","104.244.42.65","TCP","1414","50717  >  443 [ACK] Seq=475411 Ack=64820 Win=1041 Len=1360 [TCP segment of a reassembled PDU]"
"579","39.759947","192.168.0.183","104.244.42.65","TCP","1414","50717  >  443 [ACK] Seq=476771 Ack=64820 Win=1041 Len=1360 [TCP segment of a reassembled PDU]"
"580","39.759947","192.168.0.183","104.244.42.65","TCP","1414","50717  >  443 [ACK] Seq=478131 Ack=64820 Win=1041 Len=1360 [TCP segment of a reassembled PDU]"
"581","39.759947","192.168.0.183","104.244.42.65","TCP","1414","50717  >  443 [ACK] Seq=479491 Ack=64820 Win=1041 Len=1360 [TCP segment of a reassembled PDU]"
"582","39.759947","192.168.0.183","104.244.42.65","TCP","1414","50717  >  443 [ACK] Seq=480851 Ack=64820 Win=1041 Len=1360 [TCP segment of a reassembled PDU]"
"583","39.759947","192.168.0.183","104.244.42.65","TCP","1414","50717  >  443 [ACK] Seq=482211 Ack=64820 Win=1041 Len=1360 [TCP segment of a reassembled PDU]"
"584","39.759947","192.168.0.183","104.244.42.65","TCP","1414","50717  >  443 [ACK] Seq=483571 Ack=64820 Win=1041 Len=1360 [TCP segment of a reassembled PDU]"
"585","39.759947","192.168.0.183","104.244.42.65","TCP","1414","50717  >  443 [ACK] Seq=484931 Ack=64820 Win=1041 Len=1360 [TCP segment of a reassembled PDU]"
"586","39.759947","192.168.0.183","104.244.42.65","TCP","1414","50717  >  443 [ACK] Seq=486291 Ack=64820 Win=1041 Len=1360 [TCP segment of a reassembled PDU]"
"587","39.759947","192.168.0.183","104.244.42.65","TCP","1414","50717  >  443 [ACK] Seq=487651 Ack=64820 Win=1041 Len=1360 [TCP segment of a reassembled PDU]"
"588","39.759947","192.168.0.183","104.244.42.65","TCP","1414","50717  >  443 [ACK] Seq=489011 Ack=64820 Win=1041 Len=1360 [TCP segment of a reassembled PDU]"
"589","39.759947","192.168.0.183","104.244.42.65","TLSv1.2","140","Application Data"
"590","39.760063","192.168.0.183","104.244.42.65","TCP","1414","50717  >  443 [ACK] Seq=490457 Ack=64820 Win=1041 Len=1360 [TCP segment of a reassembled PDU]"
"591","39.760063","192.168.0.183","104.244.42.65","TCP","1414","50717  >  443 [ACK] Seq=491817 Ack=64820 Win=1041 Len=1360 [TCP segment of a reassembled PDU]"
"592","39.760063","192.168.0.183","104.244.42.65","TCP","1414","50717  >  443 [ACK] Seq=493177 Ack=64820 Win=1041 Len=1360 [TCP segment of a reassembled PDU]"
"593","39.760063","192.168.0.183","104.244.42.65","TCP","1414","50717  >  443 [ACK] Seq=494537 Ack=64820 Win=1041 Len=1360 [TCP segment of a reassembled PDU]"
"594","39.760063","192.168.0.183","104.244.42.65","TCP","1414","50717  >  443 [ACK] Seq=495897 Ack=64820 Win=1041 Len=1360 [TCP segment of a reassembled PDU]"
"595","39.760063","192.168.0.183","104.244.42.65","TCP","1414","50717  >  443 [ACK] Seq=497257 Ack=64820 Win=1041 Len=1360 [TCP segment of a reassembled PDU]"
"596","39.760063","192.168.0.183","104.244.42.65","TCP","1414","50717  >  443 [ACK] Seq=498617 Ack=64820 Win=1041 Len=1360 [TCP segment of a reassembled PDU]"
"597","39.760063","192.168.0.183","104.244.42.65","TCP","1414","50717  >  443 [ACK] Seq=499977 Ack=64820 Win=1041 Len=1360 [TCP segment of a reassembled PDU]"
"598","39.760063","192.168.0.183","104.244.42.65","TCP","1414","50717  >  443 [ACK] Seq=501337 Ack=64820 Win=1041 Len=1360 [TCP segment of a reassembled PDU]"
"599","39.760063","192.168.0.183","104.244.42.65","TCP","1414","50717  >  443 [ACK] Seq=502697 Ack=64820 Win=1041 Len=1360 [TCP segment of a reassembled PDU]"
"600","39.760063","192.168.0.183","104.244.42.65","TCP","1414","50717  >  443 [ACK] Seq=504057 Ack=64820 Win=1041 Len=1360 [TCP segment of a reassembled PDU]"
"601","39.760063","192.168.0.183","104.244.42.65","TCP","1414","50717  >  443 [ACK] Seq=505417 Ack=64820 Win=1041 Len=1360 [TCP segment of a reassembled PDU]"
"602","39.760063","192.168.0.183","104.244.42.65","TLSv1.2","140","Application Data"
"603","39.760168","192.168.0.183","104.244.42.65","TCP","1414","50717  >  443 [ACK] Seq=506863 Ack=64820 Win=1041 Len=1360 [TCP segment of a reassembled PDU]"
"604","39.760168","192.168.0.183","104.244.42.65","TCP","1414","50717  >  443 [ACK] Seq=508223 Ack=64820 Win=1041 Len=1360 [TCP segment of a reassembled PDU]"
"605","39.760168","192.168.0.183","104.244.42.65","TCP","1414","50717  >  443 [ACK] Seq=509583 Ack=64820 Win=1041 Len=1360 [TCP segment of a reassembled PDU]"
"606","39.760168","192.168.0.183","104.244.42.65","TCP","1414","50717  >  443 [ACK] Seq=510943 Ack=64820 Win=1041 Len=1360 [TCP segment of a reassembled PDU]"
"607","39.760168","192.168.0.183","104.244.42.65","TCP","1414","50717  >  443 [ACK] Seq=512303 Ack=64820 Win=1041 Len=1360 [TCP segment of a reassembled PDU]"
"608","39.760168","192.168.0.183","104.244.42.65","TCP","1414","50717  >  443 [ACK] Seq=513663 Ack=64820 Win=1041 Len=1360 [TCP segment of a reassembled PDU]"
"609","39.760168","192.168.0.183","104.244.42.65","TCP","1414","50717  >  443 [ACK] Seq=515023 Ack=64820 Win=1041 Len=1360 [TCP segment of a reassembled PDU]"
"610","39.760168","192.168.0.183","104.244.42.65","TCP","1414","50717  >  443 [ACK] Seq=516383 Ack=64820 Win=1041 Len=1360 [TCP segment of a reassembled PDU]"
"611","39.760168","192.168.0.183","104.244.42.65","TCP","1414","50717  >  443 [ACK] Seq=517743 Ack=64820 Win=1041 Len=1360 [TCP segment of a reassembled PDU]"
"612","39.760168","192.168.0.183","104.244.42.65","TCP","1414","50717  >  443 [ACK] Seq=519103 Ack=64820 Win=1041 Len=1360 [TCP segment of a reassembled PDU]"
"613","39.760168","192.168.0.183","104.244.42.65","TCP","1414","50717  >  443 [ACK] Seq=520463 Ack=64820 Win=1041 Len=1360 [TCP segment of a reassembled PDU]"
"614","39.760168","192.168.0.183","104.244.42.65","TCP","1414","50717  >  443 [ACK] Seq=521823 Ack=64820 Win=1041 Len=1360 [TCP segment of a reassembled PDU]"
"615","39.760168","192.168.0.183","104.244.42.65","TLSv1.2","140","Application Data"
"616","39.760268","192.168.0.183","104.244.42.65","TCP","1414","50717  >  443 [ACK] Seq=523269 Ack=64820 Win=1041 Len=1360 [TCP segment of a reassembled PDU]"
"617","39.760268","192.168.0.183","104.244.42.65","TCP","1414","50717  >  443 [ACK] Seq=524629 Ack=64820 Win=1041 Len=1360 [TCP segment of a reassembled PDU]"
"618","39.760268","192.168.0.183","104.244.42.65","TCP","1414","50717  >  443 [ACK] Seq=525989 Ack=64820 Win=1041 Len=1360 [TCP segment of a reassembled PDU]"
"619","39.760268","192.168.0.183","104.244.42.65","TLSv1.2","1391","Application Data"
"620","39.795992","104.244.42.65","192.168.0.183","TCP","60","443  >  50717 [ACK] Seq=64820 Ack=475411 Win=5732 Len=0"
"621","39.804369","104.244.42.65","192.168.0.183","TCP","60","443  >  50717 [ACK] Seq=64820 Ack=528686 Win=5713 Len=0"
"622","39.804369","104.244.42.65","192.168.0.183","TLSv1.2","89","Application Data"
"623","39.845388","192.168.0.183","104.244.42.65","TCP","54","50717  >  443 [ACK] Seq=528686 Ack=64855 Win=1041 Len=0"
"624","39.870290","104.244.42.65","192.168.0.183","TLSv1.2","180","Application Data"
"625","39.923364","192.168.0.183","104.244.42.65","TCP","54","50717  >  443 [ACK] Seq=528686 Ack=64981 Win=1040 Len=0"
"626","42.039874","192.168.0.183","104.244.42.65","TLSv1.2","675","Application Data"
"627","42.039957","192.168.0.183","104.244.42.65","TCP","1414","50717  >  443 [ACK] Seq=529307 Ack=64981 Win=1040 Len=1360 [TCP segment of a reassembled PDU]"
"628","42.039957","192.168.0.183","104.244.42.65","TLSv1.2","196","Application Data"
"629","42.078173","104.244.42.65","192.168.0.183","TCP","60","443  >  50717 [ACK] Seq=64981 Ack=530809 Win=5729 Len=0"
"630","42.099359","104.244.42.65","192.168.0.183","TLSv1.2","184","Application Data"
"631","42.148872","192.168.0.183","104.244.42.65","TCP","54","50717  >  443 [ACK] Seq=530809 Ack=65111 Win=1040 Len=0"
