"No.","Time","Source","Destination","Protocol","Length","Info"
"1","0.000000","192.168.0.183","104.244.42.65","TLSv1.2","235","Application Data"
"2","0.000062","192.168.0.183","104.244.42.65","TLSv1.2","93","Application Data"
"3","0.000121","192.168.0.183","104.244.42.65","TCP","1414","50717  >  443 [ACK] Seq=221 Ack=1 Win=1038 Len=1360 [TCP segment of a reassembled PDU]"
"4","0.000121","192.168.0.183","104.244.42.65","TLSv1.2","1287","Application Data"
"5","0.035724","104.244.42.65","192.168.0.183","TCP","60","443  >  50717 [ACK] Seq=1 Ack=221 Win=5735 Len=0"
"6","0.035724","104.244.42.65","192.168.0.183","TLSv1.2","93","Application Data"
"7","0.041562","104.244.42.65","192.168.0.183","TCP","60","443  >  50717 [ACK] Seq=40 Ack=2814 Win=5735 Len=0"
"8","0.064530","104.244.42.65","192.168.0.183","TLSv1.2","184","Application Data"
"9","0.064567","192.168.0.183","104.244.42.65","TCP","54","50717  >  443 [ACK] Seq=2814 Ack=170 Win=1038 Len=0"
"10","0.702994","192.168.0.183","104.244.42.65","TLSv1.2","301","Application Data"
"11","0.703189","192.168.0.183","104.244.42.65","TLSv1.2","659","Application Data"
"12","0.750594","104.244.42.65","192.168.0.183","TCP","60","443  >  50717 [ACK] Seq=170 Ack=3666 Win=5735 Len=0"
"13","0.770136","104.244.42.65","192.168.0.183","TLSv1.2","155","Application Data"
"14","0.816609","192.168.0.183","104.244.42.65","TCP","54","50717  >  443 [ACK] Seq=3666 Ack=271 Win=1037 Len=0"
"15","1.232013","192.168.0.183","104.244.42.65","TCP","1414","50717  >  443 [ACK] Seq=3666 Ack=271 Win=1037 Len=1360 [TCP segment of a reassembled PDU]"
"16","1.232013","192.168.0.183","104.244.42.65","TLSv1.2","294","Application Data"
"17","1.272511","104.244.42.65","192.168.0.183","TCP","60","443  >  50717 [ACK] Seq=271 Ack=5266 Win=5731 Len=0"
"18","2.025905","104.244.42.65","192.168.0.183","TCP","1414","443  >  50717 [ACK] Seq=271 Ack=5266 Win=5735 Len=1360 [TCP segment of a reassembled PDU]"
"19","2.025905","104.244.42.65","192.168.0.183","TCP","1414","443  >  50717 [ACK] Seq=1631 Ack=5266 Win=5735 Len=1360 [TCP segment of a reassembled PDU]"
"20","2.025905","104.244.42.65","192.168.0.183","TCP","1414","443  >  50717 [PSH, ACK] Seq=2991 Ack=5266 Win=5735 Len=1360 [TCP segment of a reassembled PDU]"
"21","2.025905","104.244.42.65","192.168.0.183","TCP","1414","443  >  50717 [ACK] Seq=4351 Ack=5266 Win=5735 Len=1360 [TCP segment of a reassembled PDU]"
"22","2.025905","104.244.42.65","192.168.0.183","TCP","1414","443  >  50717 [ACK] Seq=5711 Ack=5266 Win=5735 Len=1360 [TCP segment of a reassembled PDU]"
"23","2.025905","104.244.42.65","192.168.0.183","TCP","1414","443  >  50717 [PSH, ACK] Seq=7071 Ack=5266 Win=5735 Len=1360 [TCP segment of a reassembled PDU]"
"24","2.025905","104.244.42.65","192.168.0.183","TLSv1.2","702","Application Data"
"25","2.025964","192.168.0.183","104.244.42.65","TCP","54","50717  >  443 [ACK] Seq=5266 Ack=9079 Win=1041 Len=0"
"26","2.026651","192.168.0.183","104.244.42.65","TLSv1.2","89","Application Data"
"27","2.113039","104.244.42.65","192.168.0.183","TCP","60","443  >  50717 [ACK] Seq=9079 Ack=5301 Win=5735 Len=0"
"28","2.429696","192.168.0.183","104.244.42.65","TCP","1414","50717  >  443 [ACK] Seq=5301 Ack=9079 Win=1041 Len=1360 [TCP segment of a reassembled PDU]"
"29","2.429696","192.168.0.183","104.244.42.65","TLSv1.2","386","Application Data"
"30","2.467805","104.244.42.65","192.168.0.183","TCP","60","443  >  50717 [ACK] Seq=9079 Ack=6993 Win=5731 Len=0"
"31","3.006418","192.168.0.183","104.244.42.65","TLSv1.2","686","Application Data"
"32","3.006559","192.168.0.183","104.244.42.65","TCP","1414","50717  >  443 [ACK] Seq=7625 Ack=9079 Win=1041 Len=1360 [TCP segment of a reassembled PDU]"
"33","3.006559","192.168.0.183","104.244.42.65","TCP","1414","50717  >  443 [ACK] Seq=8985 Ack=9079 Win=1041 Len=1360 [TCP segment of a reassembled PDU]"
"34","3.006559","192.168.0.183","104.244.42.65","TCP","1414","50717  >  443 [ACK] Seq=10345 Ack=9079 Win=1041 Len=1360 [TCP segment of a reassembled PDU]"
"35","3.006559","192.168.0.183","104.244.42.65","TCP","1414","50717  >  443 [ACK] Seq=11705 Ack=9079 Win=1041 Len=1360 [TCP segment of a reassembled PDU]"
"36","3.006559","192.168.0.183","104.244.42.65","TCP","1414","50717  >  443 [ACK] Seq=13065 Ack=9079 Win=1041 Len=1360 [TCP segment of a reassembled PDU]"
"37","3.006559","192.168.0.183","104.244.42.65","TCP","1414","50717  >  443 [ACK] Seq=14425 Ack=9079 Win=1041 Len=1360 [TCP segment of a reassembled PDU]"
"38","3.006559","192.168.0.183","104.244.42.65","TCP","1414","50717  >  443 [ACK] Seq=15785 Ack=9079 Win=1041 Len=1360 [TCP segment of a reassembled PDU]"
"39","3.006559","192.168.0.183","104.244.42.65","TCP","1414","50717  >  443 [ACK] Seq=17145 Ack=9079 Win=1041 Len=1360 [TCP segment of a reassembled PDU]"
"40","3.006559","192.168.0.183","104.244.42.65","TCP","1414","50717  >  443 [ACK] Seq=18505 Ack=9079 Win=1041 Len=1360 [TCP segment of a reassembled PDU]"
"41","3.006559","192.168.0.183","104.244.42.65","TCP","1414","50717  >  443 [ACK] Seq=19865 Ack=9079 Win=1041 Len=1360 [TCP segment of a reassembled PDU]"
"42","3.006559","192.168.0.183","104.244.42.65","TCP","1414","50717  >  443 [ACK] Seq=21225 Ack=9079 Win=1041 Len=1360 [TCP segment of a reassembled PDU]"
"43","3.006559","192.168.0.183","104.244.42.65","TCP","1414","50717  >  443 [ACK] Seq=22585 Ack=9079 Win=1041 Len=1360 [TCP segment of a reassembled PDU]"
"44","3.006559","192.168.0.183","104.244.42.65","TLSv1.2","140","Application Data"
"45","3.006704","192.168.0.183","104.244.42.65","TCP","1414","50717  >  443 [ACK] Seq=24031 Ack=9079 Win=1041 Len=1360 [TCP segment of a reassembled PDU]"
"46","3.006704","192.168.0.183","104.244.42.65","TCP","1414","50717  >  443 [ACK] Seq=25391 Ack=9079 Win=1041 Len=1360 [TCP segment of a reassembled PDU]"
"47","3.006704","192.168.0.183","104.244.42.65","TCP","1414","50717  >  443 [ACK] Seq=26751 Ack=9079 Win=1041 Len=1360 [TCP segment of a reassembled PDU]"
"48","3.006704","192.168.0.183","104.244.42.65","TCP","1414","50717  >  443 [ACK] Seq=28111 Ack=9079 Win=1041 Len=1360 [TCP segment of a reassembled PDU]"
"49","3.006704","192.168.0.183","104.244.42.65","TCP","1414","50717  >  443 [ACK] Seq=29471 Ack=9079 Win=1041 Len=1360 [TCP segment of a reassembled PDU]"
"50","3.006704","192.168.0.183","104.244.42.65","TCP","1414","50717  >  443 [ACK] Seq=30831 Ack=9079 Win=1041 Len=1360 [TCP segment of a reassembled PDU]"
"51","3.006704","192.168.0.183","104.244.42.65","TCP","1414","50717  >  443 [ACK] Seq=32191 Ack=9079 Win=1041 Len=1360 [TCP segment of a reassembled PDU]"
"52","3.006704","192.168.0.183","104.244.42.65","TCP","1414","50717  >  443 [ACK] Seq=33551 Ack=9079 Win=1041 Len=1360 [TCP segment of a reassembled PDU]"
"53","3.006704","192.168.0.183","104.244.42.65","TLSv1.2","94","Application Data"
"54","3.045447","104.244.42.65","192.168.0.183","TCP","60","443  >  50717 [ACK] Seq=9079 Ack=10345 Win=5732 Len=0"
"55","3.049770","104.244.42.65","192.168.0.183","TCP","60","443  >  50717 [ACK] Seq=9079 Ack=34951 Win=5706 Len=0"
"56","3.107185","104.244.42.65","192.168.0.183","TLSv1.2","220","Application Data"
"57","3.153490","192.168.0.183","104.244.42.65","TCP","54","50717  >  443 [ACK] Seq=34951 Ack=9245 Win=1040 Len=0"
"58","3.221633","104.244.42.65","192.168.0.183","TCP","1414","443  >  50717 [ACK] Seq=9245 Ack=34951 Win=5735 Len=1360 [TCP segment of a reassembled PDU]"
"59","3.221633","104.244.42.65","192.168.0.183","TCP","1414","443  >  50717 [ACK] Seq=10605 Ack=34951 Win=5735 Len=1360 [TCP segment of a reassembled PDU]"
"60","3.221633","104.244.42.65","192.168.0.183","TCP","1414","443  >  50717 [PSH, ACK] Seq=11965 Ack=34951 Win=5735 Len=1360 [TCP segment of a reassembled PDU]"
"61","3.221633","104.244.42.65","192.168.0.183","TCP","1414","443  >  50717 [ACK] Seq=13325 Ack=34951 Win=5735 Len=1360 [TCP segment of a reassembled PDU]"
"62","3.221633","104.244.42.65","192.168.0.183","TCP","1414","443  >  50717 [ACK] Seq=14685 Ack=34951 Win=5735 Len=1360 [TCP segment of a reassembled PDU]"
"63","3.221633","104.244.42.65","192.168.0.183","TLSv1.2","244","Application Data"
"64","3.221756","192.168.0.183","104.244.42.65","TCP","54","50717  >  443 [ACK] Seq=34951 Ack=16235 Win=1041 Len=0"
"65","6.277485","192.168.0.183","104.244.42.65","TLSv1.2","693","Application Data"
"66","6.277603","192.168.0.183","104.244.42.65","TCP","1414","50717  >  443 [ACK] Seq=35590 Ack=16235 Win=1041 Len=1360 [TCP segment of a reassembled PDU]"
"67","6.277603","192.168.0.183","104.244.42.65","TCP","1414","50717  >  443 [ACK] Seq=36950 Ack=16235 Win=1041 Len=1360 [TCP segment of a reassembled PDU]"
"68","6.277603","192.168.0.183","104.244.42.65","TCP","1414","50717  >  443 [ACK] Seq=38310 Ack=16235 Win=1041 Len=1360 [TCP segment of a reassembled PDU]"
"69","6.277603","192.168.0.183","104.244.42.65","TCP","1414","50717  >  443 [ACK] Seq=39670 Ack=16235 Win=1041 Len=1360 [TCP segment of a reassembled PDU]"
"70","6.277603","192.168.0.183","104.244.42.65","TCP","1414","50717  >  443 [ACK] Seq=41030 Ack=16235 Win=1041 Len=1360 [TCP segment of a reassembled PDU]"
"71","6.277603","192.168.0.183","104.244.42.65","TCP","1414","50717  >  443 [ACK] Seq=42390 Ack=16235 Win=1041 Len=1360 [TCP segment of a reassembled PDU]"
"72","6.277603","192.168.0.183","104.244.42.65","TCP","1414","50717  >  443 [ACK] Seq=43750 Ack=16235 Win=1041 Len=1360 [TCP segment of a reassembled PDU]"
"73","6.277603","192.168.0.183","104.244.42.65","TCP","1414","50717  >  443 [ACK] Seq=45110 Ack=16235 Win=1041 Len=1360 [TCP segment of a reassembled PDU]"
"74","6.277603","192.168.0.183","104.244.42.65","TCP","1414","50717  >  443 [ACK] Seq=46470 Ack=16235 Win=1041 Len=1360 [TCP segment of a reassembled PDU]"
"75","6.277603","192.168.0.183","104.244.42.65","TCP","1414","50717  >  443 [ACK] Seq=47830 Ack=16235 Win=1041 Len=1360 [TCP segment of a reassembled PDU]"
"76","6.277603","192.168.0.183","104.244.42.65","TCP","1414","50717  >  443 [ACK] Seq=49190 Ack=16235 Win=1041 Len=1360 [TCP segment of a reassembled PDU]"
"77","6.277603","192.168.0.183","104.244.42.65","TCP","1414","50717  >  443 [ACK] Seq=50550 Ack=16235 Win=1041 Len=1360 [TCP segment of a reassembled PDU]"
"78","6.277603","192.168.0.183","104.244.42.65","TLSv1.2","140","Application Data"
"79","6.277734","192.168.0.183","104.244.42.65","TCP","1414","50717  >  443 [ACK] Seq=51996 Ack=16235 Win=1041 Len=1360 [TCP segment of a reassembled PDU]"
"80","6.277734","192.168.0.183","104.244.42.65","TCP","1414","50717  >  443 [ACK] Seq=53356 Ack=16235 Win=1041 Len=1360 [TCP segment of a reassembled PDU]"
"81","6.277734","192.168.0.183","104.244.42.65","TCP","1414","50717  >  443 [ACK] Seq=54716 Ack=16235 Win=1041 Len=1360 [TCP segment of a reassembled PDU]"
"82","6.277734","192.168.0.183","104.244.42.65","TCP","1414","50717  >  443 [ACK] Seq=56076 Ack=16235 Win=1041 Len=1360 [TCP segment of a reassembled PDU]"
"83","6.277734","192.168.0.183","104.244.42.65","TCP","1414","50717  >  443 [ACK] Seq=57436 Ack=16235 Win=1041 Len=1360 [TCP segment of a reassembled PDU]"
"84","6.277734","192.168.0.183","104.244.42.65","TCP","1414","50717  >  443 [ACK] Seq=58796 Ack=16235 Win=1041 Len=1360 [TCP segment of a reassembled PDU]"
"85","6.277734","192.168.0.183","104.244.42.65","TCP","1414","50717  >  443 [ACK] Seq=60156 Ack=16235 Win=1041 Len=1360 [TCP segment of a reassembled PDU]"
"86","6.277734","192.168.0.183","104.244.42.65","TCP","1414","50717  >  443 [ACK] Seq=61516 Ack=16235 Win=1041 Len=1360 [TCP segment of a reassembled PDU]"
"87","6.277734","192.168.0.183","104.244.42.65","TCP","1414","50717  >  443 [ACK] Seq=62876 Ack=16235 Win=1041 Len=1360 [TCP segment of a reassembled PDU]"
"88","6.277734","192.168.0.183","104.244.42.65","TCP","1414","50717  >  443 [ACK] Seq=64236 Ack=16235 Win=1041 Len=1360 [TCP segment of a reassembled PDU]"
"89","6.277734","192.168.0.183","104.244.42.65","TLSv1.2","512","Application Data"
"90","6.313643","104.244.42.65","192.168.0.183","TCP","60","443  >  50717 [ACK] Seq=16235 Ack=36950 Win=5730 Len=0"
"91","6.321398","104.244.42.65","192.168.0.183","TCP","60","443  >  50717 [ACK] Seq=16235 Ack=66054 Win=5682 Len=0"
"92","6.369505","104.244.42.65","192.168.0.183","TLSv1.2","182","Application Data"
"93","6.423231","192.168.0.183","104.244.42.65","TCP","54","50717  >  443 [ACK] Seq=66054 Ack=16363 Win=1040 Len=0"
"94","9.275721","192.168.0.183","104.244.42.65","TLSv1.2","238","Application Data"
"95","9.275871","192.168.0.183","104.244.42.65","TCP","1414","50717  >  443 [ACK] Seq=66238 Ack=16363 Win=1040 Len=1360 [TCP segment of a reassembled PDU]"
"96","9.275871","192.168.0.183","104.244.42.65","TCP","1414","50717  >  443 [ACK] Seq=67598 Ack=16363 Win=1040 Len=1360 [TCP segment of a reassembled PDU]"
"97","9.275871","192.168.0.183","104.244.42.65","TCP","1414","50717  >  443 [ACK] Seq=68958 Ack=16363 Win=1040 Len=1360 [TCP segment of a reassembled PDU]"
"98","9.275871","192.168.0.183","104.244.42.65","TCP","1414","50717  >  443 [ACK] Seq=70318 Ack=16363 Win=1040 Len=1360 [TCP segment of a reassembled PDU]"
"99","9.275871","192.168.0.183","104.244.42.65","TCP","1414","50717  >  443 [ACK] Seq=71678 Ack=16363 Win=1040 Len=1360 [TCP segment of a reassembled PDU]"
"100","9.275871","192.168.0.183","104.244.42.65","TCP","1414","50717  >  443 [ACK] Seq=73038 Ack=16363 Win=1040 Len=1360 [TCP segment of a reassembled PDU]"
"101","9.275871","192.168.0.183","104.244.42.65","TCP","1414","50717  >  443 [ACK] Seq=74398 Ack=16363 Win=1040 Len=1360 [TCP segment of a reassembled PDU]"
"102","9.275871","192.168.0.183","104.244.42.65","TCP","1414","50717  >  443 [ACK] Seq=75758 Ack=16363 Win=1040 Len=1360 [TCP segment of a reassembled PDU]"
"103","9.275871","192.168.0.183","104.244.42.65","TCP","1414","50717  >  443 [ACK] Seq=77118 Ack=16363 Win=1040 Len=1360 [TCP segment of a reassembled PDU]"
"104","9.275871","192.168.0.183","104.244.42.65","TCP","1414","50717  >  443 [ACK] Seq=78478 Ack=16363 Win=1040 Len=1360 [TCP segment of a reassembled PDU]"
"105","9.275871","192.168.0.183","104.244.42.65","TCP","1414","50717  >  443 [ACK] Seq=79838 Ack=16363 Win=1040 Len=1360 [TCP segment of a reassembled PDU]"
"106","9.275871","192.168.0.183","104.244.42.65","TCP","1414","50717  >  443 [ACK] Seq=81198 Ack=16363 Win=1040 Len=1360 [TCP segment of a reassembled PDU]"
"107","9.275871","192.168.0.183","104.244.42.65","TLSv1.2","140","Application Data"
"108","9.276004","192.168.0.183","104.244.42.65","TCP","1414","50717  >  443 [ACK] Seq=82644 Ack=16363 Win=1040 Len=1360 [TCP segment of a reassembled PDU]"
"109","9.276004","192.168.0.183","104.244.42.65","TCP","1414","50717  >  443 [ACK] Seq=84004 Ack=16363 Win=1040 Len=1360 [TCP segment of a reassembled PDU]"
"110","9.276004","192.168.0.183","104.244.42.65","TCP","1414","50717  >  443 [ACK] Seq=85364 Ack=16363 Win=1040 Len=1360 [TCP segment of a reassembled PDU]"
"111","9.276004","192.168.0.183","104.244.42.65","TCP","1414","50717  >  443 [ACK] Seq=86724 Ack=16363 Win=1040 Len=1360 [TCP segment of a reassembled PDU]"
"112","9.276004","192.168.0.183","104.244.42.65","TCP","1414","50717  >  443 [ACK] Seq=88084 Ack=16363 Win=1040 Len=1360 [TCP segment of a reassembled PDU]"
"113","9.276004","192.168.0.183","104.244.42.65","TCP","1414","50717  >  443 [ACK] Seq=89444 Ack=16363 Win=1040 Len=1360 [TCP segment of a reassembled PDU]"
"114","9.276004","192.168.0.183","104.244.42.65","TCP","1414","50717  >  443 [ACK] Seq=90804 Ack=16363 Win=1040 Len=1360 [TCP segment of a reassembled PDU]"
"115","9.276004","192.168.0.183","104.244.42.65","TCP","1414","50717  >  443 [ACK] Seq=92164 Ack=16363 Win=1040 Len=1360 [TCP segment of a reassembled PDU]"
"116","9.276004","192.168.0.183","104.244.42.65","TCP","1414","50717  >  443 [ACK] Seq=93524 Ack=16363 Win=1040 Len=1360 [TCP segment of a reassembled PDU]"
"117","9.276004","192.168.0.183","104.244.42.65","TCP","1414","50717  >  443 [ACK] Seq=94884 Ack=16363 Win=1040 Len=1360 [TCP segment of a reassembled PDU]"
"118","9.276004","192.168.0.183","104.244.42.65","TCP","1414","50717  >  443 [ACK] Seq=96244 Ack=16363 Win=1040 Len=1360 [TCP segment of a reassembled PDU]"
"119","9.276004","192.168.0.183","104.244.42.65","TLSv1.2","381","Application Data"
"120","9.313472","104.244.42.65","192.168.0.183","TCP","60","443  >  50717 [ACK] Seq=16363 Ack=67598 Win=5732 Len=0"
"121","9.318127","104.244.42.65","192.168.0.183","TCP","60","443  >  50717 [ACK] Seq=16363 Ack=85364 Win=5695 Len=0"
"122","9.318127","104.244.42.65","192.168.0.183","TCP","60","443  >  50717 [ACK] Seq=16363 Ack=97931 Win=5720 Len=0"
"123","9.342095","192.168.0.183","104.244.42.65","TLSv1.2","260","Application Data"
"124","9.364233","104.244.42.65","192.168.0.183","TLSv1.2","268","Application Data"
"125","9.396929","104.244.42.65","192.168.0.183","TCP","60","443  >  50717 [ACK] Seq=16577 Ack=98137 Win=5735 Len=0"
"126","9.412096","192.168.0.183","104.244.42.65","TCP","54","50717  >  443 [ACK] Seq=98137 Ack=16577 Win=1039 Len=0"
"127","9.654478","192.168.0.183","104.244.42.65","TCP","1414","50717  >  443 [ACK] Seq=98137 Ack=16577 Win=1039 Len=1360 [TCP segment of a reassembled PDU]"
"128","9.654478","192.168.0.183","104.244.42.65","TLSv1.2","474","Application Data"
"129","9.692021","104.244.42.65","192.168.0.183","TCP","60","443  >  50717 [ACK] Seq=16577 Ack=99917 Win=5731 Len=0"
"130","9.754145","104.244.42.65","192.168.0.183","TLSv1.2","195","Application Data"
"131","9.800047","192.168.0.183","104.244.42.65","TCP","54","50717  >  443 [ACK] Seq=99917 Ack=16718 Win=1039 Len=0"
"132","10.424055","104.244.42.65","192.168.0.183","TCP","1414","443  >  50717 [ACK] Seq=16718 Ack=99917 Win=5735 Len=1360 [TCP segment of a reassembled PDU]"
"133","10.424055","104.244.42.65","192.168.0.183","TCP","1414","443  >  50717 [ACK] Seq=18078 Ack=99917 Win=5735 Len=1360 [TCP segment of a reassembled PDU]"
"134","10.424055","104.244.42.65","192.168.0.183","TCP","1414","443  >  50717 [PSH, ACK] Seq=19438 Ack=99917 Win=5735 Len=1360 [TCP segment of a reassembled PDU]"
"135","10.424055","104.244.42.65","192.168.0.183","TCP","1414","443  >  50717 [ACK] Seq=20798 Ack=99917 Win=5735 Len=1360 [TCP segment of a reassembled PDU]"
"136","10.424055","104.244.42.65","192.168.0.183","TCP","1414","443  >  50717 [ACK] Seq=22158 Ack=99917 Win=5735 Len=1360 [TCP segment of a reassembled PDU]"
"137","10.424055","104.244.42.65","192.168.0.183","TCP","1414","443  >  50717 [PSH, ACK] Seq=23518 Ack=99917 Win=5735 Len=1360 [TCP segment of a reassembled PDU]"
"138","10.424055","104.244.42.65","192.168.0.183","TLSv1.2","515","Application Data"
"139","10.424115","192.168.0.183","104.244.42.65","TCP","54","50717  >  443 [ACK] Seq=99917 Ack=25339 Win=1041 Len=0"
"140","10.424744","192.168.0.183","104.244.42.65","TLSv1.2","89","Application Data"
"141","10.461503","104.244.42.65","192.168.0.183","TCP","60","443  >  50717 [ACK] Seq=25339 Ack=99952 Win=5735 Len=0"
"142","11.108265","192.168.0.183","104.244.42.65","TCP","1414","50717  >  443 [ACK] Seq=99952 Ack=25339 Win=1041 Len=1360 [TCP segment of a reassembled PDU]"
"143","11.108265","192.168.0.183","104.244.42.65","TLSv1.2","543","Application Data"
"144","11.156362","104.244.42.65","192.168.0.183","TCP","60","443  >  50717 [ACK] Seq=25339 Ack=101801 Win=5730 Len=0"
"145","11.830429","104.244.42.65","192.168.0.183","TCP","1414","443  >  50717 [ACK] Seq=25339 Ack=101801 Win=5735 Len=1360 [TCP segment of a reassembled PDU]"
"146","11.830429","104.244.42.65","192.168.0.183","TCP","1414","443  >  50717 [ACK] Seq=26699 Ack=101801 Win=5735 Len=1360 [TCP segment of a reassembled PDU]"
"147","11.830429","104.244.42.65","192.168.0.183","TCP","1414","443  >  50717 [PSH, ACK] Seq=28059 Ack=101801 Win=5735 Len=1360 [TCP segment of a reassembled PDU]"
"148","11.830429","104.244.42.65","192.168.0.183","TCP","1414","443  >  50717 [ACK] Seq=29419 Ack=101801 Win=5735 Len=1360 [TCP segment of a reassembled PDU]"
"149","11.830429","104.244.42.65","192.168.0.183","TCP","1414","443  >  50717 [ACK] Seq=30779 Ack=101801 Win=5735 Len=1360 [TCP segment of a reassembled PDU]"
"150","11.830429","104.244.42.65","192.168.0.183","TLSv1.2","880","Application Data"
"151","11.830501","192.168.0.183","104.244.42.65","TCP","54","50717  >  443 [ACK] Seq=101801 Ack=32965 Win=1041 Len=0"
"152","12.431114","192.168.0.183","104.244.42.65","TLSv1.2","284","Application Data"
"153","12.431256","192.168.0.183","104.244.42.65","TCP","1414","50717  >  443 [ACK] Seq=102031 Ack=32965 Win=1041 Len=1360 [TCP segment of a reassembled PDU]"
"154","12.431256","192.168.0.183","104.244.42.65","TCP","1414","50717  >  443 [ACK] Seq=103391 Ack=32965 Win=1041 Len=1360 [TCP segment of a reassembled PDU]"
"155","12.431256","192.168.0.183","104.244.42.65","TCP","1414","50717  >  443 [ACK] Seq=104751 Ack=32965 Win=1041 Len=1360 [TCP segment of a reassembled PDU]"
"156","12.431256","192.168.0.183","104.244.42.65","TCP","1414","50717  >  443 [ACK] Seq=106111 Ack=32965 Win=1041 Len=1360 [TCP segment of a reassembled PDU]"
"157","12.431256","192.168.0.183","104.244.42.65","TCP","1414","50717  >  443 [ACK] Seq=107471 Ack=32965 Win=1041 Len=1360 [TCP segment of a reassembled PDU]"
"158","12.431256","192.168.0.183","104.244.42.65","TCP","1414","50717  >  443 [ACK] Seq=108831 Ack=32965 Win=1041 Len=1360 [TCP segment of a reassembled PDU]"
"159","12.431256","192.168.0.183","104.244.42.65","TCP","1414","50717  >  443 [ACK] Seq=110191 Ack=32965 Win=1041 Len=1360 [TCP segment of a reassembled PDU]"
"160","12.431256","192.168.0.183","104.244.42.65","TCP","1414","50717  >  443 [ACK] Seq=111551 Ack=32965 Win=1041 Len=1360 [TCP segment of a reassembled PDU]"
"161","12.431256","192.168.0.183","104.244.42.65","TCP","1414","50717  >  443 [ACK] Seq=112911 Ack=32965 Win=1041 Len=1360 [TCP segment of a reassembled PDU]"
"162","12.431256","192.168.0.183","104.244.42.65","TCP","1414","50717  >  443 [ACK] Seq=114271 Ack=32965 Win=1041 Len=1360 [TCP segment of a reassembled PDU]"
"163","12.431256","192.168.0.183","104.244.42.65","TCP","1414","50717  >  443 [ACK] Seq=115631 Ack=32965 Win=1041 Len=1360 [TCP segment of a reassembled PDU]"
"164","12.431256","192.168.0.183","104.244.42.65","TCP","1414","50717  >  443 [ACK] Seq=116991 Ack=32965 Win=1041 Len=1360 [TCP segment of a reassembled PDU]"
"165","12.431256","192.168.0.183","104.244.42.65","TLSv1.2","140","Application Data"
"166","12.431385","192.168.0.183","104.244.42.65","TCP","1414","50717  >  443 [ACK] Seq=118437 Ack=32965 Win=1041 Len=1360 [TCP segment of a reassembled PDU]"
"167","12.431385","192.168.0.183","104.244.42.65","TCP","1414","50717  >  443 [ACK] Seq=119797 Ack=32965 Win=1041 Len=1360 [TCP segment of a reassembled PDU]"
"168","12.431385","192.168.0.183","104.244.42.65","TCP","1414","50717  >  443 [ACK] Seq=121157 Ack=32965 Win=1041 Len=1360 [TCP segment of a reassembled PDU]"
"169","12.431385","192.168.0.183","104.244.42.65","TCP","1414","50717  >  443 [ACK] Seq=122517 Ack=32965 Win=1041 Len=1360 [TCP segment of a reassembled PDU]"
"170","12.431385","192.168.0.183","104.244.42.65","TCP","1414","50717  >  443 [ACK] Seq=123877 Ack=32965 Win=1041 Len=1360 [TCP segment of a reassembled PDU]"
"171","12.431385","192.168.0.183","104.244.42.65","TCP","1414","50717  >  443 [ACK] Seq=125237 Ack=32965 Win=1041 Len=1360 [TCP segment of a reassembled PDU]"
"172","12.431385","192.168.0.183","104.244.42.65","TCP","1414","50717  >  443 [ACK] Seq=126597 Ack=32965 Win=1041 Len=1360 [TCP segment of a reassembled PDU]"
"173","12.431385","192.168.0.183","104.244.42.65","TCP","1414","50717  >  443 [ACK] Seq=127957 Ack=32965 Win=1041 Len=1360 [TCP segment of a reassembled PDU]"
"174","12.431385","192.168.0.183","104.244.42.65","TCP","1414","50717  >  443 [ACK] Seq=129317 Ack=32965 Win=1041 Len=1360 [TCP segment of a reassembled PDU]"
"175","12.431385","192.168.0.183","104.244.42.65","TCP","1414","50717  >  443 [ACK] Seq=130677 Ack=32965 Win=1041 Len=1360 [TCP segment of a reassembled PDU]"
"176","12.431385","192.168.0.183","104.244.42.65","TCP","1414","50717  >  443 [ACK] Seq=132037 Ack=32965 Win=1041 Len=1360 [TCP segment of a reassembled PDU]"
"177","12.431385","192.168.0.183","104.244.42.65","TCP","1414","50717  >  443 [ACK] Seq=133397 Ack=32965 Win=1041 Len=1360 [TCP segment of a reassembled PDU]"
"178","12.431385","192.168.0.183","104.244.42.65","TLSv1.2","140","Application Data"
"179","12.431513","192.168.0.183","104.244.42.65","TCP","1414","50717  >  443 [ACK] Seq=134843 Ack=32965 Win=1041 Len=1360 [TCP segment of a reassembled PDU]"
"180","12.431513","192.168.0.183","104.244.42.65","TCP","1414","50717  >  443 [ACK] Seq=136203 Ack=32965 Win=1041 Len=1360 [TCP segment of a reassembled PDU]"
"181","12.431513","192.168.0.183","104.244.42.65","TCP","1414","50717  >  443 [ACK] Seq=137563 Ack=32965 Win=1041 Len=1360 [TCP segment of a reassembled PDU]"
"182","12.431513","192.168.0.183","104.244.42.65","TCP","1414","50717  >  443 [ACK] Seq=138923 Ack=32965 Win=1041 Len=1360 [TCP segment of a reassembled PDU]"
"183","12.431513","192.168.0.183","104.244.42.65","TCP","1414","50717  >  443 [ACK] Seq=140283 Ack=32965 Win=1041 Len=1360 [TCP segment of a reassembled PDU]"
"184","12.431513","192.168.0.183","104.244.42.65","TCP","1414","50717  >  443 [ACK] Seq=141643 Ack=32965 Win=1041 Len=1360 [TCP segment of a reassembled PDU]"
"185","12.431513","192.168.0.183","104.244.42.65","TCP","1414","50717  >  443 [ACK] Seq=143003 Ack=32965 Win=1041 Len=1360 [TCP segment of a reassembled PDU]"
"186","12.431513","192.168.0.183","104.244.42.65","TCP","1414","50717  >  443 [ACK] Seq=144363 Ack=32965 Win=1041 Len=1360 [TCP segment of a reassembled PDU]"
"187","12.431513","192.168.0.183","104.244.42.65","TCP","1414","50717  >  443 [ACK] Seq=145723 Ack=32965 Win=1041 Len=1360 [TCP segment of a reassembled PDU]"
"188","12.431513","192.168.0.183","104.244.42.65","TCP","1414","50717  >  443 [ACK] Seq=147083 Ack=32965 Win=1041 Len=1360 [TCP segment of a reassembled PDU]"
"189","12.431513","192.168.0.183","104.244.42.65","TCP","1414","50717  >  443 [ACK] Seq=148443 Ack=32965 Win=1041 Len=1360 [TCP segment of a reassembled PDU]"
"190","12.431513","192.168.0.183","104.244.42.65","TCP","1414","50717  >  443 [ACK] Seq=149803 Ack=32965 Win=1041 Len=1360 [TCP segment of a reassembled PDU]"
"191","12.431513","192.168.0.183","104.244.42.65","TLSv1.2","140","Application Data"
"192","12.431636","192.168.0.183","104.244.42.65","TCP","1414","50717  >  443 [ACK] Seq=151249 Ack=32965 Win=1041 Len=1360 [TCP segment of a reassembled PDU]"
"193","12.431636","192.168.0.183","104.244.42.65","TCP","1414","50717  >  443 [ACK] Seq=152609 Ack=32965 Win=1041 Len=1360 [TCP segment of a reassembled PDU]"
"194","12.431636","192.168.0.183","104.244.42.65","TCP","1414","50717  >  443 [ACK] Seq=153969 Ack=32965 Win=1041 Len=1360 [TCP segment of a reassembled PDU]"
"195","12.431636","192.168.0.183","104.244.42.65","TCP","1414","50717  >  443 [ACK] Seq=155329 Ack=32965 Win=1041 Len=1360 [TCP segment of a reassembled PDU]"
"196","12.431636","192.168.0.183","104.244.42.65","TCP","1414","50717  >  443 [ACK] Seq=156689 Ack=32965 Win=1041 Len=1360 [TCP segment of a reassembled PDU]"
"197","12.431636","192.168.0.183","104.244.42.65","TCP","1414","50717  >  443 [ACK] Seq=158049 Ack=32965 Win=1041 Len=1360 [TCP segment of a reassembled PDU]"
"198","12.431636","192.168.0.183","104.244.42.65","TCP","1414","50717  >  443 [ACK] Seq=159409 Ack=32965 Win=1041 Len=1360 [TCP segment of a reassembled PDU]"
"199","12.431636","192.168.0.183","104.244.42.65","TCP","1414","50717  >  443 [ACK] Seq=160769 Ack=32965 Win=1041 Len=1360 [TCP segment of a reassembled PDU]"
"200","12.431636","192.168.0.183","104.244.42.65","TCP","1414","50717  >  443 [ACK] Seq=162129 Ack=32965 Win=1041 Len=1360 [TCP segment of a reassembled PDU]"
"201","12.431636","192.168.0.183","104.244.42.65","TCP","1414","50717  >  443 [ACK] Seq=163489 Ack=32965 Win=1041 Len=1360 [TCP segment of a reassembled PDU]"
"202","12.431636","192.168.0.183","104.244.42.65","TCP","1414","50717  >  443 [ACK] Seq=164849 Ack=32965 Win=1041 Len=1360 [TCP segment of a reassembled PDU]"
"203","12.431636","192.168.0.183","104.244.42.65","TCP","1414","50717  >  443 [ACK] Seq=166209 Ack=32965 Win=1041 Len=1360 [TCP segment of a reassembled PDU]"
"204","12.431636","192.168.0.183","104.244.42.65","TLSv1.2","140","Application Data"
"205","12.431756","192.168.0.183","104.244.42.65","TLSv1.2","121","Application Data"
"206","12.467551","104.244.42.65","192.168.0.183","TCP","60","443  >  50717 [ACK] Seq=32965 Ack=103391 Win=5731 Len=0"
"207","12.473602","104.244.42.65","192.168.0.183","TCP","60","443  >  50717 [ACK] Seq=32965 Ack=152609 Win=5699 Len=0"
"208","12.473602","104.244.42.65","192.168.0.183","TLSv1.2","89","Application Data"
"209","12.473602","104.244.42.65","192.168.0.183","TCP","60","443  >  50717 [ACK] Seq=33000 Ack=167722 Win=5727 Len=0"
"210","12.473941","192.168.0.183","104.244.42.65","TCP","1414","50717  >  443 [ACK] Seq=167722 Ack=33000 Win=1041 Len=1360 [TCP segment of a reassembled PDU]"
"211","12.473941","192.168.0.183","104.244.42.65","TCP","1414","50717  >  443 [ACK] Seq=169082 Ack=33000 Win=1041 Len=1360 [TCP segment of a reassembled PDU]"
"212","12.473941","192.168.0.183","104.244.42.65","TCP","1414","50717  >  443 [ACK] Seq=170442 Ack=33000 Win=1041 Len=1360 [TCP segment of a reassembled PDU]"
"213","12.473941","192.168.0.183","104.244.42.65","TCP","1414","50717  >  443 [ACK] Seq=171802 Ack=33000 Win=1041 Len=1360 [TCP segment of a reassembled PDU]"
"214","12.473941","192.168.0.183","104.244.42.65","TCP","1414","50717  >  443 [ACK] Seq=173162 Ack=33000 Win=1041 Len=1360 [TCP segment of a reassembled PDU]"
"215","12.473941","192.168.0.183","104.244.42.65","TCP","1414","50717  >  443 [ACK] Seq=174522 Ack=33000 Win=1041 Len=1360 [TCP segment of a reassembled PDU]"
"216","12.473941","192.168.0.183","104.244.42.65","TCP","1414","50717  >  443 [ACK] Seq=175882 Ack=33000 Win=1041 Len=1360 [TCP segment of a reassembled PDU]"
"217","12.473941","192.168.0.183","104.244.42.65","TCP","1414","50717  >  443 [ACK] Seq=177242 Ack=33000 Win=1041 Len=1360 [TCP segment of a reassembled PDU]"
"218","12.473941","192.168.0.183","104.244.42.65","TCP","1414","50717  >  443 [ACK] Seq=178602 Ack=33000 Win=1041 Len=1360 [TCP segment of a reassembled PDU]"
"219","12.473941","192.168.0.183","104.244.42.65","TCP","1414","50717  >  443 [ACK] Seq=179962 Ack=33000 Win=1041 Len=1360 [TCP segment of a reassembled PDU]"
"220","12.473941","192.168.0.183","104.244.42.65","TCP","1414","50717  >  443 [ACK] Seq=181322 Ack=33000 Win=1041 Len=1360 [TCP segment of a reassembled PDU]"
"221","12.473941","192.168.0.183","104.244.42.65","TCP","1414","50717  >  443 [ACK] Seq=182682 Ack=33000 Win=1041 Len=1360 [TCP segment of a reassembled PDU]"
"222","12.473941","192.168.0.183","104.244.42.65","TLSv1.2","104","Application Data"
"223","12.474177","192.168.0.183","104.244.42.65","TCP","1414","50717  >  443 [ACK] Seq=184092 Ack=33000 Win=1041 Len=1360 [TCP segment of a reassembled PDU]"
"224","12.474177","192.168.0.183","104.244.42.65","TCP","1414","50717  >  443 [ACK] Seq=185452 Ack=33000 Win=1041 Len=1360 [TCP segment of a reassembled PDU]"
"225","12.474177","192.168.0.183","104.244.42.65","TCP","1414","50717  >  443 [ACK] Seq=186812 Ack=33000 Win=1041 Len=1360 [TCP segment of a reassembled PDU]"
"226","12.474177","192.168.0.183","104.244.42.65","TCP","1414","50717  >  443 [ACK] Seq=188172 Ack=33000 Win=1041 Len=1360 [TCP segment of a reassembled PDU]"
"227","12.474177","192.168.0.183","104.244.42.65","TCP","1414","50717  >  443 [ACK] Seq=189532 Ack=33000 Win=1041 Len=1360 [TCP segment of a reassembled PDU]"
"228","12.474177","192.168.0.183","104.244.42.65","TCP","1414","50717  >  443 [ACK] Seq=190892 Ack=33000 Win=1041 Len=1360 [TCP segment of a reassembled PDU]"
"229","12.474177","192.168.0.183","104.244.42.65","TCP","1414","50717  >  443 [ACK] Seq=192252 Ack=33000 Win=1041 Len=1360 [TCP segment of a reassembled PDU]"
"230","12.474177","192.168.0.183","104.244.42.65","TCP","1414","50717  >  443 [ACK] Seq=193612 Ack=33000 Win=1041 Len=1360 [TCP segment of a reassembled PDU]"
"231","12.474177","192.168.0.183","104.244.42.65","TCP","1414","50717  >  443 [ACK] Seq=194972 Ack=33000 Win=1041 Len=1360 [TCP segment of a reassembled PDU]"
"232","12.474177","192.168.0.183","104.244.42.65","TCP","1414","50717  >  443 [ACK] Seq=196332 Ack=33000 Win=1041 Len=1360 [TCP segment of a reassembled PDU]"
"233","12.474177","192.168.0.183","104.244.42.65","TCP","1414","50717  >  443 [ACK] Seq=197692 Ack=33000 Win=1041 Len=1360 [TCP segment of a reassembled PDU]"
"234","12.474177","192.168.0.183","104.244.42.65","TCP","1414","50717  >  443 [ACK] Seq=199052 Ack=33000 Win=1041 Len=1360 [TCP segment of a reassembled PDU]"
"235","12.474177","192.168.0.183","104.244.42.65","TLSv1.2","140","Application Data"
"236","12.474296","192.168.0.183","104.244.42.65","TCP","1414","50717  >  443 [ACK] Seq=200498 Ack=33000 Win=1041 Len=1360 [TCP segment of a reassembled PDU]"
"237","12.474296","192.168.0.183","104.244.42.65","TCP","1414","50717  >  443 [ACK] Seq=201858 Ack=33000 Win=1041 Len=1360 [TCP segment of a reassembled PDU]"
"238","12.474296","192.168.0.183","104.244.42.65","TCP","1414","50717  >  443 [ACK] Seq=203218 Ack=33000 Win=1041 Len=1360 [TCP segment of a reassembled PDU]"
"239","12.474296","192.168.0.183","104.244.42.65","TCP","1414","50717  >  443 [ACK] Seq=204578 Ack=33000 Win=1041 Len=1360 [TCP segment of a reassembled PDU]"
"240","12.474296","192.168.0.183","104.244.42.65","TCP","1414","50717  >  443 [ACK] Seq=205938 Ack=33000 Win=1041 Len=1360 [TCP segment of a reassembled PDU]"
"241","12.474296","192.168.0.183","104.244.42.65","TCP","1414","50717  >  443 [ACK] Seq=207298 Ack=33000 Win=1041 Len=1360 [TCP segment of a reassembled PDU]"
"242","12.474296","192.168.0.183","104.244.42.65","TCP","1414","50717  >  443 [ACK] Seq=208658 Ack=33000 Win=1041 Len=1360 [TCP segment of a reassembled PDU]"
"243","12.474296","192.168.0.183","104.244.42.65","TCP","1414","50717  >  443 [ACK] Seq=210018 Ack=33000 Win=1041 Len=1360 [TCP segment of a reassembled PDU]"
"244","12.474296","192.168.0.183","104.244.42.65","TCP","1414","50717  >  443 [ACK] Seq=211378 Ack=33000 Win=1041 Len=1360 [TCP segment of a reassembled PDU]"
"245","12.474296","192.168.0.183","104.244.42.65","TCP","1414","50717  >  443 [ACK] Seq=212738 Ack=33000 Win=1041 Len=1360 [TCP segment of a reassembled PDU]"
"246","12.474296","192.168.0.183","104.244.42.65","TCP","1414","50717  >  443 [ACK] Seq=214098 Ack=33000 Win=1041 Len=1360 [TCP segment of a reassembled PDU]"
"247","12.474296","192.168.0.183","104.244.42.65","TCP","1414","50717  >  443 [ACK] Seq=215458 Ack=33000 Win=1041 Len=1360 [TCP segment of a reassembled PDU]"
"248","12.474296","192.168.0.183","104.244.42.65","TLSv1.2","140","Application Data"
"249","12.474390","192.168.0.183","104.244.42.65","TLSv1.2","121","Application Data"
"250","12.512512","104.244.42.65","192.168.0.183","TCP","60","443  >  50717 [ACK] Seq=33000 Ack=171802 Win=5725 Len=0"
"251","12.517734","104.244.42.65","192.168.0.183","TCP","60","443  >  50717 [ACK] Seq=33000 Ack=204578 Win=5725 Len=0"
"252","12.517734","104.244.42.65","192.168.0.183","TLSv1.2","89","Application Data"
"253","12.517734","104.244.42.65","192.168.0.183","TCP","60","443  >  50717 [ACK] Seq=33035 Ack=210018 Win=5735 Len=0"
"254","12.517928","192.168.0.183","104.244.42.65","TLSv1.2","1133","Application Data"
"255","12.521172","104.244.42.65","192.168.0.183","TCP","60","443  >  50717 [ACK] Seq=33035 Ack=216971 Win=5730 Len=0"
"256","12.607672","104.244.42.65","192.168.0.183","TCP","60","443  >  50717 [ACK] Seq=33035 Ack=218050 Win=5735 Len=0"
"257","12.678248","104.244.42.65","192.168.0.183","TLSv1.2","184","Application Data"
"258","12.725870","192.168.0.183","104.244.42.65","TCP","54","50717  >  443 [ACK] Seq=218050 Ack=33165 Win=1040 Len=0"
"259","14.029990","192.168.0.183","104.244.42.65","TCP","1414","50717  >  443 [ACK] Seq=218050 Ack=33165 Win=1040 Len=1360 [TCP segment of a reassembled PDU]"
"260","14.029990","192.168.0.183","104.244.42.65","TLSv1.2","720","Application Data"
"261","14.085200","104.244.42.65","192.168.0.183","TCP","60","443  >  50717 [ACK] Seq=33165 Ack=220076 Win=5730 Len=0"
"262","14.779126","104.244.42.65","192.168.0.183","TCP","1414","443  >  50717 [ACK] Seq=33165 Ack=220076 Win=5735 Len=1360 [TCP segment of a reassembled PDU]"
"263","14.779126","104.244.42.65","192.168.0.183","TCP","1414","443  >  50717 [ACK] Seq=34525 Ack=220076 Win=5735 Len=1360 [TCP segment of a reassembled PDU]"
"264","14.779126","104.244.42.65","192.168.0.183","TCP","1414","443  >  50717 [PSH, ACK] Seq=35885 Ack=220076 Win=5735 Len=1360 [TCP segment of a reassembled PDU]"
"265","14.779126","104.244.42.65","192.168.0.183","TCP","1414","443  >  50717 [ACK] Seq=37245 Ack=220076 Win=5735 Len=1360 [TCP segment of a reassembled PDU]"
"266","14.779126","104.244.42.65","192.168.0.183","TCP","1414","443  >  50717 [ACK] Seq=38605 Ack=220076 Win=5735 Len=1360 [TCP segment of a reassembled PDU]"
"267","14.779126","104.244.42.65","192.168.0.183","TLSv1.2","646","Application Data"
"268","14.779178","192.168.0.183","104.244.42.65","TCP","54","50717  >  443 [ACK] Seq=220076 Ack=40557 Win=1041 Len=0"
"269","15.495565","192.168.0.183","104.244.42.65","TLSv1.2","689","Application Data"
"270","15.495848","192.168.0.183","104.244.42.65","TCP","1414","50717  >  443 [ACK] Seq=220711 Ack=40557 Win=1041 Len=1360 [TCP segment of a reassembled PDU]"
"271","15.495848","192.168.0.183","104.244.42.65","TCP","1414","50717  >  443 [ACK] Seq=222071 Ack=40557 Win=1041 Len=1360 [TCP segment of a reassembled PDU]"
"272","15.495848","192.168.0.183","104.244.42.65","TCP","1414","50717  >  443 [ACK] Seq=223431 Ack=40557 Win=1041 Len=1360 [TCP segment of a reassembled PDU]"
"273","15.495848","192.168.0.183","104.244.42.65","TCP","1414","50717  >  443 [ACK] Seq=224791 Ack=40557 Win=1041 Len=1360 [TCP segment of a reassembled PDU]"
"274","15.495848","192.168.0.183","104.244.42.65","TCP","1414","50717  >  443 [ACK] Seq=226151 Ack=40557 Win=1041 Len=1360 [TCP segment of a reassembled PDU]"
"275","15.495848","192.168.0.183","104.244.42.65","TCP","1414","50717  >  443 [ACK] Seq=227511 Ack=40557 Win=1041 Len=1360 [TCP segment of a reassembled PDU]"
"276","15.495848","192.168.0.183","104.244.42.65","TCP","1414","50717  >  443 [ACK] Seq=228871 Ack=40557 Win=1041 Len=1360 [TCP segment of a reassembled PDU]"
"277","15.495848","192.168.0.183","104.244.42.65","TCP","1414","50717  >  443 [ACK] Seq=230231 Ack=40557 Win=1041 Len=1360 [TCP segment of a reassembled PDU]"
"278","15.495848","192.168.0.183","104.244.42.65","TCP","1414","50717  >  443 [ACK] Seq=231591 Ack=40557 Win=1041 Len=1360 [TCP segment of a reassembled PDU]"
"279","15.495848","192.168.0.183","104.244.42.65","TCP","1414","50717  >  443 [ACK] Seq=232951 Ack=40557 Win=1041 Len=1360 [TCP segment of a reassembled PDU]"
"280","15.495848","192.168.0.183","104.244.42.65","TCP","1414","50717  >  443 [ACK] Seq=234311 Ack=40557 Win=1041 Len=1360 [TCP segment of a reassembled PDU]"
"281","15.495848","192.168.0.183","104.244.42.65","TCP","1414","50717  >  443 [ACK] Seq=235671 Ack=40557 Win=1041 Len=1360 [TCP segment of a reassembled PDU]"
"282","15.495848","192.168.0.183","104.244.42.65","TLSv1.2","140","Application Data"
"283","15.496062","192.168.0.183","104.244.42.65","TCP","1414","50717  >  443 [ACK] Seq=237117 Ack=40557 Win=1041 Len=1360 [TCP segment of a reassembled PDU]"
"284","15.496062","192.168.0.183","104.244.42.65","TCP","1414","50717  >  443 [ACK] Seq=238477 Ack=40557 Win=1041 Len=1360 [TCP segment of a reassembled PDU]"
"285","15.496062","192.168.0.183","104.244.42.65","TCP","1414","50717  >  443 [ACK] Seq=239837 Ack=40557 Win=1041 Len=1360 [TCP segment of a reassembled PDU]"
"286","15.496062","192.168.0.183","104.244.42.65","TCP","1414","50717  >  443 [ACK] Seq=241197 Ack=40557 Win=1041 Len=1360 [TCP segment of a reassembled PDU]"
"287","15.496062","192.168.0.183","104.244.42.65","TCP","1414","50717  >  443 [ACK] Seq=242557 Ack=40557 Win=1041 Len=1360 [TCP segment of a reassembled PDU]"
"288","15.496062","192.168.0.183","104.244.42.65","TCP","1414","50717  >  443 [ACK] Seq=243917 Ack=40557 Win=1041 Len=1360 [TCP segment of a reassembled PDU]"
"289","15.496062","192.168.0.183","104.244.42.65","TCP","1414","50717  >  443 [ACK] Seq=245277 Ack=40557 Win=1041 Len=1360 [TCP segment of a reassembled PDU]"
"290","15.496062","192.168.0.183","104.244.42.65","TCP","1414","50717  >  443 [ACK] Seq=246637 Ack=40557 Win=1041 Len=1360 [TCP segment of a reassembled PDU]"
"291","15.496062","192.168.0.183","104.244.42.65","TCP","1414","50717  >  443 [ACK] Seq=247997 Ack=40557 Win=1041 Len=1360 [TCP segment of a reassembled PDU]"
"292","15.496062","192.168.0.183","104.244.42.65","TCP","1414","50717  >  443 [ACK] Seq=249357 Ack=40557 Win=1041 Len=1360 [TCP segment of a reassembled PDU]"
"293","15.496062","192.168.0.183","104.244.42.65","TCP","1414","50717  >  443 [ACK] Seq=250717 Ack=40557 Win=1041 Len=1360 [TCP segment of a reassembled PDU]"
"294","15.496062","192.168.0.183","104.244.42.65","TCP","1414","50717  >  443 [ACK] Seq=252077 Ack=40557 Win=1041 Len=1360 [TCP segment of a reassembled PDU]"
"295","15.496062","192.168.0.183","104.244.42.65","TLSv1.2","140","Application Data"
"296","15.496257","192.168.0.183","104.244.42.65","TCP","1414","50717  >  443 [ACK] Seq=253523 Ack=40557 Win=1041 Len=1360 [TCP segment of a reassembled PDU]"
"297","15.496257","192.168.0.183","104.244.42.65","TCP","1414","50717  >  443 [ACK] Seq=254883 Ack=40557 Win=1041 Len=1360 [TCP segment of a reassembled PDU]"
"298","15.496257","192.168.0.183","104.244.42.65","TCP","1414","50717  >  443 [ACK] Seq=256243 Ack=40557 Win=1041 Len=1360 [TCP segment of a reassembled PDU]"
"299","15.496257","192.168.0.183","104.244.42.65","TCP","1414","50717  >  443 [ACK] Seq=257603 Ack=40557 Win=1041 Len=1360 [TCP segment of a reassembled PDU]"
"300","15.496257","192.168.0.183","104.244.42.65","TCP","1414","50717  >  443 [ACK] Seq=258963 Ack=40557 Win=1041 Len=1360 [TCP segment of a reassembled PDU]"
"301","15.496257","192.168.0.183","104.244.42.65","TCP","1414","50717  >  443 [ACK] Seq=260323 Ack=40557 Win=1041 Len=1360 [TCP segment of a reassembled PDU]"
"302","15.496257","192.168.0.183","104.244.42.65","TCP","1414","50717  >  443 [ACK] Seq=261683 Ack=40557 Win=1041 Len=1360 [TCP segment of a reassembled PDU]"
"303","15.496257","192.168.0.183","104.244.42.65","TCP","1414","50717  >  443 [ACK] Seq=263043 Ack=40557 Win=1041 Len=1360 [TCP segment of a reassembled PDU]"
"304","15.496257","192.168.0.183","104.244.42.65","TCP","1414","50717  >  443 [ACK] Seq=264403 Ack=40557 Win=1041 Len=1360 [TCP segment of a reassembled PDU]"
"305","15.496257","192.168.0.183","104.244.42.65","TCP","1414","50717  >  443 [ACK] Seq=265763 Ack=40557 Win=1041 Len=1360 [TCP segment of a reassembled PDU]"
"306","15.496257","192.168.0.183","104.244.42.65","TCP","1414","50717  >  443 [ACK] Seq=267123 Ack=40557 Win=1041 Len=1360 [TCP segment of a reassembled PDU]"
"307","15.496257","192.168.0.183","104.244.42.65","TCP","1414","50717  >  443 [ACK] Seq=268483 Ack=40557 Win=1041 Len=1360 [TCP segment of a reassembled PDU]"
"308","15.496257","192.168.0.183","104.244.42.65","TLSv1.2","140","Application Data"
"309","15.496528","192.168.0.183","104.244.42.65","TCP","1414","50717  >  443 [ACK] Seq=269929 Ack=40557 Win=1041 Len=1360 [TCP segment of a reassembled PDU]"
"310","15.496528","192.168.0.183","104.244.42.65","TCP","1414","50717  >  443 [ACK] Seq=271289 Ack=40557 Win=1041 Len=1360 [TCP segment of a reassembled PDU]"
"311","15.496528","192.168.0.183","104.244.42.65","TCP","1414","50717  >  443 [ACK] Seq=272649 Ack=40557 Win=1041 Len=1360 [TCP segment of a reassembled PDU]"
"312","15.496528","192.168.0.183","104.244.42.65","TCP","1414","50717  >  443 [ACK] Seq=274009 Ack=40557 Win=1041 Len=1360 [TCP segment of a reassembled PDU]"
"313","15.496528","192.168.0.183","104.244.42.65","TCP","1414","50717  >  443 [ACK] Seq=275369 Ack=40557 Win=1041 Len=1360 [TCP segment of a reassembled PDU]"
"314","15.496528","192.168.0.183","104.244.42.65","TCP","1414","50717  >  443 [ACK] Seq=276729 Ack=40557 Win=1041 Len=1360 [TCP segment of a reassembled PDU]"
"315","15.496528","192.168.0.183","104.244.42.65","TCP","1414","50717  >  443 [ACK] Seq=278089 Ack=40557 Win=1041 Len=1360 [TCP segment of a reassembled PDU]"
"316","15.496528","192.168.0.183","104.244.42.65","TCP","1414","50717  >  443 [ACK] Seq=279449 Ack=40557 Win=1041 Len=1360 [TCP segment of a reassembled PDU]"
"317","15.496528","192.168.0.183","104.244.42.65","TCP","1414","50717  >  443 [ACK] Seq=280809 Ack=40557 Win=1041 Len=1360 [TCP segment of a reassembled PDU]"
"318","15.496528","192.168.0.183","104.244.42.65","TCP","1414","50717  >  443 [ACK] Seq=282169 Ack=40557 Win=1041 Len=1360 [TCP segment of a reassembled PDU]"
"319","15.496528","192.168.0.183","104.244.42.65","TCP","1414","50717  >  443 [ACK] Seq=283529 Ack=40557 Win=1041 Len=1360 [TCP segment of a reassembled PDU]"
"320","15.496528","192.168.0.183","104.244.42.65","TCP","1414","50717  >  443 [ACK] Seq=284889 Ack=40557 Win=1041 Len=1360 [TCP segment of a reassembled PDU]"
"321","15.496528","192.168.0.183","104.244.42.65","TLSv1.2","140","Application Data"
"322","15.496809","192.168.0.183","104.244.42.65","TLSv1.2","121","Application Data"
"323","15.542544","104.244.42.65","192.168.0.183","TCP","60","443  >  50717 [ACK] Seq=40557 Ack=222071 Win=5732 Len=0"
"324","15.542544","104.244.42.65","192.168.0.183","TCP","60","443  >  50717 [ACK] Seq=40557 Ack=286402 Win=5666 Len=0"
"325","15.542544","104.244.42.65","192.168.0.183","TLSv1.2","102","Application Data"
"326","15.542825","192.168.0.183","104.244.42.65","TCP","1414","50717  >  443 [ACK] Seq=286402 Ack=40605 Win=1041 Len=1360 [TCP segment of a reassembled PDU]"
"327","15.542825","192.168.0.183","104.244.42.65","TCP","1414","50717  >  443 [ACK] Seq=287762 Ack=40605 Win=1041 Len=1360 [TCP segment of a reassembled PDU]"
"328","15.542825","192.168.0.183","104.244.42.65","TCP","1414","50717  >  443 [ACK] Seq=289122 Ack=40605 Win=1041 Len=1360 [TCP segment of a reassembled PDU]"
"329","15.542825","192.168.0.183","104.244.42.65","TCP","1414","50717  >  443 [ACK] Seq=290482 Ack=40605 Win=1041 Len=1360 [TCP segment of a reassembled PDU]"
"330","15.542825","192.168.0.183","104.244.42.65","TCP","1414","50717  >  443 [ACK] Seq=291842 Ack=40605 Win=1041 Len=1360 [TCP segment of a reassembled PDU]"
"331","15.542825","192.168.0.183","104.244.42.65","TCP","1414","50717  >  443 [ACK] Seq=293202 Ack=40605 Win=1041 Len=1360 [TCP segment of a reassembled PDU]"
"332","15.542825","192.168.0.183","104.244.42.65","TCP","1414","50717  >  443 [ACK] Seq=294562 Ack=40605 Win=1041 Len=1360 [TCP segment of a reassembled PDU]"
"333","15.542825","192.168.0.183","104.244.42.65","TCP","1414","50717  >  443 [ACK] Seq=295922 Ack=40605 Win=1041 Len=1360 [TCP segment of a reassembled PDU]"
"334","15.542825","192.168.0.183","104.244.42.65","TCP","1414","50717  >  443 [ACK] Seq=297282 Ack=40605 Win=1041 Len=1360 [TCP segment of a reassembled PDU]"
"335","15.542825","192.168.0.183","104.244.42.65","TCP","1414","50717  >  443 [ACK] Seq=298642 Ack=40605 Win=1041 Len=1360 [TCP segment of a reassembled PDU]"
"336","15.542825","192.168.0.183","104.244.42.65","TCP","1414","50717  >  443 [ACK] Seq=300002 Ack=40605 Win=1041 Len=1360 [TCP segment of a reassembled PDU]"
"337","15.542825","192.168.0.183","104.244.42.65","TCP","1414","50717  >  443 [ACK] Seq=301362 Ack=40605 Win=1041 Len=1360 [TCP segment of a reassembled PDU]"
"338","15.542825","192.168.0.183","104.244.42.65","TLSv1.2","104","Application Data"
"339","15.542972","192.168.0.183","104.244.42.65","TCP","1414","50717  >  443 [ACK] Seq=302772 Ack=40605 Win=1041 Len=1360 [TCP segment of a reassembled PDU]"
"340","15.542972","192.168.0.183","104.244.42.65","TCP","1414","50717  >  443 [ACK] Seq=304132 Ack=40605 Win=1041 Len=1360 [TCP segment of a reassembled PDU]"
"341","15.542972","192.168.0.183","104.244.42.65","TCP","1414","50717  >  443 [ACK] Seq=305492 Ack=40605 Win=1041 Len=1360 [TCP segment of a reassembled PDU]"
"342","15.542972","192.168.0.183","104.244.42.65","TCP","1414","50717  >  443 [ACK] Seq=306852 Ack=40605 Win=1041 Len=1360 [TCP segment of a reassembled PDU]"
"343","15.542972","192.168.0.183","104.244.42.65","TLSv1.2","1392","Application Data"
"344","15.569528","192.168.0.183","104.244.42.65","TLSv1.2","691","Application Data"
"345","15.586900","104.244.42.65","192.168.0.183","TCP","60","443  >  50717 [ACK] Seq=40605 Ack=289122 Win=5729 Len=0"
"346","15.592567","104.244.42.65","192.168.0.183","TCP","60","443  >  50717 [ACK] Seq=40605 Ack=309550 Win=5735 Len=0"
"347","15.592567","104.244.42.65","192.168.0.183","TLSv1.2","89","Application Data"
"348","15.647727","192.168.0.183","104.244.42.65","TCP","54","50717  >  443 [ACK] Seq=310187 Ack=40640 Win=1040 Len=0"
"349","15.649299","104.244.42.65","192.168.0.183","TCP","60","443  >  50717 [ACK] Seq=40640 Ack=310187 Win=5735 Len=0"
"350","15.649628","104.244.42.65","192.168.0.183","TLSv1.2","184","Application Data"
"351","15.693751","192.168.0.183","104.244.42.65","TCP","54","50717  >  443 [ACK] Seq=310187 Ack=40770 Win=1040 Len=0"
"352","15.739502","192.168.0.183","104.244.42.65","TLSv1.2","250","Application Data"
"353","15.739596","192.168.0.183","104.244.42.65","TCP","1414","50717  >  443 [ACK] Seq=310383 Ack=40770 Win=1040 Len=1360 [TCP segment of a reassembled PDU]"
"354","15.739596","192.168.0.183","104.244.42.65","TLSv1.2","662","Application Data"
"355","15.741780","192.168.0.183","104.244.42.65","TLSv1.2","239","Application Data"
"356","15.742028","192.168.0.183","104.244.42.65","TCP","1414","50717  >  443 [ACK] Seq=312536 Ack=40770 Win=1040 Len=1360 [TCP segment of a reassembled PDU]"
"357","15.742028","192.168.0.183","104.244.42.65","TLSv1.2","1167","Application Data"
"358","15.775652","104.244.42.65","192.168.0.183","TCP","60","443  >  50717 [ACK] Seq=40770 Ack=310383 Win=5735 Len=0"
"359","15.778279","104.244.42.65","192.168.0.183","TCP","60","443  >  50717 [ACK] Seq=40770 Ack=312351 Win=5730 Len=0"
"360","15.782618","104.244.42.65","192.168.0.183","TCP","60","443  >  50717 [ACK] Seq=40770 Ack=315009 Win=5728 Len=0"
"361","15.821320","104.244.42.65","192.168.0.183","TLSv1.2","242","Application Data"
"362","15.863766","192.168.0.183","104.244.42.65","TCP","54","50717  >  443 [ACK] Seq=315009 Ack=40958 Win=1039 Len=0"
"363","15.914914","104.244.42.65","192.168.0.183","TLSv1.2","151","Application Data"
"364","15.956939","192.168.0.183","104.244.42.65","TCP","54","50717  >  443 [ACK] Seq=315009 Ack=41055 Win=1039 Len=0"
"365","17.120534","192.168.0.183","104.244.42.65","TLSv1.2","281","Application Data"
"366","17.120707","192.168.0.183","104.244.42.65","TLSv1.2","459","Application Data"
"367","17.158260","104.244.42.65","192.168.0.183","TCP","60","443  >  50717 [ACK] Seq=41055 Ack=315641 Win=5735 Len=0"
"368","17.178222","104.244.42.65","192.168.0.183","TLSv1.2","220","Application Data"
"369","17.222129","192.168.0.183","104.244.42.65","TCP","54","50717  >  443 [ACK] Seq=315641 Ack=41221 Win=1038 Len=0"
"370","17.547166","192.168.0.183","104.244.42.65","TLSv1.2","271","Application Data"
"371","17.547227","192.168.0.183","104.244.42.65","TLSv1.2","168","Application Data"
"372","17.583750","104.244.42.65","192.168.0.183","TCP","60","443  >  50717 [ACK] Seq=41221 Ack=315972 Win=5735 Len=0"
"373","17.661544","104.244.42.65","192.168.0.183","TLSv1.2","272","Application Data"
"374","17.662359","192.168.0.183","104.244.42.65","TLSv1.2","89","Application Data"
"375","17.741625","104.244.42.65","192.168.0.183","TCP","1414","443  >  50717 [ACK] Seq=41439 Ack=316007 Win=5735 Len=1360 [TCP segment of a reassembled PDU]"
"376","17.741625","104.244.42.65","192.168.0.183","TCP","1414","443  >  50717 [ACK] Seq=42799 Ack=316007 Win=5735 Len=1360 [TCP segment of a reassembled PDU]"
"377","17.741625","104.244.42.65","192.168.0.183","TCP","1414","443  >  50717 [PSH, ACK] Seq=44159 Ack=316007 Win=5735 Len=1360 [TCP segment of a reassembled PDU]"
"378","17.741625","104.244.42.65","192.168.0.183","TCP","1414","443  >  50717 [ACK] Seq=45519 Ack=316007 Win=5735 Len=1360 [TCP segment of a reassembled PDU]"
"379","17.741625","104.244.42.65","192.168.0.183","TCP","1414","443  >  50717 [ACK] Seq=46879 Ack=316007 Win=5735 Len=1360 [TCP segment of a reassembled PDU]"
"380","17.741625","104.244.42.65","192.168.0.183","TCP","1414","443  >  50717 [PSH, ACK] Seq=48239 Ack=316007 Win=5735 Len=1360 [TCP segment of a reassembled PDU]"
"381","17.741625","104.244.42.65","192.168.0.183","TCP","1414","443  >  50717 [ACK] Seq=49599 Ack=316007 Win=5735 Len=1360 [TCP segment of a reassembled PDU]"
"382","17.741625","104.244.42.65","192.168.0.183","TCP","1414","443  >  50717 [ACK] Seq=50959 Ack=316007 Win=5735 Len=1360 [TCP segment of a reassembled PDU]"
"383","17.741625","104.244.42.65","192.168.0.183","TCP","1414","443  >  50717 [PSH, ACK] Seq=52319 Ack=316007 Win=5735 Len=1360 [TCP segment of a reassembled PDU]"
"384","17.741625","104.244.42.65","192.168.0.183","TCP","1414","443  >  50717 [ACK] Seq=53679 Ack=316007 Win=5735 Len=1360 [TCP segment of a reassembled PDU]"
"385","17.741625","104.244.42.65","192.168.0.183","TCP","1414","443  >  50717 [ACK] Seq=55039 Ack=316007 Win=5735 Len=1360 [TCP segment of a reassembled PDU]"
"386","17.741625","104.244.42.65","192.168.0.183","TCP","1414","443  >  50717 [PSH, ACK] Seq=56399 Ack=316007 Win=5735 Len=1360 [TCP segment of a reassembled PDU]"
"387","17.741625","104.244.42.65","192.168.0.183","TLSv1.2","1414","Application Data"
"388","17.741625","104.244.42.65","192.168.0.183","TCP","1414","443  >  50717 [ACK] Seq=59119 Ack=316007 Win=5735 Len=1360 [TCP segment of a reassembled PDU]"
"389","17.741625","104.244.42.65","192.168.0.183","TCP","1414","443  >  50717 [PSH, ACK] Seq=60479 Ack=316007 Win=5735 Len=1360 [TCP segment of a reassembled PDU]"
"390","17.741625","104.244.42.65","192.168.0.183","TCP","1414","443  >  50717 [ACK] Seq=61839 Ack=316007 Win=5735 Len=1360 [TCP segment of a reassembled PDU]"
"391","17.741625","104.244.42.65","192.168.0.183","TCP","1414","443  >  50717 [ACK] Seq=63199 Ack=316007 Win=5735 Len=1360 [TCP segment of a reassembled PDU]"
"392","17.741625","104.244.42.65","192.168.0.183","TCP","1414","443  >  50717 [PSH, ACK] Seq=64559 Ack=316007 Win=5735 Len=1360 [TCP segment of a reassembled PDU]"
"393","17.741625","104.244.42.65","192.168.0.183","TCP","1414","443  >  50717 [ACK] Seq=65919 Ack=316007 Win=5735 Len=1360 [TCP segment of a reassembled PDU]"
"394","17.741625","104.244.42.65","192.168.0.183","TCP","1414","443  >  50717 [ACK] Seq=67279 Ack=316007 Win=5735 Len=1360 [TCP segment of a reassembled PDU]"
"395","17.741625","104.244.42.65","192.168.0.183","TCP","1414","443  >  50717 [PSH, ACK] Seq=68639 Ack=316007 Win=5735 Len=1360 [TCP segment of a reassembled PDU]"
"396","17.741625","104.244.42.65","192.168.0.183","TCP","1414","443  >  50717 [ACK] Seq=69999 Ack=316007 Win=5735 Len=1360 [TCP segment of a reassembled PDU]"
"397","17.741625","104.244.42.65","192.168.0.183","TCP","1414","443  >  50717 [ACK] Seq=71359 Ack=316007 Win=5735 Len=1360 [TCP segment of a reassembled PDU]"
"398","17.741625","104.244.42.65","192.168.0.183","TCP","1414","443  >  50717 [PSH, ACK] Seq=72719 Ack=316007 Win=5735 Len=1360 [TCP segment of a reassembled PDU]"
"399","17.741625","104.244.42.65","192.168.0.183","TLSv1.2","270","Application Data, Application Data"
"400","17.741769","192.168.0.183","104.244.42.65","TCP","54","50717  >  443 [ACK] Seq=316007 Ack=74295 Win=1041 Len=0"
"401","17.932218","192.168.0.183","104.244.42.65","TLSv1.2","954","Application Data"
"402","17.932396","192.168.0.183","104.244.42.65","TLSv1.2","344","Application Data"
"403","17.970619","104.244.42.65","192.168.0.183","TCP","60","443  >  50717 [ACK] Seq=74295 Ack=317197 Win=5735 Len=0"
"404","18.001406","104.244.42.65","192.168.0.183","TLSv1.2","478","Application Data"
"405","18.001406","104.244.42.65","192.168.0.183","TLSv1.2","234","Application Data"
"406","18.001501","192.168.0.183","104.244.42.65","TCP","54","50717  >  443 [ACK] Seq=317197 Ack=74899 Win=1038 Len=0"
"407","18.402122","192.168.0.183","104.244.42.65","TLSv1.2","711","Application Data"
"408","18.402298","192.168.0.183","104.244.42.65","TCP","1414","50717  >  443 [ACK] Seq=317854 Ack=74899 Win=1038 Len=1360 [TCP segment of a reassembled PDU]"
"409","18.402298","192.168.0.183","104.244.42.65","TCP","1414","50717  >  443 [ACK] Seq=319214 Ack=74899 Win=1038 Len=1360 [TCP segment of a reassembled PDU]"
"410","18.402298","192.168.0.183","104.244.42.65","TCP","1414","50717  >  443 [ACK] Seq=320574 Ack=74899 Win=1038 Len=1360 [TCP segment of a reassembled PDU]"
"411","18.402298","192.168.0.183","104.244.42.65","TCP","1414","50717  >  443 [ACK] Seq=321934 Ack=74899 Win=1038 Len=1360 [TCP segment of a reassembled PDU]"
"412","18.402298","192.168.0.183","104.244.42.65","TCP","1414","50717  >  443 [ACK] Seq=323294 Ack=74899 Win=1038 Len=1360 [TCP segment of a reassembled PDU]"
"413","18.402298","192.168.0.183","104.244.42.65","TCP","1414","50717  >  443 [ACK] Seq=324654 Ack=74899 Win=1038 Len=1360 [TCP segment of a reassembled PDU]"
"414","18.402298","192.168.0.183","104.244.42.65","TCP","1414","50717  >  443 [ACK] Seq=326014 Ack=74899 Win=1038 Len=1360 [TCP segment of a reassembled PDU]"
"415","18.402298","192.168.0.183","104.244.42.65","TCP","1414","50717  >  443 [ACK] Seq=327374 Ack=74899 Win=1038 Len=1360 [TCP segment of a reassembled PDU]"
"416","18.402298","192.168.0.183","104.244.42.65","TCP","1414","50717  >  443 [ACK] Seq=328734 Ack=74899 Win=1038 Len=1360 [TCP segment of a reassembled PDU]"
"417","18.402298","192.168.0.183","104.244.42.65","TCP","1414","50717  >  443 [ACK] Seq=330094 Ack=74899 Win=1038 Len=1360 [TCP segment of a reassembled PDU]"
"418","18.402298","192.168.0.183","104.244.42.65","TCP","1414","50717  >  443 [ACK] Seq=331454 Ack=74899 Win=1038 Len=1360 [TCP segment of a reassembled PDU]"
"419","18.402298","192.168.0.183","104.244.42.65","TCP","1414","50717  >  443 [ACK] Seq=332814 Ack=74899 Win=1038 Len=1360 [TCP segment of a reassembled PDU]"
"420","18.402298","192.168.0.183","104.244.42.65","TLSv1.2","140","Application Data"
"421","18.402729","192.168.0.183","104.244.42.65","TCP","1414","50717  >  443 [ACK] Seq=334260 Ack=74899 Win=1038 Len=1360 [TCP segment of a reassembled PDU]"
"422","18.402729","192.168.0.183","104.244.42.65","TCP","1414","50717  >  443 [ACK] Seq=335620 Ack=74899 Win=1038 Len=1360 [TCP segment of a reassembled PDU]"
"423","18.402729","192.168.0.183","104.244.42.65","TCP","1414","50717  >  443 [ACK] Seq=336980 Ack=74899 Win=1038 Len=1360 [TCP segment of a reassembled PDU]"
"424","18.402729","192.168.0.183","104.244.42.65","TCP","1414","50717  >  443 [ACK] Seq=338340 Ack=74899 Win=1038 Len=1360 [TCP segment of a reassembled PDU]"
"425","18.402729","192.168.0.183","104.244.42.65","TCP","1414","50717  >  443 [ACK] Seq=339700 Ack=74899 Win=1038 Len=1360 [TCP segment of a reassembled PDU]"
"426","18.402729","192.168.0.183","104.244.42.65","TCP","1414","50717  >  443 [ACK] Seq=341060 Ack=74899 Win=1038 Len=1360 [TCP segment of a reassembled PDU]"
"427","18.402729","192.168.0.183","104.244.42.65","TCP","1414","50717  >  443 [ACK] Seq=342420 Ack=74899 Win=1038 Len=1360 [TCP segment of a reassembled PDU]"
"428","18.402729","192.168.0.183","104.244.42.65","TCP","1414","50717  >  443 [ACK] Seq=343780 Ack=74899 Win=1038 Len=1360 [TCP segment of a reassembled PDU]"
"429","18.402729","192.168.0.183","104.244.42.65","TCP","1414","50717  >  443 [ACK] Seq=345140 Ack=74899 Win=1038 Len=1360 [TCP segment of a reassembled PDU]"
"430","18.402729","192.168.0.183","104.244.42.65","TCP","1414","50717  >  443 [ACK] Seq=346500 Ack=74899 Win=1038 Len=1360 [TCP segment of a reassembled PDU]"
"431","18.402729","192.168.0.183","104.244.42.65","TCP","1414","50717  >  443 [ACK] Seq=347860 Ack=74899 Win=1038 Len=1360 [TCP segment of a reassembled PDU]"
"432","18.402729","192.168.0.183","104.244.42.65","TCP","1414","50717  >  443 [ACK] Seq=349220 Ack=74899 Win=1038 Len=1360 [TCP segment of a reassembled PDU]"
"433","18.402729","192.168.0.183","104.244.42.65","TLSv1.2","140","Application Data"
"434","18.403172","192.168.0.183","104.244.42.65","TCP","1414","50717  >  443 [ACK] Seq=350666 Ack=74899 Win=1038 Len=1360 [TCP segment of a reassembled PDU]"
"435","18.403172","192.168.0.183","104.244.42.65","TCP","1414","50717  >  443 [ACK] Seq=352026 Ack=74899 Win=1038 Len=1360 [TCP segment of a reassembled PDU]"
"436","18.403172","192.168.0.183","104.244.42.65","TCP","1414","50717  >  443 [ACK] Seq=353386 Ack=74899 Win=1038 Len=1360 [TCP segment of a reassembled PDU]"
"437","18.403172","192.168.0.183","104.244.42.65","TCP","1414","50717  >  443 [ACK] Seq=354746 Ack=74899 Win=1038 Len=1360 [TCP segment of a reassembled PDU]"
"438","18.403172","192.168.0.183","104.244.42.65","TCP","1414","50717  >  443 [ACK] Seq=356106 Ack=74899 Win=1038 Len=1360 [TCP segment of a reassembled PDU]"
"439","18.403172","192.168.0.183","104.244.42.65","TCP","1414","50717  >  443 [ACK] Seq=357466 Ack=74899 Win=1038 Len=1360 [TCP segment of a reassembled PDU]"
"440","18.403172","192.168.0.183","104.244.42.65","TCP","1414","50717  >  443 [ACK] Seq=358826 Ack=74899 Win=1038 Len=1360 [TCP segment of a reassembled PDU]"
"441","18.403172","192.168.0.183","104.244.42.65","TCP","1414","50717  >  443 [ACK] Seq=360186 Ack=74899 Win=1038 Len=1360 [TCP segment of a reassembled PDU]"
"442","18.403172","192.168.0.183","104.244.42.65","TCP","1414","50717  >  443 [ACK] Seq=361546 Ack=74899 Win=1038 Len=1360 [TCP segment of a reassembled PDU]"
"443","18.403172","192.168.0.183","104.244.42.65","TCP","1414","50717  >  443 [ACK] Seq=362906 Ack=74899 Win=1038 Len=1360 [TCP segment of a reassembled PDU]"
"444","18.403172","192.168.0.183","104.244.42.65","TCP","1414","50717  >  443 [ACK] Seq=364266 Ack=74899 Win=1038 Len=1360 [TCP segment of a reassembled PDU]"
"445","18.403172","192.168.0.183","104.244.42.65","TCP","1414","50717  >  443 [ACK] Seq=365626 Ack=74899 Win=1038 Len=1360 [TCP segment of a reassembled PDU]"
"446","18.403172","192.168.0.183","104.244.42.65","TLSv1.2","140","Application Data"
"447","18.403550","192.168.0.183","104.244.42.65","TCP","1414","50717  >  443 [ACK] Seq=367072 Ack=74899 Win=1038 Len=1360 [TCP segment of a reassembled PDU]"
"448","18.403550","192.168.0.183","104.244.42.65","TCP","1414","50717  >  443 [ACK] Seq=368432 Ack=74899 Win=1038 Len=1360 [TCP segment of a reassembled PDU]"
"449","18.403550","192.168.0.183","104.244.42.65","TCP","1414","50717  >  443 [ACK] Seq=369792 Ack=74899 Win=1038 Len=1360 [TCP segment of a reassembled PDU]"
"450","18.403550","192.168.0.183","104.244.42.65","TCP","1414","50717  >  443 [ACK] Seq=371152 Ack=74899 Win=1038 Len=1360 [TCP segment of a reassembled PDU]"
"451","18.403550","192.168.0.183","104.244.42.65","TCP","1414","50717  >  443 [ACK] Seq=372512 Ack=74899 Win=1038 Len=1360 [TCP segment of a reassembled PDU]"
"452","18.403550","192.168.0.183","104.244.42.65","TCP","1414","50717  >  443 [ACK] Seq=373872 Ack=74899 Win=1038 Len=1360 [TCP segment of a reassembled PDU]"
"453","18.403550","192.168.0.183","104.244.42.65","TCP","1414","50717  >  443 [ACK] Seq=375232 Ack=74899 Win=1038 Len=1360 [TCP segment of a reassembled PDU]"
"454","18.403550","192.168.0.183","104.244.42.65","TCP","1414","50717  >  443 [ACK] Seq=376592 Ack=74899 Win=1038 Len=1360 [TCP segment of a reassembled PDU]"
"455","18.403550","192.168.0.183","104.244.42.65","TCP","1414","50717  >  443 [ACK] Seq=377952 Ack=74899 Win=1038 Len=1360 [TCP segment of a reassembled PDU]"
"456","18.403550","192.168.0.183","104.244.42.65","TCP","1414","50717  >  443 [ACK] Seq=379312 Ack=74899 Win=1038 Len=1360 [TCP segment of a reassembled PDU]"
"457","18.403550","192.168.0.183","104.244.42.65","TCP","1414","50717  >  443 [ACK] Seq=380672 Ack=74899 Win=1038 Len=1360 [TCP segment of a reassembled PDU]"
"458","18.403550","192.168.0.183","104.244.42.65","TCP","1414","50717  >  443 [ACK] Seq=382032 Ack=74899 Win=1038 Len=1360 [TCP segment of a reassembled PDU]"
"459","18.403550","192.168.0.183","104.244.42.65","TLSv1.2","140","Application Data"
"460","18.403904","192.168.0.183","104.244.42.65","TLSv1.2","121","Application Data"
"461","18.451740","104.244.42.65","192.168.0.183","TCP","60","443  >  50717 [ACK] Seq=74899 Ack=319214 Win=5732 Len=0"
"462","18.451740","104.244.42.65","192.168.0.183","TCP","60","443  >  50717 [ACK] Seq=74899 Ack=330094 Win=5735 Len=0"
"463","18.451740","104.244.42.65","192.168.0.183","TCP","60","443  >  50717 [ACK] Seq=74899 Ack=369792 Win=5702 Len=0"
"464","18.451740","104.244.42.65","192.168.0.183","TLSv1.2","89","Application Data"
"465","18.451740","104.244.42.65","192.168.0.183","TCP","60","443  >  50717 [ACK] Seq=74934 Ack=383545 Win=5708 Len=0"
"466","18.451988","192.168.0.183","104.244.42.65","TCP","1414","50717  >  443 [ACK] Seq=383545 Ack=74934 Win=1038 Len=1360 [TCP segment of a reassembled PDU]"
"467","18.451988","192.168.0.183","104.244.42.65","TCP","1414","50717  >  443 [ACK] Seq=384905 Ack=74934 Win=1038 Len=1360 [TCP segment of a reassembled PDU]"
"468","18.451988","192.168.0.183","104.244.42.65","TCP","1414","50717  >  443 [ACK] Seq=386265 Ack=74934 Win=1038 Len=1360 [TCP segment of a reassembled PDU]"
"469","18.451988","192.168.0.183","104.244.42.65","TCP","1414","50717  >  443 [ACK] Seq=387625 Ack=74934 Win=1038 Len=1360 [TCP segment of a reassembled PDU]"
"470","18.451988","192.168.0.183","104.244.42.65","TCP","1414","50717  >  443 [ACK] Seq=388985 Ack=74934 Win=1038 Len=1360 [TCP segment of a reassembled PDU]"
"471","18.451988","192.168.0.183","104.244.42.65","TCP","1414","50717  >  443 [ACK] Seq=390345 Ack=74934 Win=1038 Len=1360 [TCP segment of a reassembled PDU]"
"472","18.451988","192.168.0.183","104.244.42.65","TCP","1414","50717  >  443 [ACK] Seq=391705 Ack=74934 Win=1038 Len=1360 [TCP segment of a reassembled PDU]"
"473","18.451988","192.168.0.183","104.244.42.65","TCP","1414","50717  >  443 [ACK] Seq=393065 Ack=74934 Win=1038 Len=1360 [TCP segment of a reassembled PDU]"
"474","18.451988","192.168.0.183","104.244.42.65","TCP","1414","50717  >  443 [ACK] Seq=394425 Ack=74934 Win=1038 Len=1360 [TCP segment of a reassembled PDU]"
"475","18.451988","192.168.0.183","104.244.42.65","TLSv1.2","1238","Application Data"
"476","18.494826","104.244.42.65","192.168.0.183","TCP","60","443  >  50717 [ACK] Seq=74934 Ack=386265 Win=5725 Len=0"
"477","18.495466","104.244.42.65","192.168.0.183","TCP","60","443  >  50717 [ACK] Seq=74934 Ack=396969 Win=5735 Len=0"
"478","18.548073","104.244.42.65","192.168.0.183","TLSv1.2","206","Application Data"
"479","18.592018","192.168.0.183","104.244.42.65","TCP","54","50717  >  443 [ACK] Seq=396969 Ack=75086 Win=1038 Len=0"
"480","20.730591","192.168.0.183","104.244.42.65","TCP","1414","50717  >  443 [ACK] Seq=396969 Ack=75086 Win=1038 Len=1360 [TCP segment of a reassembled PDU]"
"481","20.730591","192.168.0.183","104.244.42.65","TLSv1.2","855","Application Data"
"482","20.731141","192.168.0.183","104.244.42.65","TLSv1.2","237","Application Data"
"483","20.731323","192.168.0.183","104.244.42.65","TLSv1.2","1313","Application Data"
"484","20.731368","192.168.0.183","104.244.42.65","TLSv1.2","1077","Application Data"
"485","20.731609","192.168.0.183","104.244.42.65","TLSv1.2","307","Application Data"
"486","20.772803","104.244.42.65","192.168.0.183","TCP","60","443  >  50717 [ACK] Seq=75086 Ack=401848 Win=5721 Len=0"
"487","20.794144","104.244.42.65","192.168.0.183","TLSv1.2","184","Application Data"
"488","20.849066","192.168.0.183","104.244.42.65","TCP","54","50717  >  443 [ACK] Seq=401848 Ack=75216 Win=1037 Len=0"
"489","20.989583","104.244.42.65","192.168.0.183","TCP","1414","443  >  50717 [ACK] Seq=75216 Ack=401848 Win=5735 Len=1360 [TCP segment of a reassembled PDU]"
"490","20.989583","104.244.42.65","192.168.0.183","TCP","1414","443  >  50717 [ACK] Seq=76576 Ack=401848 Win=5735 Len=1360 [TCP segment of a reassembled PDU]"
"491","20.989583","104.244.42.65","192.168.0.183","TLSv1.2","777","Application Data"
"492","20.989628","192.168.0.183","104.244.42.65","TCP","54","50717  >  443 [ACK] Seq=401848 Ack=78659 Win=1041 Len=0"
"493","21.174184","104.244.42.65","192.168.0.183","TLSv1.2","176","Application Data"
"494","21.219226","192.168.0.183","104.244.42.65","TCP","54","50717  >  443 [ACK] Seq=401848 Ack=78781 Win=1040 Len=0"
"495","21.361678","192.168.0.183","104.244.42.65","TLSv1.2","246","Application Data"
"496","21.361820","192.168.0.183","104.244.42.65","TCP","1414","50717  >  443 [ACK] Seq=402040 Ack=78781 Win=1040 Len=1360 [TCP segment of a reassembled PDU]"
"497","21.361820","192.168.0.183","104.244.42.65","TCP","1414","50717  >  443 [ACK] Seq=403400 Ack=78781 Win=1040 Len=1360 [TCP segment of a reassembled PDU]"
"498","21.361820","192.168.0.183","104.244.42.65","TCP","1414","50717  >  443 [ACK] Seq=404760 Ack=78781 Win=1040 Len=1360 [TCP segment of a reassembled PDU]"
"499","21.361820","192.168.0.183","104.244.42.65","TCP","1414","50717  >  443 [ACK] Seq=406120 Ack=78781 Win=1040 Len=1360 [TCP segment of a reassembled PDU]"
"500","21.361820","192.168.0.183","104.244.42.65","TCP","1414","50717  >  443 [ACK] Seq=407480 Ack=78781 Win=1040 Len=1360 [TCP segment of a reassembled PDU]"
"501","21.361820","192.168.0.183","104.244.42.65","TCP","1414","50717  >  443 [ACK] Seq=408840 Ack=78781 Win=1040 Len=1360 [TCP segment of a reassembled PDU]"
"502","21.361820","192.168.0.183","104.244.42.65","TCP","1414","50717  >  443 [ACK] Seq=410200 Ack=78781 Win=1040 Len=1360 [TCP segment of a reassembled PDU]"
"503","21.361820","192.168.0.183","104.244.42.65","TCP","1414","50717  >  443 [ACK] Seq=411560 Ack=78781 Win=1040 Len=1360 [TCP segment of a reassembled PDU]"
"504","21.361820","192.168.0.183","104.244.42.65","TCP","1414","50717  >  443 [ACK] Seq=412920 Ack=78781 Win=1040 Len=1360 [TCP segment of a reassembled PDU]"
"505","21.361820","192.168.0.183","104.244.42.65","TCP","1414","50717  >  443 [ACK] Seq=414280 Ack=78781 Win=1040 Len=1360 [TCP segment of a reassembled PDU]"
"506","21.361820","192.168.0.183","104.244.42.65","TCP","1414","50717  >  443 [ACK] Seq=415640 Ack=78781 Win=1040 Len=1360 [TCP segment of a reassembled PDU]"
"507","21.361820","192.168.0.183","104.244.42.65","TCP","1414","50717  >  443 [ACK] Seq=417000 Ack=78781 Win=1040 Len=1360 [TCP segment of a reassembled PDU]"
"508","21.361820","192.168.0.183","104.244.42.65","TLSv1.2","140","Application Data"
"509","21.361953","192.168.0.183","104.244.42.65","TCP","1414","50717  >  443 [ACK] Seq=418446 Ack=78781 Win=1040 Len=1360 [TCP segment of a reassembled PDU]"
"510","21.361953","192.168.0.183","104.244.42.65","TCP","1414","50717  >  443 [ACK] Seq=419806 Ack=78781 Win=1040 Len=1360 [TCP segment of a reassembled PDU]"
"511","21.361953","192.168.0.183","104.244.42.65","TCP","1414","50717  >  443 [ACK] Seq=421166 Ack=78781 Win=1040 Len=1360 [TCP segment of a reassembled PDU]"
"512","21.361953","192.168.0.183","104.244.42.65","TCP","1414","50717  >  443 [ACK] Seq=422526 Ack=78781 Win=1040 Len=1360 [TCP segment of a reassembled PDU]"
"513","21.361953","192.168.0.183","104.244.42.65","TCP","1414","50717  >  443 [ACK] Seq=423886 Ack=78781 Win=1040 Len=1360 [TCP segment of a reassembled PDU]"
"514","21.361953","192.168.0.183","104.244.42.65","TCP","1414","50717  >  443 [ACK] Seq=425246 Ack=78781 Win=1040 Len=1360 [TCP segment of a reassembled PDU]"
"515","21.361953","192.168.0.183","104.244.42.65","TCP","1414","50717  >  443 [ACK] Seq=426606 Ack=78781 Win=1040 Len=1360 [TCP segment of a reassembled PDU]"
"516","21.361953","192.168.0.183","104.244.42.65","TCP","1414","50717  >  443 [ACK] Seq=427966 Ack=78781 Win=1040 Len=1360 [TCP segment of a reassembled PDU]"
"517","21.361953","192.168.0.183","104.244.42.65","TCP","1414","50717  >  443 [ACK] Seq=429326 Ack=78781 Win=1040 Len=1360 [TCP segment of a reassembled PDU]"
"518","21.361953","192.168.0.183","104.244.42.65","TCP","1414","50717  >  443 [ACK] Seq=430686 Ack=78781 Win=1040 Len=1360 [TCP segment of a reassembled PDU]"
"519","21.361953","192.168.0.183","104.244.42.65","TCP","1414","50717  >  443 [ACK] Seq=432046 Ack=78781 Win=1040 Len=1360 [TCP segment of a reassembled PDU]"
"520","21.361953","192.168.0.183","104.244.42.65","TCP","1414","50717  >  443 [ACK] Seq=433406 Ack=78781 Win=1040 Len=1360 [TCP segment of a reassembled PDU]"
"521","21.361953","192.168.0.183","104.244.42.65","TLSv1.2","140","Application Data"
"522","21.362159","192.168.0.183","104.244.42.65","TCP","1414","50717  >  443 [ACK] Seq=434852 Ack=78781 Win=1040 Len=1360 [TCP segment of a reassembled PDU]"
"523","21.362159","192.168.0.183","104.244.42.65","TCP","1414","50717  >  443 [ACK] Seq=436212 Ack=78781 Win=1040 Len=1360 [TCP segment of a reassembled PDU]"
"524","21.362159","192.168.0.183","104.244.42.65","TCP","1414","50717  >  443 [ACK] Seq=437572 Ack=78781 Win=1040 Len=1360 [TCP segment of a reassembled PDU]"
"525","21.362159","192.168.0.183","104.244.42.65","TCP","1414","50717  >  443 [ACK] Seq=438932 Ack=78781 Win=1040 Len=1360 [TCP segment of a reassembled PDU]"
"526","21.362159","192.168.0.183","104.244.42.65","TCP","1414","50717  >  443 [ACK] Seq=440292 Ack=78781 Win=1040 Len=1360 [TCP segment of a reassembled PDU]"
"527","21.362159","192.168.0.183","104.244.42.65","TCP","1414","50717  >  443 [ACK] Seq=441652 Ack=78781 Win=1040 Len=1360 [TCP segment of a reassembled PDU]"
"528","21.362159","192.168.0.183","104.244.42.65","TCP","1414","50717  >  443 [ACK] Seq=443012 Ack=78781 Win=1040 Len=1360 [TCP segment of a reassembled PDU]"
"529","21.362159","192.168.0.183","104.244.42.65","TCP","1414","50717  >  443 [ACK] Seq=444372 Ack=78781 Win=1040 Len=1360 [TCP segment of a reassembled PDU]"
"530","21.362159","192.168.0.183","104.244.42.65","TCP","1414","50717  >  443 [ACK] Seq=445732 Ack=78781 Win=1040 Len=1360 [TCP segment of a reassembled PDU]"
"531","21.362159","192.168.0.183","104.244.42.65","TCP","1414","50717  >  443 [ACK] Seq=447092 Ack=78781 Win=1040 Len=1360 [TCP segment of a reassembled PDU]"
"532","21.362159","192.168.0.183","104.244.42.65","TCP","1414","50717  >  443 [ACK] Seq=448452 Ack=78781 Win=1040 Len=1360 [TCP segment of a reassembled PDU]"
"533","21.362159","192.168.0.183","104.244.42.65","TCP","1414","50717  >  443 [ACK] Seq=449812 Ack=78781 Win=1040 Len=1360 [TCP segment of a reassembled PDU]"
"534","21.362159","192.168.0.183","104.244.42.65","TLSv1.2","140","Application Data"
"535","21.362292","192.168.0.183","104.244.42.65","TCP","1414","50717  >  443 [ACK] Seq=451258 Ack=78781 Win=1040 Len=1360 [TCP segment of a reassembled PDU]"
"536","21.362292","192.168.0.183","104.244.42.65","TCP","1414","50717  >  443 [ACK] Seq=452618 Ack=78781 Win=1040 Len=1360 [TCP segment of a reassembled PDU]"
"537","21.362292","192.168.0.183","104.244.42.65","TCP","1414","50717  >  443 [ACK] Seq=453978 Ack=78781 Win=1040 Len=1360 [TCP segment of a reassembled PDU]"
"538","21.362292","192.168.0.183","104.244.42.65","TCP","1414","50717  >  443 [ACK] Seq=455338 Ack=78781 Win=1040 Len=1360 [TCP segment of a reassembled PDU]"
"539","21.362292","192.168.0.183","104.244.42.65","TCP","1414","50717  >  443 [ACK] Seq=456698 Ack=78781 Win=1040 Len=1360 [TCP segment of a reassembled PDU]"
"540","21.362292","192.168.0.183","104.244.42.65","TCP","1414","50717  >  443 [ACK] Seq=458058 Ack=78781 Win=1040 Len=1360 [TCP segment of a reassembled PDU]"
"541","21.362292","192.168.0.183","104.244.42.65","TCP","1414","50717  >  443 [ACK] Seq=459418 Ack=78781 Win=1040 Len=1360 [TCP segment of a reassembled PDU]"
"542","21.362292","192.168.0.183","104.244.42.65","TCP","1414","50717  >  443 [ACK] Seq=460778 Ack=78781 Win=1040 Len=1360 [TCP segment of a reassembled PDU]"
"543","21.362292","192.168.0.183","104.244.42.65","TCP","1414","50717  >  443 [ACK] Seq=462138 Ack=78781 Win=1040 Len=1360 [TCP segment of a reassembled PDU]"
"544","21.362292","192.168.0.183","104.244.42.65","TCP","1414","50717  >  443 [ACK] Seq=463498 Ack=78781 Win=1040 Len=1360 [TCP segment of a reassembled PDU]"
"545","21.362292","192.168.0.183","104.244.42.65","TCP","1414","50717  >  443 [ACK] Seq=464858 Ack=78781 Win=1040 Len=1360 [TCP segment of a reassembled PDU]"
"546","21.362292","192.168.0.183","104.244.42.65","TCP","1414","50717  >  443 [ACK] Seq=466218 Ack=78781 Win=1040 Len=1360 [TCP segment of a reassembled PDU]"
"547","21.362292","192.168.0.183","104.244.42.65","TLSv1.2","140","Application Data"
"548","21.362481","192.168.0.183","104.244.42.65","TLSv1.2","121","Application Data"
"549","21.400447","104.244.42.65","192.168.0.183","TCP","60","443  >  50717 [ACK] Seq=78781 Ack=403400 Win=5732 Len=0"
"550","21.403381","104.244.42.65","192.168.0.183","TCP","60","443  >  50717 [ACK] Seq=78781 Ack=459418 Win=5706 Len=0"
"551","21.404948","104.244.42.65","192.168.0.183","TLSv1.2","89","Application Data"
"552","21.404948","104.244.42.65","192.168.0.183","TCP","60","443  >  50717 [ACK] Seq=78816 Ack=467731 Win=5727 Len=0"
"553","21.405199","192.168.0.183","104.244.42.65","TCP","1414","50717  >  443 [ACK] Seq=467731 Ack=78816 Win=1040 Len=1360 [TCP segment of a reassembled PDU]"
"554","21.405199","192.168.0.183","104.244.42.65","TCP","1414","50717  >  443 [ACK] Seq=469091 Ack=78816 Win=1040 Len=1360 [TCP segment of a reassembled PDU]"
"555","21.405199","192.168.0.183","104.244.42.65","TCP","1414","50717  >  443 [ACK] Seq=470451 Ack=78816 Win=1040 Len=1360 [TCP segment of a reassembled PDU]"
"556","21.405199","192.168.0.183","104.244.42.65","TCP","1414","50717  >  443 [ACK] Seq=471811 Ack=78816 Win=1040 Len=1360 [TCP segment of a reassembled PDU]"
"557","21.405199","192.168.0.183","104.244.42.65","TCP","1414","50717  >  443 [ACK] Seq=473171 Ack=78816 Win=1040 Len=1360 [TCP segment of a reassembled PDU]"
"558","21.405199","192.168.0.183","104.244.42.65","TCP","1414","50717  >  443 [ACK] Seq=474531 Ack=78816 Win=1040 Len=1360 [TCP segment of a reassembled PDU]"
"559","21.405199","192.168.0.183","104.244.42.65","TCP","1414","50717  >  443 [ACK] Seq=475891 Ack=78816 Win=1040 Len=1360 [TCP segment of a reassembled PDU]"
"560","21.405199","192.168.0.183","104.244.42.65","TCP","1414","50717  >  443 [ACK] Seq=477251 Ack=78816 Win=1040 Len=1360 [TCP segment of a reassembled PDU]"
"561","21.405199","192.168.0.183","104.244.42.65","TCP","1414","50717  >  443 [ACK] Seq=478611 Ack=78816 Win=1040 Len=1360 [TCP segment of a reassembled PDU]"
"562","21.405199","192.168.0.183","104.244.42.65","TCP","1414","50717  >  443 [ACK] Seq=479971 Ack=78816 Win=1040 Len=1360 [TCP segment of a reassembled PDU]"
"563","21.405199","192.168.0.183","104.244.42.65","TLSv1.2","91","Application Data"
"564","21.455264","104.244.42.65","192.168.0.183","TCP","60","443  >  50717 [ACK] Seq=78816 Ack=470451 Win=5729 Len=0"
"565","21.455424","104.244.42.65","192.168.0.183","TCP","60","443  >  50717 [ACK] Seq=78816 Ack=481368 Win=5735 Len=0"
"566","21.507628","104.244.42.65","192.168.0.183","TLSv1.2","288","Application Data"
"567","21.510781","104.244.42.65","192.168.0.183","TCP","1414","443  >  50717 [ACK] Seq=79050 Ack=481368 Win=5735 Len=1360 [TCP segment of a reassembled PDU]"
"568","21.510781","104.244.42.65","192.168.0.183","TCP","1414","443  >  50717 [ACK] Seq=80410 Ack=481368 Win=5735 Len=1360 [TCP segment of a reassembled PDU]"
"569","21.510781","104.244.42.65","192.168.0.183","TCP","1414","443  >  50717 [PSH, ACK] Seq=81770 Ack=481368 Win=5735 Len=1360 [TCP segment of a reassembled PDU]"
"570","21.510781","104.244.42.65","192.168.0.183","TCP","1414","443  >  50717 [ACK] Seq=83130 Ack=481368 Win=5735 Len=1360 [TCP segment of a reassembled PDU]"
"571","21.510781","104.244.42.65","192.168.0.183","TCP","1414","443  >  50717 [ACK] Seq=84490 Ack=481368 Win=5735 Len=1360 [TCP segment of a reassembled PDU]"
"572","21.510781","104.244.42.65","192.168.0.183","TCP","1414","443  >  50717 [PSH, ACK] Seq=85850 Ack=481368 Win=5735 Len=1360 [TCP segment of a reassembled PDU]"
"573","21.510781","104.244.42.65","192.168.0.183","TLSv1.2","1265","Application Data"
"574","21.510825","192.168.0.183","104.244.42.65","TCP","54","50717  >  443 [ACK] Seq=481368 Ack=88421 Win=1041 Len=0"
"575","24.330323","192.168.0.183","104.244.42.65","TLSv1.2","277","Application Data"
"576","24.411466","104.244.42.65","192.168.0.183","TCP","60","443  >  50717 [ACK] Seq=88421 Ack=481591 Win=5735 Len=0"
"577","24.490747","192.168.0.183","104.244.42.65","TLSv1.2","331","Application Data"
"578","24.491249","192.168.0.183","104.244.42.65","TCP","1414","50717  >  443 [ACK] Seq=481868 Ack=88421 Win=1041 Len=1360 [TCP segment of a reassembled PDU]"
"579","24.491249","192.168.0.183","104.244.42.65","TCP","1414","50717  >  443 [ACK] Seq=483228 Ack=88421 Win=1041 Len=1360 [TCP segment of a reassembled PDU]"
"580","24.491249","192.168.0.183","104.244.42.65","TCP","1414","50717  >  443 [ACK] Seq=484588 Ack=88421 Win=1041 Len=1360 [TCP segment of a reassembled PDU]"
"581","24.491249","192.168.0.183","104.244.42.65","TCP","1414","50717  >  443 [ACK] Seq=485948 Ack=88421 Win=1041 Len=1360 [TCP segment of a reassembled PDU]"
"582","24.491249","192.168.0.183","104.244.42.65","TCP","1414","50717  >  443 [ACK] Seq=487308 Ack=88421 Win=1041 Len=1360 [TCP segment of a reassembled PDU]"
"583","24.491249","192.168.0.183","104.244.42.65","TCP","1414","50717  >  443 [ACK] Seq=488668 Ack=88421 Win=1041 Len=1360 [TCP segment of a reassembled PDU]"
"584","24.491249","192.168.0.183","104.244.42.65","TCP","1414","50717  >  443 [ACK] Seq=490028 Ack=88421 Win=1041 Len=1360 [TCP segment of a reassembled PDU]"
"585","24.491249","192.168.0.183","104.244.42.65","TCP","1414","50717  >  443 [ACK] Seq=491388 Ack=88421 Win=1041 Len=1360 [TCP segment of a reassembled PDU]"
"586","24.491249","192.168.0.183","104.244.42.65","TCP","1414","50717  >  443 [ACK] Seq=492748 Ack=88421 Win=1041 Len=1360 [TCP segment of a reassembled PDU]"
"587","24.491249","192.168.0.183","104.244.42.65","TCP","1414","50717  >  443 [ACK] Seq=494108 Ack=88421 Win=1041 Len=1360 [TCP segment of a reassembled PDU]"
"588","24.491249","192.168.0.183","104.244.42.65","TCP","1414","50717  >  443 [ACK] Seq=495468 Ack=88421 Win=1041 Len=1360 [TCP segment of a reassembled PDU]"
"589","24.491249","192.168.0.183","104.244.42.65","TCP","1414","50717  >  443 [ACK] Seq=496828 Ack=88421 Win=1041 Len=1360 [TCP segment of a reassembled PDU]"
"590","24.491249","192.168.0.183","104.244.42.65","TLSv1.2","140","Application Data"
"591","24.491676","192.168.0.183","104.244.42.65","TCP","1414","50717  >  443 [ACK] Seq=498274 Ack=88421 Win=1041 Len=1360 [TCP segment of a reassembled PDU]"
"592","24.491676","192.168.0.183","104.244.42.65","TCP","1414","50717  >  443 [ACK] Seq=499634 Ack=88421 Win=1041 Len=1360 [TCP segment of a reassembled PDU]"
"593","24.491676","192.168.0.183","104.244.42.65","TCP","1414","50717  >  443 [ACK] Seq=500994 Ack=88421 Win=1041 Len=1360 [TCP segment of a reassembled PDU]"
"594","24.491676","192.168.0.183","104.244.42.65","TCP","1414","50717  >  443 [ACK] Seq=502354 Ack=88421 Win=1041 Len=1360 [TCP segment of a reassembled PDU]"
"595","24.491676","192.168.0.183","104.244.42.65","TCP","1414","50717  >  443 [ACK] Seq=503714 Ack=88421 Win=1041 Len=1360 [TCP segment of a reassembled PDU]"
"596","24.491676","192.168.0.183","104.244.42.65","TCP","1414","50717  >  443 [ACK] Seq=505074 Ack=88421 Win=1041 Len=1360 [TCP segment of a reassembled PDU]"
"597","24.491676","192.168.0.183","104.244.42.65","TCP","1414","50717  >  443 [ACK] Seq=506434 Ack=88421 Win=1041 Len=1360 [TCP segment of a reassembled PDU]"
"598","24.491676","192.168.0.183","104.244.42.65","TCP","1414","50717  >  443 [ACK] Seq=507794 Ack=88421 Win=1041 Len=1360 [TCP segment of a reassembled PDU]"
"599","24.491676","192.168.0.183","104.244.42.65","TCP","1414","50717  >  443 [ACK] Seq=509154 Ack=88421 Win=1041 Len=1360 [TCP segment of a reassembled PDU]"
"600","24.491676","192.168.0.183","104.244.42.65","TCP","1414","50717  >  443 [ACK] Seq=510514 Ack=88421 Win=1041 Len=1360 [TCP segment of a reassembled PDU]"
"601","24.491676","192.168.0.183","104.244.42.65","TCP","1414","50717  >  443 [ACK] Seq=511874 Ack=88421 Win=1041 Len=1360 [TCP segment of a reassembled PDU]"
"602","24.491676","192.168.0.183","104.244.42.65","TCP","1414","50717  >  443 [ACK] Seq=513234 Ack=88421 Win=1041 Len=1360 [TCP segment of a reassembled PDU]"
"603","24.491676","192.168.0.183","104.244.42.65","TLSv1.2","140","Application Data"
"604","24.491974","192.168.0.183","104.244.42.65","TCP","1414","50717  >  443 [ACK] Seq=514680 Ack=88421 Win=1041 Len=1360 [TCP segment of a reassembled PDU]"
"605","24.491974","192.168.0.183","104.244.42.65","TCP","1414","50717  >  443 [ACK] Seq=516040 Ack=88421 Win=1041 Len=1360 [TCP segment of a reassembled PDU]"
"606","24.491974","192.168.0.183","104.244.42.65","TCP","1414","50717  >  443 [ACK] Seq=517400 Ack=88421 Win=1041 Len=1360 [TCP segment of a reassembled PDU]"
"607","24.491974","192.168.0.183","104.244.42.65","TCP","1414","50717  >  443 [ACK] Seq=518760 Ack=88421 Win=1041 Len=1360 [TCP segment of a reassembled PDU]"
"608","24.491974","192.168.0.183","104.244.42.65","TCP","1414","50717  >  443 [ACK] Seq=520120 Ack=88421 Win=1041 Len=1360 [TCP segment of a reassembled PDU]"
"609","24.491974","192.168.0.183","104.244.42.65","TCP","1414","50717  >  443 [ACK] Seq=521480 Ack=88421 Win=1041 Len=1360 [TCP segment of a reassembled PDU]"
"610","24.491974","192.168.0.183","104.244.42.65","TCP","1414","50717  >  443 [ACK] Seq=522840 Ack=88421 Win=1041 Len=1360 [TCP segment of a reassembled PDU]"
"611","24.491974","192.168.0.183","104.244.42.65","TCP","1414","50717  >  443 [ACK] Seq=524200 Ack=88421 Win=1041 Len=1360 [TCP segment of a reassembled PDU]"
"612","24.491974","192.168.0.183","104.244.42.65","TCP","1414","50717  >  443 [ACK] Seq=525560 Ack=88421 Win=1041 Len=1360 [TCP segment of a reassembled PDU]"
"613","24.491974","192.168.0.183","104.244.42.65","TCP","1414","50717  >  443 [ACK] Seq=526920 Ack=88421 Win=1041 Len=1360 [TCP segment of a reassembled PDU]"
"614","24.491974","192.168.0.183","104.244.42.65","TCP","1414","50717  >  443 [ACK] Seq=528280 Ack=88421 Win=1041 Len=1360 [TCP segment of a reassembled PDU]"
"615","24.491974","192.168.0.183","104.244.42.65","TCP","1414","50717  >  443 [ACK] Seq=529640 Ack=88421 Win=1041 Len=1360 [TCP segment of a reassembled PDU]"
"616","24.491974","192.168.0.183","104.244.42.65","TLSv1.2","140","Application Data"
"617","24.492287","192.168.0.183","104.244.42.65","TCP","1414","50717  >  443 [ACK] Seq=531086 Ack=88421 Win=1041 Len=1360 [TCP segment of a reassembled PDU]"
"618","24.492287","192.168.0.183","104.244.42.65","TCP","1414","50717  >  443 [ACK] Seq=532446 Ack=88421 Win=1041 Len=1360 [TCP segment of a reassembled PDU]"
"619","24.492287","192.168.0.183","104.244.42.65","TCP","1414","50717  >  443 [ACK] Seq=533806 Ack=88421 Win=1041 Len=1360 [TCP segment of a reassembled PDU]"
"620","24.492287","192.168.0.183","104.244.42.65","TCP","1414","50717  >  443 [ACK] Seq=535166 Ack=88421 Win=1041 Len=1360 [TCP segment of a reassembled PDU]"
"621","24.492287","192.168.0.183","104.244.42.65","TCP","1414","50717  >  443 [ACK] Seq=536526 Ack=88421 Win=1041 Len=1360 [TCP segment of a reassembled PDU]"
"622","24.492287","192.168.0.183","104.244.42.65","TCP","1414","50717  >  443 [ACK] Seq=537886 Ack=88421 Win=1041 Len=1360 [TCP segment of a reassembled PDU]"
"623","24.492287","192.168.0.183","104.244.42.65","TCP","1414","50717  >  443 [ACK] Seq=539246 Ack=88421 Win=1041 Len=1360 [TCP segment of a reassembled PDU]"
"624","24.492287","192.168.0.183","104.244.42.65","TCP","1414","50717  >  443 [ACK] Seq=540606 Ack=88421 Win=1041 Len=1360 [TCP segment of a reassembled PDU]"
"625","24.492287","192.168.0.183","104.244.42.65","TCP","1414","50717  >  443 [ACK] Seq=541966 Ack=88421 Win=1041 Len=1360 [TCP segment of a reassembled PDU]"
"626","24.492287","192.168.0.183","104.244.42.65","TCP","1414","50717  >  443 [ACK] Seq=543326 Ack=88421 Win=1041 Len=1360 [TCP segment of a reassembled PDU]"
"627","24.492287","192.168.0.183","104.244.42.65","TLSv1.2","1290","Application Data"
"628","24.502516","192.168.0.183","104.244.42.65","TLSv1.2","710","Application Data"
"629","24.502684","192.168.0.183","104.244.42.65","TLSv1.2","1102","Application Data"
"630","24.527938","104.244.42.65","192.168.0.183","TCP","60","443  >  50717 [ACK] Seq=88421 Ack=485948 Win=5724 Len=0"
"631","24.533240","104.244.42.65","192.168.0.183","TCP","60","443  >  50717 [ACK] Seq=88421 Ack=539246 Win=5709 Len=0"
"632","24.533240","104.244.42.65","192.168.0.183","TLSv1.2","89","Application Data"
"633","24.533240","104.244.42.65","192.168.0.183","TCP","60","443  >  50717 [ACK] Seq=88456 Ack=545922 Win=5735 Len=0"
"634","24.540348","104.244.42.65","192.168.0.183","TCP","60","443  >  50717 [ACK] Seq=88456 Ack=547626 Win=5731 Len=0"
"635","24.582271","192.168.0.183","104.244.42.65","TCP","54","50717  >  443 [ACK] Seq=547626 Ack=88456 Win=1041 Len=0"
"636","24.584416","104.244.42.65","192.168.0.183","TLSv1.2","220","Application Data"
"637","24.598510","104.244.42.65","192.168.0.183","TLSv1.2","136","Application Data"
"638","24.598620","192.168.0.183","104.244.42.65","TCP","54","50717  >  443 [ACK] Seq=547626 Ack=88704 Win=1040 Len=0"
"639","24.649767","104.244.42.65","192.168.0.183","TLSv1.2","150","Application Data"
"640","24.690257","192.168.0.183","104.244.42.65","TCP","54","50717  >  443 [ACK] Seq=547626 Ack=88800 Win=1039 Len=0"
"641","27.115779","192.168.0.183","104.244.42.65","TLSv1.2","699","Application Data"
"642","27.115854","192.168.0.183","104.244.42.65","TLSv1.2","168","Application Data"
"643","27.152459","104.244.42.65","192.168.0.183","TCP","60","443  >  50717 [ACK] Seq=88800 Ack=548385 Win=5735 Len=0"
"644","27.230121","104.244.42.65","192.168.0.183","TLSv1.2","378","Application Data"
"645","27.231194","192.168.0.183","104.244.42.65","TLSv1.2","89","Application Data"
"646","27.317036","104.244.42.65","192.168.0.183","TCP","60","443  >  50717 [ACK] Seq=89124 Ack=548420 Win=5735 Len=0"
"647","27.464204","192.168.0.183","104.244.42.65","TLSv1.2","236","Application Data"
"648","27.464726","192.168.0.183","104.244.42.65","TCP","1414","50717  >  443 [ACK] Seq=548602 Ack=89124 Win=1038 Len=1360 [TCP segment of a reassembled PDU]"
"649","27.464726","192.168.0.183","104.244.42.65","TCP","1414","50717  >  443 [ACK] Seq=549962 Ack=89124 Win=1038 Len=1360 [TCP segment of a reassembled PDU]"
"650","27.464726","192.168.0.183","104.244.42.65","TCP","1414","50717  >  443 [ACK] Seq=551322 Ack=89124 Win=1038 Len=1360 [TCP segment of a reassembled PDU]"
"651","27.464726","192.168.0.183","104.244.42.65","TCP","1414","50717  >  443 [ACK] Seq=552682 Ack=89124 Win=1038 Len=1360 [TCP segment of a reassembled PDU]"
"652","27.464726","192.168.0.183","104.244.42.65","TCP","1414","50717  >  443 [ACK] Seq=554042 Ack=89124 Win=1038 Len=1360 [TCP segment of a reassembled PDU]"
"653","27.464726","192.168.0.183","104.244.42.65","TCP","1414","50717  >  443 [ACK] Seq=555402 Ack=89124 Win=1038 Len=1360 [TCP segment of a reassembled PDU]"
"654","27.464726","192.168.0.183","104.244.42.65","TCP","1414","50717  >  443 [ACK] Seq=556762 Ack=89124 Win=1038 Len=1360 [TCP segment of a reassembled PDU]"
"655","27.464726","192.168.0.183","104.244.42.65","TCP","1414","50717  >  443 [ACK] Seq=558122 Ack=89124 Win=1038 Len=1360 [TCP segment of a reassembled PDU]"
"656","27.464726","192.168.0.183","104.244.42.65","TCP","1414","50717  >  443 [ACK] Seq=559482 Ack=89124 Win=1038 Len=1360 [TCP segment of a reassembled PDU]"
"657","27.464726","192.168.0.183","104.244.42.65","TCP","1414","50717  >  443 [ACK] Seq=560842 Ack=89124 Win=1038 Len=1360 [TCP segment of a reassembled PDU]"
"658","27.464726","192.168.0.183","104.244.42.65","TCP","1414","50717  >  443 [ACK] Seq=562202 Ack=89124 Win=1038 Len=1360 [TCP segment of a reassembled PDU]"
"659","27.464726","192.168.0.183","104.244.42.65","TCP","1414","50717  >  443 [ACK] Seq=563562 Ack=89124 Win=1038 Len=1360 [TCP segment of a reassembled PDU]"
"660","27.464726","192.168.0.183","104.244.42.65","TLSv1.2","140","Application Data"
"661","27.464998","192.168.0.183","104.244.42.65","TCP","1414","50717  >  443 [ACK] Seq=565008 Ack=89124 Win=1038 Len=1360 [TCP segment of a reassembled PDU]"
"662","27.464998","192.168.0.183","104.244.42.65","TCP","1414","50717  >  443 [ACK] Seq=566368 Ack=89124 Win=1038 Len=1360 [TCP segment of a reassembled PDU]"
"663","27.464998","192.168.0.183","104.244.42.65","TCP","1414","50717  >  443 [ACK] Seq=567728 Ack=89124 Win=1038 Len=1360 [TCP segment of a reassembled PDU]"
"664","27.464998","192.168.0.183","104.244.42.65","TCP","1414","50717  >  443 [ACK] Seq=569088 Ack=89124 Win=1038 Len=1360 [TCP segment of a reassembled PDU]"
"665","27.464998","192.168.0.183","104.244.42.65","TCP","1414","50717  >  443 [ACK] Seq=570448 Ack=89124 Win=1038 Len=1360 [TCP segment of a reassembled PDU]"
"666","27.464998","192.168.0.183","104.244.42.65","TCP","1414","50717  >  443 [ACK] Seq=571808 Ack=89124 Win=1038 Len=1360 [TCP segment of a reassembled PDU]"
"667","27.464998","192.168.0.183","104.244.42.65","TCP","1414","50717  >  443 [ACK] Seq=573168 Ack=89124 Win=1038 Len=1360 [TCP segment of a reassembled PDU]"
"668","27.464998","192.168.0.183","104.244.42.65","TCP","1414","50717  >  443 [ACK] Seq=574528 Ack=89124 Win=1038 Len=1360 [TCP segment of a reassembled PDU]"
"669","27.464998","192.168.0.183","104.244.42.65","TCP","1414","50717  >  443 [ACK] Seq=575888 Ack=89124 Win=1038 Len=1360 [TCP segment of a reassembled PDU]"
"670","27.464998","192.168.0.183","104.244.42.65","TCP","1414","50717  >  443 [ACK] Seq=577248 Ack=89124 Win=1038 Len=1360 [TCP segment of a reassembled PDU]"
"671","27.464998","192.168.0.183","104.244.42.65","TCP","1414","50717  >  443 [ACK] Seq=578608 Ack=89124 Win=1038 Len=1360 [TCP segment of a reassembled PDU]"
"672","27.464998","192.168.0.183","104.244.42.65","TCP","1414","50717  >  443 [ACK] Seq=579968 Ack=89124 Win=1038 Len=1360 [TCP segment of a reassembled PDU]"
"673","27.464998","192.168.0.183","104.244.42.65","TLSv1.2","140","Application Data"
"674","27.465196","192.168.0.183","104.244.42.65","TCP","1414","50717  >  443 [ACK] Seq=581414 Ack=89124 Win=1038 Len=1360 [TCP segment of a reassembled PDU]"
"675","27.465196","192.168.0.183","104.244.42.65","TCP","1414","50717  >  443 [ACK] Seq=582774 Ack=89124 Win=1038 Len=1360 [TCP segment of a reassembled PDU]"
"676","27.465196","192.168.0.183","104.244.42.65","TCP","1414","50717  >  443 [ACK] Seq=584134 Ack=89124 Win=1038 Len=1360 [TCP segment of a reassembled PDU]"
"677","27.465196","192.168.0.183","104.244.42.65","TCP","1414","50717  >  443 [ACK] Seq=585494 Ack=89124 Win=1038 Len=1360 [TCP segment of a reassembled PDU]"
"678","27.465196","192.168.0.183","104.244.42.65","TCP","1414","50717  >  443 [ACK] Seq=586854 Ack=89124 Win=1038 Len=1360 [TCP segment of a reassembled PDU]"
"679","27.465196","192.168.0.183","104.244.42.65","TLSv1.2","1320","Application Data"
"680","27.501760","104.244.42.65","192.168.0.183","TCP","60","443  >  50717 [ACK] Seq=89124 Ack=549962 Win=5745 Len=0"
"681","27.508024","104.244.42.65","192.168.0.183","TCP","60","443  >  50717 [ACK] Seq=89124 Ack=589480 Win=6055 Len=0"
"682","27.508024","104.244.42.65","192.168.0.183","TLSv1.2","89","Application Data"
"683","27.557038","104.244.42.65","192.168.0.183","TLSv1.2","153","Application Data"
"684","27.557079","192.168.0.183","104.244.42.65","TCP","54","50717  >  443 [ACK] Seq=589480 Ack=89258 Win=1037 Len=0"
"685","30.089645","192.168.0.183","104.244.42.65","TLSv1.2","247","Application Data"
"686","30.089710","192.168.0.183","104.244.42.65","TLSv1.2","168","Application Data"
"687","30.138808","104.244.42.65","192.168.0.183","TCP","60","443  >  50717 [ACK] Seq=89258 Ack=589787 Win=6055 Len=0"
"688","30.206476","104.244.42.65","192.168.0.183","TLSv1.2","270","Application Data"
"689","30.256015","192.168.0.183","104.244.42.65","TCP","54","50717  >  443 [ACK] Seq=589787 Ack=89474 Win=1037 Len=0"
"690","31.337940","192.168.0.183","104.244.42.65","TLSv1.2","281","Application Data"
"691","31.338086","192.168.0.183","104.244.42.65","TCP","1414","50717  >  443 [ACK] Seq=590014 Ack=89474 Win=1037 Len=1360 [TCP segment of a reassembled PDU]"
"692","31.338086","192.168.0.183","104.244.42.65","TCP","1414","50717  >  443 [ACK] Seq=591374 Ack=89474 Win=1037 Len=1360 [TCP segment of a reassembled PDU]"
"693","31.338086","192.168.0.183","104.244.42.65","TCP","1414","50717  >  443 [ACK] Seq=592734 Ack=89474 Win=1037 Len=1360 [TCP segment of a reassembled PDU]"
"694","31.338086","192.168.0.183","104.244.42.65","TCP","1414","50717  >  443 [ACK] Seq=594094 Ack=89474 Win=1037 Len=1360 [TCP segment of a reassembled PDU]"
"695","31.338086","192.168.0.183","104.244.42.65","TCP","1414","50717  >  443 [ACK] Seq=595454 Ack=89474 Win=1037 Len=1360 [TCP segment of a reassembled PDU]"
"696","31.338086","192.168.0.183","104.244.42.65","TCP","1414","50717  >  443 [ACK] Seq=596814 Ack=89474 Win=1037 Len=1360 [TCP segment of a reassembled PDU]"
"697","31.338086","192.168.0.183","104.244.42.65","TCP","1414","50717  >  443 [ACK] Seq=598174 Ack=89474 Win=1037 Len=1360 [TCP segment of a reassembled PDU]"
"698","31.338086","192.168.0.183","104.244.42.65","TCP","1414","50717  >  443 [ACK] Seq=599534 Ack=89474 Win=1037 Len=1360 [TCP segment of a reassembled PDU]"
"699","31.338086","192.168.0.183","104.244.42.65","TLSv1.2","430","Application Data"
"700","31.385884","104.244.42.65","192.168.0.183","TCP","60","443  >  50717 [ACK] Seq=89474 Ack=601270 Win=6143 Len=0"
"701","31.413078","104.244.42.65","192.168.0.183","TLSv1.2","184","Application Data"
"702","31.463103","192.168.0.183","104.244.42.65","TCP","54","50717  >  443 [ACK] Seq=601270 Ack=89604 Win=1036 Len=0"
