"No.","Time","Source","Destination","Protocol","Length","Info"
"1","0.000000","192.168.0.183","104.244.42.65","TLSv1.2","786","Application Data"
"2","0.000177","192.168.0.183","104.244.42.65","TLSv1.2","555","Application Data"
"3","0.002380","192.168.0.183","104.244.42.65","TLSv1.2","592","Application Data"
"4","0.031238","192.168.0.183","104.244.42.65","TLSv1.2","346","Application Data"
"5","0.031342","192.168.0.183","104.244.42.65","TCP","1414","50717  >  443 [ACK] Seq=2064 Ack=1 Win=1037 Len=1360 [TCP segment of a reassembled PDU]"
"6","0.031342","192.168.0.183","104.244.42.65","TLSv1.2","288","Application Data"
"7","0.031601","104.244.42.65","192.168.0.183","TCP","60","443  >  50717 [ACK] Seq=1 Ack=1234 Win=5735 Len=0"
"8","0.047890","192.168.0.183","104.244.42.65","TLSv1.2","280","Application Data"
"9","0.048011","192.168.0.183","104.244.42.65","TLSv1.2","364","Application Data"
"10","0.054926","104.244.42.65","192.168.0.183","TLSv1.2","200","Application Data"
"11","0.060442","104.244.42.65","192.168.0.183","TCP","60","443  >  50717 [ACK] Seq=147 Ack=3424 Win=5732 Len=0"
"12","0.080768","104.244.42.65","192.168.0.183","TCP","60","443  >  50717 [ACK] Seq=147 Ack=4194 Win=5735 Len=0"
"13","0.100222","192.168.0.183","104.244.42.65","TCP","54","50717  >  443 [ACK] Seq=4194 Ack=147 Win=1036 Len=0"
"14","0.113980","104.244.42.65","192.168.0.183","TLSv1.2","155","Application Data"
"15","0.162312","192.168.0.183","104.244.42.65","TCP","54","50717  >  443 [ACK] Seq=4194 Ack=248 Win=1036 Len=0"
"16","0.476553","104.244.42.65","192.168.0.183","TLSv1.2","152","Application Data"
"17","0.522816","192.168.0.183","104.244.42.65","TCP","54","50717  >  443 [ACK] Seq=4194 Ack=346 Win=1035 Len=0"
"18","1.948405","104.244.42.65","192.168.0.183","TCP","1414","443  >  50717 [ACK] Seq=346 Ack=4194 Win=5735 Len=1360 [TCP segment of a reassembled PDU]"
"19","1.948405","104.244.42.65","192.168.0.183","TCP","1414","443  >  50717 [ACK] Seq=1706 Ack=4194 Win=5735 Len=1360 [TCP segment of a reassembled PDU]"
"20","1.948405","104.244.42.65","192.168.0.183","TCP","1414","443  >  50717 [PSH, ACK] Seq=3066 Ack=4194 Win=5735 Len=1360 [TCP segment of a reassembled PDU]"
"21","1.948405","104.244.42.65","192.168.0.183","TCP","1414","443  >  50717 [ACK] Seq=4426 Ack=4194 Win=5735 Len=1360 [TCP segment of a reassembled PDU]"
"22","1.948405","104.244.42.65","192.168.0.183","TCP","1414","443  >  50717 [ACK] Seq=5786 Ack=4194 Win=5735 Len=1360 [TCP segment of a reassembled PDU]"
"23","1.948405","104.244.42.65","192.168.0.183","TCP","1414","443  >  50717 [PSH, ACK] Seq=7146 Ack=4194 Win=5735 Len=1360 [TCP segment of a reassembled PDU]"
"24","1.948405","104.244.42.65","192.168.0.183","TCP","1414","443  >  50717 [ACK] Seq=8506 Ack=4194 Win=5735 Len=1360 [TCP segment of a reassembled PDU]"
"25","1.948405","104.244.42.65","192.168.0.183","TCP","1414","443  >  50717 [ACK] Seq=9866 Ack=4194 Win=5735 Len=1360 [TCP segment of a reassembled PDU]"
"26","1.948405","104.244.42.65","192.168.0.183","TCP","1414","443  >  50717 [PSH, ACK] Seq=11226 Ack=4194 Win=5735 Len=1360 [TCP segment of a reassembled PDU]"
"27","1.948405","104.244.42.65","192.168.0.183","TCP","1414","443  >  50717 [ACK] Seq=12586 Ack=4194 Win=5735 Len=1360 [TCP segment of a reassembled PDU]"
"28","1.948405","104.244.42.65","192.168.0.183","TCP","1414","443  >  50717 [ACK] Seq=13946 Ack=4194 Win=5735 Len=1360 [TCP segment of a reassembled PDU]"
"29","1.948405","104.244.42.65","192.168.0.183","TCP","1414","443  >  50717 [PSH, ACK] Seq=15306 Ack=4194 Win=5735 Len=1360 [TCP segment of a reassembled PDU]"
"30","1.948405","104.244.42.65","192.168.0.183","TLSv1.2","1414","Application Data"
"31","1.948405","104.244.42.65","192.168.0.183","TCP","1414","443  >  50717 [ACK] Seq=18026 Ack=4194 Win=5735 Len=1360 [TCP segment of a reassembled PDU]"
"32","1.948405","104.244.42.65","192.168.0.183","TCP","1414","443  >  50717 [PSH, ACK] Seq=19386 Ack=4194 Win=5735 Len=1360 [TCP segment of a reassembled PDU]"
"33","1.948405","104.244.42.65","192.168.0.183","TCP","1414","443  >  50717 [ACK] Seq=20746 Ack=4194 Win=5735 Len=1360 [TCP segment of a reassembled PDU]"
"34","1.948405","104.244.42.65","192.168.0.183","TCP","1414","443  >  50717 [ACK] Seq=22106 Ack=4194 Win=5735 Len=1360 [TCP segment of a reassembled PDU]"
"35","1.948405","104.244.42.65","192.168.0.183","TCP","1414","443  >  50717 [PSH, ACK] Seq=23466 Ack=4194 Win=5735 Len=1360 [TCP segment of a reassembled PDU]"
"36","1.948405","104.244.42.65","192.168.0.183","TCP","1414","443  >  50717 [ACK] Seq=24826 Ack=4194 Win=5735 Len=1360 [TCP segment of a reassembled PDU]"
"37","1.948405","104.244.42.65","192.168.0.183","TCP","1414","443  >  50717 [ACK] Seq=26186 Ack=4194 Win=5735 Len=1360 [TCP segment of a reassembled PDU]"
"38","1.948405","104.244.42.65","192.168.0.183","TCP","1414","443  >  50717 [PSH, ACK] Seq=27546 Ack=4194 Win=5735 Len=1360 [TCP segment of a reassembled PDU]"
"39","1.948405","104.244.42.65","192.168.0.183","TCP","1414","443  >  50717 [ACK] Seq=28906 Ack=4194 Win=5735 Len=1360 [TCP segment of a reassembled PDU]"
"40","1.948405","104.244.42.65","192.168.0.183","TCP","1414","443  >  50717 [ACK] Seq=30266 Ack=4194 Win=5735 Len=1360 [TCP segment of a reassembled PDU]"
"41","1.948405","104.244.42.65","192.168.0.183","TCP","1414","443  >  50717 [PSH, ACK] Seq=31626 Ack=4194 Win=5735 Len=1360 [TCP segment of a reassembled PDU]"
"42","1.948405","104.244.42.65","192.168.0.183","TLSv1.2","922","Application Data, Application Data"
"43","1.948633","192.168.0.183","104.244.42.65","TCP","54","50717  >  443 [ACK] Seq=4194 Ack=33854 Win=1041 Len=0"
"44","1.949831","192.168.0.183","104.244.42.65","TLSv1.2","89","Application Data"
"45","2.018958","104.244.42.65","192.168.0.183","TCP","60","443  >  50717 [ACK] Seq=33854 Ack=4229 Win=5735 Len=0"
"46","2.731638","192.168.0.183","104.244.42.65","TCP","1414","50717  >  443 [ACK] Seq=4229 Ack=33854 Win=1041 Len=1360 [TCP segment of a reassembled PDU]"
"47","2.731638","192.168.0.183","104.244.42.65","TLSv1.2","413","Application Data"
"48","2.732082","192.168.0.183","104.244.42.65","TLSv1.2","261","Application Data"
"49","2.761756","192.168.0.183","104.244.42.65","TLSv1.2","307","Application Data"
"50","2.761893","192.168.0.183","104.244.42.65","TCP","1414","50717  >  443 [ACK] Seq=6408 Ack=33854 Win=1041 Len=1360 [TCP segment of a reassembled PDU]"
"51","2.761893","192.168.0.183","104.244.42.65","TCP","1414","50717  >  443 [ACK] Seq=7768 Ack=33854 Win=1041 Len=1360 [TCP segment of a reassembled PDU]"
"52","2.761893","192.168.0.183","104.244.42.65","TCP","1414","50717  >  443 [ACK] Seq=9128 Ack=33854 Win=1041 Len=1360 [TCP segment of a reassembled PDU]"
"53","2.761893","192.168.0.183","104.244.42.65","TCP","1414","50717  >  443 [ACK] Seq=10488 Ack=33854 Win=1041 Len=1360 [TCP segment of a reassembled PDU]"
"54","2.761893","192.168.0.183","104.244.42.65","TCP","1414","50717  >  443 [ACK] Seq=11848 Ack=33854 Win=1041 Len=1360 [TCP segment of a reassembled PDU]"
"55","2.761893","192.168.0.183","104.244.42.65","TCP","1414","50717  >  443 [ACK] Seq=13208 Ack=33854 Win=1041 Len=1360 [TCP segment of a reassembled PDU]"
"56","2.761893","192.168.0.183","104.244.42.65","TCP","1414","50717  >  443 [ACK] Seq=14568 Ack=33854 Win=1041 Len=1360 [TCP segment of a reassembled PDU]"
"57","2.761893","192.168.0.183","104.244.42.65","TCP","1414","50717  >  443 [ACK] Seq=15928 Ack=33854 Win=1041 Len=1360 [TCP segment of a reassembled PDU]"
"58","2.761893","192.168.0.183","104.244.42.65","TCP","1414","50717  >  443 [ACK] Seq=17288 Ack=33854 Win=1041 Len=1360 [TCP segment of a reassembled PDU]"
"59","2.761893","192.168.0.183","104.244.42.65","TCP","1414","50717  >  443 [ACK] Seq=18648 Ack=33854 Win=1041 Len=1360 [TCP segment of a reassembled PDU]"
"60","2.761893","192.168.0.183","104.244.42.65","TCP","1414","50717  >  443 [ACK] Seq=20008 Ack=33854 Win=1041 Len=1360 [TCP segment of a reassembled PDU]"
"61","2.761893","192.168.0.183","104.244.42.65","TCP","1414","50717  >  443 [ACK] Seq=21368 Ack=33854 Win=1041 Len=1360 [TCP segment of a reassembled PDU]"
"62","2.761893","192.168.0.183","104.244.42.65","TLSv1.2","140","Application Data"
"63","2.762048","192.168.0.183","104.244.42.65","TCP","1414","50717  >  443 [ACK] Seq=22814 Ack=33854 Win=1041 Len=1360 [TCP segment of a reassembled PDU]"
"64","2.762048","192.168.0.183","104.244.42.65","TCP","1414","50717  >  443 [ACK] Seq=24174 Ack=33854 Win=1041 Len=1360 [TCP segment of a reassembled PDU]"
"65","2.762048","192.168.0.183","104.244.42.65","TCP","1414","50717  >  443 [ACK] Seq=25534 Ack=33854 Win=1041 Len=1360 [TCP segment of a reassembled PDU]"
"66","2.762048","192.168.0.183","104.244.42.65","TCP","1414","50717  >  443 [ACK] Seq=26894 Ack=33854 Win=1041 Len=1360 [TCP segment of a reassembled PDU]"
"67","2.762048","192.168.0.183","104.244.42.65","TCP","1414","50717  >  443 [ACK] Seq=28254 Ack=33854 Win=1041 Len=1360 [TCP segment of a reassembled PDU]"
"68","2.762048","192.168.0.183","104.244.42.65","TCP","1414","50717  >  443 [ACK] Seq=29614 Ack=33854 Win=1041 Len=1360 [TCP segment of a reassembled PDU]"
"69","2.762048","192.168.0.183","104.244.42.65","TCP","1414","50717  >  443 [ACK] Seq=30974 Ack=33854 Win=1041 Len=1360 [TCP segment of a reassembled PDU]"
"70","2.762048","192.168.0.183","104.244.42.65","TCP","1414","50717  >  443 [ACK] Seq=32334 Ack=33854 Win=1041 Len=1360 [TCP segment of a reassembled PDU]"
"71","2.762048","192.168.0.183","104.244.42.65","TCP","1414","50717  >  443 [ACK] Seq=33694 Ack=33854 Win=1041 Len=1360 [TCP segment of a reassembled PDU]"
"72","2.762048","192.168.0.183","104.244.42.65","TCP","1414","50717  >  443 [ACK] Seq=35054 Ack=33854 Win=1041 Len=1360 [TCP segment of a reassembled PDU]"
"73","2.762048","192.168.0.183","104.244.42.65","TCP","1414","50717  >  443 [ACK] Seq=36414 Ack=33854 Win=1041 Len=1360 [TCP segment of a reassembled PDU]"
"74","2.762048","192.168.0.183","104.244.42.65","TCP","1414","50717  >  443 [ACK] Seq=37774 Ack=33854 Win=1041 Len=1360 [TCP segment of a reassembled PDU]"
"75","2.762048","192.168.0.183","104.244.42.65","TLSv1.2","140","Application Data"
"76","2.762189","192.168.0.183","104.244.42.65","TCP","1414","50717  >  443 [ACK] Seq=39220 Ack=33854 Win=1041 Len=1360 [TCP segment of a reassembled PDU]"
"77","2.762189","192.168.0.183","104.244.42.65","TCP","1414","50717  >  443 [ACK] Seq=40580 Ack=33854 Win=1041 Len=1360 [TCP segment of a reassembled PDU]"
"78","2.762189","192.168.0.183","104.244.42.65","TCP","1414","50717  >  443 [ACK] Seq=41940 Ack=33854 Win=1041 Len=1360 [TCP segment of a reassembled PDU]"
"79","2.762189","192.168.0.183","104.244.42.65","TCP","1414","50717  >  443 [ACK] Seq=43300 Ack=33854 Win=1041 Len=1360 [TCP segment of a reassembled PDU]"
"80","2.762189","192.168.0.183","104.244.42.65","TCP","1414","50717  >  443 [ACK] Seq=44660 Ack=33854 Win=1041 Len=1360 [TCP segment of a reassembled PDU]"
"81","2.762189","192.168.0.183","104.244.42.65","TCP","1414","50717  >  443 [ACK] Seq=46020 Ack=33854 Win=1041 Len=1360 [TCP segment of a reassembled PDU]"
"82","2.762189","192.168.0.183","104.244.42.65","TCP","1414","50717  >  443 [ACK] Seq=47380 Ack=33854 Win=1041 Len=1360 [TCP segment of a reassembled PDU]"
"83","2.762189","192.168.0.183","104.244.42.65","TCP","1414","50717  >  443 [ACK] Seq=48740 Ack=33854 Win=1041 Len=1360 [TCP segment of a reassembled PDU]"
"84","2.762189","192.168.0.183","104.244.42.65","TCP","1414","50717  >  443 [ACK] Seq=50100 Ack=33854 Win=1041 Len=1360 [TCP segment of a reassembled PDU]"
"85","2.762189","192.168.0.183","104.244.42.65","TCP","1414","50717  >  443 [ACK] Seq=51460 Ack=33854 Win=1041 Len=1360 [TCP segment of a reassembled PDU]"
"86","2.762189","192.168.0.183","104.244.42.65","TCP","1414","50717  >  443 [ACK] Seq=52820 Ack=33854 Win=1041 Len=1360 [TCP segment of a reassembled PDU]"
"87","2.762189","192.168.0.183","104.244.42.65","TCP","1414","50717  >  443 [ACK] Seq=54180 Ack=33854 Win=1041 Len=1360 [TCP segment of a reassembled PDU]"
"88","2.762189","192.168.0.183","104.244.42.65","TLSv1.2","140","Application Data"
"89","2.762338","192.168.0.183","104.244.42.65","TCP","1414","50717  >  443 [ACK] Seq=55626 Ack=33854 Win=1041 Len=1360 [TCP segment of a reassembled PDU]"
"90","2.762338","192.168.0.183","104.244.42.65","TCP","1414","50717  >  443 [ACK] Seq=56986 Ack=33854 Win=1041 Len=1360 [TCP segment of a reassembled PDU]"
"91","2.762338","192.168.0.183","104.244.42.65","TCP","1414","50717  >  443 [ACK] Seq=58346 Ack=33854 Win=1041 Len=1360 [TCP segment of a reassembled PDU]"
"92","2.762338","192.168.0.183","104.244.42.65","TCP","1414","50717  >  443 [ACK] Seq=59706 Ack=33854 Win=1041 Len=1360 [TCP segment of a reassembled PDU]"
"93","2.762338","192.168.0.183","104.244.42.65","TCP","1414","50717  >  443 [ACK] Seq=61066 Ack=33854 Win=1041 Len=1360 [TCP segment of a reassembled PDU]"
"94","2.762338","192.168.0.183","104.244.42.65","TCP","1414","50717  >  443 [ACK] Seq=62426 Ack=33854 Win=1041 Len=1360 [TCP segment of a reassembled PDU]"
"95","2.762338","192.168.0.183","104.244.42.65","TCP","1414","50717  >  443 [ACK] Seq=63786 Ack=33854 Win=1041 Len=1360 [TCP segment of a reassembled PDU]"
"96","2.762338","192.168.0.183","104.244.42.65","TCP","1414","50717  >  443 [ACK] Seq=65146 Ack=33854 Win=1041 Len=1360 [TCP segment of a reassembled PDU]"
"97","2.762338","192.168.0.183","104.244.42.65","TCP","1414","50717  >  443 [ACK] Seq=66506 Ack=33854 Win=1041 Len=1360 [TCP segment of a reassembled PDU]"
"98","2.762338","192.168.0.183","104.244.42.65","TCP","1414","50717  >  443 [ACK] Seq=67866 Ack=33854 Win=1041 Len=1360 [TCP segment of a reassembled PDU]"
"99","2.762338","192.168.0.183","104.244.42.65","TCP","1414","50717  >  443 [ACK] Seq=69226 Ack=33854 Win=1041 Len=1360 [TCP segment of a reassembled PDU]"
"100","2.762338","192.168.0.183","104.244.42.65","TCP","1414","50717  >  443 [ACK] Seq=70586 Ack=33854 Win=1041 Len=1360 [TCP segment of a reassembled PDU]"
"101","2.762338","192.168.0.183","104.244.42.65","TLSv1.2","140","Application Data"
"102","2.762501","192.168.0.183","104.244.42.65","TLSv1.2","121","Application Data"
"103","2.763939","104.244.42.65","192.168.0.183","TCP","60","443  >  50717 [ACK] Seq=33854 Ack=6155 Win=5731 Len=0"
"104","2.793463","104.244.42.65","192.168.0.183","TCP","60","443  >  50717 [ACK] Seq=33854 Ack=9128 Win=5727 Len=0"
"105","2.794586","104.244.42.65","192.168.0.183","TCP","60","443  >  50717 [ACK] Seq=33854 Ack=10488 Win=5732 Len=0"
"106","2.799342","104.244.42.65","192.168.0.183","TCP","60","443  >  50717 [ACK] Seq=33854 Ack=62426 Win=5732 Len=0"
"107","2.799342","104.244.42.65","192.168.0.183","TLSv1.2","89","Application Data"
"108","2.799342","104.244.42.65","192.168.0.183","TCP","60","443  >  50717 [ACK] Seq=33889 Ack=70586 Win=5735 Len=0"
"109","2.799682","104.244.42.65","192.168.0.183","TCP","60","443  >  50717 [ACK] Seq=33889 Ack=72099 Win=5730 Len=0"
"110","2.799691","192.168.0.183","104.244.42.65","TCP","1414","50717  >  443 [ACK] Seq=72099 Ack=33889 Win=1041 Len=1360 [TCP segment of a reassembled PDU]"
"111","2.799691","192.168.0.183","104.244.42.65","TCP","1414","50717  >  443 [ACK] Seq=73459 Ack=33889 Win=1041 Len=1360 [TCP segment of a reassembled PDU]"
"112","2.799691","192.168.0.183","104.244.42.65","TCP","1414","50717  >  443 [ACK] Seq=74819 Ack=33889 Win=1041 Len=1360 [TCP segment of a reassembled PDU]"
"113","2.799691","192.168.0.183","104.244.42.65","TCP","1414","50717  >  443 [ACK] Seq=76179 Ack=33889 Win=1041 Len=1360 [TCP segment of a reassembled PDU]"
"114","2.799691","192.168.0.183","104.244.42.65","TCP","1414","50717  >  443 [ACK] Seq=77539 Ack=33889 Win=1041 Len=1360 [TCP segment of a reassembled PDU]"
"115","2.799691","192.168.0.183","104.244.42.65","TCP","1414","50717  >  443 [ACK] Seq=78899 Ack=33889 Win=1041 Len=1360 [TCP segment of a reassembled PDU]"
"116","2.799691","192.168.0.183","104.244.42.65","TCP","1414","50717  >  443 [ACK] Seq=80259 Ack=33889 Win=1041 Len=1360 [TCP segment of a reassembled PDU]"
"117","2.799691","192.168.0.183","104.244.42.65","TCP","1414","50717  >  443 [ACK] Seq=81619 Ack=33889 Win=1041 Len=1360 [TCP segment of a reassembled PDU]"
"118","2.799691","192.168.0.183","104.244.42.65","TCP","1414","50717  >  443 [ACK] Seq=82979 Ack=33889 Win=1041 Len=1360 [TCP segment of a reassembled PDU]"
"119","2.799691","192.168.0.183","104.244.42.65","TCP","1414","50717  >  443 [ACK] Seq=84339 Ack=33889 Win=1041 Len=1360 [TCP segment of a reassembled PDU]"
"120","2.799691","192.168.0.183","104.244.42.65","TCP","1414","50717  >  443 [ACK] Seq=85699 Ack=33889 Win=1041 Len=1360 [TCP segment of a reassembled PDU]"
"121","2.799691","192.168.0.183","104.244.42.65","TCP","1414","50717  >  443 [ACK] Seq=87059 Ack=33889 Win=1041 Len=1360 [TCP segment of a reassembled PDU]"
"122","2.799691","192.168.0.183","104.244.42.65","TLSv1.2","104","Application Data"
"123","2.800187","192.168.0.183","104.244.42.65","TCP","1414","50717  >  443 [ACK] Seq=88469 Ack=33889 Win=1041 Len=1360 [TCP segment of a reassembled PDU]"
"124","2.800187","192.168.0.183","104.244.42.65","TCP","1414","50717  >  443 [ACK] Seq=89829 Ack=33889 Win=1041 Len=1360 [TCP segment of a reassembled PDU]"
"125","2.800187","192.168.0.183","104.244.42.65","TCP","1414","50717  >  443 [ACK] Seq=91189 Ack=33889 Win=1041 Len=1360 [TCP segment of a reassembled PDU]"
"126","2.800187","192.168.0.183","104.244.42.65","TCP","1414","50717  >  443 [ACK] Seq=92549 Ack=33889 Win=1041 Len=1360 [TCP segment of a reassembled PDU]"
"127","2.800187","192.168.0.183","104.244.42.65","TCP","1414","50717  >  443 [ACK] Seq=93909 Ack=33889 Win=1041 Len=1360 [TCP segment of a reassembled PDU]"
"128","2.800187","192.168.0.183","104.244.42.65","TCP","1414","50717  >  443 [ACK] Seq=95269 Ack=33889 Win=1041 Len=1360 [TCP segment of a reassembled PDU]"
"129","2.800187","192.168.0.183","104.244.42.65","TCP","1414","50717  >  443 [ACK] Seq=96629 Ack=33889 Win=1041 Len=1360 [TCP segment of a reassembled PDU]"
"130","2.800187","192.168.0.183","104.244.42.65","TCP","1414","50717  >  443 [ACK] Seq=97989 Ack=33889 Win=1041 Len=1360 [TCP segment of a reassembled PDU]"
"131","2.800187","192.168.0.183","104.244.42.65","TCP","1414","50717  >  443 [ACK] Seq=99349 Ack=33889 Win=1041 Len=1360 [TCP segment of a reassembled PDU]"
"132","2.800187","192.168.0.183","104.244.42.65","TCP","1414","50717  >  443 [ACK] Seq=100709 Ack=33889 Win=1041 Len=1360 [TCP segment of a reassembled PDU]"
"133","2.800187","192.168.0.183","104.244.42.65","TCP","1414","50717  >  443 [ACK] Seq=102069 Ack=33889 Win=1041 Len=1360 [TCP segment of a reassembled PDU]"
"134","2.800187","192.168.0.183","104.244.42.65","TCP","1414","50717  >  443 [ACK] Seq=103429 Ack=33889 Win=1041 Len=1360 [TCP segment of a reassembled PDU]"
"135","2.800187","192.168.0.183","104.244.42.65","TLSv1.2","140","Application Data"
"136","2.800755","192.168.0.183","104.244.42.65","TCP","1414","50717  >  443 [ACK] Seq=104875 Ack=33889 Win=1041 Len=1360 [TCP segment of a reassembled PDU]"
"137","2.800755","192.168.0.183","104.244.42.65","TCP","1414","50717  >  443 [ACK] Seq=106235 Ack=33889 Win=1041 Len=1360 [TCP segment of a reassembled PDU]"
"138","2.800755","192.168.0.183","104.244.42.65","TCP","1414","50717  >  443 [ACK] Seq=107595 Ack=33889 Win=1041 Len=1360 [TCP segment of a reassembled PDU]"
"139","2.800755","192.168.0.183","104.244.42.65","TCP","1414","50717  >  443 [ACK] Seq=108955 Ack=33889 Win=1041 Len=1360 [TCP segment of a reassembled PDU]"
"140","2.800755","192.168.0.183","104.244.42.65","TCP","1414","50717  >  443 [ACK] Seq=110315 Ack=33889 Win=1041 Len=1360 [TCP segment of a reassembled PDU]"
"141","2.800755","192.168.0.183","104.244.42.65","TCP","1414","50717  >  443 [ACK] Seq=111675 Ack=33889 Win=1041 Len=1360 [TCP segment of a reassembled PDU]"
"142","2.800755","192.168.0.183","104.244.42.65","TCP","1414","50717  >  443 [ACK] Seq=113035 Ack=33889 Win=1041 Len=1360 [TCP segment of a reassembled PDU]"
"143","2.800755","192.168.0.183","104.244.42.65","TCP","1414","50717  >  443 [ACK] Seq=114395 Ack=33889 Win=1041 Len=1360 [TCP segment of a reassembled PDU]"
"144","2.800755","192.168.0.183","104.244.42.65","TCP","1414","50717  >  443 [ACK] Seq=115755 Ack=33889 Win=1041 Len=1360 [TCP segment of a reassembled PDU]"
"145","2.800755","192.168.0.183","104.244.42.65","TCP","1414","50717  >  443 [ACK] Seq=117115 Ack=33889 Win=1041 Len=1360 [TCP segment of a reassembled PDU]"
"146","2.800755","192.168.0.183","104.244.42.65","TCP","1414","50717  >  443 [ACK] Seq=118475 Ack=33889 Win=1041 Len=1360 [TCP segment of a reassembled PDU]"
"147","2.800755","192.168.0.183","104.244.42.65","TCP","1414","50717  >  443 [ACK] Seq=119835 Ack=33889 Win=1041 Len=1360 [TCP segment of a reassembled PDU]"
"148","2.800755","192.168.0.183","104.244.42.65","TLSv1.2","140","Application Data"
"149","2.801124","192.168.0.183","104.244.42.65","TLSv1.2","121","Application Data"
"150","2.830784","104.244.42.65","192.168.0.183","TCP","60","443  >  50717 [ACK] Seq=33889 Ack=74819 Win=5732 Len=0"
"151","2.834364","104.244.42.65","192.168.0.183","TCP","60","443  >  50717 [ACK] Seq=33889 Ack=111675 Win=5684 Len=0"
"152","2.834364","104.244.42.65","192.168.0.183","TLSv1.2","89","Application Data"
"153","2.834364","104.244.42.65","192.168.0.183","TCP","60","443  >  50717 [ACK] Seq=33924 Ack=121348 Win=5723 Len=0"
"154","2.834591","192.168.0.183","104.244.42.65","TCP","1414","50717  >  443 [ACK] Seq=121348 Ack=33924 Win=1040 Len=1360 [TCP segment of a reassembled PDU]"
"155","2.834591","192.168.0.183","104.244.42.65","TLSv1.2","78","Application Data"
"156","2.865209","104.244.42.65","192.168.0.183","TCP","60","443  >  50717 [ACK] Seq=33924 Ack=122732 Win=5731 Len=0"
"157","2.966932","104.244.42.65","192.168.0.183","TLSv1.2","184","Application Data"
"158","3.017235","192.168.0.183","104.244.42.65","TCP","54","50717  >  443 [ACK] Seq=122732 Ack=34054 Win=1040 Len=0"
"159","3.145355","104.244.42.65","192.168.0.183","TLSv1.2","162","Application Data"
"160","3.187342","192.168.0.183","104.244.42.65","TCP","54","50717  >  443 [ACK] Seq=122732 Ack=34162 Win=1040 Len=0"
"161","3.450568","104.244.42.193","192.168.0.183","TLSv1.2","93","Application Data"
"162","3.450951","192.168.0.183","104.244.42.193","TCP","54","50715  >  443 [FIN, ACK] Seq=1 Ack=40 Win=260 Len=0"
"163","3.484522","104.244.42.193","192.168.0.183","TLSv1.2","78","Application Data"
"164","3.484575","192.168.0.183","104.244.42.193","TCP","54","50715  >  443 [RST, ACK] Seq=2 Ack=64 Win=0 Len=0"
"165","3.490745","104.244.42.193","192.168.0.183","TCP","56","443  >  50715 [FIN, ACK] Seq=64 Ack=2 Win=288 Len=0"
"166","3.505134","104.244.42.65","192.168.0.183","TCP","1414","443  >  50717 [ACK] Seq=34162 Ack=122732 Win=5735 Len=1360 [TCP segment of a reassembled PDU]"
"167","3.505134","104.244.42.65","192.168.0.183","TCP","1414","443  >  50717 [ACK] Seq=35522 Ack=122732 Win=5735 Len=1360 [TCP segment of a reassembled PDU]"
"168","3.505134","104.244.42.65","192.168.0.183","TCP","1414","443  >  50717 [PSH, ACK] Seq=36882 Ack=122732 Win=5735 Len=1360 [TCP segment of a reassembled PDU]"
"169","3.505134","104.244.42.65","192.168.0.183","TCP","1414","443  >  50717 [ACK] Seq=38242 Ack=122732 Win=5735 Len=1360 [TCP segment of a reassembled PDU]"
"170","3.505134","104.244.42.65","192.168.0.183","TCP","1414","443  >  50717 [ACK] Seq=39602 Ack=122732 Win=5735 Len=1360 [TCP segment of a reassembled PDU]"
"171","3.505134","104.244.42.65","192.168.0.183","TCP","1414","443  >  50717 [PSH, ACK] Seq=40962 Ack=122732 Win=5735 Len=1360 [TCP segment of a reassembled PDU]"
"172","3.505134","104.244.42.65","192.168.0.183","TLSv1.2","1080","Application Data"
"173","3.505200","192.168.0.183","104.244.42.65","TCP","54","50717  >  443 [ACK] Seq=122732 Ack=43348 Win=1041 Len=0"
"174","3.985685","192.168.0.183","104.244.42.65","TLSv1.2","379","Application Data"
"175","3.985831","192.168.0.183","104.244.42.65","TLSv1.2","1227","Application Data"
"176","3.985961","192.168.0.183","104.244.42.65","TLSv1.2","628","Application Data"
"177","3.986003","192.168.0.183","104.244.42.65","TLSv1.2","459","Application Data"
"178","4.025814","104.244.42.65","192.168.0.183","TCP","60","443  >  50717 [ACK] Seq=43348 Ack=124230 Win=5731 Len=0"
"179","4.025814","104.244.42.65","192.168.0.183","TCP","60","443  >  50717 [ACK] Seq=43348 Ack=125209 Win=5735 Len=0"
"180","4.051381","104.244.42.65","192.168.0.183","TLSv1.2","275","Application Data"
"181","4.051381","104.244.42.65","192.168.0.183","TLSv1.2","258","Application Data"
"182","4.051475","192.168.0.183","104.244.42.65","TCP","54","50717  >  443 [ACK] Seq=125209 Ack=43773 Win=1039 Len=0"
"183","4.345431","192.168.0.183","104.244.42.65","TLSv1.2","1283","Application Data"
"184","4.345600","192.168.0.183","104.244.42.65","TLSv1.2","332","Application Data"
"185","4.376430","104.244.42.65","192.168.0.183","TCP","60","443  >  50717 [ACK] Seq=43773 Ack=126716 Win=5734 Len=0"
"186","4.403872","104.244.42.65","192.168.0.183","TLSv1.2","465","Application Data"
"187","4.407393","104.244.42.65","192.168.0.183","TLSv1.2","228","Application Data"
"188","4.407485","192.168.0.183","104.244.42.65","TCP","54","50717  >  443 [ACK] Seq=126716 Ack=44358 Win=1037 Len=0"
"189","5.723341","192.168.0.183","104.244.42.65","TLSv1.2","282","Application Data"
"190","5.723449","192.168.0.183","104.244.42.65","TCP","1414","50717  >  443 [ACK] Seq=126944 Ack=44358 Win=1037 Len=1360 [TCP segment of a reassembled PDU]"
"191","5.723449","192.168.0.183","104.244.42.65","TCP","1414","50717  >  443 [ACK] Seq=128304 Ack=44358 Win=1037 Len=1360 [TCP segment of a reassembled PDU]"
"192","5.723449","192.168.0.183","104.244.42.65","TCP","1414","50717  >  443 [ACK] Seq=129664 Ack=44358 Win=1037 Len=1360 [TCP segment of a reassembled PDU]"
"193","5.723449","192.168.0.183","104.244.42.65","TCP","1414","50717  >  443 [ACK] Seq=131024 Ack=44358 Win=1037 Len=1360 [TCP segment of a reassembled PDU]"
"194","5.723449","192.168.0.183","104.244.42.65","TCP","1414","50717  >  443 [ACK] Seq=132384 Ack=44358 Win=1037 Len=1360 [TCP segment of a reassembled PDU]"
"195","5.723449","192.168.0.183","104.244.42.65","TCP","1414","50717  >  443 [ACK] Seq=133744 Ack=44358 Win=1037 Len=1360 [TCP segment of a reassembled PDU]"
"196","5.723449","192.168.0.183","104.244.42.65","TCP","1414","50717  >  443 [ACK] Seq=135104 Ack=44358 Win=1037 Len=1360 [TCP segment of a reassembled PDU]"
"197","5.723449","192.168.0.183","104.244.42.65","TCP","1414","50717  >  443 [ACK] Seq=136464 Ack=44358 Win=1037 Len=1360 [TCP segment of a reassembled PDU]"
"198","5.723449","192.168.0.183","104.244.42.65","TCP","1414","50717  >  443 [ACK] Seq=137824 Ack=44358 Win=1037 Len=1360 [TCP segment of a reassembled PDU]"
"199","5.723449","192.168.0.183","104.244.42.65","TCP","1414","50717  >  443 [ACK] Seq=139184 Ack=44358 Win=1037 Len=1360 [TCP segment of a reassembled PDU]"
"200","5.723449","192.168.0.183","104.244.42.65","TCP","1414","50717  >  443 [ACK] Seq=140544 Ack=44358 Win=1037 Len=1360 [TCP segment of a reassembled PDU]"
"201","5.723449","192.168.0.183","104.244.42.65","TCP","1414","50717  >  443 [ACK] Seq=141904 Ack=44358 Win=1037 Len=1360 [TCP segment of a reassembled PDU]"
"202","5.723449","192.168.0.183","104.244.42.65","TLSv1.2","140","Application Data"
"203","5.723583","192.168.0.183","104.244.42.65","TCP","1414","50717  >  443 [ACK] Seq=143350 Ack=44358 Win=1037 Len=1360 [TCP segment of a reassembled PDU]"
"204","5.723583","192.168.0.183","104.244.42.65","TCP","1414","50717  >  443 [ACK] Seq=144710 Ack=44358 Win=1037 Len=1360 [TCP segment of a reassembled PDU]"
"205","5.723583","192.168.0.183","104.244.42.65","TCP","1414","50717  >  443 [ACK] Seq=146070 Ack=44358 Win=1037 Len=1360 [TCP segment of a reassembled PDU]"
"206","5.723583","192.168.0.183","104.244.42.65","TCP","1414","50717  >  443 [ACK] Seq=147430 Ack=44358 Win=1037 Len=1360 [TCP segment of a reassembled PDU]"
"207","5.723583","192.168.0.183","104.244.42.65","TCP","1414","50717  >  443 [ACK] Seq=148790 Ack=44358 Win=1037 Len=1360 [TCP segment of a reassembled PDU]"
"208","5.723583","192.168.0.183","104.244.42.65","TCP","1414","50717  >  443 [ACK] Seq=150150 Ack=44358 Win=1037 Len=1360 [TCP segment of a reassembled PDU]"
"209","5.723583","192.168.0.183","104.244.42.65","TCP","1414","50717  >  443 [ACK] Seq=151510 Ack=44358 Win=1037 Len=1360 [TCP segment of a reassembled PDU]"
"210","5.723583","192.168.0.183","104.244.42.65","TCP","1414","50717  >  443 [ACK] Seq=152870 Ack=44358 Win=1037 Len=1360 [TCP segment of a reassembled PDU]"
"211","5.723583","192.168.0.183","104.244.42.65","TCP","1414","50717  >  443 [ACK] Seq=154230 Ack=44358 Win=1037 Len=1360 [TCP segment of a reassembled PDU]"
"212","5.723583","192.168.0.183","104.244.42.65","TCP","1414","50717  >  443 [ACK] Seq=155590 Ack=44358 Win=1037 Len=1360 [TCP segment of a reassembled PDU]"
"213","5.723583","192.168.0.183","104.244.42.65","TCP","1414","50717  >  443 [ACK] Seq=156950 Ack=44358 Win=1037 Len=1360 [TCP segment of a reassembled PDU]"
"214","5.723583","192.168.0.183","104.244.42.65","TCP","1414","50717  >  443 [ACK] Seq=158310 Ack=44358 Win=1037 Len=1360 [TCP segment of a reassembled PDU]"
"215","5.723583","192.168.0.183","104.244.42.65","TLSv1.2","140","Application Data"
"216","5.723722","192.168.0.183","104.244.42.65","TCP","1414","50717  >  443 [ACK] Seq=159756 Ack=44358 Win=1037 Len=1360 [TCP segment of a reassembled PDU]"
"217","5.723722","192.168.0.183","104.244.42.65","TCP","1414","50717  >  443 [ACK] Seq=161116 Ack=44358 Win=1037 Len=1360 [TCP segment of a reassembled PDU]"
"218","5.723722","192.168.0.183","104.244.42.65","TCP","1414","50717  >  443 [ACK] Seq=162476 Ack=44358 Win=1037 Len=1360 [TCP segment of a reassembled PDU]"
"219","5.723722","192.168.0.183","104.244.42.65","TCP","1414","50717  >  443 [ACK] Seq=163836 Ack=44358 Win=1037 Len=1360 [TCP segment of a reassembled PDU]"
"220","5.723722","192.168.0.183","104.244.42.65","TCP","1414","50717  >  443 [ACK] Seq=165196 Ack=44358 Win=1037 Len=1360 [TCP segment of a reassembled PDU]"
"221","5.723722","192.168.0.183","104.244.42.65","TCP","1414","50717  >  443 [ACK] Seq=166556 Ack=44358 Win=1037 Len=1360 [TCP segment of a reassembled PDU]"
"222","5.723722","192.168.0.183","104.244.42.65","TCP","1414","50717  >  443 [ACK] Seq=167916 Ack=44358 Win=1037 Len=1360 [TCP segment of a reassembled PDU]"
"223","5.723722","192.168.0.183","104.244.42.65","TCP","1414","50717  >  443 [ACK] Seq=169276 Ack=44358 Win=1037 Len=1360 [TCP segment of a reassembled PDU]"
"224","5.723722","192.168.0.183","104.244.42.65","TLSv1.2","59","Application Data"
"225","5.758848","104.244.42.65","192.168.0.183","TCP","60","443  >  50717 [ACK] Seq=44358 Ack=143350 Win=5735 Len=0"
"226","5.758848","104.244.42.65","192.168.0.183","TCP","60","443  >  50717 [ACK] Seq=44358 Ack=170636 Win=5725 Len=0"
"227","5.758848","104.244.42.65","192.168.0.183","TLSv1.2","89","Application Data"
"228","5.807500","104.244.42.65","192.168.0.183","TLSv1.2","207","Application Data"
"229","5.807537","192.168.0.183","104.244.42.65","TCP","54","50717  >  443 [ACK] Seq=170641 Ack=44546 Win=1036 Len=0"
"230","8.721252","192.168.0.183","104.244.42.65","TLSv1.2","278","Application Data"
"231","8.721385","192.168.0.183","104.244.42.65","TCP","1414","50717  >  443 [ACK] Seq=170865 Ack=44546 Win=1036 Len=1360 [TCP segment of a reassembled PDU]"
"232","8.721385","192.168.0.183","104.244.42.65","TCP","1414","50717  >  443 [ACK] Seq=172225 Ack=44546 Win=1036 Len=1360 [TCP segment of a reassembled PDU]"
"233","8.721385","192.168.0.183","104.244.42.65","TCP","1414","50717  >  443 [ACK] Seq=173585 Ack=44546 Win=1036 Len=1360 [TCP segment of a reassembled PDU]"
"234","8.721385","192.168.0.183","104.244.42.65","TCP","1414","50717  >  443 [ACK] Seq=174945 Ack=44546 Win=1036 Len=1360 [TCP segment of a reassembled PDU]"
"235","8.721385","192.168.0.183","104.244.42.65","TCP","1414","50717  >  443 [ACK] Seq=176305 Ack=44546 Win=1036 Len=1360 [TCP segment of a reassembled PDU]"
"236","8.721385","192.168.0.183","104.244.42.65","TCP","1414","50717  >  443 [ACK] Seq=177665 Ack=44546 Win=1036 Len=1360 [TCP segment of a reassembled PDU]"
"237","8.721385","192.168.0.183","104.244.42.65","TCP","1414","50717  >  443 [ACK] Seq=179025 Ack=44546 Win=1036 Len=1360 [TCP segment of a reassembled PDU]"
"238","8.721385","192.168.0.183","104.244.42.65","TCP","1414","50717  >  443 [ACK] Seq=180385 Ack=44546 Win=1036 Len=1360 [TCP segment of a reassembled PDU]"
"239","8.721385","192.168.0.183","104.244.42.65","TCP","1414","50717  >  443 [ACK] Seq=181745 Ack=44546 Win=1036 Len=1360 [TCP segment of a reassembled PDU]"
"240","8.721385","192.168.0.183","104.244.42.65","TCP","1414","50717  >  443 [ACK] Seq=183105 Ack=44546 Win=1036 Len=1360 [TCP segment of a reassembled PDU]"
"241","8.721385","192.168.0.183","104.244.42.65","TCP","1414","50717  >  443 [ACK] Seq=184465 Ack=44546 Win=1036 Len=1360 [TCP segment of a reassembled PDU]"
"242","8.721385","192.168.0.183","104.244.42.65","TCP","1414","50717  >  443 [ACK] Seq=185825 Ack=44546 Win=1036 Len=1360 [TCP segment of a reassembled PDU]"
"243","8.721385","192.168.0.183","104.244.42.65","TLSv1.2","140","Application Data"
"244","8.721515","192.168.0.183","104.244.42.65","TCP","1414","50717  >  443 [ACK] Seq=187271 Ack=44546 Win=1036 Len=1360 [TCP segment of a reassembled PDU]"
"245","8.721515","192.168.0.183","104.244.42.65","TCP","1414","50717  >  443 [ACK] Seq=188631 Ack=44546 Win=1036 Len=1360 [TCP segment of a reassembled PDU]"
"246","8.721515","192.168.0.183","104.244.42.65","TCP","1414","50717  >  443 [ACK] Seq=189991 Ack=44546 Win=1036 Len=1360 [TCP segment of a reassembled PDU]"
"247","8.721515","192.168.0.183","104.244.42.65","TCP","1414","50717  >  443 [ACK] Seq=191351 Ack=44546 Win=1036 Len=1360 [TCP segment of a reassembled PDU]"
"248","8.721515","192.168.0.183","104.244.42.65","TCP","1414","50717  >  443 [ACK] Seq=192711 Ack=44546 Win=1036 Len=1360 [TCP segment of a reassembled PDU]"
"249","8.721515","192.168.0.183","104.244.42.65","TCP","1414","50717  >  443 [ACK] Seq=194071 Ack=44546 Win=1036 Len=1360 [TCP segment of a reassembled PDU]"
"250","8.721515","192.168.0.183","104.244.42.65","TCP","1414","50717  >  443 [ACK] Seq=195431 Ack=44546 Win=1036 Len=1360 [TCP segment of a reassembled PDU]"
"251","8.721515","192.168.0.183","104.244.42.65","TLSv1.2","1061","Application Data"
"252","8.753259","104.244.42.65","192.168.0.183","TCP","60","443  >  50717 [ACK] Seq=44546 Ack=173585 Win=5729 Len=0"
"253","8.759059","104.244.42.65","192.168.0.183","TCP","60","443  >  50717 [ACK] Seq=44546 Ack=197798 Win=5729 Len=0"
"254","8.788145","104.244.42.65","192.168.0.183","TLSv1.2","206","Application Data"
"255","8.841991","192.168.0.183","104.244.42.65","TCP","54","50717  >  443 [ACK] Seq=197798 Ack=44698 Win=1035 Len=0"
"256","12.298590","192.168.0.183","104.244.42.65","TLSv1.2","255","Application Data"
"257","12.298812","192.168.0.183","104.244.42.65","TCP","1414","50717  >  443 [ACK] Seq=197999 Ack=44698 Win=1035 Len=1360 [TCP segment of a reassembled PDU]"
"258","12.298812","192.168.0.183","104.244.42.65","TCP","1414","50717  >  443 [ACK] Seq=199359 Ack=44698 Win=1035 Len=1360 [TCP segment of a reassembled PDU]"
"259","12.298812","192.168.0.183","104.244.42.65","TCP","1414","50717  >  443 [ACK] Seq=200719 Ack=44698 Win=1035 Len=1360 [TCP segment of a reassembled PDU]"
"260","12.298812","192.168.0.183","104.244.42.65","TCP","1414","50717  >  443 [ACK] Seq=202079 Ack=44698 Win=1035 Len=1360 [TCP segment of a reassembled PDU]"
"261","12.298812","192.168.0.183","104.244.42.65","TCP","1414","50717  >  443 [ACK] Seq=203439 Ack=44698 Win=1035 Len=1360 [TCP segment of a reassembled PDU]"
"262","12.298812","192.168.0.183","104.244.42.65","TCP","1414","50717  >  443 [ACK] Seq=204799 Ack=44698 Win=1035 Len=1360 [TCP segment of a reassembled PDU]"
"263","12.298812","192.168.0.183","104.244.42.65","TCP","1414","50717  >  443 [ACK] Seq=206159 Ack=44698 Win=1035 Len=1360 [TCP segment of a reassembled PDU]"
"264","12.298812","192.168.0.183","104.244.42.65","TCP","1414","50717  >  443 [ACK] Seq=207519 Ack=44698 Win=1035 Len=1360 [TCP segment of a reassembled PDU]"
"265","12.298812","192.168.0.183","104.244.42.65","TCP","1414","50717  >  443 [ACK] Seq=208879 Ack=44698 Win=1035 Len=1360 [TCP segment of a reassembled PDU]"
"266","12.298812","192.168.0.183","104.244.42.65","TCP","1414","50717  >  443 [ACK] Seq=210239 Ack=44698 Win=1035 Len=1360 [TCP segment of a reassembled PDU]"
"267","12.298812","192.168.0.183","104.244.42.65","TCP","1414","50717  >  443 [ACK] Seq=211599 Ack=44698 Win=1035 Len=1360 [TCP segment of a reassembled PDU]"
"268","12.298812","192.168.0.183","104.244.42.65","TCP","1414","50717  >  443 [ACK] Seq=212959 Ack=44698 Win=1035 Len=1360 [TCP segment of a reassembled PDU]"
"269","12.298812","192.168.0.183","104.244.42.65","TLSv1.2","140","Application Data"
"270","12.298987","192.168.0.183","104.244.42.65","TCP","1414","50717  >  443 [ACK] Seq=214405 Ack=44698 Win=1035 Len=1360 [TCP segment of a reassembled PDU]"
"271","12.298987","192.168.0.183","104.244.42.65","TCP","1414","50717  >  443 [ACK] Seq=215765 Ack=44698 Win=1035 Len=1360 [TCP segment of a reassembled PDU]"
"272","12.298987","192.168.0.183","104.244.42.65","TCP","1414","50717  >  443 [ACK] Seq=217125 Ack=44698 Win=1035 Len=1360 [TCP segment of a reassembled PDU]"
"273","12.298987","192.168.0.183","104.244.42.65","TCP","1414","50717  >  443 [ACK] Seq=218485 Ack=44698 Win=1035 Len=1360 [TCP segment of a reassembled PDU]"
"274","12.298987","192.168.0.183","104.244.42.65","TCP","1414","50717  >  443 [ACK] Seq=219845 Ack=44698 Win=1035 Len=1360 [TCP segment of a reassembled PDU]"
"275","12.298987","192.168.0.183","104.244.42.65","TCP","1414","50717  >  443 [ACK] Seq=221205 Ack=44698 Win=1035 Len=1360 [TCP segment of a reassembled PDU]"
"276","12.298987","192.168.0.183","104.244.42.65","TLSv1.2","577","Application Data"
"277","12.299369","192.168.0.183","104.244.42.65","TLSv1.2","285","Application Data"
"278","12.328880","104.244.42.65","192.168.0.183","TCP","60","443  >  50717 [ACK] Seq=44698 Ack=199359 Win=5731 Len=0"
"279","12.349237","104.244.42.65","192.168.0.183","TCP","60","443  >  50717 [ACK] Seq=44698 Ack=223088 Win=5723 Len=0"
"280","12.365947","104.244.42.65","192.168.0.183","TLSv1.2","180","Application Data"
"281","12.411095","192.168.0.183","104.244.42.65","TLSv1.2","813","Application Data"
"282","12.411204","192.168.0.183","104.244.42.65","TCP","1414","50717  >  443 [ACK] Seq=224078 Ack=44824 Win=1041 Len=1360 [TCP segment of a reassembled PDU]"
"283","12.411204","192.168.0.183","104.244.42.65","TLSv1.2","310","Application Data"
"284","12.411749","192.168.0.183","104.244.42.65","TLSv1.2","614","Application Data"
"285","12.411887","192.168.0.183","104.244.42.65","TLSv1.2","647","Application Data"
"286","12.440134","104.244.42.65","192.168.0.183","TCP","60","443  >  50717 [ACK] Seq=44824 Ack=225694 Win=5731 Len=0"
"287","12.446364","104.244.42.65","192.168.0.183","TCP","60","443  >  50717 [ACK] Seq=44824 Ack=226847 Win=5735 Len=0"
"288","12.469497","104.244.42.65","192.168.0.183","TLSv1.2","161","Application Data"
"289","12.521125","192.168.0.183","104.244.42.65","TCP","54","50717  >  443 [ACK] Seq=226847 Ack=44931 Win=1040 Len=0"
"290","12.792710","104.244.42.65","192.168.0.183","TLSv1.2","167","Application Data"
"291","12.847150","192.168.0.183","104.244.42.65","TCP","54","50717  >  443 [ACK] Seq=226847 Ack=45044 Win=1040 Len=0"
"292","13.879130","104.244.42.65","192.168.0.183","TCP","1414","443  >  50717 [ACK] Seq=45044 Ack=226847 Win=5735 Len=1360 [TCP segment of a reassembled PDU]"
"293","13.879130","104.244.42.65","192.168.0.183","TCP","1414","443  >  50717 [ACK] Seq=46404 Ack=226847 Win=5735 Len=1360 [TCP segment of a reassembled PDU]"
"294","13.879130","104.244.42.65","192.168.0.183","TCP","1414","443  >  50717 [PSH, ACK] Seq=47764 Ack=226847 Win=5735 Len=1360 [TCP segment of a reassembled PDU]"
"295","13.879130","104.244.42.65","192.168.0.183","TCP","1414","443  >  50717 [ACK] Seq=49124 Ack=226847 Win=5735 Len=1360 [TCP segment of a reassembled PDU]"
"296","13.879130","104.244.42.65","192.168.0.183","TCP","1414","443  >  50717 [ACK] Seq=50484 Ack=226847 Win=5735 Len=1360 [TCP segment of a reassembled PDU]"
"297","13.879130","104.244.42.65","192.168.0.183","TCP","1414","443  >  50717 [PSH, ACK] Seq=51844 Ack=226847 Win=5735 Len=1360 [TCP segment of a reassembled PDU]"
"298","13.879130","104.244.42.65","192.168.0.183","TCP","1414","443  >  50717 [ACK] Seq=53204 Ack=226847 Win=5735 Len=1360 [TCP segment of a reassembled PDU]"
"299","13.879130","104.244.42.65","192.168.0.183","TCP","1414","443  >  50717 [ACK] Seq=54564 Ack=226847 Win=5735 Len=1360 [TCP segment of a reassembled PDU]"
"300","13.879130","104.244.42.65","192.168.0.183","TCP","1414","443  >  50717 [PSH, ACK] Seq=55924 Ack=226847 Win=5735 Len=1360 [TCP segment of a reassembled PDU]"
"301","13.879130","104.244.42.65","192.168.0.183","TCP","1414","443  >  50717 [ACK] Seq=57284 Ack=226847 Win=5735 Len=1360 [TCP segment of a reassembled PDU]"
"302","13.879130","104.244.42.65","192.168.0.183","TCP","1414","443  >  50717 [ACK] Seq=58644 Ack=226847 Win=5735 Len=1360 [TCP segment of a reassembled PDU]"
"303","13.879130","104.244.42.65","192.168.0.183","TCP","1414","443  >  50717 [PSH, ACK] Seq=60004 Ack=226847 Win=5735 Len=1360 [TCP segment of a reassembled PDU]"
"304","13.879130","104.244.42.65","192.168.0.183","TLSv1.2","1414","Application Data"
"305","13.879130","104.244.42.65","192.168.0.183","TCP","1414","443  >  50717 [ACK] Seq=62724 Ack=226847 Win=5735 Len=1360 [TCP segment of a reassembled PDU]"
"306","13.879130","104.244.42.65","192.168.0.183","TCP","1414","443  >  50717 [PSH, ACK] Seq=64084 Ack=226847 Win=5735 Len=1360 [TCP segment of a reassembled PDU]"
"307","13.879130","104.244.42.65","192.168.0.183","TCP","1414","443  >  50717 [ACK] Seq=65444 Ack=226847 Win=5735 Len=1360 [TCP segment of a reassembled PDU]"
"308","13.879130","104.244.42.65","192.168.0.183","TCP","1414","443  >  50717 [ACK] Seq=66804 Ack=226847 Win=5735 Len=1360 [TCP segment of a reassembled PDU]"
"309","13.879130","104.244.42.65","192.168.0.183","TCP","1414","443  >  50717 [PSH, ACK] Seq=68164 Ack=226847 Win=5735 Len=1360 [TCP segment of a reassembled PDU]"
"310","13.879130","104.244.42.65","192.168.0.183","TCP","1414","443  >  50717 [ACK] Seq=69524 Ack=226847 Win=5735 Len=1360 [TCP segment of a reassembled PDU]"
"311","13.879130","104.244.42.65","192.168.0.183","TCP","1414","443  >  50717 [ACK] Seq=70884 Ack=226847 Win=5735 Len=1360 [TCP segment of a reassembled PDU]"
"312","13.879130","104.244.42.65","192.168.0.183","TCP","1414","443  >  50717 [PSH, ACK] Seq=72244 Ack=226847 Win=5735 Len=1360 [TCP segment of a reassembled PDU]"
"313","13.879130","104.244.42.65","192.168.0.183","TCP","1414","443  >  50717 [ACK] Seq=73604 Ack=226847 Win=5735 Len=1360 [TCP segment of a reassembled PDU]"
"314","13.879130","104.244.42.65","192.168.0.183","TCP","1414","443  >  50717 [ACK] Seq=74964 Ack=226847 Win=5735 Len=1360 [TCP segment of a reassembled PDU]"
"315","13.879130","104.244.42.65","192.168.0.183","TCP","1414","443  >  50717 [PSH, ACK] Seq=76324 Ack=226847 Win=5735 Len=1360 [TCP segment of a reassembled PDU]"
"316","13.879130","104.244.42.65","192.168.0.183","TLSv1.2","1414","Application Data"
"317","13.879431","192.168.0.183","104.244.42.65","TCP","54","50717  >  443 [ACK] Seq=226847 Ack=79044 Win=1041 Len=0"
"318","13.879531","104.244.42.65","192.168.0.183","TLSv1.2","924","Application Data"
"319","13.879590","192.168.0.183","104.244.42.65","TCP","54","50717  >  443 [ACK] Seq=226847 Ack=79914 Win=1037 Len=0"
"320","13.880817","192.168.0.183","104.244.42.65","TLSv1.2","89","Application Data"
"321","13.951307","104.244.42.65","192.168.0.183","TCP","60","443  >  50717 [ACK] Seq=79914 Ack=226882 Win=5735 Len=0"
"322","15.047524","192.168.0.183","104.244.42.65","TLSv1.2","319","Application Data"
"323","15.047703","192.168.0.183","104.244.42.65","TCP","1414","50717  >  443 [ACK] Seq=227147 Ack=79914 Win=1037 Len=1360 [TCP segment of a reassembled PDU]"
"324","15.047703","192.168.0.183","104.244.42.65","TCP","1414","50717  >  443 [ACK] Seq=228507 Ack=79914 Win=1037 Len=1360 [TCP segment of a reassembled PDU]"
"325","15.047703","192.168.0.183","104.244.42.65","TCP","1414","50717  >  443 [ACK] Seq=229867 Ack=79914 Win=1037 Len=1360 [TCP segment of a reassembled PDU]"
"326","15.047703","192.168.0.183","104.244.42.65","TCP","1414","50717  >  443 [ACK] Seq=231227 Ack=79914 Win=1037 Len=1360 [TCP segment of a reassembled PDU]"
"327","15.047703","192.168.0.183","104.244.42.65","TCP","1414","50717  >  443 [ACK] Seq=232587 Ack=79914 Win=1037 Len=1360 [TCP segment of a reassembled PDU]"
"328","15.047703","192.168.0.183","104.244.42.65","TCP","1414","50717  >  443 [ACK] Seq=233947 Ack=79914 Win=1037 Len=1360 [TCP segment of a reassembled PDU]"
"329","15.047703","192.168.0.183","104.244.42.65","TCP","1414","50717  >  443 [ACK] Seq=235307 Ack=79914 Win=1037 Len=1360 [TCP segment of a reassembled PDU]"
"330","15.047703","192.168.0.183","104.244.42.65","TCP","1414","50717  >  443 [ACK] Seq=236667 Ack=79914 Win=1037 Len=1360 [TCP segment of a reassembled PDU]"
"331","15.047703","192.168.0.183","104.244.42.65","TCP","1414","50717  >  443 [ACK] Seq=238027 Ack=79914 Win=1037 Len=1360 [TCP segment of a reassembled PDU]"
"332","15.047703","192.168.0.183","104.244.42.65","TCP","1414","50717  >  443 [ACK] Seq=239387 Ack=79914 Win=1037 Len=1360 [TCP segment of a reassembled PDU]"
"333","15.047703","192.168.0.183","104.244.42.65","TCP","1414","50717  >  443 [ACK] Seq=240747 Ack=79914 Win=1037 Len=1360 [TCP segment of a reassembled PDU]"
"334","15.047703","192.168.0.183","104.244.42.65","TCP","1414","50717  >  443 [ACK] Seq=242107 Ack=79914 Win=1037 Len=1360 [TCP segment of a reassembled PDU]"
"335","15.047703","192.168.0.183","104.244.42.65","TLSv1.2","140","Application Data"
"336","15.048004","192.168.0.183","104.244.42.65","TCP","1414","50717  >  443 [ACK] Seq=243553 Ack=79914 Win=1037 Len=1360 [TCP segment of a reassembled PDU]"
"337","15.048004","192.168.0.183","104.244.42.65","TCP","1414","50717  >  443 [ACK] Seq=244913 Ack=79914 Win=1037 Len=1360 [TCP segment of a reassembled PDU]"
"338","15.048004","192.168.0.183","104.244.42.65","TCP","1414","50717  >  443 [ACK] Seq=246273 Ack=79914 Win=1037 Len=1360 [TCP segment of a reassembled PDU]"
"339","15.048004","192.168.0.183","104.244.42.65","TCP","1414","50717  >  443 [ACK] Seq=247633 Ack=79914 Win=1037 Len=1360 [TCP segment of a reassembled PDU]"
"340","15.048004","192.168.0.183","104.244.42.65","TCP","1414","50717  >  443 [ACK] Seq=248993 Ack=79914 Win=1037 Len=1360 [TCP segment of a reassembled PDU]"
"341","15.048004","192.168.0.183","104.244.42.65","TCP","1414","50717  >  443 [ACK] Seq=250353 Ack=79914 Win=1037 Len=1360 [TCP segment of a reassembled PDU]"
"342","15.048004","192.168.0.183","104.244.42.65","TCP","1414","50717  >  443 [ACK] Seq=251713 Ack=79914 Win=1037 Len=1360 [TCP segment of a reassembled PDU]"
"343","15.048004","192.168.0.183","104.244.42.65","TCP","1414","50717  >  443 [ACK] Seq=253073 Ack=79914 Win=1037 Len=1360 [TCP segment of a reassembled PDU]"
"344","15.048004","192.168.0.183","104.244.42.65","TCP","1414","50717  >  443 [ACK] Seq=254433 Ack=79914 Win=1037 Len=1360 [TCP segment of a reassembled PDU]"
"345","15.048004","192.168.0.183","104.244.42.65","TCP","1414","50717  >  443 [ACK] Seq=255793 Ack=79914 Win=1037 Len=1360 [TCP segment of a reassembled PDU]"
"346","15.048004","192.168.0.183","104.244.42.65","TCP","1414","50717  >  443 [ACK] Seq=257153 Ack=79914 Win=1037 Len=1360 [TCP segment of a reassembled PDU]"
"347","15.048004","192.168.0.183","104.244.42.65","TCP","1414","50717  >  443 [ACK] Seq=258513 Ack=79914 Win=1037 Len=1360 [TCP segment of a reassembled PDU]"
"348","15.048004","192.168.0.183","104.244.42.65","TLSv1.2","140","Application Data"
"349","15.048340","192.168.0.183","104.244.42.65","TCP","1414","50717  >  443 [ACK] Seq=259959 Ack=79914 Win=1037 Len=1360 [TCP segment of a reassembled PDU]"
"350","15.048340","192.168.0.183","104.244.42.65","TCP","1414","50717  >  443 [ACK] Seq=261319 Ack=79914 Win=1037 Len=1360 [TCP segment of a reassembled PDU]"
"351","15.048340","192.168.0.183","104.244.42.65","TCP","1414","50717  >  443 [ACK] Seq=262679 Ack=79914 Win=1037 Len=1360 [TCP segment of a reassembled PDU]"
"352","15.048340","192.168.0.183","104.244.42.65","TCP","1414","50717  >  443 [ACK] Seq=264039 Ack=79914 Win=1037 Len=1360 [TCP segment of a reassembled PDU]"
"353","15.048340","192.168.0.183","104.244.42.65","TCP","1414","50717  >  443 [ACK] Seq=265399 Ack=79914 Win=1037 Len=1360 [TCP segment of a reassembled PDU]"
"354","15.048340","192.168.0.183","104.244.42.65","TCP","1414","50717  >  443 [ACK] Seq=266759 Ack=79914 Win=1037 Len=1360 [TCP segment of a reassembled PDU]"
"355","15.048340","192.168.0.183","104.244.42.65","TCP","1414","50717  >  443 [ACK] Seq=268119 Ack=79914 Win=1037 Len=1360 [TCP segment of a reassembled PDU]"
"356","15.048340","192.168.0.183","104.244.42.65","TCP","1414","50717  >  443 [ACK] Seq=269479 Ack=79914 Win=1037 Len=1360 [TCP segment of a reassembled PDU]"
"357","15.048340","192.168.0.183","104.244.42.65","TCP","1414","50717  >  443 [ACK] Seq=270839 Ack=79914 Win=1037 Len=1360 [TCP segment of a reassembled PDU]"
"358","15.048340","192.168.0.183","104.244.42.65","TCP","1414","50717  >  443 [ACK] Seq=272199 Ack=79914 Win=1037 Len=1360 [TCP segment of a reassembled PDU]"
"359","15.048340","192.168.0.183","104.244.42.65","TCP","1414","50717  >  443 [ACK] Seq=273559 Ack=79914 Win=1037 Len=1360 [TCP segment of a reassembled PDU]"
"360","15.048340","192.168.0.183","104.244.42.65","TCP","1414","50717  >  443 [ACK] Seq=274919 Ack=79914 Win=1037 Len=1360 [TCP segment of a reassembled PDU]"
"361","15.048340","192.168.0.183","104.244.42.65","TLSv1.2","140","Application Data"
"362","15.048531","192.168.0.183","104.244.42.65","TCP","1414","50717  >  443 [ACK] Seq=276365 Ack=79914 Win=1037 Len=1360 [TCP segment of a reassembled PDU]"
"363","15.048531","192.168.0.183","104.244.42.65","TCP","1414","50717  >  443 [ACK] Seq=277725 Ack=79914 Win=1037 Len=1360 [TCP segment of a reassembled PDU]"
"364","15.048531","192.168.0.183","104.244.42.65","TCP","1414","50717  >  443 [ACK] Seq=279085 Ack=79914 Win=1037 Len=1360 [TCP segment of a reassembled PDU]"
"365","15.048531","192.168.0.183","104.244.42.65","TCP","1414","50717  >  443 [ACK] Seq=280445 Ack=79914 Win=1037 Len=1360 [TCP segment of a reassembled PDU]"
"366","15.048531","192.168.0.183","104.244.42.65","TCP","1414","50717  >  443 [ACK] Seq=281805 Ack=79914 Win=1037 Len=1360 [TCP segment of a reassembled PDU]"
"367","15.048531","192.168.0.183","104.244.42.65","TCP","1414","50717  >  443 [ACK] Seq=283165 Ack=79914 Win=1037 Len=1360 [TCP segment of a reassembled PDU]"
"368","15.048531","192.168.0.183","104.244.42.65","TCP","1414","50717  >  443 [ACK] Seq=284525 Ack=79914 Win=1037 Len=1360 [TCP segment of a reassembled PDU]"
"369","15.048531","192.168.0.183","104.244.42.65","TCP","1414","50717  >  443 [ACK] Seq=285885 Ack=79914 Win=1037 Len=1360 [TCP segment of a reassembled PDU]"
"370","15.048531","192.168.0.183","104.244.42.65","TCP","1414","50717  >  443 [ACK] Seq=287245 Ack=79914 Win=1037 Len=1360 [TCP segment of a reassembled PDU]"
"371","15.048531","192.168.0.183","104.244.42.65","TCP","1414","50717  >  443 [ACK] Seq=288605 Ack=79914 Win=1037 Len=1360 [TCP segment of a reassembled PDU]"
"372","15.048531","192.168.0.183","104.244.42.65","TCP","1414","50717  >  443 [ACK] Seq=289965 Ack=79914 Win=1037 Len=1360 [TCP segment of a reassembled PDU]"
"373","15.048531","192.168.0.183","104.244.42.65","TCP","1414","50717  >  443 [ACK] Seq=291325 Ack=79914 Win=1037 Len=1360 [TCP segment of a reassembled PDU]"
"374","15.048531","192.168.0.183","104.244.42.65","TLSv1.2","140","Application Data"
"375","15.048778","192.168.0.183","104.244.42.65","TLSv1.2","121","Application Data"
"376","15.078866","104.244.42.65","192.168.0.183","TCP","60","443  >  50717 [ACK] Seq=79914 Ack=231227 Win=5724 Len=0"
"377","15.084454","104.244.42.65","192.168.0.183","TCP","60","443  >  50717 [ACK] Seq=79914 Ack=280445 Win=5717 Len=0"
"378","15.088455","104.244.42.65","192.168.0.183","TCP","60","443  >  50717 [ACK] Seq=79914 Ack=292838 Win=5728 Len=0"
"379","15.088455","104.244.42.65","192.168.0.183","TLSv1.2","89","Application Data"
"380","15.088785","192.168.0.183","104.244.42.65","TCP","1414","50717  >  443 [ACK] Seq=292838 Ack=79949 Win=1037 Len=1360 [TCP segment of a reassembled PDU]"
"381","15.088785","192.168.0.183","104.244.42.65","TCP","1414","50717  >  443 [ACK] Seq=294198 Ack=79949 Win=1037 Len=1360 [TCP segment of a reassembled PDU]"
"382","15.088785","192.168.0.183","104.244.42.65","TCP","1414","50717  >  443 [ACK] Seq=295558 Ack=79949 Win=1037 Len=1360 [TCP segment of a reassembled PDU]"
"383","15.088785","192.168.0.183","104.244.42.65","TCP","1414","50717  >  443 [ACK] Seq=296918 Ack=79949 Win=1037 Len=1360 [TCP segment of a reassembled PDU]"
"384","15.088785","192.168.0.183","104.244.42.65","TCP","1414","50717  >  443 [ACK] Seq=298278 Ack=79949 Win=1037 Len=1360 [TCP segment of a reassembled PDU]"
"385","15.088785","192.168.0.183","104.244.42.65","TCP","1414","50717  >  443 [ACK] Seq=299638 Ack=79949 Win=1037 Len=1360 [TCP segment of a reassembled PDU]"
"386","15.088785","192.168.0.183","104.244.42.65","TCP","1414","50717  >  443 [ACK] Seq=300998 Ack=79949 Win=1037 Len=1360 [TCP segment of a reassembled PDU]"
"387","15.088785","192.168.0.183","104.244.42.65","TCP","1414","50717  >  443 [ACK] Seq=302358 Ack=79949 Win=1037 Len=1360 [TCP segment of a reassembled PDU]"
"388","15.088785","192.168.0.183","104.244.42.65","TCP","1414","50717  >  443 [ACK] Seq=303718 Ack=79949 Win=1037 Len=1360 [TCP segment of a reassembled PDU]"
"389","15.088785","192.168.0.183","104.244.42.65","TCP","1414","50717  >  443 [ACK] Seq=305078 Ack=79949 Win=1037 Len=1360 [TCP segment of a reassembled PDU]"
"390","15.088785","192.168.0.183","104.244.42.65","TCP","1414","50717  >  443 [ACK] Seq=306438 Ack=79949 Win=1037 Len=1360 [TCP segment of a reassembled PDU]"
"391","15.088785","192.168.0.183","104.244.42.65","TLSv1.2","523","Application Data"
"392","15.118797","104.244.42.65","192.168.0.183","TCP","60","443  >  50717 [ACK] Seq=79949 Ack=295558 Win=5729 Len=0"
"393","15.126236","104.244.42.65","192.168.0.183","TCP","60","443  >  50717 [ACK] Seq=79949 Ack=308267 Win=5735 Len=0"
"394","15.209808","104.244.42.65","192.168.0.183","TLSv1.2","182","Application Data"
"395","15.254223","192.168.0.183","104.244.42.65","TCP","54","50717  >  443 [ACK] Seq=308267 Ack=80077 Win=1037 Len=0"
"396","16.858397","192.168.0.183","104.244.42.65","TLSv1.2","297","Application Data"
"397","16.858461","192.168.0.183","104.244.42.65","TLSv1.2","168","Application Data"
"398","16.889274","104.244.42.65","192.168.0.183","TCP","60","443  >  50717 [ACK] Seq=80077 Ack=308624 Win=5735 Len=0"
"399","16.954667","104.244.42.65","192.168.0.183","TLSv1.2","353","Application Data"
"400","17.008649","192.168.0.183","104.244.42.65","TCP","54","50717  >  443 [ACK] Seq=308624 Ack=80376 Win=1036 Len=0"
"401","18.091085","192.168.0.183","104.244.42.65","TLSv1.2","237","Application Data"
"402","18.091192","192.168.0.183","104.244.42.65","TCP","1414","50717  >  443 [ACK] Seq=308807 Ack=80376 Win=1036 Len=1360 [TCP segment of a reassembled PDU]"
"403","18.091192","192.168.0.183","104.244.42.65","TCP","1414","50717  >  443 [ACK] Seq=310167 Ack=80376 Win=1036 Len=1360 [TCP segment of a reassembled PDU]"
"404","18.091192","192.168.0.183","104.244.42.65","TCP","1414","50717  >  443 [ACK] Seq=311527 Ack=80376 Win=1036 Len=1360 [TCP segment of a reassembled PDU]"
"405","18.091192","192.168.0.183","104.244.42.65","TCP","1414","50717  >  443 [ACK] Seq=312887 Ack=80376 Win=1036 Len=1360 [TCP segment of a reassembled PDU]"
"406","18.091192","192.168.0.183","104.244.42.65","TLSv1.2","466","Application Data"
"407","18.133141","104.244.42.65","192.168.0.183","TCP","60","443  >  50717 [ACK] Seq=80376 Ack=314659 Win=5720 Len=0"
"408","18.150089","104.244.42.65","192.168.0.183","TLSv1.2","279","Application Data"
"409","18.195348","192.168.0.183","104.244.42.65","TCP","54","50717  >  443 [ACK] Seq=314659 Ack=80601 Win=1041 Len=0"
"410","21.220942","192.168.0.183","104.244.42.65","TLSv1.2","254","Application Data"
"411","21.221073","192.168.0.183","104.244.42.65","TCP","1414","50717  >  443 [ACK] Seq=314859 Ack=80601 Win=1041 Len=1360 [TCP segment of a reassembled PDU]"
"412","21.221073","192.168.0.183","104.244.42.65","TCP","1414","50717  >  443 [ACK] Seq=316219 Ack=80601 Win=1041 Len=1360 [TCP segment of a reassembled PDU]"
"413","21.221073","192.168.0.183","104.244.42.65","TCP","1414","50717  >  443 [ACK] Seq=317579 Ack=80601 Win=1041 Len=1360 [TCP segment of a reassembled PDU]"
"414","21.221073","192.168.0.183","104.244.42.65","TCP","1414","50717  >  443 [ACK] Seq=318939 Ack=80601 Win=1041 Len=1360 [TCP segment of a reassembled PDU]"
"415","21.221073","192.168.0.183","104.244.42.65","TCP","1414","50717  >  443 [ACK] Seq=320299 Ack=80601 Win=1041 Len=1360 [TCP segment of a reassembled PDU]"
"416","21.221073","192.168.0.183","104.244.42.65","TCP","1414","50717  >  443 [ACK] Seq=321659 Ack=80601 Win=1041 Len=1360 [TCP segment of a reassembled PDU]"
"417","21.221073","192.168.0.183","104.244.42.65","TCP","1414","50717  >  443 [ACK] Seq=323019 Ack=80601 Win=1041 Len=1360 [TCP segment of a reassembled PDU]"
"418","21.221073","192.168.0.183","104.244.42.65","TCP","1414","50717  >  443 [ACK] Seq=324379 Ack=80601 Win=1041 Len=1360 [TCP segment of a reassembled PDU]"
"419","21.221073","192.168.0.183","104.244.42.65","TCP","1414","50717  >  443 [ACK] Seq=325739 Ack=80601 Win=1041 Len=1360 [TCP segment of a reassembled PDU]"
"420","21.221073","192.168.0.183","104.244.42.65","TCP","1414","50717  >  443 [ACK] Seq=327099 Ack=80601 Win=1041 Len=1360 [TCP segment of a reassembled PDU]"
"421","21.221073","192.168.0.183","104.244.42.65","TCP","1414","50717  >  443 [ACK] Seq=328459 Ack=80601 Win=1041 Len=1360 [TCP segment of a reassembled PDU]"
"422","21.221073","192.168.0.183","104.244.42.65","TCP","1414","50717  >  443 [ACK] Seq=329819 Ack=80601 Win=1041 Len=1360 [TCP segment of a reassembled PDU]"
"423","21.221073","192.168.0.183","104.244.42.65","TLSv1.2","140","Application Data"
"424","21.221185","192.168.0.183","104.244.42.65","TCP","1414","50717  >  443 [ACK] Seq=331265 Ack=80601 Win=1041 Len=1360 [TCP segment of a reassembled PDU]"
"425","21.221185","192.168.0.183","104.244.42.65","TCP","1414","50717  >  443 [ACK] Seq=332625 Ack=80601 Win=1041 Len=1360 [TCP segment of a reassembled PDU]"
"426","21.221185","192.168.0.183","104.244.42.65","TLSv1.2","477","Application Data"
"427","21.252855","104.244.42.65","192.168.0.183","TCP","60","443  >  50717 [ACK] Seq=80601 Ack=316219 Win=5732 Len=0"
"428","21.257383","104.244.42.65","192.168.0.183","TCP","60","443  >  50717 [ACK] Seq=80601 Ack=334408 Win=5690 Len=0"
"429","21.284849","104.244.42.65","192.168.0.183","TLSv1.2","184","Application Data"
"430","21.337167","192.168.0.183","104.244.42.65","TCP","54","50717  >  443 [ACK] Seq=334408 Ack=80731 Win=1040 Len=0"
"431","24.201394","192.168.0.183","104.244.42.65","TLSv1.2","262","Application Data"
"432","24.201519","192.168.0.183","104.244.42.65","TCP","1414","50717  >  443 [ACK] Seq=334616 Ack=80731 Win=1040 Len=1360 [TCP segment of a reassembled PDU]"
"433","24.201519","192.168.0.183","104.244.42.65","TCP","1414","50717  >  443 [ACK] Seq=335976 Ack=80731 Win=1040 Len=1360 [TCP segment of a reassembled PDU]"
"434","24.201519","192.168.0.183","104.244.42.65","TCP","1414","50717  >  443 [ACK] Seq=337336 Ack=80731 Win=1040 Len=1360 [TCP segment of a reassembled PDU]"
"435","24.201519","192.168.0.183","104.244.42.65","TCP","1414","50717  >  443 [ACK] Seq=338696 Ack=80731 Win=1040 Len=1360 [TCP segment of a reassembled PDU]"
"436","24.201519","192.168.0.183","104.244.42.65","TCP","1414","50717  >  443 [ACK] Seq=340056 Ack=80731 Win=1040 Len=1360 [TCP segment of a reassembled PDU]"
"437","24.201519","192.168.0.183","104.244.42.65","TCP","1414","50717  >  443 [ACK] Seq=341416 Ack=80731 Win=1040 Len=1360 [TCP segment of a reassembled PDU]"
"438","24.201519","192.168.0.183","104.244.42.65","TCP","1414","50717  >  443 [ACK] Seq=342776 Ack=80731 Win=1040 Len=1360 [TCP segment of a reassembled PDU]"
"439","24.201519","192.168.0.183","104.244.42.65","TCP","1414","50717  >  443 [ACK] Seq=344136 Ack=80731 Win=1040 Len=1360 [TCP segment of a reassembled PDU]"
"440","24.201519","192.168.0.183","104.244.42.65","TCP","1414","50717  >  443 [ACK] Seq=345496 Ack=80731 Win=1040 Len=1360 [TCP segment of a reassembled PDU]"
"441","24.201519","192.168.0.183","104.244.42.65","TCP","1414","50717  >  443 [ACK] Seq=346856 Ack=80731 Win=1040 Len=1360 [TCP segment of a reassembled PDU]"
"442","24.201519","192.168.0.183","104.244.42.65","TLSv1.2","483","Application Data"
"443","24.235316","104.244.42.65","192.168.0.183","TCP","60","443  >  50717 [ACK] Seq=80731 Ack=335976 Win=5732 Len=0"
"444","24.236975","104.244.42.65","192.168.0.183","TCP","60","443  >  50717 [ACK] Seq=80731 Ack=348645 Win=5735 Len=0"
"445","24.264714","104.244.42.65","192.168.0.183","TLSv1.2","203","Application Data"
"446","24.312412","192.168.0.183","104.244.42.65","TCP","54","50717  >  443 [ACK] Seq=348645 Ack=80880 Win=1040 Len=0"
"447","27.202360","192.168.0.183","104.244.42.65","TLSv1.2","338","Application Data"
"448","27.202509","192.168.0.183","104.244.42.65","TCP","1414","50717  >  443 [ACK] Seq=348929 Ack=80880 Win=1040 Len=1360 [TCP segment of a reassembled PDU]"
"449","27.202509","192.168.0.183","104.244.42.65","TCP","1414","50717  >  443 [ACK] Seq=350289 Ack=80880 Win=1040 Len=1360 [TCP segment of a reassembled PDU]"
"450","27.202509","192.168.0.183","104.244.42.65","TCP","1414","50717  >  443 [ACK] Seq=351649 Ack=80880 Win=1040 Len=1360 [TCP segment of a reassembled PDU]"
"451","27.202509","192.168.0.183","104.244.42.65","TCP","1414","50717  >  443 [ACK] Seq=353009 Ack=80880 Win=1040 Len=1360 [TCP segment of a reassembled PDU]"
"452","27.202509","192.168.0.183","104.244.42.65","TCP","1414","50717  >  443 [ACK] Seq=354369 Ack=80880 Win=1040 Len=1360 [TCP segment of a reassembled PDU]"
"453","27.202509","192.168.0.183","104.244.42.65","TCP","1414","50717  >  443 [ACK] Seq=355729 Ack=80880 Win=1040 Len=1360 [TCP segment of a reassembled PDU]"
"454","27.202509","192.168.0.183","104.244.42.65","TCP","1414","50717  >  443 [ACK] Seq=357089 Ack=80880 Win=1040 Len=1360 [TCP segment of a reassembled PDU]"
"455","27.202509","192.168.0.183","104.244.42.65","TCP","1414","50717  >  443 [ACK] Seq=358449 Ack=80880 Win=1040 Len=1360 [TCP segment of a reassembled PDU]"
"456","27.202509","192.168.0.183","104.244.42.65","TCP","1414","50717  >  443 [ACK] Seq=359809 Ack=80880 Win=1040 Len=1360 [TCP segment of a reassembled PDU]"
"457","27.202509","192.168.0.183","104.244.42.65","TCP","1414","50717  >  443 [ACK] Seq=361169 Ack=80880 Win=1040 Len=1360 [TCP segment of a reassembled PDU]"
"458","27.202509","192.168.0.183","104.244.42.65","TCP","1414","50717  >  443 [ACK] Seq=362529 Ack=80880 Win=1040 Len=1360 [TCP segment of a reassembled PDU]"
"459","27.202509","192.168.0.183","104.244.42.65","TCP","1414","50717  >  443 [ACK] Seq=363889 Ack=80880 Win=1040 Len=1360 [TCP segment of a reassembled PDU]"
"460","27.202509","192.168.0.183","104.244.42.65","TLSv1.2","140","Application Data"
"461","27.202621","192.168.0.183","104.244.42.65","TCP","1414","50717  >  443 [ACK] Seq=365335 Ack=80880 Win=1040 Len=1360 [TCP segment of a reassembled PDU]"
"462","27.202621","192.168.0.183","104.244.42.65","TLSv1.2","1210","Application Data"
"463","27.231985","104.244.42.65","192.168.0.183","TCP","60","443  >  50717 [ACK] Seq=80880 Ack=350289 Win=5731 Len=0"
"464","27.238438","104.244.42.65","192.168.0.183","TCP","60","443  >  50717 [ACK] Seq=80880 Ack=367851 Win=5703 Len=0"
"465","27.270195","104.244.42.65","192.168.0.183","TLSv1.2","206","Application Data"
"466","27.316475","192.168.0.183","104.244.42.65","TCP","54","50717  >  443 [ACK] Seq=367851 Ack=81032 Win=1039 Len=0"
"467","30.681362","192.168.0.183","104.244.42.65","TLSv1.2","688","Application Data"
"468","30.681495","192.168.0.183","104.244.42.65","TCP","1414","50717  >  443 [ACK] Seq=368485 Ack=81032 Win=1039 Len=1360 [TCP segment of a reassembled PDU]"
"469","30.681495","192.168.0.183","104.244.42.65","TCP","1414","50717  >  443 [ACK] Seq=369845 Ack=81032 Win=1039 Len=1360 [TCP segment of a reassembled PDU]"
"470","30.681495","192.168.0.183","104.244.42.65","TCP","1414","50717  >  443 [ACK] Seq=371205 Ack=81032 Win=1039 Len=1360 [TCP segment of a reassembled PDU]"
"471","30.681495","192.168.0.183","104.244.42.65","TCP","1414","50717  >  443 [ACK] Seq=372565 Ack=81032 Win=1039 Len=1360 [TCP segment of a reassembled PDU]"
"472","30.681495","192.168.0.183","104.244.42.65","TCP","1414","50717  >  443 [ACK] Seq=373925 Ack=81032 Win=1039 Len=1360 [TCP segment of a reassembled PDU]"
"473","30.681495","192.168.0.183","104.244.42.65","TCP","1414","50717  >  443 [ACK] Seq=375285 Ack=81032 Win=1039 Len=1360 [TCP segment of a reassembled PDU]"
"474","30.681495","192.168.0.183","104.244.42.65","TCP","1414","50717  >  443 [ACK] Seq=376645 Ack=81032 Win=1039 Len=1360 [TCP segment of a reassembled PDU]"
"475","30.681495","192.168.0.183","104.244.42.65","TCP","1414","50717  >  443 [ACK] Seq=378005 Ack=81032 Win=1039 Len=1360 [TCP segment of a reassembled PDU]"
"476","30.681495","192.168.0.183","104.244.42.65","TCP","1414","50717  >  443 [ACK] Seq=379365 Ack=81032 Win=1039 Len=1360 [TCP segment of a reassembled PDU]"
"477","30.681495","192.168.0.183","104.244.42.65","TLSv1.2","288","Application Data"
"478","30.714310","104.244.42.65","192.168.0.183","TCP","60","443  >  50717 [ACK] Seq=81032 Ack=369845 Win=5730 Len=0"
"479","30.720182","104.244.42.65","192.168.0.183","TCP","60","443  >  50717 [ACK] Seq=81032 Ack=380959 Win=5735 Len=0"
"480","30.744444","104.244.42.65","192.168.0.183","TLSv1.2","180","Application Data"
"481","30.800199","192.168.0.183","104.244.42.65","TCP","54","50717  >  443 [ACK] Seq=380959 Ack=81158 Win=1039 Len=0"
