"No.","Time","Source","Destination","Protocol","Length","Info"
"1","0.000000","192.168.0.183","104.244.42.65","TLSv1.2","258","Application Data"
"2","0.000091","192.168.0.183","104.244.42.65","TCP","1414","50717  >  443 [ACK] Seq=205 Ack=1 Win=1040 Len=1360 [TCP segment of a reassembled PDU]"
"3","0.000091","192.168.0.183","104.244.42.65","TCP","1414","50717  >  443 [ACK] Seq=1565 Ack=1 Win=1040 Len=1360 [TCP segment of a reassembled PDU]"
"4","0.000091","192.168.0.183","104.244.42.65","TLSv1.2","193","Application Data"
"5","0.029466","104.244.42.65","192.168.0.183","TCP","60","443  >  50717 [ACK] Seq=1 Ack=205 Win=5732 Len=0"
"6","0.036043","104.244.42.65","192.168.0.183","TCP","60","443  >  50717 [ACK] Seq=1 Ack=3064 Win=5727 Len=0"
"7","0.055644","104.244.42.65","192.168.0.183","TLSv1.2","214","Application Data"
"8","0.105837","192.168.0.183","104.244.42.65","TCP","54","50717  >  443 [ACK] Seq=3064 Ack=161 Win=1039 Len=0"
"9","1.214455","192.168.0.183","104.244.42.65","TLSv1.2","815","Application Data"
"10","1.214524","192.168.0.183","104.244.42.65","TLSv1.2","168","Application Data"
"11","1.245346","104.244.42.65","192.168.0.183","TCP","60","443  >  50717 [ACK] Seq=161 Ack=3939 Win=5734 Len=0"
"12","1.317230","104.244.42.65","192.168.0.183","TLSv1.2","302","Application Data"
"13","1.317897","192.168.0.183","104.244.42.65","TLSv1.2","89","Application Data"
"14","1.388399","104.244.42.65","192.168.0.183","TCP","60","443  >  50717 [ACK] Seq=409 Ack=3974 Win=5734 Len=0"
"15","2.999493","192.168.0.183","104.244.42.65","TLSv1.2","300","Application Data"
"16","2.999599","192.168.0.183","104.244.42.65","TCP","1414","50717  >  443 [ACK] Seq=4220 Ack=409 Win=1038 Len=1360 [TCP segment of a reassembled PDU]"
"17","2.999599","192.168.0.183","104.244.42.65","TCP","1414","50717  >  443 [ACK] Seq=5580 Ack=409 Win=1038 Len=1360 [TCP segment of a reassembled PDU]"
"18","2.999599","192.168.0.183","104.244.42.65","TCP","1414","50717  >  443 [ACK] Seq=6940 Ack=409 Win=1038 Len=1360 [TCP segment of a reassembled PDU]"
"19","2.999599","192.168.0.183","104.244.42.65","TCP","1414","50717  >  443 [ACK] Seq=8300 Ack=409 Win=1038 Len=1360 [TCP segment of a reassembled PDU]"
"20","2.999599","192.168.0.183","104.244.42.65","TCP","1414","50717  >  443 [ACK] Seq=9660 Ack=409 Win=1038 Len=1360 [TCP segment of a reassembled PDU]"
"21","2.999599","192.168.0.183","104.244.42.65","TCP","1414","50717  >  443 [ACK] Seq=11020 Ack=409 Win=1038 Len=1360 [TCP segment of a reassembled PDU]"
"22","2.999599","192.168.0.183","104.244.42.65","TCP","1414","50717  >  443 [ACK] Seq=12380 Ack=409 Win=1038 Len=1360 [TCP segment of a reassembled PDU]"
"23","2.999599","192.168.0.183","104.244.42.65","TCP","1414","50717  >  443 [ACK] Seq=13740 Ack=409 Win=1038 Len=1360 [TCP segment of a reassembled PDU]"
"24","2.999599","192.168.0.183","104.244.42.65","TLSv1.2","472","Application Data"
"25","3.036659","104.244.42.65","192.168.0.183","TCP","60","443  >  50717 [ACK] Seq=409 Ack=15518 Win=5723 Len=0"
"26","3.066219","104.244.42.65","192.168.0.183","TLSv1.2","184","Application Data"
"27","3.122495","192.168.0.183","104.244.42.65","TCP","54","50717  >  443 [ACK] Seq=15518 Ack=539 Win=1038 Len=0"
"28","5.485038","192.168.0.183","104.244.42.65","TLSv1.2","247","Application Data"
"29","5.485099","192.168.0.183","104.244.42.65","TLSv1.2","168","Application Data"
"30","5.486616","192.168.0.183","104.244.42.65","TLSv1.2","234","Application Data"
"31","5.486757","192.168.0.183","104.244.42.65","TCP","1414","50717  >  443 [ACK] Seq=16005 Ack=539 Win=1038 Len=1360 [TCP segment of a reassembled PDU]"
"32","5.486757","192.168.0.183","104.244.42.65","TLSv1.2","447","Application Data"
"33","5.515653","104.244.42.65","192.168.0.183","TCP","60","443  >  50717 [ACK] Seq=539 Ack=16005 Win=5735 Len=0"
"34","5.521177","104.244.42.65","192.168.0.183","TCP","60","443  >  50717 [ACK] Seq=539 Ack=17758 Win=5731 Len=0"
"35","5.541761","104.244.42.65","192.168.0.183","TLSv1.2","178","Application Data"
"36","5.583803","192.168.0.183","104.244.42.65","TCP","54","50717  >  443 [ACK] Seq=17758 Ack=663 Win=1037 Len=0"
"37","5.591486","104.244.42.65","192.168.0.183","TLSv1.2","245","Application Data"
"38","5.645765","192.168.0.183","104.244.42.65","TCP","54","50717  >  443 [ACK] Seq=17758 Ack=854 Win=1036 Len=0"
"39","6.040511","192.168.0.183","104.244.42.65","TLSv1.2","234","Application Data"
"40","6.040677","192.168.0.183","104.244.42.65","TLSv1.2","376","Application Data"
"41","6.072867","104.244.42.65","192.168.0.183","TCP","60","443  >  50717 [ACK] Seq=854 Ack=18260 Win=5735 Len=0"
"42","6.094733","104.244.42.65","192.168.0.183","TLSv1.2","275","Application Data"
"43","6.149925","192.168.0.183","104.244.42.65","TCP","54","50717  >  443 [ACK] Seq=18260 Ack=1075 Win=1035 Len=0"
"44","6.613281","192.168.0.183","104.244.42.65","TLSv1.2","1375","Application Data"
"45","6.613394","192.168.0.183","104.244.42.65","TLSv1.2","267","Application Data"
"46","6.671519","104.244.42.65","192.168.0.183","TCP","60","443  >  50717 [ACK] Seq=1075 Ack=19794 Win=5731 Len=0"
"47","6.671519","104.244.42.65","192.168.0.183","TLSv1.2","461","Application Data"
"48","6.672774","192.168.0.183","104.244.42.65","TLSv1.2","89","Application Data"
"49","6.674822","104.244.42.65","192.168.0.183","TLSv1.2","334","Application Data"
"50","6.724967","192.168.0.183","104.244.42.65","TCP","54","50717  >  443 [ACK] Seq=19829 Ack=1762 Win=1040 Len=0"
"51","6.744196","104.244.42.65","192.168.0.183","TCP","60","443  >  50717 [ACK] Seq=1762 Ack=19829 Win=5735 Len=0"
"52","8.469244","192.168.0.183","104.244.42.65","TLSv1.2","259","Application Data"
"53","8.469351","192.168.0.183","104.244.42.65","TCP","1414","50717  >  443 [ACK] Seq=20034 Ack=1762 Win=1040 Len=1360 [TCP segment of a reassembled PDU]"
"54","8.469351","192.168.0.183","104.244.42.65","TCP","1414","50717  >  443 [ACK] Seq=21394 Ack=1762 Win=1040 Len=1360 [TCP segment of a reassembled PDU]"
"55","8.469351","192.168.0.183","104.244.42.65","TCP","1414","50717  >  443 [ACK] Seq=22754 Ack=1762 Win=1040 Len=1360 [TCP segment of a reassembled PDU]"
"56","8.469351","192.168.0.183","104.244.42.65","TCP","1414","50717  >  443 [ACK] Seq=24114 Ack=1762 Win=1040 Len=1360 [TCP segment of a reassembled PDU]"
"57","8.469351","192.168.0.183","104.244.42.65","TCP","1414","50717  >  443 [ACK] Seq=25474 Ack=1762 Win=1040 Len=1360 [TCP segment of a reassembled PDU]"
"58","8.469351","192.168.0.183","104.244.42.65","TLSv1.2","719","Application Data"
"59","8.499690","104.244.42.65","192.168.0.183","TCP","60","443  >  50717 [ACK] Seq=1762 Ack=21394 Win=5731 Len=0"
"60","8.505298","104.244.42.65","192.168.0.183","TCP","60","443  >  50717 [ACK] Seq=1762 Ack=27499 Win=5719 Len=0"
"61","8.534459","104.244.42.65","192.168.0.183","TLSv1.2","225","Application Data"
"62","8.575868","192.168.0.183","104.244.42.65","TCP","54","50717  >  443 [ACK] Seq=27499 Ack=1933 Win=1039 Len=0"
"63","8.762815","192.168.0.183","104.244.42.65","TCP","1414","50717  >  443 [ACK] Seq=27499 Ack=1933 Win=1039 Len=1360 [TCP segment of a reassembled PDU]"
"64","8.762815","192.168.0.183","104.244.42.65","TLSv1.2","959","Application Data"
"65","8.763003","192.168.0.183","104.244.42.65","TLSv1.2","260","Application Data"
"66","8.797601","104.244.42.65","192.168.0.183","TCP","60","443  >  50717 [ACK] Seq=1933 Ack=29970 Win=5728 Len=0"
"67","9.240303","104.244.42.65","192.168.0.183","TLSv1.2","175","Application Data"
"68","9.288859","192.168.0.183","104.244.42.65","TCP","54","50717  >  443 [ACK] Seq=29970 Ack=2054 Win=1039 Len=0"
"69","9.634982","104.244.42.65","192.168.0.183","TCP","1414","443  >  50717 [ACK] Seq=2054 Ack=29970 Win=5735 Len=1360 [TCP segment of a reassembled PDU]"
"70","9.634982","104.244.42.65","192.168.0.183","TCP","1414","443  >  50717 [ACK] Seq=3414 Ack=29970 Win=5735 Len=1360 [TCP segment of a reassembled PDU]"
"71","9.634982","104.244.42.65","192.168.0.183","TCP","1414","443  >  50717 [PSH, ACK] Seq=4774 Ack=29970 Win=5735 Len=1360 [TCP segment of a reassembled PDU]"
"72","9.634982","104.244.42.65","192.168.0.183","TCP","1414","443  >  50717 [ACK] Seq=6134 Ack=29970 Win=5735 Len=1360 [TCP segment of a reassembled PDU]"
"73","9.634982","104.244.42.65","192.168.0.183","TCP","1414","443  >  50717 [ACK] Seq=7494 Ack=29970 Win=5735 Len=1360 [TCP segment of a reassembled PDU]"
"74","9.634982","104.244.42.65","192.168.0.183","TCP","1414","443  >  50717 [PSH, ACK] Seq=8854 Ack=29970 Win=5735 Len=1360 [TCP segment of a reassembled PDU]"
"75","9.634982","104.244.42.65","192.168.0.183","TCP","1414","443  >  50717 [ACK] Seq=10214 Ack=29970 Win=5735 Len=1360 [TCP segment of a reassembled PDU]"
"76","9.634982","104.244.42.65","192.168.0.183","TLSv1.2","1127","Application Data"
"77","9.635079","192.168.0.183","104.244.42.65","TCP","54","50717  >  443 [ACK] Seq=29970 Ack=12647 Win=1041 Len=0"
"78","10.248174","192.168.0.183","104.244.42.65","TLSv1.2","311","Application Data"
"79","10.248226","192.168.0.183","104.244.42.65","TLSv1.2","168","Application Data"
"80","10.291964","104.244.42.65","192.168.0.183","TCP","60","443  >  50717 [ACK] Seq=12647 Ack=30341 Win=5735 Len=0"
"81","10.354335","104.244.42.65","192.168.0.183","TLSv1.2","259","Application Data"
"82","10.401810","192.168.0.183","104.244.42.65","TCP","54","50717  >  443 [ACK] Seq=30341 Ack=12852 Win=1040 Len=0"
"83","11.558435","192.168.0.183","104.244.42.65","TLSv1.2","261","Application Data"
"84","11.558547","192.168.0.183","104.244.42.65","TCP","1414","50717  >  443 [ACK] Seq=30548 Ack=12852 Win=1040 Len=1360 [TCP segment of a reassembled PDU]"
"85","11.558547","192.168.0.183","104.244.42.65","TCP","1414","50717  >  443 [ACK] Seq=31908 Ack=12852 Win=1040 Len=1360 [TCP segment of a reassembled PDU]"
"86","11.558547","192.168.0.183","104.244.42.65","TCP","1414","50717  >  443 [ACK] Seq=33268 Ack=12852 Win=1040 Len=1360 [TCP segment of a reassembled PDU]"
"87","11.558547","192.168.0.183","104.244.42.65","TCP","1414","50717  >  443 [ACK] Seq=34628 Ack=12852 Win=1040 Len=1360 [TCP segment of a reassembled PDU]"
"88","11.558547","192.168.0.183","104.244.42.65","TCP","1414","50717  >  443 [ACK] Seq=35988 Ack=12852 Win=1040 Len=1360 [TCP segment of a reassembled PDU]"
"89","11.558547","192.168.0.183","104.244.42.65","TCP","1414","50717  >  443 [ACK] Seq=37348 Ack=12852 Win=1040 Len=1360 [TCP segment of a reassembled PDU]"
"90","11.558547","192.168.0.183","104.244.42.65","TCP","1414","50717  >  443 [ACK] Seq=38708 Ack=12852 Win=1040 Len=1360 [TCP segment of a reassembled PDU]"
"91","11.558547","192.168.0.183","104.244.42.65","TCP","1414","50717  >  443 [ACK] Seq=40068 Ack=12852 Win=1040 Len=1360 [TCP segment of a reassembled PDU]"
"92","11.558547","192.168.0.183","104.244.42.65","TCP","1414","50717  >  443 [ACK] Seq=41428 Ack=12852 Win=1040 Len=1360 [TCP segment of a reassembled PDU]"
"93","11.558547","192.168.0.183","104.244.42.65","TCP","1414","50717  >  443 [ACK] Seq=42788 Ack=12852 Win=1040 Len=1360 [TCP segment of a reassembled PDU]"
"94","11.558547","192.168.0.183","104.244.42.65","TCP","1414","50717  >  443 [ACK] Seq=44148 Ack=12852 Win=1040 Len=1360 [TCP segment of a reassembled PDU]"
"95","11.558547","192.168.0.183","104.244.42.65","TCP","1414","50717  >  443 [ACK] Seq=45508 Ack=12852 Win=1040 Len=1360 [TCP segment of a reassembled PDU]"
"96","11.558547","192.168.0.183","104.244.42.65","TLSv1.2","140","Application Data"
"97","11.558678","192.168.0.183","104.244.42.65","TCP","1414","50717  >  443 [ACK] Seq=46954 Ack=12852 Win=1040 Len=1360 [TCP segment of a reassembled PDU]"
"98","11.558678","192.168.0.183","104.244.42.65","TCP","1414","50717  >  443 [ACK] Seq=48314 Ack=12852 Win=1040 Len=1360 [TCP segment of a reassembled PDU]"
"99","11.558678","192.168.0.183","104.244.42.65","TCP","1414","50717  >  443 [ACK] Seq=49674 Ack=12852 Win=1040 Len=1360 [TCP segment of a reassembled PDU]"
"100","11.558678","192.168.0.183","104.244.42.65","TCP","1414","50717  >  443 [ACK] Seq=51034 Ack=12852 Win=1040 Len=1360 [TCP segment of a reassembled PDU]"
"101","11.558678","192.168.0.183","104.244.42.65","TCP","1414","50717  >  443 [ACK] Seq=52394 Ack=12852 Win=1040 Len=1360 [TCP segment of a reassembled PDU]"
"102","11.558678","192.168.0.183","104.244.42.65","TCP","1414","50717  >  443 [ACK] Seq=53754 Ack=12852 Win=1040 Len=1360 [TCP segment of a reassembled PDU]"
"103","11.558678","192.168.0.183","104.244.42.65","TCP","1414","50717  >  443 [ACK] Seq=55114 Ack=12852 Win=1040 Len=1360 [TCP segment of a reassembled PDU]"
"104","11.558678","192.168.0.183","104.244.42.65","TCP","1414","50717  >  443 [ACK] Seq=56474 Ack=12852 Win=1040 Len=1360 [TCP segment of a reassembled PDU]"
"105","11.558678","192.168.0.183","104.244.42.65","TCP","1414","50717  >  443 [ACK] Seq=57834 Ack=12852 Win=1040 Len=1360 [TCP segment of a reassembled PDU]"
"106","11.558678","192.168.0.183","104.244.42.65","TCP","1414","50717  >  443 [ACK] Seq=59194 Ack=12852 Win=1040 Len=1360 [TCP segment of a reassembled PDU]"
"107","11.558678","192.168.0.183","104.244.42.65","TCP","1414","50717  >  443 [ACK] Seq=60554 Ack=12852 Win=1040 Len=1360 [TCP segment of a reassembled PDU]"
"108","11.558678","192.168.0.183","104.244.42.65","TCP","1414","50717  >  443 [ACK] Seq=61914 Ack=12852 Win=1040 Len=1360 [TCP segment of a reassembled PDU]"
"109","11.558678","192.168.0.183","104.244.42.65","TLSv1.2","140","Application Data"
"110","11.558797","192.168.0.183","104.244.42.65","TCP","1414","50717  >  443 [ACK] Seq=63360 Ack=12852 Win=1040 Len=1360 [TCP segment of a reassembled PDU]"
"111","11.558797","192.168.0.183","104.244.42.65","TCP","1414","50717  >  443 [ACK] Seq=64720 Ack=12852 Win=1040 Len=1360 [TCP segment of a reassembled PDU]"
"112","11.558797","192.168.0.183","104.244.42.65","TCP","1414","50717  >  443 [ACK] Seq=66080 Ack=12852 Win=1040 Len=1360 [TCP segment of a reassembled PDU]"
"113","11.558797","192.168.0.183","104.244.42.65","TCP","1414","50717  >  443 [ACK] Seq=67440 Ack=12852 Win=1040 Len=1360 [TCP segment of a reassembled PDU]"
"114","11.558797","192.168.0.183","104.244.42.65","TCP","1414","50717  >  443 [ACK] Seq=68800 Ack=12852 Win=1040 Len=1360 [TCP segment of a reassembled PDU]"
"115","11.558797","192.168.0.183","104.244.42.65","TCP","1414","50717  >  443 [ACK] Seq=70160 Ack=12852 Win=1040 Len=1360 [TCP segment of a reassembled PDU]"
"116","11.558797","192.168.0.183","104.244.42.65","TCP","1414","50717  >  443 [ACK] Seq=71520 Ack=12852 Win=1040 Len=1360 [TCP segment of a reassembled PDU]"
"117","11.558797","192.168.0.183","104.244.42.65","TCP","1414","50717  >  443 [ACK] Seq=72880 Ack=12852 Win=1040 Len=1360 [TCP segment of a reassembled PDU]"
"118","11.558797","192.168.0.183","104.244.42.65","TCP","1414","50717  >  443 [ACK] Seq=74240 Ack=12852 Win=1040 Len=1360 [TCP segment of a reassembled PDU]"
"119","11.558797","192.168.0.183","104.244.42.65","TCP","1414","50717  >  443 [ACK] Seq=75600 Ack=12852 Win=1040 Len=1360 [TCP segment of a reassembled PDU]"
"120","11.558797","192.168.0.183","104.244.42.65","TCP","1414","50717  >  443 [ACK] Seq=76960 Ack=12852 Win=1040 Len=1360 [TCP segment of a reassembled PDU]"
"121","11.558797","192.168.0.183","104.244.42.65","TCP","1414","50717  >  443 [ACK] Seq=78320 Ack=12852 Win=1040 Len=1360 [TCP segment of a reassembled PDU]"
"122","11.558797","192.168.0.183","104.244.42.65","TLSv1.2","140","Application Data"
"123","11.559010","192.168.0.183","104.244.42.65","TCP","1414","50717  >  443 [ACK] Seq=79766 Ack=12852 Win=1040 Len=1360 [TCP segment of a reassembled PDU]"
"124","11.559010","192.168.0.183","104.244.42.65","TCP","1414","50717  >  443 [ACK] Seq=81126 Ack=12852 Win=1040 Len=1360 [TCP segment of a reassembled PDU]"
"125","11.559010","192.168.0.183","104.244.42.65","TCP","1414","50717  >  443 [ACK] Seq=82486 Ack=12852 Win=1040 Len=1360 [TCP segment of a reassembled PDU]"
"126","11.559010","192.168.0.183","104.244.42.65","TCP","1414","50717  >  443 [ACK] Seq=83846 Ack=12852 Win=1040 Len=1360 [TCP segment of a reassembled PDU]"
"127","11.559010","192.168.0.183","104.244.42.65","TCP","1414","50717  >  443 [ACK] Seq=85206 Ack=12852 Win=1040 Len=1360 [TCP segment of a reassembled PDU]"
"128","11.559010","192.168.0.183","104.244.42.65","TCP","1414","50717  >  443 [ACK] Seq=86566 Ack=12852 Win=1040 Len=1360 [TCP segment of a reassembled PDU]"
"129","11.559010","192.168.0.183","104.244.42.65","TCP","1414","50717  >  443 [ACK] Seq=87926 Ack=12852 Win=1040 Len=1360 [TCP segment of a reassembled PDU]"
"130","11.559010","192.168.0.183","104.244.42.65","TCP","1414","50717  >  443 [ACK] Seq=89286 Ack=12852 Win=1040 Len=1360 [TCP segment of a reassembled PDU]"
"131","11.559010","192.168.0.183","104.244.42.65","TCP","1414","50717  >  443 [ACK] Seq=90646 Ack=12852 Win=1040 Len=1360 [TCP segment of a reassembled PDU]"
"132","11.559010","192.168.0.183","104.244.42.65","TCP","1414","50717  >  443 [ACK] Seq=92006 Ack=12852 Win=1040 Len=1360 [TCP segment of a reassembled PDU]"
"133","11.559010","192.168.0.183","104.244.42.65","TCP","1414","50717  >  443 [ACK] Seq=93366 Ack=12852 Win=1040 Len=1360 [TCP segment of a reassembled PDU]"
"134","11.559010","192.168.0.183","104.244.42.65","TCP","1414","50717  >  443 [ACK] Seq=94726 Ack=12852 Win=1040 Len=1360 [TCP segment of a reassembled PDU]"
"135","11.559010","192.168.0.183","104.244.42.65","TLSv1.2","140","Application Data"
"136","11.559127","192.168.0.183","104.244.42.65","TLSv1.2","121","Application Data"
"137","11.589578","104.244.42.65","192.168.0.183","TCP","60","443  >  50717 [ACK] Seq=12852 Ack=34628 Win=5735 Len=0"
"138","11.593886","104.244.42.65","192.168.0.183","TCP","60","443  >  50717 [ACK] Seq=12852 Ack=93366 Win=5729 Len=0"
"139","11.593886","104.244.42.65","192.168.0.183","TLSv1.2","89","Application Data"
"140","11.593886","104.244.42.65","192.168.0.183","TCP","60","443  >  50717 [ACK] Seq=12887 Ack=96239 Win=5719 Len=0"
"141","11.594079","192.168.0.183","104.244.42.65","TCP","1414","50717  >  443 [ACK] Seq=96239 Ack=12887 Win=1040 Len=1360 [TCP segment of a reassembled PDU]"
"142","11.594079","192.168.0.183","104.244.42.65","TCP","1414","50717  >  443 [ACK] Seq=97599 Ack=12887 Win=1040 Len=1360 [TCP segment of a reassembled PDU]"
"143","11.594079","192.168.0.183","104.244.42.65","TCP","1414","50717  >  443 [ACK] Seq=98959 Ack=12887 Win=1040 Len=1360 [TCP segment of a reassembled PDU]"
"144","11.594079","192.168.0.183","104.244.42.65","TLSv1.2","1140","Application Data"
"145","11.624763","104.244.42.65","192.168.0.183","TCP","60","443  >  50717 [ACK] Seq=12887 Ack=100319 Win=5725 Len=0"
"146","11.668397","104.244.42.65","192.168.0.183","TCP","60","443  >  50717 [ACK] Seq=12887 Ack=101405 Win=5735 Len=0"
"147","11.698589","104.244.42.65","192.168.0.183","TLSv1.2","180","Application Data"
"148","11.752845","192.168.0.183","104.244.42.65","TCP","54","50717  >  443 [ACK] Seq=101405 Ack=13013 Win=1039 Len=0"
"149","13.867219","192.168.0.183","104.244.42.65","TLSv1.2","678","Application Data"
"150","13.867317","192.168.0.183","104.244.42.65","TLSv1.2","1212","Application Data"
"151","13.897880","104.244.42.65","192.168.0.183","TCP","60","443  >  50717 [ACK] Seq=13013 Ack=103187 Win=5731 Len=0"
"152","13.921082","104.244.42.65","192.168.0.183","TLSv1.2","184","Application Data"
"153","13.961535","192.168.0.183","104.244.42.65","TCP","54","50717  >  443 [ACK] Seq=103187 Ack=13143 Win=1039 Len=0"
"154","14.026415","192.168.0.183","104.244.42.65","TLSv1.2","233","Application Data"
"155","14.026506","192.168.0.183","104.244.42.65","TCP","1414","50717  >  443 [ACK] Seq=103366 Ack=13143 Win=1039 Len=1360 [TCP segment of a reassembled PDU]"
"156","14.026506","192.168.0.183","104.244.42.65","TLSv1.2","1020","Application Data"
"157","14.058134","104.244.42.65","192.168.0.183","TCP","60","443  >  50717 [ACK] Seq=13143 Ack=104726 Win=5732 Len=0"
"158","14.082676","104.244.42.65","192.168.0.183","TLSv1.2","161","Application Data"
"159","14.131131","192.168.0.183","104.244.42.65","TCP","54","50717  >  443 [ACK] Seq=105692 Ack=13250 Win=1038 Len=0"
"160","14.746262","192.168.0.183","104.244.42.65","TCP","1414","50717  >  443 [ACK] Seq=105692 Ack=13250 Win=1038 Len=1360 [TCP segment of a reassembled PDU]"
"161","14.746262","192.168.0.183","104.244.42.65","TLSv1.2","492","Application Data"
"162","14.775121","104.244.42.65","192.168.0.183","TCP","60","443  >  50717 [ACK] Seq=13250 Ack=107490 Win=5731 Len=0"
"163","15.462073","104.244.42.65","192.168.0.183","TCP","1414","443  >  50717 [ACK] Seq=13250 Ack=107490 Win=5735 Len=1360 [TCP segment of a reassembled PDU]"
"164","15.462073","104.244.42.65","192.168.0.183","TCP","1414","443  >  50717 [ACK] Seq=14610 Ack=107490 Win=5735 Len=1360 [TCP segment of a reassembled PDU]"
"165","15.462073","104.244.42.65","192.168.0.183","TCP","1414","443  >  50717 [PSH, ACK] Seq=15970 Ack=107490 Win=5735 Len=1360 [TCP segment of a reassembled PDU]"
"166","15.462073","104.244.42.65","192.168.0.183","TCP","1414","443  >  50717 [ACK] Seq=17330 Ack=107490 Win=5735 Len=1360 [TCP segment of a reassembled PDU]"
"167","15.462073","104.244.42.65","192.168.0.183","TCP","1414","443  >  50717 [ACK] Seq=18690 Ack=107490 Win=5735 Len=1360 [TCP segment of a reassembled PDU]"
"168","15.462073","104.244.42.65","192.168.0.183","TLSv1.2","739","Application Data"
"169","15.462130","192.168.0.183","104.244.42.65","TCP","54","50717  >  443 [ACK] Seq=107490 Ack=20735 Win=1041 Len=0"
"170","15.462920","192.168.0.183","104.244.42.65","TLSv1.2","89","Application Data"
"171","15.536106","104.244.42.65","192.168.0.183","TCP","60","443  >  50717 [ACK] Seq=20735 Ack=107525 Win=5735 Len=0"
"172","17.028340","192.168.0.183","104.244.42.65","TLSv1.2","260","Application Data"
"173","17.028458","192.168.0.183","104.244.42.65","TCP","1414","50717  >  443 [ACK] Seq=107731 Ack=20735 Win=1041 Len=1360 [TCP segment of a reassembled PDU]"
"174","17.028458","192.168.0.183","104.244.42.65","TCP","1414","50717  >  443 [ACK] Seq=109091 Ack=20735 Win=1041 Len=1360 [TCP segment of a reassembled PDU]"
"175","17.028458","192.168.0.183","104.244.42.65","TCP","1414","50717  >  443 [ACK] Seq=110451 Ack=20735 Win=1041 Len=1360 [TCP segment of a reassembled PDU]"
"176","17.028458","192.168.0.183","104.244.42.65","TCP","1414","50717  >  443 [ACK] Seq=111811 Ack=20735 Win=1041 Len=1360 [TCP segment of a reassembled PDU]"
"177","17.028458","192.168.0.183","104.244.42.65","TCP","1414","50717  >  443 [ACK] Seq=113171 Ack=20735 Win=1041 Len=1360 [TCP segment of a reassembled PDU]"
"178","17.028458","192.168.0.183","104.244.42.65","TCP","1414","50717  >  443 [ACK] Seq=114531 Ack=20735 Win=1041 Len=1360 [TCP segment of a reassembled PDU]"
"179","17.028458","192.168.0.183","104.244.42.65","TCP","1414","50717  >  443 [ACK] Seq=115891 Ack=20735 Win=1041 Len=1360 [TCP segment of a reassembled PDU]"
"180","17.028458","192.168.0.183","104.244.42.65","TCP","1414","50717  >  443 [ACK] Seq=117251 Ack=20735 Win=1041 Len=1360 [TCP segment of a reassembled PDU]"
"181","17.028458","192.168.0.183","104.244.42.65","TCP","1414","50717  >  443 [ACK] Seq=118611 Ack=20735 Win=1041 Len=1360 [TCP segment of a reassembled PDU]"
"182","17.028458","192.168.0.183","104.244.42.65","TCP","1414","50717  >  443 [ACK] Seq=119971 Ack=20735 Win=1041 Len=1360 [TCP segment of a reassembled PDU]"
"183","17.028458","192.168.0.183","104.244.42.65","TCP","1414","50717  >  443 [ACK] Seq=121331 Ack=20735 Win=1041 Len=1360 [TCP segment of a reassembled PDU]"
"184","17.028458","192.168.0.183","104.244.42.65","TCP","1414","50717  >  443 [ACK] Seq=122691 Ack=20735 Win=1041 Len=1360 [TCP segment of a reassembled PDU]"
"185","17.028458","192.168.0.183","104.244.42.65","TLSv1.2","140","Application Data"
"186","17.028590","192.168.0.183","104.244.42.65","TCP","1414","50717  >  443 [ACK] Seq=124137 Ack=20735 Win=1041 Len=1360 [TCP segment of a reassembled PDU]"
"187","17.028590","192.168.0.183","104.244.42.65","TCP","1414","50717  >  443 [ACK] Seq=125497 Ack=20735 Win=1041 Len=1360 [TCP segment of a reassembled PDU]"
"188","17.028590","192.168.0.183","104.244.42.65","TCP","1414","50717  >  443 [ACK] Seq=126857 Ack=20735 Win=1041 Len=1360 [TCP segment of a reassembled PDU]"
"189","17.028590","192.168.0.183","104.244.42.65","TCP","1414","50717  >  443 [ACK] Seq=128217 Ack=20735 Win=1041 Len=1360 [TCP segment of a reassembled PDU]"
"190","17.028590","192.168.0.183","104.244.42.65","TCP","1414","50717  >  443 [ACK] Seq=129577 Ack=20735 Win=1041 Len=1360 [TCP segment of a reassembled PDU]"
"191","17.028590","192.168.0.183","104.244.42.65","TCP","1414","50717  >  443 [ACK] Seq=130937 Ack=20735 Win=1041 Len=1360 [TCP segment of a reassembled PDU]"
"192","17.028590","192.168.0.183","104.244.42.65","TCP","1414","50717  >  443 [ACK] Seq=132297 Ack=20735 Win=1041 Len=1360 [TCP segment of a reassembled PDU]"
"193","17.028590","192.168.0.183","104.244.42.65","TCP","1414","50717  >  443 [ACK] Seq=133657 Ack=20735 Win=1041 Len=1360 [TCP segment of a reassembled PDU]"
"194","17.028590","192.168.0.183","104.244.42.65","TCP","1414","50717  >  443 [ACK] Seq=135017 Ack=20735 Win=1041 Len=1360 [TCP segment of a reassembled PDU]"
"195","17.028590","192.168.0.183","104.244.42.65","TCP","1414","50717  >  443 [ACK] Seq=136377 Ack=20735 Win=1041 Len=1360 [TCP segment of a reassembled PDU]"
"196","17.028590","192.168.0.183","104.244.42.65","TCP","1414","50717  >  443 [ACK] Seq=137737 Ack=20735 Win=1041 Len=1360 [TCP segment of a reassembled PDU]"
"197","17.028590","192.168.0.183","104.244.42.65","TCP","1414","50717  >  443 [ACK] Seq=139097 Ack=20735 Win=1041 Len=1360 [TCP segment of a reassembled PDU]"
"198","17.028590","192.168.0.183","104.244.42.65","TLSv1.2","140","Application Data"
"199","17.028716","192.168.0.183","104.244.42.65","TCP","1414","50717  >  443 [ACK] Seq=140543 Ack=20735 Win=1041 Len=1360 [TCP segment of a reassembled PDU]"
"200","17.028716","192.168.0.183","104.244.42.65","TCP","1414","50717  >  443 [ACK] Seq=141903 Ack=20735 Win=1041 Len=1360 [TCP segment of a reassembled PDU]"
"201","17.028716","192.168.0.183","104.244.42.65","TCP","1414","50717  >  443 [ACK] Seq=143263 Ack=20735 Win=1041 Len=1360 [TCP segment of a reassembled PDU]"
"202","17.028716","192.168.0.183","104.244.42.65","TCP","1414","50717  >  443 [ACK] Seq=144623 Ack=20735 Win=1041 Len=1360 [TCP segment of a reassembled PDU]"
"203","17.028716","192.168.0.183","104.244.42.65","TCP","1414","50717  >  443 [ACK] Seq=145983 Ack=20735 Win=1041 Len=1360 [TCP segment of a reassembled PDU]"
"204","17.028716","192.168.0.183","104.244.42.65","TCP","1414","50717  >  443 [ACK] Seq=147343 Ack=20735 Win=1041 Len=1360 [TCP segment of a reassembled PDU]"
"205","17.028716","192.168.0.183","104.244.42.65","TCP","1414","50717  >  443 [ACK] Seq=148703 Ack=20735 Win=1041 Len=1360 [TCP segment of a reassembled PDU]"
"206","17.028716","192.168.0.183","104.244.42.65","TCP","1414","50717  >  443 [ACK] Seq=150063 Ack=20735 Win=1041 Len=1360 [TCP segment of a reassembled PDU]"
"207","17.028716","192.168.0.183","104.244.42.65","TCP","1414","50717  >  443 [ACK] Seq=151423 Ack=20735 Win=1041 Len=1360 [TCP segment of a reassembled PDU]"
"208","17.028716","192.168.0.183","104.244.42.65","TCP","1414","50717  >  443 [ACK] Seq=152783 Ack=20735 Win=1041 Len=1360 [TCP segment of a reassembled PDU]"
"209","17.028716","192.168.0.183","104.244.42.65","TCP","1414","50717  >  443 [ACK] Seq=154143 Ack=20735 Win=1041 Len=1360 [TCP segment of a reassembled PDU]"
"210","17.028716","192.168.0.183","104.244.42.65","TCP","1414","50717  >  443 [ACK] Seq=155503 Ack=20735 Win=1041 Len=1360 [TCP segment of a reassembled PDU]"
"211","17.028716","192.168.0.183","104.244.42.65","TLSv1.2","140","Application Data"
"212","17.028857","192.168.0.183","104.244.42.65","TCP","1414","50717  >  443 [ACK] Seq=156949 Ack=20735 Win=1041 Len=1360 [TCP segment of a reassembled PDU]"
"213","17.028857","192.168.0.183","104.244.42.65","TCP","1414","50717  >  443 [ACK] Seq=158309 Ack=20735 Win=1041 Len=1360 [TCP segment of a reassembled PDU]"
"214","17.028857","192.168.0.183","104.244.42.65","TCP","1414","50717  >  443 [ACK] Seq=159669 Ack=20735 Win=1041 Len=1360 [TCP segment of a reassembled PDU]"
"215","17.028857","192.168.0.183","104.244.42.65","TCP","1414","50717  >  443 [ACK] Seq=161029 Ack=20735 Win=1041 Len=1360 [TCP segment of a reassembled PDU]"
"216","17.028857","192.168.0.183","104.244.42.65","TCP","1414","50717  >  443 [ACK] Seq=162389 Ack=20735 Win=1041 Len=1360 [TCP segment of a reassembled PDU]"
"217","17.028857","192.168.0.183","104.244.42.65","TCP","1414","50717  >  443 [ACK] Seq=163749 Ack=20735 Win=1041 Len=1360 [TCP segment of a reassembled PDU]"
"218","17.028857","192.168.0.183","104.244.42.65","TCP","1414","50717  >  443 [ACK] Seq=165109 Ack=20735 Win=1041 Len=1360 [TCP segment of a reassembled PDU]"
"219","17.028857","192.168.0.183","104.244.42.65","TCP","1414","50717  >  443 [ACK] Seq=166469 Ack=20735 Win=1041 Len=1360 [TCP segment of a reassembled PDU]"
"220","17.028857","192.168.0.183","104.244.42.65","TCP","1414","50717  >  443 [ACK] Seq=167829 Ack=20735 Win=1041 Len=1360 [TCP segment of a reassembled PDU]"
"221","17.028857","192.168.0.183","104.244.42.65","TCP","1414","50717  >  443 [ACK] Seq=169189 Ack=20735 Win=1041 Len=1360 [TCP segment of a reassembled PDU]"
"222","17.028857","192.168.0.183","104.244.42.65","TCP","1414","50717  >  443 [ACK] Seq=170549 Ack=20735 Win=1041 Len=1360 [TCP segment of a reassembled PDU]"
"223","17.028857","192.168.0.183","104.244.42.65","TCP","1414","50717  >  443 [ACK] Seq=171909 Ack=20735 Win=1041 Len=1360 [TCP segment of a reassembled PDU]"
"224","17.028857","192.168.0.183","104.244.42.65","TLSv1.2","140","Application Data"
"225","17.028979","192.168.0.183","104.244.42.65","TLSv1.2","121","Application Data"
"226","17.056617","104.244.42.65","192.168.0.183","TCP","60","443  >  50717 [ACK] Seq=20735 Ack=107731 Win=5735 Len=0"
"227","17.059907","104.244.42.65","192.168.0.183","TCP","60","443  >  50717 [ACK] Seq=20735 Ack=170549 Win=5707 Len=0"
"228","17.059907","104.244.42.65","192.168.0.183","TLSv1.2","89","Application Data"
"229","17.059907","104.244.42.65","192.168.0.183","TCP","60","443  >  50717 [ACK] Seq=20770 Ack=173355 Win=5728 Len=0"
"230","17.060115","192.168.0.183","104.244.42.65","TCP","1414","50717  >  443 [ACK] Seq=173422 Ack=20770 Win=1041 Len=1360 [TCP segment of a reassembled PDU]"
"231","17.060115","192.168.0.183","104.244.42.65","TCP","1414","50717  >  443 [ACK] Seq=174782 Ack=20770 Win=1041 Len=1360 [TCP segment of a reassembled PDU]"
"232","17.060115","192.168.0.183","104.244.42.65","TCP","1414","50717  >  443 [ACK] Seq=176142 Ack=20770 Win=1041 Len=1360 [TCP segment of a reassembled PDU]"
"233","17.060115","192.168.0.183","104.244.42.65","TCP","1414","50717  >  443 [ACK] Seq=177502 Ack=20770 Win=1041 Len=1360 [TCP segment of a reassembled PDU]"
"234","17.060115","192.168.0.183","104.244.42.65","TCP","1414","50717  >  443 [ACK] Seq=178862 Ack=20770 Win=1041 Len=1360 [TCP segment of a reassembled PDU]"
"235","17.060115","192.168.0.183","104.244.42.65","TCP","1414","50717  >  443 [ACK] Seq=180222 Ack=20770 Win=1041 Len=1360 [TCP segment of a reassembled PDU]"
"236","17.060115","192.168.0.183","104.244.42.65","TCP","1414","50717  >  443 [ACK] Seq=181582 Ack=20770 Win=1041 Len=1360 [TCP segment of a reassembled PDU]"
"237","17.060115","192.168.0.183","104.244.42.65","TCP","1414","50717  >  443 [ACK] Seq=182942 Ack=20770 Win=1041 Len=1360 [TCP segment of a reassembled PDU]"
"238","17.060115","192.168.0.183","104.244.42.65","TCP","1414","50717  >  443 [ACK] Seq=184302 Ack=20770 Win=1041 Len=1360 [TCP segment of a reassembled PDU]"
"239","17.060115","192.168.0.183","104.244.42.65","TCP","1414","50717  >  443 [ACK] Seq=185662 Ack=20770 Win=1041 Len=1360 [TCP segment of a reassembled PDU]"
"240","17.060115","192.168.0.183","104.244.42.65","TCP","1414","50717  >  443 [ACK] Seq=187022 Ack=20770 Win=1041 Len=1360 [TCP segment of a reassembled PDU]"
"241","17.060115","192.168.0.183","104.244.42.65","TCP","1414","50717  >  443 [ACK] Seq=188382 Ack=20770 Win=1041 Len=1360 [TCP segment of a reassembled PDU]"
"242","17.060115","192.168.0.183","104.244.42.65","TLSv1.2","104","Application Data"
"243","17.060262","192.168.0.183","104.244.42.65","TCP","1414","50717  >  443 [ACK] Seq=189792 Ack=20770 Win=1041 Len=1360 [TCP segment of a reassembled PDU]"
"244","17.060262","192.168.0.183","104.244.42.65","TCP","1414","50717  >  443 [ACK] Seq=191152 Ack=20770 Win=1041 Len=1360 [TCP segment of a reassembled PDU]"
"245","17.060262","192.168.0.183","104.244.42.65","TCP","1414","50717  >  443 [ACK] Seq=192512 Ack=20770 Win=1041 Len=1360 [TCP segment of a reassembled PDU]"
"246","17.060262","192.168.0.183","104.244.42.65","TCP","1414","50717  >  443 [ACK] Seq=193872 Ack=20770 Win=1041 Len=1360 [TCP segment of a reassembled PDU]"
"247","17.060262","192.168.0.183","104.244.42.65","TCP","1414","50717  >  443 [ACK] Seq=195232 Ack=20770 Win=1041 Len=1360 [TCP segment of a reassembled PDU]"
"248","17.060262","192.168.0.183","104.244.42.65","TLSv1.2","978","Application Data"
"249","17.093513","104.244.42.65","192.168.0.183","TCP","60","443  >  50717 [ACK] Seq=20770 Ack=197516 Win=5730 Len=0"
"250","17.093513","104.244.42.65","192.168.0.183","TLSv1.2","89","Application Data"
"251","17.146752","192.168.0.183","104.244.42.65","TCP","54","50717  >  443 [ACK] Seq=197516 Ack=20805 Win=1040 Len=0"
"252","17.172054","104.244.42.65","192.168.0.183","TLSv1.2","184","Application Data"
"253","17.222820","192.168.0.183","104.244.42.65","TCP","54","50717  >  443 [ACK] Seq=197516 Ack=20935 Win=1040 Len=0"
"254","19.965995","192.168.0.183","104.244.42.65","TLSv1.2","790","Application Data"
"255","20.035741","104.244.42.65","192.168.0.183","TCP","60","443  >  50717 [ACK] Seq=20935 Ack=198252 Win=5735 Len=0"
"256","20.092796","192.168.0.183","104.244.42.65","TLSv1.2","261","Application Data"
"257","20.092880","192.168.0.183","104.244.42.65","TCP","1414","50717  >  443 [ACK] Seq=198459 Ack=20935 Win=1040 Len=1360 [TCP segment of a reassembled PDU]"
"258","20.092880","192.168.0.183","104.244.42.65","TLSv1.2","552","Application Data"
"259","20.095103","192.168.0.183","104.244.42.65","TLSv1.2","297","Application Data"
"260","20.095301","192.168.0.183","104.244.42.65","TCP","1414","50717  >  443 [ACK] Seq=200560 Ack=20935 Win=1040 Len=1360 [TCP segment of a reassembled PDU]"
"261","20.095301","192.168.0.183","104.244.42.65","TCP","1414","50717  >  443 [ACK] Seq=201920 Ack=20935 Win=1040 Len=1360 [TCP segment of a reassembled PDU]"
"262","20.095301","192.168.0.183","104.244.42.65","TCP","1414","50717  >  443 [ACK] Seq=203280 Ack=20935 Win=1040 Len=1360 [TCP segment of a reassembled PDU]"
"263","20.095301","192.168.0.183","104.244.42.65","TCP","1414","50717  >  443 [ACK] Seq=204640 Ack=20935 Win=1040 Len=1360 [TCP segment of a reassembled PDU]"
"264","20.095301","192.168.0.183","104.244.42.65","TCP","1414","50717  >  443 [ACK] Seq=206000 Ack=20935 Win=1040 Len=1360 [TCP segment of a reassembled PDU]"
"265","20.095301","192.168.0.183","104.244.42.65","TCP","1414","50717  >  443 [ACK] Seq=207360 Ack=20935 Win=1040 Len=1360 [TCP segment of a reassembled PDU]"
"266","20.095301","192.168.0.183","104.244.42.65","TCP","1414","50717  >  443 [ACK] Seq=208720 Ack=20935 Win=1040 Len=1360 [TCP segment of a reassembled PDU]"
"267","20.095301","192.168.0.183","104.244.42.65","TCP","1414","50717  >  443 [ACK] Seq=210080 Ack=20935 Win=1040 Len=1360 [TCP segment of a reassembled PDU]"
"268","20.095301","192.168.0.183","104.244.42.65","TCP","1414","50717  >  443 [ACK] Seq=211440 Ack=20935 Win=1040 Len=1360 [TCP segment of a reassembled PDU]"
"269","20.095301","192.168.0.183","104.244.42.65","TCP","1414","50717  >  443 [ACK] Seq=212800 Ack=20935 Win=1040 Len=1360 [TCP segment of a reassembled PDU]"
"270","20.095301","192.168.0.183","104.244.42.65","TCP","1414","50717  >  443 [ACK] Seq=214160 Ack=20935 Win=1040 Len=1360 [TCP segment of a reassembled PDU]"
"271","20.095301","192.168.0.183","104.244.42.65","TCP","1414","50717  >  443 [ACK] Seq=215520 Ack=20935 Win=1040 Len=1360 [TCP segment of a reassembled PDU]"
"272","20.095301","192.168.0.183","104.244.42.65","TLSv1.2","140","Application Data"
"273","20.095437","192.168.0.183","104.244.42.65","TCP","1414","50717  >  443 [ACK] Seq=216966 Ack=20935 Win=1040 Len=1360 [TCP segment of a reassembled PDU]"
"274","20.095437","192.168.0.183","104.244.42.65","TCP","1414","50717  >  443 [ACK] Seq=218326 Ack=20935 Win=1040 Len=1360 [TCP segment of a reassembled PDU]"
"275","20.095437","192.168.0.183","104.244.42.65","TCP","1414","50717  >  443 [ACK] Seq=219686 Ack=20935 Win=1040 Len=1360 [TCP segment of a reassembled PDU]"
"276","20.095437","192.168.0.183","104.244.42.65","TCP","1414","50717  >  443 [ACK] Seq=221046 Ack=20935 Win=1040 Len=1360 [TCP segment of a reassembled PDU]"
"277","20.095437","192.168.0.183","104.244.42.65","TCP","1414","50717  >  443 [ACK] Seq=222406 Ack=20935 Win=1040 Len=1360 [TCP segment of a reassembled PDU]"
"278","20.095437","192.168.0.183","104.244.42.65","TCP","1414","50717  >  443 [ACK] Seq=223766 Ack=20935 Win=1040 Len=1360 [TCP segment of a reassembled PDU]"
"279","20.095437","192.168.0.183","104.244.42.65","TCP","1414","50717  >  443 [ACK] Seq=225126 Ack=20935 Win=1040 Len=1360 [TCP segment of a reassembled PDU]"
"280","20.095437","192.168.0.183","104.244.42.65","TCP","1414","50717  >  443 [ACK] Seq=226486 Ack=20935 Win=1040 Len=1360 [TCP segment of a reassembled PDU]"
"281","20.095437","192.168.0.183","104.244.42.65","TCP","1414","50717  >  443 [ACK] Seq=227846 Ack=20935 Win=1040 Len=1360 [TCP segment of a reassembled PDU]"
"282","20.095437","192.168.0.183","104.244.42.65","TCP","1414","50717  >  443 [ACK] Seq=229206 Ack=20935 Win=1040 Len=1360 [TCP segment of a reassembled PDU]"
"283","20.095437","192.168.0.183","104.244.42.65","TCP","1414","50717  >  443 [ACK] Seq=230566 Ack=20935 Win=1040 Len=1360 [TCP segment of a reassembled PDU]"
"284","20.095437","192.168.0.183","104.244.42.65","TCP","1414","50717  >  443 [ACK] Seq=231926 Ack=20935 Win=1040 Len=1360 [TCP segment of a reassembled PDU]"
"285","20.095437","192.168.0.183","104.244.42.65","TLSv1.2","140","Application Data"
"286","20.095551","192.168.0.183","104.244.42.65","TCP","1414","50717  >  443 [ACK] Seq=233372 Ack=20935 Win=1040 Len=1360 [TCP segment of a reassembled PDU]"
"287","20.095551","192.168.0.183","104.244.42.65","TCP","1414","50717  >  443 [ACK] Seq=234732 Ack=20935 Win=1040 Len=1360 [TCP segment of a reassembled PDU]"
"288","20.095551","192.168.0.183","104.244.42.65","TCP","1414","50717  >  443 [ACK] Seq=236092 Ack=20935 Win=1040 Len=1360 [TCP segment of a reassembled PDU]"
"289","20.095551","192.168.0.183","104.244.42.65","TCP","1414","50717  >  443 [ACK] Seq=237452 Ack=20935 Win=1040 Len=1360 [TCP segment of a reassembled PDU]"
"290","20.095551","192.168.0.183","104.244.42.65","TCP","1414","50717  >  443 [ACK] Seq=238812 Ack=20935 Win=1040 Len=1360 [TCP segment of a reassembled PDU]"
"291","20.095551","192.168.0.183","104.244.42.65","TCP","1414","50717  >  443 [ACK] Seq=240172 Ack=20935 Win=1040 Len=1360 [TCP segment of a reassembled PDU]"
"292","20.095551","192.168.0.183","104.244.42.65","TCP","1414","50717  >  443 [ACK] Seq=241532 Ack=20935 Win=1040 Len=1360 [TCP segment of a reassembled PDU]"
"293","20.095551","192.168.0.183","104.244.42.65","TCP","1414","50717  >  443 [ACK] Seq=242892 Ack=20935 Win=1040 Len=1360 [TCP segment of a reassembled PDU]"
"294","20.095551","192.168.0.183","104.244.42.65","TCP","1414","50717  >  443 [ACK] Seq=244252 Ack=20935 Win=1040 Len=1360 [TCP segment of a reassembled PDU]"
"295","20.095551","192.168.0.183","104.244.42.65","TCP","1414","50717  >  443 [ACK] Seq=245612 Ack=20935 Win=1040 Len=1360 [TCP segment of a reassembled PDU]"
"296","20.095551","192.168.0.183","104.244.42.65","TCP","1414","50717  >  443 [ACK] Seq=246972 Ack=20935 Win=1040 Len=1360 [TCP segment of a reassembled PDU]"
"297","20.095551","192.168.0.183","104.244.42.65","TCP","1414","50717  >  443 [ACK] Seq=248332 Ack=20935 Win=1040 Len=1360 [TCP segment of a reassembled PDU]"
"298","20.095551","192.168.0.183","104.244.42.65","TLSv1.2","140","Application Data"
"299","20.095679","192.168.0.183","104.244.42.65","TCP","1414","50717  >  443 [ACK] Seq=249778 Ack=20935 Win=1040 Len=1360 [TCP segment of a reassembled PDU]"
"300","20.095679","192.168.0.183","104.244.42.65","TCP","1414","50717  >  443 [ACK] Seq=251138 Ack=20935 Win=1040 Len=1360 [TCP segment of a reassembled PDU]"
"301","20.095679","192.168.0.183","104.244.42.65","TCP","1414","50717  >  443 [ACK] Seq=252498 Ack=20935 Win=1040 Len=1360 [TCP segment of a reassembled PDU]"
"302","20.095679","192.168.0.183","104.244.42.65","TCP","1414","50717  >  443 [ACK] Seq=253858 Ack=20935 Win=1040 Len=1360 [TCP segment of a reassembled PDU]"
"303","20.095679","192.168.0.183","104.244.42.65","TCP","1414","50717  >  443 [ACK] Seq=255218 Ack=20935 Win=1040 Len=1360 [TCP segment of a reassembled PDU]"
"304","20.095679","192.168.0.183","104.244.42.65","TCP","1414","50717  >  443 [ACK] Seq=256578 Ack=20935 Win=1040 Len=1360 [TCP segment of a reassembled PDU]"
"305","20.095679","192.168.0.183","104.244.42.65","TCP","1414","50717  >  443 [ACK] Seq=257938 Ack=20935 Win=1040 Len=1360 [TCP segment of a reassembled PDU]"
"306","20.095679","192.168.0.183","104.244.42.65","TLSv1.2","736","Application Data"
"307","20.096147","192.168.0.183","104.244.42.65","TLSv1.2","262","Application Data"
"308","20.096210","192.168.0.183","104.244.42.65","TLSv1.2","667","Application Data"
"309","20.123497","104.244.42.65","192.168.0.183","TCP","60","443  >  50717 [ACK] Seq=20935 Ack=200317 Win=5729 Len=0"
"310","20.129504","104.244.42.65","192.168.0.183","TCP","60","443  >  50717 [ACK] Seq=20935 Ack=238812 Win=5732 Len=0"
"311","20.133164","104.244.42.65","192.168.0.183","TCP","60","443  >  50717 [ACK] Seq=20935 Ack=260801 Win=5735 Len=0"
"312","20.133164","104.244.42.65","192.168.0.183","TLSv1.2","89","Application Data"
"313","20.149505","104.244.42.65","192.168.0.183","TLSv1.2","275","Application Data"
"314","20.149569","192.168.0.183","104.244.42.65","TCP","54","50717  >  443 [ACK] Seq=260801 Ack=21191 Win=1039 Len=0"
"315","20.178335","104.244.42.65","192.168.0.183","TLSv1.2","235","Application Data"
"316","20.221845","192.168.0.183","104.244.42.65","TCP","54","50717  >  443 [ACK] Seq=260801 Ack=21372 Win=1038 Len=0"
"317","20.456156","104.244.42.65","192.168.0.183","TLSv1.2","201","Application Data"
"318","20.502928","192.168.0.183","104.244.42.65","TCP","54","50717  >  443 [ACK] Seq=260801 Ack=21519 Win=1038 Len=0"
"319","20.800000","192.168.0.183","104.244.42.193","TCP","55","50715  >  443 [ACK] Seq=1 Ack=1 Win=260 Len=1 [TCP segment of a reassembled PDU]"
"320","20.829541","104.244.42.193","192.168.0.183","TCP","66","443  >  50715 [ACK] Seq=1 Ack=2 Win=288 Len=0 SLE=1 SRE=2"
"321","21.580546","104.244.42.65","192.168.0.183","TCP","1414","443  >  50717 [ACK] Seq=21519 Ack=260801 Win=5735 Len=1360 [TCP segment of a reassembled PDU]"
"322","21.580546","104.244.42.65","192.168.0.183","TCP","1414","443  >  50717 [ACK] Seq=22879 Ack=260801 Win=5735 Len=1360 [TCP segment of a reassembled PDU]"
"323","21.580546","104.244.42.65","192.168.0.183","TCP","1414","443  >  50717 [PSH, ACK] Seq=24239 Ack=260801 Win=5735 Len=1360 [TCP segment of a reassembled PDU]"
"324","21.580546","104.244.42.65","192.168.0.183","TCP","1414","443  >  50717 [ACK] Seq=25599 Ack=260801 Win=5735 Len=1360 [TCP segment of a reassembled PDU]"
"325","21.580546","104.244.42.65","192.168.0.183","TCP","1414","443  >  50717 [ACK] Seq=26959 Ack=260801 Win=5735 Len=1360 [TCP segment of a reassembled PDU]"
"326","21.580546","104.244.42.65","192.168.0.183","TCP","1414","443  >  50717 [PSH, ACK] Seq=28319 Ack=260801 Win=5735 Len=1360 [TCP segment of a reassembled PDU]"
"327","21.580546","104.244.42.65","192.168.0.183","TCP","1414","443  >  50717 [ACK] Seq=29679 Ack=260801 Win=5735 Len=1360 [TCP segment of a reassembled PDU]"
"328","21.580546","104.244.42.65","192.168.0.183","TCP","1414","443  >  50717 [ACK] Seq=31039 Ack=260801 Win=5735 Len=1360 [TCP segment of a reassembled PDU]"
"329","21.580546","104.244.42.65","192.168.0.183","TCP","1414","443  >  50717 [PSH, ACK] Seq=32399 Ack=260801 Win=5735 Len=1360 [TCP segment of a reassembled PDU]"
"330","21.580546","104.244.42.65","192.168.0.183","TCP","1414","443  >  50717 [ACK] Seq=33759 Ack=260801 Win=5735 Len=1360 [TCP segment of a reassembled PDU]"
"331","21.580546","104.244.42.65","192.168.0.183","TCP","1414","443  >  50717 [ACK] Seq=35119 Ack=260801 Win=5735 Len=1360 [TCP segment of a reassembled PDU]"
"332","21.580546","104.244.42.65","192.168.0.183","TCP","1414","443  >  50717 [PSH, ACK] Seq=36479 Ack=260801 Win=5735 Len=1360 [TCP segment of a reassembled PDU]"
"333","21.580546","104.244.42.65","192.168.0.183","TLSv1.2","1414","Application Data"
"334","21.580546","104.244.42.65","192.168.0.183","TCP","1414","443  >  50717 [ACK] Seq=39199 Ack=260801 Win=5735 Len=1360 [TCP segment of a reassembled PDU]"
"335","21.580546","104.244.42.65","192.168.0.183","TCP","1414","443  >  50717 [PSH, ACK] Seq=40559 Ack=260801 Win=5735 Len=1360 [TCP segment of a reassembled PDU]"
"336","21.580546","104.244.42.65","192.168.0.183","TCP","1414","443  >  50717 [ACK] Seq=41919 Ack=260801 Win=5735 Len=1360 [TCP segment of a reassembled PDU]"
"337","21.580546","104.244.42.65","192.168.0.183","TCP","1414","443  >  50717 [ACK] Seq=43279 Ack=260801 Win=5735 Len=1360 [TCP segment of a reassembled PDU]"
"338","21.580546","104.244.42.65","192.168.0.183","TCP","1414","443  >  50717 [PSH, ACK] Seq=44639 Ack=260801 Win=5735 Len=1360 [TCP segment of a reassembled PDU]"
"339","21.580546","104.244.42.65","192.168.0.183","TCP","1414","443  >  50717 [ACK] Seq=45999 Ack=260801 Win=5735 Len=1360 [TCP segment of a reassembled PDU]"
"340","21.580546","104.244.42.65","192.168.0.183","TCP","1414","443  >  50717 [ACK] Seq=47359 Ack=260801 Win=5735 Len=1360 [TCP segment of a reassembled PDU]"
"341","21.580546","104.244.42.65","192.168.0.183","TCP","1414","443  >  50717 [PSH, ACK] Seq=48719 Ack=260801 Win=5735 Len=1360 [TCP segment of a reassembled PDU]"
"342","21.580546","104.244.42.65","192.168.0.183","TCP","1414","443  >  50717 [ACK] Seq=50079 Ack=260801 Win=5735 Len=1360 [TCP segment of a reassembled PDU]"
"343","21.580546","104.244.42.65","192.168.0.183","TCP","1414","443  >  50717 [ACK] Seq=51439 Ack=260801 Win=5735 Len=1360 [TCP segment of a reassembled PDU]"
"344","21.580546","104.244.42.65","192.168.0.183","TCP","1414","443  >  50717 [PSH, ACK] Seq=52799 Ack=260801 Win=5735 Len=1360 [TCP segment of a reassembled PDU]"
"345","21.580546","104.244.42.65","192.168.0.183","TLSv1.2","1414","Application Data"
"346","21.580546","104.244.42.65","192.168.0.183","TCP","1414","443  >  50717 [ACK] Seq=55519 Ack=260801 Win=5735 Len=1360 [TCP segment of a reassembled PDU]"
"347","21.580546","104.244.42.65","192.168.0.183","TCP","1414","443  >  50717 [PSH, ACK] Seq=56879 Ack=260801 Win=5735 Len=1360 [TCP segment of a reassembled PDU]"
"348","21.580546","104.244.42.65","192.168.0.183","TCP","1414","443  >  50717 [ACK] Seq=58239 Ack=260801 Win=5735 Len=1360 [TCP segment of a reassembled PDU]"
"349","21.580546","104.244.42.65","192.168.0.183","TCP","1414","443  >  50717 [ACK] Seq=59599 Ack=260801 Win=5735 Len=1360 [TCP segment of a reassembled PDU]"
"350","21.580546","104.244.42.65","192.168.0.183","TLSv1.2","902","Application Data"
"351","21.580770","192.168.0.183","104.244.42.65","TCP","54","50717  >  443 [ACK] Seq=260801 Ack=61807 Win=1041 Len=0"
"352","21.581851","192.168.0.183","104.244.42.65","TLSv1.2","89","Application Data"
"353","21.661352","104.244.42.65","192.168.0.183","TCP","60","443  >  50717 [ACK] Seq=61807 Ack=260836 Win=5735 Len=0"
"354","23.064363","192.168.0.183","104.244.42.65","TLSv1.2","695","Application Data"
"355","23.064439","192.168.0.183","104.244.42.65","TLSv1.2","168","Application Data"
"356","23.086263","192.168.0.183","104.244.42.65","TLSv1.2","234","Application Data"
"357","23.086472","192.168.0.183","104.244.42.65","TCP","1414","50717  >  443 [ACK] Seq=261771 Ack=61807 Win=1041 Len=1360 [TCP segment of a reassembled PDU]"
"358","23.086472","192.168.0.183","104.244.42.65","TCP","1414","50717  >  443 [ACK] Seq=263131 Ack=61807 Win=1041 Len=1360 [TCP segment of a reassembled PDU]"
"359","23.086472","192.168.0.183","104.244.42.65","TCP","1414","50717  >  443 [ACK] Seq=264491 Ack=61807 Win=1041 Len=1360 [TCP segment of a reassembled PDU]"
"360","23.086472","192.168.0.183","104.244.42.65","TCP","1414","50717  >  443 [ACK] Seq=265851 Ack=61807 Win=1041 Len=1360 [TCP segment of a reassembled PDU]"
"361","23.086472","192.168.0.183","104.244.42.65","TCP","1414","50717  >  443 [ACK] Seq=267211 Ack=61807 Win=1041 Len=1360 [TCP segment of a reassembled PDU]"
"362","23.086472","192.168.0.183","104.244.42.65","TLSv1.2","966","Application Data"
"363","23.092982","104.244.42.65","192.168.0.183","TCP","60","443  >  50717 [ACK] Seq=61807 Ack=261477 Win=5734 Len=0"
"364","23.095255","104.244.42.65","192.168.0.183","TCP","60","443  >  50717 [ACK] Seq=61807 Ack=261591 Win=5735 Len=0"
"365","23.124206","104.244.42.65","192.168.0.183","TCP","60","443  >  50717 [ACK] Seq=61807 Ack=263131 Win=5732 Len=0"
"366","23.124206","104.244.42.65","192.168.0.183","TCP","60","443  >  50717 [ACK] Seq=61807 Ack=269483 Win=5733 Len=0"
"367","23.156996","104.244.42.65","192.168.0.183","TLSv1.2","214","Application Data"
"368","23.170818","104.244.42.65","192.168.0.183","TLSv1.2","220","Application Data"
"369","23.170879","192.168.0.183","104.244.42.65","TCP","54","50717  >  443 [ACK] Seq=269483 Ack=62133 Win=1039 Len=0"
"370","26.088183","192.168.0.183","104.244.42.65","TLSv1.2","237","Application Data"
"371","26.088369","192.168.0.183","104.244.42.65","TCP","1414","50717  >  443 [ACK] Seq=269666 Ack=62133 Win=1039 Len=1360 [TCP segment of a reassembled PDU]"
"372","26.088369","192.168.0.183","104.244.42.65","TCP","1414","50717  >  443 [ACK] Seq=271026 Ack=62133 Win=1039 Len=1360 [TCP segment of a reassembled PDU]"
"373","26.088369","192.168.0.183","104.244.42.65","TCP","1414","50717  >  443 [ACK] Seq=272386 Ack=62133 Win=1039 Len=1360 [TCP segment of a reassembled PDU]"
"374","26.088369","192.168.0.183","104.244.42.65","TCP","1414","50717  >  443 [ACK] Seq=273746 Ack=62133 Win=1039 Len=1360 [TCP segment of a reassembled PDU]"
"375","26.088369","192.168.0.183","104.244.42.65","TCP","1414","50717  >  443 [ACK] Seq=275106 Ack=62133 Win=1039 Len=1360 [TCP segment of a reassembled PDU]"
"376","26.088369","192.168.0.183","104.244.42.65","TCP","1414","50717  >  443 [ACK] Seq=276466 Ack=62133 Win=1039 Len=1360 [TCP segment of a reassembled PDU]"
"377","26.088369","192.168.0.183","104.244.42.65","TCP","1414","50717  >  443 [ACK] Seq=277826 Ack=62133 Win=1039 Len=1360 [TCP segment of a reassembled PDU]"
"378","26.088369","192.168.0.183","104.244.42.65","TCP","1414","50717  >  443 [ACK] Seq=279186 Ack=62133 Win=1039 Len=1360 [TCP segment of a reassembled PDU]"
"379","26.088369","192.168.0.183","104.244.42.65","TCP","1414","50717  >  443 [ACK] Seq=280546 Ack=62133 Win=1039 Len=1360 [TCP segment of a reassembled PDU]"
"380","26.088369","192.168.0.183","104.244.42.65","TCP","1414","50717  >  443 [ACK] Seq=281906 Ack=62133 Win=1039 Len=1360 [TCP segment of a reassembled PDU]"
"381","26.088369","192.168.0.183","104.244.42.65","TCP","1414","50717  >  443 [ACK] Seq=283266 Ack=62133 Win=1039 Len=1360 [TCP segment of a reassembled PDU]"
"382","26.088369","192.168.0.183","104.244.42.65","TLSv1.2","356","Application Data"
"383","26.121151","104.244.42.65","192.168.0.183","TCP","60","443  >  50717 [ACK] Seq=62133 Ack=271026 Win=5732 Len=0"
"384","26.123988","104.244.42.65","192.168.0.183","TCP","60","443  >  50717 [ACK] Seq=62133 Ack=284928 Win=5735 Len=0"
"385","26.154950","104.244.42.65","192.168.0.183","TLSv1.2","184","Application Data"
"386","26.200857","192.168.0.183","104.244.42.65","TCP","54","50717  >  443 [ACK] Seq=284928 Ack=62263 Win=1039 Len=0"
"387","27.024513","192.168.0.183","104.244.42.65","TCP","1414","50717  >  443 [ACK] Seq=284928 Ack=62263 Win=1039 Len=1360 [TCP segment of a reassembled PDU]"
"388","27.024513","192.168.0.183","104.244.42.65","TLSv1.2","270","Application Data"
"389","27.058133","104.244.42.65","192.168.0.183","TCP","60","443  >  50717 [ACK] Seq=62263 Ack=286504 Win=5731 Len=0"
"390","28.080624","104.244.42.65","192.168.0.183","TCP","1414","443  >  50717 [ACK] Seq=62263 Ack=286504 Win=5735 Len=1360 [TCP segment of a reassembled PDU]"
"391","28.080624","104.244.42.65","192.168.0.183","TCP","1414","443  >  50717 [ACK] Seq=63623 Ack=286504 Win=5735 Len=1360 [TCP segment of a reassembled PDU]"
"392","28.080624","104.244.42.65","192.168.0.183","TCP","1414","443  >  50717 [PSH, ACK] Seq=64983 Ack=286504 Win=5735 Len=1360 [TCP segment of a reassembled PDU]"
"393","28.080624","104.244.42.65","192.168.0.183","TCP","1414","443  >  50717 [ACK] Seq=66343 Ack=286504 Win=5735 Len=1360 [TCP segment of a reassembled PDU]"
"394","28.080624","104.244.42.65","192.168.0.183","TCP","1414","443  >  50717 [ACK] Seq=67703 Ack=286504 Win=5735 Len=1360 [TCP segment of a reassembled PDU]"
"395","28.080624","104.244.42.65","192.168.0.183","TCP","1414","443  >  50717 [PSH, ACK] Seq=69063 Ack=286504 Win=5735 Len=1360 [TCP segment of a reassembled PDU]"
"396","28.080624","104.244.42.65","192.168.0.183","TLSv1.2","755","Application Data"
"397","28.080699","192.168.0.183","104.244.42.65","TCP","54","50717  >  443 [ACK] Seq=286504 Ack=71124 Win=1041 Len=0"
"398","28.082436","192.168.0.183","104.244.42.65","TLSv1.2","89","Application Data"
"399","28.153913","104.244.42.65","192.168.0.183","TCP","60","443  >  50717 [ACK] Seq=71124 Ack=286539 Win=5735 Len=0"
"400","29.250102","192.168.0.183","104.244.42.65","TLSv1.2","787","Application Data"
"401","29.250322","192.168.0.183","104.244.42.65","TCP","1414","50717  >  443 [ACK] Seq=287272 Ack=71124 Win=1041 Len=1360 [TCP segment of a reassembled PDU]"
"402","29.250322","192.168.0.183","104.244.42.65","TCP","1414","50717  >  443 [ACK] Seq=288632 Ack=71124 Win=1041 Len=1360 [TCP segment of a reassembled PDU]"
"403","29.250322","192.168.0.183","104.244.42.65","TCP","1414","50717  >  443 [ACK] Seq=289992 Ack=71124 Win=1041 Len=1360 [TCP segment of a reassembled PDU]"
"404","29.250322","192.168.0.183","104.244.42.65","TCP","1414","50717  >  443 [ACK] Seq=291352 Ack=71124 Win=1041 Len=1360 [TCP segment of a reassembled PDU]"
"405","29.250322","192.168.0.183","104.244.42.65","TCP","1414","50717  >  443 [ACK] Seq=292712 Ack=71124 Win=1041 Len=1360 [TCP segment of a reassembled PDU]"
"406","29.250322","192.168.0.183","104.244.42.65","TCP","1414","50717  >  443 [ACK] Seq=294072 Ack=71124 Win=1041 Len=1360 [TCP segment of a reassembled PDU]"
"407","29.250322","192.168.0.183","104.244.42.65","TCP","1414","50717  >  443 [ACK] Seq=295432 Ack=71124 Win=1041 Len=1360 [TCP segment of a reassembled PDU]"
"408","29.250322","192.168.0.183","104.244.42.65","TCP","1414","50717  >  443 [ACK] Seq=296792 Ack=71124 Win=1041 Len=1360 [TCP segment of a reassembled PDU]"
"409","29.250322","192.168.0.183","104.244.42.65","TCP","1414","50717  >  443 [ACK] Seq=298152 Ack=71124 Win=1041 Len=1360 [TCP segment of a reassembled PDU]"
"410","29.250322","192.168.0.183","104.244.42.65","TCP","1414","50717  >  443 [ACK] Seq=299512 Ack=71124 Win=1041 Len=1360 [TCP segment of a reassembled PDU]"
"411","29.250322","192.168.0.183","104.244.42.65","TCP","1414","50717  >  443 [ACK] Seq=300872 Ack=71124 Win=1041 Len=1360 [TCP segment of a reassembled PDU]"
"412","29.250322","192.168.0.183","104.244.42.65","TCP","1414","50717  >  443 [ACK] Seq=302232 Ack=71124 Win=1041 Len=1360 [TCP segment of a reassembled PDU]"
"413","29.250322","192.168.0.183","104.244.42.65","TLSv1.2","140","Application Data"
"414","29.250548","192.168.0.183","104.244.42.65","TCP","1414","50717  >  443 [ACK] Seq=303678 Ack=71124 Win=1041 Len=1360 [TCP segment of a reassembled PDU]"
"415","29.250548","192.168.0.183","104.244.42.65","TCP","1414","50717  >  443 [ACK] Seq=305038 Ack=71124 Win=1041 Len=1360 [TCP segment of a reassembled PDU]"
"416","29.250548","192.168.0.183","104.244.42.65","TCP","1414","50717  >  443 [ACK] Seq=306398 Ack=71124 Win=1041 Len=1360 [TCP segment of a reassembled PDU]"
"417","29.250548","192.168.0.183","104.244.42.65","TCP","1414","50717  >  443 [ACK] Seq=307758 Ack=71124 Win=1041 Len=1360 [TCP segment of a reassembled PDU]"
"418","29.250548","192.168.0.183","104.244.42.65","TCP","1414","50717  >  443 [ACK] Seq=309118 Ack=71124 Win=1041 Len=1360 [TCP segment of a reassembled PDU]"
"419","29.250548","192.168.0.183","104.244.42.65","TCP","1414","50717  >  443 [ACK] Seq=310478 Ack=71124 Win=1041 Len=1360 [TCP segment of a reassembled PDU]"
"420","29.250548","192.168.0.183","104.244.42.65","TCP","1414","50717  >  443 [ACK] Seq=311838 Ack=71124 Win=1041 Len=1360 [TCP segment of a reassembled PDU]"
"421","29.250548","192.168.0.183","104.244.42.65","TCP","1414","50717  >  443 [ACK] Seq=313198 Ack=71124 Win=1041 Len=1360 [TCP segment of a reassembled PDU]"
"422","29.250548","192.168.0.183","104.244.42.65","TCP","1414","50717  >  443 [ACK] Seq=314558 Ack=71124 Win=1041 Len=1360 [TCP segment of a reassembled PDU]"
"423","29.250548","192.168.0.183","104.244.42.65","TCP","1414","50717  >  443 [ACK] Seq=315918 Ack=71124 Win=1041 Len=1360 [TCP segment of a reassembled PDU]"
"424","29.250548","192.168.0.183","104.244.42.65","TCP","1414","50717  >  443 [ACK] Seq=317278 Ack=71124 Win=1041 Len=1360 [TCP segment of a reassembled PDU]"
"425","29.250548","192.168.0.183","104.244.42.65","TCP","1414","50717  >  443 [ACK] Seq=318638 Ack=71124 Win=1041 Len=1360 [TCP segment of a reassembled PDU]"
"426","29.250548","192.168.0.183","104.244.42.65","TLSv1.2","140","Application Data"
"427","29.250665","192.168.0.183","104.244.42.65","TCP","1414","50717  >  443 [ACK] Seq=320084 Ack=71124 Win=1041 Len=1360 [TCP segment of a reassembled PDU]"
"428","29.250665","192.168.0.183","104.244.42.65","TCP","1414","50717  >  443 [ACK] Seq=321444 Ack=71124 Win=1041 Len=1360 [TCP segment of a reassembled PDU]"
"429","29.250665","192.168.0.183","104.244.42.65","TCP","1414","50717  >  443 [ACK] Seq=322804 Ack=71124 Win=1041 Len=1360 [TCP segment of a reassembled PDU]"
"430","29.250665","192.168.0.183","104.244.42.65","TCP","1414","50717  >  443 [ACK] Seq=324164 Ack=71124 Win=1041 Len=1360 [TCP segment of a reassembled PDU]"
"431","29.250665","192.168.0.183","104.244.42.65","TCP","1414","50717  >  443 [ACK] Seq=325524 Ack=71124 Win=1041 Len=1360 [TCP segment of a reassembled PDU]"
"432","29.250665","192.168.0.183","104.244.42.65","TCP","1414","50717  >  443 [ACK] Seq=326884 Ack=71124 Win=1041 Len=1360 [TCP segment of a reassembled PDU]"
"433","29.250665","192.168.0.183","104.244.42.65","TCP","1414","50717  >  443 [ACK] Seq=328244 Ack=71124 Win=1041 Len=1360 [TCP segment of a reassembled PDU]"
"434","29.250665","192.168.0.183","104.244.42.65","TCP","1414","50717  >  443 [ACK] Seq=329604 Ack=71124 Win=1041 Len=1360 [TCP segment of a reassembled PDU]"
"435","29.250665","192.168.0.183","104.244.42.65","TLSv1.2","1093","Application Data"
"436","29.282967","104.244.42.65","192.168.0.183","TCP","60","443  >  50717 [ACK] Seq=71124 Ack=332003 Win=5722 Len=0"
"437","29.282967","104.244.42.65","192.168.0.183","TLSv1.2","89","Application Data"
"438","29.325807","192.168.0.183","104.244.42.65","TCP","54","50717  >  443 [ACK] Seq=332003 Ack=71159 Win=1041 Len=0"
"439","29.330271","104.244.42.65","192.168.0.183","TLSv1.2","178","Application Data"
"440","29.371915","192.168.0.183","104.244.42.65","TCP","54","50717  >  443 [ACK] Seq=332003 Ack=71283 Win=1040 Len=0"
"441","31.031789","192.168.0.183","104.244.42.65","TLSv1.2","320","Application Data"
"442","31.031879","192.168.0.183","104.244.42.65","TLSv1.2","168","Application Data"
"443","31.061455","104.244.42.65","192.168.0.183","TCP","60","443  >  50717 [ACK] Seq=71283 Ack=332383 Win=5735 Len=0"
"444","31.139461","104.244.42.65","192.168.0.183","TLSv1.2","298","Application Data"
"445","31.187743","192.168.0.183","104.244.42.65","TCP","54","50717  >  443 [ACK] Seq=332383 Ack=71527 Win=1039 Len=0"
"446","32.374769","192.168.0.183","104.244.42.65","TLSv1.2","261","Application Data"
"447","32.374865","192.168.0.183","104.244.42.65","TCP","1414","50717  >  443 [ACK] Seq=332590 Ack=71527 Win=1039 Len=1360 [TCP segment of a reassembled PDU]"
"448","32.374865","192.168.0.183","104.244.42.65","TCP","1414","50717  >  443 [ACK] Seq=333950 Ack=71527 Win=1039 Len=1360 [TCP segment of a reassembled PDU]"
"449","32.374865","192.168.0.183","104.244.42.65","TCP","1414","50717  >  443 [ACK] Seq=335310 Ack=71527 Win=1039 Len=1360 [TCP segment of a reassembled PDU]"
"450","32.374865","192.168.0.183","104.244.42.65","TLSv1.2","860","Application Data"
"451","32.405868","104.244.42.65","192.168.0.183","TCP","60","443  >  50717 [ACK] Seq=71527 Ack=333950 Win=5731 Len=0"
"452","32.411793","104.244.42.65","192.168.0.183","TCP","60","443  >  50717 [ACK] Seq=71527 Ack=337476 Win=5735 Len=0"
"453","32.434991","104.244.42.65","192.168.0.183","TLSv1.2","370","Application Data"
"454","32.477960","192.168.0.183","104.244.42.65","TCP","54","50717  >  443 [ACK] Seq=337476 Ack=71843 Win=1038 Len=0"
"455","34.455067","192.168.0.183","104.244.42.65","TLSv1.2","680","Application Data"
"456","34.455257","192.168.0.183","104.244.42.65","TLSv1.2","966","Application Data"
"457","34.485864","104.244.42.65","192.168.0.183","TCP","60","443  >  50717 [ACK] Seq=71843 Ack=339014 Win=5731 Len=0"
