"No.","Time","Source","Destination","Protocol","Length","Info"
"1","0.000000","192.168.0.183","104.244.42.193","TLSv1.2","150","Application Data"
"2","0.000079","192.168.0.183","104.244.42.193","TLSv1.2","93","Application Data"
"3","0.039961","104.244.42.193","192.168.0.183","TCP","56","443  >  50715 [ACK] Seq=1 Ack=136 Win=288 Len=0"
"4","0.039961","104.244.42.193","192.168.0.183","TLSv1.2","93","Application Data"
"5","0.054775","104.244.42.193","192.168.0.183","TCP","1414","443  >  50715 [ACK] Seq=40 Ack=136 Win=288 Len=1360 [TCP segment of a reassembled PDU]"
"6","0.054775","104.244.42.193","192.168.0.183","TCP","1414","443  >  50715 [PSH, ACK] Seq=1400 Ack=136 Win=288 Len=1360 [TCP segment of a reassembled PDU]"
"7","0.054775","104.244.42.193","192.168.0.183","TLSv1.2","597","Application Data"
"8","0.054819","192.168.0.183","104.244.42.193","TCP","54","50715  >  443 [ACK] Seq=136 Ack=3303 Win=260 Len=0"
"9","0.058104","192.168.0.183","104.244.42.193","TLSv1.2","89","Application Data"
"10","0.133747","104.244.42.193","192.168.0.183","TCP","60","443  >  50715 [ACK] Seq=3303 Ack=171 Win=288 Len=0"
"11","1.344384","192.168.0.183","104.244.42.193","TLSv1.2","112","Application Data"
"12","1.375251","104.244.42.193","192.168.0.183","TCP","60","443  >  50715 [ACK] Seq=3303 Ack=229 Win=288 Len=0"
"13","1.393119","104.244.42.193","192.168.0.183","TCP","1414","443  >  50715 [ACK] Seq=3303 Ack=229 Win=288 Len=1360 [TCP segment of a reassembled PDU]"
"14","1.393119","104.244.42.193","192.168.0.183","TCP","1414","443  >  50715 [PSH, ACK] Seq=4663 Ack=229 Win=288 Len=1360 [TCP segment of a reassembled PDU]"
"15","1.393119","104.244.42.193","192.168.0.183","TLSv1.2","595","Application Data"
"16","1.393166","192.168.0.183","104.244.42.193","TCP","54","50715  >  443 [ACK] Seq=229 Ack=6564 Win=260 Len=0"
"17","1.403765","192.168.0.183","104.244.42.65","TLSv1.2","294","Application Data"
"18","1.487712","104.244.42.65","192.168.0.183","TCP","60","443  >  50717 [ACK] Seq=1 Ack=241 Win=989 Len=0"
"19","1.507274","104.244.42.65","192.168.0.183","TCP","1414","443  >  50717 [ACK] Seq=1 Ack=241 Win=989 Len=1360 [TCP segment of a reassembled PDU]"
"20","1.507274","104.244.42.65","192.168.0.183","TCP","1414","443  >  50717 [ACK] Seq=1361 Ack=241 Win=989 Len=1360 [TCP segment of a reassembled PDU]"
"21","1.507274","104.244.42.65","192.168.0.183","TLSv1.2","1100","Application Data"
"22","1.507274","104.244.42.65","192.168.0.183","TLSv1.2","179","Application Data"
"23","1.507274","104.244.42.65","192.168.0.183","TLSv1.2","99","Application Data"
"24","1.507274","104.244.42.65","192.168.0.183","TLSv1.2","99","Application Data"
"25","1.507274","104.244.42.65","192.168.0.183","TLSv1.2","128","Application Data"
"26","1.507274","104.244.42.65","192.168.0.183","TLSv1.2","241","Application Data"
"27","1.507274","104.244.42.65","192.168.0.183","TLSv1.2","143","Application Data"
"28","1.507274","104.244.42.65","192.168.0.183","TLSv1.2","433","Application Data"
"29","1.507274","104.244.42.65","192.168.0.183","TLSv1.2","142","Application Data"
"30","1.507274","104.244.42.65","192.168.0.183","TLSv1.2","219","Application Data"
"31","1.507274","104.244.42.65","192.168.0.183","TLSv1.2","152","Application Data"
"32","1.507274","104.244.42.65","192.168.0.183","TLSv1.2","199","Application Data"
"33","1.507274","104.244.42.65","192.168.0.183","TLSv1.2","310","Application Data"
"34","1.507274","104.244.42.65","192.168.0.183","TLSv1.2","379","Application Data"
"35","1.507352","192.168.0.183","104.244.42.65","TCP","54","50717  >  443 [ACK] Seq=241 Ack=5788 Win=520 Len=0"
"36","1.508653","192.168.0.183","104.244.42.65","TLSv1.2","89","Application Data"
"37","1.537862","104.244.42.65","192.168.0.183","TCP","60","443  >  50717 [ACK] Seq=5788 Ack=276 Win=989 Len=0"
"38","1.564380","104.244.42.65","192.168.0.183","TLSv1.2","343","Application Data"
"39","1.564380","104.244.42.65","192.168.0.183","TCP","1414","443  >  50717 [ACK] Seq=6077 Ack=276 Win=989 Len=1360 [TCP segment of a reassembled PDU]"
"40","1.564380","104.244.42.65","192.168.0.183","TCP","1414","443  >  50717 [ACK] Seq=7437 Ack=276 Win=989 Len=1360 [TCP segment of a reassembled PDU]"
"41","1.564380","104.244.42.65","192.168.0.183","TLSv1.2","901","Application Data"
"42","1.564380","104.244.42.65","192.168.0.183","TLSv1.2","130","Application Data"
"43","1.564380","104.244.42.65","192.168.0.183","TLSv1.2","382","Application Data"
"44","1.564380","104.244.42.65","192.168.0.183","TLSv1.2","421","Application Data"
"45","1.564380","104.244.42.65","192.168.0.183","TLSv1.2","364","Application Data"
"46","1.564380","104.244.42.65","192.168.0.183","TLSv1.2","765","Application Data"
"47","1.564380","104.244.42.65","192.168.0.183","TLSv1.2","319","Application Data"
"48","1.564380","104.244.42.65","192.168.0.183","TLSv1.2","1390","Application Data"
"49","1.564380","104.244.42.65","192.168.0.183","TLSv1.2","115","Application Data"
"50","1.564380","104.244.42.65","192.168.0.183","TCP","1414","443  >  50717 [ACK] Seq=13098 Ack=276 Win=989 Len=1360 [TCP segment of a reassembled PDU]"
"51","1.564380","104.244.42.65","192.168.0.183","TCP","1414","443  >  50717 [ACK] Seq=14458 Ack=276 Win=989 Len=1360 [TCP segment of a reassembled PDU]"
"52","1.564380","104.244.42.65","192.168.0.183","TLSv1.2","981","Application Data"
"53","1.564380","104.244.42.65","192.168.0.183","TCP","1414","443  >  50717 [ACK] Seq=16745 Ack=276 Win=989 Len=1360 [TCP segment of a reassembled PDU]"
"54","1.564380","104.244.42.65","192.168.0.183","TCP","1414","443  >  50717 [ACK] Seq=18105 Ack=276 Win=989 Len=1360 [TCP segment of a reassembled PDU]"
"55","1.564380","104.244.42.65","192.168.0.183","TLSv1.2","394","Application Data"
"56","1.564380","104.244.42.65","192.168.0.183","TCP","1414","443  >  50717 [ACK] Seq=19805 Ack=276 Win=989 Len=1360 [TCP segment of a reassembled PDU]"
"57","1.564380","104.244.42.65","192.168.0.183","TCP","1414","443  >  50717 [ACK] Seq=21165 Ack=276 Win=989 Len=1360 [TCP segment of a reassembled PDU]"
"58","1.564380","104.244.42.65","192.168.0.183","TLSv1.2","267","Application Data"
"59","1.564380","104.244.42.65","192.168.0.183","TCP","1414","443  >  50717 [ACK] Seq=22738 Ack=276 Win=989 Len=1360 [TCP segment of a reassembled PDU]"
"60","1.564380","104.244.42.65","192.168.0.183","TCP","1414","443  >  50717 [ACK] Seq=24098 Ack=276 Win=989 Len=1360 [TCP segment of a reassembled PDU]"
"61","1.564380","104.244.42.65","192.168.0.183","TLSv1.2","861","Application Data"
"62","1.564380","104.244.42.65","192.168.0.183","TCP","1414","443  >  50717 [ACK] Seq=26265 Ack=276 Win=989 Len=1360 [TCP segment of a reassembled PDU]"
"63","1.564380","104.244.42.65","192.168.0.183","TCP","1414","443  >  50717 [ACK] Seq=27625 Ack=276 Win=989 Len=1360 [TCP segment of a reassembled PDU]"
"64","1.564380","104.244.42.65","192.168.0.183","TLSv1.2","279","Application Data"
"65","1.564380","104.244.42.65","192.168.0.183","TCP","1414","443  >  50717 [ACK] Seq=29210 Ack=276 Win=989 Len=1360 [TCP segment of a reassembled PDU]"
"66","1.564380","104.244.42.65","192.168.0.183","TCP","1414","443  >  50717 [ACK] Seq=30570 Ack=276 Win=989 Len=1360 [TCP segment of a reassembled PDU]"
"67","1.564380","104.244.42.65","192.168.0.183","TLSv1.2","297","Application Data"
"68","1.564380","104.244.42.65","192.168.0.183","TCP","1414","443  >  50717 [ACK] Seq=32173 Ack=276 Win=989 Len=1360 [TCP segment of a reassembled PDU]"
"69","1.564380","104.244.42.65","192.168.0.183","TLSv1.2","1132","Application Data"
"70","1.564762","192.168.0.183","104.244.42.65","TCP","54","50717  >  443 [ACK] Seq=276 Ack=34611 Win=520 Len=0"
"71","1.564899","104.244.42.65","192.168.0.183","TLSv1.2","1013","Application Data"
"72","1.564899","104.244.42.65","192.168.0.183","TLSv1.2","161","Application Data"
"73","1.564925","192.168.0.183","104.244.42.65","TCP","54","50717  >  443 [ACK] Seq=276 Ack=35677 Win=516 Len=0"
"74","1.565180","104.244.42.65","192.168.0.183","TCP","1414","443  >  50717 [ACK] Seq=35677 Ack=276 Win=989 Len=1360 [TCP segment of a reassembled PDU]"
"75","1.565180","104.244.42.65","192.168.0.183","TLSv1.2","595","Application Data"
"76","1.565180","104.244.42.65","192.168.0.183","TCP","1414","443  >  50717 [ACK] Seq=37578 Ack=276 Win=989 Len=1360 [TCP segment of a reassembled PDU]"
"77","1.565180","104.244.42.65","192.168.0.183","TCP","1414","443  >  50717 [ACK] Seq=38938 Ack=276 Win=989 Len=1360 [TCP segment of a reassembled PDU]"
"78","1.565180","104.244.42.65","192.168.0.183","TLSv1.2","464","Application Data"
"79","1.565180","104.244.42.65","192.168.0.183","TCP","1414","443  >  50717 [ACK] Seq=40708 Ack=276 Win=989 Len=1360 [TCP segment of a reassembled PDU]"
"80","1.565180","104.244.42.65","192.168.0.183","TCP","1414","443  >  50717 [ACK] Seq=42068 Ack=276 Win=989 Len=1360 [TCP segment of a reassembled PDU]"
"81","1.565180","104.244.42.65","192.168.0.183","TLSv1.2","1414","Application Data"
"82","1.565276","192.168.0.183","104.244.42.65","TCP","54","50717  >  443 [ACK] Seq=276 Ack=44788 Win=520 Len=0"
"83","1.571949","104.244.42.65","192.168.0.183","TCP","1414","443  >  50717 [ACK] Seq=44788 Ack=276 Win=989 Len=1360 [TCP segment of a reassembled PDU]"
"84","1.571949","104.244.42.65","192.168.0.183","TCP","1414","443  >  50717 [ACK] Seq=46148 Ack=276 Win=989 Len=1360 [TCP segment of a reassembled PDU]"
"85","1.571949","104.244.42.65","192.168.0.183","TCP","1414","443  >  50717 [ACK] Seq=47508 Ack=276 Win=989 Len=1360 [TCP segment of a reassembled PDU]"
"86","1.571949","104.244.42.65","192.168.0.183","TLSv1.2","1059","Application Data"
"87","1.571949","104.244.42.65","192.168.0.183","TLSv1.2","130","Application Data"
"88","1.571949","104.244.42.65","192.168.0.183","TLSv1.2","93","Application Data"
"89","1.571949","104.244.42.65","192.168.0.183","TLSv1.2","185","Application Data"
"90","1.571949","104.244.42.65","192.168.0.183","TLSv1.2","142","Application Data"
"91","1.571949","104.244.42.65","192.168.0.183","TLSv1.2","128","Application Data"
"92","1.571949","104.244.42.65","192.168.0.183","TLSv1.2","282","Application Data"
"93","1.571949","104.244.42.65","192.168.0.183","TLSv1.2","95","Application Data"
"94","1.572087","192.168.0.183","104.244.42.65","TCP","54","50717  >  443 [ACK] Seq=276 Ack=50550 Win=520 Len=0"
"95","1.928873","192.168.0.183","104.244.42.65","TLSv1.2","735","Application Data"
"96","1.928953","192.168.0.183","104.244.42.65","TLSv1.2","234","Application Data"
"97","1.929011","192.168.0.183","104.244.42.65","TLSv1.2","237","Application Data"
"98","1.947841","192.168.0.183","104.244.42.65","TLSv1.2","137","Application Data"
"99","1.949754","192.168.0.183","104.244.42.65","TLSv1.2","246","Application Data"
"100","1.949854","192.168.0.183","104.244.42.65","TCP","1414","50717  >  443 [ACK] Seq=1595 Ack=50550 Win=520 Len=1360 [TCP segment of a reassembled PDU]"
"101","1.949854","192.168.0.183","104.244.42.65","TLSv1.2","278","Application Data"
"102","1.959666","104.244.42.65","192.168.0.183","TCP","60","443  >  50717 [ACK] Seq=50550 Ack=1320 Win=1021 Len=0"
"103","1.978517","104.244.42.65","192.168.0.183","TLSv1.2","161","Application Data"
"104","1.982846","104.244.42.65","192.168.0.183","TLSv1.2","380","Application Data"
"105","1.982897","192.168.0.183","104.244.42.65","TCP","54","50717  >  443 [ACK] Seq=3179 Ack=50983 Win=518 Len=0"
"106","1.988258","104.244.42.65","192.168.0.183","TCP","60","443  >  50717 [ACK] Seq=50983 Ack=3179 Win=1044 Len=0"
"107","1.988638","104.244.42.65","192.168.0.183","TCP","1414","443  >  50717 [ACK] Seq=50983 Ack=3179 Win=1044 Len=1360 [TCP segment of a reassembled PDU]"
"108","1.988638","104.244.42.65","192.168.0.183","TCP","1414","443  >  50717 [ACK] Seq=52343 Ack=3179 Win=1044 Len=1360 [TCP segment of a reassembled PDU]"
"109","1.988638","104.244.42.65","192.168.0.183","TCP","1414","443  >  50717 [ACK] Seq=53703 Ack=3179 Win=1044 Len=1360 [TCP segment of a reassembled PDU]"
"110","1.988638","104.244.42.65","192.168.0.183","TCP","1414","443  >  50717 [ACK] Seq=55063 Ack=3179 Win=1044 Len=1360 [TCP segment of a reassembled PDU]"
"111","1.988638","104.244.42.65","192.168.0.183","TLSv1.2","761","Application Data"
"112","1.988698","192.168.0.183","104.244.42.65","TCP","54","50717  >  443 [ACK] Seq=3179 Ack=57130 Win=520 Len=0"
"113","2.155301","192.168.0.183","104.244.42.65","TLSv1.2","297","Application Data"
"114","2.155407","192.168.0.183","104.244.42.65","TCP","1414","50717  >  443 [ACK] Seq=3422 Ack=57130 Win=520 Len=1360 [TCP segment of a reassembled PDU]"
"115","2.155407","192.168.0.183","104.244.42.65","TLSv1.2","422","Application Data"
"116","2.158570","192.168.0.183","104.244.42.65","TLSv1.2","782","Application Data"
"117","2.158657","192.168.0.183","104.244.42.65","TLSv1.2","621","Application Data"
"118","2.185048","104.244.42.65","192.168.0.183","TCP","60","443  >  50717 [ACK] Seq=57130 Ack=5150 Win=1068 Len=0"
"119","2.191301","104.244.42.65","192.168.0.183","TCP","60","443  >  50717 [ACK] Seq=57130 Ack=6445 Win=1090 Len=0"
"120","2.211353","104.244.42.65","192.168.0.183","TLSv1.2","134","Application Data"
"121","2.213538","104.244.42.65","192.168.0.183","TLSv1.2","138","Application Data"
"122","2.213579","192.168.0.183","104.244.42.65","TCP","54","50717  >  443 [ACK] Seq=6445 Ack=57294 Win=519 Len=0"
"123","2.475696","192.168.0.183","104.244.42.65","TLSv1.2","487","Application Data"
"124","2.529755","192.168.0.183","104.244.42.65","TLSv1.2","957","Application Data"
"125","2.530400","104.244.42.65","192.168.0.183","TLSv1.2","210","Application Data"
"126","2.575869","192.168.0.183","104.244.42.65","TLSv1.2","590","Application Data"
"127","2.599865","104.244.42.65","192.168.0.183","TCP","60","443  >  50717 [ACK] Seq=57450 Ack=7781 Win=1111 Len=0"
"128","2.605282","104.244.42.65","192.168.0.183","TCP","60","443  >  50717 [ACK] Seq=57450 Ack=8317 Win=1121 Len=0"
"129","2.650963","192.168.0.183","104.244.42.65","TLSv1.2","727","Application Data"
"130","2.677663","192.168.0.183","104.244.42.65","TLSv1.2","261","Application Data"
"131","2.679231","192.168.0.183","104.244.42.65","TLSv1.2","1312","Application Data"
"132","2.679325","104.244.42.65","192.168.0.183","TCP","60","443  >  50717 [ACK] Seq=57450 Ack=8990 Win=1132 Len=0"
"133","2.692539","192.168.0.183","104.244.42.65","TLSv1.2","875","Application Data"
"134","2.692663","192.168.0.183","104.244.42.65","TLSv1.2","289","Application Data"
"135","2.700713","104.244.42.65","192.168.0.183","TLSv1.2","174","Application Data"
"136","2.709310","104.244.42.65","192.168.0.183","TCP","60","443  >  50717 [ACK] Seq=57570 Ack=10455 Win=1153 Len=0"
"137","2.724468","104.244.42.65","192.168.0.183","TCP","60","443  >  50717 [ACK] Seq=57570 Ack=11511 Win=1175 Len=0"
"138","2.746270","192.168.0.183","104.244.42.65","TCP","54","50717  >  443 [ACK] Seq=11511 Ack=57570 Win=518 Len=0"
"139","2.753407","104.244.42.65","192.168.0.183","TLSv1.2","247","Application Data"
"140","2.760118","104.244.42.65","192.168.0.183","TCP","1414","443  >  50717 [ACK] Seq=57763 Ack=11511 Win=1175 Len=1360 [TCP segment of a reassembled PDU]"
"141","2.760118","104.244.42.65","192.168.0.183","TLSv1.2","977","Application Data"
"142","2.760192","192.168.0.183","104.244.42.65","TCP","54","50717  >  443 [ACK] Seq=11511 Ack=60046 Win=520 Len=0"
"143","2.865885","104.244.42.65","192.168.0.183","TCP","1414","443  >  50717 [ACK] Seq=60046 Ack=11511 Win=1175 Len=1360 [TCP segment of a reassembled PDU]"
"144","2.865885","104.244.42.65","192.168.0.183","TLSv1.2","607","Application Data"
"145","2.865934","192.168.0.183","104.244.42.65","TCP","54","50717  >  443 [ACK] Seq=11511 Ack=61959 Win=520 Len=0"
"146","2.955735","104.244.42.65","192.168.0.183","TCP","1414","443  >  50717 [ACK] Seq=61959 Ack=11511 Win=1175 Len=1360 [TCP segment of a reassembled PDU]"
"147","2.955735","104.244.42.65","192.168.0.183","TCP","1414","443  >  50717 [ACK] Seq=63319 Ack=11511 Win=1175 Len=1360 [TCP segment of a reassembled PDU]"
"148","2.955735","104.244.42.65","192.168.0.183","TLSv1.2","1019","Application Data"
"149","2.955834","192.168.0.183","104.244.42.65","TCP","54","50717  >  443 [ACK] Seq=11511 Ack=65644 Win=520 Len=0"
"150","3.116725","104.244.42.65","192.168.0.183","TLSv1.2","178","Application Data"
"151","3.161952","192.168.0.183","104.244.42.65","TLSv1.2","814","Application Data"
"152","3.162063","192.168.0.183","104.244.42.65","TLSv1.2","157","Application Data"
"153","3.191809","104.244.42.65","192.168.0.183","TCP","60","443  >  50717 [ACK] Seq=65768 Ack=12374 Win=1185 Len=0"
"154","3.208612","104.244.42.65","192.168.0.183","TLSv1.2","476","Application Data"
"155","3.258100","104.244.42.65","192.168.0.183","TCP","1414","443  >  50717 [ACK] Seq=66190 Ack=12374 Win=1185 Len=1360 [TCP segment of a reassembled PDU]"
"156","3.258100","104.244.42.65","192.168.0.183","TCP","1414","443  >  50717 [ACK] Seq=67550 Ack=12374 Win=1185 Len=1360 [TCP segment of a reassembled PDU]"
"157","3.258100","104.244.42.65","192.168.0.183","TCP","1414","443  >  50717 [ACK] Seq=68910 Ack=12374 Win=1185 Len=1360 [TCP segment of a reassembled PDU]"
"158","3.258100","104.244.42.65","192.168.0.183","TCP","1414","443  >  50717 [PSH, ACK] Seq=70270 Ack=12374 Win=1185 Len=1360 [TCP segment of a reassembled PDU]"
"159","3.258100","104.244.42.65","192.168.0.183","TCP","1414","443  >  50717 [ACK] Seq=71630 Ack=12374 Win=1185 Len=1360 [TCP segment of a reassembled PDU]"
"160","3.258100","104.244.42.65","192.168.0.183","TCP","1414","443  >  50717 [ACK] Seq=72990 Ack=12374 Win=1185 Len=1360 [TCP segment of a reassembled PDU]"
"161","3.258100","104.244.42.65","192.168.0.183","TCP","1414","443  >  50717 [ACK] Seq=74350 Ack=12374 Win=1185 Len=1360 [TCP segment of a reassembled PDU]"
"162","3.258100","104.244.42.65","192.168.0.183","TCP","1414","443  >  50717 [PSH, ACK] Seq=75710 Ack=12374 Win=1185 Len=1360 [TCP segment of a reassembled PDU]"
"163","3.258100","104.244.42.65","192.168.0.183","TCP","1414","443  >  50717 [ACK] Seq=77070 Ack=12374 Win=1185 Len=1360 [TCP segment of a reassembled PDU]"
"164","3.258100","104.244.42.65","192.168.0.183","TCP","1414","443  >  50717 [ACK] Seq=78430 Ack=12374 Win=1185 Len=1360 [TCP segment of a reassembled PDU]"
"165","3.258100","104.244.42.65","192.168.0.183","TCP","1414","443  >  50717 [ACK] Seq=79790 Ack=12374 Win=1185 Len=1360 [TCP segment of a reassembled PDU]"
"166","3.258100","104.244.42.65","192.168.0.183","TCP","1414","443  >  50717 [PSH, ACK] Seq=81150 Ack=12374 Win=1185 Len=1360 [TCP segment of a reassembled PDU]"
"167","3.258100","104.244.42.65","192.168.0.183","TLSv1.2","1414","Application Data"
"168","3.258100","104.244.42.65","192.168.0.183","TCP","1414","443  >  50717 [ACK] Seq=83870 Ack=12374 Win=1185 Len=1360 [TCP segment of a reassembled PDU]"
"169","3.258100","104.244.42.65","192.168.0.183","TCP","1414","443  >  50717 [ACK] Seq=85230 Ack=12374 Win=1185 Len=1360 [TCP segment of a reassembled PDU]"
"170","3.258100","104.244.42.65","192.168.0.183","TCP","1414","443  >  50717 [PSH, ACK] Seq=86590 Ack=12374 Win=1185 Len=1360 [TCP segment of a reassembled PDU]"
"171","3.258100","104.244.42.65","192.168.0.183","TCP","1414","443  >  50717 [ACK] Seq=87950 Ack=12374 Win=1185 Len=1360 [TCP segment of a reassembled PDU]"
"172","3.258100","104.244.42.65","192.168.0.183","TCP","1414","443  >  50717 [ACK] Seq=89310 Ack=12374 Win=1185 Len=1360 [TCP segment of a reassembled PDU]"
"173","3.258100","104.244.42.65","192.168.0.183","TCP","1414","443  >  50717 [ACK] Seq=90670 Ack=12374 Win=1185 Len=1360 [TCP segment of a reassembled PDU]"
"174","3.258100","104.244.42.65","192.168.0.183","TCP","1414","443  >  50717 [PSH, ACK] Seq=92030 Ack=12374 Win=1185 Len=1360 [TCP segment of a reassembled PDU]"
"175","3.258100","104.244.42.65","192.168.0.183","TCP","1414","443  >  50717 [ACK] Seq=93390 Ack=12374 Win=1185 Len=1360 [TCP segment of a reassembled PDU]"
"176","3.258100","104.244.42.65","192.168.0.183","TCP","1414","443  >  50717 [ACK] Seq=94750 Ack=12374 Win=1185 Len=1360 [TCP segment of a reassembled PDU]"
"177","3.258100","104.244.42.65","192.168.0.183","TCP","1414","443  >  50717 [ACK] Seq=96110 Ack=12374 Win=1185 Len=1360 [TCP segment of a reassembled PDU]"
"178","3.258100","104.244.42.65","192.168.0.183","TCP","1414","443  >  50717 [PSH, ACK] Seq=97470 Ack=12374 Win=1185 Len=1360 [TCP segment of a reassembled PDU]"
"179","3.258100","104.244.42.65","192.168.0.183","TLSv1.2","1414","Application Data"
"180","3.258100","104.244.42.65","192.168.0.183","TCP","1414","443  >  50717 [ACK] Seq=100190 Ack=12374 Win=1185 Len=1360 [TCP segment of a reassembled PDU]"
"181","3.258100","104.244.42.65","192.168.0.183","TCP","1414","443  >  50717 [ACK] Seq=101550 Ack=12374 Win=1185 Len=1360 [TCP segment of a reassembled PDU]"
"182","3.258100","104.244.42.65","192.168.0.183","TCP","1414","443  >  50717 [PSH, ACK] Seq=102910 Ack=12374 Win=1185 Len=1360 [TCP segment of a reassembled PDU]"
"183","3.258100","104.244.42.65","192.168.0.183","TCP","1414","443  >  50717 [ACK] Seq=104270 Ack=12374 Win=1185 Len=1360 [TCP segment of a reassembled PDU]"
"184","3.258100","104.244.42.65","192.168.0.183","TCP","1414","443  >  50717 [ACK] Seq=105630 Ack=12374 Win=1185 Len=1360 [TCP segment of a reassembled PDU]"
"185","3.258100","104.244.42.65","192.168.0.183","TCP","1414","443  >  50717 [ACK] Seq=106990 Ack=12374 Win=1185 Len=1360 [TCP segment of a reassembled PDU]"
"186","3.258100","104.244.42.65","192.168.0.183","TCP","1414","443  >  50717 [PSH, ACK] Seq=108350 Ack=12374 Win=1185 Len=1360 [TCP segment of a reassembled PDU]"
"187","3.258258","192.168.0.183","104.244.42.65","TCP","54","50717  >  443 [ACK] Seq=12374 Ack=109710 Win=1041 Len=0"
"188","3.258324","104.244.42.65","192.168.0.183","TCP","1414","443  >  50717 [ACK] Seq=109710 Ack=12374 Win=1185 Len=1360 [TCP segment of a reassembled PDU]"
"189","3.258324","104.244.42.65","192.168.0.183","TCP","1414","443  >  50717 [ACK] Seq=111070 Ack=12374 Win=1185 Len=1360 [TCP segment of a reassembled PDU]"
"190","3.258324","104.244.42.65","192.168.0.183","TCP","1414","443  >  50717 [ACK] Seq=112430 Ack=12374 Win=1185 Len=1360 [TCP segment of a reassembled PDU]"
"191","3.258324","104.244.42.65","192.168.0.183","TCP","1414","443  >  50717 [PSH, ACK] Seq=113790 Ack=12374 Win=1185 Len=1360 [TCP segment of a reassembled PDU]"
"192","3.258324","104.244.42.65","192.168.0.183","TLSv1.2","312","Application Data"
"193","3.258324","104.244.42.65","192.168.0.183","TCP","1414","443  >  50717 [ACK] Seq=115408 Ack=12374 Win=1185 Len=1360 [TCP segment of a reassembled PDU]"
"194","3.258324","104.244.42.65","192.168.0.183","TCP","1414","443  >  50717 [ACK] Seq=116768 Ack=12374 Win=1185 Len=1360 [TCP segment of a reassembled PDU]"
"195","3.258324","104.244.42.65","192.168.0.183","TCP","1414","443  >  50717 [ACK] Seq=118128 Ack=12374 Win=1185 Len=1360 [TCP segment of a reassembled PDU]"
"196","3.258324","104.244.42.65","192.168.0.183","TCP","1414","443  >  50717 [PSH, ACK] Seq=119488 Ack=12374 Win=1185 Len=1360 [TCP segment of a reassembled PDU]"
"197","3.258324","104.244.42.65","192.168.0.183","TCP","1414","443  >  50717 [ACK] Seq=120848 Ack=12374 Win=1185 Len=1360 [TCP segment of a reassembled PDU]"
"198","3.258324","104.244.42.65","192.168.0.183","TCP","1414","443  >  50717 [ACK] Seq=122208 Ack=12374 Win=1185 Len=1360 [TCP segment of a reassembled PDU]"
"199","3.258324","104.244.42.65","192.168.0.183","TCP","1414","443  >  50717 [ACK] Seq=123568 Ack=12374 Win=1185 Len=1360 [TCP segment of a reassembled PDU]"
"200","3.258324","104.244.42.65","192.168.0.183","TCP","1414","443  >  50717 [PSH, ACK] Seq=124928 Ack=12374 Win=1185 Len=1360 [TCP segment of a reassembled PDU]"
"201","3.258324","104.244.42.65","192.168.0.183","TCP","1414","443  >  50717 [ACK] Seq=126288 Ack=12374 Win=1185 Len=1360 [TCP segment of a reassembled PDU]"
"202","3.258324","104.244.42.65","192.168.0.183","TLSv1.2","1052","Application Data"
"203","3.258359","192.168.0.183","104.244.42.65","TCP","54","50717  >  443 [ACK] Seq=12374 Ack=128646 Win=1041 Len=0"
"204","3.985099","104.244.42.65","192.168.0.183","TCP","1414","443  >  50717 [ACK] Seq=128646 Ack=12374 Win=1185 Len=1360 [TCP segment of a reassembled PDU]"
"205","3.985099","104.244.42.65","192.168.0.183","TCP","1414","443  >  50717 [ACK] Seq=130006 Ack=12374 Win=1185 Len=1360 [TCP segment of a reassembled PDU]"
"206","3.985099","104.244.42.65","192.168.0.183","TCP","1414","443  >  50717 [ACK] Seq=131366 Ack=12374 Win=1185 Len=1360 [TCP segment of a reassembled PDU]"
"207","3.985099","104.244.42.65","192.168.0.183","TCP","1414","443  >  50717 [PSH, ACK] Seq=132726 Ack=12374 Win=1185 Len=1360 [TCP segment of a reassembled PDU]"
"208","3.985099","104.244.42.65","192.168.0.183","TCP","1414","443  >  50717 [ACK] Seq=134086 Ack=12374 Win=1185 Len=1360 [TCP segment of a reassembled PDU]"
"209","3.985099","104.244.42.65","192.168.0.183","TCP","1414","443  >  50717 [ACK] Seq=135446 Ack=12374 Win=1185 Len=1360 [TCP segment of a reassembled PDU]"
"210","3.985099","104.244.42.65","192.168.0.183","TCP","1414","443  >  50717 [ACK] Seq=136806 Ack=12374 Win=1185 Len=1360 [TCP segment of a reassembled PDU]"
"211","3.985099","104.244.42.65","192.168.0.183","TCP","1414","443  >  50717 [PSH, ACK] Seq=138166 Ack=12374 Win=1185 Len=1360 [TCP segment of a reassembled PDU]"
"212","3.985099","104.244.42.65","192.168.0.183","TCP","1414","443  >  50717 [ACK] Seq=139526 Ack=12374 Win=1185 Len=1360 [TCP segment of a reassembled PDU]"
"213","3.985099","104.244.42.65","192.168.0.183","TCP","1414","443  >  50717 [ACK] Seq=140886 Ack=12374 Win=1185 Len=1360 [TCP segment of a reassembled PDU]"
"214","3.985099","104.244.42.65","192.168.0.183","TCP","1414","443  >  50717 [ACK] Seq=142246 Ack=12374 Win=1185 Len=1360 [TCP segment of a reassembled PDU]"
"215","3.985099","104.244.42.65","192.168.0.183","TCP","1414","443  >  50717 [PSH, ACK] Seq=143606 Ack=12374 Win=1185 Len=1360 [TCP segment of a reassembled PDU]"
"216","3.985099","104.244.42.65","192.168.0.183","TLSv1.2","1414","Application Data"
"217","3.985099","104.244.42.65","192.168.0.183","TCP","1414","443  >  50717 [ACK] Seq=146326 Ack=12374 Win=1185 Len=1360 [TCP segment of a reassembled PDU]"
"218","3.985099","104.244.42.65","192.168.0.183","TCP","1414","443  >  50717 [ACK] Seq=147686 Ack=12374 Win=1185 Len=1360 [TCP segment of a reassembled PDU]"
"219","3.985099","104.244.42.65","192.168.0.183","TCP","1414","443  >  50717 [PSH, ACK] Seq=149046 Ack=12374 Win=1185 Len=1360 [TCP segment of a reassembled PDU]"
"220","3.985099","104.244.42.65","192.168.0.183","TCP","1414","443  >  50717 [ACK] Seq=150406 Ack=12374 Win=1185 Len=1360 [TCP segment of a reassembled PDU]"
"221","3.985099","104.244.42.65","192.168.0.183","TCP","1414","443  >  50717 [ACK] Seq=151766 Ack=12374 Win=1185 Len=1360 [TCP segment of a reassembled PDU]"
"222","3.985099","104.244.42.65","192.168.0.183","TCP","1414","443  >  50717 [ACK] Seq=153126 Ack=12374 Win=1185 Len=1360 [TCP segment of a reassembled PDU]"
"223","3.985099","104.244.42.65","192.168.0.183","TCP","1414","443  >  50717 [PSH, ACK] Seq=154486 Ack=12374 Win=1185 Len=1360 [TCP segment of a reassembled PDU]"
"224","3.985099","104.244.42.65","192.168.0.183","TCP","1414","443  >  50717 [ACK] Seq=155846 Ack=12374 Win=1185 Len=1360 [TCP segment of a reassembled PDU]"
"225","3.985099","104.244.42.65","192.168.0.183","TCP","1414","443  >  50717 [ACK] Seq=157206 Ack=12374 Win=1185 Len=1360 [TCP segment of a reassembled PDU]"
"226","3.985099","104.244.42.65","192.168.0.183","TCP","1414","443  >  50717 [ACK] Seq=158566 Ack=12374 Win=1185 Len=1360 [TCP segment of a reassembled PDU]"
"227","3.985099","104.244.42.65","192.168.0.183","TCP","1414","443  >  50717 [PSH, ACK] Seq=159926 Ack=12374 Win=1185 Len=1360 [TCP segment of a reassembled PDU]"
"228","3.985099","104.244.42.65","192.168.0.183","TLSv1.2","1414","Application Data"
"229","3.985099","104.244.42.65","192.168.0.183","TCP","1414","443  >  50717 [ACK] Seq=162646 Ack=12374 Win=1185 Len=1360 [TCP segment of a reassembled PDU]"
"230","3.985099","104.244.42.65","192.168.0.183","TLSv1.2","694","Application Data"
"231","3.985198","192.168.0.183","104.244.42.65","TCP","54","50717  >  443 [ACK] Seq=12374 Ack=164646 Win=1041 Len=0"
"232","4.244048","192.168.0.183","104.244.42.65","TLSv1.2","274","Application Data"
"233","4.244094","192.168.0.183","104.244.42.65","TLSv1.2","1131","Application Data"
"234","4.290191","104.244.42.65","192.168.0.183","TCP","60","443  >  50717 [ACK] Seq=164646 Ack=13671 Win=1206 Len=0"
"235","4.307851","104.244.42.65","192.168.0.183","TLSv1.2","206","Application Data"
"236","4.350857","192.168.0.183","104.244.42.65","TCP","54","50717  >  443 [ACK] Seq=13671 Ack=164798 Win=1040 Len=0"
"237","4.427485","192.168.0.183","104.244.42.65","TLSv1.2","235","Application Data"
"238","4.427599","192.168.0.183","104.244.42.65","TLSv1.2","560","Application Data"
"239","4.459902","104.244.42.65","192.168.0.183","TCP","60","443  >  50717 [ACK] Seq=164798 Ack=14358 Win=1228 Len=0"
"240","4.481351","104.244.42.65","192.168.0.183","TLSv1.2","138","Application Data"
"241","4.535827","192.168.0.183","104.244.42.65","TCP","54","50717  >  443 [ACK] Seq=14358 Ack=164882 Win=1040 Len=0"
"242","4.836013","192.168.0.183","104.244.42.65","TLSv1.2","196","Application Data"
"243","4.883650","104.244.42.65","192.168.0.183","TCP","1414","443  >  50717 [ACK] Seq=164882 Ack=14500 Win=1238 Len=1360 [TCP segment of a reassembled PDU]"
"244","4.883650","104.244.42.65","192.168.0.183","TCP","1414","443  >  50717 [ACK] Seq=166242 Ack=14500 Win=1238 Len=1360 [TCP segment of a reassembled PDU]"
"245","4.883650","104.244.42.65","192.168.0.183","TCP","1414","443  >  50717 [ACK] Seq=167602 Ack=14500 Win=1238 Len=1360 [TCP segment of a reassembled PDU]"
"246","4.883650","104.244.42.65","192.168.0.183","TCP","1414","443  >  50717 [PSH, ACK] Seq=168962 Ack=14500 Win=1238 Len=1360 [TCP segment of a reassembled PDU]"
"247","4.883650","104.244.42.65","192.168.0.183","TCP","1414","443  >  50717 [ACK] Seq=170322 Ack=14500 Win=1238 Len=1360 [TCP segment of a reassembled PDU]"
"248","4.883650","104.244.42.65","192.168.0.183","TLSv1.2","1002","Application Data"
"249","4.883818","192.168.0.183","104.244.42.65","TCP","54","50717  >  443 [ACK] Seq=14500 Ack=172630 Win=1041 Len=0"
"250","5.116346","192.168.0.183","104.244.42.65","TLSv1.2","674","Application Data"
"251","5.116483","192.168.0.183","104.244.42.65","TCP","1414","50717  >  443 [ACK] Seq=15120 Ack=172630 Win=1041 Len=1360 [TCP segment of a reassembled PDU]"
"252","5.116483","192.168.0.183","104.244.42.65","TCP","1414","50717  >  443 [ACK] Seq=16480 Ack=172630 Win=1041 Len=1360 [TCP segment of a reassembled PDU]"
"253","5.116483","192.168.0.183","104.244.42.65","TCP","1414","50717  >  443 [ACK] Seq=17840 Ack=172630 Win=1041 Len=1360 [TCP segment of a reassembled PDU]"
"254","5.116483","192.168.0.183","104.244.42.65","TCP","1414","50717  >  443 [ACK] Seq=19200 Ack=172630 Win=1041 Len=1360 [TCP segment of a reassembled PDU]"
"255","5.116483","192.168.0.183","104.244.42.65","TCP","1414","50717  >  443 [ACK] Seq=20560 Ack=172630 Win=1041 Len=1360 [TCP segment of a reassembled PDU]"
"256","5.116483","192.168.0.183","104.244.42.65","TCP","1414","50717  >  443 [ACK] Seq=21920 Ack=172630 Win=1041 Len=1360 [TCP segment of a reassembled PDU]"
"257","5.116483","192.168.0.183","104.244.42.65","TCP","1414","50717  >  443 [ACK] Seq=23280 Ack=172630 Win=1041 Len=1360 [TCP segment of a reassembled PDU]"
"258","5.116483","192.168.0.183","104.244.42.65","TCP","1414","50717  >  443 [ACK] Seq=24640 Ack=172630 Win=1041 Len=1360 [TCP segment of a reassembled PDU]"
"259","5.116483","192.168.0.183","104.244.42.65","TCP","1414","50717  >  443 [ACK] Seq=26000 Ack=172630 Win=1041 Len=1360 [TCP segment of a reassembled PDU]"
"260","5.116483","192.168.0.183","104.244.42.65","TCP","1414","50717  >  443 [ACK] Seq=27360 Ack=172630 Win=1041 Len=1360 [TCP segment of a reassembled PDU]"
"261","5.116483","192.168.0.183","104.244.42.65","TCP","1414","50717  >  443 [ACK] Seq=28720 Ack=172630 Win=1041 Len=1360 [TCP segment of a reassembled PDU]"
"262","5.116483","192.168.0.183","104.244.42.65","TCP","1414","50717  >  443 [ACK] Seq=30080 Ack=172630 Win=1041 Len=1360 [TCP segment of a reassembled PDU]"
"263","5.116483","192.168.0.183","104.244.42.65","TLSv1.2","140","Application Data"
"264","5.116630","192.168.0.183","104.244.42.65","TCP","1414","50717  >  443 [ACK] Seq=31526 Ack=172630 Win=1041 Len=1360 [TCP segment of a reassembled PDU]"
"265","5.116630","192.168.0.183","104.244.42.65","TCP","1414","50717  >  443 [ACK] Seq=32886 Ack=172630 Win=1041 Len=1360 [TCP segment of a reassembled PDU]"
"266","5.116630","192.168.0.183","104.244.42.65","TCP","1414","50717  >  443 [ACK] Seq=34246 Ack=172630 Win=1041 Len=1360 [TCP segment of a reassembled PDU]"
"267","5.116630","192.168.0.183","104.244.42.65","TCP","1414","50717  >  443 [ACK] Seq=35606 Ack=172630 Win=1041 Len=1360 [TCP segment of a reassembled PDU]"
"268","5.116630","192.168.0.183","104.244.42.65","TCP","1414","50717  >  443 [ACK] Seq=36966 Ack=172630 Win=1041 Len=1360 [TCP segment of a reassembled PDU]"
"269","5.116630","192.168.0.183","104.244.42.65","TCP","1414","50717  >  443 [ACK] Seq=38326 Ack=172630 Win=1041 Len=1360 [TCP segment of a reassembled PDU]"
"270","5.116630","192.168.0.183","104.244.42.65","TCP","1414","50717  >  443 [ACK] Seq=39686 Ack=172630 Win=1041 Len=1360 [TCP segment of a reassembled PDU]"
"271","5.116630","192.168.0.183","104.244.42.65","TCP","1414","50717  >  443 [ACK] Seq=41046 Ack=172630 Win=1041 Len=1360 [TCP segment of a reassembled PDU]"
"272","5.116630","192.168.0.183","104.244.42.65","TCP","1414","50717  >  443 [ACK] Seq=42406 Ack=172630 Win=1041 Len=1360 [TCP segment of a reassembled PDU]"
"273","5.116630","192.168.0.183","104.244.42.65","TLSv1.2","1128","Application Data"
"274","5.151847","104.244.42.65","192.168.0.183","TCP","60","443  >  50717 [ACK] Seq=172630 Ack=39686 Win=1441 Len=0"
"275","5.155364","104.244.42.65","192.168.0.183","TCP","60","443  >  50717 [ACK] Seq=172630 Ack=44840 Win=1481 Len=0"
"276","5.209323","104.244.42.65","192.168.0.183","TLSv1.2","168","Application Data"
"277","5.262347","192.168.0.183","104.244.42.65","TCP","54","50717  >  443 [ACK] Seq=44840 Ack=172744 Win=1040 Len=0"
"278","7.784450","192.168.0.183","104.244.42.65","TLSv1.2","234","Application Data"
"279","7.784554","192.168.0.183","104.244.42.65","TLSv1.2","795","Application Data"
"280","7.815438","104.244.42.65","192.168.0.183","TCP","60","443  >  50717 [ACK] Seq=172744 Ack=45761 Win=1502 Len=0"
"281","7.836841","104.244.42.65","192.168.0.183","TLSv1.2","180","Application Data"
"282","7.888973","192.168.0.183","104.244.42.65","TCP","54","50717  >  443 [ACK] Seq=45761 Ack=172870 Win=1040 Len=0"
"283","10.206011","192.168.0.183","104.244.42.65","TLSv1.2","303","Application Data"
"284","10.206071","192.168.0.183","104.244.42.65","TLSv1.2","168","Application Data"
"285","10.239117","104.244.42.65","192.168.0.183","TCP","60","443  >  50717 [ACK] Seq=172870 Ack=46124 Win=1513 Len=0"
"286","10.307258","104.244.42.65","192.168.0.183","TLSv1.2","349","Application Data"
"287","10.308263","192.168.0.183","104.244.42.65","TLSv1.2","89","Application Data"
"288","10.381532","104.244.42.65","192.168.0.183","TCP","60","443  >  50717 [ACK] Seq=173165 Ack=46159 Win=1513 Len=0"
"289","10.790630","192.168.0.183","104.244.42.65","TLSv1.2","794","Application Data"
"290","10.790746","192.168.0.183","104.244.42.65","TCP","1414","50717  >  443 [ACK] Seq=46899 Ack=173165 Win=1039 Len=1360 [TCP segment of a reassembled PDU]"
"291","10.790746","192.168.0.183","104.244.42.65","TCP","1414","50717  >  443 [ACK] Seq=48259 Ack=173165 Win=1039 Len=1360 [TCP segment of a reassembled PDU]"
"292","10.790746","192.168.0.183","104.244.42.65","TCP","1414","50717  >  443 [ACK] Seq=49619 Ack=173165 Win=1039 Len=1360 [TCP segment of a reassembled PDU]"
"293","10.790746","192.168.0.183","104.244.42.65","TCP","1414","50717  >  443 [ACK] Seq=50979 Ack=173165 Win=1039 Len=1360 [TCP segment of a reassembled PDU]"
"294","10.790746","192.168.0.183","104.244.42.65","TCP","1414","50717  >  443 [ACK] Seq=52339 Ack=173165 Win=1039 Len=1360 [TCP segment of a reassembled PDU]"
"295","10.790746","192.168.0.183","104.244.42.65","TCP","1414","50717  >  443 [ACK] Seq=53699 Ack=173165 Win=1039 Len=1360 [TCP segment of a reassembled PDU]"
"296","10.790746","192.168.0.183","104.244.42.65","TLSv1.2","89","Application Data"
"297","10.822103","104.244.42.65","192.168.0.183","TCP","60","443  >  50717 [ACK] Seq=173165 Ack=49619 Win=1545 Len=0"
"298","10.827792","104.244.42.65","192.168.0.183","TCP","60","443  >  50717 [ACK] Seq=173165 Ack=55094 Win=1588 Len=0"
"299","10.856923","104.244.42.65","192.168.0.183","TLSv1.2","161","Application Data"
"300","10.903577","192.168.0.183","104.244.42.65","TCP","54","50717  >  443 [ACK] Seq=55094 Ack=173272 Win=1038 Len=0"
"301","11.619950","192.168.0.183","104.244.42.65","TCP","1414","50717  >  443 [ACK] Seq=55094 Ack=173272 Win=1038 Len=1360 [TCP segment of a reassembled PDU]"
"302","11.619950","192.168.0.183","104.244.42.65","TLSv1.2","122","Application Data"
"303","11.620186","192.168.0.183","104.244.42.65","TLSv1.2","230","Application Data"
"304","11.620437","192.168.0.183","104.244.42.65","TLSv1.2","260","Application Data"
"305","11.649634","104.244.42.65","192.168.0.183","TCP","60","443  >  50717 [ACK] Seq=173272 Ack=56522 Win=1599 Len=0"
"306","11.655362","104.244.42.65","192.168.0.183","TCP","60","443  >  50717 [ACK] Seq=173272 Ack=56904 Win=1620 Len=0"
"307","11.669883","104.244.42.65","192.168.0.183","TLSv1.2","498","Application Data"
"308","11.715502","192.168.0.183","104.244.42.65","TCP","54","50717  >  443 [ACK] Seq=56904 Ack=173716 Win=1037 Len=0"
"309","11.963599","104.244.42.65","192.168.0.183","TLSv1.2","189","Application Data"
"310","12.008133","192.168.0.183","104.244.42.65","TCP","54","50717  >  443 [ACK] Seq=56904 Ack=173851 Win=1036 Len=0"
"311","12.911340","104.244.42.65","192.168.0.183","TCP","1414","443  >  50717 [ACK] Seq=173851 Ack=56904 Win=1620 Len=1360 [TCP segment of a reassembled PDU]"
"312","12.911340","104.244.42.65","192.168.0.183","TCP","1414","443  >  50717 [ACK] Seq=175211 Ack=56904 Win=1620 Len=1360 [TCP segment of a reassembled PDU]"
"313","12.911340","104.244.42.65","192.168.0.183","TCP","1414","443  >  50717 [PSH, ACK] Seq=176571 Ack=56904 Win=1620 Len=1360 [TCP segment of a reassembled PDU]"
"314","12.911340","104.244.42.65","192.168.0.183","TCP","1414","443  >  50717 [ACK] Seq=177931 Ack=56904 Win=1620 Len=1360 [TCP segment of a reassembled PDU]"
"315","12.911340","104.244.42.65","192.168.0.183","TCP","1414","443  >  50717 [ACK] Seq=179291 Ack=56904 Win=1620 Len=1360 [TCP segment of a reassembled PDU]"
"316","12.911340","104.244.42.65","192.168.0.183","TCP","1414","443  >  50717 [PSH, ACK] Seq=180651 Ack=56904 Win=1620 Len=1360 [TCP segment of a reassembled PDU]"
"317","12.911340","104.244.42.65","192.168.0.183","TCP","1414","443  >  50717 [ACK] Seq=182011 Ack=56904 Win=1620 Len=1360 [TCP segment of a reassembled PDU]"
"318","12.911340","104.244.42.65","192.168.0.183","TCP","1414","443  >  50717 [ACK] Seq=183371 Ack=56904 Win=1620 Len=1360 [TCP segment of a reassembled PDU]"
"319","12.911340","104.244.42.65","192.168.0.183","TCP","1414","443  >  50717 [PSH, ACK] Seq=184731 Ack=56904 Win=1620 Len=1360 [TCP segment of a reassembled PDU]"
"320","12.911340","104.244.42.65","192.168.0.183","TCP","1414","443  >  50717 [ACK] Seq=186091 Ack=56904 Win=1620 Len=1360 [TCP segment of a reassembled PDU]"
"321","12.911340","104.244.42.65","192.168.0.183","TCP","1414","443  >  50717 [ACK] Seq=187451 Ack=56904 Win=1620 Len=1360 [TCP segment of a reassembled PDU]"
"322","12.911340","104.244.42.65","192.168.0.183","TCP","1414","443  >  50717 [PSH, ACK] Seq=188811 Ack=56904 Win=1620 Len=1360 [TCP segment of a reassembled PDU]"
"323","12.911340","104.244.42.65","192.168.0.183","TLSv1.2","91","Application Data"
"324","12.911671","192.168.0.183","104.244.42.65","TCP","54","50717  >  443 [ACK] Seq=56904 Ack=190208 Win=1041 Len=0"
"325","14.443827","192.168.0.183","104.244.42.65","TLSv1.2","685","Application Data"
"326","14.444043","192.168.0.183","104.244.42.65","TCP","1414","50717  >  443 [ACK] Seq=57535 Ack=190208 Win=1041 Len=1360 [TCP segment of a reassembled PDU]"
"327","14.444043","192.168.0.183","104.244.42.65","TCP","1414","50717  >  443 [ACK] Seq=58895 Ack=190208 Win=1041 Len=1360 [TCP segment of a reassembled PDU]"
"328","14.444043","192.168.0.183","104.244.42.65","TCP","1414","50717  >  443 [ACK] Seq=60255 Ack=190208 Win=1041 Len=1360 [TCP segment of a reassembled PDU]"
"329","14.444043","192.168.0.183","104.244.42.65","TCP","1414","50717  >  443 [ACK] Seq=61615 Ack=190208 Win=1041 Len=1360 [TCP segment of a reassembled PDU]"
"330","14.444043","192.168.0.183","104.244.42.65","TCP","1414","50717  >  443 [ACK] Seq=62975 Ack=190208 Win=1041 Len=1360 [TCP segment of a reassembled PDU]"
"331","14.444043","192.168.0.183","104.244.42.65","TCP","1414","50717  >  443 [ACK] Seq=64335 Ack=190208 Win=1041 Len=1360 [TCP segment of a reassembled PDU]"
"332","14.444043","192.168.0.183","104.244.42.65","TCP","1414","50717  >  443 [ACK] Seq=65695 Ack=190208 Win=1041 Len=1360 [TCP segment of a reassembled PDU]"
"333","14.444043","192.168.0.183","104.244.42.65","TCP","1414","50717  >  443 [ACK] Seq=67055 Ack=190208 Win=1041 Len=1360 [TCP segment of a reassembled PDU]"
"334","14.444043","192.168.0.183","104.244.42.65","TCP","1414","50717  >  443 [ACK] Seq=68415 Ack=190208 Win=1041 Len=1360 [TCP segment of a reassembled PDU]"
"335","14.444043","192.168.0.183","104.244.42.65","TCP","1414","50717  >  443 [ACK] Seq=69775 Ack=190208 Win=1041 Len=1360 [TCP segment of a reassembled PDU]"
"336","14.444043","192.168.0.183","104.244.42.65","TCP","1414","50717  >  443 [ACK] Seq=71135 Ack=190208 Win=1041 Len=1360 [TCP segment of a reassembled PDU]"
"337","14.444043","192.168.0.183","104.244.42.65","TCP","1414","50717  >  443 [ACK] Seq=72495 Ack=190208 Win=1041 Len=1360 [TCP segment of a reassembled PDU]"
"338","14.444043","192.168.0.183","104.244.42.65","TLSv1.2","140","Application Data"
"339","14.444312","192.168.0.183","104.244.42.65","TCP","1414","50717  >  443 [ACK] Seq=73941 Ack=190208 Win=1041 Len=1360 [TCP segment of a reassembled PDU]"
"340","14.444312","192.168.0.183","104.244.42.65","TCP","1414","50717  >  443 [ACK] Seq=75301 Ack=190208 Win=1041 Len=1360 [TCP segment of a reassembled PDU]"
"341","14.444312","192.168.0.183","104.244.42.65","TCP","1414","50717  >  443 [ACK] Seq=76661 Ack=190208 Win=1041 Len=1360 [TCP segment of a reassembled PDU]"
"342","14.444312","192.168.0.183","104.244.42.65","TCP","1414","50717  >  443 [ACK] Seq=78021 Ack=190208 Win=1041 Len=1360 [TCP segment of a reassembled PDU]"
"343","14.444312","192.168.0.183","104.244.42.65","TCP","1414","50717  >  443 [ACK] Seq=79381 Ack=190208 Win=1041 Len=1360 [TCP segment of a reassembled PDU]"
"344","14.444312","192.168.0.183","104.244.42.65","TCP","1414","50717  >  443 [ACK] Seq=80741 Ack=190208 Win=1041 Len=1360 [TCP segment of a reassembled PDU]"
"345","14.444312","192.168.0.183","104.244.42.65","TCP","1414","50717  >  443 [ACK] Seq=82101 Ack=190208 Win=1041 Len=1360 [TCP segment of a reassembled PDU]"
"346","14.444312","192.168.0.183","104.244.42.65","TCP","1414","50717  >  443 [ACK] Seq=83461 Ack=190208 Win=1041 Len=1360 [TCP segment of a reassembled PDU]"
"347","14.444312","192.168.0.183","104.244.42.65","TCP","1414","50717  >  443 [ACK] Seq=84821 Ack=190208 Win=1041 Len=1360 [TCP segment of a reassembled PDU]"
"348","14.444312","192.168.0.183","104.244.42.65","TCP","1414","50717  >  443 [ACK] Seq=86181 Ack=190208 Win=1041 Len=1360 [TCP segment of a reassembled PDU]"
"349","14.444312","192.168.0.183","104.244.42.65","TCP","1414","50717  >  443 [ACK] Seq=87541 Ack=190208 Win=1041 Len=1360 [TCP segment of a reassembled PDU]"
"350","14.444312","192.168.0.183","104.244.42.65","TCP","1414","50717  >  443 [ACK] Seq=88901 Ack=190208 Win=1041 Len=1360 [TCP segment of a reassembled PDU]"
"351","14.444312","192.168.0.183","104.244.42.65","TLSv1.2","140","Application Data"
"352","14.444598","192.168.0.183","104.244.42.65","TCP","1414","50717  >  443 [ACK] Seq=90347 Ack=190208 Win=1041 Len=1360 [TCP segment of a reassembled PDU]"
"353","14.444598","192.168.0.183","104.244.42.65","TCP","1414","50717  >  443 [ACK] Seq=91707 Ack=190208 Win=1041 Len=1360 [TCP segment of a reassembled PDU]"
"354","14.444598","192.168.0.183","104.244.42.65","TCP","1414","50717  >  443 [ACK] Seq=93067 Ack=190208 Win=1041 Len=1360 [TCP segment of a reassembled PDU]"
"355","14.444598","192.168.0.183","104.244.42.65","TCP","1414","50717  >  443 [ACK] Seq=94427 Ack=190208 Win=1041 Len=1360 [TCP segment of a reassembled PDU]"
"356","14.444598","192.168.0.183","104.244.42.65","TCP","1414","50717  >  443 [ACK] Seq=95787 Ack=190208 Win=1041 Len=1360 [TCP segment of a reassembled PDU]"
"357","14.444598","192.168.0.183","104.244.42.65","TCP","1414","50717  >  443 [ACK] Seq=97147 Ack=190208 Win=1041 Len=1360 [TCP segment of a reassembled PDU]"
"358","14.444598","192.168.0.183","104.244.42.65","TCP","1414","50717  >  443 [ACK] Seq=98507 Ack=190208 Win=1041 Len=1360 [TCP segment of a reassembled PDU]"
"359","14.444598","192.168.0.183","104.244.42.65","TCP","1414","50717  >  443 [ACK] Seq=99867 Ack=190208 Win=1041 Len=1360 [TCP segment of a reassembled PDU]"
"360","14.444598","192.168.0.183","104.244.42.65","TCP","1414","50717  >  443 [ACK] Seq=101227 Ack=190208 Win=1041 Len=1360 [TCP segment of a reassembled PDU]"
"361","14.444598","192.168.0.183","104.244.42.65","TCP","1414","50717  >  443 [ACK] Seq=102587 Ack=190208 Win=1041 Len=1360 [TCP segment of a reassembled PDU]"
"362","14.444598","192.168.0.183","104.244.42.65","TCP","1414","50717  >  443 [ACK] Seq=103947 Ack=190208 Win=1041 Len=1360 [TCP segment of a reassembled PDU]"
"363","14.444598","192.168.0.183","104.244.42.65","TLSv1.2","365","Application Data"
"364","14.473482","104.244.42.65","192.168.0.183","TCP","60","443  >  50717 [ACK] Seq=190208 Ack=58895 Win=1641 Len=0"
"365","14.480323","104.244.42.65","192.168.0.183","TCP","60","443  >  50717 [ACK] Seq=190208 Ack=105618 Win=2006 Len=0"
"366","14.480323","104.244.42.65","192.168.0.183","TLSv1.2","89","Application Data"
"367","14.530158","104.244.42.65","192.168.0.183","TLSv1.2","184","Application Data"
"368","14.530286","192.168.0.183","104.244.42.65","TCP","54","50717  >  443 [ACK] Seq=105618 Ack=190373 Win=1040 Len=0"
"369","15.309786","192.168.0.183","104.244.42.193","TCP","55","50716  >  443 [ACK] Seq=1 Ack=1 Win=260 Len=1 [TCP segment of a reassembled PDU]"
"370","15.355142","104.244.42.193","192.168.0.183","TCP","66","443  >  50716 [ACK] Seq=1 Ack=2 Win=278 Len=0 SLE=1 SRE=2"
"371","16.699703","192.168.0.183","104.244.42.65","TLSv1.2","255","Application Data"
"372","16.699799","192.168.0.183","104.244.42.65","TCP","1414","50717  >  443 [ACK] Seq=105819 Ack=190373 Win=1040 Len=1360 [TCP segment of a reassembled PDU]"
"373","16.699799","192.168.0.183","104.244.42.65","TCP","1414","50717  >  443 [ACK] Seq=107179 Ack=190373 Win=1040 Len=1360 [TCP segment of a reassembled PDU]"
"374","16.699799","192.168.0.183","104.244.42.65","TLSv1.2","952","Application Data"
"375","16.729371","104.244.42.65","192.168.0.183","TCP","60","443  >  50717 [ACK] Seq=190373 Ack=107179 Win=2028 Len=0"
"376","16.736163","104.244.42.65","192.168.0.183","TCP","60","443  >  50717 [ACK] Seq=190373 Ack=109437 Win=2045 Len=0"
"377","16.765927","104.244.42.65","192.168.0.183","TLSv1.2","320","Application Data"
"378","16.766622","192.168.0.183","104.244.42.65","TLSv1.2","89","Application Data"
"379","16.831644","104.244.42.65","192.168.0.183","TCP","60","443  >  50717 [ACK] Seq=190639 Ack=109472 Win=2045 Len=0"
"380","17.445284","192.168.0.183","104.244.42.65","TLSv1.2","261","Application Data"
"381","17.445429","192.168.0.183","104.244.42.65","TCP","1414","50717  >  443 [ACK] Seq=109679 Ack=190639 Win=1039 Len=1360 [TCP segment of a reassembled PDU]"
"382","17.445429","192.168.0.183","104.244.42.65","TCP","1414","50717  >  443 [ACK] Seq=111039 Ack=190639 Win=1039 Len=1360 [TCP segment of a reassembled PDU]"
"383","17.445429","192.168.0.183","104.244.42.65","TCP","1414","50717  >  443 [ACK] Seq=112399 Ack=190639 Win=1039 Len=1360 [TCP segment of a reassembled PDU]"
"384","17.445429","192.168.0.183","104.244.42.65","TCP","1414","50717  >  443 [ACK] Seq=113759 Ack=190639 Win=1039 Len=1360 [TCP segment of a reassembled PDU]"
"385","17.445429","192.168.0.183","104.244.42.65","TCP","1414","50717  >  443 [ACK] Seq=115119 Ack=190639 Win=1039 Len=1360 [TCP segment of a reassembled PDU]"
"386","17.445429","192.168.0.183","104.244.42.65","TCP","1414","50717  >  443 [ACK] Seq=116479 Ack=190639 Win=1039 Len=1360 [TCP segment of a reassembled PDU]"
"387","17.445429","192.168.0.183","104.244.42.65","TCP","1414","50717  >  443 [ACK] Seq=117839 Ack=190639 Win=1039 Len=1360 [TCP segment of a reassembled PDU]"
"388","17.445429","192.168.0.183","104.244.42.65","TCP","1414","50717  >  443 [ACK] Seq=119199 Ack=190639 Win=1039 Len=1360 [TCP segment of a reassembled PDU]"
"389","17.445429","192.168.0.183","104.244.42.65","TCP","1414","50717  >  443 [ACK] Seq=120559 Ack=190639 Win=1039 Len=1360 [TCP segment of a reassembled PDU]"
"390","17.445429","192.168.0.183","104.244.42.65","TCP","1414","50717  >  443 [ACK] Seq=121919 Ack=190639 Win=1039 Len=1360 [TCP segment of a reassembled PDU]"
"391","17.445429","192.168.0.183","104.244.42.65","TCP","1414","50717  >  443 [ACK] Seq=123279 Ack=190639 Win=1039 Len=1360 [TCP segment of a reassembled PDU]"
"392","17.445429","192.168.0.183","104.244.42.65","TCP","1414","50717  >  443 [ACK] Seq=124639 Ack=190639 Win=1039 Len=1360 [TCP segment of a reassembled PDU]"
"393","17.445429","192.168.0.183","104.244.42.65","TLSv1.2","140","Application Data"
"394","17.445601","192.168.0.183","104.244.42.65","TCP","1414","50717  >  443 [ACK] Seq=126085 Ack=190639 Win=1039 Len=1360 [TCP segment of a reassembled PDU]"
"395","17.445601","192.168.0.183","104.244.42.65","TCP","1414","50717  >  443 [ACK] Seq=127445 Ack=190639 Win=1039 Len=1360 [TCP segment of a reassembled PDU]"
"396","17.445601","192.168.0.183","104.244.42.65","TCP","1414","50717  >  443 [ACK] Seq=128805 Ack=190639 Win=1039 Len=1360 [TCP segment of a reassembled PDU]"
"397","17.445601","192.168.0.183","104.244.42.65","TCP","1414","50717  >  443 [ACK] Seq=130165 Ack=190639 Win=1039 Len=1360 [TCP segment of a reassembled PDU]"
"398","17.445601","192.168.0.183","104.244.42.65","TCP","1414","50717  >  443 [ACK] Seq=131525 Ack=190639 Win=1039 Len=1360 [TCP segment of a reassembled PDU]"
"399","17.445601","192.168.0.183","104.244.42.65","TCP","1414","50717  >  443 [ACK] Seq=132885 Ack=190639 Win=1039 Len=1360 [TCP segment of a reassembled PDU]"
"400","17.445601","192.168.0.183","104.244.42.65","TCP","1414","50717  >  443 [ACK] Seq=134245 Ack=190639 Win=1039 Len=1360 [TCP segment of a reassembled PDU]"
"401","17.445601","192.168.0.183","104.244.42.65","TCP","1414","50717  >  443 [ACK] Seq=135605 Ack=190639 Win=1039 Len=1360 [TCP segment of a reassembled PDU]"
"402","17.445601","192.168.0.183","104.244.42.65","TCP","1414","50717  >  443 [ACK] Seq=136965 Ack=190639 Win=1039 Len=1360 [TCP segment of a reassembled PDU]"
"403","17.445601","192.168.0.183","104.244.42.65","TCP","1414","50717  >  443 [ACK] Seq=138325 Ack=190639 Win=1039 Len=1360 [TCP segment of a reassembled PDU]"
"404","17.445601","192.168.0.183","104.244.42.65","TCP","1414","50717  >  443 [ACK] Seq=139685 Ack=190639 Win=1039 Len=1360 [TCP segment of a reassembled PDU]"
"405","17.445601","192.168.0.183","104.244.42.65","TLSv1.2","1056","Application Data"
"406","17.482360","104.244.42.65","192.168.0.183","TCP","60","443  >  50717 [ACK] Seq=190639 Ack=142047 Win=2309 Len=0"
"407","17.514357","104.244.42.65","192.168.0.183","TLSv1.2","191","Application Data"
"408","17.558980","192.168.0.183","104.244.42.65","TCP","54","50717  >  443 [ACK] Seq=142047 Ack=190776 Win=1039 Len=0"
"409","20.447828","192.168.0.183","104.244.42.65","TLSv1.2","811","Application Data"
"410","20.447947","192.168.0.183","104.244.42.65","TCP","1414","50717  >  443 [ACK] Seq=142804 Ack=190776 Win=1039 Len=1360 [TCP segment of a reassembled PDU]"
"411","20.447947","192.168.0.183","104.244.42.65","TCP","1414","50717  >  443 [ACK] Seq=144164 Ack=190776 Win=1039 Len=1360 [TCP segment of a reassembled PDU]"
"412","20.447947","192.168.0.183","104.244.42.65","TCP","1414","50717  >  443 [ACK] Seq=145524 Ack=190776 Win=1039 Len=1360 [TCP segment of a reassembled PDU]"
"413","20.447947","192.168.0.183","104.244.42.65","TCP","1414","50717  >  443 [ACK] Seq=146884 Ack=190776 Win=1039 Len=1360 [TCP segment of a reassembled PDU]"
"414","20.447947","192.168.0.183","104.244.42.65","TCP","1414","50717  >  443 [ACK] Seq=148244 Ack=190776 Win=1039 Len=1360 [TCP segment of a reassembled PDU]"
"415","20.447947","192.168.0.183","104.244.42.65","TCP","1414","50717  >  443 [ACK] Seq=149604 Ack=190776 Win=1039 Len=1360 [TCP segment of a reassembled PDU]"
"416","20.447947","192.168.0.183","104.244.42.65","TCP","1414","50717  >  443 [ACK] Seq=150964 Ack=190776 Win=1039 Len=1360 [TCP segment of a reassembled PDU]"
"417","20.447947","192.168.0.183","104.244.42.65","TCP","1414","50717  >  443 [ACK] Seq=152324 Ack=190776 Win=1039 Len=1360 [TCP segment of a reassembled PDU]"
"418","20.447947","192.168.0.183","104.244.42.65","TLSv1.2","1387","Application Data"
"419","20.481951","104.244.42.65","192.168.0.183","TCP","60","443  >  50717 [ACK] Seq=190776 Ack=146884 Win=2351 Len=0"
"420","20.485327","104.244.42.65","192.168.0.183","TCP","60","443  >  50717 [ACK] Seq=190776 Ack=155017 Win=2415 Len=0"
"421","20.528929","104.244.42.65","192.168.0.183","TLSv1.2","184","Application Data"
"422","20.581288","192.168.0.183","104.244.42.65","TCP","54","50717  >  443 [ACK] Seq=155017 Ack=190906 Win=1038 Len=0"
"423","23.454045","192.168.0.183","104.244.42.65","TLSv1.2","324","Application Data"
"424","23.454168","192.168.0.183","104.244.42.65","TCP","1414","50717  >  443 [ACK] Seq=155287 Ack=190906 Win=1038 Len=1360 [TCP segment of a reassembled PDU]"
"425","23.454168","192.168.0.183","104.244.42.65","TCP","1414","50717  >  443 [ACK] Seq=156647 Ack=190906 Win=1038 Len=1360 [TCP segment of a reassembled PDU]"
"426","23.454168","192.168.0.183","104.244.42.65","TCP","1414","50717  >  443 [ACK] Seq=158007 Ack=190906 Win=1038 Len=1360 [TCP segment of a reassembled PDU]"
"427","23.454168","192.168.0.183","104.244.42.65","TCP","1414","50717  >  443 [ACK] Seq=159367 Ack=190906 Win=1038 Len=1360 [TCP segment of a reassembled PDU]"
"428","23.454168","192.168.0.183","104.244.42.65","TCP","1414","50717  >  443 [ACK] Seq=160727 Ack=190906 Win=1038 Len=1360 [TCP segment of a reassembled PDU]"
"429","23.454168","192.168.0.183","104.244.42.65","TCP","1414","50717  >  443 [ACK] Seq=162087 Ack=190906 Win=1038 Len=1360 [TCP segment of a reassembled PDU]"
"430","23.454168","192.168.0.183","104.244.42.65","TLSv1.2","1260","Application Data"
"431","23.485355","104.244.42.65","192.168.0.183","TCP","60","443  >  50717 [ACK] Seq=190906 Ack=156647 Win=2436 Len=0"
"432","23.493582","104.244.42.65","192.168.0.183","TCP","60","443  >  50717 [ACK] Seq=190906 Ack=164653 Win=2499 Len=0"
"433","23.521240","104.244.42.65","192.168.0.183","TLSv1.2","184","Application Data"
"434","23.570936","192.168.0.183","104.244.42.65","TCP","54","50717  >  443 [ACK] Seq=164653 Ack=191036 Win=1038 Len=0"
"435","24.183369","192.168.0.183","104.244.42.65","TLSv1.2","234","Application Data"
"436","24.183458","192.168.0.183","104.244.42.65","TLSv1.2","783","Application Data"
"437","24.215702","104.244.42.65","192.168.0.183","TCP","60","443  >  50717 [ACK] Seq=191036 Ack=165562 Win=2520 Len=0"
"438","24.235622","104.244.42.65","192.168.0.183","TLSv1.2","184","Application Data"
"439","24.286045","192.168.0.183","104.244.42.65","TCP","54","50717  >  443 [ACK] Seq=165562 Ack=191166 Win=1037 Len=0"
"440","26.456133","192.168.0.183","104.244.42.65","TLSv1.2","240","Application Data"
"441","26.456226","192.168.0.183","104.244.42.65","TCP","1414","50717  >  443 [ACK] Seq=165748 Ack=191166 Win=1037 Len=1360 [TCP segment of a reassembled PDU]"
"442","26.456226","192.168.0.183","104.244.42.65","TCP","1414","50717  >  443 [ACK] Seq=167108 Ack=191166 Win=1037 Len=1360 [TCP segment of a reassembled PDU]"
"443","26.456226","192.168.0.183","104.244.42.65","TCP","1414","50717  >  443 [ACK] Seq=168468 Ack=191166 Win=1037 Len=1360 [TCP segment of a reassembled PDU]"
"444","26.456226","192.168.0.183","104.244.42.65","TCP","1414","50717  >  443 [ACK] Seq=169828 Ack=191166 Win=1037 Len=1360 [TCP segment of a reassembled PDU]"
"445","26.456226","192.168.0.183","104.244.42.65","TCP","1414","50717  >  443 [ACK] Seq=171188 Ack=191166 Win=1037 Len=1360 [TCP segment of a reassembled PDU]"
"446","26.456226","192.168.0.183","104.244.42.65","TLSv1.2","1381","Application Data"
"447","26.487486","104.244.42.65","192.168.0.183","TCP","60","443  >  50717 [ACK] Seq=191166 Ack=167108 Win=2541 Len=0"
"448","26.496820","104.244.42.65","192.168.0.183","TCP","60","443  >  50717 [ACK] Seq=191166 Ack=173875 Win=2594 Len=0"
"449","26.516871","104.244.42.65","192.168.0.183","TLSv1.2","182","Application Data"
"450","26.558467","192.168.0.183","104.244.42.65","TCP","54","50717  >  443 [ACK] Seq=173875 Ack=191294 Win=1037 Len=0"
"451","29.480576","192.168.0.183","104.244.42.65","TLSv1.2","685","Application Data"
"452","29.480763","192.168.0.183","104.244.42.65","TCP","1414","50717  >  443 [ACK] Seq=174506 Ack=191294 Win=1037 Len=1360 [TCP segment of a reassembled PDU]"
"453","29.480763","192.168.0.183","104.244.42.65","TCP","1414","50717  >  443 [ACK] Seq=175866 Ack=191294 Win=1037 Len=1360 [TCP segment of a reassembled PDU]"
"454","29.480763","192.168.0.183","104.244.42.65","TCP","1414","50717  >  443 [ACK] Seq=177226 Ack=191294 Win=1037 Len=1360 [TCP segment of a reassembled PDU]"
"455","29.480763","192.168.0.183","104.244.42.65","TCP","1414","50717  >  443 [ACK] Seq=178586 Ack=191294 Win=1037 Len=1360 [TCP segment of a reassembled PDU]"
"456","29.480763","192.168.0.183","104.244.42.65","TCP","1414","50717  >  443 [ACK] Seq=179946 Ack=191294 Win=1037 Len=1360 [TCP segment of a reassembled PDU]"
"457","29.480763","192.168.0.183","104.244.42.65","TCP","1414","50717  >  443 [ACK] Seq=181306 Ack=191294 Win=1037 Len=1360 [TCP segment of a reassembled PDU]"
"458","29.480763","192.168.0.183","104.244.42.65","TCP","1414","50717  >  443 [ACK] Seq=182666 Ack=191294 Win=1037 Len=1360 [TCP segment of a reassembled PDU]"
"459","29.480763","192.168.0.183","104.244.42.65","TCP","1414","50717  >  443 [ACK] Seq=184026 Ack=191294 Win=1037 Len=1360 [TCP segment of a reassembled PDU]"
"460","29.480763","192.168.0.183","104.244.42.65","TCP","1414","50717  >  443 [ACK] Seq=185386 Ack=191294 Win=1037 Len=1360 [TCP segment of a reassembled PDU]"
"461","29.480763","192.168.0.183","104.244.42.65","TCP","1414","50717  >  443 [ACK] Seq=186746 Ack=191294 Win=1037 Len=1360 [TCP segment of a reassembled PDU]"
"462","29.480763","192.168.0.183","104.244.42.65","TCP","1414","50717  >  443 [ACK] Seq=188106 Ack=191294 Win=1037 Len=1360 [TCP segment of a reassembled PDU]"
"463","29.480763","192.168.0.183","104.244.42.65","TCP","1414","50717  >  443 [ACK] Seq=189466 Ack=191294 Win=1037 Len=1360 [TCP segment of a reassembled PDU]"
"464","29.480763","192.168.0.183","104.244.42.65","TLSv1.2","140","Application Data"
"465","29.480921","192.168.0.183","104.244.42.65","TCP","1414","50717  >  443 [ACK] Seq=190912 Ack=191294 Win=1037 Len=1360 [TCP segment of a reassembled PDU]"
"466","29.480921","192.168.0.183","104.244.42.65","TLSv1.2","605","Application Data"
"467","29.527104","104.244.42.65","192.168.0.183","TCP","60","443  >  50717 [ACK] Seq=191294 Ack=175866 Win=2615 Len=0"
"468","29.527104","104.244.42.65","192.168.0.183","TCP","60","443  >  50717 [ACK] Seq=191294 Ack=192823 Win=2748 Len=0"
"469","29.557063","104.244.42.65","192.168.0.183","TLSv1.2","275","Application Data"
"470","29.603054","192.168.0.183","104.244.42.65","TCP","54","50717  >  443 [ACK] Seq=192823 Ack=191515 Win=1036 Len=0"
"471","32.281087","192.168.0.183","104.244.42.65","TLSv1.2","930","Application Data"
"472","32.281203","192.168.0.183","104.244.42.65","TLSv1.2","248","Application Data"
"473","32.340452","104.244.42.65","192.168.0.183","TCP","60","443  >  50717 [ACK] Seq=191515 Ack=193893 Win=2769 Len=0"
"474","32.340452","104.244.42.65","192.168.0.183","TLSv1.2","421","Application Data"
"475","32.341474","192.168.0.183","104.244.42.65","TLSv1.2","89","Application Data"
"476","32.346067","104.244.42.65","192.168.0.183","TLSv1.2","457","Application Data"
"477","32.400432","192.168.0.183","104.244.42.65","TCP","54","50717  >  443 [ACK] Seq=193928 Ack=192285 Win=1039 Len=0"
"478","32.417425","104.244.42.65","192.168.0.183","TCP","60","443  >  50717 [ACK] Seq=192285 Ack=193928 Win=2769 Len=0"
"479","32.523094","192.168.0.183","104.244.42.65","TLSv1.2","260","Application Data"
"480","32.523272","192.168.0.183","104.244.42.65","TCP","1414","50717  >  443 [ACK] Seq=194134 Ack=192285 Win=1039 Len=1360 [TCP segment of a reassembled PDU]"
"481","32.523272","192.168.0.183","104.244.42.65","TCP","1414","50717  >  443 [ACK] Seq=195494 Ack=192285 Win=1039 Len=1360 [TCP segment of a reassembled PDU]"
"482","32.523272","192.168.0.183","104.244.42.65","TCP","1414","50717  >  443 [ACK] Seq=196854 Ack=192285 Win=1039 Len=1360 [TCP segment of a reassembled PDU]"
"483","32.523272","192.168.0.183","104.244.42.65","TCP","1414","50717  >  443 [ACK] Seq=198214 Ack=192285 Win=1039 Len=1360 [TCP segment of a reassembled PDU]"
"484","32.523272","192.168.0.183","104.244.42.65","TCP","1414","50717  >  443 [ACK] Seq=199574 Ack=192285 Win=1039 Len=1360 [TCP segment of a reassembled PDU]"
"485","32.523272","192.168.0.183","104.244.42.65","TCP","1414","50717  >  443 [ACK] Seq=200934 Ack=192285 Win=1039 Len=1360 [TCP segment of a reassembled PDU]"
"486","32.523272","192.168.0.183","104.244.42.65","TCP","1414","50717  >  443 [ACK] Seq=202294 Ack=192285 Win=1039 Len=1360 [TCP segment of a reassembled PDU]"
"487","32.523272","192.168.0.183","104.244.42.65","TCP","1414","50717  >  443 [ACK] Seq=203654 Ack=192285 Win=1039 Len=1360 [TCP segment of a reassembled PDU]"
"488","32.523272","192.168.0.183","104.244.42.65","TCP","1414","50717  >  443 [ACK] Seq=205014 Ack=192285 Win=1039 Len=1360 [TCP segment of a reassembled PDU]"
"489","32.523272","192.168.0.183","104.244.42.65","TCP","1414","50717  >  443 [ACK] Seq=206374 Ack=192285 Win=1039 Len=1360 [TCP segment of a reassembled PDU]"
"490","32.523272","192.168.0.183","104.244.42.65","TCP","1414","50717  >  443 [ACK] Seq=207734 Ack=192285 Win=1039 Len=1360 [TCP segment of a reassembled PDU]"
"491","32.523272","192.168.0.183","104.244.42.65","TCP","1414","50717  >  443 [ACK] Seq=209094 Ack=192285 Win=1039 Len=1360 [TCP segment of a reassembled PDU]"
"492","32.523272","192.168.0.183","104.244.42.65","TLSv1.2","140","Application Data"
"493","32.523462","192.168.0.183","104.244.42.65","TCP","1414","50717  >  443 [ACK] Seq=210540 Ack=192285 Win=1039 Len=1360 [TCP segment of a reassembled PDU]"
"494","32.523462","192.168.0.183","104.244.42.65","TCP","1414","50717  >  443 [ACK] Seq=211900 Ack=192285 Win=1039 Len=1360 [TCP segment of a reassembled PDU]"
"495","32.523462","192.168.0.183","104.244.42.65","TCP","1414","50717  >  443 [ACK] Seq=213260 Ack=192285 Win=1039 Len=1360 [TCP segment of a reassembled PDU]"
"496","32.523462","192.168.0.183","104.244.42.65","TCP","1414","50717  >  443 [ACK] Seq=214620 Ack=192285 Win=1039 Len=1360 [TCP segment of a reassembled PDU]"
"497","32.523462","192.168.0.183","104.244.42.65","TCP","1414","50717  >  443 [ACK] Seq=215980 Ack=192285 Win=1039 Len=1360 [TCP segment of a reassembled PDU]"
"498","32.523462","192.168.0.183","104.244.42.65","TCP","1414","50717  >  443 [ACK] Seq=217340 Ack=192285 Win=1039 Len=1360 [TCP segment of a reassembled PDU]"
"499","32.523462","192.168.0.183","104.244.42.65","TCP","1414","50717  >  443 [ACK] Seq=218700 Ack=192285 Win=1039 Len=1360 [TCP segment of a reassembled PDU]"
"500","32.523462","192.168.0.183","104.244.42.65","TCP","1414","50717  >  443 [ACK] Seq=220060 Ack=192285 Win=1039 Len=1360 [TCP segment of a reassembled PDU]"
"501","32.523462","192.168.0.183","104.244.42.65","TCP","1414","50717  >  443 [ACK] Seq=221420 Ack=192285 Win=1039 Len=1360 [TCP segment of a reassembled PDU]"
"502","32.523462","192.168.0.183","104.244.42.65","TCP","1414","50717  >  443 [ACK] Seq=222780 Ack=192285 Win=1039 Len=1360 [TCP segment of a reassembled PDU]"
"503","32.523462","192.168.0.183","104.244.42.65","TCP","1414","50717  >  443 [ACK] Seq=224140 Ack=192285 Win=1039 Len=1360 [TCP segment of a reassembled PDU]"
"504","32.523462","192.168.0.183","104.244.42.65","TCP","1414","50717  >  443 [ACK] Seq=225500 Ack=192285 Win=1039 Len=1360 [TCP segment of a reassembled PDU]"
"505","32.523462","192.168.0.183","104.244.42.65","TLSv1.2","140","Application Data"
"506","32.523689","192.168.0.183","104.244.42.65","TCP","1414","50717  >  443 [ACK] Seq=226946 Ack=192285 Win=1039 Len=1360 [TCP segment of a reassembled PDU]"
"507","32.523689","192.168.0.183","104.244.42.65","TCP","1414","50717  >  443 [ACK] Seq=228306 Ack=192285 Win=1039 Len=1360 [TCP segment of a reassembled PDU]"
"508","32.523689","192.168.0.183","104.244.42.65","TLSv1.2","1215","Application Data"
"509","32.553761","104.244.42.65","192.168.0.183","TCP","60","443  >  50717 [ACK] Seq=192285 Ack=195494 Win=2790 Len=0"
"510","32.559290","104.244.42.65","192.168.0.183","TCP","60","443  >  50717 [ACK] Seq=192285 Ack=213260 Win=2929 Len=0"
"511","32.559290","104.244.42.65","192.168.0.183","TCP","60","443  >  50717 [ACK] Seq=192285 Ack=230827 Win=3066 Len=0"
"512","32.559290","104.244.42.65","192.168.0.183","TLSv1.2","89","Application Data"
"513","32.600474","192.168.0.183","104.244.42.65","TCP","54","50717  >  443 [ACK] Seq=230827 Ack=192320 Win=1039 Len=0"
"514","32.611973","104.244.42.65","192.168.0.183","TLSv1.2","181","Application Data"
"515","32.662420","192.168.0.183","104.244.42.65","TCP","54","50717  >  443 [ACK] Seq=230827 Ack=192447 Win=1039 Len=0"
"516","35.655452","192.168.0.183","104.244.42.65","TLSv1.2","809","Application Data"
"517","35.655601","192.168.0.183","104.244.42.65","TCP","1414","50717  >  443 [ACK] Seq=231582 Ack=192447 Win=1039 Len=1360 [TCP segment of a reassembled PDU]"
"518","35.655601","192.168.0.183","104.244.42.65","TCP","1414","50717  >  443 [ACK] Seq=232942 Ack=192447 Win=1039 Len=1360 [TCP segment of a reassembled PDU]"
"519","35.655601","192.168.0.183","104.244.42.65","TCP","1414","50717  >  443 [ACK] Seq=234302 Ack=192447 Win=1039 Len=1360 [TCP segment of a reassembled PDU]"
"520","35.655601","192.168.0.183","104.244.42.65","TCP","1414","50717  >  443 [ACK] Seq=235662 Ack=192447 Win=1039 Len=1360 [TCP segment of a reassembled PDU]"
"521","35.655601","192.168.0.183","104.244.42.65","TCP","1414","50717  >  443 [ACK] Seq=237022 Ack=192447 Win=1039 Len=1360 [TCP segment of a reassembled PDU]"
"522","35.655601","192.168.0.183","104.244.42.65","TCP","1414","50717  >  443 [ACK] Seq=238382 Ack=192447 Win=1039 Len=1360 [TCP segment of a reassembled PDU]"
"523","35.655601","192.168.0.183","104.244.42.65","TCP","1414","50717  >  443 [ACK] Seq=239742 Ack=192447 Win=1039 Len=1360 [TCP segment of a reassembled PDU]"
"524","35.655601","192.168.0.183","104.244.42.65","TCP","1414","50717  >  443 [ACK] Seq=241102 Ack=192447 Win=1039 Len=1360 [TCP segment of a reassembled PDU]"
"525","35.655601","192.168.0.183","104.244.42.65","TCP","1414","50717  >  443 [ACK] Seq=242462 Ack=192447 Win=1039 Len=1360 [TCP segment of a reassembled PDU]"
"526","35.655601","192.168.0.183","104.244.42.65","TCP","1414","50717  >  443 [ACK] Seq=243822 Ack=192447 Win=1039 Len=1360 [TCP segment of a reassembled PDU]"
"527","35.655601","192.168.0.183","104.244.42.65","TCP","1414","50717  >  443 [ACK] Seq=245182 Ack=192447 Win=1039 Len=1360 [TCP segment of a reassembled PDU]"
"528","35.655601","192.168.0.183","104.244.42.65","TCP","1414","50717  >  443 [ACK] Seq=246542 Ack=192447 Win=1039 Len=1360 [TCP segment of a reassembled PDU]"
"529","35.655601","192.168.0.183","104.244.42.65","TLSv1.2","140","Application Data"
"530","35.655747","192.168.0.183","104.244.42.65","TCP","1414","50717  >  443 [ACK] Seq=247988 Ack=192447 Win=1039 Len=1360 [TCP segment of a reassembled PDU]"
"531","35.655747","192.168.0.183","104.244.42.65","TCP","1414","50717  >  443 [ACK] Seq=249348 Ack=192447 Win=1039 Len=1360 [TCP segment of a reassembled PDU]"
"532","35.655747","192.168.0.183","104.244.42.65","TCP","1414","50717  >  443 [ACK] Seq=250708 Ack=192447 Win=1039 Len=1360 [TCP segment of a reassembled PDU]"
"533","35.655747","192.168.0.183","104.244.42.65","TCP","1414","50717  >  443 [ACK] Seq=252068 Ack=192447 Win=1039 Len=1360 [TCP segment of a reassembled PDU]"
"534","35.655747","192.168.0.183","104.244.42.65","TCP","1414","50717  >  443 [ACK] Seq=253428 Ack=192447 Win=1039 Len=1360 [TCP segment of a reassembled PDU]"
"535","35.655747","192.168.0.183","104.244.42.65","TCP","1414","50717  >  443 [ACK] Seq=254788 Ack=192447 Win=1039 Len=1360 [TCP segment of a reassembled PDU]"
"536","35.655747","192.168.0.183","104.244.42.65","TCP","1414","50717  >  443 [ACK] Seq=256148 Ack=192447 Win=1039 Len=1360 [TCP segment of a reassembled PDU]"
"537","35.655747","192.168.0.183","104.244.42.65","TLSv1.2","983","Application Data"
"538","35.687296","104.244.42.65","192.168.0.183","TCP","60","443  >  50717 [ACK] Seq=192447 Ack=232942 Win=3087 Len=0"
"539","35.692880","104.244.42.65","192.168.0.183","TCP","60","443  >  50717 [ACK] Seq=192447 Ack=258437 Win=3287 Len=0"
"540","35.730570","104.244.42.65","192.168.0.183","TLSv1.2","184","Application Data"
"541","35.775502","192.168.0.183","104.244.42.65","TCP","54","50717  >  443 [ACK] Seq=258437 Ack=192577 Win=1038 Len=0"
