"No.","Time","Source","Destination","Protocol","Length","Info"
"1","0.000000","192.168.0.183","104.244.42.65","TLSv1.2","238","Application Data"
"2","0.000090","192.168.0.183","104.244.42.65","TLSv1.2","547","Application Data"
"3","0.040504","104.244.42.65","192.168.0.183","TCP","60","443  >  50717 [ACK] Seq=1 Ack=678 Win=5734 Len=0"
"4","0.054469","104.244.42.65","192.168.0.183","TLSv1.2","184","Application Data"
"5","0.061354","192.168.0.183","104.244.42.65","TLSv1.2","255","Application Data"
"6","0.061445","192.168.0.183","104.244.42.65","TLSv1.2","393","Application Data"
"7","0.093834","104.244.42.65","192.168.0.183","TCP","60","443  >  50717 [ACK] Seq=131 Ack=1218 Win=5735 Len=0"
"8","0.108309","104.244.42.65","192.168.0.183","TLSv1.2","157","Application Data"
"9","0.149553","192.168.0.183","104.244.42.65","TCP","54","50717  >  443 [ACK] Seq=1218 Ack=234 Win=1040 Len=0"
"10","0.801470","192.168.0.183","104.244.42.65","TCP","1414","50717  >  443 [ACK] Seq=1218 Ack=234 Win=1040 Len=1360 [TCP segment of a reassembled PDU]"
"11","0.801470","192.168.0.183","104.244.42.65","TLSv1.2","309","Application Data"
"12","0.802263","192.168.0.183","104.244.42.65","TLSv1.2","239","Application Data"
"13","0.839986","104.244.42.65","192.168.0.183","TCP","60","443  >  50717 [ACK] Seq=234 Ack=2833 Win=5731 Len=0"
"14","0.904277","104.244.42.65","192.168.0.183","TCP","60","443  >  50717 [ACK] Seq=234 Ack=3018 Win=5735 Len=0"
"15","1.147702","104.244.42.65","192.168.0.183","TLSv1.2","174","Application Data"
"16","1.198621","192.168.0.183","104.244.42.65","TCP","54","50717  >  443 [ACK] Seq=3018 Ack=354 Win=1040 Len=0"
"17","2.111243","104.244.42.65","192.168.0.183","TCP","1414","443  >  50717 [ACK] Seq=354 Ack=3018 Win=5735 Len=1360 [TCP segment of a reassembled PDU]"
"18","2.111243","104.244.42.65","192.168.0.183","TCP","1414","443  >  50717 [ACK] Seq=1714 Ack=3018 Win=5735 Len=1360 [TCP segment of a reassembled PDU]"
"19","2.111243","104.244.42.65","192.168.0.183","TCP","1414","443  >  50717 [PSH, ACK] Seq=3074 Ack=3018 Win=5735 Len=1360 [TCP segment of a reassembled PDU]"
"20","2.111243","104.244.42.65","192.168.0.183","TCP","1414","443  >  50717 [ACK] Seq=4434 Ack=3018 Win=5735 Len=1360 [TCP segment of a reassembled PDU]"
"21","2.111243","104.244.42.65","192.168.0.183","TCP","1414","443  >  50717 [ACK] Seq=5794 Ack=3018 Win=5735 Len=1360 [TCP segment of a reassembled PDU]"
"22","2.111243","104.244.42.65","192.168.0.183","TLSv1.2","437","Application Data"
"23","2.111298","192.168.0.183","104.244.42.65","TCP","54","50717  >  443 [ACK] Seq=3018 Ack=7537 Win=1041 Len=0"
"24","2.450941","192.168.0.183","104.244.42.65","TCP","1414","50717  >  443 [ACK] Seq=3018 Ack=7537 Win=1041 Len=1360 [TCP segment of a reassembled PDU]"
"25","2.450941","192.168.0.183","104.244.42.65","TLSv1.2","910","Application Data"
"26","2.484274","104.244.42.65","192.168.0.183","TCP","60","443  >  50717 [ACK] Seq=7537 Ack=5234 Win=5730 Len=0"
"27","3.011542","192.168.0.183","104.244.42.65","TLSv1.2","282","Application Data"
"28","3.011691","192.168.0.183","104.244.42.65","TCP","1414","50717  >  443 [ACK] Seq=5462 Ack=7537 Win=1041 Len=1360 [TCP segment of a reassembled PDU]"
"29","3.011691","192.168.0.183","104.244.42.65","TCP","1414","50717  >  443 [ACK] Seq=6822 Ack=7537 Win=1041 Len=1360 [TCP segment of a reassembled PDU]"
"30","3.011691","192.168.0.183","104.244.42.65","TCP","1414","50717  >  443 [ACK] Seq=8182 Ack=7537 Win=1041 Len=1360 [TCP segment of a reassembled PDU]"
"31","3.011691","192.168.0.183","104.244.42.65","TCP","1414","50717  >  443 [ACK] Seq=9542 Ack=7537 Win=1041 Len=1360 [TCP segment of a reassembled PDU]"
"32","3.011691","192.168.0.183","104.244.42.65","TCP","1414","50717  >  443 [ACK] Seq=10902 Ack=7537 Win=1041 Len=1360 [TCP segment of a reassembled PDU]"
"33","3.011691","192.168.0.183","104.244.42.65","TCP","1414","50717  >  443 [ACK] Seq=12262 Ack=7537 Win=1041 Len=1360 [TCP segment of a reassembled PDU]"
"34","3.011691","192.168.0.183","104.244.42.65","TCP","1414","50717  >  443 [ACK] Seq=13622 Ack=7537 Win=1041 Len=1360 [TCP segment of a reassembled PDU]"
"35","3.011691","192.168.0.183","104.244.42.65","TCP","1414","50717  >  443 [ACK] Seq=14982 Ack=7537 Win=1041 Len=1360 [TCP segment of a reassembled PDU]"
"36","3.011691","192.168.0.183","104.244.42.65","TCP","1414","50717  >  443 [ACK] Seq=16342 Ack=7537 Win=1041 Len=1360 [TCP segment of a reassembled PDU]"
"37","3.011691","192.168.0.183","104.244.42.65","TCP","1414","50717  >  443 [ACK] Seq=17702 Ack=7537 Win=1041 Len=1360 [TCP segment of a reassembled PDU]"
"38","3.011691","192.168.0.183","104.244.42.65","TCP","1414","50717  >  443 [ACK] Seq=19062 Ack=7537 Win=1041 Len=1360 [TCP segment of a reassembled PDU]"
"39","3.011691","192.168.0.183","104.244.42.65","TCP","1414","50717  >  443 [ACK] Seq=20422 Ack=7537 Win=1041 Len=1360 [TCP segment of a reassembled PDU]"
"40","3.011691","192.168.0.183","104.244.42.65","TLSv1.2","140","Application Data"
"41","3.011832","192.168.0.183","104.244.42.65","TCP","1414","50717  >  443 [ACK] Seq=21868 Ack=7537 Win=1041 Len=1360 [TCP segment of a reassembled PDU]"
"42","3.011832","192.168.0.183","104.244.42.65","TCP","1414","50717  >  443 [ACK] Seq=23228 Ack=7537 Win=1041 Len=1360 [TCP segment of a reassembled PDU]"
"43","3.011832","192.168.0.183","104.244.42.65","TCP","1414","50717  >  443 [ACK] Seq=24588 Ack=7537 Win=1041 Len=1360 [TCP segment of a reassembled PDU]"
"44","3.011832","192.168.0.183","104.244.42.65","TCP","1414","50717  >  443 [ACK] Seq=25948 Ack=7537 Win=1041 Len=1360 [TCP segment of a reassembled PDU]"
"45","3.011832","192.168.0.183","104.244.42.65","TCP","1414","50717  >  443 [ACK] Seq=27308 Ack=7537 Win=1041 Len=1360 [TCP segment of a reassembled PDU]"
"46","3.011832","192.168.0.183","104.244.42.65","TCP","1414","50717  >  443 [ACK] Seq=28668 Ack=7537 Win=1041 Len=1360 [TCP segment of a reassembled PDU]"
"47","3.011832","192.168.0.183","104.244.42.65","TCP","1414","50717  >  443 [ACK] Seq=30028 Ack=7537 Win=1041 Len=1360 [TCP segment of a reassembled PDU]"
"48","3.011832","192.168.0.183","104.244.42.65","TCP","1414","50717  >  443 [ACK] Seq=31388 Ack=7537 Win=1041 Len=1360 [TCP segment of a reassembled PDU]"
"49","3.011832","192.168.0.183","104.244.42.65","TCP","1414","50717  >  443 [ACK] Seq=32748 Ack=7537 Win=1041 Len=1360 [TCP segment of a reassembled PDU]"
"50","3.011832","192.168.0.183","104.244.42.65","TCP","1414","50717  >  443 [ACK] Seq=34108 Ack=7537 Win=1041 Len=1360 [TCP segment of a reassembled PDU]"
"51","3.011832","192.168.0.183","104.244.42.65","TCP","1414","50717  >  443 [ACK] Seq=35468 Ack=7537 Win=1041 Len=1360 [TCP segment of a reassembled PDU]"
"52","3.011832","192.168.0.183","104.244.42.65","TCP","1414","50717  >  443 [ACK] Seq=36828 Ack=7537 Win=1041 Len=1360 [TCP segment of a reassembled PDU]"
"53","3.011832","192.168.0.183","104.244.42.65","TLSv1.2","140","Application Data"
"54","3.012006","192.168.0.183","104.244.42.65","TCP","1414","50717  >  443 [ACK] Seq=38274 Ack=7537 Win=1041 Len=1360 [TCP segment of a reassembled PDU]"
"55","3.012006","192.168.0.183","104.244.42.65","TCP","1414","50717  >  443 [ACK] Seq=39634 Ack=7537 Win=1041 Len=1360 [TCP segment of a reassembled PDU]"
"56","3.012006","192.168.0.183","104.244.42.65","TCP","1414","50717  >  443 [ACK] Seq=40994 Ack=7537 Win=1041 Len=1360 [TCP segment of a reassembled PDU]"
"57","3.012006","192.168.0.183","104.244.42.65","TCP","1414","50717  >  443 [ACK] Seq=42354 Ack=7537 Win=1041 Len=1360 [TCP segment of a reassembled PDU]"
"58","3.012006","192.168.0.183","104.244.42.65","TCP","1414","50717  >  443 [ACK] Seq=43714 Ack=7537 Win=1041 Len=1360 [TCP segment of a reassembled PDU]"
"59","3.012006","192.168.0.183","104.244.42.65","TCP","1414","50717  >  443 [ACK] Seq=45074 Ack=7537 Win=1041 Len=1360 [TCP segment of a reassembled PDU]"
"60","3.012006","192.168.0.183","104.244.42.65","TCP","1414","50717  >  443 [ACK] Seq=46434 Ack=7537 Win=1041 Len=1360 [TCP segment of a reassembled PDU]"
"61","3.012006","192.168.0.183","104.244.42.65","TCP","1414","50717  >  443 [ACK] Seq=47794 Ack=7537 Win=1041 Len=1360 [TCP segment of a reassembled PDU]"
"62","3.012006","192.168.0.183","104.244.42.65","TCP","1414","50717  >  443 [ACK] Seq=49154 Ack=7537 Win=1041 Len=1360 [TCP segment of a reassembled PDU]"
"63","3.012006","192.168.0.183","104.244.42.65","TCP","1414","50717  >  443 [ACK] Seq=50514 Ack=7537 Win=1041 Len=1360 [TCP segment of a reassembled PDU]"
"64","3.012006","192.168.0.183","104.244.42.65","TCP","1414","50717  >  443 [ACK] Seq=51874 Ack=7537 Win=1041 Len=1360 [TCP segment of a reassembled PDU]"
"65","3.012006","192.168.0.183","104.244.42.65","TCP","1414","50717  >  443 [ACK] Seq=53234 Ack=7537 Win=1041 Len=1360 [TCP segment of a reassembled PDU]"
"66","3.012006","192.168.0.183","104.244.42.65","TLSv1.2","140","Application Data"
"67","3.012207","192.168.0.183","104.244.42.65","TCP","1414","50717  >  443 [ACK] Seq=54680 Ack=7537 Win=1041 Len=1360 [TCP segment of a reassembled PDU]"
"68","3.012207","192.168.0.183","104.244.42.65","TCP","1414","50717  >  443 [ACK] Seq=56040 Ack=7537 Win=1041 Len=1360 [TCP segment of a reassembled PDU]"
"69","3.012207","192.168.0.183","104.244.42.65","TCP","1414","50717  >  443 [ACK] Seq=57400 Ack=7537 Win=1041 Len=1360 [TCP segment of a reassembled PDU]"
"70","3.012207","192.168.0.183","104.244.42.65","TCP","1414","50717  >  443 [ACK] Seq=58760 Ack=7537 Win=1041 Len=1360 [TCP segment of a reassembled PDU]"
"71","3.012207","192.168.0.183","104.244.42.65","TCP","1414","50717  >  443 [ACK] Seq=60120 Ack=7537 Win=1041 Len=1360 [TCP segment of a reassembled PDU]"
"72","3.012207","192.168.0.183","104.244.42.65","TCP","1414","50717  >  443 [ACK] Seq=61480 Ack=7537 Win=1041 Len=1360 [TCP segment of a reassembled PDU]"
"73","3.012207","192.168.0.183","104.244.42.65","TLSv1.2","56","Application Data"
"74","3.047645","104.244.42.65","192.168.0.183","TCP","60","443  >  50717 [ACK] Seq=7537 Ack=21782 Win=5692 Len=0"
"75","3.047645","104.244.42.65","192.168.0.183","TCP","60","443  >  50717 [ACK] Seq=7537 Ack=21868 Win=5735 Len=0"
"76","3.049806","104.244.42.65","192.168.0.183","TCP","60","443  >  50717 [ACK] Seq=7537 Ack=62842 Win=5688 Len=0"
"77","3.049806","104.244.42.65","192.168.0.183","TLSv1.2","89","Application Data"
"78","3.096253","104.244.42.65","192.168.0.183","TLSv1.2","178","Application Data"
"79","3.096290","192.168.0.183","104.244.42.65","TCP","54","50717  >  443 [ACK] Seq=62842 Ack=7696 Win=1040 Len=0"
"80","3.324168","104.244.42.65","192.168.0.183","TCP","1414","443  >  50717 [ACK] Seq=7696 Ack=62842 Win=5735 Len=1360 [TCP segment of a reassembled PDU]"
"81","3.324168","104.244.42.65","192.168.0.183","TCP","1414","443  >  50717 [ACK] Seq=9056 Ack=62842 Win=5735 Len=1360 [TCP segment of a reassembled PDU]"
"82","3.324168","104.244.42.65","192.168.0.183","TCP","1414","443  >  50717 [PSH, ACK] Seq=10416 Ack=62842 Win=5735 Len=1360 [TCP segment of a reassembled PDU]"
"83","3.324168","104.244.42.65","192.168.0.183","TCP","1414","443  >  50717 [ACK] Seq=11776 Ack=62842 Win=5735 Len=1360 [TCP segment of a reassembled PDU]"
"84","3.324168","104.244.42.65","192.168.0.183","TLSv1.2","1250","Application Data"
"85","3.324275","192.168.0.183","104.244.42.65","TCP","54","50717  >  443 [ACK] Seq=62842 Ack=14332 Win=1041 Len=0"
"86","3.327516","192.168.0.183","104.244.42.65","TLSv1.2","89","Application Data"
"87","3.401122","104.244.42.65","192.168.0.183","TCP","60","443  >  50717 [ACK] Seq=14332 Ack=62877 Win=5735 Len=0"
"88","3.796790","192.168.0.183","104.244.42.65","TCP","1414","50717  >  443 [ACK] Seq=62877 Ack=14332 Win=1041 Len=1360 [TCP segment of a reassembled PDU]"
"89","3.796790","192.168.0.183","104.244.42.65","TLSv1.2","972","Application Data"
"90","3.826231","104.244.42.65","192.168.0.183","TCP","60","443  >  50717 [ACK] Seq=14332 Ack=65155 Win=5730 Len=0"
"91","4.890526","104.244.42.65","192.168.0.183","TCP","1414","443  >  50717 [ACK] Seq=14332 Ack=65155 Win=5735 Len=1360 [TCP segment of a reassembled PDU]"
"92","4.890526","104.244.42.65","192.168.0.183","TCP","1414","443  >  50717 [ACK] Seq=15692 Ack=65155 Win=5735 Len=1360 [TCP segment of a reassembled PDU]"
"93","4.890526","104.244.42.65","192.168.0.183","TCP","1414","443  >  50717 [PSH, ACK] Seq=17052 Ack=65155 Win=5735 Len=1360 [TCP segment of a reassembled PDU]"
"94","4.890526","104.244.42.65","192.168.0.183","TCP","1414","443  >  50717 [ACK] Seq=18412 Ack=65155 Win=5735 Len=1360 [TCP segment of a reassembled PDU]"
"95","4.890526","104.244.42.65","192.168.0.183","TCP","1414","443  >  50717 [ACK] Seq=19772 Ack=65155 Win=5735 Len=1360 [TCP segment of a reassembled PDU]"
"96","4.890526","104.244.42.65","192.168.0.183","TLSv1.2","508","Application Data"
"97","4.890587","192.168.0.183","104.244.42.65","TCP","54","50717  >  443 [ACK] Seq=65155 Ack=21586 Win=1041 Len=0"
"98","5.716300","192.168.0.183","104.244.42.65","TCP","1414","50717  >  443 [ACK] Seq=65155 Ack=21586 Win=1041 Len=1360 [TCP segment of a reassembled PDU]"
"99","5.716300","192.168.0.183","104.244.42.65","TLSv1.2","354","Application Data"
"100","5.746271","104.244.42.65","192.168.0.183","TCP","60","443  >  50717 [ACK] Seq=21586 Ack=66815 Win=5731 Len=0"
"101","6.379659","192.168.0.183","104.244.42.65","TLSv1.2","236","Application Data"
"102","6.379783","192.168.0.183","104.244.42.65","TCP","1414","50717  >  443 [ACK] Seq=66997 Ack=21586 Win=1041 Len=1360 [TCP segment of a reassembled PDU]"
"103","6.379783","192.168.0.183","104.244.42.65","TCP","1414","50717  >  443 [ACK] Seq=68357 Ack=21586 Win=1041 Len=1360 [TCP segment of a reassembled PDU]"
"104","6.379783","192.168.0.183","104.244.42.65","TCP","1414","50717  >  443 [ACK] Seq=69717 Ack=21586 Win=1041 Len=1360 [TCP segment of a reassembled PDU]"
"105","6.379783","192.168.0.183","104.244.42.65","TCP","1414","50717  >  443 [ACK] Seq=71077 Ack=21586 Win=1041 Len=1360 [TCP segment of a reassembled PDU]"
"106","6.379783","192.168.0.183","104.244.42.65","TCP","1414","50717  >  443 [ACK] Seq=72437 Ack=21586 Win=1041 Len=1360 [TCP segment of a reassembled PDU]"
"107","6.379783","192.168.0.183","104.244.42.65","TCP","1414","50717  >  443 [ACK] Seq=73797 Ack=21586 Win=1041 Len=1360 [TCP segment of a reassembled PDU]"
"108","6.379783","192.168.0.183","104.244.42.65","TCP","1414","50717  >  443 [ACK] Seq=75157 Ack=21586 Win=1041 Len=1360 [TCP segment of a reassembled PDU]"
"109","6.379783","192.168.0.183","104.244.42.65","TCP","1414","50717  >  443 [ACK] Seq=76517 Ack=21586 Win=1041 Len=1360 [TCP segment of a reassembled PDU]"
"110","6.379783","192.168.0.183","104.244.42.65","TCP","1414","50717  >  443 [ACK] Seq=77877 Ack=21586 Win=1041 Len=1360 [TCP segment of a reassembled PDU]"
"111","6.379783","192.168.0.183","104.244.42.65","TCP","1414","50717  >  443 [ACK] Seq=79237 Ack=21586 Win=1041 Len=1360 [TCP segment of a reassembled PDU]"
"112","6.379783","192.168.0.183","104.244.42.65","TCP","1414","50717  >  443 [ACK] Seq=80597 Ack=21586 Win=1041 Len=1360 [TCP segment of a reassembled PDU]"
"113","6.379783","192.168.0.183","104.244.42.65","TCP","1414","50717  >  443 [ACK] Seq=81957 Ack=21586 Win=1041 Len=1360 [TCP segment of a reassembled PDU]"
"114","6.379783","192.168.0.183","104.244.42.65","TLSv1.2","140","Application Data"
"115","6.379914","192.168.0.183","104.244.42.65","TCP","1414","50717  >  443 [ACK] Seq=83403 Ack=21586 Win=1041 Len=1360 [TCP segment of a reassembled PDU]"
"116","6.379914","192.168.0.183","104.244.42.65","TCP","1414","50717  >  443 [ACK] Seq=84763 Ack=21586 Win=1041 Len=1360 [TCP segment of a reassembled PDU]"
"117","6.379914","192.168.0.183","104.244.42.65","TCP","1414","50717  >  443 [ACK] Seq=86123 Ack=21586 Win=1041 Len=1360 [TCP segment of a reassembled PDU]"
"118","6.379914","192.168.0.183","104.244.42.65","TCP","1414","50717  >  443 [ACK] Seq=87483 Ack=21586 Win=1041 Len=1360 [TCP segment of a reassembled PDU]"
"119","6.379914","192.168.0.183","104.244.42.65","TCP","1414","50717  >  443 [ACK] Seq=88843 Ack=21586 Win=1041 Len=1360 [TCP segment of a reassembled PDU]"
"120","6.379914","192.168.0.183","104.244.42.65","TCP","1414","50717  >  443 [ACK] Seq=90203 Ack=21586 Win=1041 Len=1360 [TCP segment of a reassembled PDU]"
"121","6.379914","192.168.0.183","104.244.42.65","TCP","1414","50717  >  443 [ACK] Seq=91563 Ack=21586 Win=1041 Len=1360 [TCP segment of a reassembled PDU]"
"122","6.379914","192.168.0.183","104.244.42.65","TCP","1414","50717  >  443 [ACK] Seq=92923 Ack=21586 Win=1041 Len=1360 [TCP segment of a reassembled PDU]"
"123","6.379914","192.168.0.183","104.244.42.65","TCP","1414","50717  >  443 [ACK] Seq=94283 Ack=21586 Win=1041 Len=1360 [TCP segment of a reassembled PDU]"
"124","6.379914","192.168.0.183","104.244.42.65","TCP","1414","50717  >  443 [ACK] Seq=95643 Ack=21586 Win=1041 Len=1360 [TCP segment of a reassembled PDU]"
"125","6.379914","192.168.0.183","104.244.42.65","TCP","1414","50717  >  443 [ACK] Seq=97003 Ack=21586 Win=1041 Len=1360 [TCP segment of a reassembled PDU]"
"126","6.379914","192.168.0.183","104.244.42.65","TCP","1414","50717  >  443 [ACK] Seq=98363 Ack=21586 Win=1041 Len=1360 [TCP segment of a reassembled PDU]"
"127","6.379914","192.168.0.183","104.244.42.65","TLSv1.2","140","Application Data"
"128","6.380040","192.168.0.183","104.244.42.65","TCP","1414","50717  >  443 [ACK] Seq=99809 Ack=21586 Win=1041 Len=1360 [TCP segment of a reassembled PDU]"
"129","6.380040","192.168.0.183","104.244.42.65","TCP","1414","50717  >  443 [ACK] Seq=101169 Ack=21586 Win=1041 Len=1360 [TCP segment of a reassembled PDU]"
"130","6.380040","192.168.0.183","104.244.42.65","TCP","1414","50717  >  443 [ACK] Seq=102529 Ack=21586 Win=1041 Len=1360 [TCP segment of a reassembled PDU]"
"131","6.380040","192.168.0.183","104.244.42.65","TCP","1414","50717  >  443 [ACK] Seq=103889 Ack=21586 Win=1041 Len=1360 [TCP segment of a reassembled PDU]"
"132","6.380040","192.168.0.183","104.244.42.65","TCP","1414","50717  >  443 [ACK] Seq=105249 Ack=21586 Win=1041 Len=1360 [TCP segment of a reassembled PDU]"
"133","6.380040","192.168.0.183","104.244.42.65","TCP","1414","50717  >  443 [ACK] Seq=106609 Ack=21586 Win=1041 Len=1360 [TCP segment of a reassembled PDU]"
"134","6.380040","192.168.0.183","104.244.42.65","TCP","1414","50717  >  443 [ACK] Seq=107969 Ack=21586 Win=1041 Len=1360 [TCP segment of a reassembled PDU]"
"135","6.380040","192.168.0.183","104.244.42.65","TCP","1414","50717  >  443 [ACK] Seq=109329 Ack=21586 Win=1041 Len=1360 [TCP segment of a reassembled PDU]"
"136","6.380040","192.168.0.183","104.244.42.65","TCP","1414","50717  >  443 [ACK] Seq=110689 Ack=21586 Win=1041 Len=1360 [TCP segment of a reassembled PDU]"
"137","6.380040","192.168.0.183","104.244.42.65","TCP","1414","50717  >  443 [ACK] Seq=112049 Ack=21586 Win=1041 Len=1360 [TCP segment of a reassembled PDU]"
"138","6.380040","192.168.0.183","104.244.42.65","TCP","1414","50717  >  443 [ACK] Seq=113409 Ack=21586 Win=1041 Len=1360 [TCP segment of a reassembled PDU]"
"139","6.380040","192.168.0.183","104.244.42.65","TCP","1414","50717  >  443 [ACK] Seq=114769 Ack=21586 Win=1041 Len=1360 [TCP segment of a reassembled PDU]"
"140","6.380040","192.168.0.183","104.244.42.65","TLSv1.2","140","Application Data"
"141","6.380191","192.168.0.183","104.244.42.65","TCP","1414","50717  >  443 [ACK] Seq=116215 Ack=21586 Win=1041 Len=1360 [TCP segment of a reassembled PDU]"
"142","6.380191","192.168.0.183","104.244.42.65","TLSv1.2","337","Application Data"
"143","6.410316","104.244.42.65","192.168.0.183","TCP","60","443  >  50717 [ACK] Seq=21586 Ack=72437 Win=5720 Len=0"
"144","6.418264","104.244.42.65","192.168.0.183","TCP","60","443  >  50717 [ACK] Seq=21586 Ack=116215 Win=5699 Len=0"
"145","6.418264","104.244.42.65","192.168.0.183","TLSv1.2","89","Application Data"
"146","6.418264","104.244.42.65","192.168.0.183","TCP","60","443  >  50717 [ACK] Seq=21621 Ack=117858 Win=5731 Len=0"
"147","6.470521","192.168.0.183","104.244.42.65","TCP","54","50717  >  443 [ACK] Seq=117858 Ack=21621 Win=1041 Len=0"
"148","6.474416","104.244.42.65","192.168.0.183","TLSv1.2","184","Application Data"
"149","6.516465","192.168.0.183","104.244.42.65","TCP","54","50717  >  443 [ACK] Seq=117858 Ack=21751 Win=1040 Len=0"
"150","6.700149","104.244.42.65","192.168.0.183","TCP","1414","443  >  50717 [ACK] Seq=21751 Ack=117858 Win=5735 Len=1360 [TCP segment of a reassembled PDU]"
"151","6.700149","104.244.42.65","192.168.0.183","TCP","1414","443  >  50717 [ACK] Seq=23111 Ack=117858 Win=5735 Len=1360 [TCP segment of a reassembled PDU]"
"152","6.700149","104.244.42.65","192.168.0.183","TCP","1414","443  >  50717 [PSH, ACK] Seq=24471 Ack=117858 Win=5735 Len=1360 [TCP segment of a reassembled PDU]"
"153","6.700149","104.244.42.65","192.168.0.183","TCP","1414","443  >  50717 [ACK] Seq=25831 Ack=117858 Win=5735 Len=1360 [TCP segment of a reassembled PDU]"
"154","6.700149","104.244.42.65","192.168.0.183","TCP","1414","443  >  50717 [ACK] Seq=27191 Ack=117858 Win=5735 Len=1360 [TCP segment of a reassembled PDU]"
"155","6.700149","104.244.42.65","192.168.0.183","TLSv1.2","544","Application Data"
"156","6.700216","192.168.0.183","104.244.42.65","TCP","54","50717  >  443 [ACK] Seq=117858 Ack=29041 Win=1041 Len=0"
"157","7.073052","192.168.0.183","104.244.42.65","TCP","1414","50717  >  443 [ACK] Seq=117858 Ack=29041 Win=1041 Len=1360 [TCP segment of a reassembled PDU]"
"158","7.073052","192.168.0.183","104.244.42.65","TLSv1.2","448","Application Data"
"159","7.104327","104.244.42.65","192.168.0.183","TCP","60","443  >  50717 [ACK] Seq=29041 Ack=119612 Win=5731 Len=0"
"160","7.808862","104.244.42.65","192.168.0.183","TCP","1414","443  >  50717 [ACK] Seq=29041 Ack=119612 Win=5735 Len=1360 [TCP segment of a reassembled PDU]"
"161","7.808862","104.244.42.65","192.168.0.183","TCP","1414","443  >  50717 [ACK] Seq=30401 Ack=119612 Win=5735 Len=1360 [TCP segment of a reassembled PDU]"
"162","7.808862","104.244.42.65","192.168.0.183","TCP","1414","443  >  50717 [ACK] Seq=31761 Ack=119612 Win=5735 Len=1360 [TCP segment of a reassembled PDU]"
"163","7.808862","104.244.42.65","192.168.0.183","TCP","1414","443  >  50717 [PSH, ACK] Seq=33121 Ack=119612 Win=5735 Len=1360 [TCP segment of a reassembled PDU]"
"164","7.808862","104.244.42.65","192.168.0.183","TCP","1414","443  >  50717 [ACK] Seq=34481 Ack=119612 Win=5735 Len=1360 [TCP segment of a reassembled PDU]"
"165","7.808862","104.244.42.65","192.168.0.183","TLSv1.2","959","Application Data"
"166","7.808972","192.168.0.183","104.244.42.65","TCP","54","50717  >  443 [ACK] Seq=119612 Ack=36746 Win=1041 Len=0"
"167","9.558768","192.168.0.183","104.244.42.65","TLSv1.2","248","Application Data"
"168","9.558903","192.168.0.183","104.244.42.65","TCP","1414","50717  >  443 [ACK] Seq=119806 Ack=36746 Win=1041 Len=1360 [TCP segment of a reassembled PDU]"
"169","9.558903","192.168.0.183","104.244.42.65","TCP","1414","50717  >  443 [ACK] Seq=121166 Ack=36746 Win=1041 Len=1360 [TCP segment of a reassembled PDU]"
"170","9.558903","192.168.0.183","104.244.42.65","TCP","1414","50717  >  443 [ACK] Seq=122526 Ack=36746 Win=1041 Len=1360 [TCP segment of a reassembled PDU]"
"171","9.558903","192.168.0.183","104.244.42.65","TCP","1414","50717  >  443 [ACK] Seq=123886 Ack=36746 Win=1041 Len=1360 [TCP segment of a reassembled PDU]"
"172","9.558903","192.168.0.183","104.244.42.65","TCP","1414","50717  >  443 [ACK] Seq=125246 Ack=36746 Win=1041 Len=1360 [TCP segment of a reassembled PDU]"
"173","9.558903","192.168.0.183","104.244.42.65","TCP","1414","50717  >  443 [ACK] Seq=126606 Ack=36746 Win=1041 Len=1360 [TCP segment of a reassembled PDU]"
"174","9.558903","192.168.0.183","104.244.42.65","TCP","1414","50717  >  443 [ACK] Seq=127966 Ack=36746 Win=1041 Len=1360 [TCP segment of a reassembled PDU]"
"175","9.558903","192.168.0.183","104.244.42.65","TCP","1414","50717  >  443 [ACK] Seq=129326 Ack=36746 Win=1041 Len=1360 [TCP segment of a reassembled PDU]"
"176","9.558903","192.168.0.183","104.244.42.65","TCP","1414","50717  >  443 [ACK] Seq=130686 Ack=36746 Win=1041 Len=1360 [TCP segment of a reassembled PDU]"
"177","9.558903","192.168.0.183","104.244.42.65","TCP","1414","50717  >  443 [ACK] Seq=132046 Ack=36746 Win=1041 Len=1360 [TCP segment of a reassembled PDU]"
"178","9.558903","192.168.0.183","104.244.42.65","TCP","1414","50717  >  443 [ACK] Seq=133406 Ack=36746 Win=1041 Len=1360 [TCP segment of a reassembled PDU]"
"179","9.558903","192.168.0.183","104.244.42.65","TCP","1414","50717  >  443 [ACK] Seq=134766 Ack=36746 Win=1041 Len=1360 [TCP segment of a reassembled PDU]"
"180","9.558903","192.168.0.183","104.244.42.65","TLSv1.2","140","Application Data"
"181","9.559030","192.168.0.183","104.244.42.65","TCP","1414","50717  >  443 [ACK] Seq=136212 Ack=36746 Win=1041 Len=1360 [TCP segment of a reassembled PDU]"
"182","9.559030","192.168.0.183","104.244.42.65","TCP","1414","50717  >  443 [ACK] Seq=137572 Ack=36746 Win=1041 Len=1360 [TCP segment of a reassembled PDU]"
"183","9.559030","192.168.0.183","104.244.42.65","TCP","1414","50717  >  443 [ACK] Seq=138932 Ack=36746 Win=1041 Len=1360 [TCP segment of a reassembled PDU]"
"184","9.559030","192.168.0.183","104.244.42.65","TCP","1414","50717  >  443 [ACK] Seq=140292 Ack=36746 Win=1041 Len=1360 [TCP segment of a reassembled PDU]"
"185","9.559030","192.168.0.183","104.244.42.65","TCP","1414","50717  >  443 [ACK] Seq=141652 Ack=36746 Win=1041 Len=1360 [TCP segment of a reassembled PDU]"
"186","9.559030","192.168.0.183","104.244.42.65","TCP","1414","50717  >  443 [ACK] Seq=143012 Ack=36746 Win=1041 Len=1360 [TCP segment of a reassembled PDU]"
"187","9.559030","192.168.0.183","104.244.42.65","TCP","1414","50717  >  443 [ACK] Seq=144372 Ack=36746 Win=1041 Len=1360 [TCP segment of a reassembled PDU]"
"188","9.559030","192.168.0.183","104.244.42.65","TCP","1414","50717  >  443 [ACK] Seq=145732 Ack=36746 Win=1041 Len=1360 [TCP segment of a reassembled PDU]"
"189","9.559030","192.168.0.183","104.244.42.65","TCP","1414","50717  >  443 [ACK] Seq=147092 Ack=36746 Win=1041 Len=1360 [TCP segment of a reassembled PDU]"
"190","9.559030","192.168.0.183","104.244.42.65","TCP","1414","50717  >  443 [ACK] Seq=148452 Ack=36746 Win=1041 Len=1360 [TCP segment of a reassembled PDU]"
"191","9.559030","192.168.0.183","104.244.42.65","TCP","1414","50717  >  443 [ACK] Seq=149812 Ack=36746 Win=1041 Len=1360 [TCP segment of a reassembled PDU]"
"192","9.559030","192.168.0.183","104.244.42.65","TCP","1414","50717  >  443 [ACK] Seq=151172 Ack=36746 Win=1041 Len=1360 [TCP segment of a reassembled PDU]"
"193","9.559030","192.168.0.183","104.244.42.65","TLSv1.2","140","Application Data"
"194","9.559149","192.168.0.183","104.244.42.65","TCP","1414","50717  >  443 [ACK] Seq=152618 Ack=36746 Win=1041 Len=1360 [TCP segment of a reassembled PDU]"
"195","9.559149","192.168.0.183","104.244.42.65","TCP","1414","50717  >  443 [ACK] Seq=153978 Ack=36746 Win=1041 Len=1360 [TCP segment of a reassembled PDU]"
"196","9.559149","192.168.0.183","104.244.42.65","TCP","1414","50717  >  443 [ACK] Seq=155338 Ack=36746 Win=1041 Len=1360 [TCP segment of a reassembled PDU]"
"197","9.559149","192.168.0.183","104.244.42.65","TCP","1414","50717  >  443 [ACK] Seq=156698 Ack=36746 Win=1041 Len=1360 [TCP segment of a reassembled PDU]"
"198","9.559149","192.168.0.183","104.244.42.65","TCP","1414","50717  >  443 [ACK] Seq=158058 Ack=36746 Win=1041 Len=1360 [TCP segment of a reassembled PDU]"
"199","9.559149","192.168.0.183","104.244.42.65","TCP","1414","50717  >  443 [ACK] Seq=159418 Ack=36746 Win=1041 Len=1360 [TCP segment of a reassembled PDU]"
"200","9.559149","192.168.0.183","104.244.42.65","TCP","1414","50717  >  443 [ACK] Seq=160778 Ack=36746 Win=1041 Len=1360 [TCP segment of a reassembled PDU]"
"201","9.559149","192.168.0.183","104.244.42.65","TCP","1414","50717  >  443 [ACK] Seq=162138 Ack=36746 Win=1041 Len=1360 [TCP segment of a reassembled PDU]"
"202","9.559149","192.168.0.183","104.244.42.65","TCP","1414","50717  >  443 [ACK] Seq=163498 Ack=36746 Win=1041 Len=1360 [TCP segment of a reassembled PDU]"
"203","9.559149","192.168.0.183","104.244.42.65","TCP","1414","50717  >  443 [ACK] Seq=164858 Ack=36746 Win=1041 Len=1360 [TCP segment of a reassembled PDU]"
"204","9.559149","192.168.0.183","104.244.42.65","TCP","1414","50717  >  443 [ACK] Seq=166218 Ack=36746 Win=1041 Len=1360 [TCP segment of a reassembled PDU]"
"205","9.559149","192.168.0.183","104.244.42.65","TCP","1414","50717  >  443 [ACK] Seq=167578 Ack=36746 Win=1041 Len=1360 [TCP segment of a reassembled PDU]"
"206","9.559149","192.168.0.183","104.244.42.65","TLSv1.2","140","Application Data"
"207","9.559261","192.168.0.183","104.244.42.65","TCP","1414","50717  >  443 [ACK] Seq=169024 Ack=36746 Win=1041 Len=1360 [TCP segment of a reassembled PDU]"
"208","9.559261","192.168.0.183","104.244.42.65","TCP","1414","50717  >  443 [ACK] Seq=170384 Ack=36746 Win=1041 Len=1360 [TCP segment of a reassembled PDU]"
"209","9.559261","192.168.0.183","104.244.42.65","TCP","1414","50717  >  443 [ACK] Seq=171744 Ack=36746 Win=1041 Len=1360 [TCP segment of a reassembled PDU]"
"210","9.559261","192.168.0.183","104.244.42.65","TCP","1414","50717  >  443 [ACK] Seq=173104 Ack=36746 Win=1041 Len=1360 [TCP segment of a reassembled PDU]"
"211","9.559261","192.168.0.183","104.244.42.65","TCP","1414","50717  >  443 [ACK] Seq=174464 Ack=36746 Win=1041 Len=1360 [TCP segment of a reassembled PDU]"
"212","9.559261","192.168.0.183","104.244.42.65","TCP","1414","50717  >  443 [ACK] Seq=175824 Ack=36746 Win=1041 Len=1360 [TCP segment of a reassembled PDU]"
"213","9.559261","192.168.0.183","104.244.42.65","TCP","1414","50717  >  443 [ACK] Seq=177184 Ack=36746 Win=1041 Len=1360 [TCP segment of a reassembled PDU]"
"214","9.559261","192.168.0.183","104.244.42.65","TCP","1414","50717  >  443 [ACK] Seq=178544 Ack=36746 Win=1041 Len=1360 [TCP segment of a reassembled PDU]"
"215","9.559261","192.168.0.183","104.244.42.65","TCP","1414","50717  >  443 [ACK] Seq=179904 Ack=36746 Win=1041 Len=1360 [TCP segment of a reassembled PDU]"
"216","9.559261","192.168.0.183","104.244.42.65","TCP","1414","50717  >  443 [ACK] Seq=181264 Ack=36746 Win=1041 Len=1360 [TCP segment of a reassembled PDU]"
"217","9.559261","192.168.0.183","104.244.42.65","TCP","1414","50717  >  443 [ACK] Seq=182624 Ack=36746 Win=1041 Len=1360 [TCP segment of a reassembled PDU]"
"218","9.559261","192.168.0.183","104.244.42.65","TCP","1414","50717  >  443 [ACK] Seq=183984 Ack=36746 Win=1041 Len=1360 [TCP segment of a reassembled PDU]"
"219","9.559261","192.168.0.183","104.244.42.65","TLSv1.2","140","Application Data"
"220","9.559393","192.168.0.183","104.244.42.65","TLSv1.2","121","Application Data"
"221","9.588113","104.244.42.65","192.168.0.183","TCP","60","443  >  50717 [ACK] Seq=36746 Ack=121166 Win=5731 Len=0"
"222","9.594248","104.244.42.65","192.168.0.183","TCP","60","443  >  50717 [ACK] Seq=36746 Ack=170384 Win=5724 Len=0"
"223","9.594248","104.244.42.65","192.168.0.183","TLSv1.2","89","Application Data"
"224","9.594474","192.168.0.183","104.244.42.65","TCP","1414","50717  >  443 [ACK] Seq=185497 Ack=36781 Win=1041 Len=1360 [TCP segment of a reassembled PDU]"
"225","9.594474","192.168.0.183","104.244.42.65","TCP","1414","50717  >  443 [ACK] Seq=186857 Ack=36781 Win=1041 Len=1360 [TCP segment of a reassembled PDU]"
"226","9.594474","192.168.0.183","104.244.42.65","TCP","1414","50717  >  443 [ACK] Seq=188217 Ack=36781 Win=1041 Len=1360 [TCP segment of a reassembled PDU]"
"227","9.594474","192.168.0.183","104.244.42.65","TCP","1414","50717  >  443 [ACK] Seq=189577 Ack=36781 Win=1041 Len=1360 [TCP segment of a reassembled PDU]"
"228","9.594474","192.168.0.183","104.244.42.65","TCP","1414","50717  >  443 [ACK] Seq=190937 Ack=36781 Win=1041 Len=1360 [TCP segment of a reassembled PDU]"
"229","9.594474","192.168.0.183","104.244.42.65","TCP","1414","50717  >  443 [ACK] Seq=192297 Ack=36781 Win=1041 Len=1360 [TCP segment of a reassembled PDU]"
"230","9.594474","192.168.0.183","104.244.42.65","TLSv1.2","391","Application Data"
"231","9.624988","104.244.42.65","192.168.0.183","TCP","60","443  >  50717 [ACK] Seq=36781 Ack=188217 Win=5729 Len=0"
"232","9.631975","104.244.42.65","192.168.0.183","TCP","60","443  >  50717 [ACK] Seq=36781 Ack=193994 Win=5735 Len=0"
"233","9.720541","104.244.42.65","192.168.0.183","TLSv1.2","184","Application Data"
"234","9.772900","192.168.0.183","104.244.42.65","TCP","54","50717  >  443 [ACK] Seq=193994 Ack=36911 Win=1040 Len=0"
"235","12.564656","192.168.0.183","104.244.42.65","TLSv1.2","238","Application Data"
"236","12.564793","192.168.0.183","104.244.42.65","TCP","1414","50717  >  443 [ACK] Seq=194178 Ack=36911 Win=1040 Len=1360 [TCP segment of a reassembled PDU]"
"237","12.564793","192.168.0.183","104.244.42.65","TCP","1414","50717  >  443 [ACK] Seq=195538 Ack=36911 Win=1040 Len=1360 [TCP segment of a reassembled PDU]"
"238","12.564793","192.168.0.183","104.244.42.65","TCP","1414","50717  >  443 [ACK] Seq=196898 Ack=36911 Win=1040 Len=1360 [TCP segment of a reassembled PDU]"
"239","12.564793","192.168.0.183","104.244.42.65","TCP","1414","50717  >  443 [ACK] Seq=198258 Ack=36911 Win=1040 Len=1360 [TCP segment of a reassembled PDU]"
"240","12.564793","192.168.0.183","104.244.42.65","TCP","1414","50717  >  443 [ACK] Seq=199618 Ack=36911 Win=1040 Len=1360 [TCP segment of a reassembled PDU]"
"241","12.564793","192.168.0.183","104.244.42.65","TCP","1414","50717  >  443 [ACK] Seq=200978 Ack=36911 Win=1040 Len=1360 [TCP segment of a reassembled PDU]"
"242","12.564793","192.168.0.183","104.244.42.65","TCP","1414","50717  >  443 [ACK] Seq=202338 Ack=36911 Win=1040 Len=1360 [TCP segment of a reassembled PDU]"
"243","12.564793","192.168.0.183","104.244.42.65","TCP","1414","50717  >  443 [ACK] Seq=203698 Ack=36911 Win=1040 Len=1360 [TCP segment of a reassembled PDU]"
"244","12.564793","192.168.0.183","104.244.42.65","TCP","1414","50717  >  443 [ACK] Seq=205058 Ack=36911 Win=1040 Len=1360 [TCP segment of a reassembled PDU]"
"245","12.564793","192.168.0.183","104.244.42.65","TCP","1414","50717  >  443 [ACK] Seq=206418 Ack=36911 Win=1040 Len=1360 [TCP segment of a reassembled PDU]"
"246","12.564793","192.168.0.183","104.244.42.65","TCP","1414","50717  >  443 [ACK] Seq=207778 Ack=36911 Win=1040 Len=1360 [TCP segment of a reassembled PDU]"
"247","12.564793","192.168.0.183","104.244.42.65","TCP","1414","50717  >  443 [ACK] Seq=209138 Ack=36911 Win=1040 Len=1360 [TCP segment of a reassembled PDU]"
"248","12.564793","192.168.0.183","104.244.42.65","TLSv1.2","140","Application Data"
"249","12.565006","192.168.0.183","104.244.42.65","TCP","1414","50717  >  443 [ACK] Seq=210584 Ack=36911 Win=1040 Len=1360 [TCP segment of a reassembled PDU]"
"250","12.565006","192.168.0.183","104.244.42.65","TCP","1414","50717  >  443 [ACK] Seq=211944 Ack=36911 Win=1040 Len=1360 [TCP segment of a reassembled PDU]"
"251","12.565006","192.168.0.183","104.244.42.65","TCP","1414","50717  >  443 [ACK] Seq=213304 Ack=36911 Win=1040 Len=1360 [TCP segment of a reassembled PDU]"
"252","12.565006","192.168.0.183","104.244.42.65","TCP","1414","50717  >  443 [ACK] Seq=214664 Ack=36911 Win=1040 Len=1360 [TCP segment of a reassembled PDU]"
"253","12.565006","192.168.0.183","104.244.42.65","TCP","1414","50717  >  443 [ACK] Seq=216024 Ack=36911 Win=1040 Len=1360 [TCP segment of a reassembled PDU]"
"254","12.565006","192.168.0.183","104.244.42.65","TCP","1414","50717  >  443 [ACK] Seq=217384 Ack=36911 Win=1040 Len=1360 [TCP segment of a reassembled PDU]"
"255","12.565006","192.168.0.183","104.244.42.65","TCP","1414","50717  >  443 [ACK] Seq=218744 Ack=36911 Win=1040 Len=1360 [TCP segment of a reassembled PDU]"
"256","12.565006","192.168.0.183","104.244.42.65","TCP","1414","50717  >  443 [ACK] Seq=220104 Ack=36911 Win=1040 Len=1360 [TCP segment of a reassembled PDU]"
"257","12.565006","192.168.0.183","104.244.42.65","TCP","1414","50717  >  443 [ACK] Seq=221464 Ack=36911 Win=1040 Len=1360 [TCP segment of a reassembled PDU]"
"258","12.565006","192.168.0.183","104.244.42.65","TLSv1.2","1361","Application Data"
"259","12.605710","104.244.42.65","192.168.0.183","TCP","60","443  >  50717 [ACK] Seq=36911 Ack=224131 Win=5735 Len=0"
"260","12.605710","104.244.42.65","192.168.0.183","TLSv1.2","89","Application Data"
"261","12.637385","104.244.42.65","192.168.0.183","TLSv1.2","184","Application Data"
"262","12.637465","192.168.0.183","104.244.42.65","TCP","54","50717  >  443 [ACK] Seq=224131 Ack=37076 Win=1039 Len=0"
"263","13.715070","192.168.0.183","104.244.42.65","TLSv1.2","278","Application Data"
"264","13.789699","104.244.42.65","192.168.0.183","TCP","60","443  >  50717 [ACK] Seq=37076 Ack=224355 Win=5735 Len=0"
"265","13.949910","192.168.0.183","104.244.42.65","TLSv1.2","758","Application Data"
"266","13.950005","192.168.0.183","104.244.42.65","TCP","1414","50717  >  443 [ACK] Seq=225059 Ack=37076 Win=1039 Len=1360 [TCP segment of a reassembled PDU]"
"267","13.950005","192.168.0.183","104.244.42.65","TLSv1.2","1041","Application Data"
"268","13.982328","104.244.42.65","192.168.0.183","TCP","60","443  >  50717 [ACK] Seq=37076 Ack=227406 Win=5729 Len=0"
"269","14.008683","104.244.42.65","192.168.0.183","TLSv1.2","184","Application Data"
"270","14.052646","192.168.0.183","104.244.42.65","TCP","54","50717  >  443 [ACK] Seq=227406 Ack=37206 Win=1039 Len=0"
"271","14.082974","104.244.42.65","192.168.0.183","TLSv1.2","189","Application Data"
"272","14.128597","192.168.0.183","104.244.42.65","TCP","54","50717  >  443 [ACK] Seq=227406 Ack=37341 Win=1038 Len=0"
"273","15.391933","192.168.0.183","104.244.42.65","TCP","1414","50717  >  443 [ACK] Seq=227406 Ack=37341 Win=1038 Len=1360 [TCP segment of a reassembled PDU]"
"274","15.391933","192.168.0.183","104.244.42.65","TLSv1.2","426","Application Data"
"275","15.392127","192.168.0.183","104.244.42.65","TLSv1.2","721","Application Data"
"276","15.423213","104.244.42.65","192.168.0.183","TCP","60","443  >  50717 [ACK] Seq=37341 Ack=229138 Win=5731 Len=0"
"277","15.470082","104.244.42.65","192.168.0.183","TCP","60","443  >  50717 [ACK] Seq=37341 Ack=229805 Win=5735 Len=0"
"278","15.570103","192.168.0.183","104.244.42.65","TLSv1.2","308","Application Data"
"279","15.570316","192.168.0.183","104.244.42.65","TCP","1414","50717  >  443 [ACK] Seq=230059 Ack=37341 Win=1038 Len=1360 [TCP segment of a reassembled PDU]"
"280","15.570316","192.168.0.183","104.244.42.65","TCP","1414","50717  >  443 [ACK] Seq=231419 Ack=37341 Win=1038 Len=1360 [TCP segment of a reassembled PDU]"
"281","15.570316","192.168.0.183","104.244.42.65","TCP","1414","50717  >  443 [ACK] Seq=232779 Ack=37341 Win=1038 Len=1360 [TCP segment of a reassembled PDU]"
"282","15.570316","192.168.0.183","104.244.42.65","TCP","1414","50717  >  443 [ACK] Seq=234139 Ack=37341 Win=1038 Len=1360 [TCP segment of a reassembled PDU]"
"283","15.570316","192.168.0.183","104.244.42.65","TCP","1414","50717  >  443 [ACK] Seq=235499 Ack=37341 Win=1038 Len=1360 [TCP segment of a reassembled PDU]"
"284","15.570316","192.168.0.183","104.244.42.65","TCP","1414","50717  >  443 [ACK] Seq=236859 Ack=37341 Win=1038 Len=1360 [TCP segment of a reassembled PDU]"
"285","15.570316","192.168.0.183","104.244.42.65","TCP","1414","50717  >  443 [ACK] Seq=238219 Ack=37341 Win=1038 Len=1360 [TCP segment of a reassembled PDU]"
"286","15.570316","192.168.0.183","104.244.42.65","TCP","1414","50717  >  443 [ACK] Seq=239579 Ack=37341 Win=1038 Len=1360 [TCP segment of a reassembled PDU]"
"287","15.570316","192.168.0.183","104.244.42.65","TCP","1414","50717  >  443 [ACK] Seq=240939 Ack=37341 Win=1038 Len=1360 [TCP segment of a reassembled PDU]"
"288","15.570316","192.168.0.183","104.244.42.65","TCP","1414","50717  >  443 [ACK] Seq=242299 Ack=37341 Win=1038 Len=1360 [TCP segment of a reassembled PDU]"
"289","15.570316","192.168.0.183","104.244.42.65","TCP","1414","50717  >  443 [ACK] Seq=243659 Ack=37341 Win=1038 Len=1360 [TCP segment of a reassembled PDU]"
"290","15.570316","192.168.0.183","104.244.42.65","TCP","1414","50717  >  443 [ACK] Seq=245019 Ack=37341 Win=1038 Len=1360 [TCP segment of a reassembled PDU]"
"291","15.570316","192.168.0.183","104.244.42.65","TLSv1.2","140","Application Data"
"292","15.570595","192.168.0.183","104.244.42.65","TCP","1414","50717  >  443 [ACK] Seq=246465 Ack=37341 Win=1038 Len=1360 [TCP segment of a reassembled PDU]"
"293","15.570595","192.168.0.183","104.244.42.65","TCP","1414","50717  >  443 [ACK] Seq=247825 Ack=37341 Win=1038 Len=1360 [TCP segment of a reassembled PDU]"
"294","15.570595","192.168.0.183","104.244.42.65","TCP","1414","50717  >  443 [ACK] Seq=249185 Ack=37341 Win=1038 Len=1360 [TCP segment of a reassembled PDU]"
"295","15.570595","192.168.0.183","104.244.42.65","TCP","1414","50717  >  443 [ACK] Seq=250545 Ack=37341 Win=1038 Len=1360 [TCP segment of a reassembled PDU]"
"296","15.570595","192.168.0.183","104.244.42.65","TCP","1414","50717  >  443 [ACK] Seq=251905 Ack=37341 Win=1038 Len=1360 [TCP segment of a reassembled PDU]"
"297","15.570595","192.168.0.183","104.244.42.65","TCP","1414","50717  >  443 [ACK] Seq=253265 Ack=37341 Win=1038 Len=1360 [TCP segment of a reassembled PDU]"
"298","15.570595","192.168.0.183","104.244.42.65","TCP","1414","50717  >  443 [ACK] Seq=254625 Ack=37341 Win=1038 Len=1360 [TCP segment of a reassembled PDU]"
"299","15.570595","192.168.0.183","104.244.42.65","TCP","1414","50717  >  443 [ACK] Seq=255985 Ack=37341 Win=1038 Len=1360 [TCP segment of a reassembled PDU]"
"300","15.570595","192.168.0.183","104.244.42.65","TCP","1414","50717  >  443 [ACK] Seq=257345 Ack=37341 Win=1038 Len=1360 [TCP segment of a reassembled PDU]"
"301","15.570595","192.168.0.183","104.244.42.65","TCP","1414","50717  >  443 [ACK] Seq=258705 Ack=37341 Win=1038 Len=1360 [TCP segment of a reassembled PDU]"
"302","15.570595","192.168.0.183","104.244.42.65","TCP","1414","50717  >  443 [ACK] Seq=260065 Ack=37341 Win=1038 Len=1360 [TCP segment of a reassembled PDU]"
"303","15.570595","192.168.0.183","104.244.42.65","TCP","1414","50717  >  443 [ACK] Seq=261425 Ack=37341 Win=1038 Len=1360 [TCP segment of a reassembled PDU]"
"304","15.570595","192.168.0.183","104.244.42.65","TLSv1.2","140","Application Data"
"305","15.570829","192.168.0.183","104.244.42.65","TCP","1414","50717  >  443 [ACK] Seq=262871 Ack=37341 Win=1038 Len=1360 [TCP segment of a reassembled PDU]"
"306","15.570829","192.168.0.183","104.244.42.65","TCP","1414","50717  >  443 [ACK] Seq=264231 Ack=37341 Win=1038 Len=1360 [TCP segment of a reassembled PDU]"
"307","15.570829","192.168.0.183","104.244.42.65","TCP","1414","50717  >  443 [ACK] Seq=265591 Ack=37341 Win=1038 Len=1360 [TCP segment of a reassembled PDU]"
"308","15.570829","192.168.0.183","104.244.42.65","TCP","1414","50717  >  443 [ACK] Seq=266951 Ack=37341 Win=1038 Len=1360 [TCP segment of a reassembled PDU]"
"309","15.570829","192.168.0.183","104.244.42.65","TCP","1414","50717  >  443 [ACK] Seq=268311 Ack=37341 Win=1038 Len=1360 [TCP segment of a reassembled PDU]"
"310","15.570829","192.168.0.183","104.244.42.65","TCP","1414","50717  >  443 [ACK] Seq=269671 Ack=37341 Win=1038 Len=1360 [TCP segment of a reassembled PDU]"
"311","15.570829","192.168.0.183","104.244.42.65","TCP","1414","50717  >  443 [ACK] Seq=271031 Ack=37341 Win=1038 Len=1360 [TCP segment of a reassembled PDU]"
"312","15.570829","192.168.0.183","104.244.42.65","TCP","1414","50717  >  443 [ACK] Seq=272391 Ack=37341 Win=1038 Len=1360 [TCP segment of a reassembled PDU]"
"313","15.570829","192.168.0.183","104.244.42.65","TCP","1414","50717  >  443 [ACK] Seq=273751 Ack=37341 Win=1038 Len=1360 [TCP segment of a reassembled PDU]"
"314","15.570829","192.168.0.183","104.244.42.65","TCP","1414","50717  >  443 [ACK] Seq=275111 Ack=37341 Win=1038 Len=1360 [TCP segment of a reassembled PDU]"
"315","15.570829","192.168.0.183","104.244.42.65","TCP","1414","50717  >  443 [ACK] Seq=276471 Ack=37341 Win=1038 Len=1360 [TCP segment of a reassembled PDU]"
"316","15.570829","192.168.0.183","104.244.42.65","TCP","1414","50717  >  443 [ACK] Seq=277831 Ack=37341 Win=1038 Len=1360 [TCP segment of a reassembled PDU]"
"317","15.570829","192.168.0.183","104.244.42.65","TLSv1.2","140","Application Data"
"318","15.571170","192.168.0.183","104.244.42.65","TCP","1414","50717  >  443 [ACK] Seq=279277 Ack=37341 Win=1038 Len=1360 [TCP segment of a reassembled PDU]"
"319","15.571170","192.168.0.183","104.244.42.65","TCP","1414","50717  >  443 [ACK] Seq=280637 Ack=37341 Win=1038 Len=1360 [TCP segment of a reassembled PDU]"
"320","15.571170","192.168.0.183","104.244.42.65","TCP","1414","50717  >  443 [ACK] Seq=281997 Ack=37341 Win=1038 Len=1360 [TCP segment of a reassembled PDU]"
"321","15.571170","192.168.0.183","104.244.42.65","TCP","1414","50717  >  443 [ACK] Seq=283357 Ack=37341 Win=1038 Len=1360 [TCP segment of a reassembled PDU]"
"322","15.571170","192.168.0.183","104.244.42.65","TCP","1414","50717  >  443 [ACK] Seq=284717 Ack=37341 Win=1038 Len=1360 [TCP segment of a reassembled PDU]"
"323","15.571170","192.168.0.183","104.244.42.65","TCP","1414","50717  >  443 [ACK] Seq=286077 Ack=37341 Win=1038 Len=1360 [TCP segment of a reassembled PDU]"
"324","15.571170","192.168.0.183","104.244.42.65","TCP","1414","50717  >  443 [ACK] Seq=287437 Ack=37341 Win=1038 Len=1360 [TCP segment of a reassembled PDU]"
"325","15.571170","192.168.0.183","104.244.42.65","TCP","1414","50717  >  443 [ACK] Seq=288797 Ack=37341 Win=1038 Len=1360 [TCP segment of a reassembled PDU]"
"326","15.571170","192.168.0.183","104.244.42.65","TCP","1414","50717  >  443 [ACK] Seq=290157 Ack=37341 Win=1038 Len=1360 [TCP segment of a reassembled PDU]"
"327","15.571170","192.168.0.183","104.244.42.65","TCP","1414","50717  >  443 [ACK] Seq=291517 Ack=37341 Win=1038 Len=1360 [TCP segment of a reassembled PDU]"
"328","15.571170","192.168.0.183","104.244.42.65","TCP","1414","50717  >  443 [ACK] Seq=292877 Ack=37341 Win=1038 Len=1360 [TCP segment of a reassembled PDU]"
"329","15.571170","192.168.0.183","104.244.42.65","TCP","1414","50717  >  443 [ACK] Seq=294237 Ack=37341 Win=1038 Len=1360 [TCP segment of a reassembled PDU]"
"330","15.571170","192.168.0.183","104.244.42.65","TLSv1.2","140","Application Data"
"331","15.571502","192.168.0.183","104.244.42.65","TLSv1.2","121","Application Data"
"332","15.599691","104.244.42.65","192.168.0.183","TCP","60","443  >  50717 [ACK] Seq=37341 Ack=231419 Win=5731 Len=0"
"333","15.606690","104.244.42.65","192.168.0.183","TCP","60","443  >  50717 [ACK] Seq=37341 Ack=288797 Win=5711 Len=0"
"334","15.606690","104.244.42.65","192.168.0.183","TLSv1.2","89","Application Data"
"335","15.606690","104.244.42.65","192.168.0.183","TCP","60","443  >  50717 [ACK] Seq=37376 Ack=295750 Win=5723 Len=0"
"336","15.606927","192.168.0.183","104.244.42.65","TCP","1414","50717  >  443 [ACK] Seq=295750 Ack=37376 Win=1038 Len=1360 [TCP segment of a reassembled PDU]"
"337","15.606927","192.168.0.183","104.244.42.65","TCP","1414","50717  >  443 [ACK] Seq=297110 Ack=37376 Win=1038 Len=1360 [TCP segment of a reassembled PDU]"
"338","15.606927","192.168.0.183","104.244.42.65","TCP","1414","50717  >  443 [ACK] Seq=298470 Ack=37376 Win=1038 Len=1360 [TCP segment of a reassembled PDU]"
"339","15.606927","192.168.0.183","104.244.42.65","TCP","1414","50717  >  443 [ACK] Seq=299830 Ack=37376 Win=1038 Len=1360 [TCP segment of a reassembled PDU]"
"340","15.606927","192.168.0.183","104.244.42.65","TCP","1414","50717  >  443 [ACK] Seq=301190 Ack=37376 Win=1038 Len=1360 [TCP segment of a reassembled PDU]"
"341","15.606927","192.168.0.183","104.244.42.65","TCP","1414","50717  >  443 [ACK] Seq=302550 Ack=37376 Win=1038 Len=1360 [TCP segment of a reassembled PDU]"
"342","15.606927","192.168.0.183","104.244.42.65","TCP","1414","50717  >  443 [ACK] Seq=303910 Ack=37376 Win=1038 Len=1360 [TCP segment of a reassembled PDU]"
"343","15.606927","192.168.0.183","104.244.42.65","TCP","1414","50717  >  443 [ACK] Seq=305270 Ack=37376 Win=1038 Len=1360 [TCP segment of a reassembled PDU]"
"344","15.606927","192.168.0.183","104.244.42.65","TCP","1414","50717  >  443 [ACK] Seq=306630 Ack=37376 Win=1038 Len=1360 [TCP segment of a reassembled PDU]"
"345","15.606927","192.168.0.183","104.244.42.65","TCP","1414","50717  >  443 [ACK] Seq=307990 Ack=37376 Win=1038 Len=1360 [TCP segment of a reassembled PDU]"
"346","15.606927","192.168.0.183","104.244.42.65","TCP","1414","50717  >  443 [ACK] Seq=309350 Ack=37376 Win=1038 Len=1360 [TCP segment of a reassembled PDU]"
"347","15.606927","192.168.0.183","104.244.42.65","TCP","1414","50717  >  443 [ACK] Seq=310710 Ack=37376 Win=1038 Len=1360 [TCP segment of a reassembled PDU]"
"348","15.606927","192.168.0.183","104.244.42.65","TLSv1.2","104","Application Data"
"349","15.607073","192.168.0.183","104.244.42.65","TCP","1414","50717  >  443 [ACK] Seq=312120 Ack=37376 Win=1038 Len=1360 [TCP segment of a reassembled PDU]"
"350","15.607073","192.168.0.183","104.244.42.65","TCP","1414","50717  >  443 [ACK] Seq=313480 Ack=37376 Win=1038 Len=1360 [TCP segment of a reassembled PDU]"
"351","15.607073","192.168.0.183","104.244.42.65","TCP","1414","50717  >  443 [ACK] Seq=314840 Ack=37376 Win=1038 Len=1360 [TCP segment of a reassembled PDU]"
"352","15.607073","192.168.0.183","104.244.42.65","TCP","1414","50717  >  443 [ACK] Seq=316200 Ack=37376 Win=1038 Len=1360 [TCP segment of a reassembled PDU]"
"353","15.607073","192.168.0.183","104.244.42.65","TCP","1414","50717  >  443 [ACK] Seq=317560 Ack=37376 Win=1038 Len=1360 [TCP segment of a reassembled PDU]"
"354","15.607073","192.168.0.183","104.244.42.65","TCP","1414","50717  >  443 [ACK] Seq=318920 Ack=37376 Win=1038 Len=1360 [TCP segment of a reassembled PDU]"
"355","15.607073","192.168.0.183","104.244.42.65","TCP","1414","50717  >  443 [ACK] Seq=320280 Ack=37376 Win=1038 Len=1360 [TCP segment of a reassembled PDU]"
"356","15.607073","192.168.0.183","104.244.42.65","TCP","1414","50717  >  443 [ACK] Seq=321640 Ack=37376 Win=1038 Len=1360 [TCP segment of a reassembled PDU]"
"357","15.607073","192.168.0.183","104.244.42.65","TCP","1414","50717  >  443 [ACK] Seq=323000 Ack=37376 Win=1038 Len=1360 [TCP segment of a reassembled PDU]"
"358","15.607073","192.168.0.183","104.244.42.65","TCP","1414","50717  >  443 [ACK] Seq=324360 Ack=37376 Win=1038 Len=1360 [TCP segment of a reassembled PDU]"
"359","15.607073","192.168.0.183","104.244.42.65","TCP","1414","50717  >  443 [ACK] Seq=325720 Ack=37376 Win=1038 Len=1360 [TCP segment of a reassembled PDU]"
"360","15.607073","192.168.0.183","104.244.42.65","TCP","1414","50717  >  443 [ACK] Seq=327080 Ack=37376 Win=1038 Len=1360 [TCP segment of a reassembled PDU]"
"361","15.607073","192.168.0.183","104.244.42.65","TLSv1.2","140","Application Data"
"362","15.607192","192.168.0.183","104.244.42.65","TCP","1414","50717  >  443 [ACK] Seq=328526 Ack=37376 Win=1038 Len=1360 [TCP segment of a reassembled PDU]"
"363","15.607192","192.168.0.183","104.244.42.65","TCP","1414","50717  >  443 [ACK] Seq=329886 Ack=37376 Win=1038 Len=1360 [TCP segment of a reassembled PDU]"
"364","15.607192","192.168.0.183","104.244.42.65","TCP","1414","50717  >  443 [ACK] Seq=331246 Ack=37376 Win=1038 Len=1360 [TCP segment of a reassembled PDU]"
"365","15.607192","192.168.0.183","104.244.42.65","TCP","1414","50717  >  443 [ACK] Seq=332606 Ack=37376 Win=1038 Len=1360 [TCP segment of a reassembled PDU]"
"366","15.607192","192.168.0.183","104.244.42.65","TCP","1414","50717  >  443 [ACK] Seq=333966 Ack=37376 Win=1038 Len=1360 [TCP segment of a reassembled PDU]"
"367","15.607192","192.168.0.183","104.244.42.65","TCP","1414","50717  >  443 [ACK] Seq=335326 Ack=37376 Win=1038 Len=1360 [TCP segment of a reassembled PDU]"
"368","15.607192","192.168.0.183","104.244.42.65","TLSv1.2","359","Application Data"
"369","15.638066","104.244.42.65","192.168.0.183","TCP","60","443  >  50717 [ACK] Seq=37376 Ack=306630 Win=5735 Len=0"
"370","15.645838","104.244.42.65","192.168.0.183","TCP","60","443  >  50717 [ACK] Seq=37376 Ack=328526 Win=5676 Len=0"
"371","15.645838","104.244.42.65","192.168.0.183","TLSv1.2","89","Application Data"
"372","15.645838","104.244.42.65","192.168.0.183","TCP","60","443  >  50717 [ACK] Seq=37411 Ack=336991 Win=5735 Len=0"
"373","15.686230","192.168.0.183","104.244.42.65","TCP","54","50717  >  443 [ACK] Seq=336991 Ack=37411 Win=1038 Len=0"
"374","15.753457","104.244.42.65","192.168.0.183","TLSv1.2","204","Application Data"
"375","15.789139","104.244.42.65","192.168.0.183","TLSv1.2","152","Application Data"
"376","15.789163","192.168.0.183","104.244.42.65","TCP","54","50717  >  443 [ACK] Seq=336991 Ack=37659 Win=1037 Len=0"
"377","16.315737","104.244.42.65","192.168.0.183","TCP","1414","443  >  50717 [ACK] Seq=37659 Ack=336991 Win=5735 Len=1360 [TCP segment of a reassembled PDU]"
"378","16.315737","104.244.42.65","192.168.0.183","TCP","1414","443  >  50717 [ACK] Seq=39019 Ack=336991 Win=5735 Len=1360 [TCP segment of a reassembled PDU]"
"379","16.315737","104.244.42.65","192.168.0.183","TCP","1414","443  >  50717 [PSH, ACK] Seq=40379 Ack=336991 Win=5735 Len=1360 [TCP segment of a reassembled PDU]"
"380","16.315737","104.244.42.65","192.168.0.183","TCP","1414","443  >  50717 [ACK] Seq=41739 Ack=336991 Win=5735 Len=1360 [TCP segment of a reassembled PDU]"
"381","16.315737","104.244.42.65","192.168.0.183","TCP","1414","443  >  50717 [ACK] Seq=43099 Ack=336991 Win=5735 Len=1360 [TCP segment of a reassembled PDU]"
"382","16.315737","104.244.42.65","192.168.0.183","TCP","1414","443  >  50717 [PSH, ACK] Seq=44459 Ack=336991 Win=5735 Len=1360 [TCP segment of a reassembled PDU]"
"383","16.315737","104.244.42.65","192.168.0.183","TLSv1.2","187","Application Data"
"384","16.315786","192.168.0.183","104.244.42.65","TCP","54","50717  >  443 [ACK] Seq=336991 Ack=45952 Win=1041 Len=0"
"385","16.316389","192.168.0.183","104.244.42.65","TLSv1.2","89","Application Data"
"386","16.395584","104.244.42.65","192.168.0.183","TCP","60","443  >  50717 [ACK] Seq=45952 Ack=337026 Win=5735 Len=0"
"387","19.363910","192.168.0.183","104.244.42.65","TLSv1.2","245","Application Data"
"388","19.364101","192.168.0.183","104.244.42.65","TCP","1414","50717  >  443 [ACK] Seq=337217 Ack=45952 Win=1041 Len=1360 [TCP segment of a reassembled PDU]"
"389","19.364101","192.168.0.183","104.244.42.65","TCP","1414","50717  >  443 [ACK] Seq=338577 Ack=45952 Win=1041 Len=1360 [TCP segment of a reassembled PDU]"
"390","19.364101","192.168.0.183","104.244.42.65","TCP","1414","50717  >  443 [ACK] Seq=339937 Ack=45952 Win=1041 Len=1360 [TCP segment of a reassembled PDU]"
"391","19.364101","192.168.0.183","104.244.42.65","TCP","1414","50717  >  443 [ACK] Seq=341297 Ack=45952 Win=1041 Len=1360 [TCP segment of a reassembled PDU]"
"392","19.364101","192.168.0.183","104.244.42.65","TCP","1414","50717  >  443 [ACK] Seq=342657 Ack=45952 Win=1041 Len=1360 [TCP segment of a reassembled PDU]"
"393","19.364101","192.168.0.183","104.244.42.65","TCP","1414","50717  >  443 [ACK] Seq=344017 Ack=45952 Win=1041 Len=1360 [TCP segment of a reassembled PDU]"
"394","19.364101","192.168.0.183","104.244.42.65","TCP","1414","50717  >  443 [ACK] Seq=345377 Ack=45952 Win=1041 Len=1360 [TCP segment of a reassembled PDU]"
"395","19.364101","192.168.0.183","104.244.42.65","TCP","1414","50717  >  443 [ACK] Seq=346737 Ack=45952 Win=1041 Len=1360 [TCP segment of a reassembled PDU]"
"396","19.364101","192.168.0.183","104.244.42.65","TCP","1414","50717  >  443 [ACK] Seq=348097 Ack=45952 Win=1041 Len=1360 [TCP segment of a reassembled PDU]"
"397","19.364101","192.168.0.183","104.244.42.65","TCP","1414","50717  >  443 [ACK] Seq=349457 Ack=45952 Win=1041 Len=1360 [TCP segment of a reassembled PDU]"
"398","19.364101","192.168.0.183","104.244.42.65","TCP","1414","50717  >  443 [ACK] Seq=350817 Ack=45952 Win=1041 Len=1360 [TCP segment of a reassembled PDU]"
"399","19.364101","192.168.0.183","104.244.42.65","TCP","1414","50717  >  443 [ACK] Seq=352177 Ack=45952 Win=1041 Len=1360 [TCP segment of a reassembled PDU]"
"400","19.364101","192.168.0.183","104.244.42.65","TLSv1.2","140","Application Data"
"401","19.364291","192.168.0.183","104.244.42.65","TLSv1.2","1294","Application Data"
"402","19.393836","104.244.42.65","192.168.0.183","TCP","60","443  >  50717 [ACK] Seq=45952 Ack=338577 Win=5731 Len=0"
"403","19.399686","104.244.42.65","192.168.0.183","TCP","60","443  >  50717 [ACK] Seq=45952 Ack=354863 Win=5728 Len=0"
"404","19.438013","104.244.42.65","192.168.0.183","TLSv1.2","184","Application Data"
"405","19.479420","192.168.0.183","104.244.42.65","TCP","54","50717  >  443 [ACK] Seq=354863 Ack=46082 Win=1040 Len=0"
"406","20.028115","192.168.0.183","104.244.42.65","TLSv1.2","234","Application Data"
"407","20.028284","192.168.0.183","104.244.42.65","TLSv1.2","1159","Application Data"
"408","20.058735","104.244.42.65","192.168.0.183","TCP","60","443  >  50717 [ACK] Seq=46082 Ack=356148 Win=5735 Len=0"
"409","20.081365","104.244.42.65","192.168.0.183","TLSv1.2","235","Application Data"
"410","20.134544","192.168.0.183","104.244.42.65","TCP","54","50717  >  443 [ACK] Seq=356148 Ack=46263 Win=1040 Len=0"
"411","20.743927","192.168.0.183","104.244.42.65","TLSv1.2","236","Application Data"
"412","20.744017","192.168.0.183","104.244.42.65","TCP","1414","50717  >  443 [ACK] Seq=356330 Ack=46263 Win=1040 Len=1360 [TCP segment of a reassembled PDU]"
"413","20.744017","192.168.0.183","104.244.42.65","TLSv1.2","553","Application Data"
"414","20.773729","104.244.42.65","192.168.0.183","TCP","60","443  >  50717 [ACK] Seq=46263 Ack=357690 Win=5732 Len=0"
"415","20.798444","104.244.42.65","192.168.0.183","TLSv1.2","304","Application Data"
"416","20.849408","192.168.0.183","104.244.42.65","TCP","54","50717  >  443 [ACK] Seq=358189 Ack=46513 Win=1039 Len=0"
"417","22.200859","192.168.0.183","104.244.42.65","TLSv1.2","251","Application Data"
"418","22.200928","192.168.0.183","104.244.42.65","TLSv1.2","168","Application Data"
"419","22.230436","104.244.42.65","192.168.0.183","TCP","60","443  >  50717 [ACK] Seq=46513 Ack=358500 Win=5735 Len=0"
"420","22.306696","104.244.42.65","192.168.0.183","TLSv1.2","270","Application Data"
"421","22.307968","192.168.0.183","104.244.42.65","TLSv1.2","89","Application Data"
"422","22.382363","104.244.42.65","192.168.0.183","TCP","60","443  >  50717 [ACK] Seq=46729 Ack=358535 Win=5735 Len=0"
"423","23.744718","192.168.0.183","104.244.42.65","TLSv1.2","760","Application Data"
"424","23.744858","192.168.0.183","104.244.42.65","TCP","1414","50717  >  443 [ACK] Seq=359241 Ack=46729 Win=1038 Len=1360 [TCP segment of a reassembled PDU]"
"425","23.744858","192.168.0.183","104.244.42.65","TCP","1414","50717  >  443 [ACK] Seq=360601 Ack=46729 Win=1038 Len=1360 [TCP segment of a reassembled PDU]"
"426","23.744858","192.168.0.183","104.244.42.65","TCP","1414","50717  >  443 [ACK] Seq=361961 Ack=46729 Win=1038 Len=1360 [TCP segment of a reassembled PDU]"
"427","23.744858","192.168.0.183","104.244.42.65","TCP","1414","50717  >  443 [ACK] Seq=363321 Ack=46729 Win=1038 Len=1360 [TCP segment of a reassembled PDU]"
"428","23.744858","192.168.0.183","104.244.42.65","TCP","1414","50717  >  443 [ACK] Seq=364681 Ack=46729 Win=1038 Len=1360 [TCP segment of a reassembled PDU]"
"429","23.744858","192.168.0.183","104.244.42.65","TCP","1414","50717  >  443 [ACK] Seq=366041 Ack=46729 Win=1038 Len=1360 [TCP segment of a reassembled PDU]"
"430","23.744858","192.168.0.183","104.244.42.65","TCP","1414","50717  >  443 [ACK] Seq=367401 Ack=46729 Win=1038 Len=1360 [TCP segment of a reassembled PDU]"
"431","23.744858","192.168.0.183","104.244.42.65","TCP","1414","50717  >  443 [ACK] Seq=368761 Ack=46729 Win=1038 Len=1360 [TCP segment of a reassembled PDU]"
"432","23.744858","192.168.0.183","104.244.42.65","TCP","1414","50717  >  443 [ACK] Seq=370121 Ack=46729 Win=1038 Len=1360 [TCP segment of a reassembled PDU]"
"433","23.744858","192.168.0.183","104.244.42.65","TCP","1414","50717  >  443 [ACK] Seq=371481 Ack=46729 Win=1038 Len=1360 [TCP segment of a reassembled PDU]"
"434","23.744858","192.168.0.183","104.244.42.65","TCP","1414","50717  >  443 [ACK] Seq=372841 Ack=46729 Win=1038 Len=1360 [TCP segment of a reassembled PDU]"
"435","23.744858","192.168.0.183","104.244.42.65","TCP","1414","50717  >  443 [ACK] Seq=374201 Ack=46729 Win=1038 Len=1360 [TCP segment of a reassembled PDU]"
"436","23.744858","192.168.0.183","104.244.42.65","TLSv1.2","140","Application Data"
"437","23.744980","192.168.0.183","104.244.42.65","TCP","1414","50717  >  443 [ACK] Seq=375647 Ack=46729 Win=1038 Len=1360 [TCP segment of a reassembled PDU]"
"438","23.744980","192.168.0.183","104.244.42.65","TCP","1414","50717  >  443 [ACK] Seq=377007 Ack=46729 Win=1038 Len=1360 [TCP segment of a reassembled PDU]"
"439","23.744980","192.168.0.183","104.244.42.65","TCP","1414","50717  >  443 [ACK] Seq=378367 Ack=46729 Win=1038 Len=1360 [TCP segment of a reassembled PDU]"
"440","23.744980","192.168.0.183","104.244.42.65","TCP","1414","50717  >  443 [ACK] Seq=379727 Ack=46729 Win=1038 Len=1360 [TCP segment of a reassembled PDU]"
"441","23.744980","192.168.0.183","104.244.42.65","TCP","1414","50717  >  443 [ACK] Seq=381087 Ack=46729 Win=1038 Len=1360 [TCP segment of a reassembled PDU]"
"442","23.744980","192.168.0.183","104.244.42.65","TCP","1414","50717  >  443 [ACK] Seq=382447 Ack=46729 Win=1038 Len=1360 [TCP segment of a reassembled PDU]"
"443","23.744980","192.168.0.183","104.244.42.65","TCP","1414","50717  >  443 [ACK] Seq=383807 Ack=46729 Win=1038 Len=1360 [TCP segment of a reassembled PDU]"
"444","23.744980","192.168.0.183","104.244.42.65","TLSv1.2","581","Application Data"
"445","23.776042","104.244.42.65","192.168.0.183","TCP","60","443  >  50717 [ACK] Seq=46729 Ack=360601 Win=5730 Len=0"
"446","23.782358","104.244.42.65","192.168.0.183","TCP","60","443  >  50717 [ACK] Seq=46729 Ack=385694 Win=5719 Len=0"
"447","23.815439","104.244.42.65","192.168.0.183","TLSv1.2","184","Application Data"
"448","23.864770","192.168.0.183","104.244.42.65","TCP","54","50717  >  443 [ACK] Seq=385694 Ack=46859 Win=1037 Len=0"
"449","24.034368","192.168.0.183","104.244.42.65","TCP","1414","50717  >  443 [ACK] Seq=385694 Ack=46859 Win=1037 Len=1360 [TCP segment of a reassembled PDU]"
"450","24.034368","192.168.0.183","104.244.42.65","TLSv1.2","517","Application Data"
"451","24.064251","104.244.42.65","192.168.0.183","TCP","60","443  >  50717 [ACK] Seq=46859 Ack=387517 Win=5730 Len=0"
"452","24.899661","104.244.42.65","192.168.0.183","TCP","1414","443  >  50717 [ACK] Seq=46859 Ack=387517 Win=5735 Len=1360 [TCP segment of a reassembled PDU]"
"453","24.899661","104.244.42.65","192.168.0.183","TCP","1414","443  >  50717 [ACK] Seq=48219 Ack=387517 Win=5735 Len=1360 [TCP segment of a reassembled PDU]"
"454","24.899661","104.244.42.65","192.168.0.183","TCP","1414","443  >  50717 [PSH, ACK] Seq=49579 Ack=387517 Win=5735 Len=1360 [TCP segment of a reassembled PDU]"
"455","24.899661","104.244.42.65","192.168.0.183","TCP","1414","443  >  50717 [ACK] Seq=50939 Ack=387517 Win=5735 Len=1360 [TCP segment of a reassembled PDU]"
"456","24.899661","104.244.42.65","192.168.0.183","TCP","1414","443  >  50717 [ACK] Seq=52299 Ack=387517 Win=5735 Len=1360 [TCP segment of a reassembled PDU]"
"457","24.899661","104.244.42.65","192.168.0.183","TLSv1.2","906","Application Data"
"458","24.899947","192.168.0.183","104.244.42.65","TCP","54","50717  >  443 [ACK] Seq=387517 Ack=54511 Win=1041 Len=0"
"459","26.987138","192.168.0.183","104.244.42.65","TLSv1.2","719","Application Data"
"460","26.987355","192.168.0.183","104.244.42.65","TCP","1414","50717  >  443 [ACK] Seq=388182 Ack=54511 Win=1041 Len=1360 [TCP segment of a reassembled PDU]"
"461","26.987355","192.168.0.183","104.244.42.65","TCP","1414","50717  >  443 [ACK] Seq=389542 Ack=54511 Win=1041 Len=1360 [TCP segment of a reassembled PDU]"
"462","26.987355","192.168.0.183","104.244.42.65","TCP","1414","50717  >  443 [ACK] Seq=390902 Ack=54511 Win=1041 Len=1360 [TCP segment of a reassembled PDU]"
"463","26.987355","192.168.0.183","104.244.42.65","TCP","1414","50717  >  443 [ACK] Seq=392262 Ack=54511 Win=1041 Len=1360 [TCP segment of a reassembled PDU]"
"464","26.987355","192.168.0.183","104.244.42.65","TCP","1414","50717  >  443 [ACK] Seq=393622 Ack=54511 Win=1041 Len=1360 [TCP segment of a reassembled PDU]"
"465","26.987355","192.168.0.183","104.244.42.65","TCP","1414","50717  >  443 [ACK] Seq=394982 Ack=54511 Win=1041 Len=1360 [TCP segment of a reassembled PDU]"
"466","26.987355","192.168.0.183","104.244.42.65","TCP","1414","50717  >  443 [ACK] Seq=396342 Ack=54511 Win=1041 Len=1360 [TCP segment of a reassembled PDU]"
"467","26.987355","192.168.0.183","104.244.42.65","TCP","1414","50717  >  443 [ACK] Seq=397702 Ack=54511 Win=1041 Len=1360 [TCP segment of a reassembled PDU]"
"468","26.987355","192.168.0.183","104.244.42.65","TCP","1414","50717  >  443 [ACK] Seq=399062 Ack=54511 Win=1041 Len=1360 [TCP segment of a reassembled PDU]"
"469","26.987355","192.168.0.183","104.244.42.65","TCP","1414","50717  >  443 [ACK] Seq=400422 Ack=54511 Win=1041 Len=1360 [TCP segment of a reassembled PDU]"
"470","26.987355","192.168.0.183","104.244.42.65","TCP","1414","50717  >  443 [ACK] Seq=401782 Ack=54511 Win=1041 Len=1360 [TCP segment of a reassembled PDU]"
"471","26.987355","192.168.0.183","104.244.42.65","TCP","1414","50717  >  443 [ACK] Seq=403142 Ack=54511 Win=1041 Len=1360 [TCP segment of a reassembled PDU]"
"472","26.987355","192.168.0.183","104.244.42.65","TLSv1.2","140","Application Data"
"473","26.987629","192.168.0.183","104.244.42.65","TCP","1414","50717  >  443 [ACK] Seq=404588 Ack=54511 Win=1041 Len=1360 [TCP segment of a reassembled PDU]"
"474","26.987629","192.168.0.183","104.244.42.65","TCP","1414","50717  >  443 [ACK] Seq=405948 Ack=54511 Win=1041 Len=1360 [TCP segment of a reassembled PDU]"
"475","26.987629","192.168.0.183","104.244.42.65","TCP","1414","50717  >  443 [ACK] Seq=407308 Ack=54511 Win=1041 Len=1360 [TCP segment of a reassembled PDU]"
"476","26.987629","192.168.0.183","104.244.42.65","TCP","1414","50717  >  443 [ACK] Seq=408668 Ack=54511 Win=1041 Len=1360 [TCP segment of a reassembled PDU]"
"477","26.987629","192.168.0.183","104.244.42.65","TCP","1414","50717  >  443 [ACK] Seq=410028 Ack=54511 Win=1041 Len=1360 [TCP segment of a reassembled PDU]"
"478","26.987629","192.168.0.183","104.244.42.65","TCP","1414","50717  >  443 [ACK] Seq=411388 Ack=54511 Win=1041 Len=1360 [TCP segment of a reassembled PDU]"
"479","26.987629","192.168.0.183","104.244.42.65","TCP","1414","50717  >  443 [ACK] Seq=412748 Ack=54511 Win=1041 Len=1360 [TCP segment of a reassembled PDU]"
"480","26.987629","192.168.0.183","104.244.42.65","TCP","1414","50717  >  443 [ACK] Seq=414108 Ack=54511 Win=1041 Len=1360 [TCP segment of a reassembled PDU]"
"481","26.987629","192.168.0.183","104.244.42.65","TCP","1414","50717  >  443 [ACK] Seq=415468 Ack=54511 Win=1041 Len=1360 [TCP segment of a reassembled PDU]"
"482","26.987629","192.168.0.183","104.244.42.65","TCP","1414","50717  >  443 [ACK] Seq=416828 Ack=54511 Win=1041 Len=1360 [TCP segment of a reassembled PDU]"
"483","26.987629","192.168.0.183","104.244.42.65","TCP","1414","50717  >  443 [ACK] Seq=418188 Ack=54511 Win=1041 Len=1360 [TCP segment of a reassembled PDU]"
"484","26.987629","192.168.0.183","104.244.42.65","TCP","1414","50717  >  443 [ACK] Seq=419548 Ack=54511 Win=1041 Len=1360 [TCP segment of a reassembled PDU]"
"485","26.987629","192.168.0.183","104.244.42.65","TLSv1.2","140","Application Data"
"486","26.987847","192.168.0.183","104.244.42.65","TCP","1414","50717  >  443 [ACK] Seq=420994 Ack=54511 Win=1041 Len=1360 [TCP segment of a reassembled PDU]"
"487","26.987847","192.168.0.183","104.244.42.65","TCP","1414","50717  >  443 [ACK] Seq=422354 Ack=54511 Win=1041 Len=1360 [TCP segment of a reassembled PDU]"
"488","26.987847","192.168.0.183","104.244.42.65","TCP","1414","50717  >  443 [ACK] Seq=423714 Ack=54511 Win=1041 Len=1360 [TCP segment of a reassembled PDU]"
"489","26.987847","192.168.0.183","104.244.42.65","TCP","1414","50717  >  443 [ACK] Seq=425074 Ack=54511 Win=1041 Len=1360 [TCP segment of a reassembled PDU]"
"490","26.987847","192.168.0.183","104.244.42.65","TLSv1.2","1048","Application Data"
"491","27.023647","104.244.42.65","192.168.0.183","TCP","60","443  >  50717 [ACK] Seq=54511 Ack=427428 Win=5729 Len=0"
"492","27.023647","104.244.42.65","192.168.0.183","TLSv1.2","89","Application Data"
"493","27.062407","104.244.42.65","192.168.0.183","TLSv1.2","180","Application Data"
"494","27.062442","192.168.0.183","104.244.42.65","TCP","54","50717  >  443 [ACK] Seq=427428 Ack=54672 Win=1040 Len=0"
"495","27.615298","192.168.0.183","104.244.42.65","TLSv1.2","305","Application Data"
"496","27.615388","192.168.0.183","104.244.42.65","TLSv1.2","413","Application Data"
"497","27.646543","104.244.42.65","192.168.0.183","TCP","60","443  >  50717 [ACK] Seq=54672 Ack=428038 Win=5735 Len=0"
"498","27.666610","104.244.42.65","192.168.0.183","TLSv1.2","206","Application Data"
"499","27.718112","192.168.0.183","104.244.42.65","TCP","54","50717  >  443 [ACK] Seq=428038 Ack=54824 Win=1040 Len=0"
"500","28.211675","192.168.0.183","104.244.42.65","TLSv1.2","938","Application Data"
"501","28.211840","192.168.0.183","104.244.42.65","TLSv1.2","246","Application Data"
"502","28.242518","104.244.42.65","192.168.0.183","TCP","60","443  >  50717 [ACK] Seq=54824 Ack=429114 Win=5735 Len=0"
"503","28.268913","104.244.42.65","192.168.0.183","TLSv1.2","461","Application Data"
"504","28.268913","104.244.42.65","192.168.0.183","TLSv1.2","260","Application Data"
"505","28.268984","192.168.0.183","104.244.42.65","TCP","54","50717  >  443 [ACK] Seq=429114 Ack=55437 Win=1037 Len=0"
"506","28.269872","192.168.0.183","104.244.42.65","TLSv1.2","89","Application Data"
"507","28.366805","104.244.42.65","192.168.0.183","TCP","60","443  >  50717 [ACK] Seq=55437 Ack=429149 Win=5735 Len=0"
"508","29.990307","192.168.0.183","104.244.42.65","TLSv1.2","235","Application Data"
"509","29.990452","192.168.0.183","104.244.42.65","TCP","1414","50717  >  443 [ACK] Seq=429330 Ack=55437 Win=1037 Len=1360 [TCP segment of a reassembled PDU]"
"510","29.990452","192.168.0.183","104.244.42.65","TCP","1414","50717  >  443 [ACK] Seq=430690 Ack=55437 Win=1037 Len=1360 [TCP segment of a reassembled PDU]"
"511","29.990452","192.168.0.183","104.244.42.65","TCP","1414","50717  >  443 [ACK] Seq=432050 Ack=55437 Win=1037 Len=1360 [TCP segment of a reassembled PDU]"
"512","29.990452","192.168.0.183","104.244.42.65","TCP","1414","50717  >  443 [ACK] Seq=433410 Ack=55437 Win=1037 Len=1360 [TCP segment of a reassembled PDU]"
"513","29.990452","192.168.0.183","104.244.42.65","TCP","1414","50717  >  443 [ACK] Seq=434770 Ack=55437 Win=1037 Len=1360 [TCP segment of a reassembled PDU]"
"514","29.990452","192.168.0.183","104.244.42.65","TCP","1414","50717  >  443 [ACK] Seq=436130 Ack=55437 Win=1037 Len=1360 [TCP segment of a reassembled PDU]"
"515","29.990452","192.168.0.183","104.244.42.65","TCP","1414","50717  >  443 [ACK] Seq=437490 Ack=55437 Win=1037 Len=1360 [TCP segment of a reassembled PDU]"
"516","29.990452","192.168.0.183","104.244.42.65","TCP","1414","50717  >  443 [ACK] Seq=438850 Ack=55437 Win=1037 Len=1360 [TCP segment of a reassembled PDU]"
"517","29.990452","192.168.0.183","104.244.42.65","TCP","1414","50717  >  443 [ACK] Seq=440210 Ack=55437 Win=1037 Len=1360 [TCP segment of a reassembled PDU]"
"518","29.990452","192.168.0.183","104.244.42.65","TCP","1414","50717  >  443 [ACK] Seq=441570 Ack=55437 Win=1037 Len=1360 [TCP segment of a reassembled PDU]"
"519","29.990452","192.168.0.183","104.244.42.65","TCP","1414","50717  >  443 [ACK] Seq=442930 Ack=55437 Win=1037 Len=1360 [TCP segment of a reassembled PDU]"
"520","29.990452","192.168.0.183","104.244.42.65","TCP","1414","50717  >  443 [ACK] Seq=444290 Ack=55437 Win=1037 Len=1360 [TCP segment of a reassembled PDU]"
"521","29.990452","192.168.0.183","104.244.42.65","TLSv1.2","140","Application Data"
"522","29.990597","192.168.0.183","104.244.42.65","TCP","1414","50717  >  443 [ACK] Seq=445736 Ack=55437 Win=1037 Len=1360 [TCP segment of a reassembled PDU]"
"523","29.990597","192.168.0.183","104.244.42.65","TCP","1414","50717  >  443 [ACK] Seq=447096 Ack=55437 Win=1037 Len=1360 [TCP segment of a reassembled PDU]"
"524","29.990597","192.168.0.183","104.244.42.65","TCP","1414","50717  >  443 [ACK] Seq=448456 Ack=55437 Win=1037 Len=1360 [TCP segment of a reassembled PDU]"
"525","29.990597","192.168.0.183","104.244.42.65","TCP","1414","50717  >  443 [ACK] Seq=449816 Ack=55437 Win=1037 Len=1360 [TCP segment of a reassembled PDU]"
"526","29.990597","192.168.0.183","104.244.42.65","TCP","1414","50717  >  443 [ACK] Seq=451176 Ack=55437 Win=1037 Len=1360 [TCP segment of a reassembled PDU]"
"527","29.990597","192.168.0.183","104.244.42.65","TCP","1414","50717  >  443 [ACK] Seq=452536 Ack=55437 Win=1037 Len=1360 [TCP segment of a reassembled PDU]"
"528","29.990597","192.168.0.183","104.244.42.65","TCP","1414","50717  >  443 [ACK] Seq=453896 Ack=55437 Win=1037 Len=1360 [TCP segment of a reassembled PDU]"
"529","29.990597","192.168.0.183","104.244.42.65","TCP","1414","50717  >  443 [ACK] Seq=455256 Ack=55437 Win=1037 Len=1360 [TCP segment of a reassembled PDU]"
"530","29.990597","192.168.0.183","104.244.42.65","TCP","1414","50717  >  443 [ACK] Seq=456616 Ack=55437 Win=1037 Len=1360 [TCP segment of a reassembled PDU]"
"531","29.990597","192.168.0.183","104.244.42.65","TLSv1.2","770","Application Data"
"532","30.022391","104.244.42.65","192.168.0.183","TCP","60","443  >  50717 [ACK] Seq=55437 Ack=430690 Win=5732 Len=0"
"533","30.027824","104.244.42.65","192.168.0.183","TCP","60","443  >  50717 [ACK] Seq=55437 Ack=458692 Win=5719 Len=0"
"534","30.066993","104.244.42.65","192.168.0.183","TLSv1.2","197","Application Data"
"535","30.117203","192.168.0.183","104.244.42.65","TCP","54","50717  >  443 [ACK] Seq=458692 Ack=55580 Win=1037 Len=0"
"536","30.542081","192.168.0.183","104.244.42.65","TLSv1.2","250","Application Data"
"537","30.542195","192.168.0.183","104.244.42.65","TLSv1.2","168","Application Data"
"538","30.572177","104.244.42.65","192.168.0.183","TCP","60","443  >  50717 [ACK] Seq=55580 Ack=459002 Win=5735 Len=0"
"539","30.654022","104.244.42.65","192.168.0.183","TLSv1.2","329","Application Data"
"540","30.707540","192.168.0.183","104.244.42.65","TCP","54","50717  >  443 [ACK] Seq=459002 Ack=55855 Win=1036 Len=0"
"541","32.991783","192.168.0.183","104.244.42.65","TLSv1.2","761","Application Data"
"542","32.991922","192.168.0.183","104.244.42.65","TCP","1414","50717  >  443 [ACK] Seq=459709 Ack=55855 Win=1036 Len=1360 [TCP segment of a reassembled PDU]"
"543","32.991922","192.168.0.183","104.244.42.65","TCP","1414","50717  >  443 [ACK] Seq=461069 Ack=55855 Win=1036 Len=1360 [TCP segment of a reassembled PDU]"
"544","32.991922","192.168.0.183","104.244.42.65","TCP","1414","50717  >  443 [ACK] Seq=462429 Ack=55855 Win=1036 Len=1360 [TCP segment of a reassembled PDU]"
"545","32.991922","192.168.0.183","104.244.42.65","TCP","1414","50717  >  443 [ACK] Seq=463789 Ack=55855 Win=1036 Len=1360 [TCP segment of a reassembled PDU]"
"546","32.991922","192.168.0.183","104.244.42.65","TCP","1414","50717  >  443 [ACK] Seq=465149 Ack=55855 Win=1036 Len=1360 [TCP segment of a reassembled PDU]"
"547","32.991922","192.168.0.183","104.244.42.65","TCP","1414","50717  >  443 [ACK] Seq=466509 Ack=55855 Win=1036 Len=1360 [TCP segment of a reassembled PDU]"
"548","32.991922","192.168.0.183","104.244.42.65","TCP","1414","50717  >  443 [ACK] Seq=467869 Ack=55855 Win=1036 Len=1360 [TCP segment of a reassembled PDU]"
"549","32.991922","192.168.0.183","104.244.42.65","TCP","1414","50717  >  443 [ACK] Seq=469229 Ack=55855 Win=1036 Len=1360 [TCP segment of a reassembled PDU]"
"550","32.991922","192.168.0.183","104.244.42.65","TCP","1414","50717  >  443 [ACK] Seq=470589 Ack=55855 Win=1036 Len=1360 [TCP segment of a reassembled PDU]"
"551","32.991922","192.168.0.183","104.244.42.65","TCP","1414","50717  >  443 [ACK] Seq=471949 Ack=55855 Win=1036 Len=1360 [TCP segment of a reassembled PDU]"
"552","32.991922","192.168.0.183","104.244.42.65","TCP","1414","50717  >  443 [ACK] Seq=473309 Ack=55855 Win=1036 Len=1360 [TCP segment of a reassembled PDU]"
"553","32.991922","192.168.0.183","104.244.42.65","TCP","1414","50717  >  443 [ACK] Seq=474669 Ack=55855 Win=1036 Len=1360 [TCP segment of a reassembled PDU]"
"554","32.991922","192.168.0.183","104.244.42.65","TLSv1.2","140","Application Data"
"555","32.992059","192.168.0.183","104.244.42.65","TCP","1414","50717  >  443 [ACK] Seq=476115 Ack=55855 Win=1036 Len=1360 [TCP segment of a reassembled PDU]"
"556","32.992059","192.168.0.183","104.244.42.65","TCP","1414","50717  >  443 [ACK] Seq=477475 Ack=55855 Win=1036 Len=1360 [TCP segment of a reassembled PDU]"
"557","32.992059","192.168.0.183","104.244.42.65","TCP","1414","50717  >  443 [ACK] Seq=478835 Ack=55855 Win=1036 Len=1360 [TCP segment of a reassembled PDU]"
"558","32.992059","192.168.0.183","104.244.42.65","TCP","1414","50717  >  443 [ACK] Seq=480195 Ack=55855 Win=1036 Len=1360 [TCP segment of a reassembled PDU]"
"559","32.992059","192.168.0.183","104.244.42.65","TCP","1414","50717  >  443 [ACK] Seq=481555 Ack=55855 Win=1036 Len=1360 [TCP segment of a reassembled PDU]"
"560","32.992059","192.168.0.183","104.244.42.65","TCP","1414","50717  >  443 [ACK] Seq=482915 Ack=55855 Win=1036 Len=1360 [TCP segment of a reassembled PDU]"
"561","32.992059","192.168.0.183","104.244.42.65","TLSv1.2","1396","Application Data"
"562","33.024426","104.244.42.65","192.168.0.183","TCP","60","443  >  50717 [ACK] Seq=55855 Ack=462429 Win=5726 Len=0"
"563","33.027953","104.244.42.65","192.168.0.183","TCP","60","443  >  50717 [ACK] Seq=55855 Ack=485617 Win=5735 Len=0"
"564","33.058221","104.244.42.65","192.168.0.183","TLSv1.2","256","Application Data"
"565","33.098560","192.168.0.183","104.244.42.65","TCP","54","50717  >  443 [ACK] Seq=485617 Ack=56057 Win=1041 Len=0"
"566","35.957289","192.168.0.183","104.244.42.65","TLSv1.2","302","Application Data"
"567","35.957407","192.168.0.183","104.244.42.65","TLSv1.2","168","Application Data"
"568","35.958237","192.168.0.183","104.244.42.65","TLSv1.2","718","Application Data"
"569","35.958383","192.168.0.183","104.244.42.65","TCP","1414","50717  >  443 [ACK] Seq=486643 Ack=56057 Win=1041 Len=1360 [TCP segment of a reassembled PDU]"
"570","35.958383","192.168.0.183","104.244.42.65","TCP","1414","50717  >  443 [ACK] Seq=488003 Ack=56057 Win=1041 Len=1360 [TCP segment of a reassembled PDU]"
"571","35.958383","192.168.0.183","104.244.42.65","TLSv1.2","63","Application Data"
"572","35.988504","104.244.42.65","192.168.0.183","TCP","60","443  >  50717 [ACK] Seq=56057 Ack=485979 Win=5735 Len=0"
"573","35.993148","104.244.42.65","192.168.0.183","TCP","60","443  >  50717 [ACK] Seq=56057 Ack=489372 Win=5726 Len=0"
"574","36.011319","104.244.42.65","192.168.0.183","TLSv1.2","300","Application Data"
"575","36.056414","192.168.0.183","104.244.42.65","TCP","54","50717  >  443 [ACK] Seq=489372 Ack=56303 Win=1040 Len=0"
"576","36.071452","104.244.42.65","192.168.0.183","TLSv1.2","247","Application Data"
"577","36.072009","192.168.0.183","104.244.42.65","TLSv1.2","89","Application Data"
"578","36.151998","104.244.42.65","192.168.0.183","TCP","60","443  >  50717 [ACK] Seq=56496 Ack=489407 Win=5735 Len=0"
