"No.","Time","Source","Destination","Protocol","Length","Info"
"1","0.000000","192.168.0.183","104.244.42.65","TLSv1.2","811","Application Data"
"2","0.000175","192.168.0.183","104.244.42.65","TCP","1414","50717  >  443 [ACK] Seq=758 Ack=1 Win=1041 Len=1360 [TCP segment of a reassembled PDU]"
"3","0.000175","192.168.0.183","104.244.42.65","TCP","1414","50717  >  443 [ACK] Seq=2118 Ack=1 Win=1041 Len=1360 [TCP segment of a reassembled PDU]"
"4","0.000175","192.168.0.183","104.244.42.65","TCP","1414","50717  >  443 [ACK] Seq=3478 Ack=1 Win=1041 Len=1360 [TCP segment of a reassembled PDU]"
"5","0.000175","192.168.0.183","104.244.42.65","TCP","1414","50717  >  443 [ACK] Seq=4838 Ack=1 Win=1041 Len=1360 [TCP segment of a reassembled PDU]"
"6","0.000175","192.168.0.183","104.244.42.65","TCP","1414","50717  >  443 [ACK] Seq=6198 Ack=1 Win=1041 Len=1360 [TCP segment of a reassembled PDU]"
"7","0.000175","192.168.0.183","104.244.42.65","TCP","1414","50717  >  443 [ACK] Seq=7558 Ack=1 Win=1041 Len=1360 [TCP segment of a reassembled PDU]"
"8","0.000175","192.168.0.183","104.244.42.65","TCP","1414","50717  >  443 [ACK] Seq=8918 Ack=1 Win=1041 Len=1360 [TCP segment of a reassembled PDU]"
"9","0.000175","192.168.0.183","104.244.42.65","TCP","1414","50717  >  443 [ACK] Seq=10278 Ack=1 Win=1041 Len=1360 [TCP segment of a reassembled PDU]"
"10","0.000175","192.168.0.183","104.244.42.65","TCP","1414","50717  >  443 [ACK] Seq=11638 Ack=1 Win=1041 Len=1360 [TCP segment of a reassembled PDU]"
"11","0.000175","192.168.0.183","104.244.42.65","TCP","1414","50717  >  443 [ACK] Seq=12998 Ack=1 Win=1041 Len=1360 [TCP segment of a reassembled PDU]"
"12","0.000175","192.168.0.183","104.244.42.65","TCP","1414","50717  >  443 [ACK] Seq=14358 Ack=1 Win=1041 Len=1360 [TCP segment of a reassembled PDU]"
"13","0.000175","192.168.0.183","104.244.42.65","TCP","1414","50717  >  443 [ACK] Seq=15718 Ack=1 Win=1041 Len=1360 [TCP segment of a reassembled PDU]"
"14","0.000175","192.168.0.183","104.244.42.65","TLSv1.2","140","Application Data"
"15","0.000332","192.168.0.183","104.244.42.65","TCP","1414","50717  >  443 [ACK] Seq=17164 Ack=1 Win=1041 Len=1360 [TCP segment of a reassembled PDU]"
"16","0.000332","192.168.0.183","104.244.42.65","TCP","1414","50717  >  443 [ACK] Seq=18524 Ack=1 Win=1041 Len=1360 [TCP segment of a reassembled PDU]"
"17","0.000332","192.168.0.183","104.244.42.65","TCP","1414","50717  >  443 [ACK] Seq=19884 Ack=1 Win=1041 Len=1360 [TCP segment of a reassembled PDU]"
"18","0.000332","192.168.0.183","104.244.42.65","TCP","1414","50717  >  443 [ACK] Seq=21244 Ack=1 Win=1041 Len=1360 [TCP segment of a reassembled PDU]"
"19","0.000332","192.168.0.183","104.244.42.65","TCP","1414","50717  >  443 [ACK] Seq=22604 Ack=1 Win=1041 Len=1360 [TCP segment of a reassembled PDU]"
"20","0.000332","192.168.0.183","104.244.42.65","TLSv1.2","1316","Application Data"
"21","0.034342","104.244.42.65","192.168.0.183","TCP","60","443  >  50717 [ACK] Seq=1 Ack=25226 Win=3605 Len=0"
"22","0.077216","104.244.42.65","192.168.0.183","TLSv1.2","275","Application Data"
"23","0.131200","192.168.0.183","104.244.42.65","TCP","54","50717  >  443 [ACK] Seq=25226 Ack=222 Win=1040 Len=0"
"24","3.830193","192.168.0.183","104.244.42.65","TLSv1.2","276","Application Data"
"25","3.830299","192.168.0.183","104.244.42.65","TCP","1414","50717  >  443 [ACK] Seq=25448 Ack=222 Win=1040 Len=1360 [TCP segment of a reassembled PDU]"
"26","3.830299","192.168.0.183","104.244.42.65","TCP","1414","50717  >  443 [ACK] Seq=26808 Ack=222 Win=1040 Len=1360 [TCP segment of a reassembled PDU]"
"27","3.830299","192.168.0.183","104.244.42.65","TCP","1414","50717  >  443 [ACK] Seq=28168 Ack=222 Win=1040 Len=1360 [TCP segment of a reassembled PDU]"
"28","3.830299","192.168.0.183","104.244.42.65","TCP","1414","50717  >  443 [ACK] Seq=29528 Ack=222 Win=1040 Len=1360 [TCP segment of a reassembled PDU]"
"29","3.830299","192.168.0.183","104.244.42.65","TCP","1414","50717  >  443 [ACK] Seq=30888 Ack=222 Win=1040 Len=1360 [TCP segment of a reassembled PDU]"
"30","3.830299","192.168.0.183","104.244.42.65","TCP","1414","50717  >  443 [ACK] Seq=32248 Ack=222 Win=1040 Len=1360 [TCP segment of a reassembled PDU]"
"31","3.830299","192.168.0.183","104.244.42.65","TLSv1.2","649","Application Data"
"32","3.863830","104.244.42.65","192.168.0.183","TCP","60","443  >  50717 [ACK] Seq=222 Ack=28168 Win=3637 Len=0"
"33","3.870039","104.244.42.65","192.168.0.183","TCP","60","443  >  50717 [ACK] Seq=222 Ack=34203 Win=3684 Len=0"
"34","3.898083","104.244.42.65","192.168.0.183","TLSv1.2","180","Application Data"
"35","3.941458","192.168.0.183","104.244.42.65","TCP","54","50717  >  443 [ACK] Seq=34203 Ack=348 Win=1039 Len=0"
"36","6.222269","192.168.0.183","104.244.42.65","TLSv1.2","235","Application Data"
"37","6.222370","192.168.0.183","104.244.42.65","TLSv1.2","660","Application Data"
"38","6.262104","104.244.42.65","192.168.0.183","TCP","60","443  >  50717 [ACK] Seq=348 Ack=34990 Win=3705 Len=0"
"39","6.284251","104.244.42.65","192.168.0.183","TLSv1.2","281","Application Data"
"40","6.339178","192.168.0.183","104.244.42.65","TCP","54","50717  >  443 [ACK] Seq=34990 Ack=575 Win=1039 Len=0"
"41","6.811353","192.168.0.183","104.244.42.65","TLSv1.2","932","Application Data"
"42","6.811462","192.168.0.183","104.244.42.65","TLSv1.2","265","Application Data"
"43","6.841833","104.244.42.65","192.168.0.183","TCP","60","443  >  50717 [ACK] Seq=575 Ack=36079 Win=3727 Len=0"
"44","6.872564","104.244.42.65","192.168.0.183","TLSv1.2","346","Application Data"
"45","6.872564","104.244.42.65","192.168.0.183","TLSv1.2","461","Application Data"
"46","6.872608","192.168.0.183","104.244.42.65","TCP","54","50717  >  443 [ACK] Seq=36079 Ack=1274 Win=1036 Len=0"
"47","6.873447","192.168.0.183","104.244.42.65","TLSv1.2","89","Application Data"
"48","6.943137","104.244.42.65","192.168.0.183","TCP","60","443  >  50717 [ACK] Seq=1274 Ack=36114 Win=3727 Len=0"
"49","10.907910","192.168.0.183","104.244.42.65","TLSv1.2","680","Application Data"
"50","10.907999","192.168.0.183","104.244.42.65","TLSv1.2","514","Application Data"
"51","10.938051","104.244.42.65","192.168.0.183","TCP","60","443  >  50717 [ACK] Seq=1274 Ack=37200 Win=3748 Len=0"
"52","10.962291","104.244.42.65","192.168.0.183","TLSv1.2","182","Application Data"
"53","10.995334","192.168.0.183","104.244.42.65","TLSv1.2","264","Application Data"
"54","10.995397","192.168.0.183","104.244.42.65","TLSv1.2","168","Application Data"
"55","10.996018","192.168.0.183","104.244.42.65","TLSv1.2","258","Application Data"
"56","10.996088","192.168.0.183","104.244.42.65","TCP","1414","50717  >  443 [ACK] Seq=37728 Ack=1402 Win=1041 Len=1360 [TCP segment of a reassembled PDU]"
"57","10.996088","192.168.0.183","104.244.42.65","TLSv1.2","535","Application Data"
"58","11.025994","104.244.42.65","192.168.0.183","TCP","60","443  >  50717 [ACK] Seq=1402 Ack=37728 Win=3769 Len=0"
"59","11.032013","104.244.42.65","192.168.0.183","TCP","60","443  >  50717 [ACK] Seq=1402 Ack=39569 Win=3784 Len=0"
"60","11.057506","104.244.42.65","192.168.0.183","TLSv1.2","138","Application Data"
"61","11.098018","192.168.0.183","104.244.42.65","TCP","54","50717  >  443 [ACK] Seq=39569 Ack=1486 Win=1040 Len=0"
"62","11.107702","104.244.42.65","192.168.0.183","TLSv1.2","246","Application Data"
"63","11.159169","192.168.0.183","104.244.42.65","TCP","54","50717  >  443 [ACK] Seq=39569 Ack=1678 Win=1040 Len=0"
"64","16.277466","192.168.0.183","104.244.42.65","TLSv1.2","808","Application Data"
"65","16.277569","192.168.0.183","104.244.42.65","TCP","1414","50717  >  443 [ACK] Seq=40323 Ack=1678 Win=1040 Len=1360 [TCP segment of a reassembled PDU]"
"66","16.277569","192.168.0.183","104.244.42.65","TLSv1.2","667","Application Data"
"67","16.308369","104.244.42.65","192.168.0.183","TCP","60","443  >  50717 [ACK] Seq=1678 Ack=42296 Win=3810 Len=0"
"68","16.327989","104.244.42.65","192.168.0.183","TLSv1.2","184","Application Data"
"69","16.381079","192.168.0.183","104.244.42.65","TCP","54","50717  >  443 [ACK] Seq=42296 Ack=1808 Win=1039 Len=0"
"70","18.571770","192.168.0.183","104.244.42.65","TCP","1414","50717  >  443 [ACK] Seq=42296 Ack=1808 Win=1039 Len=1360 [TCP segment of a reassembled PDU]"
"71","18.571770","192.168.0.183","104.244.42.65","TLSv1.2","459","Application Data"
"72","18.572133","192.168.0.183","104.244.42.65","TLSv1.2","261","Application Data"
"73","18.605161","104.244.42.65","192.168.0.183","TCP","60","443  >  50717 [ACK] Seq=1808 Ack=44061 Win=3823 Len=0"
"74","18.650057","104.244.42.65","192.168.0.183","TCP","60","443  >  50717 [ACK] Seq=1808 Ack=44268 Win=3834 Len=0"
"75","18.936861","104.244.42.65","192.168.0.183","TLSv1.2","212","Application Data"
"76","18.979596","192.168.0.183","104.244.42.65","TCP","54","50717  >  443 [ACK] Seq=44268 Ack=1966 Win=1039 Len=0"
"77","19.283003","192.168.0.183","104.244.42.65","TLSv1.2","236","Application Data"
"78","19.283143","192.168.0.183","104.244.42.65","TCP","1414","50717  >  443 [ACK] Seq=44450 Ack=1966 Win=1039 Len=1360 [TCP segment of a reassembled PDU]"
"79","19.283143","192.168.0.183","104.244.42.65","TCP","1414","50717  >  443 [ACK] Seq=45810 Ack=1966 Win=1039 Len=1360 [TCP segment of a reassembled PDU]"
"80","19.283143","192.168.0.183","104.244.42.65","TCP","1414","50717  >  443 [ACK] Seq=47170 Ack=1966 Win=1039 Len=1360 [TCP segment of a reassembled PDU]"
"81","19.283143","192.168.0.183","104.244.42.65","TCP","1414","50717  >  443 [ACK] Seq=48530 Ack=1966 Win=1039 Len=1360 [TCP segment of a reassembled PDU]"
"82","19.283143","192.168.0.183","104.244.42.65","TCP","1414","50717  >  443 [ACK] Seq=49890 Ack=1966 Win=1039 Len=1360 [TCP segment of a reassembled PDU]"
"83","19.283143","192.168.0.183","104.244.42.65","TCP","1414","50717  >  443 [ACK] Seq=51250 Ack=1966 Win=1039 Len=1360 [TCP segment of a reassembled PDU]"
"84","19.283143","192.168.0.183","104.244.42.65","TCP","1414","50717  >  443 [ACK] Seq=52610 Ack=1966 Win=1039 Len=1360 [TCP segment of a reassembled PDU]"
"85","19.283143","192.168.0.183","104.244.42.65","TCP","1414","50717  >  443 [ACK] Seq=53970 Ack=1966 Win=1039 Len=1360 [TCP segment of a reassembled PDU]"
"86","19.283143","192.168.0.183","104.244.42.65","TCP","1414","50717  >  443 [ACK] Seq=55330 Ack=1966 Win=1039 Len=1360 [TCP segment of a reassembled PDU]"
"87","19.283143","192.168.0.183","104.244.42.65","TCP","1414","50717  >  443 [ACK] Seq=56690 Ack=1966 Win=1039 Len=1360 [TCP segment of a reassembled PDU]"
"88","19.283143","192.168.0.183","104.244.42.65","TCP","1414","50717  >  443 [ACK] Seq=58050 Ack=1966 Win=1039 Len=1360 [TCP segment of a reassembled PDU]"
"89","19.283143","192.168.0.183","104.244.42.65","TCP","1414","50717  >  443 [ACK] Seq=59410 Ack=1966 Win=1039 Len=1360 [TCP segment of a reassembled PDU]"
"90","19.283143","192.168.0.183","104.244.42.65","TLSv1.2","140","Application Data"
"91","19.283359","192.168.0.183","104.244.42.65","TCP","1414","50717  >  443 [ACK] Seq=60856 Ack=1966 Win=1039 Len=1360 [TCP segment of a reassembled PDU]"
"92","19.283359","192.168.0.183","104.244.42.65","TCP","1414","50717  >  443 [ACK] Seq=62216 Ack=1966 Win=1039 Len=1360 [TCP segment of a reassembled PDU]"
"93","19.283359","192.168.0.183","104.244.42.65","TCP","1414","50717  >  443 [ACK] Seq=63576 Ack=1966 Win=1039 Len=1360 [TCP segment of a reassembled PDU]"
"94","19.283359","192.168.0.183","104.244.42.65","TCP","1414","50717  >  443 [ACK] Seq=64936 Ack=1966 Win=1039 Len=1360 [TCP segment of a reassembled PDU]"
"95","19.283359","192.168.0.183","104.244.42.65","TCP","1414","50717  >  443 [ACK] Seq=66296 Ack=1966 Win=1039 Len=1360 [TCP segment of a reassembled PDU]"
"96","19.283359","192.168.0.183","104.244.42.65","TCP","1414","50717  >  443 [ACK] Seq=67656 Ack=1966 Win=1039 Len=1360 [TCP segment of a reassembled PDU]"
"97","19.283359","192.168.0.183","104.244.42.65","TCP","1414","50717  >  443 [ACK] Seq=69016 Ack=1966 Win=1039 Len=1360 [TCP segment of a reassembled PDU]"
"98","19.283359","192.168.0.183","104.244.42.65","TCP","1414","50717  >  443 [ACK] Seq=70376 Ack=1966 Win=1039 Len=1360 [TCP segment of a reassembled PDU]"
"99","19.283359","192.168.0.183","104.244.42.65","TCP","1414","50717  >  443 [ACK] Seq=71736 Ack=1966 Win=1039 Len=1360 [TCP segment of a reassembled PDU]"
"100","19.283359","192.168.0.183","104.244.42.65","TCP","1414","50717  >  443 [ACK] Seq=73096 Ack=1966 Win=1039 Len=1360 [TCP segment of a reassembled PDU]"
"101","19.283359","192.168.0.183","104.244.42.65","TCP","1414","50717  >  443 [ACK] Seq=74456 Ack=1966 Win=1039 Len=1360 [TCP segment of a reassembled PDU]"
"102","19.283359","192.168.0.183","104.244.42.65","TCP","1414","50717  >  443 [ACK] Seq=75816 Ack=1966 Win=1039 Len=1360 [TCP segment of a reassembled PDU]"
"103","19.283359","192.168.0.183","104.244.42.65","TLSv1.2","140","Application Data"
"104","19.283661","192.168.0.183","104.244.42.65","TCP","1414","50717  >  443 [ACK] Seq=77262 Ack=1966 Win=1039 Len=1360 [TCP segment of a reassembled PDU]"
"105","19.283661","192.168.0.183","104.244.42.65","TCP","1414","50717  >  443 [ACK] Seq=78622 Ack=1966 Win=1039 Len=1360 [TCP segment of a reassembled PDU]"
"106","19.283661","192.168.0.183","104.244.42.65","TCP","1414","50717  >  443 [ACK] Seq=79982 Ack=1966 Win=1039 Len=1360 [TCP segment of a reassembled PDU]"
"107","19.283661","192.168.0.183","104.244.42.65","TCP","1414","50717  >  443 [ACK] Seq=81342 Ack=1966 Win=1039 Len=1360 [TCP segment of a reassembled PDU]"
"108","19.283661","192.168.0.183","104.244.42.65","TCP","1414","50717  >  443 [ACK] Seq=82702 Ack=1966 Win=1039 Len=1360 [TCP segment of a reassembled PDU]"
"109","19.283661","192.168.0.183","104.244.42.65","TCP","1414","50717  >  443 [ACK] Seq=84062 Ack=1966 Win=1039 Len=1360 [TCP segment of a reassembled PDU]"
"110","19.283661","192.168.0.183","104.244.42.65","TCP","1414","50717  >  443 [ACK] Seq=85422 Ack=1966 Win=1039 Len=1360 [TCP segment of a reassembled PDU]"
"111","19.283661","192.168.0.183","104.244.42.65","TCP","1414","50717  >  443 [ACK] Seq=86782 Ack=1966 Win=1039 Len=1360 [TCP segment of a reassembled PDU]"
"112","19.283661","192.168.0.183","104.244.42.65","TCP","1414","50717  >  443 [ACK] Seq=88142 Ack=1966 Win=1039 Len=1360 [TCP segment of a reassembled PDU]"
"113","19.283661","192.168.0.183","104.244.42.65","TCP","1414","50717  >  443 [ACK] Seq=89502 Ack=1966 Win=1039 Len=1360 [TCP segment of a reassembled PDU]"
"114","19.283661","192.168.0.183","104.244.42.65","TCP","1414","50717  >  443 [ACK] Seq=90862 Ack=1966 Win=1039 Len=1360 [TCP segment of a reassembled PDU]"
"115","19.283661","192.168.0.183","104.244.42.65","TCP","1414","50717  >  443 [ACK] Seq=92222 Ack=1966 Win=1039 Len=1360 [TCP segment of a reassembled PDU]"
"116","19.283661","192.168.0.183","104.244.42.65","TLSv1.2","140","Application Data"
"117","19.283889","192.168.0.183","104.244.42.65","TCP","1414","50717  >  443 [ACK] Seq=93668 Ack=1966 Win=1039 Len=1360 [TCP segment of a reassembled PDU]"
"118","19.283889","192.168.0.183","104.244.42.65","TCP","1414","50717  >  443 [ACK] Seq=95028 Ack=1966 Win=1039 Len=1360 [TCP segment of a reassembled PDU]"
"119","19.283889","192.168.0.183","104.244.42.65","TCP","1414","50717  >  443 [ACK] Seq=96388 Ack=1966 Win=1039 Len=1360 [TCP segment of a reassembled PDU]"
"120","19.283889","192.168.0.183","104.244.42.65","TCP","1414","50717  >  443 [ACK] Seq=97748 Ack=1966 Win=1039 Len=1360 [TCP segment of a reassembled PDU]"
"121","19.283889","192.168.0.183","104.244.42.65","TCP","1414","50717  >  443 [ACK] Seq=99108 Ack=1966 Win=1039 Len=1360 [TCP segment of a reassembled PDU]"
"122","19.283889","192.168.0.183","104.244.42.65","TCP","1414","50717  >  443 [ACK] Seq=100468 Ack=1966 Win=1039 Len=1360 [TCP segment of a reassembled PDU]"
"123","19.283889","192.168.0.183","104.244.42.65","TCP","1414","50717  >  443 [ACK] Seq=101828 Ack=1966 Win=1039 Len=1360 [TCP segment of a reassembled PDU]"
"124","19.283889","192.168.0.183","104.244.42.65","TCP","1414","50717  >  443 [ACK] Seq=103188 Ack=1966 Win=1039 Len=1360 [TCP segment of a reassembled PDU]"
"125","19.283889","192.168.0.183","104.244.42.65","TCP","1414","50717  >  443 [ACK] Seq=104548 Ack=1966 Win=1039 Len=1360 [TCP segment of a reassembled PDU]"
"126","19.283889","192.168.0.183","104.244.42.65","TCP","1414","50717  >  443 [ACK] Seq=105908 Ack=1966 Win=1039 Len=1360 [TCP segment of a reassembled PDU]"
"127","19.283889","192.168.0.183","104.244.42.65","TCP","1414","50717  >  443 [ACK] Seq=107268 Ack=1966 Win=1039 Len=1360 [TCP segment of a reassembled PDU]"
"128","19.283889","192.168.0.183","104.244.42.65","TCP","1414","50717  >  443 [ACK] Seq=108628 Ack=1966 Win=1039 Len=1360 [TCP segment of a reassembled PDU]"
"129","19.283889","192.168.0.183","104.244.42.65","TLSv1.2","140","Application Data"
"130","19.284145","192.168.0.183","104.244.42.65","TLSv1.2","121","Application Data"
"131","19.311821","104.244.42.65","192.168.0.183","TCP","60","443  >  50717 [ACK] Seq=1966 Ack=44450 Win=3845 Len=0"
"132","19.313724","104.244.42.65","192.168.0.183","TCP","60","443  >  50717 [ACK] Seq=1966 Ack=45810 Win=3855 Len=0"
"133","19.317962","104.244.42.65","192.168.0.183","TCP","60","443  >  50717 [ACK] Seq=1966 Ack=104548 Win=4314 Len=0"
"134","19.317962","104.244.42.65","192.168.0.183","TLSv1.2","89","Application Data"
"135","19.318136","192.168.0.183","104.244.42.65","TLSv1.2","119","Application Data"
"136","19.319512","104.244.42.65","192.168.0.183","TCP","60","443  >  50717 [ACK] Seq=2001 Ack=110141 Win=4357 Len=0"
"137","19.387420","104.244.42.65","192.168.0.183","TCP","1414","443  >  50717 [ACK] Seq=2001 Ack=110206 Win=4357 Len=1360 [TCP segment of a reassembled PDU]"
"138","19.387420","104.244.42.65","192.168.0.183","TCP","1414","443  >  50717 [ACK] Seq=3361 Ack=110206 Win=4357 Len=1360 [TCP segment of a reassembled PDU]"
"139","19.387420","104.244.42.65","192.168.0.183","TCP","1414","443  >  50717 [PSH, ACK] Seq=4721 Ack=110206 Win=4357 Len=1360 [TCP segment of a reassembled PDU]"
"140","19.387420","104.244.42.65","192.168.0.183","TCP","1414","443  >  50717 [ACK] Seq=6081 Ack=110206 Win=4357 Len=1360 [TCP segment of a reassembled PDU]"
"141","19.387420","104.244.42.65","192.168.0.183","TCP","1414","443  >  50717 [ACK] Seq=7441 Ack=110206 Win=4357 Len=1360 [TCP segment of a reassembled PDU]"
"142","19.387420","104.244.42.65","192.168.0.183","TLSv1.2","406","Application Data"
"143","19.387465","192.168.0.183","104.244.42.65","TCP","54","50717  >  443 [ACK] Seq=110206 Ack=9153 Win=1041 Len=0"
"144","19.388039","192.168.0.183","104.244.42.65","TLSv1.2","89","Application Data"
"145","19.395243","104.244.42.65","192.168.0.183","TLSv1.2","227","Application Data"
"146","19.447265","192.168.0.183","104.244.42.65","TCP","54","50717  >  443 [ACK] Seq=110241 Ack=9326 Win=1040 Len=0"
"147","19.478378","104.244.42.65","192.168.0.183","TCP","60","443  >  50717 [ACK] Seq=9326 Ack=110241 Win=4357 Len=0"
"148","20.891052","192.168.0.183","104.244.42.65","TCP","1414","50717  >  443 [ACK] Seq=110241 Ack=9326 Win=1040 Len=1360 [TCP segment of a reassembled PDU]"
"149","20.891052","192.168.0.183","104.244.42.65","TLSv1.2","476","Application Data"
"150","20.922297","104.244.42.65","192.168.0.183","TCP","60","443  >  50717 [ACK] Seq=9326 Ack=112023 Win=4371 Len=0"
"151","21.639381","104.244.42.65","192.168.0.183","TCP","1414","443  >  50717 [ACK] Seq=9326 Ack=112023 Win=4371 Len=1360 [TCP segment of a reassembled PDU]"
"152","21.639381","104.244.42.65","192.168.0.183","TCP","1414","443  >  50717 [ACK] Seq=10686 Ack=112023 Win=4371 Len=1360 [TCP segment of a reassembled PDU]"
"153","21.639381","104.244.42.65","192.168.0.183","TCP","1414","443  >  50717 [PSH, ACK] Seq=12046 Ack=112023 Win=4371 Len=1360 [TCP segment of a reassembled PDU]"
"154","21.639381","104.244.42.65","192.168.0.183","TCP","1414","443  >  50717 [ACK] Seq=13406 Ack=112023 Win=4371 Len=1360 [TCP segment of a reassembled PDU]"
"155","21.639381","104.244.42.65","192.168.0.183","TLSv1.2","814","Application Data"
"156","21.639435","192.168.0.183","104.244.42.65","TCP","54","50717  >  443 [ACK] Seq=112023 Ack=15526 Win=1041 Len=0"
"157","22.439928","192.168.0.183","104.244.42.65","TLSv1.2","680","Application Data"
"158","22.440063","192.168.0.183","104.244.42.65","TCP","1414","50717  >  443 [ACK] Seq=112649 Ack=15526 Win=1041 Len=1360 [TCP segment of a reassembled PDU]"
"159","22.440063","192.168.0.183","104.244.42.65","TCP","1414","50717  >  443 [ACK] Seq=114009 Ack=15526 Win=1041 Len=1360 [TCP segment of a reassembled PDU]"
"160","22.440063","192.168.0.183","104.244.42.65","TCP","1414","50717  >  443 [ACK] Seq=115369 Ack=15526 Win=1041 Len=1360 [TCP segment of a reassembled PDU]"
"161","22.440063","192.168.0.183","104.244.42.65","TCP","1414","50717  >  443 [ACK] Seq=116729 Ack=15526 Win=1041 Len=1360 [TCP segment of a reassembled PDU]"
"162","22.440063","192.168.0.183","104.244.42.65","TCP","1414","50717  >  443 [ACK] Seq=118089 Ack=15526 Win=1041 Len=1360 [TCP segment of a reassembled PDU]"
"163","22.440063","192.168.0.183","104.244.42.65","TCP","1414","50717  >  443 [ACK] Seq=119449 Ack=15526 Win=1041 Len=1360 [TCP segment of a reassembled PDU]"
"164","22.440063","192.168.0.183","104.244.42.65","TCP","1414","50717  >  443 [ACK] Seq=120809 Ack=15526 Win=1041 Len=1360 [TCP segment of a reassembled PDU]"
"165","22.440063","192.168.0.183","104.244.42.65","TCP","1414","50717  >  443 [ACK] Seq=122169 Ack=15526 Win=1041 Len=1360 [TCP segment of a reassembled PDU]"
"166","22.440063","192.168.0.183","104.244.42.65","TCP","1414","50717  >  443 [ACK] Seq=123529 Ack=15526 Win=1041 Len=1360 [TCP segment of a reassembled PDU]"
"167","22.440063","192.168.0.183","104.244.42.65","TCP","1414","50717  >  443 [ACK] Seq=124889 Ack=15526 Win=1041 Len=1360 [TCP segment of a reassembled PDU]"
"168","22.440063","192.168.0.183","104.244.42.65","TCP","1414","50717  >  443 [ACK] Seq=126249 Ack=15526 Win=1041 Len=1360 [TCP segment of a reassembled PDU]"
"169","22.440063","192.168.0.183","104.244.42.65","TCP","1414","50717  >  443 [ACK] Seq=127609 Ack=15526 Win=1041 Len=1360 [TCP segment of a reassembled PDU]"
"170","22.440063","192.168.0.183","104.244.42.65","TLSv1.2","140","Application Data"
"171","22.440197","192.168.0.183","104.244.42.65","TCP","1414","50717  >  443 [ACK] Seq=129055 Ack=15526 Win=1041 Len=1360 [TCP segment of a reassembled PDU]"
"172","22.440197","192.168.0.183","104.244.42.65","TCP","1414","50717  >  443 [ACK] Seq=130415 Ack=15526 Win=1041 Len=1360 [TCP segment of a reassembled PDU]"
"173","22.440197","192.168.0.183","104.244.42.65","TCP","1414","50717  >  443 [ACK] Seq=131775 Ack=15526 Win=1041 Len=1360 [TCP segment of a reassembled PDU]"
"174","22.440197","192.168.0.183","104.244.42.65","TCP","1414","50717  >  443 [ACK] Seq=133135 Ack=15526 Win=1041 Len=1360 [TCP segment of a reassembled PDU]"
"175","22.440197","192.168.0.183","104.244.42.65","TCP","1414","50717  >  443 [ACK] Seq=134495 Ack=15526 Win=1041 Len=1360 [TCP segment of a reassembled PDU]"
"176","22.440197","192.168.0.183","104.244.42.65","TCP","1414","50717  >  443 [ACK] Seq=135855 Ack=15526 Win=1041 Len=1360 [TCP segment of a reassembled PDU]"
"177","22.440197","192.168.0.183","104.244.42.65","TCP","1414","50717  >  443 [ACK] Seq=137215 Ack=15526 Win=1041 Len=1360 [TCP segment of a reassembled PDU]"
"178","22.440197","192.168.0.183","104.244.42.65","TCP","1414","50717  >  443 [ACK] Seq=138575 Ack=15526 Win=1041 Len=1360 [TCP segment of a reassembled PDU]"
"179","22.440197","192.168.0.183","104.244.42.65","TCP","1414","50717  >  443 [ACK] Seq=139935 Ack=15526 Win=1041 Len=1360 [TCP segment of a reassembled PDU]"
"180","22.440197","192.168.0.183","104.244.42.65","TCP","1414","50717  >  443 [ACK] Seq=141295 Ack=15526 Win=1041 Len=1360 [TCP segment of a reassembled PDU]"
"181","22.440197","192.168.0.183","104.244.42.65","TCP","1414","50717  >  443 [ACK] Seq=142655 Ack=15526 Win=1041 Len=1360 [TCP segment of a reassembled PDU]"
"182","22.440197","192.168.0.183","104.244.42.65","TCP","1414","50717  >  443 [ACK] Seq=144015 Ack=15526 Win=1041 Len=1360 [TCP segment of a reassembled PDU]"
"183","22.440197","192.168.0.183","104.244.42.65","TLSv1.2","140","Application Data"
"184","22.440314","192.168.0.183","104.244.42.65","TCP","1414","50717  >  443 [ACK] Seq=145461 Ack=15526 Win=1041 Len=1360 [TCP segment of a reassembled PDU]"
"185","22.440314","192.168.0.183","104.244.42.65","TCP","1414","50717  >  443 [ACK] Seq=146821 Ack=15526 Win=1041 Len=1360 [TCP segment of a reassembled PDU]"
"186","22.440314","192.168.0.183","104.244.42.65","TCP","1414","50717  >  443 [ACK] Seq=148181 Ack=15526 Win=1041 Len=1360 [TCP segment of a reassembled PDU]"
"187","22.440314","192.168.0.183","104.244.42.65","TCP","1414","50717  >  443 [ACK] Seq=149541 Ack=15526 Win=1041 Len=1360 [TCP segment of a reassembled PDU]"
"188","22.440314","192.168.0.183","104.244.42.65","TCP","1414","50717  >  443 [ACK] Seq=150901 Ack=15526 Win=1041 Len=1360 [TCP segment of a reassembled PDU]"
"189","22.440314","192.168.0.183","104.244.42.65","TCP","1414","50717  >  443 [ACK] Seq=152261 Ack=15526 Win=1041 Len=1360 [TCP segment of a reassembled PDU]"
"190","22.440314","192.168.0.183","104.244.42.65","TCP","1414","50717  >  443 [ACK] Seq=153621 Ack=15526 Win=1041 Len=1360 [TCP segment of a reassembled PDU]"
"191","22.440314","192.168.0.183","104.244.42.65","TCP","1414","50717  >  443 [ACK] Seq=154981 Ack=15526 Win=1041 Len=1360 [TCP segment of a reassembled PDU]"
"192","22.440314","192.168.0.183","104.244.42.65","TCP","1414","50717  >  443 [ACK] Seq=156341 Ack=15526 Win=1041 Len=1360 [TCP segment of a reassembled PDU]"
"193","22.440314","192.168.0.183","104.244.42.65","TCP","1414","50717  >  443 [ACK] Seq=157701 Ack=15526 Win=1041 Len=1360 [TCP segment of a reassembled PDU]"
"194","22.440314","192.168.0.183","104.244.42.65","TCP","1414","50717  >  443 [ACK] Seq=159061 Ack=15526 Win=1041 Len=1360 [TCP segment of a reassembled PDU]"
"195","22.440314","192.168.0.183","104.244.42.65","TCP","1414","50717  >  443 [ACK] Seq=160421 Ack=15526 Win=1041 Len=1360 [TCP segment of a reassembled PDU]"
"196","22.440314","192.168.0.183","104.244.42.65","TLSv1.2","140","Application Data"
"197","22.440428","192.168.0.183","104.244.42.65","TCP","1414","50717  >  443 [ACK] Seq=161867 Ack=15526 Win=1041 Len=1360 [TCP segment of a reassembled PDU]"
"198","22.440428","192.168.0.183","104.244.42.65","TCP","1414","50717  >  443 [ACK] Seq=163227 Ack=15526 Win=1041 Len=1360 [TCP segment of a reassembled PDU]"
"199","22.440428","192.168.0.183","104.244.42.65","TCP","1414","50717  >  443 [ACK] Seq=164587 Ack=15526 Win=1041 Len=1360 [TCP segment of a reassembled PDU]"
"200","22.440428","192.168.0.183","104.244.42.65","TCP","1414","50717  >  443 [ACK] Seq=165947 Ack=15526 Win=1041 Len=1360 [TCP segment of a reassembled PDU]"
"201","22.440428","192.168.0.183","104.244.42.65","TCP","1414","50717  >  443 [ACK] Seq=167307 Ack=15526 Win=1041 Len=1360 [TCP segment of a reassembled PDU]"
"202","22.440428","192.168.0.183","104.244.42.65","TLSv1.2","1375","Application Data"
"203","22.472815","104.244.42.65","192.168.0.183","TCP","60","443  >  50717 [ACK] Seq=15526 Ack=169988 Win=4829 Len=0"
"204","22.472815","104.244.42.65","192.168.0.183","TLSv1.2","89","Application Data"
"205","22.519087","192.168.0.183","104.244.42.65","TCP","54","50717  >  443 [ACK] Seq=169988 Ack=15561 Win=1041 Len=0"
"206","22.522059","104.244.42.65","192.168.0.183","TLSv1.2","258","Application Data"
"207","22.565052","192.168.0.183","104.244.42.65","TCP","54","50717  >  443 [ACK] Seq=169988 Ack=15765 Win=1040 Len=0"
"208","27.583205","192.168.0.183","104.244.42.65","TLSv1.2","255","Application Data"
"209","27.583355","192.168.0.183","104.244.42.65","TCP","1414","50717  >  443 [ACK] Seq=170189 Ack=15765 Win=1040 Len=1360 [TCP segment of a reassembled PDU]"
"210","27.583355","192.168.0.183","104.244.42.65","TCP","1414","50717  >  443 [ACK] Seq=171549 Ack=15765 Win=1040 Len=1360 [TCP segment of a reassembled PDU]"
"211","27.583355","192.168.0.183","104.244.42.65","TCP","1414","50717  >  443 [ACK] Seq=172909 Ack=15765 Win=1040 Len=1360 [TCP segment of a reassembled PDU]"
"212","27.583355","192.168.0.183","104.244.42.65","TCP","1414","50717  >  443 [ACK] Seq=174269 Ack=15765 Win=1040 Len=1360 [TCP segment of a reassembled PDU]"
"213","27.583355","192.168.0.183","104.244.42.65","TCP","1414","50717  >  443 [ACK] Seq=175629 Ack=15765 Win=1040 Len=1360 [TCP segment of a reassembled PDU]"
"214","27.583355","192.168.0.183","104.244.42.65","TLSv1.2","1173","Application Data"
"215","27.583572","192.168.0.183","104.244.42.65","TLSv1.2","265","Application Data"
"216","27.613784","104.244.42.65","192.168.0.183","TCP","60","443  >  50717 [ACK] Seq=15765 Ack=171549 Win=4840 Len=0"
"217","27.620016","104.244.42.65","192.168.0.183","TCP","60","443  >  50717 [ACK] Seq=15765 Ack=178108 Win=4891 Len=0"
"218","27.642049","104.244.42.65","192.168.0.183","TLSv1.2","225","Application Data"
"219","27.697812","192.168.0.183","104.244.42.65","TCP","54","50717  >  443 [ACK] Seq=178319 Ack=15936 Win=1039 Len=0"
"220","27.776902","192.168.0.183","104.244.42.65","TLSv1.2","809","Application Data"
"221","27.777001","192.168.0.183","104.244.42.65","TLSv1.2","1349","Application Data"
"222","27.807606","104.244.42.65","192.168.0.183","TCP","60","443  >  50717 [ACK] Seq=15936 Ack=180369 Win=4912 Len=0"
"223","27.830850","104.244.42.65","192.168.0.183","TLSv1.2","159","Application Data"
"224","27.871727","192.168.0.183","104.244.42.65","TCP","54","50717  >  443 [ACK] Seq=180369 Ack=16041 Win=1039 Len=0"
"225","27.908090","104.244.42.65","192.168.0.183","TLSv1.2","151","Application Data"
"226","27.949753","192.168.0.183","104.244.42.65","TCP","54","50717  >  443 [ACK] Seq=180369 Ack=16138 Win=1038 Len=0"
"227","29.402478","192.168.0.183","104.244.42.65","TLSv1.2","300","Application Data"
"228","29.402595","192.168.0.183","104.244.42.65","TLSv1.2","189","Application Data"
"229","29.434846","104.244.42.65","192.168.0.183","TCP","60","443  >  50717 [ACK] Seq=16138 Ack=180750 Win=4923 Len=0"
"230","29.548207","104.244.42.65","192.168.0.183","TLSv1.2","400","Application Data"
"231","29.549262","192.168.0.183","104.244.42.65","TLSv1.2","89","Application Data"
"232","29.627107","104.244.42.65","192.168.0.183","TCP","60","443  >  50717 [ACK] Seq=16484 Ack=180785 Win=4923 Len=0"
"233","30.431162","192.168.0.183","104.244.42.65","TLSv1.2","286","Application Data"
"234","30.431300","192.168.0.183","104.244.42.65","TCP","1414","50717  >  443 [ACK] Seq=181017 Ack=16484 Win=1037 Len=1360 [TCP segment of a reassembled PDU]"
"235","30.431300","192.168.0.183","104.244.42.65","TCP","1414","50717  >  443 [ACK] Seq=182377 Ack=16484 Win=1037 Len=1360 [TCP segment of a reassembled PDU]"
"236","30.431300","192.168.0.183","104.244.42.65","TCP","1414","50717  >  443 [ACK] Seq=183737 Ack=16484 Win=1037 Len=1360 [TCP segment of a reassembled PDU]"
"237","30.431300","192.168.0.183","104.244.42.65","TCP","1414","50717  >  443 [ACK] Seq=185097 Ack=16484 Win=1037 Len=1360 [TCP segment of a reassembled PDU]"
"238","30.431300","192.168.0.183","104.244.42.65","TCP","1414","50717  >  443 [ACK] Seq=186457 Ack=16484 Win=1037 Len=1360 [TCP segment of a reassembled PDU]"
"239","30.431300","192.168.0.183","104.244.42.65","TCP","1414","50717  >  443 [ACK] Seq=187817 Ack=16484 Win=1037 Len=1360 [TCP segment of a reassembled PDU]"
"240","30.431300","192.168.0.183","104.244.42.65","TCP","1414","50717  >  443 [ACK] Seq=189177 Ack=16484 Win=1037 Len=1360 [TCP segment of a reassembled PDU]"
"241","30.431300","192.168.0.183","104.244.42.65","TCP","1414","50717  >  443 [ACK] Seq=190537 Ack=16484 Win=1037 Len=1360 [TCP segment of a reassembled PDU]"
"242","30.431300","192.168.0.183","104.244.42.65","TCP","1414","50717  >  443 [ACK] Seq=191897 Ack=16484 Win=1037 Len=1360 [TCP segment of a reassembled PDU]"
"243","30.431300","192.168.0.183","104.244.42.65","TCP","1414","50717  >  443 [ACK] Seq=193257 Ack=16484 Win=1037 Len=1360 [TCP segment of a reassembled PDU]"
"244","30.431300","192.168.0.183","104.244.42.65","TCP","1414","50717  >  443 [ACK] Seq=194617 Ack=16484 Win=1037 Len=1360 [TCP segment of a reassembled PDU]"
"245","30.431300","192.168.0.183","104.244.42.65","TCP","1414","50717  >  443 [ACK] Seq=195977 Ack=16484 Win=1037 Len=1360 [TCP segment of a reassembled PDU]"
"246","30.431300","192.168.0.183","104.244.42.65","TLSv1.2","140","Application Data"
"247","30.431429","192.168.0.183","104.244.42.65","TCP","1414","50717  >  443 [ACK] Seq=197423 Ack=16484 Win=1037 Len=1360 [TCP segment of a reassembled PDU]"
"248","30.431429","192.168.0.183","104.244.42.65","TCP","1414","50717  >  443 [ACK] Seq=198783 Ack=16484 Win=1037 Len=1360 [TCP segment of a reassembled PDU]"
"249","30.431429","192.168.0.183","104.244.42.65","TCP","1414","50717  >  443 [ACK] Seq=200143 Ack=16484 Win=1037 Len=1360 [TCP segment of a reassembled PDU]"
"250","30.431429","192.168.0.183","104.244.42.65","TCP","1414","50717  >  443 [ACK] Seq=201503 Ack=16484 Win=1037 Len=1360 [TCP segment of a reassembled PDU]"
"251","30.431429","192.168.0.183","104.244.42.65","TCP","1414","50717  >  443 [ACK] Seq=202863 Ack=16484 Win=1037 Len=1360 [TCP segment of a reassembled PDU]"
"252","30.431429","192.168.0.183","104.244.42.65","TCP","1414","50717  >  443 [ACK] Seq=204223 Ack=16484 Win=1037 Len=1360 [TCP segment of a reassembled PDU]"
"253","30.431429","192.168.0.183","104.244.42.65","TCP","1414","50717  >  443 [ACK] Seq=205583 Ack=16484 Win=1037 Len=1360 [TCP segment of a reassembled PDU]"
"254","30.431429","192.168.0.183","104.244.42.65","TCP","1414","50717  >  443 [ACK] Seq=206943 Ack=16484 Win=1037 Len=1360 [TCP segment of a reassembled PDU]"
"255","30.431429","192.168.0.183","104.244.42.65","TCP","1414","50717  >  443 [ACK] Seq=208303 Ack=16484 Win=1037 Len=1360 [TCP segment of a reassembled PDU]"
"256","30.431429","192.168.0.183","104.244.42.65","TCP","1414","50717  >  443 [ACK] Seq=209663 Ack=16484 Win=1037 Len=1360 [TCP segment of a reassembled PDU]"
"257","30.431429","192.168.0.183","104.244.42.65","TCP","1414","50717  >  443 [ACK] Seq=211023 Ack=16484 Win=1037 Len=1360 [TCP segment of a reassembled PDU]"
"258","30.431429","192.168.0.183","104.244.42.65","TLSv1.2","1145","Application Data"
"259","30.461758","104.244.42.65","192.168.0.183","TCP","60","443  >  50717 [ACK] Seq=16484 Ack=185097 Win=4955 Len=0"
"260","30.467978","104.244.42.65","192.168.0.183","TCP","60","443  >  50717 [ACK] Seq=16484 Ack=213474 Win=5177 Len=0"
"261","30.504755","104.244.42.65","192.168.0.183","TLSv1.2","214","Application Data"
"262","30.548728","192.168.0.183","104.244.42.65","TCP","54","50717  >  443 [ACK] Seq=213474 Ack=16644 Win=1036 Len=0"
"263","30.899470","192.168.0.183","104.244.42.65","TLSv1.2","237","Application Data"
"264","30.899558","192.168.0.183","104.244.42.65","TLSv1.2","232","Application Data"
"265","30.930627","104.244.42.65","192.168.0.183","TCP","60","443  >  50717 [ACK] Seq=16644 Ack=213835 Win=5177 Len=0"
"266","30.948606","104.244.42.65","192.168.0.183","TLSv1.2","159","Application Data"
"267","30.999103","192.168.0.183","104.244.42.65","TCP","54","50717  >  443 [ACK] Seq=213835 Ack=16749 Win=1036 Len=0"
"268","33.537701","192.168.0.183","104.244.42.65","TLSv1.2","682","Application Data"
"269","33.537840","192.168.0.183","104.244.42.65","TCP","1414","50717  >  443 [ACK] Seq=214463 Ack=16749 Win=1036 Len=1360 [TCP segment of a reassembled PDU]"
"270","33.537840","192.168.0.183","104.244.42.65","TCP","1414","50717  >  443 [ACK] Seq=215823 Ack=16749 Win=1036 Len=1360 [TCP segment of a reassembled PDU]"
"271","33.537840","192.168.0.183","104.244.42.65","TCP","1414","50717  >  443 [ACK] Seq=217183 Ack=16749 Win=1036 Len=1360 [TCP segment of a reassembled PDU]"
"272","33.537840","192.168.0.183","104.244.42.65","TCP","1414","50717  >  443 [ACK] Seq=218543 Ack=16749 Win=1036 Len=1360 [TCP segment of a reassembled PDU]"
"273","33.537840","192.168.0.183","104.244.42.65","TCP","1414","50717  >  443 [ACK] Seq=219903 Ack=16749 Win=1036 Len=1360 [TCP segment of a reassembled PDU]"
"274","33.537840","192.168.0.183","104.244.42.65","TCP","1414","50717  >  443 [ACK] Seq=221263 Ack=16749 Win=1036 Len=1360 [TCP segment of a reassembled PDU]"
"275","33.537840","192.168.0.183","104.244.42.65","TCP","1414","50717  >  443 [ACK] Seq=222623 Ack=16749 Win=1036 Len=1360 [TCP segment of a reassembled PDU]"
"276","33.537840","192.168.0.183","104.244.42.65","TCP","1414","50717  >  443 [ACK] Seq=223983 Ack=16749 Win=1036 Len=1360 [TCP segment of a reassembled PDU]"
"277","33.537840","192.168.0.183","104.244.42.65","TCP","1414","50717  >  443 [ACK] Seq=225343 Ack=16749 Win=1036 Len=1360 [TCP segment of a reassembled PDU]"
"278","33.537840","192.168.0.183","104.244.42.65","TCP","1414","50717  >  443 [ACK] Seq=226703 Ack=16749 Win=1036 Len=1360 [TCP segment of a reassembled PDU]"
"279","33.537840","192.168.0.183","104.244.42.65","TCP","1414","50717  >  443 [ACK] Seq=228063 Ack=16749 Win=1036 Len=1360 [TCP segment of a reassembled PDU]"
"280","33.537840","192.168.0.183","104.244.42.65","TCP","1414","50717  >  443 [ACK] Seq=229423 Ack=16749 Win=1036 Len=1360 [TCP segment of a reassembled PDU]"
"281","33.537840","192.168.0.183","104.244.42.65","TLSv1.2","140","Application Data"
"282","33.537993","192.168.0.183","104.244.42.65","TCP","1414","50717  >  443 [ACK] Seq=230869 Ack=16749 Win=1036 Len=1360 [TCP segment of a reassembled PDU]"
"283","33.537993","192.168.0.183","104.244.42.65","TCP","1414","50717  >  443 [ACK] Seq=232229 Ack=16749 Win=1036 Len=1360 [TCP segment of a reassembled PDU]"
"284","33.537993","192.168.0.183","104.244.42.65","TCP","1414","50717  >  443 [ACK] Seq=233589 Ack=16749 Win=1036 Len=1360 [TCP segment of a reassembled PDU]"
"285","33.537993","192.168.0.183","104.244.42.65","TLSv1.2","619","Application Data"
"286","33.568271","104.244.42.65","192.168.0.183","TCP","60","443  >  50717 [ACK] Seq=16749 Ack=223983 Win=5262 Len=0"
"287","33.573757","104.244.42.65","192.168.0.183","TCP","60","443  >  50717 [ACK] Seq=16749 Ack=235514 Win=5352 Len=0"
"288","33.608468","104.244.42.65","192.168.0.183","TLSv1.2","182","Application Data"
"289","33.663973","192.168.0.183","104.244.42.65","TCP","54","50717  >  443 [ACK] Seq=235514 Ack=16877 Win=1035 Len=0"
"290","35.968032","192.168.0.183","104.244.42.193","TCP","55","50715  >  443 [ACK] Seq=1 Ack=1 Win=260 Len=1 [TCP segment of a reassembled PDU]"
"291","35.998530","104.244.42.193","192.168.0.183","TCP","66","443  >  50715 [ACK] Seq=1 Ack=2 Win=288 Len=0 SLE=1 SRE=2"
"292","36.227828","192.168.0.183","104.244.42.65","TLSv1.2","254","Application Data"
"293","36.227928","192.168.0.183","104.244.42.65","TLSv1.2","376","Application Data"
"294","36.258112","104.244.42.65","192.168.0.183","TCP","60","443  >  50717 [ACK] Seq=16877 Ack=236036 Win=5362 Len=0"
"295","36.280260","104.244.42.65","192.168.0.183","TLSv1.2","184","Application Data"
"296","36.325131","192.168.0.183","104.244.42.65","TCP","54","50717  >  443 [ACK] Seq=236036 Ack=17007 Win=1041 Len=0"
"297","36.464742","192.168.0.183","104.244.42.65","TLSv1.2","278","Application Data"
"298","36.464855","192.168.0.183","104.244.42.65","TLSv1.2","168","Application Data"
"299","36.495279","104.244.42.65","192.168.0.183","TCP","60","443  >  50717 [ACK] Seq=17007 Ack=236374 Win=5362 Len=0"
"300","36.541661","192.168.0.183","104.244.42.65","TLSv1.2","809","Application Data"
"301","36.541811","192.168.0.183","104.244.42.65","TCP","1414","50717  >  443 [ACK] Seq=237129 Ack=17007 Win=1041 Len=1360 [TCP segment of a reassembled PDU]"
"302","36.541811","192.168.0.183","104.244.42.65","TCP","1414","50717  >  443 [ACK] Seq=238489 Ack=17007 Win=1041 Len=1360 [TCP segment of a reassembled PDU]"
"303","36.541811","192.168.0.183","104.244.42.65","TCP","1414","50717  >  443 [ACK] Seq=239849 Ack=17007 Win=1041 Len=1360 [TCP segment of a reassembled PDU]"
"304","36.541811","192.168.0.183","104.244.42.65","TCP","1414","50717  >  443 [ACK] Seq=241209 Ack=17007 Win=1041 Len=1360 [TCP segment of a reassembled PDU]"
"305","36.541811","192.168.0.183","104.244.42.65","TCP","1414","50717  >  443 [ACK] Seq=242569 Ack=17007 Win=1041 Len=1360 [TCP segment of a reassembled PDU]"
"306","36.541811","192.168.0.183","104.244.42.65","TCP","1414","50717  >  443 [ACK] Seq=243929 Ack=17007 Win=1041 Len=1360 [TCP segment of a reassembled PDU]"
"307","36.541811","192.168.0.183","104.244.42.65","TCP","1414","50717  >  443 [ACK] Seq=245289 Ack=17007 Win=1041 Len=1360 [TCP segment of a reassembled PDU]"
"308","36.541811","192.168.0.183","104.244.42.65","TCP","1414","50717  >  443 [ACK] Seq=246649 Ack=17007 Win=1041 Len=1360 [TCP segment of a reassembled PDU]"
"309","36.541811","192.168.0.183","104.244.42.65","TCP","1414","50717  >  443 [ACK] Seq=248009 Ack=17007 Win=1041 Len=1360 [TCP segment of a reassembled PDU]"
"310","36.541811","192.168.0.183","104.244.42.65","TCP","1414","50717  >  443 [ACK] Seq=249369 Ack=17007 Win=1041 Len=1360 [TCP segment of a reassembled PDU]"
"311","36.541811","192.168.0.183","104.244.42.65","TCP","1414","50717  >  443 [ACK] Seq=250729 Ack=17007 Win=1041 Len=1360 [TCP segment of a reassembled PDU]"
"312","36.541811","192.168.0.183","104.244.42.65","TCP","1414","50717  >  443 [ACK] Seq=252089 Ack=17007 Win=1041 Len=1360 [TCP segment of a reassembled PDU]"
"313","36.541811","192.168.0.183","104.244.42.65","TLSv1.2","140","Application Data"
"314","36.541960","192.168.0.183","104.244.42.65","TCP","1414","50717  >  443 [ACK] Seq=253535 Ack=17007 Win=1041 Len=1360 [TCP segment of a reassembled PDU]"
"315","36.541960","192.168.0.183","104.244.42.65","TCP","1414","50717  >  443 [ACK] Seq=254895 Ack=17007 Win=1041 Len=1360 [TCP segment of a reassembled PDU]"
"316","36.541960","192.168.0.183","104.244.42.65","TCP","1414","50717  >  443 [ACK] Seq=256255 Ack=17007 Win=1041 Len=1360 [TCP segment of a reassembled PDU]"
"317","36.541960","192.168.0.183","104.244.42.65","TCP","1414","50717  >  443 [ACK] Seq=257615 Ack=17007 Win=1041 Len=1360 [TCP segment of a reassembled PDU]"
"318","36.541960","192.168.0.183","104.244.42.65","TCP","1414","50717  >  443 [ACK] Seq=258975 Ack=17007 Win=1041 Len=1360 [TCP segment of a reassembled PDU]"
"319","36.541960","192.168.0.183","104.244.42.65","TCP","1414","50717  >  443 [ACK] Seq=260335 Ack=17007 Win=1041 Len=1360 [TCP segment of a reassembled PDU]"
"320","36.541960","192.168.0.183","104.244.42.65","TCP","1414","50717  >  443 [ACK] Seq=261695 Ack=17007 Win=1041 Len=1360 [TCP segment of a reassembled PDU]"
"321","36.541960","192.168.0.183","104.244.42.65","TCP","1414","50717  >  443 [ACK] Seq=263055 Ack=17007 Win=1041 Len=1360 [TCP segment of a reassembled PDU]"
"322","36.541960","192.168.0.183","104.244.42.65","TCP","1414","50717  >  443 [ACK] Seq=264415 Ack=17007 Win=1041 Len=1360 [TCP segment of a reassembled PDU]"
"323","36.541960","192.168.0.183","104.244.42.65","TLSv1.2","531","Application Data"
"324","36.570268","104.244.42.65","192.168.0.183","TLSv1.2","271","Application Data"
"325","36.571026","192.168.0.183","104.244.42.65","TLSv1.2","89","Application Data"
"326","36.572145","104.244.42.65","192.168.0.183","TCP","60","443  >  50717 [ACK] Seq=17224 Ack=238489 Win=5384 Len=0"
"327","36.577775","104.244.42.65","192.168.0.183","TCP","60","443  >  50717 [ACK] Seq=17224 Ack=253535 Win=5501 Len=0"
"328","36.577775","104.244.42.65","192.168.0.183","TLSv1.2","89","Application Data"
"329","36.577775","104.244.42.65","192.168.0.183","TCP","60","443  >  50717 [ACK] Seq=17259 Ack=266252 Win=5600 Len=0"
"330","36.610681","104.244.42.65","192.168.0.183","TLSv1.2","229","Application Data"
"331","36.610720","192.168.0.183","104.244.42.65","TCP","54","50717  >  443 [ACK] Seq=266287 Ack=17434 Win=1039 Len=0"
"332","36.913403","192.168.0.183","104.244.42.65","TLSv1.2","967","Application Data"
"333","36.913988","192.168.0.183","104.244.42.65","TLSv1.2","246","Application Data"
"334","36.952184","104.244.42.65","192.168.0.183","TCP","60","443  >  50717 [ACK] Seq=17434 Ack=267392 Win=5611 Len=0"
"335","36.968868","104.244.42.65","192.168.0.183","TLSv1.2","461","Application Data"
"336","36.973065","104.244.42.65","192.168.0.183","TLSv1.2","263","Application Data"
"337","36.973133","192.168.0.183","104.244.42.65","TCP","54","50717  >  443 [ACK] Seq=267392 Ack=18050 Win=1037 Len=0"
"338","39.548402","192.168.0.183","104.244.42.65","TLSv1.2","236","Application Data"
"339","39.548509","192.168.0.183","104.244.42.65","TCP","1414","50717  >  443 [ACK] Seq=267574 Ack=18050 Win=1037 Len=1360 [TCP segment of a reassembled PDU]"
"340","39.548509","192.168.0.183","104.244.42.65","TCP","1414","50717  >  443 [ACK] Seq=268934 Ack=18050 Win=1037 Len=1360 [TCP segment of a reassembled PDU]"
"341","39.548509","192.168.0.183","104.244.42.65","TCP","1414","50717  >  443 [ACK] Seq=270294 Ack=18050 Win=1037 Len=1360 [TCP segment of a reassembled PDU]"
"342","39.548509","192.168.0.183","104.244.42.65","TCP","1414","50717  >  443 [ACK] Seq=271654 Ack=18050 Win=1037 Len=1360 [TCP segment of a reassembled PDU]"
"343","39.548509","192.168.0.183","104.244.42.65","TCP","1414","50717  >  443 [ACK] Seq=273014 Ack=18050 Win=1037 Len=1360 [TCP segment of a reassembled PDU]"
"344","39.548509","192.168.0.183","104.244.42.65","TCP","1414","50717  >  443 [ACK] Seq=274374 Ack=18050 Win=1037 Len=1360 [TCP segment of a reassembled PDU]"
"345","39.548509","192.168.0.183","104.244.42.65","TCP","1414","50717  >  443 [ACK] Seq=275734 Ack=18050 Win=1037 Len=1360 [TCP segment of a reassembled PDU]"
"346","39.548509","192.168.0.183","104.244.42.65","TCP","1414","50717  >  443 [ACK] Seq=277094 Ack=18050 Win=1037 Len=1360 [TCP segment of a reassembled PDU]"
"347","39.548509","192.168.0.183","104.244.42.65","TLSv1.2","735","Application Data"
"348","39.584127","104.244.42.65","192.168.0.183","TCP","60","443  >  50717 [ACK] Seq=18050 Ack=270294 Win=5632 Len=0"
"349","39.592529","104.244.42.65","192.168.0.183","TCP","60","443  >  50717 [ACK] Seq=18050 Ack=279135 Win=5701 Len=0"
"350","39.624306","104.244.42.65","192.168.0.183","TLSv1.2","279","Application Data"
"351","39.676609","192.168.0.183","104.244.42.65","TCP","54","50717  >  443 [ACK] Seq=279135 Ack=18275 Win=1036 Len=0"
