"No.","Time","Source","Destination","Protocol","Length","Info"
"1","0.000000","192.168.0.183","104.244.42.65","TLSv1.2","311","Application Data"
"2","0.000213","192.168.0.183","104.244.42.65","TCP","1414","50717  >  443 [ACK] Seq=258 Ack=1 Win=1038 Len=1360 [TCP segment of a reassembled PDU]"
"3","0.000213","192.168.0.183","104.244.42.65","TLSv1.2","164","Application Data"
"4","0.000282","192.168.0.183","104.244.42.65","TCP","1414","50717  >  443 [ACK] Seq=1728 Ack=1 Win=1038 Len=1360 [TCP segment of a reassembled PDU]"
"5","0.000282","192.168.0.183","104.244.42.65","TLSv1.2","387","Application Data"
"6","0.000452","192.168.0.183","104.244.42.65","TLSv1.2","356","Application Data"
"7","0.041304","104.244.42.65","192.168.0.183","TCP","60","443  >  50717 [ACK] Seq=1 Ack=1728 Win=7926 Len=0"
"8","0.044043","104.244.42.65","192.168.0.183","TCP","60","443  >  50717 [ACK] Seq=1 Ack=3421 Win=7927 Len=0"
"9","0.056042","104.244.42.65","192.168.0.183","TLSv1.2","257","Application Data"
"10","0.107910","192.168.0.183","104.244.42.65","TCP","54","50717  >  443 [ACK] Seq=3723 Ack=204 Win=1037 Len=0"
"11","0.392254","104.244.42.65","192.168.0.183","TLSv1.2","152","Application Data"
"12","0.433040","192.168.0.183","104.244.42.65","TCP","54","50717  >  443 [ACK] Seq=3723 Ack=302 Win=1037 Len=0"
"13","1.191549","104.244.42.65","192.168.0.183","TCP","1414","443  >  50717 [ACK] Seq=302 Ack=3723 Win=7930 Len=1360 [TCP segment of a reassembled PDU]"
"14","1.191549","104.244.42.65","192.168.0.183","TCP","1414","443  >  50717 [PSH, ACK] Seq=1662 Ack=3723 Win=7930 Len=1360 [TCP segment of a reassembled PDU]"
"15","1.191549","104.244.42.65","192.168.0.183","TCP","1414","443  >  50717 [ACK] Seq=3022 Ack=3723 Win=7930 Len=1360 [TCP segment of a reassembled PDU]"
"16","1.191549","104.244.42.65","192.168.0.183","TCP","1414","443  >  50717 [PSH, ACK] Seq=4382 Ack=3723 Win=7930 Len=1360 [TCP segment of a reassembled PDU]"
"17","1.191549","104.244.42.65","192.168.0.183","TCP","1414","443  >  50717 [ACK] Seq=5742 Ack=3723 Win=7930 Len=1360 [TCP segment of a reassembled PDU]"
"18","1.191549","104.244.42.65","192.168.0.183","TCP","1414","443  >  50717 [PSH, ACK] Seq=7102 Ack=3723 Win=7930 Len=1360 [TCP segment of a reassembled PDU]"
"19","1.191549","104.244.42.65","192.168.0.183","TCP","1414","443  >  50717 [ACK] Seq=8462 Ack=3723 Win=7930 Len=1360 [TCP segment of a reassembled PDU]"
"20","1.191549","104.244.42.65","192.168.0.183","TLSv1.2","778","Application Data"
"21","1.191613","192.168.0.183","104.244.42.65","TCP","54","50717  >  443 [ACK] Seq=3723 Ack=10546 Win=1041 Len=0"
"22","1.192390","192.168.0.183","104.244.42.65","TLSv1.2","89","Application Data"
"23","1.269043","104.244.42.65","192.168.0.183","TCP","60","443  >  50717 [ACK] Seq=10546 Ack=3758 Win=7930 Len=0"
"24","2.813376","192.168.0.183","104.244.42.65","TLSv1.2","669","Application Data"
"25","2.813509","192.168.0.183","104.244.42.65","TCP","1414","50717  >  443 [ACK] Seq=4373 Ack=10546 Win=1041 Len=1360 [TCP segment of a reassembled PDU]"
"26","2.813509","192.168.0.183","104.244.42.65","TCP","1414","50717  >  443 [ACK] Seq=5733 Ack=10546 Win=1041 Len=1360 [TCP segment of a reassembled PDU]"
"27","2.813509","192.168.0.183","104.244.42.65","TCP","1414","50717  >  443 [ACK] Seq=7093 Ack=10546 Win=1041 Len=1360 [TCP segment of a reassembled PDU]"
"28","2.813509","192.168.0.183","104.244.42.65","TCP","1414","50717  >  443 [ACK] Seq=8453 Ack=10546 Win=1041 Len=1360 [TCP segment of a reassembled PDU]"
"29","2.813509","192.168.0.183","104.244.42.65","TCP","1414","50717  >  443 [ACK] Seq=9813 Ack=10546 Win=1041 Len=1360 [TCP segment of a reassembled PDU]"
"30","2.813509","192.168.0.183","104.244.42.65","TCP","1414","50717  >  443 [ACK] Seq=11173 Ack=10546 Win=1041 Len=1360 [TCP segment of a reassembled PDU]"
"31","2.813509","192.168.0.183","104.244.42.65","TCP","1414","50717  >  443 [ACK] Seq=12533 Ack=10546 Win=1041 Len=1360 [TCP segment of a reassembled PDU]"
"32","2.813509","192.168.0.183","104.244.42.65","TCP","1414","50717  >  443 [ACK] Seq=13893 Ack=10546 Win=1041 Len=1360 [TCP segment of a reassembled PDU]"
"33","2.813509","192.168.0.183","104.244.42.65","TCP","1414","50717  >  443 [ACK] Seq=15253 Ack=10546 Win=1041 Len=1360 [TCP segment of a reassembled PDU]"
"34","2.813509","192.168.0.183","104.244.42.65","TCP","1414","50717  >  443 [ACK] Seq=16613 Ack=10546 Win=1041 Len=1360 [TCP segment of a reassembled PDU]"
"35","2.813509","192.168.0.183","104.244.42.65","TCP","1414","50717  >  443 [ACK] Seq=17973 Ack=10546 Win=1041 Len=1360 [TCP segment of a reassembled PDU]"
"36","2.813509","192.168.0.183","104.244.42.65","TCP","1414","50717  >  443 [ACK] Seq=19333 Ack=10546 Win=1041 Len=1360 [TCP segment of a reassembled PDU]"
"37","2.813509","192.168.0.183","104.244.42.65","TLSv1.2","140","Application Data"
"38","2.813648","192.168.0.183","104.244.42.65","TCP","1414","50717  >  443 [ACK] Seq=20779 Ack=10546 Win=1041 Len=1360 [TCP segment of a reassembled PDU]"
"39","2.813648","192.168.0.183","104.244.42.65","TCP","1414","50717  >  443 [ACK] Seq=22139 Ack=10546 Win=1041 Len=1360 [TCP segment of a reassembled PDU]"
"40","2.813648","192.168.0.183","104.244.42.65","TCP","1414","50717  >  443 [ACK] Seq=23499 Ack=10546 Win=1041 Len=1360 [TCP segment of a reassembled PDU]"
"41","2.813648","192.168.0.183","104.244.42.65","TCP","1414","50717  >  443 [ACK] Seq=24859 Ack=10546 Win=1041 Len=1360 [TCP segment of a reassembled PDU]"
"42","2.813648","192.168.0.183","104.244.42.65","TCP","1414","50717  >  443 [ACK] Seq=26219 Ack=10546 Win=1041 Len=1360 [TCP segment of a reassembled PDU]"
"43","2.813648","192.168.0.183","104.244.42.65","TCP","1414","50717  >  443 [ACK] Seq=27579 Ack=10546 Win=1041 Len=1360 [TCP segment of a reassembled PDU]"
"44","2.813648","192.168.0.183","104.244.42.65","TCP","1414","50717  >  443 [ACK] Seq=28939 Ack=10546 Win=1041 Len=1360 [TCP segment of a reassembled PDU]"
"45","2.813648","192.168.0.183","104.244.42.65","TCP","1414","50717  >  443 [ACK] Seq=30299 Ack=10546 Win=1041 Len=1360 [TCP segment of a reassembled PDU]"
"46","2.813648","192.168.0.183","104.244.42.65","TCP","1414","50717  >  443 [ACK] Seq=31659 Ack=10546 Win=1041 Len=1360 [TCP segment of a reassembled PDU]"
"47","2.813648","192.168.0.183","104.244.42.65","TCP","1414","50717  >  443 [ACK] Seq=33019 Ack=10546 Win=1041 Len=1360 [TCP segment of a reassembled PDU]"
"48","2.813648","192.168.0.183","104.244.42.65","TCP","1414","50717  >  443 [ACK] Seq=34379 Ack=10546 Win=1041 Len=1360 [TCP segment of a reassembled PDU]"
"49","2.813648","192.168.0.183","104.244.42.65","TCP","1414","50717  >  443 [ACK] Seq=35739 Ack=10546 Win=1041 Len=1360 [TCP segment of a reassembled PDU]"
"50","2.813648","192.168.0.183","104.244.42.65","TLSv1.2","140","Application Data"
"51","2.813788","192.168.0.183","104.244.42.65","TCP","1414","50717  >  443 [ACK] Seq=37185 Ack=10546 Win=1041 Len=1360 [TCP segment of a reassembled PDU]"
"52","2.813788","192.168.0.183","104.244.42.65","TCP","1414","50717  >  443 [ACK] Seq=38545 Ack=10546 Win=1041 Len=1360 [TCP segment of a reassembled PDU]"
"53","2.813788","192.168.0.183","104.244.42.65","TCP","1414","50717  >  443 [ACK] Seq=39905 Ack=10546 Win=1041 Len=1360 [TCP segment of a reassembled PDU]"
"54","2.813788","192.168.0.183","104.244.42.65","TCP","1414","50717  >  443 [ACK] Seq=41265 Ack=10546 Win=1041 Len=1360 [TCP segment of a reassembled PDU]"
"55","2.813788","192.168.0.183","104.244.42.65","TCP","1414","50717  >  443 [ACK] Seq=42625 Ack=10546 Win=1041 Len=1360 [TCP segment of a reassembled PDU]"
"56","2.813788","192.168.0.183","104.244.42.65","TCP","1414","50717  >  443 [ACK] Seq=43985 Ack=10546 Win=1041 Len=1360 [TCP segment of a reassembled PDU]"
"57","2.813788","192.168.0.183","104.244.42.65","TCP","1414","50717  >  443 [ACK] Seq=45345 Ack=10546 Win=1041 Len=1360 [TCP segment of a reassembled PDU]"
"58","2.813788","192.168.0.183","104.244.42.65","TCP","1414","50717  >  443 [ACK] Seq=46705 Ack=10546 Win=1041 Len=1360 [TCP segment of a reassembled PDU]"
"59","2.813788","192.168.0.183","104.244.42.65","TCP","1414","50717  >  443 [ACK] Seq=48065 Ack=10546 Win=1041 Len=1360 [TCP segment of a reassembled PDU]"
"60","2.813788","192.168.0.183","104.244.42.65","TCP","1414","50717  >  443 [ACK] Seq=49425 Ack=10546 Win=1041 Len=1360 [TCP segment of a reassembled PDU]"
"61","2.813788","192.168.0.183","104.244.42.65","TLSv1.2","1046","Application Data"
"62","2.850158","104.244.42.65","192.168.0.183","TCP","60","443  >  50717 [ACK] Seq=10546 Ack=4373 Win=7930 Len=0"
"63","2.852690","104.244.42.65","192.168.0.183","TCP","60","443  >  50717 [ACK] Seq=10546 Ack=5733 Win=7928 Len=0"
"64","2.855910","104.244.42.65","192.168.0.183","TCP","60","443  >  50717 [ACK] Seq=10546 Ack=49425 Win=7921 Len=0"
"65","2.858698","104.244.42.65","192.168.0.183","TCP","60","443  >  50717 [ACK] Seq=10546 Ack=51777 Win=7925 Len=0"
"66","2.858698","104.244.42.65","192.168.0.183","TLSv1.2","89","Application Data"
"67","2.898860","192.168.0.183","104.244.42.65","TLSv1.2","236","Application Data"
"68","2.899046","192.168.0.183","104.244.42.65","TLSv1.2","1093","Application Data"
"69","2.914825","104.244.42.65","192.168.0.183","TLSv1.2","189","Application Data"
"70","2.936216","104.244.42.65","192.168.0.183","TCP","60","443  >  50717 [ACK] Seq=10716 Ack=52998 Win=7930 Len=0"
"71","2.958410","192.168.0.183","104.244.42.65","TCP","54","50717  >  443 [ACK] Seq=52998 Ack=10716 Win=1040 Len=0"
"72","2.960576","104.244.42.65","192.168.0.183","TLSv1.2","264","Application Data"
"73","3.004711","192.168.0.183","104.244.42.65","TCP","54","50717  >  443 [ACK] Seq=52998 Ack=10926 Win=1039 Len=0"
"74","5.888435","192.168.0.183","104.244.42.65","TLSv1.2","551","Application Data"
"75","5.888562","192.168.0.183","104.244.42.65","TCP","1414","50717  >  443 [ACK] Seq=53495 Ack=10926 Win=1039 Len=1360 [TCP segment of a reassembled PDU]"
"76","5.888562","192.168.0.183","104.244.42.65","TCP","1414","50717  >  443 [ACK] Seq=54855 Ack=10926 Win=1039 Len=1360 [TCP segment of a reassembled PDU]"
"77","5.888562","192.168.0.183","104.244.42.65","TCP","1414","50717  >  443 [ACK] Seq=56215 Ack=10926 Win=1039 Len=1360 [TCP segment of a reassembled PDU]"
"78","5.888562","192.168.0.183","104.244.42.65","TCP","1414","50717  >  443 [ACK] Seq=57575 Ack=10926 Win=1039 Len=1360 [TCP segment of a reassembled PDU]"
"79","5.888562","192.168.0.183","104.244.42.65","TCP","1414","50717  >  443 [ACK] Seq=58935 Ack=10926 Win=1039 Len=1360 [TCP segment of a reassembled PDU]"
"80","5.888562","192.168.0.183","104.244.42.65","TCP","1414","50717  >  443 [ACK] Seq=60295 Ack=10926 Win=1039 Len=1360 [TCP segment of a reassembled PDU]"
"81","5.888562","192.168.0.183","104.244.42.65","TCP","1414","50717  >  443 [ACK] Seq=61655 Ack=10926 Win=1039 Len=1360 [TCP segment of a reassembled PDU]"
"82","5.888562","192.168.0.183","104.244.42.65","TCP","1414","50717  >  443 [ACK] Seq=63015 Ack=10926 Win=1039 Len=1360 [TCP segment of a reassembled PDU]"
"83","5.888562","192.168.0.183","104.244.42.65","TCP","1414","50717  >  443 [ACK] Seq=64375 Ack=10926 Win=1039 Len=1360 [TCP segment of a reassembled PDU]"
"84","5.888562","192.168.0.183","104.244.42.65","TCP","1414","50717  >  443 [ACK] Seq=65735 Ack=10926 Win=1039 Len=1360 [TCP segment of a reassembled PDU]"
"85","5.888562","192.168.0.183","104.244.42.65","TLSv1.2","1195","Application Data"
"86","5.928677","104.244.42.65","192.168.0.183","TCP","60","443  >  50717 [ACK] Seq=10926 Ack=57575 Win=7928 Len=0"
"87","5.936367","104.244.42.65","192.168.0.183","TCP","60","443  >  50717 [ACK] Seq=10926 Ack=68236 Win=7930 Len=0"
"88","5.963855","104.244.42.65","192.168.0.183","TLSv1.2","184","Application Data"
"89","6.005909","192.168.0.183","104.244.42.65","TCP","54","50717  >  443 [ACK] Seq=68236 Ack=11056 Win=1039 Len=0"
"90","8.899077","192.168.0.183","104.244.42.65","TLSv1.2","379","Application Data"
"91","8.899274","192.168.0.183","104.244.42.65","TCP","1414","50717  >  443 [ACK] Seq=68561 Ack=11056 Win=1039 Len=1360 [TCP segment of a reassembled PDU]"
"92","8.899274","192.168.0.183","104.244.42.65","TCP","1414","50717  >  443 [ACK] Seq=69921 Ack=11056 Win=1039 Len=1360 [TCP segment of a reassembled PDU]"
"93","8.899274","192.168.0.183","104.244.42.65","TCP","1414","50717  >  443 [ACK] Seq=71281 Ack=11056 Win=1039 Len=1360 [TCP segment of a reassembled PDU]"
"94","8.899274","192.168.0.183","104.244.42.65","TCP","1414","50717  >  443 [ACK] Seq=72641 Ack=11056 Win=1039 Len=1360 [TCP segment of a reassembled PDU]"
"95","8.899274","192.168.0.183","104.244.42.65","TCP","1414","50717  >  443 [ACK] Seq=74001 Ack=11056 Win=1039 Len=1360 [TCP segment of a reassembled PDU]"
"96","8.899274","192.168.0.183","104.244.42.65","TCP","1414","50717  >  443 [ACK] Seq=75361 Ack=11056 Win=1039 Len=1360 [TCP segment of a reassembled PDU]"
"97","8.899274","192.168.0.183","104.244.42.65","TCP","1414","50717  >  443 [ACK] Seq=76721 Ack=11056 Win=1039 Len=1360 [TCP segment of a reassembled PDU]"
"98","8.899274","192.168.0.183","104.244.42.65","TCP","1414","50717  >  443 [ACK] Seq=78081 Ack=11056 Win=1039 Len=1360 [TCP segment of a reassembled PDU]"
"99","8.899274","192.168.0.183","104.244.42.65","TCP","1414","50717  >  443 [ACK] Seq=79441 Ack=11056 Win=1039 Len=1360 [TCP segment of a reassembled PDU]"
"100","8.899274","192.168.0.183","104.244.42.65","TCP","1414","50717  >  443 [ACK] Seq=80801 Ack=11056 Win=1039 Len=1360 [TCP segment of a reassembled PDU]"
"101","8.899274","192.168.0.183","104.244.42.65","TCP","1414","50717  >  443 [ACK] Seq=82161 Ack=11056 Win=1039 Len=1360 [TCP segment of a reassembled PDU]"
"102","8.899274","192.168.0.183","104.244.42.65","TCP","1414","50717  >  443 [ACK] Seq=83521 Ack=11056 Win=1039 Len=1360 [TCP segment of a reassembled PDU]"
"103","8.899274","192.168.0.183","104.244.42.65","TLSv1.2","140","Application Data"
"104","8.899711","192.168.0.183","104.244.42.65","TCP","1414","50717  >  443 [ACK] Seq=84967 Ack=11056 Win=1039 Len=1360 [TCP segment of a reassembled PDU]"
"105","8.899711","192.168.0.183","104.244.42.65","TCP","1414","50717  >  443 [ACK] Seq=86327 Ack=11056 Win=1039 Len=1360 [TCP segment of a reassembled PDU]"
"106","8.899711","192.168.0.183","104.244.42.65","TCP","1414","50717  >  443 [ACK] Seq=87687 Ack=11056 Win=1039 Len=1360 [TCP segment of a reassembled PDU]"
"107","8.899711","192.168.0.183","104.244.42.65","TCP","1414","50717  >  443 [ACK] Seq=89047 Ack=11056 Win=1039 Len=1360 [TCP segment of a reassembled PDU]"
"108","8.899711","192.168.0.183","104.244.42.65","TCP","1414","50717  >  443 [ACK] Seq=90407 Ack=11056 Win=1039 Len=1360 [TCP segment of a reassembled PDU]"
"109","8.899711","192.168.0.183","104.244.42.65","TCP","1414","50717  >  443 [ACK] Seq=91767 Ack=11056 Win=1039 Len=1360 [TCP segment of a reassembled PDU]"
"110","8.899711","192.168.0.183","104.244.42.65","TCP","1414","50717  >  443 [ACK] Seq=93127 Ack=11056 Win=1039 Len=1360 [TCP segment of a reassembled PDU]"
"111","8.899711","192.168.0.183","104.244.42.65","TCP","1414","50717  >  443 [ACK] Seq=94487 Ack=11056 Win=1039 Len=1360 [TCP segment of a reassembled PDU]"
"112","8.899711","192.168.0.183","104.244.42.65","TCP","1414","50717  >  443 [ACK] Seq=95847 Ack=11056 Win=1039 Len=1360 [TCP segment of a reassembled PDU]"
"113","8.899711","192.168.0.183","104.244.42.65","TCP","1414","50717  >  443 [ACK] Seq=97207 Ack=11056 Win=1039 Len=1360 [TCP segment of a reassembled PDU]"
"114","8.899711","192.168.0.183","104.244.42.65","TLSv1.2","611","Application Data"
"115","8.938827","104.244.42.65","192.168.0.183","TCP","60","443  >  50717 [ACK] Seq=11056 Ack=99124 Win=7930 Len=0"
"116","8.981071","104.244.42.65","192.168.0.183","TLSv1.2","182","Application Data"
"117","9.025394","192.168.0.183","104.244.42.65","TCP","54","50717  >  443 [ACK] Seq=99124 Ack=11184 Win=1038 Len=0"
"118","9.883720","192.168.0.183","104.244.42.65","TCP","1414","50717  >  443 [ACK] Seq=99124 Ack=11184 Win=1038 Len=1360 [TCP segment of a reassembled PDU]"
"119","9.883720","192.168.0.183","104.244.42.65","TLSv1.2","571","Application Data"
"120","9.920278","104.244.42.65","192.168.0.183","TCP","60","443  >  50717 [ACK] Seq=11184 Ack=101001 Win=7926 Len=0"
"121","11.022550","104.244.42.65","192.168.0.183","TCP","1414","443  >  50717 [ACK] Seq=11184 Ack=101001 Win=7930 Len=1360 [TCP segment of a reassembled PDU]"
"122","11.022550","104.244.42.65","192.168.0.183","TCP","1414","443  >  50717 [PSH, ACK] Seq=12544 Ack=101001 Win=7930 Len=1360 [TCP segment of a reassembled PDU]"
"123","11.022550","104.244.42.65","192.168.0.183","TCP","1414","443  >  50717 [ACK] Seq=13904 Ack=101001 Win=7930 Len=1360 [TCP segment of a reassembled PDU]"
"124","11.022550","104.244.42.65","192.168.0.183","TCP","1414","443  >  50717 [PSH, ACK] Seq=15264 Ack=101001 Win=7930 Len=1360 [TCP segment of a reassembled PDU]"
"125","11.022550","104.244.42.65","192.168.0.183","TCP","1414","443  >  50717 [ACK] Seq=16624 Ack=101001 Win=7930 Len=1360 [TCP segment of a reassembled PDU]"
"126","11.022550","104.244.42.65","192.168.0.183","TCP","1414","443  >  50717 [PSH, ACK] Seq=17984 Ack=101001 Win=7930 Len=1360 [TCP segment of a reassembled PDU]"
"127","11.022550","104.244.42.65","192.168.0.183","TCP","1414","443  >  50717 [ACK] Seq=19344 Ack=101001 Win=7930 Len=1360 [TCP segment of a reassembled PDU]"
"128","11.022550","104.244.42.65","192.168.0.183","TLSv1.2","1008","Application Data"
"129","11.022651","192.168.0.183","104.244.42.65","TCP","54","50717  >  443 [ACK] Seq=101001 Ack=21658 Win=1041 Len=0"
"130","11.023910","192.168.0.183","104.244.42.65","TLSv1.2","89","Application Data"
"131","11.105190","104.244.42.65","192.168.0.183","TCP","60","443  >  50717 [ACK] Seq=21658 Ack=101036 Win=7930 Len=0"
"132","12.217000","192.168.0.183","104.244.42.65","TLSv1.2","338","Application Data"
"133","12.217176","192.168.0.183","104.244.42.65","TCP","1414","50717  >  443 [ACK] Seq=101320 Ack=21658 Win=1041 Len=1360 [TCP segment of a reassembled PDU]"
"134","12.217176","192.168.0.183","104.244.42.65","TCP","1414","50717  >  443 [ACK] Seq=102680 Ack=21658 Win=1041 Len=1360 [TCP segment of a reassembled PDU]"
"135","12.217176","192.168.0.183","104.244.42.65","TCP","1414","50717  >  443 [ACK] Seq=104040 Ack=21658 Win=1041 Len=1360 [TCP segment of a reassembled PDU]"
"136","12.217176","192.168.0.183","104.244.42.65","TCP","1414","50717  >  443 [ACK] Seq=105400 Ack=21658 Win=1041 Len=1360 [TCP segment of a reassembled PDU]"
"137","12.217176","192.168.0.183","104.244.42.65","TCP","1414","50717  >  443 [ACK] Seq=106760 Ack=21658 Win=1041 Len=1360 [TCP segment of a reassembled PDU]"
"138","12.217176","192.168.0.183","104.244.42.65","TCP","1414","50717  >  443 [ACK] Seq=108120 Ack=21658 Win=1041 Len=1360 [TCP segment of a reassembled PDU]"
"139","12.217176","192.168.0.183","104.244.42.65","TCP","1414","50717  >  443 [ACK] Seq=109480 Ack=21658 Win=1041 Len=1360 [TCP segment of a reassembled PDU]"
"140","12.217176","192.168.0.183","104.244.42.65","TCP","1414","50717  >  443 [ACK] Seq=110840 Ack=21658 Win=1041 Len=1360 [TCP segment of a reassembled PDU]"
"141","12.217176","192.168.0.183","104.244.42.65","TCP","1414","50717  >  443 [ACK] Seq=112200 Ack=21658 Win=1041 Len=1360 [TCP segment of a reassembled PDU]"
"142","12.217176","192.168.0.183","104.244.42.65","TCP","1414","50717  >  443 [ACK] Seq=113560 Ack=21658 Win=1041 Len=1360 [TCP segment of a reassembled PDU]"
"143","12.217176","192.168.0.183","104.244.42.65","TCP","1414","50717  >  443 [ACK] Seq=114920 Ack=21658 Win=1041 Len=1360 [TCP segment of a reassembled PDU]"
"144","12.217176","192.168.0.183","104.244.42.65","TCP","1414","50717  >  443 [ACK] Seq=116280 Ack=21658 Win=1041 Len=1360 [TCP segment of a reassembled PDU]"
"145","12.217176","192.168.0.183","104.244.42.65","TLSv1.2","140","Application Data"
"146","12.217344","192.168.0.183","104.244.42.65","TCP","1414","50717  >  443 [ACK] Seq=117726 Ack=21658 Win=1041 Len=1360 [TCP segment of a reassembled PDU]"
"147","12.217344","192.168.0.183","104.244.42.65","TCP","1414","50717  >  443 [ACK] Seq=119086 Ack=21658 Win=1041 Len=1360 [TCP segment of a reassembled PDU]"
"148","12.217344","192.168.0.183","104.244.42.65","TCP","1414","50717  >  443 [ACK] Seq=120446 Ack=21658 Win=1041 Len=1360 [TCP segment of a reassembled PDU]"
"149","12.217344","192.168.0.183","104.244.42.65","TCP","1414","50717  >  443 [ACK] Seq=121806 Ack=21658 Win=1041 Len=1360 [TCP segment of a reassembled PDU]"
"150","12.217344","192.168.0.183","104.244.42.65","TCP","1414","50717  >  443 [ACK] Seq=123166 Ack=21658 Win=1041 Len=1360 [TCP segment of a reassembled PDU]"
"151","12.217344","192.168.0.183","104.244.42.65","TCP","1414","50717  >  443 [ACK] Seq=124526 Ack=21658 Win=1041 Len=1360 [TCP segment of a reassembled PDU]"
"152","12.217344","192.168.0.183","104.244.42.65","TCP","1414","50717  >  443 [ACK] Seq=125886 Ack=21658 Win=1041 Len=1360 [TCP segment of a reassembled PDU]"
"153","12.217344","192.168.0.183","104.244.42.65","TCP","1414","50717  >  443 [ACK] Seq=127246 Ack=21658 Win=1041 Len=1360 [TCP segment of a reassembled PDU]"
"154","12.217344","192.168.0.183","104.244.42.65","TCP","1414","50717  >  443 [ACK] Seq=128606 Ack=21658 Win=1041 Len=1360 [TCP segment of a reassembled PDU]"
"155","12.217344","192.168.0.183","104.244.42.65","TCP","1414","50717  >  443 [ACK] Seq=129966 Ack=21658 Win=1041 Len=1360 [TCP segment of a reassembled PDU]"
"156","12.217344","192.168.0.183","104.244.42.65","TCP","1414","50717  >  443 [ACK] Seq=131326 Ack=21658 Win=1041 Len=1360 [TCP segment of a reassembled PDU]"
"157","12.217344","192.168.0.183","104.244.42.65","TCP","1414","50717  >  443 [ACK] Seq=132686 Ack=21658 Win=1041 Len=1360 [TCP segment of a reassembled PDU]"
"158","12.217344","192.168.0.183","104.244.42.65","TLSv1.2","140","Application Data"
"159","12.217579","192.168.0.183","104.244.42.65","TCP","1414","50717  >  443 [ACK] Seq=134132 Ack=21658 Win=1041 Len=1360 [TCP segment of a reassembled PDU]"
"160","12.217579","192.168.0.183","104.244.42.65","TCP","1414","50717  >  443 [ACK] Seq=135492 Ack=21658 Win=1041 Len=1360 [TCP segment of a reassembled PDU]"
"161","12.217579","192.168.0.183","104.244.42.65","TCP","1414","50717  >  443 [ACK] Seq=136852 Ack=21658 Win=1041 Len=1360 [TCP segment of a reassembled PDU]"
"162","12.217579","192.168.0.183","104.244.42.65","TCP","1414","50717  >  443 [ACK] Seq=138212 Ack=21658 Win=1041 Len=1360 [TCP segment of a reassembled PDU]"
"163","12.217579","192.168.0.183","104.244.42.65","TCP","1414","50717  >  443 [ACK] Seq=139572 Ack=21658 Win=1041 Len=1360 [TCP segment of a reassembled PDU]"
"164","12.217579","192.168.0.183","104.244.42.65","TCP","1414","50717  >  443 [ACK] Seq=140932 Ack=21658 Win=1041 Len=1360 [TCP segment of a reassembled PDU]"
"165","12.217579","192.168.0.183","104.244.42.65","TCP","1414","50717  >  443 [ACK] Seq=142292 Ack=21658 Win=1041 Len=1360 [TCP segment of a reassembled PDU]"
"166","12.217579","192.168.0.183","104.244.42.65","TCP","1414","50717  >  443 [ACK] Seq=143652 Ack=21658 Win=1041 Len=1360 [TCP segment of a reassembled PDU]"
"167","12.217579","192.168.0.183","104.244.42.65","TCP","1414","50717  >  443 [ACK] Seq=145012 Ack=21658 Win=1041 Len=1360 [TCP segment of a reassembled PDU]"
"168","12.217579","192.168.0.183","104.244.42.65","TCP","1414","50717  >  443 [ACK] Seq=146372 Ack=21658 Win=1041 Len=1360 [TCP segment of a reassembled PDU]"
"169","12.217579","192.168.0.183","104.244.42.65","TCP","1414","50717  >  443 [ACK] Seq=147732 Ack=21658 Win=1041 Len=1360 [TCP segment of a reassembled PDU]"
"170","12.217579","192.168.0.183","104.244.42.65","TCP","1414","50717  >  443 [ACK] Seq=149092 Ack=21658 Win=1041 Len=1360 [TCP segment of a reassembled PDU]"
"171","12.217579","192.168.0.183","104.244.42.65","TLSv1.2","140","Application Data"
"172","12.217810","192.168.0.183","104.244.42.65","TCP","1414","50717  >  443 [ACK] Seq=150538 Ack=21658 Win=1041 Len=1360 [TCP segment of a reassembled PDU]"
"173","12.217810","192.168.0.183","104.244.42.65","TCP","1414","50717  >  443 [ACK] Seq=151898 Ack=21658 Win=1041 Len=1360 [TCP segment of a reassembled PDU]"
"174","12.217810","192.168.0.183","104.244.42.65","TCP","1414","50717  >  443 [ACK] Seq=153258 Ack=21658 Win=1041 Len=1360 [TCP segment of a reassembled PDU]"
"175","12.217810","192.168.0.183","104.244.42.65","TCP","1414","50717  >  443 [ACK] Seq=154618 Ack=21658 Win=1041 Len=1360 [TCP segment of a reassembled PDU]"
"176","12.217810","192.168.0.183","104.244.42.65","TCP","1414","50717  >  443 [ACK] Seq=155978 Ack=21658 Win=1041 Len=1360 [TCP segment of a reassembled PDU]"
"177","12.217810","192.168.0.183","104.244.42.65","TCP","1414","50717  >  443 [ACK] Seq=157338 Ack=21658 Win=1041 Len=1360 [TCP segment of a reassembled PDU]"
"178","12.217810","192.168.0.183","104.244.42.65","TCP","1414","50717  >  443 [ACK] Seq=158698 Ack=21658 Win=1041 Len=1360 [TCP segment of a reassembled PDU]"
"179","12.217810","192.168.0.183","104.244.42.65","TCP","1414","50717  >  443 [ACK] Seq=160058 Ack=21658 Win=1041 Len=1360 [TCP segment of a reassembled PDU]"
"180","12.217810","192.168.0.183","104.244.42.65","TCP","1414","50717  >  443 [ACK] Seq=161418 Ack=21658 Win=1041 Len=1360 [TCP segment of a reassembled PDU]"
"181","12.217810","192.168.0.183","104.244.42.65","TCP","1414","50717  >  443 [ACK] Seq=162778 Ack=21658 Win=1041 Len=1360 [TCP segment of a reassembled PDU]"
"182","12.217810","192.168.0.183","104.244.42.65","TCP","1414","50717  >  443 [ACK] Seq=164138 Ack=21658 Win=1041 Len=1360 [TCP segment of a reassembled PDU]"
"183","12.217810","192.168.0.183","104.244.42.65","TCP","1414","50717  >  443 [ACK] Seq=165498 Ack=21658 Win=1041 Len=1360 [TCP segment of a reassembled PDU]"
"184","12.217810","192.168.0.183","104.244.42.65","TLSv1.2","140","Application Data"
"185","12.218008","192.168.0.183","104.244.42.65","TLSv1.2","121","Application Data"
"186","12.255695","104.244.42.65","192.168.0.183","TCP","60","443  >  50717 [ACK] Seq=21658 Ack=104040 Win=7923 Len=0"
"187","12.260159","104.244.42.65","192.168.0.183","TCP","60","443  >  50717 [ACK] Seq=21658 Ack=162778 Win=7894 Len=0"
"188","12.260159","104.244.42.65","192.168.0.183","TLSv1.2","89","Application Data"
"189","12.260159","104.244.42.65","192.168.0.183","TCP","60","443  >  50717 [ACK] Seq=21693 Ack=167011 Win=7919 Len=0"
"190","12.260341","192.168.0.183","104.244.42.65","TCP","1414","50717  >  443 [ACK] Seq=167011 Ack=21693 Win=1041 Len=1360 [TCP segment of a reassembled PDU]"
"191","12.260341","192.168.0.183","104.244.42.65","TCP","1414","50717  >  443 [ACK] Seq=168371 Ack=21693 Win=1041 Len=1360 [TCP segment of a reassembled PDU]"
"192","12.260341","192.168.0.183","104.244.42.65","TCP","1414","50717  >  443 [ACK] Seq=169731 Ack=21693 Win=1041 Len=1360 [TCP segment of a reassembled PDU]"
"193","12.260341","192.168.0.183","104.244.42.65","TCP","1414","50717  >  443 [ACK] Seq=171091 Ack=21693 Win=1041 Len=1360 [TCP segment of a reassembled PDU]"
"194","12.260341","192.168.0.183","104.244.42.65","TCP","1414","50717  >  443 [ACK] Seq=172451 Ack=21693 Win=1041 Len=1360 [TCP segment of a reassembled PDU]"
"195","12.260341","192.168.0.183","104.244.42.65","TLSv1.2","1357","Application Data"
"196","12.298288","104.244.42.65","192.168.0.183","TCP","60","443  >  50717 [ACK] Seq=21693 Ack=169731 Win=7925 Len=0"
"197","12.306615","104.244.42.65","192.168.0.183","TCP","60","443  >  50717 [ACK] Seq=21693 Ack=175114 Win=7930 Len=0"
"198","12.371306","104.244.42.65","192.168.0.183","TLSv1.2","182","Application Data"
"199","12.413930","192.168.0.183","104.244.42.65","TCP","54","50717  >  443 [ACK] Seq=175114 Ack=21821 Win=1040 Len=0"
"200","14.784366","192.168.0.183","104.244.42.65","TLSv1.2","370","Application Data"
"201","14.869966","104.244.42.65","192.168.0.183","TCP","60","443  >  50717 [ACK] Seq=21821 Ack=175430 Win=7930 Len=0"
"202","14.903669","192.168.0.183","104.244.42.65","TLSv1.2","680","Application Data"
"203","14.903748","192.168.0.183","104.244.42.65","TCP","1414","50717  >  443 [ACK] Seq=176056 Ack=21821 Win=1040 Len=1360 [TCP segment of a reassembled PDU]"
"204","14.903748","192.168.0.183","104.244.42.65","TLSv1.2","464","Application Data"
"205","14.904159","192.168.0.183","104.244.42.65","TLSv1.2","234","Application Data"
"206","14.904246","192.168.0.183","104.244.42.65","TLSv1.2","669","Application Data"
"207","14.939475","104.244.42.65","192.168.0.183","TCP","60","443  >  50717 [ACK] Seq=21821 Ack=178006 Win=7924 Len=0"
"208","14.953810","104.244.42.65","192.168.0.183","TCP","60","443  >  50717 [ACK] Seq=21821 Ack=178621 Win=7930 Len=0"
"209","14.973212","104.244.42.65","192.168.0.183","TLSv1.2","184","Application Data"
"210","15.024812","192.168.0.183","104.244.42.65","TCP","54","50717  >  443 [ACK] Seq=178621 Ack=21951 Win=1040 Len=0"
"211","15.172403","104.244.42.65","192.168.0.183","TLSv1.2","178","Application Data"
"212","15.211988","192.168.0.183","104.244.42.65","TCP","54","50717  >  443 [ACK] Seq=178621 Ack=22075 Win=1039 Len=0"
"213","15.322841","192.168.0.183","104.244.42.65","TLSv1.2","550","Application Data"
"214","15.322974","192.168.0.183","104.244.42.65","TCP","1414","50717  >  443 [ACK] Seq=179117 Ack=22075 Win=1039 Len=1360 [TCP segment of a reassembled PDU]"
"215","15.322974","192.168.0.183","104.244.42.65","TCP","1414","50717  >  443 [ACK] Seq=180477 Ack=22075 Win=1039 Len=1360 [TCP segment of a reassembled PDU]"
"216","15.322974","192.168.0.183","104.244.42.65","TCP","1414","50717  >  443 [ACK] Seq=181837 Ack=22075 Win=1039 Len=1360 [TCP segment of a reassembled PDU]"
"217","15.322974","192.168.0.183","104.244.42.65","TCP","1414","50717  >  443 [ACK] Seq=183197 Ack=22075 Win=1039 Len=1360 [TCP segment of a reassembled PDU]"
"218","15.322974","192.168.0.183","104.244.42.65","TCP","1414","50717  >  443 [ACK] Seq=184557 Ack=22075 Win=1039 Len=1360 [TCP segment of a reassembled PDU]"
"219","15.322974","192.168.0.183","104.244.42.65","TCP","1414","50717  >  443 [ACK] Seq=185917 Ack=22075 Win=1039 Len=1360 [TCP segment of a reassembled PDU]"
"220","15.322974","192.168.0.183","104.244.42.65","TCP","1414","50717  >  443 [ACK] Seq=187277 Ack=22075 Win=1039 Len=1360 [TCP segment of a reassembled PDU]"
"221","15.322974","192.168.0.183","104.244.42.65","TCP","1414","50717  >  443 [ACK] Seq=188637 Ack=22075 Win=1039 Len=1360 [TCP segment of a reassembled PDU]"
"222","15.322974","192.168.0.183","104.244.42.65","TCP","1414","50717  >  443 [ACK] Seq=189997 Ack=22075 Win=1039 Len=1360 [TCP segment of a reassembled PDU]"
"223","15.322974","192.168.0.183","104.244.42.65","TCP","1414","50717  >  443 [ACK] Seq=191357 Ack=22075 Win=1039 Len=1360 [TCP segment of a reassembled PDU]"
"224","15.322974","192.168.0.183","104.244.42.65","TCP","1414","50717  >  443 [ACK] Seq=192717 Ack=22075 Win=1039 Len=1360 [TCP segment of a reassembled PDU]"
"225","15.322974","192.168.0.183","104.244.42.65","TCP","1414","50717  >  443 [ACK] Seq=194077 Ack=22075 Win=1039 Len=1360 [TCP segment of a reassembled PDU]"
"226","15.322974","192.168.0.183","104.244.42.65","TLSv1.2","140","Application Data"
"227","15.323104","192.168.0.183","104.244.42.65","TCP","1414","50717  >  443 [ACK] Seq=195523 Ack=22075 Win=1039 Len=1360 [TCP segment of a reassembled PDU]"
"228","15.323104","192.168.0.183","104.244.42.65","TCP","1414","50717  >  443 [ACK] Seq=196883 Ack=22075 Win=1039 Len=1360 [TCP segment of a reassembled PDU]"
"229","15.323104","192.168.0.183","104.244.42.65","TCP","1414","50717  >  443 [ACK] Seq=198243 Ack=22075 Win=1039 Len=1360 [TCP segment of a reassembled PDU]"
"230","15.323104","192.168.0.183","104.244.42.65","TCP","1414","50717  >  443 [ACK] Seq=199603 Ack=22075 Win=1039 Len=1360 [TCP segment of a reassembled PDU]"
"231","15.323104","192.168.0.183","104.244.42.65","TCP","1414","50717  >  443 [ACK] Seq=200963 Ack=22075 Win=1039 Len=1360 [TCP segment of a reassembled PDU]"
"232","15.323104","192.168.0.183","104.244.42.65","TCP","1414","50717  >  443 [ACK] Seq=202323 Ack=22075 Win=1039 Len=1360 [TCP segment of a reassembled PDU]"
"233","15.323104","192.168.0.183","104.244.42.65","TCP","1414","50717  >  443 [ACK] Seq=203683 Ack=22075 Win=1039 Len=1360 [TCP segment of a reassembled PDU]"
"234","15.323104","192.168.0.183","104.244.42.65","TCP","1414","50717  >  443 [ACK] Seq=205043 Ack=22075 Win=1039 Len=1360 [TCP segment of a reassembled PDU]"
"235","15.323104","192.168.0.183","104.244.42.65","TCP","1414","50717  >  443 [ACK] Seq=206403 Ack=22075 Win=1039 Len=1360 [TCP segment of a reassembled PDU]"
"236","15.323104","192.168.0.183","104.244.42.65","TCP","1414","50717  >  443 [ACK] Seq=207763 Ack=22075 Win=1039 Len=1360 [TCP segment of a reassembled PDU]"
"237","15.323104","192.168.0.183","104.244.42.65","TCP","1414","50717  >  443 [ACK] Seq=209123 Ack=22075 Win=1039 Len=1360 [TCP segment of a reassembled PDU]"
"238","15.323104","192.168.0.183","104.244.42.65","TCP","1414","50717  >  443 [ACK] Seq=210483 Ack=22075 Win=1039 Len=1360 [TCP segment of a reassembled PDU]"
"239","15.323104","192.168.0.183","104.244.42.65","TLSv1.2","140","Application Data"
"240","15.323222","192.168.0.183","104.244.42.65","TCP","1414","50717  >  443 [ACK] Seq=211929 Ack=22075 Win=1039 Len=1360 [TCP segment of a reassembled PDU]"
"241","15.323222","192.168.0.183","104.244.42.65","TCP","1414","50717  >  443 [ACK] Seq=213289 Ack=22075 Win=1039 Len=1360 [TCP segment of a reassembled PDU]"
"242","15.323222","192.168.0.183","104.244.42.65","TCP","1414","50717  >  443 [ACK] Seq=214649 Ack=22075 Win=1039 Len=1360 [TCP segment of a reassembled PDU]"
"243","15.323222","192.168.0.183","104.244.42.65","TCP","1414","50717  >  443 [ACK] Seq=216009 Ack=22075 Win=1039 Len=1360 [TCP segment of a reassembled PDU]"
"244","15.323222","192.168.0.183","104.244.42.65","TCP","1414","50717  >  443 [ACK] Seq=217369 Ack=22075 Win=1039 Len=1360 [TCP segment of a reassembled PDU]"
"245","15.323222","192.168.0.183","104.244.42.65","TCP","1414","50717  >  443 [ACK] Seq=218729 Ack=22075 Win=1039 Len=1360 [TCP segment of a reassembled PDU]"
"246","15.323222","192.168.0.183","104.244.42.65","TCP","1414","50717  >  443 [ACK] Seq=220089 Ack=22075 Win=1039 Len=1360 [TCP segment of a reassembled PDU]"
"247","15.323222","192.168.0.183","104.244.42.65","TCP","1414","50717  >  443 [ACK] Seq=221449 Ack=22075 Win=1039 Len=1360 [TCP segment of a reassembled PDU]"
"248","15.323222","192.168.0.183","104.244.42.65","TCP","1414","50717  >  443 [ACK] Seq=222809 Ack=22075 Win=1039 Len=1360 [TCP segment of a reassembled PDU]"
"249","15.323222","192.168.0.183","104.244.42.65","TCP","1414","50717  >  443 [ACK] Seq=224169 Ack=22075 Win=1039 Len=1360 [TCP segment of a reassembled PDU]"
"250","15.323222","192.168.0.183","104.244.42.65","TCP","1414","50717  >  443 [ACK] Seq=225529 Ack=22075 Win=1039 Len=1360 [TCP segment of a reassembled PDU]"
"251","15.323222","192.168.0.183","104.244.42.65","TCP","1414","50717  >  443 [ACK] Seq=226889 Ack=22075 Win=1039 Len=1360 [TCP segment of a reassembled PDU]"
"252","15.323222","192.168.0.183","104.244.42.65","TLSv1.2","140","Application Data"
"253","15.323342","192.168.0.183","104.244.42.65","TCP","1414","50717  >  443 [ACK] Seq=228335 Ack=22075 Win=1039 Len=1360 [TCP segment of a reassembled PDU]"
"254","15.323342","192.168.0.183","104.244.42.65","TCP","1414","50717  >  443 [ACK] Seq=229695 Ack=22075 Win=1039 Len=1360 [TCP segment of a reassembled PDU]"
"255","15.323342","192.168.0.183","104.244.42.65","TCP","1414","50717  >  443 [ACK] Seq=231055 Ack=22075 Win=1039 Len=1360 [TCP segment of a reassembled PDU]"
"256","15.323342","192.168.0.183","104.244.42.65","TCP","1414","50717  >  443 [ACK] Seq=232415 Ack=22075 Win=1039 Len=1360 [TCP segment of a reassembled PDU]"
"257","15.323342","192.168.0.183","104.244.42.65","TCP","1414","50717  >  443 [ACK] Seq=233775 Ack=22075 Win=1039 Len=1360 [TCP segment of a reassembled PDU]"
"258","15.323342","192.168.0.183","104.244.42.65","TCP","1414","50717  >  443 [ACK] Seq=235135 Ack=22075 Win=1039 Len=1360 [TCP segment of a reassembled PDU]"
"259","15.323342","192.168.0.183","104.244.42.65","TCP","1414","50717  >  443 [ACK] Seq=236495 Ack=22075 Win=1039 Len=1360 [TCP segment of a reassembled PDU]"
"260","15.323342","192.168.0.183","104.244.42.65","TCP","1414","50717  >  443 [ACK] Seq=237855 Ack=22075 Win=1039 Len=1360 [TCP segment of a reassembled PDU]"
"261","15.323342","192.168.0.183","104.244.42.65","TCP","1414","50717  >  443 [ACK] Seq=239215 Ack=22075 Win=1039 Len=1360 [TCP segment of a reassembled PDU]"
"262","15.323342","192.168.0.183","104.244.42.65","TCP","1414","50717  >  443 [ACK] Seq=240575 Ack=22075 Win=1039 Len=1360 [TCP segment of a reassembled PDU]"
"263","15.323342","192.168.0.183","104.244.42.65","TCP","1414","50717  >  443 [ACK] Seq=241935 Ack=22075 Win=1039 Len=1360 [TCP segment of a reassembled PDU]"
"264","15.323342","192.168.0.183","104.244.42.65","TCP","1414","50717  >  443 [ACK] Seq=243295 Ack=22075 Win=1039 Len=1360 [TCP segment of a reassembled PDU]"
"265","15.323342","192.168.0.183","104.244.42.65","TLSv1.2","140","Application Data"
"266","15.323700","192.168.0.183","104.244.42.65","TLSv1.2","121","Application Data"
"267","15.360883","104.244.42.65","192.168.0.183","TCP","60","443  >  50717 [ACK] Seq=22075 Ack=180477 Win=7926 Len=0"
"268","15.365804","104.244.42.65","192.168.0.183","TCP","60","443  >  50717 [ACK] Seq=22075 Ack=216009 Win=7867 Len=0"
"269","15.367394","104.244.42.65","192.168.0.183","TCP","60","443  >  50717 [ACK] Seq=22075 Ack=237855 Win=7891 Len=0"
"270","15.367394","104.244.42.65","192.168.0.183","TLSv1.2","89","Application Data"
"271","15.367394","104.244.42.65","192.168.0.183","TCP","60","443  >  50717 [ACK] Seq=22110 Ack=244808 Win=7912 Len=0"
"272","15.367589","192.168.0.183","104.244.42.65","TCP","1414","50717  >  443 [ACK] Seq=244808 Ack=22110 Win=1039 Len=1360 [TCP segment of a reassembled PDU]"
"273","15.367589","192.168.0.183","104.244.42.65","TCP","1414","50717  >  443 [ACK] Seq=246168 Ack=22110 Win=1039 Len=1360 [TCP segment of a reassembled PDU]"
"274","15.367589","192.168.0.183","104.244.42.65","TCP","1414","50717  >  443 [ACK] Seq=247528 Ack=22110 Win=1039 Len=1360 [TCP segment of a reassembled PDU]"
"275","15.367589","192.168.0.183","104.244.42.65","TCP","1414","50717  >  443 [ACK] Seq=248888 Ack=22110 Win=1039 Len=1360 [TCP segment of a reassembled PDU]"
"276","15.367589","192.168.0.183","104.244.42.65","TCP","1414","50717  >  443 [ACK] Seq=250248 Ack=22110 Win=1039 Len=1360 [TCP segment of a reassembled PDU]"
"277","15.367589","192.168.0.183","104.244.42.65","TCP","1414","50717  >  443 [ACK] Seq=251608 Ack=22110 Win=1039 Len=1360 [TCP segment of a reassembled PDU]"
"278","15.367589","192.168.0.183","104.244.42.65","TCP","1414","50717  >  443 [ACK] Seq=252968 Ack=22110 Win=1039 Len=1360 [TCP segment of a reassembled PDU]"
"279","15.367589","192.168.0.183","104.244.42.65","TLSv1.2","63","Application Data"
"280","15.415108","104.244.42.65","192.168.0.183","TCP","60","443  >  50717 [ACK] Seq=22110 Ack=251608 Win=7914 Len=0"
"281","15.415108","104.244.42.65","192.168.0.183","TCP","60","443  >  50717 [ACK] Seq=22110 Ack=254337 Win=7924 Len=0"
"282","15.498591","104.244.42.65","192.168.0.183","TLSv1.2","270","Application Data"
"283","15.541144","192.168.0.183","104.244.42.65","TCP","54","50717  >  443 [ACK] Seq=254337 Ack=22326 Win=1038 Len=0"
"284","16.493629","104.244.42.65","192.168.0.183","TCP","1414","443  >  50717 [ACK] Seq=22326 Ack=254337 Win=7930 Len=1360 [TCP segment of a reassembled PDU]"
"285","16.493629","104.244.42.65","192.168.0.183","TCP","1414","443  >  50717 [ACK] Seq=23686 Ack=254337 Win=7930 Len=1360 [TCP segment of a reassembled PDU]"
"286","16.493629","104.244.42.65","192.168.0.183","TCP","1414","443  >  50717 [PSH, ACK] Seq=25046 Ack=254337 Win=7930 Len=1360 [TCP segment of a reassembled PDU]"
"287","16.493629","104.244.42.65","192.168.0.183","TCP","1414","443  >  50717 [ACK] Seq=26406 Ack=254337 Win=7930 Len=1360 [TCP segment of a reassembled PDU]"
"288","16.493629","104.244.42.65","192.168.0.183","TCP","1414","443  >  50717 [ACK] Seq=27766 Ack=254337 Win=7930 Len=1360 [TCP segment of a reassembled PDU]"
"289","16.493629","104.244.42.65","192.168.0.183","TCP","1414","443  >  50717 [PSH, ACK] Seq=29126 Ack=254337 Win=7930 Len=1360 [TCP segment of a reassembled PDU]"
"290","16.493629","104.244.42.65","192.168.0.183","TCP","1414","443  >  50717 [ACK] Seq=30486 Ack=254337 Win=7930 Len=1360 [TCP segment of a reassembled PDU]"
"291","16.493629","104.244.42.65","192.168.0.183","TCP","1414","443  >  50717 [ACK] Seq=31846 Ack=254337 Win=7930 Len=1360 [TCP segment of a reassembled PDU]"
"292","16.493629","104.244.42.65","192.168.0.183","TCP","1414","443  >  50717 [PSH, ACK] Seq=33206 Ack=254337 Win=7930 Len=1360 [TCP segment of a reassembled PDU]"
"293","16.493629","104.244.42.65","192.168.0.183","TCP","1414","443  >  50717 [ACK] Seq=34566 Ack=254337 Win=7930 Len=1360 [TCP segment of a reassembled PDU]"
"294","16.493629","104.244.42.65","192.168.0.183","TCP","1414","443  >  50717 [ACK] Seq=35926 Ack=254337 Win=7930 Len=1360 [TCP segment of a reassembled PDU]"
"295","16.493629","104.244.42.65","192.168.0.183","TCP","1414","443  >  50717 [PSH, ACK] Seq=37286 Ack=254337 Win=7930 Len=1360 [TCP segment of a reassembled PDU]"
"296","16.493629","104.244.42.65","192.168.0.183","TLSv1.2","1414","Application Data"
"297","16.493629","104.244.42.65","192.168.0.183","TCP","1414","443  >  50717 [ACK] Seq=40006 Ack=254337 Win=7930 Len=1360 [TCP segment of a reassembled PDU]"
"298","16.493629","104.244.42.65","192.168.0.183","TCP","1414","443  >  50717 [PSH, ACK] Seq=41366 Ack=254337 Win=7930 Len=1360 [TCP segment of a reassembled PDU]"
"299","16.493629","104.244.42.65","192.168.0.183","TCP","1414","443  >  50717 [ACK] Seq=42726 Ack=254337 Win=7930 Len=1360 [TCP segment of a reassembled PDU]"
"300","16.493629","104.244.42.65","192.168.0.183","TCP","1414","443  >  50717 [ACK] Seq=44086 Ack=254337 Win=7930 Len=1360 [TCP segment of a reassembled PDU]"
"301","16.493629","104.244.42.65","192.168.0.183","TCP","1414","443  >  50717 [PSH, ACK] Seq=45446 Ack=254337 Win=7930 Len=1360 [TCP segment of a reassembled PDU]"
"302","16.493629","104.244.42.65","192.168.0.183","TCP","1414","443  >  50717 [ACK] Seq=46806 Ack=254337 Win=7930 Len=1360 [TCP segment of a reassembled PDU]"
"303","16.493629","104.244.42.65","192.168.0.183","TCP","1414","443  >  50717 [ACK] Seq=48166 Ack=254337 Win=7930 Len=1360 [TCP segment of a reassembled PDU]"
"304","16.493629","104.244.42.65","192.168.0.183","TCP","1414","443  >  50717 [PSH, ACK] Seq=49526 Ack=254337 Win=7930 Len=1360 [TCP segment of a reassembled PDU]"
"305","16.493629","104.244.42.65","192.168.0.183","TCP","1414","443  >  50717 [ACK] Seq=50886 Ack=254337 Win=7930 Len=1360 [TCP segment of a reassembled PDU]"
"306","16.493629","104.244.42.65","192.168.0.183","TCP","1414","443  >  50717 [ACK] Seq=52246 Ack=254337 Win=7930 Len=1360 [TCP segment of a reassembled PDU]"
"307","16.493629","104.244.42.65","192.168.0.183","TCP","1414","443  >  50717 [PSH, ACK] Seq=53606 Ack=254337 Win=7930 Len=1360 [TCP segment of a reassembled PDU]"
"308","16.493629","104.244.42.65","192.168.0.183","TLSv1.2","1414","Application Data"
"309","16.493629","104.244.42.65","192.168.0.183","TCP","1414","443  >  50717 [ACK] Seq=56326 Ack=254337 Win=7930 Len=1360 [TCP segment of a reassembled PDU]"
"310","16.493629","104.244.42.65","192.168.0.183","TLSv1.2","866","Application Data"
"311","16.493915","192.168.0.183","104.244.42.65","TCP","54","50717  >  443 [ACK] Seq=254337 Ack=58498 Win=1041 Len=0"
"312","16.495535","192.168.0.183","104.244.42.65","TLSv1.2","89","Application Data"
"313","16.571393","104.244.42.65","192.168.0.183","TCP","60","443  >  50717 [ACK] Seq=58498 Ack=254372 Win=7930 Len=0"
"314","18.248342","192.168.0.183","104.244.42.65","TLSv1.2","380","Application Data"
"315","18.248487","192.168.0.183","104.244.42.65","TCP","1414","50717  >  443 [ACK] Seq=254698 Ack=58498 Win=1041 Len=1360 [TCP segment of a reassembled PDU]"
"316","18.248487","192.168.0.183","104.244.42.65","TCP","1414","50717  >  443 [ACK] Seq=256058 Ack=58498 Win=1041 Len=1360 [TCP segment of a reassembled PDU]"
"317","18.248487","192.168.0.183","104.244.42.65","TCP","1414","50717  >  443 [ACK] Seq=257418 Ack=58498 Win=1041 Len=1360 [TCP segment of a reassembled PDU]"
"318","18.248487","192.168.0.183","104.244.42.65","TCP","1414","50717  >  443 [ACK] Seq=258778 Ack=58498 Win=1041 Len=1360 [TCP segment of a reassembled PDU]"
"319","18.248487","192.168.0.183","104.244.42.65","TCP","1414","50717  >  443 [ACK] Seq=260138 Ack=58498 Win=1041 Len=1360 [TCP segment of a reassembled PDU]"
"320","18.248487","192.168.0.183","104.244.42.65","TCP","1414","50717  >  443 [ACK] Seq=261498 Ack=58498 Win=1041 Len=1360 [TCP segment of a reassembled PDU]"
"321","18.248487","192.168.0.183","104.244.42.65","TCP","1414","50717  >  443 [ACK] Seq=262858 Ack=58498 Win=1041 Len=1360 [TCP segment of a reassembled PDU]"
"322","18.248487","192.168.0.183","104.244.42.65","TCP","1414","50717  >  443 [ACK] Seq=264218 Ack=58498 Win=1041 Len=1360 [TCP segment of a reassembled PDU]"
"323","18.248487","192.168.0.183","104.244.42.65","TCP","1414","50717  >  443 [ACK] Seq=265578 Ack=58498 Win=1041 Len=1360 [TCP segment of a reassembled PDU]"
"324","18.248487","192.168.0.183","104.244.42.65","TCP","1414","50717  >  443 [ACK] Seq=266938 Ack=58498 Win=1041 Len=1360 [TCP segment of a reassembled PDU]"
"325","18.248487","192.168.0.183","104.244.42.65","TCP","1414","50717  >  443 [ACK] Seq=268298 Ack=58498 Win=1041 Len=1360 [TCP segment of a reassembled PDU]"
"326","18.248487","192.168.0.183","104.244.42.65","TCP","1414","50717  >  443 [ACK] Seq=269658 Ack=58498 Win=1041 Len=1360 [TCP segment of a reassembled PDU]"
"327","18.248487","192.168.0.183","104.244.42.65","TLSv1.2","140","Application Data"
"328","18.248606","192.168.0.183","104.244.42.65","TCP","1414","50717  >  443 [ACK] Seq=271104 Ack=58498 Win=1041 Len=1360 [TCP segment of a reassembled PDU]"
"329","18.248606","192.168.0.183","104.244.42.65","TCP","1414","50717  >  443 [ACK] Seq=272464 Ack=58498 Win=1041 Len=1360 [TCP segment of a reassembled PDU]"
"330","18.248606","192.168.0.183","104.244.42.65","TCP","1414","50717  >  443 [ACK] Seq=273824 Ack=58498 Win=1041 Len=1360 [TCP segment of a reassembled PDU]"
"331","18.248606","192.168.0.183","104.244.42.65","TCP","1414","50717  >  443 [ACK] Seq=275184 Ack=58498 Win=1041 Len=1360 [TCP segment of a reassembled PDU]"
"332","18.248606","192.168.0.183","104.244.42.65","TCP","1414","50717  >  443 [ACK] Seq=276544 Ack=58498 Win=1041 Len=1360 [TCP segment of a reassembled PDU]"
"333","18.248606","192.168.0.183","104.244.42.65","TCP","1414","50717  >  443 [ACK] Seq=277904 Ack=58498 Win=1041 Len=1360 [TCP segment of a reassembled PDU]"
"334","18.248606","192.168.0.183","104.244.42.65","TLSv1.2","1208","Application Data"
"335","18.287773","104.244.42.65","192.168.0.183","TCP","60","443  >  50717 [ACK] Seq=58498 Ack=254698 Win=7930 Len=0"
"336","18.287773","104.244.42.65","192.168.0.183","TCP","60","443  >  50717 [ACK] Seq=58498 Ack=256058 Win=7928 Len=0"
"337","18.290382","104.244.42.65","192.168.0.183","TCP","60","443  >  50717 [ACK] Seq=58498 Ack=280418 Win=7884 Len=0"
"338","18.322880","104.244.42.65","192.168.0.183","TLSv1.2","185","Application Data"
"339","18.365640","192.168.0.183","104.244.42.65","TCP","54","50717  >  443 [ACK] Seq=280418 Ack=58629 Win=1040 Len=0"
"340","19.195322","192.168.0.183","104.244.42.65","TLSv1.2","281","Application Data"
"341","19.195489","192.168.0.183","104.244.42.65","TLSv1.2","533","Application Data"
"342","19.235571","104.244.42.65","192.168.0.183","TCP","60","443  >  50717 [ACK] Seq=58629 Ack=281124 Win=7930 Len=0"
"343","19.255011","104.244.42.65","192.168.0.183","TLSv1.2","310","Application Data"
"344","19.298208","192.168.0.183","104.244.42.65","TCP","54","50717  >  443 [ACK] Seq=281124 Ack=58885 Win=1039 Len=0"
"345","19.793035","192.168.0.183","104.244.42.65","TLSv1.2","938","Application Data"
"346","19.793267","192.168.0.183","104.244.42.65","TLSv1.2","269","Application Data"
"347","19.831931","104.244.42.65","192.168.0.183","TCP","60","443  >  50717 [ACK] Seq=58885 Ack=282223 Win=7930 Len=0"
"348","19.858731","104.244.42.65","192.168.0.183","TLSv1.2","240","Application Data"
"349","19.860486","104.244.42.65","192.168.0.183","TLSv1.2","484","Application Data"
"350","19.860554","192.168.0.183","104.244.42.65","TCP","54","50717  >  443 [ACK] Seq=282223 Ack=59501 Win=1037 Len=0"
"351","21.251821","192.168.0.183","104.244.42.65","TLSv1.2","371","Application Data"
"352","21.251917","192.168.0.183","104.244.42.65","TLSv1.2","548","Application Data"
"353","21.288317","104.244.42.65","192.168.0.183","TCP","60","443  >  50717 [ACK] Seq=59501 Ack=283034 Win=7930 Len=0"
"354","21.306672","104.244.42.65","192.168.0.183","TLSv1.2","184","Application Data"
"355","21.351530","192.168.0.183","104.244.42.65","TCP","54","50717  >  443 [ACK] Seq=283034 Ack=59631 Win=1036 Len=0"
"356","21.956078","192.168.0.183","104.244.42.65","TLSv1.2","693","Application Data"
"357","21.956142","192.168.0.183","104.244.42.65","TLSv1.2","168","Application Data"
"358","21.956998","192.168.0.183","104.244.42.65","TLSv1.2","235","Application Data"
"359","21.957073","192.168.0.183","104.244.42.65","TCP","1414","50717  >  443 [ACK] Seq=283968 Ack=59631 Win=1036 Len=1360 [TCP segment of a reassembled PDU]"
"360","21.957073","192.168.0.183","104.244.42.65","TLSv1.2","165","Application Data"
"361","21.992069","104.244.42.65","192.168.0.183","TCP","60","443  >  50717 [ACK] Seq=59631 Ack=283787 Win=7930 Len=0"
"362","21.993991","104.244.42.65","192.168.0.183","TCP","60","443  >  50717 [ACK] Seq=59631 Ack=285439 Win=7926 Len=0"
"363","22.015170","104.244.42.65","192.168.0.183","TLSv1.2","159","Application Data"
"364","22.066114","192.168.0.183","104.244.42.65","TCP","54","50717  >  443 [ACK] Seq=285439 Ack=59736 Win=1036 Len=0"
"365","22.070473","104.244.42.65","192.168.0.183","TLSv1.2","262","Application Data"
"366","22.071152","192.168.0.183","104.244.42.65","TLSv1.2","89","Application Data"
"367","22.160115","104.244.42.65","192.168.0.183","TCP","60","443  >  50717 [ACK] Seq=59944 Ack=285474 Win=7930 Len=0"
"368","22.959662","192.168.0.183","104.244.42.65","TCP","1414","50717  >  443 [ACK] Seq=285474 Ack=59944 Win=1041 Len=1360 [TCP segment of a reassembled PDU]"
"369","22.959662","192.168.0.183","104.244.42.65","TLSv1.2","736","Application Data"
"370","22.960127","192.168.0.183","104.244.42.65","TLSv1.2","423","Application Data"
"371","22.960185","192.168.0.183","104.244.42.65","TLSv1.2","763","Application Data"
"372","22.960398","192.168.0.183","104.244.42.65","TLSv1.2","269","Application Data"
"373","22.996559","104.244.42.65","192.168.0.183","TCP","60","443  >  50717 [ACK] Seq=59944 Ack=287885 Win=7925 Len=0"
"374","23.001985","104.244.42.65","192.168.0.183","TCP","60","443  >  50717 [ACK] Seq=59944 Ack=288809 Win=7930 Len=0"
"375","23.024669","104.244.42.65","192.168.0.183","TLSv1.2","184","Application Data"
"376","23.071064","192.168.0.183","104.244.42.65","TCP","54","50717  >  443 [ACK] Seq=288809 Ack=60074 Win=1040 Len=0"
"377","23.322138","104.244.42.65","192.168.0.183","TLSv1.2","187","Application Data"
"378","23.369102","192.168.0.183","104.244.42.65","TCP","54","50717  >  443 [ACK] Seq=288809 Ack=60207 Win=1040 Len=0"
"379","23.716594","104.244.42.65","192.168.0.183","TCP","1414","443  >  50717 [ACK] Seq=60207 Ack=288809 Win=7930 Len=1360 [TCP segment of a reassembled PDU]"
"380","23.716594","104.244.42.65","192.168.0.183","TCP","1414","443  >  50717 [ACK] Seq=61567 Ack=288809 Win=7930 Len=1360 [TCP segment of a reassembled PDU]"
"381","23.716594","104.244.42.65","192.168.0.183","TCP","1414","443  >  50717 [PSH, ACK] Seq=62927 Ack=288809 Win=7930 Len=1360 [TCP segment of a reassembled PDU]"
"382","23.716594","104.244.42.65","192.168.0.183","TCP","1414","443  >  50717 [ACK] Seq=64287 Ack=288809 Win=7930 Len=1360 [TCP segment of a reassembled PDU]"
"383","23.716594","104.244.42.65","192.168.0.183","TCP","1414","443  >  50717 [ACK] Seq=65647 Ack=288809 Win=7930 Len=1360 [TCP segment of a reassembled PDU]"
"384","23.716594","104.244.42.65","192.168.0.183","TLSv1.2","1138","Application Data"
"385","23.716642","192.168.0.183","104.244.42.65","TCP","54","50717  >  443 [ACK] Seq=288809 Ack=68091 Win=1041 Len=0"
"386","24.930825","192.168.0.183","104.244.42.65","TLSv1.2","262","Application Data"
"387","24.930945","192.168.0.183","104.244.42.65","TCP","1414","50717  >  443 [ACK] Seq=289017 Ack=68091 Win=1041 Len=1360 [TCP segment of a reassembled PDU]"
"388","24.930945","192.168.0.183","104.244.42.65","TCP","1414","50717  >  443 [ACK] Seq=290377 Ack=68091 Win=1041 Len=1360 [TCP segment of a reassembled PDU]"
"389","24.930945","192.168.0.183","104.244.42.65","TCP","1414","50717  >  443 [ACK] Seq=291737 Ack=68091 Win=1041 Len=1360 [TCP segment of a reassembled PDU]"
"390","24.930945","192.168.0.183","104.244.42.65","TCP","1414","50717  >  443 [ACK] Seq=293097 Ack=68091 Win=1041 Len=1360 [TCP segment of a reassembled PDU]"
"391","24.930945","192.168.0.183","104.244.42.65","TCP","1414","50717  >  443 [ACK] Seq=294457 Ack=68091 Win=1041 Len=1360 [TCP segment of a reassembled PDU]"
"392","24.930945","192.168.0.183","104.244.42.65","TCP","1414","50717  >  443 [ACK] Seq=295817 Ack=68091 Win=1041 Len=1360 [TCP segment of a reassembled PDU]"
"393","24.930945","192.168.0.183","104.244.42.65","TCP","1414","50717  >  443 [ACK] Seq=297177 Ack=68091 Win=1041 Len=1360 [TCP segment of a reassembled PDU]"
"394","24.930945","192.168.0.183","104.244.42.65","TCP","1414","50717  >  443 [ACK] Seq=298537 Ack=68091 Win=1041 Len=1360 [TCP segment of a reassembled PDU]"
"395","24.930945","192.168.0.183","104.244.42.65","TCP","1414","50717  >  443 [ACK] Seq=299897 Ack=68091 Win=1041 Len=1360 [TCP segment of a reassembled PDU]"
"396","24.930945","192.168.0.183","104.244.42.65","TCP","1414","50717  >  443 [ACK] Seq=301257 Ack=68091 Win=1041 Len=1360 [TCP segment of a reassembled PDU]"
"397","24.930945","192.168.0.183","104.244.42.65","TCP","1414","50717  >  443 [ACK] Seq=302617 Ack=68091 Win=1041 Len=1360 [TCP segment of a reassembled PDU]"
"398","24.930945","192.168.0.183","104.244.42.65","TCP","1414","50717  >  443 [ACK] Seq=303977 Ack=68091 Win=1041 Len=1360 [TCP segment of a reassembled PDU]"
"399","24.930945","192.168.0.183","104.244.42.65","TLSv1.2","140","Application Data"
"400","24.931073","192.168.0.183","104.244.42.65","TCP","1414","50717  >  443 [ACK] Seq=305423 Ack=68091 Win=1041 Len=1360 [TCP segment of a reassembled PDU]"
"401","24.931073","192.168.0.183","104.244.42.65","TCP","1414","50717  >  443 [ACK] Seq=306783 Ack=68091 Win=1041 Len=1360 [TCP segment of a reassembled PDU]"
"402","24.931073","192.168.0.183","104.244.42.65","TCP","1414","50717  >  443 [ACK] Seq=308143 Ack=68091 Win=1041 Len=1360 [TCP segment of a reassembled PDU]"
"403","24.931073","192.168.0.183","104.244.42.65","TCP","1414","50717  >  443 [ACK] Seq=309503 Ack=68091 Win=1041 Len=1360 [TCP segment of a reassembled PDU]"
"404","24.931073","192.168.0.183","104.244.42.65","TCP","1414","50717  >  443 [ACK] Seq=310863 Ack=68091 Win=1041 Len=1360 [TCP segment of a reassembled PDU]"
"405","24.931073","192.168.0.183","104.244.42.65","TCP","1414","50717  >  443 [ACK] Seq=312223 Ack=68091 Win=1041 Len=1360 [TCP segment of a reassembled PDU]"
"406","24.931073","192.168.0.183","104.244.42.65","TCP","1414","50717  >  443 [ACK] Seq=313583 Ack=68091 Win=1041 Len=1360 [TCP segment of a reassembled PDU]"
"407","24.931073","192.168.0.183","104.244.42.65","TCP","1414","50717  >  443 [ACK] Seq=314943 Ack=68091 Win=1041 Len=1360 [TCP segment of a reassembled PDU]"
"408","24.931073","192.168.0.183","104.244.42.65","TCP","1414","50717  >  443 [ACK] Seq=316303 Ack=68091 Win=1041 Len=1360 [TCP segment of a reassembled PDU]"
"409","24.931073","192.168.0.183","104.244.42.65","TCP","1414","50717  >  443 [ACK] Seq=317663 Ack=68091 Win=1041 Len=1360 [TCP segment of a reassembled PDU]"
"410","24.931073","192.168.0.183","104.244.42.65","TCP","1414","50717  >  443 [ACK] Seq=319023 Ack=68091 Win=1041 Len=1360 [TCP segment of a reassembled PDU]"
"411","24.931073","192.168.0.183","104.244.42.65","TCP","1414","50717  >  443 [ACK] Seq=320383 Ack=68091 Win=1041 Len=1360 [TCP segment of a reassembled PDU]"
"412","24.931073","192.168.0.183","104.244.42.65","TLSv1.2","140","Application Data"
"413","24.931208","192.168.0.183","104.244.42.65","TCP","1414","50717  >  443 [ACK] Seq=321829 Ack=68091 Win=1041 Len=1360 [TCP segment of a reassembled PDU]"
"414","24.931208","192.168.0.183","104.244.42.65","TCP","1414","50717  >  443 [ACK] Seq=323189 Ack=68091 Win=1041 Len=1360 [TCP segment of a reassembled PDU]"
"415","24.931208","192.168.0.183","104.244.42.65","TCP","1414","50717  >  443 [ACK] Seq=324549 Ack=68091 Win=1041 Len=1360 [TCP segment of a reassembled PDU]"
"416","24.931208","192.168.0.183","104.244.42.65","TCP","1414","50717  >  443 [ACK] Seq=325909 Ack=68091 Win=1041 Len=1360 [TCP segment of a reassembled PDU]"
"417","24.931208","192.168.0.183","104.244.42.65","TCP","1414","50717  >  443 [ACK] Seq=327269 Ack=68091 Win=1041 Len=1360 [TCP segment of a reassembled PDU]"
"418","24.931208","192.168.0.183","104.244.42.65","TCP","1414","50717  >  443 [ACK] Seq=328629 Ack=68091 Win=1041 Len=1360 [TCP segment of a reassembled PDU]"
"419","24.931208","192.168.0.183","104.244.42.65","TCP","1414","50717  >  443 [ACK] Seq=329989 Ack=68091 Win=1041 Len=1360 [TCP segment of a reassembled PDU]"
"420","24.931208","192.168.0.183","104.244.42.65","TCP","1414","50717  >  443 [ACK] Seq=331349 Ack=68091 Win=1041 Len=1360 [TCP segment of a reassembled PDU]"
"421","24.931208","192.168.0.183","104.244.42.65","TCP","1414","50717  >  443 [ACK] Seq=332709 Ack=68091 Win=1041 Len=1360 [TCP segment of a reassembled PDU]"
"422","24.931208","192.168.0.183","104.244.42.65","TLSv1.2","151","Application Data"
"423","24.968223","104.244.42.65","192.168.0.183","TCP","60","443  >  50717 [ACK] Seq=68091 Ack=290377 Win=7927 Len=0"
"424","24.974954","104.244.42.65","192.168.0.183","TCP","60","443  >  50717 [ACK] Seq=68091 Ack=308143 Win=7925 Len=0"
"425","24.974954","104.244.42.65","192.168.0.183","TLSv1.2","89","Application Data"
"426","24.974954","104.244.42.65","192.168.0.183","TCP","60","443  >  50717 [ACK] Seq=68126 Ack=334166 Win=7927 Len=0"
"427","24.974954","104.244.42.65","192.168.0.183","TLSv1.2","89","Application Data"
"428","24.974987","192.168.0.183","104.244.42.65","TCP","54","50717  >  443 [ACK] Seq=334166 Ack=68161 Win=1040 Len=0"
"429","25.030332","104.244.42.65","192.168.0.183","TLSv1.2","184","Application Data"
"430","25.078674","192.168.0.183","104.244.42.65","TCP","54","50717  >  443 [ACK] Seq=334166 Ack=68291 Win=1040 Len=0"
"431","28.269442","192.168.0.183","104.244.42.65","TLSv1.2","352","Application Data"
"432","28.269534","192.168.0.183","104.244.42.65","TCP","1414","50717  >  443 [ACK] Seq=334464 Ack=68291 Win=1040 Len=1360 [TCP segment of a reassembled PDU]"
"433","28.269534","192.168.0.183","104.244.42.65","TLSv1.2","85","Application Data"
"434","28.308259","104.244.42.65","192.168.0.183","TCP","60","443  >  50717 [ACK] Seq=68291 Ack=335855 Win=7926 Len=0"
"435","28.348234","104.244.42.65","192.168.0.183","TLSv1.2","185","Application Data"
"436","28.389643","192.168.0.183","104.244.42.65","TCP","54","50717  >  443 [ACK] Seq=335855 Ack=68422 Win=1039 Len=0"
"437","31.268031","192.168.0.183","104.244.42.65","TLSv1.2","240","Application Data"
"438","31.268283","192.168.0.183","104.244.42.65","TCP","1414","50717  >  443 [ACK] Seq=336041 Ack=68422 Win=1039 Len=1360 [TCP segment of a reassembled PDU]"
"439","31.268283","192.168.0.183","104.244.42.65","TCP","1414","50717  >  443 [ACK] Seq=337401 Ack=68422 Win=1039 Len=1360 [TCP segment of a reassembled PDU]"
"440","31.268283","192.168.0.183","104.244.42.65","TCP","1414","50717  >  443 [ACK] Seq=338761 Ack=68422 Win=1039 Len=1360 [TCP segment of a reassembled PDU]"
"441","31.268283","192.168.0.183","104.244.42.65","TCP","1414","50717  >  443 [ACK] Seq=340121 Ack=68422 Win=1039 Len=1360 [TCP segment of a reassembled PDU]"
"442","31.268283","192.168.0.183","104.244.42.65","TCP","1414","50717  >  443 [ACK] Seq=341481 Ack=68422 Win=1039 Len=1360 [TCP segment of a reassembled PDU]"
"443","31.268283","192.168.0.183","104.244.42.65","TCP","1414","50717  >  443 [ACK] Seq=342841 Ack=68422 Win=1039 Len=1360 [TCP segment of a reassembled PDU]"
"444","31.268283","192.168.0.183","104.244.42.65","TCP","1414","50717  >  443 [ACK] Seq=344201 Ack=68422 Win=1039 Len=1360 [TCP segment of a reassembled PDU]"
"445","31.268283","192.168.0.183","104.244.42.65","TCP","1414","50717  >  443 [ACK] Seq=345561 Ack=68422 Win=1039 Len=1360 [TCP segment of a reassembled PDU]"
"446","31.268283","192.168.0.183","104.244.42.65","TCP","1414","50717  >  443 [ACK] Seq=346921 Ack=68422 Win=1039 Len=1360 [TCP segment of a reassembled PDU]"
"447","31.268283","192.168.0.183","104.244.42.65","TCP","1414","50717  >  443 [ACK] Seq=348281 Ack=68422 Win=1039 Len=1360 [TCP segment of a reassembled PDU]"
"448","31.268283","192.168.0.183","104.244.42.65","TCP","1414","50717  >  443 [ACK] Seq=349641 Ack=68422 Win=1039 Len=1360 [TCP segment of a reassembled PDU]"
"449","31.268283","192.168.0.183","104.244.42.65","TCP","1414","50717  >  443 [ACK] Seq=351001 Ack=68422 Win=1039 Len=1360 [TCP segment of a reassembled PDU]"
"450","31.268283","192.168.0.183","104.244.42.65","TLSv1.2","140","Application Data"
"451","31.268500","192.168.0.183","104.244.42.65","TCP","1414","50717  >  443 [ACK] Seq=352447 Ack=68422 Win=1039 Len=1360 [TCP segment of a reassembled PDU]"
"452","31.268500","192.168.0.183","104.244.42.65","TCP","1414","50717  >  443 [ACK] Seq=353807 Ack=68422 Win=1039 Len=1360 [TCP segment of a reassembled PDU]"
"453","31.268500","192.168.0.183","104.244.42.65","TCP","1414","50717  >  443 [ACK] Seq=355167 Ack=68422 Win=1039 Len=1360 [TCP segment of a reassembled PDU]"
"454","31.268500","192.168.0.183","104.244.42.65","TCP","1414","50717  >  443 [ACK] Seq=356527 Ack=68422 Win=1039 Len=1360 [TCP segment of a reassembled PDU]"
"455","31.268500","192.168.0.183","104.244.42.65","TCP","1414","50717  >  443 [ACK] Seq=357887 Ack=68422 Win=1039 Len=1360 [TCP segment of a reassembled PDU]"
"456","31.268500","192.168.0.183","104.244.42.65","TCP","1414","50717  >  443 [ACK] Seq=359247 Ack=68422 Win=1039 Len=1360 [TCP segment of a reassembled PDU]"
"457","31.268500","192.168.0.183","104.244.42.65","TCP","1414","50717  >  443 [ACK] Seq=360607 Ack=68422 Win=1039 Len=1360 [TCP segment of a reassembled PDU]"
"458","31.268500","192.168.0.183","104.244.42.65","TCP","1414","50717  >  443 [ACK] Seq=361967 Ack=68422 Win=1039 Len=1360 [TCP segment of a reassembled PDU]"
"459","31.268500","192.168.0.183","104.244.42.65","TCP","1414","50717  >  443 [ACK] Seq=363327 Ack=68422 Win=1039 Len=1360 [TCP segment of a reassembled PDU]"
"460","31.268500","192.168.0.183","104.244.42.65","TCP","1414","50717  >  443 [ACK] Seq=364687 Ack=68422 Win=1039 Len=1360 [TCP segment of a reassembled PDU]"
"461","31.268500","192.168.0.183","104.244.42.65","TCP","1414","50717  >  443 [ACK] Seq=366047 Ack=68422 Win=1039 Len=1360 [TCP segment of a reassembled PDU]"
"462","31.268500","192.168.0.183","104.244.42.65","TCP","1414","50717  >  443 [ACK] Seq=367407 Ack=68422 Win=1039 Len=1360 [TCP segment of a reassembled PDU]"
"463","31.268500","192.168.0.183","104.244.42.65","TLSv1.2","140","Application Data"
"464","31.268692","192.168.0.183","104.244.42.65","TCP","1414","50717  >  443 [ACK] Seq=368853 Ack=68422 Win=1039 Len=1360 [TCP segment of a reassembled PDU]"
"465","31.268692","192.168.0.183","104.244.42.65","TCP","1414","50717  >  443 [ACK] Seq=370213 Ack=68422 Win=1039 Len=1360 [TCP segment of a reassembled PDU]"
"466","31.268692","192.168.0.183","104.244.42.65","TCP","1414","50717  >  443 [ACK] Seq=371573 Ack=68422 Win=1039 Len=1360 [TCP segment of a reassembled PDU]"
"467","31.268692","192.168.0.183","104.244.42.65","TCP","1414","50717  >  443 [ACK] Seq=372933 Ack=68422 Win=1039 Len=1360 [TCP segment of a reassembled PDU]"
"468","31.268692","192.168.0.183","104.244.42.65","TCP","1414","50717  >  443 [ACK] Seq=374293 Ack=68422 Win=1039 Len=1360 [TCP segment of a reassembled PDU]"
"469","31.268692","192.168.0.183","104.244.42.65","TCP","1414","50717  >  443 [ACK] Seq=375653 Ack=68422 Win=1039 Len=1360 [TCP segment of a reassembled PDU]"
"470","31.268692","192.168.0.183","104.244.42.65","TCP","1414","50717  >  443 [ACK] Seq=377013 Ack=68422 Win=1039 Len=1360 [TCP segment of a reassembled PDU]"
"471","31.268692","192.168.0.183","104.244.42.65","TCP","1414","50717  >  443 [ACK] Seq=378373 Ack=68422 Win=1039 Len=1360 [TCP segment of a reassembled PDU]"
"472","31.268692","192.168.0.183","104.244.42.65","TCP","1414","50717  >  443 [ACK] Seq=379733 Ack=68422 Win=1039 Len=1360 [TCP segment of a reassembled PDU]"
"473","31.268692","192.168.0.183","104.244.42.65","TCP","1414","50717  >  443 [ACK] Seq=381093 Ack=68422 Win=1039 Len=1360 [TCP segment of a reassembled PDU]"
"474","31.268692","192.168.0.183","104.244.42.65","TCP","1414","50717  >  443 [ACK] Seq=382453 Ack=68422 Win=1039 Len=1360 [TCP segment of a reassembled PDU]"
"475","31.268692","192.168.0.183","104.244.42.65","TCP","1414","50717  >  443 [ACK] Seq=383813 Ack=68422 Win=1039 Len=1360 [TCP segment of a reassembled PDU]"
"476","31.268692","192.168.0.183","104.244.42.65","TLSv1.2","140","Application Data"
"477","31.268816","192.168.0.183","104.244.42.65","TCP","1414","50717  >  443 [ACK] Seq=385259 Ack=68422 Win=1039 Len=1360 [TCP segment of a reassembled PDU]"
"478","31.268816","192.168.0.183","104.244.42.65","TCP","1414","50717  >  443 [ACK] Seq=386619 Ack=68422 Win=1039 Len=1360 [TCP segment of a reassembled PDU]"
"479","31.268816","192.168.0.183","104.244.42.65","TCP","1414","50717  >  443 [ACK] Seq=387979 Ack=68422 Win=1039 Len=1360 [TCP segment of a reassembled PDU]"
"480","31.268816","192.168.0.183","104.244.42.65","TCP","1414","50717  >  443 [ACK] Seq=389339 Ack=68422 Win=1039 Len=1360 [TCP segment of a reassembled PDU]"
"481","31.268816","192.168.0.183","104.244.42.65","TCP","1414","50717  >  443 [ACK] Seq=390699 Ack=68422 Win=1039 Len=1360 [TCP segment of a reassembled PDU]"
"482","31.268816","192.168.0.183","104.244.42.65","TCP","1414","50717  >  443 [ACK] Seq=392059 Ack=68422 Win=1039 Len=1360 [TCP segment of a reassembled PDU]"
"483","31.268816","192.168.0.183","104.244.42.65","TCP","1414","50717  >  443 [ACK] Seq=393419 Ack=68422 Win=1039 Len=1360 [TCP segment of a reassembled PDU]"
"484","31.268816","192.168.0.183","104.244.42.65","TCP","1414","50717  >  443 [ACK] Seq=394779 Ack=68422 Win=1039 Len=1360 [TCP segment of a reassembled PDU]"
"485","31.268816","192.168.0.183","104.244.42.65","TCP","1414","50717  >  443 [ACK] Seq=396139 Ack=68422 Win=1039 Len=1360 [TCP segment of a reassembled PDU]"
"486","31.268816","192.168.0.183","104.244.42.65","TCP","1414","50717  >  443 [ACK] Seq=397499 Ack=68422 Win=1039 Len=1360 [TCP segment of a reassembled PDU]"
"487","31.268816","192.168.0.183","104.244.42.65","TCP","1414","50717  >  443 [ACK] Seq=398859 Ack=68422 Win=1039 Len=1360 [TCP segment of a reassembled PDU]"
"488","31.268816","192.168.0.183","104.244.42.65","TCP","1414","50717  >  443 [ACK] Seq=400219 Ack=68422 Win=1039 Len=1360 [TCP segment of a reassembled PDU]"
"489","31.268816","192.168.0.183","104.244.42.65","TLSv1.2","140","Application Data"
"490","31.268925","192.168.0.183","104.244.42.65","TLSv1.2","121","Application Data"
"491","31.311733","104.244.42.65","192.168.0.183","TCP","60","443  >  50717 [ACK] Seq=68422 Ack=346921 Win=7930 Len=0"
"492","31.311733","104.244.42.65","192.168.0.183","TCP","60","443  >  50717 [ACK] Seq=68422 Ack=393419 Win=7873 Len=0"
"493","31.311733","104.244.42.65","192.168.0.183","TLSv1.2","89","Application Data"
"494","31.313561","104.244.42.65","192.168.0.183","TCP","60","443  >  50717 [ACK] Seq=68457 Ack=401732 Win=7915 Len=0"
"495","31.317494","192.168.0.183","104.244.42.65","TLSv1.2","1326","Application Data"
"496","31.394921","104.244.42.65","192.168.0.183","TCP","60","443  >  50717 [ACK] Seq=68457 Ack=403004 Win=7930 Len=0"
"497","31.402475","104.244.42.65","192.168.0.183","TLSv1.2","310","Application Data"
"498","31.445829","192.168.0.183","104.244.42.65","TCP","54","50717  >  443 [ACK] Seq=403004 Ack=68713 Win=1038 Len=0"
"499","34.384529","192.168.0.183","104.244.42.65","TLSv1.2","668","Application Data"
"500","34.384690","192.168.0.183","104.244.42.65","TCP","1414","50717  >  443 [ACK] Seq=403618 Ack=68713 Win=1038 Len=1360 [TCP segment of a reassembled PDU]"
"501","34.384690","192.168.0.183","104.244.42.65","TCP","1414","50717  >  443 [ACK] Seq=404978 Ack=68713 Win=1038 Len=1360 [TCP segment of a reassembled PDU]"
"502","34.384690","192.168.0.183","104.244.42.65","TCP","1414","50717  >  443 [ACK] Seq=406338 Ack=68713 Win=1038 Len=1360 [TCP segment of a reassembled PDU]"
"503","34.384690","192.168.0.183","104.244.42.65","TCP","1414","50717  >  443 [ACK] Seq=407698 Ack=68713 Win=1038 Len=1360 [TCP segment of a reassembled PDU]"
"504","34.384690","192.168.0.183","104.244.42.65","TCP","1414","50717  >  443 [ACK] Seq=409058 Ack=68713 Win=1038 Len=1360 [TCP segment of a reassembled PDU]"
"505","34.384690","192.168.0.183","104.244.42.65","TCP","1414","50717  >  443 [ACK] Seq=410418 Ack=68713 Win=1038 Len=1360 [TCP segment of a reassembled PDU]"
"506","34.384690","192.168.0.183","104.244.42.65","TCP","1414","50717  >  443 [ACK] Seq=411778 Ack=68713 Win=1038 Len=1360 [TCP segment of a reassembled PDU]"
"507","34.384690","192.168.0.183","104.244.42.65","TCP","1414","50717  >  443 [ACK] Seq=413138 Ack=68713 Win=1038 Len=1360 [TCP segment of a reassembled PDU]"
"508","34.384690","192.168.0.183","104.244.42.65","TCP","1414","50717  >  443 [ACK] Seq=414498 Ack=68713 Win=1038 Len=1360 [TCP segment of a reassembled PDU]"
"509","34.384690","192.168.0.183","104.244.42.65","TCP","1414","50717  >  443 [ACK] Seq=415858 Ack=68713 Win=1038 Len=1360 [TCP segment of a reassembled PDU]"
"510","34.384690","192.168.0.183","104.244.42.65","TCP","1414","50717  >  443 [ACK] Seq=417218 Ack=68713 Win=1038 Len=1360 [TCP segment of a reassembled PDU]"
"511","34.384690","192.168.0.183","104.244.42.65","TCP","1414","50717  >  443 [ACK] Seq=418578 Ack=68713 Win=1038 Len=1360 [TCP segment of a reassembled PDU]"
"512","34.384690","192.168.0.183","104.244.42.65","TLSv1.2","140","Application Data"
"513","34.384818","192.168.0.183","104.244.42.65","TCP","1414","50717  >  443 [ACK] Seq=420024 Ack=68713 Win=1038 Len=1360 [TCP segment of a reassembled PDU]"
"514","34.384818","192.168.0.183","104.244.42.65","TCP","1414","50717  >  443 [ACK] Seq=421384 Ack=68713 Win=1038 Len=1360 [TCP segment of a reassembled PDU]"
"515","34.384818","192.168.0.183","104.244.42.65","TCP","1414","50717  >  443 [ACK] Seq=422744 Ack=68713 Win=1038 Len=1360 [TCP segment of a reassembled PDU]"
"516","34.384818","192.168.0.183","104.244.42.65","TCP","1414","50717  >  443 [ACK] Seq=424104 Ack=68713 Win=1038 Len=1360 [TCP segment of a reassembled PDU]"
"517","34.384818","192.168.0.183","104.244.42.65","TCP","1414","50717  >  443 [ACK] Seq=425464 Ack=68713 Win=1038 Len=1360 [TCP segment of a reassembled PDU]"
"518","34.384818","192.168.0.183","104.244.42.65","TLSv1.2","1120","Application Data"
"519","34.421552","104.244.42.65","192.168.0.183","TCP","60","443  >  50717 [ACK] Seq=68713 Ack=404978 Win=7926 Len=0"
"520","34.428355","104.244.42.65","192.168.0.183","TCP","60","443  >  50717 [ACK] Seq=68713 Ack=427890 Win=7925 Len=0"
"521","34.462716","104.244.42.65","192.168.0.183","TLSv1.2","184","Application Data"
"522","34.505903","192.168.0.183","104.244.42.65","TCP","54","50717  >  443 [ACK] Seq=427890 Ack=68843 Win=1038 Len=0"
"523","34.539861","192.168.0.183","104.244.42.65","TCP","1414","50717  >  443 [ACK] Seq=427890 Ack=68843 Win=1038 Len=1360 [TCP segment of a reassembled PDU]"
"524","34.539861","192.168.0.183","104.244.42.65","TLSv1.2","528","Application Data"
"525","34.576074","104.244.42.65","192.168.0.183","TCP","60","443  >  50717 [ACK] Seq=68843 Ack=429724 Win=7926 Len=0"
"526","35.217346","104.244.42.65","192.168.0.183","TCP","1414","443  >  50717 [ACK] Seq=68843 Ack=429724 Win=7930 Len=1360 [TCP segment of a reassembled PDU]"
"527","35.217346","104.244.42.65","192.168.0.183","TCP","1414","443  >  50717 [ACK] Seq=70203 Ack=429724 Win=7930 Len=1360 [TCP segment of a reassembled PDU]"
"528","35.217346","104.244.42.65","192.168.0.183","TCP","1414","443  >  50717 [PSH, ACK] Seq=71563 Ack=429724 Win=7930 Len=1360 [TCP segment of a reassembled PDU]"
"529","35.217346","104.244.42.65","192.168.0.183","TCP","1414","443  >  50717 [ACK] Seq=72923 Ack=429724 Win=7930 Len=1360 [TCP segment of a reassembled PDU]"
"530","35.217346","104.244.42.65","192.168.0.183","TLSv1.2","648","Application Data"
"531","35.217395","192.168.0.183","104.244.42.65","TCP","54","50717  >  443 [ACK] Seq=429724 Ack=74877 Win=1041 Len=0"
"532","35.218747","192.168.0.183","104.244.42.65","TLSv1.2","89","Application Data"
"533","35.294807","104.244.42.65","192.168.0.183","TCP","60","443  >  50717 [ACK] Seq=74877 Ack=429759 Win=7930 Len=0"
"534","37.316426","192.168.0.183","104.244.42.65","TLSv1.2","594","Application Data"
"535","37.316563","192.168.0.183","104.244.42.65","TCP","1414","50717  >  443 [ACK] Seq=430299 Ack=74877 Win=1041 Len=1360 [TCP segment of a reassembled PDU]"
"536","37.316563","192.168.0.183","104.244.42.65","TCP","1414","50717  >  443 [ACK] Seq=431659 Ack=74877 Win=1041 Len=1360 [TCP segment of a reassembled PDU]"
"537","37.316563","192.168.0.183","104.244.42.65","TCP","1414","50717  >  443 [ACK] Seq=433019 Ack=74877 Win=1041 Len=1360 [TCP segment of a reassembled PDU]"
"538","37.316563","192.168.0.183","104.244.42.65","TCP","1414","50717  >  443 [ACK] Seq=434379 Ack=74877 Win=1041 Len=1360 [TCP segment of a reassembled PDU]"
"539","37.316563","192.168.0.183","104.244.42.65","TCP","1414","50717  >  443 [ACK] Seq=435739 Ack=74877 Win=1041 Len=1360 [TCP segment of a reassembled PDU]"
"540","37.316563","192.168.0.183","104.244.42.65","TCP","1414","50717  >  443 [ACK] Seq=437099 Ack=74877 Win=1041 Len=1360 [TCP segment of a reassembled PDU]"
"541","37.316563","192.168.0.183","104.244.42.65","TCP","1414","50717  >  443 [ACK] Seq=438459 Ack=74877 Win=1041 Len=1360 [TCP segment of a reassembled PDU]"
"542","37.316563","192.168.0.183","104.244.42.65","TCP","1414","50717  >  443 [ACK] Seq=439819 Ack=74877 Win=1041 Len=1360 [TCP segment of a reassembled PDU]"
"543","37.316563","192.168.0.183","104.244.42.65","TCP","1414","50717  >  443 [ACK] Seq=441179 Ack=74877 Win=1041 Len=1360 [TCP segment of a reassembled PDU]"
"544","37.316563","192.168.0.183","104.244.42.65","TCP","1414","50717  >  443 [ACK] Seq=442539 Ack=74877 Win=1041 Len=1360 [TCP segment of a reassembled PDU]"
"545","37.316563","192.168.0.183","104.244.42.65","TCP","1414","50717  >  443 [ACK] Seq=443899 Ack=74877 Win=1041 Len=1360 [TCP segment of a reassembled PDU]"
"546","37.316563","192.168.0.183","104.244.42.65","TCP","1414","50717  >  443 [ACK] Seq=445259 Ack=74877 Win=1041 Len=1360 [TCP segment of a reassembled PDU]"
"547","37.316563","192.168.0.183","104.244.42.65","TLSv1.2","140","Application Data"
"548","37.316697","192.168.0.183","104.244.42.65","TCP","1414","50717  >  443 [ACK] Seq=446705 Ack=74877 Win=1041 Len=1360 [TCP segment of a reassembled PDU]"
"549","37.316697","192.168.0.183","104.244.42.65","TCP","1414","50717  >  443 [ACK] Seq=448065 Ack=74877 Win=1041 Len=1360 [TCP segment of a reassembled PDU]"
"550","37.316697","192.168.0.183","104.244.42.65","TCP","1414","50717  >  443 [ACK] Seq=449425 Ack=74877 Win=1041 Len=1360 [TCP segment of a reassembled PDU]"
"551","37.316697","192.168.0.183","104.244.42.65","TCP","1414","50717  >  443 [ACK] Seq=450785 Ack=74877 Win=1041 Len=1360 [TCP segment of a reassembled PDU]"
"552","37.316697","192.168.0.183","104.244.42.65","TCP","1414","50717  >  443 [ACK] Seq=452145 Ack=74877 Win=1041 Len=1360 [TCP segment of a reassembled PDU]"
"553","37.316697","192.168.0.183","104.244.42.65","TCP","1414","50717  >  443 [ACK] Seq=453505 Ack=74877 Win=1041 Len=1360 [TCP segment of a reassembled PDU]"
"554","37.316697","192.168.0.183","104.244.42.65","TCP","1414","50717  >  443 [ACK] Seq=454865 Ack=74877 Win=1041 Len=1360 [TCP segment of a reassembled PDU]"
"555","37.316697","192.168.0.183","104.244.42.65","TCP","1414","50717  >  443 [ACK] Seq=456225 Ack=74877 Win=1041 Len=1360 [TCP segment of a reassembled PDU]"
"556","37.316697","192.168.0.183","104.244.42.65","TCP","1414","50717  >  443 [ACK] Seq=457585 Ack=74877 Win=1041 Len=1360 [TCP segment of a reassembled PDU]"
"557","37.316697","192.168.0.183","104.244.42.65","TCP","1414","50717  >  443 [ACK] Seq=458945 Ack=74877 Win=1041 Len=1360 [TCP segment of a reassembled PDU]"
"558","37.316697","192.168.0.183","104.244.42.65","TCP","1414","50717  >  443 [ACK] Seq=460305 Ack=74877 Win=1041 Len=1360 [TCP segment of a reassembled PDU]"
"559","37.316697","192.168.0.183","104.244.42.65","TCP","1414","50717  >  443 [ACK] Seq=461665 Ack=74877 Win=1041 Len=1360 [TCP segment of a reassembled PDU]"
"560","37.316697","192.168.0.183","104.244.42.65","TLSv1.2","140","Application Data"
"561","37.316814","192.168.0.183","104.244.42.65","TCP","1414","50717  >  443 [ACK] Seq=463111 Ack=74877 Win=1041 Len=1360 [TCP segment of a reassembled PDU]"
"562","37.316814","192.168.0.183","104.244.42.65","TCP","1414","50717  >  443 [ACK] Seq=464471 Ack=74877 Win=1041 Len=1360 [TCP segment of a reassembled PDU]"
"563","37.316814","192.168.0.183","104.244.42.65","TCP","1414","50717  >  443 [ACK] Seq=465831 Ack=74877 Win=1041 Len=1360 [TCP segment of a reassembled PDU]"
"564","37.316814","192.168.0.183","104.244.42.65","TCP","1414","50717  >  443 [ACK] Seq=467191 Ack=74877 Win=1041 Len=1360 [TCP segment of a reassembled PDU]"
"565","37.316814","192.168.0.183","104.244.42.65","TCP","1414","50717  >  443 [ACK] Seq=468551 Ack=74877 Win=1041 Len=1360 [TCP segment of a reassembled PDU]"
"566","37.316814","192.168.0.183","104.244.42.65","TCP","1414","50717  >  443 [ACK] Seq=469911 Ack=74877 Win=1041 Len=1360 [TCP segment of a reassembled PDU]"
"567","37.316814","192.168.0.183","104.244.42.65","TCP","1414","50717  >  443 [ACK] Seq=471271 Ack=74877 Win=1041 Len=1360 [TCP segment of a reassembled PDU]"
"568","37.316814","192.168.0.183","104.244.42.65","TCP","1414","50717  >  443 [ACK] Seq=472631 Ack=74877 Win=1041 Len=1360 [TCP segment of a reassembled PDU]"
"569","37.316814","192.168.0.183","104.244.42.65","TCP","1414","50717  >  443 [ACK] Seq=473991 Ack=74877 Win=1041 Len=1360 [TCP segment of a reassembled PDU]"
"570","37.316814","192.168.0.183","104.244.42.65","TCP","1414","50717  >  443 [ACK] Seq=475351 Ack=74877 Win=1041 Len=1360 [TCP segment of a reassembled PDU]"
"571","37.316814","192.168.0.183","104.244.42.65","TCP","1414","50717  >  443 [ACK] Seq=476711 Ack=74877 Win=1041 Len=1360 [TCP segment of a reassembled PDU]"
"572","37.316814","192.168.0.183","104.244.42.65","TCP","1414","50717  >  443 [ACK] Seq=478071 Ack=74877 Win=1041 Len=1360 [TCP segment of a reassembled PDU]"
"573","37.316814","192.168.0.183","104.244.42.65","TLSv1.2","140","Application Data"
"574","37.316932","192.168.0.183","104.244.42.65","TCP","1414","50717  >  443 [ACK] Seq=479517 Ack=74877 Win=1041 Len=1360 [TCP segment of a reassembled PDU]"
"575","37.316932","192.168.0.183","104.244.42.65","TCP","1414","50717  >  443 [ACK] Seq=480877 Ack=74877 Win=1041 Len=1360 [TCP segment of a reassembled PDU]"
"576","37.316932","192.168.0.183","104.244.42.65","TCP","1414","50717  >  443 [ACK] Seq=482237 Ack=74877 Win=1041 Len=1360 [TCP segment of a reassembled PDU]"
"577","37.316932","192.168.0.183","104.244.42.65","TCP","1414","50717  >  443 [ACK] Seq=483597 Ack=74877 Win=1041 Len=1360 [TCP segment of a reassembled PDU]"
"578","37.316932","192.168.0.183","104.244.42.65","TCP","1414","50717  >  443 [ACK] Seq=484957 Ack=74877 Win=1041 Len=1360 [TCP segment of a reassembled PDU]"
"579","37.316932","192.168.0.183","104.244.42.65","TCP","1414","50717  >  443 [ACK] Seq=486317 Ack=74877 Win=1041 Len=1360 [TCP segment of a reassembled PDU]"
"580","37.316932","192.168.0.183","104.244.42.65","TCP","1414","50717  >  443 [ACK] Seq=487677 Ack=74877 Win=1041 Len=1360 [TCP segment of a reassembled PDU]"
"581","37.316932","192.168.0.183","104.244.42.65","TCP","1414","50717  >  443 [ACK] Seq=489037 Ack=74877 Win=1041 Len=1360 [TCP segment of a reassembled PDU]"
"582","37.316932","192.168.0.183","104.244.42.65","TCP","1414","50717  >  443 [ACK] Seq=490397 Ack=74877 Win=1041 Len=1360 [TCP segment of a reassembled PDU]"
"583","37.316932","192.168.0.183","104.244.42.65","TCP","1414","50717  >  443 [ACK] Seq=491757 Ack=74877 Win=1041 Len=1360 [TCP segment of a reassembled PDU]"
"584","37.316932","192.168.0.183","104.244.42.65","TCP","1414","50717  >  443 [ACK] Seq=493117 Ack=74877 Win=1041 Len=1360 [TCP segment of a reassembled PDU]"
"585","37.316932","192.168.0.183","104.244.42.65","TCP","1414","50717  >  443 [ACK] Seq=494477 Ack=74877 Win=1041 Len=1360 [TCP segment of a reassembled PDU]"
"586","37.316932","192.168.0.183","104.244.42.65","TLSv1.2","140","Application Data"
"587","37.317049","192.168.0.183","104.244.42.65","TLSv1.2","121","Application Data"
"588","37.352612","104.244.42.65","192.168.0.183","TCP","60","443  >  50717 [ACK] Seq=74877 Ack=434379 Win=7928 Len=0"
"589","37.358926","104.244.42.65","192.168.0.183","TCP","60","443  >  50717 [ACK] Seq=74877 Ack=484957 Win=7928 Len=0"
"590","37.358926","104.244.42.65","192.168.0.183","TLSv1.2","89","Application Data"
"591","37.359099","104.244.42.65","192.168.0.183","TCP","60","443  >  50717 [ACK] Seq=74912 Ack=495990 Win=7915 Len=0"
"592","37.359289","192.168.0.183","104.244.42.65","TCP","1414","50717  >  443 [ACK] Seq=495990 Ack=74912 Win=1041 Len=1360 [TCP segment of a reassembled PDU]"
"593","37.359289","192.168.0.183","104.244.42.65","TCP","1414","50717  >  443 [ACK] Seq=497350 Ack=74912 Win=1041 Len=1360 [TCP segment of a reassembled PDU]"
"594","37.359289","192.168.0.183","104.244.42.65","TCP","1414","50717  >  443 [ACK] Seq=498710 Ack=74912 Win=1041 Len=1360 [TCP segment of a reassembled PDU]"
"595","37.359289","192.168.0.183","104.244.42.65","TCP","1414","50717  >  443 [ACK] Seq=500070 Ack=74912 Win=1041 Len=1360 [TCP segment of a reassembled PDU]"
"596","37.359289","192.168.0.183","104.244.42.65","TCP","1414","50717  >  443 [ACK] Seq=501430 Ack=74912 Win=1041 Len=1360 [TCP segment of a reassembled PDU]"
"597","37.359289","192.168.0.183","104.244.42.65","TCP","1414","50717  >  443 [ACK] Seq=502790 Ack=74912 Win=1041 Len=1360 [TCP segment of a reassembled PDU]"
"598","37.359289","192.168.0.183","104.244.42.65","TCP","1414","50717  >  443 [ACK] Seq=504150 Ack=74912 Win=1041 Len=1360 [TCP segment of a reassembled PDU]"
"599","37.359289","192.168.0.183","104.244.42.65","TCP","1414","50717  >  443 [ACK] Seq=505510 Ack=74912 Win=1041 Len=1360 [TCP segment of a reassembled PDU]"
"600","37.359289","192.168.0.183","104.244.42.65","TCP","1414","50717  >  443 [ACK] Seq=506870 Ack=74912 Win=1041 Len=1360 [TCP segment of a reassembled PDU]"
"601","37.359289","192.168.0.183","104.244.42.65","TCP","1414","50717  >  443 [ACK] Seq=508230 Ack=74912 Win=1041 Len=1360 [TCP segment of a reassembled PDU]"
"602","37.359289","192.168.0.183","104.244.42.65","TCP","1414","50717  >  443 [ACK] Seq=509590 Ack=74912 Win=1041 Len=1360 [TCP segment of a reassembled PDU]"
"603","37.359289","192.168.0.183","104.244.42.65","TCP","1414","50717  >  443 [ACK] Seq=510950 Ack=74912 Win=1041 Len=1360 [TCP segment of a reassembled PDU]"
"604","37.359289","192.168.0.183","104.244.42.65","TLSv1.2","104","Application Data"
"605","37.359525","192.168.0.183","104.244.42.65","TCP","1414","50717  >  443 [ACK] Seq=512360 Ack=74912 Win=1041 Len=1360 [TCP segment of a reassembled PDU]"
"606","37.359525","192.168.0.183","104.244.42.65","TLSv1.2","72","Application Data"
"607","37.398008","104.244.42.65","192.168.0.183","TCP","60","443  >  50717 [ACK] Seq=74912 Ack=498710 Win=7925 Len=0"
"608","37.406918","104.244.42.65","192.168.0.183","TCP","60","443  >  50717 [ACK] Seq=74912 Ack=513738 Win=7901 Len=0"
"609","37.406918","104.244.42.65","192.168.0.183","TLSv1.2","89","Application Data"
"610","37.462082","104.244.42.65","192.168.0.183","TLSv1.2","184","Application Data"
"611","37.462118","192.168.0.183","104.244.42.65","TCP","54","50717  >  443 [ACK] Seq=513738 Ack=75077 Win=1040 Len=0"
"612","37.846950","192.168.0.183","104.244.42.65","TCP","1414","50717  >  443 [ACK] Seq=513738 Ack=75077 Win=1040 Len=1360 [TCP segment of a reassembled PDU]"
"613","37.846950","192.168.0.183","104.244.42.65","TLSv1.2","796","Application Data"
"614","37.884322","104.244.42.65","192.168.0.183","TCP","60","443  >  50717 [ACK] Seq=75077 Ack=515840 Win=7926 Len=0"
"615","38.591369","104.244.42.65","192.168.0.183","TCP","1414","443  >  50717 [ACK] Seq=75077 Ack=515840 Win=7930 Len=1360 [TCP segment of a reassembled PDU]"
"616","38.591369","104.244.42.65","192.168.0.183","TCP","1414","443  >  50717 [ACK] Seq=76437 Ack=515840 Win=7930 Len=1360 [TCP segment of a reassembled PDU]"
"617","38.591369","104.244.42.65","192.168.0.183","TCP","1414","443  >  50717 [PSH, ACK] Seq=77797 Ack=515840 Win=7930 Len=1360 [TCP segment of a reassembled PDU]"
"618","38.591369","104.244.42.65","192.168.0.183","TCP","1414","443  >  50717 [ACK] Seq=79157 Ack=515840 Win=7930 Len=1360 [TCP segment of a reassembled PDU]"
"619","38.591369","104.244.42.65","192.168.0.183","TCP","1414","443  >  50717 [ACK] Seq=80517 Ack=515840 Win=7930 Len=1360 [TCP segment of a reassembled PDU]"
"620","38.591369","104.244.42.65","192.168.0.183","TCP","1414","443  >  50717 [PSH, ACK] Seq=81877 Ack=515840 Win=7930 Len=1360 [TCP segment of a reassembled PDU]"
"621","38.591369","104.244.42.65","192.168.0.183","TLSv1.2","1167","Application Data"
"622","38.591418","192.168.0.183","104.244.42.65","TCP","54","50717  >  443 [ACK] Seq=515840 Ack=84350 Win=1041 Len=0"
"623","40.325462","192.168.0.183","104.244.42.65","TLSv1.2","266","Application Data"
"624","40.325637","192.168.0.183","104.244.42.65","TCP","1414","50717  >  443 [ACK] Seq=516052 Ack=84350 Win=1041 Len=1360 [TCP segment of a reassembled PDU]"
"625","40.325637","192.168.0.183","104.244.42.65","TCP","1414","50717  >  443 [ACK] Seq=517412 Ack=84350 Win=1041 Len=1360 [TCP segment of a reassembled PDU]"
"626","40.325637","192.168.0.183","104.244.42.65","TCP","1414","50717  >  443 [ACK] Seq=518772 Ack=84350 Win=1041 Len=1360 [TCP segment of a reassembled PDU]"
"627","40.325637","192.168.0.183","104.244.42.65","TCP","1414","50717  >  443 [ACK] Seq=520132 Ack=84350 Win=1041 Len=1360 [TCP segment of a reassembled PDU]"
"628","40.325637","192.168.0.183","104.244.42.65","TCP","1414","50717  >  443 [ACK] Seq=521492 Ack=84350 Win=1041 Len=1360 [TCP segment of a reassembled PDU]"
"629","40.325637","192.168.0.183","104.244.42.65","TCP","1414","50717  >  443 [ACK] Seq=522852 Ack=84350 Win=1041 Len=1360 [TCP segment of a reassembled PDU]"
"630","40.325637","192.168.0.183","104.244.42.65","TCP","1414","50717  >  443 [ACK] Seq=524212 Ack=84350 Win=1041 Len=1360 [TCP segment of a reassembled PDU]"
"631","40.325637","192.168.0.183","104.244.42.65","TCP","1414","50717  >  443 [ACK] Seq=525572 Ack=84350 Win=1041 Len=1360 [TCP segment of a reassembled PDU]"
"632","40.325637","192.168.0.183","104.244.42.65","TCP","1414","50717  >  443 [ACK] Seq=526932 Ack=84350 Win=1041 Len=1360 [TCP segment of a reassembled PDU]"
"633","40.325637","192.168.0.183","104.244.42.65","TCP","1414","50717  >  443 [ACK] Seq=528292 Ack=84350 Win=1041 Len=1360 [TCP segment of a reassembled PDU]"
"634","40.325637","192.168.0.183","104.244.42.65","TCP","1414","50717  >  443 [ACK] Seq=529652 Ack=84350 Win=1041 Len=1360 [TCP segment of a reassembled PDU]"
"635","40.325637","192.168.0.183","104.244.42.65","TCP","1414","50717  >  443 [ACK] Seq=531012 Ack=84350 Win=1041 Len=1360 [TCP segment of a reassembled PDU]"
"636","40.325637","192.168.0.183","104.244.42.65","TLSv1.2","140","Application Data"
"637","40.325824","192.168.0.183","104.244.42.65","TCP","1414","50717  >  443 [ACK] Seq=532458 Ack=84350 Win=1041 Len=1360 [TCP segment of a reassembled PDU]"
"638","40.325824","192.168.0.183","104.244.42.65","TCP","1414","50717  >  443 [ACK] Seq=533818 Ack=84350 Win=1041 Len=1360 [TCP segment of a reassembled PDU]"
"639","40.325824","192.168.0.183","104.244.42.65","TCP","1414","50717  >  443 [ACK] Seq=535178 Ack=84350 Win=1041 Len=1360 [TCP segment of a reassembled PDU]"
"640","40.325824","192.168.0.183","104.244.42.65","TCP","1414","50717  >  443 [ACK] Seq=536538 Ack=84350 Win=1041 Len=1360 [TCP segment of a reassembled PDU]"
"641","40.325824","192.168.0.183","104.244.42.65","TCP","1414","50717  >  443 [ACK] Seq=537898 Ack=84350 Win=1041 Len=1360 [TCP segment of a reassembled PDU]"
"642","40.325824","192.168.0.183","104.244.42.65","TCP","1414","50717  >  443 [ACK] Seq=539258 Ack=84350 Win=1041 Len=1360 [TCP segment of a reassembled PDU]"
"643","40.325824","192.168.0.183","104.244.42.65","TCP","1414","50717  >  443 [ACK] Seq=540618 Ack=84350 Win=1041 Len=1360 [TCP segment of a reassembled PDU]"
"644","40.325824","192.168.0.183","104.244.42.65","TCP","1414","50717  >  443 [ACK] Seq=541978 Ack=84350 Win=1041 Len=1360 [TCP segment of a reassembled PDU]"
"645","40.325824","192.168.0.183","104.244.42.65","TCP","1414","50717  >  443 [ACK] Seq=543338 Ack=84350 Win=1041 Len=1360 [TCP segment of a reassembled PDU]"
"646","40.325824","192.168.0.183","104.244.42.65","TCP","1414","50717  >  443 [ACK] Seq=544698 Ack=84350 Win=1041 Len=1360 [TCP segment of a reassembled PDU]"
"647","40.325824","192.168.0.183","104.244.42.65","TCP","1414","50717  >  443 [ACK] Seq=546058 Ack=84350 Win=1041 Len=1360 [TCP segment of a reassembled PDU]"
"648","40.325824","192.168.0.183","104.244.42.65","TCP","1414","50717  >  443 [ACK] Seq=547418 Ack=84350 Win=1041 Len=1360 [TCP segment of a reassembled PDU]"
"649","40.325824","192.168.0.183","104.244.42.65","TLSv1.2","140","Application Data"
"650","40.325961","192.168.0.183","104.244.42.65","TCP","1414","50717  >  443 [ACK] Seq=548864 Ack=84350 Win=1041 Len=1360 [TCP segment of a reassembled PDU]"
"651","40.325961","192.168.0.183","104.244.42.65","TCP","1414","50717  >  443 [ACK] Seq=550224 Ack=84350 Win=1041 Len=1360 [TCP segment of a reassembled PDU]"
"652","40.325961","192.168.0.183","104.244.42.65","TCP","1414","50717  >  443 [ACK] Seq=551584 Ack=84350 Win=1041 Len=1360 [TCP segment of a reassembled PDU]"
"653","40.325961","192.168.0.183","104.244.42.65","TCP","1414","50717  >  443 [ACK] Seq=552944 Ack=84350 Win=1041 Len=1360 [TCP segment of a reassembled PDU]"
"654","40.325961","192.168.0.183","104.244.42.65","TCP","1414","50717  >  443 [ACK] Seq=554304 Ack=84350 Win=1041 Len=1360 [TCP segment of a reassembled PDU]"
"655","40.325961","192.168.0.183","104.244.42.65","TCP","1414","50717  >  443 [ACK] Seq=555664 Ack=84350 Win=1041 Len=1360 [TCP segment of a reassembled PDU]"
"656","40.325961","192.168.0.183","104.244.42.65","TCP","1414","50717  >  443 [ACK] Seq=557024 Ack=84350 Win=1041 Len=1360 [TCP segment of a reassembled PDU]"
"657","40.325961","192.168.0.183","104.244.42.65","TCP","1414","50717  >  443 [ACK] Seq=558384 Ack=84350 Win=1041 Len=1360 [TCP segment of a reassembled PDU]"
"658","40.325961","192.168.0.183","104.244.42.65","TCP","1414","50717  >  443 [ACK] Seq=559744 Ack=84350 Win=1041 Len=1360 [TCP segment of a reassembled PDU]"
"659","40.325961","192.168.0.183","104.244.42.65","TCP","1414","50717  >  443 [ACK] Seq=561104 Ack=84350 Win=1041 Len=1360 [TCP segment of a reassembled PDU]"
"660","40.325961","192.168.0.183","104.244.42.65","TCP","1414","50717  >  443 [ACK] Seq=562464 Ack=84350 Win=1041 Len=1360 [TCP segment of a reassembled PDU]"
"661","40.325961","192.168.0.183","104.244.42.65","TCP","1414","50717  >  443 [ACK] Seq=563824 Ack=84350 Win=1041 Len=1360 [TCP segment of a reassembled PDU]"
"662","40.325961","192.168.0.183","104.244.42.65","TLSv1.2","140","Application Data"
"663","40.326087","192.168.0.183","104.244.42.65","TCP","1414","50717  >  443 [ACK] Seq=565270 Ack=84350 Win=1041 Len=1360 [TCP segment of a reassembled PDU]"
"664","40.326087","192.168.0.183","104.244.42.65","TCP","1414","50717  >  443 [ACK] Seq=566630 Ack=84350 Win=1041 Len=1360 [TCP segment of a reassembled PDU]"
"665","40.326087","192.168.0.183","104.244.42.65","TCP","1414","50717  >  443 [ACK] Seq=567990 Ack=84350 Win=1041 Len=1360 [TCP segment of a reassembled PDU]"
"666","40.326087","192.168.0.183","104.244.42.65","TLSv1.2","147","Application Data"
"667","40.364133","104.244.42.65","192.168.0.183","TCP","60","443  >  50717 [ACK] Seq=84350 Ack=517412 Win=7927 Len=0"
"668","40.365466","104.244.42.65","192.168.0.183","TCP","60","443  >  50717 [ACK] Seq=84350 Ack=520132 Win=7930 Len=0"
"669","40.369786","104.244.42.65","192.168.0.183","TCP","60","443  >  50717 [ACK] Seq=84350 Ack=567990 Win=7898 Len=0"
"670","40.369786","104.244.42.65","192.168.0.183","TLSv1.2","89","Application Data"
"671","40.369786","104.244.42.65","192.168.0.183","TCP","60","443  >  50717 [ACK] Seq=84385 Ack=569443 Win=7930 Len=0"
"672","40.416885","104.244.42.65","192.168.0.183","TLSv1.2","182","Application Data"
"673","40.416918","192.168.0.183","104.244.42.65","TCP","54","50717  >  443 [ACK] Seq=569443 Ack=84513 Win=1040 Len=0"
