"No.","Time","Source","Destination","Protocol","Length","Info"
"1","0.000000","192.168.0.183","104.244.42.65","TLSv1.2","684","Application Data"
"2","0.000098","192.168.0.183","104.244.42.65","TLSv1.2","93","Application Data"
"3","0.000167","192.168.0.183","104.244.42.65","TCP","1414","50717  >  443 [ACK] Seq=670 Ack=1 Win=1037 Len=1360 [TCP segment of a reassembled PDU]"
"4","0.000167","192.168.0.183","104.244.42.65","TLSv1.2","587","Application Data"
"5","0.036704","104.244.42.65","192.168.0.183","TCP","60","443  >  50717 [ACK] Seq=1 Ack=670 Win=5735 Len=0"
"6","0.036704","104.244.42.65","192.168.0.183","TLSv1.2","93","Application Data"
"7","0.042521","104.244.42.65","192.168.0.183","TCP","60","443  >  50717 [ACK] Seq=40 Ack=2563 Win=5730 Len=0"
"8","0.062698","104.244.42.65","192.168.0.183","TLSv1.2","180","Application Data"
"9","0.062740","192.168.0.183","104.244.42.65","TCP","54","50717  >  443 [ACK] Seq=2563 Ack=166 Win=1036 Len=0"
"10","1.022025","192.168.0.183","104.244.42.65","TLSv1.2","698","Application Data"
"11","1.022114","192.168.0.183","104.244.42.65","TLSv1.2","243","Application Data"
"12","1.058586","104.244.42.65","192.168.0.183","TCP","60","443  >  50717 [ACK] Seq=166 Ack=3396 Win=5735 Len=0"
"13","1.086738","104.244.42.65","192.168.0.183","TLSv1.2","197","Application Data"
"14","1.132356","192.168.0.183","104.244.42.65","TCP","54","50717  >  443 [ACK] Seq=3396 Ack=309 Win=1036 Len=0"
"15","3.000941","192.168.0.183","104.244.42.65","TLSv1.2","286","Application Data"
"16","3.001039","192.168.0.183","104.244.42.65","TCP","1414","50717  >  443 [ACK] Seq=3628 Ack=309 Win=1036 Len=1360 [TCP segment of a reassembled PDU]"
"17","3.001039","192.168.0.183","104.244.42.65","TCP","1414","50717  >  443 [ACK] Seq=4988 Ack=309 Win=1036 Len=1360 [TCP segment of a reassembled PDU]"
"18","3.001039","192.168.0.183","104.244.42.65","TCP","1414","50717  >  443 [ACK] Seq=6348 Ack=309 Win=1036 Len=1360 [TCP segment of a reassembled PDU]"
"19","3.001039","192.168.0.183","104.244.42.65","TLSv1.2","821","Application Data"
"20","3.045266","104.244.42.65","192.168.0.183","TCP","60","443  >  50717 [ACK] Seq=309 Ack=8475 Win=5735 Len=0"
"21","3.069989","104.244.42.65","192.168.0.183","TLSv1.2","184","Application Data"
"22","3.119815","192.168.0.183","104.244.42.65","TCP","54","50717  >  443 [ACK] Seq=8475 Ack=439 Win=1041 Len=0"
"23","3.372420","192.168.0.183","104.244.42.65","TCP","1414","50717  >  443 [ACK] Seq=8475 Ack=439 Win=1041 Len=1360 [TCP segment of a reassembled PDU]"
"24","3.372420","192.168.0.183","104.244.42.65","TLSv1.2","454","Application Data"
"25","3.372616","192.168.0.183","104.244.42.65","TLSv1.2","271","Application Data"
"26","3.408383","104.244.42.65","192.168.0.183","TCP","60","443  >  50717 [ACK] Seq=439 Ack=10452 Win=5729 Len=0"
"27","3.700238","104.244.42.65","192.168.0.183","TLSv1.2","187","Application Data"
"28","3.752560","192.168.0.183","104.244.42.65","TCP","54","50717  >  443 [ACK] Seq=10452 Ack=572 Win=1040 Len=0"
"29","4.190597","104.244.42.65","192.168.0.183","TCP","1414","443  >  50717 [ACK] Seq=572 Ack=10452 Win=5735 Len=1360 [TCP segment of a reassembled PDU]"
"30","4.190597","104.244.42.65","192.168.0.183","TCP","1414","443  >  50717 [PSH, ACK] Seq=1932 Ack=10452 Win=5735 Len=1360 [TCP segment of a reassembled PDU]"
"31","4.190597","104.244.42.65","192.168.0.183","TCP","1414","443  >  50717 [ACK] Seq=3292 Ack=10452 Win=5735 Len=1360 [TCP segment of a reassembled PDU]"
"32","4.190597","104.244.42.65","192.168.0.183","TCP","1414","443  >  50717 [PSH, ACK] Seq=4652 Ack=10452 Win=5735 Len=1360 [TCP segment of a reassembled PDU]"
"33","4.190597","104.244.42.65","192.168.0.183","TCP","1414","443  >  50717 [ACK] Seq=6012 Ack=10452 Win=5735 Len=1360 [TCP segment of a reassembled PDU]"
"34","4.190597","104.244.42.65","192.168.0.183","TCP","1414","443  >  50717 [PSH, ACK] Seq=7372 Ack=10452 Win=5735 Len=1360 [TCP segment of a reassembled PDU]"
"35","4.190597","104.244.42.65","192.168.0.183","TCP","1414","443  >  50717 [ACK] Seq=8732 Ack=10452 Win=5735 Len=1360 [TCP segment of a reassembled PDU]"
"36","4.190597","104.244.42.65","192.168.0.183","TLSv1.2","252","Application Data"
"37","4.190657","192.168.0.183","104.244.42.65","TCP","54","50717  >  443 [ACK] Seq=10452 Ack=10290 Win=1041 Len=0"
"38","4.191495","192.168.0.183","104.244.42.65","TLSv1.2","89","Application Data"
"39","4.273367","104.244.42.65","192.168.0.183","TCP","60","443  >  50717 [ACK] Seq=10290 Ack=10487 Win=5735 Len=0"
"40","6.156615","192.168.0.183","104.244.42.65","TLSv1.2","236","Application Data"
"41","6.156774","192.168.0.183","104.244.42.65","TCP","1414","50717  >  443 [ACK] Seq=10669 Ack=10290 Win=1041 Len=1360 [TCP segment of a reassembled PDU]"
"42","6.156774","192.168.0.183","104.244.42.65","TCP","1414","50717  >  443 [ACK] Seq=12029 Ack=10290 Win=1041 Len=1360 [TCP segment of a reassembled PDU]"
"43","6.156774","192.168.0.183","104.244.42.65","TCP","1414","50717  >  443 [ACK] Seq=13389 Ack=10290 Win=1041 Len=1360 [TCP segment of a reassembled PDU]"
"44","6.156774","192.168.0.183","104.244.42.65","TCP","1414","50717  >  443 [ACK] Seq=14749 Ack=10290 Win=1041 Len=1360 [TCP segment of a reassembled PDU]"
"45","6.156774","192.168.0.183","104.244.42.65","TCP","1414","50717  >  443 [ACK] Seq=16109 Ack=10290 Win=1041 Len=1360 [TCP segment of a reassembled PDU]"
"46","6.156774","192.168.0.183","104.244.42.65","TCP","1414","50717  >  443 [ACK] Seq=17469 Ack=10290 Win=1041 Len=1360 [TCP segment of a reassembled PDU]"
"47","6.156774","192.168.0.183","104.244.42.65","TCP","1414","50717  >  443 [ACK] Seq=18829 Ack=10290 Win=1041 Len=1360 [TCP segment of a reassembled PDU]"
"48","6.156774","192.168.0.183","104.244.42.65","TCP","1414","50717  >  443 [ACK] Seq=20189 Ack=10290 Win=1041 Len=1360 [TCP segment of a reassembled PDU]"
"49","6.156774","192.168.0.183","104.244.42.65","TCP","1414","50717  >  443 [ACK] Seq=21549 Ack=10290 Win=1041 Len=1360 [TCP segment of a reassembled PDU]"
"50","6.156774","192.168.0.183","104.244.42.65","TCP","1414","50717  >  443 [ACK] Seq=22909 Ack=10290 Win=1041 Len=1360 [TCP segment of a reassembled PDU]"
"51","6.156774","192.168.0.183","104.244.42.65","TCP","1414","50717  >  443 [ACK] Seq=24269 Ack=10290 Win=1041 Len=1360 [TCP segment of a reassembled PDU]"
"52","6.156774","192.168.0.183","104.244.42.65","TCP","1414","50717  >  443 [ACK] Seq=25629 Ack=10290 Win=1041 Len=1360 [TCP segment of a reassembled PDU]"
"53","6.156774","192.168.0.183","104.244.42.65","TLSv1.2","140","Application Data"
"54","6.156919","192.168.0.183","104.244.42.65","TCP","1414","50717  >  443 [ACK] Seq=27075 Ack=10290 Win=1041 Len=1360 [TCP segment of a reassembled PDU]"
"55","6.156919","192.168.0.183","104.244.42.65","TCP","1414","50717  >  443 [ACK] Seq=28435 Ack=10290 Win=1041 Len=1360 [TCP segment of a reassembled PDU]"
"56","6.156919","192.168.0.183","104.244.42.65","TCP","1414","50717  >  443 [ACK] Seq=29795 Ack=10290 Win=1041 Len=1360 [TCP segment of a reassembled PDU]"
"57","6.156919","192.168.0.183","104.244.42.65","TCP","1414","50717  >  443 [ACK] Seq=31155 Ack=10290 Win=1041 Len=1360 [TCP segment of a reassembled PDU]"
"58","6.156919","192.168.0.183","104.244.42.65","TCP","1414","50717  >  443 [ACK] Seq=32515 Ack=10290 Win=1041 Len=1360 [TCP segment of a reassembled PDU]"
"59","6.156919","192.168.0.183","104.244.42.65","TCP","1414","50717  >  443 [ACK] Seq=33875 Ack=10290 Win=1041 Len=1360 [TCP segment of a reassembled PDU]"
"60","6.156919","192.168.0.183","104.244.42.65","TCP","1414","50717  >  443 [ACK] Seq=35235 Ack=10290 Win=1041 Len=1360 [TCP segment of a reassembled PDU]"
"61","6.156919","192.168.0.183","104.244.42.65","TCP","1414","50717  >  443 [ACK] Seq=36595 Ack=10290 Win=1041 Len=1360 [TCP segment of a reassembled PDU]"
"62","6.156919","192.168.0.183","104.244.42.65","TCP","1414","50717  >  443 [ACK] Seq=37955 Ack=10290 Win=1041 Len=1360 [TCP segment of a reassembled PDU]"
"63","6.156919","192.168.0.183","104.244.42.65","TCP","1414","50717  >  443 [ACK] Seq=39315 Ack=10290 Win=1041 Len=1360 [TCP segment of a reassembled PDU]"
"64","6.156919","192.168.0.183","104.244.42.65","TCP","1414","50717  >  443 [ACK] Seq=40675 Ack=10290 Win=1041 Len=1360 [TCP segment of a reassembled PDU]"
"65","6.156919","192.168.0.183","104.244.42.65","TCP","1414","50717  >  443 [ACK] Seq=42035 Ack=10290 Win=1041 Len=1360 [TCP segment of a reassembled PDU]"
"66","6.156919","192.168.0.183","104.244.42.65","TLSv1.2","140","Application Data"
"67","6.157049","192.168.0.183","104.244.42.65","TCP","1414","50717  >  443 [ACK] Seq=43481 Ack=10290 Win=1041 Len=1360 [TCP segment of a reassembled PDU]"
"68","6.157049","192.168.0.183","104.244.42.65","TCP","1414","50717  >  443 [ACK] Seq=44841 Ack=10290 Win=1041 Len=1360 [TCP segment of a reassembled PDU]"
"69","6.157049","192.168.0.183","104.244.42.65","TCP","1414","50717  >  443 [ACK] Seq=46201 Ack=10290 Win=1041 Len=1360 [TCP segment of a reassembled PDU]"
"70","6.157049","192.168.0.183","104.244.42.65","TCP","1414","50717  >  443 [ACK] Seq=47561 Ack=10290 Win=1041 Len=1360 [TCP segment of a reassembled PDU]"
"71","6.157049","192.168.0.183","104.244.42.65","TCP","1414","50717  >  443 [ACK] Seq=48921 Ack=10290 Win=1041 Len=1360 [TCP segment of a reassembled PDU]"
"72","6.157049","192.168.0.183","104.244.42.65","TCP","1414","50717  >  443 [ACK] Seq=50281 Ack=10290 Win=1041 Len=1360 [TCP segment of a reassembled PDU]"
"73","6.157049","192.168.0.183","104.244.42.65","TCP","1414","50717  >  443 [ACK] Seq=51641 Ack=10290 Win=1041 Len=1360 [TCP segment of a reassembled PDU]"
"74","6.157049","192.168.0.183","104.244.42.65","TCP","1414","50717  >  443 [ACK] Seq=53001 Ack=10290 Win=1041 Len=1360 [TCP segment of a reassembled PDU]"
"75","6.157049","192.168.0.183","104.244.42.65","TCP","1414","50717  >  443 [ACK] Seq=54361 Ack=10290 Win=1041 Len=1360 [TCP segment of a reassembled PDU]"
"76","6.157049","192.168.0.183","104.244.42.65","TCP","1414","50717  >  443 [ACK] Seq=55721 Ack=10290 Win=1041 Len=1360 [TCP segment of a reassembled PDU]"
"77","6.157049","192.168.0.183","104.244.42.65","TCP","1414","50717  >  443 [ACK] Seq=57081 Ack=10290 Win=1041 Len=1360 [TCP segment of a reassembled PDU]"
"78","6.157049","192.168.0.183","104.244.42.65","TCP","1414","50717  >  443 [ACK] Seq=58441 Ack=10290 Win=1041 Len=1360 [TCP segment of a reassembled PDU]"
"79","6.157049","192.168.0.183","104.244.42.65","TLSv1.2","140","Application Data"
"80","6.157184","192.168.0.183","104.244.42.65","TCP","1414","50717  >  443 [ACK] Seq=59887 Ack=10290 Win=1041 Len=1360 [TCP segment of a reassembled PDU]"
"81","6.157184","192.168.0.183","104.244.42.65","TCP","1414","50717  >  443 [ACK] Seq=61247 Ack=10290 Win=1041 Len=1360 [TCP segment of a reassembled PDU]"
"82","6.157184","192.168.0.183","104.244.42.65","TCP","1414","50717  >  443 [ACK] Seq=62607 Ack=10290 Win=1041 Len=1360 [TCP segment of a reassembled PDU]"
"83","6.157184","192.168.0.183","104.244.42.65","TCP","1414","50717  >  443 [ACK] Seq=63967 Ack=10290 Win=1041 Len=1360 [TCP segment of a reassembled PDU]"
"84","6.157184","192.168.0.183","104.244.42.65","TCP","1414","50717  >  443 [ACK] Seq=65327 Ack=10290 Win=1041 Len=1360 [TCP segment of a reassembled PDU]"
"85","6.157184","192.168.0.183","104.244.42.65","TCP","1414","50717  >  443 [ACK] Seq=66687 Ack=10290 Win=1041 Len=1360 [TCP segment of a reassembled PDU]"
"86","6.157184","192.168.0.183","104.244.42.65","TCP","1414","50717  >  443 [ACK] Seq=68047 Ack=10290 Win=1041 Len=1360 [TCP segment of a reassembled PDU]"
"87","6.157184","192.168.0.183","104.244.42.65","TCP","1414","50717  >  443 [ACK] Seq=69407 Ack=10290 Win=1041 Len=1360 [TCP segment of a reassembled PDU]"
"88","6.157184","192.168.0.183","104.244.42.65","TCP","1414","50717  >  443 [ACK] Seq=70767 Ack=10290 Win=1041 Len=1360 [TCP segment of a reassembled PDU]"
"89","6.157184","192.168.0.183","104.244.42.65","TCP","1414","50717  >  443 [ACK] Seq=72127 Ack=10290 Win=1041 Len=1360 [TCP segment of a reassembled PDU]"
"90","6.157184","192.168.0.183","104.244.42.65","TCP","1414","50717  >  443 [ACK] Seq=73487 Ack=10290 Win=1041 Len=1360 [TCP segment of a reassembled PDU]"
"91","6.157184","192.168.0.183","104.244.42.65","TCP","1414","50717  >  443 [ACK] Seq=74847 Ack=10290 Win=1041 Len=1360 [TCP segment of a reassembled PDU]"
"92","6.157184","192.168.0.183","104.244.42.65","TLSv1.2","140","Application Data"
"93","6.157331","192.168.0.183","104.244.42.65","TLSv1.2","121","Application Data"
"94","6.193275","104.244.42.65","192.168.0.183","TCP","60","443  >  50717 [ACK] Seq=10290 Ack=12029 Win=5732 Len=0"
"95","6.199187","104.244.42.65","192.168.0.183","TCP","60","443  >  50717 [ACK] Seq=10290 Ack=63967 Win=5676 Len=0"
"96","6.199187","104.244.42.65","192.168.0.183","TLSv1.2","89","Application Data"
"97","6.199187","104.244.42.65","192.168.0.183","TCP","60","443  >  50717 [ACK] Seq=10325 Ack=76360 Win=5723 Len=0"
"98","6.199508","192.168.0.183","104.244.42.65","TCP","1414","50717  >  443 [ACK] Seq=76360 Ack=10325 Win=1041 Len=1360 [TCP segment of a reassembled PDU]"
"99","6.199508","192.168.0.183","104.244.42.65","TCP","1414","50717  >  443 [ACK] Seq=77720 Ack=10325 Win=1041 Len=1360 [TCP segment of a reassembled PDU]"
"100","6.199508","192.168.0.183","104.244.42.65","TCP","1414","50717  >  443 [ACK] Seq=79080 Ack=10325 Win=1041 Len=1360 [TCP segment of a reassembled PDU]"
"101","6.199508","192.168.0.183","104.244.42.65","TCP","1414","50717  >  443 [ACK] Seq=80440 Ack=10325 Win=1041 Len=1360 [TCP segment of a reassembled PDU]"
"102","6.199508","192.168.0.183","104.244.42.65","TCP","1414","50717  >  443 [ACK] Seq=81800 Ack=10325 Win=1041 Len=1360 [TCP segment of a reassembled PDU]"
"103","6.199508","192.168.0.183","104.244.42.65","TCP","1414","50717  >  443 [ACK] Seq=83160 Ack=10325 Win=1041 Len=1360 [TCP segment of a reassembled PDU]"
"104","6.199508","192.168.0.183","104.244.42.65","TCP","1414","50717  >  443 [ACK] Seq=84520 Ack=10325 Win=1041 Len=1360 [TCP segment of a reassembled PDU]"
"105","6.199508","192.168.0.183","104.244.42.65","TCP","1414","50717  >  443 [ACK] Seq=85880 Ack=10325 Win=1041 Len=1360 [TCP segment of a reassembled PDU]"
"106","6.199508","192.168.0.183","104.244.42.65","TCP","1414","50717  >  443 [ACK] Seq=87240 Ack=10325 Win=1041 Len=1360 [TCP segment of a reassembled PDU]"
"107","6.199508","192.168.0.183","104.244.42.65","TCP","1414","50717  >  443 [ACK] Seq=88600 Ack=10325 Win=1041 Len=1360 [TCP segment of a reassembled PDU]"
"108","6.199508","192.168.0.183","104.244.42.65","TCP","1414","50717  >  443 [ACK] Seq=89960 Ack=10325 Win=1041 Len=1360 [TCP segment of a reassembled PDU]"
"109","6.199508","192.168.0.183","104.244.42.65","TCP","1414","50717  >  443 [ACK] Seq=91320 Ack=10325 Win=1041 Len=1360 [TCP segment of a reassembled PDU]"
"110","6.199508","192.168.0.183","104.244.42.65","TLSv1.2","104","Application Data"
"111","6.199743","192.168.0.183","104.244.42.65","TCP","1414","50717  >  443 [ACK] Seq=92730 Ack=10325 Win=1041 Len=1360 [TCP segment of a reassembled PDU]"
"112","6.199743","192.168.0.183","104.244.42.65","TCP","1414","50717  >  443 [ACK] Seq=94090 Ack=10325 Win=1041 Len=1360 [TCP segment of a reassembled PDU]"
"113","6.199743","192.168.0.183","104.244.42.65","TCP","1414","50717  >  443 [ACK] Seq=95450 Ack=10325 Win=1041 Len=1360 [TCP segment of a reassembled PDU]"
"114","6.199743","192.168.0.183","104.244.42.65","TCP","1414","50717  >  443 [ACK] Seq=96810 Ack=10325 Win=1041 Len=1360 [TCP segment of a reassembled PDU]"
"115","6.199743","192.168.0.183","104.244.42.65","TCP","1414","50717  >  443 [ACK] Seq=98170 Ack=10325 Win=1041 Len=1360 [TCP segment of a reassembled PDU]"
"116","6.199743","192.168.0.183","104.244.42.65","TCP","1414","50717  >  443 [ACK] Seq=99530 Ack=10325 Win=1041 Len=1360 [TCP segment of a reassembled PDU]"
"117","6.199743","192.168.0.183","104.244.42.65","TCP","1414","50717  >  443 [ACK] Seq=100890 Ack=10325 Win=1041 Len=1360 [TCP segment of a reassembled PDU]"
"118","6.199743","192.168.0.183","104.244.42.65","TCP","1414","50717  >  443 [ACK] Seq=102250 Ack=10325 Win=1041 Len=1360 [TCP segment of a reassembled PDU]"
"119","6.199743","192.168.0.183","104.244.42.65","TCP","1414","50717  >  443 [ACK] Seq=103610 Ack=10325 Win=1041 Len=1360 [TCP segment of a reassembled PDU]"
"120","6.199743","192.168.0.183","104.244.42.65","TCP","1414","50717  >  443 [ACK] Seq=104970 Ack=10325 Win=1041 Len=1360 [TCP segment of a reassembled PDU]"
"121","6.199743","192.168.0.183","104.244.42.65","TLSv1.2","991","Application Data"
"122","6.237809","104.244.42.65","192.168.0.183","TCP","60","443  >  50717 [ACK] Seq=10325 Ack=79080 Win=5729 Len=0"
"123","6.245286","104.244.42.65","192.168.0.183","TCP","60","443  >  50717 [ACK] Seq=10325 Ack=107267 Win=5685 Len=0"
"124","6.245286","104.244.42.65","192.168.0.183","TLSv1.2","89","Application Data"
"125","6.298395","192.168.0.183","104.244.42.65","TCP","54","50717  >  443 [ACK] Seq=107267 Ack=10360 Win=1040 Len=0"
"126","6.311695","104.244.42.65","192.168.0.183","TLSv1.2","266","Application Data"
"127","6.360400","192.168.0.183","104.244.42.65","TCP","54","50717  >  443 [ACK] Seq=107267 Ack=10572 Win=1040 Len=0"
"128","6.819760","192.168.0.183","104.244.42.65","TLSv1.2","347","Application Data"
"129","6.897446","104.244.42.65","192.168.0.183","TCP","60","443  >  50717 [ACK] Seq=10572 Ack=107560 Win=5735 Len=0"
"130","6.953402","192.168.0.183","104.244.42.65","TLSv1.2","683","Application Data"
"131","6.953576","192.168.0.183","104.244.42.65","TLSv1.2","929","Application Data"
"132","6.990506","104.244.42.65","192.168.0.183","TCP","60","443  >  50717 [ACK] Seq=10572 Ack=109064 Win=5731 Len=0"
"133","7.019300","104.244.42.65","192.168.0.183","TLSv1.2","157","Application Data"
"134","7.062405","192.168.0.183","104.244.42.65","TCP","54","50717  >  443 [ACK] Seq=109064 Ack=10675 Win=1039 Len=0"
"135","7.280339","104.244.42.65","192.168.0.183","TLSv1.2","174","Application Data"
"136","7.328273","192.168.0.183","104.244.42.65","TCP","54","50717  >  443 [ACK] Seq=109064 Ack=10795 Win=1039 Len=0"
"137","9.160881","192.168.0.183","104.244.42.65","TLSv1.2","697","Application Data"
"138","9.161092","192.168.0.183","104.244.42.65","TCP","1414","50717  >  443 [ACK] Seq=109707 Ack=10795 Win=1039 Len=1360 [TCP segment of a reassembled PDU]"
"139","9.161092","192.168.0.183","104.244.42.65","TCP","1414","50717  >  443 [ACK] Seq=111067 Ack=10795 Win=1039 Len=1360 [TCP segment of a reassembled PDU]"
"140","9.161092","192.168.0.183","104.244.42.65","TCP","1414","50717  >  443 [ACK] Seq=112427 Ack=10795 Win=1039 Len=1360 [TCP segment of a reassembled PDU]"
"141","9.161092","192.168.0.183","104.244.42.65","TCP","1414","50717  >  443 [ACK] Seq=113787 Ack=10795 Win=1039 Len=1360 [TCP segment of a reassembled PDU]"
"142","9.161092","192.168.0.183","104.244.42.65","TCP","1414","50717  >  443 [ACK] Seq=115147 Ack=10795 Win=1039 Len=1360 [TCP segment of a reassembled PDU]"
"143","9.161092","192.168.0.183","104.244.42.65","TCP","1414","50717  >  443 [ACK] Seq=116507 Ack=10795 Win=1039 Len=1360 [TCP segment of a reassembled PDU]"
"144","9.161092","192.168.0.183","104.244.42.65","TCP","1414","50717  >  443 [ACK] Seq=117867 Ack=10795 Win=1039 Len=1360 [TCP segment of a reassembled PDU]"
"145","9.161092","192.168.0.183","104.244.42.65","TCP","1414","50717  >  443 [ACK] Seq=119227 Ack=10795 Win=1039 Len=1360 [TCP segment of a reassembled PDU]"
"146","9.161092","192.168.0.183","104.244.42.65","TCP","1414","50717  >  443 [ACK] Seq=120587 Ack=10795 Win=1039 Len=1360 [TCP segment of a reassembled PDU]"
"147","9.161092","192.168.0.183","104.244.42.65","TCP","1414","50717  >  443 [ACK] Seq=121947 Ack=10795 Win=1039 Len=1360 [TCP segment of a reassembled PDU]"
"148","9.161092","192.168.0.183","104.244.42.65","TCP","1414","50717  >  443 [ACK] Seq=123307 Ack=10795 Win=1039 Len=1360 [TCP segment of a reassembled PDU]"
"149","9.161092","192.168.0.183","104.244.42.65","TCP","1414","50717  >  443 [ACK] Seq=124667 Ack=10795 Win=1039 Len=1360 [TCP segment of a reassembled PDU]"
"150","9.161092","192.168.0.183","104.244.42.65","TLSv1.2","140","Application Data"
"151","9.161322","192.168.0.183","104.244.42.65","TCP","1414","50717  >  443 [ACK] Seq=126113 Ack=10795 Win=1039 Len=1360 [TCP segment of a reassembled PDU]"
"152","9.161322","192.168.0.183","104.244.42.65","TCP","1414","50717  >  443 [ACK] Seq=127473 Ack=10795 Win=1039 Len=1360 [TCP segment of a reassembled PDU]"
"153","9.161322","192.168.0.183","104.244.42.65","TCP","1414","50717  >  443 [ACK] Seq=128833 Ack=10795 Win=1039 Len=1360 [TCP segment of a reassembled PDU]"
"154","9.161322","192.168.0.183","104.244.42.65","TCP","1414","50717  >  443 [ACK] Seq=130193 Ack=10795 Win=1039 Len=1360 [TCP segment of a reassembled PDU]"
"155","9.161322","192.168.0.183","104.244.42.65","TCP","1414","50717  >  443 [ACK] Seq=131553 Ack=10795 Win=1039 Len=1360 [TCP segment of a reassembled PDU]"
"156","9.161322","192.168.0.183","104.244.42.65","TCP","1414","50717  >  443 [ACK] Seq=132913 Ack=10795 Win=1039 Len=1360 [TCP segment of a reassembled PDU]"
"157","9.161322","192.168.0.183","104.244.42.65","TCP","1414","50717  >  443 [ACK] Seq=134273 Ack=10795 Win=1039 Len=1360 [TCP segment of a reassembled PDU]"
"158","9.161322","192.168.0.183","104.244.42.65","TCP","1414","50717  >  443 [ACK] Seq=135633 Ack=10795 Win=1039 Len=1360 [TCP segment of a reassembled PDU]"
"159","9.161322","192.168.0.183","104.244.42.65","TCP","1414","50717  >  443 [ACK] Seq=136993 Ack=10795 Win=1039 Len=1360 [TCP segment of a reassembled PDU]"
"160","9.161322","192.168.0.183","104.244.42.65","TCP","1414","50717  >  443 [ACK] Seq=138353 Ack=10795 Win=1039 Len=1360 [TCP segment of a reassembled PDU]"
"161","9.161322","192.168.0.183","104.244.42.65","TCP","1414","50717  >  443 [ACK] Seq=139713 Ack=10795 Win=1039 Len=1360 [TCP segment of a reassembled PDU]"
"162","9.161322","192.168.0.183","104.244.42.65","TCP","1414","50717  >  443 [ACK] Seq=141073 Ack=10795 Win=1039 Len=1360 [TCP segment of a reassembled PDU]"
"163","9.161322","192.168.0.183","104.244.42.65","TLSv1.2","140","Application Data"
"164","9.161527","192.168.0.183","104.244.42.65","TCP","1414","50717  >  443 [ACK] Seq=142519 Ack=10795 Win=1039 Len=1360 [TCP segment of a reassembled PDU]"
"165","9.161527","192.168.0.183","104.244.42.65","TCP","1414","50717  >  443 [ACK] Seq=143879 Ack=10795 Win=1039 Len=1360 [TCP segment of a reassembled PDU]"
"166","9.161527","192.168.0.183","104.244.42.65","TCP","1414","50717  >  443 [ACK] Seq=145239 Ack=10795 Win=1039 Len=1360 [TCP segment of a reassembled PDU]"
"167","9.161527","192.168.0.183","104.244.42.65","TCP","1414","50717  >  443 [ACK] Seq=146599 Ack=10795 Win=1039 Len=1360 [TCP segment of a reassembled PDU]"
"168","9.161527","192.168.0.183","104.244.42.65","TCP","1414","50717  >  443 [ACK] Seq=147959 Ack=10795 Win=1039 Len=1360 [TCP segment of a reassembled PDU]"
"169","9.161527","192.168.0.183","104.244.42.65","TCP","1414","50717  >  443 [ACK] Seq=149319 Ack=10795 Win=1039 Len=1360 [TCP segment of a reassembled PDU]"
"170","9.161527","192.168.0.183","104.244.42.65","TCP","1414","50717  >  443 [ACK] Seq=150679 Ack=10795 Win=1039 Len=1360 [TCP segment of a reassembled PDU]"
"171","9.161527","192.168.0.183","104.244.42.65","TCP","1414","50717  >  443 [ACK] Seq=152039 Ack=10795 Win=1039 Len=1360 [TCP segment of a reassembled PDU]"
"172","9.161527","192.168.0.183","104.244.42.65","TCP","1414","50717  >  443 [ACK] Seq=153399 Ack=10795 Win=1039 Len=1360 [TCP segment of a reassembled PDU]"
"173","9.161527","192.168.0.183","104.244.42.65","TCP","1414","50717  >  443 [ACK] Seq=154759 Ack=10795 Win=1039 Len=1360 [TCP segment of a reassembled PDU]"
"174","9.161527","192.168.0.183","104.244.42.65","TCP","1414","50717  >  443 [ACK] Seq=156119 Ack=10795 Win=1039 Len=1360 [TCP segment of a reassembled PDU]"
"175","9.161527","192.168.0.183","104.244.42.65","TCP","1414","50717  >  443 [ACK] Seq=157479 Ack=10795 Win=1039 Len=1360 [TCP segment of a reassembled PDU]"
"176","9.161527","192.168.0.183","104.244.42.65","TLSv1.2","140","Application Data"
"177","9.161812","192.168.0.183","104.244.42.65","TCP","1414","50717  >  443 [ACK] Seq=158925 Ack=10795 Win=1039 Len=1360 [TCP segment of a reassembled PDU]"
"178","9.161812","192.168.0.183","104.244.42.65","TCP","1414","50717  >  443 [ACK] Seq=160285 Ack=10795 Win=1039 Len=1360 [TCP segment of a reassembled PDU]"
"179","9.161812","192.168.0.183","104.244.42.65","TCP","1414","50717  >  443 [ACK] Seq=161645 Ack=10795 Win=1039 Len=1360 [TCP segment of a reassembled PDU]"
"180","9.161812","192.168.0.183","104.244.42.65","TCP","1414","50717  >  443 [ACK] Seq=163005 Ack=10795 Win=1039 Len=1360 [TCP segment of a reassembled PDU]"
"181","9.161812","192.168.0.183","104.244.42.65","TCP","1414","50717  >  443 [ACK] Seq=164365 Ack=10795 Win=1039 Len=1360 [TCP segment of a reassembled PDU]"
"182","9.161812","192.168.0.183","104.244.42.65","TCP","1414","50717  >  443 [ACK] Seq=165725 Ack=10795 Win=1039 Len=1360 [TCP segment of a reassembled PDU]"
"183","9.161812","192.168.0.183","104.244.42.65","TCP","1414","50717  >  443 [ACK] Seq=167085 Ack=10795 Win=1039 Len=1360 [TCP segment of a reassembled PDU]"
"184","9.161812","192.168.0.183","104.244.42.65","TLSv1.2","187","Application Data"
"185","9.198301","104.244.42.65","192.168.0.183","TCP","60","443  >  50717 [ACK] Seq=10795 Ack=113787 Win=5735 Len=0"
"186","9.206889","104.244.42.65","192.168.0.183","TCP","60","443  >  50717 [ACK] Seq=10795 Ack=168578 Win=5701 Len=0"
"187","9.206889","104.244.42.65","192.168.0.183","TLSv1.2","89","Application Data"
"188","9.255990","192.168.0.183","104.244.42.65","TCP","54","50717  >  443 [ACK] Seq=168578 Ack=10830 Win=1039 Len=0"
"189","9.271353","104.244.42.65","192.168.0.183","TLSv1.2","222","Application Data"
"190","9.317030","192.168.0.183","104.244.42.65","TCP","54","50717  >  443 [ACK] Seq=168578 Ack=10998 Win=1038 Len=0"
"191","9.558812","192.168.0.183","104.244.42.65","TCP","1414","50717  >  443 [ACK] Seq=168578 Ack=10998 Win=1038 Len=1360 [TCP segment of a reassembled PDU]"
"192","9.558812","192.168.0.183","104.244.42.65","TLSv1.2","468","Application Data"
"193","9.559090","192.168.0.183","104.244.42.65","TLSv1.2","237","Application Data"
"194","9.607073","104.244.42.65","192.168.0.183","TCP","60","443  >  50717 [ACK] Seq=10998 Ack=170352 Win=5731 Len=0"
"195","9.638933","104.244.42.65","192.168.0.183","TCP","60","443  >  50717 [ACK] Seq=10998 Ack=170535 Win=5735 Len=0"
"196","10.001464","104.244.42.65","192.168.0.183","TLSv1.2","174","Application Data"
"197","10.004006","104.244.42.65","192.168.0.183","TCP","1414","443  >  50717 [ACK] Seq=11118 Ack=170535 Win=5735 Len=1360 [TCP segment of a reassembled PDU]"
"198","10.004006","104.244.42.65","192.168.0.183","TCP","1414","443  >  50717 [PSH, ACK] Seq=12478 Ack=170535 Win=5735 Len=1360 [TCP segment of a reassembled PDU]"
"199","10.004006","104.244.42.65","192.168.0.183","TCP","1414","443  >  50717 [ACK] Seq=13838 Ack=170535 Win=5735 Len=1360 [TCP segment of a reassembled PDU]"
"200","10.004006","104.244.42.65","192.168.0.183","TCP","1414","443  >  50717 [PSH, ACK] Seq=15198 Ack=170535 Win=5735 Len=1360 [TCP segment of a reassembled PDU]"
"201","10.004006","104.244.42.65","192.168.0.183","TCP","1414","443  >  50717 [ACK] Seq=16558 Ack=170535 Win=5735 Len=1360 [TCP segment of a reassembled PDU]"
"202","10.004006","104.244.42.65","192.168.0.183","TLSv1.2","185","Application Data"
"203","10.004045","192.168.0.183","104.244.42.65","TCP","54","50717  >  443 [ACK] Seq=170535 Ack=18049 Win=1041 Len=0"
"204","10.005771","192.168.0.183","104.244.42.65","TLSv1.2","89","Application Data"
"205","10.040930","104.244.42.65","192.168.0.183","TCP","60","443  >  50717 [ACK] Seq=18049 Ack=170570 Win=5735 Len=0"
"206","12.163695","192.168.0.183","104.244.42.65","TLSv1.2","260","Application Data"
"207","12.163837","192.168.0.183","104.244.42.65","TCP","1414","50717  >  443 [ACK] Seq=170776 Ack=18049 Win=1041 Len=1360 [TCP segment of a reassembled PDU]"
"208","12.163837","192.168.0.183","104.244.42.65","TCP","1414","50717  >  443 [ACK] Seq=172136 Ack=18049 Win=1041 Len=1360 [TCP segment of a reassembled PDU]"
"209","12.163837","192.168.0.183","104.244.42.65","TCP","1414","50717  >  443 [ACK] Seq=173496 Ack=18049 Win=1041 Len=1360 [TCP segment of a reassembled PDU]"
"210","12.163837","192.168.0.183","104.244.42.65","TCP","1414","50717  >  443 [ACK] Seq=174856 Ack=18049 Win=1041 Len=1360 [TCP segment of a reassembled PDU]"
"211","12.163837","192.168.0.183","104.244.42.65","TCP","1414","50717  >  443 [ACK] Seq=176216 Ack=18049 Win=1041 Len=1360 [TCP segment of a reassembled PDU]"
"212","12.163837","192.168.0.183","104.244.42.65","TCP","1414","50717  >  443 [ACK] Seq=177576 Ack=18049 Win=1041 Len=1360 [TCP segment of a reassembled PDU]"
"213","12.163837","192.168.0.183","104.244.42.65","TCP","1414","50717  >  443 [ACK] Seq=178936 Ack=18049 Win=1041 Len=1360 [TCP segment of a reassembled PDU]"
"214","12.163837","192.168.0.183","104.244.42.65","TCP","1414","50717  >  443 [ACK] Seq=180296 Ack=18049 Win=1041 Len=1360 [TCP segment of a reassembled PDU]"
"215","12.163837","192.168.0.183","104.244.42.65","TCP","1414","50717  >  443 [ACK] Seq=181656 Ack=18049 Win=1041 Len=1360 [TCP segment of a reassembled PDU]"
"216","12.163837","192.168.0.183","104.244.42.65","TCP","1414","50717  >  443 [ACK] Seq=183016 Ack=18049 Win=1041 Len=1360 [TCP segment of a reassembled PDU]"
"217","12.163837","192.168.0.183","104.244.42.65","TCP","1414","50717  >  443 [ACK] Seq=184376 Ack=18049 Win=1041 Len=1360 [TCP segment of a reassembled PDU]"
"218","12.163837","192.168.0.183","104.244.42.65","TCP","1414","50717  >  443 [ACK] Seq=185736 Ack=18049 Win=1041 Len=1360 [TCP segment of a reassembled PDU]"
"219","12.163837","192.168.0.183","104.244.42.65","TLSv1.2","140","Application Data"
"220","12.163962","192.168.0.183","104.244.42.65","TCP","1414","50717  >  443 [ACK] Seq=187182 Ack=18049 Win=1041 Len=1360 [TCP segment of a reassembled PDU]"
"221","12.163962","192.168.0.183","104.244.42.65","TCP","1414","50717  >  443 [ACK] Seq=188542 Ack=18049 Win=1041 Len=1360 [TCP segment of a reassembled PDU]"
"222","12.163962","192.168.0.183","104.244.42.65","TCP","1414","50717  >  443 [ACK] Seq=189902 Ack=18049 Win=1041 Len=1360 [TCP segment of a reassembled PDU]"
"223","12.163962","192.168.0.183","104.244.42.65","TCP","1414","50717  >  443 [ACK] Seq=191262 Ack=18049 Win=1041 Len=1360 [TCP segment of a reassembled PDU]"
"224","12.163962","192.168.0.183","104.244.42.65","TCP","1414","50717  >  443 [ACK] Seq=192622 Ack=18049 Win=1041 Len=1360 [TCP segment of a reassembled PDU]"
"225","12.163962","192.168.0.183","104.244.42.65","TCP","1414","50717  >  443 [ACK] Seq=193982 Ack=18049 Win=1041 Len=1360 [TCP segment of a reassembled PDU]"
"226","12.163962","192.168.0.183","104.244.42.65","TCP","1414","50717  >  443 [ACK] Seq=195342 Ack=18049 Win=1041 Len=1360 [TCP segment of a reassembled PDU]"
"227","12.163962","192.168.0.183","104.244.42.65","TCP","1414","50717  >  443 [ACK] Seq=196702 Ack=18049 Win=1041 Len=1360 [TCP segment of a reassembled PDU]"
"228","12.163962","192.168.0.183","104.244.42.65","TCP","1414","50717  >  443 [ACK] Seq=198062 Ack=18049 Win=1041 Len=1360 [TCP segment of a reassembled PDU]"
"229","12.163962","192.168.0.183","104.244.42.65","TCP","1414","50717  >  443 [ACK] Seq=199422 Ack=18049 Win=1041 Len=1360 [TCP segment of a reassembled PDU]"
"230","12.163962","192.168.0.183","104.244.42.65","TCP","1414","50717  >  443 [ACK] Seq=200782 Ack=18049 Win=1041 Len=1360 [TCP segment of a reassembled PDU]"
"231","12.163962","192.168.0.183","104.244.42.65","TCP","1414","50717  >  443 [ACK] Seq=202142 Ack=18049 Win=1041 Len=1360 [TCP segment of a reassembled PDU]"
"232","12.163962","192.168.0.183","104.244.42.65","TLSv1.2","140","Application Data"
"233","12.164165","192.168.0.183","104.244.42.65","TCP","1414","50717  >  443 [ACK] Seq=203588 Ack=18049 Win=1041 Len=1360 [TCP segment of a reassembled PDU]"
"234","12.164165","192.168.0.183","104.244.42.65","TCP","1414","50717  >  443 [ACK] Seq=204948 Ack=18049 Win=1041 Len=1360 [TCP segment of a reassembled PDU]"
"235","12.164165","192.168.0.183","104.244.42.65","TCP","1414","50717  >  443 [ACK] Seq=206308 Ack=18049 Win=1041 Len=1360 [TCP segment of a reassembled PDU]"
"236","12.164165","192.168.0.183","104.244.42.65","TCP","1414","50717  >  443 [ACK] Seq=207668 Ack=18049 Win=1041 Len=1360 [TCP segment of a reassembled PDU]"
"237","12.164165","192.168.0.183","104.244.42.65","TCP","1414","50717  >  443 [ACK] Seq=209028 Ack=18049 Win=1041 Len=1360 [TCP segment of a reassembled PDU]"
"238","12.164165","192.168.0.183","104.244.42.65","TCP","1414","50717  >  443 [ACK] Seq=210388 Ack=18049 Win=1041 Len=1360 [TCP segment of a reassembled PDU]"
"239","12.164165","192.168.0.183","104.244.42.65","TCP","1414","50717  >  443 [ACK] Seq=211748 Ack=18049 Win=1041 Len=1360 [TCP segment of a reassembled PDU]"
"240","12.164165","192.168.0.183","104.244.42.65","TCP","1414","50717  >  443 [ACK] Seq=213108 Ack=18049 Win=1041 Len=1360 [TCP segment of a reassembled PDU]"
"241","12.164165","192.168.0.183","104.244.42.65","TCP","1414","50717  >  443 [ACK] Seq=214468 Ack=18049 Win=1041 Len=1360 [TCP segment of a reassembled PDU]"
"242","12.164165","192.168.0.183","104.244.42.65","TCP","1414","50717  >  443 [ACK] Seq=215828 Ack=18049 Win=1041 Len=1360 [TCP segment of a reassembled PDU]"
"243","12.164165","192.168.0.183","104.244.42.65","TCP","1414","50717  >  443 [ACK] Seq=217188 Ack=18049 Win=1041 Len=1360 [TCP segment of a reassembled PDU]"
"244","12.164165","192.168.0.183","104.244.42.65","TCP","1414","50717  >  443 [ACK] Seq=218548 Ack=18049 Win=1041 Len=1360 [TCP segment of a reassembled PDU]"
"245","12.164165","192.168.0.183","104.244.42.65","TLSv1.2","140","Application Data"
"246","12.164469","192.168.0.183","104.244.42.65","TCP","1414","50717  >  443 [ACK] Seq=219994 Ack=18049 Win=1041 Len=1360 [TCP segment of a reassembled PDU]"
"247","12.164469","192.168.0.183","104.244.42.65","TCP","1414","50717  >  443 [ACK] Seq=221354 Ack=18049 Win=1041 Len=1360 [TCP segment of a reassembled PDU]"
"248","12.164469","192.168.0.183","104.244.42.65","TCP","1414","50717  >  443 [ACK] Seq=222714 Ack=18049 Win=1041 Len=1360 [TCP segment of a reassembled PDU]"
"249","12.164469","192.168.0.183","104.244.42.65","TCP","1414","50717  >  443 [ACK] Seq=224074 Ack=18049 Win=1041 Len=1360 [TCP segment of a reassembled PDU]"
"250","12.164469","192.168.0.183","104.244.42.65","TCP","1414","50717  >  443 [ACK] Seq=225434 Ack=18049 Win=1041 Len=1360 [TCP segment of a reassembled PDU]"
"251","12.164469","192.168.0.183","104.244.42.65","TCP","1414","50717  >  443 [ACK] Seq=226794 Ack=18049 Win=1041 Len=1360 [TCP segment of a reassembled PDU]"
"252","12.164469","192.168.0.183","104.244.42.65","TCP","1414","50717  >  443 [ACK] Seq=228154 Ack=18049 Win=1041 Len=1360 [TCP segment of a reassembled PDU]"
"253","12.164469","192.168.0.183","104.244.42.65","TCP","1414","50717  >  443 [ACK] Seq=229514 Ack=18049 Win=1041 Len=1360 [TCP segment of a reassembled PDU]"
"254","12.164469","192.168.0.183","104.244.42.65","TCP","1414","50717  >  443 [ACK] Seq=230874 Ack=18049 Win=1041 Len=1360 [TCP segment of a reassembled PDU]"
"255","12.164469","192.168.0.183","104.244.42.65","TCP","1414","50717  >  443 [ACK] Seq=232234 Ack=18049 Win=1041 Len=1360 [TCP segment of a reassembled PDU]"
"256","12.164469","192.168.0.183","104.244.42.65","TCP","1414","50717  >  443 [ACK] Seq=233594 Ack=18049 Win=1041 Len=1360 [TCP segment of a reassembled PDU]"
"257","12.164469","192.168.0.183","104.244.42.65","TCP","1414","50717  >  443 [ACK] Seq=234954 Ack=18049 Win=1041 Len=1360 [TCP segment of a reassembled PDU]"
"258","12.164469","192.168.0.183","104.244.42.65","TLSv1.2","140","Application Data"
"259","12.164633","192.168.0.183","104.244.42.65","TLSv1.2","121","Application Data"
"260","12.214665","104.244.42.65","192.168.0.183","TCP","60","443  >  50717 [ACK] Seq=18049 Ack=187182 Win=5690 Len=0"
"261","12.214665","104.244.42.65","192.168.0.183","TCP","60","443  >  50717 [ACK] Seq=18049 Ack=222714 Win=5721 Len=0"
"262","12.214665","104.244.42.65","192.168.0.183","TLSv1.2","89","Application Data"
"263","12.214665","104.244.42.65","192.168.0.183","TCP","60","443  >  50717 [ACK] Seq=18084 Ack=236467 Win=5727 Len=0"
"264","12.215100","192.168.0.183","104.244.42.65","TCP","1414","50717  >  443 [ACK] Seq=236467 Ack=18084 Win=1041 Len=1360 [TCP segment of a reassembled PDU]"
"265","12.215100","192.168.0.183","104.244.42.65","TCP","1414","50717  >  443 [ACK] Seq=237827 Ack=18084 Win=1041 Len=1360 [TCP segment of a reassembled PDU]"
"266","12.215100","192.168.0.183","104.244.42.65","TCP","1414","50717  >  443 [ACK] Seq=239187 Ack=18084 Win=1041 Len=1360 [TCP segment of a reassembled PDU]"
"267","12.215100","192.168.0.183","104.244.42.65","TCP","1414","50717  >  443 [ACK] Seq=240547 Ack=18084 Win=1041 Len=1360 [TCP segment of a reassembled PDU]"
"268","12.215100","192.168.0.183","104.244.42.65","TCP","1414","50717  >  443 [ACK] Seq=241907 Ack=18084 Win=1041 Len=1360 [TCP segment of a reassembled PDU]"
"269","12.215100","192.168.0.183","104.244.42.65","TCP","1414","50717  >  443 [ACK] Seq=243267 Ack=18084 Win=1041 Len=1360 [TCP segment of a reassembled PDU]"
"270","12.215100","192.168.0.183","104.244.42.65","TCP","1414","50717  >  443 [ACK] Seq=244627 Ack=18084 Win=1041 Len=1360 [TCP segment of a reassembled PDU]"
"271","12.215100","192.168.0.183","104.244.42.65","TCP","1414","50717  >  443 [ACK] Seq=245987 Ack=18084 Win=1041 Len=1360 [TCP segment of a reassembled PDU]"
"272","12.215100","192.168.0.183","104.244.42.65","TCP","1414","50717  >  443 [ACK] Seq=247347 Ack=18084 Win=1041 Len=1360 [TCP segment of a reassembled PDU]"
"273","12.215100","192.168.0.183","104.244.42.65","TCP","1414","50717  >  443 [ACK] Seq=248707 Ack=18084 Win=1041 Len=1360 [TCP segment of a reassembled PDU]"
"274","12.215100","192.168.0.183","104.244.42.65","TCP","1414","50717  >  443 [ACK] Seq=250067 Ack=18084 Win=1041 Len=1360 [TCP segment of a reassembled PDU]"
"275","12.215100","192.168.0.183","104.244.42.65","TCP","1414","50717  >  443 [ACK] Seq=251427 Ack=18084 Win=1041 Len=1360 [TCP segment of a reassembled PDU]"
"276","12.215100","192.168.0.183","104.244.42.65","TLSv1.2","104","Application Data"
"277","12.215428","192.168.0.183","104.244.42.65","TCP","1414","50717  >  443 [ACK] Seq=252837 Ack=18084 Win=1041 Len=1360 [TCP segment of a reassembled PDU]"
"278","12.215428","192.168.0.183","104.244.42.65","TCP","1414","50717  >  443 [ACK] Seq=254197 Ack=18084 Win=1041 Len=1360 [TCP segment of a reassembled PDU]"
"279","12.215428","192.168.0.183","104.244.42.65","TLSv1.2","665","Application Data"
"280","12.252280","104.244.42.65","192.168.0.183","TCP","60","443  >  50717 [ACK] Seq=18084 Ack=239187 Win=5729 Len=0"
"281","12.258900","104.244.42.65","192.168.0.183","TCP","60","443  >  50717 [ACK] Seq=18084 Ack=256168 Win=5722 Len=0"
"282","12.258900","104.244.42.65","192.168.0.183","TLSv1.2","89","Application Data"
"283","12.307683","192.168.0.183","104.244.42.65","TCP","54","50717  >  443 [ACK] Seq=256168 Ack=18119 Win=1040 Len=0"
"284","12.315774","104.244.42.65","192.168.0.183","TLSv1.2","201","Application Data"
"285","12.368485","192.168.0.183","104.244.42.65","TCP","54","50717  >  443 [ACK] Seq=256168 Ack=18266 Win=1040 Len=0"
"286","12.756856","192.168.0.183","104.244.42.65","TLSv1.2","243","Application Data"
"287","12.757015","192.168.0.183","104.244.42.65","TLSv1.2","676","Application Data"
"288","12.794680","104.244.42.65","192.168.0.183","TCP","60","443  >  50717 [ACK] Seq=18266 Ack=256979 Win=5735 Len=0"
"289","12.816867","104.244.42.65","192.168.0.183","TLSv1.2","184","Application Data"
"290","12.864441","192.168.0.183","104.244.42.65","TCP","54","50717  >  443 [ACK] Seq=256979 Ack=18396 Win=1039 Len=0"
"291","13.336251","192.168.0.183","104.244.42.65","TLSv1.2","929","Application Data"
"292","13.336365","192.168.0.183","104.244.42.65","TLSv1.2","339","Application Data"
"293","13.376222","104.244.42.65","192.168.0.183","TCP","60","443  >  50717 [ACK] Seq=18396 Ack=258139 Win=5735 Len=0"
"294","13.402898","104.244.42.65","192.168.0.183","TLSv1.2","487","Application Data"
"295","13.405618","104.244.42.65","192.168.0.183","TLSv1.2","238","Application Data"
"296","13.405649","192.168.0.183","104.244.42.65","TCP","54","50717  >  443 [ACK] Seq=258139 Ack=19013 Win=1037 Len=0"
"297","15.939996","192.168.0.183","104.244.42.65","TLSv1.2","686","Application Data"
"298","15.940326","192.168.0.183","104.244.42.65","TCP","1414","50717  >  443 [ACK] Seq=258771 Ack=19013 Win=1037 Len=1360 [TCP segment of a reassembled PDU]"
"299","15.940326","192.168.0.183","104.244.42.65","TCP","1414","50717  >  443 [ACK] Seq=260131 Ack=19013 Win=1037 Len=1360 [TCP segment of a reassembled PDU]"
"300","15.940326","192.168.0.183","104.244.42.65","TCP","1414","50717  >  443 [ACK] Seq=261491 Ack=19013 Win=1037 Len=1360 [TCP segment of a reassembled PDU]"
"301","15.940326","192.168.0.183","104.244.42.65","TCP","1414","50717  >  443 [ACK] Seq=262851 Ack=19013 Win=1037 Len=1360 [TCP segment of a reassembled PDU]"
"302","15.940326","192.168.0.183","104.244.42.65","TCP","1414","50717  >  443 [ACK] Seq=264211 Ack=19013 Win=1037 Len=1360 [TCP segment of a reassembled PDU]"
"303","15.940326","192.168.0.183","104.244.42.65","TCP","1414","50717  >  443 [ACK] Seq=265571 Ack=19013 Win=1037 Len=1360 [TCP segment of a reassembled PDU]"
"304","15.940326","192.168.0.183","104.244.42.65","TCP","1414","50717  >  443 [ACK] Seq=266931 Ack=19013 Win=1037 Len=1360 [TCP segment of a reassembled PDU]"
"305","15.940326","192.168.0.183","104.244.42.65","TCP","1414","50717  >  443 [ACK] Seq=268291 Ack=19013 Win=1037 Len=1360 [TCP segment of a reassembled PDU]"
"306","15.940326","192.168.0.183","104.244.42.65","TCP","1414","50717  >  443 [ACK] Seq=269651 Ack=19013 Win=1037 Len=1360 [TCP segment of a reassembled PDU]"
"307","15.940326","192.168.0.183","104.244.42.65","TCP","1414","50717  >  443 [ACK] Seq=271011 Ack=19013 Win=1037 Len=1360 [TCP segment of a reassembled PDU]"
"308","15.940326","192.168.0.183","104.244.42.65","TCP","1414","50717  >  443 [ACK] Seq=272371 Ack=19013 Win=1037 Len=1360 [TCP segment of a reassembled PDU]"
"309","15.940326","192.168.0.183","104.244.42.65","TCP","1414","50717  >  443 [ACK] Seq=273731 Ack=19013 Win=1037 Len=1360 [TCP segment of a reassembled PDU]"
"310","15.940326","192.168.0.183","104.244.42.65","TLSv1.2","138","Application Data"
"311","15.979549","104.244.42.65","192.168.0.183","TCP","60","443  >  50717 [ACK] Seq=19013 Ack=260131 Win=5730 Len=0"
"312","15.984769","104.244.42.65","192.168.0.183","TCP","60","443  >  50717 [ACK] Seq=19013 Ack=275175 Win=5735 Len=0"
"313","16.010838","104.244.42.65","192.168.0.183","TLSv1.2","282","Application Data"
"314","16.056513","192.168.0.183","104.244.42.65","TCP","54","50717  >  443 [ACK] Seq=275175 Ack=19241 Win=1036 Len=0"
"315","16.505316","192.168.0.183","104.244.42.65","TLSv1.2","702","Application Data"
"316","16.505448","192.168.0.183","104.244.42.65","TLSv1.2","168","Application Data"
"317","16.599310","104.244.42.65","192.168.0.183","TCP","60","443  >  50717 [ACK] Seq=19241 Ack=275937 Win=5735 Len=0"
"318","16.621726","104.244.42.65","192.168.0.183","TLSv1.2","302","Application Data"
"319","16.622548","192.168.0.183","104.244.42.65","TLSv1.2","89","Application Data"
"320","16.704052","104.244.42.65","192.168.0.183","TCP","60","443  >  50717 [ACK] Seq=19489 Ack=275972 Win=5735 Len=0"
"321","18.255245","192.168.0.183","104.244.42.65","TLSv1.2","282","Application Data"
"322","18.302906","104.244.42.65","192.168.0.183","TCP","60","443  >  50717 [ACK] Seq=19489 Ack=276200 Win=5735 Len=0"
"323","18.466530","192.168.0.183","104.244.42.65","TLSv1.2","308","Application Data"
"324","18.466622","192.168.0.183","104.244.42.65","TLSv1.2","647","Application Data"
"325","18.507691","104.244.42.65","192.168.0.183","TCP","60","443  >  50717 [ACK] Seq=19489 Ack=277047 Win=5733 Len=0"
"326","18.527170","104.244.42.65","192.168.0.183","TLSv1.2","180","Application Data"
"327","18.568588","192.168.0.183","104.244.42.65","TCP","54","50717  >  443 [ACK] Seq=277047 Ack=19615 Win=1040 Len=0"
"328","18.634904","104.244.42.65","192.168.0.183","TLSv1.2","167","Application Data"
"329","18.676658","192.168.0.183","104.244.42.65","TCP","54","50717  >  443 [ACK] Seq=277047 Ack=19728 Win=1040 Len=0"
"330","18.985248","192.168.0.183","104.244.42.65","TLSv1.2","260","Application Data"
"331","18.985442","192.168.0.183","104.244.42.65","TCP","1414","50717  >  443 [ACK] Seq=277253 Ack=19728 Win=1040 Len=1360 [TCP segment of a reassembled PDU]"
"332","18.985442","192.168.0.183","104.244.42.65","TCP","1414","50717  >  443 [ACK] Seq=278613 Ack=19728 Win=1040 Len=1360 [TCP segment of a reassembled PDU]"
"333","18.985442","192.168.0.183","104.244.42.65","TCP","1414","50717  >  443 [ACK] Seq=279973 Ack=19728 Win=1040 Len=1360 [TCP segment of a reassembled PDU]"
"334","18.985442","192.168.0.183","104.244.42.65","TCP","1414","50717  >  443 [ACK] Seq=281333 Ack=19728 Win=1040 Len=1360 [TCP segment of a reassembled PDU]"
"335","18.985442","192.168.0.183","104.244.42.65","TCP","1414","50717  >  443 [ACK] Seq=282693 Ack=19728 Win=1040 Len=1360 [TCP segment of a reassembled PDU]"
"336","18.985442","192.168.0.183","104.244.42.65","TCP","1414","50717  >  443 [ACK] Seq=284053 Ack=19728 Win=1040 Len=1360 [TCP segment of a reassembled PDU]"
"337","18.985442","192.168.0.183","104.244.42.65","TCP","1414","50717  >  443 [ACK] Seq=285413 Ack=19728 Win=1040 Len=1360 [TCP segment of a reassembled PDU]"
"338","18.985442","192.168.0.183","104.244.42.65","TCP","1414","50717  >  443 [ACK] Seq=286773 Ack=19728 Win=1040 Len=1360 [TCP segment of a reassembled PDU]"
"339","18.985442","192.168.0.183","104.244.42.65","TCP","1414","50717  >  443 [ACK] Seq=288133 Ack=19728 Win=1040 Len=1360 [TCP segment of a reassembled PDU]"
"340","18.985442","192.168.0.183","104.244.42.65","TCP","1414","50717  >  443 [ACK] Seq=289493 Ack=19728 Win=1040 Len=1360 [TCP segment of a reassembled PDU]"
"341","18.985442","192.168.0.183","104.244.42.65","TCP","1414","50717  >  443 [ACK] Seq=290853 Ack=19728 Win=1040 Len=1360 [TCP segment of a reassembled PDU]"
"342","18.985442","192.168.0.183","104.244.42.65","TCP","1414","50717  >  443 [ACK] Seq=292213 Ack=19728 Win=1040 Len=1360 [TCP segment of a reassembled PDU]"
"343","18.985442","192.168.0.183","104.244.42.65","TLSv1.2","140","Application Data"
"344","18.985649","192.168.0.183","104.244.42.65","TCP","1414","50717  >  443 [ACK] Seq=293659 Ack=19728 Win=1040 Len=1360 [TCP segment of a reassembled PDU]"
"345","18.985649","192.168.0.183","104.244.42.65","TCP","1414","50717  >  443 [ACK] Seq=295019 Ack=19728 Win=1040 Len=1360 [TCP segment of a reassembled PDU]"
"346","18.985649","192.168.0.183","104.244.42.65","TCP","1414","50717  >  443 [ACK] Seq=296379 Ack=19728 Win=1040 Len=1360 [TCP segment of a reassembled PDU]"
"347","18.985649","192.168.0.183","104.244.42.65","TCP","1414","50717  >  443 [ACK] Seq=297739 Ack=19728 Win=1040 Len=1360 [TCP segment of a reassembled PDU]"
"348","18.985649","192.168.0.183","104.244.42.65","TCP","1414","50717  >  443 [ACK] Seq=299099 Ack=19728 Win=1040 Len=1360 [TCP segment of a reassembled PDU]"
"349","18.985649","192.168.0.183","104.244.42.65","TCP","1414","50717  >  443 [ACK] Seq=300459 Ack=19728 Win=1040 Len=1360 [TCP segment of a reassembled PDU]"
"350","18.985649","192.168.0.183","104.244.42.65","TCP","1414","50717  >  443 [ACK] Seq=301819 Ack=19728 Win=1040 Len=1360 [TCP segment of a reassembled PDU]"
"351","18.985649","192.168.0.183","104.244.42.65","TCP","1414","50717  >  443 [ACK] Seq=303179 Ack=19728 Win=1040 Len=1360 [TCP segment of a reassembled PDU]"
"352","18.985649","192.168.0.183","104.244.42.65","TCP","1414","50717  >  443 [ACK] Seq=304539 Ack=19728 Win=1040 Len=1360 [TCP segment of a reassembled PDU]"
"353","18.985649","192.168.0.183","104.244.42.65","TCP","1414","50717  >  443 [ACK] Seq=305899 Ack=19728 Win=1040 Len=1360 [TCP segment of a reassembled PDU]"
"354","18.985649","192.168.0.183","104.244.42.65","TCP","1414","50717  >  443 [ACK] Seq=307259 Ack=19728 Win=1040 Len=1360 [TCP segment of a reassembled PDU]"
"355","18.985649","192.168.0.183","104.244.42.65","TCP","1414","50717  >  443 [ACK] Seq=308619 Ack=19728 Win=1040 Len=1360 [TCP segment of a reassembled PDU]"
"356","18.985649","192.168.0.183","104.244.42.65","TLSv1.2","140","Application Data"
"357","18.985822","192.168.0.183","104.244.42.65","TCP","1414","50717  >  443 [ACK] Seq=310065 Ack=19728 Win=1040 Len=1360 [TCP segment of a reassembled PDU]"
"358","18.985822","192.168.0.183","104.244.42.65","TCP","1414","50717  >  443 [ACK] Seq=311425 Ack=19728 Win=1040 Len=1360 [TCP segment of a reassembled PDU]"
"359","18.985822","192.168.0.183","104.244.42.65","TCP","1414","50717  >  443 [ACK] Seq=312785 Ack=19728 Win=1040 Len=1360 [TCP segment of a reassembled PDU]"
"360","18.985822","192.168.0.183","104.244.42.65","TCP","1414","50717  >  443 [ACK] Seq=314145 Ack=19728 Win=1040 Len=1360 [TCP segment of a reassembled PDU]"
"361","18.985822","192.168.0.183","104.244.42.65","TCP","1414","50717  >  443 [ACK] Seq=315505 Ack=19728 Win=1040 Len=1360 [TCP segment of a reassembled PDU]"
"362","18.985822","192.168.0.183","104.244.42.65","TCP","1414","50717  >  443 [ACK] Seq=316865 Ack=19728 Win=1040 Len=1360 [TCP segment of a reassembled PDU]"
"363","18.985822","192.168.0.183","104.244.42.65","TCP","1414","50717  >  443 [ACK] Seq=318225 Ack=19728 Win=1040 Len=1360 [TCP segment of a reassembled PDU]"
"364","18.985822","192.168.0.183","104.244.42.65","TLSv1.2","253","Application Data"
"365","19.023022","104.244.42.65","192.168.0.183","TCP","60","443  >  50717 [ACK] Seq=19728 Ack=278613 Win=5729 Len=0"
"366","19.028981","104.244.42.65","192.168.0.183","TCP","60","443  >  50717 [ACK] Seq=19728 Ack=319784 Win=5727 Len=0"
"367","19.028981","104.244.42.65","192.168.0.183","TLSv1.2","89","Application Data"
"368","19.075669","104.244.42.65","192.168.0.183","TLSv1.2","199","Application Data"
"369","19.075706","192.168.0.183","104.244.42.65","TCP","54","50717  >  443 [ACK] Seq=319784 Ack=19908 Win=1039 Len=0"
"370","20.946925","192.168.0.183","104.244.42.65","TLSv1.2","245","Application Data"
"371","20.947014","192.168.0.183","104.244.42.65","TLSv1.2","231","Application Data"
"372","20.986253","104.244.42.65","192.168.0.183","TCP","60","443  >  50717 [ACK] Seq=19908 Ack=320152 Win=5735 Len=0"
"373","21.003288","104.244.42.65","192.168.0.183","TLSv1.2","182","Application Data"
"374","21.044738","192.168.0.183","104.244.42.65","TCP","54","50717  >  443 [ACK] Seq=320152 Ack=20036 Win=1039 Len=0"
"375","21.957948","192.168.0.183","104.244.42.65","TLSv1.2","327","Application Data"
"376","21.958153","192.168.0.183","104.244.42.65","TCP","1414","50717  >  443 [ACK] Seq=320425 Ack=20036 Win=1039 Len=1360 [TCP segment of a reassembled PDU]"
"377","21.958153","192.168.0.183","104.244.42.65","TCP","1414","50717  >  443 [ACK] Seq=321785 Ack=20036 Win=1039 Len=1360 [TCP segment of a reassembled PDU]"
"378","21.958153","192.168.0.183","104.244.42.65","TCP","1414","50717  >  443 [ACK] Seq=323145 Ack=20036 Win=1039 Len=1360 [TCP segment of a reassembled PDU]"
"379","21.958153","192.168.0.183","104.244.42.65","TCP","1414","50717  >  443 [ACK] Seq=324505 Ack=20036 Win=1039 Len=1360 [TCP segment of a reassembled PDU]"
"380","21.958153","192.168.0.183","104.244.42.65","TCP","1414","50717  >  443 [ACK] Seq=325865 Ack=20036 Win=1039 Len=1360 [TCP segment of a reassembled PDU]"
"381","21.958153","192.168.0.183","104.244.42.65","TCP","1414","50717  >  443 [ACK] Seq=327225 Ack=20036 Win=1039 Len=1360 [TCP segment of a reassembled PDU]"
"382","21.958153","192.168.0.183","104.244.42.65","TCP","1414","50717  >  443 [ACK] Seq=328585 Ack=20036 Win=1039 Len=1360 [TCP segment of a reassembled PDU]"
"383","21.958153","192.168.0.183","104.244.42.65","TCP","1414","50717  >  443 [ACK] Seq=329945 Ack=20036 Win=1039 Len=1360 [TCP segment of a reassembled PDU]"
"384","21.958153","192.168.0.183","104.244.42.65","TCP","1414","50717  >  443 [ACK] Seq=331305 Ack=20036 Win=1039 Len=1360 [TCP segment of a reassembled PDU]"
"385","21.958153","192.168.0.183","104.244.42.65","TCP","1414","50717  >  443 [ACK] Seq=332665 Ack=20036 Win=1039 Len=1360 [TCP segment of a reassembled PDU]"
"386","21.958153","192.168.0.183","104.244.42.65","TCP","1414","50717  >  443 [ACK] Seq=334025 Ack=20036 Win=1039 Len=1360 [TCP segment of a reassembled PDU]"
"387","21.958153","192.168.0.183","104.244.42.65","TCP","1414","50717  >  443 [ACK] Seq=335385 Ack=20036 Win=1039 Len=1360 [TCP segment of a reassembled PDU]"
"388","21.958153","192.168.0.183","104.244.42.65","TLSv1.2","140","Application Data"
"389","21.958318","192.168.0.183","104.244.42.65","TCP","1414","50717  >  443 [ACK] Seq=336831 Ack=20036 Win=1039 Len=1360 [TCP segment of a reassembled PDU]"
"390","21.958318","192.168.0.183","104.244.42.65","TCP","1414","50717  >  443 [ACK] Seq=338191 Ack=20036 Win=1039 Len=1360 [TCP segment of a reassembled PDU]"
"391","21.958318","192.168.0.183","104.244.42.65","TCP","1414","50717  >  443 [ACK] Seq=339551 Ack=20036 Win=1039 Len=1360 [TCP segment of a reassembled PDU]"
"392","21.958318","192.168.0.183","104.244.42.65","TCP","1414","50717  >  443 [ACK] Seq=340911 Ack=20036 Win=1039 Len=1360 [TCP segment of a reassembled PDU]"
"393","21.958318","192.168.0.183","104.244.42.65","TCP","1414","50717  >  443 [ACK] Seq=342271 Ack=20036 Win=1039 Len=1360 [TCP segment of a reassembled PDU]"
"394","21.958318","192.168.0.183","104.244.42.65","TCP","1414","50717  >  443 [ACK] Seq=343631 Ack=20036 Win=1039 Len=1360 [TCP segment of a reassembled PDU]"
"395","21.958318","192.168.0.183","104.244.42.65","TCP","1414","50717  >  443 [ACK] Seq=344991 Ack=20036 Win=1039 Len=1360 [TCP segment of a reassembled PDU]"
"396","21.958318","192.168.0.183","104.244.42.65","TCP","1414","50717  >  443 [ACK] Seq=346351 Ack=20036 Win=1039 Len=1360 [TCP segment of a reassembled PDU]"
"397","21.958318","192.168.0.183","104.244.42.65","TCP","1414","50717  >  443 [ACK] Seq=347711 Ack=20036 Win=1039 Len=1360 [TCP segment of a reassembled PDU]"
"398","21.958318","192.168.0.183","104.244.42.65","TCP","1414","50717  >  443 [ACK] Seq=349071 Ack=20036 Win=1039 Len=1360 [TCP segment of a reassembled PDU]"
"399","21.958318","192.168.0.183","104.244.42.65","TCP","1414","50717  >  443 [ACK] Seq=350431 Ack=20036 Win=1039 Len=1360 [TCP segment of a reassembled PDU]"
"400","21.958318","192.168.0.183","104.244.42.65","TCP","1414","50717  >  443 [ACK] Seq=351791 Ack=20036 Win=1039 Len=1360 [TCP segment of a reassembled PDU]"
"401","21.958318","192.168.0.183","104.244.42.65","TLSv1.2","140","Application Data"
"402","21.958438","192.168.0.183","104.244.42.65","TCP","1414","50717  >  443 [ACK] Seq=353237 Ack=20036 Win=1039 Len=1360 [TCP segment of a reassembled PDU]"
"403","21.958438","192.168.0.183","104.244.42.65","TCP","1414","50717  >  443 [ACK] Seq=354597 Ack=20036 Win=1039 Len=1360 [TCP segment of a reassembled PDU]"
"404","21.958438","192.168.0.183","104.244.42.65","TCP","1414","50717  >  443 [ACK] Seq=355957 Ack=20036 Win=1039 Len=1360 [TCP segment of a reassembled PDU]"
"405","21.958438","192.168.0.183","104.244.42.65","TCP","1414","50717  >  443 [ACK] Seq=357317 Ack=20036 Win=1039 Len=1360 [TCP segment of a reassembled PDU]"
"406","21.958438","192.168.0.183","104.244.42.65","TCP","1414","50717  >  443 [ACK] Seq=358677 Ack=20036 Win=1039 Len=1360 [TCP segment of a reassembled PDU]"
"407","21.958438","192.168.0.183","104.244.42.65","TCP","1414","50717  >  443 [ACK] Seq=360037 Ack=20036 Win=1039 Len=1360 [TCP segment of a reassembled PDU]"
"408","21.958438","192.168.0.183","104.244.42.65","TLSv1.2","117","Application Data"
"409","21.994729","104.244.42.65","192.168.0.183","TCP","60","443  >  50717 [ACK] Seq=20036 Ack=323145 Win=5729 Len=0"
"410","22.000261","104.244.42.65","192.168.0.183","TCP","60","443  >  50717 [ACK] Seq=20036 Ack=361460 Win=5735 Len=0"
"411","22.000261","104.244.42.65","192.168.0.183","TLSv1.2","89","Application Data"
"412","22.044302","104.244.42.65","192.168.0.183","TLSv1.2","183","Application Data"
"413","22.044340","192.168.0.183","104.244.42.65","TCP","54","50717  >  443 [ACK] Seq=361460 Ack=20200 Win=1038 Len=0"
"414","25.627388","192.168.0.183","104.244.42.65","TLSv1.2","684","Application Data"
"415","25.627572","192.168.0.183","104.244.42.65","TCP","1414","50717  >  443 [ACK] Seq=362090 Ack=20200 Win=1038 Len=1360 [TCP segment of a reassembled PDU]"
"416","25.627572","192.168.0.183","104.244.42.65","TCP","1414","50717  >  443 [ACK] Seq=363450 Ack=20200 Win=1038 Len=1360 [TCP segment of a reassembled PDU]"
"417","25.627572","192.168.0.183","104.244.42.65","TCP","1414","50717  >  443 [ACK] Seq=364810 Ack=20200 Win=1038 Len=1360 [TCP segment of a reassembled PDU]"
"418","25.627572","192.168.0.183","104.244.42.65","TCP","1414","50717  >  443 [ACK] Seq=366170 Ack=20200 Win=1038 Len=1360 [TCP segment of a reassembled PDU]"
"419","25.627572","192.168.0.183","104.244.42.65","TCP","1414","50717  >  443 [ACK] Seq=367530 Ack=20200 Win=1038 Len=1360 [TCP segment of a reassembled PDU]"
"420","25.627572","192.168.0.183","104.244.42.65","TCP","1414","50717  >  443 [ACK] Seq=368890 Ack=20200 Win=1038 Len=1360 [TCP segment of a reassembled PDU]"
"421","25.627572","192.168.0.183","104.244.42.65","TCP","1414","50717  >  443 [ACK] Seq=370250 Ack=20200 Win=1038 Len=1360 [TCP segment of a reassembled PDU]"
"422","25.627572","192.168.0.183","104.244.42.65","TCP","1414","50717  >  443 [ACK] Seq=371610 Ack=20200 Win=1038 Len=1360 [TCP segment of a reassembled PDU]"
"423","25.627572","192.168.0.183","104.244.42.65","TCP","1414","50717  >  443 [ACK] Seq=372970 Ack=20200 Win=1038 Len=1360 [TCP segment of a reassembled PDU]"
"424","25.627572","192.168.0.183","104.244.42.65","TLSv1.2","1087","Application Data"
"425","25.664737","104.244.42.65","192.168.0.183","TCP","60","443  >  50717 [ACK] Seq=20200 Ack=374330 Win=5703 Len=0"
"426","25.692013","104.244.42.65","192.168.0.183","TLSv1.2","184","Application Data"
"427","25.739474","192.168.0.183","104.244.42.65","TCP","54","50717  >  443 [ACK] Seq=375363 Ack=20330 Win=1037 Len=0"
"428","28.609957","192.168.0.183","104.244.42.65","TLSv1.2","552","Application Data"
"429","28.610089","192.168.0.183","104.244.42.65","TCP","1414","50717  >  443 [ACK] Seq=375861 Ack=20330 Win=1037 Len=1360 [TCP segment of a reassembled PDU]"
"430","28.610089","192.168.0.183","104.244.42.65","TCP","1414","50717  >  443 [ACK] Seq=377221 Ack=20330 Win=1037 Len=1360 [TCP segment of a reassembled PDU]"
"431","28.610089","192.168.0.183","104.244.42.65","TCP","1414","50717  >  443 [ACK] Seq=378581 Ack=20330 Win=1037 Len=1360 [TCP segment of a reassembled PDU]"
"432","28.610089","192.168.0.183","104.244.42.65","TCP","1414","50717  >  443 [ACK] Seq=379941 Ack=20330 Win=1037 Len=1360 [TCP segment of a reassembled PDU]"
"433","28.610089","192.168.0.183","104.244.42.65","TCP","1414","50717  >  443 [ACK] Seq=381301 Ack=20330 Win=1037 Len=1360 [TCP segment of a reassembled PDU]"
"434","28.610089","192.168.0.183","104.244.42.65","TCP","1414","50717  >  443 [ACK] Seq=382661 Ack=20330 Win=1037 Len=1360 [TCP segment of a reassembled PDU]"
"435","28.610089","192.168.0.183","104.244.42.65","TCP","1414","50717  >  443 [ACK] Seq=384021 Ack=20330 Win=1037 Len=1360 [TCP segment of a reassembled PDU]"
"436","28.610089","192.168.0.183","104.244.42.65","TCP","1414","50717  >  443 [ACK] Seq=385381 Ack=20330 Win=1037 Len=1360 [TCP segment of a reassembled PDU]"
"437","28.610089","192.168.0.183","104.244.42.65","TCP","1414","50717  >  443 [ACK] Seq=386741 Ack=20330 Win=1037 Len=1360 [TCP segment of a reassembled PDU]"
"438","28.610089","192.168.0.183","104.244.42.65","TLSv1.2","1049","Application Data"
"439","28.646416","104.244.42.65","192.168.0.183","TCP","60","443  >  50717 [ACK] Seq=20330 Ack=378581 Win=5727 Len=0"
"440","28.661839","104.244.42.65","192.168.0.183","TCP","60","443  >  50717 [ACK] Seq=20330 Ack=389096 Win=5735 Len=0"
"441","28.678793","104.244.42.65","192.168.0.183","TLSv1.2","201","Application Data"
"442","28.725408","192.168.0.183","104.244.42.65","TCP","54","50717  >  443 [ACK] Seq=389096 Ack=20477 Win=1037 Len=0"
"443","31.632520","192.168.0.183","104.244.42.65","TLSv1.2","407","Application Data"
"444","31.632586","192.168.0.183","104.244.42.65","TLSv1.2","168","Application Data"
"445","31.641295","192.168.0.183","104.244.42.65","TLSv1.2","305","Application Data"
"446","31.641444","192.168.0.183","104.244.42.65","TCP","1414","50717  >  443 [ACK] Seq=389814 Ack=20477 Win=1037 Len=1360 [TCP segment of a reassembled PDU]"
"447","31.641444","192.168.0.183","104.244.42.65","TCP","1414","50717  >  443 [ACK] Seq=391174 Ack=20477 Win=1037 Len=1360 [TCP segment of a reassembled PDU]"
"448","31.641444","192.168.0.183","104.244.42.65","TLSv1.2","1378","Application Data"
"449","31.679069","104.244.42.65","192.168.0.183","TCP","60","443  >  50717 [ACK] Seq=20477 Ack=389814 Win=5735 Len=0"
"450","31.685652","104.244.42.65","192.168.0.183","TCP","60","443  >  50717 [ACK] Seq=20477 Ack=392534 Win=5729 Len=0"
"451","31.706179","104.244.42.65","192.168.0.183","TLSv1.2","184","Application Data"
"452","31.752280","104.244.42.65","192.168.0.183","TLSv1.2","303","Application Data"
"453","31.752439","192.168.0.183","104.244.42.65","TCP","54","50717  >  443 [ACK] Seq=393858 Ack=20856 Win=1041 Len=0"
"454","31.753371","192.168.0.183","104.244.42.65","TLSv1.2","89","Application Data"
"455","31.828232","104.244.42.65","192.168.0.183","TCP","60","443  >  50717 [ACK] Seq=20856 Ack=393893 Win=5735 Len=0"
"456","35.204068","192.168.0.183","104.244.42.65","TLSv1.2","261","Application Data"
"457","35.204221","192.168.0.183","104.244.42.65","TCP","1414","50717  >  443 [ACK] Seq=394100 Ack=20856 Win=1041 Len=1360 [TCP segment of a reassembled PDU]"
"458","35.204221","192.168.0.183","104.244.42.65","TCP","1414","50717  >  443 [ACK] Seq=395460 Ack=20856 Win=1041 Len=1360 [TCP segment of a reassembled PDU]"
"459","35.204221","192.168.0.183","104.244.42.65","TCP","1414","50717  >  443 [ACK] Seq=396820 Ack=20856 Win=1041 Len=1360 [TCP segment of a reassembled PDU]"
"460","35.204221","192.168.0.183","104.244.42.65","TCP","1414","50717  >  443 [ACK] Seq=398180 Ack=20856 Win=1041 Len=1360 [TCP segment of a reassembled PDU]"
"461","35.204221","192.168.0.183","104.244.42.65","TCP","1414","50717  >  443 [ACK] Seq=399540 Ack=20856 Win=1041 Len=1360 [TCP segment of a reassembled PDU]"
"462","35.204221","192.168.0.183","104.244.42.65","TCP","1414","50717  >  443 [ACK] Seq=400900 Ack=20856 Win=1041 Len=1360 [TCP segment of a reassembled PDU]"
"463","35.204221","192.168.0.183","104.244.42.65","TCP","1414","50717  >  443 [ACK] Seq=402260 Ack=20856 Win=1041 Len=1360 [TCP segment of a reassembled PDU]"
"464","35.204221","192.168.0.183","104.244.42.65","TLSv1.2","700","Application Data"
"465","35.240264","104.244.42.65","192.168.0.183","TCP","60","443  >  50717 [ACK] Seq=20856 Ack=395460 Win=5732 Len=0"
"466","35.246950","104.244.42.65","192.168.0.183","TCP","60","443  >  50717 [ACK] Seq=20856 Ack=404266 Win=5727 Len=0"
"467","35.269420","104.244.42.65","192.168.0.183","TLSv1.2","288","Application Data"
"468","35.317489","192.168.0.183","104.244.42.65","TCP","54","50717  >  443 [ACK] Seq=404266 Ack=21090 Win=1040 Len=0"
"469","38.192457","192.168.0.183","104.244.42.65","TLSv1.2","246","Application Data"
"470","38.192623","192.168.0.183","104.244.42.65","TCP","1414","50717  >  443 [ACK] Seq=404458 Ack=21090 Win=1040 Len=1360 [TCP segment of a reassembled PDU]"
"471","38.192623","192.168.0.183","104.244.42.65","TCP","1414","50717  >  443 [ACK] Seq=405818 Ack=21090 Win=1040 Len=1360 [TCP segment of a reassembled PDU]"
"472","38.192623","192.168.0.183","104.244.42.65","TCP","1414","50717  >  443 [ACK] Seq=407178 Ack=21090 Win=1040 Len=1360 [TCP segment of a reassembled PDU]"
"473","38.192623","192.168.0.183","104.244.42.65","TCP","1414","50717  >  443 [ACK] Seq=408538 Ack=21090 Win=1040 Len=1360 [TCP segment of a reassembled PDU]"
"474","38.192623","192.168.0.183","104.244.42.65","TCP","1414","50717  >  443 [ACK] Seq=409898 Ack=21090 Win=1040 Len=1360 [TCP segment of a reassembled PDU]"
"475","38.192623","192.168.0.183","104.244.42.65","TCP","1414","50717  >  443 [ACK] Seq=411258 Ack=21090 Win=1040 Len=1360 [TCP segment of a reassembled PDU]"
"476","38.192623","192.168.0.183","104.244.42.65","TCP","1414","50717  >  443 [ACK] Seq=412618 Ack=21090 Win=1040 Len=1360 [TCP segment of a reassembled PDU]"
"477","38.192623","192.168.0.183","104.244.42.65","TCP","1414","50717  >  443 [ACK] Seq=413978 Ack=21090 Win=1040 Len=1360 [TCP segment of a reassembled PDU]"
"478","38.192623","192.168.0.183","104.244.42.65","TCP","1414","50717  >  443 [ACK] Seq=415338 Ack=21090 Win=1040 Len=1360 [TCP segment of a reassembled PDU]"
"479","38.192623","192.168.0.183","104.244.42.65","TCP","1414","50717  >  443 [ACK] Seq=416698 Ack=21090 Win=1040 Len=1360 [TCP segment of a reassembled PDU]"
"480","38.192623","192.168.0.183","104.244.42.65","TCP","1414","50717  >  443 [ACK] Seq=418058 Ack=21090 Win=1040 Len=1360 [TCP segment of a reassembled PDU]"
"481","38.192623","192.168.0.183","104.244.42.65","TCP","1414","50717  >  443 [ACK] Seq=419418 Ack=21090 Win=1040 Len=1360 [TCP segment of a reassembled PDU]"
"482","38.192623","192.168.0.183","104.244.42.65","TLSv1.2","140","Application Data"
"483","38.192767","192.168.0.183","104.244.42.65","TCP","1414","50717  >  443 [ACK] Seq=420864 Ack=21090 Win=1040 Len=1360 [TCP segment of a reassembled PDU]"
"484","38.192767","192.168.0.183","104.244.42.65","TCP","1414","50717  >  443 [ACK] Seq=422224 Ack=21090 Win=1040 Len=1360 [TCP segment of a reassembled PDU]"
"485","38.192767","192.168.0.183","104.244.42.65","TLSv1.2","1163","Application Data"
"486","38.231173","104.244.42.65","192.168.0.183","TCP","60","443  >  50717 [ACK] Seq=21090 Ack=407178 Win=5729 Len=0"
"487","38.251374","104.244.42.65","192.168.0.183","TCP","60","443  >  50717 [ACK] Seq=21090 Ack=424693 Win=5692 Len=0"
"488","38.263648","104.244.42.65","192.168.0.183","TLSv1.2","262","Application Data"
"489","38.311459","192.168.0.183","104.244.42.65","TCP","54","50717  >  443 [ACK] Seq=424693 Ack=21298 Win=1039 Len=0"
