"No.","Time","Source","Destination","Protocol","Length","Info"
"1","0.000000","192.168.0.183","104.244.42.65","TLSv1.2","235","Application Data"
"2","0.000092","192.168.0.183","104.244.42.65","TCP","1414","50717  >  443 [ACK] Seq=182 Ack=1 Win=1036 Len=1360 [TCP segment of a reassembled PDU]"
"3","0.000092","192.168.0.183","104.244.42.65","TLSv1.2","68","Application Data"
"4","0.037727","104.244.42.65","192.168.0.183","TCP","60","443  >  50717 [ACK] Seq=1 Ack=1556 Win=7926 Len=0"
"5","0.058687","104.244.42.65","192.168.0.183","TLSv1.2","184","Application Data"
"6","0.110318","192.168.0.183","104.244.42.65","TCP","54","50717  >  443 [ACK] Seq=1556 Ack=131 Win=1036 Len=0"
"7","0.336210","192.168.0.183","104.244.42.65","TCP","1414","50717  >  443 [ACK] Seq=1556 Ack=131 Win=1036 Len=1360 [TCP segment of a reassembled PDU]"
"8","0.336210","192.168.0.183","104.244.42.65","TLSv1.2","141","Application Data"
"9","0.336607","192.168.0.183","104.244.42.65","TLSv1.2","357","Application Data"
"10","0.373489","104.244.42.65","192.168.0.183","TCP","60","443  >  50717 [ACK] Seq=131 Ack=3306 Win=7926 Len=0"
"11","0.754424","104.244.42.65","192.168.0.183","TLSv1.2","189","Application Data"
"12","0.806191","192.168.0.183","104.244.42.65","TCP","54","50717  >  443 [ACK] Seq=3306 Ack=266 Win=1041 Len=0"
"13","1.640942","104.244.42.65","192.168.0.183","TCP","1414","443  >  50717 [ACK] Seq=266 Ack=3306 Win=7930 Len=1360 [TCP segment of a reassembled PDU]"
"14","1.640942","104.244.42.65","192.168.0.183","TCP","1414","443  >  50717 [ACK] Seq=1626 Ack=3306 Win=7930 Len=1360 [TCP segment of a reassembled PDU]"
"15","1.640942","104.244.42.65","192.168.0.183","TCP","1414","443  >  50717 [PSH, ACK] Seq=2986 Ack=3306 Win=7930 Len=1360 [TCP segment of a reassembled PDU]"
"16","1.640942","104.244.42.65","192.168.0.183","TCP","1414","443  >  50717 [ACK] Seq=4346 Ack=3306 Win=7930 Len=1360 [TCP segment of a reassembled PDU]"
"17","1.640942","104.244.42.65","192.168.0.183","TCP","1414","443  >  50717 [ACK] Seq=5706 Ack=3306 Win=7930 Len=1360 [TCP segment of a reassembled PDU]"
"18","1.640942","104.244.42.65","192.168.0.183","TCP","1414","443  >  50717 [PSH, ACK] Seq=7066 Ack=3306 Win=7930 Len=1360 [TCP segment of a reassembled PDU]"
"19","1.640942","104.244.42.65","192.168.0.183","TCP","1414","443  >  50717 [ACK] Seq=8426 Ack=3306 Win=7930 Len=1360 [TCP segment of a reassembled PDU]"
"20","1.640942","104.244.42.65","192.168.0.183","TCP","1414","443  >  50717 [ACK] Seq=9786 Ack=3306 Win=7930 Len=1360 [TCP segment of a reassembled PDU]"
"21","1.640942","104.244.42.65","192.168.0.183","TCP","1414","443  >  50717 [PSH, ACK] Seq=11146 Ack=3306 Win=7930 Len=1360 [TCP segment of a reassembled PDU]"
"22","1.640942","104.244.42.65","192.168.0.183","TCP","1414","443  >  50717 [ACK] Seq=12506 Ack=3306 Win=7930 Len=1360 [TCP segment of a reassembled PDU]"
"23","1.640942","104.244.42.65","192.168.0.183","TCP","1414","443  >  50717 [ACK] Seq=13866 Ack=3306 Win=7930 Len=1360 [TCP segment of a reassembled PDU]"
"24","1.640942","104.244.42.65","192.168.0.183","TCP","1414","443  >  50717 [PSH, ACK] Seq=15226 Ack=3306 Win=7930 Len=1360 [TCP segment of a reassembled PDU]"
"25","1.640942","104.244.42.65","192.168.0.183","TLSv1.2","1414","Application Data"
"26","1.640942","104.244.42.65","192.168.0.183","TCP","1414","443  >  50717 [ACK] Seq=17946 Ack=3306 Win=7930 Len=1360 [TCP segment of a reassembled PDU]"
"27","1.640942","104.244.42.65","192.168.0.183","TCP","1414","443  >  50717 [PSH, ACK] Seq=19306 Ack=3306 Win=7930 Len=1360 [TCP segment of a reassembled PDU]"
"28","1.640942","104.244.42.65","192.168.0.183","TCP","1414","443  >  50717 [ACK] Seq=20666 Ack=3306 Win=7930 Len=1360 [TCP segment of a reassembled PDU]"
"29","1.641050","192.168.0.183","104.244.42.65","TCP","54","50717  >  443 [ACK] Seq=3306 Ack=22026 Win=1041 Len=0"
"30","1.642144","104.244.42.65","192.168.0.183","TCP","1414","443  >  50717 [ACK] Seq=22026 Ack=3306 Win=7930 Len=1360 [TCP segment of a reassembled PDU]"
"31","1.642144","104.244.42.65","192.168.0.183","TLSv1.2","575","Application Data"
"32","1.642165","192.168.0.183","104.244.42.65","TCP","54","50717  >  443 [ACK] Seq=3306 Ack=23907 Win=1041 Len=0"
"33","1.843530","192.168.0.183","104.244.42.65","TLSv1.2","256","Application Data"
"34","1.843705","192.168.0.183","104.244.42.65","TLSv1.2","799","Application Data"
"35","1.882588","104.244.42.65","192.168.0.183","TCP","60","443  >  50717 [ACK] Seq=23907 Ack=4253 Win=7930 Len=0"
"36","1.910096","104.244.42.65","192.168.0.183","TLSv1.2","292","Application Data"
"37","1.957574","192.168.0.183","104.244.42.65","TCP","54","50717  >  443 [ACK] Seq=4253 Ack=24145 Win=1040 Len=0"
"38","3.002030","192.168.0.183","104.244.42.65","TLSv1.2","689","Application Data"
"39","3.002165","192.168.0.183","104.244.42.65","TCP","1414","50717  >  443 [ACK] Seq=4888 Ack=24145 Win=1040 Len=1360 [TCP segment of a reassembled PDU]"
"40","3.002165","192.168.0.183","104.244.42.65","TCP","1414","50717  >  443 [ACK] Seq=6248 Ack=24145 Win=1040 Len=1360 [TCP segment of a reassembled PDU]"
"41","3.002165","192.168.0.183","104.244.42.65","TCP","1414","50717  >  443 [ACK] Seq=7608 Ack=24145 Win=1040 Len=1360 [TCP segment of a reassembled PDU]"
"42","3.002165","192.168.0.183","104.244.42.65","TCP","1414","50717  >  443 [ACK] Seq=8968 Ack=24145 Win=1040 Len=1360 [TCP segment of a reassembled PDU]"
"43","3.002165","192.168.0.183","104.244.42.65","TCP","1414","50717  >  443 [ACK] Seq=10328 Ack=24145 Win=1040 Len=1360 [TCP segment of a reassembled PDU]"
"44","3.002165","192.168.0.183","104.244.42.65","TCP","1414","50717  >  443 [ACK] Seq=11688 Ack=24145 Win=1040 Len=1360 [TCP segment of a reassembled PDU]"
"45","3.002165","192.168.0.183","104.244.42.65","TCP","1414","50717  >  443 [ACK] Seq=13048 Ack=24145 Win=1040 Len=1360 [TCP segment of a reassembled PDU]"
"46","3.002165","192.168.0.183","104.244.42.65","TCP","1414","50717  >  443 [ACK] Seq=14408 Ack=24145 Win=1040 Len=1360 [TCP segment of a reassembled PDU]"
"47","3.002165","192.168.0.183","104.244.42.65","TCP","1414","50717  >  443 [ACK] Seq=15768 Ack=24145 Win=1040 Len=1360 [TCP segment of a reassembled PDU]"
"48","3.002165","192.168.0.183","104.244.42.65","TCP","1414","50717  >  443 [ACK] Seq=17128 Ack=24145 Win=1040 Len=1360 [TCP segment of a reassembled PDU]"
"49","3.002165","192.168.0.183","104.244.42.65","TCP","1414","50717  >  443 [ACK] Seq=18488 Ack=24145 Win=1040 Len=1360 [TCP segment of a reassembled PDU]"
"50","3.002165","192.168.0.183","104.244.42.65","TCP","1414","50717  >  443 [ACK] Seq=19848 Ack=24145 Win=1040 Len=1360 [TCP segment of a reassembled PDU]"
"51","3.002165","192.168.0.183","104.244.42.65","TLSv1.2","140","Application Data"
"52","3.002321","192.168.0.183","104.244.42.65","TCP","1414","50717  >  443 [ACK] Seq=21294 Ack=24145 Win=1040 Len=1360 [TCP segment of a reassembled PDU]"
"53","3.002321","192.168.0.183","104.244.42.65","TCP","1414","50717  >  443 [ACK] Seq=22654 Ack=24145 Win=1040 Len=1360 [TCP segment of a reassembled PDU]"
"54","3.002321","192.168.0.183","104.244.42.65","TCP","1414","50717  >  443 [ACK] Seq=24014 Ack=24145 Win=1040 Len=1360 [TCP segment of a reassembled PDU]"
"55","3.002321","192.168.0.183","104.244.42.65","TCP","1414","50717  >  443 [ACK] Seq=25374 Ack=24145 Win=1040 Len=1360 [TCP segment of a reassembled PDU]"
"56","3.002321","192.168.0.183","104.244.42.65","TCP","1414","50717  >  443 [ACK] Seq=26734 Ack=24145 Win=1040 Len=1360 [TCP segment of a reassembled PDU]"
"57","3.002321","192.168.0.183","104.244.42.65","TCP","1414","50717  >  443 [ACK] Seq=28094 Ack=24145 Win=1040 Len=1360 [TCP segment of a reassembled PDU]"
"58","3.002321","192.168.0.183","104.244.42.65","TCP","1414","50717  >  443 [ACK] Seq=29454 Ack=24145 Win=1040 Len=1360 [TCP segment of a reassembled PDU]"
"59","3.002321","192.168.0.183","104.244.42.65","TCP","1414","50717  >  443 [ACK] Seq=30814 Ack=24145 Win=1040 Len=1360 [TCP segment of a reassembled PDU]"
"60","3.002321","192.168.0.183","104.244.42.65","TCP","1414","50717  >  443 [ACK] Seq=32174 Ack=24145 Win=1040 Len=1360 [TCP segment of a reassembled PDU]"
"61","3.002321","192.168.0.183","104.244.42.65","TCP","1414","50717  >  443 [ACK] Seq=33534 Ack=24145 Win=1040 Len=1360 [TCP segment of a reassembled PDU]"
"62","3.002321","192.168.0.183","104.244.42.65","TCP","1414","50717  >  443 [ACK] Seq=34894 Ack=24145 Win=1040 Len=1360 [TCP segment of a reassembled PDU]"
"63","3.002321","192.168.0.183","104.244.42.65","TCP","1414","50717  >  443 [ACK] Seq=36254 Ack=24145 Win=1040 Len=1360 [TCP segment of a reassembled PDU]"
"64","3.002321","192.168.0.183","104.244.42.65","TLSv1.2","140","Application Data"
"65","3.002430","192.168.0.183","104.244.42.65","TCP","1414","50717  >  443 [ACK] Seq=37700 Ack=24145 Win=1040 Len=1360 [TCP segment of a reassembled PDU]"
"66","3.002430","192.168.0.183","104.244.42.65","TCP","1414","50717  >  443 [ACK] Seq=39060 Ack=24145 Win=1040 Len=1360 [TCP segment of a reassembled PDU]"
"67","3.002430","192.168.0.183","104.244.42.65","TCP","1414","50717  >  443 [ACK] Seq=40420 Ack=24145 Win=1040 Len=1360 [TCP segment of a reassembled PDU]"
"68","3.002430","192.168.0.183","104.244.42.65","TCP","1414","50717  >  443 [ACK] Seq=41780 Ack=24145 Win=1040 Len=1360 [TCP segment of a reassembled PDU]"
"69","3.002430","192.168.0.183","104.244.42.65","TLSv1.2","123","Application Data"
"70","3.039709","104.244.42.65","192.168.0.183","TCP","60","443  >  50717 [ACK] Seq=24145 Ack=6248 Win=7926 Len=0"
"71","3.045011","104.244.42.65","192.168.0.183","TCP","60","443  >  50717 [ACK] Seq=24145 Ack=43209 Win=7893 Len=0"
"72","3.045011","104.244.42.65","192.168.0.183","TLSv1.2","89","Application Data"
"73","3.094460","192.168.0.183","104.244.42.65","TCP","54","50717  >  443 [ACK] Seq=43209 Ack=24180 Win=1040 Len=0"
"74","3.100042","104.244.42.65","192.168.0.183","TLSv1.2","182","Application Data"
"75","3.140334","192.168.0.183","104.244.42.65","TCP","54","50717  >  443 [ACK] Seq=43209 Ack=24308 Win=1039 Len=0"
"76","6.725890","192.168.0.183","104.244.42.65","TLSv1.2","548","Application Data"
"77","6.725978","192.168.0.183","104.244.42.65","TLSv1.2","595","Application Data"
"78","6.759141","192.168.0.183","104.244.42.65","TLSv1.2","418","Application Data"
"79","6.759210","192.168.0.183","104.244.42.65","TLSv1.2","168","Application Data"
"80","6.759610","192.168.0.183","104.244.42.65","TLSv1.2","243","Application Data"
"81","6.759679","192.168.0.183","104.244.42.65","TCP","1414","50717  >  443 [ACK] Seq=44911 Ack=24308 Win=1039 Len=1360 [TCP segment of a reassembled PDU]"
"82","6.759679","192.168.0.183","104.244.42.65","TLSv1.2","545","Application Data"
"83","6.765493","104.244.42.65","192.168.0.183","TCP","60","443  >  50717 [ACK] Seq=24308 Ack=44244 Win=7930 Len=0"
"84","6.785733","104.244.42.65","192.168.0.183","TLSv1.2","180","Application Data"
"85","6.794852","104.244.42.65","192.168.0.183","TCP","60","443  >  50717 [ACK] Seq=24434 Ack=44722 Win=7930 Len=0"
"86","6.802304","104.244.42.65","192.168.0.183","TCP","60","443  >  50717 [ACK] Seq=24434 Ack=46762 Win=7926 Len=0"
"87","6.820222","104.244.42.65","192.168.0.183","TLSv1.2","138","Application Data"
"88","6.820276","192.168.0.183","104.244.42.65","TCP","54","50717  >  443 [ACK] Seq=46762 Ack=24518 Win=1038 Len=0"
"89","6.868562","104.244.42.65","192.168.0.183","TLSv1.2","220","Application Data"
"90","6.869290","192.168.0.183","104.244.42.65","TLSv1.2","89","Application Data"
"91","6.948636","104.244.42.65","192.168.0.183","TCP","60","443  >  50717 [ACK] Seq=24684 Ack=46797 Win=7930 Len=0"
"92","9.745855","192.168.0.183","104.244.42.65","TLSv1.2","316","Application Data"
"93","9.745943","192.168.0.183","104.244.42.65","TCP","1414","50717  >  443 [ACK] Seq=47059 Ack=24684 Win=1038 Len=1360 [TCP segment of a reassembled PDU]"
"94","9.745943","192.168.0.183","104.244.42.65","TLSv1.2","1149","Application Data"
"95","9.791391","104.244.42.65","192.168.0.183","TCP","60","443  >  50717 [ACK] Seq=24684 Ack=49514 Win=7929 Len=0"
"96","9.810615","104.244.42.65","192.168.0.183","TLSv1.2","184","Application Data"
"97","9.865300","192.168.0.183","104.244.42.65","TCP","54","50717  >  443 [ACK] Seq=49514 Ack=24814 Win=1037 Len=0"
"98","11.434939","192.168.0.183","104.244.42.65","TCP","1414","50717  >  443 [ACK] Seq=49514 Ack=24814 Win=1037 Len=1360 [TCP segment of a reassembled PDU]"
"99","11.434939","192.168.0.183","104.244.42.65","TLSv1.2","210","Application Data"
"100","11.435074","192.168.0.183","104.244.42.65","TLSv1.2","255","Application Data"
"101","11.435136","192.168.0.183","104.244.42.65","TCP","1414","50717  >  443 [ACK] Seq=51231 Ack=24814 Win=1037 Len=1360 [TCP segment of a reassembled PDU]"
"102","11.435136","192.168.0.183","104.244.42.65","TLSv1.2","227","Application Data"
"103","11.472952","104.244.42.65","192.168.0.183","TCP","60","443  >  50717 [ACK] Seq=24814 Ack=51231 Win=7926 Len=0"
"104","11.479099","104.244.42.65","192.168.0.183","TCP","60","443  >  50717 [ACK] Seq=24814 Ack=52764 Win=7927 Len=0"
"105","11.496837","104.244.42.65","192.168.0.183","TLSv1.2","184","Application Data"
"106","11.551201","192.168.0.183","104.244.42.65","TCP","54","50717  >  443 [ACK] Seq=52764 Ack=24944 Win=1037 Len=0"
"107","13.185368","104.244.42.65","192.168.0.183","TCP","1414","443  >  50717 [ACK] Seq=24944 Ack=52764 Win=7930 Len=1360 [TCP segment of a reassembled PDU]"
"108","13.185368","104.244.42.65","192.168.0.183","TCP","1414","443  >  50717 [ACK] Seq=26304 Ack=52764 Win=7930 Len=1360 [TCP segment of a reassembled PDU]"
"109","13.185368","104.244.42.65","192.168.0.183","TCP","1414","443  >  50717 [PSH, ACK] Seq=27664 Ack=52764 Win=7930 Len=1360 [TCP segment of a reassembled PDU]"
"110","13.185368","104.244.42.65","192.168.0.183","TCP","1414","443  >  50717 [ACK] Seq=29024 Ack=52764 Win=7930 Len=1360 [TCP segment of a reassembled PDU]"
"111","13.185368","104.244.42.65","192.168.0.183","TCP","1414","443  >  50717 [ACK] Seq=30384 Ack=52764 Win=7930 Len=1360 [TCP segment of a reassembled PDU]"
"112","13.185368","104.244.42.65","192.168.0.183","TCP","1414","443  >  50717 [PSH, ACK] Seq=31744 Ack=52764 Win=7930 Len=1360 [TCP segment of a reassembled PDU]"
"113","13.185368","104.244.42.65","192.168.0.183","TCP","1414","443  >  50717 [ACK] Seq=33104 Ack=52764 Win=7930 Len=1360 [TCP segment of a reassembled PDU]"
"114","13.185368","104.244.42.65","192.168.0.183","TCP","1414","443  >  50717 [ACK] Seq=34464 Ack=52764 Win=7930 Len=1360 [TCP segment of a reassembled PDU]"
"115","13.185368","104.244.42.65","192.168.0.183","TCP","1414","443  >  50717 [PSH, ACK] Seq=35824 Ack=52764 Win=7930 Len=1360 [TCP segment of a reassembled PDU]"
"116","13.185368","104.244.42.65","192.168.0.183","TCP","1414","443  >  50717 [ACK] Seq=37184 Ack=52764 Win=7930 Len=1360 [TCP segment of a reassembled PDU]"
"117","13.185368","104.244.42.65","192.168.0.183","TCP","1414","443  >  50717 [ACK] Seq=38544 Ack=52764 Win=7930 Len=1360 [TCP segment of a reassembled PDU]"
"118","13.185368","104.244.42.65","192.168.0.183","TCP","1414","443  >  50717 [PSH, ACK] Seq=39904 Ack=52764 Win=7930 Len=1360 [TCP segment of a reassembled PDU]"
"119","13.185368","104.244.42.65","192.168.0.183","TLSv1.2","1414","Application Data"
"120","13.185368","104.244.42.65","192.168.0.183","TCP","1414","443  >  50717 [ACK] Seq=42624 Ack=52764 Win=7930 Len=1360 [TCP segment of a reassembled PDU]"
"121","13.185368","104.244.42.65","192.168.0.183","TCP","1414","443  >  50717 [PSH, ACK] Seq=43984 Ack=52764 Win=7930 Len=1360 [TCP segment of a reassembled PDU]"
"122","13.185368","104.244.42.65","192.168.0.183","TCP","1414","443  >  50717 [ACK] Seq=45344 Ack=52764 Win=7930 Len=1360 [TCP segment of a reassembled PDU]"
"123","13.185368","104.244.42.65","192.168.0.183","TCP","1414","443  >  50717 [ACK] Seq=46704 Ack=52764 Win=7930 Len=1360 [TCP segment of a reassembled PDU]"
"124","13.185368","104.244.42.65","192.168.0.183","TCP","1414","443  >  50717 [PSH, ACK] Seq=48064 Ack=52764 Win=7930 Len=1360 [TCP segment of a reassembled PDU]"
"125","13.185368","104.244.42.65","192.168.0.183","TCP","1414","443  >  50717 [ACK] Seq=49424 Ack=52764 Win=7930 Len=1360 [TCP segment of a reassembled PDU]"
"126","13.185368","104.244.42.65","192.168.0.183","TLSv1.2","995","Application Data"
"127","13.185543","192.168.0.183","104.244.42.65","TCP","54","50717  >  443 [ACK] Seq=52764 Ack=51725 Win=1041 Len=0"
"128","13.186432","192.168.0.183","104.244.42.65","TLSv1.2","89","Application Data"
"129","13.263763","104.244.42.65","192.168.0.183","TCP","60","443  >  50717 [ACK] Seq=51725 Ack=52799 Win=7930 Len=0"
"130","14.334844","192.168.0.183","104.244.42.65","TLSv1.2","689","Application Data"
"131","14.335039","192.168.0.183","104.244.42.65","TCP","1414","50717  >  443 [ACK] Seq=53434 Ack=51725 Win=1041 Len=1360 [TCP segment of a reassembled PDU]"
"132","14.335039","192.168.0.183","104.244.42.65","TCP","1414","50717  >  443 [ACK] Seq=54794 Ack=51725 Win=1041 Len=1360 [TCP segment of a reassembled PDU]"
"133","14.335039","192.168.0.183","104.244.42.65","TCP","1414","50717  >  443 [ACK] Seq=56154 Ack=51725 Win=1041 Len=1360 [TCP segment of a reassembled PDU]"
"134","14.335039","192.168.0.183","104.244.42.65","TCP","1414","50717  >  443 [ACK] Seq=57514 Ack=51725 Win=1041 Len=1360 [TCP segment of a reassembled PDU]"
"135","14.335039","192.168.0.183","104.244.42.65","TCP","1414","50717  >  443 [ACK] Seq=58874 Ack=51725 Win=1041 Len=1360 [TCP segment of a reassembled PDU]"
"136","14.335039","192.168.0.183","104.244.42.65","TCP","1414","50717  >  443 [ACK] Seq=60234 Ack=51725 Win=1041 Len=1360 [TCP segment of a reassembled PDU]"
"137","14.335039","192.168.0.183","104.244.42.65","TCP","1414","50717  >  443 [ACK] Seq=61594 Ack=51725 Win=1041 Len=1360 [TCP segment of a reassembled PDU]"
"138","14.335039","192.168.0.183","104.244.42.65","TCP","1414","50717  >  443 [ACK] Seq=62954 Ack=51725 Win=1041 Len=1360 [TCP segment of a reassembled PDU]"
"139","14.335039","192.168.0.183","104.244.42.65","TCP","1414","50717  >  443 [ACK] Seq=64314 Ack=51725 Win=1041 Len=1360 [TCP segment of a reassembled PDU]"
"140","14.335039","192.168.0.183","104.244.42.65","TCP","1414","50717  >  443 [ACK] Seq=65674 Ack=51725 Win=1041 Len=1360 [TCP segment of a reassembled PDU]"
"141","14.335039","192.168.0.183","104.244.42.65","TCP","1414","50717  >  443 [ACK] Seq=67034 Ack=51725 Win=1041 Len=1360 [TCP segment of a reassembled PDU]"
"142","14.335039","192.168.0.183","104.244.42.65","TCP","1414","50717  >  443 [ACK] Seq=68394 Ack=51725 Win=1041 Len=1360 [TCP segment of a reassembled PDU]"
"143","14.335039","192.168.0.183","104.244.42.65","TLSv1.2","140","Application Data"
"144","14.335250","192.168.0.183","104.244.42.65","TCP","1414","50717  >  443 [ACK] Seq=69840 Ack=51725 Win=1041 Len=1360 [TCP segment of a reassembled PDU]"
"145","14.335250","192.168.0.183","104.244.42.65","TCP","1414","50717  >  443 [ACK] Seq=71200 Ack=51725 Win=1041 Len=1360 [TCP segment of a reassembled PDU]"
"146","14.335250","192.168.0.183","104.244.42.65","TCP","1414","50717  >  443 [ACK] Seq=72560 Ack=51725 Win=1041 Len=1360 [TCP segment of a reassembled PDU]"
"147","14.335250","192.168.0.183","104.244.42.65","TCP","1414","50717  >  443 [ACK] Seq=73920 Ack=51725 Win=1041 Len=1360 [TCP segment of a reassembled PDU]"
"148","14.335250","192.168.0.183","104.244.42.65","TCP","1414","50717  >  443 [ACK] Seq=75280 Ack=51725 Win=1041 Len=1360 [TCP segment of a reassembled PDU]"
"149","14.335250","192.168.0.183","104.244.42.65","TCP","1414","50717  >  443 [ACK] Seq=76640 Ack=51725 Win=1041 Len=1360 [TCP segment of a reassembled PDU]"
"150","14.335250","192.168.0.183","104.244.42.65","TCP","1414","50717  >  443 [ACK] Seq=78000 Ack=51725 Win=1041 Len=1360 [TCP segment of a reassembled PDU]"
"151","14.335250","192.168.0.183","104.244.42.65","TCP","1414","50717  >  443 [ACK] Seq=79360 Ack=51725 Win=1041 Len=1360 [TCP segment of a reassembled PDU]"
"152","14.335250","192.168.0.183","104.244.42.65","TCP","1414","50717  >  443 [ACK] Seq=80720 Ack=51725 Win=1041 Len=1360 [TCP segment of a reassembled PDU]"
"153","14.335250","192.168.0.183","104.244.42.65","TCP","1414","50717  >  443 [ACK] Seq=82080 Ack=51725 Win=1041 Len=1360 [TCP segment of a reassembled PDU]"
"154","14.335250","192.168.0.183","104.244.42.65","TCP","1414","50717  >  443 [ACK] Seq=83440 Ack=51725 Win=1041 Len=1360 [TCP segment of a reassembled PDU]"
"155","14.335250","192.168.0.183","104.244.42.65","TCP","1414","50717  >  443 [ACK] Seq=84800 Ack=51725 Win=1041 Len=1360 [TCP segment of a reassembled PDU]"
"156","14.335250","192.168.0.183","104.244.42.65","TLSv1.2","140","Application Data"
"157","14.335417","192.168.0.183","104.244.42.65","TCP","1414","50717  >  443 [ACK] Seq=86246 Ack=51725 Win=1041 Len=1360 [TCP segment of a reassembled PDU]"
"158","14.335417","192.168.0.183","104.244.42.65","TLSv1.2","249","Application Data"
"159","14.372905","104.244.42.65","192.168.0.183","TCP","60","443  >  50717 [ACK] Seq=51725 Ack=56154 Win=7922 Len=0"
"160","14.376523","104.244.42.65","192.168.0.183","TCP","60","443  >  50717 [ACK] Seq=51725 Ack=87801 Win=7908 Len=0"
"161","14.376523","104.244.42.65","192.168.0.183","TLSv1.2","89","Application Data"
"162","14.421277","104.244.42.65","192.168.0.183","TLSv1.2","184","Application Data"
"163","14.421324","192.168.0.183","104.244.42.65","TCP","54","50717  >  443 [ACK] Seq=87801 Ack=51890 Win=1040 Len=0"
"164","17.396292","192.168.0.183","104.244.42.65","TLSv1.2","549","Application Data"
"165","17.396408","192.168.0.183","104.244.42.65","TCP","1414","50717  >  443 [ACK] Seq=88296 Ack=51890 Win=1040 Len=1360 [TCP segment of a reassembled PDU]"
"166","17.396408","192.168.0.183","104.244.42.65","TCP","1414","50717  >  443 [ACK] Seq=89656 Ack=51890 Win=1040 Len=1360 [TCP segment of a reassembled PDU]"
"167","17.396408","192.168.0.183","104.244.42.65","TCP","1414","50717  >  443 [ACK] Seq=91016 Ack=51890 Win=1040 Len=1360 [TCP segment of a reassembled PDU]"
"168","17.396408","192.168.0.183","104.244.42.65","TCP","1414","50717  >  443 [ACK] Seq=92376 Ack=51890 Win=1040 Len=1360 [TCP segment of a reassembled PDU]"
"169","17.396408","192.168.0.183","104.244.42.65","TCP","1414","50717  >  443 [ACK] Seq=93736 Ack=51890 Win=1040 Len=1360 [TCP segment of a reassembled PDU]"
"170","17.396408","192.168.0.183","104.244.42.65","TCP","1414","50717  >  443 [ACK] Seq=95096 Ack=51890 Win=1040 Len=1360 [TCP segment of a reassembled PDU]"
"171","17.396408","192.168.0.183","104.244.42.65","TCP","1414","50717  >  443 [ACK] Seq=96456 Ack=51890 Win=1040 Len=1360 [TCP segment of a reassembled PDU]"
"172","17.396408","192.168.0.183","104.244.42.65","TCP","1414","50717  >  443 [ACK] Seq=97816 Ack=51890 Win=1040 Len=1360 [TCP segment of a reassembled PDU]"
"173","17.396408","192.168.0.183","104.244.42.65","TCP","1414","50717  >  443 [ACK] Seq=99176 Ack=51890 Win=1040 Len=1360 [TCP segment of a reassembled PDU]"
"174","17.396408","192.168.0.183","104.244.42.65","TCP","1414","50717  >  443 [ACK] Seq=100536 Ack=51890 Win=1040 Len=1360 [TCP segment of a reassembled PDU]"
"175","17.396408","192.168.0.183","104.244.42.65","TCP","1414","50717  >  443 [ACK] Seq=101896 Ack=51890 Win=1040 Len=1360 [TCP segment of a reassembled PDU]"
"176","17.396408","192.168.0.183","104.244.42.65","TCP","1414","50717  >  443 [ACK] Seq=103256 Ack=51890 Win=1040 Len=1360 [TCP segment of a reassembled PDU]"
"177","17.396408","192.168.0.183","104.244.42.65","TLSv1.2","140","Application Data"
"178","17.396536","192.168.0.183","104.244.42.65","TCP","1414","50717  >  443 [ACK] Seq=104702 Ack=51890 Win=1040 Len=1360 [TCP segment of a reassembled PDU]"
"179","17.396536","192.168.0.183","104.244.42.65","TCP","1414","50717  >  443 [ACK] Seq=106062 Ack=51890 Win=1040 Len=1360 [TCP segment of a reassembled PDU]"
"180","17.396536","192.168.0.183","104.244.42.65","TCP","1414","50717  >  443 [ACK] Seq=107422 Ack=51890 Win=1040 Len=1360 [TCP segment of a reassembled PDU]"
"181","17.396536","192.168.0.183","104.244.42.65","TCP","1414","50717  >  443 [ACK] Seq=108782 Ack=51890 Win=1040 Len=1360 [TCP segment of a reassembled PDU]"
"182","17.396536","192.168.0.183","104.244.42.65","TCP","1414","50717  >  443 [ACK] Seq=110142 Ack=51890 Win=1040 Len=1360 [TCP segment of a reassembled PDU]"
"183","17.396536","192.168.0.183","104.244.42.65","TCP","1414","50717  >  443 [ACK] Seq=111502 Ack=51890 Win=1040 Len=1360 [TCP segment of a reassembled PDU]"
"184","17.396536","192.168.0.183","104.244.42.65","TCP","1414","50717  >  443 [ACK] Seq=112862 Ack=51890 Win=1040 Len=1360 [TCP segment of a reassembled PDU]"
"185","17.396536","192.168.0.183","104.244.42.65","TCP","1414","50717  >  443 [ACK] Seq=114222 Ack=51890 Win=1040 Len=1360 [TCP segment of a reassembled PDU]"
"186","17.396536","192.168.0.183","104.244.42.65","TCP","1414","50717  >  443 [ACK] Seq=115582 Ack=51890 Win=1040 Len=1360 [TCP segment of a reassembled PDU]"
"187","17.396536","192.168.0.183","104.244.42.65","TCP","1414","50717  >  443 [ACK] Seq=116942 Ack=51890 Win=1040 Len=1360 [TCP segment of a reassembled PDU]"
"188","17.396536","192.168.0.183","104.244.42.65","TCP","1414","50717  >  443 [ACK] Seq=118302 Ack=51890 Win=1040 Len=1360 [TCP segment of a reassembled PDU]"
"189","17.396536","192.168.0.183","104.244.42.65","TCP","1414","50717  >  443 [ACK] Seq=119662 Ack=51890 Win=1040 Len=1360 [TCP segment of a reassembled PDU]"
"190","17.396536","192.168.0.183","104.244.42.65","TLSv1.2","140","Application Data"
"191","17.396644","192.168.0.183","104.244.42.65","TCP","1414","50717  >  443 [ACK] Seq=121108 Ack=51890 Win=1040 Len=1360 [TCP segment of a reassembled PDU]"
"192","17.396644","192.168.0.183","104.244.42.65","TCP","1414","50717  >  443 [ACK] Seq=122468 Ack=51890 Win=1040 Len=1360 [TCP segment of a reassembled PDU]"
"193","17.396644","192.168.0.183","104.244.42.65","TCP","1414","50717  >  443 [ACK] Seq=123828 Ack=51890 Win=1040 Len=1360 [TCP segment of a reassembled PDU]"
"194","17.396644","192.168.0.183","104.244.42.65","TCP","1414","50717  >  443 [ACK] Seq=125188 Ack=51890 Win=1040 Len=1360 [TCP segment of a reassembled PDU]"
"195","17.396644","192.168.0.183","104.244.42.65","TCP","1414","50717  >  443 [ACK] Seq=126548 Ack=51890 Win=1040 Len=1360 [TCP segment of a reassembled PDU]"
"196","17.396644","192.168.0.183","104.244.42.65","TCP","1414","50717  >  443 [ACK] Seq=127908 Ack=51890 Win=1040 Len=1360 [TCP segment of a reassembled PDU]"
"197","17.396644","192.168.0.183","104.244.42.65","TCP","1414","50717  >  443 [ACK] Seq=129268 Ack=51890 Win=1040 Len=1360 [TCP segment of a reassembled PDU]"
"198","17.396644","192.168.0.183","104.244.42.65","TLSv1.2","640","Application Data"
"199","17.432788","104.244.42.65","192.168.0.183","TCP","60","443  >  50717 [ACK] Seq=51890 Ack=93736 Win=7915 Len=0"
"200","17.438535","104.244.42.65","192.168.0.183","TCP","60","443  >  50717 [ACK] Seq=51890 Ack=121108 Win=7927 Len=0"
"201","17.438535","104.244.42.65","192.168.0.183","TCP","60","443  >  50717 [ACK] Seq=51890 Ack=130628 Win=7902 Len=0"
"202","17.438535","104.244.42.65","192.168.0.183","TLSv1.2","89","Application Data"
"203","17.485574","192.168.0.183","104.244.42.65","TCP","54","50717  >  443 [ACK] Seq=131214 Ack=51925 Win=1040 Len=0"
"204","17.486320","104.244.42.65","192.168.0.183","TLSv1.2","184","Application Data"
"205","17.532296","192.168.0.183","104.244.42.65","TCP","54","50717  >  443 [ACK] Seq=131214 Ack=52055 Win=1039 Len=0"
"206","20.394532","192.168.0.183","104.244.42.65","TLSv1.2","404","Application Data"
"207","20.394639","192.168.0.183","104.244.42.65","TCP","1414","50717  >  443 [ACK] Seq=131564 Ack=52055 Win=1039 Len=1360 [TCP segment of a reassembled PDU]"
"208","20.394639","192.168.0.183","104.244.42.65","TCP","1414","50717  >  443 [ACK] Seq=132924 Ack=52055 Win=1039 Len=1360 [TCP segment of a reassembled PDU]"
"209","20.394639","192.168.0.183","104.244.42.65","TCP","1414","50717  >  443 [ACK] Seq=134284 Ack=52055 Win=1039 Len=1360 [TCP segment of a reassembled PDU]"
"210","20.394639","192.168.0.183","104.244.42.65","TCP","1414","50717  >  443 [ACK] Seq=135644 Ack=52055 Win=1039 Len=1360 [TCP segment of a reassembled PDU]"
"211","20.394639","192.168.0.183","104.244.42.65","TCP","1414","50717  >  443 [ACK] Seq=137004 Ack=52055 Win=1039 Len=1360 [TCP segment of a reassembled PDU]"
"212","20.394639","192.168.0.183","104.244.42.65","TLSv1.2","717","Application Data"
"213","20.436841","104.244.42.65","192.168.0.183","TCP","60","443  >  50717 [ACK] Seq=52055 Ack=139027 Win=7930 Len=0"
"214","20.461085","104.244.42.65","192.168.0.183","TLSv1.2","316","Application Data"
"215","20.509788","192.168.0.183","104.244.42.65","TCP","54","50717  >  443 [ACK] Seq=139027 Ack=52317 Win=1038 Len=0"
"216","21.781753","192.168.0.183","104.244.42.65","TLSv1.2","243","Application Data"
"217","21.781842","192.168.0.183","104.244.42.65","TLSv1.2","516","Application Data"
"218","21.820344","104.244.42.65","192.168.0.183","TCP","60","443  >  50717 [ACK] Seq=52317 Ack=139678 Win=7930 Len=0"
"219","21.837172","104.244.42.65","192.168.0.183","TLSv1.2","184","Application Data"
"220","21.883923","192.168.0.183","104.244.42.65","TCP","54","50717  >  443 [ACK] Seq=139678 Ack=52447 Win=1038 Len=0"
"221","23.407809","192.168.0.183","104.244.42.65","TLSv1.2","262","Application Data"
"222","23.407969","192.168.0.183","104.244.42.65","TCP","1414","50717  >  443 [ACK] Seq=139886 Ack=52447 Win=1038 Len=1360 [TCP segment of a reassembled PDU]"
"223","23.407969","192.168.0.183","104.244.42.65","TCP","1414","50717  >  443 [ACK] Seq=141246 Ack=52447 Win=1038 Len=1360 [TCP segment of a reassembled PDU]"
"224","23.407969","192.168.0.183","104.244.42.65","TCP","1414","50717  >  443 [ACK] Seq=142606 Ack=52447 Win=1038 Len=1360 [TCP segment of a reassembled PDU]"
"225","23.407969","192.168.0.183","104.244.42.65","TCP","1414","50717  >  443 [ACK] Seq=143966 Ack=52447 Win=1038 Len=1360 [TCP segment of a reassembled PDU]"
"226","23.407969","192.168.0.183","104.244.42.65","TCP","1414","50717  >  443 [ACK] Seq=145326 Ack=52447 Win=1038 Len=1360 [TCP segment of a reassembled PDU]"
"227","23.407969","192.168.0.183","104.244.42.65","TCP","1414","50717  >  443 [ACK] Seq=146686 Ack=52447 Win=1038 Len=1360 [TCP segment of a reassembled PDU]"
"228","23.407969","192.168.0.183","104.244.42.65","TCP","1414","50717  >  443 [ACK] Seq=148046 Ack=52447 Win=1038 Len=1360 [TCP segment of a reassembled PDU]"
"229","23.407969","192.168.0.183","104.244.42.65","TCP","1414","50717  >  443 [ACK] Seq=149406 Ack=52447 Win=1038 Len=1360 [TCP segment of a reassembled PDU]"
"230","23.407969","192.168.0.183","104.244.42.65","TCP","1414","50717  >  443 [ACK] Seq=150766 Ack=52447 Win=1038 Len=1360 [TCP segment of a reassembled PDU]"
"231","23.407969","192.168.0.183","104.244.42.65","TCP","1414","50717  >  443 [ACK] Seq=152126 Ack=52447 Win=1038 Len=1360 [TCP segment of a reassembled PDU]"
"232","23.407969","192.168.0.183","104.244.42.65","TCP","1414","50717  >  443 [ACK] Seq=153486 Ack=52447 Win=1038 Len=1360 [TCP segment of a reassembled PDU]"
"233","23.407969","192.168.0.183","104.244.42.65","TCP","1414","50717  >  443 [ACK] Seq=154846 Ack=52447 Win=1038 Len=1360 [TCP segment of a reassembled PDU]"
"234","23.407969","192.168.0.183","104.244.42.65","TLSv1.2","140","Application Data"
"235","23.408099","192.168.0.183","104.244.42.65","TCP","1414","50717  >  443 [ACK] Seq=156292 Ack=52447 Win=1038 Len=1360 [TCP segment of a reassembled PDU]"
"236","23.408099","192.168.0.183","104.244.42.65","TCP","1414","50717  >  443 [ACK] Seq=157652 Ack=52447 Win=1038 Len=1360 [TCP segment of a reassembled PDU]"
"237","23.408099","192.168.0.183","104.244.42.65","TCP","1414","50717  >  443 [ACK] Seq=159012 Ack=52447 Win=1038 Len=1360 [TCP segment of a reassembled PDU]"
"238","23.408099","192.168.0.183","104.244.42.65","TCP","1414","50717  >  443 [ACK] Seq=160372 Ack=52447 Win=1038 Len=1360 [TCP segment of a reassembled PDU]"
"239","23.408099","192.168.0.183","104.244.42.65","TCP","1414","50717  >  443 [ACK] Seq=161732 Ack=52447 Win=1038 Len=1360 [TCP segment of a reassembled PDU]"
"240","23.408099","192.168.0.183","104.244.42.65","TCP","1414","50717  >  443 [ACK] Seq=163092 Ack=52447 Win=1038 Len=1360 [TCP segment of a reassembled PDU]"
"241","23.408099","192.168.0.183","104.244.42.65","TCP","1414","50717  >  443 [ACK] Seq=164452 Ack=52447 Win=1038 Len=1360 [TCP segment of a reassembled PDU]"
"242","23.408099","192.168.0.183","104.244.42.65","TCP","1414","50717  >  443 [ACK] Seq=165812 Ack=52447 Win=1038 Len=1360 [TCP segment of a reassembled PDU]"
"243","23.408099","192.168.0.183","104.244.42.65","TCP","1414","50717  >  443 [ACK] Seq=167172 Ack=52447 Win=1038 Len=1360 [TCP segment of a reassembled PDU]"
"244","23.408099","192.168.0.183","104.244.42.65","TCP","1414","50717  >  443 [ACK] Seq=168532 Ack=52447 Win=1038 Len=1360 [TCP segment of a reassembled PDU]"
"245","23.408099","192.168.0.183","104.244.42.65","TCP","1414","50717  >  443 [ACK] Seq=169892 Ack=52447 Win=1038 Len=1360 [TCP segment of a reassembled PDU]"
"246","23.408099","192.168.0.183","104.244.42.65","TCP","1414","50717  >  443 [ACK] Seq=171252 Ack=52447 Win=1038 Len=1360 [TCP segment of a reassembled PDU]"
"247","23.408099","192.168.0.183","104.244.42.65","TLSv1.2","140","Application Data"
"248","23.408216","192.168.0.183","104.244.42.65","TCP","1414","50717  >  443 [ACK] Seq=172698 Ack=52447 Win=1038 Len=1360 [TCP segment of a reassembled PDU]"
"249","23.408216","192.168.0.183","104.244.42.65","TCP","1414","50717  >  443 [ACK] Seq=174058 Ack=52447 Win=1038 Len=1360 [TCP segment of a reassembled PDU]"
"250","23.408216","192.168.0.183","104.244.42.65","TCP","1414","50717  >  443 [ACK] Seq=175418 Ack=52447 Win=1038 Len=1360 [TCP segment of a reassembled PDU]"
"251","23.408216","192.168.0.183","104.244.42.65","TLSv1.2","59","Application Data"
"252","23.444844","104.244.42.65","192.168.0.183","TCP","60","443  >  50717 [ACK] Seq=52447 Ack=141246 Win=7927 Len=0"
"253","23.451036","104.244.42.65","192.168.0.183","TCP","60","443  >  50717 [ACK] Seq=52447 Ack=159012 Win=7928 Len=0"
"254","23.451036","104.244.42.65","192.168.0.183","TCP","60","443  >  50717 [ACK] Seq=52447 Ack=168532 Win=7930 Len=0"
"255","23.452700","104.244.42.65","192.168.0.183","TCP","60","443  >  50717 [ACK] Seq=52447 Ack=176783 Win=7908 Len=0"
"256","23.452700","104.244.42.65","192.168.0.183","TLSv1.2","89","Application Data"
"257","23.494647","104.244.42.65","192.168.0.183","TLSv1.2","315","Application Data"
"258","23.494683","192.168.0.183","104.244.42.65","TCP","54","50717  >  443 [ACK] Seq=176783 Ack=52743 Win=1037 Len=0"
"259","26.461484","192.168.0.183","104.244.42.65","TLSv1.2","327","Application Data"
"260","26.461955","192.168.0.183","104.244.42.65","TCP","1414","50717  >  443 [ACK] Seq=177056 Ack=52743 Win=1037 Len=1360 [TCP segment of a reassembled PDU]"
"261","26.461955","192.168.0.183","104.244.42.65","TCP","1414","50717  >  443 [ACK] Seq=178416 Ack=52743 Win=1037 Len=1360 [TCP segment of a reassembled PDU]"
"262","26.461955","192.168.0.183","104.244.42.65","TCP","1414","50717  >  443 [ACK] Seq=179776 Ack=52743 Win=1037 Len=1360 [TCP segment of a reassembled PDU]"
"263","26.461955","192.168.0.183","104.244.42.65","TCP","1414","50717  >  443 [ACK] Seq=181136 Ack=52743 Win=1037 Len=1360 [TCP segment of a reassembled PDU]"
"264","26.461955","192.168.0.183","104.244.42.65","TCP","1414","50717  >  443 [ACK] Seq=182496 Ack=52743 Win=1037 Len=1360 [TCP segment of a reassembled PDU]"
"265","26.461955","192.168.0.183","104.244.42.65","TCP","1414","50717  >  443 [ACK] Seq=183856 Ack=52743 Win=1037 Len=1360 [TCP segment of a reassembled PDU]"
"266","26.461955","192.168.0.183","104.244.42.65","TCP","1414","50717  >  443 [ACK] Seq=185216 Ack=52743 Win=1037 Len=1360 [TCP segment of a reassembled PDU]"
"267","26.461955","192.168.0.183","104.244.42.65","TCP","1414","50717  >  443 [ACK] Seq=186576 Ack=52743 Win=1037 Len=1360 [TCP segment of a reassembled PDU]"
"268","26.461955","192.168.0.183","104.244.42.65","TCP","1414","50717  >  443 [ACK] Seq=187936 Ack=52743 Win=1037 Len=1360 [TCP segment of a reassembled PDU]"
"269","26.461955","192.168.0.183","104.244.42.65","TCP","1414","50717  >  443 [ACK] Seq=189296 Ack=52743 Win=1037 Len=1360 [TCP segment of a reassembled PDU]"
"270","26.461955","192.168.0.183","104.244.42.65","TCP","1414","50717  >  443 [ACK] Seq=190656 Ack=52743 Win=1037 Len=1360 [TCP segment of a reassembled PDU]"
"271","26.461955","192.168.0.183","104.244.42.65","TCP","1414","50717  >  443 [ACK] Seq=192016 Ack=52743 Win=1037 Len=1360 [TCP segment of a reassembled PDU]"
"272","26.461955","192.168.0.183","104.244.42.65","TLSv1.2","140","Application Data"
"273","26.462410","192.168.0.183","104.244.42.65","TCP","1414","50717  >  443 [ACK] Seq=193462 Ack=52743 Win=1037 Len=1360 [TCP segment of a reassembled PDU]"
"274","26.462410","192.168.0.183","104.244.42.65","TCP","1414","50717  >  443 [ACK] Seq=194822 Ack=52743 Win=1037 Len=1360 [TCP segment of a reassembled PDU]"
"275","26.462410","192.168.0.183","104.244.42.65","TCP","1414","50717  >  443 [ACK] Seq=196182 Ack=52743 Win=1037 Len=1360 [TCP segment of a reassembled PDU]"
"276","26.462410","192.168.0.183","104.244.42.65","TCP","1414","50717  >  443 [ACK] Seq=197542 Ack=52743 Win=1037 Len=1360 [TCP segment of a reassembled PDU]"
"277","26.462410","192.168.0.183","104.244.42.65","TCP","1414","50717  >  443 [ACK] Seq=198902 Ack=52743 Win=1037 Len=1360 [TCP segment of a reassembled PDU]"
"278","26.462410","192.168.0.183","104.244.42.65","TCP","1414","50717  >  443 [ACK] Seq=200262 Ack=52743 Win=1037 Len=1360 [TCP segment of a reassembled PDU]"
"279","26.462410","192.168.0.183","104.244.42.65","TCP","1414","50717  >  443 [ACK] Seq=201622 Ack=52743 Win=1037 Len=1360 [TCP segment of a reassembled PDU]"
"280","26.462410","192.168.0.183","104.244.42.65","TCP","1414","50717  >  443 [ACK] Seq=202982 Ack=52743 Win=1037 Len=1360 [TCP segment of a reassembled PDU]"
"281","26.462410","192.168.0.183","104.244.42.65","TCP","1414","50717  >  443 [ACK] Seq=204342 Ack=52743 Win=1037 Len=1360 [TCP segment of a reassembled PDU]"
"282","26.462410","192.168.0.183","104.244.42.65","TCP","1414","50717  >  443 [ACK] Seq=205702 Ack=52743 Win=1037 Len=1360 [TCP segment of a reassembled PDU]"
"283","26.462410","192.168.0.183","104.244.42.65","TCP","1414","50717  >  443 [ACK] Seq=207062 Ack=52743 Win=1037 Len=1360 [TCP segment of a reassembled PDU]"
"284","26.462410","192.168.0.183","104.244.42.65","TCP","1414","50717  >  443 [ACK] Seq=208422 Ack=52743 Win=1037 Len=1360 [TCP segment of a reassembled PDU]"
"285","26.462410","192.168.0.183","104.244.42.65","TLSv1.2","140","Application Data"
"286","26.462657","192.168.0.183","104.244.42.65","TCP","1414","50717  >  443 [ACK] Seq=209868 Ack=52743 Win=1037 Len=1360 [TCP segment of a reassembled PDU]"
"287","26.462657","192.168.0.183","104.244.42.65","TCP","1414","50717  >  443 [ACK] Seq=211228 Ack=52743 Win=1037 Len=1360 [TCP segment of a reassembled PDU]"
"288","26.462657","192.168.0.183","104.244.42.65","TCP","1414","50717  >  443 [ACK] Seq=212588 Ack=52743 Win=1037 Len=1360 [TCP segment of a reassembled PDU]"
"289","26.462657","192.168.0.183","104.244.42.65","TCP","1414","50717  >  443 [ACK] Seq=213948 Ack=52743 Win=1037 Len=1360 [TCP segment of a reassembled PDU]"
"290","26.462657","192.168.0.183","104.244.42.65","TCP","1414","50717  >  443 [ACK] Seq=215308 Ack=52743 Win=1037 Len=1360 [TCP segment of a reassembled PDU]"
"291","26.462657","192.168.0.183","104.244.42.65","TCP","1414","50717  >  443 [ACK] Seq=216668 Ack=52743 Win=1037 Len=1360 [TCP segment of a reassembled PDU]"
"292","26.462657","192.168.0.183","104.244.42.65","TLSv1.2","77","Application Data"
"293","26.501558","104.244.42.65","192.168.0.183","TCP","60","443  >  50717 [ACK] Seq=52743 Ack=178416 Win=7927 Len=0"
"294","26.507359","104.244.42.65","192.168.0.183","TCP","60","443  >  50717 [ACK] Seq=52743 Ack=218051 Win=7920 Len=0"
"295","26.507359","104.244.42.65","192.168.0.183","TLSv1.2","89","Application Data"
"296","26.550322","104.244.42.65","192.168.0.183","TLSv1.2","180","Application Data"
"297","26.550365","192.168.0.183","104.244.42.65","TCP","54","50717  >  443 [ACK] Seq=218051 Ack=52904 Win=1036 Len=0"
"298","28.129600","192.168.0.183","104.244.42.65","TLSv1.2","989","Application Data"
"299","28.129730","192.168.0.183","104.244.42.65","TLSv1.2","246","Application Data"
"300","28.166795","104.244.42.65","192.168.0.183","TCP","60","443  >  50717 [ACK] Seq=52904 Ack=219178 Win=7930 Len=0"
"301","28.191018","104.244.42.65","192.168.0.183","TLSv1.2","511","Application Data"
"302","28.191673","192.168.0.183","104.244.42.65","TLSv1.2","89","Application Data"
"303","28.195736","104.244.42.65","192.168.0.183","TLSv1.2","287","Application Data"
"304","28.244296","192.168.0.183","104.244.42.65","TCP","54","50717  >  443 [ACK] Seq=219213 Ack=53594 Win=1040 Len=0"
"305","28.267708","104.244.42.65","192.168.0.183","TCP","60","443  >  50717 [ACK] Seq=53594 Ack=219213 Win=7930 Len=0"
"306","29.572125","192.168.0.183","104.244.42.65","TLSv1.2","710","Application Data"
"307","29.572242","192.168.0.183","104.244.42.65","TCP","1414","50717  >  443 [ACK] Seq=219869 Ack=53594 Win=1040 Len=1360 [TCP segment of a reassembled PDU]"
"308","29.572242","192.168.0.183","104.244.42.65","TCP","1414","50717  >  443 [ACK] Seq=221229 Ack=53594 Win=1040 Len=1360 [TCP segment of a reassembled PDU]"
"309","29.572242","192.168.0.183","104.244.42.65","TCP","1414","50717  >  443 [ACK] Seq=222589 Ack=53594 Win=1040 Len=1360 [TCP segment of a reassembled PDU]"
"310","29.572242","192.168.0.183","104.244.42.65","TCP","1414","50717  >  443 [ACK] Seq=223949 Ack=53594 Win=1040 Len=1360 [TCP segment of a reassembled PDU]"
"311","29.572242","192.168.0.183","104.244.42.65","TCP","1414","50717  >  443 [ACK] Seq=225309 Ack=53594 Win=1040 Len=1360 [TCP segment of a reassembled PDU]"
"312","29.572242","192.168.0.183","104.244.42.65","TCP","1414","50717  >  443 [ACK] Seq=226669 Ack=53594 Win=1040 Len=1360 [TCP segment of a reassembled PDU]"
"313","29.572242","192.168.0.183","104.244.42.65","TCP","1414","50717  >  443 [ACK] Seq=228029 Ack=53594 Win=1040 Len=1360 [TCP segment of a reassembled PDU]"
"314","29.572242","192.168.0.183","104.244.42.65","TCP","1414","50717  >  443 [ACK] Seq=229389 Ack=53594 Win=1040 Len=1360 [TCP segment of a reassembled PDU]"
"315","29.572242","192.168.0.183","104.244.42.65","TCP","1414","50717  >  443 [ACK] Seq=230749 Ack=53594 Win=1040 Len=1360 [TCP segment of a reassembled PDU]"
"316","29.572242","192.168.0.183","104.244.42.65","TCP","1414","50717  >  443 [ACK] Seq=232109 Ack=53594 Win=1040 Len=1360 [TCP segment of a reassembled PDU]"
"317","29.572242","192.168.0.183","104.244.42.65","TCP","1414","50717  >  443 [ACK] Seq=233469 Ack=53594 Win=1040 Len=1360 [TCP segment of a reassembled PDU]"
"318","29.572242","192.168.0.183","104.244.42.65","TCP","1414","50717  >  443 [ACK] Seq=234829 Ack=53594 Win=1040 Len=1360 [TCP segment of a reassembled PDU]"
"319","29.572242","192.168.0.183","104.244.42.65","TLSv1.2","140","Application Data"
"320","29.572370","192.168.0.183","104.244.42.65","TCP","1414","50717  >  443 [ACK] Seq=236275 Ack=53594 Win=1040 Len=1360 [TCP segment of a reassembled PDU]"
"321","29.572370","192.168.0.183","104.244.42.65","TCP","1414","50717  >  443 [ACK] Seq=237635 Ack=53594 Win=1040 Len=1360 [TCP segment of a reassembled PDU]"
"322","29.572370","192.168.0.183","104.244.42.65","TCP","1414","50717  >  443 [ACK] Seq=238995 Ack=53594 Win=1040 Len=1360 [TCP segment of a reassembled PDU]"
"323","29.572370","192.168.0.183","104.244.42.65","TCP","1414","50717  >  443 [ACK] Seq=240355 Ack=53594 Win=1040 Len=1360 [TCP segment of a reassembled PDU]"
"324","29.572370","192.168.0.183","104.244.42.65","TCP","1414","50717  >  443 [ACK] Seq=241715 Ack=53594 Win=1040 Len=1360 [TCP segment of a reassembled PDU]"
"325","29.572370","192.168.0.183","104.244.42.65","TCP","1414","50717  >  443 [ACK] Seq=243075 Ack=53594 Win=1040 Len=1360 [TCP segment of a reassembled PDU]"
"326","29.572370","192.168.0.183","104.244.42.65","TCP","1414","50717  >  443 [ACK] Seq=244435 Ack=53594 Win=1040 Len=1360 [TCP segment of a reassembled PDU]"
"327","29.572370","192.168.0.183","104.244.42.65","TCP","1414","50717  >  443 [ACK] Seq=245795 Ack=53594 Win=1040 Len=1360 [TCP segment of a reassembled PDU]"
"328","29.572370","192.168.0.183","104.244.42.65","TCP","1414","50717  >  443 [ACK] Seq=247155 Ack=53594 Win=1040 Len=1360 [TCP segment of a reassembled PDU]"
"329","29.572370","192.168.0.183","104.244.42.65","TCP","1414","50717  >  443 [ACK] Seq=248515 Ack=53594 Win=1040 Len=1360 [TCP segment of a reassembled PDU]"
"330","29.572370","192.168.0.183","104.244.42.65","TCP","1414","50717  >  443 [ACK] Seq=249875 Ack=53594 Win=1040 Len=1360 [TCP segment of a reassembled PDU]"
"331","29.572370","192.168.0.183","104.244.42.65","TCP","1414","50717  >  443 [ACK] Seq=251235 Ack=53594 Win=1040 Len=1360 [TCP segment of a reassembled PDU]"
"332","29.572370","192.168.0.183","104.244.42.65","TLSv1.2","140","Application Data"
"333","29.572492","192.168.0.183","104.244.42.65","TCP","1414","50717  >  443 [ACK] Seq=252681 Ack=53594 Win=1040 Len=1360 [TCP segment of a reassembled PDU]"
"334","29.572492","192.168.0.183","104.244.42.65","TCP","1414","50717  >  443 [ACK] Seq=254041 Ack=53594 Win=1040 Len=1360 [TCP segment of a reassembled PDU]"
"335","29.572492","192.168.0.183","104.244.42.65","TCP","1414","50717  >  443 [ACK] Seq=255401 Ack=53594 Win=1040 Len=1360 [TCP segment of a reassembled PDU]"
"336","29.572492","192.168.0.183","104.244.42.65","TCP","1414","50717  >  443 [ACK] Seq=256761 Ack=53594 Win=1040 Len=1360 [TCP segment of a reassembled PDU]"
"337","29.572492","192.168.0.183","104.244.42.65","TCP","1414","50717  >  443 [ACK] Seq=258121 Ack=53594 Win=1040 Len=1360 [TCP segment of a reassembled PDU]"
"338","29.572492","192.168.0.183","104.244.42.65","TCP","1414","50717  >  443 [ACK] Seq=259481 Ack=53594 Win=1040 Len=1360 [TCP segment of a reassembled PDU]"
"339","29.572492","192.168.0.183","104.244.42.65","TCP","1414","50717  >  443 [ACK] Seq=260841 Ack=53594 Win=1040 Len=1360 [TCP segment of a reassembled PDU]"
"340","29.572492","192.168.0.183","104.244.42.65","TCP","1414","50717  >  443 [ACK] Seq=262201 Ack=53594 Win=1040 Len=1360 [TCP segment of a reassembled PDU]"
"341","29.572492","192.168.0.183","104.244.42.65","TCP","1414","50717  >  443 [ACK] Seq=263561 Ack=53594 Win=1040 Len=1360 [TCP segment of a reassembled PDU]"
"342","29.572492","192.168.0.183","104.244.42.65","TCP","1414","50717  >  443 [ACK] Seq=264921 Ack=53594 Win=1040 Len=1360 [TCP segment of a reassembled PDU]"
"343","29.572492","192.168.0.183","104.244.42.65","TCP","1414","50717  >  443 [ACK] Seq=266281 Ack=53594 Win=1040 Len=1360 [TCP segment of a reassembled PDU]"
"344","29.572492","192.168.0.183","104.244.42.65","TCP","1414","50717  >  443 [ACK] Seq=267641 Ack=53594 Win=1040 Len=1360 [TCP segment of a reassembled PDU]"
"345","29.572492","192.168.0.183","104.244.42.65","TLSv1.2","140","Application Data"
"346","29.572617","192.168.0.183","104.244.42.65","TCP","1414","50717  >  443 [ACK] Seq=269087 Ack=53594 Win=1040 Len=1360 [TCP segment of a reassembled PDU]"
"347","29.572617","192.168.0.183","104.244.42.65","TCP","1414","50717  >  443 [ACK] Seq=270447 Ack=53594 Win=1040 Len=1360 [TCP segment of a reassembled PDU]"
"348","29.572617","192.168.0.183","104.244.42.65","TCP","1414","50717  >  443 [ACK] Seq=271807 Ack=53594 Win=1040 Len=1360 [TCP segment of a reassembled PDU]"
"349","29.572617","192.168.0.183","104.244.42.65","TCP","1414","50717  >  443 [ACK] Seq=273167 Ack=53594 Win=1040 Len=1360 [TCP segment of a reassembled PDU]"
"350","29.572617","192.168.0.183","104.244.42.65","TCP","1414","50717  >  443 [ACK] Seq=274527 Ack=53594 Win=1040 Len=1360 [TCP segment of a reassembled PDU]"
"351","29.572617","192.168.0.183","104.244.42.65","TCP","1414","50717  >  443 [ACK] Seq=275887 Ack=53594 Win=1040 Len=1360 [TCP segment of a reassembled PDU]"
"352","29.572617","192.168.0.183","104.244.42.65","TCP","1414","50717  >  443 [ACK] Seq=277247 Ack=53594 Win=1040 Len=1360 [TCP segment of a reassembled PDU]"
"353","29.572617","192.168.0.183","104.244.42.65","TCP","1414","50717  >  443 [ACK] Seq=278607 Ack=53594 Win=1040 Len=1360 [TCP segment of a reassembled PDU]"
"354","29.572617","192.168.0.183","104.244.42.65","TLSv1.2","614","Application Data"
"355","29.620501","104.244.42.65","192.168.0.183","TCP","60","443  >  50717 [ACK] Seq=53594 Ack=221229 Win=7926 Len=0"
"356","29.620501","104.244.42.65","192.168.0.183","TCP","60","443  >  50717 [ACK] Seq=53594 Ack=241715 Win=7891 Len=0"
"357","29.620501","104.244.42.65","192.168.0.183","TCP","60","443  >  50717 [ACK] Seq=53594 Ack=270447 Win=7923 Len=0"
"358","29.620501","104.244.42.65","192.168.0.183","TLSv1.2","89","Application Data"
"359","29.620501","104.244.42.65","192.168.0.183","TCP","60","443  >  50717 [ACK] Seq=53629 Ack=280527 Win=7930 Len=0"
"360","29.665362","192.168.0.183","104.244.42.65","TCP","54","50717  >  443 [ACK] Seq=280527 Ack=53629 Win=1040 Len=0"
"361","29.668127","104.244.42.65","192.168.0.183","TLSv1.2","184","Application Data"
"362","29.711207","192.168.0.183","104.244.42.65","TCP","54","50717  >  443 [ACK] Seq=280527 Ack=53759 Win=1039 Len=0"
"363","30.764372","192.168.0.183","104.244.42.65","TLSv1.2","576","Application Data"
"364","30.840505","104.244.42.65","192.168.0.183","TCP","60","443  >  50717 [ACK] Seq=53759 Ack=281049 Win=7930 Len=0"
"365","31.248832","104.244.42.65","192.168.0.183","TLSv1.2","212","Application Data"
"366","31.301223","192.168.0.183","104.244.42.65","TCP","54","50717  >  443 [ACK] Seq=281049 Ack=53917 Win=1039 Len=0"
"367","32.607407","192.168.0.183","104.244.42.65","TLSv1.2","408","Application Data"
"368","32.607533","192.168.0.183","104.244.42.65","TCP","1414","50717  >  443 [ACK] Seq=281403 Ack=53917 Win=1039 Len=1360 [TCP segment of a reassembled PDU]"
"369","32.607533","192.168.0.183","104.244.42.65","TCP","1414","50717  >  443 [ACK] Seq=282763 Ack=53917 Win=1039 Len=1360 [TCP segment of a reassembled PDU]"
"370","32.607533","192.168.0.183","104.244.42.65","TCP","1414","50717  >  443 [ACK] Seq=284123 Ack=53917 Win=1039 Len=1360 [TCP segment of a reassembled PDU]"
"371","32.607533","192.168.0.183","104.244.42.65","TCP","1414","50717  >  443 [ACK] Seq=285483 Ack=53917 Win=1039 Len=1360 [TCP segment of a reassembled PDU]"
"372","32.607533","192.168.0.183","104.244.42.65","TCP","1414","50717  >  443 [ACK] Seq=286843 Ack=53917 Win=1039 Len=1360 [TCP segment of a reassembled PDU]"
"373","32.607533","192.168.0.183","104.244.42.65","TCP","1414","50717  >  443 [ACK] Seq=288203 Ack=53917 Win=1039 Len=1360 [TCP segment of a reassembled PDU]"
"374","32.607533","192.168.0.183","104.244.42.65","TCP","1414","50717  >  443 [ACK] Seq=289563 Ack=53917 Win=1039 Len=1360 [TCP segment of a reassembled PDU]"
"375","32.607533","192.168.0.183","104.244.42.65","TCP","1414","50717  >  443 [ACK] Seq=290923 Ack=53917 Win=1039 Len=1360 [TCP segment of a reassembled PDU]"
"376","32.607533","192.168.0.183","104.244.42.65","TCP","1414","50717  >  443 [ACK] Seq=292283 Ack=53917 Win=1039 Len=1360 [TCP segment of a reassembled PDU]"
"377","32.607533","192.168.0.183","104.244.42.65","TCP","1414","50717  >  443 [ACK] Seq=293643 Ack=53917 Win=1039 Len=1360 [TCP segment of a reassembled PDU]"
"378","32.607533","192.168.0.183","104.244.42.65","TCP","1414","50717  >  443 [ACK] Seq=295003 Ack=53917 Win=1039 Len=1360 [TCP segment of a reassembled PDU]"
"379","32.607533","192.168.0.183","104.244.42.65","TCP","1414","50717  >  443 [ACK] Seq=296363 Ack=53917 Win=1039 Len=1360 [TCP segment of a reassembled PDU]"
"380","32.607533","192.168.0.183","104.244.42.65","TLSv1.2","140","Application Data"
"381","32.607661","192.168.0.183","104.244.42.65","TCP","1414","50717  >  443 [ACK] Seq=297809 Ack=53917 Win=1039 Len=1360 [TCP segment of a reassembled PDU]"
"382","32.607661","192.168.0.183","104.244.42.65","TCP","1414","50717  >  443 [ACK] Seq=299169 Ack=53917 Win=1039 Len=1360 [TCP segment of a reassembled PDU]"
"383","32.607661","192.168.0.183","104.244.42.65","TCP","1414","50717  >  443 [ACK] Seq=300529 Ack=53917 Win=1039 Len=1360 [TCP segment of a reassembled PDU]"
"384","32.607661","192.168.0.183","104.244.42.65","TCP","1414","50717  >  443 [ACK] Seq=301889 Ack=53917 Win=1039 Len=1360 [TCP segment of a reassembled PDU]"
"385","32.607661","192.168.0.183","104.244.42.65","TCP","1414","50717  >  443 [ACK] Seq=303249 Ack=53917 Win=1039 Len=1360 [TCP segment of a reassembled PDU]"
"386","32.607661","192.168.0.183","104.244.42.65","TCP","1414","50717  >  443 [ACK] Seq=304609 Ack=53917 Win=1039 Len=1360 [TCP segment of a reassembled PDU]"
"387","32.607661","192.168.0.183","104.244.42.65","TCP","1414","50717  >  443 [ACK] Seq=305969 Ack=53917 Win=1039 Len=1360 [TCP segment of a reassembled PDU]"
"388","32.607661","192.168.0.183","104.244.42.65","TCP","1414","50717  >  443 [ACK] Seq=307329 Ack=53917 Win=1039 Len=1360 [TCP segment of a reassembled PDU]"
"389","32.607661","192.168.0.183","104.244.42.65","TCP","1414","50717  >  443 [ACK] Seq=308689 Ack=53917 Win=1039 Len=1360 [TCP segment of a reassembled PDU]"
"390","32.607661","192.168.0.183","104.244.42.65","TCP","1414","50717  >  443 [ACK] Seq=310049 Ack=53917 Win=1039 Len=1360 [TCP segment of a reassembled PDU]"
"391","32.607661","192.168.0.183","104.244.42.65","TCP","1414","50717  >  443 [ACK] Seq=311409 Ack=53917 Win=1039 Len=1360 [TCP segment of a reassembled PDU]"
"392","32.607661","192.168.0.183","104.244.42.65","TCP","1414","50717  >  443 [ACK] Seq=312769 Ack=53917 Win=1039 Len=1360 [TCP segment of a reassembled PDU]"
"393","32.607661","192.168.0.183","104.244.42.65","TLSv1.2","140","Application Data"
"394","32.607791","192.168.0.183","104.244.42.65","TCP","1414","50717  >  443 [ACK] Seq=314215 Ack=53917 Win=1039 Len=1360 [TCP segment of a reassembled PDU]"
"395","32.607791","192.168.0.183","104.244.42.65","TCP","1414","50717  >  443 [ACK] Seq=315575 Ack=53917 Win=1039 Len=1360 [TCP segment of a reassembled PDU]"
"396","32.607791","192.168.0.183","104.244.42.65","TCP","1414","50717  >  443 [ACK] Seq=316935 Ack=53917 Win=1039 Len=1360 [TCP segment of a reassembled PDU]"
"397","32.607791","192.168.0.183","104.244.42.65","TCP","1414","50717  >  443 [ACK] Seq=318295 Ack=53917 Win=1039 Len=1360 [TCP segment of a reassembled PDU]"
"398","32.607791","192.168.0.183","104.244.42.65","TCP","1414","50717  >  443 [ACK] Seq=319655 Ack=53917 Win=1039 Len=1360 [TCP segment of a reassembled PDU]"
"399","32.607791","192.168.0.183","104.244.42.65","TCP","1414","50717  >  443 [ACK] Seq=321015 Ack=53917 Win=1039 Len=1360 [TCP segment of a reassembled PDU]"
"400","32.607791","192.168.0.183","104.244.42.65","TCP","1414","50717  >  443 [ACK] Seq=322375 Ack=53917 Win=1039 Len=1360 [TCP segment of a reassembled PDU]"
"401","32.607791","192.168.0.183","104.244.42.65","TCP","1414","50717  >  443 [ACK] Seq=323735 Ack=53917 Win=1039 Len=1360 [TCP segment of a reassembled PDU]"
"402","32.607791","192.168.0.183","104.244.42.65","TCP","1414","50717  >  443 [ACK] Seq=325095 Ack=53917 Win=1039 Len=1360 [TCP segment of a reassembled PDU]"
"403","32.607791","192.168.0.183","104.244.42.65","TLSv1.2","114","Application Data"
"404","32.645050","104.244.42.65","192.168.0.183","TCP","60","443  >  50717 [ACK] Seq=53917 Ack=282763 Win=7927 Len=0"
"405","32.650761","104.244.42.65","192.168.0.183","TCP","60","443  >  50717 [ACK] Seq=53917 Ack=325095 Win=7903 Len=0"
"406","32.653468","104.244.42.65","192.168.0.183","TCP","60","443  >  50717 [ACK] Seq=53917 Ack=326515 Win=7927 Len=0"
"407","32.653468","104.244.42.65","192.168.0.183","TLSv1.2","89","Application Data"
"408","32.690288","104.244.42.65","192.168.0.183","TLSv1.2","184","Application Data"
"409","32.690324","192.168.0.183","104.244.42.65","TCP","54","50717  >  443 [ACK] Seq=326515 Ack=54082 Win=1038 Len=0"
"410","36.684374","192.168.0.183","104.244.42.65","TLSv1.2","243","Application Data"
"411","36.684476","192.168.0.183","104.244.42.65","TCP","1414","50717  >  443 [ACK] Seq=326704 Ack=54082 Win=1038 Len=1360 [TCP segment of a reassembled PDU]"
"412","36.684476","192.168.0.183","104.244.42.65","TCP","1414","50717  >  443 [ACK] Seq=328064 Ack=54082 Win=1038 Len=1360 [TCP segment of a reassembled PDU]"
"413","36.684476","192.168.0.183","104.244.42.65","TCP","1414","50717  >  443 [ACK] Seq=329424 Ack=54082 Win=1038 Len=1360 [TCP segment of a reassembled PDU]"
"414","36.684476","192.168.0.183","104.244.42.65","TCP","1414","50717  >  443 [ACK] Seq=330784 Ack=54082 Win=1038 Len=1360 [TCP segment of a reassembled PDU]"
"415","36.684476","192.168.0.183","104.244.42.65","TCP","1414","50717  >  443 [ACK] Seq=332144 Ack=54082 Win=1038 Len=1360 [TCP segment of a reassembled PDU]"
"416","36.684476","192.168.0.183","104.244.42.65","TCP","1414","50717  >  443 [ACK] Seq=333504 Ack=54082 Win=1038 Len=1360 [TCP segment of a reassembled PDU]"
"417","36.684476","192.168.0.183","104.244.42.65","TLSv1.2","673","Application Data"
"418","36.733617","104.244.42.65","192.168.0.183","TCP","60","443  >  50717 [ACK] Seq=54082 Ack=328064 Win=7928 Len=0"
"419","36.733617","104.244.42.65","192.168.0.183","TCP","60","443  >  50717 [ACK] Seq=54082 Ack=335483 Win=7930 Len=0"
"420","36.768960","104.244.42.65","192.168.0.183","TLSv1.2","184","Application Data"
"421","36.812276","192.168.0.183","104.244.42.65","TCP","54","50717  >  443 [ACK] Seq=335483 Ack=54212 Win=1037 Len=0"
"422","37.231686","192.168.0.183","104.244.42.65","TLSv1.2","286","Application Data"
"423","37.231751","192.168.0.183","104.244.42.65","TLSv1.2","168","Application Data"
"424","37.269088","104.244.42.65","192.168.0.183","TCP","60","443  >  50717 [ACK] Seq=54212 Ack=335829 Win=7930 Len=0"
"425","37.339832","104.244.42.65","192.168.0.183","TLSv1.2","314","Application Data"
"426","37.340458","192.168.0.183","104.244.42.65","TLSv1.2","89","Application Data"
"427","37.416557","104.244.42.65","192.168.0.183","TCP","60","443  >  50717 [ACK] Seq=54472 Ack=335864 Win=7930 Len=0"
"428","39.699894","192.168.0.183","104.244.42.65","TLSv1.2","382","Application Data"
"429","39.700011","192.168.0.183","104.244.42.65","TCP","1414","50717  >  443 [ACK] Seq=336192 Ack=54472 Win=1036 Len=1360 [TCP segment of a reassembled PDU]"
"430","39.700011","192.168.0.183","104.244.42.65","TCP","1414","50717  >  443 [ACK] Seq=337552 Ack=54472 Win=1036 Len=1360 [TCP segment of a reassembled PDU]"
"431","39.700011","192.168.0.183","104.244.42.65","TLSv1.2","981","Application Data"
"432","39.742827","104.244.42.65","192.168.0.183","TCP","60","443  >  50717 [ACK] Seq=54472 Ack=339839 Win=7925 Len=0"
"433","39.765655","104.244.42.65","192.168.0.183","TLSv1.2","314","Application Data"
"434","39.817175","192.168.0.183","104.244.42.65","TCP","54","50717  >  443 [ACK] Seq=339839 Ack=54732 Win=1041 Len=0"
