"No.","Time","Source","Destination","Protocol","Length","Info"
"1","0.000000","192.168.0.183","104.244.42.65","TCP","1414","50717  >  443 [ACK] Seq=1 Ack=1 Win=1040 Len=1360 [TCP segment of a reassembled PDU]"
"2","0.000000","192.168.0.183","104.244.42.65","TLSv1.2","81","Application Data"
"3","0.000327","192.168.0.183","104.244.42.65","TLSv1.2","783","Application Data"
"4","0.039000","104.244.42.65","192.168.0.183","TCP","60","443  >  50717 [ACK] Seq=1 Ack=2117 Win=5729 Len=0"
"5","0.536253","104.244.42.65","192.168.0.183","TLSv1.2","213","Application Data"
"6","0.582185","192.168.0.183","104.244.42.65","TCP","54","50717  >  443 [ACK] Seq=2117 Ack=160 Win=1039 Len=0"
"7","0.705371","192.168.0.183","104.244.42.65","TLSv1.2","235","Application Data"
"8","0.705563","192.168.0.183","104.244.42.65","TCP","1414","50717  >  443 [ACK] Seq=2298 Ack=160 Win=1039 Len=1360 [TCP segment of a reassembled PDU]"
"9","0.705563","192.168.0.183","104.244.42.65","TCP","1414","50717  >  443 [ACK] Seq=3658 Ack=160 Win=1039 Len=1360 [TCP segment of a reassembled PDU]"
"10","0.705563","192.168.0.183","104.244.42.65","TCP","1414","50717  >  443 [ACK] Seq=5018 Ack=160 Win=1039 Len=1360 [TCP segment of a reassembled PDU]"
"11","0.705563","192.168.0.183","104.244.42.65","TCP","1414","50717  >  443 [ACK] Seq=6378 Ack=160 Win=1039 Len=1360 [TCP segment of a reassembled PDU]"
"12","0.705563","192.168.0.183","104.244.42.65","TCP","1414","50717  >  443 [ACK] Seq=7738 Ack=160 Win=1039 Len=1360 [TCP segment of a reassembled PDU]"
"13","0.705563","192.168.0.183","104.244.42.65","TCP","1414","50717  >  443 [ACK] Seq=9098 Ack=160 Win=1039 Len=1360 [TCP segment of a reassembled PDU]"
"14","0.705563","192.168.0.183","104.244.42.65","TCP","1414","50717  >  443 [ACK] Seq=10458 Ack=160 Win=1039 Len=1360 [TCP segment of a reassembled PDU]"
"15","0.705563","192.168.0.183","104.244.42.65","TCP","1414","50717  >  443 [ACK] Seq=11818 Ack=160 Win=1039 Len=1360 [TCP segment of a reassembled PDU]"
"16","0.705563","192.168.0.183","104.244.42.65","TCP","1414","50717  >  443 [ACK] Seq=13178 Ack=160 Win=1039 Len=1360 [TCP segment of a reassembled PDU]"
"17","0.705563","192.168.0.183","104.244.42.65","TCP","1414","50717  >  443 [ACK] Seq=14538 Ack=160 Win=1039 Len=1360 [TCP segment of a reassembled PDU]"
"18","0.705563","192.168.0.183","104.244.42.65","TCP","1414","50717  >  443 [ACK] Seq=15898 Ack=160 Win=1039 Len=1360 [TCP segment of a reassembled PDU]"
"19","0.705563","192.168.0.183","104.244.42.65","TCP","1414","50717  >  443 [ACK] Seq=17258 Ack=160 Win=1039 Len=1360 [TCP segment of a reassembled PDU]"
"20","0.705563","192.168.0.183","104.244.42.65","TLSv1.2","140","Application Data"
"21","0.705719","192.168.0.183","104.244.42.65","TCP","1414","50717  >  443 [ACK] Seq=18704 Ack=160 Win=1039 Len=1360 [TCP segment of a reassembled PDU]"
"22","0.705719","192.168.0.183","104.244.42.65","TCP","1414","50717  >  443 [ACK] Seq=20064 Ack=160 Win=1039 Len=1360 [TCP segment of a reassembled PDU]"
"23","0.705719","192.168.0.183","104.244.42.65","TCP","1414","50717  >  443 [ACK] Seq=21424 Ack=160 Win=1039 Len=1360 [TCP segment of a reassembled PDU]"
"24","0.705719","192.168.0.183","104.244.42.65","TCP","1414","50717  >  443 [ACK] Seq=22784 Ack=160 Win=1039 Len=1360 [TCP segment of a reassembled PDU]"
"25","0.705719","192.168.0.183","104.244.42.65","TCP","1414","50717  >  443 [ACK] Seq=24144 Ack=160 Win=1039 Len=1360 [TCP segment of a reassembled PDU]"
"26","0.705719","192.168.0.183","104.244.42.65","TCP","1414","50717  >  443 [ACK] Seq=25504 Ack=160 Win=1039 Len=1360 [TCP segment of a reassembled PDU]"
"27","0.705719","192.168.0.183","104.244.42.65","TCP","1414","50717  >  443 [ACK] Seq=26864 Ack=160 Win=1039 Len=1360 [TCP segment of a reassembled PDU]"
"28","0.705719","192.168.0.183","104.244.42.65","TCP","1414","50717  >  443 [ACK] Seq=28224 Ack=160 Win=1039 Len=1360 [TCP segment of a reassembled PDU]"
"29","0.705719","192.168.0.183","104.244.42.65","TCP","1414","50717  >  443 [ACK] Seq=29584 Ack=160 Win=1039 Len=1360 [TCP segment of a reassembled PDU]"
"30","0.705719","192.168.0.183","104.244.42.65","TCP","1414","50717  >  443 [ACK] Seq=30944 Ack=160 Win=1039 Len=1360 [TCP segment of a reassembled PDU]"
"31","0.705719","192.168.0.183","104.244.42.65","TCP","1414","50717  >  443 [ACK] Seq=32304 Ack=160 Win=1039 Len=1360 [TCP segment of a reassembled PDU]"
"32","0.705719","192.168.0.183","104.244.42.65","TCP","1414","50717  >  443 [ACK] Seq=33664 Ack=160 Win=1039 Len=1360 [TCP segment of a reassembled PDU]"
"33","0.705719","192.168.0.183","104.244.42.65","TLSv1.2","140","Application Data"
"34","0.705936","192.168.0.183","104.244.42.65","TCP","1414","50717  >  443 [ACK] Seq=35110 Ack=160 Win=1039 Len=1360 [TCP segment of a reassembled PDU]"
"35","0.705936","192.168.0.183","104.244.42.65","TCP","1414","50717  >  443 [ACK] Seq=36470 Ack=160 Win=1039 Len=1360 [TCP segment of a reassembled PDU]"
"36","0.705936","192.168.0.183","104.244.42.65","TCP","1414","50717  >  443 [ACK] Seq=37830 Ack=160 Win=1039 Len=1360 [TCP segment of a reassembled PDU]"
"37","0.705936","192.168.0.183","104.244.42.65","TCP","1414","50717  >  443 [ACK] Seq=39190 Ack=160 Win=1039 Len=1360 [TCP segment of a reassembled PDU]"
"38","0.705936","192.168.0.183","104.244.42.65","TCP","1414","50717  >  443 [ACK] Seq=40550 Ack=160 Win=1039 Len=1360 [TCP segment of a reassembled PDU]"
"39","0.705936","192.168.0.183","104.244.42.65","TCP","1414","50717  >  443 [ACK] Seq=41910 Ack=160 Win=1039 Len=1360 [TCP segment of a reassembled PDU]"
"40","0.705936","192.168.0.183","104.244.42.65","TCP","1414","50717  >  443 [ACK] Seq=43270 Ack=160 Win=1039 Len=1360 [TCP segment of a reassembled PDU]"
"41","0.705936","192.168.0.183","104.244.42.65","TCP","1414","50717  >  443 [ACK] Seq=44630 Ack=160 Win=1039 Len=1360 [TCP segment of a reassembled PDU]"
"42","0.705936","192.168.0.183","104.244.42.65","TCP","1414","50717  >  443 [ACK] Seq=45990 Ack=160 Win=1039 Len=1360 [TCP segment of a reassembled PDU]"
"43","0.705936","192.168.0.183","104.244.42.65","TLSv1.2","353","Application Data"
"44","0.743466","104.244.42.65","192.168.0.183","TCP","60","443  >  50717 [ACK] Seq=160 Ack=5018 Win=5729 Len=0"
"45","0.748143","104.244.42.65","192.168.0.183","TCP","60","443  >  50717 [ACK] Seq=160 Ack=47649 Win=5735 Len=0"
"46","0.748143","104.244.42.65","192.168.0.183","TLSv1.2","89","Application Data"
"47","0.795477","104.244.42.65","192.168.0.183","TLSv1.2","263","Application Data"
"48","0.795515","192.168.0.183","104.244.42.65","TCP","54","50717  >  443 [ACK] Seq=47649 Ack=404 Win=1038 Len=0"
"49","1.223019","104.244.42.65","192.168.0.183","TCP","1414","443  >  50717 [ACK] Seq=404 Ack=47649 Win=5735 Len=1360 [TCP segment of a reassembled PDU]"
"50","1.223019","104.244.42.65","192.168.0.183","TCP","1414","443  >  50717 [PSH, ACK] Seq=1764 Ack=47649 Win=5735 Len=1360 [TCP segment of a reassembled PDU]"
"51","1.223019","104.244.42.65","192.168.0.183","TCP","1414","443  >  50717 [ACK] Seq=3124 Ack=47649 Win=5735 Len=1360 [TCP segment of a reassembled PDU]"
"52","1.223019","104.244.42.65","192.168.0.183","TCP","1414","443  >  50717 [PSH, ACK] Seq=4484 Ack=47649 Win=5735 Len=1360 [TCP segment of a reassembled PDU]"
"53","1.223019","104.244.42.65","192.168.0.183","TCP","1414","443  >  50717 [ACK] Seq=5844 Ack=47649 Win=5735 Len=1360 [TCP segment of a reassembled PDU]"
"54","1.223019","104.244.42.65","192.168.0.183","TCP","1414","443  >  50717 [PSH, ACK] Seq=7204 Ack=47649 Win=5735 Len=1360 [TCP segment of a reassembled PDU]"
"55","1.223019","104.244.42.65","192.168.0.183","TCP","1414","443  >  50717 [ACK] Seq=8564 Ack=47649 Win=5735 Len=1360 [TCP segment of a reassembled PDU]"
"56","1.223019","104.244.42.65","192.168.0.183","TCP","1414","443  >  50717 [PSH, ACK] Seq=9924 Ack=47649 Win=5735 Len=1360 [TCP segment of a reassembled PDU]"
"57","1.223019","104.244.42.65","192.168.0.183","TCP","1414","443  >  50717 [ACK] Seq=11284 Ack=47649 Win=5735 Len=1360 [TCP segment of a reassembled PDU]"
"58","1.223019","104.244.42.65","192.168.0.183","TCP","1414","443  >  50717 [PSH, ACK] Seq=12644 Ack=47649 Win=5735 Len=1360 [TCP segment of a reassembled PDU]"
"59","1.223019","104.244.42.65","192.168.0.183","TCP","1414","443  >  50717 [ACK] Seq=14004 Ack=47649 Win=5735 Len=1360 [TCP segment of a reassembled PDU]"
"60","1.223019","104.244.42.65","192.168.0.183","TCP","1414","443  >  50717 [PSH, ACK] Seq=15364 Ack=47649 Win=5735 Len=1360 [TCP segment of a reassembled PDU]"
"61","1.223019","104.244.42.65","192.168.0.183","TLSv1.2","622","Application Data, Application Data"
"62","1.223095","192.168.0.183","104.244.42.65","TCP","54","50717  >  443 [ACK] Seq=47649 Ack=17292 Win=1041 Len=0"
"63","1.224507","192.168.0.183","104.244.42.65","TLSv1.2","89","Application Data"
"64","1.312461","104.244.42.65","192.168.0.183","TCP","60","443  >  50717 [ACK] Seq=17292 Ack=47684 Win=5735 Len=0"
"65","3.822355","192.168.0.183","104.244.42.65","TLSv1.2","674","Application Data"
"66","3.822566","192.168.0.183","104.244.42.65","TCP","1414","50717  >  443 [ACK] Seq=48304 Ack=17292 Win=1041 Len=1360 [TCP segment of a reassembled PDU]"
"67","3.822566","192.168.0.183","104.244.42.65","TCP","1414","50717  >  443 [ACK] Seq=49664 Ack=17292 Win=1041 Len=1360 [TCP segment of a reassembled PDU]"
"68","3.822566","192.168.0.183","104.244.42.65","TCP","1414","50717  >  443 [ACK] Seq=51024 Ack=17292 Win=1041 Len=1360 [TCP segment of a reassembled PDU]"
"69","3.822566","192.168.0.183","104.244.42.65","TCP","1414","50717  >  443 [ACK] Seq=52384 Ack=17292 Win=1041 Len=1360 [TCP segment of a reassembled PDU]"
"70","3.822566","192.168.0.183","104.244.42.65","TCP","1414","50717  >  443 [ACK] Seq=53744 Ack=17292 Win=1041 Len=1360 [TCP segment of a reassembled PDU]"
"71","3.822566","192.168.0.183","104.244.42.65","TCP","1414","50717  >  443 [ACK] Seq=55104 Ack=17292 Win=1041 Len=1360 [TCP segment of a reassembled PDU]"
"72","3.822566","192.168.0.183","104.244.42.65","TCP","1414","50717  >  443 [ACK] Seq=56464 Ack=17292 Win=1041 Len=1360 [TCP segment of a reassembled PDU]"
"73","3.822566","192.168.0.183","104.244.42.65","TCP","1414","50717  >  443 [ACK] Seq=57824 Ack=17292 Win=1041 Len=1360 [TCP segment of a reassembled PDU]"
"74","3.822566","192.168.0.183","104.244.42.65","TCP","1414","50717  >  443 [ACK] Seq=59184 Ack=17292 Win=1041 Len=1360 [TCP segment of a reassembled PDU]"
"75","3.822566","192.168.0.183","104.244.42.65","TCP","1414","50717  >  443 [ACK] Seq=60544 Ack=17292 Win=1041 Len=1360 [TCP segment of a reassembled PDU]"
"76","3.822566","192.168.0.183","104.244.42.65","TCP","1414","50717  >  443 [ACK] Seq=61904 Ack=17292 Win=1041 Len=1360 [TCP segment of a reassembled PDU]"
"77","3.822566","192.168.0.183","104.244.42.65","TCP","1414","50717  >  443 [ACK] Seq=63264 Ack=17292 Win=1041 Len=1360 [TCP segment of a reassembled PDU]"
"78","3.822566","192.168.0.183","104.244.42.65","TLSv1.2","58","Application Data"
"79","3.858880","104.244.42.65","192.168.0.183","TCP","60","443  >  50717 [ACK] Seq=17292 Ack=55104 Win=5729 Len=0"
"80","3.864916","104.244.42.65","192.168.0.183","TCP","60","443  >  50717 [ACK] Seq=17292 Ack=64628 Win=5721 Len=0"
"81","3.899464","104.244.42.65","192.168.0.183","TLSv1.2","184","Application Data"
"82","3.948330","192.168.0.183","104.244.42.65","TCP","54","50717  >  443 [ACK] Seq=64628 Ack=17422 Win=1040 Len=0"
"83","6.298533","192.168.0.183","104.244.42.65","TLSv1.2","301","Application Data"
"84","6.312983","192.168.0.183","104.244.42.65","TLSv1.2","286","Application Data"
"85","6.313113","192.168.0.183","104.244.42.65","TCP","1414","50717  >  443 [ACK] Seq=65107 Ack=17422 Win=1040 Len=1360 [TCP segment of a reassembled PDU]"
"86","6.313113","192.168.0.183","104.244.42.65","TLSv1.2","354","Application Data"
"87","6.332005","192.168.0.183","104.244.42.65","TLSv1.2","291","Application Data"
"88","6.332224","192.168.0.183","104.244.42.65","TLSv1.2","1198","Application Data"
"89","6.350248","104.244.42.65","192.168.0.183","TCP","60","443  >  50717 [ACK] Seq=17422 Ack=66767 Win=5729 Len=0"
"90","6.374245","104.244.42.65","192.168.0.183","TCP","60","443  >  50717 [ACK] Seq=17422 Ack=68148 Win=5731 Len=0"
"91","6.414808","104.244.42.65","192.168.0.183","TLSv1.2","180","Application Data"
"92","6.459175","192.168.0.183","104.244.42.65","TCP","54","50717  >  443 [ACK] Seq=68148 Ack=17548 Win=1040 Len=0"
"93","6.600137","104.244.42.65","192.168.0.183","TLSv1.2","175","Application Data"
"94","6.644436","192.168.0.183","104.244.42.65","TCP","54","50717  >  443 [ACK] Seq=68148 Ack=17669 Win=1039 Len=0"
"95","6.959610","192.168.0.183","104.244.42.65","TLSv1.2","235","Application Data"
"96","6.959739","192.168.0.183","104.244.42.65","TCP","1414","50717  >  443 [ACK] Seq=68329 Ack=17669 Win=1039 Len=1360 [TCP segment of a reassembled PDU]"
"97","6.959739","192.168.0.183","104.244.42.65","TCP","1414","50717  >  443 [ACK] Seq=69689 Ack=17669 Win=1039 Len=1360 [TCP segment of a reassembled PDU]"
"98","6.959739","192.168.0.183","104.244.42.65","TCP","1414","50717  >  443 [ACK] Seq=71049 Ack=17669 Win=1039 Len=1360 [TCP segment of a reassembled PDU]"
"99","6.959739","192.168.0.183","104.244.42.65","TCP","1414","50717  >  443 [ACK] Seq=72409 Ack=17669 Win=1039 Len=1360 [TCP segment of a reassembled PDU]"
"100","6.959739","192.168.0.183","104.244.42.65","TCP","1414","50717  >  443 [ACK] Seq=73769 Ack=17669 Win=1039 Len=1360 [TCP segment of a reassembled PDU]"
"101","6.959739","192.168.0.183","104.244.42.65","TCP","1414","50717  >  443 [ACK] Seq=75129 Ack=17669 Win=1039 Len=1360 [TCP segment of a reassembled PDU]"
"102","6.959739","192.168.0.183","104.244.42.65","TCP","1414","50717  >  443 [ACK] Seq=76489 Ack=17669 Win=1039 Len=1360 [TCP segment of a reassembled PDU]"
"103","6.959739","192.168.0.183","104.244.42.65","TCP","1414","50717  >  443 [ACK] Seq=77849 Ack=17669 Win=1039 Len=1360 [TCP segment of a reassembled PDU]"
"104","6.959739","192.168.0.183","104.244.42.65","TCP","1414","50717  >  443 [ACK] Seq=79209 Ack=17669 Win=1039 Len=1360 [TCP segment of a reassembled PDU]"
"105","6.959739","192.168.0.183","104.244.42.65","TCP","1414","50717  >  443 [ACK] Seq=80569 Ack=17669 Win=1039 Len=1360 [TCP segment of a reassembled PDU]"
"106","6.959739","192.168.0.183","104.244.42.65","TCP","1414","50717  >  443 [ACK] Seq=81929 Ack=17669 Win=1039 Len=1360 [TCP segment of a reassembled PDU]"
"107","6.959739","192.168.0.183","104.244.42.65","TCP","1414","50717  >  443 [ACK] Seq=83289 Ack=17669 Win=1039 Len=1360 [TCP segment of a reassembled PDU]"
"108","6.959739","192.168.0.183","104.244.42.65","TLSv1.2","140","Application Data"
"109","6.959880","192.168.0.183","104.244.42.65","TCP","1414","50717  >  443 [ACK] Seq=84735 Ack=17669 Win=1039 Len=1360 [TCP segment of a reassembled PDU]"
"110","6.959880","192.168.0.183","104.244.42.65","TCP","1414","50717  >  443 [ACK] Seq=86095 Ack=17669 Win=1039 Len=1360 [TCP segment of a reassembled PDU]"
"111","6.959880","192.168.0.183","104.244.42.65","TCP","1414","50717  >  443 [ACK] Seq=87455 Ack=17669 Win=1039 Len=1360 [TCP segment of a reassembled PDU]"
"112","6.959880","192.168.0.183","104.244.42.65","TCP","1414","50717  >  443 [ACK] Seq=88815 Ack=17669 Win=1039 Len=1360 [TCP segment of a reassembled PDU]"
"113","6.959880","192.168.0.183","104.244.42.65","TCP","1414","50717  >  443 [ACK] Seq=90175 Ack=17669 Win=1039 Len=1360 [TCP segment of a reassembled PDU]"
"114","6.959880","192.168.0.183","104.244.42.65","TCP","1414","50717  >  443 [ACK] Seq=91535 Ack=17669 Win=1039 Len=1360 [TCP segment of a reassembled PDU]"
"115","6.959880","192.168.0.183","104.244.42.65","TCP","1414","50717  >  443 [ACK] Seq=92895 Ack=17669 Win=1039 Len=1360 [TCP segment of a reassembled PDU]"
"116","6.959880","192.168.0.183","104.244.42.65","TCP","1414","50717  >  443 [ACK] Seq=94255 Ack=17669 Win=1039 Len=1360 [TCP segment of a reassembled PDU]"
"117","6.959880","192.168.0.183","104.244.42.65","TCP","1414","50717  >  443 [ACK] Seq=95615 Ack=17669 Win=1039 Len=1360 [TCP segment of a reassembled PDU]"
"118","6.959880","192.168.0.183","104.244.42.65","TCP","1414","50717  >  443 [ACK] Seq=96975 Ack=17669 Win=1039 Len=1360 [TCP segment of a reassembled PDU]"
"119","6.959880","192.168.0.183","104.244.42.65","TCP","1414","50717  >  443 [ACK] Seq=98335 Ack=17669 Win=1039 Len=1360 [TCP segment of a reassembled PDU]"
"120","6.959880","192.168.0.183","104.244.42.65","TCP","1414","50717  >  443 [ACK] Seq=99695 Ack=17669 Win=1039 Len=1360 [TCP segment of a reassembled PDU]"
"121","6.959880","192.168.0.183","104.244.42.65","TLSv1.2","140","Application Data"
"122","6.960001","192.168.0.183","104.244.42.65","TCP","1414","50717  >  443 [ACK] Seq=101141 Ack=17669 Win=1039 Len=1360 [TCP segment of a reassembled PDU]"
"123","6.960001","192.168.0.183","104.244.42.65","TCP","1414","50717  >  443 [ACK] Seq=102501 Ack=17669 Win=1039 Len=1360 [TCP segment of a reassembled PDU]"
"124","6.960001","192.168.0.183","104.244.42.65","TCP","1414","50717  >  443 [ACK] Seq=103861 Ack=17669 Win=1039 Len=1360 [TCP segment of a reassembled PDU]"
"125","6.960001","192.168.0.183","104.244.42.65","TCP","1414","50717  >  443 [ACK] Seq=105221 Ack=17669 Win=1039 Len=1360 [TCP segment of a reassembled PDU]"
"126","6.960001","192.168.0.183","104.244.42.65","TCP","1414","50717  >  443 [ACK] Seq=106581 Ack=17669 Win=1039 Len=1360 [TCP segment of a reassembled PDU]"
"127","6.960001","192.168.0.183","104.244.42.65","TCP","1414","50717  >  443 [ACK] Seq=107941 Ack=17669 Win=1039 Len=1360 [TCP segment of a reassembled PDU]"
"128","6.960001","192.168.0.183","104.244.42.65","TCP","1414","50717  >  443 [ACK] Seq=109301 Ack=17669 Win=1039 Len=1360 [TCP segment of a reassembled PDU]"
"129","6.960001","192.168.0.183","104.244.42.65","TCP","1414","50717  >  443 [ACK] Seq=110661 Ack=17669 Win=1039 Len=1360 [TCP segment of a reassembled PDU]"
"130","6.960001","192.168.0.183","104.244.42.65","TCP","1414","50717  >  443 [ACK] Seq=112021 Ack=17669 Win=1039 Len=1360 [TCP segment of a reassembled PDU]"
"131","6.960001","192.168.0.183","104.244.42.65","TCP","1414","50717  >  443 [ACK] Seq=113381 Ack=17669 Win=1039 Len=1360 [TCP segment of a reassembled PDU]"
"132","6.960001","192.168.0.183","104.244.42.65","TCP","1414","50717  >  443 [ACK] Seq=114741 Ack=17669 Win=1039 Len=1360 [TCP segment of a reassembled PDU]"
"133","6.960001","192.168.0.183","104.244.42.65","TCP","1414","50717  >  443 [ACK] Seq=116101 Ack=17669 Win=1039 Len=1360 [TCP segment of a reassembled PDU]"
"134","6.960001","192.168.0.183","104.244.42.65","TLSv1.2","140","Application Data"
"135","6.960137","192.168.0.183","104.244.42.65","TCP","1414","50717  >  443 [ACK] Seq=117547 Ack=17669 Win=1039 Len=1360 [TCP segment of a reassembled PDU]"
"136","6.960137","192.168.0.183","104.244.42.65","TCP","1414","50717  >  443 [ACK] Seq=118907 Ack=17669 Win=1039 Len=1360 [TCP segment of a reassembled PDU]"
"137","6.960137","192.168.0.183","104.244.42.65","TCP","1414","50717  >  443 [ACK] Seq=120267 Ack=17669 Win=1039 Len=1360 [TCP segment of a reassembled PDU]"
"138","6.960137","192.168.0.183","104.244.42.65","TCP","1414","50717  >  443 [ACK] Seq=121627 Ack=17669 Win=1039 Len=1360 [TCP segment of a reassembled PDU]"
"139","6.960137","192.168.0.183","104.244.42.65","TCP","1414","50717  >  443 [ACK] Seq=122987 Ack=17669 Win=1039 Len=1360 [TCP segment of a reassembled PDU]"
"140","6.960137","192.168.0.183","104.244.42.65","TCP","1414","50717  >  443 [ACK] Seq=124347 Ack=17669 Win=1039 Len=1360 [TCP segment of a reassembled PDU]"
"141","6.960137","192.168.0.183","104.244.42.65","TCP","1414","50717  >  443 [ACK] Seq=125707 Ack=17669 Win=1039 Len=1360 [TCP segment of a reassembled PDU]"
"142","6.960137","192.168.0.183","104.244.42.65","TCP","1414","50717  >  443 [ACK] Seq=127067 Ack=17669 Win=1039 Len=1360 [TCP segment of a reassembled PDU]"
"143","6.960137","192.168.0.183","104.244.42.65","TCP","1414","50717  >  443 [ACK] Seq=128427 Ack=17669 Win=1039 Len=1360 [TCP segment of a reassembled PDU]"
"144","6.960137","192.168.0.183","104.244.42.65","TCP","1414","50717  >  443 [ACK] Seq=129787 Ack=17669 Win=1039 Len=1360 [TCP segment of a reassembled PDU]"
"145","6.960137","192.168.0.183","104.244.42.65","TCP","1414","50717  >  443 [ACK] Seq=131147 Ack=17669 Win=1039 Len=1360 [TCP segment of a reassembled PDU]"
"146","6.960137","192.168.0.183","104.244.42.65","TCP","1414","50717  >  443 [ACK] Seq=132507 Ack=17669 Win=1039 Len=1360 [TCP segment of a reassembled PDU]"
"147","6.960137","192.168.0.183","104.244.42.65","TLSv1.2","140","Application Data"
"148","6.960268","192.168.0.183","104.244.42.65","TLSv1.2","121","Application Data"
"149","6.995067","104.244.42.65","192.168.0.183","TCP","60","443  >  50717 [ACK] Seq=17669 Ack=69689 Win=5732 Len=0"
"150","7.001817","104.244.42.65","192.168.0.183","TCP","60","443  >  50717 [ACK] Seq=17669 Ack=122987 Win=5680 Len=0"
"151","7.001817","104.244.42.65","192.168.0.183","TLSv1.2","102","Application Data"
"152","7.001817","104.244.42.65","192.168.0.183","TCP","60","443  >  50717 [ACK] Seq=17717 Ack=134020 Win=5716 Len=0"
"153","7.002068","192.168.0.183","104.244.42.65","TCP","1414","50717  >  443 [ACK] Seq=134020 Ack=17717 Win=1039 Len=1360 [TCP segment of a reassembled PDU]"
"154","7.002068","192.168.0.183","104.244.42.65","TCP","1414","50717  >  443 [ACK] Seq=135380 Ack=17717 Win=1039 Len=1360 [TCP segment of a reassembled PDU]"
"155","7.002068","192.168.0.183","104.244.42.65","TCP","1414","50717  >  443 [ACK] Seq=136740 Ack=17717 Win=1039 Len=1360 [TCP segment of a reassembled PDU]"
"156","7.002068","192.168.0.183","104.244.42.65","TCP","1414","50717  >  443 [ACK] Seq=138100 Ack=17717 Win=1039 Len=1360 [TCP segment of a reassembled PDU]"
"157","7.002068","192.168.0.183","104.244.42.65","TCP","1414","50717  >  443 [ACK] Seq=139460 Ack=17717 Win=1039 Len=1360 [TCP segment of a reassembled PDU]"
"158","7.002068","192.168.0.183","104.244.42.65","TCP","1414","50717  >  443 [ACK] Seq=140820 Ack=17717 Win=1039 Len=1360 [TCP segment of a reassembled PDU]"
"159","7.002068","192.168.0.183","104.244.42.65","TCP","1414","50717  >  443 [ACK] Seq=142180 Ack=17717 Win=1039 Len=1360 [TCP segment of a reassembled PDU]"
"160","7.002068","192.168.0.183","104.244.42.65","TCP","1414","50717  >  443 [ACK] Seq=143540 Ack=17717 Win=1039 Len=1360 [TCP segment of a reassembled PDU]"
"161","7.002068","192.168.0.183","104.244.42.65","TCP","1414","50717  >  443 [ACK] Seq=144900 Ack=17717 Win=1039 Len=1360 [TCP segment of a reassembled PDU]"
"162","7.002068","192.168.0.183","104.244.42.65","TCP","1414","50717  >  443 [ACK] Seq=146260 Ack=17717 Win=1039 Len=1360 [TCP segment of a reassembled PDU]"
"163","7.002068","192.168.0.183","104.244.42.65","TLSv1.2","698","Application Data"
"164","7.039313","104.244.42.65","192.168.0.183","TCP","60","443  >  50717 [ACK] Seq=17717 Ack=140820 Win=5718 Len=0"
"165","7.045013","104.244.42.65","192.168.0.183","TCP","60","443  >  50717 [ACK] Seq=17717 Ack=148264 Win=5730 Len=0"
"166","7.110983","104.244.42.65","192.168.0.183","TLSv1.2","183","Application Data"
"167","7.162002","192.168.0.183","104.244.42.65","TCP","54","50717  >  443 [ACK] Seq=148264 Ack=17846 Win=1039 Len=0"
"168","7.774179","104.244.42.65","192.168.0.183","TCP","1414","443  >  50717 [ACK] Seq=17846 Ack=148264 Win=5735 Len=1360 [TCP segment of a reassembled PDU]"
"169","7.774179","104.244.42.65","192.168.0.183","TCP","1414","443  >  50717 [ACK] Seq=19206 Ack=148264 Win=5735 Len=1360 [TCP segment of a reassembled PDU]"
"170","7.774179","104.244.42.65","192.168.0.183","TCP","1414","443  >  50717 [PSH, ACK] Seq=20566 Ack=148264 Win=5735 Len=1360 [TCP segment of a reassembled PDU]"
"171","7.774179","104.244.42.65","192.168.0.183","TCP","1414","443  >  50717 [ACK] Seq=21926 Ack=148264 Win=5735 Len=1360 [TCP segment of a reassembled PDU]"
"172","7.774179","104.244.42.65","192.168.0.183","TCP","1414","443  >  50717 [ACK] Seq=23286 Ack=148264 Win=5735 Len=1360 [TCP segment of a reassembled PDU]"
"173","7.774179","104.244.42.65","192.168.0.183","TCP","1414","443  >  50717 [PSH, ACK] Seq=24646 Ack=148264 Win=5735 Len=1360 [TCP segment of a reassembled PDU]"
"174","7.774179","104.244.42.65","192.168.0.183","TCP","1414","443  >  50717 [ACK] Seq=26006 Ack=148264 Win=5735 Len=1360 [TCP segment of a reassembled PDU]"
"175","7.774179","104.244.42.65","192.168.0.183","TCP","1414","443  >  50717 [ACK] Seq=27366 Ack=148264 Win=5735 Len=1360 [TCP segment of a reassembled PDU]"
"176","7.774179","104.244.42.65","192.168.0.183","TCP","1414","443  >  50717 [PSH, ACK] Seq=28726 Ack=148264 Win=5735 Len=1360 [TCP segment of a reassembled PDU]"
"177","7.774179","104.244.42.65","192.168.0.183","TCP","1414","443  >  50717 [ACK] Seq=30086 Ack=148264 Win=5735 Len=1360 [TCP segment of a reassembled PDU]"
"178","7.774179","104.244.42.65","192.168.0.183","TCP","1414","443  >  50717 [ACK] Seq=31446 Ack=148264 Win=5735 Len=1360 [TCP segment of a reassembled PDU]"
"179","7.774179","104.244.42.65","192.168.0.183","TCP","1414","443  >  50717 [PSH, ACK] Seq=32806 Ack=148264 Win=5735 Len=1360 [TCP segment of a reassembled PDU]"
"180","7.774179","104.244.42.65","192.168.0.183","TLSv1.2","140","Application Data"
"181","7.774179","104.244.42.65","192.168.0.183","TCP","1414","443  >  50717 [ACK] Seq=34252 Ack=148264 Win=5735 Len=1360 [TCP segment of a reassembled PDU]"
"182","7.774179","104.244.42.65","192.168.0.183","TCP","1414","443  >  50717 [ACK] Seq=35612 Ack=148264 Win=5735 Len=1360 [TCP segment of a reassembled PDU]"
"183","7.774179","104.244.42.65","192.168.0.183","TCP","1414","443  >  50717 [PSH, ACK] Seq=36972 Ack=148264 Win=5735 Len=1360 [TCP segment of a reassembled PDU]"
"184","7.774179","104.244.42.65","192.168.0.183","TCP","1414","443  >  50717 [ACK] Seq=38332 Ack=148264 Win=5735 Len=1360 [TCP segment of a reassembled PDU]"
"185","7.774179","104.244.42.65","192.168.0.183","TCP","1414","443  >  50717 [ACK] Seq=39692 Ack=148264 Win=5735 Len=1360 [TCP segment of a reassembled PDU]"
"186","7.774179","104.244.42.65","192.168.0.183","TCP","1414","443  >  50717 [PSH, ACK] Seq=41052 Ack=148264 Win=5735 Len=1360 [TCP segment of a reassembled PDU]"
"187","7.774179","104.244.42.65","192.168.0.183","TCP","1414","443  >  50717 [ACK] Seq=42412 Ack=148264 Win=5735 Len=1360 [TCP segment of a reassembled PDU]"
"188","7.774179","104.244.42.65","192.168.0.183","TCP","1414","443  >  50717 [ACK] Seq=43772 Ack=148264 Win=5735 Len=1360 [TCP segment of a reassembled PDU]"
"189","7.774179","104.244.42.65","192.168.0.183","TCP","1414","443  >  50717 [PSH, ACK] Seq=45132 Ack=148264 Win=5735 Len=1360 [TCP segment of a reassembled PDU]"
"190","7.774179","104.244.42.65","192.168.0.183","TCP","1414","443  >  50717 [ACK] Seq=46492 Ack=148264 Win=5735 Len=1360 [TCP segment of a reassembled PDU]"
"191","7.774179","104.244.42.65","192.168.0.183","TCP","1414","443  >  50717 [ACK] Seq=47852 Ack=148264 Win=5735 Len=1360 [TCP segment of a reassembled PDU]"
"192","7.774179","104.244.42.65","192.168.0.183","TCP","1414","443  >  50717 [PSH, ACK] Seq=49212 Ack=148264 Win=5735 Len=1360 [TCP segment of a reassembled PDU]"
"193","7.774179","104.244.42.65","192.168.0.183","TLSv1.2","140","Application Data"
"194","7.774179","104.244.42.65","192.168.0.183","TCP","1414","443  >  50717 [ACK] Seq=50658 Ack=148264 Win=5735 Len=1360 [TCP segment of a reassembled PDU]"
"195","7.774179","104.244.42.65","192.168.0.183","TLSv1.2","1208","Application Data"
"196","7.774321","192.168.0.183","104.244.42.65","TCP","54","50717  >  443 [ACK] Seq=148264 Ack=53172 Win=1041 Len=0"
"197","7.774957","192.168.0.183","104.244.42.65","TLSv1.2","89","Application Data"
"198","7.851264","104.244.42.65","192.168.0.183","TCP","60","443  >  50717 [ACK] Seq=53172 Ack=148299 Win=5735 Len=0"
"199","8.871109","192.168.0.183","104.244.42.65","TCP","1414","50717  >  443 [ACK] Seq=148299 Ack=53172 Win=1041 Len=1360 [TCP segment of a reassembled PDU]"
"200","8.871109","192.168.0.183","104.244.42.65","TLSv1.2","414","Application Data"
"201","8.871301","192.168.0.183","104.244.42.65","TLSv1.2","785","Application Data"
"202","8.908706","104.244.42.65","192.168.0.183","TCP","60","443  >  50717 [ACK] Seq=53172 Ack=150019 Win=5731 Len=0"
"203","8.915380","104.244.42.65","192.168.0.183","TCP","60","443  >  50717 [ACK] Seq=53172 Ack=150750 Win=5734 Len=0"
"204","9.229769","104.244.42.65","192.168.0.183","TLSv1.2","175","Application Data"
"205","9.284066","192.168.0.183","104.244.42.65","TCP","54","50717  >  443 [ACK] Seq=150750 Ack=53293 Win=1040 Len=0"
"206","9.374743","104.244.42.65","192.168.0.183","TCP","1414","443  >  50717 [ACK] Seq=53293 Ack=150750 Win=5735 Len=1360 [TCP segment of a reassembled PDU]"
"207","9.374743","104.244.42.65","192.168.0.183","TCP","1414","443  >  50717 [ACK] Seq=54653 Ack=150750 Win=5735 Len=1360 [TCP segment of a reassembled PDU]"
"208","9.374743","104.244.42.65","192.168.0.183","TCP","1414","443  >  50717 [PSH, ACK] Seq=56013 Ack=150750 Win=5735 Len=1360 [TCP segment of a reassembled PDU]"
"209","9.374743","104.244.42.65","192.168.0.183","TCP","1414","443  >  50717 [ACK] Seq=57373 Ack=150750 Win=5735 Len=1360 [TCP segment of a reassembled PDU]"
"210","9.374743","104.244.42.65","192.168.0.183","TCP","1414","443  >  50717 [ACK] Seq=58733 Ack=150750 Win=5735 Len=1360 [TCP segment of a reassembled PDU]"
"211","9.374743","104.244.42.65","192.168.0.183","TLSv1.2","634","Application Data"
"212","9.374793","192.168.0.183","104.244.42.65","TCP","54","50717  >  443 [ACK] Seq=150750 Ack=60673 Win=1041 Len=0"
"213","9.954918","192.168.0.183","104.244.42.65","TLSv1.2","672","Application Data"
"214","9.955043","192.168.0.183","104.244.42.65","TCP","1414","50717  >  443 [ACK] Seq=151368 Ack=60673 Win=1041 Len=1360 [TCP segment of a reassembled PDU]"
"215","9.955043","192.168.0.183","104.244.42.65","TCP","1414","50717  >  443 [ACK] Seq=152728 Ack=60673 Win=1041 Len=1360 [TCP segment of a reassembled PDU]"
"216","9.955043","192.168.0.183","104.244.42.65","TCP","1414","50717  >  443 [ACK] Seq=154088 Ack=60673 Win=1041 Len=1360 [TCP segment of a reassembled PDU]"
"217","9.955043","192.168.0.183","104.244.42.65","TCP","1414","50717  >  443 [ACK] Seq=155448 Ack=60673 Win=1041 Len=1360 [TCP segment of a reassembled PDU]"
"218","9.955043","192.168.0.183","104.244.42.65","TCP","1414","50717  >  443 [ACK] Seq=156808 Ack=60673 Win=1041 Len=1360 [TCP segment of a reassembled PDU]"
"219","9.955043","192.168.0.183","104.244.42.65","TCP","1414","50717  >  443 [ACK] Seq=158168 Ack=60673 Win=1041 Len=1360 [TCP segment of a reassembled PDU]"
"220","9.955043","192.168.0.183","104.244.42.65","TCP","1414","50717  >  443 [ACK] Seq=159528 Ack=60673 Win=1041 Len=1360 [TCP segment of a reassembled PDU]"
"221","9.955043","192.168.0.183","104.244.42.65","TCP","1414","50717  >  443 [ACK] Seq=160888 Ack=60673 Win=1041 Len=1360 [TCP segment of a reassembled PDU]"
"222","9.955043","192.168.0.183","104.244.42.65","TCP","1414","50717  >  443 [ACK] Seq=162248 Ack=60673 Win=1041 Len=1360 [TCP segment of a reassembled PDU]"
"223","9.955043","192.168.0.183","104.244.42.65","TCP","1414","50717  >  443 [ACK] Seq=163608 Ack=60673 Win=1041 Len=1360 [TCP segment of a reassembled PDU]"
"224","9.955043","192.168.0.183","104.244.42.65","TCP","1414","50717  >  443 [ACK] Seq=164968 Ack=60673 Win=1041 Len=1360 [TCP segment of a reassembled PDU]"
"225","9.955043","192.168.0.183","104.244.42.65","TCP","1414","50717  >  443 [ACK] Seq=166328 Ack=60673 Win=1041 Len=1360 [TCP segment of a reassembled PDU]"
"226","9.955043","192.168.0.183","104.244.42.65","TLSv1.2","140","Application Data"
"227","9.955175","192.168.0.183","104.244.42.65","TCP","1414","50717  >  443 [ACK] Seq=167774 Ack=60673 Win=1041 Len=1360 [TCP segment of a reassembled PDU]"
"228","9.955175","192.168.0.183","104.244.42.65","TCP","1414","50717  >  443 [ACK] Seq=169134 Ack=60673 Win=1041 Len=1360 [TCP segment of a reassembled PDU]"
"229","9.955175","192.168.0.183","104.244.42.65","TCP","1414","50717  >  443 [ACK] Seq=170494 Ack=60673 Win=1041 Len=1360 [TCP segment of a reassembled PDU]"
"230","9.955175","192.168.0.183","104.244.42.65","TCP","1414","50717  >  443 [ACK] Seq=171854 Ack=60673 Win=1041 Len=1360 [TCP segment of a reassembled PDU]"
"231","9.955175","192.168.0.183","104.244.42.65","TCP","1414","50717  >  443 [ACK] Seq=173214 Ack=60673 Win=1041 Len=1360 [TCP segment of a reassembled PDU]"
"232","9.955175","192.168.0.183","104.244.42.65","TCP","1414","50717  >  443 [ACK] Seq=174574 Ack=60673 Win=1041 Len=1360 [TCP segment of a reassembled PDU]"
"233","9.955175","192.168.0.183","104.244.42.65","TCP","1414","50717  >  443 [ACK] Seq=175934 Ack=60673 Win=1041 Len=1360 [TCP segment of a reassembled PDU]"
"234","9.955175","192.168.0.183","104.244.42.65","TCP","1414","50717  >  443 [ACK] Seq=177294 Ack=60673 Win=1041 Len=1360 [TCP segment of a reassembled PDU]"
"235","9.955175","192.168.0.183","104.244.42.65","TCP","1414","50717  >  443 [ACK] Seq=178654 Ack=60673 Win=1041 Len=1360 [TCP segment of a reassembled PDU]"
"236","9.955175","192.168.0.183","104.244.42.65","TCP","1414","50717  >  443 [ACK] Seq=180014 Ack=60673 Win=1041 Len=1360 [TCP segment of a reassembled PDU]"
"237","9.955175","192.168.0.183","104.244.42.65","TCP","1414","50717  >  443 [ACK] Seq=181374 Ack=60673 Win=1041 Len=1360 [TCP segment of a reassembled PDU]"
"238","9.955175","192.168.0.183","104.244.42.65","TCP","1414","50717  >  443 [ACK] Seq=182734 Ack=60673 Win=1041 Len=1360 [TCP segment of a reassembled PDU]"
"239","9.955175","192.168.0.183","104.244.42.65","TLSv1.2","140","Application Data"
"240","9.955338","192.168.0.183","104.244.42.65","TCP","1414","50717  >  443 [ACK] Seq=184180 Ack=60673 Win=1041 Len=1360 [TCP segment of a reassembled PDU]"
"241","9.955338","192.168.0.183","104.244.42.65","TCP","1414","50717  >  443 [ACK] Seq=185540 Ack=60673 Win=1041 Len=1360 [TCP segment of a reassembled PDU]"
"242","9.955338","192.168.0.183","104.244.42.65","TCP","1414","50717  >  443 [ACK] Seq=186900 Ack=60673 Win=1041 Len=1360 [TCP segment of a reassembled PDU]"
"243","9.955338","192.168.0.183","104.244.42.65","TCP","1414","50717  >  443 [ACK] Seq=188260 Ack=60673 Win=1041 Len=1360 [TCP segment of a reassembled PDU]"
"244","9.955338","192.168.0.183","104.244.42.65","TCP","1414","50717  >  443 [ACK] Seq=189620 Ack=60673 Win=1041 Len=1360 [TCP segment of a reassembled PDU]"
"245","9.955338","192.168.0.183","104.244.42.65","TCP","1414","50717  >  443 [ACK] Seq=190980 Ack=60673 Win=1041 Len=1360 [TCP segment of a reassembled PDU]"
"246","9.955338","192.168.0.183","104.244.42.65","TCP","1414","50717  >  443 [ACK] Seq=192340 Ack=60673 Win=1041 Len=1360 [TCP segment of a reassembled PDU]"
"247","9.955338","192.168.0.183","104.244.42.65","TCP","1414","50717  >  443 [ACK] Seq=193700 Ack=60673 Win=1041 Len=1360 [TCP segment of a reassembled PDU]"
"248","9.955338","192.168.0.183","104.244.42.65","TCP","1414","50717  >  443 [ACK] Seq=195060 Ack=60673 Win=1041 Len=1360 [TCP segment of a reassembled PDU]"
"249","9.955338","192.168.0.183","104.244.42.65","TCP","1414","50717  >  443 [ACK] Seq=196420 Ack=60673 Win=1041 Len=1360 [TCP segment of a reassembled PDU]"
"250","9.955338","192.168.0.183","104.244.42.65","TCP","1414","50717  >  443 [ACK] Seq=197780 Ack=60673 Win=1041 Len=1360 [TCP segment of a reassembled PDU]"
"251","9.955338","192.168.0.183","104.244.42.65","TCP","1414","50717  >  443 [ACK] Seq=199140 Ack=60673 Win=1041 Len=1360 [TCP segment of a reassembled PDU]"
"252","9.955338","192.168.0.183","104.244.42.65","TLSv1.2","140","Application Data"
"253","9.955478","192.168.0.183","104.244.42.65","TCP","1414","50717  >  443 [ACK] Seq=200586 Ack=60673 Win=1041 Len=1360 [TCP segment of a reassembled PDU]"
"254","9.955478","192.168.0.183","104.244.42.65","TCP","1414","50717  >  443 [ACK] Seq=201946 Ack=60673 Win=1041 Len=1360 [TCP segment of a reassembled PDU]"
"255","9.955478","192.168.0.183","104.244.42.65","TCP","1414","50717  >  443 [ACK] Seq=203306 Ack=60673 Win=1041 Len=1360 [TCP segment of a reassembled PDU]"
"256","9.955478","192.168.0.183","104.244.42.65","TCP","1414","50717  >  443 [ACK] Seq=204666 Ack=60673 Win=1041 Len=1360 [TCP segment of a reassembled PDU]"
"257","9.955478","192.168.0.183","104.244.42.65","TCP","1414","50717  >  443 [ACK] Seq=206026 Ack=60673 Win=1041 Len=1360 [TCP segment of a reassembled PDU]"
"258","9.955478","192.168.0.183","104.244.42.65","TCP","1414","50717  >  443 [ACK] Seq=207386 Ack=60673 Win=1041 Len=1360 [TCP segment of a reassembled PDU]"
"259","9.955478","192.168.0.183","104.244.42.65","TLSv1.2","199","Application Data"
"260","9.990700","104.244.42.65","192.168.0.183","TCP","60","443  >  50717 [ACK] Seq=60673 Ack=155448 Win=5729 Len=0"
"261","9.998728","104.244.42.65","192.168.0.183","TCP","60","443  >  50717 [ACK] Seq=60673 Ack=203306 Win=5732 Len=0"
"262","9.998728","104.244.42.65","192.168.0.183","TLSv1.2","89","Application Data"
"263","9.998728","104.244.42.65","192.168.0.183","TCP","60","443  >  50717 [ACK] Seq=60708 Ack=208891 Win=5735 Len=0"
"264","10.046624","192.168.0.183","104.244.42.65","TCP","54","50717  >  443 [ACK] Seq=208891 Ack=60708 Win=1041 Len=0"
"265","10.124457","104.244.42.65","192.168.0.183","TLSv1.2","184","Application Data"
"266","10.171161","192.168.0.183","104.244.42.65","TCP","54","50717  >  443 [ACK] Seq=208891 Ack=60838 Win=1040 Len=0"
"267","12.763427","192.168.0.183","104.244.42.65","TCP","1414","50717  >  443 [ACK] Seq=208891 Ack=60838 Win=1040 Len=1360 [TCP segment of a reassembled PDU]"
"268","12.763427","192.168.0.183","104.244.42.65","TLSv1.2","475","Application Data"
"269","12.801125","104.244.42.65","192.168.0.183","TCP","60","443  >  50717 [ACK] Seq=60838 Ack=210672 Win=5731 Len=0"
"270","13.162268","104.244.42.65","192.168.0.183","TCP","1414","443  >  50717 [ACK] Seq=60838 Ack=210672 Win=5735 Len=1360 [TCP segment of a reassembled PDU]"
"271","13.162268","104.244.42.65","192.168.0.183","TCP","1414","443  >  50717 [ACK] Seq=62198 Ack=210672 Win=5735 Len=1360 [TCP segment of a reassembled PDU]"
"272","13.162268","104.244.42.65","192.168.0.183","TCP","1414","443  >  50717 [PSH, ACK] Seq=63558 Ack=210672 Win=5735 Len=1360 [TCP segment of a reassembled PDU]"
"273","13.162268","104.244.42.65","192.168.0.183","TCP","1414","443  >  50717 [ACK] Seq=64918 Ack=210672 Win=5735 Len=1360 [TCP segment of a reassembled PDU]"
"274","13.162268","104.244.42.65","192.168.0.183","TLSv1.2","183","Application Data"
"275","13.162406","192.168.0.183","104.244.42.65","TCP","54","50717  >  443 [ACK] Seq=210672 Ack=66407 Win=1041 Len=0"
"276","13.170699","192.168.0.183","104.244.42.65","TLSv1.2","89","Application Data"
"277","13.255168","104.244.42.65","192.168.0.183","TCP","60","443  >  50717 [ACK] Seq=66407 Ack=210707 Win=5735 Len=0"
"278","13.438589","192.168.0.183","104.244.42.65","TLSv1.2","331","Application Data"
"279","13.438731","192.168.0.183","104.244.42.65","TCP","1414","50717  >  443 [ACK] Seq=210984 Ack=66407 Win=1041 Len=1360 [TCP segment of a reassembled PDU]"
"280","13.438731","192.168.0.183","104.244.42.65","TCP","1414","50717  >  443 [ACK] Seq=212344 Ack=66407 Win=1041 Len=1360 [TCP segment of a reassembled PDU]"
"281","13.438731","192.168.0.183","104.244.42.65","TCP","1414","50717  >  443 [ACK] Seq=213704 Ack=66407 Win=1041 Len=1360 [TCP segment of a reassembled PDU]"
"282","13.438731","192.168.0.183","104.244.42.65","TCP","1414","50717  >  443 [ACK] Seq=215064 Ack=66407 Win=1041 Len=1360 [TCP segment of a reassembled PDU]"
"283","13.438731","192.168.0.183","104.244.42.65","TCP","1414","50717  >  443 [ACK] Seq=216424 Ack=66407 Win=1041 Len=1360 [TCP segment of a reassembled PDU]"
"284","13.438731","192.168.0.183","104.244.42.65","TCP","1414","50717  >  443 [ACK] Seq=217784 Ack=66407 Win=1041 Len=1360 [TCP segment of a reassembled PDU]"
"285","13.438731","192.168.0.183","104.244.42.65","TCP","1414","50717  >  443 [ACK] Seq=219144 Ack=66407 Win=1041 Len=1360 [TCP segment of a reassembled PDU]"
"286","13.438731","192.168.0.183","104.244.42.65","TCP","1414","50717  >  443 [ACK] Seq=220504 Ack=66407 Win=1041 Len=1360 [TCP segment of a reassembled PDU]"
"287","13.438731","192.168.0.183","104.244.42.65","TCP","1414","50717  >  443 [ACK] Seq=221864 Ack=66407 Win=1041 Len=1360 [TCP segment of a reassembled PDU]"
"288","13.438731","192.168.0.183","104.244.42.65","TCP","1414","50717  >  443 [ACK] Seq=223224 Ack=66407 Win=1041 Len=1360 [TCP segment of a reassembled PDU]"
"289","13.438731","192.168.0.183","104.244.42.65","TCP","1414","50717  >  443 [ACK] Seq=224584 Ack=66407 Win=1041 Len=1360 [TCP segment of a reassembled PDU]"
"290","13.438731","192.168.0.183","104.244.42.65","TCP","1414","50717  >  443 [ACK] Seq=225944 Ack=66407 Win=1041 Len=1360 [TCP segment of a reassembled PDU]"
"291","13.438731","192.168.0.183","104.244.42.65","TLSv1.2","140","Application Data"
"292","13.438839","192.168.0.183","104.244.42.65","TLSv1.2","577","Application Data"
"293","13.438932","192.168.0.183","104.244.42.65","TLSv1.2","259","Application Data"
"294","13.439098","192.168.0.183","104.244.42.65","TCP","1414","50717  >  443 [ACK] Seq=228118 Ack=66407 Win=1041 Len=1360 [TCP segment of a reassembled PDU]"
"295","13.439098","192.168.0.183","104.244.42.65","TLSv1.2","222","Application Data"
"296","13.439161","192.168.0.183","104.244.42.65","TLSv1.2","1211","Application Data"
"297","13.474866","104.244.42.65","192.168.0.183","TCP","60","443  >  50717 [ACK] Seq=66407 Ack=210984 Win=5734 Len=0"
"298","13.477010","104.244.42.65","192.168.0.183","TCP","60","443  >  50717 [ACK] Seq=66407 Ack=212344 Win=5732 Len=0"
"299","13.481057","104.244.42.65","192.168.0.183","TCP","60","443  >  50717 [ACK] Seq=66407 Ack=230803 Win=5728 Len=0"
"300","13.508631","104.244.42.65","192.168.0.183","TLSv1.2","174","Application Data"
"301","13.516547","104.244.42.65","192.168.0.183","TLSv1.2","222","Application Data"
"302","13.516580","192.168.0.183","104.244.42.65","TCP","54","50717  >  443 [ACK] Seq=230803 Ack=66695 Win=1040 Len=0"
"303","14.131562","104.244.42.65","192.168.0.183","TCP","1414","443  >  50717 [ACK] Seq=66695 Ack=230803 Win=5735 Len=1360 [TCP segment of a reassembled PDU]"
"304","14.131562","104.244.42.65","192.168.0.183","TCP","1414","443  >  50717 [ACK] Seq=68055 Ack=230803 Win=5735 Len=1360 [TCP segment of a reassembled PDU]"
"305","14.131562","104.244.42.65","192.168.0.183","TLSv1.2","977","Application Data"
"306","14.131611","192.168.0.183","104.244.42.65","TCP","54","50717  >  443 [ACK] Seq=230803 Ack=70338 Win=1041 Len=0"
"307","16.164346","192.168.0.183","104.244.42.65","TLSv1.2","327","Application Data"
"308","16.164649","192.168.0.183","104.244.42.65","TCP","1414","50717  >  443 [ACK] Seq=231076 Ack=70338 Win=1041 Len=1360 [TCP segment of a reassembled PDU]"
"309","16.164649","192.168.0.183","104.244.42.65","TCP","1414","50717  >  443 [ACK] Seq=232436 Ack=70338 Win=1041 Len=1360 [TCP segment of a reassembled PDU]"
"310","16.164649","192.168.0.183","104.244.42.65","TCP","1414","50717  >  443 [ACK] Seq=233796 Ack=70338 Win=1041 Len=1360 [TCP segment of a reassembled PDU]"
"311","16.164649","192.168.0.183","104.244.42.65","TCP","1414","50717  >  443 [ACK] Seq=235156 Ack=70338 Win=1041 Len=1360 [TCP segment of a reassembled PDU]"
"312","16.164649","192.168.0.183","104.244.42.65","TCP","1414","50717  >  443 [ACK] Seq=236516 Ack=70338 Win=1041 Len=1360 [TCP segment of a reassembled PDU]"
"313","16.164649","192.168.0.183","104.244.42.65","TCP","1414","50717  >  443 [ACK] Seq=237876 Ack=70338 Win=1041 Len=1360 [TCP segment of a reassembled PDU]"
"314","16.164649","192.168.0.183","104.244.42.65","TCP","1414","50717  >  443 [ACK] Seq=239236 Ack=70338 Win=1041 Len=1360 [TCP segment of a reassembled PDU]"
"315","16.164649","192.168.0.183","104.244.42.65","TCP","1414","50717  >  443 [ACK] Seq=240596 Ack=70338 Win=1041 Len=1360 [TCP segment of a reassembled PDU]"
"316","16.164649","192.168.0.183","104.244.42.65","TCP","1414","50717  >  443 [ACK] Seq=241956 Ack=70338 Win=1041 Len=1360 [TCP segment of a reassembled PDU]"
"317","16.164649","192.168.0.183","104.244.42.65","TCP","1414","50717  >  443 [ACK] Seq=243316 Ack=70338 Win=1041 Len=1360 [TCP segment of a reassembled PDU]"
"318","16.164649","192.168.0.183","104.244.42.65","TCP","1414","50717  >  443 [ACK] Seq=244676 Ack=70338 Win=1041 Len=1360 [TCP segment of a reassembled PDU]"
"319","16.164649","192.168.0.183","104.244.42.65","TCP","1414","50717  >  443 [ACK] Seq=246036 Ack=70338 Win=1041 Len=1360 [TCP segment of a reassembled PDU]"
"320","16.164649","192.168.0.183","104.244.42.65","TLSv1.2","140","Application Data"
"321","16.164923","192.168.0.183","104.244.42.65","TCP","1414","50717  >  443 [ACK] Seq=247482 Ack=70338 Win=1041 Len=1360 [TCP segment of a reassembled PDU]"
"322","16.164923","192.168.0.183","104.244.42.65","TCP","1414","50717  >  443 [ACK] Seq=248842 Ack=70338 Win=1041 Len=1360 [TCP segment of a reassembled PDU]"
"323","16.164923","192.168.0.183","104.244.42.65","TCP","1414","50717  >  443 [ACK] Seq=250202 Ack=70338 Win=1041 Len=1360 [TCP segment of a reassembled PDU]"
"324","16.164923","192.168.0.183","104.244.42.65","TCP","1414","50717  >  443 [ACK] Seq=251562 Ack=70338 Win=1041 Len=1360 [TCP segment of a reassembled PDU]"
"325","16.164923","192.168.0.183","104.244.42.65","TCP","1414","50717  >  443 [ACK] Seq=252922 Ack=70338 Win=1041 Len=1360 [TCP segment of a reassembled PDU]"
"326","16.164923","192.168.0.183","104.244.42.65","TCP","1414","50717  >  443 [ACK] Seq=254282 Ack=70338 Win=1041 Len=1360 [TCP segment of a reassembled PDU]"
"327","16.164923","192.168.0.183","104.244.42.65","TCP","1414","50717  >  443 [ACK] Seq=255642 Ack=70338 Win=1041 Len=1360 [TCP segment of a reassembled PDU]"
"328","16.164923","192.168.0.183","104.244.42.65","TCP","1414","50717  >  443 [ACK] Seq=257002 Ack=70338 Win=1041 Len=1360 [TCP segment of a reassembled PDU]"
"329","16.164923","192.168.0.183","104.244.42.65","TCP","1414","50717  >  443 [ACK] Seq=258362 Ack=70338 Win=1041 Len=1360 [TCP segment of a reassembled PDU]"
"330","16.164923","192.168.0.183","104.244.42.65","TCP","1414","50717  >  443 [ACK] Seq=259722 Ack=70338 Win=1041 Len=1360 [TCP segment of a reassembled PDU]"
"331","16.164923","192.168.0.183","104.244.42.65","TCP","1414","50717  >  443 [ACK] Seq=261082 Ack=70338 Win=1041 Len=1360 [TCP segment of a reassembled PDU]"
"332","16.164923","192.168.0.183","104.244.42.65","TCP","1414","50717  >  443 [ACK] Seq=262442 Ack=70338 Win=1041 Len=1360 [TCP segment of a reassembled PDU]"
"333","16.164923","192.168.0.183","104.244.42.65","TLSv1.2","140","Application Data"
"334","16.165169","192.168.0.183","104.244.42.65","TCP","1414","50717  >  443 [ACK] Seq=263888 Ack=70338 Win=1041 Len=1360 [TCP segment of a reassembled PDU]"
"335","16.165169","192.168.0.183","104.244.42.65","TCP","1414","50717  >  443 [ACK] Seq=265248 Ack=70338 Win=1041 Len=1360 [TCP segment of a reassembled PDU]"
"336","16.165169","192.168.0.183","104.244.42.65","TCP","1414","50717  >  443 [ACK] Seq=266608 Ack=70338 Win=1041 Len=1360 [TCP segment of a reassembled PDU]"
"337","16.165169","192.168.0.183","104.244.42.65","TCP","1414","50717  >  443 [ACK] Seq=267968 Ack=70338 Win=1041 Len=1360 [TCP segment of a reassembled PDU]"
"338","16.165169","192.168.0.183","104.244.42.65","TCP","1414","50717  >  443 [ACK] Seq=269328 Ack=70338 Win=1041 Len=1360 [TCP segment of a reassembled PDU]"
"339","16.165169","192.168.0.183","104.244.42.65","TCP","1414","50717  >  443 [ACK] Seq=270688 Ack=70338 Win=1041 Len=1360 [TCP segment of a reassembled PDU]"
"340","16.165169","192.168.0.183","104.244.42.65","TCP","1414","50717  >  443 [ACK] Seq=272048 Ack=70338 Win=1041 Len=1360 [TCP segment of a reassembled PDU]"
"341","16.165169","192.168.0.183","104.244.42.65","TCP","1414","50717  >  443 [ACK] Seq=273408 Ack=70338 Win=1041 Len=1360 [TCP segment of a reassembled PDU]"
"342","16.165169","192.168.0.183","104.244.42.65","TCP","1414","50717  >  443 [ACK] Seq=274768 Ack=70338 Win=1041 Len=1360 [TCP segment of a reassembled PDU]"
"343","16.165169","192.168.0.183","104.244.42.65","TCP","1414","50717  >  443 [ACK] Seq=276128 Ack=70338 Win=1041 Len=1360 [TCP segment of a reassembled PDU]"
"344","16.165169","192.168.0.183","104.244.42.65","TCP","1414","50717  >  443 [ACK] Seq=277488 Ack=70338 Win=1041 Len=1360 [TCP segment of a reassembled PDU]"
"345","16.165169","192.168.0.183","104.244.42.65","TCP","1414","50717  >  443 [ACK] Seq=278848 Ack=70338 Win=1041 Len=1360 [TCP segment of a reassembled PDU]"
"346","16.165169","192.168.0.183","104.244.42.65","TLSv1.2","140","Application Data"
"347","16.165402","192.168.0.183","104.244.42.65","TCP","1414","50717  >  443 [ACK] Seq=280294 Ack=70338 Win=1041 Len=1360 [TCP segment of a reassembled PDU]"
"348","16.165402","192.168.0.183","104.244.42.65","TCP","1414","50717  >  443 [ACK] Seq=281654 Ack=70338 Win=1041 Len=1360 [TCP segment of a reassembled PDU]"
"349","16.165402","192.168.0.183","104.244.42.65","TCP","1414","50717  >  443 [ACK] Seq=283014 Ack=70338 Win=1041 Len=1360 [TCP segment of a reassembled PDU]"
"350","16.165402","192.168.0.183","104.244.42.65","TCP","1414","50717  >  443 [ACK] Seq=284374 Ack=70338 Win=1041 Len=1360 [TCP segment of a reassembled PDU]"
"351","16.165402","192.168.0.183","104.244.42.65","TLSv1.2","618","Application Data"
"352","16.200794","104.244.42.65","192.168.0.183","TCP","60","443  >  50717 [ACK] Seq=70338 Ack=232436 Win=5731 Len=0"
"353","16.207053","104.244.42.65","192.168.0.183","TCP","60","443  >  50717 [ACK] Seq=70338 Ack=286298 Win=5704 Len=0"
"354","16.207053","104.244.42.65","192.168.0.183","TLSv1.2","89","Application Data"
"355","16.257071","192.168.0.183","104.244.42.65","TCP","54","50717  >  443 [ACK] Seq=286298 Ack=70373 Win=1041 Len=0"
"356","16.262764","104.244.42.65","192.168.0.183","TLSv1.2","184","Application Data"
"357","16.318035","192.168.0.183","104.244.42.65","TCP","54","50717  >  443 [ACK] Seq=286298 Ack=70503 Win=1040 Len=0"
"358","16.388373","192.168.0.183","104.244.42.65","TCP","1414","50717  >  443 [ACK] Seq=286298 Ack=70503 Win=1040 Len=1360 [TCP segment of a reassembled PDU]"
"359","16.388373","192.168.0.183","104.244.42.65","TLSv1.2","1095","Application Data"
"360","16.425480","104.244.42.65","192.168.0.183","TCP","60","443  >  50717 [ACK] Seq=70503 Ack=288699 Win=5729 Len=0"
"361","16.836145","104.244.42.65","192.168.0.183","TCP","1414","443  >  50717 [ACK] Seq=70503 Ack=288699 Win=5735 Len=1360 [TCP segment of a reassembled PDU]"
"362","16.836145","104.244.42.65","192.168.0.183","TCP","1414","443  >  50717 [ACK] Seq=71863 Ack=288699 Win=5735 Len=1360 [TCP segment of a reassembled PDU]"
"363","16.836145","104.244.42.65","192.168.0.183","TCP","1414","443  >  50717 [PSH, ACK] Seq=73223 Ack=288699 Win=5735 Len=1360 [TCP segment of a reassembled PDU]"
"364","16.836145","104.244.42.65","192.168.0.183","TCP","1414","443  >  50717 [ACK] Seq=74583 Ack=288699 Win=5735 Len=1360 [TCP segment of a reassembled PDU]"
"365","16.836145","104.244.42.65","192.168.0.183","TLSv1.2","313","Application Data"
"366","16.836192","192.168.0.183","104.244.42.65","TCP","54","50717  >  443 [ACK] Seq=288699 Ack=76202 Win=1041 Len=0"
"367","17.189589","192.168.0.183","104.244.42.65","TLSv1.2","671","Application Data"
"368","17.189682","192.168.0.183","104.244.42.65","TLSv1.2","1146","Application Data"
"369","17.189770","192.168.0.183","104.244.42.65","TLSv1.2","233","Application Data"
"370","17.189804","192.168.0.183","104.244.42.65","TLSv1.2","459","Application Data"
"371","17.227220","104.244.42.65","192.168.0.183","TCP","60","443  >  50717 [ACK] Seq=76202 Ack=290587 Win=5730 Len=0"
"372","17.247311","104.244.42.65","192.168.0.183","TLSv1.2","206","Application Data"
"373","17.253962","104.244.42.65","192.168.0.183","TLSv1.2","138","Application Data"
"374","17.253994","192.168.0.183","104.244.42.65","TCP","54","50717  >  443 [ACK] Seq=290992 Ack=76438 Win=1040 Len=0"
"375","17.493782","192.168.0.183","104.244.42.65","TLSv1.2","279","Application Data"
"376","17.559749","192.168.0.183","104.244.42.65","TLSv1.2","976","Application Data"
"377","17.559920","192.168.0.183","104.244.42.65","TLSv1.2","273","Application Data"
"378","17.571553","104.244.42.65","192.168.0.183","TCP","60","443  >  50717 [ACK] Seq=76438 Ack=291217 Win=5735 Len=0"
"379","17.596899","192.168.0.183","104.244.42.65","TLSv1.2","243","Application Data"
"380","17.597065","192.168.0.183","104.244.42.65","TLSv1.2","364","Application Data"
"381","17.605085","104.244.42.65","192.168.0.183","TCP","60","443  >  50717 [ACK] Seq=76438 Ack=292358 Win=5735 Len=0"
"382","17.633341","104.244.42.65","192.168.0.183","TLSv1.2","461","Application Data"
"383","17.633341","104.244.42.65","192.168.0.183","TLSv1.2","236","Application Data"
"384","17.633389","192.168.0.183","104.244.42.65","TCP","54","50717  >  443 [ACK] Seq=292857 Ack=77027 Win=1038 Len=0"
"385","17.652675","104.244.42.65","192.168.0.183","TLSv1.2","151","Application Data"
"386","17.695718","192.168.0.183","104.244.42.65","TCP","54","50717  >  443 [ACK] Seq=292857 Ack=77124 Win=1037 Len=0"
"387","17.884886","104.244.42.65","192.168.0.183","TLSv1.2","179","Application Data"
"388","17.931037","192.168.0.183","104.244.42.65","TCP","54","50717  >  443 [ACK] Seq=292857 Ack=77249 Win=1037 Len=0"
"389","19.212560","192.168.0.183","104.244.42.65","TLSv1.2","282","Application Data"
"390","19.212887","192.168.0.183","104.244.42.65","TCP","1414","50717  >  443 [ACK] Seq=293085 Ack=77249 Win=1037 Len=1360 [TCP segment of a reassembled PDU]"
"391","19.212887","192.168.0.183","104.244.42.65","TCP","1414","50717  >  443 [ACK] Seq=294445 Ack=77249 Win=1037 Len=1360 [TCP segment of a reassembled PDU]"
"392","19.212887","192.168.0.183","104.244.42.65","TCP","1414","50717  >  443 [ACK] Seq=295805 Ack=77249 Win=1037 Len=1360 [TCP segment of a reassembled PDU]"
"393","19.212887","192.168.0.183","104.244.42.65","TCP","1414","50717  >  443 [ACK] Seq=297165 Ack=77249 Win=1037 Len=1360 [TCP segment of a reassembled PDU]"
"394","19.212887","192.168.0.183","104.244.42.65","TCP","1414","50717  >  443 [ACK] Seq=298525 Ack=77249 Win=1037 Len=1360 [TCP segment of a reassembled PDU]"
"395","19.212887","192.168.0.183","104.244.42.65","TCP","1414","50717  >  443 [ACK] Seq=299885 Ack=77249 Win=1037 Len=1360 [TCP segment of a reassembled PDU]"
"396","19.212887","192.168.0.183","104.244.42.65","TCP","1414","50717  >  443 [ACK] Seq=301245 Ack=77249 Win=1037 Len=1360 [TCP segment of a reassembled PDU]"
"397","19.212887","192.168.0.183","104.244.42.65","TCP","1414","50717  >  443 [ACK] Seq=302605 Ack=77249 Win=1037 Len=1360 [TCP segment of a reassembled PDU]"
"398","19.212887","192.168.0.183","104.244.42.65","TCP","1414","50717  >  443 [ACK] Seq=303965 Ack=77249 Win=1037 Len=1360 [TCP segment of a reassembled PDU]"
"399","19.212887","192.168.0.183","104.244.42.65","TCP","1414","50717  >  443 [ACK] Seq=305325 Ack=77249 Win=1037 Len=1360 [TCP segment of a reassembled PDU]"
"400","19.212887","192.168.0.183","104.244.42.65","TCP","1414","50717  >  443 [ACK] Seq=306685 Ack=77249 Win=1037 Len=1360 [TCP segment of a reassembled PDU]"
"401","19.212887","192.168.0.183","104.244.42.65","TCP","1414","50717  >  443 [ACK] Seq=308045 Ack=77249 Win=1037 Len=1360 [TCP segment of a reassembled PDU]"
"402","19.212887","192.168.0.183","104.244.42.65","TLSv1.2","140","Application Data"
"403","19.213064","192.168.0.183","104.244.42.65","TCP","1414","50717  >  443 [ACK] Seq=309491 Ack=77249 Win=1037 Len=1360 [TCP segment of a reassembled PDU]"
"404","19.213064","192.168.0.183","104.244.42.65","TCP","1414","50717  >  443 [ACK] Seq=310851 Ack=77249 Win=1037 Len=1360 [TCP segment of a reassembled PDU]"
"405","19.213064","192.168.0.183","104.244.42.65","TCP","1414","50717  >  443 [ACK] Seq=312211 Ack=77249 Win=1037 Len=1360 [TCP segment of a reassembled PDU]"
"406","19.213064","192.168.0.183","104.244.42.65","TCP","1414","50717  >  443 [ACK] Seq=313571 Ack=77249 Win=1037 Len=1360 [TCP segment of a reassembled PDU]"
"407","19.213064","192.168.0.183","104.244.42.65","TCP","1414","50717  >  443 [ACK] Seq=314931 Ack=77249 Win=1037 Len=1360 [TCP segment of a reassembled PDU]"
"408","19.213064","192.168.0.183","104.244.42.65","TCP","1414","50717  >  443 [ACK] Seq=316291 Ack=77249 Win=1037 Len=1360 [TCP segment of a reassembled PDU]"
"409","19.213064","192.168.0.183","104.244.42.65","TCP","1414","50717  >  443 [ACK] Seq=317651 Ack=77249 Win=1037 Len=1360 [TCP segment of a reassembled PDU]"
"410","19.213064","192.168.0.183","104.244.42.65","TCP","1414","50717  >  443 [ACK] Seq=319011 Ack=77249 Win=1037 Len=1360 [TCP segment of a reassembled PDU]"
"411","19.213064","192.168.0.183","104.244.42.65","TCP","1414","50717  >  443 [ACK] Seq=320371 Ack=77249 Win=1037 Len=1360 [TCP segment of a reassembled PDU]"
"412","19.213064","192.168.0.183","104.244.42.65","TCP","1414","50717  >  443 [ACK] Seq=321731 Ack=77249 Win=1037 Len=1360 [TCP segment of a reassembled PDU]"
"413","19.213064","192.168.0.183","104.244.42.65","TCP","1414","50717  >  443 [ACK] Seq=323091 Ack=77249 Win=1037 Len=1360 [TCP segment of a reassembled PDU]"
"414","19.213064","192.168.0.183","104.244.42.65","TCP","1414","50717  >  443 [ACK] Seq=324451 Ack=77249 Win=1037 Len=1360 [TCP segment of a reassembled PDU]"
"415","19.213064","192.168.0.183","104.244.42.65","TLSv1.2","140","Application Data"
"416","19.213231","192.168.0.183","104.244.42.65","TCP","1414","50717  >  443 [ACK] Seq=325897 Ack=77249 Win=1037 Len=1360 [TCP segment of a reassembled PDU]"
"417","19.213231","192.168.0.183","104.244.42.65","TCP","1414","50717  >  443 [ACK] Seq=327257 Ack=77249 Win=1037 Len=1360 [TCP segment of a reassembled PDU]"
"418","19.213231","192.168.0.183","104.244.42.65","TCP","1414","50717  >  443 [ACK] Seq=328617 Ack=77249 Win=1037 Len=1360 [TCP segment of a reassembled PDU]"
"419","19.213231","192.168.0.183","104.244.42.65","TCP","1414","50717  >  443 [ACK] Seq=329977 Ack=77249 Win=1037 Len=1360 [TCP segment of a reassembled PDU]"
"420","19.213231","192.168.0.183","104.244.42.65","TCP","1414","50717  >  443 [ACK] Seq=331337 Ack=77249 Win=1037 Len=1360 [TCP segment of a reassembled PDU]"
"421","19.213231","192.168.0.183","104.244.42.65","TCP","1414","50717  >  443 [ACK] Seq=332697 Ack=77249 Win=1037 Len=1360 [TCP segment of a reassembled PDU]"
"422","19.213231","192.168.0.183","104.244.42.65","TCP","1414","50717  >  443 [ACK] Seq=334057 Ack=77249 Win=1037 Len=1360 [TCP segment of a reassembled PDU]"
"423","19.213231","192.168.0.183","104.244.42.65","TCP","1414","50717  >  443 [ACK] Seq=335417 Ack=77249 Win=1037 Len=1360 [TCP segment of a reassembled PDU]"
"424","19.213231","192.168.0.183","104.244.42.65","TCP","1414","50717  >  443 [ACK] Seq=336777 Ack=77249 Win=1037 Len=1360 [TCP segment of a reassembled PDU]"
"425","19.213231","192.168.0.183","104.244.42.65","TCP","1414","50717  >  443 [ACK] Seq=338137 Ack=77249 Win=1037 Len=1360 [TCP segment of a reassembled PDU]"
"426","19.213231","192.168.0.183","104.244.42.65","TCP","1414","50717  >  443 [ACK] Seq=339497 Ack=77249 Win=1037 Len=1360 [TCP segment of a reassembled PDU]"
"427","19.213231","192.168.0.183","104.244.42.65","TCP","1414","50717  >  443 [ACK] Seq=340857 Ack=77249 Win=1037 Len=1360 [TCP segment of a reassembled PDU]"
"428","19.213231","192.168.0.183","104.244.42.65","TLSv1.2","140","Application Data"
"429","19.213394","192.168.0.183","104.244.42.65","TCP","1414","50717  >  443 [ACK] Seq=342303 Ack=77249 Win=1037 Len=1360 [TCP segment of a reassembled PDU]"
"430","19.213394","192.168.0.183","104.244.42.65","TCP","1414","50717  >  443 [ACK] Seq=343663 Ack=77249 Win=1037 Len=1360 [TCP segment of a reassembled PDU]"
"431","19.213394","192.168.0.183","104.244.42.65","TCP","1414","50717  >  443 [ACK] Seq=345023 Ack=77249 Win=1037 Len=1360 [TCP segment of a reassembled PDU]"
"432","19.213394","192.168.0.183","104.244.42.65","TCP","1414","50717  >  443 [ACK] Seq=346383 Ack=77249 Win=1037 Len=1360 [TCP segment of a reassembled PDU]"
"433","19.213394","192.168.0.183","104.244.42.65","TCP","1414","50717  >  443 [ACK] Seq=347743 Ack=77249 Win=1037 Len=1360 [TCP segment of a reassembled PDU]"
"434","19.213394","192.168.0.183","104.244.42.65","TCP","1414","50717  >  443 [ACK] Seq=349103 Ack=77249 Win=1037 Len=1360 [TCP segment of a reassembled PDU]"
"435","19.213394","192.168.0.183","104.244.42.65","TCP","1414","50717  >  443 [ACK] Seq=350463 Ack=77249 Win=1037 Len=1360 [TCP segment of a reassembled PDU]"
"436","19.213394","192.168.0.183","104.244.42.65","TCP","1414","50717  >  443 [ACK] Seq=351823 Ack=77249 Win=1037 Len=1360 [TCP segment of a reassembled PDU]"
"437","19.213394","192.168.0.183","104.244.42.65","TCP","1414","50717  >  443 [ACK] Seq=353183 Ack=77249 Win=1037 Len=1360 [TCP segment of a reassembled PDU]"
"438","19.213394","192.168.0.183","104.244.42.65","TCP","1414","50717  >  443 [ACK] Seq=354543 Ack=77249 Win=1037 Len=1360 [TCP segment of a reassembled PDU]"
"439","19.213394","192.168.0.183","104.244.42.65","TCP","1414","50717  >  443 [ACK] Seq=355903 Ack=77249 Win=1037 Len=1360 [TCP segment of a reassembled PDU]"
"440","19.213394","192.168.0.183","104.244.42.65","TCP","1414","50717  >  443 [ACK] Seq=357263 Ack=77249 Win=1037 Len=1360 [TCP segment of a reassembled PDU]"
"441","19.213394","192.168.0.183","104.244.42.65","TLSv1.2","140","Application Data"
"442","19.213604","192.168.0.183","104.244.42.65","TLSv1.2","121","Application Data"
"443","19.252778","104.244.42.65","192.168.0.183","TCP","60","443  >  50717 [ACK] Seq=77249 Ack=358776 Win=5678 Len=0"
"444","19.252778","104.244.42.65","192.168.0.183","TLSv1.2","89","Application Data"
"445","19.252981","192.168.0.183","104.244.42.65","TCP","1414","50717  >  443 [ACK] Seq=358776 Ack=77284 Win=1037 Len=1360 [TCP segment of a reassembled PDU]"
"446","19.252981","192.168.0.183","104.244.42.65","TCP","1414","50717  >  443 [ACK] Seq=360136 Ack=77284 Win=1037 Len=1360 [TCP segment of a reassembled PDU]"
"447","19.252981","192.168.0.183","104.244.42.65","TCP","1414","50717  >  443 [ACK] Seq=361496 Ack=77284 Win=1037 Len=1360 [TCP segment of a reassembled PDU]"
"448","19.252981","192.168.0.183","104.244.42.65","TCP","1414","50717  >  443 [ACK] Seq=362856 Ack=77284 Win=1037 Len=1360 [TCP segment of a reassembled PDU]"
"449","19.252981","192.168.0.183","104.244.42.65","TCP","1414","50717  >  443 [ACK] Seq=364216 Ack=77284 Win=1037 Len=1360 [TCP segment of a reassembled PDU]"
"450","19.252981","192.168.0.183","104.244.42.65","TCP","1414","50717  >  443 [ACK] Seq=365576 Ack=77284 Win=1037 Len=1360 [TCP segment of a reassembled PDU]"
"451","19.252981","192.168.0.183","104.244.42.65","TCP","1414","50717  >  443 [ACK] Seq=366936 Ack=77284 Win=1037 Len=1360 [TCP segment of a reassembled PDU]"
"452","19.252981","192.168.0.183","104.244.42.65","TCP","1414","50717  >  443 [ACK] Seq=368296 Ack=77284 Win=1037 Len=1360 [TCP segment of a reassembled PDU]"
"453","19.252981","192.168.0.183","104.244.42.65","TCP","1414","50717  >  443 [ACK] Seq=369656 Ack=77284 Win=1037 Len=1360 [TCP segment of a reassembled PDU]"
"454","19.252981","192.168.0.183","104.244.42.65","TCP","1414","50717  >  443 [ACK] Seq=371016 Ack=77284 Win=1037 Len=1360 [TCP segment of a reassembled PDU]"
"455","19.252981","192.168.0.183","104.244.42.65","TCP","1414","50717  >  443 [ACK] Seq=372376 Ack=77284 Win=1037 Len=1360 [TCP segment of a reassembled PDU]"
"456","19.252981","192.168.0.183","104.244.42.65","TCP","1414","50717  >  443 [ACK] Seq=373736 Ack=77284 Win=1037 Len=1360 [TCP segment of a reassembled PDU]"
"457","19.252981","192.168.0.183","104.244.42.65","TLSv1.2","104","Application Data"
"458","19.253130","192.168.0.183","104.244.42.65","TCP","1414","50717  >  443 [ACK] Seq=375146 Ack=77284 Win=1037 Len=1360 [TCP segment of a reassembled PDU]"
"459","19.253130","192.168.0.183","104.244.42.65","TCP","1414","50717  >  443 [ACK] Seq=376506 Ack=77284 Win=1037 Len=1360 [TCP segment of a reassembled PDU]"
"460","19.253130","192.168.0.183","104.244.42.65","TCP","1414","50717  >  443 [ACK] Seq=377866 Ack=77284 Win=1037 Len=1360 [TCP segment of a reassembled PDU]"
"461","19.253130","192.168.0.183","104.244.42.65","TCP","1414","50717  >  443 [ACK] Seq=379226 Ack=77284 Win=1037 Len=1360 [TCP segment of a reassembled PDU]"
"462","19.253130","192.168.0.183","104.244.42.65","TCP","1414","50717  >  443 [ACK] Seq=380586 Ack=77284 Win=1037 Len=1360 [TCP segment of a reassembled PDU]"
"463","19.253130","192.168.0.183","104.244.42.65","TCP","1414","50717  >  443 [ACK] Seq=381946 Ack=77284 Win=1037 Len=1360 [TCP segment of a reassembled PDU]"
"464","19.253130","192.168.0.183","104.244.42.65","TCP","1414","50717  >  443 [ACK] Seq=383306 Ack=77284 Win=1037 Len=1360 [TCP segment of a reassembled PDU]"
"465","19.253130","192.168.0.183","104.244.42.65","TCP","1414","50717  >  443 [ACK] Seq=384666 Ack=77284 Win=1037 Len=1360 [TCP segment of a reassembled PDU]"
"466","19.253130","192.168.0.183","104.244.42.65","TCP","1414","50717  >  443 [ACK] Seq=386026 Ack=77284 Win=1037 Len=1360 [TCP segment of a reassembled PDU]"
"467","19.253130","192.168.0.183","104.244.42.65","TCP","1414","50717  >  443 [ACK] Seq=387386 Ack=77284 Win=1037 Len=1360 [TCP segment of a reassembled PDU]"
"468","19.253130","192.168.0.183","104.244.42.65","TCP","1414","50717  >  443 [ACK] Seq=388746 Ack=77284 Win=1037 Len=1360 [TCP segment of a reassembled PDU]"
"469","19.253130","192.168.0.183","104.244.42.65","TLSv1.2","542","Application Data"
"470","19.289298","104.244.42.65","192.168.0.183","TCP","60","443  >  50717 [ACK] Seq=77284 Ack=361496 Win=5729 Len=0"
"471","19.295437","104.244.42.65","192.168.0.183","TCP","60","443  >  50717 [ACK] Seq=77284 Ack=390594 Win=5735 Len=0"
"472","19.295437","104.244.42.65","192.168.0.183","TLSv1.2","89","Application Data"
"473","19.336162","192.168.0.183","104.244.42.65","TCP","54","50717  >  443 [ACK] Seq=390594 Ack=77319 Win=1036 Len=0"
"474","19.355283","104.244.42.65","192.168.0.183","TLSv1.2","182","Application Data"
"475","19.398189","192.168.0.183","104.244.42.65","TCP","54","50717  >  443 [ACK] Seq=390594 Ack=77447 Win=1036 Len=0"
"476","22.663728","192.168.0.183","104.244.42.65","TLSv1.2","758","Application Data"
"477","22.663849","192.168.0.183","104.244.42.65","TCP","1414","50717  >  443 [ACK] Seq=391298 Ack=77447 Win=1036 Len=1360 [TCP segment of a reassembled PDU]"
"478","22.663849","192.168.0.183","104.244.42.65","TCP","1414","50717  >  443 [ACK] Seq=392658 Ack=77447 Win=1036 Len=1360 [TCP segment of a reassembled PDU]"
"479","22.663849","192.168.0.183","104.244.42.65","TLSv1.2","280","Application Data"
"480","22.721201","104.244.42.65","192.168.0.183","TCP","60","443  >  50717 [ACK] Seq=77447 Ack=394244 Win=5735 Len=0"
"481","22.721201","104.244.42.65","192.168.0.183","TLSv1.2","284","Application Data"
"482","22.766184","192.168.0.183","104.244.42.65","TCP","54","50717  >  443 [ACK] Seq=394244 Ack=77677 Win=1041 Len=0"
"483","25.205559","192.168.0.183","104.244.42.65","TLSv1.2","676","Application Data"
"484","25.205636","192.168.0.183","104.244.42.65","TLSv1.2","547","Application Data"
"485","25.248508","104.244.42.65","192.168.0.183","TCP","60","443  >  50717 [ACK] Seq=77677 Ack=395359 Win=5735 Len=0"
"486","25.268757","104.244.42.65","192.168.0.183","TLSv1.2","216","Application Data"
"487","25.312191","192.168.0.183","104.244.42.65","TCP","54","50717  >  443 [ACK] Seq=395359 Ack=77839 Win=1040 Len=0"
"488","28.169953","192.168.0.183","104.244.42.65","TLSv1.2","235","Application Data"
"489","28.170050","192.168.0.183","104.244.42.65","TCP","1414","50717  >  443 [ACK] Seq=395540 Ack=77839 Win=1040 Len=1360 [TCP segment of a reassembled PDU]"
"490","28.170050","192.168.0.183","104.244.42.65","TCP","1414","50717  >  443 [ACK] Seq=396900 Ack=77839 Win=1040 Len=1360 [TCP segment of a reassembled PDU]"
"491","28.170050","192.168.0.183","104.244.42.65","TCP","1414","50717  >  443 [ACK] Seq=398260 Ack=77839 Win=1040 Len=1360 [TCP segment of a reassembled PDU]"
"492","28.170050","192.168.0.183","104.244.42.65","TLSv1.2","691","Application Data"
"493","28.206638","104.244.42.65","192.168.0.183","TCP","60","443  >  50717 [ACK] Seq=77839 Ack=396900 Win=5731 Len=0"
"494","28.212856","104.244.42.65","192.168.0.183","TCP","60","443  >  50717 [ACK] Seq=77839 Ack=400257 Win=5735 Len=0"
"495","28.242250","104.244.42.65","192.168.0.183","TLSv1.2","245","Application Data"
"496","28.291115","192.168.0.183","104.244.42.65","TCP","54","50717  >  443 [ACK] Seq=400257 Ack=78030 Win=1039 Len=0"
"497","30.696211","192.168.0.183","104.244.42.65","TLSv1.2","281","Application Data"
"498","30.696273","192.168.0.183","104.244.42.65","TLSv1.2","168","Application Data"
"499","30.733134","104.244.42.65","192.168.0.183","TCP","60","443  >  50717 [ACK] Seq=78030 Ack=400598 Win=5735 Len=0"
"500","30.805530","104.244.42.65","192.168.0.183","TLSv1.2","360","Application Data"
"501","30.806506","192.168.0.183","104.244.42.65","TLSv1.2","89","Application Data"
"502","30.896037","104.244.42.65","192.168.0.183","TCP","60","443  >  50717 [ACK] Seq=78336 Ack=400633 Win=5735 Len=0"
"503","31.384455","192.168.0.183","104.244.42.65","TLSv1.2","283","Application Data"
"504","31.384582","192.168.0.183","104.244.42.65","TCP","1414","50717  >  443 [ACK] Seq=400862 Ack=78336 Win=1038 Len=1360 [TCP segment of a reassembled PDU]"
"505","31.384582","192.168.0.183","104.244.42.65","TCP","1414","50717  >  443 [ACK] Seq=402222 Ack=78336 Win=1038 Len=1360 [TCP segment of a reassembled PDU]"
"506","31.384582","192.168.0.183","104.244.42.65","TCP","1414","50717  >  443 [ACK] Seq=403582 Ack=78336 Win=1038 Len=1360 [TCP segment of a reassembled PDU]"
"507","31.384582","192.168.0.183","104.244.42.65","TCP","1414","50717  >  443 [ACK] Seq=404942 Ack=78336 Win=1038 Len=1360 [TCP segment of a reassembled PDU]"
"508","31.384582","192.168.0.183","104.244.42.65","TCP","1414","50717  >  443 [ACK] Seq=406302 Ack=78336 Win=1038 Len=1360 [TCP segment of a reassembled PDU]"
"509","31.384582","192.168.0.183","104.244.42.65","TCP","1414","50717  >  443 [ACK] Seq=407662 Ack=78336 Win=1038 Len=1360 [TCP segment of a reassembled PDU]"
"510","31.384582","192.168.0.183","104.244.42.65","TCP","1414","50717  >  443 [ACK] Seq=409022 Ack=78336 Win=1038 Len=1360 [TCP segment of a reassembled PDU]"
"511","31.384582","192.168.0.183","104.244.42.65","TCP","1414","50717  >  443 [ACK] Seq=410382 Ack=78336 Win=1038 Len=1360 [TCP segment of a reassembled PDU]"
"512","31.384582","192.168.0.183","104.244.42.65","TCP","1414","50717  >  443 [ACK] Seq=411742 Ack=78336 Win=1038 Len=1360 [TCP segment of a reassembled PDU]"
"513","31.384582","192.168.0.183","104.244.42.65","TCP","1414","50717  >  443 [ACK] Seq=413102 Ack=78336 Win=1038 Len=1360 [TCP segment of a reassembled PDU]"
"514","31.384582","192.168.0.183","104.244.42.65","TCP","1414","50717  >  443 [ACK] Seq=414462 Ack=78336 Win=1038 Len=1360 [TCP segment of a reassembled PDU]"
"515","31.384582","192.168.0.183","104.244.42.65","TCP","1414","50717  >  443 [ACK] Seq=415822 Ack=78336 Win=1038 Len=1360 [TCP segment of a reassembled PDU]"
"516","31.384582","192.168.0.183","104.244.42.65","TLSv1.2","140","Application Data"
"517","31.384728","192.168.0.183","104.244.42.65","TCP","1414","50717  >  443 [ACK] Seq=417268 Ack=78336 Win=1038 Len=1360 [TCP segment of a reassembled PDU]"
"518","31.384728","192.168.0.183","104.244.42.65","TCP","1414","50717  >  443 [ACK] Seq=418628 Ack=78336 Win=1038 Len=1360 [TCP segment of a reassembled PDU]"
"519","31.384728","192.168.0.183","104.244.42.65","TCP","1414","50717  >  443 [ACK] Seq=419988 Ack=78336 Win=1038 Len=1360 [TCP segment of a reassembled PDU]"
"520","31.384728","192.168.0.183","104.244.42.65","TCP","1414","50717  >  443 [ACK] Seq=421348 Ack=78336 Win=1038 Len=1360 [TCP segment of a reassembled PDU]"
"521","31.384728","192.168.0.183","104.244.42.65","TCP","1414","50717  >  443 [ACK] Seq=422708 Ack=78336 Win=1038 Len=1360 [TCP segment of a reassembled PDU]"
"522","31.384728","192.168.0.183","104.244.42.65","TCP","1414","50717  >  443 [ACK] Seq=424068 Ack=78336 Win=1038 Len=1360 [TCP segment of a reassembled PDU]"
"523","31.384728","192.168.0.183","104.244.42.65","TCP","1414","50717  >  443 [ACK] Seq=425428 Ack=78336 Win=1038 Len=1360 [TCP segment of a reassembled PDU]"
"524","31.384728","192.168.0.183","104.244.42.65","TCP","1414","50717  >  443 [ACK] Seq=426788 Ack=78336 Win=1038 Len=1360 [TCP segment of a reassembled PDU]"
"525","31.384728","192.168.0.183","104.244.42.65","TCP","1414","50717  >  443 [ACK] Seq=428148 Ack=78336 Win=1038 Len=1360 [TCP segment of a reassembled PDU]"
"526","31.384728","192.168.0.183","104.244.42.65","TCP","1414","50717  >  443 [ACK] Seq=429508 Ack=78336 Win=1038 Len=1360 [TCP segment of a reassembled PDU]"
"527","31.384728","192.168.0.183","104.244.42.65","TLSv1.2","1079","Application Data"
"528","31.429052","104.244.42.65","192.168.0.183","TCP","60","443  >  50717 [ACK] Seq=78336 Ack=402222 Win=5731 Len=0"
"529","31.429052","104.244.42.65","192.168.0.183","TCP","60","443  >  50717 [ACK] Seq=78336 Ack=431893 Win=5729 Len=0"
"530","31.460000","104.244.42.65","192.168.0.183","TLSv1.2","161","Application Data"
"531","31.505137","192.168.0.183","104.244.42.65","TCP","54","50717  >  443 [ACK] Seq=431893 Ack=78443 Win=1038 Len=0"
"532","32.647694","192.168.0.183","104.244.42.65","TLSv1.2","271","Application Data"
"533","32.647757","192.168.0.183","104.244.42.65","TLSv1.2","168","Application Data"
"534","32.685342","104.244.42.65","192.168.0.183","TCP","60","443  >  50717 [ACK] Seq=78443 Ack=432224 Win=5735 Len=0"
"535","32.761742","104.244.42.65","192.168.0.183","TLSv1.2","274","Application Data"
"536","32.808704","192.168.0.183","104.244.42.65","TCP","54","50717  >  443 [ACK] Seq=432224 Ack=78663 Win=1037 Len=0"
"537","33.209320","192.168.0.183","104.244.42.65","TLSv1.2","244","Application Data"
"538","33.209622","192.168.0.183","104.244.42.65","TLSv1.2","528","Application Data"
"539","33.245337","104.244.42.65","192.168.0.183","TCP","60","443  >  50717 [ACK] Seq=78663 Ack=432888 Win=5735 Len=0"
"540","33.268300","104.244.42.65","192.168.0.183","TLSv1.2","161","Application Data"
"541","33.311770","192.168.0.183","104.244.42.65","TCP","54","50717  >  443 [ACK] Seq=432888 Ack=78770 Win=1036 Len=0"
"542","34.380873","192.168.0.183","104.244.42.65","TLSv1.2","282","Application Data"
"543","34.381010","192.168.0.183","104.244.42.65","TCP","1414","50717  >  443 [ACK] Seq=433116 Ack=78770 Win=1036 Len=1360 [TCP segment of a reassembled PDU]"
"544","34.381010","192.168.0.183","104.244.42.65","TCP","1414","50717  >  443 [ACK] Seq=434476 Ack=78770 Win=1036 Len=1360 [TCP segment of a reassembled PDU]"
"545","34.381010","192.168.0.183","104.244.42.65","TCP","1414","50717  >  443 [ACK] Seq=435836 Ack=78770 Win=1036 Len=1360 [TCP segment of a reassembled PDU]"
"546","34.381010","192.168.0.183","104.244.42.65","TCP","1414","50717  >  443 [ACK] Seq=437196 Ack=78770 Win=1036 Len=1360 [TCP segment of a reassembled PDU]"
"547","34.381010","192.168.0.183","104.244.42.65","TCP","1414","50717  >  443 [ACK] Seq=438556 Ack=78770 Win=1036 Len=1360 [TCP segment of a reassembled PDU]"
"548","34.381010","192.168.0.183","104.244.42.65","TCP","1414","50717  >  443 [ACK] Seq=439916 Ack=78770 Win=1036 Len=1360 [TCP segment of a reassembled PDU]"
"549","34.381010","192.168.0.183","104.244.42.65","TCP","1414","50717  >  443 [ACK] Seq=441276 Ack=78770 Win=1036 Len=1360 [TCP segment of a reassembled PDU]"
"550","34.381010","192.168.0.183","104.244.42.65","TCP","1414","50717  >  443 [ACK] Seq=442636 Ack=78770 Win=1036 Len=1360 [TCP segment of a reassembled PDU]"
"551","34.381010","192.168.0.183","104.244.42.65","TCP","1414","50717  >  443 [ACK] Seq=443996 Ack=78770 Win=1036 Len=1360 [TCP segment of a reassembled PDU]"
"552","34.381010","192.168.0.183","104.244.42.65","TCP","1414","50717  >  443 [ACK] Seq=445356 Ack=78770 Win=1036 Len=1360 [TCP segment of a reassembled PDU]"
"553","34.381010","192.168.0.183","104.244.42.65","TCP","1414","50717  >  443 [ACK] Seq=446716 Ack=78770 Win=1036 Len=1360 [TCP segment of a reassembled PDU]"
"554","34.381010","192.168.0.183","104.244.42.65","TCP","1414","50717  >  443 [ACK] Seq=448076 Ack=78770 Win=1036 Len=1360 [TCP segment of a reassembled PDU]"
"555","34.381010","192.168.0.183","104.244.42.65","TLSv1.2","140","Application Data"
"556","34.381126","192.168.0.183","104.244.42.65","TLSv1.2","251","Application Data"
"557","34.416831","104.244.42.65","192.168.0.183","TCP","60","443  >  50717 [ACK] Seq=78770 Ack=434476 Win=5731 Len=0"
"558","34.423563","104.244.42.65","192.168.0.183","TCP","60","443  >  50717 [ACK] Seq=78770 Ack=449719 Win=5730 Len=0"
"559","34.457428","104.244.42.65","192.168.0.183","TLSv1.2","182","Application Data"
"560","34.498196","192.168.0.183","104.244.42.65","TCP","54","50717  >  443 [ACK] Seq=449719 Ack=78898 Win=1036 Len=0"
