"No.","Time","Source","Destination","Protocol","Length","Info"
"1","0.000000","192.168.0.183","172.64.155.249","TLSv1.2","166","Application Data"
"2","0.000062","192.168.0.183","172.64.155.249","TLSv1.2","93","Application Data"
"3","0.000089","192.168.0.183","172.64.155.249","TLSv1.2","229","Application Data"
"4","0.013747","172.64.155.249","192.168.0.183","TCP","60","443  >  51124 [ACK] Seq=1 Ack=152 Win=8 Len=0"
"5","0.013747","172.64.155.249","192.168.0.183","TLSv1.2","93","Application Data"
"6","0.015090","192.168.0.183","172.64.155.249","TLSv1.2","125","Application Data"
"7","0.032278","172.64.155.249","192.168.0.183","TCP","60","443  >  51124 [ACK] Seq=40 Ack=398 Win=8 Len=0"
"8","0.051871","172.64.155.249","192.168.0.183","TLSv1.2","286","Application Data"
"9","0.062076","172.64.155.249","192.168.0.183","TLSv1.2","170","Application Data"
"10","0.062076","172.64.155.249","192.168.0.183","TLSv1.2","100","Application Data"
"11","0.062076","172.64.155.249","192.168.0.183","TLSv1.2","1285","Application Data"
"12","0.062102","192.168.0.183","172.64.155.249","TCP","54","51124  >  443 [ACK] Seq=398 Ack=1665 Win=514 Len=0"
"13","0.063211","192.168.0.183","172.64.155.249","TLSv1.2","89","Application Data"
"14","0.064839","172.64.155.249","192.168.0.183","TCP","1514","443  >  51124 [ACK] Seq=1665 Ack=398 Win=8 Len=1460 [TCP segment of a reassembled PDU]"
"15","0.064839","172.64.155.249","192.168.0.183","TCP","1514","443  >  51124 [ACK] Seq=3125 Ack=398 Win=8 Len=1460 [TCP segment of a reassembled PDU]"
"16","0.064839","172.64.155.249","192.168.0.183","TCP","1514","443  >  51124 [ACK] Seq=4585 Ack=398 Win=8 Len=1460 [TCP segment of a reassembled PDU]"
"17","0.064839","172.64.155.249","192.168.0.183","TLSv1.2","589","Application Data"
"18","0.064839","172.64.155.249","192.168.0.183","TCP","1514","443  >  51124 [ACK] Seq=6580 Ack=398 Win=8 Len=1460 [TCP segment of a reassembled PDU]"
"19","0.064839","172.64.155.249","192.168.0.183","TCP","1514","443  >  51124 [ACK] Seq=8040 Ack=398 Win=8 Len=1460 [TCP segment of a reassembled PDU]"
"20","0.064839","172.64.155.249","192.168.0.183","TCP","1514","443  >  51124 [ACK] Seq=9500 Ack=398 Win=8 Len=1460 [TCP segment of a reassembled PDU]"
"21","0.064839","172.64.155.249","192.168.0.183","TLSv1.2","457","Application Data"
"22","0.064885","192.168.0.183","172.64.155.249","TCP","54","51124  >  443 [ACK] Seq=433 Ack=11363 Win=514 Len=0"
"23","0.073371","172.64.155.249","192.168.0.183","TCP","1514","443  >  51124 [ACK] Seq=11363 Ack=398 Win=8 Len=1460 [TCP segment of a reassembled PDU]"
"24","0.073371","172.64.155.249","192.168.0.183","TLSv1.2","426","Application Data"
"25","0.073456","192.168.0.183","172.64.155.249","TCP","54","51124  >  443 [ACK] Seq=433 Ack=13195 Win=514 Len=0"
"26","0.077218","172.64.155.249","192.168.0.183","TCP","1514","443  >  51124 [ACK] Seq=13195 Ack=433 Win=8 Len=1460 [TCP segment of a reassembled PDU]"
"27","0.077218","172.64.155.249","192.168.0.183","TCP","1514","443  >  51124 [ACK] Seq=14655 Ack=433 Win=8 Len=1460 [TCP segment of a reassembled PDU]"
"28","0.077218","172.64.155.249","192.168.0.183","TCP","1514","443  >  51124 [ACK] Seq=16115 Ack=433 Win=8 Len=1460 [TCP segment of a reassembled PDU]"
"29","0.077218","172.64.155.249","192.168.0.183","TCP","1514","443  >  51124 [ACK] Seq=17575 Ack=433 Win=8 Len=1460 [TCP segment of a reassembled PDU]"
"30","0.077218","172.64.155.249","192.168.0.183","TCP","1514","443  >  51124 [ACK] Seq=19035 Ack=433 Win=8 Len=1460 [TCP segment of a reassembled PDU]"
"31","0.077218","172.64.155.249","192.168.0.183","TCP","1514","443  >  51124 [PSH, ACK] Seq=20495 Ack=433 Win=8 Len=1460 [TCP segment of a reassembled PDU]"
"32","0.077218","172.64.155.249","192.168.0.183","TCP","1514","443  >  51124 [ACK] Seq=21955 Ack=433 Win=8 Len=1460 [TCP segment of a reassembled PDU]"
"33","0.077218","172.64.155.249","192.168.0.183","TCP","1514","443  >  51124 [ACK] Seq=23415 Ack=433 Win=8 Len=1460 [TCP segment of a reassembled PDU]"
"34","0.077218","172.64.155.249","192.168.0.183","TCP","1514","443  >  51124 [ACK] Seq=24875 Ack=433 Win=8 Len=1460 [TCP segment of a reassembled PDU]"
"35","0.077218","172.64.155.249","192.168.0.183","TLSv1.2","1297","Application Data"
"36","0.077218","172.64.155.249","192.168.0.183","TCP","1514","443  >  51124 [ACK] Seq=27578 Ack=433 Win=8 Len=1460 [TCP segment of a reassembled PDU]"
"37","0.077218","172.64.155.249","192.168.0.183","TCP","1514","443  >  51124 [ACK] Seq=29038 Ack=433 Win=8 Len=1460 [TCP segment of a reassembled PDU]"
"38","0.077218","172.64.155.249","192.168.0.183","TCP","1514","443  >  51124 [ACK] Seq=30498 Ack=433 Win=8 Len=1460 [TCP segment of a reassembled PDU]"
"39","0.077218","172.64.155.249","192.168.0.183","TCP","1514","443  >  51124 [ACK] Seq=31958 Ack=433 Win=8 Len=1460 [TCP segment of a reassembled PDU]"
"40","0.077218","172.64.155.249","192.168.0.183","TLSv1.2","351","Application Data"
"41","0.077342","192.168.0.183","172.64.155.249","TCP","54","51124  >  443 [ACK] Seq=433 Ack=33715 Win=514 Len=0"
"42","0.084538","172.64.155.249","192.168.0.183","TCP","1514","443  >  51124 [ACK] Seq=33715 Ack=433 Win=8 Len=1460 [TCP segment of a reassembled PDU]"
"43","0.084538","172.64.155.249","192.168.0.183","TCP","1514","443  >  51124 [ACK] Seq=35175 Ack=433 Win=8 Len=1460 [TCP segment of a reassembled PDU]"
"44","0.084538","172.64.155.249","192.168.0.183","TCP","1514","443  >  51124 [ACK] Seq=36635 Ack=433 Win=8 Len=1460 [TCP segment of a reassembled PDU]"
"45","0.084538","172.64.155.249","192.168.0.183","TCP","1514","443  >  51124 [ACK] Seq=38095 Ack=433 Win=8 Len=1460 [TCP segment of a reassembled PDU]"
"46","0.084538","172.64.155.249","192.168.0.183","TLSv1.2","885","Application Data"
"47","0.084633","192.168.0.183","172.64.155.249","TCP","54","51124  >  443 [ACK] Seq=433 Ack=40386 Win=514 Len=0"
"48","0.085738","172.64.155.249","192.168.0.183","TCP","1514","443  >  51124 [ACK] Seq=40386 Ack=433 Win=8 Len=1460 [TCP segment of a reassembled PDU]"
"49","0.085738","172.64.155.249","192.168.0.183","TCP","1514","443  >  51124 [ACK] Seq=41846 Ack=433 Win=8 Len=1460 [TCP segment of a reassembled PDU]"
"50","0.085738","172.64.155.249","192.168.0.183","TCP","1514","443  >  51124 [ACK] Seq=43306 Ack=433 Win=8 Len=1460 [TCP segment of a reassembled PDU]"
"51","0.085738","172.64.155.249","192.168.0.183","TLSv1.2","599","Application Data"
"52","0.085738","172.64.155.249","192.168.0.183","TCP","1514","443  >  51124 [ACK] Seq=45311 Ack=433 Win=8 Len=1460 [TCP segment of a reassembled PDU]"
"53","0.085738","172.64.155.249","192.168.0.183","TLSv1.2","298","Application Data"
"54","0.085738","172.64.155.249","192.168.0.183","TLSv1.2","96","Application Data"
"55","0.085738","172.64.155.249","192.168.0.183","TLSv1.2","85","Application Data"
"56","0.085803","192.168.0.183","172.64.155.249","TCP","54","51124  >  443 [ACK] Seq=433 Ack=47088 Win=514 Len=0"
"57","0.570141","192.168.0.183","172.64.155.249","TLSv1.2","552","Application Data"
"58","0.570208","192.168.0.183","172.64.155.249","TLSv1.2","519","Application Data"
"59","0.583803","172.64.155.249","192.168.0.183","TCP","60","443  >  51124 [ACK] Seq=47088 Ack=1396 Win=8 Len=0"
"60","0.607931","172.64.155.249","192.168.0.183","TLSv1.2","406","Application Data"
"61","0.607931","172.64.155.249","192.168.0.183","TLSv1.2","85","Application Data"
"62","0.608028","192.168.0.183","172.64.155.249","TCP","54","51124  >  443 [ACK] Seq=1396 Ack=47471 Win=512 Len=0"
"63","5.776567","192.168.0.183","172.64.155.249","TLSv1.2","175","Application Data"
"64","5.776638","192.168.0.183","172.64.155.249","TLSv1.2","167","Application Data"
"65","5.788733","172.64.155.249","192.168.0.183","TCP","60","443  >  51124 [ACK] Seq=47471 Ack=1630 Win=8 Len=0"
"66","5.790330","192.168.0.183","172.64.155.249","TLSv1.2","641","Application Data"
"67","5.813378","172.64.155.249","192.168.0.183","TLSv1.2","279","Application Data"
"68","5.840384","172.64.155.249","192.168.0.183","TLSv1.2","213","Application Data"
"69","5.840384","172.64.155.249","192.168.0.183","TLSv1.2","100","Application Data"
"70","5.840384","172.64.155.249","192.168.0.183","TCP","1514","443  >  51124 [ACK] Seq=47901 Ack=2217 Win=8 Len=1460 [TCP segment of a reassembled PDU]"
"71","5.840384","172.64.155.249","192.168.0.183","TLSv1.2","1125","Application Data"
"72","5.840434","192.168.0.183","172.64.155.249","TCP","54","51124  >  443 [ACK] Seq=2217 Ack=50432 Win=514 Len=0"
"73","5.841878","192.168.0.183","172.64.155.249","TLSv1.2","89","Application Data"
"74","5.842527","172.64.155.249","192.168.0.183","TCP","1514","443  >  51124 [ACK] Seq=50432 Ack=2217 Win=8 Len=1460 [TCP segment of a reassembled PDU]"
"75","5.842527","172.64.155.249","192.168.0.183","TCP","1514","443  >  51124 [ACK] Seq=51892 Ack=2217 Win=8 Len=1460 [TCP segment of a reassembled PDU]"
"76","5.842527","172.64.155.249","192.168.0.183","TCP","1514","443  >  51124 [ACK] Seq=53352 Ack=2217 Win=8 Len=1460 [TCP segment of a reassembled PDU]"
"77","5.842527","172.64.155.249","192.168.0.183","TLSv1.2","515","Application Data"
"78","5.842527","172.64.155.249","192.168.0.183","TCP","1514","443  >  51124 [ACK] Seq=55273 Ack=2217 Win=8 Len=1460 [TCP segment of a reassembled PDU]"
"79","5.842527","172.64.155.249","192.168.0.183","TLSv1.2","868","Application Data"
"80","5.842615","192.168.0.183","172.64.155.249","TCP","54","51124  >  443 [ACK] Seq=2252 Ack=57547 Win=514 Len=0"
"81","5.850919","172.64.155.249","192.168.0.183","TCP","1514","443  >  51124 [ACK] Seq=57547 Ack=2217 Win=8 Len=1460 [TCP segment of a reassembled PDU]"
"82","5.850919","172.64.155.249","192.168.0.183","TLSv1.2","1454","Application Data"
"83","5.850919","172.64.155.249","192.168.0.183","TCP","1514","443  >  51124 [ACK] Seq=60407 Ack=2217 Win=8 Len=1460 [TCP segment of a reassembled PDU]"
"84","5.850919","172.64.155.249","192.168.0.183","TLSv1.2","1092","Application Data"
"85","5.850994","192.168.0.183","172.64.155.249","TCP","54","51124  >  443 [ACK] Seq=2252 Ack=62905 Win=514 Len=0"
"86","5.852577","172.64.155.249","192.168.0.183","TCP","1514","443  >  51124 [ACK] Seq=62905 Ack=2217 Win=8 Len=1460 [TCP segment of a reassembled PDU]"
"87","5.852577","172.64.155.249","192.168.0.183","TLSv1.2","1044","Application Data"
"88","5.852577","172.64.155.249","192.168.0.183","TCP","1514","443  >  51124 [ACK] Seq=65355 Ack=2217 Win=8 Len=1460 [TCP segment of a reassembled PDU]"
"89","5.852577","172.64.155.249","192.168.0.183","TCP","1514","443  >  51124 [ACK] Seq=66815 Ack=2217 Win=8 Len=1460 [TCP segment of a reassembled PDU]"
"90","5.852721","192.168.0.183","172.64.155.249","TCP","54","51124  >  443 [ACK] Seq=2252 Ack=68275 Win=514 Len=0"
"91","5.854517","172.64.155.249","192.168.0.183","TCP","1514","443  >  51124 [ACK] Seq=68275 Ack=2217 Win=8 Len=1460 [TCP segment of a reassembled PDU]"
"92","5.854517","172.64.155.249","192.168.0.183","TLSv1.2","333","Application Data"
"93","5.854517","172.64.155.249","192.168.0.183","TCP","1514","443  >  51124 [ACK] Seq=70014 Ack=2217 Win=8 Len=1460 [TCP segment of a reassembled PDU]"
"94","5.854517","172.64.155.249","192.168.0.183","TCP","1514","443  >  51124 [ACK] Seq=71474 Ack=2217 Win=8 Len=1460 [TCP segment of a reassembled PDU]"
"95","5.854517","172.64.155.249","192.168.0.183","TCP","1514","443  >  51124 [ACK] Seq=72934 Ack=2217 Win=8 Len=1460 [TCP segment of a reassembled PDU]"
"96","5.854517","172.64.155.249","192.168.0.183","TLSv1.2","389","Application Data"
"97","5.854517","172.64.155.249","192.168.0.183","TCP","1514","443  >  51124 [ACK] Seq=74729 Ack=2217 Win=8 Len=1460 [TCP segment of a reassembled PDU]"
"98","5.854517","172.64.155.249","192.168.0.183","TCP","1514","443  >  51124 [ACK] Seq=76189 Ack=2217 Win=8 Len=1460 [TCP segment of a reassembled PDU]"
"99","5.854517","172.64.155.249","192.168.0.183","TCP","1514","443  >  51124 [ACK] Seq=77649 Ack=2217 Win=8 Len=1460 [TCP segment of a reassembled PDU]"
"100","5.854517","172.64.155.249","192.168.0.183","TLSv1.2","757","Application Data"
"101","5.854658","192.168.0.183","172.64.155.249","TCP","54","51124  >  443 [ACK] Seq=2252 Ack=79812 Win=514 Len=0"
"102","5.861138","172.64.155.249","192.168.0.183","TCP","1514","443  >  51124 [ACK] Seq=79812 Ack=2252 Win=8 Len=1460 [TCP segment of a reassembled PDU]"
"103","5.861138","172.64.155.249","192.168.0.183","TCP","1514","443  >  51124 [ACK] Seq=81272 Ack=2252 Win=8 Len=1460 [TCP segment of a reassembled PDU]"
"104","5.861138","172.64.155.249","192.168.0.183","TLSv1.2","840","Application Data"
"105","5.861138","172.64.155.249","192.168.0.183","TCP","1514","443  >  51124 [ACK] Seq=83518 Ack=2252 Win=8 Len=1460 [TCP segment of a reassembled PDU]"
"106","5.861138","172.64.155.249","192.168.0.183","TCP","1514","443  >  51124 [ACK] Seq=84978 Ack=2252 Win=8 Len=1460 [TCP segment of a reassembled PDU]"
"107","5.861138","172.64.155.249","192.168.0.183","TLSv1.2","419","Application Data"
"108","5.861138","172.64.155.249","192.168.0.183","TLSv1.2","96","Application Data"
"109","5.861138","172.64.155.249","192.168.0.183","TLSv1.2","85","Application Data"
"110","5.861201","192.168.0.183","172.64.155.249","TCP","54","51124  >  443 [ACK] Seq=2252 Ack=86876 Win=514 Len=0"
"111","5.930810","192.168.0.183","172.64.155.249","TLSv1.2","184","Application Data"
"112","5.930841","192.168.0.183","172.64.155.249","TLSv1.2","93","Application Data"
"113","5.948617","172.64.155.249","192.168.0.183","TCP","60","443  >  51134 [ACK] Seq=1 Ack=170 Win=8 Len=0"
"114","5.948617","172.64.155.249","192.168.0.183","TLSv1.2","93","Application Data"
"115","5.983191","172.64.155.249","192.168.0.183","TLSv1.2","476","Application Data"
"116","5.983191","172.64.155.249","192.168.0.183","TLSv1.2","203","Application Data"
"117","5.983191","172.64.155.249","192.168.0.183","TLSv1.2","85","Application Data"
"118","5.983239","192.168.0.183","172.64.155.249","TCP","54","51134  >  443 [ACK] Seq=170 Ack=642 Win=514 Len=0"
"119","5.988504","192.168.0.183","172.64.155.249","TLSv1.2","89","Application Data"
"120","6.045491","172.64.155.249","192.168.0.183","TCP","60","443  >  51134 [ACK] Seq=642 Ack=205 Win=8 Len=0"
"121","6.313884","192.168.0.183","172.64.155.249","TLSv1.2","547","Application Data"
"122","6.313944","192.168.0.183","172.64.155.249","TLSv1.2","528","Application Data"
"123","6.326893","172.64.155.249","192.168.0.183","TCP","60","443  >  51124 [ACK] Seq=86876 Ack=3219 Win=8 Len=0"
"124","6.352551","172.64.155.249","192.168.0.183","TLSv1.2","144","Application Data"
"125","6.352551","172.64.155.249","192.168.0.183","TLSv1.2","85","Application Data"
"126","6.352625","192.168.0.183","172.64.155.249","TCP","54","51124  >  443 [ACK] Seq=3219 Ack=86997 Win=513 Len=0"
"127","7.715898","192.168.0.183","172.64.155.249","TLSv1.2","342","Application Data"
"128","7.764022","172.64.155.249","192.168.0.183","TLSv1.2","279","Application Data"
"129","7.764022","172.64.155.249","192.168.0.183","TLSv1.2","100","Application Data"
"130","7.764022","172.64.155.249","192.168.0.183","TLSv1.2","1305","Application Data"
"131","7.764022","172.64.155.249","192.168.0.183","TCP","1514","443  >  51124 [ACK] Seq=88519 Ack=3507 Win=8 Len=1460 [TCP segment of a reassembled PDU]"
"132","7.764070","192.168.0.183","172.64.155.249","TCP","54","51124  >  443 [ACK] Seq=3507 Ack=89979 Win=514 Len=0"
"133","7.765476","172.64.155.249","192.168.0.183","TCP","1514","443  >  51124 [ACK] Seq=89979 Ack=3507 Win=8 Len=1460 [TCP segment of a reassembled PDU]"
"134","7.765476","172.64.155.249","192.168.0.183","TLSv1.2","967","Application Data"
"135","7.765476","172.64.155.249","192.168.0.183","TCP","1514","443  >  51124 [ACK] Seq=92352 Ack=3507 Win=8 Len=1460 [TCP segment of a reassembled PDU]"
"136","7.765476","172.64.155.249","192.168.0.183","TLSv1.2","1029","Application Data"
"137","7.765504","192.168.0.183","172.64.155.249","TCP","54","51124  >  443 [ACK] Seq=3507 Ack=94787 Win=514 Len=0"
"138","7.775055","172.64.155.249","192.168.0.183","TCP","1514","443  >  51124 [ACK] Seq=94787 Ack=3507 Win=8 Len=1460 [TCP segment of a reassembled PDU]"
"139","7.775055","172.64.155.249","192.168.0.183","TCP","1514","443  >  51124 [ACK] Seq=96247 Ack=3507 Win=8 Len=1460 [TCP segment of a reassembled PDU]"
"140","7.775055","172.64.155.249","192.168.0.183","TLSv1.2","1052","Application Data"
"141","7.775055","172.64.155.249","192.168.0.183","TCP","1514","443  >  51124 [ACK] Seq=98705 Ack=3507 Win=8 Len=1460 [TCP segment of a reassembled PDU]"
"142","7.775055","172.64.155.249","192.168.0.183","TLSv1.2","1273","Application Data"
"143","7.775105","192.168.0.183","172.64.155.249","TCP","54","51124  >  443 [ACK] Seq=3507 Ack=101384 Win=514 Len=0"
"144","7.778082","172.64.155.249","192.168.0.183","TCP","1514","443  >  51124 [ACK] Seq=101384 Ack=3507 Win=8 Len=1460 [TCP segment of a reassembled PDU]"
"145","7.778082","172.64.155.249","192.168.0.183","TCP","1514","443  >  51124 [ACK] Seq=102844 Ack=3507 Win=8 Len=1460 [TCP segment of a reassembled PDU]"
"146","7.778082","172.64.155.249","192.168.0.183","TCP","1514","443  >  51124 [ACK] Seq=104304 Ack=3507 Win=8 Len=1460 [TCP segment of a reassembled PDU]"
"147","7.778082","172.64.155.249","192.168.0.183","TCP","1514","443  >  51124 [ACK] Seq=105764 Ack=3507 Win=8 Len=1460 [TCP segment of a reassembled PDU]"
"148","7.778082","172.64.155.249","192.168.0.183","TCP","1514","443  >  51124 [ACK] Seq=107224 Ack=3507 Win=8 Len=1460 [TCP segment of a reassembled PDU]"
"149","7.778082","172.64.155.249","192.168.0.183","TCP","1514","443  >  51124 [PSH, ACK] Seq=108684 Ack=3507 Win=8 Len=1460 [TCP segment of a reassembled PDU]"
"150","7.778082","172.64.155.249","192.168.0.183","TLSv1.2","85","Application Data"
"151","7.778082","172.64.155.249","192.168.0.183","TCP","1514","443  >  51124 [ACK] Seq=110175 Ack=3507 Win=8 Len=1460 [TCP segment of a reassembled PDU]"
"152","7.778082","172.64.155.249","192.168.0.183","TLSv1.2","1092","Application Data"
"153","7.778162","192.168.0.183","172.64.155.249","TCP","54","51124  >  443 [ACK] Seq=3507 Ack=112673 Win=514 Len=0"
"154","7.784890","172.64.155.249","192.168.0.183","TCP","1514","443  >  51124 [ACK] Seq=112673 Ack=3507 Win=8 Len=1460 [TCP segment of a reassembled PDU]"
"155","7.784890","172.64.155.249","192.168.0.183","TCP","1514","443  >  51124 [ACK] Seq=114133 Ack=3507 Win=8 Len=1460 [TCP segment of a reassembled PDU]"
"156","7.784890","172.64.155.249","192.168.0.183","TCP","1514","443  >  51124 [ACK] Seq=115593 Ack=3507 Win=8 Len=1460 [TCP segment of a reassembled PDU]"
"157","7.784890","172.64.155.249","192.168.0.183","TLSv1.2","888","Application Data"
"158","7.784890","172.64.155.249","192.168.0.183","TCP","1514","443  >  51124 [ACK] Seq=117887 Ack=3507 Win=8 Len=1460 [TCP segment of a reassembled PDU]"
"159","7.784890","172.64.155.249","192.168.0.183","TCP","1514","443  >  51124 [ACK] Seq=119347 Ack=3507 Win=8 Len=1460 [TCP segment of a reassembled PDU]"
"160","7.784890","172.64.155.249","192.168.0.183","TCP","1514","443  >  51124 [ACK] Seq=120807 Ack=3507 Win=8 Len=1460 [TCP segment of a reassembled PDU]"
"161","7.784890","172.64.155.249","192.168.0.183","TLSv1.2","1363","Application Data"
"162","7.784958","192.168.0.183","172.64.155.249","TCP","54","51124  >  443 [ACK] Seq=3507 Ack=123576 Win=514 Len=0"
"163","7.793252","172.64.155.249","192.168.0.183","TCP","1514","443  >  51124 [ACK] Seq=123576 Ack=3507 Win=8 Len=1460 [TCP segment of a reassembled PDU]"
"164","7.793252","172.64.155.249","192.168.0.183","TCP","1514","443  >  51124 [ACK] Seq=125036 Ack=3507 Win=8 Len=1460 [TCP segment of a reassembled PDU]"
"165","7.793252","172.64.155.249","192.168.0.183","TLSv1.2","1247","Application Data"
"166","7.793252","172.64.155.249","192.168.0.183","TLSv1.2","96","Application Data"
"167","7.793252","172.64.155.249","192.168.0.183","TLSv1.2","85","Application Data"
"168","7.793353","192.168.0.183","172.64.155.249","TCP","54","51124  >  443 [ACK] Seq=3507 Ack=127762 Win=514 Len=0"
"169","7.887992","192.168.0.183","172.64.155.249","TLSv1.2","226","Application Data"
"170","7.901129","172.64.155.249","192.168.0.183","TCP","60","443  >  51134 [ACK] Seq=642 Ack=377 Win=8 Len=0"
"171","7.927822","172.64.155.249","192.168.0.183","TLSv1.2","472","Application Data"
"172","7.927822","172.64.155.249","192.168.0.183","TLSv1.2","203","Application Data"
"173","7.927822","172.64.155.249","192.168.0.183","TLSv1.2","85","Application Data"
"174","7.927868","192.168.0.183","172.64.155.249","TCP","54","51134  >  443 [ACK] Seq=377 Ack=1240 Win=511 Len=0"
"175","8.035899","192.168.0.183","172.64.155.249","TLSv1.2","258","Application Data"
"176","8.074573","172.64.155.249","192.168.0.183","TLSv1.2","144","Application Data"
"177","8.116030","192.168.0.183","172.64.155.249","TCP","54","51124  >  443 [ACK] Seq=3711 Ack=127852 Win=513 Len=0"
"178","8.306236","192.168.0.183","172.64.155.249","TLSv1.2","515","Application Data"
"179","8.306301","192.168.0.183","172.64.155.249","TLSv1.2","554","Application Data"
"180","8.318930","172.64.155.249","192.168.0.183","TCP","60","443  >  51124 [ACK] Seq=127852 Ack=4672 Win=8 Len=0"
"181","8.343749","172.64.155.249","192.168.0.183","TLSv1.2","144","Application Data"
"182","8.343749","172.64.155.249","192.168.0.183","TLSv1.2","85","Application Data"
"183","8.343782","192.168.0.183","172.64.155.249","TCP","54","51124  >  443 [ACK] Seq=4672 Ack=127973 Win=513 Len=0"
"184","10.617676","192.168.0.183","172.64.155.249","TLSv1.2","184","Application Data"
"185","10.671242","172.64.155.249","192.168.0.183","TCP","60","443  >  51124 [ACK] Seq=127973 Ack=4802 Win=8 Len=0"
"186","10.686636","172.64.155.249","192.168.0.183","TLSv1.2","283","Application Data"
"187","10.686636","172.64.155.249","192.168.0.183","TLSv1.2","100","Application Data"
"188","10.686636","172.64.155.249","192.168.0.183","TLSv1.2","1283","Application Data"
"189","10.686636","172.64.155.249","192.168.0.183","TCP","1514","443  >  51124 [ACK] Seq=129477 Ack=4802 Win=8 Len=1460 [TCP segment of a reassembled PDU]"
"190","10.686818","192.168.0.183","172.64.155.249","TCP","54","51124  >  443 [ACK] Seq=4802 Ack=128248 Win=512 Len=0"
"191","10.686965","192.168.0.183","172.64.155.249","TCP","54","51124  >  443 [ACK] Seq=4802 Ack=130937 Win=514 Len=0"
"192","10.689476","172.64.155.249","192.168.0.183","TCP","1514","443  >  51124 [ACK] Seq=130937 Ack=4802 Win=8 Len=1460 [TCP segment of a reassembled PDU]"
"193","10.689476","172.64.155.249","192.168.0.183","TCP","1514","443  >  51124 [ACK] Seq=132397 Ack=4802 Win=8 Len=1460 [TCP segment of a reassembled PDU]"
"194","10.689476","172.64.155.249","192.168.0.183","TLSv1.2","561","Application Data"
"195","10.689476","172.64.155.249","192.168.0.183","TCP","1514","443  >  51124 [ACK] Seq=134364 Ack=4802 Win=8 Len=1460 [TCP segment of a reassembled PDU]"
"196","10.689476","172.64.155.249","192.168.0.183","TCP","1514","443  >  51124 [ACK] Seq=135824 Ack=4802 Win=8 Len=1460 [TCP segment of a reassembled PDU]"
"197","10.689476","172.64.155.249","192.168.0.183","TLSv1.2","776","Application Data"
"198","10.689560","192.168.0.183","172.64.155.249","TCP","54","51124  >  443 [ACK] Seq=4802 Ack=138006 Win=514 Len=0"
"199","10.697477","172.64.155.249","192.168.0.183","TCP","1514","443  >  51124 [ACK] Seq=138006 Ack=4802 Win=8 Len=1460 [TCP segment of a reassembled PDU]"
"200","10.697477","172.64.155.249","192.168.0.183","TLSv1.2","1349","Application Data"
"201","10.697521","192.168.0.183","172.64.155.249","TCP","54","51124  >  443 [ACK] Seq=4802 Ack=140761 Win=514 Len=0"
"202","10.704113","172.64.155.249","192.168.0.183","TCP","1514","443  >  51124 [ACK] Seq=140761 Ack=4802 Win=8 Len=1460 [TCP segment of a reassembled PDU]"
"203","10.704113","172.64.155.249","192.168.0.183","TCP","1514","443  >  51124 [ACK] Seq=142221 Ack=4802 Win=8 Len=1460 [TCP segment of a reassembled PDU]"
"204","10.704113","172.64.155.249","192.168.0.183","TCP","1514","443  >  51124 [ACK] Seq=143681 Ack=4802 Win=8 Len=1460 [TCP segment of a reassembled PDU]"
"205","10.704113","172.64.155.249","192.168.0.183","TCP","1514","443  >  51124 [ACK] Seq=145141 Ack=4802 Win=8 Len=1460 [TCP segment of a reassembled PDU]"
"206","10.704113","172.64.155.249","192.168.0.183","TCP","1514","443  >  51124 [ACK] Seq=146601 Ack=4802 Win=8 Len=1460 [TCP segment of a reassembled PDU]"
"207","10.704113","172.64.155.249","192.168.0.183","TCP","1514","443  >  51124 [PSH, ACK] Seq=148061 Ack=4802 Win=8 Len=1460 [TCP segment of a reassembled PDU]"
"208","10.704113","172.64.155.249","192.168.0.183","TCP","1514","443  >  51124 [ACK] Seq=149521 Ack=4802 Win=8 Len=1460 [TCP segment of a reassembled PDU]"
"209","10.704113","172.64.155.249","192.168.0.183","TLSv1.2","208","Application Data"
"210","10.704113","172.64.155.249","192.168.0.183","TLSv1.2","127","Application Data, Application Data"
"211","10.704284","192.168.0.183","172.64.155.249","TCP","54","51124  >  443 [ACK] Seq=4802 Ack=151208 Win=514 Len=0"
"212","11.001677","192.168.0.183","172.64.155.249","TLSv1.2","211","Application Data"
"213","11.014633","172.64.155.249","192.168.0.183","TCP","60","443  >  51124 [ACK] Seq=151208 Ack=4959 Win=8 Len=0"
"214","11.047216","172.64.155.249","192.168.0.183","TLSv1.2","144","Application Data"
"215","11.088644","192.168.0.183","172.64.155.249","TCP","54","51124  >  443 [ACK] Seq=4959 Ack=151298 Win=513 Len=0"
"216","11.110758","192.168.0.183","172.64.155.249","TLSv1.2","490","Application Data"
"217","11.110798","192.168.0.183","172.64.155.249","TLSv1.2","538","Application Data"
"218","11.125894","172.64.155.249","192.168.0.183","TCP","60","443  >  51124 [ACK] Seq=151298 Ack=5879 Win=8 Len=0"
"219","11.152312","172.64.155.249","192.168.0.183","TLSv1.2","144","Application Data"
"220","11.152312","172.64.155.249","192.168.0.183","TLSv1.2","85","Application Data"
"221","11.152379","192.168.0.183","172.64.155.249","TCP","54","51124  >  443 [ACK] Seq=5879 Ack=151419 Win=513 Len=0"
"222","12.537309","192.168.0.183","172.64.155.249","TLSv1.2","526","Application Data"
"223","12.537450","192.168.0.183","172.64.155.249","TLSv1.2","170","Application Data"
"224","12.548677","192.168.0.183","172.64.155.249","TLSv1.2","318","Application Data"
"225","12.551502","172.64.155.249","192.168.0.183","TCP","60","443  >  51124 [ACK] Seq=151419 Ack=6467 Win=8 Len=0"
"226","12.573119","172.64.155.249","192.168.0.183","TLSv1.2","278","Application Data"
"227","12.622038","192.168.0.183","172.64.155.249","TCP","54","51124  >  443 [ACK] Seq=6731 Ack=151643 Win=512 Len=0"
"228","12.791738","192.168.0.183","172.64.155.249","TLSv1.2","173","Application Data"
"229","12.828829","172.64.155.249","192.168.0.183","TLSv1.2","146","Application Data"
"230","12.828829","172.64.155.249","192.168.0.183","TLSv1.2","100","Application Data"
"231","12.828829","172.64.155.249","192.168.0.183","TLSv1.2","1330","Application Data"
"232","12.828829","172.64.155.249","192.168.0.183","TCP","1514","443  >  51124 [ACK] Seq=153057 Ack=6850 Win=8 Len=1460 [TCP segment of a reassembled PDU]"
"233","12.828879","192.168.0.183","172.64.155.249","TCP","54","51124  >  443 [ACK] Seq=6850 Ack=154517 Win=514 Len=0"
"234","12.829756","172.64.155.249","192.168.0.183","TCP","1514","443  >  51124 [ACK] Seq=154517 Ack=6850 Win=8 Len=1460 [TCP segment of a reassembled PDU]"
"235","12.829756","172.64.155.249","192.168.0.183","TCP","1514","443  >  51124 [ACK] Seq=155977 Ack=6850 Win=8 Len=1460 [TCP segment of a reassembled PDU]"
"236","12.829756","172.64.155.249","192.168.0.183","TLSv1.2","637","Application Data"
"237","12.829756","172.64.155.249","192.168.0.183","TCP","1514","443  >  51124 [ACK] Seq=158020 Ack=6850 Win=8 Len=1460 [TCP segment of a reassembled PDU]"
"238","12.829756","172.64.155.249","192.168.0.183","TCP","1514","443  >  51124 [ACK] Seq=159480 Ack=6850 Win=8 Len=1460 [TCP segment of a reassembled PDU]"
"239","12.829756","172.64.155.249","192.168.0.183","TLSv1.2","592","Application Data"
"240","12.829804","192.168.0.183","172.64.155.249","TCP","54","51124  >  443 [ACK] Seq=6850 Ack=161478 Win=514 Len=0"
"241","12.829826","192.168.0.183","172.64.155.249","TLSv1.2","89","Application Data"
"242","12.832547","172.64.155.249","192.168.0.183","TLSv1.2","147","Application Data"
"243","12.832547","172.64.155.249","192.168.0.183","TLSv1.2","100","Application Data"
"244","12.832547","172.64.155.249","192.168.0.183","TCP","1514","443  >  51124 [ACK] Seq=161617 Ack=6850 Win=8 Len=1460 [TCP segment of a reassembled PDU]"
"245","12.832547","172.64.155.249","192.168.0.183","TLSv1.2","659","Application Data"
"246","12.832612","192.168.0.183","172.64.155.249","TCP","54","51124  >  443 [ACK] Seq=6885 Ack=163682 Win=514 Len=0"
"247","12.834423","172.64.155.249","192.168.0.183","TLSv1.2","126","Application Data, Application Data"
"248","12.844097","172.64.155.249","192.168.0.183","TCP","1514","443  >  51124 [ACK] Seq=163754 Ack=6850 Win=8 Len=1460 [TCP segment of a reassembled PDU]"
"249","12.844097","172.64.155.249","192.168.0.183","TLSv1.2","1139","Application Data"
"250","12.844097","172.64.155.249","192.168.0.183","TCP","1514","443  >  51124 [ACK] Seq=166299 Ack=6850 Win=8 Len=1460 [TCP segment of a reassembled PDU]"
"251","12.844097","172.64.155.249","192.168.0.183","TLSv1.2","373","Application Data"
"252","12.844097","172.64.155.249","192.168.0.183","TCP","1514","443  >  51124 [ACK] Seq=168078 Ack=6850 Win=8 Len=1460 [TCP segment of a reassembled PDU]"
"253","12.844097","172.64.155.249","192.168.0.183","TCP","1514","443  >  51124 [ACK] Seq=169538 Ack=6850 Win=8 Len=1460 [TCP segment of a reassembled PDU]"
"254","12.844097","172.64.155.249","192.168.0.183","TCP","1514","443  >  51124 [ACK] Seq=170998 Ack=6850 Win=8 Len=1460 [TCP segment of a reassembled PDU]"
"255","12.844097","172.64.155.249","192.168.0.183","TLSv1.2","177","Application Data"
"256","12.844097","172.64.155.249","192.168.0.183","TCP","1514","443  >  51124 [ACK] Seq=172581 Ack=6885 Win=8 Len=1460 [TCP segment of a reassembled PDU]"
"257","12.844097","172.64.155.249","192.168.0.183","TCP","1514","443  >  51124 [ACK] Seq=174041 Ack=6885 Win=8 Len=1460 [TCP segment of a reassembled PDU]"
"258","12.844097","172.64.155.249","192.168.0.183","TCP","1514","443  >  51124 [ACK] Seq=175501 Ack=6885 Win=8 Len=1460 [TCP segment of a reassembled PDU]"
"259","12.844097","172.64.155.249","192.168.0.183","TCP","1514","443  >  51124 [ACK] Seq=176961 Ack=6885 Win=8 Len=1460 [TCP segment of a reassembled PDU]"
"260","12.844097","172.64.155.249","192.168.0.183","TCP","1514","443  >  51124 [ACK] Seq=178421 Ack=6885 Win=8 Len=1460 [TCP segment of a reassembled PDU]"
"261","12.844097","172.64.155.249","192.168.0.183","TCP","1514","443  >  51124 [PSH, ACK] Seq=179881 Ack=6885 Win=8 Len=1460 [TCP segment of a reassembled PDU]"
"262","12.844097","172.64.155.249","192.168.0.183","TCP","1514","443  >  51124 [ACK] Seq=181341 Ack=6885 Win=8 Len=1460 [TCP segment of a reassembled PDU]"
"263","12.844097","172.64.155.249","192.168.0.183","TCP","1514","443  >  51124 [ACK] Seq=182801 Ack=6885 Win=8 Len=1460 [TCP segment of a reassembled PDU]"
"264","12.844097","172.64.155.249","192.168.0.183","TCP","1514","443  >  51124 [ACK] Seq=184261 Ack=6885 Win=8 Len=1460 [TCP segment of a reassembled PDU]"
"265","12.844097","172.64.155.249","192.168.0.183","TCP","1514","443  >  51124 [ACK] Seq=185721 Ack=6885 Win=8 Len=1460 [TCP segment of a reassembled PDU]"
"266","12.844097","172.64.155.249","192.168.0.183","TLSv1.2","91","Application Data"
"267","12.844272","192.168.0.183","172.64.155.249","TCP","54","51124  >  443 [ACK] Seq=6885 Ack=187218 Win=514 Len=0"
"268","12.844951","172.64.155.249","192.168.0.183","TLSv1.2","127","Application Data, Application Data"
"269","12.895462","192.168.0.183","172.64.155.249","TCP","54","51124  >  443 [ACK] Seq=6885 Ack=187291 Win=513 Len=0"
"270","12.980256","192.168.0.183","172.64.155.249","TLSv1.2","184","Application Data"
"271","13.027324","172.64.155.249","192.168.0.183","TLSv1.2","474","Application Data"
"272","13.027324","172.64.155.249","192.168.0.183","TLSv1.2","234","Application Data, Application Data"
"273","13.027376","192.168.0.183","172.64.155.249","TCP","54","51134  >  443 [ACK] Seq=507 Ack=1840 Win=509 Len=0"
"274","13.028534","192.168.0.183","172.64.155.249","TLSv1.2","89","Application Data"
"275","13.087483","172.64.155.249","192.168.0.183","TCP","60","443  >  51134 [ACK] Seq=1840 Ack=542 Win=8 Len=0"
"276","13.278831","192.168.0.183","172.64.155.249","TLSv1.2","739","Application Data"
"277","13.278891","192.168.0.183","172.64.155.249","TLSv1.2","547","Application Data"
"278","13.293484","172.64.155.249","192.168.0.183","TCP","60","443  >  51124 [ACK] Seq=187291 Ack=8063 Win=8 Len=0"
"279","13.319122","172.64.155.249","192.168.0.183","TLSv1.2","164","Application Data"
"280","13.319122","172.64.155.249","192.168.0.183","TLSv1.2","85","Application Data"
"281","13.319169","192.168.0.183","172.64.155.249","TCP","54","51124  >  443 [ACK] Seq=8063 Ack=187432 Win=513 Len=0"
"282","15.567132","192.168.0.183","172.64.155.249","TLSv1.2","306","Application Data"
"283","15.567291","192.168.0.183","172.64.155.249","TLSv1.2","587","Application Data"
"284","15.581609","192.168.0.183","172.64.155.249","TLSv1.2","187","Application Data"
"285","15.583670","172.64.155.249","192.168.0.183","TCP","60","443  >  51124 [ACK] Seq=187432 Ack=8848 Win=8 Len=0"
"286","15.603646","172.64.155.249","192.168.0.183","TLSv1.2","312","Application Data"
"287","15.603646","172.64.155.249","192.168.0.183","TLSv1.2","85","Application Data"
"288","15.603694","192.168.0.183","172.64.155.249","TCP","54","51124  >  443 [ACK] Seq=8981 Ack=187721 Win=512 Len=0"
"289","15.632607","172.64.155.249","192.168.0.183","TLSv1.2","274","Application Data"
"290","15.632607","172.64.155.249","192.168.0.183","TLSv1.2","100","Application Data"
"291","15.632607","172.64.155.249","192.168.0.183","TLSv1.2","1314","Application Data"
"292","15.632607","172.64.155.249","192.168.0.183","TCP","1514","443  >  51124 [ACK] Seq=189247 Ack=8981 Win=8 Len=1460 [TCP segment of a reassembled PDU]"
"293","15.632607","172.64.155.249","192.168.0.183","TCP","1514","443  >  51124 [ACK] Seq=190707 Ack=8981 Win=8 Len=1460 [TCP segment of a reassembled PDU]"
"294","15.632759","192.168.0.183","172.64.155.249","TCP","54","51124  >  443 [ACK] Seq=8981 Ack=192167 Win=514 Len=0"
"295","15.634504","172.64.155.249","192.168.0.183","TCP","1514","443  >  51124 [ACK] Seq=192167 Ack=8981 Win=8 Len=1460 [TCP segment of a reassembled PDU]"
"296","15.634504","172.64.155.249","192.168.0.183","TLSv1.2","677","Application Data"
"297","15.634504","172.64.155.249","192.168.0.183","TLSv1.2","1511","Application Data"
"298","15.634504","172.64.155.249","192.168.0.183","TCP","1514","443  >  51124 [ACK] Seq=195707 Ack=8981 Win=8 Len=1460 [TCP segment of a reassembled PDU]"
"299","15.634504","172.64.155.249","192.168.0.183","TLSv1.2","910","Application Data"
"300","15.634636","192.168.0.183","172.64.155.249","TCP","54","51124  >  443 [ACK] Seq=8981 Ack=198023 Win=514 Len=0"
"301","15.653223","172.64.155.249","192.168.0.183","TCP","1514","443  >  51124 [ACK] Seq=198023 Ack=8981 Win=8 Len=1460 [TCP segment of a reassembled PDU]"
"302","15.653223","172.64.155.249","192.168.0.183","TLSv1.2","1106","Application Data"
"303","15.653223","172.64.155.249","192.168.0.183","TCP","1514","443  >  51124 [ACK] Seq=200535 Ack=8981 Win=8 Len=1460 [TCP segment of a reassembled PDU]"
"304","15.653223","172.64.155.249","192.168.0.183","TCP","1514","443  >  51124 [ACK] Seq=201995 Ack=8981 Win=8 Len=1460 [TCP segment of a reassembled PDU]"
"305","15.653223","172.64.155.249","192.168.0.183","TCP","1514","443  >  51124 [ACK] Seq=203455 Ack=8981 Win=8 Len=1460 [TCP segment of a reassembled PDU]"
"306","15.653223","172.64.155.249","192.168.0.183","TCP","1514","443  >  51124 [ACK] Seq=204915 Ack=8981 Win=8 Len=1460 [TCP segment of a reassembled PDU]"
"307","15.653223","172.64.155.249","192.168.0.183","TCP","1514","443  >  51124 [ACK] Seq=206375 Ack=8981 Win=8 Len=1460 [TCP segment of a reassembled PDU]"
"308","15.653223","172.64.155.249","192.168.0.183","TCP","1514","443  >  51124 [PSH, ACK] Seq=207835 Ack=8981 Win=8 Len=1460 [TCP segment of a reassembled PDU]"
"309","15.653223","172.64.155.249","192.168.0.183","TCP","1514","443  >  51124 [ACK] Seq=209295 Ack=8981 Win=8 Len=1460 [TCP segment of a reassembled PDU]"
"310","15.653223","172.64.155.249","192.168.0.183","TCP","1514","443  >  51124 [ACK] Seq=210755 Ack=8981 Win=8 Len=1460 [TCP segment of a reassembled PDU]"
"311","15.653223","172.64.155.249","192.168.0.183","TCP","1514","443  >  51124 [ACK] Seq=212215 Ack=8981 Win=8 Len=1460 [TCP segment of a reassembled PDU]"
"312","15.653223","172.64.155.249","192.168.0.183","TCP","1514","443  >  51124 [ACK] Seq=213675 Ack=8981 Win=8 Len=1460 [TCP segment of a reassembled PDU]"
"313","15.653223","172.64.155.249","192.168.0.183","TCP","1514","443  >  51124 [ACK] Seq=215135 Ack=8981 Win=8 Len=1460 [TCP segment of a reassembled PDU]"
"314","15.653223","172.64.155.249","192.168.0.183","TLSv1.2","400","Application Data"
"315","15.653223","172.64.155.249","192.168.0.183","TCP","1514","443  >  51124 [ACK] Seq=216941 Ack=8981 Win=8 Len=1460 [TCP segment of a reassembled PDU]"
"316","15.653223","172.64.155.249","192.168.0.183","TCP","1514","443  >  51124 [ACK] Seq=218401 Ack=8981 Win=8 Len=1460 [TCP segment of a reassembled PDU]"
"317","15.653223","172.64.155.249","192.168.0.183","TLSv1.2","1007","Application Data"
"318","15.653414","192.168.0.183","172.64.155.249","TCP","54","51124  >  443 [ACK] Seq=8981 Ack=220814 Win=514 Len=0"
"319","15.654711","172.64.155.249","192.168.0.183","TCP","1514","443  >  51124 [ACK] Seq=220814 Ack=8981 Win=8 Len=1460 [TCP segment of a reassembled PDU]"
"320","15.654711","172.64.155.249","192.168.0.183","TCP","1514","443  >  51124 [ACK] Seq=222274 Ack=8981 Win=8 Len=1460 [TCP segment of a reassembled PDU]"
"321","15.654711","172.64.155.249","192.168.0.183","TLSv1.2","416","Application Data"
"322","15.654759","192.168.0.183","172.64.155.249","TCP","54","51124  >  443 [ACK] Seq=8981 Ack=224096 Win=514 Len=0"
"323","15.658554","172.64.155.249","192.168.0.183","TCP","1514","443  >  51124 [ACK] Seq=224096 Ack=8981 Win=8 Len=1460 [TCP segment of a reassembled PDU]"
"324","15.658554","172.64.155.249","192.168.0.183","TCP","1514","443  >  51124 [ACK] Seq=225556 Ack=8981 Win=8 Len=1460 [TCP segment of a reassembled PDU]"
"325","15.658554","172.64.155.249","192.168.0.183","TLSv1.2","802","Application Data"
"326","15.658554","172.64.155.249","192.168.0.183","TLSv1.2","96","Application Data"
"327","15.658554","172.64.155.249","192.168.0.183","TLSv1.2","85","Application Data"
"328","15.658622","192.168.0.183","172.64.155.249","TCP","54","51124  >  443 [ACK] Seq=8981 Ack=227837 Win=514 Len=0"
"329","15.752810","192.168.0.183","172.64.155.249","TLSv1.2","234","Application Data"
"330","15.772737","172.64.155.249","192.168.0.183","TCP","60","443  >  51134 [ACK] Seq=1840 Ack=722 Win=8 Len=0"
"331","15.795260","172.64.155.249","192.168.0.183","TLSv1.2","477","Application Data"
"332","15.795260","172.64.155.249","192.168.0.183","TLSv1.2","95","Application Data"
"333","15.795260","172.64.155.249","192.168.0.183","TLSv1.2","193","Application Data"
"334","15.795260","172.64.155.249","192.168.0.183","TLSv1.2","85","Application Data"
"335","15.795301","192.168.0.183","172.64.155.249","TCP","54","51134  >  443 [ACK] Seq=722 Ack=2474 Win=514 Len=0"
"336","15.880035","192.168.0.183","172.64.155.249","TLSv1.2","260","Application Data"
"337","15.914838","172.64.155.249","192.168.0.183","TLSv1.2","152","Application Data"
"338","15.956549","192.168.0.183","172.64.155.249","TCP","54","51124  >  443 [ACK] Seq=9187 Ack=227935 Win=513 Len=0"
"339","16.144773","192.168.0.183","172.64.155.249","TLSv1.2","490","Application Data"
"340","16.144852","192.168.0.183","172.64.155.249","TLSv1.2","571","Application Data"
"341","16.159374","172.64.155.249","192.168.0.183","TCP","60","443  >  51124 [ACK] Seq=227935 Ack=10140 Win=8 Len=0"
"342","16.185888","172.64.155.249","192.168.0.183","TLSv1.2","144","Application Data"
"343","16.185888","172.64.155.249","192.168.0.183","TLSv1.2","85","Application Data"
"344","16.185921","192.168.0.183","172.64.155.249","TCP","54","51124  >  443 [ACK] Seq=10140 Ack=228056 Win=513 Len=0"
"345","17.688738","192.168.0.183","172.64.155.249","TLSv1.2","527","Application Data"
"346","17.688815","192.168.0.183","172.64.155.249","TLSv1.2","274","Application Data"
"347","17.702928","172.64.155.249","192.168.0.183","TCP","60","443  >  51124 [ACK] Seq=228056 Ack=10833 Win=8 Len=0"
"348","17.703019","192.168.0.183","172.64.155.249","TLSv1.2","345","Application Data"
"349","17.727930","172.64.155.249","192.168.0.183","TLSv1.2","307","Application Data"
"350","17.765940","172.64.155.249","192.168.0.183","TLSv1.2","183","Application Data"
"351","17.765940","172.64.155.249","192.168.0.183","TLSv1.2","100","Application Data"
"352","17.765982","192.168.0.183","172.64.155.249","TCP","54","51124  >  443 [ACK] Seq=11124 Ack=228484 Win=511 Len=0"
"353","17.768763","172.64.155.249","192.168.0.183","TCP","1514","443  >  51124 [ACK] Seq=228484 Ack=11124 Win=8 Len=1460 [TCP segment of a reassembled PDU]"
"354","17.768763","172.64.155.249","192.168.0.183","TLSv1.2","1149","Application Data"
"355","17.768831","192.168.0.183","172.64.155.249","TCP","54","51124  >  443 [ACK] Seq=11124 Ack=231039 Win=514 Len=0"
"356","17.770607","172.64.155.249","192.168.0.183","TCP","1514","443  >  51124 [ACK] Seq=231039 Ack=11124 Win=8 Len=1460 [TCP segment of a reassembled PDU]"
"357","17.770607","172.64.155.249","192.168.0.183","TCP","1514","443  >  51124 [ACK] Seq=232499 Ack=11124 Win=8 Len=1460 [TCP segment of a reassembled PDU]"
"358","17.770607","172.64.155.249","192.168.0.183","TCP","1514","443  >  51124 [ACK] Seq=233959 Ack=11124 Win=8 Len=1460 [TCP segment of a reassembled PDU]"
"359","17.770607","172.64.155.249","192.168.0.183","TCP","1514","443  >  51124 [ACK] Seq=235419 Ack=11124 Win=8 Len=1460 [TCP segment of a reassembled PDU]"
"360","17.770607","172.64.155.249","192.168.0.183","TCP","1514","443  >  51124 [ACK] Seq=236879 Ack=11124 Win=8 Len=1460 [TCP segment of a reassembled PDU]"
"361","17.770607","172.64.155.249","192.168.0.183","TLSv1.2","92","Application Data"
"362","17.770652","192.168.0.183","172.64.155.249","TCP","54","51124  >  443 [ACK] Seq=11124 Ack=238377 Win=514 Len=0"
"363","17.780305","172.64.155.249","192.168.0.183","TCP","1514","443  >  51124 [ACK] Seq=238377 Ack=11124 Win=8 Len=1460 [TCP segment of a reassembled PDU]"
"364","17.780305","172.64.155.249","192.168.0.183","TLSv1.2","1285","Application Data"
"365","17.780381","192.168.0.183","172.64.155.249","TCP","54","51124  >  443 [ACK] Seq=11124 Ack=241068 Win=514 Len=0"
"366","17.786633","172.64.155.249","192.168.0.183","TCP","1514","443  >  51124 [ACK] Seq=241068 Ack=11124 Win=8 Len=1460 [TCP segment of a reassembled PDU]"
"367","17.786633","172.64.155.249","192.168.0.183","TCP","1514","443  >  51124 [ACK] Seq=242528 Ack=11124 Win=8 Len=1460 [TCP segment of a reassembled PDU]"
"368","17.786633","172.64.155.249","192.168.0.183","TCP","1514","443  >  51124 [ACK] Seq=243988 Ack=11124 Win=8 Len=1460 [TCP segment of a reassembled PDU]"
"369","17.786633","172.64.155.249","192.168.0.183","TCP","1514","443  >  51124 [ACK] Seq=245448 Ack=11124 Win=8 Len=1460 [TCP segment of a reassembled PDU]"
"370","17.786633","172.64.155.249","192.168.0.183","TCP","1514","443  >  51124 [ACK] Seq=246908 Ack=11124 Win=8 Len=1460 [TCP segment of a reassembled PDU]"
"371","17.786633","172.64.155.249","192.168.0.183","TLSv1.2","1170","Application Data"
"372","17.786633","172.64.155.249","192.168.0.183","TCP","1514","443  >  51124 [ACK] Seq=249484 Ack=11124 Win=8 Len=1460 [TCP segment of a reassembled PDU]"
"373","17.786633","172.64.155.249","192.168.0.183","TCP","1514","443  >  51124 [ACK] Seq=250944 Ack=11124 Win=8 Len=1460 [TCP segment of a reassembled PDU]"
"374","17.786633","172.64.155.249","192.168.0.183","TCP","1514","443  >  51124 [ACK] Seq=252404 Ack=11124 Win=8 Len=1460 [TCP segment of a reassembled PDU]"
"375","17.786633","172.64.155.249","192.168.0.183","TCP","1514","443  >  51124 [ACK] Seq=253864 Ack=11124 Win=8 Len=1460 [TCP segment of a reassembled PDU]"
"376","17.786633","172.64.155.249","192.168.0.183","TCP","1514","443  >  51124 [ACK] Seq=255324 Ack=11124 Win=8 Len=1460 [TCP segment of a reassembled PDU]"
"377","17.786633","172.64.155.249","192.168.0.183","TCP","1514","443  >  51124 [PSH, ACK] Seq=256784 Ack=11124 Win=8 Len=1460 [TCP segment of a reassembled PDU]"
"378","17.786633","172.64.155.249","192.168.0.183","TCP","1514","443  >  51124 [ACK] Seq=258244 Ack=11124 Win=8 Len=1460 [TCP segment of a reassembled PDU]"
"379","17.786633","172.64.155.249","192.168.0.183","TCP","1514","443  >  51124 [ACK] Seq=259704 Ack=11124 Win=8 Len=1460 [TCP segment of a reassembled PDU]"
"380","17.786633","172.64.155.249","192.168.0.183","TLSv1.2","640","Application Data"
"381","17.786731","192.168.0.183","172.64.155.249","TCP","54","51124  >  443 [ACK] Seq=11124 Ack=261750 Win=514 Len=0"
"382","17.787242","172.64.155.249","192.168.0.183","TCP","1514","443  >  51124 [ACK] Seq=261750 Ack=11124 Win=8 Len=1460 [TCP segment of a reassembled PDU]"
"383","17.787242","172.64.155.249","192.168.0.183","TCP","1514","443  >  51124 [ACK] Seq=263210 Ack=11124 Win=8 Len=1460 [TCP segment of a reassembled PDU]"
"384","17.787242","172.64.155.249","192.168.0.183","TLSv1.2","1073","Application Data"
"385","17.787297","192.168.0.183","172.64.155.249","TCP","54","51124  >  443 [ACK] Seq=11124 Ack=265689 Win=514 Len=0"
"386","17.795065","172.64.155.249","192.168.0.183","TCP","1514","443  >  51124 [ACK] Seq=265689 Ack=11124 Win=8 Len=1460 [TCP segment of a reassembled PDU]"
"387","17.795065","172.64.155.249","192.168.0.183","TCP","1514","443  >  51124 [ACK] Seq=267149 Ack=11124 Win=8 Len=1460 [TCP segment of a reassembled PDU]"
"388","17.795065","172.64.155.249","192.168.0.183","TCP","1514","443  >  51124 [ACK] Seq=268609 Ack=11124 Win=8 Len=1460 [TCP segment of a reassembled PDU]"
"389","17.795065","172.64.155.249","192.168.0.183","TCP","1514","443  >  51124 [ACK] Seq=270069 Ack=11124 Win=8 Len=1460 [TCP segment of a reassembled PDU]"
"390","17.795065","172.64.155.249","192.168.0.183","TCP","1514","443  >  51124 [ACK] Seq=271529 Ack=11124 Win=8 Len=1460 [TCP segment of a reassembled PDU]"
"391","17.795065","172.64.155.249","192.168.0.183","TCP","1514","443  >  51124 [PSH, ACK] Seq=272989 Ack=11124 Win=8 Len=1460 [TCP segment of a reassembled PDU]"
"392","17.795065","172.64.155.249","192.168.0.183","TCP","1514","443  >  51124 [ACK] Seq=274449 Ack=11124 Win=8 Len=1460 [TCP segment of a reassembled PDU]"
"393","17.795065","172.64.155.249","192.168.0.183","TLSv1.2","690","Application Data"
"394","17.795132","192.168.0.183","172.64.155.249","TCP","54","51124  >  443 [ACK] Seq=11124 Ack=276545 Win=514 Len=0"
"395","17.797802","172.64.155.249","192.168.0.183","TCP","1514","443  >  51124 [ACK] Seq=276545 Ack=11124 Win=8 Len=1460 [TCP segment of a reassembled PDU]"
"396","17.797802","172.64.155.249","192.168.0.183","TCP","1514","443  >  51124 [ACK] Seq=278005 Ack=11124 Win=8 Len=1460 [TCP segment of a reassembled PDU]"
"397","17.797802","172.64.155.249","192.168.0.183","TCP","1514","443  >  51124 [ACK] Seq=279465 Ack=11124 Win=8 Len=1460 [TCP segment of a reassembled PDU]"
"398","17.797802","172.64.155.249","192.168.0.183","TLSv1.2","134","Application Data"
"399","17.797802","172.64.155.249","192.168.0.183","TCP","1514","443  >  51124 [ACK] Seq=281005 Ack=11124 Win=8 Len=1460 [TCP segment of a reassembled PDU]"
"400","17.797802","172.64.155.249","192.168.0.183","TCP","1514","443  >  51124 [ACK] Seq=282465 Ack=11124 Win=8 Len=1460 [TCP segment of a reassembled PDU]"
"401","17.797802","172.64.155.249","192.168.0.183","TCP","1514","443  >  51124 [ACK] Seq=283925 Ack=11124 Win=8 Len=1460 [TCP segment of a reassembled PDU]"
"402","17.797802","172.64.155.249","192.168.0.183","TCP","1514","443  >  51124 [ACK] Seq=285385 Ack=11124 Win=8 Len=1460 [TCP segment of a reassembled PDU]"
"403","17.797802","172.64.155.249","192.168.0.183","TCP","1514","443  >  51124 [ACK] Seq=286845 Ack=11124 Win=8 Len=1460 [TCP segment of a reassembled PDU]"
"404","17.797802","172.64.155.249","192.168.0.183","TCP","1514","443  >  51124 [PSH, ACK] Seq=288305 Ack=11124 Win=8 Len=1460 [TCP segment of a reassembled PDU]"
"405","17.797802","172.64.155.249","192.168.0.183","TLSv1.2","1017","Application Data"
"406","17.797802","172.64.155.249","192.168.0.183","TCP","1514","443  >  51124 [ACK] Seq=290728 Ack=11124 Win=8 Len=1460 [TCP segment of a reassembled PDU]"
"407","17.797906","192.168.0.183","172.64.155.249","TCP","54","51124  >  443 [ACK] Seq=11124 Ack=292188 Win=514 Len=0"
"408","17.801573","172.64.155.249","192.168.0.183","TCP","1514","443  >  51124 [ACK] Seq=292188 Ack=11124 Win=8 Len=1460 [TCP segment of a reassembled PDU]"
"409","17.801573","172.64.155.249","192.168.0.183","TCP","1514","443  >  51124 [ACK] Seq=293648 Ack=11124 Win=8 Len=1460 [TCP segment of a reassembled PDU]"
"410","17.801573","172.64.155.249","192.168.0.183","TLSv1.2","654","Application Data"
"411","17.801573","172.64.155.249","192.168.0.183","TCP","1514","443  >  51124 [ACK] Seq=295708 Ack=11124 Win=8 Len=1460 [TCP segment of a reassembled PDU]"
"412","17.801573","172.64.155.249","192.168.0.183","TCP","1514","443  >  51124 [ACK] Seq=297168 Ack=11124 Win=8 Len=1460 [TCP segment of a reassembled PDU]"
"413","17.801573","172.64.155.249","192.168.0.183","TLSv1.2","581","Application Data"
"414","17.801573","172.64.155.249","192.168.0.183","TLSv1.2","96","Application Data"
"415","17.801573","172.64.155.249","192.168.0.183","TLSv1.2","85","Application Data"
"416","17.801668","192.168.0.183","172.64.155.249","TCP","54","51124  >  443 [ACK] Seq=11124 Ack=299228 Win=514 Len=0"
"417","18.081402","192.168.0.183","172.64.155.249","TLSv1.2","259","Application Data"
"418","18.122927","172.64.155.249","192.168.0.183","TLSv1.2","668","Application Data"
"419","18.122927","172.64.155.249","192.168.0.183","TLSv1.2","203","Application Data"
"420","18.122927","172.64.155.249","192.168.0.183","TLSv1.2","85","Application Data"
"421","18.122976","192.168.0.183","172.64.155.249","TCP","54","51134  >  443 [ACK] Seq=927 Ack=3268 Win=510 Len=0"
"422","18.123863","192.168.0.183","172.64.155.249","TLSv1.2","89","Application Data"
"423","18.189486","172.64.155.249","192.168.0.183","TCP","60","443  >  51134 [ACK] Seq=3268 Ack=962 Win=8 Len=0"
"424","18.251972","192.168.0.183","172.64.155.249","TLSv1.2","266","Application Data"
"425","18.252080","192.168.0.183","172.64.155.249","TLSv1.2","182","Application Data"
"426","18.272845","172.64.155.249","192.168.0.183","TCP","60","443  >  51124 [ACK] Seq=299228 Ack=11464 Win=8 Len=0"
"427","18.302715","172.64.155.249","192.168.0.183","TLSv1.2","158","Application Data"
"428","18.302715","172.64.155.249","192.168.0.183","TLSv1.2","139","Application Data"
"429","18.302715","172.64.155.249","192.168.0.183","TLSv1.2","85","Application Data"
"430","18.302715","172.64.155.249","192.168.0.183","TLSv1.2","144","Application Data"
"431","18.302761","192.168.0.183","172.64.155.249","TCP","54","51124  >  443 [ACK] Seq=11464 Ack=299538 Win=512 Len=0"
"432","18.303715","192.168.0.183","172.64.155.249","TLSv1.2","89","Application Data"
"433","18.366708","172.64.155.249","192.168.0.183","TCP","60","443  >  51124 [ACK] Seq=299538 Ack=11499 Win=8 Len=0"
"434","18.470938","192.168.0.183","172.64.155.249","TLSv1.2","693","Application Data"
"435","18.471002","192.168.0.183","172.64.155.249","TLSv1.2","589","Application Data"
"436","18.490947","172.64.155.249","192.168.0.183","TCP","60","443  >  51124 [ACK] Seq=299538 Ack=12673 Win=8 Len=0"
"437","18.514598","172.64.155.249","192.168.0.183","TLSv1.2","277","Application Data"
"438","18.514598","172.64.155.249","192.168.0.183","TLSv1.2","85","Application Data"
"439","18.514630","192.168.0.183","172.64.155.249","TCP","54","51124  >  443 [ACK] Seq=12673 Ack=299792 Win=511 Len=0"
"440","21.785439","192.168.0.183","172.64.155.249","TLSv1.2","133","Application Data"
"441","21.785544","192.168.0.183","172.64.155.249","TLSv1.2","265","Application Data"
"442","21.801704","192.168.0.183","172.64.155.249","TLSv1.2","166","Application Data"
"443","21.812386","172.64.155.249","192.168.0.183","TCP","60","443  >  51124 [ACK] Seq=299792 Ack=12963 Win=8 Len=0"
"444","21.826479","172.64.155.249","192.168.0.183","TLSv1.2","278","Application Data"
"445","21.850733","172.64.155.249","192.168.0.183","TLSv1.2","150","Application Data"
"446","21.850733","172.64.155.249","192.168.0.183","TLSv1.2","100","Application Data"
"447","21.850733","172.64.155.249","192.168.0.183","TLSv1.2","1306","Application Data"
"448","21.850781","192.168.0.183","172.64.155.249","TCP","54","51124  >  443 [ACK] Seq=13075 Ack=301410 Win=514 Len=0"
"449","21.852144","172.64.155.249","192.168.0.183","TCP","1514","443  >  51124 [ACK] Seq=301410 Ack=13075 Win=8 Len=1460 [TCP segment of a reassembled PDU]"
"450","21.852144","172.64.155.249","192.168.0.183","TCP","1514","443  >  51124 [ACK] Seq=302870 Ack=13075 Win=8 Len=1460 [TCP segment of a reassembled PDU]"
"451","21.852144","172.64.155.249","192.168.0.183","TCP","1514","443  >  51124 [ACK] Seq=304330 Ack=13075 Win=8 Len=1460 [TCP segment of a reassembled PDU]"
"452","21.852144","172.64.155.249","192.168.0.183","TCP","1514","443  >  51124 [ACK] Seq=305790 Ack=13075 Win=8 Len=1460 [TCP segment of a reassembled PDU]"
"453","21.852144","172.64.155.249","192.168.0.183","TCP","1514","443  >  51124 [ACK] Seq=307250 Ack=13075 Win=8 Len=1460 [TCP segment of a reassembled PDU]"
"454","21.852144","172.64.155.249","192.168.0.183","TCP","1514","443  >  51124 [PSH, ACK] Seq=308710 Ack=13075 Win=8 Len=1460 [TCP segment of a reassembled PDU]"
"455","21.852144","172.64.155.249","192.168.0.183","TLSv1.2","233","Application Data"
"456","21.852217","192.168.0.183","172.64.155.249","TCP","54","51124  >  443 [ACK] Seq=13075 Ack=310349 Win=514 Len=0"
"457","21.859999","172.64.155.249","192.168.0.183","TCP","1514","443  >  51124 [ACK] Seq=310349 Ack=13075 Win=8 Len=1460 [TCP segment of a reassembled PDU]"
"458","21.859999","172.64.155.249","192.168.0.183","TLSv1.2","1039","Application Data"
"459","21.860048","192.168.0.183","172.64.155.249","TCP","54","51124  >  443 [ACK] Seq=13075 Ack=312794 Win=514 Len=0"
"460","21.862049","172.64.155.249","192.168.0.183","TCP","1514","443  >  51124 [ACK] Seq=312794 Ack=13075 Win=8 Len=1460 [TCP segment of a reassembled PDU]"
"461","21.862049","172.64.155.249","192.168.0.183","TLSv1.2","1113","Application Data"
"462","21.862049","172.64.155.249","192.168.0.183","TCP","1514","443  >  51124 [ACK] Seq=315313 Ack=13075 Win=8 Len=1460 [TCP segment of a reassembled PDU]"
"463","21.862121","192.168.0.183","172.64.155.249","TCP","54","51124  >  443 [ACK] Seq=13075 Ack=316773 Win=514 Len=0"
"464","21.863959","172.64.155.249","192.168.0.183","TCP","1514","443  >  51124 [ACK] Seq=316773 Ack=13075 Win=8 Len=1460 [TCP segment of a reassembled PDU]"
"465","21.863959","172.64.155.249","192.168.0.183","TLSv1.2","1513","Application Data"
"466","21.863959","172.64.155.249","192.168.0.183","TCP","1514","443  >  51124 [ACK] Seq=319692 Ack=13075 Win=8 Len=1460 [TCP segment of a reassembled PDU]"
"467","21.863959","172.64.155.249","192.168.0.183","TCP","1514","443  >  51124 [ACK] Seq=321152 Ack=13075 Win=8 Len=1460 [TCP segment of a reassembled PDU]"
"468","21.863959","172.64.155.249","192.168.0.183","TCP","1514","443  >  51124 [ACK] Seq=322612 Ack=13075 Win=8 Len=1460 [TCP segment of a reassembled PDU]"
"469","21.863959","172.64.155.249","192.168.0.183","TLSv1.2","106","Application Data"
"470","21.864068","192.168.0.183","172.64.155.249","TCP","54","51124  >  443 [ACK] Seq=13075 Ack=324124 Win=514 Len=0"
"471","21.865522","172.64.155.249","192.168.0.183","TCP","1514","443  >  51124 [ACK] Seq=324124 Ack=13075 Win=8 Len=1460 [TCP segment of a reassembled PDU]"
"472","21.865522","172.64.155.249","192.168.0.183","TCP","1514","443  >  51124 [ACK] Seq=325584 Ack=13075 Win=8 Len=1460 [TCP segment of a reassembled PDU]"
"473","21.865522","172.64.155.249","192.168.0.183","TCP","1514","443  >  51124 [ACK] Seq=327044 Ack=13075 Win=8 Len=1460 [TCP segment of a reassembled PDU]"
"474","21.865522","172.64.155.249","192.168.0.183","TCP","1514","443  >  51124 [ACK] Seq=328504 Ack=13075 Win=8 Len=1460 [TCP segment of a reassembled PDU]"
"475","21.865522","172.64.155.249","192.168.0.183","TCP","1514","443  >  51124 [ACK] Seq=329964 Ack=13075 Win=8 Len=1460 [TCP segment of a reassembled PDU]"
"476","21.865522","172.64.155.249","192.168.0.183","TLSv1.2","617","Application Data"
"477","21.865644","192.168.0.183","172.64.155.249","TCP","54","51124  >  443 [ACK] Seq=13075 Ack=331987 Win=514 Len=0"
"478","21.872315","172.64.155.249","192.168.0.183","TCP","1514","443  >  51124 [ACK] Seq=331987 Ack=13075 Win=8 Len=1460 [TCP segment of a reassembled PDU]"
"479","21.872315","172.64.155.249","192.168.0.183","TCP","1514","443  >  51124 [ACK] Seq=333447 Ack=13075 Win=8 Len=1460 [TCP segment of a reassembled PDU]"
"480","21.872315","172.64.155.249","192.168.0.183","TCP","1514","443  >  51124 [ACK] Seq=334907 Ack=13075 Win=8 Len=1460 [TCP segment of a reassembled PDU]"
"481","21.872315","172.64.155.249","192.168.0.183","TCP","1514","443  >  51124 [ACK] Seq=336367 Ack=13075 Win=8 Len=1460 [TCP segment of a reassembled PDU]"
"482","21.872315","172.64.155.249","192.168.0.183","TCP","1514","443  >  51124 [ACK] Seq=337827 Ack=13075 Win=8 Len=1460 [TCP segment of a reassembled PDU]"
"483","21.872315","172.64.155.249","192.168.0.183","TLSv1.2","624","Application Data"
"484","21.872315","172.64.155.249","192.168.0.183","TLSv1.2","96","Application Data"
"485","21.872315","172.64.155.249","192.168.0.183","TLSv1.2","85","Application Data"
"486","21.872386","192.168.0.183","172.64.155.249","TCP","54","51124  >  443 [ACK] Seq=13075 Ack=339930 Win=514 Len=0"
"487","21.928867","192.168.0.183","172.64.155.249","TLSv1.2","231","Application Data"
"488","21.945775","172.64.155.249","192.168.0.183","TCP","60","443  >  51134 [ACK] Seq=3268 Ack=1139 Win=8 Len=0"
"489","21.974018","172.64.155.249","192.168.0.183","TLSv1.2","473","Application Data"
"490","21.974018","172.64.155.249","192.168.0.183","TLSv1.2","203","Application Data"
"491","21.974018","172.64.155.249","192.168.0.183","TLSv1.2","85","Application Data"
"492","21.974055","192.168.0.183","172.64.155.249","TCP","54","51134  >  443 [ACK] Seq=1139 Ack=3867 Win=508 Len=0"
"493","22.105789","192.168.0.183","172.64.155.249","TLSv1.2","243","Application Data"
"494","22.143558","172.64.155.249","192.168.0.183","TLSv1.2","145","Application Data"
"495","22.190524","192.168.0.183","172.64.155.249","TCP","54","51124  >  443 [ACK] Seq=13264 Ack=340021 Win=513 Len=0"
"496","22.297297","192.168.0.183","172.64.155.249","TLSv1.2","568","Application Data"
"497","22.297369","192.168.0.183","172.64.155.249","TLSv1.2","581","Application Data"
"498","22.313280","172.64.155.249","192.168.0.183","TCP","60","443  >  51124 [ACK] Seq=340021 Ack=14305 Win=8 Len=0"
"499","22.337154","172.64.155.249","192.168.0.183","TLSv1.2","144","Application Data"
"500","22.337154","172.64.155.249","192.168.0.183","TLSv1.2","85","Application Data"
"501","22.337196","192.168.0.183","172.64.155.249","TCP","54","51124  >  443 [ACK] Seq=14305 Ack=340142 Win=513 Len=0"
"502","27.065506","192.168.0.183","172.64.155.249","TLSv1.2","133","Application Data"
"503","27.065602","192.168.0.183","172.64.155.249","TLSv1.2","176","Application Data"
"504","27.067415","192.168.0.183","172.64.155.249","TLSv1.2","133","Application Data"
"505","27.067463","192.168.0.183","172.64.155.249","TLSv1.2","183","Application Data"
"506","27.078847","172.64.155.249","192.168.0.183","TCP","60","443  >  51124 [ACK] Seq=340142 Ack=14585 Win=8 Len=0"
"507","27.102729","172.64.155.249","192.168.0.183","TLSv1.2","279","Application Data"
"508","27.104891","172.64.155.249","192.168.0.183","TLSv1.2","201","Application Data"
"509","27.104925","192.168.0.183","172.64.155.249","TCP","54","51124  >  443 [ACK] Seq=14714 Ack=340514 Win=511 Len=0"
