"No.","Time","Source","Destination","Protocol","Length","Info"
"1","0.000000","192.168.0.183","172.64.155.249","TLSv1.2","179","Application Data"
"2","0.000055","192.168.0.183","172.64.155.249","TLSv1.2","93","Application Data"
"3","0.000085","192.168.0.183","172.64.155.249","TLSv1.2","170","Application Data"
"4","0.016210","172.64.155.249","192.168.0.183","TCP","60","443  >  51124 [ACK] Seq=1 Ack=165 Win=8 Len=0"
"5","0.016210","172.64.155.249","192.168.0.183","TLSv1.2","93","Application Data"
"6","0.042027","172.64.155.249","192.168.0.183","TLSv1.2","278","Application Data"
"7","0.042097","192.168.0.183","172.64.155.249","TCP","54","51124  >  443 [ACK] Seq=281 Ack=264 Win=512 Len=0"
"8","2.958451","192.168.0.183","172.64.155.249","TLSv1.2","289","Application Data"
"9","2.993725","172.64.155.249","192.168.0.183","TLSv1.2","277","Application Data"
"10","3.034947","192.168.0.183","172.64.155.249","TCP","54","51124  >  443 [ACK] Seq=516 Ack=487 Win=511 Len=0"
"11","3.082647","192.168.0.183","172.64.155.249","TLSv1.2","963","Application Data"
"12","3.082708","192.168.0.183","172.64.155.249","TLSv1.2","553","Application Data"
"13","3.096947","172.64.155.249","192.168.0.183","TCP","60","443  >  51124 [ACK] Seq=487 Ack=1924 Win=8 Len=0"
"14","3.128375","172.64.155.249","192.168.0.183","TLSv1.2","277","Application Data"
"15","3.128375","172.64.155.249","192.168.0.183","TLSv1.2","85","Application Data"
"16","3.128418","192.168.0.183","172.64.155.249","TCP","54","51124  >  443 [ACK] Seq=1924 Ack=741 Win=510 Len=0"
"17","4.145868","192.168.0.183","172.64.155.249","TLSv1.2","157","Application Data"
"18","4.145959","192.168.0.183","172.64.155.249","TLSv1.2","229","Application Data"
"19","4.158852","192.168.0.183","172.64.155.249","TLSv1.2","132","Application Data"
"20","4.160804","172.64.155.249","192.168.0.183","TCP","60","443  >  51124 [ACK] Seq=741 Ack=2202 Win=8 Len=0"
"21","4.184075","172.64.155.249","192.168.0.183","TLSv1.2","279","Application Data"
"22","4.201305","172.64.155.249","192.168.0.183","TLSv1.2","181","Application Data"
"23","4.201305","172.64.155.249","192.168.0.183","TLSv1.2","100","Application Data"
"24","4.201305","172.64.155.249","192.168.0.183","TCP","1514","443  >  51124 [ACK] Seq=1139 Ack=2280 Win=8 Len=1460 [TCP segment of a reassembled PDU]"
"25","4.201305","172.64.155.249","192.168.0.183","TLSv1.2","1146","Application Data"
"26","4.201305","172.64.155.249","192.168.0.183","TCP","1514","443  >  51124 [ACK] Seq=3691 Ack=2280 Win=8 Len=1460 [TCP segment of a reassembled PDU]"
"27","4.201305","172.64.155.249","192.168.0.183","TLSv1.2","1089","Application Data"
"28","4.201361","192.168.0.183","172.64.155.249","TCP","54","51124  >  443 [ACK] Seq=2280 Ack=6186 Win=514 Len=0"
"29","4.202156","192.168.0.183","172.64.155.249","TLSv1.2","89","Application Data"
"30","4.202920","172.64.155.249","192.168.0.183","TCP","1514","443  >  51124 [ACK] Seq=6186 Ack=2280 Win=8 Len=1460 [TCP segment of a reassembled PDU]"
"31","4.202920","172.64.155.249","192.168.0.183","TCP","1514","443  >  51124 [ACK] Seq=7646 Ack=2280 Win=8 Len=1460 [TCP segment of a reassembled PDU]"
"32","4.202920","172.64.155.249","192.168.0.183","TLSv1.2","1015","Application Data"
"33","4.202920","172.64.155.249","192.168.0.183","TLSv1.2","789","Application Data"
"34","4.202967","192.168.0.183","172.64.155.249","TCP","54","51124  >  443 [ACK] Seq=2315 Ack=10802 Win=514 Len=0"
"35","4.212703","172.64.155.249","192.168.0.183","TCP","1514","443  >  51124 [ACK] Seq=10802 Ack=2280 Win=8 Len=1460 [TCP segment of a reassembled PDU]"
"36","4.212703","172.64.155.249","192.168.0.183","TCP","1514","443  >  51124 [ACK] Seq=12262 Ack=2280 Win=8 Len=1460 [TCP segment of a reassembled PDU]"
"37","4.212703","172.64.155.249","192.168.0.183","TLSv1.2","195","Application Data"
"38","4.212703","172.64.155.249","192.168.0.183","TLSv1.2","1512","Application Data"
"39","4.212813","192.168.0.183","172.64.155.249","TCP","54","51124  >  443 [ACK] Seq=2315 Ack=15321 Win=514 Len=0"
"40","4.217029","172.64.155.249","192.168.0.183","TCP","1514","443  >  51124 [ACK] Seq=15321 Ack=2280 Win=8 Len=1460 [TCP segment of a reassembled PDU]"
"41","4.217029","172.64.155.249","192.168.0.183","TCP","1514","443  >  51124 [ACK] Seq=16781 Ack=2280 Win=8 Len=1460 [TCP segment of a reassembled PDU]"
"42","4.217029","172.64.155.249","192.168.0.183","TCP","1514","443  >  51124 [ACK] Seq=18241 Ack=2280 Win=8 Len=1460 [TCP segment of a reassembled PDU]"
"43","4.217029","172.64.155.249","192.168.0.183","TCP","1514","443  >  51124 [ACK] Seq=19701 Ack=2280 Win=8 Len=1460 [TCP segment of a reassembled PDU]"
"44","4.217029","172.64.155.249","192.168.0.183","TLSv1.2","358","Application Data"
"45","4.217029","172.64.155.249","192.168.0.183","TLSv1.2","96","Application Data"
"46","4.217029","172.64.155.249","192.168.0.183","TLSv1.2","85","Application Data"
"47","4.217130","192.168.0.183","172.64.155.249","TCP","54","51124  >  443 [ACK] Seq=2315 Ack=21538 Win=514 Len=0"
"48","4.255282","172.64.155.249","192.168.0.183","TCP","60","443  >  51124 [ACK] Seq=21538 Ack=2315 Win=8 Len=0"
"49","4.584411","192.168.0.183","172.64.155.249","TLSv1.2","519","Application Data"
"50","4.584488","192.168.0.183","172.64.155.249","TLSv1.2","523","Application Data"
"51","4.596892","172.64.155.249","192.168.0.183","TCP","60","443  >  51124 [ACK] Seq=21538 Ack=2780 Win=8 Len=0"
"52","4.599495","172.64.155.249","192.168.0.183","TCP","60","443  >  51124 [ACK] Seq=21538 Ack=3249 Win=8 Len=0"
"53","4.627807","172.64.155.249","192.168.0.183","TLSv1.2","144","Application Data"
"54","4.627807","172.64.155.249","192.168.0.183","TLSv1.2","85","Application Data"
"55","4.627852","192.168.0.183","172.64.155.249","TCP","54","51124  >  443 [ACK] Seq=3249 Ack=21659 Win=513 Len=0"
"56","6.260989","192.168.0.183","172.64.155.249","TLSv1.2","332","Application Data"
"57","6.316139","172.64.155.249","192.168.0.183","TCP","60","443  >  51124 [ACK] Seq=21659 Ack=3527 Win=8 Len=0"
"58","6.415270","172.64.155.249","192.168.0.183","TLSv1.2","314","Application Data"
"59","6.415270","172.64.155.249","192.168.0.183","TLSv1.2","100","Application Data"
"60","6.415270","172.64.155.249","192.168.0.183","TLSv1.2","1300","Application Data"
"61","6.415270","172.64.155.249","192.168.0.183","TCP","1514","443  >  51124 [ACK] Seq=23211 Ack=3527 Win=8 Len=1460 [TCP segment of a reassembled PDU]"
"62","6.415318","192.168.0.183","172.64.155.249","TCP","54","51124  >  443 [ACK] Seq=3527 Ack=24671 Win=514 Len=0"
"63","6.416211","172.64.155.249","192.168.0.183","TCP","1514","443  >  51124 [ACK] Seq=24671 Ack=3527 Win=8 Len=1460 [TCP segment of a reassembled PDU]"
"64","6.416211","172.64.155.249","192.168.0.183","TCP","1514","443  >  51124 [ACK] Seq=26131 Ack=3527 Win=8 Len=1460 [TCP segment of a reassembled PDU]"
"65","6.416211","172.64.155.249","192.168.0.183","TLSv1.2","613","Application Data"
"66","6.416211","172.64.155.249","192.168.0.183","TCP","1514","443  >  51124 [ACK] Seq=28150 Ack=3527 Win=8 Len=1460 [TCP segment of a reassembled PDU]"
"67","6.416211","172.64.155.249","192.168.0.183","TLSv1.2","1348","Application Data"
"68","6.416243","192.168.0.183","172.64.155.249","TCP","54","51124  >  443 [ACK] Seq=3527 Ack=30904 Win=514 Len=0"
"69","6.424389","172.64.155.249","192.168.0.183","TCP","1514","443  >  51124 [ACK] Seq=30904 Ack=3527 Win=8 Len=1460 [TCP segment of a reassembled PDU]"
"70","6.424389","172.64.155.249","192.168.0.183","TLSv1.2","1062","Application Data"
"71","6.424474","192.168.0.183","172.64.155.249","TCP","54","51124  >  443 [ACK] Seq=3527 Ack=33372 Win=514 Len=0"
"72","6.426642","172.64.155.249","192.168.0.183","TCP","1514","443  >  51124 [ACK] Seq=33372 Ack=3527 Win=8 Len=1460 [TCP segment of a reassembled PDU]"
"73","6.426642","172.64.155.249","192.168.0.183","TCP","1514","443  >  51124 [ACK] Seq=34832 Ack=3527 Win=8 Len=1460 [TCP segment of a reassembled PDU]"
"74","6.426642","172.64.155.249","192.168.0.183","TLSv1.2","911","Application Data"
"75","6.426642","172.64.155.249","192.168.0.183","TCP","1514","443  >  51124 [ACK] Seq=37149 Ack=3527 Win=8 Len=1460 [TCP segment of a reassembled PDU]"
"76","6.426706","192.168.0.183","172.64.155.249","TCP","54","51124  >  443 [ACK] Seq=3527 Ack=38609 Win=514 Len=0"
"77","6.428417","172.64.155.249","192.168.0.183","TCP","1514","443  >  51124 [ACK] Seq=38609 Ack=3527 Win=8 Len=1460 [TCP segment of a reassembled PDU]"
"78","6.428417","172.64.155.249","192.168.0.183","TLSv1.2","892","Application Data"
"79","6.428477","192.168.0.183","172.64.155.249","TCP","54","51124  >  443 [ACK] Seq=3527 Ack=40907 Win=514 Len=0"
"80","6.435959","172.64.155.249","192.168.0.183","TCP","1514","443  >  51124 [ACK] Seq=40907 Ack=3527 Win=8 Len=1460 [TCP segment of a reassembled PDU]"
"81","6.435959","172.64.155.249","192.168.0.183","TCP","1514","443  >  51124 [ACK] Seq=42367 Ack=3527 Win=8 Len=1460 [TCP segment of a reassembled PDU]"
"82","6.435959","172.64.155.249","192.168.0.183","TCP","1514","443  >  51124 [ACK] Seq=43827 Ack=3527 Win=8 Len=1460 [TCP segment of a reassembled PDU]"
"83","6.435959","172.64.155.249","192.168.0.183","TCP","1514","443  >  51124 [ACK] Seq=45287 Ack=3527 Win=8 Len=1460 [TCP segment of a reassembled PDU]"
"84","6.435959","172.64.155.249","192.168.0.183","TCP","1514","443  >  51124 [ACK] Seq=46747 Ack=3527 Win=8 Len=1460 [TCP segment of a reassembled PDU]"
"85","6.435959","172.64.155.249","192.168.0.183","TCP","1514","443  >  51124 [PSH, ACK] Seq=48207 Ack=3527 Win=8 Len=1460 [TCP segment of a reassembled PDU]"
"86","6.435959","172.64.155.249","192.168.0.183","TLSv1.2","1095","Application Data"
"87","6.435959","172.64.155.249","192.168.0.183","TCP","1514","443  >  51124 [ACK] Seq=50708 Ack=3527 Win=8 Len=1460 [TCP segment of a reassembled PDU]"
"88","6.435959","172.64.155.249","192.168.0.183","TCP","1514","443  >  51124 [ACK] Seq=52168 Ack=3527 Win=8 Len=1460 [TCP segment of a reassembled PDU]"
"89","6.435959","172.64.155.249","192.168.0.183","TCP","1514","443  >  51124 [ACK] Seq=53628 Ack=3527 Win=8 Len=1460 [TCP segment of a reassembled PDU]"
"90","6.435959","172.64.155.249","192.168.0.183","TCP","1514","443  >  51124 [ACK] Seq=55088 Ack=3527 Win=8 Len=1460 [TCP segment of a reassembled PDU]"
"91","6.435959","172.64.155.249","192.168.0.183","TCP","1514","443  >  51124 [ACK] Seq=56548 Ack=3527 Win=8 Len=1460 [TCP segment of a reassembled PDU]"
"92","6.435959","172.64.155.249","192.168.0.183","TLSv1.2","967","Application Data"
"93","6.435959","172.64.155.249","192.168.0.183","TCP","1514","443  >  51124 [ACK] Seq=58921 Ack=3527 Win=8 Len=1460 [TCP segment of a reassembled PDU]"
"94","6.435959","172.64.155.249","192.168.0.183","TLSv1.2","1481","Application Data"
"95","6.436079","192.168.0.183","172.64.155.249","TCP","54","51124  >  443 [ACK] Seq=3527 Ack=61808 Win=514 Len=0"
"96","6.437916","172.64.155.249","192.168.0.183","TLSv1.2","96","Application Data"
"97","6.437916","172.64.155.249","192.168.0.183","TLSv1.2","85","Application Data"
"98","6.437961","192.168.0.183","172.64.155.249","TCP","54","51124  >  443 [ACK] Seq=3527 Ack=61881 Win=513 Len=0"
"99","6.620323","192.168.0.183","172.64.155.249","TLSv1.2","191","Application Data"
"100","6.620397","192.168.0.183","172.64.155.249","TLSv1.2","93","Application Data"
"101","6.633701","172.64.155.249","192.168.0.183","TCP","60","443  >  51134 [ACK] Seq=1 Ack=177 Win=8 Len=0"
"102","6.633701","172.64.155.249","192.168.0.183","TLSv1.2","93","Application Data"
"103","6.668882","172.64.155.249","192.168.0.183","TLSv1.2","473","Application Data"
"104","6.668882","172.64.155.249","192.168.0.183","TLSv1.2","203","Application Data"
"105","6.668882","172.64.155.249","192.168.0.183","TLSv1.2","85","Application Data"
"106","6.668954","192.168.0.183","172.64.155.249","TCP","54","51134  >  443 [ACK] Seq=177 Ack=639 Win=511 Len=0"
"107","6.670340","192.168.0.183","172.64.155.249","TLSv1.2","89","Application Data"
"108","6.725444","172.64.155.249","192.168.0.183","TCP","60","443  >  51134 [ACK] Seq=639 Ack=212 Win=8 Len=0"
"109","6.964764","192.168.0.183","172.64.155.249","TLSv1.2","556","Application Data"
"110","6.964833","192.168.0.183","172.64.155.249","TLSv1.2","540","Application Data"
"111","6.979631","172.64.155.249","192.168.0.183","TCP","60","443  >  51124 [ACK] Seq=61881 Ack=4515 Win=8 Len=0"
"112","7.008203","172.64.155.249","192.168.0.183","TLSv1.2","164","Application Data"
"113","7.008203","172.64.155.249","192.168.0.183","TLSv1.2","85","Application Data"
"114","7.008254","192.168.0.183","172.64.155.249","TCP","54","51124  >  443 [ACK] Seq=4515 Ack=62022 Win=513 Len=0"
"115","8.348984","192.168.0.183","172.64.155.249","TLSv1.2","350","Application Data"
"116","8.394016","172.64.155.249","192.168.0.183","TLSv1.2","407","Application Data"
"117","8.394016","172.64.155.249","192.168.0.183","TLSv1.2","100","Application Data"
"118","8.394016","172.64.155.249","192.168.0.183","TLSv1.2","1315","Application Data"
"119","8.394065","192.168.0.183","172.64.155.249","TCP","54","51124  >  443 [ACK] Seq=4811 Ack=63682 Win=514 Len=0"
"120","8.394891","172.64.155.249","192.168.0.183","TCP","1514","443  >  51124 [ACK] Seq=63682 Ack=4811 Win=8 Len=1460 [TCP segment of a reassembled PDU]"
"121","8.394891","172.64.155.249","192.168.0.183","TCP","1514","443  >  51124 [ACK] Seq=65142 Ack=4811 Win=8 Len=1460 [TCP segment of a reassembled PDU]"
"122","8.394891","172.64.155.249","192.168.0.183","TCP","1514","443  >  51124 [ACK] Seq=66602 Ack=4811 Win=8 Len=1460 [TCP segment of a reassembled PDU]"
"123","8.394891","172.64.155.249","192.168.0.183","TLSv1.2","660","Application Data"
"124","8.394891","172.64.155.249","192.168.0.183","TLSv1.2","1332","Application Data"
"125","8.394922","192.168.0.183","172.64.155.249","TCP","54","51124  >  443 [ACK] Seq=4811 Ack=69946 Win=514 Len=0"
"126","8.406263","172.64.155.249","192.168.0.183","TCP","1514","443  >  51124 [ACK] Seq=69946 Ack=4811 Win=8 Len=1460 [TCP segment of a reassembled PDU]"
"127","8.406263","172.64.155.249","192.168.0.183","TLSv1.2","1272","Application Data"
"128","8.406263","172.64.155.249","192.168.0.183","TLSv1.2","1329","Application Data"
"129","8.406470","192.168.0.183","172.64.155.249","TCP","54","51124  >  443 [ACK] Seq=4811 Ack=73899 Win=514 Len=0"
"130","8.406742","172.64.155.249","192.168.0.183","TCP","1514","443  >  51124 [ACK] Seq=73899 Ack=4811 Win=8 Len=1460 [TCP segment of a reassembled PDU]"
"131","8.406742","172.64.155.249","192.168.0.183","TLSv1.2","1214","Application Data"
"132","8.406810","192.168.0.183","172.64.155.249","TCP","54","51124  >  443 [ACK] Seq=4811 Ack=76519 Win=514 Len=0"
"133","8.406938","172.64.155.249","192.168.0.183","TCP","1514","443  >  51124 [ACK] Seq=76519 Ack=4811 Win=8 Len=1460 [TCP segment of a reassembled PDU]"
"134","8.406938","172.64.155.249","192.168.0.183","TCP","1514","443  >  51124 [ACK] Seq=77979 Ack=4811 Win=8 Len=1460 [TCP segment of a reassembled PDU]"
"135","8.406938","172.64.155.249","192.168.0.183","TCP","1514","443  >  51124 [ACK] Seq=79439 Ack=4811 Win=8 Len=1460 [TCP segment of a reassembled PDU]"
"136","8.406938","172.64.155.249","192.168.0.183","TLSv1.2","608","Application Data"
"137","8.406938","172.64.155.249","192.168.0.183","TCP","1514","443  >  51124 [ACK] Seq=81453 Ack=4811 Win=8 Len=1460 [TCP segment of a reassembled PDU]"
"138","8.406938","172.64.155.249","192.168.0.183","TCP","1514","443  >  51124 [ACK] Seq=82913 Ack=4811 Win=8 Len=1460 [TCP segment of a reassembled PDU]"
"139","8.406938","172.64.155.249","192.168.0.183","TLSv1.2","1002","Application Data"
"140","8.407037","192.168.0.183","172.64.155.249","TCP","54","51124  >  443 [ACK] Seq=4811 Ack=85321 Win=514 Len=0"
"141","8.408669","172.64.155.249","192.168.0.183","TCP","1514","443  >  51124 [ACK] Seq=85321 Ack=4811 Win=8 Len=1460 [TCP segment of a reassembled PDU]"
"142","8.408669","172.64.155.249","192.168.0.183","TCP","1514","443  >  51124 [ACK] Seq=86781 Ack=4811 Win=8 Len=1460 [TCP segment of a reassembled PDU]"
"143","8.408669","172.64.155.249","192.168.0.183","TLSv1.2","1001","Application Data"
"144","8.408781","192.168.0.183","172.64.155.249","TCP","54","51124  >  443 [ACK] Seq=4811 Ack=89188 Win=514 Len=0"
"145","8.415439","172.64.155.249","192.168.0.183","TCP","1514","443  >  51124 [ACK] Seq=89188 Ack=4811 Win=8 Len=1460 [TCP segment of a reassembled PDU]"
"146","8.415439","172.64.155.249","192.168.0.183","TCP","1514","443  >  51124 [ACK] Seq=90648 Ack=4811 Win=8 Len=1460 [TCP segment of a reassembled PDU]"
"147","8.415439","172.64.155.249","192.168.0.183","TLSv1.2","974","Application Data"
"148","8.415439","172.64.155.249","192.168.0.183","TCP","1514","443  >  51124 [ACK] Seq=93028 Ack=4811 Win=8 Len=1460 [TCP segment of a reassembled PDU]"
"149","8.415439","172.64.155.249","192.168.0.183","TCP","1514","443  >  51124 [ACK] Seq=94488 Ack=4811 Win=8 Len=1460 [TCP segment of a reassembled PDU]"
"150","8.415439","172.64.155.249","192.168.0.183","TCP","1514","443  >  51124 [ACK] Seq=95948 Ack=4811 Win=8 Len=1460 [TCP segment of a reassembled PDU]"
"151","8.415439","172.64.155.249","192.168.0.183","TLSv1.2","194","Application Data"
"152","8.415439","172.64.155.249","192.168.0.183","TCP","1514","443  >  51124 [ACK] Seq=97548 Ack=4811 Win=8 Len=1460 [TCP segment of a reassembled PDU]"
"153","8.415439","172.64.155.249","192.168.0.183","TLSv1.2","1110","Application Data"
"154","8.415543","192.168.0.183","172.64.155.249","TCP","54","51124  >  443 [ACK] Seq=4811 Ack=100064 Win=514 Len=0"
"155","8.416913","172.64.155.249","192.168.0.183","TLSv1.2","1510","Application Data"
"156","8.416913","172.64.155.249","192.168.0.183","TLSv1.2","85","Application Data"
"157","8.416951","192.168.0.183","172.64.155.249","TCP","54","51124  >  443 [ACK] Seq=4811 Ack=101551 Win=514 Len=0"
"158","8.519129","192.168.0.183","172.64.155.249","TLSv1.2","220","Application Data"
"159","8.529980","172.64.155.249","192.168.0.183","TCP","60","443  >  51134 [ACK] Seq=639 Ack=378 Win=8 Len=0"
"160","8.555829","172.64.155.249","192.168.0.183","TLSv1.2","474","Application Data"
"161","8.555829","172.64.155.249","192.168.0.183","TLSv1.2","203","Application Data"
"162","8.555829","172.64.155.249","192.168.0.183","TLSv1.2","85","Application Data"
"163","8.555877","192.168.0.183","172.64.155.249","TCP","54","51134  >  443 [ACK] Seq=378 Ack=1239 Win=509 Len=0"
"164","8.643461","192.168.0.183","172.64.155.249","TLSv1.2","619","Application Data"
"165","8.681749","172.64.155.249","192.168.0.183","TLSv1.2","173","Application Data"
"166","8.733830","192.168.0.183","172.64.155.249","TCP","54","51124  >  443 [ACK] Seq=5376 Ack=101670 Win=513 Len=0"
"167","8.889388","192.168.0.183","172.64.155.249","TLSv1.2","514","Application Data"
"168","8.889472","192.168.0.183","172.64.155.249","TLSv1.2","580","Application Data"
"169","8.903486","172.64.155.249","192.168.0.183","TCP","60","443  >  51124 [ACK] Seq=101670 Ack=6362 Win=8 Len=0"
"170","8.925444","172.64.155.249","192.168.0.183","TLSv1.2","144","Application Data"
"171","8.925444","172.64.155.249","192.168.0.183","TLSv1.2","85","Application Data"
"172","8.925485","192.168.0.183","172.64.155.249","TCP","54","51124  >  443 [ACK] Seq=6362 Ack=101791 Win=513 Len=0"
"173","14.318810","192.168.0.183","172.64.155.249","TLSv1.2","190","Application Data"
"174","14.318970","192.168.0.183","172.64.155.249","TLSv1.2","273","Application Data"
"175","14.333437","192.168.0.183","172.64.155.249","TLSv1.2","182","Application Data"
"176","14.333516","172.64.155.249","192.168.0.183","TCP","60","443  >  51124 [ACK] Seq=101791 Ack=6717 Win=8 Len=0"
"177","14.360349","172.64.155.249","192.168.0.183","TLSv1.2","286","Application Data"
"178","14.411859","192.168.0.183","172.64.155.249","TCP","54","51124  >  443 [ACK] Seq=6845 Ack=102023 Win=512 Len=0"
"179","14.750178","172.64.155.249","192.168.0.183","TLSv1.2","152","Application Data"
"180","14.750178","172.64.155.249","192.168.0.183","TLSv1.2","100","Application Data"
"181","14.750217","192.168.0.183","172.64.155.249","TCP","54","51124  >  443 [ACK] Seq=6845 Ack=102167 Win=511 Len=0"
"182","14.751160","192.168.0.183","172.64.155.249","TLSv1.2","89","Application Data"
"183","14.753266","172.64.155.249","192.168.0.183","TLSv1.2","1308","Application Data"
"184","14.753266","172.64.155.249","192.168.0.183","TCP","1514","443  >  51124 [ACK] Seq=103421 Ack=6845 Win=8 Len=1460 [TCP segment of a reassembled PDU]"
"185","14.753266","172.64.155.249","192.168.0.183","TCP","1514","443  >  51124 [ACK] Seq=104881 Ack=6845 Win=8 Len=1460 [TCP segment of a reassembled PDU]"
"186","14.753266","172.64.155.249","192.168.0.183","TCP","1514","443  >  51124 [ACK] Seq=106341 Ack=6845 Win=8 Len=1460 [TCP segment of a reassembled PDU]"
"187","14.753266","172.64.155.249","192.168.0.183","TLSv1.2","673","Application Data"
"188","14.753266","172.64.155.249","192.168.0.183","TCP","1514","443  >  51124 [ACK] Seq=108420 Ack=6845 Win=8 Len=1460 [TCP segment of a reassembled PDU]"
"189","14.753379","192.168.0.183","172.64.155.249","TCP","54","51124  >  443 [ACK] Seq=6880 Ack=109880 Win=514 Len=0"
"190","14.755088","172.64.155.249","192.168.0.183","TCP","1514","443  >  51124 [ACK] Seq=109880 Ack=6845 Win=8 Len=1460 [TCP segment of a reassembled PDU]"
"191","14.755088","172.64.155.249","192.168.0.183","TLSv1.2","758","Application Data"
"192","14.755220","192.168.0.183","172.64.155.249","TCP","54","51124  >  443 [ACK] Seq=6880 Ack=112044 Win=514 Len=0"
"193","14.760544","172.64.155.249","192.168.0.183","TCP","1514","443  >  51124 [ACK] Seq=112044 Ack=6845 Win=8 Len=1460 [TCP segment of a reassembled PDU]"
"194","14.760544","172.64.155.249","192.168.0.183","TLSv1.2","1289","Application Data"
"195","14.760612","192.168.0.183","172.64.155.249","TCP","54","51124  >  443 [ACK] Seq=6880 Ack=114739 Win=514 Len=0"
"196","14.767103","172.64.155.249","192.168.0.183","TCP","1514","443  >  51124 [ACK] Seq=114739 Ack=6880 Win=8 Len=1460 [TCP segment of a reassembled PDU]"
"197","14.767103","172.64.155.249","192.168.0.183","TCP","1514","443  >  51124 [ACK] Seq=116199 Ack=6880 Win=8 Len=1460 [TCP segment of a reassembled PDU]"
"198","14.767103","172.64.155.249","192.168.0.183","TCP","1514","443  >  51124 [ACK] Seq=117659 Ack=6880 Win=8 Len=1460 [TCP segment of a reassembled PDU]"
"199","14.767103","172.64.155.249","192.168.0.183","TCP","1514","443  >  51124 [ACK] Seq=119119 Ack=6880 Win=8 Len=1460 [TCP segment of a reassembled PDU]"
"200","14.767103","172.64.155.249","192.168.0.183","TLSv1.2","202","Application Data"
"201","14.767103","172.64.155.249","192.168.0.183","TCP","1514","443  >  51124 [ACK] Seq=120727 Ack=6880 Win=8 Len=1460 [TCP segment of a reassembled PDU]"
"202","14.767103","172.64.155.249","192.168.0.183","TCP","1514","443  >  51124 [ACK] Seq=122187 Ack=6880 Win=8 Len=1460 [TCP segment of a reassembled PDU]"
"203","14.767103","172.64.155.249","192.168.0.183","TLSv1.2","1284","Application Data"
"204","14.767190","192.168.0.183","172.64.155.249","TCP","54","51124  >  443 [ACK] Seq=6880 Ack=124877 Win=514 Len=0"
"205","14.770062","172.64.155.249","192.168.0.183","TCP","1514","443  >  51124 [ACK] Seq=124877 Ack=6880 Win=8 Len=1460 [TCP segment of a reassembled PDU]"
"206","14.770062","172.64.155.249","192.168.0.183","TCP","1514","443  >  51124 [ACK] Seq=126337 Ack=6880 Win=8 Len=1460 [TCP segment of a reassembled PDU]"
"207","14.770062","172.64.155.249","192.168.0.183","TCP","1514","443  >  51124 [ACK] Seq=127797 Ack=6880 Win=8 Len=1460 [TCP segment of a reassembled PDU]"
"208","14.770062","172.64.155.249","192.168.0.183","TCP","1514","443  >  51124 [ACK] Seq=129257 Ack=6880 Win=8 Len=1460 [TCP segment of a reassembled PDU]"
"209","14.770062","172.64.155.249","192.168.0.183","TCP","1514","443  >  51124 [ACK] Seq=130717 Ack=6880 Win=8 Len=1460 [TCP segment of a reassembled PDU]"
"210","14.770062","172.64.155.249","192.168.0.183","TCP","1514","443  >  51124 [PSH, ACK] Seq=132177 Ack=6880 Win=8 Len=1460 [TCP segment of a reassembled PDU]"
"211","14.770062","172.64.155.249","192.168.0.183","TCP","1514","443  >  51124 [ACK] Seq=133637 Ack=6880 Win=8 Len=1460 [TCP segment of a reassembled PDU]"
"212","14.770062","172.64.155.249","192.168.0.183","TLSv1.2","490","Application Data"
"213","14.770134","192.168.0.183","172.64.155.249","TCP","54","51124  >  443 [ACK] Seq=6880 Ack=135533 Win=514 Len=0"
"214","14.772276","172.64.155.249","192.168.0.183","TCP","1514","443  >  51124 [ACK] Seq=135533 Ack=6880 Win=8 Len=1460 [TCP segment of a reassembled PDU]"
"215","14.772276","172.64.155.249","192.168.0.183","TCP","1514","443  >  51124 [ACK] Seq=136993 Ack=6880 Win=8 Len=1460 [TCP segment of a reassembled PDU]"
"216","14.772276","172.64.155.249","192.168.0.183","TLSv1.2","767","Application Data"
"217","14.772408","192.168.0.183","172.64.155.249","TCP","54","51124  >  443 [ACK] Seq=6880 Ack=139166 Win=514 Len=0"
"218","14.775762","172.64.155.249","192.168.0.183","TCP","1514","443  >  51124 [ACK] Seq=139166 Ack=6880 Win=8 Len=1460 [TCP segment of a reassembled PDU]"
"219","14.775762","172.64.155.249","192.168.0.183","TCP","1514","443  >  51124 [ACK] Seq=140626 Ack=6880 Win=8 Len=1460 [TCP segment of a reassembled PDU]"
"220","14.775762","172.64.155.249","192.168.0.183","TLSv1.2","891","Application Data"
"221","14.775762","172.64.155.249","192.168.0.183","TCP","1514","443  >  51124 [ACK] Seq=142923 Ack=6880 Win=8 Len=1460 [TCP segment of a reassembled PDU]"
"222","14.775889","192.168.0.183","172.64.155.249","TCP","54","51124  >  443 [ACK] Seq=6880 Ack=144383 Win=514 Len=0"
"223","14.777597","172.64.155.249","192.168.0.183","TCP","1514","443  >  51124 [ACK] Seq=144383 Ack=6880 Win=8 Len=1460 [TCP segment of a reassembled PDU]"
"224","14.777597","172.64.155.249","192.168.0.183","TCP","1514","443  >  51124 [ACK] Seq=145843 Ack=6880 Win=8 Len=1460 [TCP segment of a reassembled PDU]"
"225","14.777597","172.64.155.249","192.168.0.183","TLSv1.2","188","Application Data"
"226","14.777597","172.64.155.249","192.168.0.183","TCP","1514","443  >  51124 [ACK] Seq=147437 Ack=6880 Win=8 Len=1460 [TCP segment of a reassembled PDU]"
"227","14.777647","192.168.0.183","172.64.155.249","TCP","54","51124  >  443 [ACK] Seq=6880 Ack=148897 Win=514 Len=0"
"228","14.779652","172.64.155.249","192.168.0.183","TCP","1514","443  >  51124 [ACK] Seq=148897 Ack=6880 Win=8 Len=1460 [TCP segment of a reassembled PDU]"
"229","14.779652","172.64.155.249","192.168.0.183","TCP","1514","443  >  51124 [ACK] Seq=150357 Ack=6880 Win=8 Len=1460 [TCP segment of a reassembled PDU]"
"230","14.779652","172.64.155.249","192.168.0.183","TCP","1514","443  >  51124 [ACK] Seq=151817 Ack=6880 Win=8 Len=1460 [TCP segment of a reassembled PDU]"
"231","14.779652","172.64.155.249","192.168.0.183","TLSv1.2","1010","Application Data"
"232","14.779679","192.168.0.183","172.64.155.249","TCP","54","51124  >  443 [ACK] Seq=6880 Ack=154233 Win=514 Len=0"
"233","14.785148","172.64.155.249","192.168.0.183","TCP","1514","443  >  51124 [ACK] Seq=154233 Ack=6880 Win=8 Len=1460 [TCP segment of a reassembled PDU]"
"234","14.785148","172.64.155.249","192.168.0.183","TCP","1514","443  >  51124 [ACK] Seq=155693 Ack=6880 Win=8 Len=1460 [TCP segment of a reassembled PDU]"
"235","14.785148","172.64.155.249","192.168.0.183","TCP","1514","443  >  51124 [ACK] Seq=157153 Ack=6880 Win=8 Len=1460 [TCP segment of a reassembled PDU]"
"236","14.785148","172.64.155.249","192.168.0.183","TCP","1514","443  >  51124 [ACK] Seq=158613 Ack=6880 Win=8 Len=1460 [TCP segment of a reassembled PDU]"
"237","14.785148","172.64.155.249","192.168.0.183","TCP","1514","443  >  51124 [ACK] Seq=160073 Ack=6880 Win=8 Len=1460 [TCP segment of a reassembled PDU]"
"238","14.785148","172.64.155.249","192.168.0.183","TCP","1514","443  >  51124 [PSH, ACK] Seq=161533 Ack=6880 Win=8 Len=1460 [TCP segment of a reassembled PDU]"
"239","14.785148","172.64.155.249","192.168.0.183","TCP","1514","443  >  51124 [ACK] Seq=162993 Ack=6880 Win=8 Len=1460 [TCP segment of a reassembled PDU]"
"240","14.785148","172.64.155.249","192.168.0.183","TLSv1.2","1198","Application Data"
"241","14.785148","172.64.155.249","192.168.0.183","TCP","1514","443  >  51124 [ACK] Seq=165597 Ack=6880 Win=8 Len=1460 [TCP segment of a reassembled PDU]"
"242","14.785148","172.64.155.249","192.168.0.183","TCP","1514","443  >  51124 [ACK] Seq=167057 Ack=6880 Win=8 Len=1460 [TCP segment of a reassembled PDU]"
"243","14.785148","172.64.155.249","192.168.0.183","TLSv1.2","642","Application Data"
"244","14.785259","192.168.0.183","172.64.155.249","TCP","54","51124  >  443 [ACK] Seq=6880 Ack=169105 Win=514 Len=0"
"245","14.786063","172.64.155.249","192.168.0.183","TCP","1514","443  >  51124 [ACK] Seq=169105 Ack=6880 Win=8 Len=1460 [TCP segment of a reassembled PDU]"
"246","14.786063","172.64.155.249","192.168.0.183","TCP","1514","443  >  51124 [ACK] Seq=170565 Ack=6880 Win=8 Len=1460 [TCP segment of a reassembled PDU]"
"247","14.786063","172.64.155.249","192.168.0.183","TCP","1514","443  >  51124 [ACK] Seq=172025 Ack=6880 Win=8 Len=1460 [TCP segment of a reassembled PDU]"
"248","14.786063","172.64.155.249","192.168.0.183","TLSv1.2","568","Application Data"
"249","14.786063","172.64.155.249","192.168.0.183","TCP","1514","443  >  51124 [ACK] Seq=173999 Ack=6880 Win=8 Len=1460 [TCP segment of a reassembled PDU]"
"250","14.786063","172.64.155.249","192.168.0.183","TCP","1514","443  >  51124 [ACK] Seq=175459 Ack=6880 Win=8 Len=1460 [TCP segment of a reassembled PDU]"
"251","14.786063","172.64.155.249","192.168.0.183","TLSv1.2","1176","Application Data"
"252","14.786104","192.168.0.183","172.64.155.249","TCP","54","51124  >  443 [ACK] Seq=6880 Ack=178041 Win=514 Len=0"
"253","14.788650","172.64.155.249","192.168.0.183","TCP","1514","443  >  51124 [ACK] Seq=178041 Ack=6880 Win=8 Len=1460 [TCP segment of a reassembled PDU]"
"254","14.788650","172.64.155.249","192.168.0.183","TCP","1514","443  >  51124 [ACK] Seq=179501 Ack=6880 Win=8 Len=1460 [TCP segment of a reassembled PDU]"
"255","14.788650","172.64.155.249","192.168.0.183","TLSv1.2","1020","Application Data"
"256","14.788650","172.64.155.249","192.168.0.183","TCP","1514","443  >  51124 [ACK] Seq=181927 Ack=6880 Win=8 Len=1460 [TCP segment of a reassembled PDU]"
"257","14.788650","172.64.155.249","192.168.0.183","TCP","1514","443  >  51124 [ACK] Seq=183387 Ack=6880 Win=8 Len=1460 [TCP segment of a reassembled PDU]"
"258","14.788650","172.64.155.249","192.168.0.183","TCP","1514","443  >  51124 [ACK] Seq=184847 Ack=6880 Win=8 Len=1460 [TCP segment of a reassembled PDU]"
"259","14.788650","172.64.155.249","192.168.0.183","TLSv1.2","943","Application Data"
"260","14.788650","172.64.155.249","192.168.0.183","TCP","1514","443  >  51124 [ACK] Seq=187196 Ack=6880 Win=8 Len=1460 [TCP segment of a reassembled PDU]"
"261","14.788650","172.64.155.249","192.168.0.183","TCP","1514","443  >  51124 [ACK] Seq=188656 Ack=6880 Win=8 Len=1460 [TCP segment of a reassembled PDU]"
"262","14.788650","172.64.155.249","192.168.0.183","TCP","1514","443  >  51124 [ACK] Seq=190116 Ack=6880 Win=8 Len=1460 [TCP segment of a reassembled PDU]"
"263","14.788650","172.64.155.249","192.168.0.183","TLSv1.2","594","Application Data"
"264","14.788792","192.168.0.183","172.64.155.249","TCP","54","51124  >  443 [ACK] Seq=6880 Ack=192116 Win=514 Len=0"
"265","14.791265","172.64.155.249","192.168.0.183","TCP","1514","443  >  51124 [ACK] Seq=192116 Ack=6880 Win=8 Len=1460 [TCP segment of a reassembled PDU]"
"266","14.791265","172.64.155.249","192.168.0.183","TCP","1514","443  >  51124 [ACK] Seq=193576 Ack=6880 Win=8 Len=1460 [TCP segment of a reassembled PDU]"
"267","14.791265","172.64.155.249","192.168.0.183","TCP","1514","443  >  51124 [ACK] Seq=195036 Ack=6880 Win=8 Len=1460 [TCP segment of a reassembled PDU]"
"268","14.791265","172.64.155.249","192.168.0.183","TLSv1.2","90","Application Data"
"269","14.791265","172.64.155.249","192.168.0.183","TLSv1.2","96","Application Data"
"270","14.791265","172.64.155.249","192.168.0.183","TLSv1.2","85","Application Data"
"271","14.791369","192.168.0.183","172.64.155.249","TCP","54","51124  >  443 [ACK] Seq=6880 Ack=196605 Win=514 Len=0"
"272","15.064273","192.168.0.183","172.64.155.249","TLSv1.2","238","Application Data"
"273","15.111571","172.64.155.249","192.168.0.183","TLSv1.2","474","Application Data"
"274","15.111571","172.64.155.249","192.168.0.183","TLSv1.2","203","Application Data"
"275","15.111571","172.64.155.249","192.168.0.183","TLSv1.2","85","Application Data"
"276","15.111616","192.168.0.183","172.64.155.249","TCP","54","51134  >  443 [ACK] Seq=562 Ack=1839 Win=514 Len=0"
"277","15.112353","192.168.0.183","172.64.155.249","TLSv1.2","89","Application Data"
"278","15.166955","172.64.155.249","192.168.0.183","TCP","60","443  >  51134 [ACK] Seq=1839 Ack=597 Win=8 Len=0"
"279","15.487637","192.168.0.183","172.64.155.249","TLSv1.2","300","Application Data"
"280","15.526992","172.64.155.249","192.168.0.183","TLSv1.2","277","Application Data"
"281","15.581828","192.168.0.183","172.64.155.249","TCP","54","51124  >  443 [ACK] Seq=7126 Ack=196828 Win=513 Len=0"
"282","16.143103","192.168.0.183","172.64.155.249","TLSv1.2","490","Application Data"
"283","16.143172","192.168.0.183","172.64.155.249","TLSv1.2","594","Application Data"
"284","16.156546","172.64.155.249","192.168.0.183","TCP","60","443  >  51124 [ACK] Seq=196828 Ack=8102 Win=8 Len=0"
"285","16.181582","172.64.155.249","192.168.0.183","TLSv1.2","277","Application Data"
"286","16.181582","172.64.155.249","192.168.0.183","TLSv1.2","85","Application Data"
"287","16.181610","192.168.0.183","172.64.155.249","TCP","54","51124  >  443 [ACK] Seq=8102 Ack=197082 Win=512 Len=0"
"288","34.840506","192.168.0.183","172.64.155.249","TLSv1.2","386","Application Data"
"289","34.840535","192.168.0.183","172.64.155.249","TLSv1.2","93","Application Data"
"290","34.858631","172.64.155.249","192.168.0.183","TCP","60","443  >  51124 [ACK] Seq=197082 Ack=8473 Win=8 Len=0"
"291","34.858631","172.64.155.249","192.168.0.183","TLSv1.2","93","Application Data"
"292","34.905317","172.64.155.249","192.168.0.183","TLSv1.2","297","Application Data"
"293","34.905317","172.64.155.249","192.168.0.183","TLSv1.2","100","Application Data"
"294","34.905317","172.64.155.249","192.168.0.183","TLSv1.2","1280","Application Data"
"295","34.905317","172.64.155.249","192.168.0.183","TCP","1514","443  >  51124 [ACK] Seq=198636 Ack=8473 Win=8 Len=1460 [TCP segment of a reassembled PDU]"
"296","34.905317","172.64.155.249","192.168.0.183","TCP","1514","443  >  51124 [ACK] Seq=200096 Ack=8473 Win=8 Len=1460 [TCP segment of a reassembled PDU]"
"297","34.905317","172.64.155.249","192.168.0.183","TCP","1514","443  >  51124 [ACK] Seq=201556 Ack=8473 Win=8 Len=1460 [TCP segment of a reassembled PDU]"
"298","34.905317","172.64.155.249","192.168.0.183","TLSv1.2","572","Application Data"
"299","34.905373","192.168.0.183","172.64.155.249","TCP","54","51124  >  443 [ACK] Seq=8473 Ack=203534 Win=514 Len=0"
"300","34.905511","172.64.155.249","192.168.0.183","TCP","1514","443  >  51124 [ACK] Seq=203534 Ack=8473 Win=8 Len=1460 [TCP segment of a reassembled PDU]"
"301","34.905511","172.64.155.249","192.168.0.183","TLSv1.2","927","Application Data"
"302","34.905532","192.168.0.183","172.64.155.249","TCP","54","51124  >  443 [ACK] Seq=8473 Ack=205867 Win=514 Len=0"
"303","34.907162","192.168.0.183","172.64.155.249","TLSv1.2","89","Application Data"
"304","34.912843","172.64.155.249","192.168.0.183","TCP","1514","443  >  51124 [ACK] Seq=205867 Ack=8473 Win=8 Len=1460 [TCP segment of a reassembled PDU]"
"305","34.912937","192.168.0.183","172.64.155.249","TCP","54","51124  >  443 [ACK] Seq=8508 Ack=207327 Win=514 Len=0"
"306","34.914757","172.64.155.249","192.168.0.183","TLSv1.2","1334","Application Data"
"307","34.914757","172.64.155.249","192.168.0.183","TCP","1514","443  >  51124 [ACK] Seq=208607 Ack=8473 Win=8 Len=1460 [TCP segment of a reassembled PDU]"
"308","34.914757","172.64.155.249","192.168.0.183","TLSv1.2","60","Application Data"
"309","34.914757","172.64.155.249","192.168.0.183","TCP","1514","443  >  51124 [ACK] Seq=210072 Ack=8473 Win=8 Len=1460 [TCP segment of a reassembled PDU]"
"310","34.914834","192.168.0.183","172.64.155.249","TCP","54","51124  >  443 [ACK] Seq=8508 Ack=211532 Win=514 Len=0"
"311","34.915808","172.64.155.249","192.168.0.183","TCP","1514","443  >  51124 [ACK] Seq=211532 Ack=8473 Win=8 Len=1460 [TCP segment of a reassembled PDU]"
"312","34.915808","172.64.155.249","192.168.0.183","TCP","1514","443  >  51124 [ACK] Seq=212992 Ack=8473 Win=8 Len=1460 [TCP segment of a reassembled PDU]"
"313","34.915808","172.64.155.249","192.168.0.183","TLSv1.2","449","Application Data"
"314","34.915808","172.64.155.249","192.168.0.183","TCP","1514","443  >  51124 [ACK] Seq=214847 Ack=8473 Win=8 Len=1460 [TCP segment of a reassembled PDU]"
"315","34.915808","172.64.155.249","192.168.0.183","TCP","1514","443  >  51124 [ACK] Seq=216307 Ack=8473 Win=8 Len=1460 [TCP segment of a reassembled PDU]"
"316","34.915808","172.64.155.249","192.168.0.183","TCP","1514","443  >  51124 [ACK] Seq=217767 Ack=8473 Win=8 Len=1460 [TCP segment of a reassembled PDU]"
"317","34.915808","172.64.155.249","192.168.0.183","TLSv1.2","83","Application Data"
"318","34.916066","192.168.0.183","172.64.155.249","TCP","54","51124  >  443 [ACK] Seq=8508 Ack=219256 Win=514 Len=0"
"319","34.917096","172.64.155.249","192.168.0.183","TLSv1.2","96","Application Data"
"320","34.917096","172.64.155.249","192.168.0.183","TLSv1.2","85","Application Data"
"321","34.917170","192.168.0.183","172.64.155.249","TCP","54","51124  >  443 [ACK] Seq=8508 Ack=219329 Win=513 Len=0"
"322","34.963994","172.64.155.249","192.168.0.183","TCP","60","443  >  51124 [ACK] Seq=219329 Ack=8508 Win=8 Len=0"
"323","35.187103","192.168.0.183","172.64.155.249","TLSv1.2","264","Application Data"
"324","35.204388","172.64.155.249","192.168.0.183","TCP","60","443  >  51124 [ACK] Seq=219329 Ack=8718 Win=8 Len=0"
"325","35.230061","172.64.155.249","192.168.0.183","TLSv1.2","278","Application Data"
"326","35.281258","192.168.0.183","172.64.155.249","TCP","54","51124  >  443 [ACK] Seq=8718 Ack=219553 Win=512 Len=0"
"327","35.321902","192.168.0.183","172.64.155.249","TLSv1.2","1011","Application Data"
"328","35.321968","192.168.0.183","172.64.155.249","TLSv1.2","545","Application Data"
"329","35.335796","172.64.155.249","192.168.0.183","TCP","60","443  >  51124 [ACK] Seq=219553 Ack=10166 Win=8 Len=0"
"330","35.357899","172.64.155.249","192.168.0.183","TLSv1.2","144","Application Data"
"331","35.357899","172.64.155.249","192.168.0.183","TLSv1.2","85","Application Data"
"332","35.357948","192.168.0.183","172.64.155.249","TCP","54","51124  >  443 [ACK] Seq=10166 Ack=219674 Win=512 Len=0"
"333","36.946665","192.168.0.183","172.64.155.249","TLSv1.2","222","Application Data"
"334","36.983001","172.64.155.249","192.168.0.183","TLSv1.2","351","Application Data"
"335","36.983001","172.64.155.249","192.168.0.183","TLSv1.2","100","Application Data"
"336","36.983001","172.64.155.249","192.168.0.183","TCP","1514","443  >  51124 [ACK] Seq=220017 Ack=10334 Win=8 Len=1460 [TCP segment of a reassembled PDU]"
"337","36.983001","172.64.155.249","192.168.0.183","TLSv1.2","217","Application Data"
"338","36.983001","172.64.155.249","192.168.0.183","TLSv1.2","95","Application Data"
"339","36.983001","172.64.155.249","192.168.0.183","TLSv1.2","85","Application Data"
"340","36.983043","192.168.0.183","172.64.155.249","TCP","54","51124  >  443 [ACK] Seq=10334 Ack=221712 Win=514 Len=0"
"341","37.179613","192.168.0.183","172.64.155.249","TLSv1.2","193","Application Data"
"342","37.179679","192.168.0.183","172.64.155.249","TLSv1.2","170","Application Data"
"343","37.191204","192.168.0.183","172.64.155.249","TLSv1.2","155","Application Data"
"344","37.193089","172.64.155.249","192.168.0.183","TCP","60","443  >  51124 [ACK] Seq=221712 Ack=10589 Win=8 Len=0"
"345","37.215984","172.64.155.249","192.168.0.183","TLSv1.2","456","Application Data"
"346","37.268742","192.168.0.183","172.64.155.249","TCP","54","51124  >  443 [ACK] Seq=10690 Ack=222114 Win=512 Len=0"
"347","37.361015","172.64.155.249","192.168.0.183","TLSv1.2","146","Application Data"
"348","37.361015","172.64.155.249","192.168.0.183","TLSv1.2","100","Application Data"
"349","37.361015","172.64.155.249","192.168.0.183","TLSv1.2","1318","Application Data"
"350","37.361015","172.64.155.249","192.168.0.183","TCP","1514","443  >  51124 [ACK] Seq=223516 Ack=10690 Win=8 Len=1460 [TCP segment of a reassembled PDU]"
"351","37.361079","192.168.0.183","172.64.155.249","TCP","54","51124  >  443 [ACK] Seq=10690 Ack=224976 Win=514 Len=0"
"352","37.363152","172.64.155.249","192.168.0.183","TCP","1514","443  >  51124 [ACK] Seq=224976 Ack=10690 Win=8 Len=1460 [TCP segment of a reassembled PDU]"
"353","37.363152","172.64.155.249","192.168.0.183","TCP","1514","443  >  51124 [ACK] Seq=226436 Ack=10690 Win=8 Len=1460 [TCP segment of a reassembled PDU]"
"354","37.363152","172.64.155.249","192.168.0.183","TCP","1514","443  >  51124 [ACK] Seq=227896 Ack=10690 Win=8 Len=1460 [TCP segment of a reassembled PDU]"
"355","37.363152","172.64.155.249","192.168.0.183","TCP","1514","443  >  51124 [ACK] Seq=229356 Ack=10690 Win=8 Len=1460 [TCP segment of a reassembled PDU]"
"356","37.363152","172.64.155.249","192.168.0.183","TCP","1514","443  >  51124 [PSH, ACK] Seq=230816 Ack=10690 Win=8 Len=1460 [TCP segment of a reassembled PDU]"
"357","37.363152","172.64.155.249","192.168.0.183","TLSv1.2","1103","Application Data"
"358","37.363199","192.168.0.183","172.64.155.249","TCP","54","51124  >  443 [ACK] Seq=10690 Ack=233325 Win=514 Len=0"
"359","37.378949","172.64.155.249","192.168.0.183","TCP","1514","443  >  51124 [ACK] Seq=233325 Ack=10690 Win=8 Len=1460 [TCP segment of a reassembled PDU]"
"360","37.378949","172.64.155.249","192.168.0.183","TLSv1.2","324","Application Data"
"361","37.378949","172.64.155.249","192.168.0.183","TCP","1514","443  >  51124 [ACK] Seq=235055 Ack=10690 Win=8 Len=1460 [TCP segment of a reassembled PDU]"
"362","37.378949","172.64.155.249","192.168.0.183","TLSv1.2","1053","Application Data"
"363","37.378949","172.64.155.249","192.168.0.183","TCP","1514","443  >  51124 [ACK] Seq=237514 Ack=10690 Win=8 Len=1460 [TCP segment of a reassembled PDU]"
"364","37.378949","172.64.155.249","192.168.0.183","TCP","1514","443  >  51124 [ACK] Seq=238974 Ack=10690 Win=8 Len=1460 [TCP segment of a reassembled PDU]"
"365","37.378949","172.64.155.249","192.168.0.183","TCP","1514","443  >  51124 [ACK] Seq=240434 Ack=10690 Win=8 Len=1460 [TCP segment of a reassembled PDU]"
"366","37.378949","172.64.155.249","192.168.0.183","TLSv1.2","925","Application Data"
"367","37.378949","172.64.155.249","192.168.0.183","TCP","1514","443  >  51124 [ACK] Seq=242765 Ack=10690 Win=8 Len=1460 [TCP segment of a reassembled PDU]"
"368","37.378949","172.64.155.249","192.168.0.183","TCP","1514","443  >  51124 [ACK] Seq=244225 Ack=10690 Win=8 Len=1460 [TCP segment of a reassembled PDU]"
"369","37.378949","172.64.155.249","192.168.0.183","TCP","1514","443  >  51124 [ACK] Seq=245685 Ack=10690 Win=8 Len=1460 [TCP segment of a reassembled PDU]"
"370","37.378949","172.64.155.249","192.168.0.183","TCP","1514","443  >  51124 [ACK] Seq=247145 Ack=10690 Win=8 Len=1460 [TCP segment of a reassembled PDU]"
"371","37.378949","172.64.155.249","192.168.0.183","TCP","1514","443  >  51124 [ACK] Seq=248605 Ack=10690 Win=8 Len=1460 [TCP segment of a reassembled PDU]"
"372","37.378949","172.64.155.249","192.168.0.183","TCP","1514","443  >  51124 [PSH, ACK] Seq=250065 Ack=10690 Win=8 Len=1460 [TCP segment of a reassembled PDU]"
"373","37.378949","172.64.155.249","192.168.0.183","TLSv1.2","1277","Application Data"
"374","37.378949","172.64.155.249","192.168.0.183","TLSv1.2","127","Application Data, Application Data"
"375","37.379083","192.168.0.183","172.64.155.249","TCP","54","51124  >  443 [ACK] Seq=10690 Ack=252821 Win=514 Len=0"
"376","37.440547","192.168.0.183","172.64.155.249","TLSv1.2","184","Application Data"
"377","37.440610","192.168.0.183","172.64.155.249","TLSv1.2","93","Application Data"
"378","37.460683","172.64.155.249","192.168.0.183","TCP","60","443  >  51134 [ACK] Seq=1839 Ack=766 Win=8 Len=0"
"379","37.460683","172.64.155.249","192.168.0.183","TLSv1.2","93","Application Data"
"380","37.496186","172.64.155.249","192.168.0.183","TLSv1.2","474","Application Data"
"381","37.496186","172.64.155.249","192.168.0.183","TLSv1.2","203","Application Data"
"382","37.496186","172.64.155.249","192.168.0.183","TLSv1.2","85","Application Data"
"383","37.496299","192.168.0.183","172.64.155.249","TCP","54","51134  >  443 [ACK] Seq=766 Ack=2478 Win=511 Len=0"
"384","37.500858","192.168.0.183","172.64.155.249","TLSv1.2","89","Application Data"
"385","37.553557","172.64.155.249","192.168.0.183","TCP","60","443  >  51134 [ACK] Seq=2478 Ack=801 Win=8 Len=0"
"386","37.791631","192.168.0.183","172.64.155.249","TLSv1.2","544","Application Data"
"387","37.791697","192.168.0.183","172.64.155.249","TLSv1.2","553","Application Data"
"388","37.805826","172.64.155.249","192.168.0.183","TCP","60","443  >  51124 [ACK] Seq=252821 Ack=11679 Win=8 Len=0"
"389","37.826982","172.64.155.249","192.168.0.183","TLSv1.2","144","Application Data"
"390","37.826982","172.64.155.249","192.168.0.183","TLSv1.2","85","Application Data"
"391","37.827026","192.168.0.183","172.64.155.249","TCP","54","51124  >  443 [ACK] Seq=11679 Ack=252942 Win=513 Len=0"
"392","38.999273","192.168.0.183","172.64.155.249","TLSv1.2","228","Application Data"
"393","38.999378","192.168.0.183","172.64.155.249","TLSv1.2","593","Application Data"
"394","39.015822","192.168.0.183","172.64.155.249","TLSv1.2","402","Application Data"
"395","39.017305","172.64.155.249","192.168.0.183","TCP","60","443  >  51124 [ACK] Seq=252942 Ack=12392 Win=8 Len=0"
"396","39.038994","172.64.155.249","192.168.0.183","TLSv1.2","278","Application Data"
"397","39.038994","172.64.155.249","192.168.0.183","TLSv1.2","85","Application Data"
"398","39.039039","192.168.0.183","172.64.155.249","TCP","54","51124  >  443 [ACK] Seq=12740 Ack=253197 Win=512 Len=0"
"399","39.065095","172.64.155.249","192.168.0.183","TLSv1.2","152","Application Data"
"400","39.065095","172.64.155.249","192.168.0.183","TLSv1.2","100","Application Data"
"401","39.065137","192.168.0.183","172.64.155.249","TCP","54","51124  >  443 [ACK] Seq=12740 Ack=253341 Win=512 Len=0"
"402","39.069095","172.64.155.249","192.168.0.183","TCP","1514","443  >  51124 [ACK] Seq=253341 Ack=12740 Win=8 Len=1460 [TCP segment of a reassembled PDU]"
"403","39.069095","172.64.155.249","192.168.0.183","TCP","1514","443  >  51124 [ACK] Seq=254801 Ack=12740 Win=8 Len=1460 [TCP segment of a reassembled PDU]"
"404","39.069095","172.64.155.249","192.168.0.183","TCP","1514","443  >  51124 [ACK] Seq=256261 Ack=12740 Win=8 Len=1460 [TCP segment of a reassembled PDU]"
"405","39.069095","172.64.155.249","192.168.0.183","TCP","1514","443  >  51124 [ACK] Seq=257721 Ack=12740 Win=8 Len=1460 [TCP segment of a reassembled PDU]"
"406","39.069095","172.64.155.249","192.168.0.183","TCP","1514","443  >  51124 [ACK] Seq=259181 Ack=12740 Win=8 Len=1460 [TCP segment of a reassembled PDU]"
"407","39.069095","172.64.155.249","192.168.0.183","TCP","1514","443  >  51124 [PSH, ACK] Seq=260641 Ack=12740 Win=8 Len=1460 [TCP segment of a reassembled PDU]"
"408","39.069095","172.64.155.249","192.168.0.183","TLSv1.2","1107","Application Data"
"409","39.069170","192.168.0.183","172.64.155.249","TCP","54","51124  >  443 [ACK] Seq=12740 Ack=263154 Win=514 Len=0"
"410","39.074902","172.64.155.249","192.168.0.183","TCP","1514","443  >  51124 [ACK] Seq=263154 Ack=12740 Win=8 Len=1460 [TCP segment of a reassembled PDU]"
"411","39.074902","172.64.155.249","192.168.0.183","TLSv1.2","241","Application Data"
"412","39.074954","192.168.0.183","172.64.155.249","TCP","54","51124  >  443 [ACK] Seq=12740 Ack=264801 Win=514 Len=0"
"413","39.078658","172.64.155.249","192.168.0.183","TCP","1514","443  >  51124 [ACK] Seq=264801 Ack=12740 Win=8 Len=1460 [TCP segment of a reassembled PDU]"
"414","39.078658","172.64.155.249","192.168.0.183","TCP","1514","443  >  51124 [ACK] Seq=266261 Ack=12740 Win=8 Len=1460 [TCP segment of a reassembled PDU]"
"415","39.078658","172.64.155.249","192.168.0.183","TLSv1.2","925","Application Data"
"416","39.078658","172.64.155.249","192.168.0.183","TCP","1514","443  >  51124 [ACK] Seq=268592 Ack=12740 Win=8 Len=1460 [TCP segment of a reassembled PDU]"
"417","39.078722","192.168.0.183","172.64.155.249","TCP","54","51124  >  443 [ACK] Seq=12740 Ack=270052 Win=514 Len=0"
"418","39.079920","172.64.155.249","192.168.0.183","TCP","1514","443  >  51124 [ACK] Seq=270052 Ack=12740 Win=8 Len=1460 [TCP segment of a reassembled PDU]"
"419","39.079920","172.64.155.249","192.168.0.183","TCP","1514","443  >  51124 [ACK] Seq=271512 Ack=12740 Win=8 Len=1460 [TCP segment of a reassembled PDU]"
"420","39.079920","172.64.155.249","192.168.0.183","TCP","1514","443  >  51124 [ACK] Seq=272972 Ack=12740 Win=8 Len=1460 [TCP segment of a reassembled PDU]"
"421","39.079920","172.64.155.249","192.168.0.183","TLSv1.2","238","Application Data"
"422","39.079989","192.168.0.183","172.64.155.249","TCP","54","51124  >  443 [ACK] Seq=12740 Ack=274616 Win=514 Len=0"
"423","39.081794","172.64.155.249","192.168.0.183","TCP","1514","443  >  51124 [ACK] Seq=274616 Ack=12740 Win=8 Len=1460 [TCP segment of a reassembled PDU]"
"424","39.081794","172.64.155.249","192.168.0.183","TCP","1514","443  >  51124 [ACK] Seq=276076 Ack=12740 Win=8 Len=1460 [TCP segment of a reassembled PDU]"
"425","39.081794","172.64.155.249","192.168.0.183","TCP","1514","443  >  51124 [ACK] Seq=277536 Ack=12740 Win=8 Len=1460 [TCP segment of a reassembled PDU]"
"426","39.081794","172.64.155.249","192.168.0.183","TCP","1514","443  >  51124 [ACK] Seq=278996 Ack=12740 Win=8 Len=1460 [TCP segment of a reassembled PDU]"
"427","39.081794","172.64.155.249","192.168.0.183","TCP","1514","443  >  51124 [ACK] Seq=280456 Ack=12740 Win=8 Len=1460 [TCP segment of a reassembled PDU]"
"428","39.081794","172.64.155.249","192.168.0.183","TCP","1514","443  >  51124 [PSH, ACK] Seq=281916 Ack=12740 Win=8 Len=1460 [TCP segment of a reassembled PDU]"
"429","39.081794","172.64.155.249","192.168.0.183","TLSv1.2","1131","Application Data"
"430","39.081918","192.168.0.183","172.64.155.249","TCP","54","51124  >  443 [ACK] Seq=12740 Ack=284453 Win=514 Len=0"
"431","39.087828","172.64.155.249","192.168.0.183","TCP","1514","443  >  51124 [ACK] Seq=284453 Ack=12740 Win=8 Len=1460 [TCP segment of a reassembled PDU]"
"432","39.087828","172.64.155.249","192.168.0.183","TCP","1514","443  >  51124 [ACK] Seq=285913 Ack=12740 Win=8 Len=1460 [TCP segment of a reassembled PDU]"
"433","39.087828","172.64.155.249","192.168.0.183","TLSv1.2","501","Application Data"
"434","39.087901","192.168.0.183","172.64.155.249","TCP","54","51124  >  443 [ACK] Seq=12740 Ack=287820 Win=514 Len=0"
"435","39.088829","172.64.155.249","192.168.0.183","TCP","1514","443  >  51124 [ACK] Seq=287820 Ack=12740 Win=8 Len=1460 [TCP segment of a reassembled PDU]"
"436","39.088829","172.64.155.249","192.168.0.183","TCP","1514","443  >  51124 [ACK] Seq=289280 Ack=12740 Win=8 Len=1460 [TCP segment of a reassembled PDU]"
"437","39.088829","172.64.155.249","192.168.0.183","TCP","1514","443  >  51124 [ACK] Seq=290740 Ack=12740 Win=8 Len=1460 [TCP segment of a reassembled PDU]"
"438","39.088829","172.64.155.249","192.168.0.183","TLSv1.2","525","Application Data"
"439","39.088829","172.64.155.249","192.168.0.183","TCP","1514","443  >  51124 [ACK] Seq=292671 Ack=12740 Win=8 Len=1460 [TCP segment of a reassembled PDU]"
"440","39.088829","172.64.155.249","192.168.0.183","TLSv1.2","1424","Application Data"
"441","39.088829","172.64.155.249","192.168.0.183","TLSv1.2","96","Application Data"
"442","39.088829","172.64.155.249","192.168.0.183","TLSv1.2","85","Application Data"
"443","39.088894","192.168.0.183","172.64.155.249","TCP","54","51124  >  443 [ACK] Seq=12740 Ack=295574 Win=514 Len=0"
"444","39.191741","192.168.0.183","172.64.155.249","TLSv1.2","210","Application Data"
"445","39.205985","172.64.155.249","192.168.0.183","TCP","60","443  >  51134 [ACK] Seq=2478 Ack=957 Win=8 Len=0"
"446","39.232557","172.64.155.249","192.168.0.183","TLSv1.2","672","Application Data"
"447","39.232557","172.64.155.249","192.168.0.183","TLSv1.2","203","Application Data"
"448","39.232557","172.64.155.249","192.168.0.183","TLSv1.2","85","Application Data"
"449","39.232658","192.168.0.183","172.64.155.249","TCP","54","51134  >  443 [ACK] Seq=957 Ack=3276 Win=514 Len=0"
"450","39.376012","192.168.0.183","172.64.155.249","TLSv1.2","268","Application Data"
"451","39.425784","172.64.155.249","192.168.0.183","TLSv1.2","286","Application Data"
"452","39.477746","192.168.0.183","172.64.155.249","TCP","54","51124  >  443 [ACK] Seq=12954 Ack=295806 Win=513 Len=0"
"453","39.638616","192.168.0.183","172.64.155.249","TLSv1.2","1052","Application Data"
"454","39.638680","192.168.0.183","172.64.155.249","TLSv1.2","608","Application Data"
"455","39.652485","172.64.155.249","192.168.0.183","TCP","60","443  >  51124 [ACK] Seq=295806 Ack=14506 Win=8 Len=0"
"456","39.680061","172.64.155.249","192.168.0.183","TLSv1.2","144","Application Data"
"457","39.680061","172.64.155.249","192.168.0.183","TLSv1.2","85","Application Data"
"458","39.680167","192.168.0.183","172.64.155.249","TCP","54","51124  >  443 [ACK] Seq=14506 Ack=295927 Win=512 Len=0"
"459","44.591684","192.168.0.183","172.64.155.249","TLSv1.2","202","Application Data"
"460","44.644722","172.64.155.249","192.168.0.183","TCP","60","443  >  51124 [ACK] Seq=295927 Ack=14654 Win=8 Len=0"
"461","44.703530","172.64.155.249","192.168.0.183","TLSv1.2","280","Application Data"
"462","44.703530","172.64.155.249","192.168.0.183","TLSv1.2","100","Application Data"
"463","44.703530","172.64.155.249","192.168.0.183","TLSv1.2","1265","Application Data"
"464","44.703575","192.168.0.183","172.64.155.249","TCP","54","51124  >  443 [ACK] Seq=14654 Ack=297410 Win=514 Len=0"
"465","44.704464","192.168.0.183","172.64.155.249","TLSv1.2","89","Application Data"
"466","44.705627","172.64.155.249","192.168.0.183","TCP","1514","443  >  51124 [ACK] Seq=297410 Ack=14654 Win=8 Len=1460 [TCP segment of a reassembled PDU]"
"467","44.705627","172.64.155.249","192.168.0.183","TCP","1514","443  >  51124 [ACK] Seq=298870 Ack=14654 Win=8 Len=1460 [TCP segment of a reassembled PDU]"
"468","44.705627","172.64.155.249","192.168.0.183","TCP","1514","443  >  51124 [ACK] Seq=300330 Ack=14654 Win=8 Len=1460 [TCP segment of a reassembled PDU]"
"469","44.705627","172.64.155.249","192.168.0.183","TLSv1.2","569","Application Data"
"470","44.705627","172.64.155.249","192.168.0.183","TCP","1514","443  >  51124 [ACK] Seq=302305 Ack=14654 Win=8 Len=1460 [TCP segment of a reassembled PDU]"
"471","44.705627","172.64.155.249","192.168.0.183","TCP","1514","443  >  51124 [ACK] Seq=303765 Ack=14654 Win=8 Len=1460 [TCP segment of a reassembled PDU]"
"472","44.705627","172.64.155.249","192.168.0.183","TLSv1.2","792","Application Data"
"473","44.705704","192.168.0.183","172.64.155.249","TCP","54","51124  >  443 [ACK] Seq=14689 Ack=305963 Win=514 Len=0"
"474","44.715892","172.64.155.249","192.168.0.183","TCP","1514","443  >  51124 [ACK] Seq=305963 Ack=14654 Win=8 Len=1460 [TCP segment of a reassembled PDU]"
"475","44.715892","172.64.155.249","192.168.0.183","TLSv1.2","1390","Application Data"
"476","44.715892","172.64.155.249","192.168.0.183","TCP","1514","443  >  51124 [ACK] Seq=308759 Ack=14654 Win=8 Len=1460 [TCP segment of a reassembled PDU]"
"477","44.715892","172.64.155.249","192.168.0.183","TLSv1.2","733","Application Data"
"478","44.716000","192.168.0.183","172.64.155.249","TCP","54","51124  >  443 [ACK] Seq=14689 Ack=310898 Win=514 Len=0"
"479","44.716417","172.64.155.249","192.168.0.183","TCP","60","443  >  51124 [ACK] Seq=310898 Ack=14689 Win=8 Len=0"
"480","44.716417","172.64.155.249","192.168.0.183","TCP","1514","443  >  51124 [ACK] Seq=310898 Ack=14689 Win=8 Len=1460 [TCP segment of a reassembled PDU]"
"481","44.716445","192.168.0.183","172.64.155.249","TCP","54","51124  >  443 [ACK] Seq=14689 Ack=312358 Win=514 Len=0"
"482","44.718207","172.64.155.249","192.168.0.183","TCP","1514","443  >  51124 [ACK] Seq=312358 Ack=14689 Win=8 Len=1460 [TCP segment of a reassembled PDU]"
"483","44.718207","172.64.155.249","192.168.0.183","TCP","1514","443  >  51124 [ACK] Seq=313818 Ack=14689 Win=8 Len=1460 [TCP segment of a reassembled PDU]"
"484","44.718207","172.64.155.249","192.168.0.183","TCP","1514","443  >  51124 [ACK] Seq=315278 Ack=14689 Win=8 Len=1460 [TCP segment of a reassembled PDU]"
"485","44.718207","172.64.155.249","192.168.0.183","TCP","1514","443  >  51124 [ACK] Seq=316738 Ack=14689 Win=8 Len=1460 [TCP segment of a reassembled PDU]"
"486","44.718207","172.64.155.249","192.168.0.183","TCP","1514","443  >  51124 [PSH, ACK] Seq=318198 Ack=14689 Win=8 Len=1460 [TCP segment of a reassembled PDU]"
"487","44.718207","172.64.155.249","192.168.0.183","TLSv1.2","628","Application Data"
"488","44.718207","172.64.155.249","192.168.0.183","TLSv1.2","1210","Application Data"
"489","44.718207","172.64.155.249","192.168.0.183","TLSv1.2","127","Application Data, Application Data"
"490","44.718264","192.168.0.183","172.64.155.249","TCP","54","51124  >  443 [ACK] Seq=14689 Ack=321461 Win=514 Len=0"
"491","44.994115","192.168.0.183","172.64.155.249","TLSv1.2","238","Application Data"
"492","44.994930","192.168.0.183","172.64.155.249","TLSv1.2","182","Application Data"
"493","45.007495","172.64.155.249","192.168.0.183","TCP","60","443  >  51124 [ACK] Seq=321461 Ack=15001 Win=8 Len=0"
"494","45.032972","172.64.155.249","192.168.0.183","TLSv1.2","144","Application Data"
"495","45.032972","172.64.155.249","192.168.0.183","TLSv1.2","146","Application Data"
"496","45.032972","172.64.155.249","192.168.0.183","TLSv1.2","225","Application Data"
"497","45.032972","172.64.155.249","192.168.0.183","TLSv1.2","85","Application Data"
"498","45.033093","192.168.0.183","172.64.155.249","TCP","54","51124  >  443 [ACK] Seq=15001 Ack=321845 Win=512 Len=0"
"499","45.116678","192.168.0.183","172.64.155.249","TLSv1.2","490","Application Data"
"500","45.116745","192.168.0.183","172.64.155.249","TLSv1.2","544","Application Data"
"501","45.131087","172.64.155.249","192.168.0.183","TCP","60","443  >  51124 [ACK] Seq=321845 Ack=15927 Win=8 Len=0"
"502","45.154007","172.64.155.249","192.168.0.183","TLSv1.2","278","Application Data"
"503","45.154007","172.64.155.249","192.168.0.183","TLSv1.2","85","Application Data"
"504","45.154033","192.168.0.183","172.64.155.249","TCP","54","51124  >  443 [ACK] Seq=15927 Ack=322100 Win=511 Len=0"
