"No.","Time","Source","Destination","Protocol","Length","Info"
"1","0.000000","192.168.0.183","172.64.155.249","TLSv1.2","134","Application Data"
"2","0.000037","192.168.0.183","172.64.155.249","TLSv1.2","93","Application Data"
"3","0.015685","172.64.155.249","192.168.0.183","TCP","60","443  >  51124 [ACK] Seq=1 Ack=120 Win=49 Len=0"
"4","0.015685","172.64.155.249","192.168.0.183","TLSv1.2","93","Application Data"
"5","0.061935","192.168.0.183","172.64.155.249","TCP","54","51124  >  443 [ACK] Seq=120 Ack=40 Win=512 Len=0"
"6","0.066860","172.64.155.249","192.168.0.183","TLSv1.2","340","Application Data"
"7","0.066860","172.64.155.249","192.168.0.183","TLSv1.2","100","Application Data"
"8","0.066860","172.64.155.249","192.168.0.183","TLSv1.2","1292","Application Data"
"9","0.066860","172.64.155.249","192.168.0.183","TCP","1514","443  >  51124 [ACK] Seq=1610 Ack=120 Win=49 Len=1460 [TCP segment of a reassembled PDU]"
"10","0.066908","192.168.0.183","172.64.155.249","TCP","54","51124  >  443 [ACK] Seq=120 Ack=3070 Win=514 Len=0"
"11","0.067827","192.168.0.183","172.64.155.249","TLSv1.2","89","Application Data"
"12","0.068664","172.64.155.249","192.168.0.183","TCP","1514","443  >  51124 [ACK] Seq=3070 Ack=120 Win=49 Len=1460 [TCP segment of a reassembled PDU]"
"13","0.068664","172.64.155.249","192.168.0.183","TCP","1514","443  >  51124 [ACK] Seq=4530 Ack=120 Win=49 Len=1460 [TCP segment of a reassembled PDU]"
"14","0.068664","172.64.155.249","192.168.0.183","TCP","1514","443  >  51124 [ACK] Seq=5990 Ack=120 Win=49 Len=1460 [TCP segment of a reassembled PDU]"
"15","0.068664","172.64.155.249","192.168.0.183","TCP","1514","443  >  51124 [ACK] Seq=7450 Ack=120 Win=49 Len=1460 [TCP segment of a reassembled PDU]"
"16","0.068664","172.64.155.249","192.168.0.183","TLSv1.2","467","Application Data"
"17","0.068713","192.168.0.183","172.64.155.249","TCP","54","51124  >  443 [ACK] Seq=155 Ack=9323 Win=514 Len=0"
"18","0.076887","172.64.155.249","192.168.0.183","TCP","1514","443  >  51124 [ACK] Seq=9323 Ack=120 Win=49 Len=1460 [TCP segment of a reassembled PDU]"
"19","0.076887","172.64.155.249","192.168.0.183","TLSv1.2","1092","Application Data"
"20","0.076887","172.64.155.249","192.168.0.183","TLSv1.2","1266","Application Data"
"21","0.077059","192.168.0.183","172.64.155.249","TCP","54","51124  >  443 [ACK] Seq=155 Ack=13033 Win=514 Len=0"
"22","0.080063","172.64.155.249","192.168.0.183","TCP","1514","443  >  51124 [ACK] Seq=13033 Ack=120 Win=49 Len=1460 [TCP segment of a reassembled PDU]"
"23","0.080063","172.64.155.249","192.168.0.183","TCP","1514","443  >  51124 [ACK] Seq=14493 Ack=120 Win=49 Len=1460 [TCP segment of a reassembled PDU]"
"24","0.080063","172.64.155.249","192.168.0.183","TLSv1.2","727","Application Data"
"25","0.080133","192.168.0.183","172.64.155.249","TCP","54","51124  >  443 [ACK] Seq=155 Ack=16626 Win=514 Len=0"
"26","0.090284","172.64.155.249","192.168.0.183","TCP","1514","443  >  51124 [ACK] Seq=16626 Ack=155 Win=49 Len=1460 [TCP segment of a reassembled PDU]"
"27","0.090284","172.64.155.249","192.168.0.183","TCP","1514","443  >  51124 [PSH, ACK] Seq=18086 Ack=155 Win=49 Len=1460 [TCP segment of a reassembled PDU]"
"28","0.090284","172.64.155.249","192.168.0.183","TCP","1514","443  >  51124 [ACK] Seq=19546 Ack=155 Win=49 Len=1460 [TCP segment of a reassembled PDU]"
"29","0.090284","172.64.155.249","192.168.0.183","TLSv1.2","1152","Application Data, Application Data, Application Data"
"30","0.090377","192.168.0.183","172.64.155.249","TCP","54","51124  >  443 [ACK] Seq=155 Ack=22104 Win=514 Len=0"
"31","0.369932","192.168.0.183","172.64.155.249","TLSv1.2","183","Application Data"
"32","0.370114","192.168.0.183","172.64.155.249","TLSv1.2","177","Application Data"
"33","0.384438","172.64.155.249","192.168.0.183","TCP","60","443  >  51124 [ACK] Seq=22104 Ack=407 Win=49 Len=0"
"34","0.412691","172.64.155.249","192.168.0.183","TLSv1.2","144","Application Data"
"35","0.423770","172.64.155.249","192.168.0.183","TLSv1.2","146","Application Data"
"36","0.423770","172.64.155.249","192.168.0.183","TLSv1.2","225","Application Data"
"37","0.423770","172.64.155.249","192.168.0.183","TLSv1.2","85","Application Data"
"38","0.423977","192.168.0.183","172.64.155.249","TCP","54","51124  >  443 [ACK] Seq=407 Ack=22488 Win=512 Len=0"
"39","0.503939","192.168.0.183","172.64.155.249","TLSv1.2","515","Application Data"
"40","0.503997","192.168.0.183","172.64.155.249","TLSv1.2","537","Application Data"
"41","0.520208","172.64.155.249","192.168.0.183","TCP","60","443  >  51124 [ACK] Seq=22488 Ack=1351 Win=50 Len=0"
"42","0.545984","172.64.155.249","192.168.0.183","TLSv1.2","301","Application Data"
"43","0.545984","172.64.155.249","192.168.0.183","TLSv1.2","85","Application Data"
"44","0.546017","192.168.0.183","172.64.155.249","TCP","54","51124  >  443 [ACK] Seq=1351 Ack=22766 Win=511 Len=0"
"45","2.987196","192.168.0.183","172.64.155.249","TLSv1.2","166","Application Data"
"46","2.987330","192.168.0.183","172.64.155.249","TLSv1.2","170","Application Data"
"47","2.996903","192.168.0.183","172.64.155.249","TLSv1.2","228","Application Data"
"48","2.999766","172.64.155.249","192.168.0.183","TCP","60","443  >  51124 [ACK] Seq=22766 Ack=1579 Win=50 Len=0"
"49","3.021833","172.64.155.249","192.168.0.183","TLSv1.2","287","Application Data"
"50","3.074854","192.168.0.183","172.64.155.249","TCP","54","51124  >  443 [ACK] Seq=1753 Ack=22999 Win=510 Len=0"
"51","3.173131","172.64.155.249","192.168.0.183","TLSv1.2","146","Application Data"
"52","3.173131","172.64.155.249","192.168.0.183","TLSv1.2","100","Application Data"
"53","3.173131","172.64.155.249","192.168.0.183","TLSv1.2","1318","Application Data"
"54","3.173131","172.64.155.249","192.168.0.183","TCP","1514","443  >  51124 [ACK] Seq=24401 Ack=1753 Win=51 Len=1460 [TCP segment of a reassembled PDU]"
"55","3.173189","192.168.0.183","172.64.155.249","TCP","54","51124  >  443 [ACK] Seq=1753 Ack=25861 Win=514 Len=0"
"56","3.177008","172.64.155.249","192.168.0.183","TCP","1514","443  >  51124 [ACK] Seq=25861 Ack=1753 Win=51 Len=1460 [TCP segment of a reassembled PDU]"
"57","3.177008","172.64.155.249","192.168.0.183","TCP","1514","443  >  51124 [ACK] Seq=27321 Ack=1753 Win=51 Len=1460 [TCP segment of a reassembled PDU]"
"58","3.177008","172.64.155.249","192.168.0.183","TLSv1.2","621","Application Data"
"59","3.177008","172.64.155.249","192.168.0.183","TCP","1514","443  >  51124 [ACK] Seq=29348 Ack=1753 Win=51 Len=1460 [TCP segment of a reassembled PDU]"
"60","3.177008","172.64.155.249","192.168.0.183","TCP","1514","443  >  51124 [ACK] Seq=30808 Ack=1753 Win=51 Len=1460 [TCP segment of a reassembled PDU]"
"61","3.177008","172.64.155.249","192.168.0.183","TLSv1.2","780","Application Data"
"62","3.177093","192.168.0.183","172.64.155.249","TCP","54","51124  >  443 [ACK] Seq=1753 Ack=32994 Win=514 Len=0"
"63","3.191665","172.64.155.249","192.168.0.183","TCP","1514","443  >  51124 [ACK] Seq=32994 Ack=1753 Win=51 Len=1460 [TCP segment of a reassembled PDU]"
"64","3.191665","172.64.155.249","192.168.0.183","TLSv1.2","1503","Application Data"
"65","3.191665","172.64.155.249","192.168.0.183","TCP","1514","443  >  51124 [ACK] Seq=35903 Ack=1753 Win=51 Len=1460 [TCP segment of a reassembled PDU]"
"66","3.191665","172.64.155.249","192.168.0.183","TCP","1514","443  >  51124 [ACK] Seq=37363 Ack=1753 Win=51 Len=1460 [TCP segment of a reassembled PDU]"
"67","3.191665","172.64.155.249","192.168.0.183","TCP","1514","443  >  51124 [ACK] Seq=38823 Ack=1753 Win=51 Len=1460 [TCP segment of a reassembled PDU]"
"68","3.191665","172.64.155.249","192.168.0.183","TCP","1514","443  >  51124 [ACK] Seq=40283 Ack=1753 Win=51 Len=1460 [TCP segment of a reassembled PDU]"
"69","3.191665","172.64.155.249","192.168.0.183","TCP","1514","443  >  51124 [ACK] Seq=41743 Ack=1753 Win=51 Len=1460 [TCP segment of a reassembled PDU]"
"70","3.191665","172.64.155.249","192.168.0.183","TCP","1514","443  >  51124 [PSH, ACK] Seq=43203 Ack=1753 Win=51 Len=1460 [TCP segment of a reassembled PDU]"
"71","3.191665","172.64.155.249","192.168.0.183","TCP","1514","443  >  51124 [ACK] Seq=44663 Ack=1753 Win=51 Len=1460 [TCP segment of a reassembled PDU]"
"72","3.191665","172.64.155.249","192.168.0.183","TCP","1514","443  >  51124 [ACK] Seq=46123 Ack=1753 Win=51 Len=1460 [TCP segment of a reassembled PDU]"
"73","3.191665","172.64.155.249","192.168.0.183","TCP","1514","443  >  51124 [ACK] Seq=47583 Ack=1753 Win=51 Len=1460 [TCP segment of a reassembled PDU]"
"74","3.191665","172.64.155.249","192.168.0.183","TCP","1514","443  >  51124 [ACK] Seq=49043 Ack=1753 Win=51 Len=1460 [TCP segment of a reassembled PDU]"
"75","3.191665","172.64.155.249","192.168.0.183","TCP","1514","443  >  51124 [ACK] Seq=50503 Ack=1753 Win=51 Len=1460 [TCP segment of a reassembled PDU]"
"76","3.191665","172.64.155.249","192.168.0.183","TLSv1.2","400","Application Data"
"77","3.191665","172.64.155.249","192.168.0.183","TCP","1514","443  >  51124 [ACK] Seq=52309 Ack=1753 Win=51 Len=1460 [TCP segment of a reassembled PDU]"
"78","3.191665","172.64.155.249","192.168.0.183","TLSv1.2","460","Application Data, Application Data, Application Data"
"79","3.191877","192.168.0.183","172.64.155.249","TCP","54","51124  >  443 [ACK] Seq=1753 Ack=54175 Win=514 Len=0"
"80","3.263602","192.168.0.183","172.64.155.249","TLSv1.2","184","Application Data"
"81","3.263662","192.168.0.183","172.64.155.249","TLSv1.2","93","Application Data"
"82","3.281832","172.64.155.249","192.168.0.183","TCP","60","443  >  51134 [ACK] Seq=1 Ack=170 Win=8 Len=0"
"83","3.281832","172.64.155.249","192.168.0.183","TLSv1.2","93","Application Data"
"84","3.305348","172.64.155.249","192.168.0.183","TLSv1.2","472","Application Data"
"85","3.305348","172.64.155.249","192.168.0.183","TLSv1.2","203","Application Data"
"86","3.305348","172.64.155.249","192.168.0.183","TLSv1.2","85","Application Data"
"87","3.305586","192.168.0.183","172.64.155.249","TCP","54","51134  >  443 [ACK] Seq=170 Ack=638 Win=511 Len=0"
"88","3.306678","192.168.0.183","172.64.155.249","TLSv1.2","89","Application Data"
"89","3.360813","172.64.155.249","192.168.0.183","TCP","60","443  >  51134 [ACK] Seq=638 Ack=205 Win=8 Len=0"
"90","3.639180","192.168.0.183","172.64.155.249","TLSv1.2","545","Application Data"
"91","3.639333","192.168.0.183","172.64.155.249","TLSv1.2","563","Application Data"
"92","3.655038","172.64.155.249","192.168.0.183","TCP","60","443  >  51124 [ACK] Seq=54175 Ack=2753 Win=51 Len=0"
"93","3.680897","172.64.155.249","192.168.0.183","TLSv1.2","144","Application Data"
"94","3.680897","172.64.155.249","192.168.0.183","TLSv1.2","85","Application Data"
"95","3.680928","192.168.0.183","172.64.155.249","TCP","54","51124  >  443 [ACK] Seq=2753 Ack=54296 Win=513 Len=0"
"96","7.093987","192.168.0.183","172.64.155.249","TLSv1.2","733","Application Data"
"97","7.094136","192.168.0.183","172.64.155.249","TLSv1.2","603","Application Data"
"98","7.107725","172.64.155.249","192.168.0.183","TCP","60","443  >  51124 [ACK] Seq=54296 Ack=3981 Win=52 Len=0"
"99","7.110110","192.168.0.183","172.64.155.249","TLSv1.2","432","Application Data"
"100","7.134400","172.64.155.249","192.168.0.183","TLSv1.2","277","Application Data"
"101","7.134400","172.64.155.249","192.168.0.183","TLSv1.2","85","Application Data"
"102","7.134430","192.168.0.183","172.64.155.249","TCP","54","51124  >  443 [ACK] Seq=4359 Ack=54550 Win=512 Len=0"
"103","7.168620","172.64.155.249","192.168.0.183","TLSv1.2","146","Application Data"
"104","7.168620","172.64.155.249","192.168.0.183","TLSv1.2","100","Application Data"
"105","7.168620","172.64.155.249","192.168.0.183","TLSv1.2","1309","Application Data"
"106","7.168662","192.168.0.183","172.64.155.249","TCP","54","51124  >  443 [ACK] Seq=4359 Ack=55943 Win=514 Len=0"
"107","7.170010","192.168.0.183","172.64.155.249","TLSv1.2","89","Application Data"
"108","7.171167","172.64.155.249","192.168.0.183","TCP","1514","443  >  51124 [ACK] Seq=55943 Ack=4359 Win=52 Len=1460 [TCP segment of a reassembled PDU]"
"109","7.171167","172.64.155.249","192.168.0.183","TCP","1514","443  >  51124 [ACK] Seq=57403 Ack=4359 Win=52 Len=1460 [TCP segment of a reassembled PDU]"
"110","7.171167","172.64.155.249","192.168.0.183","TCP","1514","443  >  51124 [ACK] Seq=58863 Ack=4359 Win=52 Len=1460 [TCP segment of a reassembled PDU]"
"111","7.171167","172.64.155.249","192.168.0.183","TCP","1514","443  >  51124 [ACK] Seq=60323 Ack=4359 Win=52 Len=1460 [TCP segment of a reassembled PDU]"
"112","7.171167","172.64.155.249","192.168.0.183","TLSv1.2","1493","Application Data"
"113","7.171223","192.168.0.183","172.64.155.249","TCP","54","51124  >  443 [ACK] Seq=4394 Ack=63222 Win=514 Len=0"
"114","7.180320","172.64.155.249","192.168.0.183","TCP","1514","443  >  51124 [ACK] Seq=63222 Ack=4359 Win=52 Len=1460 [TCP segment of a reassembled PDU]"
"115","7.180320","172.64.155.249","192.168.0.183","TCP","1514","443  >  51124 [ACK] Seq=64682 Ack=4359 Win=52 Len=1460 [TCP segment of a reassembled PDU]"
"116","7.180320","172.64.155.249","192.168.0.183","TLSv1.2","1334","Application Data"
"117","7.180365","192.168.0.183","172.64.155.249","TCP","54","51124  >  443 [ACK] Seq=4394 Ack=67422 Win=514 Len=0"
"118","7.189065","172.64.155.249","192.168.0.183","TCP","1514","443  >  51124 [ACK] Seq=67422 Ack=4394 Win=52 Len=1460 [TCP segment of a reassembled PDU]"
"119","7.189065","172.64.155.249","192.168.0.183","TCP","1514","443  >  51124 [ACK] Seq=68882 Ack=4394 Win=52 Len=1460 [TCP segment of a reassembled PDU]"
"120","7.189065","172.64.155.249","192.168.0.183","TCP","1514","443  >  51124 [ACK] Seq=70342 Ack=4394 Win=52 Len=1460 [TCP segment of a reassembled PDU]"
"121","7.189065","172.64.155.249","192.168.0.183","TCP","1514","443  >  51124 [ACK] Seq=71802 Ack=4394 Win=52 Len=1460 [TCP segment of a reassembled PDU]"
"122","7.189065","172.64.155.249","192.168.0.183","TCP","1514","443  >  51124 [ACK] Seq=73262 Ack=4394 Win=52 Len=1460 [TCP segment of a reassembled PDU]"
"123","7.189065","172.64.155.249","192.168.0.183","TCP","1514","443  >  51124 [PSH, ACK] Seq=74722 Ack=4394 Win=52 Len=1460 [TCP segment of a reassembled PDU]"
"124","7.189065","172.64.155.249","192.168.0.183","TCP","1514","443  >  51124 [ACK] Seq=76182 Ack=4394 Win=52 Len=1460 [TCP segment of a reassembled PDU]"
"125","7.189065","172.64.155.249","192.168.0.183","TCP","1514","443  >  51124 [ACK] Seq=77642 Ack=4394 Win=52 Len=1460 [TCP segment of a reassembled PDU]"
"126","7.189065","172.64.155.249","192.168.0.183","TCP","1514","443  >  51124 [ACK] Seq=79102 Ack=4394 Win=52 Len=1460 [TCP segment of a reassembled PDU]"
"127","7.189065","172.64.155.249","192.168.0.183","TCP","1514","443  >  51124 [ACK] Seq=80562 Ack=4394 Win=52 Len=1460 [TCP segment of a reassembled PDU]"
"128","7.189065","172.64.155.249","192.168.0.183","TCP","1514","443  >  51124 [ACK] Seq=82022 Ack=4394 Win=52 Len=1460 [TCP segment of a reassembled PDU]"
"129","7.189065","172.64.155.249","192.168.0.183","TLSv1.2","158","Application Data"
"130","7.189218","192.168.0.183","172.64.155.249","TCP","54","51124  >  443 [ACK] Seq=4394 Ack=83586 Win=514 Len=0"
"131","7.190692","172.64.155.249","192.168.0.183","TCP","1514","443  >  51124 [ACK] Seq=83586 Ack=4394 Win=52 Len=1460 [TCP segment of a reassembled PDU]"
"132","7.190692","172.64.155.249","192.168.0.183","TCP","1514","443  >  51124 [ACK] Seq=85046 Ack=4394 Win=52 Len=1460 [TCP segment of a reassembled PDU]"
"133","7.190692","172.64.155.249","192.168.0.183","TCP","1514","443  >  51124 [ACK] Seq=86506 Ack=4394 Win=52 Len=1460 [TCP segment of a reassembled PDU]"
"134","7.190692","172.64.155.249","192.168.0.183","TCP","1514","443  >  51124 [ACK] Seq=87966 Ack=4394 Win=52 Len=1460 [TCP segment of a reassembled PDU]"
"135","7.190692","172.64.155.249","192.168.0.183","TCP","1514","443  >  51124 [ACK] Seq=89426 Ack=4394 Win=52 Len=1460 [TCP segment of a reassembled PDU]"
"136","7.190692","172.64.155.249","192.168.0.183","TCP","1514","443  >  51124 [PSH, ACK] Seq=90886 Ack=4394 Win=52 Len=1460 [TCP segment of a reassembled PDU]"
"137","7.190692","172.64.155.249","192.168.0.183","TCP","1514","443  >  51124 [ACK] Seq=92346 Ack=4394 Win=52 Len=1460 [TCP segment of a reassembled PDU]"
"138","7.190692","172.64.155.249","192.168.0.183","TLSv1.2","1064","Application Data"
"139","7.190692","172.64.155.249","192.168.0.183","TCP","1514","443  >  51124 [ACK] Seq=94816 Ack=4394 Win=52 Len=1460 [TCP segment of a reassembled PDU]"
"140","7.190692","172.64.155.249","192.168.0.183","TLSv1.2","183","Application Data"
"141","7.190692","172.64.155.249","192.168.0.183","TLSv1.2","96","Application Data"
"142","7.190692","172.64.155.249","192.168.0.183","TLSv1.2","85","Application Data"
"143","7.190786","192.168.0.183","172.64.155.249","TCP","54","51124  >  443 [ACK] Seq=4394 Ack=96478 Win=514 Len=0"
"144","7.286915","192.168.0.183","172.64.155.249","TLSv1.2","246","Application Data"
"145","7.301326","172.64.155.249","192.168.0.183","TCP","60","443  >  51134 [ACK] Seq=638 Ack=397 Win=8 Len=0"
"146","7.331005","172.64.155.249","192.168.0.183","TLSv1.2","669","Application Data"
"147","7.331005","172.64.155.249","192.168.0.183","TLSv1.2","203","Application Data"
"148","7.331005","172.64.155.249","192.168.0.183","TLSv1.2","85","Application Data"
"149","7.331103","192.168.0.183","172.64.155.249","TCP","54","51134  >  443 [ACK] Seq=397 Ack=1433 Win=514 Len=0"
"150","7.485126","192.168.0.183","172.64.155.249","TLSv1.2","307","Application Data"
"151","7.524222","172.64.155.249","192.168.0.183","TLSv1.2","144","Application Data"
"152","7.566007","192.168.0.183","172.64.155.249","TCP","54","51124  >  443 [ACK] Seq=4647 Ack=96568 Win=513 Len=0"
"153","7.715004","192.168.0.183","172.64.155.249","TLSv1.2","514","Application Data"
"154","7.715066","192.168.0.183","172.64.155.249","TLSv1.2","618","Application Data"
"155","7.731386","172.64.155.249","192.168.0.183","TCP","60","443  >  51124 [ACK] Seq=96568 Ack=5671 Win=53 Len=0"
"156","7.754795","172.64.155.249","192.168.0.183","TLSv1.2","144","Application Data"
"157","7.754795","172.64.155.249","192.168.0.183","TLSv1.2","85","Application Data"
"158","7.754836","192.168.0.183","172.64.155.249","TCP","54","51124  >  443 [ACK] Seq=5671 Ack=96689 Win=513 Len=0"
"159","11.295903","192.168.0.183","172.64.155.249","TLSv1.2","141","Application Data"
"160","11.352186","172.64.155.249","192.168.0.183","TCP","60","443  >  51124 [ACK] Seq=96689 Ack=5758 Win=53 Len=0"
"161","11.366167","172.64.155.249","192.168.0.183","TLSv1.2","280","Application Data"
"162","11.366167","172.64.155.249","192.168.0.183","TCP","1514","443  >  51124 [ACK] Seq=96915 Ack=5758 Win=53 Len=1460 [TCP segment of a reassembled PDU]"
"163","11.366167","172.64.155.249","192.168.0.183","TCP","1514","443  >  51124 [ACK] Seq=98375 Ack=5758 Win=53 Len=1460 [TCP segment of a reassembled PDU]"
"164","11.366167","172.64.155.249","192.168.0.183","TCP","1514","443  >  51124 [ACK] Seq=99835 Ack=5758 Win=53 Len=1460 [TCP segment of a reassembled PDU]"
"165","11.366167","172.64.155.249","192.168.0.183","TCP","1514","443  >  51124 [ACK] Seq=101295 Ack=5758 Win=53 Len=1460 [TCP segment of a reassembled PDU]"
"166","11.366167","172.64.155.249","192.168.0.183","TCP","1514","443  >  51124 [ACK] Seq=102755 Ack=5758 Win=53 Len=1460 [TCP segment of a reassembled PDU]"
"167","11.366167","172.64.155.249","192.168.0.183","TLSv1.2","1183","Application Data"
"168","11.366212","192.168.0.183","172.64.155.249","TCP","54","51124  >  443 [ACK] Seq=5758 Ack=105344 Win=514 Len=0"
"169","11.376225","172.64.155.249","192.168.0.183","TCP","1514","443  >  51124 [ACK] Seq=105344 Ack=5758 Win=53 Len=1460 [TCP segment of a reassembled PDU]"
"170","11.376225","172.64.155.249","192.168.0.183","TLSv1.2","1304","Application Data"
"171","11.376225","172.64.155.249","192.168.0.183","TCP","1514","443  >  51124 [ACK] Seq=108054 Ack=5758 Win=53 Len=1460 [TCP segment of a reassembled PDU]"
"172","11.376225","172.64.155.249","192.168.0.183","TLSv1.2","830","Application Data"
"173","11.376225","172.64.155.249","192.168.0.183","TCP","1514","443  >  51124 [ACK] Seq=110290 Ack=5758 Win=53 Len=1460 [TCP segment of a reassembled PDU]"
"174","11.376225","172.64.155.249","192.168.0.183","TLSv1.2","1095","Application Data"
"175","11.376309","192.168.0.183","172.64.155.249","TCP","54","51124  >  443 [ACK] Seq=5758 Ack=112791 Win=514 Len=0"
"176","11.379339","172.64.155.249","192.168.0.183","TCP","1514","443  >  51124 [ACK] Seq=112791 Ack=5758 Win=53 Len=1460 [TCP segment of a reassembled PDU]"
"177","11.379339","172.64.155.249","192.168.0.183","TCP","1514","443  >  51124 [ACK] Seq=114251 Ack=5758 Win=53 Len=1460 [TCP segment of a reassembled PDU]"
"178","11.379339","172.64.155.249","192.168.0.183","TCP","1514","443  >  51124 [ACK] Seq=115711 Ack=5758 Win=53 Len=1460 [TCP segment of a reassembled PDU]"
"179","11.379339","172.64.155.249","192.168.0.183","TCP","1514","443  >  51124 [ACK] Seq=117171 Ack=5758 Win=53 Len=1460 [TCP segment of a reassembled PDU]"
"180","11.379339","172.64.155.249","192.168.0.183","TCP","1514","443  >  51124 [ACK] Seq=118631 Ack=5758 Win=53 Len=1460 [TCP segment of a reassembled PDU]"
"181","11.379339","172.64.155.249","192.168.0.183","TLSv1.2","620","Application Data"
"182","11.379339","172.64.155.249","192.168.0.183","TLSv1.2","96","Application Data"
"183","11.379339","172.64.155.249","192.168.0.183","TLSv1.2","85","Application Data"
"184","11.379412","192.168.0.183","172.64.155.249","TCP","54","51124  >  443 [ACK] Seq=5758 Ack=120730 Win=514 Len=0"
"185","11.592062","192.168.0.183","172.64.155.249","TLSv1.2","232","Application Data"
"186","11.592288","192.168.0.183","172.64.155.249","TLSv1.2","243","Application Data"
"187","11.622782","172.64.155.249","192.168.0.183","TCP","60","443  >  51124 [ACK] Seq=120730 Ack=5936 Win=54 Len=0"
"188","11.646506","172.64.155.249","192.168.0.183","TLSv1.2","162","Application Data"
"189","11.646506","172.64.155.249","192.168.0.183","TLSv1.2","225","Application Data"
"190","11.646506","172.64.155.249","192.168.0.183","TLSv1.2","85","Application Data"
"191","11.646547","192.168.0.183","172.64.155.249","TCP","54","51124  >  443 [ACK] Seq=6125 Ack=121040 Win=512 Len=0"
"192","11.672030","172.64.155.249","192.168.0.183","TLSv1.2","144","Application Data"
"193","11.672124","192.168.0.183","172.64.155.249","TCP","54","51124  >  443 [ACK] Seq=6125 Ack=121130 Win=512 Len=0"
"194","11.756934","192.168.0.183","172.64.155.249","TLSv1.2","448","Application Data"
"195","11.756982","192.168.0.183","172.64.155.249","TLSv1.2","546","Application Data"
"196","11.770162","172.64.155.249","192.168.0.183","TCP","60","443  >  51124 [ACK] Seq=121130 Ack=7011 Win=55 Len=0"
"197","11.797413","172.64.155.249","192.168.0.183","TLSv1.2","298","Application Data"
"198","11.797413","172.64.155.249","192.168.0.183","TLSv1.2","85","Application Data"
"199","11.797448","192.168.0.183","172.64.155.249","TCP","54","51124  >  443 [ACK] Seq=7011 Ack=121405 Win=511 Len=0"
"200","18.142811","192.168.0.183","172.64.155.249","TLSv1.2","166","Application Data"
"201","18.142899","192.168.0.183","172.64.155.249","TLSv1.2","170","Application Data"
"202","18.158416","192.168.0.183","172.64.155.249","TLSv1.2","180","Application Data"
"203","18.161831","172.64.155.249","192.168.0.183","TCP","60","443  >  51124 [ACK] Seq=121405 Ack=7239 Win=55 Len=0"
"204","18.177350","172.64.155.249","192.168.0.183","TLSv1.2","314","Application Data"
"205","18.208879","172.64.155.249","192.168.0.183","TLSv1.2","171","Application Data"
"206","18.208879","172.64.155.249","192.168.0.183","TLSv1.2","100","Application Data"
"207","18.208915","192.168.0.183","172.64.155.249","TCP","54","51124  >  443 [ACK] Seq=7365 Ack=121828 Win=509 Len=0"
"208","18.209733","192.168.0.183","172.64.155.249","TLSv1.2","89","Application Data"
"209","18.211342","172.64.155.249","192.168.0.183","TCP","1514","443  >  51124 [ACK] Seq=121828 Ack=7365 Win=55 Len=1460 [TCP segment of a reassembled PDU]"
"210","18.211342","172.64.155.249","192.168.0.183","TCP","1514","443  >  51124 [ACK] Seq=123288 Ack=7365 Win=55 Len=1460 [TCP segment of a reassembled PDU]"
"211","18.211342","172.64.155.249","192.168.0.183","TCP","1514","443  >  51124 [ACK] Seq=124748 Ack=7365 Win=55 Len=1460 [TCP segment of a reassembled PDU]"
"212","18.211342","172.64.155.249","192.168.0.183","TLSv1.2","701","Application Data"
"213","18.211342","172.64.155.249","192.168.0.183","TCP","1514","443  >  51124 [ACK] Seq=126855 Ack=7365 Win=55 Len=1460 [TCP segment of a reassembled PDU]"
"214","18.211385","192.168.0.183","172.64.155.249","TCP","54","51124  >  443 [ACK] Seq=7400 Ack=128315 Win=514 Len=0"
"215","18.212181","172.64.155.249","192.168.0.183","TCP","1514","443  >  51124 [ACK] Seq=128315 Ack=7365 Win=55 Len=1460 [TCP segment of a reassembled PDU]"
"216","18.212181","172.64.155.249","192.168.0.183","TCP","1514","443  >  51124 [ACK] Seq=129775 Ack=7365 Win=55 Len=1460 [TCP segment of a reassembled PDU]"
"217","18.212181","172.64.155.249","192.168.0.183","TLSv1.2","903","Application Data"
"218","18.212210","192.168.0.183","172.64.155.249","TCP","54","51124  >  443 [ACK] Seq=7400 Ack=132084 Win=514 Len=0"
"219","18.219645","172.64.155.249","192.168.0.183","TCP","1514","443  >  51124 [ACK] Seq=132084 Ack=7365 Win=55 Len=1460 [TCP segment of a reassembled PDU]"
"220","18.219645","172.64.155.249","192.168.0.183","TLSv1.2","1046","Application Data"
"221","18.219745","192.168.0.183","172.64.155.249","TCP","54","51124  >  443 [ACK] Seq=7400 Ack=134536 Win=514 Len=0"
"222","18.222487","172.64.155.249","192.168.0.183","TCP","1514","443  >  51124 [ACK] Seq=134536 Ack=7365 Win=55 Len=1460 [TCP segment of a reassembled PDU]"
"223","18.222487","172.64.155.249","192.168.0.183","TCP","1514","443  >  51124 [ACK] Seq=135996 Ack=7365 Win=55 Len=1460 [TCP segment of a reassembled PDU]"
"224","18.222487","172.64.155.249","192.168.0.183","TCP","1514","443  >  51124 [ACK] Seq=137456 Ack=7365 Win=55 Len=1460 [TCP segment of a reassembled PDU]"
"225","18.222487","172.64.155.249","192.168.0.183","TLSv1.2","293","Application Data"
"226","18.222591","192.168.0.183","172.64.155.249","TCP","54","51124  >  443 [ACK] Seq=7400 Ack=139155 Win=514 Len=0"
"227","18.226361","172.64.155.249","192.168.0.183","TCP","1514","443  >  51124 [ACK] Seq=139155 Ack=7400 Win=55 Len=1460 [TCP segment of a reassembled PDU]"
"228","18.226361","172.64.155.249","192.168.0.183","TCP","1514","443  >  51124 [ACK] Seq=140615 Ack=7400 Win=55 Len=1460 [TCP segment of a reassembled PDU]"
"229","18.226361","172.64.155.249","192.168.0.183","TCP","1514","443  >  51124 [ACK] Seq=142075 Ack=7400 Win=55 Len=1460 [TCP segment of a reassembled PDU]"
"230","18.226361","172.64.155.249","192.168.0.183","TCP","1514","443  >  51124 [ACK] Seq=143535 Ack=7400 Win=55 Len=1460 [TCP segment of a reassembled PDU]"
"231","18.226361","172.64.155.249","192.168.0.183","TCP","1514","443  >  51124 [ACK] Seq=144995 Ack=7400 Win=55 Len=1460 [TCP segment of a reassembled PDU]"
"232","18.226361","172.64.155.249","192.168.0.183","TCP","1514","443  >  51124 [PSH, ACK] Seq=146455 Ack=7400 Win=55 Len=1460 [TCP segment of a reassembled PDU]"
"233","18.226361","172.64.155.249","192.168.0.183","TCP","1514","443  >  51124 [ACK] Seq=147915 Ack=7400 Win=55 Len=1460 [TCP segment of a reassembled PDU]"
"234","18.226361","172.64.155.249","192.168.0.183","TCP","1514","443  >  51124 [ACK] Seq=149375 Ack=7400 Win=55 Len=1460 [TCP segment of a reassembled PDU]"
"235","18.226361","172.64.155.249","192.168.0.183","TCP","1514","443  >  51124 [ACK] Seq=150835 Ack=7400 Win=55 Len=1460 [TCP segment of a reassembled PDU]"
"236","18.226361","172.64.155.249","192.168.0.183","TCP","1514","443  >  51124 [ACK] Seq=152295 Ack=7400 Win=55 Len=1460 [TCP segment of a reassembled PDU]"
"237","18.226361","172.64.155.249","192.168.0.183","TLSv1.2","627","Application Data"
"238","18.226452","192.168.0.183","172.64.155.249","TCP","54","51124  >  443 [ACK] Seq=7400 Ack=154328 Win=514 Len=0"
"239","18.230521","172.64.155.249","192.168.0.183","TCP","1514","443  >  51124 [ACK] Seq=154328 Ack=7400 Win=55 Len=1460 [TCP segment of a reassembled PDU]"
"240","18.230521","172.64.155.249","192.168.0.183","TCP","1514","443  >  51124 [ACK] Seq=155788 Ack=7400 Win=55 Len=1460 [TCP segment of a reassembled PDU]"
"241","18.230521","172.64.155.249","192.168.0.183","TCP","1514","443  >  51124 [ACK] Seq=157248 Ack=7400 Win=55 Len=1460 [TCP segment of a reassembled PDU]"
"242","18.230521","172.64.155.249","192.168.0.183","TCP","1514","443  >  51124 [ACK] Seq=158708 Ack=7400 Win=55 Len=1460 [TCP segment of a reassembled PDU]"
"243","18.230521","172.64.155.249","192.168.0.183","TCP","1514","443  >  51124 [ACK] Seq=160168 Ack=7400 Win=55 Len=1460 [TCP segment of a reassembled PDU]"
"244","18.230521","172.64.155.249","192.168.0.183","TLSv1.2","107","Application Data"
"245","18.230604","192.168.0.183","172.64.155.249","TCP","54","51124  >  443 [ACK] Seq=7400 Ack=161681 Win=514 Len=0"
"246","18.232572","172.64.155.249","192.168.0.183","TCP","1514","443  >  51124 [ACK] Seq=161681 Ack=7400 Win=55 Len=1460 [TCP segment of a reassembled PDU]"
"247","18.232572","172.64.155.249","192.168.0.183","TLSv1.2","210","Application Data"
"248","18.232572","172.64.155.249","192.168.0.183","TLSv1.2","127","Application Data, Application Data"
"249","18.232609","192.168.0.183","172.64.155.249","TCP","54","51124  >  443 [ACK] Seq=7400 Ack=163370 Win=514 Len=0"
"250","18.289547","192.168.0.183","172.64.155.249","TLSv1.2","218","Application Data"
"251","18.289584","192.168.0.183","172.64.155.249","TLSv1.2","93","Application Data"
"252","18.305172","172.64.155.249","192.168.0.183","TCP","60","443  >  51134 [ACK] Seq=1433 Ack=600 Win=8 Len=0"
"253","18.305172","172.64.155.249","192.168.0.183","TLSv1.2","93","Application Data"
"254","18.331992","172.64.155.249","192.168.0.183","TLSv1.2","471","Application Data"
"255","18.331992","172.64.155.249","192.168.0.183","TLSv1.2","203","Application Data"
"256","18.331992","172.64.155.249","192.168.0.183","TLSv1.2","85","Application Data"
"257","18.332039","192.168.0.183","172.64.155.249","TCP","54","51134  >  443 [ACK] Seq=600 Ack=2069 Win=511 Len=0"
"258","18.333166","192.168.0.183","172.64.155.249","TLSv1.2","89","Application Data"
"259","18.402777","172.64.155.249","192.168.0.183","TCP","60","443  >  51134 [ACK] Seq=2069 Ack=635 Win=8 Len=0"
"260","18.486679","192.168.0.183","172.64.155.249","TLSv1.2","250","Application Data"
"261","18.523381","172.64.155.249","192.168.0.183","TLSv1.2","301","Application Data"
"262","18.570930","192.168.0.183","172.64.155.249","TCP","54","51124  >  443 [ACK] Seq=7596 Ack=163617 Win=513 Len=0"
"263","18.783814","192.168.0.183","172.64.155.249","TLSv1.2","992","Application Data"
"264","18.783897","192.168.0.183","172.64.155.249","TLSv1.2","603","Application Data"
"265","18.801223","172.64.155.249","192.168.0.183","TCP","60","443  >  51124 [ACK] Seq=163617 Ack=9083 Win=56 Len=0"
"266","18.826982","172.64.155.249","192.168.0.183","TLSv1.2","278","Application Data"
"267","18.826982","172.64.155.249","192.168.0.183","TLSv1.2","85","Application Data"
"268","18.827024","192.168.0.183","172.64.155.249","TCP","54","51124  >  443 [ACK] Seq=9083 Ack=163872 Win=512 Len=0"
"269","24.553602","192.168.0.183","172.64.155.249","TLSv1.2","362","Application Data"
"270","24.608007","172.64.155.249","192.168.0.183","TCP","60","443  >  51124 [ACK] Seq=163872 Ack=9391 Win=56 Len=0"
"271","24.688827","172.64.155.249","192.168.0.183","TLSv1.2","280","Application Data"
"272","24.688827","172.64.155.249","192.168.0.183","TLSv1.2","100","Application Data"
"273","24.688827","172.64.155.249","192.168.0.183","TCP","1514","443  >  51124 [ACK] Seq=164144 Ack=9391 Win=56 Len=1460 [TCP segment of a reassembled PDU]"
"274","24.688827","172.64.155.249","192.168.0.183","TCP","1514","443  >  51124 [ACK] Seq=165604 Ack=9391 Win=56 Len=1460 [TCP segment of a reassembled PDU]"
"275","24.688827","172.64.155.249","192.168.0.183","TCP","1514","443  >  51124 [ACK] Seq=167064 Ack=9391 Win=56 Len=1460 [TCP segment of a reassembled PDU]"
"276","24.688827","172.64.155.249","192.168.0.183","TLSv1.2","624","Application Data"
"277","24.688827","172.64.155.249","192.168.0.183","TCP","1514","443  >  51124 [ACK] Seq=169094 Ack=9391 Win=56 Len=1460 [TCP segment of a reassembled PDU]"
"278","24.688879","192.168.0.183","172.64.155.249","TCP","54","51124  >  443 [ACK] Seq=9391 Ack=170554 Win=514 Len=0"
"279","24.689788","192.168.0.183","172.64.155.249","TLSv1.2","89","Application Data"
"280","24.690712","172.64.155.249","192.168.0.183","TLSv1.2","933","Application Data"
"281","24.701705","172.64.155.249","192.168.0.183","TCP","1514","443  >  51124 [ACK] Seq=171433 Ack=9391 Win=56 Len=1460 [TCP segment of a reassembled PDU]"
"282","24.701705","172.64.155.249","192.168.0.183","TCP","1514","443  >  51124 [ACK] Seq=172893 Ack=9391 Win=56 Len=1460 [TCP segment of a reassembled PDU]"
"283","24.701705","172.64.155.249","192.168.0.183","TCP","1514","443  >  51124 [ACK] Seq=174353 Ack=9391 Win=56 Len=1460 [TCP segment of a reassembled PDU]"
"284","24.701705","172.64.155.249","192.168.0.183","TLSv1.2","561","Application Data"
"285","24.701705","172.64.155.249","192.168.0.183","TCP","1514","443  >  51124 [ACK] Seq=176320 Ack=9391 Win=56 Len=1460 [TCP segment of a reassembled PDU]"
"286","24.701705","172.64.155.249","192.168.0.183","TLSv1.2","205","Application Data"
"287","24.701705","172.64.155.249","192.168.0.183","TCP","60","443  >  51124 [ACK] Seq=177931 Ack=9426 Win=56 Len=0"
"288","24.701826","192.168.0.183","172.64.155.249","TCP","54","51124  >  443 [ACK] Seq=9426 Ack=177931 Win=514 Len=0"
"289","24.705062","172.64.155.249","192.168.0.183","TCP","1514","443  >  51124 [ACK] Seq=177931 Ack=9426 Win=56 Len=1460 [TCP segment of a reassembled PDU]"
"290","24.705062","172.64.155.249","192.168.0.183","TCP","1514","443  >  51124 [ACK] Seq=179391 Ack=9426 Win=56 Len=1460 [TCP segment of a reassembled PDU]"
"291","24.705062","172.64.155.249","192.168.0.183","TCP","1514","443  >  51124 [ACK] Seq=180851 Ack=9426 Win=56 Len=1460 [TCP segment of a reassembled PDU]"
"292","24.705062","172.64.155.249","192.168.0.183","TLSv1.2","278","Application Data"
"293","24.705062","172.64.155.249","192.168.0.183","TCP","1514","443  >  51124 [ACK] Seq=182535 Ack=9426 Win=56 Len=1460 [TCP segment of a reassembled PDU]"
"294","24.705062","172.64.155.249","192.168.0.183","TCP","1514","443  >  51124 [ACK] Seq=183995 Ack=9426 Win=56 Len=1460 [TCP segment of a reassembled PDU]"
"295","24.705142","192.168.0.183","172.64.155.249","TCP","54","51124  >  443 [ACK] Seq=9426 Ack=185455 Win=514 Len=0"
"296","24.705279","172.64.155.249","192.168.0.183","TLSv1.2","1268","Application Data"
"297","24.705279","172.64.155.249","192.168.0.183","TLSv1.2","96","Application Data"
"298","24.705279","172.64.155.249","192.168.0.183","TLSv1.2","85","Application Data"
"299","24.705319","192.168.0.183","172.64.155.249","TCP","54","51124  >  443 [ACK] Seq=9426 Ack=186742 Win=509 Len=0"
"300","24.978362","192.168.0.183","172.64.155.249","TLSv1.2","232","Application Data"
"301","24.978586","192.168.0.183","172.64.155.249","TLSv1.2","178","Application Data"
"302","24.991733","172.64.155.249","192.168.0.183","TCP","60","443  >  51124 [ACK] Seq=186742 Ack=9728 Win=56 Len=0"
"303","25.015817","172.64.155.249","192.168.0.183","TLSv1.2","286","Application Data"
"304","25.024487","172.64.155.249","192.168.0.183","TLSv1.2","146","Application Data"
"305","25.024487","172.64.155.249","192.168.0.183","TLSv1.2","224","Application Data"
"306","25.024487","172.64.155.249","192.168.0.183","TLSv1.2","85","Application Data"
"307","25.024525","192.168.0.183","172.64.155.249","TCP","54","51124  >  443 [ACK] Seq=9728 Ack=187267 Win=514 Len=0"
"308","25.104591","192.168.0.183","172.64.155.249","TLSv1.2","514","Application Data"
"309","25.104661","192.168.0.183","172.64.155.249","TLSv1.2","549","Application Data"
"310","25.120507","172.64.155.249","192.168.0.183","TCP","60","443  >  51124 [ACK] Seq=187267 Ack=10683 Win=57 Len=0"
"311","25.142596","172.64.155.249","192.168.0.183","TLSv1.2","144","Application Data"
"312","25.142596","172.64.155.249","192.168.0.183","TLSv1.2","85","Application Data"
"313","25.142627","192.168.0.183","172.64.155.249","TCP","54","51124  >  443 [ACK] Seq=10683 Ack=187388 Win=513 Len=0"
"314","31.315959","192.168.0.183","172.64.155.249","TLSv1.2","195","Application Data"
"315","31.316050","192.168.0.183","172.64.155.249","TLSv1.2","170","Application Data"
"316","31.327894","192.168.0.183","172.64.155.249","TLSv1.2","147","Application Data"
"317","31.329245","172.64.155.249","192.168.0.183","TCP","60","443  >  51124 [ACK] Seq=187388 Ack=10940 Win=57 Len=0"
"318","31.356559","172.64.155.249","192.168.0.183","TLSv1.2","279","Application Data"
"319","31.408879","192.168.0.183","172.64.155.249","TCP","54","51124  >  443 [ACK] Seq=11033 Ack=187613 Win=512 Len=0"
"320","31.493679","192.168.0.183","172.64.155.249","TLSv1.2","174","Application Data"
"321","31.534130","172.64.155.249","192.168.0.183","TLSv1.2","162","Application Data"
"322","31.534130","172.64.155.249","192.168.0.183","TCP","1514","443  >  51124 [ACK] Seq=187721 Ack=11153 Win=57 Len=1460 [TCP segment of a reassembled PDU]"
"323","31.534130","172.64.155.249","192.168.0.183","TLSv1.2","589","Application Data"
"324","31.534130","172.64.155.249","192.168.0.183","TLSv1.2","85","Application Data"
"325","31.534280","192.168.0.183","172.64.155.249","TCP","54","51124  >  443 [ACK] Seq=11153 Ack=189747 Win=514 Len=0"
"326","31.535547","192.168.0.183","172.64.155.249","TLSv1.2","89","Application Data"
"327","31.541615","172.64.155.249","192.168.0.183","TLSv1.2","183","Application Data"
"328","31.541615","172.64.155.249","192.168.0.183","TLSv1.2","85","Application Data"
"329","31.541654","192.168.0.183","172.64.155.249","TCP","54","51124  >  443 [ACK] Seq=11188 Ack=189907 Win=513 Len=0"
"330","31.552763","192.168.0.183","172.64.155.249","TLSv1.2","156","Application Data"
"331","31.559942","172.64.155.249","192.168.0.183","TCP","60","443  >  51124 [ACK] Seq=189907 Ack=11290 Win=57 Len=0"
"332","31.589520","172.64.155.249","192.168.0.183","TLSv1.2","146","Application Data"
"333","31.589520","172.64.155.249","192.168.0.183","TLSv1.2","100","Application Data"
"334","31.589520","172.64.155.249","192.168.0.183","TLSv1.2","1331","Application Data"
"335","31.589520","172.64.155.249","192.168.0.183","TCP","1514","443  >  51124 [ACK] Seq=191322 Ack=11290 Win=57 Len=1460 [TCP segment of a reassembled PDU]"
"336","31.589520","172.64.155.249","192.168.0.183","TCP","1514","443  >  51124 [ACK] Seq=192782 Ack=11290 Win=57 Len=1460 [TCP segment of a reassembled PDU]"
"337","31.589568","192.168.0.183","172.64.155.249","TCP","54","51124  >  443 [ACK] Seq=11290 Ack=194242 Win=514 Len=0"
"338","31.589638","172.64.155.249","192.168.0.183","TCP","1514","443  >  51124 [ACK] Seq=194242 Ack=11290 Win=57 Len=1460 [TCP segment of a reassembled PDU]"
"339","31.589638","172.64.155.249","192.168.0.183","TLSv1.2","494","Application Data"
"340","31.589638","172.64.155.249","192.168.0.183","TCP","1514","443  >  51124 [ACK] Seq=196142 Ack=11290 Win=57 Len=1460 [TCP segment of a reassembled PDU]"
"341","31.589638","172.64.155.249","192.168.0.183","TLSv1.2","1481","Application Data"
"342","31.589663","192.168.0.183","172.64.155.249","TCP","54","51124  >  443 [ACK] Seq=11290 Ack=199029 Win=514 Len=0"
"343","31.596158","172.64.155.249","192.168.0.183","TCP","1514","443  >  51124 [ACK] Seq=199029 Ack=11290 Win=57 Len=1460 [TCP segment of a reassembled PDU]"
"344","31.596158","172.64.155.249","192.168.0.183","TLSv1.2","1135","Application Data"
"345","31.596232","192.168.0.183","172.64.155.249","TCP","54","51124  >  443 [ACK] Seq=11290 Ack=201570 Win=514 Len=0"
"346","31.597793","172.64.155.249","192.168.0.183","TCP","1514","443  >  51124 [ACK] Seq=201570 Ack=11290 Win=57 Len=1460 [TCP segment of a reassembled PDU]"
"347","31.597793","172.64.155.249","192.168.0.183","TLSv1.2","1119","Application Data"
"348","31.597793","172.64.155.249","192.168.0.183","TLSv1.2","96","Application Data"
"349","31.597793","172.64.155.249","192.168.0.183","TLSv1.2","85","Application Data"
"350","31.597952","192.168.0.183","172.64.155.249","TCP","54","51124  >  443 [ACK] Seq=11290 Ack=204168 Win=514 Len=0"
"351","32.140652","192.168.0.183","172.64.155.249","TLSv1.2","544","Application Data"
"352","32.140745","192.168.0.183","172.64.155.249","TLSv1.2","567","Application Data"
"353","32.157147","172.64.155.249","192.168.0.183","TCP","60","443  >  51124 [ACK] Seq=204168 Ack=12293 Win=58 Len=0"
"354","32.176189","172.64.155.249","192.168.0.183","TLSv1.2","298","Application Data"
"355","32.176189","172.64.155.249","192.168.0.183","TLSv1.2","85","Application Data"
"356","32.176245","192.168.0.183","172.64.155.249","TCP","54","51124  >  443 [ACK] Seq=12293 Ack=204443 Win=512 Len=0"
"357","34.247581","192.168.0.183","172.64.155.249","TLSv1.2","700","Application Data"
"358","34.247676","192.168.0.183","172.64.155.249","TCP","1454","51124  >  443 [ACK] Seq=12939 Ack=204443 Win=512 Len=1400 [TCP segment of a reassembled PDU]"
"359","34.247676","192.168.0.183","172.64.155.249","TLSv1.2","427","Application Data"
"360","34.262533","172.64.155.249","192.168.0.183","TCP","60","443  >  51124 [ACK] Seq=204443 Ack=14712 Win=59 Len=0"
"361","34.388438","172.64.155.249","192.168.0.183","TLSv1.2","540","Application Data"
"362","34.388438","172.64.155.249","192.168.0.183","TLSv1.2","85","Application Data"
"363","34.388479","192.168.0.183","172.64.155.249","TCP","54","51124  >  443 [ACK] Seq=14712 Ack=204960 Win=510 Len=0"
"364","34.395526","192.168.0.183","172.64.155.249","TLSv1.2","172","Application Data"
"365","34.443913","172.64.155.249","192.168.0.183","TCP","60","443  >  51124 [ACK] Seq=204960 Ack=14830 Win=59 Len=0"
"366","34.675674","172.64.155.249","192.168.0.183","TLSv1.2","170","Application Data"
"367","34.675674","172.64.155.249","192.168.0.183","TLSv1.2","100","Application Data"
"368","34.675674","172.64.155.249","192.168.0.183","TLSv1.2","1324","Application Data"
"369","34.675717","192.168.0.183","172.64.155.249","TCP","54","51124  >  443 [ACK] Seq=14830 Ack=206392 Win=514 Len=0"
"370","34.677366","172.64.155.249","192.168.0.183","TCP","1514","443  >  51124 [ACK] Seq=206392 Ack=14830 Win=59 Len=1460 [TCP segment of a reassembled PDU]"
"371","34.677366","172.64.155.249","192.168.0.183","TCP","1514","443  >  51124 [ACK] Seq=207852 Ack=14830 Win=59 Len=1460 [TCP segment of a reassembled PDU]"
"372","34.677366","172.64.155.249","192.168.0.183","TCP","1514","443  >  51124 [ACK] Seq=209312 Ack=14830 Win=59 Len=1460 [TCP segment of a reassembled PDU]"
"373","34.677366","172.64.155.249","192.168.0.183","TCP","1514","443  >  51124 [ACK] Seq=210772 Ack=14830 Win=59 Len=1460 [TCP segment of a reassembled PDU]"
"374","34.677366","172.64.155.249","192.168.0.183","TLSv1.2","387","Application Data"
"375","34.677422","192.168.0.183","172.64.155.249","TCP","54","51124  >  443 [ACK] Seq=14830 Ack=212565 Win=514 Len=0"
"376","34.688222","172.64.155.249","192.168.0.183","TCP","1514","443  >  51124 [ACK] Seq=212565 Ack=14830 Win=59 Len=1460 [TCP segment of a reassembled PDU]"
"377","34.688222","172.64.155.249","192.168.0.183","TCP","1514","443  >  51124 [ACK] Seq=214025 Ack=14830 Win=59 Len=1460 [TCP segment of a reassembled PDU]"
"378","34.688222","172.64.155.249","192.168.0.183","TLSv1.2","1114","Application Data"
"379","34.688222","172.64.155.249","192.168.0.183","TCP","1514","443  >  51124 [ACK] Seq=216545 Ack=14830 Win=59 Len=1460 [TCP segment of a reassembled PDU]"
"380","34.688222","172.64.155.249","192.168.0.183","TLSv1.2","1201","Application Data"
"381","34.688293","192.168.0.183","172.64.155.249","TCP","54","51124  >  443 [ACK] Seq=14830 Ack=219152 Win=514 Len=0"
"382","34.690508","172.64.155.249","192.168.0.183","TCP","1514","443  >  51124 [ACK] Seq=219152 Ack=14830 Win=59 Len=1460 [TCP segment of a reassembled PDU]"
"383","34.690508","172.64.155.249","192.168.0.183","TCP","1514","443  >  51124 [ACK] Seq=220612 Ack=14830 Win=59 Len=1460 [TCP segment of a reassembled PDU]"
"384","34.690508","172.64.155.249","192.168.0.183","TLSv1.2","1123","Application Data"
"385","34.690508","172.64.155.249","192.168.0.183","TCP","1514","443  >  51124 [ACK] Seq=223141 Ack=14830 Win=59 Len=1460 [TCP segment of a reassembled PDU]"
"386","34.690508","172.64.155.249","192.168.0.183","TCP","1514","443  >  51124 [ACK] Seq=224601 Ack=14830 Win=59 Len=1460 [TCP segment of a reassembled PDU]"
"387","34.690508","172.64.155.249","192.168.0.183","TLSv1.2","123","Application Data"
"388","34.690508","172.64.155.249","192.168.0.183","TCP","1514","443  >  51124 [ACK] Seq=226130 Ack=14830 Win=59 Len=1460 [TCP segment of a reassembled PDU]"
"389","34.690508","172.64.155.249","192.168.0.183","TCP","1514","443  >  51124 [ACK] Seq=227590 Ack=14830 Win=59 Len=1460 [TCP segment of a reassembled PDU]"
"390","34.690508","172.64.155.249","192.168.0.183","TCP","1514","443  >  51124 [ACK] Seq=229050 Ack=14830 Win=59 Len=1460 [TCP segment of a reassembled PDU]"
"391","34.690508","172.64.155.249","192.168.0.183","TLSv1.2","866","Application Data"
"392","34.690564","192.168.0.183","172.64.155.249","TCP","54","51124  >  443 [ACK] Seq=14830 Ack=231322 Win=514 Len=0"
"393","34.697882","172.64.155.249","192.168.0.183","TCP","1514","443  >  51124 [ACK] Seq=231322 Ack=14830 Win=59 Len=1460 [TCP segment of a reassembled PDU]"
"394","34.697882","172.64.155.249","192.168.0.183","TCP","1514","443  >  51124 [ACK] Seq=232782 Ack=14830 Win=59 Len=1460 [TCP segment of a reassembled PDU]"
"395","34.697882","172.64.155.249","192.168.0.183","TCP","1514","443  >  51124 [ACK] Seq=234242 Ack=14830 Win=59 Len=1460 [TCP segment of a reassembled PDU]"
"396","34.697882","172.64.155.249","192.168.0.183","TCP","1514","443  >  51124 [ACK] Seq=235702 Ack=14830 Win=59 Len=1460 [TCP segment of a reassembled PDU]"
"397","34.697882","172.64.155.249","192.168.0.183","TCP","1514","443  >  51124 [ACK] Seq=237162 Ack=14830 Win=59 Len=1460 [TCP segment of a reassembled PDU]"
"398","34.697882","172.64.155.249","192.168.0.183","TLSv1.2","668","Application Data"
"399","34.697882","172.64.155.249","192.168.0.183","TLSv1.2","96","Application Data"
"400","34.697882","172.64.155.249","192.168.0.183","TLSv1.2","85","Application Data"
"401","34.697946","192.168.0.183","172.64.155.249","TCP","54","51124  >  443 [ACK] Seq=14830 Ack=239309 Win=514 Len=0"
"402","34.902968","192.168.0.183","172.64.155.249","TLSv1.2","184","Application Data"
"403","34.903082","192.168.0.183","172.64.155.249","TLSv1.2","93","Application Data"
"404","34.916352","172.64.155.249","192.168.0.183","TCP","60","443  >  51134 [ACK] Seq=2069 Ack=804 Win=8 Len=0"
"405","34.916352","172.64.155.249","192.168.0.183","TLSv1.2","93","Application Data"
"406","34.945784","172.64.155.249","192.168.0.183","TLSv1.2","472","Application Data"
"407","34.945784","172.64.155.249","192.168.0.183","TLSv1.2","203","Application Data"
"408","34.945784","172.64.155.249","192.168.0.183","TLSv1.2","85","Application Data"
"409","34.945840","192.168.0.183","172.64.155.249","TCP","54","51134  >  443 [ACK] Seq=804 Ack=2706 Win=509 Len=0"
"410","34.947606","192.168.0.183","172.64.155.249","TLSv1.2","89","Application Data"
"411","35.000736","172.64.155.249","192.168.0.183","TCP","60","443  >  51134 [ACK] Seq=2706 Ack=839 Win=8 Len=0"
"412","35.182648","192.168.0.183","172.64.155.249","TLSv1.2","564","Application Data"
"413","35.182717","192.168.0.183","172.64.155.249","TLSv1.2","586","Application Data"
"414","35.204163","172.64.155.249","192.168.0.183","TCP","60","443  >  51124 [ACK] Seq=239309 Ack=15872 Win=59 Len=0"
"415","35.229903","172.64.155.249","192.168.0.183","TLSv1.2","278","Application Data"
"416","35.229903","172.64.155.249","192.168.0.183","TLSv1.2","85","Application Data"
"417","35.229946","192.168.0.183","172.64.155.249","TCP","54","51124  >  443 [ACK] Seq=15872 Ack=239564 Win=513 Len=0"
