"No.","Time","Source","Destination","Protocol","Length","Info"
"1","0.000000","192.168.0.183","172.64.155.249","TLSv1.2","423","Application Data"
"2","0.000058","192.168.0.183","172.64.155.249","TLSv1.2","93","Application Data"
"3","0.000085","192.168.0.183","172.64.155.249","TLSv1.2","170","Application Data"
"4","0.010284","192.168.0.183","172.64.155.249","TLSv1.2","507","Application Data"
"5","0.015423","172.64.155.249","192.168.0.183","TCP","60","443  >  51124 [ACK] Seq=1 Ack=525 Win=119 Len=0"
"6","0.015423","172.64.155.249","192.168.0.183","TLSv1.2","93","Application Data"
"7","0.046614","172.64.155.249","192.168.0.183","TLSv1.2","279","Application Data"
"8","0.046679","192.168.0.183","172.64.155.249","TCP","54","51124  >  443 [ACK] Seq=978 Ack=265 Win=510 Len=0"
"9","0.061114","172.64.155.249","192.168.0.183","TLSv1.2","146","Application Data"
"10","0.061114","172.64.155.249","192.168.0.183","TLSv1.2","100","Application Data"
"11","0.061157","192.168.0.183","172.64.155.249","TCP","54","51124  >  443 [ACK] Seq=978 Ack=403 Win=509 Len=0"
"12","0.062127","192.168.0.183","172.64.155.249","TLSv1.2","89","Application Data"
"13","0.065418","172.64.155.249","192.168.0.183","TLSv1.2","1312","Application Data"
"14","0.065418","172.64.155.249","192.168.0.183","TCP","1514","443  >  51124 [ACK] Seq=1661 Ack=978 Win=119 Len=1460 [TCP segment of a reassembled PDU]"
"15","0.065418","172.64.155.249","192.168.0.183","TCP","1514","443  >  51124 [ACK] Seq=3121 Ack=978 Win=119 Len=1460 [TCP segment of a reassembled PDU]"
"16","0.065418","172.64.155.249","192.168.0.183","TCP","1514","443  >  51124 [ACK] Seq=4581 Ack=978 Win=119 Len=1460 [TCP segment of a reassembled PDU]"
"17","0.065418","172.64.155.249","192.168.0.183","TCP","1514","443  >  51124 [ACK] Seq=6041 Ack=978 Win=119 Len=1460 [TCP segment of a reassembled PDU]"
"18","0.065418","172.64.155.249","192.168.0.183","TCP","1514","443  >  51124 [ACK] Seq=7501 Ack=978 Win=119 Len=1460 [TCP segment of a reassembled PDU]"
"19","0.065418","172.64.155.249","192.168.0.183","TLSv1.2","355","Application Data"
"20","0.065568","192.168.0.183","172.64.155.249","TCP","54","51124  >  443 [ACK] Seq=1013 Ack=9262 Win=514 Len=0"
"21","0.074639","172.64.155.249","192.168.0.183","TCP","1514","443  >  51124 [ACK] Seq=9262 Ack=978 Win=119 Len=1460 [TCP segment of a reassembled PDU]"
"22","0.074639","172.64.155.249","192.168.0.183","TLSv1.2","1063","Application Data"
"23","0.074639","172.64.155.249","192.168.0.183","TCP","1514","443  >  51124 [ACK] Seq=11731 Ack=978 Win=119 Len=1460 [TCP segment of a reassembled PDU]"
"24","0.074943","192.168.0.183","172.64.155.249","TCP","54","51124  >  443 [ACK] Seq=1013 Ack=11731 Win=514 Len=0"
"25","0.075054","192.168.0.183","172.64.155.249","TCP","54","51124  >  443 [ACK] Seq=1013 Ack=13191 Win=514 Len=0"
"26","0.078285","172.64.155.249","192.168.0.183","TCP","1514","443  >  51124 [ACK] Seq=13191 Ack=978 Win=119 Len=1460 [TCP segment of a reassembled PDU]"
"27","0.078285","172.64.155.249","192.168.0.183","TLSv1.2","961","Application Data"
"28","0.078285","172.64.155.249","192.168.0.183","TCP","1514","443  >  51124 [ACK] Seq=15558 Ack=978 Win=119 Len=1460 [TCP segment of a reassembled PDU]"
"29","0.078285","172.64.155.249","192.168.0.183","TCP","1514","443  >  51124 [ACK] Seq=17018 Ack=978 Win=119 Len=1460 [TCP segment of a reassembled PDU]"
"30","0.078285","172.64.155.249","192.168.0.183","TLSv1.2","1063","Application Data"
"31","0.078374","192.168.0.183","172.64.155.249","TCP","54","51124  >  443 [ACK] Seq=1013 Ack=19487 Win=514 Len=0"
"32","0.079102","172.64.155.249","192.168.0.183","TCP","1514","443  >  51124 [ACK] Seq=19487 Ack=1013 Win=119 Len=1460 [TCP segment of a reassembled PDU]"
"33","0.079102","172.64.155.249","192.168.0.183","TCP","1514","443  >  51124 [ACK] Seq=20947 Ack=1013 Win=119 Len=1460 [TCP segment of a reassembled PDU]"
"34","0.079102","172.64.155.249","192.168.0.183","TCP","1514","443  >  51124 [ACK] Seq=22407 Ack=1013 Win=119 Len=1460 [TCP segment of a reassembled PDU]"
"35","0.079102","172.64.155.249","192.168.0.183","TCP","1514","443  >  51124 [ACK] Seq=23867 Ack=1013 Win=119 Len=1460 [TCP segment of a reassembled PDU]"
"36","0.079102","172.64.155.249","192.168.0.183","TCP","1514","443  >  51124 [ACK] Seq=25327 Ack=1013 Win=119 Len=1460 [TCP segment of a reassembled PDU]"
"37","0.079102","172.64.155.249","192.168.0.183","TLSv1.2","1123","Application Data"
"38","0.079191","192.168.0.183","172.64.155.249","TCP","54","51124  >  443 [ACK] Seq=1013 Ack=27856 Win=514 Len=0"
"39","0.083916","172.64.155.249","192.168.0.183","TCP","1514","443  >  51124 [ACK] Seq=27856 Ack=1013 Win=119 Len=1460 [TCP segment of a reassembled PDU]"
"40","0.083916","172.64.155.249","192.168.0.183","TCP","1514","443  >  51124 [ACK] Seq=29316 Ack=1013 Win=119 Len=1460 [TCP segment of a reassembled PDU]"
"41","0.083916","172.64.155.249","192.168.0.183","TCP","1514","443  >  51124 [ACK] Seq=30776 Ack=1013 Win=119 Len=1460 [TCP segment of a reassembled PDU]"
"42","0.083916","172.64.155.249","192.168.0.183","TLSv1.2","147","Application Data"
"43","0.083971","192.168.0.183","172.64.155.249","TCP","54","51124  >  443 [ACK] Seq=1013 Ack=32329 Win=514 Len=0"
"44","0.086204","172.64.155.249","192.168.0.183","TCP","1514","443  >  51124 [ACK] Seq=32329 Ack=1013 Win=119 Len=1460 [TCP segment of a reassembled PDU]"
"45","0.086204","172.64.155.249","192.168.0.183","TCP","1514","443  >  51124 [ACK] Seq=33789 Ack=1013 Win=119 Len=1460 [TCP segment of a reassembled PDU]"
"46","0.086204","172.64.155.249","192.168.0.183","TCP","1514","443  >  51124 [ACK] Seq=35249 Ack=1013 Win=119 Len=1460 [TCP segment of a reassembled PDU]"
"47","0.086204","172.64.155.249","192.168.0.183","TLSv1.2","659","Application Data"
"48","0.086204","172.64.155.249","192.168.0.183","TCP","1514","443  >  51124 [ACK] Seq=37314 Ack=1013 Win=119 Len=1460 [TCP segment of a reassembled PDU]"
"49","0.086204","172.64.155.249","192.168.0.183","TCP","1514","443  >  51124 [ACK] Seq=38774 Ack=1013 Win=119 Len=1460 [TCP segment of a reassembled PDU]"
"50","0.086204","172.64.155.249","192.168.0.183","TCP","1514","443  >  51124 [ACK] Seq=40234 Ack=1013 Win=119 Len=1460 [TCP segment of a reassembled PDU]"
"51","0.086204","172.64.155.249","192.168.0.183","TCP","1514","443  >  51124 [ACK] Seq=41694 Ack=1013 Win=119 Len=1460 [TCP segment of a reassembled PDU]"
"52","0.086204","172.64.155.249","192.168.0.183","TCP","1514","443  >  51124 [ACK] Seq=43154 Ack=1013 Win=119 Len=1460 [TCP segment of a reassembled PDU]"
"53","0.086204","172.64.155.249","192.168.0.183","TLSv1.2","1096","Application Data"
"54","0.086204","172.64.155.249","192.168.0.183","TLSv1.2","96","Application Data"
"55","0.086204","172.64.155.249","192.168.0.183","TLSv1.2","85","Application Data"
"56","0.086338","192.168.0.183","172.64.155.249","TCP","54","51124  >  443 [ACK] Seq=1013 Ack=45729 Win=514 Len=0"
"57","0.134938","192.168.0.183","172.64.155.249","TLSv1.2","227","Application Data"
"58","0.134964","192.168.0.183","172.64.155.249","TLSv1.2","93","Application Data"
"59","0.135114","192.168.0.183","172.64.155.249","TLSv1.2","273","Application Data"
"60","0.153271","172.64.155.249","192.168.0.183","TCP","60","443  >  51134 [ACK] Seq=1 Ack=213 Win=8 Len=0"
"61","0.153271","172.64.155.249","192.168.0.183","TLSv1.2","93","Application Data"
"62","0.183474","172.64.155.249","192.168.0.183","TLSv1.2","180","Application Data"
"63","0.183474","172.64.155.249","192.168.0.183","TLSv1.2","120","Application Data"
"64","0.183474","172.64.155.249","192.168.0.183","TLSv1.2","85","Application Data"
"65","0.183528","192.168.0.183","172.64.155.249","TCP","54","51124  >  443 [ACK] Seq=1232 Ack=45952 Win=513 Len=0"
"66","0.192884","172.64.155.249","192.168.0.183","TLSv1.2","669","Application Data"
"67","0.192884","172.64.155.249","192.168.0.183","TLSv1.2","203","Application Data"
"68","0.192884","172.64.155.249","192.168.0.183","TLSv1.2","85","Application Data"
"69","0.192941","192.168.0.183","172.64.155.249","TCP","54","51134  >  443 [ACK] Seq=213 Ack=835 Win=510 Len=0"
"70","0.193883","192.168.0.183","172.64.155.249","TLSv1.2","89","Application Data"
"71","0.246263","172.64.155.249","192.168.0.183","TCP","60","443  >  51134 [ACK] Seq=835 Ack=248 Win=8 Len=0"
"72","0.438060","192.168.0.183","172.64.155.249","TLSv1.2","219","Application Data"
"73","0.475025","172.64.155.249","192.168.0.183","TLSv1.2","144","Application Data"
"74","0.523264","192.168.0.183","172.64.155.249","TCP","54","51124  >  443 [ACK] Seq=1397 Ack=46042 Win=512 Len=0"
"75","0.737555","192.168.0.183","172.64.155.249","TLSv1.2","525","Application Data"
"76","0.737628","192.168.0.183","172.64.155.249","TLSv1.2","597","Application Data"
"77","0.760378","172.64.155.249","192.168.0.183","TCP","60","443  >  51124 [ACK] Seq=46042 Ack=2411 Win=121 Len=0"
"78","0.783563","172.64.155.249","192.168.0.183","TLSv1.2","435","Application Data"
"79","0.783563","172.64.155.249","192.168.0.183","TLSv1.2","85","Application Data"
"80","0.783589","192.168.0.183","172.64.155.249","TCP","54","51124  >  443 [ACK] Seq=2411 Ack=46454 Win=511 Len=0"
"81","3.727305","192.168.0.183","172.64.155.249","TLSv1.2","279","Application Data"
"82","3.782346","172.64.155.249","192.168.0.183","TCP","60","443  >  51124 [ACK] Seq=46454 Ack=2636 Win=121 Len=0"
"83","3.852424","172.64.155.249","192.168.0.183","TLSv1.2","299","Application Data"
"84","3.852424","172.64.155.249","192.168.0.183","TLSv1.2","100","Application Data"
"85","3.852424","172.64.155.249","192.168.0.183","TCP","1514","443  >  51124 [ACK] Seq=46745 Ack=2636 Win=121 Len=1460 [TCP segment of a reassembled PDU]"
"86","3.852468","192.168.0.183","172.64.155.249","TCP","54","51124  >  443 [ACK] Seq=2636 Ack=48205 Win=514 Len=0"
"87","3.853402","172.64.155.249","192.168.0.183","TCP","1514","443  >  51124 [ACK] Seq=48205 Ack=2636 Win=121 Len=1460 [TCP segment of a reassembled PDU]"
"88","3.853402","172.64.155.249","192.168.0.183","TCP","1514","443  >  51124 [ACK] Seq=49665 Ack=2636 Win=121 Len=1460 [TCP segment of a reassembled PDU]"
"89","3.853402","172.64.155.249","192.168.0.183","TCP","1514","443  >  51124 [ACK] Seq=51125 Ack=2636 Win=121 Len=1460 [TCP segment of a reassembled PDU]"
"90","3.853402","172.64.155.249","192.168.0.183","TCP","1514","443  >  51124 [ACK] Seq=52585 Ack=2636 Win=121 Len=1460 [TCP segment of a reassembled PDU]"
"91","3.853402","172.64.155.249","192.168.0.183","TLSv1.2","322","Application Data"
"92","3.853432","192.168.0.183","172.64.155.249","TCP","54","51124  >  443 [ACK] Seq=2636 Ack=54313 Win=514 Len=0"
"93","3.862315","172.64.155.249","192.168.0.183","TCP","1514","443  >  51124 [ACK] Seq=54313 Ack=2636 Win=121 Len=1460 [TCP segment of a reassembled PDU]"
"94","3.862315","172.64.155.249","192.168.0.183","TCP","1514","443  >  51124 [ACK] Seq=55773 Ack=2636 Win=121 Len=1460 [TCP segment of a reassembled PDU]"
"95","3.862315","172.64.155.249","192.168.0.183","TCP","1514","443  >  51124 [ACK] Seq=57233 Ack=2636 Win=121 Len=1460 [TCP segment of a reassembled PDU]"
"96","3.862315","172.64.155.249","192.168.0.183","TLSv1.2","471","Application Data"
"97","3.862315","172.64.155.249","192.168.0.183","TLSv1.2","1239","Application Data"
"98","3.862389","192.168.0.183","172.64.155.249","TCP","54","51124  >  443 [ACK] Seq=2636 Ack=60295 Win=514 Len=0"
"99","3.864834","172.64.155.249","192.168.0.183","TCP","1514","443  >  51124 [ACK] Seq=60295 Ack=2636 Win=121 Len=1460 [TCP segment of a reassembled PDU]"
"100","3.864834","172.64.155.249","192.168.0.183","TCP","1514","443  >  51124 [ACK] Seq=61755 Ack=2636 Win=121 Len=1460 [TCP segment of a reassembled PDU]"
"101","3.864834","172.64.155.249","192.168.0.183","TCP","1514","443  >  51124 [ACK] Seq=63215 Ack=2636 Win=121 Len=1460 [TCP segment of a reassembled PDU]"
"102","3.864834","172.64.155.249","192.168.0.183","TCP","1514","443  >  51124 [ACK] Seq=64675 Ack=2636 Win=121 Len=1460 [TCP segment of a reassembled PDU]"
"103","3.864834","172.64.155.249","192.168.0.183","TCP","1514","443  >  51124 [ACK] Seq=66135 Ack=2636 Win=121 Len=1460 [TCP segment of a reassembled PDU]"
"104","3.864834","172.64.155.249","192.168.0.183","TCP","1514","443  >  51124 [PSH, ACK] Seq=67595 Ack=2636 Win=121 Len=1460 [TCP segment of a reassembled PDU]"
"105","3.864834","172.64.155.249","192.168.0.183","TLSv1.2","576","Application Data"
"106","3.864834","172.64.155.249","192.168.0.183","TLSv1.2","127","Application Data, Application Data"
"107","3.864919","192.168.0.183","172.64.155.249","TCP","54","51124  >  443 [ACK] Seq=2636 Ack=69650 Win=514 Len=0"
"108","4.057156","192.168.0.183","172.64.155.249","TLSv1.2","183","Application Data"
"109","4.057450","192.168.0.183","172.64.155.249","TLSv1.2","200","Application Data"
"110","4.068938","172.64.155.249","192.168.0.183","TCP","60","443  >  51124 [ACK] Seq=69650 Ack=2911 Win=122 Len=0"
"111","4.091756","172.64.155.249","192.168.0.183","TLSv1.2","144","Application Data"
"112","4.100684","172.64.155.249","192.168.0.183","TLSv1.2","150","Application Data"
"113","4.100684","172.64.155.249","192.168.0.183","TLSv1.2","223","Application Data"
"114","4.100684","172.64.155.249","192.168.0.183","TLSv1.2","85","Application Data"
"115","4.100724","192.168.0.183","172.64.155.249","TCP","54","51124  >  443 [ACK] Seq=2911 Ack=70036 Win=512 Len=0"
"116","4.135317","172.64.155.249","192.168.0.183","TCP","85","[TCP Spurious Retransmission] 443  >  51124 [PSH, ACK] Seq=70005 Ack=2911 Win=122 Len=31"
"117","4.135357","192.168.0.183","172.64.155.249","TCP","66","[TCP Dup ACK 115#1] 51124  >  443 [ACK] Seq=2911 Ack=70036 Win=512 Len=0 SLE=70005 SRE=70036"
"118","4.227719","192.168.0.183","172.64.155.249","TLSv1.2","491","Application Data"
"119","4.227786","192.168.0.183","172.64.155.249","TLSv1.2","538","Application Data"
"120","4.242957","172.64.155.249","192.168.0.183","TCP","60","443  >  51124 [ACK] Seq=70036 Ack=3832 Win=122 Len=0"
"121","4.267559","172.64.155.249","192.168.0.183","TLSv1.2","144","Application Data"
"122","4.267559","172.64.155.249","192.168.0.183","TLSv1.2","85","Application Data"
"123","4.267592","192.168.0.183","172.64.155.249","TCP","54","51124  >  443 [ACK] Seq=3832 Ack=70157 Win=512 Len=0"
"124","6.145138","192.168.0.183","172.64.155.249","TLSv1.2","424","Application Data"
"125","6.145204","192.168.0.183","172.64.155.249","TLSv1.2","170","Application Data"
"126","6.153818","192.168.0.183","172.64.155.249","TLSv1.2","478","Application Data"
"127","6.167742","172.64.155.249","192.168.0.183","TCP","60","443  >  51124 [ACK] Seq=70157 Ack=4318 Win=123 Len=0"
"128","6.184586","172.64.155.249","192.168.0.183","TLSv1.2","278","Application Data"
"129","6.192791","172.64.155.249","192.168.0.183","TLSv1.2","184","Application Data"
"130","6.192791","172.64.155.249","192.168.0.183","TLSv1.2","85","Application Data"
"131","6.192839","192.168.0.183","172.64.155.249","TCP","54","51124  >  443 [ACK] Seq=4742 Ack=70542 Win=510 Len=0"
"132","6.200741","192.168.0.183","172.64.155.249","TLSv1.2","170","Application Data"
"133","6.240710","172.64.155.249","192.168.0.183","TLSv1.2","164","Application Data"
"134","6.240710","172.64.155.249","192.168.0.183","TLSv1.2","100","Application Data"
"135","6.240710","172.64.155.249","192.168.0.183","TLSv1.2","1331","Application Data"
"136","6.240710","172.64.155.249","192.168.0.183","TCP","1514","443  >  51124 [ACK] Seq=71975 Ack=4858 Win=123 Len=1460 [TCP segment of a reassembled PDU]"
"137","6.240710","172.64.155.249","192.168.0.183","TCP","1514","443  >  51124 [ACK] Seq=73435 Ack=4858 Win=123 Len=1460 [TCP segment of a reassembled PDU]"
"138","6.240710","172.64.155.249","192.168.0.183","TLSv1.2","938","Application Data"
"139","6.240796","192.168.0.183","172.64.155.249","TCP","54","51124  >  443 [ACK] Seq=4858 Ack=75779 Win=514 Len=0"
"140","6.241986","192.168.0.183","172.64.155.249","TLSv1.2","89","Application Data"
"141","6.245386","172.64.155.249","192.168.0.183","TCP","1514","443  >  51124 [ACK] Seq=75779 Ack=4858 Win=123 Len=1460 [TCP segment of a reassembled PDU]"
"142","6.245386","172.64.155.249","192.168.0.183","TCP","1514","443  >  51124 [ACK] Seq=77239 Ack=4858 Win=123 Len=1460 [TCP segment of a reassembled PDU]"
"143","6.245386","172.64.155.249","192.168.0.183","TCP","1514","443  >  51124 [ACK] Seq=78699 Ack=4858 Win=123 Len=1460 [TCP segment of a reassembled PDU]"
"144","6.245386","172.64.155.249","192.168.0.183","TLSv1.2","216","Application Data"
"145","6.245470","192.168.0.183","172.64.155.249","TCP","54","51124  >  443 [ACK] Seq=4893 Ack=80321 Win=514 Len=0"
"146","6.251320","172.64.155.249","192.168.0.183","TCP","1514","443  >  51124 [ACK] Seq=80321 Ack=4858 Win=123 Len=1460 [TCP segment of a reassembled PDU]"
"147","6.251320","172.64.155.249","192.168.0.183","TLSv1.2","1316","Application Data"
"148","6.251320","172.64.155.249","192.168.0.183","TCP","1514","443  >  51124 [ACK] Seq=83043 Ack=4858 Win=123 Len=1460 [TCP segment of a reassembled PDU]"
"149","6.251320","172.64.155.249","192.168.0.183","TLSv1.2","307","Application Data"
"150","6.251320","172.64.155.249","192.168.0.183","TLSv1.2","127","Application Data, Application Data"
"151","6.251394","192.168.0.183","172.64.155.249","TCP","54","51124  >  443 [ACK] Seq=4893 Ack=84829 Win=514 Len=0"
"152","6.294397","172.64.155.249","192.168.0.183","TCP","60","443  >  51124 [ACK] Seq=84829 Ack=4893 Win=123 Len=0"
"153","6.752043","192.168.0.183","172.64.155.249","TLSv1.2","552","Application Data"
"154","6.752141","192.168.0.183","172.64.155.249","TLSv1.2","567","Application Data"
"155","6.765998","172.64.155.249","192.168.0.183","TCP","60","443  >  51124 [ACK] Seq=84829 Ack=5391 Win=123 Len=0"
"156","6.772278","172.64.155.249","192.168.0.183","TCP","60","443  >  51124 [ACK] Seq=84829 Ack=5904 Win=124 Len=0"
"157","6.793612","172.64.155.249","192.168.0.183","TLSv1.2","278","Application Data"
"158","6.793612","172.64.155.249","192.168.0.183","TLSv1.2","85","Application Data"
"159","6.793655","192.168.0.183","172.64.155.249","TCP","54","51124  >  443 [ACK] Seq=5904 Ack=85084 Win=513 Len=0"
"160","7.815943","192.168.0.183","172.64.155.249","TLSv1.2","229","Application Data"
"161","7.816046","192.168.0.183","172.64.155.249","TCP","1454","51124  >  443 [ACK] Seq=6079 Ack=85084 Win=513 Len=1400 [TCP segment of a reassembled PDU]"
"162","7.816046","192.168.0.183","172.64.155.249","TLSv1.2","427","Application Data"
"163","7.834224","172.64.155.249","192.168.0.183","TCP","60","443  >  51124 [ACK] Seq=85084 Ack=7852 Win=125 Len=0"
"164","7.919394","172.64.155.249","192.168.0.183","TLSv1.2","367","Application Data"
"165","7.919394","172.64.155.249","192.168.0.183","TLSv1.2","85","Application Data"
"166","7.919437","192.168.0.183","172.64.155.249","TCP","54","51124  >  443 [ACK] Seq=7852 Ack=85428 Win=511 Len=0"
"167","7.927990","192.168.0.183","172.64.155.249","TLSv1.2","172","Application Data"
"168","7.984363","172.64.155.249","192.168.0.183","TCP","60","443  >  51124 [ACK] Seq=85428 Ack=7970 Win=125 Len=0"
"169","8.144273","172.64.155.249","192.168.0.183","TLSv1.2","146","Application Data"
"170","8.144273","172.64.155.249","192.168.0.183","TLSv1.2","100","Application Data"
"171","8.144273","172.64.155.249","192.168.0.183","TLSv1.2","1327","Application Data"
"172","8.144318","192.168.0.183","172.64.155.249","TCP","54","51124  >  443 [ACK] Seq=7970 Ack=86839 Win=514 Len=0"
"173","8.145931","172.64.155.249","192.168.0.183","TCP","1514","443  >  51124 [ACK] Seq=86839 Ack=7970 Win=125 Len=1460 [TCP segment of a reassembled PDU]"
"174","8.145931","172.64.155.249","192.168.0.183","TCP","1514","443  >  51124 [ACK] Seq=88299 Ack=7970 Win=125 Len=1460 [TCP segment of a reassembled PDU]"
"175","8.145931","172.64.155.249","192.168.0.183","TCP","1514","443  >  51124 [ACK] Seq=89759 Ack=7970 Win=125 Len=1460 [TCP segment of a reassembled PDU]"
"176","8.145931","172.64.155.249","192.168.0.183","TLSv1.2","501","Application Data"
"177","8.145931","172.64.155.249","192.168.0.183","TCP","1514","443  >  51124 [ACK] Seq=91666 Ack=7970 Win=125 Len=1460 [TCP segment of a reassembled PDU]"
"178","8.145931","172.64.155.249","192.168.0.183","TCP","1514","443  >  51124 [ACK] Seq=93126 Ack=7970 Win=125 Len=1460 [TCP segment of a reassembled PDU]"
"179","8.145931","172.64.155.249","192.168.0.183","TLSv1.2","913","Application Data"
"180","8.146002","192.168.0.183","172.64.155.249","TCP","54","51124  >  443 [ACK] Seq=7970 Ack=95445 Win=514 Len=0"
"181","8.156051","172.64.155.249","192.168.0.183","TCP","1514","443  >  51124 [ACK] Seq=95445 Ack=7970 Win=125 Len=1460 [TCP segment of a reassembled PDU]"
"182","8.156051","172.64.155.249","192.168.0.183","TLSv1.2","1214","Application Data"
"183","8.156139","192.168.0.183","172.64.155.249","TCP","54","51124  >  443 [ACK] Seq=7970 Ack=98065 Win=514 Len=0"
"184","8.157926","172.64.155.249","192.168.0.183","TCP","1514","443  >  51124 [ACK] Seq=98065 Ack=7970 Win=125 Len=1460 [TCP segment of a reassembled PDU]"
"185","8.157926","172.64.155.249","192.168.0.183","TCP","1514","443  >  51124 [ACK] Seq=99525 Ack=7970 Win=125 Len=1460 [TCP segment of a reassembled PDU]"
"186","8.157926","172.64.155.249","192.168.0.183","TCP","1514","443  >  51124 [ACK] Seq=100985 Ack=7970 Win=125 Len=1460 [TCP segment of a reassembled PDU]"
"187","8.157926","172.64.155.249","192.168.0.183","TLSv1.2","276","Application Data"
"188","8.158046","192.168.0.183","172.64.155.249","TCP","54","51124  >  443 [ACK] Seq=7970 Ack=102667 Win=514 Len=0"
"189","8.160588","172.64.155.249","192.168.0.183","TCP","1514","443  >  51124 [ACK] Seq=102667 Ack=7970 Win=125 Len=1460 [TCP segment of a reassembled PDU]"
"190","8.160588","172.64.155.249","192.168.0.183","TCP","1514","443  >  51124 [ACK] Seq=104127 Ack=7970 Win=125 Len=1460 [TCP segment of a reassembled PDU]"
"191","8.160588","172.64.155.249","192.168.0.183","TCP","1514","443  >  51124 [ACK] Seq=105587 Ack=7970 Win=125 Len=1460 [TCP segment of a reassembled PDU]"
"192","8.160588","172.64.155.249","192.168.0.183","TCP","1514","443  >  51124 [ACK] Seq=107047 Ack=7970 Win=125 Len=1460 [TCP segment of a reassembled PDU]"
"193","8.160588","172.64.155.249","192.168.0.183","TCP","1514","443  >  51124 [ACK] Seq=108507 Ack=7970 Win=125 Len=1460 [TCP segment of a reassembled PDU]"
"194","8.160588","172.64.155.249","192.168.0.183","TCP","1514","443  >  51124 [PSH, ACK] Seq=109967 Ack=7970 Win=125 Len=1460 [TCP segment of a reassembled PDU]"
"195","8.160588","172.64.155.249","192.168.0.183","TLSv1.2","588","Application Data"
"196","8.160588","172.64.155.249","192.168.0.183","TLSv1.2","1348","Application Data"
"197","8.160588","172.64.155.249","192.168.0.183","TCP","1514","443  >  51124 [ACK] Seq=113255 Ack=7970 Win=125 Len=1460 [TCP segment of a reassembled PDU]"
"198","8.160588","172.64.155.249","192.168.0.183","TCP","1514","443  >  51124 [ACK] Seq=114715 Ack=7970 Win=125 Len=1460 [TCP segment of a reassembled PDU]"
"199","8.160588","172.64.155.249","192.168.0.183","TLSv1.2","842","Application Data"
"200","8.160723","192.168.0.183","172.64.155.249","TCP","54","51124  >  443 [ACK] Seq=7970 Ack=116963 Win=514 Len=0"
"201","8.166497","172.64.155.249","192.168.0.183","TCP","1514","443  >  51124 [ACK] Seq=116963 Ack=7970 Win=125 Len=1460 [TCP segment of a reassembled PDU]"
"202","8.166497","172.64.155.249","192.168.0.183","TCP","1514","443  >  51124 [ACK] Seq=118423 Ack=7970 Win=125 Len=1460 [TCP segment of a reassembled PDU]"
"203","8.166497","172.64.155.249","192.168.0.183","TLSv1.2","1199","Application Data"
"204","8.166497","172.64.155.249","192.168.0.183","TLSv1.2","460","Application Data"
"205","8.166497","172.64.155.249","192.168.0.183","TLSv1.2","127","Application Data, Application Data"
"206","8.166577","192.168.0.183","172.64.155.249","TCP","54","51124  >  443 [ACK] Seq=7970 Ack=121507 Win=514 Len=0"
"207","8.246344","192.168.0.183","172.64.155.249","TLSv1.2","184","Application Data"
"208","8.260618","172.64.155.249","192.168.0.183","TCP","60","443  >  51134 [ACK] Seq=835 Ack=378 Win=8 Len=0"
"209","8.285254","172.64.155.249","192.168.0.183","TLSv1.2","473","Application Data"
"210","8.285254","172.64.155.249","192.168.0.183","TLSv1.2","203","Application Data"
"211","8.285254","172.64.155.249","192.168.0.183","TLSv1.2","85","Application Data"
"212","8.285313","192.168.0.183","172.64.155.249","TCP","54","51134  >  443 [ACK] Seq=378 Ack=1434 Win=514 Len=0"
"213","8.286043","192.168.0.183","172.64.155.249","TLSv1.2","89","Application Data"
"214","8.341234","172.64.155.249","192.168.0.183","TCP","60","443  >  51134 [ACK] Seq=1434 Ack=413 Win=8 Len=0"
"215","8.653601","192.168.0.183","172.64.155.249","TLSv1.2","694","Application Data"
"216","8.653665","192.168.0.183","172.64.155.249","TLSv1.2","585","Application Data"
"217","8.667463","172.64.155.249","192.168.0.183","TCP","60","443  >  51124 [ACK] Seq=121507 Ack=9141 Win=125 Len=0"
"218","8.691678","172.64.155.249","192.168.0.183","TLSv1.2","313","Application Data"
"219","8.691678","172.64.155.249","192.168.0.183","TLSv1.2","85","Application Data"
"220","8.691751","192.168.0.183","172.64.155.249","TCP","54","51124  >  443 [ACK] Seq=9141 Ack=121797 Win=512 Len=0"
"221","10.246597","192.168.0.183","172.64.155.249","TLSv1.2","529","Application Data"
"222","10.246660","192.168.0.183","172.64.155.249","TLSv1.2","625","Application Data"
"223","10.259951","172.64.155.249","192.168.0.183","TCP","60","443  >  51124 [ACK] Seq=121797 Ack=10187 Win=126 Len=0"
"224","10.284172","172.64.155.249","192.168.0.183","TLSv1.2","435","Application Data"
"225","10.284172","172.64.155.249","192.168.0.183","TLSv1.2","85","Application Data"
"226","10.284216","192.168.0.183","172.64.155.249","TCP","54","51124  >  443 [ACK] Seq=10187 Ack=122209 Win=511 Len=0"
"227","10.550919","192.168.0.183","172.64.155.249","TLSv1.2","355","Application Data"
"228","10.551005","192.168.0.183","172.64.155.249","TLSv1.2","625","Application Data"
"229","10.563882","172.64.155.249","192.168.0.183","TCP","60","443  >  51124 [ACK] Seq=122209 Ack=11059 Win=127 Len=0"
"230","10.565130","192.168.0.183","172.64.155.249","TLSv1.2","356","Application Data"
"231","10.588497","172.64.155.249","192.168.0.183","TLSv1.2","278","Application Data"
"232","10.588497","172.64.155.249","192.168.0.183","TLSv1.2","85","Application Data"
"233","10.588567","192.168.0.183","172.64.155.249","TCP","54","51124  >  443 [ACK] Seq=11361 Ack=122464 Win=510 Len=0"
"234","10.613164","172.64.155.249","192.168.0.183","TLSv1.2","169","Application Data"
"235","10.613164","172.64.155.249","192.168.0.183","TLSv1.2","100","Application Data"
"236","10.613209","192.168.0.183","172.64.155.249","TCP","54","51124  >  443 [ACK] Seq=11361 Ack=122625 Win=509 Len=0"
"237","10.628746","172.64.155.249","192.168.0.183","TCP","1514","443  >  51124 [ACK] Seq=122625 Ack=11361 Win=127 Len=1460 [TCP segment of a reassembled PDU]"
"238","10.628746","172.64.155.249","192.168.0.183","TCP","1514","443  >  51124 [ACK] Seq=124085 Ack=11361 Win=127 Len=1460 [TCP segment of a reassembled PDU]"
"239","10.628746","172.64.155.249","192.168.0.183","TCP","1514","443  >  51124 [ACK] Seq=125545 Ack=11361 Win=127 Len=1460 [TCP segment of a reassembled PDU]"
"240","10.628746","172.64.155.249","192.168.0.183","TCP","1514","443  >  51124 [ACK] Seq=127005 Ack=11361 Win=127 Len=1460 [TCP segment of a reassembled PDU]"
"241","10.628746","172.64.155.249","192.168.0.183","TCP","1514","443  >  51124 [ACK] Seq=128465 Ack=11361 Win=127 Len=1460 [TCP segment of a reassembled PDU]"
"242","10.628746","172.64.155.249","192.168.0.183","TCP","1514","443  >  51124 [PSH, ACK] Seq=129925 Ack=11361 Win=127 Len=1460 [TCP segment of a reassembled PDU]"
"243","10.628746","172.64.155.249","192.168.0.183","TLSv1.2","213","Application Data"
"244","10.628746","172.64.155.249","192.168.0.183","TCP","1514","443  >  51124 [ACK] Seq=131544 Ack=11361 Win=127 Len=1460 [TCP segment of a reassembled PDU]"
"245","10.628746","172.64.155.249","192.168.0.183","TLSv1.2","1063","Application Data"
"246","10.628746","172.64.155.249","192.168.0.183","TCP","1514","443  >  51124 [ACK] Seq=134013 Ack=11361 Win=127 Len=1460 [TCP segment of a reassembled PDU]"
"247","10.628746","172.64.155.249","192.168.0.183","TCP","1514","443  >  51124 [ACK] Seq=135473 Ack=11361 Win=127 Len=1460 [TCP segment of a reassembled PDU]"
"248","10.628746","172.64.155.249","192.168.0.183","TLSv1.2","884","Application Data"
"249","10.628746","172.64.155.249","192.168.0.183","TCP","1514","443  >  51124 [ACK] Seq=137763 Ack=11361 Win=127 Len=1460 [TCP segment of a reassembled PDU]"
"250","10.628746","172.64.155.249","192.168.0.183","TCP","1514","443  >  51124 [ACK] Seq=139223 Ack=11361 Win=127 Len=1460 [TCP segment of a reassembled PDU]"
"251","10.628746","172.64.155.249","192.168.0.183","TCP","1514","443  >  51124 [ACK] Seq=140683 Ack=11361 Win=127 Len=1460 [TCP segment of a reassembled PDU]"
"252","10.628746","172.64.155.249","192.168.0.183","TCP","1514","443  >  51124 [ACK] Seq=142143 Ack=11361 Win=127 Len=1460 [TCP segment of a reassembled PDU]"
"253","10.628746","172.64.155.249","192.168.0.183","TCP","1514","443  >  51124 [ACK] Seq=143603 Ack=11361 Win=127 Len=1460 [TCP segment of a reassembled PDU]"
"254","10.628746","172.64.155.249","192.168.0.183","TLSv1.2","1093","Application Data"
"255","10.628746","172.64.155.249","192.168.0.183","TCP","1514","443  >  51124 [ACK] Seq=146102 Ack=11361 Win=127 Len=1460 [TCP segment of a reassembled PDU]"
"256","10.628746","172.64.155.249","192.168.0.183","TCP","1514","443  >  51124 [ACK] Seq=147562 Ack=11361 Win=127 Len=1460 [TCP segment of a reassembled PDU]"
"257","10.628746","172.64.155.249","192.168.0.183","TCP","1514","443  >  51124 [ACK] Seq=149022 Ack=11361 Win=127 Len=1460 [TCP segment of a reassembled PDU]"
"258","10.628746","172.64.155.249","192.168.0.183","TCP","1514","443  >  51124 [ACK] Seq=150482 Ack=11361 Win=127 Len=1460 [TCP segment of a reassembled PDU]"
"259","10.628746","172.64.155.249","192.168.0.183","TLSv1.2","731","Application Data"
"260","10.628910","192.168.0.183","172.64.155.249","TCP","54","51124  >  443 [ACK] Seq=11361 Ack=152619 Win=514 Len=0"
"261","10.633753","172.64.155.249","192.168.0.183","TCP","1514","443  >  51124 [ACK] Seq=152619 Ack=11361 Win=127 Len=1460 [TCP segment of a reassembled PDU]"
"262","10.633753","172.64.155.249","192.168.0.183","TCP","1514","443  >  51124 [ACK] Seq=154079 Ack=11361 Win=127 Len=1460 [TCP segment of a reassembled PDU]"
"263","10.633753","172.64.155.249","192.168.0.183","TCP","1514","443  >  51124 [ACK] Seq=155539 Ack=11361 Win=127 Len=1460 [TCP segment of a reassembled PDU]"
"264","10.633753","172.64.155.249","192.168.0.183","TLSv1.2","190","Application Data"
"265","10.633819","192.168.0.183","172.64.155.249","TCP","54","51124  >  443 [ACK] Seq=11361 Ack=157135 Win=514 Len=0"
"266","10.636311","172.64.155.249","192.168.0.183","TCP","1514","443  >  51124 [ACK] Seq=157135 Ack=11361 Win=127 Len=1460 [TCP segment of a reassembled PDU]"
"267","10.636311","172.64.155.249","192.168.0.183","TCP","1514","443  >  51124 [ACK] Seq=158595 Ack=11361 Win=127 Len=1460 [TCP segment of a reassembled PDU]"
"268","10.636311","172.64.155.249","192.168.0.183","TCP","1514","443  >  51124 [ACK] Seq=160055 Ack=11361 Win=127 Len=1460 [TCP segment of a reassembled PDU]"
"269","10.636311","172.64.155.249","192.168.0.183","TLSv1.2","407","Application Data"
"270","10.636311","172.64.155.249","192.168.0.183","TLSv1.2","96","Application Data"
"271","10.636311","172.64.155.249","192.168.0.183","TLSv1.2","85","Application Data"
"272","10.636414","192.168.0.183","172.64.155.249","TCP","54","51124  >  443 [ACK] Seq=11361 Ack=161941 Win=514 Len=0"
"273","10.726701","192.168.0.183","172.64.155.249","TLSv1.2","216","Application Data"
"274","10.740235","172.64.155.249","192.168.0.183","TCP","60","443  >  51134 [ACK] Seq=1434 Ack=575 Win=8 Len=0"
"275","10.764096","172.64.155.249","192.168.0.183","TLSv1.2","473","Application Data"
"276","10.764096","172.64.155.249","192.168.0.183","TLSv1.2","203","Application Data"
"277","10.764185","192.168.0.183","172.64.155.249","TCP","54","51134  >  443 [ACK] Seq=575 Ack=2002 Win=511 Len=0"
"278","10.765511","172.64.155.249","192.168.0.183","TLSv1.2","85","Application Data"
"279","10.819833","192.168.0.183","172.64.155.249","TCP","54","51134  >  443 [ACK] Seq=575 Ack=2033 Win=511 Len=0"
"280","10.950550","192.168.0.183","172.64.155.249","TLSv1.2","288","Application Data"
"281","10.988514","172.64.155.249","192.168.0.183","TLSv1.2","152","Application Data"
"282","11.039359","192.168.0.183","172.64.155.249","TCP","54","51124  >  443 [ACK] Seq=11595 Ack=162039 Win=513 Len=0"
"283","11.147047","192.168.0.183","172.64.155.249","TLSv1.2","498","Application Data"
"284","11.147118","192.168.0.183","172.64.155.249","TLSv1.2","592","Application Data"
"285","11.159543","172.64.155.249","192.168.0.183","TCP","60","443  >  51124 [ACK] Seq=162039 Ack=12577 Win=128 Len=0"
"286","11.184315","172.64.155.249","192.168.0.183","TLSv1.2","144","Application Data"
"287","11.184315","172.64.155.249","192.168.0.183","TLSv1.2","85","Application Data"
"288","11.184350","192.168.0.183","172.64.155.249","TCP","54","51124  >  443 [ACK] Seq=12577 Ack=162160 Win=513 Len=0"
"289","14.207291","192.168.0.183","172.64.155.249","TLSv1.2","143","Application Data"
"290","14.264387","172.64.155.249","192.168.0.183","TCP","60","443  >  51124 [ACK] Seq=162160 Ack=12666 Win=128 Len=0"
"291","14.276329","172.64.155.249","192.168.0.183","TLSv1.2","280","Application Data"
"292","14.276329","172.64.155.249","192.168.0.183","TLSv1.2","100","Application Data"
"293","14.276329","172.64.155.249","192.168.0.183","TLSv1.2","1276","Application Data"
"294","14.276329","172.64.155.249","192.168.0.183","TCP","1514","443  >  51124 [ACK] Seq=163654 Ack=12666 Win=128 Len=1460 [TCP segment of a reassembled PDU]"
"295","14.276329","172.64.155.249","192.168.0.183","TCP","1514","443  >  51124 [ACK] Seq=165114 Ack=12666 Win=128 Len=1460 [TCP segment of a reassembled PDU]"
"296","14.276378","192.168.0.183","172.64.155.249","TCP","54","51124  >  443 [ACK] Seq=12666 Ack=166574 Win=514 Len=0"
"297","14.277254","192.168.0.183","172.64.155.249","TLSv1.2","89","Application Data"
"298","14.277828","172.64.155.249","192.168.0.183","TCP","1514","443  >  51124 [ACK] Seq=166574 Ack=12666 Win=128 Len=1460 [TCP segment of a reassembled PDU]"
"299","14.277828","172.64.155.249","192.168.0.183","TLSv1.2","562","Application Data"
"300","14.277828","172.64.155.249","192.168.0.183","TCP","1514","443  >  51124 [ACK] Seq=168542 Ack=12666 Win=128 Len=1460 [TCP segment of a reassembled PDU]"
"301","14.277828","172.64.155.249","192.168.0.183","TCP","1514","443  >  51124 [ACK] Seq=170002 Ack=12666 Win=128 Len=1460 [TCP segment of a reassembled PDU]"
"302","14.277828","172.64.155.249","192.168.0.183","TCP","1514","443  >  51124 [ACK] Seq=171462 Ack=12666 Win=128 Len=1460 [TCP segment of a reassembled PDU]"
"303","14.277828","172.64.155.249","192.168.0.183","TLSv1.2","429","Application Data"
"304","14.277876","192.168.0.183","172.64.155.249","TCP","54","51124  >  443 [ACK] Seq=12701 Ack=173297 Win=514 Len=0"
"305","14.288104","172.64.155.249","192.168.0.183","TCP","1514","443  >  51124 [ACK] Seq=173297 Ack=12666 Win=128 Len=1460 [TCP segment of a reassembled PDU]"
"306","14.288104","172.64.155.249","192.168.0.183","TLSv1.2","406","Application Data"
"307","14.288104","172.64.155.249","192.168.0.183","TLSv1.2","972","Application Data"
"308","14.288188","192.168.0.183","172.64.155.249","TCP","54","51124  >  443 [ACK] Seq=12701 Ack=176027 Win=514 Len=0"
"309","14.288461","172.64.155.249","192.168.0.183","TCP","1514","443  >  51124 [ACK] Seq=176027 Ack=12666 Win=128 Len=1460 [TCP segment of a reassembled PDU]"
"310","14.288461","172.64.155.249","192.168.0.183","TCP","1514","443  >  51124 [ACK] Seq=177487 Ack=12666 Win=128 Len=1460 [TCP segment of a reassembled PDU]"
"311","14.288461","172.64.155.249","192.168.0.183","TCP","1514","443  >  51124 [ACK] Seq=178947 Ack=12666 Win=128 Len=1460 [TCP segment of a reassembled PDU]"
"312","14.288461","172.64.155.249","192.168.0.183","TCP","1514","443  >  51124 [ACK] Seq=180407 Ack=12666 Win=128 Len=1460 [TCP segment of a reassembled PDU]"
"313","14.288461","172.64.155.249","192.168.0.183","TLSv1.2","392","Application Data"
"314","14.288501","192.168.0.183","172.64.155.249","TCP","54","51124  >  443 [ACK] Seq=12701 Ack=182205 Win=514 Len=0"
"315","14.290440","172.64.155.249","192.168.0.183","TCP","1514","443  >  51124 [ACK] Seq=182205 Ack=12666 Win=128 Len=1460 [TCP segment of a reassembled PDU]"
"316","14.290440","172.64.155.249","192.168.0.183","TCP","1514","443  >  51124 [ACK] Seq=183665 Ack=12666 Win=128 Len=1460 [TCP segment of a reassembled PDU]"
"317","14.290440","172.64.155.249","192.168.0.183","TLSv1.2","1337","Application Data"
"318","14.290440","172.64.155.249","192.168.0.183","TLSv1.2","96","Application Data"
"319","14.290440","172.64.155.249","192.168.0.183","TCP","60","443  >  51124 [ACK] Seq=186450 Ack=12701 Win=128 Len=0"
"320","14.290440","172.64.155.249","192.168.0.183","TLSv1.2","85","Application Data"
"321","14.290545","192.168.0.183","172.64.155.249","TCP","54","51124  >  443 [ACK] Seq=12701 Ack=186481 Win=514 Len=0"
"322","14.509140","192.168.0.183","172.64.155.249","TLSv1.2","225","Application Data"
"323","14.543989","172.64.155.249","192.168.0.183","TLSv1.2","284","Application Data"
"324","14.590263","192.168.0.183","172.64.155.249","TCP","54","51124  >  443 [ACK] Seq=12872 Ack=186711 Win=513 Len=0"
"325","14.665912","192.168.0.183","172.64.155.249","TLSv1.2","531","Application Data"
"326","14.665981","192.168.0.183","172.64.155.249","TLSv1.2","548","Application Data"
"327","14.682074","172.64.155.249","192.168.0.183","TCP","60","443  >  51124 [ACK] Seq=186711 Ack=13843 Win=129 Len=0"
"328","14.710238","172.64.155.249","192.168.0.183","TLSv1.2","144","Application Data"
"329","14.710238","172.64.155.249","192.168.0.183","TLSv1.2","85","Application Data"
"330","14.710281","192.168.0.183","172.64.155.249","TCP","54","51124  >  443 [ACK] Seq=13843 Ack=186832 Win=512 Len=0"
"331","18.453536","192.168.0.183","172.64.155.249","TLSv1.2","289","Application Data"
"332","18.453633","192.168.0.183","172.64.155.249","TLSv1.2","170","Application Data"
"333","18.466338","192.168.0.183","172.64.155.249","TLSv1.2","150","Application Data"
"334","18.467522","172.64.155.249","192.168.0.183","TCP","60","443  >  51124 [ACK] Seq=186832 Ack=14194 Win=129 Len=0"
"335","18.501887","172.64.155.249","192.168.0.183","TLSv1.2","278","Application Data"
"336","18.548525","192.168.0.183","172.64.155.249","TCP","54","51124  >  443 [ACK] Seq=14290 Ack=187056 Win=511 Len=0"
"337","18.652912","172.64.155.249","192.168.0.183","TLSv1.2","158","Application Data"
"338","18.652912","172.64.155.249","192.168.0.183","TLSv1.2","100","Application Data"
"339","18.652912","172.64.155.249","192.168.0.183","TLSv1.2","1322","Application Data"
"340","18.652912","172.64.155.249","192.168.0.183","TCP","1514","443  >  51124 [ACK] Seq=188474 Ack=14290 Win=129 Len=1460 [TCP segment of a reassembled PDU]"
"341","18.652912","172.64.155.249","192.168.0.183","TLSv1.2","1220","Application Data"
"342","18.652912","172.64.155.249","192.168.0.183","TCP","1514","443  >  51124 [ACK] Seq=191100 Ack=14290 Win=129 Len=1460 [TCP segment of a reassembled PDU]"
"343","18.652912","172.64.155.249","192.168.0.183","TCP","1514","443  >  51124 [ACK] Seq=192560 Ack=14290 Win=129 Len=1460 [TCP segment of a reassembled PDU]"
"344","18.652912","172.64.155.249","192.168.0.183","TCP","1514","443  >  51124 [ACK] Seq=194020 Ack=14290 Win=129 Len=1460 [TCP segment of a reassembled PDU]"
"345","18.652912","172.64.155.249","192.168.0.183","TLSv1.2","1489","Application Data"
"346","18.653111","192.168.0.183","172.64.155.249","TCP","54","51124  >  443 [ACK] Seq=14290 Ack=196915 Win=514 Len=0"
"347","18.661971","172.64.155.249","192.168.0.183","TCP","1514","443  >  51124 [ACK] Seq=196915 Ack=14290 Win=129 Len=1460 [TCP segment of a reassembled PDU]"
"348","18.661971","172.64.155.249","192.168.0.183","TLSv1.2","1191","Application Data"
"349","18.662094","192.168.0.183","172.64.155.249","TCP","54","51124  >  443 [ACK] Seq=14290 Ack=199512 Win=514 Len=0"
"350","18.664054","172.64.155.249","192.168.0.183","TCP","1514","443  >  51124 [ACK] Seq=199512 Ack=14290 Win=129 Len=1460 [TCP segment of a reassembled PDU]"
"351","18.664054","172.64.155.249","192.168.0.183","TCP","1514","443  >  51124 [ACK] Seq=200972 Ack=14290 Win=129 Len=1460 [TCP segment of a reassembled PDU]"
"352","18.664054","172.64.155.249","192.168.0.183","TLSv1.2","1121","Application Data"
"353","18.664054","172.64.155.249","192.168.0.183","TCP","1514","443  >  51124 [ACK] Seq=203499 Ack=14290 Win=129 Len=1460 [TCP segment of a reassembled PDU]"
"354","18.664054","172.64.155.249","192.168.0.183","TLSv1.2","1470","Application Data"
"355","18.664134","192.168.0.183","172.64.155.249","TCP","54","51124  >  443 [ACK] Seq=14290 Ack=206375 Win=514 Len=0"
"356","18.666386","172.64.155.249","192.168.0.183","TCP","1514","443  >  51124 [ACK] Seq=206375 Ack=14290 Win=129 Len=1460 [TCP segment of a reassembled PDU]"
"357","18.666386","172.64.155.249","192.168.0.183","TCP","1514","443  >  51124 [ACK] Seq=207835 Ack=14290 Win=129 Len=1460 [TCP segment of a reassembled PDU]"
"358","18.666386","172.64.155.249","192.168.0.183","TCP","1514","443  >  51124 [ACK] Seq=209295 Ack=14290 Win=129 Len=1460 [TCP segment of a reassembled PDU]"
"359","18.666386","172.64.155.249","192.168.0.183","TLSv1.2","933","Application Data"
"360","18.666386","172.64.155.249","192.168.0.183","TCP","1514","443  >  51124 [ACK] Seq=211634 Ack=14290 Win=129 Len=1460 [TCP segment of a reassembled PDU]"
"361","18.666386","172.64.155.249","192.168.0.183","TCP","1514","443  >  51124 [ACK] Seq=213094 Ack=14290 Win=129 Len=1460 [TCP segment of a reassembled PDU]"
"362","18.666386","172.64.155.249","192.168.0.183","TCP","1514","443  >  51124 [ACK] Seq=214554 Ack=14290 Win=129 Len=1460 [TCP segment of a reassembled PDU]"
"363","18.666386","172.64.155.249","192.168.0.183","TCP","1514","443  >  51124 [ACK] Seq=216014 Ack=14290 Win=129 Len=1460 [TCP segment of a reassembled PDU]"
"364","18.666386","172.64.155.249","192.168.0.183","TLSv1.2","1225","Application Data"
"365","18.666461","192.168.0.183","172.64.155.249","TCP","54","51124  >  443 [ACK] Seq=14290 Ack=218645 Win=514 Len=0"
"366","18.672795","172.64.155.249","192.168.0.183","TCP","1514","443  >  51124 [ACK] Seq=218645 Ack=14290 Win=129 Len=1460 [TCP segment of a reassembled PDU]"
"367","18.672795","172.64.155.249","192.168.0.183","TCP","1514","443  >  51124 [ACK] Seq=220105 Ack=14290 Win=129 Len=1460 [TCP segment of a reassembled PDU]"
"368","18.672795","172.64.155.249","192.168.0.183","TLSv1.2","1140","Application Data"
"369","18.672795","172.64.155.249","192.168.0.183","TLSv1.2","96","Application Data"
"370","18.672795","172.64.155.249","192.168.0.183","TLSv1.2","85","Application Data"
"371","18.672935","192.168.0.183","172.64.155.249","TCP","54","51124  >  443 [ACK] Seq=14290 Ack=222724 Win=514 Len=0"
"372","18.735270","192.168.0.183","172.64.155.249","TLSv1.2","184","Application Data"
"373","18.773877","172.64.155.249","192.168.0.183","TLSv1.2","474","Application Data"
"374","18.773877","172.64.155.249","192.168.0.183","TLSv1.2","203","Application Data"
"375","18.773877","172.64.155.249","192.168.0.183","TLSv1.2","85","Application Data"
"376","18.773913","192.168.0.183","172.64.155.249","TCP","54","51134  >  443 [ACK] Seq=705 Ack=2633 Win=509 Len=0"
"377","18.774563","192.168.0.183","172.64.155.249","TLSv1.2","89","Application Data"
"378","18.830271","172.64.155.249","192.168.0.183","TCP","60","443  >  51134 [ACK] Seq=2633 Ack=740 Win=8 Len=0"
"379","19.084575","192.168.0.183","172.64.155.249","TLSv1.2","815","Application Data"
"380","19.084704","192.168.0.183","172.64.155.249","TLSv1.2","554","Application Data"
"381","19.098461","172.64.155.249","192.168.0.183","TCP","60","443  >  51124 [ACK] Seq=222724 Ack=15551 Win=130 Len=0"
"382","19.121297","172.64.155.249","192.168.0.183","TLSv1.2","164","Application Data"
"383","19.121297","172.64.155.249","192.168.0.183","TLSv1.2","85","Application Data"
"384","19.121390","192.168.0.183","172.64.155.249","TCP","54","51124  >  443 [ACK] Seq=15551 Ack=222865 Win=513 Len=0"
"385","20.710969","192.168.0.183","172.64.155.249","TLSv1.2","424","Application Data"
"386","20.711095","192.168.0.183","172.64.155.249","TLSv1.2","594","Application Data"
"387","20.728302","192.168.0.183","172.64.155.249","TLSv1.2","393","Application Data"
"388","20.739344","172.64.155.249","192.168.0.183","TCP","60","443  >  51124 [ACK] Seq=222865 Ack=16461 Win=131 Len=0"
"389","20.748851","172.64.155.249","192.168.0.183","TLSv1.2","313","Application Data"
"390","20.748851","172.64.155.249","192.168.0.183","TLSv1.2","85","Application Data"
"391","20.748889","192.168.0.183","172.64.155.249","TCP","54","51124  >  443 [ACK] Seq=16800 Ack=223155 Win=512 Len=0"
"392","20.809815","172.64.155.249","192.168.0.183","TLSv1.2","146","Application Data"
"393","20.809815","172.64.155.249","192.168.0.183","TLSv1.2","100","Application Data"
"394","20.809815","172.64.155.249","192.168.0.183","TCP","1514","443  >  51124 [ACK] Seq=223293 Ack=16800 Win=131 Len=1460 [TCP segment of a reassembled PDU]"
"395","20.809815","172.64.155.249","192.168.0.183","TLSv1.2","1138","Application Data"
"396","20.809815","172.64.155.249","192.168.0.183","TCP","1514","443  >  51124 [ACK] Seq=225837 Ack=16800 Win=131 Len=1460 [TCP segment of a reassembled PDU]"
"397","20.809868","192.168.0.183","172.64.155.249","TCP","54","51124  >  443 [ACK] Seq=16800 Ack=227297 Win=514 Len=0"
"398","20.809960","172.64.155.249","192.168.0.183","TLSv1.2","1132","Application Data"
"399","20.809960","172.64.155.249","192.168.0.183","TCP","1514","443  >  51124 [ACK] Seq=228375 Ack=16800 Win=131 Len=1460 [TCP segment of a reassembled PDU]"
"400","20.809960","172.64.155.249","192.168.0.183","TCP","1514","443  >  51124 [ACK] Seq=229835 Ack=16800 Win=131 Len=1460 [TCP segment of a reassembled PDU]"
"401","20.809988","192.168.0.183","172.64.155.249","TCP","54","51124  >  443 [ACK] Seq=16800 Ack=231295 Win=514 Len=0"
"402","20.810112","172.64.155.249","192.168.0.183","TCP","1514","443  >  51124 [ACK] Seq=231295 Ack=16800 Win=131 Len=1460 [TCP segment of a reassembled PDU]"
"403","20.810112","172.64.155.249","192.168.0.183","TLSv1.2","412","Application Data"
"404","20.810135","192.168.0.183","172.64.155.249","TCP","54","51124  >  443 [ACK] Seq=16800 Ack=233113 Win=514 Len=0"
"405","20.811087","192.168.0.183","172.64.155.249","TLSv1.2","89","Application Data"
"406","20.816169","172.64.155.249","192.168.0.183","TCP","1514","443  >  51124 [ACK] Seq=233113 Ack=16800 Win=131 Len=1460 [TCP segment of a reassembled PDU]"
"407","20.816169","172.64.155.249","192.168.0.183","TLSv1.2","1001","Application Data"
"408","20.816226","192.168.0.183","172.64.155.249","TCP","54","51124  >  443 [ACK] Seq=16835 Ack=235520 Win=514 Len=0"
"409","20.820011","172.64.155.249","192.168.0.183","TCP","1514","443  >  51124 [ACK] Seq=235520 Ack=16800 Win=131 Len=1460 [TCP segment of a reassembled PDU]"
"410","20.820011","172.64.155.249","192.168.0.183","TCP","1514","443  >  51124 [ACK] Seq=236980 Ack=16800 Win=131 Len=1460 [TCP segment of a reassembled PDU]"
"411","20.820011","172.64.155.249","192.168.0.183","TCP","1514","443  >  51124 [ACK] Seq=238440 Ack=16800 Win=131 Len=1460 [TCP segment of a reassembled PDU]"
"412","20.820011","172.64.155.249","192.168.0.183","TCP","1514","443  >  51124 [ACK] Seq=239900 Ack=16800 Win=131 Len=1460 [TCP segment of a reassembled PDU]"
"413","20.820011","172.64.155.249","192.168.0.183","TCP","1514","443  >  51124 [ACK] Seq=241360 Ack=16800 Win=131 Len=1460 [TCP segment of a reassembled PDU]"
"414","20.820011","172.64.155.249","192.168.0.183","TLSv1.2","79","Application Data"
"415","20.820174","192.168.0.183","172.64.155.249","TCP","54","51124  >  443 [ACK] Seq=16835 Ack=242845 Win=514 Len=0"
"416","20.822386","172.64.155.249","192.168.0.183","TCP","1514","443  >  51124 [ACK] Seq=242845 Ack=16800 Win=131 Len=1460 [TCP segment of a reassembled PDU]"
"417","20.822386","172.64.155.249","192.168.0.183","TCP","1514","443  >  51124 [ACK] Seq=244305 Ack=16800 Win=131 Len=1460 [TCP segment of a reassembled PDU]"
"418","20.822386","172.64.155.249","192.168.0.183","TCP","1514","443  >  51124 [ACK] Seq=245765 Ack=16800 Win=131 Len=1460 [TCP segment of a reassembled PDU]"
"419","20.822386","172.64.155.249","192.168.0.183","TCP","1514","443  >  51124 [ACK] Seq=247225 Ack=16800 Win=131 Len=1460 [TCP segment of a reassembled PDU]"
"420","20.822386","172.64.155.249","192.168.0.183","TCP","1514","443  >  51124 [ACK] Seq=248685 Ack=16800 Win=131 Len=1460 [TCP segment of a reassembled PDU]"
"421","20.822386","172.64.155.249","192.168.0.183","TCP","1514","443  >  51124 [PSH, ACK] Seq=250145 Ack=16800 Win=131 Len=1460 [TCP segment of a reassembled PDU]"
"422","20.822386","172.64.155.249","192.168.0.183","TCP","1514","443  >  51124 [ACK] Seq=251605 Ack=16800 Win=131 Len=1460 [TCP segment of a reassembled PDU]"
"423","20.822386","172.64.155.249","192.168.0.183","TCP","1514","443  >  51124 [ACK] Seq=253065 Ack=16800 Win=131 Len=1460 [TCP segment of a reassembled PDU]"
"424","20.822386","172.64.155.249","192.168.0.183","TCP","1514","443  >  51124 [ACK] Seq=254525 Ack=16800 Win=131 Len=1460 [TCP segment of a reassembled PDU]"
"425","20.822386","172.64.155.249","192.168.0.183","TLSv1.2","86","Application Data"
"426","20.822507","192.168.0.183","172.64.155.249","TCP","54","51124  >  443 [ACK] Seq=16835 Ack=256017 Win=514 Len=0"
"427","20.827163","172.64.155.249","192.168.0.183","TCP","1514","443  >  51124 [ACK] Seq=256017 Ack=16800 Win=131 Len=1460 [TCP segment of a reassembled PDU]"
"428","20.827163","172.64.155.249","192.168.0.183","TCP","1514","443  >  51124 [ACK] Seq=257477 Ack=16800 Win=131 Len=1460 [TCP segment of a reassembled PDU]"
"429","20.827163","172.64.155.249","192.168.0.183","TLSv1.2","845","Application Data"
"430","20.827263","192.168.0.183","172.64.155.249","TCP","54","51124  >  443 [ACK] Seq=16835 Ack=259728 Win=514 Len=0"
"431","20.828817","172.64.155.249","192.168.0.183","TCP","1514","443  >  51124 [ACK] Seq=259728 Ack=16800 Win=131 Len=1460 [TCP segment of a reassembled PDU]"
"432","20.828817","172.64.155.249","192.168.0.183","TCP","1514","443  >  51124 [ACK] Seq=261188 Ack=16800 Win=131 Len=1460 [TCP segment of a reassembled PDU]"
"433","20.828817","172.64.155.249","192.168.0.183","TLSv1.2","447","Application Data"
"434","20.828817","172.64.155.249","192.168.0.183","TLSv1.2","96","Application Data"
"435","20.828817","172.64.155.249","192.168.0.183","TLSv1.2","85","Application Data"
"436","20.828887","192.168.0.183","172.64.155.249","TCP","54","51124  >  443 [ACK] Seq=16835 Ack=263114 Win=514 Len=0"
"437","20.870315","172.64.155.249","192.168.0.183","TCP","60","443  >  51124 [ACK] Seq=263114 Ack=16835 Win=131 Len=0"
"438","20.929970","192.168.0.183","172.64.155.249","TLSv1.2","219","Application Data"
"439","20.930319","192.168.0.183","172.64.155.249","TLSv1.2","289","Application Data"
"440","20.947388","172.64.155.249","192.168.0.183","TCP","60","443  >  51134 [ACK] Seq=2633 Ack=905 Win=8 Len=0"
"441","20.952256","172.64.155.249","192.168.0.183","TCP","60","443  >  51124 [ACK] Seq=263114 Ack=17070 Win=131 Len=0"
"442","20.973927","172.64.155.249","192.168.0.183","TLSv1.2","156","Application Data"
"443","20.973927","172.64.155.249","192.168.0.183","TLSv1.2","120","Application Data"
"444","20.973927","172.64.155.249","192.168.0.183","TLSv1.2","85","Application Data"
"445","20.973927","172.64.155.249","192.168.0.183","TLSv1.2","472","Application Data"
"446","20.973927","172.64.155.249","192.168.0.183","TLSv1.2","203","Application Data"
"447","20.973927","172.64.155.249","192.168.0.183","TLSv1.2","85","Application Data"
"448","20.974093","192.168.0.183","172.64.155.249","TCP","54","51124  >  443 [ACK] Seq=17070 Ack=263313 Win=513 Len=0"
"449","20.974154","192.168.0.183","172.64.155.249","TCP","54","51134  >  443 [ACK] Seq=905 Ack=3231 Win=514 Len=0"
"450","21.122047","192.168.0.183","172.64.155.249","TLSv1.2","225","Application Data"
"451","21.158261","172.64.155.249","192.168.0.183","TLSv1.2","302","Application Data"
"452","21.204135","192.168.0.183","172.64.155.249","TCP","54","51124  >  443 [ACK] Seq=17241 Ack=263561 Win=512 Len=0"
"453","21.332750","192.168.0.183","172.64.155.249","TLSv1.2","514","Application Data"
"454","21.332814","192.168.0.183","172.64.155.249","TLSv1.2","636","Application Data"
"455","21.346916","172.64.155.249","192.168.0.183","TCP","60","443  >  51124 [ACK] Seq=263561 Ack=18283 Win=132 Len=0"
"456","21.369499","172.64.155.249","192.168.0.183","TLSv1.2","144","Application Data"
"457","21.369499","172.64.155.249","192.168.0.183","TLSv1.2","85","Application Data"
"458","21.369576","192.168.0.183","172.64.155.249","TCP","54","51124  >  443 [ACK] Seq=18283 Ack=263682 Win=511 Len=0"
"459","24.899016","192.168.0.183","172.64.155.249","TLSv1.2","309","Application Data"
"460","24.952327","172.64.155.249","192.168.0.183","TCP","60","443  >  51124 [ACK] Seq=263682 Ack=18538 Win=133 Len=0"
"461","24.995932","172.64.155.249","192.168.0.183","TLSv1.2","284","Application Data"
"462","24.995932","172.64.155.249","192.168.0.183","TLSv1.2","100","Application Data"
"463","24.995932","172.64.155.249","192.168.0.183","TLSv1.2","1278","Application Data"
"464","24.995932","172.64.155.249","192.168.0.183","TCP","1514","443  >  51124 [ACK] Seq=265182 Ack=18538 Win=133 Len=1460 [TCP segment of a reassembled PDU]"
"465","24.995932","172.64.155.249","192.168.0.183","TCP","1514","443  >  51124 [ACK] Seq=266642 Ack=18538 Win=133 Len=1460 [TCP segment of a reassembled PDU]"
"466","24.995932","172.64.155.249","192.168.0.183","TCP","1514","443  >  51124 [ACK] Seq=268102 Ack=18538 Win=133 Len=1460 [TCP segment of a reassembled PDU]"
"467","24.995932","172.64.155.249","192.168.0.183","TLSv1.2","568","Application Data"
"468","24.995985","192.168.0.183","172.64.155.249","TCP","54","51124  >  443 [ACK] Seq=18538 Ack=270076 Win=514 Len=0"
"469","24.997805","172.64.155.249","192.168.0.183","TCP","1514","443  >  51124 [ACK] Seq=270076 Ack=18538 Win=133 Len=1460 [TCP segment of a reassembled PDU]"
"470","24.997805","172.64.155.249","192.168.0.183","TCP","1514","443  >  51124 [ACK] Seq=271536 Ack=18538 Win=133 Len=1460 [TCP segment of a reassembled PDU]"
"471","24.997805","172.64.155.249","192.168.0.183","TLSv1.2","786","Application Data"
"472","24.997887","192.168.0.183","172.64.155.249","TCP","54","51124  >  443 [ACK] Seq=18538 Ack=273728 Win=514 Len=0"
"473","25.007141","172.64.155.249","192.168.0.183","TCP","1514","443  >  51124 [ACK] Seq=273728 Ack=18538 Win=133 Len=1460 [TCP segment of a reassembled PDU]"
"474","25.007141","172.64.155.249","192.168.0.183","TLSv1.2","1349","Application Data"
"475","25.007141","172.64.155.249","192.168.0.183","TLSv1.2","452","Application Data"
"476","25.007242","192.168.0.183","172.64.155.249","TCP","54","51124  >  443 [ACK] Seq=18538 Ack=276881 Win=514 Len=0"
"477","25.009880","172.64.155.249","192.168.0.183","TCP","1514","443  >  51124 [ACK] Seq=276881 Ack=18538 Win=133 Len=1460 [TCP segment of a reassembled PDU]"
"478","25.009880","172.64.155.249","192.168.0.183","TCP","1514","443  >  51124 [ACK] Seq=278341 Ack=18538 Win=133 Len=1460 [TCP segment of a reassembled PDU]"
"479","25.009880","172.64.155.249","192.168.0.183","TCP","1514","443  >  51124 [ACK] Seq=279801 Ack=18538 Win=133 Len=1460 [TCP segment of a reassembled PDU]"
"480","25.009880","172.64.155.249","192.168.0.183","TCP","1514","443  >  51124 [ACK] Seq=281261 Ack=18538 Win=133 Len=1460 [TCP segment of a reassembled PDU]"
"481","25.009880","172.64.155.249","192.168.0.183","TCP","1514","443  >  51124 [ACK] Seq=282721 Ack=18538 Win=133 Len=1460 [TCP segment of a reassembled PDU]"
"482","25.009880","172.64.155.249","192.168.0.183","TCP","1514","443  >  51124 [PSH, ACK] Seq=284181 Ack=18538 Win=133 Len=1460 [TCP segment of a reassembled PDU]"
"483","25.009880","172.64.155.249","192.168.0.183","TCP","1514","443  >  51124 [ACK] Seq=285641 Ack=18538 Win=133 Len=1460 [TCP segment of a reassembled PDU]"
"484","25.009880","172.64.155.249","192.168.0.183","TLSv1.2","236","Application Data"
"485","25.009880","172.64.155.249","192.168.0.183","TLSv1.2","127","Application Data, Application Data"
"486","25.009964","192.168.0.183","172.64.155.249","TCP","54","51124  >  443 [ACK] Seq=18538 Ack=287356 Win=514 Len=0"
"487","25.235103","192.168.0.183","172.64.155.249","TLSv1.2","498","Application Data"
"488","25.247937","172.64.155.249","192.168.0.183","TCP","60","443  >  51124 [ACK] Seq=287356 Ack=18982 Win=133 Len=0"
"489","25.269842","172.64.155.249","192.168.0.183","TLSv1.2","152","Application Data"
"490","25.314362","192.168.0.183","172.64.155.249","TCP","54","51124  >  443 [ACK] Seq=18982 Ack=287454 Win=513 Len=0"
"491","25.382066","192.168.0.183","172.64.155.249","TLSv1.2","490","Application Data"
"492","25.382130","192.168.0.183","172.64.155.249","TLSv1.2","552","Application Data"
"493","25.396875","172.64.155.249","192.168.0.183","TCP","60","443  >  51124 [ACK] Seq=287454 Ack=19916 Win=134 Len=0"
"494","25.418917","172.64.155.249","192.168.0.183","TLSv1.2","144","Application Data"
"495","25.418917","172.64.155.249","192.168.0.183","TLSv1.2","85","Application Data"
"496","25.418956","192.168.0.183","172.64.155.249","TCP","54","51124  >  443 [ACK] Seq=19916 Ack=287575 Win=513 Len=0"
"497","27.425470","192.168.0.183","172.64.155.249","TLSv1.2","237","Application Data"
"498","27.425562","192.168.0.183","172.64.155.249","TLSv1.2","170","Application Data"
"499","27.438717","192.168.0.183","172.64.155.249","TLSv1.2","419","Application Data"
"500","27.439588","172.64.155.249","192.168.0.183","TCP","60","443  >  51124 [ACK] Seq=287575 Ack=20215 Win=134 Len=0"
"501","27.460281","172.64.155.249","192.168.0.183","TLSv1.2","278","Application Data"
"502","27.487895","172.64.155.249","192.168.0.183","TLSv1.2","194","Application Data"
"503","27.487895","172.64.155.249","192.168.0.183","TLSv1.2","100","Application Data"
"504","27.487895","172.64.155.249","192.168.0.183","TCP","1514","443  >  51124 [ACK] Seq=287985 Ack=20580 Win=134 Len=1460 [TCP segment of a reassembled PDU]"
"505","27.487895","172.64.155.249","192.168.0.183","TCP","1514","443  >  51124 [ACK] Seq=289445 Ack=20580 Win=134 Len=1460 [TCP segment of a reassembled PDU]"
"506","27.487895","172.64.155.249","192.168.0.183","TLSv1.2","937","Application Data"
"507","27.487943","192.168.0.183","172.64.155.249","TCP","54","51124  >  443 [ACK] Seq=20580 Ack=291788 Win=514 Len=0"
"508","27.488929","192.168.0.183","172.64.155.249","TLSv1.2","89","Application Data"
"509","27.490062","172.64.155.249","192.168.0.183","TCP","1514","443  >  51124 [ACK] Seq=291788 Ack=20580 Win=134 Len=1460 [TCP segment of a reassembled PDU]"
"510","27.490062","172.64.155.249","192.168.0.183","TCP","1514","443  >  51124 [ACK] Seq=293248 Ack=20580 Win=134 Len=1460 [TCP segment of a reassembled PDU]"
"511","27.490062","172.64.155.249","192.168.0.183","TCP","1514","443  >  51124 [ACK] Seq=294708 Ack=20580 Win=134 Len=1460 [TCP segment of a reassembled PDU]"
"512","27.490062","172.64.155.249","192.168.0.183","TCP","1514","443  >  51124 [ACK] Seq=296168 Ack=20580 Win=134 Len=1460 [TCP segment of a reassembled PDU]"
"513","27.490062","172.64.155.249","192.168.0.183","TLSv1.2","147","Application Data"
"514","27.490118","192.168.0.183","172.64.155.249","TCP","54","51124  >  443 [ACK] Seq=20615 Ack=297721 Win=514 Len=0"
"515","27.499383","172.64.155.249","192.168.0.183","TCP","1514","443  >  51124 [ACK] Seq=297721 Ack=20580 Win=134 Len=1460 [TCP segment of a reassembled PDU]"
"516","27.499383","172.64.155.249","192.168.0.183","TLSv1.2","1000","Application Data"
"517","27.499462","192.168.0.183","172.64.155.249","TCP","54","51124  >  443 [ACK] Seq=20615 Ack=300127 Win=514 Len=0"
"518","27.501980","172.64.155.249","192.168.0.183","TCP","1514","443  >  51124 [ACK] Seq=300127 Ack=20615 Win=134 Len=1460 [TCP segment of a reassembled PDU]"
"519","27.501980","172.64.155.249","192.168.0.183","TLSv1.2","657","Application Data"
"520","27.501980","172.64.155.249","192.168.0.183","TCP","1514","443  >  51124 [ACK] Seq=302190 Ack=20615 Win=134 Len=1460 [TCP segment of a reassembled PDU]"
"521","27.501980","172.64.155.249","192.168.0.183","TCP","1514","443  >  51124 [ACK] Seq=303650 Ack=20615 Win=134 Len=1460 [TCP segment of a reassembled PDU]"
"522","27.502130","192.168.0.183","172.64.155.249","TCP","54","51124  >  443 [ACK] Seq=20615 Ack=305110 Win=514 Len=0"
"523","27.508674","172.64.155.249","192.168.0.183","TCP","1514","443  >  51124 [ACK] Seq=305110 Ack=20615 Win=134 Len=1460 [TCP segment of a reassembled PDU]"
"524","27.508674","172.64.155.249","192.168.0.183","TLSv1.2","125","Application Data"
"525","27.508674","172.64.155.249","192.168.0.183","TCP","1514","443  >  51124 [ACK] Seq=306641 Ack=20615 Win=134 Len=1460 [TCP segment of a reassembled PDU]"
"526","27.508674","172.64.155.249","192.168.0.183","TCP","1514","443  >  51124 [ACK] Seq=308101 Ack=20615 Win=134 Len=1460 [TCP segment of a reassembled PDU]"
"527","27.508674","172.64.155.249","192.168.0.183","TCP","1514","443  >  51124 [ACK] Seq=309561 Ack=20615 Win=134 Len=1460 [TCP segment of a reassembled PDU]"
"528","27.508674","172.64.155.249","192.168.0.183","TLSv1.2","322","Application Data"
"529","27.508674","172.64.155.249","192.168.0.183","TCP","1514","443  >  51124 [ACK] Seq=311289 Ack=20615 Win=134 Len=1460 [TCP segment of a reassembled PDU]"
"530","27.508674","172.64.155.249","192.168.0.183","TCP","1514","443  >  51124 [ACK] Seq=312749 Ack=20615 Win=134 Len=1460 [TCP segment of a reassembled PDU]"
"531","27.508674","172.64.155.249","192.168.0.183","TCP","1514","443  >  51124 [ACK] Seq=314209 Ack=20615 Win=134 Len=1460 [TCP segment of a reassembled PDU]"
"532","27.508674","172.64.155.249","192.168.0.183","TCP","1514","443  >  51124 [ACK] Seq=315669 Ack=20615 Win=134 Len=1460 [TCP segment of a reassembled PDU]"
"533","27.508674","172.64.155.249","192.168.0.183","TLSv1.2","288","Application Data"
"534","27.508674","172.64.155.249","192.168.0.183","TCP","1514","443  >  51124 [ACK] Seq=317363 Ack=20615 Win=134 Len=1460 [TCP segment of a reassembled PDU]"
"535","27.508674","172.64.155.249","192.168.0.183","TCP","1514","443  >  51124 [ACK] Seq=318823 Ack=20615 Win=134 Len=1460 [TCP segment of a reassembled PDU]"
"536","27.508674","172.64.155.249","192.168.0.183","TCP","1514","443  >  51124 [ACK] Seq=320283 Ack=20615 Win=134 Len=1460 [TCP segment of a reassembled PDU]"
"537","27.508674","172.64.155.249","192.168.0.183","TCP","1514","443  >  51124 [ACK] Seq=321743 Ack=20615 Win=134 Len=1460 [TCP segment of a reassembled PDU]"
"538","27.508674","172.64.155.249","192.168.0.183","TCP","1514","443  >  51124 [ACK] Seq=323203 Ack=20615 Win=134 Len=1460 [TCP segment of a reassembled PDU]"
"539","27.508674","172.64.155.249","192.168.0.183","TLSv1.2","109","Application Data"
"540","27.508950","192.168.0.183","172.64.155.249","TCP","54","51124  >  443 [ACK] Seq=20615 Ack=324718 Win=514 Len=0"
"541","27.512404","172.64.155.249","192.168.0.183","TCP","1514","443  >  51124 [ACK] Seq=324718 Ack=20615 Win=134 Len=1460 [TCP segment of a reassembled PDU]"
"542","27.512404","172.64.155.249","192.168.0.183","TCP","1514","443  >  51124 [ACK] Seq=326178 Ack=20615 Win=134 Len=1460 [TCP segment of a reassembled PDU]"
"543","27.512404","172.64.155.249","192.168.0.183","TLSv1.2","173","Application Data"
"544","27.512404","172.64.155.249","192.168.0.183","TLSv1.2","96","Application Data"
"545","27.512404","172.64.155.249","192.168.0.183","TLSv1.2","85","Application Data"
"546","27.512490","192.168.0.183","172.64.155.249","TCP","54","51124  >  443 [ACK] Seq=20615 Ack=327830 Win=514 Len=0"
"547","27.573908","192.168.0.183","172.64.155.249","TLSv1.2","237","Application Data"
"548","27.613191","172.64.155.249","192.168.0.183","TLSv1.2","670","Application Data"
"549","27.613191","172.64.155.249","192.168.0.183","TLSv1.2","203","Application Data"
"550","27.613191","172.64.155.249","192.168.0.183","TLSv1.2","85","Application Data"
"551","27.613489","192.168.0.183","172.64.155.249","TCP","54","51134  >  443 [ACK] Seq=1088 Ack=4027 Win=510 Len=0"
"552","27.615259","192.168.0.183","172.64.155.249","TLSv1.2","89","Application Data"
"553","27.668504","172.64.155.249","192.168.0.183","TCP","60","443  >  51134 [ACK] Seq=4027 Ack=1123 Win=8 Len=0"
"554","27.788933","192.168.0.183","172.64.155.249","TLSv1.2","245","Application Data"
"555","27.823492","172.64.155.249","192.168.0.183","TLSv1.2","254","Application Data"
"556","27.868273","192.168.0.183","172.64.155.249","TCP","54","51124  >  443 [ACK] Seq=20806 Ack=328030 Win=513 Len=0"
"557","28.011543","192.168.0.183","172.64.155.249","TLSv1.2","503","Application Data"
"558","28.011609","192.168.0.183","172.64.155.249","TLSv1.2","567","Application Data"
"559","28.025536","172.64.155.249","192.168.0.183","TCP","60","443  >  51124 [ACK] Seq=328030 Ack=21768 Win=135 Len=0"
"560","28.049661","172.64.155.249","192.168.0.183","TLSv1.2","144","Application Data"
"561","28.049661","172.64.155.249","192.168.0.183","TLSv1.2","85","Application Data"
"562","28.049701","192.168.0.183","172.64.155.249","TCP","54","51124  >  443 [ACK] Seq=21768 Ack=328151 Win=512 Len=0"
"563","30.273963","192.168.0.183","172.64.155.249","TLSv1.2","161","Application Data"
"564","30.338713","172.64.155.249","192.168.0.183","TCP","60","443  >  51124 [ACK] Seq=328151 Ack=21875 Win=135 Len=0"
"565","30.543884","172.64.155.249","192.168.0.183","TLSv1.2","280","Application Data"
"566","30.543884","172.64.155.249","192.168.0.183","TLSv1.2","100","Application Data"
"567","30.543884","172.64.155.249","192.168.0.183","TCP","1514","443  >  51124 [ACK] Seq=328423 Ack=21875 Win=135 Len=1460 [TCP segment of a reassembled PDU]"
"568","30.543884","172.64.155.249","192.168.0.183","TLSv1.2","1098","Application Data"
"569","30.543884","172.64.155.249","192.168.0.183","TCP","1514","443  >  51124 [ACK] Seq=330927 Ack=21875 Win=135 Len=1460 [TCP segment of a reassembled PDU]"
"570","30.543933","192.168.0.183","172.64.155.249","TCP","54","51124  >  443 [ACK] Seq=21875 Ack=332387 Win=514 Len=0"
"571","30.545541","172.64.155.249","192.168.0.183","TCP","1514","443  >  51124 [ACK] Seq=332387 Ack=21875 Win=135 Len=1460 [TCP segment of a reassembled PDU]"
"572","30.545541","172.64.155.249","192.168.0.183","TLSv1.2","710","Application Data"
"573","30.545541","172.64.155.249","192.168.0.183","TCP","1514","443  >  51124 [ACK] Seq=334503 Ack=21875 Win=135 Len=1460 [TCP segment of a reassembled PDU]"
"574","30.545541","172.64.155.249","192.168.0.183","TCP","1514","443  >  51124 [ACK] Seq=335963 Ack=21875 Win=135 Len=1460 [TCP segment of a reassembled PDU]"
"575","30.545541","172.64.155.249","192.168.0.183","TCP","1514","443  >  51124 [ACK] Seq=337423 Ack=21875 Win=135 Len=1460 [TCP segment of a reassembled PDU]"
"576","30.545541","172.64.155.249","192.168.0.183","TLSv1.2","561","Application Data"
"577","30.545662","192.168.0.183","172.64.155.249","TCP","54","51124  >  443 [ACK] Seq=21875 Ack=339390 Win=514 Len=0"
"578","30.553901","172.64.155.249","192.168.0.183","TCP","1514","443  >  51124 [ACK] Seq=339390 Ack=21875 Win=135 Len=1460 [TCP segment of a reassembled PDU]"
"579","30.553901","172.64.155.249","192.168.0.183","TLSv1.2","295","Application Data"
"580","30.553901","172.64.155.249","192.168.0.183","TCP","1514","443  >  51124 [ACK] Seq=341091 Ack=21875 Win=135 Len=1460 [TCP segment of a reassembled PDU]"
"581","30.554016","192.168.0.183","172.64.155.249","TCP","54","51124  >  443 [ACK] Seq=21875 Ack=342551 Win=514 Len=0"
"582","30.555641","172.64.155.249","192.168.0.183","TCP","1514","443  >  51124 [ACK] Seq=342551 Ack=21875 Win=135 Len=1460 [TCP segment of a reassembled PDU]"
"583","30.555641","172.64.155.249","192.168.0.183","TCP","1514","443  >  51124 [ACK] Seq=344011 Ack=21875 Win=135 Len=1460 [TCP segment of a reassembled PDU]"
"584","30.555641","172.64.155.249","192.168.0.183","TLSv1.2","375","Application Data"
"585","30.555641","172.64.155.249","192.168.0.183","TCP","1514","443  >  51124 [ACK] Seq=345792 Ack=21875 Win=135 Len=1460 [TCP segment of a reassembled PDU]"
"586","30.555641","172.64.155.249","192.168.0.183","TCP","1514","443  >  51124 [ACK] Seq=347252 Ack=21875 Win=135 Len=1460 [TCP segment of a reassembled PDU]"
"587","30.555699","192.168.0.183","172.64.155.249","TCP","54","51124  >  443 [ACK] Seq=21875 Ack=348712 Win=514 Len=0"
"588","30.557390","172.64.155.249","192.168.0.183","TCP","1514","443  >  51124 [ACK] Seq=348712 Ack=21875 Win=135 Len=1460 [TCP segment of a reassembled PDU]"
"589","30.557390","172.64.155.249","192.168.0.183","TLSv1.2","809","Application Data"
"590","30.557390","172.64.155.249","192.168.0.183","TLSv1.2","96","Application Data"
"591","30.557390","172.64.155.249","192.168.0.183","TLSv1.2","85","Application Data"
"592","30.557462","192.168.0.183","172.64.155.249","TCP","54","51124  >  443 [ACK] Seq=21875 Ack=351000 Win=514 Len=0"
"593","30.854820","192.168.0.183","172.64.155.249","TLSv1.2","229","Application Data"
"594","30.855069","192.168.0.183","172.64.155.249","TLSv1.2","178","Application Data"
"595","30.869183","172.64.155.249","192.168.0.183","TCP","60","443  >  51124 [ACK] Seq=351000 Ack=22174 Win=136 Len=0"
"596","30.892790","172.64.155.249","192.168.0.183","TLSv1.2","144","Application Data"
"597","30.896996","172.64.155.249","192.168.0.183","TLSv1.2","158","Application Data"
"598","30.896996","172.64.155.249","192.168.0.183","TLSv1.2","227","Application Data"
"599","30.896996","172.64.155.249","192.168.0.183","TLSv1.2","85","Application Data"
"600","30.897051","192.168.0.183","172.64.155.249","TCP","54","51124  >  443 [ACK] Seq=22174 Ack=351398 Win=512 Len=0"
"601","30.991592","192.168.0.183","172.64.155.249","TLSv1.2","637","Application Data"
"602","30.991654","192.168.0.183","172.64.155.249","TLSv1.2","545","Application Data"
"603","31.003389","172.64.155.249","192.168.0.183","TCP","60","443  >  51124 [ACK] Seq=351398 Ack=23248 Win=136 Len=0"
"604","31.034540","172.64.155.249","192.168.0.183","TLSv1.2","199","Application Data"
"605","31.034540","172.64.155.249","192.168.0.183","TLSv1.2","85","Application Data"
"606","31.034576","192.168.0.183","172.64.155.249","TCP","54","51124  >  443 [ACK] Seq=23248 Ack=351574 Win=511 Len=0"
