"No.","Time","Source","Destination","Protocol","Length","Info"
"1","0.000000","192.168.0.183","172.64.155.249","TLSv1.2","171","Application Data"
"2","0.000089","192.168.0.183","172.64.155.249","TLSv1.2","93","Application Data"
"3","0.000116","192.168.0.183","172.64.155.249","TLSv1.2","176","Application Data"
"4","0.000338","192.168.0.183","172.64.155.249","TLSv1.2","129","Application Data"
"5","0.000410","192.168.0.183","172.64.155.249","TLSv1.2","183","Application Data"
"6","0.018517","172.64.155.249","192.168.0.183","TCP","60","443  >  51124 [ACK] Seq=1 Ack=483 Win=8 Len=0"
"7","0.018517","172.64.155.249","192.168.0.183","TLSv1.2","93","Application Data"
"8","0.047869","172.64.155.249","192.168.0.183","TLSv1.2","406","Application Data"
"9","0.047869","172.64.155.249","192.168.0.183","TLSv1.2","153","Application Data"
"10","0.047904","192.168.0.183","172.64.155.249","TCP","54","51124  >  443 [ACK] Seq=483 Ack=491 Win=509 Len=0"
"11","9.901357","192.168.0.183","172.64.155.249","TLSv1.2","183","Application Data"
"12","9.956170","172.64.155.249","192.168.0.183","TCP","60","443  >  51124 [ACK] Seq=491 Ack=612 Win=8 Len=0"
"13","9.986779","172.64.155.249","192.168.0.183","TLSv1.2","279","Application Data"
"14","9.986779","172.64.155.249","192.168.0.183","TLSv1.2","100","Application Data"
"15","9.986779","172.64.155.249","192.168.0.183","TLSv1.2","1280","Application Data"
"16","9.986839","192.168.0.183","172.64.155.249","TCP","54","51124  >  443 [ACK] Seq=612 Ack=1988 Win=514 Len=0"
"17","9.988451","192.168.0.183","172.64.155.249","TLSv1.2","89","Application Data"
"18","9.990227","172.64.155.249","192.168.0.183","TCP","1514","443  >  51124 [ACK] Seq=1988 Ack=612 Win=8 Len=1460 [TCP segment of a reassembled PDU]"
"19","9.990227","172.64.155.249","192.168.0.183","TCP","1514","443  >  51124 [ACK] Seq=3448 Ack=612 Win=8 Len=1460 [TCP segment of a reassembled PDU]"
"20","9.990227","172.64.155.249","192.168.0.183","TCP","1514","443  >  51124 [ACK] Seq=4908 Ack=612 Win=8 Len=1460 [TCP segment of a reassembled PDU]"
"21","9.990227","172.64.155.249","192.168.0.183","TCP","1514","443  >  51124 [ACK] Seq=6368 Ack=612 Win=8 Len=1460 [TCP segment of a reassembled PDU]"
"22","9.990227","172.64.155.249","192.168.0.183","TCP","1514","443  >  51124 [ACK] Seq=7828 Ack=612 Win=8 Len=1460 [TCP segment of a reassembled PDU]"
"23","9.990227","172.64.155.249","192.168.0.183","TLSv1.2","1325","Application Data"
"24","9.990443","192.168.0.183","172.64.155.249","TCP","54","51124  >  443 [ACK] Seq=647 Ack=10559 Win=514 Len=0"
"25","9.999472","172.64.155.249","192.168.0.183","TCP","1514","443  >  51124 [ACK] Seq=10559 Ack=612 Win=8 Len=1460 [TCP segment of a reassembled PDU]"
"26","9.999472","172.64.155.249","192.168.0.183","TLSv1.2","1312","Application Data"
"27","9.999472","172.64.155.249","192.168.0.183","TCP","1514","443  >  51124 [ACK] Seq=13277 Ack=612 Win=8 Len=1460 [TCP segment of a reassembled PDU]"
"28","9.999515","192.168.0.183","172.64.155.249","TCP","54","51124  >  443 [ACK] Seq=647 Ack=14737 Win=514 Len=0"
"29","10.001280","172.64.155.249","192.168.0.183","TCP","1514","443  >  51124 [ACK] Seq=14737 Ack=612 Win=8 Len=1460 [TCP segment of a reassembled PDU]"
"30","10.001280","172.64.155.249","192.168.0.183","TCP","1514","443  >  51124 [ACK] Seq=16197 Ack=612 Win=8 Len=1460 [TCP segment of a reassembled PDU]"
"31","10.001280","172.64.155.249","192.168.0.183","TLSv1.2","1357","Application Data"
"32","10.001280","172.64.155.249","192.168.0.183","TCP","60","443  >  51124 [ACK] Seq=18960 Ack=647 Win=8 Len=0"
"33","10.001280","172.64.155.249","192.168.0.183","TCP","1514","443  >  51124 [ACK] Seq=18960 Ack=647 Win=8 Len=1460 [TCP segment of a reassembled PDU]"
"34","10.001280","172.64.155.249","192.168.0.183","TCP","1514","443  >  51124 [ACK] Seq=20420 Ack=647 Win=8 Len=1460 [TCP segment of a reassembled PDU]"
"35","10.001280","172.64.155.249","192.168.0.183","TCP","1514","443  >  51124 [ACK] Seq=21880 Ack=647 Win=8 Len=1460 [TCP segment of a reassembled PDU]"
"36","10.001280","172.64.155.249","192.168.0.183","TLSv1.2","362","Application Data"
"37","10.001280","172.64.155.249","192.168.0.183","TLSv1.2","85","Application Data"
"38","10.001391","192.168.0.183","172.64.155.249","TCP","54","51124  >  443 [ACK] Seq=647 Ack=23679 Win=514 Len=0"
"39","10.420827","192.168.0.183","172.64.155.249","TLSv1.2","610","Application Data"
"40","10.421068","192.168.0.183","172.64.155.249","TLSv1.2","176","Application Data"
"41","10.433989","172.64.155.249","192.168.0.183","TCP","60","443  >  51124 [ACK] Seq=23679 Ack=1325 Win=8 Len=0"
"42","10.459107","172.64.155.249","192.168.0.183","TLSv1.2","173","Application Data"
"43","10.476896","172.64.155.249","192.168.0.183","TLSv1.2","164","Application Data"
"44","10.476896","172.64.155.249","192.168.0.183","TLSv1.2","224","Application Data"
"45","10.476896","172.64.155.249","192.168.0.183","TLSv1.2","85","Application Data"
"46","10.476957","192.168.0.183","172.64.155.249","TCP","54","51124  >  443 [ACK] Seq=1325 Ack=24109 Win=512 Len=0"
"47","10.576986","192.168.0.183","172.64.155.249","TLSv1.2","468","Application Data"
"48","10.577048","192.168.0.183","172.64.155.249","TLSv1.2","538","Application Data"
"49","10.594872","172.64.155.249","192.168.0.183","TCP","60","443  >  51124 [ACK] Seq=24109 Ack=2223 Win=8 Len=0"
"50","10.619930","172.64.155.249","192.168.0.183","TLSv1.2","277","Application Data"
"51","10.619930","172.64.155.249","192.168.0.183","TLSv1.2","85","Application Data"
"52","10.619974","192.168.0.183","172.64.155.249","TCP","54","51124  >  443 [ACK] Seq=2223 Ack=24363 Win=511 Len=0"
"53","13.009962","192.168.0.183","172.64.155.249","TLSv1.2","365","Application Data"
"54","13.010030","192.168.0.183","172.64.155.249","TLSv1.2","170","Application Data"
"55","13.023550","192.168.0.183","172.64.155.249","TLSv1.2","301","Application Data"
"56","13.025644","172.64.155.249","192.168.0.183","TCP","60","443  >  51124 [ACK] Seq=24363 Ack=2650 Win=8 Len=0"
"57","13.047542","172.64.155.249","192.168.0.183","TLSv1.2","278","Application Data"
"58","13.078463","172.64.155.249","192.168.0.183","TLSv1.2","183","Application Data"
"59","13.078463","172.64.155.249","192.168.0.183","TLSv1.2","85","Application Data"
"60","13.078505","192.168.0.183","172.64.155.249","TCP","54","51124  >  443 [ACK] Seq=2897 Ack=24747 Win=509 Len=0"
"61","13.086072","192.168.0.183","172.64.155.249","TLSv1.2","156","Application Data"
"62","13.122702","172.64.155.249","192.168.0.183","TLSv1.2","169","Application Data"
"63","13.122702","172.64.155.249","192.168.0.183","TLSv1.2","100","Application Data"
"64","13.122702","172.64.155.249","192.168.0.183","TCP","1514","443  >  51124 [ACK] Seq=24908 Ack=2999 Win=8 Len=1460 [TCP segment of a reassembled PDU]"
"65","13.122702","172.64.155.249","192.168.0.183","TCP","1514","443  >  51124 [ACK] Seq=26368 Ack=2999 Win=8 Len=1460 [TCP segment of a reassembled PDU]"
"66","13.122702","172.64.155.249","192.168.0.183","TLSv1.2","911","Application Data"
"67","13.122748","192.168.0.183","172.64.155.249","TCP","54","51124  >  443 [ACK] Seq=2999 Ack=28685 Win=514 Len=0"
"68","13.124811","172.64.155.249","192.168.0.183","TCP","1514","443  >  51124 [ACK] Seq=28685 Ack=2999 Win=8 Len=1460 [TCP segment of a reassembled PDU]"
"69","13.124811","172.64.155.249","192.168.0.183","TCP","1514","443  >  51124 [ACK] Seq=30145 Ack=2999 Win=8 Len=1460 [TCP segment of a reassembled PDU]"
"70","13.124811","172.64.155.249","192.168.0.183","TCP","1514","443  >  51124 [ACK] Seq=31605 Ack=2999 Win=8 Len=1460 [TCP segment of a reassembled PDU]"
"71","13.124811","172.64.155.249","192.168.0.183","TLSv1.2","769","Application Data"
"72","13.124876","192.168.0.183","172.64.155.249","TCP","54","51124  >  443 [ACK] Seq=2999 Ack=33780 Win=514 Len=0"
"73","13.133107","172.64.155.249","192.168.0.183","TCP","1514","443  >  51124 [ACK] Seq=33780 Ack=2999 Win=8 Len=1460 [TCP segment of a reassembled PDU]"
"74","13.133107","172.64.155.249","192.168.0.183","TLSv1.2","1125","Application Data"
"75","13.133107","172.64.155.249","192.168.0.183","TCP","1514","443  >  51124 [ACK] Seq=36311 Ack=2999 Win=8 Len=1460 [TCP segment of a reassembled PDU]"
"76","13.133107","172.64.155.249","192.168.0.183","TLSv1.2","1176","Application Data"
"77","13.133107","172.64.155.249","192.168.0.183","TLSv1.2","96","Application Data"
"78","13.133107","172.64.155.249","192.168.0.183","TLSv1.2","85","Application Data"
"79","13.133172","192.168.0.183","172.64.155.249","TCP","54","51124  >  443 [ACK] Seq=2999 Ack=38966 Win=514 Len=0"
"80","13.263226","192.168.0.183","172.64.155.249","TCP","55","51134  >  443 [ACK] Seq=1 Ack=1 Win=508 Len=1 [TCP segment of a reassembled PDU]"
"81","13.274931","172.64.155.249","192.168.0.183","TCP","66","443  >  51134 [ACK] Seq=1 Ack=2 Win=8 Len=0 SLE=1 SRE=2"
"82","13.731481","192.168.0.183","172.64.155.249","TLSv1.2","551","Application Data"
"83","13.731606","192.168.0.183","172.64.155.249","TLSv1.2","567","Application Data"
"84","13.745984","172.64.155.249","192.168.0.183","TCP","60","443  >  51124 [ACK] Seq=38966 Ack=4009 Win=8 Len=0"
"85","13.770688","172.64.155.249","192.168.0.183","TLSv1.2","277","Application Data"
"86","13.770688","172.64.155.249","192.168.0.183","TLSv1.2","85","Application Data"
"87","13.770779","192.168.0.183","172.64.155.249","TCP","54","51124  >  443 [ACK] Seq=4009 Ack=39220 Win=513 Len=0"
"88","15.213482","192.168.0.183","172.64.155.249","TLSv1.2","264","Application Data"
"89","15.213548","192.168.0.183","172.64.155.249","TCP","1454","51124  >  443 [ACK] Seq=4219 Ack=39220 Win=513 Len=1400 [TCP segment of a reassembled PDU]"
"90","15.213548","192.168.0.183","172.64.155.249","TLSv1.2","427","Application Data"
"91","15.230735","172.64.155.249","192.168.0.183","TCP","60","443  >  51124 [ACK] Seq=39220 Ack=5992 Win=8 Len=0"
"92","15.326597","172.64.155.249","192.168.0.183","TLSv1.2","348","Application Data"
"93","15.326597","172.64.155.249","192.168.0.183","TLSv1.2","85","Application Data"
"94","15.326637","192.168.0.183","172.64.155.249","TCP","54","51124  >  443 [ACK] Seq=5992 Ack=39545 Win=511 Len=0"
"95","15.332476","192.168.0.183","172.64.155.249","TLSv1.2","173","Application Data"
"96","15.396485","172.64.155.249","192.168.0.183","TCP","60","443  >  51124 [ACK] Seq=39545 Ack=6111 Win=8 Len=0"
"97","15.622443","172.64.155.249","192.168.0.183","TLSv1.2","204","Application Data"
"98","15.622443","172.64.155.249","192.168.0.183","TLSv1.2","100","Application Data"
"99","15.622443","172.64.155.249","192.168.0.183","TLSv1.2","1325","Application Data"
"100","15.622488","192.168.0.183","172.64.155.249","TCP","54","51124  >  443 [ACK] Seq=6111 Ack=41012 Win=514 Len=0"
"101","15.623600","192.168.0.183","172.64.155.249","TLSv1.2","89","Application Data"
"102","15.647306","172.64.155.249","192.168.0.183","TCP","1514","443  >  51124 [ACK] Seq=41012 Ack=6111 Win=8 Len=1460 [TCP segment of a reassembled PDU]"
"103","15.647306","172.64.155.249","192.168.0.183","TCP","1514","443  >  51124 [ACK] Seq=42472 Ack=6111 Win=8 Len=1460 [TCP segment of a reassembled PDU]"
"104","15.647306","172.64.155.249","192.168.0.183","TCP","1514","443  >  51124 [ACK] Seq=43932 Ack=6111 Win=8 Len=1460 [TCP segment of a reassembled PDU]"
"105","15.647306","172.64.155.249","192.168.0.183","TCP","1514","443  >  51124 [ACK] Seq=45392 Ack=6111 Win=8 Len=1460 [TCP segment of a reassembled PDU]"
"106","15.647306","172.64.155.249","192.168.0.183","TCP","1514","443  >  51124 [ACK] Seq=46852 Ack=6111 Win=8 Len=1460 [TCP segment of a reassembled PDU]"
"107","15.647306","172.64.155.249","192.168.0.183","TCP","1514","443  >  51124 [PSH, ACK] Seq=48312 Ack=6111 Win=8 Len=1460 [TCP segment of a reassembled PDU]"
"108","15.647306","172.64.155.249","192.168.0.183","TLSv1.2","1075","Application Data"
"109","15.647306","172.64.155.249","192.168.0.183","TCP","1514","443  >  51124 [ACK] Seq=50793 Ack=6111 Win=8 Len=1460 [TCP segment of a reassembled PDU]"
"110","15.647306","172.64.155.249","192.168.0.183","TLSv1.2","271","Application Data"
"111","15.647306","172.64.155.249","192.168.0.183","TCP","1514","443  >  51124 [ACK] Seq=52470 Ack=6111 Win=8 Len=1460 [TCP segment of a reassembled PDU]"
"112","15.647306","172.64.155.249","192.168.0.183","TCP","1514","443  >  51124 [ACK] Seq=53930 Ack=6111 Win=8 Len=1460 [TCP segment of a reassembled PDU]"
"113","15.647306","172.64.155.249","192.168.0.183","TLSv1.2","445","Application Data"
"114","15.647306","172.64.155.249","192.168.0.183","TCP","60","443  >  51124 [ACK] Seq=55781 Ack=6146 Win=8 Len=0"
"115","15.647306","172.64.155.249","192.168.0.183","TCP","1514","443  >  51124 [ACK] Seq=55781 Ack=6146 Win=8 Len=1460 [TCP segment of a reassembled PDU]"
"116","15.647306","172.64.155.249","192.168.0.183","TCP","1514","443  >  51124 [ACK] Seq=57241 Ack=6146 Win=8 Len=1460 [TCP segment of a reassembled PDU]"
"117","15.647306","172.64.155.249","192.168.0.183","TCP","1514","443  >  51124 [ACK] Seq=58701 Ack=6146 Win=8 Len=1460 [TCP segment of a reassembled PDU]"
"118","15.647306","172.64.155.249","192.168.0.183","TLSv1.2","213","Application Data"
"119","15.647306","172.64.155.249","192.168.0.183","TCP","1514","443  >  51124 [ACK] Seq=60320 Ack=6146 Win=8 Len=1460 [TCP segment of a reassembled PDU]"
"120","15.647306","172.64.155.249","192.168.0.183","TCP","1514","443  >  51124 [ACK] Seq=61780 Ack=6146 Win=8 Len=1460 [TCP segment of a reassembled PDU]"
"121","15.647306","172.64.155.249","192.168.0.183","TCP","1514","443  >  51124 [ACK] Seq=63240 Ack=6146 Win=8 Len=1460 [TCP segment of a reassembled PDU]"
"122","15.647306","172.64.155.249","192.168.0.183","TLSv1.2","481","Application Data"
"123","15.647306","172.64.155.249","192.168.0.183","TCP","1514","443  >  51124 [ACK] Seq=65127 Ack=6146 Win=8 Len=1460 [TCP segment of a reassembled PDU]"
"124","15.647306","172.64.155.249","192.168.0.183","TCP","1514","443  >  51124 [ACK] Seq=66587 Ack=6146 Win=8 Len=1460 [TCP segment of a reassembled PDU]"
"125","15.647306","172.64.155.249","192.168.0.183","TCP","1514","443  >  51124 [ACK] Seq=68047 Ack=6146 Win=8 Len=1460 [TCP segment of a reassembled PDU]"
"126","15.647306","172.64.155.249","192.168.0.183","TCP","1514","443  >  51124 [ACK] Seq=69507 Ack=6146 Win=8 Len=1460 [TCP segment of a reassembled PDU]"
"127","15.647306","172.64.155.249","192.168.0.183","TCP","1514","443  >  51124 [ACK] Seq=70967 Ack=6146 Win=8 Len=1460 [TCP segment of a reassembled PDU]"
"128","15.647306","172.64.155.249","192.168.0.183","TLSv1.2","129","Application Data"
"129","15.647306","172.64.155.249","192.168.0.183","TCP","1514","443  >  51124 [ACK] Seq=72502 Ack=6146 Win=8 Len=1460 [TCP segment of a reassembled PDU]"
"130","15.647306","172.64.155.249","192.168.0.183","TLSv1.2","160","Application Data"
"131","15.647306","172.64.155.249","192.168.0.183","TLSv1.2","96","Application Data"
"132","15.647306","172.64.155.249","192.168.0.183","TLSv1.2","85","Application Data"
"133","15.647488","192.168.0.183","172.64.155.249","TCP","54","51124  >  443 [ACK] Seq=6146 Ack=74141 Win=514 Len=0"
"134","15.720037","192.168.0.183","172.64.155.249","TLSv1.2","184","Ignored Unknown Record"
"135","15.720087","192.168.0.183","172.64.155.249","TLSv1.2","93","Application Data"
"136","15.742242","172.64.155.249","192.168.0.183","TCP","60","443  >  51134 [ACK] Seq=1 Ack=171 Win=8 Len=0"
"137","15.742242","172.64.155.249","192.168.0.183","TLSv1.2","93","Application Data"
"138","15.774884","172.64.155.249","192.168.0.183","TLSv1.2","474","Application Data"
"139","15.774884","172.64.155.249","192.168.0.183","TLSv1.2","203","Application Data"
"140","15.774884","172.64.155.249","192.168.0.183","TLSv1.2","85","Application Data"
"141","15.774928","192.168.0.183","172.64.155.249","TCP","54","51134  >  443 [ACK] Seq=171 Ack=640 Win=514 Len=0"
"142","15.775976","192.168.0.183","172.64.155.249","TLSv1.2","89","Application Data"
"143","15.828822","172.64.155.249","192.168.0.183","TCP","60","443  >  51134 [ACK] Seq=640 Ack=206 Win=8 Len=0"
"144","16.097280","192.168.0.183","172.64.155.249","TLSv1.2","571","Application Data"
"145","16.097344","192.168.0.183","172.64.155.249","TLSv1.2","588","Application Data"
"146","16.110114","172.64.155.249","192.168.0.183","TCP","60","443  >  51124 [ACK] Seq=74141 Ack=7197 Win=8 Len=0"
"147","16.135755","172.64.155.249","192.168.0.183","TLSv1.2","403","Application Data"
"148","16.135755","172.64.155.249","192.168.0.183","TLSv1.2","85","Application Data"
"149","16.135787","192.168.0.183","172.64.155.249","TCP","54","51124  >  443 [ACK] Seq=7197 Ack=74521 Win=512 Len=0"
"150","17.464708","192.168.0.183","172.64.155.249","TLSv1.2","609","Application Data"
"151","17.464798","192.168.0.183","172.64.155.249","TLSv1.2","627","Application Data"
"152","17.481251","172.64.155.249","192.168.0.183","TCP","60","443  >  51124 [ACK] Seq=74521 Ack=8325 Win=8 Len=0"
"153","17.485318","192.168.0.183","172.64.155.249","TLSv1.2","199","Application Data"
"154","17.502366","172.64.155.249","192.168.0.183","TLSv1.2","278","Application Data"
"155","17.502366","172.64.155.249","192.168.0.183","TLSv1.2","85","Application Data"
"156","17.502523","192.168.0.183","172.64.155.249","TCP","54","51124  >  443 [ACK] Seq=8470 Ack=74776 Win=511 Len=0"
"157","17.544142","172.64.155.249","192.168.0.183","TCP","60","443  >  51124 [ACK] Seq=74776 Ack=8470 Win=8 Len=0"
"158","17.555968","172.64.155.249","192.168.0.183","TLSv1.2","175","Application Data"
"159","17.555968","172.64.155.249","192.168.0.183","TLSv1.2","100","Application Data"
"160","17.555968","172.64.155.249","192.168.0.183","TLSv1.2","1310","Application Data"
"161","17.556014","192.168.0.183","172.64.155.249","TCP","54","51124  >  443 [ACK] Seq=8470 Ack=76199 Win=514 Len=0"
"162","17.558310","172.64.155.249","192.168.0.183","TCP","1514","443  >  51124 [ACK] Seq=76199 Ack=8470 Win=8 Len=1460 [TCP segment of a reassembled PDU]"
"163","17.558310","172.64.155.249","192.168.0.183","TCP","1514","443  >  51124 [ACK] Seq=77659 Ack=8470 Win=8 Len=1460 [TCP segment of a reassembled PDU]"
"164","17.558310","172.64.155.249","192.168.0.183","TCP","1514","443  >  51124 [ACK] Seq=79119 Ack=8470 Win=8 Len=1460 [TCP segment of a reassembled PDU]"
"165","17.558310","172.64.155.249","192.168.0.183","TLSv1.2","677","Application Data"
"166","17.558310","172.64.155.249","192.168.0.183","TCP","1514","443  >  51124 [ACK] Seq=81202 Ack=8470 Win=8 Len=1460 [TCP segment of a reassembled PDU]"
"167","17.558406","192.168.0.183","172.64.155.249","TCP","54","51124  >  443 [ACK] Seq=8470 Ack=82662 Win=514 Len=0"
"168","17.560068","172.64.155.249","192.168.0.183","TCP","1514","443  >  51124 [ACK] Seq=82662 Ack=8470 Win=8 Len=1460 [TCP segment of a reassembled PDU]"
"169","17.560068","172.64.155.249","192.168.0.183","TLSv1.2","861","Application Data"
"170","17.560101","192.168.0.183","172.64.155.249","TCP","54","51124  >  443 [ACK] Seq=8470 Ack=84929 Win=514 Len=0"
"171","17.566268","172.64.155.249","192.168.0.183","TCP","1514","443  >  51124 [ACK] Seq=84929 Ack=8470 Win=8 Len=1460 [TCP segment of a reassembled PDU]"
"172","17.566268","172.64.155.249","192.168.0.183","TLSv1.2","1411","Application Data"
"173","17.566323","192.168.0.183","172.64.155.249","TCP","54","51124  >  443 [ACK] Seq=8470 Ack=87746 Win=514 Len=0"
"174","17.568885","172.64.155.249","192.168.0.183","TCP","1514","443  >  51124 [ACK] Seq=87746 Ack=8470 Win=8 Len=1460 [TCP segment of a reassembled PDU]"
"175","17.568885","172.64.155.249","192.168.0.183","TLSv1.2","1057","Application Data"
"176","17.568885","172.64.155.249","192.168.0.183","TCP","1514","443  >  51124 [ACK] Seq=90209 Ack=8470 Win=8 Len=1460 [TCP segment of a reassembled PDU]"
"177","17.568885","172.64.155.249","192.168.0.183","TLSv1.2","937","Application Data"
"178","17.569093","192.168.0.183","172.64.155.249","TCP","54","51124  >  443 [ACK] Seq=8470 Ack=92552 Win=514 Len=0"
"179","17.570719","172.64.155.249","192.168.0.183","TCP","1514","443  >  51124 [ACK] Seq=92552 Ack=8470 Win=8 Len=1460 [TCP segment of a reassembled PDU]"
"180","17.570719","172.64.155.249","192.168.0.183","TCP","1514","443  >  51124 [ACK] Seq=94012 Ack=8470 Win=8 Len=1460 [TCP segment of a reassembled PDU]"
"181","17.570719","172.64.155.249","192.168.0.183","TLSv1.2","906","Application Data"
"182","17.570825","192.168.0.183","172.64.155.249","TCP","54","51124  >  443 [ACK] Seq=8470 Ack=96324 Win=514 Len=0"
"183","17.575369","172.64.155.249","192.168.0.183","TCP","1514","443  >  51124 [ACK] Seq=96324 Ack=8470 Win=8 Len=1460 [TCP segment of a reassembled PDU]"
"184","17.575369","172.64.155.249","192.168.0.183","TCP","1514","443  >  51124 [ACK] Seq=97784 Ack=8470 Win=8 Len=1460 [TCP segment of a reassembled PDU]"
"185","17.575369","172.64.155.249","192.168.0.183","TCP","1514","443  >  51124 [ACK] Seq=99244 Ack=8470 Win=8 Len=1460 [TCP segment of a reassembled PDU]"
"186","17.575369","172.64.155.249","192.168.0.183","TCP","1514","443  >  51124 [ACK] Seq=100704 Ack=8470 Win=8 Len=1460 [TCP segment of a reassembled PDU]"
"187","17.575369","172.64.155.249","192.168.0.183","TCP","1514","443  >  51124 [ACK] Seq=102164 Ack=8470 Win=8 Len=1460 [TCP segment of a reassembled PDU]"
"188","17.575369","172.64.155.249","192.168.0.183","TLSv1.2","404","Application Data"
"189","17.575369","172.64.155.249","192.168.0.183","TLSv1.2","1365","Application Data"
"190","17.575453","192.168.0.183","172.64.155.249","TCP","54","51124  >  443 [ACK] Seq=8470 Ack=105285 Win=514 Len=0"
"191","17.578112","172.64.155.249","192.168.0.183","TCP","1514","443  >  51124 [ACK] Seq=105285 Ack=8470 Win=8 Len=1460 [TCP segment of a reassembled PDU]"
"192","17.578112","172.64.155.249","192.168.0.183","TCP","1514","443  >  51124 [ACK] Seq=106745 Ack=8470 Win=8 Len=1460 [TCP segment of a reassembled PDU]"
"193","17.578112","172.64.155.249","192.168.0.183","TCP","1514","443  >  51124 [ACK] Seq=108205 Ack=8470 Win=8 Len=1460 [TCP segment of a reassembled PDU]"
"194","17.578112","172.64.155.249","192.168.0.183","TCP","1514","443  >  51124 [ACK] Seq=109665 Ack=8470 Win=8 Len=1460 [TCP segment of a reassembled PDU]"
"195","17.578112","172.64.155.249","192.168.0.183","TLSv1.2","705","Application Data"
"196","17.578182","192.168.0.183","172.64.155.249","TCP","54","51124  >  443 [ACK] Seq=8470 Ack=111776 Win=514 Len=0"
"197","17.581746","172.64.155.249","192.168.0.183","TCP","1514","443  >  51124 [ACK] Seq=111776 Ack=8470 Win=8 Len=1460 [TCP segment of a reassembled PDU]"
"198","17.581746","172.64.155.249","192.168.0.183","TCP","1514","443  >  51124 [ACK] Seq=113236 Ack=8470 Win=8 Len=1460 [TCP segment of a reassembled PDU]"
"199","17.581746","172.64.155.249","192.168.0.183","TCP","1514","443  >  51124 [ACK] Seq=114696 Ack=8470 Win=8 Len=1460 [TCP segment of a reassembled PDU]"
"200","17.581746","172.64.155.249","192.168.0.183","TCP","1514","443  >  51124 [ACK] Seq=116156 Ack=8470 Win=8 Len=1460 [TCP segment of a reassembled PDU]"
"201","17.581746","172.64.155.249","192.168.0.183","TCP","1514","443  >  51124 [ACK] Seq=117616 Ack=8470 Win=8 Len=1460 [TCP segment of a reassembled PDU]"
"202","17.581746","172.64.155.249","192.168.0.183","TCP","1514","443  >  51124 [PSH, ACK] Seq=119076 Ack=8470 Win=8 Len=1460 [TCP segment of a reassembled PDU]"
"203","17.581746","172.64.155.249","192.168.0.183","TLSv1.2","1241","Application Data"
"204","17.581746","172.64.155.249","192.168.0.183","TLSv1.2","1316","Application Data"
"205","17.581746","172.64.155.249","192.168.0.183","TLSv1.2","127","Application Data, Application Data"
"206","17.581869","192.168.0.183","172.64.155.249","TCP","54","51124  >  443 [ACK] Seq=8470 Ack=123058 Win=514 Len=0"
"207","17.692273","192.168.0.183","172.64.155.249","TLSv1.2","201","Application Data"
"208","17.707032","172.64.155.249","192.168.0.183","TCP","60","443  >  51134 [ACK] Seq=640 Ack=353 Win=8 Len=0"
"209","17.733974","172.64.155.249","192.168.0.183","TLSv1.2","474","Application Data"
"210","17.733974","172.64.155.249","192.168.0.183","TLSv1.2","203","Application Data"
"211","17.733974","172.64.155.249","192.168.0.183","TLSv1.2","85","Application Data"
"212","17.734089","192.168.0.183","172.64.155.249","TCP","54","51134  >  443 [ACK] Seq=353 Ack=1240 Win=511 Len=0"
"213","17.981324","192.168.0.183","172.64.155.249","TLSv1.2","470","Application Data"
"214","17.999513","172.64.155.249","192.168.0.183","TCP","60","443  >  51124 [ACK] Seq=123058 Ack=8886 Win=8 Len=0"
"215","18.022070","172.64.155.249","192.168.0.183","TLSv1.2","292","Application Data"
"216","18.065352","192.168.0.183","172.64.155.249","TCP","54","51124  >  443 [ACK] Seq=8886 Ack=123296 Win=513 Len=0"
"217","18.214112","192.168.0.183","172.64.155.249","TLSv1.2","490","Application Data"
"218","18.214150","192.168.0.183","172.64.155.249","TLSv1.2","594","Application Data"
"219","18.334428","172.64.155.249","192.168.0.183","TCP","60","443  >  51124 [ACK] Seq=123296 Ack=9862 Win=8 Len=0"
"220","18.357296","172.64.155.249","192.168.0.183","TLSv1.2","144","Application Data"
"221","18.357296","172.64.155.249","192.168.0.183","TLSv1.2","85","Application Data"
"222","18.357339","192.168.0.183","172.64.155.249","TCP","54","51124  >  443 [ACK] Seq=9862 Ack=123417 Win=512 Len=0"
"223","20.790537","192.168.0.183","172.64.155.249","TLSv1.2","299","Application Data"
"224","20.844030","172.64.155.249","192.168.0.183","TCP","60","443  >  51124 [ACK] Seq=123417 Ack=10107 Win=8 Len=0"
"225","20.855344","172.64.155.249","192.168.0.183","TLSv1.2","292","Application Data"
"226","20.855344","172.64.155.249","192.168.0.183","TLSv1.2","100","Application Data"
"227","20.855344","172.64.155.249","192.168.0.183","TCP","1514","443  >  51124 [ACK] Seq=123701 Ack=10107 Win=8 Len=1460 [TCP segment of a reassembled PDU]"
"228","20.855344","172.64.155.249","192.168.0.183","TCP","1514","443  >  51124 [ACK] Seq=125161 Ack=10107 Win=8 Len=1460 [TCP segment of a reassembled PDU]"
"229","20.855344","172.64.155.249","192.168.0.183","TCP","1514","443  >  51124 [ACK] Seq=126621 Ack=10107 Win=8 Len=1460 [TCP segment of a reassembled PDU]"
"230","20.855344","172.64.155.249","192.168.0.183","TLSv1.2","630","Application Data"
"231","20.855344","172.64.155.249","192.168.0.183","TCP","1514","443  >  51124 [ACK] Seq=128657 Ack=10107 Win=8 Len=1460 [TCP segment of a reassembled PDU]"
"232","20.855427","192.168.0.183","172.64.155.249","TCP","54","51124  >  443 [ACK] Seq=10107 Ack=130117 Win=514 Len=0"
"233","20.856276","192.168.0.183","172.64.155.249","TLSv1.2","89","Application Data"
"234","20.857141","172.64.155.249","192.168.0.183","TCP","1514","443  >  51124 [ACK] Seq=130117 Ack=10107 Win=8 Len=1460 [TCP segment of a reassembled PDU]"
"235","20.857141","172.64.155.249","192.168.0.183","TLSv1.2","1078","Application Data"
"236","20.857179","192.168.0.183","172.64.155.249","TCP","54","51124  >  443 [ACK] Seq=10142 Ack=132601 Win=514 Len=0"
"237","20.870426","172.64.155.249","192.168.0.183","TCP","1514","443  >  51124 [ACK] Seq=132601 Ack=10107 Win=8 Len=1460 [TCP segment of a reassembled PDU]"
"238","20.870426","172.64.155.249","192.168.0.183","TLSv1.2","1042","Application Data"
"239","20.870426","172.64.155.249","192.168.0.183","TCP","1514","443  >  51124 [ACK] Seq=135049 Ack=10107 Win=8 Len=1460 [TCP segment of a reassembled PDU]"
"240","20.870426","172.64.155.249","192.168.0.183","TLSv1.2","888","Application Data"
"241","20.870426","172.64.155.249","192.168.0.183","TCP","1514","443  >  51124 [ACK] Seq=137343 Ack=10107 Win=8 Len=1460 [TCP segment of a reassembled PDU]"
"242","20.870426","172.64.155.249","192.168.0.183","TCP","1514","443  >  51124 [ACK] Seq=138803 Ack=10107 Win=8 Len=1460 [TCP segment of a reassembled PDU]"
"243","20.870426","172.64.155.249","192.168.0.183","TCP","1514","443  >  51124 [ACK] Seq=140263 Ack=10107 Win=8 Len=1460 [TCP segment of a reassembled PDU]"
"244","20.870426","172.64.155.249","192.168.0.183","TLSv1.2","298","Application Data"
"245","20.870426","172.64.155.249","192.168.0.183","TCP","1514","443  >  51124 [ACK] Seq=141967 Ack=10107 Win=8 Len=1460 [TCP segment of a reassembled PDU]"
"246","20.870426","172.64.155.249","192.168.0.183","TCP","1514","443  >  51124 [ACK] Seq=143427 Ack=10107 Win=8 Len=1460 [TCP segment of a reassembled PDU]"
"247","20.870426","172.64.155.249","192.168.0.183","TCP","1514","443  >  51124 [ACK] Seq=144887 Ack=10107 Win=8 Len=1460 [TCP segment of a reassembled PDU]"
"248","20.870426","172.64.155.249","192.168.0.183","TLSv1.2","404","Application Data"
"249","20.870426","172.64.155.249","192.168.0.183","TLSv1.2","96","Application Data"
"250","20.870426","172.64.155.249","192.168.0.183","TLSv1.2","85","Application Data"
"251","20.870426","172.64.155.249","192.168.0.183","TCP","60","443  >  51124 [ACK] Seq=146770 Ack=10142 Win=8 Len=0"
"252","20.870549","192.168.0.183","172.64.155.249","TCP","54","51124  >  443 [ACK] Seq=10142 Ack=135049 Win=514 Len=0"
"253","20.870755","192.168.0.183","172.64.155.249","TCP","54","51124  >  443 [ACK] Seq=10142 Ack=146770 Win=514 Len=0"
"254","21.139442","192.168.0.183","172.64.155.249","TLSv1.2","203","Application Data"
"255","21.139667","192.168.0.183","172.64.155.249","TLSv1.2","179","Application Data"
"256","21.151784","172.64.155.249","192.168.0.183","TCP","60","443  >  51124 [ACK] Seq=146770 Ack=10416 Win=8 Len=0"
"257","21.188745","172.64.155.249","192.168.0.183","TLSv1.2","145","Application Data"
"258","21.193682","172.64.155.249","192.168.0.183","TLSv1.2","146","Application Data"
"259","21.193682","172.64.155.249","192.168.0.183","TLSv1.2","226","Application Data"
"260","21.193682","172.64.155.249","192.168.0.183","TLSv1.2","85","Application Data"
"261","21.193730","192.168.0.183","172.64.155.249","TCP","54","51124  >  443 [ACK] Seq=10416 Ack=147156 Win=512 Len=0"
"262","21.257514","192.168.0.183","172.64.155.249","TLSv1.2","557","Application Data"
"263","21.257584","192.168.0.183","172.64.155.249","TLSv1.2","553","Application Data"
"264","21.275984","172.64.155.249","192.168.0.183","TCP","60","443  >  51124 [ACK] Seq=147156 Ack=11418 Win=8 Len=0"
"265","21.296785","172.64.155.249","192.168.0.183","TLSv1.2","144","Application Data"
"266","21.296785","172.64.155.249","192.168.0.183","TLSv1.2","85","Application Data"
"267","21.296814","192.168.0.183","172.64.155.249","TCP","54","51124  >  443 [ACK] Seq=11418 Ack=147277 Win=512 Len=0"
"268","22.829558","192.168.0.183","172.64.155.249","TLSv1.2","172","Application Data"
"269","22.829621","192.168.0.183","172.64.155.249","TLSv1.2","170","Application Data"
"270","22.844020","192.168.0.183","172.64.155.249","TLSv1.2","162","Application Data"
"271","22.850103","172.64.155.249","192.168.0.183","TCP","60","443  >  51124 [ACK] Seq=147277 Ack=11652 Win=8 Len=0"
"272","22.875342","172.64.155.249","192.168.0.183","TLSv1.2","279","Application Data"
"273","22.916165","192.168.0.183","172.64.155.249","TCP","54","51124  >  443 [ACK] Seq=11760 Ack=147502 Win=511 Len=0"
"274","23.030745","172.64.155.249","192.168.0.183","TLSv1.2","169","Application Data"
"275","23.030745","172.64.155.249","192.168.0.183","TLSv1.2","100","Application Data"
"276","23.030745","172.64.155.249","192.168.0.183","TCP","1514","443  >  51124 [ACK] Seq=147663 Ack=11760 Win=8 Len=1460 [TCP segment of a reassembled PDU]"
"277","23.030745","172.64.155.249","192.168.0.183","TCP","1514","443  >  51124 [ACK] Seq=149123 Ack=11760 Win=8 Len=1460 [TCP segment of a reassembled PDU]"
"278","23.030745","172.64.155.249","192.168.0.183","TLSv1.2","957","Application Data"
"279","23.030745","172.64.155.249","192.168.0.183","TCP","1514","443  >  51124 [ACK] Seq=151486 Ack=11760 Win=8 Len=1460 [TCP segment of a reassembled PDU]"
"280","23.030745","172.64.155.249","192.168.0.183","TCP","1514","443  >  51124 [ACK] Seq=152946 Ack=11760 Win=8 Len=1460 [TCP segment of a reassembled PDU]"
"281","23.030847","192.168.0.183","172.64.155.249","TCP","54","51124  >  443 [ACK] Seq=11760 Ack=154406 Win=514 Len=0"
"282","23.031590","172.64.155.249","192.168.0.183","TCP","1514","443  >  51124 [ACK] Seq=154406 Ack=11760 Win=8 Len=1460 [TCP segment of a reassembled PDU]"
"283","23.031590","172.64.155.249","192.168.0.183","TLSv1.2","307","Application Data"
"284","23.031590","172.64.155.249","192.168.0.183","TCP","1514","443  >  51124 [ACK] Seq=156119 Ack=11760 Win=8 Len=1460 [TCP segment of a reassembled PDU]"
"285","23.031590","172.64.155.249","192.168.0.183","TLSv1.2","1113","Application Data"
"286","23.031732","192.168.0.183","172.64.155.249","TCP","54","51124  >  443 [ACK] Seq=11760 Ack=158638 Win=514 Len=0"
"287","23.038839","172.64.155.249","192.168.0.183","TCP","1514","443  >  51124 [ACK] Seq=158638 Ack=11760 Win=8 Len=1460 [TCP segment of a reassembled PDU]"
"288","23.038839","172.64.155.249","192.168.0.183","TLSv1.2","239","Application Data"
"289","23.038839","172.64.155.249","192.168.0.183","TCP","1514","443  >  51124 [ACK] Seq=160283 Ack=11760 Win=8 Len=1460 [TCP segment of a reassembled PDU]"
"290","23.038839","172.64.155.249","192.168.0.183","TLSv1.2","1105","Application Data"
"291","23.038952","192.168.0.183","172.64.155.249","TCP","54","51124  >  443 [ACK] Seq=11760 Ack=162794 Win=514 Len=0"
"292","23.040159","172.64.155.249","192.168.0.183","TCP","1514","443  >  51124 [ACK] Seq=162794 Ack=11760 Win=8 Len=1460 [TCP segment of a reassembled PDU]"
"293","23.040159","172.64.155.249","192.168.0.183","TCP","1514","443  >  51124 [ACK] Seq=164254 Ack=11760 Win=8 Len=1460 [TCP segment of a reassembled PDU]"
"294","23.040159","172.64.155.249","192.168.0.183","TCP","1514","443  >  51124 [ACK] Seq=165714 Ack=11760 Win=8 Len=1460 [TCP segment of a reassembled PDU]"
"295","23.040159","172.64.155.249","192.168.0.183","TCP","1514","443  >  51124 [ACK] Seq=167174 Ack=11760 Win=8 Len=1460 [TCP segment of a reassembled PDU]"
"296","23.040159","172.64.155.249","192.168.0.183","TCP","1514","443  >  51124 [ACK] Seq=168634 Ack=11760 Win=8 Len=1460 [TCP segment of a reassembled PDU]"
"297","23.040159","172.64.155.249","192.168.0.183","TCP","1514","443  >  51124 [PSH, ACK] Seq=170094 Ack=11760 Win=8 Len=1460 [TCP segment of a reassembled PDU]"
"298","23.040159","172.64.155.249","192.168.0.183","TLSv1.2","1106","Application Data"
"299","23.040159","172.64.155.249","192.168.0.183","TCP","1514","443  >  51124 [ACK] Seq=172606 Ack=11760 Win=8 Len=1460 [TCP segment of a reassembled PDU]"
"300","23.040159","172.64.155.249","192.168.0.183","TCP","1514","443  >  51124 [ACK] Seq=174066 Ack=11760 Win=8 Len=1460 [TCP segment of a reassembled PDU]"
"301","23.040159","172.64.155.249","192.168.0.183","TCP","1514","443  >  51124 [ACK] Seq=175526 Ack=11760 Win=8 Len=1460 [TCP segment of a reassembled PDU]"
"302","23.040159","172.64.155.249","192.168.0.183","TCP","1514","443  >  51124 [ACK] Seq=176986 Ack=11760 Win=8 Len=1460 [TCP segment of a reassembled PDU]"
"303","23.040159","172.64.155.249","192.168.0.183","TCP","1514","443  >  51124 [ACK] Seq=178446 Ack=11760 Win=8 Len=1460 [TCP segment of a reassembled PDU]"
"304","23.040159","172.64.155.249","192.168.0.183","TLSv1.2","339","Application Data"
"305","23.040159","172.64.155.249","192.168.0.183","TLSv1.2","96","Application Data"
"306","23.040159","172.64.155.249","192.168.0.183","TLSv1.2","85","Application Data"
"307","23.040263","192.168.0.183","172.64.155.249","TCP","54","51124  >  443 [ACK] Seq=11760 Ack=180264 Win=514 Len=0"
"308","23.120803","192.168.0.183","172.64.155.249","TLSv1.2","184","Application Data"
"309","23.157443","172.64.155.249","192.168.0.183","TLSv1.2","473","Application Data"
"310","23.157443","172.64.155.249","192.168.0.183","TLSv1.2","203","Application Data"
"311","23.157443","172.64.155.249","192.168.0.183","TLSv1.2","85","Application Data"
"312","23.157475","192.168.0.183","172.64.155.249","TCP","54","51134  >  443 [ACK] Seq=483 Ack=1839 Win=509 Len=0"
"313","23.158453","192.168.0.183","172.64.155.249","TLSv1.2","89","Application Data"
"314","23.211013","172.64.155.249","192.168.0.183","TCP","60","443  >  51134 [ACK] Seq=1839 Ack=518 Win=8 Len=0"
"315","23.477601","192.168.0.183","172.64.155.249","TLSv1.2","539","Application Data"
"316","23.477663","192.168.0.183","172.64.155.249","TLSv1.2","553","Application Data"
"317","23.492328","172.64.155.249","192.168.0.183","TCP","60","443  >  51124 [ACK] Seq=180264 Ack=12744 Win=8 Len=0"
"318","23.514965","172.64.155.249","192.168.0.183","TLSv1.2","144","Application Data"
"319","23.514965","172.64.155.249","192.168.0.183","TLSv1.2","85","Application Data"
"320","23.515015","192.168.0.183","172.64.155.249","TCP","54","51124  >  443 [ACK] Seq=12744 Ack=180385 Win=513 Len=0"
"321","28.100704","192.168.0.183","172.64.155.249","TLSv1.2","795","Application Data"
"322","28.100879","192.168.0.183","172.64.155.249","TLSv1.2","593","Application Data"
"323","28.114239","172.64.155.249","192.168.0.183","TCP","60","443  >  51124 [ACK] Seq=180385 Ack=14024 Win=8 Len=0"
"324","28.115747","192.168.0.183","172.64.155.249","TLSv1.2","210","Application Data"
"325","28.167554","172.64.155.249","192.168.0.183","TLSv1.2","278","Application Data"
"326","28.167554","172.64.155.249","192.168.0.183","TLSv1.2","85","Application Data"
"327","28.167600","192.168.0.183","172.64.155.249","TCP","54","51124  >  443 [ACK] Seq=14180 Ack=180640 Win=512 Len=0"
"328","28.169686","172.64.155.249","192.168.0.183","TLSv1.2","181","Application Data"
"329","28.169686","172.64.155.249","192.168.0.183","TLSv1.2","100","Application Data"
"330","28.169686","172.64.155.249","192.168.0.183","TLSv1.2","1313","Application Data"
"331","28.169686","172.64.155.249","192.168.0.183","TCP","1514","443  >  51124 [ACK] Seq=182072 Ack=14180 Win=8 Len=1460 [TCP segment of a reassembled PDU]"
"332","28.169776","192.168.0.183","172.64.155.249","TCP","54","51124  >  443 [ACK] Seq=14180 Ack=183532 Win=514 Len=0"
"333","28.170548","192.168.0.183","172.64.155.249","TLSv1.2","89","Application Data"
"334","28.171267","172.64.155.249","192.168.0.183","TCP","1514","443  >  51124 [ACK] Seq=183532 Ack=14180 Win=8 Len=1460 [TCP segment of a reassembled PDU]"
"335","28.171267","172.64.155.249","192.168.0.183","TCP","1514","443  >  51124 [ACK] Seq=184992 Ack=14180 Win=8 Len=1460 [TCP segment of a reassembled PDU]"
"336","28.171267","172.64.155.249","192.168.0.183","TLSv1.2","672","Application Data"
"337","28.171267","172.64.155.249","192.168.0.183","TCP","1514","443  >  51124 [ACK] Seq=187070 Ack=14180 Win=8 Len=1460 [TCP segment of a reassembled PDU]"
"338","28.171267","172.64.155.249","192.168.0.183","TLSv1.2","116","Application Data"
"339","28.171301","192.168.0.183","172.64.155.249","TCP","54","51124  >  443 [ACK] Seq=14215 Ack=188592 Win=514 Len=0"
"340","28.180132","172.64.155.249","192.168.0.183","TCP","1514","443  >  51124 [ACK] Seq=188592 Ack=14180 Win=8 Len=1460 [TCP segment of a reassembled PDU]"
"341","28.180132","172.64.155.249","192.168.0.183","TCP","1514","443  >  51124 [ACK] Seq=190052 Ack=14180 Win=8 Len=1460 [TCP segment of a reassembled PDU]"
"342","28.180132","172.64.155.249","192.168.0.183","TCP","1514","443  >  51124 [ACK] Seq=191512 Ack=14180 Win=8 Len=1460 [TCP segment of a reassembled PDU]"
"343","28.180132","172.64.155.249","192.168.0.183","TLSv1.2","257","Application Data"
"344","28.180213","192.168.0.183","172.64.155.249","TCP","54","51124  >  443 [ACK] Seq=14215 Ack=193175 Win=514 Len=0"
"345","28.185415","172.64.155.249","192.168.0.183","TCP","1514","443  >  51124 [ACK] Seq=193175 Ack=14180 Win=8 Len=1460 [TCP segment of a reassembled PDU]"
"346","28.185415","172.64.155.249","192.168.0.183","TLSv1.2","1267","Application Data"
"347","28.185415","172.64.155.249","192.168.0.183","TCP","1514","443  >  51124 [ACK] Seq=195848 Ack=14180 Win=8 Len=1460 [TCP segment of a reassembled PDU]"
"348","28.185415","172.64.155.249","192.168.0.183","TCP","1514","443  >  51124 [ACK] Seq=197308 Ack=14180 Win=8 Len=1460 [TCP segment of a reassembled PDU]"
"349","28.185415","172.64.155.249","192.168.0.183","TCP","1514","443  >  51124 [ACK] Seq=198768 Ack=14180 Win=8 Len=1460 [TCP segment of a reassembled PDU]"
"350","28.185415","172.64.155.249","192.168.0.183","TLSv1.2","159","Application Data"
"351","28.185415","172.64.155.249","192.168.0.183","TCP","1514","443  >  51124 [ACK] Seq=200333 Ack=14215 Win=8 Len=1460 [TCP segment of a reassembled PDU]"
"352","28.185415","172.64.155.249","192.168.0.183","TCP","1514","443  >  51124 [ACK] Seq=201793 Ack=14215 Win=8 Len=1460 [TCP segment of a reassembled PDU]"
"353","28.185415","172.64.155.249","192.168.0.183","TCP","1514","443  >  51124 [ACK] Seq=203253 Ack=14215 Win=8 Len=1460 [TCP segment of a reassembled PDU]"
"354","28.185415","172.64.155.249","192.168.0.183","TCP","1514","443  >  51124 [ACK] Seq=204713 Ack=14215 Win=8 Len=1460 [TCP segment of a reassembled PDU]"
"355","28.185415","172.64.155.249","192.168.0.183","TCP","1514","443  >  51124 [ACK] Seq=206173 Ack=14215 Win=8 Len=1460 [TCP segment of a reassembled PDU]"
"356","28.185415","172.64.155.249","192.168.0.183","TLSv1.2","1011","Application Data"
"357","28.185599","192.168.0.183","172.64.155.249","TCP","54","51124  >  443 [ACK] Seq=14215 Ack=208590 Win=514 Len=0"
"358","28.199340","172.64.155.249","192.168.0.183","TCP","1514","443  >  51124 [ACK] Seq=208590 Ack=14215 Win=8 Len=1460 [TCP segment of a reassembled PDU]"
"359","28.199340","172.64.155.249","192.168.0.183","TCP","1514","443  >  51124 [ACK] Seq=210050 Ack=14215 Win=8 Len=1460 [TCP segment of a reassembled PDU]"
"360","28.199340","172.64.155.249","192.168.0.183","TCP","1514","443  >  51124 [ACK] Seq=211510 Ack=14215 Win=8 Len=1460 [TCP segment of a reassembled PDU]"
"361","28.199340","172.64.155.249","192.168.0.183","TLSv1.2","724","Application Data"
"362","28.199340","172.64.155.249","192.168.0.183","TCP","1514","443  >  51124 [ACK] Seq=213640 Ack=14215 Win=8 Len=1460 [TCP segment of a reassembled PDU]"
"363","28.199340","172.64.155.249","192.168.0.183","TCP","1514","443  >  51124 [ACK] Seq=215100 Ack=14215 Win=8 Len=1460 [TCP segment of a reassembled PDU]"
"364","28.199340","172.64.155.249","192.168.0.183","TCP","1514","443  >  51124 [ACK] Seq=216560 Ack=14215 Win=8 Len=1460 [TCP segment of a reassembled PDU]"
"365","28.199340","172.64.155.249","192.168.0.183","TCP","1514","443  >  51124 [ACK] Seq=218020 Ack=14215 Win=8 Len=1460 [TCP segment of a reassembled PDU]"
"366","28.199340","172.64.155.249","192.168.0.183","TLSv1.2","750","Application Data"
"367","28.199340","172.64.155.249","192.168.0.183","TLSv1.2","96","Application Data"
"368","28.199340","172.64.155.249","192.168.0.183","TLSv1.2","85","Application Data"
"369","28.199474","192.168.0.183","172.64.155.249","TCP","54","51124  >  443 [ACK] Seq=14215 Ack=213640 Win=514 Len=0"
"370","28.199598","192.168.0.183","172.64.155.249","TCP","54","51124  >  443 [ACK] Seq=14215 Ack=220249 Win=514 Len=0"
"371","28.283343","192.168.0.183","172.64.155.249","TLSv1.2","237","Application Data"
"372","28.295727","172.64.155.249","192.168.0.183","TCP","60","443  >  51134 [ACK] Seq=1839 Ack=701 Win=8 Len=0"
"373","28.320084","172.64.155.249","192.168.0.183","TLSv1.2","670","Application Data"
"374","28.320084","172.64.155.249","192.168.0.183","TLSv1.2","203","Application Data"
"375","28.320084","172.64.155.249","192.168.0.183","TLSv1.2","85","Application Data"
"376","28.320145","192.168.0.183","172.64.155.249","TCP","54","51134  >  443 [ACK] Seq=701 Ack=2635 Win=514 Len=0"
"377","28.321513","192.168.0.183","172.64.155.249","TLSv1.2","89","Application Data"
"378","28.375329","172.64.155.249","192.168.0.183","TCP","60","443  >  51134 [ACK] Seq=2635 Ack=736 Win=8 Len=0"
"379","28.434451","192.168.0.183","172.64.155.249","TLSv1.2","283","Application Data"
"380","28.481915","172.64.155.249","192.168.0.183","TLSv1.2","144","Application Data"
"381","28.527591","192.168.0.183","172.64.155.249","TCP","54","51124  >  443 [ACK] Seq=14444 Ack=220339 Win=513 Len=0"
"382","28.702561","192.168.0.183","172.64.155.249","TLSv1.2","497","Application Data"
"383","28.702637","192.168.0.183","172.64.155.249","TLSv1.2","612","Application Data"
"384","28.717529","172.64.155.249","192.168.0.183","TCP","60","443  >  51124 [ACK] Seq=220339 Ack=15445 Win=8 Len=0"
"385","28.741654","172.64.155.249","192.168.0.183","TLSv1.2","426","Application Data"
"386","28.741654","172.64.155.249","192.168.0.183","TLSv1.2","85","Application Data"
"387","28.741709","192.168.0.183","172.64.155.249","TCP","54","51124  >  443 [ACK] Seq=15445 Ack=220742 Win=512 Len=0"
"388","33.809842","192.168.0.183","172.64.155.249","TLSv1.2","383","Application Data"
"389","33.863854","172.64.155.249","192.168.0.183","TCP","60","443  >  51124 [ACK] Seq=220742 Ack=15774 Win=8 Len=0"
"390","33.870513","172.64.155.249","192.168.0.183","TLSv1.2","308","Application Data"
"391","33.870513","172.64.155.249","192.168.0.183","TLSv1.2","100","Application Data"
"392","33.870513","172.64.155.249","192.168.0.183","TCP","1514","443  >  51124 [ACK] Seq=221042 Ack=15774 Win=8 Len=1460 [TCP segment of a reassembled PDU]"
"393","33.870513","172.64.155.249","192.168.0.183","TLSv1.2","1113","Application Data"
"394","33.870513","172.64.155.249","192.168.0.183","TCP","1514","443  >  51124 [ACK] Seq=223561 Ack=15774 Win=8 Len=1460 [TCP segment of a reassembled PDU]"
"395","33.870513","172.64.155.249","192.168.0.183","TCP","1514","443  >  51124 [ACK] Seq=225021 Ack=15774 Win=8 Len=1460 [TCP segment of a reassembled PDU]"
"396","33.870550","192.168.0.183","172.64.155.249","TCP","54","51124  >  443 [ACK] Seq=15774 Ack=226481 Win=514 Len=0"
"397","33.871866","192.168.0.183","172.64.155.249","TLSv1.2","89","Application Data"
"398","33.872344","172.64.155.249","192.168.0.183","TCP","1514","443  >  51124 [ACK] Seq=226481 Ack=15774 Win=8 Len=1460 [TCP segment of a reassembled PDU]"
"399","33.872344","172.64.155.249","192.168.0.183","TLSv1.2","534","Application Data"
"400","33.872344","172.64.155.249","192.168.0.183","TCP","1514","443  >  51124 [ACK] Seq=228421 Ack=15774 Win=8 Len=1460 [TCP segment of a reassembled PDU]"
"401","33.872344","172.64.155.249","192.168.0.183","TCP","1514","443  >  51124 [ACK] Seq=229881 Ack=15774 Win=8 Len=1460 [TCP segment of a reassembled PDU]"
"402","33.872344","172.64.155.249","192.168.0.183","TLSv1.2","769","Application Data"
"403","33.872380","192.168.0.183","172.64.155.249","TCP","54","51124  >  443 [ACK] Seq=15809 Ack=232056 Win=514 Len=0"
"404","33.880338","172.64.155.249","192.168.0.183","TCP","1514","443  >  51124 [ACK] Seq=232056 Ack=15774 Win=8 Len=1460 [TCP segment of a reassembled PDU]"
"405","33.880338","172.64.155.249","192.168.0.183","TLSv1.2","264","Application Data"
"406","33.880410","192.168.0.183","172.64.155.249","TCP","54","51124  >  443 [ACK] Seq=15809 Ack=233726 Win=514 Len=0"
"407","33.883830","172.64.155.249","192.168.0.183","TCP","1514","443  >  51124 [ACK] Seq=233726 Ack=15774 Win=8 Len=1460 [TCP segment of a reassembled PDU]"
"408","33.883830","172.64.155.249","192.168.0.183","TCP","1514","443  >  51124 [ACK] Seq=235186 Ack=15774 Win=8 Len=1460 [TCP segment of a reassembled PDU]"
"409","33.883830","172.64.155.249","192.168.0.183","TCP","1514","443  >  51124 [ACK] Seq=236646 Ack=15774 Win=8 Len=1460 [TCP segment of a reassembled PDU]"
"410","33.883830","172.64.155.249","192.168.0.183","TLSv1.2","288","Application Data"
"411","33.883830","172.64.155.249","192.168.0.183","TCP","60","443  >  51124 [ACK] Seq=238340 Ack=15809 Win=8 Len=0"
"412","33.883952","192.168.0.183","172.64.155.249","TCP","54","51124  >  443 [ACK] Seq=15809 Ack=238340 Win=514 Len=0"
"413","33.884074","172.64.155.249","192.168.0.183","TCP","1514","443  >  51124 [ACK] Seq=238340 Ack=15809 Win=8 Len=1460 [TCP segment of a reassembled PDU]"
"414","33.884074","172.64.155.249","192.168.0.183","TCP","1514","443  >  51124 [ACK] Seq=239800 Ack=15809 Win=8 Len=1460 [TCP segment of a reassembled PDU]"
"415","33.884074","172.64.155.249","192.168.0.183","TCP","1514","443  >  51124 [ACK] Seq=241260 Ack=15809 Win=8 Len=1460 [TCP segment of a reassembled PDU]"
"416","33.884074","172.64.155.249","192.168.0.183","TLSv1.2","1265","Application Data"
"417","33.884074","172.64.155.249","192.168.0.183","TLSv1.2","96","Application Data"
"418","33.884074","172.64.155.249","192.168.0.183","TLSv1.2","85","Application Data"
"419","33.884140","192.168.0.183","172.64.155.249","TCP","54","51124  >  443 [ACK] Seq=15809 Ack=244004 Win=514 Len=0"
"420","34.087743","192.168.0.183","172.64.155.249","TLSv1.2","222","Application Data"
"421","34.128868","172.64.155.249","192.168.0.183","TLSv1.2","158","Application Data"
"422","34.177540","192.168.0.183","172.64.155.249","TCP","54","51124  >  443 [ACK] Seq=15977 Ack=244108 Win=513 Len=0"
"423","34.269897","192.168.0.183","172.64.155.249","TLSv1.2","521","Application Data"
"424","34.269961","192.168.0.183","172.64.155.249","TLSv1.2","553","Application Data"
"425","34.283330","172.64.155.249","192.168.0.183","TCP","60","443  >  51124 [ACK] Seq=244108 Ack=16943 Win=8 Len=0"
"426","34.306330","172.64.155.249","192.168.0.183","TLSv1.2","145","Application Data"
"427","34.306330","172.64.155.249","192.168.0.183","TLSv1.2","85","Application Data"
"428","34.306356","192.168.0.183","172.64.155.249","TCP","54","51124  >  443 [ACK] Seq=16943 Ack=244230 Win=513 Len=0"
