"No.","Time","Source","Destination","Protocol","Length","Info"
"1","0.000000","192.168.0.183","172.64.155.249","TLSv1.2","172","Application Data"
"2","0.000063","192.168.0.183","172.64.155.249","TLSv1.2","93","Application Data"
"3","0.000094","192.168.0.183","172.64.155.249","TLSv1.2","170","Application Data"
"4","0.014151","192.168.0.183","172.64.155.249","TLSv1.2","151","Application Data"
"5","0.016345","172.64.155.249","192.168.0.183","TCP","60","443  >  51124 [ACK] Seq=1 Ack=274 Win=75 Len=0"
"6","0.016345","172.64.155.249","192.168.0.183","TLSv1.2","93","Application Data"
"7","0.067274","192.168.0.183","172.64.155.249","TCP","54","51124  >  443 [ACK] Seq=371 Ack=40 Win=510 Len=0"
"8","0.068022","172.64.155.249","192.168.0.183","TCP","60","443  >  51124 [ACK] Seq=40 Ack=371 Win=75 Len=0"
"9","0.080515","172.64.155.249","192.168.0.183","TLSv1.2","279","Application Data"
"10","0.086238","172.64.155.249","192.168.0.183","TLSv1.2","189","Application Data"
"11","0.086275","192.168.0.183","172.64.155.249","TCP","54","51124  >  443 [ACK] Seq=371 Ack=400 Win=509 Len=0"
"12","0.087026","192.168.0.183","172.64.155.249","TLSv1.2","89","Application Data"
"13","0.087827","172.64.155.249","192.168.0.183","TLSv1.2","85","Application Data"
"14","0.096341","192.168.0.183","172.64.155.249","TLSv1.2","155","Application Data"
"15","0.099642","172.64.155.249","192.168.0.183","TCP","60","443  >  51124 [ACK] Seq=431 Ack=406 Win=75 Len=0"
"16","0.101878","192.168.0.183","172.64.155.249","TLSv1.2","172","Application Data"
"17","0.105025","172.64.155.249","192.168.0.183","TCP","60","443  >  51124 [ACK] Seq=431 Ack=507 Win=75 Len=0"
"18","0.114651","172.64.155.249","192.168.0.183","TCP","60","443  >  51124 [ACK] Seq=431 Ack=625 Win=75 Len=0"
"19","0.131845","172.64.155.249","192.168.0.183","TLSv1.2","165","Application Data"
"20","0.131845","172.64.155.249","192.168.0.183","TLSv1.2","100","Application Data"
"21","0.131845","172.64.155.249","192.168.0.183","TLSv1.2","1330","Application Data"
"22","0.131845","172.64.155.249","192.168.0.183","TCP","1514","443  >  51124 [ACK] Seq=1864 Ack=625 Win=75 Len=1460 [TCP segment of a reassembled PDU]"
"23","0.131893","192.168.0.183","172.64.155.249","TCP","54","51124  >  443 [ACK] Seq=625 Ack=3324 Win=514 Len=0"
"24","0.132959","192.168.0.183","172.64.155.249","TLSv1.2","89","Application Data"
"25","0.140510","192.168.0.183","172.64.155.249","TLSv1.2","89","Application Data"
"26","0.142877","172.64.155.249","192.168.0.183","TCP","1514","443  >  51124 [ACK] Seq=3324 Ack=625 Win=75 Len=1460 [TCP segment of a reassembled PDU]"
"27","0.142877","172.64.155.249","192.168.0.183","TCP","1514","443  >  51124 [PSH, ACK] Seq=4784 Ack=625 Win=75 Len=1460 [TCP segment of a reassembled PDU]"
"28","0.142877","172.64.155.249","192.168.0.183","TLSv1.2","1514","Application Data"
"29","0.142877","172.64.155.249","192.168.0.183","TCP","1514","443  >  51124 [PSH, ACK] Seq=7704 Ack=625 Win=75 Len=1460 [TCP segment of a reassembled PDU]"
"30","0.142937","192.168.0.183","172.64.155.249","TCP","54","51124  >  443 [ACK] Seq=695 Ack=9164 Win=514 Len=0"
"31","0.157189","172.64.155.249","192.168.0.183","TCP","1514","443  >  51124 [ACK] Seq=9164 Ack=695 Win=75 Len=1460 [TCP segment of a reassembled PDU]"
"32","0.157189","172.64.155.249","192.168.0.183","TLSv1.2","1514","Application Data"
"33","0.157189","172.64.155.249","192.168.0.183","TCP","1514","443  >  51124 [ACK] Seq=12084 Ack=695 Win=75 Len=1460 [TCP segment of a reassembled PDU]"
"34","0.157189","172.64.155.249","192.168.0.183","TLSv1.2","1514","Application Data, Application Data, Application Data, Application Data"
"35","0.157294","192.168.0.183","172.64.155.249","TCP","54","51124  >  443 [ACK] Seq=695 Ack=15004 Win=514 Len=0"
"36","0.170946","172.64.155.249","192.168.0.183","TCP","1514","443  >  51124 [ACK] Seq=15004 Ack=695 Win=75 Len=1460 [TCP segment of a reassembled PDU]"
"37","0.170946","172.64.155.249","192.168.0.183","TLSv1.2","475","Application Data, Application Data, Application Data"
"38","0.171057","192.168.0.183","172.64.155.249","TCP","54","51124  >  443 [ACK] Seq=695 Ack=16885 Win=514 Len=0"
"39","0.886489","192.168.0.183","172.64.155.249","TLSv1.2","671","Application Data"
"40","0.886562","192.168.0.183","172.64.155.249","TLSv1.2","567","Application Data"
"41","0.901253","172.64.155.249","192.168.0.183","TCP","60","443  >  51124 [ACK] Seq=16885 Ack=1825 Win=76 Len=0"
"42","0.931292","172.64.155.249","192.168.0.183","TLSv1.2","278","Application Data"
"43","0.931292","172.64.155.249","192.168.0.183","TLSv1.2","85","Application Data"
"44","0.931357","192.168.0.183","172.64.155.249","TCP","54","51124  >  443 [ACK] Seq=1825 Ack=17140 Win=513 Len=0"
"45","1.905998","192.168.0.183","172.64.155.249","TLSv1.2","633","Application Data"
"46","1.906116","192.168.0.183","172.64.155.249","TCP","1454","51124  >  443 [ACK] Seq=2404 Ack=17140 Win=513 Len=1400 [TCP segment of a reassembled PDU]"
"47","1.906116","192.168.0.183","172.64.155.249","TLSv1.2","427","Application Data"
"48","1.919117","172.64.155.249","192.168.0.183","TCP","60","443  >  51124 [ACK] Seq=17140 Ack=3804 Win=77 Len=0"
"49","1.966264","172.64.155.249","192.168.0.183","TCP","60","443  >  51124 [ACK] Seq=17140 Ack=4177 Win=77 Len=0"
"50","1.998091","172.64.155.249","192.168.0.183","TLSv1.2","345","Application Data"
"51","1.998091","172.64.155.249","192.168.0.183","TLSv1.2","85","Application Data"
"52","1.998140","192.168.0.183","172.64.155.249","TCP","54","51124  >  443 [ACK] Seq=4177 Ack=17462 Win=511 Len=0"
"53","2.004898","192.168.0.183","172.64.155.249","TLSv1.2","170","Application Data"
"54","2.019048","172.64.155.249","192.168.0.183","TCP","60","443  >  51124 [ACK] Seq=17462 Ack=4293 Win=77 Len=0"
"55","2.222566","172.64.155.249","192.168.0.183","TLSv1.2","146","Application Data"
"56","2.222566","172.64.155.249","192.168.0.183","TLSv1.2","100","Application Data"
"57","2.222566","172.64.155.249","192.168.0.183","TCP","1514","443  >  51124 [ACK] Seq=17600 Ack=4293 Win=77 Len=1460 [TCP segment of a reassembled PDU]"
"58","2.222566","172.64.155.249","192.168.0.183","TCP","1514","443  >  51124 [ACK] Seq=19060 Ack=4293 Win=77 Len=1460 [TCP segment of a reassembled PDU]"
"59","2.222566","172.64.155.249","192.168.0.183","TCP","1514","443  >  51124 [ACK] Seq=20520 Ack=4293 Win=77 Len=1460 [TCP segment of a reassembled PDU]"
"60","2.222566","172.64.155.249","192.168.0.183","TLSv1.2","715","Application Data"
"61","2.222715","192.168.0.183","172.64.155.249","TCP","54","51124  >  443 [ACK] Seq=4293 Ack=22641 Win=514 Len=0"
"62","2.224804","172.64.155.249","192.168.0.183","TCP","1514","443  >  51124 [ACK] Seq=22641 Ack=4293 Win=77 Len=1460 [TCP segment of a reassembled PDU]"
"63","2.224804","172.64.155.249","192.168.0.183","TCP","1514","443  >  51124 [ACK] Seq=24101 Ack=4293 Win=77 Len=1460 [TCP segment of a reassembled PDU]"
"64","2.224804","172.64.155.249","192.168.0.183","TCP","1514","443  >  51124 [ACK] Seq=25561 Ack=4293 Win=77 Len=1460 [TCP segment of a reassembled PDU]"
"65","2.224804","172.64.155.249","192.168.0.183","TLSv1.2","300","Application Data"
"66","2.224866","192.168.0.183","172.64.155.249","TCP","54","51124  >  443 [ACK] Seq=4293 Ack=27267 Win=514 Len=0"
"67","2.232410","172.64.155.249","192.168.0.183","TCP","1514","443  >  51124 [ACK] Seq=27267 Ack=4293 Win=77 Len=1460 [TCP segment of a reassembled PDU]"
"68","2.232410","172.64.155.249","192.168.0.183","TLSv1.2","1122","Application Data"
"69","2.232410","172.64.155.249","192.168.0.183","TCP","1514","443  >  51124 [ACK] Seq=29795 Ack=4293 Win=77 Len=1460 [TCP segment of a reassembled PDU]"
"70","2.232410","172.64.155.249","192.168.0.183","TLSv1.2","356","Application Data"
"71","2.232468","192.168.0.183","172.64.155.249","TCP","54","51124  >  443 [ACK] Seq=4293 Ack=31557 Win=514 Len=0"
"72","2.236743","172.64.155.249","192.168.0.183","TCP","1514","443  >  51124 [ACK] Seq=31557 Ack=4293 Win=77 Len=1460 [TCP segment of a reassembled PDU]"
"73","2.236743","172.64.155.249","192.168.0.183","TCP","1514","443  >  51124 [ACK] Seq=33017 Ack=4293 Win=77 Len=1460 [TCP segment of a reassembled PDU]"
"74","2.236743","172.64.155.249","192.168.0.183","TCP","1514","443  >  51124 [ACK] Seq=34477 Ack=4293 Win=77 Len=1460 [TCP segment of a reassembled PDU]"
"75","2.236743","172.64.155.249","192.168.0.183","TCP","1514","443  >  51124 [ACK] Seq=35937 Ack=4293 Win=77 Len=1460 [TCP segment of a reassembled PDU]"
"76","2.236743","172.64.155.249","192.168.0.183","TCP","1514","443  >  51124 [ACK] Seq=37397 Ack=4293 Win=77 Len=1460 [TCP segment of a reassembled PDU]"
"77","2.236743","172.64.155.249","192.168.0.183","TLSv1.2","931","Application Data"
"78","2.236743","172.64.155.249","192.168.0.183","TCP","1514","443  >  51124 [ACK] Seq=39734 Ack=4293 Win=77 Len=1460 [TCP segment of a reassembled PDU]"
"79","2.236743","172.64.155.249","192.168.0.183","TCP","1514","443  >  51124 [ACK] Seq=41194 Ack=4293 Win=77 Len=1460 [TCP segment of a reassembled PDU]"
"80","2.236743","172.64.155.249","192.168.0.183","TCP","1514","443  >  51124 [ACK] Seq=42654 Ack=4293 Win=77 Len=1460 [TCP segment of a reassembled PDU]"
"81","2.236743","172.64.155.249","192.168.0.183","TCP","1514","443  >  51124 [ACK] Seq=44114 Ack=4293 Win=77 Len=1460 [TCP segment of a reassembled PDU]"
"82","2.236743","172.64.155.249","192.168.0.183","TCP","1514","443  >  51124 [ACK] Seq=45574 Ack=4293 Win=77 Len=1460 [TCP segment of a reassembled PDU]"
"83","2.236743","172.64.155.249","192.168.0.183","TCP","1514","443  >  51124 [PSH, ACK] Seq=47034 Ack=4293 Win=77 Len=1460 [TCP segment of a reassembled PDU]"
"84","2.236743","172.64.155.249","192.168.0.183","TLSv1.2","87","Application Data"
"85","2.236849","192.168.0.183","172.64.155.249","TCP","54","51124  >  443 [ACK] Seq=4293 Ack=48527 Win=514 Len=0"
"86","2.243362","172.64.155.249","192.168.0.183","TCP","1514","443  >  51124 [ACK] Seq=48527 Ack=4293 Win=77 Len=1460 [TCP segment of a reassembled PDU]"
"87","2.243362","172.64.155.249","192.168.0.183","TCP","1514","443  >  51124 [ACK] Seq=49987 Ack=4293 Win=77 Len=1460 [TCP segment of a reassembled PDU]"
"88","2.243362","172.64.155.249","192.168.0.183","TLSv1.2","800","Application Data"
"89","2.243362","172.64.155.249","192.168.0.183","TLSv1.2","96","Application Data"
"90","2.243362","172.64.155.249","192.168.0.183","TLSv1.2","85","Application Data"
"91","2.243474","192.168.0.183","172.64.155.249","TCP","54","51124  >  443 [ACK] Seq=4293 Ack=52266 Win=514 Len=0"
"92","2.341450","192.168.0.183","172.64.155.249","TLSv1.2","184","Application Data"
"93","2.341576","192.168.0.183","172.64.155.249","TLSv1.2","93","Application Data"
"94","2.352292","172.64.155.249","192.168.0.183","TCP","60","443  >  51134 [ACK] Seq=1 Ack=170 Win=8 Len=0"
"95","2.352292","172.64.155.249","192.168.0.183","TLSv1.2","93","Application Data"
"96","2.395325","192.168.0.183","172.64.155.249","TCP","54","51134  >  443 [ACK] Seq=170 Ack=40 Win=509 Len=0"
"97","2.416106","172.64.155.249","192.168.0.183","TLSv1.2","472","Application Data"
"98","2.416106","172.64.155.249","192.168.0.183","TLSv1.2","203","Application Data"
"99","2.416106","172.64.155.249","192.168.0.183","TLSv1.2","85","Application Data"
"100","2.416151","192.168.0.183","172.64.155.249","TCP","54","51134  >  443 [ACK] Seq=170 Ack=638 Win=514 Len=0"
"101","2.416880","192.168.0.183","172.64.155.249","TLSv1.2","89","Application Data"
"102","2.471020","172.64.155.249","192.168.0.183","TCP","60","443  >  51134 [ACK] Seq=638 Ack=205 Win=8 Len=0"
"103","2.816894","192.168.0.183","172.64.155.249","TLSv1.2","569","Application Data"
"104","2.816955","192.168.0.183","172.64.155.249","TLSv1.2","584","Application Data"
"105","2.831609","172.64.155.249","192.168.0.183","TCP","60","443  >  51124 [ACK] Seq=52266 Ack=5338 Win=78 Len=0"
"106","2.854514","172.64.155.249","192.168.0.183","TLSv1.2","278","Application Data"
"107","2.854514","172.64.155.249","192.168.0.183","TLSv1.2","85","Application Data"
"108","2.854551","192.168.0.183","172.64.155.249","TCP","54","51124  >  443 [ACK] Seq=5338 Ack=52521 Win=513 Len=0"
"109","3.953244","192.168.0.183","172.64.155.249","TLSv1.2","267","Application Data"
"110","3.953356","192.168.0.183","172.64.155.249","TLSv1.2","624","Application Data"
"111","3.967392","172.64.155.249","192.168.0.183","TCP","60","443  >  51124 [ACK] Seq=52521 Ack=6121 Win=78 Len=0"
"112","3.971517","192.168.0.183","172.64.155.249","TLSv1.2","348","Application Data"
"113","3.990526","172.64.155.249","192.168.0.183","TLSv1.2","278","Application Data"
"114","3.990526","172.64.155.249","192.168.0.183","TLSv1.2","85","Application Data"
"115","3.990609","192.168.0.183","172.64.155.249","TCP","54","51124  >  443 [ACK] Seq=6415 Ack=52776 Win=512 Len=0"
"116","4.038504","172.64.155.249","192.168.0.183","TLSv1.2","162","Application Data"
"117","4.038504","172.64.155.249","192.168.0.183","TLSv1.2","100","Application Data"
"118","4.038555","192.168.0.183","172.64.155.249","TCP","54","51124  >  443 [ACK] Seq=6415 Ack=52930 Win=511 Len=0"
"119","4.040559","172.64.155.249","192.168.0.183","TCP","1514","443  >  51124 [ACK] Seq=52930 Ack=6415 Win=79 Len=1460 [TCP segment of a reassembled PDU]"
"120","4.040559","172.64.155.249","192.168.0.183","TCP","1514","443  >  51124 [ACK] Seq=54390 Ack=6415 Win=79 Len=1460 [TCP segment of a reassembled PDU]"
"121","4.040559","172.64.155.249","192.168.0.183","TCP","1514","443  >  51124 [ACK] Seq=55850 Ack=6415 Win=79 Len=1460 [TCP segment of a reassembled PDU]"
"122","4.040559","172.64.155.249","192.168.0.183","TLSv1.2","721","Application Data"
"123","4.040559","172.64.155.249","192.168.0.183","TCP","1514","443  >  51124 [ACK] Seq=57977 Ack=6415 Win=79 Len=1460 [TCP segment of a reassembled PDU]"
"124","4.040559","172.64.155.249","192.168.0.183","TCP","1514","443  >  51124 [ACK] Seq=59437 Ack=6415 Win=79 Len=1460 [TCP segment of a reassembled PDU]"
"125","4.040559","172.64.155.249","192.168.0.183","TCP","1514","443  >  51124 [ACK] Seq=60897 Ack=6415 Win=79 Len=1460 [TCP segment of a reassembled PDU]"
"126","4.040559","172.64.155.249","192.168.0.183","TLSv1.2","543","Application Data"
"127","4.040648","192.168.0.183","172.64.155.249","TCP","54","51124  >  443 [ACK] Seq=6415 Ack=62846 Win=514 Len=0"
"128","4.047924","172.64.155.249","192.168.0.183","TCP","1514","443  >  51124 [ACK] Seq=62846 Ack=6415 Win=79 Len=1460 [TCP segment of a reassembled PDU]"
"129","4.047924","172.64.155.249","192.168.0.183","TLSv1.2","1123","Application Data"
"130","4.048025","192.168.0.183","172.64.155.249","TCP","54","51124  >  443 [ACK] Seq=6415 Ack=65375 Win=514 Len=0"
"131","4.051214","172.64.155.249","192.168.0.183","TCP","1514","443  >  51124 [ACK] Seq=65375 Ack=6415 Win=79 Len=1460 [TCP segment of a reassembled PDU]"
"132","4.051214","172.64.155.249","192.168.0.183","TCP","1514","443  >  51124 [ACK] Seq=66835 Ack=6415 Win=79 Len=1460 [TCP segment of a reassembled PDU]"
"133","4.051214","172.64.155.249","192.168.0.183","TCP","1514","443  >  51124 [ACK] Seq=68295 Ack=6415 Win=79 Len=1460 [TCP segment of a reassembled PDU]"
"134","4.051214","172.64.155.249","192.168.0.183","TLSv1.2","367","Application Data"
"135","4.051214","172.64.155.249","192.168.0.183","TCP","1514","443  >  51124 [ACK] Seq=70068 Ack=6415 Win=79 Len=1460 [TCP segment of a reassembled PDU]"
"136","4.051277","192.168.0.183","172.64.155.249","TCP","54","51124  >  443 [ACK] Seq=6415 Ack=71528 Win=514 Len=0"
"137","4.053066","172.64.155.249","192.168.0.183","TCP","1514","443  >  51124 [ACK] Seq=71528 Ack=6415 Win=79 Len=1460 [TCP segment of a reassembled PDU]"
"138","4.053066","172.64.155.249","192.168.0.183","TLSv1.2","172","Application Data"
"139","4.053113","192.168.0.183","172.64.155.249","TCP","54","51124  >  443 [ACK] Seq=6415 Ack=73106 Win=514 Len=0"
"140","4.055166","172.64.155.249","192.168.0.183","TCP","1514","443  >  51124 [ACK] Seq=73106 Ack=6415 Win=79 Len=1460 [TCP segment of a reassembled PDU]"
"141","4.055166","172.64.155.249","192.168.0.183","TCP","1514","443  >  51124 [ACK] Seq=74566 Ack=6415 Win=79 Len=1460 [TCP segment of a reassembled PDU]"
"142","4.055166","172.64.155.249","192.168.0.183","TCP","1514","443  >  51124 [ACK] Seq=76026 Ack=6415 Win=79 Len=1460 [TCP segment of a reassembled PDU]"
"143","4.055166","172.64.155.249","192.168.0.183","TCP","1514","443  >  51124 [ACK] Seq=77486 Ack=6415 Win=79 Len=1460 [TCP segment of a reassembled PDU]"
"144","4.055166","172.64.155.249","192.168.0.183","TCP","1514","443  >  51124 [ACK] Seq=78946 Ack=6415 Win=79 Len=1460 [TCP segment of a reassembled PDU]"
"145","4.055166","172.64.155.249","192.168.0.183","TCP","1514","443  >  51124 [PSH, ACK] Seq=80406 Ack=6415 Win=79 Len=1460 [TCP segment of a reassembled PDU]"
"146","4.055166","172.64.155.249","192.168.0.183","TCP","1514","443  >  51124 [ACK] Seq=81866 Ack=6415 Win=79 Len=1460 [TCP segment of a reassembled PDU]"
"147","4.055166","172.64.155.249","192.168.0.183","TCP","1514","443  >  51124 [ACK] Seq=83326 Ack=6415 Win=79 Len=1460 [TCP segment of a reassembled PDU]"
"148","4.055166","172.64.155.249","192.168.0.183","TLSv1.2","176","Application Data"
"149","4.055265","192.168.0.183","172.64.155.249","TCP","54","51124  >  443 [ACK] Seq=6415 Ack=84908 Win=514 Len=0"
"150","4.062663","172.64.155.249","192.168.0.183","TCP","1514","443  >  51124 [ACK] Seq=84908 Ack=6415 Win=79 Len=1460 [TCP segment of a reassembled PDU]"
"151","4.062663","172.64.155.249","192.168.0.183","TLSv1.2","764","Application Data"
"152","4.062663","172.64.155.249","192.168.0.183","TCP","1514","443  >  51124 [ACK] Seq=87078 Ack=6415 Win=79 Len=1460 [TCP segment of a reassembled PDU]"
"153","4.062663","172.64.155.249","192.168.0.183","TCP","1514","443  >  51124 [ACK] Seq=88538 Ack=6415 Win=79 Len=1460 [TCP segment of a reassembled PDU]"
"154","4.062779","192.168.0.183","172.64.155.249","TCP","54","51124  >  443 [ACK] Seq=6415 Ack=89998 Win=514 Len=0"
"155","4.063577","172.64.155.249","192.168.0.183","TCP","1514","443  >  51124 [ACK] Seq=89998 Ack=6415 Win=79 Len=1460 [TCP segment of a reassembled PDU]"
"156","4.063577","172.64.155.249","192.168.0.183","TCP","1514","443  >  51124 [ACK] Seq=91458 Ack=6415 Win=79 Len=1460 [TCP segment of a reassembled PDU]"
"157","4.063577","172.64.155.249","192.168.0.183","TCP","1514","443  >  51124 [ACK] Seq=92918 Ack=6415 Win=79 Len=1460 [TCP segment of a reassembled PDU]"
"158","4.063577","172.64.155.249","192.168.0.183","TCP","1514","443  >  51124 [PSH, ACK] Seq=94378 Ack=6415 Win=79 Len=1460 [TCP segment of a reassembled PDU]"
"159","4.063577","172.64.155.249","192.168.0.183","TLSv1.2","1008","Application Data"
"160","4.063577","172.64.155.249","192.168.0.183","TLSv1.2","127","Application Data, Application Data"
"161","4.063619","192.168.0.183","172.64.155.249","TCP","54","51124  >  443 [ACK] Seq=6415 Ack=96865 Win=514 Len=0"
"162","4.170105","192.168.0.183","172.64.155.249","TLSv1.2","201","Application Data"
"163","4.184367","172.64.155.249","192.168.0.183","TCP","60","443  >  51134 [ACK] Seq=638 Ack=352 Win=8 Len=0"
"164","4.212905","172.64.155.249","192.168.0.183","TLSv1.2","671","Application Data"
"165","4.212905","172.64.155.249","192.168.0.183","TLSv1.2","203","Application Data"
"166","4.212905","172.64.155.249","192.168.0.183","TLSv1.2","85","Application Data"
"167","4.213238","192.168.0.183","172.64.155.249","TCP","54","51134  >  443 [ACK] Seq=352 Ack=1435 Win=510 Len=0"
"168","4.408512","192.168.0.183","172.64.155.249","TLSv1.2","306","Application Data"
"169","4.408649","192.168.0.183","172.64.155.249","TLSv1.2","179","Application Data"
"170","4.422862","172.64.155.249","192.168.0.183","TCP","60","443  >  51124 [ACK] Seq=96865 Ack=6792 Win=79 Len=0"
"171","4.443340","172.64.155.249","192.168.0.183","TLSv1.2","478","Application Data"
"172","4.443340","172.64.155.249","192.168.0.183","TLSv1.2","158","Application Data"
"173","4.443340","172.64.155.249","192.168.0.183","TLSv1.2","563","Application Data"
"174","4.443340","172.64.155.249","192.168.0.183","TLSv1.2","85","Application Data"
"175","4.443394","192.168.0.183","172.64.155.249","TCP","54","51124  >  443 [ACK] Seq=6792 Ack=97933 Win=509 Len=0"
"176","4.851215","192.168.0.183","172.64.155.249","TLSv1.2","618","Application Data"
"177","4.851317","192.168.0.183","172.64.155.249","TLSv1.2","598","Application Data"
"178","4.864927","172.64.155.249","192.168.0.183","TCP","60","443  >  51124 [ACK] Seq=97933 Ack=7900 Win=80 Len=0"
"179","4.896957","172.64.155.249","192.168.0.183","TLSv1.2","164","Application Data"
"180","4.896957","172.64.155.249","192.168.0.183","TLSv1.2","85","Application Data"
"181","4.896999","192.168.0.183","172.64.155.249","TCP","54","51124  >  443 [ACK] Seq=7900 Ack=98074 Win=509 Len=0"
"182","6.861157","192.168.0.183","172.64.155.249","TLSv1.2","142","Application Data"
"183","6.921310","172.64.155.249","192.168.0.183","TCP","60","443  >  51124 [ACK] Seq=98074 Ack=7988 Win=80 Len=0"
"184","6.952056","172.64.155.249","192.168.0.183","TLSv1.2","303","Application Data"
"185","6.952056","172.64.155.249","192.168.0.183","TLSv1.2","100","Application Data"
"186","6.952056","172.64.155.249","192.168.0.183","TLSv1.2","1281","Application Data"
"187","6.952056","172.64.155.249","192.168.0.183","TCP","1514","443  >  51124 [ACK] Seq=99596 Ack=7988 Win=80 Len=1460 [TCP segment of a reassembled PDU]"
"188","6.952056","172.64.155.249","192.168.0.183","TCP","1514","443  >  51124 [ACK] Seq=101056 Ack=7988 Win=80 Len=1460 [TCP segment of a reassembled PDU]"
"189","6.952056","172.64.155.249","192.168.0.183","TCP","1514","443  >  51124 [ACK] Seq=102516 Ack=7988 Win=80 Len=1460 [TCP segment of a reassembled PDU]"
"190","6.952056","172.64.155.249","192.168.0.183","TLSv1.2","561","Application Data"
"191","6.952056","172.64.155.249","192.168.0.183","TCP","1514","443  >  51124 [ACK] Seq=104483 Ack=7988 Win=80 Len=1460 [TCP segment of a reassembled PDU]"
"192","6.952056","172.64.155.249","192.168.0.183","TCP","1514","443  >  51124 [ACK] Seq=105943 Ack=7988 Win=80 Len=1460 [TCP segment of a reassembled PDU]"
"193","6.952112","192.168.0.183","172.64.155.249","TCP","54","51124  >  443 [ACK] Seq=7988 Ack=107403 Win=514 Len=0"
"194","6.953030","192.168.0.183","172.64.155.249","TLSv1.2","89","Application Data"
"195","6.954059","172.64.155.249","192.168.0.183","TLSv1.2","776","Application Data"
"196","6.957543","172.64.155.249","192.168.0.183","TCP","1514","443  >  51124 [ACK] Seq=108125 Ack=7988 Win=80 Len=1460 [TCP segment of a reassembled PDU]"
"197","6.957543","172.64.155.249","192.168.0.183","TLSv1.2","1363","Application Data"
"198","6.957543","172.64.155.249","192.168.0.183","TLSv1.2","314","Application Data"
"199","6.957543","172.64.155.249","192.168.0.183","TCP","1514","443  >  51124 [ACK] Seq=111154 Ack=7988 Win=80 Len=1460 [TCP segment of a reassembled PDU]"
"200","6.957543","172.64.155.249","192.168.0.183","TLSv1.2","1106","Application Data"
"201","6.957689","192.168.0.183","172.64.155.249","TCP","54","51124  >  443 [ACK] Seq=8023 Ack=113666 Win=514 Len=0"
"202","6.968391","172.64.155.249","192.168.0.183","TCP","1514","443  >  51124 [ACK] Seq=113666 Ack=7988 Win=80 Len=1460 [TCP segment of a reassembled PDU]"
"203","6.968391","172.64.155.249","192.168.0.183","TCP","1514","443  >  51124 [ACK] Seq=115126 Ack=7988 Win=80 Len=1460 [TCP segment of a reassembled PDU]"
"204","6.968391","172.64.155.249","192.168.0.183","TCP","1514","443  >  51124 [ACK] Seq=116586 Ack=7988 Win=80 Len=1460 [TCP segment of a reassembled PDU]"
"205","6.968391","172.64.155.249","192.168.0.183","TLSv1.2","1158","Application Data"
"206","6.968391","172.64.155.249","192.168.0.183","TCP","1514","443  >  51124 [ACK] Seq=119150 Ack=7988 Win=80 Len=1460 [TCP segment of a reassembled PDU]"
"207","6.968391","172.64.155.249","192.168.0.183","TLSv1.2","194","Application Data"
"208","6.968391","172.64.155.249","192.168.0.183","TLSv1.2","96","Application Data"
"209","6.968391","172.64.155.249","192.168.0.183","TLSv1.2","85","Application Data"
"210","6.968391","172.64.155.249","192.168.0.183","TCP","60","443  >  51124 [ACK] Seq=120823 Ack=8023 Win=80 Len=0"
"211","6.968391","172.64.155.249","192.168.0.183","TCP","60","[TCP Dup ACK 210#1] 443  >  51124 [ACK] Seq=120823 Ack=8023 Win=80 Len=0"
"212","6.968492","192.168.0.183","172.64.155.249","TCP","54","51124  >  443 [ACK] Seq=8023 Ack=120823 Win=514 Len=0"
"213","7.214340","192.168.0.183","172.64.155.249","TLSv1.2","210","Application Data"
"214","7.227187","172.64.155.249","192.168.0.183","TCP","60","443  >  51124 [ACK] Seq=120823 Ack=8179 Win=80 Len=0"
"215","7.260584","172.64.155.249","192.168.0.183","TLSv1.2","144","Application Data"
"216","7.309343","192.168.0.183","172.64.155.249","TCP","54","51124  >  443 [ACK] Seq=8179 Ack=120913 Win=513 Len=0"
"217","7.349599","192.168.0.183","172.64.155.249","TLSv1.2","925","Application Data"
"218","7.349665","192.168.0.183","172.64.155.249","TLSv1.2","538","Application Data"
"219","7.364933","172.64.155.249","192.168.0.183","TCP","60","443  >  51124 [ACK] Seq=120913 Ack=9534 Win=81 Len=0"
"220","7.390833","172.64.155.249","192.168.0.183","TLSv1.2","278","Application Data"
"221","7.390833","172.64.155.249","192.168.0.183","TLSv1.2","85","Application Data"
"222","7.390893","192.168.0.183","172.64.155.249","TCP","54","51124  >  443 [ACK] Seq=9534 Ack=121168 Win=512 Len=0"
"223","11.628689","192.168.0.183","172.64.155.249","TLSv1.2","213","Application Data"
"224","11.628752","192.168.0.183","172.64.155.249","TLSv1.2","170","Application Data"
"225","11.642474","172.64.155.249","192.168.0.183","TCP","60","443  >  51124 [ACK] Seq=121168 Ack=9809 Win=81 Len=0"
"226","11.643920","192.168.0.183","172.64.155.249","TLSv1.2","179","Application Data"
"227","11.663920","172.64.155.249","192.168.0.183","TLSv1.2","279","Application Data"
"228","11.692766","172.64.155.249","192.168.0.183","TLSv1.2","165","Application Data"
"229","11.692766","172.64.155.249","192.168.0.183","TLSv1.2","100","Application Data"
"230","11.692766","172.64.155.249","192.168.0.183","TLSv1.2","1283","Application Data"
"231","11.692809","192.168.0.183","172.64.155.249","TCP","54","51124  >  443 [ACK] Seq=9934 Ack=122779 Win=514 Len=0"
"232","11.694824","172.64.155.249","192.168.0.183","TCP","1514","443  >  51124 [ACK] Seq=122779 Ack=9934 Win=81 Len=1460 [TCP segment of a reassembled PDU]"
"233","11.694824","172.64.155.249","192.168.0.183","TCP","1514","443  >  51124 [ACK] Seq=124239 Ack=9934 Win=81 Len=1460 [TCP segment of a reassembled PDU]"
"234","11.694824","172.64.155.249","192.168.0.183","TCP","1514","443  >  51124 [ACK] Seq=125699 Ack=9934 Win=81 Len=1460 [TCP segment of a reassembled PDU]"
"235","11.694824","172.64.155.249","192.168.0.183","TLSv1.2","661","Application Data"
"236","11.694824","172.64.155.249","192.168.0.183","TCP","1514","443  >  51124 [ACK] Seq=127766 Ack=9934 Win=81 Len=1460 [TCP segment of a reassembled PDU]"
"237","11.694904","192.168.0.183","172.64.155.249","TCP","54","51124  >  443 [ACK] Seq=9934 Ack=129226 Win=514 Len=0"
"238","11.696862","172.64.155.249","192.168.0.183","TCP","1514","443  >  51124 [ACK] Seq=129226 Ack=9934 Win=81 Len=1460 [TCP segment of a reassembled PDU]"
"239","11.696862","172.64.155.249","192.168.0.183","TLSv1.2","1220","Application Data"
"240","11.696899","192.168.0.183","172.64.155.249","TCP","54","51124  >  443 [ACK] Seq=9934 Ack=131852 Win=514 Len=0"
"241","11.703137","172.64.155.249","192.168.0.183","TCP","1514","443  >  51124 [ACK] Seq=131852 Ack=9934 Win=81 Len=1460 [TCP segment of a reassembled PDU]"
"242","11.703137","172.64.155.249","192.168.0.183","TLSv1.2","1036","Application Data"
"243","11.703184","192.168.0.183","172.64.155.249","TCP","54","51124  >  443 [ACK] Seq=9934 Ack=134294 Win=514 Len=0"
"244","11.707557","172.64.155.249","192.168.0.183","TCP","1514","443  >  51124 [ACK] Seq=134294 Ack=9934 Win=81 Len=1460 [TCP segment of a reassembled PDU]"
"245","11.707557","172.64.155.249","192.168.0.183","TCP","1514","443  >  51124 [ACK] Seq=135754 Ack=9934 Win=81 Len=1460 [TCP segment of a reassembled PDU]"
"246","11.707557","172.64.155.249","192.168.0.183","TCP","1514","443  >  51124 [ACK] Seq=137214 Ack=9934 Win=81 Len=1460 [TCP segment of a reassembled PDU]"
"247","11.707557","172.64.155.249","192.168.0.183","TLSv1.2","430","Application Data"
"248","11.707656","192.168.0.183","172.64.155.249","TCP","54","51124  >  443 [ACK] Seq=9934 Ack=139050 Win=514 Len=0"
"249","11.710234","172.64.155.249","192.168.0.183","TCP","1514","443  >  51124 [ACK] Seq=139050 Ack=9934 Win=81 Len=1460 [TCP segment of a reassembled PDU]"
"250","11.710234","172.64.155.249","192.168.0.183","TCP","1514","443  >  51124 [ACK] Seq=140510 Ack=9934 Win=81 Len=1460 [TCP segment of a reassembled PDU]"
"251","11.710234","172.64.155.249","192.168.0.183","TCP","1514","443  >  51124 [ACK] Seq=141970 Ack=9934 Win=81 Len=1460 [TCP segment of a reassembled PDU]"
"252","11.710234","172.64.155.249","192.168.0.183","TCP","1514","443  >  51124 [ACK] Seq=143430 Ack=9934 Win=81 Len=1460 [TCP segment of a reassembled PDU]"
"253","11.710234","172.64.155.249","192.168.0.183","TCP","1514","443  >  51124 [ACK] Seq=144890 Ack=9934 Win=81 Len=1460 [TCP segment of a reassembled PDU]"
"254","11.710234","172.64.155.249","192.168.0.183","TCP","1514","443  >  51124 [PSH, ACK] Seq=146350 Ack=9934 Win=81 Len=1460 [TCP segment of a reassembled PDU]"
"255","11.710234","172.64.155.249","192.168.0.183","TCP","1514","443  >  51124 [ACK] Seq=147810 Ack=9934 Win=81 Len=1460 [TCP segment of a reassembled PDU]"
"256","11.710234","172.64.155.249","192.168.0.183","TCP","1514","443  >  51124 [ACK] Seq=149270 Ack=9934 Win=81 Len=1460 [TCP segment of a reassembled PDU]"
"257","11.710234","172.64.155.249","192.168.0.183","TCP","1514","443  >  51124 [ACK] Seq=150730 Ack=9934 Win=81 Len=1460 [TCP segment of a reassembled PDU]"
"258","11.710234","172.64.155.249","192.168.0.183","TCP","1514","443  >  51124 [ACK] Seq=152190 Ack=9934 Win=81 Len=1460 [TCP segment of a reassembled PDU]"
"259","11.710234","172.64.155.249","192.168.0.183","TCP","1514","443  >  51124 [ACK] Seq=153650 Ack=9934 Win=81 Len=1460 [TCP segment of a reassembled PDU]"
"260","11.710234","172.64.155.249","192.168.0.183","TLSv1.2","400","Application Data"
"261","11.710370","192.168.0.183","172.64.155.249","TCP","54","51124  >  443 [ACK] Seq=9934 Ack=155456 Win=514 Len=0"
"262","11.710920","172.64.155.249","192.168.0.183","TLSv1.2","483","Application Data"
"263","11.710947","192.168.0.183","172.64.155.249","TCP","54","51124  >  443 [ACK] Seq=9934 Ack=155885 Win=512 Len=0"
"264","11.714842","172.64.155.249","192.168.0.183","TCP","1514","443  >  51124 [ACK] Seq=155885 Ack=9934 Win=81 Len=1460 [TCP segment of a reassembled PDU]"
"265","11.714842","172.64.155.249","192.168.0.183","TCP","1514","443  >  51124 [ACK] Seq=157345 Ack=9934 Win=81 Len=1460 [TCP segment of a reassembled PDU]"
"266","11.714842","172.64.155.249","192.168.0.183","TLSv1.2","857","Application Data"
"267","11.714898","192.168.0.183","172.64.155.249","TCP","54","51124  >  443 [ACK] Seq=9934 Ack=159608 Win=514 Len=0"
"268","11.716200","172.64.155.249","192.168.0.183","TCP","1514","443  >  51124 [ACK] Seq=159608 Ack=9934 Win=81 Len=1460 [TCP segment of a reassembled PDU]"
"269","11.716200","172.64.155.249","192.168.0.183","TLSv1.2","670","Application Data"
"270","11.716200","172.64.155.249","192.168.0.183","TLSv1.2","96","Application Data"
"271","11.716200","172.64.155.249","192.168.0.183","TLSv1.2","85","Application Data"
"272","11.716244","192.168.0.183","172.64.155.249","TCP","54","51124  >  443 [ACK] Seq=9934 Ack=161757 Win=514 Len=0"
"273","11.767546","192.168.0.183","172.64.155.249","TLSv1.2","218","Application Data"
"274","11.808738","172.64.155.249","192.168.0.183","TLSv1.2","473","Application Data"
"275","11.808738","172.64.155.249","192.168.0.183","TLSv1.2","203","Application Data"
"276","11.808738","172.64.155.249","192.168.0.183","TLSv1.2","85","Application Data"
"277","11.808779","192.168.0.183","172.64.155.249","TCP","54","51134  >  443 [ACK] Seq=516 Ack=2034 Win=508 Len=0"
"278","11.809625","192.168.0.183","172.64.155.249","TLSv1.2","89","Application Data"
"279","11.864291","172.64.155.249","192.168.0.183","TCP","60","443  >  51134 [ACK] Seq=2034 Ack=551 Win=8 Len=0"
"280","11.966894","192.168.0.183","172.64.155.249","TLSv1.2","248","Application Data"
"281","12.009316","172.64.155.249","192.168.0.183","TLSv1.2","144","Application Data"
"282","12.049331","192.168.0.183","172.64.155.249","TCP","54","51124  >  443 [ACK] Seq=10128 Ack=161847 Win=513 Len=0"
"283","12.209205","192.168.0.183","172.64.155.249","TLSv1.2","516","Application Data"
"284","12.209280","192.168.0.183","172.64.155.249","TLSv1.2","582","Application Data"
"285","12.232358","172.64.155.249","192.168.0.183","TCP","60","443  >  51124 [ACK] Seq=161847 Ack=11118 Win=82 Len=0"
"286","12.255711","172.64.155.249","192.168.0.183","TLSv1.2","143","Application Data"
"287","12.255711","172.64.155.249","192.168.0.183","TLSv1.2","85","Application Data"
"288","12.255772","192.168.0.183","172.64.155.249","TCP","54","51124  >  443 [ACK] Seq=11118 Ack=161967 Win=513 Len=0"
"289","15.479082","192.168.0.183","172.64.155.249","TLSv1.2","457","Application Data"
"290","15.534607","172.64.155.249","192.168.0.183","TCP","60","443  >  51124 [ACK] Seq=161967 Ack=11521 Win=82 Len=0"
"291","15.569438","172.64.155.249","192.168.0.183","TLSv1.2","279","Application Data"
"292","15.569438","172.64.155.249","192.168.0.183","TLSv1.2","100","Application Data"
"293","15.569438","172.64.155.249","192.168.0.183","TLSv1.2","1272","Application Data"
"294","15.569564","192.168.0.183","172.64.155.249","TCP","54","51124  >  443 [ACK] Seq=11521 Ack=163456 Win=514 Len=0"
"295","15.570960","192.168.0.183","172.64.155.249","TLSv1.2","89","Application Data"
"296","15.572818","172.64.155.249","192.168.0.183","TCP","1514","443  >  51124 [ACK] Seq=163456 Ack=11521 Win=82 Len=1460 [TCP segment of a reassembled PDU]"
"297","15.572818","172.64.155.249","192.168.0.183","TCP","1514","443  >  51124 [ACK] Seq=164916 Ack=11521 Win=82 Len=1460 [TCP segment of a reassembled PDU]"
"298","15.572818","172.64.155.249","192.168.0.183","TCP","1514","443  >  51124 [ACK] Seq=166376 Ack=11521 Win=82 Len=1460 [TCP segment of a reassembled PDU]"
"299","15.572818","172.64.155.249","192.168.0.183","TCP","1514","443  >  51124 [ACK] Seq=167836 Ack=11521 Win=82 Len=1460 [TCP segment of a reassembled PDU]"
"300","15.572818","172.64.155.249","192.168.0.183","TCP","1514","443  >  51124 [ACK] Seq=169296 Ack=11521 Win=82 Len=1460 [TCP segment of a reassembled PDU]"
"301","15.572818","172.64.155.249","192.168.0.183","TCP","1514","443  >  51124 [PSH, ACK] Seq=170756 Ack=11521 Win=82 Len=1460 [TCP segment of a reassembled PDU]"
"302","15.572818","172.64.155.249","192.168.0.183","TLSv1.2","1118","Application Data"
"303","15.572970","192.168.0.183","172.64.155.249","TCP","54","51124  >  443 [ACK] Seq=11556 Ack=173280 Win=514 Len=0"
"304","15.583017","172.64.155.249","192.168.0.183","TCP","1514","443  >  51124 [ACK] Seq=173280 Ack=11521 Win=82 Len=1460 [TCP segment of a reassembled PDU]"
"305","15.583017","172.64.155.249","192.168.0.183","TLSv1.2","272","Application Data"
"306","15.583017","172.64.155.249","192.168.0.183","TCP","60","443  >  51124 [ACK] Seq=174958 Ack=11556 Win=82 Len=0"
"307","15.583070","192.168.0.183","172.64.155.249","TCP","54","51124  >  443 [ACK] Seq=11556 Ack=174958 Win=514 Len=0"
"308","15.587346","172.64.155.249","192.168.0.183","TCP","1514","443  >  51124 [ACK] Seq=174958 Ack=11556 Win=82 Len=1460 [TCP segment of a reassembled PDU]"
"309","15.587346","172.64.155.249","192.168.0.183","TCP","1514","443  >  51124 [ACK] Seq=176418 Ack=11556 Win=82 Len=1460 [TCP segment of a reassembled PDU]"
"310","15.587346","172.64.155.249","192.168.0.183","TCP","1514","443  >  51124 [ACK] Seq=177878 Ack=11556 Win=82 Len=1460 [TCP segment of a reassembled PDU]"
"311","15.587346","172.64.155.249","192.168.0.183","TCP","1514","443  >  51124 [ACK] Seq=179338 Ack=11556 Win=82 Len=1460 [TCP segment of a reassembled PDU]"
"312","15.587346","172.64.155.249","192.168.0.183","TCP","1514","443  >  51124 [ACK] Seq=180798 Ack=11556 Win=82 Len=1460 [TCP segment of a reassembled PDU]"
"313","15.587346","172.64.155.249","192.168.0.183","TCP","1514","443  >  51124 [PSH, ACK] Seq=182258 Ack=11556 Win=82 Len=1460 [TCP segment of a reassembled PDU]"
"314","15.587346","172.64.155.249","192.168.0.183","TCP","1514","443  >  51124 [ACK] Seq=183718 Ack=11556 Win=82 Len=1460 [TCP segment of a reassembled PDU]"
"315","15.587346","172.64.155.249","192.168.0.183","TCP","1514","443  >  51124 [ACK] Seq=185178 Ack=11556 Win=82 Len=1460 [TCP segment of a reassembled PDU]"
"316","15.587346","172.64.155.249","192.168.0.183","TLSv1.2","898","Application Data"
"317","15.587346","172.64.155.249","192.168.0.183","TLSv1.2","127","Application Data, Application Data"
"318","15.587493","192.168.0.183","172.64.155.249","TCP","54","51124  >  443 [ACK] Seq=11556 Ack=187555 Win=514 Len=0"
"319","15.885497","192.168.0.183","172.64.155.249","TLSv1.2","221","Application Data"
"320","15.886027","192.168.0.183","172.64.155.249","TLSv1.2","177","Application Data"
"321","15.907144","172.64.155.249","192.168.0.183","TCP","60","443  >  51124 [ACK] Seq=187555 Ack=11846 Win=83 Len=0"
"322","15.931731","172.64.155.249","192.168.0.183","TLSv1.2","144","Application Data"
"323","15.935776","172.64.155.249","192.168.0.183","TLSv1.2","146","Application Data"
"324","15.935776","172.64.155.249","192.168.0.183","TLSv1.2","224","Application Data"
"325","15.935776","172.64.155.249","192.168.0.183","TLSv1.2","85","Application Data"
"326","15.935953","192.168.0.183","172.64.155.249","TCP","54","51124  >  443 [ACK] Seq=11846 Ack=187938 Win=512 Len=0"
"327","16.009691","192.168.0.183","172.64.155.249","TLSv1.2","489","Application Data"
"328","16.009758","192.168.0.183","172.64.155.249","TLSv1.2","541","Application Data"
"329","16.024033","172.64.155.249","192.168.0.183","TCP","60","443  >  51124 [ACK] Seq=187938 Ack=12768 Win=83 Len=0"
"330","16.048285","172.64.155.249","192.168.0.183","TLSv1.2","144","Application Data"
"331","16.048285","172.64.155.249","192.168.0.183","TLSv1.2","85","Application Data"
"332","16.048312","192.168.0.183","172.64.155.249","TCP","54","51124  >  443 [ACK] Seq=12768 Ack=188059 Win=512 Len=0"
"333","17.998135","192.168.0.183","172.64.155.249","TLSv1.2","608","Application Data"
"334","18.052043","172.64.155.249","192.168.0.183","TCP","60","443  >  51124 [ACK] Seq=188059 Ack=13322 Win=84 Len=0"
"335","18.075504","172.64.155.249","192.168.0.183","TLSv1.2","487","Application Data"
"336","18.075504","172.64.155.249","192.168.0.183","TCP","1514","443  >  51124 [ACK] Seq=188492 Ack=13322 Win=84 Len=1460 [TCP segment of a reassembled PDU]"
"337","18.075504","172.64.155.249","192.168.0.183","TLSv1.2","612","Application Data"
"338","18.075504","172.64.155.249","192.168.0.183","TLSv1.2","85","Application Data"
"339","18.075538","192.168.0.183","172.64.155.249","TCP","54","51124  >  443 [ACK] Seq=13322 Ack=190541 Win=514 Len=0"
"340","18.780312","192.168.0.183","172.64.155.249","TLSv1.2","130","Application Data"
"341","18.780376","192.168.0.183","172.64.155.249","TLSv1.2","170","Application Data"
"342","18.793503","192.168.0.183","172.64.155.249","TLSv1.2","151","Application Data"
"343","18.793504","172.64.155.249","192.168.0.183","TCP","60","443  >  51124 [ACK] Seq=190541 Ack=13514 Win=84 Len=0"
"344","18.806493","172.64.155.249","192.168.0.183","TCP","60","443  >  51124 [ACK] Seq=190541 Ack=13611 Win=84 Len=0"
"345","18.817081","172.64.155.249","192.168.0.183","TLSv1.2","306","Application Data"
"346","18.862744","192.168.0.183","172.64.155.249","TCP","54","51124  >  443 [ACK] Seq=13611 Ack=190793 Win=513 Len=0"
"347","18.942339","192.168.0.183","172.64.155.249","TLSv1.2","154","Application Data"
"348","18.985794","172.64.155.249","192.168.0.183","TLSv1.2","152","Application Data"
"349","18.985794","172.64.155.249","192.168.0.183","TCP","1514","443  >  51124 [ACK] Seq=190891 Ack=13711 Win=84 Len=1460 [TCP segment of a reassembled PDU]"
"350","18.985794","172.64.155.249","192.168.0.183","TLSv1.2","612","Application Data"
"351","18.985794","172.64.155.249","192.168.0.183","TLSv1.2","85","Application Data"
"352","18.985894","192.168.0.183","172.64.155.249","TCP","54","51124  >  443 [ACK] Seq=13711 Ack=192940 Win=514 Len=0"
"353","19.190362","172.64.155.249","192.168.0.183","TLSv1.2","146","Application Data"
"354","19.190362","172.64.155.249","192.168.0.183","TLSv1.2","100","Application Data"
"355","19.190362","172.64.155.249","192.168.0.183","TCP","1514","443  >  51124 [ACK] Seq=193078 Ack=13711 Win=84 Len=1460 [TCP segment of a reassembled PDU]"
"356","19.190362","172.64.155.249","192.168.0.183","TCP","1514","443  >  51124 [ACK] Seq=194538 Ack=13711 Win=84 Len=1460 [TCP segment of a reassembled PDU]"
"357","19.190362","172.64.155.249","192.168.0.183","TCP","1514","443  >  51124 [ACK] Seq=195998 Ack=13711 Win=84 Len=1460 [TCP segment of a reassembled PDU]"
"358","19.190362","172.64.155.249","192.168.0.183","TLSv1.2","694","Application Data"
"359","19.190362","172.64.155.249","192.168.0.183","TCP","1514","443  >  51124 [ACK] Seq=198098 Ack=13711 Win=84 Len=1460 [TCP segment of a reassembled PDU]"
"360","19.190416","192.168.0.183","172.64.155.249","TCP","54","51124  >  443 [ACK] Seq=13711 Ack=199558 Win=514 Len=0"
"361","19.203354","172.64.155.249","192.168.0.183","TCP","1514","443  >  51124 [ACK] Seq=199558 Ack=13711 Win=84 Len=1460 [TCP segment of a reassembled PDU]"
"362","19.203354","172.64.155.249","192.168.0.183","TCP","1514","443  >  51124 [ACK] Seq=201018 Ack=13711 Win=84 Len=1460 [TCP segment of a reassembled PDU]"
"363","19.203354","172.64.155.249","192.168.0.183","TCP","1514","443  >  51124 [ACK] Seq=202478 Ack=13711 Win=84 Len=1460 [TCP segment of a reassembled PDU]"
"364","19.203354","172.64.155.249","192.168.0.183","TLSv1.2","135","Application Data"
"365","19.203354","172.64.155.249","192.168.0.183","TCP","1514","443  >  51124 [ACK] Seq=204019 Ack=13711 Win=84 Len=1460 [TCP segment of a reassembled PDU]"
"366","19.203354","172.64.155.249","192.168.0.183","TLSv1.2","334","Application Data"
"367","19.203354","172.64.155.249","192.168.0.183","TCP","1514","443  >  51124 [ACK] Seq=205759 Ack=13711 Win=84 Len=1460 [TCP segment of a reassembled PDU]"
"368","19.203354","172.64.155.249","192.168.0.183","TCP","1514","443  >  51124 [ACK] Seq=207219 Ack=13711 Win=84 Len=1460 [TCP segment of a reassembled PDU]"
"369","19.203354","172.64.155.249","192.168.0.183","TCP","1514","443  >  51124 [ACK] Seq=208679 Ack=13711 Win=84 Len=1460 [TCP segment of a reassembled PDU]"
"370","19.203354","172.64.155.249","192.168.0.183","TCP","1514","443  >  51124 [ACK] Seq=210139 Ack=13711 Win=84 Len=1460 [TCP segment of a reassembled PDU]"
"371","19.203354","172.64.155.249","192.168.0.183","TCP","1514","443  >  51124 [ACK] Seq=211599 Ack=13711 Win=84 Len=1460 [TCP segment of a reassembled PDU]"
"372","19.203354","172.64.155.249","192.168.0.183","TCP","1514","443  >  51124 [PSH, ACK] Seq=213059 Ack=13711 Win=84 Len=1460 [TCP segment of a reassembled PDU]"
"373","19.203354","172.64.155.249","192.168.0.183","TCP","1514","443  >  51124 [ACK] Seq=214519 Ack=13711 Win=84 Len=1460 [TCP segment of a reassembled PDU]"
"374","19.203354","172.64.155.249","192.168.0.183","TCP","1514","443  >  51124 [ACK] Seq=215979 Ack=13711 Win=84 Len=1460 [TCP segment of a reassembled PDU]"
"375","19.203354","172.64.155.249","192.168.0.183","TLSv1.2","414","Application Data"
"376","19.203354","172.64.155.249","192.168.0.183","TLSv1.2","1491","Application Data"
"377","19.203354","172.64.155.249","192.168.0.183","TCP","1514","443  >  51124 [ACK] Seq=219236 Ack=13711 Win=84 Len=1460 [TCP segment of a reassembled PDU]"
"378","19.203354","172.64.155.249","192.168.0.183","TCP","1514","443  >  51124 [ACK] Seq=220696 Ack=13711 Win=84 Len=1460 [TCP segment of a reassembled PDU]"
"379","19.203354","172.64.155.249","192.168.0.183","TCP","1514","443  >  51124 [ACK] Seq=222156 Ack=13711 Win=84 Len=1460 [TCP segment of a reassembled PDU]"
"380","19.203354","172.64.155.249","192.168.0.183","TCP","1514","443  >  51124 [ACK] Seq=223616 Ack=13711 Win=84 Len=1460 [TCP segment of a reassembled PDU]"
"381","19.203354","172.64.155.249","192.168.0.183","TLSv1.2","223","Application Data"
"382","19.203354","172.64.155.249","192.168.0.183","TCP","1514","443  >  51124 [ACK] Seq=225245 Ack=13711 Win=84 Len=1460 [TCP segment of a reassembled PDU]"
"383","19.203354","172.64.155.249","192.168.0.183","TCP","1514","443  >  51124 [ACK] Seq=226705 Ack=13711 Win=84 Len=1460 [TCP segment of a reassembled PDU]"
"384","19.203354","172.64.155.249","192.168.0.183","TLSv1.2","114","Application Data"
"385","19.203354","172.64.155.249","192.168.0.183","TLSv1.2","127","Application Data, Application Data"
"386","19.203605","192.168.0.183","172.64.155.249","TCP","54","51124  >  443 [ACK] Seq=13711 Ack=228298 Win=514 Len=0"
"387","19.355248","192.168.0.183","172.64.155.249","TLSv1.2","184","Application Data"
"388","19.375093","172.64.155.249","192.168.0.183","TCP","60","443  >  51134 [ACK] Seq=2034 Ack=681 Win=8 Len=0"
"389","19.393513","172.64.155.249","192.168.0.183","TLSv1.2","474","Application Data"
"390","19.393513","172.64.155.249","192.168.0.183","TLSv1.2","203","Application Data"
"391","19.393513","172.64.155.249","192.168.0.183","TLSv1.2","85","Application Data"
"392","19.393556","192.168.0.183","172.64.155.249","TCP","54","51134  >  443 [ACK] Seq=681 Ack=2634 Win=514 Len=0"
"393","19.394544","192.168.0.183","172.64.155.249","TLSv1.2","89","Application Data"
"394","19.454016","172.64.155.249","192.168.0.183","TCP","60","443  >  51134 [ACK] Seq=2634 Ack=716 Win=8 Len=0"
"395","19.677523","192.168.0.183","172.64.155.249","TLSv1.2","531","Application Data"
"396","19.677587","192.168.0.183","172.64.155.249","TLSv1.2","545","Application Data"
"397","19.691126","172.64.155.249","192.168.0.183","TCP","60","443  >  51124 [ACK] Seq=228298 Ack=14679 Win=84 Len=0"
"398","19.715528","172.64.155.249","192.168.0.183","TLSv1.2","277","Application Data"
"399","19.715528","172.64.155.249","192.168.0.183","TLSv1.2","85","Application Data"
"400","19.715560","192.168.0.183","172.64.155.249","TCP","54","51124  >  443 [ACK] Seq=14679 Ack=228552 Win=513 Len=0"
"401","20.477623","192.168.0.183","172.64.155.249","TLSv1.2","277","Application Data"
"402","20.477718","192.168.0.183","172.64.155.249","TLSv1.2","585","Application Data"
"403","20.491065","172.64.155.249","192.168.0.183","TCP","60","443  >  51124 [ACK] Seq=228552 Ack=15433 Win=85 Len=0"
"404","20.500729","192.168.0.183","172.64.155.249","TLSv1.2","187","Application Data"
"405","20.515136","172.64.155.249","192.168.0.183","TLSv1.2","277","Application Data"
"406","20.515136","172.64.155.249","192.168.0.183","TLSv1.2","85","Application Data"
"407","20.515172","192.168.0.183","172.64.155.249","TCP","54","51124  >  443 [ACK] Seq=15566 Ack=228806 Win=512 Len=0"
"408","20.555601","172.64.155.249","192.168.0.183","TLSv1.2","146","Application Data"
"409","20.555601","172.64.155.249","192.168.0.183","TLSv1.2","100","Application Data"
"410","20.555601","172.64.155.249","192.168.0.183","TLSv1.2","1309","Application Data"
"411","20.555661","192.168.0.183","172.64.155.249","TCP","54","51124  >  443 [ACK] Seq=15566 Ack=230199 Win=514 Len=0"
"412","20.557834","172.64.155.249","192.168.0.183","TCP","1514","443  >  51124 [ACK] Seq=230199 Ack=15566 Win=85 Len=1460 [TCP segment of a reassembled PDU]"
"413","20.557834","172.64.155.249","192.168.0.183","TCP","1514","443  >  51124 [ACK] Seq=231659 Ack=15566 Win=85 Len=1460 [TCP segment of a reassembled PDU]"
"414","20.557834","172.64.155.249","192.168.0.183","TCP","1514","443  >  51124 [ACK] Seq=233119 Ack=15566 Win=85 Len=1460 [TCP segment of a reassembled PDU]"
"415","20.557834","172.64.155.249","192.168.0.183","TLSv1.2","669","Application Data"
"416","20.557834","172.64.155.249","192.168.0.183","TCP","1514","443  >  51124 [ACK] Seq=235194 Ack=15566 Win=85 Len=1460 [TCP segment of a reassembled PDU]"
"417","20.557834","172.64.155.249","192.168.0.183","TCP","1514","443  >  51124 [ACK] Seq=236654 Ack=15566 Win=85 Len=1460 [TCP segment of a reassembled PDU]"
"418","20.557834","172.64.155.249","192.168.0.183","TLSv1.2","709","Application Data"
"419","20.558009","192.168.0.183","172.64.155.249","TCP","54","51124  >  443 [ACK] Seq=15566 Ack=238769 Win=514 Len=0"
"420","20.565024","172.64.155.249","192.168.0.183","TCP","1514","443  >  51124 [ACK] Seq=238769 Ack=15566 Win=85 Len=1460 [TCP segment of a reassembled PDU]"
"421","20.565024","172.64.155.249","192.168.0.183","TLSv1.2","809","Application Data"
"422","20.565097","192.168.0.183","172.64.155.249","TCP","54","51124  >  443 [ACK] Seq=15566 Ack=240984 Win=514 Len=0"
"423","20.569641","172.64.155.249","192.168.0.183","TCP","1514","443  >  51124 [ACK] Seq=240984 Ack=15566 Win=85 Len=1460 [TCP segment of a reassembled PDU]"
"424","20.569641","172.64.155.249","192.168.0.183","TCP","1514","443  >  51124 [ACK] Seq=242444 Ack=15566 Win=85 Len=1460 [TCP segment of a reassembled PDU]"
"425","20.569641","172.64.155.249","192.168.0.183","TCP","1514","443  >  51124 [ACK] Seq=243904 Ack=15566 Win=85 Len=1460 [TCP segment of a reassembled PDU]"
"426","20.569641","172.64.155.249","192.168.0.183","TCP","1514","443  >  51124 [ACK] Seq=245364 Ack=15566 Win=85 Len=1460 [TCP segment of a reassembled PDU]"
"427","20.569641","172.64.155.249","192.168.0.183","TLSv1.2","691","Application Data"
"428","20.569754","192.168.0.183","172.64.155.249","TCP","54","51124  >  443 [ACK] Seq=15566 Ack=247461 Win=514 Len=0"
"429","20.571826","172.64.155.249","192.168.0.183","TCP","1514","443  >  51124 [ACK] Seq=247461 Ack=15566 Win=85 Len=1460 [TCP segment of a reassembled PDU]"
"430","20.571826","172.64.155.249","192.168.0.183","TCP","1514","443  >  51124 [ACK] Seq=248921 Ack=15566 Win=85 Len=1460 [TCP segment of a reassembled PDU]"
"431","20.571826","172.64.155.249","192.168.0.183","TCP","1514","443  >  51124 [ACK] Seq=250381 Ack=15566 Win=85 Len=1460 [TCP segment of a reassembled PDU]"
"432","20.571826","172.64.155.249","192.168.0.183","TCP","1514","443  >  51124 [ACK] Seq=251841 Ack=15566 Win=85 Len=1460 [TCP segment of a reassembled PDU]"
"433","20.571826","172.64.155.249","192.168.0.183","TCP","1514","443  >  51124 [ACK] Seq=253301 Ack=15566 Win=85 Len=1460 [TCP segment of a reassembled PDU]"
"434","20.571826","172.64.155.249","192.168.0.183","TCP","1514","443  >  51124 [PSH, ACK] Seq=254761 Ack=15566 Win=85 Len=1460 [TCP segment of a reassembled PDU]"
"435","20.571826","172.64.155.249","192.168.0.183","TCP","1514","443  >  51124 [ACK] Seq=256221 Ack=15566 Win=85 Len=1460 [TCP segment of a reassembled PDU]"
"436","20.571826","172.64.155.249","192.168.0.183","TLSv1.2","754","Application Data"
"437","20.571941","192.168.0.183","172.64.155.249","TCP","54","51124  >  443 [ACK] Seq=15566 Ack=258381 Win=514 Len=0"
"438","20.576874","172.64.155.249","192.168.0.183","TCP","1514","443  >  51124 [ACK] Seq=258381 Ack=15566 Win=85 Len=1460 [TCP segment of a reassembled PDU]"
"439","20.576874","172.64.155.249","192.168.0.183","TCP","1514","443  >  51124 [ACK] Seq=259841 Ack=15566 Win=85 Len=1460 [TCP segment of a reassembled PDU]"
"440","20.576874","172.64.155.249","192.168.0.183","TCP","1514","443  >  51124 [ACK] Seq=261301 Ack=15566 Win=85 Len=1460 [TCP segment of a reassembled PDU]"
"441","20.576874","172.64.155.249","192.168.0.183","TCP","1514","443  >  51124 [ACK] Seq=262761 Ack=15566 Win=85 Len=1460 [TCP segment of a reassembled PDU]"
"442","20.576874","172.64.155.249","192.168.0.183","TLSv1.2","1153","Application Data"
"443","20.576963","192.168.0.183","172.64.155.249","TCP","54","51124  >  443 [ACK] Seq=15566 Ack=265320 Win=514 Len=0"
"444","20.578793","172.64.155.249","192.168.0.183","TCP","1514","443  >  51124 [ACK] Seq=265320 Ack=15566 Win=85 Len=1460 [TCP segment of a reassembled PDU]"
"445","20.578793","172.64.155.249","192.168.0.183","TCP","1514","443  >  51124 [ACK] Seq=266780 Ack=15566 Win=85 Len=1460 [TCP segment of a reassembled PDU]"
"446","20.578793","172.64.155.249","192.168.0.183","TLSv1.2","801","Application Data"
"447","20.578793","172.64.155.249","192.168.0.183","TLSv1.2","96","Application Data"
"448","20.578793","172.64.155.249","192.168.0.183","TLSv1.2","85","Application Data"
"449","20.578843","192.168.0.183","172.64.155.249","TCP","54","51124  >  443 [ACK] Seq=15566 Ack=269060 Win=514 Len=0"
"450","20.579033","192.168.0.183","172.64.155.249","TLSv1.2","89","Application Data"
"451","20.639828","172.64.155.249","192.168.0.183","TCP","60","443  >  51124 [ACK] Seq=269060 Ack=15601 Win=85 Len=0"
"452","20.685162","192.168.0.183","172.64.155.249","TLSv1.2","198","Application Data"
"453","20.713030","172.64.155.249","192.168.0.183","TCP","60","443  >  51134 [ACK] Seq=2634 Ack=860 Win=8 Len=0"
"454","20.737046","172.64.155.249","192.168.0.183","TLSv1.2","474","Application Data"
"455","20.737046","172.64.155.249","192.168.0.183","TLSv1.2","203","Application Data"
"456","20.737046","172.64.155.249","192.168.0.183","TLSv1.2","85","Application Data"
"457","20.737120","192.168.0.183","172.64.155.249","TCP","54","51134  >  443 [ACK] Seq=860 Ack=3234 Win=511 Len=0"
"458","20.897832","192.168.0.183","172.64.155.249","TLSv1.2","241","Application Data"
"459","20.910676","172.64.155.249","192.168.0.183","TCP","60","443  >  51124 [ACK] Seq=269060 Ack=15788 Win=86 Len=0"
"460","20.960919","172.64.155.249","192.168.0.183","TLSv1.2","144","Application Data"
"461","21.011436","192.168.0.183","172.64.155.249","TCP","54","51124  >  443 [ACK] Seq=15788 Ack=269150 Win=513 Len=0"
"462","21.128677","192.168.0.183","172.64.155.249","TLSv1.2","513","Application Data"
"463","21.128742","192.168.0.183","172.64.155.249","TLSv1.2","588","Application Data"
"464","21.142972","172.64.155.249","192.168.0.183","TCP","60","443  >  51124 [ACK] Seq=269150 Ack=16781 Win=86 Len=0"
"465","21.168352","172.64.155.249","192.168.0.183","TLSv1.2","144","Application Data"
"466","21.168352","172.64.155.249","192.168.0.183","TLSv1.2","85","Application Data"
"467","21.168412","192.168.0.183","172.64.155.249","TCP","54","51124  >  443 [ACK] Seq=16781 Ack=269271 Win=513 Len=0"
"468","23.945950","192.168.0.183","172.64.155.249","TLSv1.2","474","Application Data"
"469","24.000946","172.64.155.249","192.168.0.183","TCP","60","443  >  51124 [ACK] Seq=269271 Ack=17201 Win=87 Len=0"
"470","24.096952","172.64.155.249","192.168.0.183","TLSv1.2","298","Application Data"
"471","24.096952","172.64.155.249","192.168.0.183","TLSv1.2","100","Application Data"
"472","24.096952","172.64.155.249","192.168.0.183","TLSv1.2","1275","Application Data"
"473","24.096952","172.64.155.249","192.168.0.183","TCP","1514","443  >  51124 [ACK] Seq=270782 Ack=17201 Win=87 Len=1460 [TCP segment of a reassembled PDU]"
"474","24.096998","192.168.0.183","172.64.155.249","TCP","54","51124  >  443 [ACK] Seq=17201 Ack=272242 Win=514 Len=0"
"475","24.098491","172.64.155.249","192.168.0.183","TCP","1514","443  >  51124 [ACK] Seq=272242 Ack=17201 Win=87 Len=1460 [TCP segment of a reassembled PDU]"
"476","24.098491","172.64.155.249","192.168.0.183","TCP","1514","443  >  51124 [ACK] Seq=273702 Ack=17201 Win=87 Len=1460 [TCP segment of a reassembled PDU]"
"477","24.098491","172.64.155.249","192.168.0.183","TCP","1514","443  >  51124 [ACK] Seq=275162 Ack=17201 Win=87 Len=1460 [TCP segment of a reassembled PDU]"
"478","24.098491","172.64.155.249","192.168.0.183","TCP","1514","443  >  51124 [ACK] Seq=276622 Ack=17201 Win=87 Len=1460 [TCP segment of a reassembled PDU]"
"479","24.098491","172.64.155.249","192.168.0.183","TLSv1.2","1328","Application Data"
"480","24.098534","192.168.0.183","172.64.155.249","TCP","54","51124  >  443 [ACK] Seq=17201 Ack=279356 Win=514 Len=0"
"481","24.108844","172.64.155.249","192.168.0.183","TCP","1514","443  >  51124 [ACK] Seq=279356 Ack=17201 Win=87 Len=1460 [TCP segment of a reassembled PDU]"
"482","24.108844","172.64.155.249","192.168.0.183","TLSv1.2","1378","Application Data"
"483","24.108844","172.64.155.249","192.168.0.183","TCP","1514","443  >  51124 [ACK] Seq=282140 Ack=17201 Win=87 Len=1460 [TCP segment of a reassembled PDU]"
"484","24.108844","172.64.155.249","192.168.0.183","TLSv1.2","344","Application Data"
"485","24.108844","172.64.155.249","192.168.0.183","TCP","1514","443  >  51124 [ACK] Seq=283890 Ack=17201 Win=87 Len=1460 [TCP segment of a reassembled PDU]"
"486","24.108918","192.168.0.183","172.64.155.249","TCP","54","51124  >  443 [ACK] Seq=17201 Ack=285350 Win=514 Len=0"
"487","24.109773","172.64.155.249","192.168.0.183","TCP","1514","443  >  51124 [ACK] Seq=285350 Ack=17201 Win=87 Len=1460 [TCP segment of a reassembled PDU]"
"488","24.109773","172.64.155.249","192.168.0.183","TCP","1514","443  >  51124 [ACK] Seq=286810 Ack=17201 Win=87 Len=1460 [TCP segment of a reassembled PDU]"
"489","24.109773","172.64.155.249","192.168.0.183","TLSv1.2","872","Application Data"
"490","24.109773","172.64.155.249","192.168.0.183","TCP","1514","443  >  51124 [ACK] Seq=289088 Ack=17201 Win=87 Len=1460 [TCP segment of a reassembled PDU]"
"491","24.109773","172.64.155.249","192.168.0.183","TCP","1514","443  >  51124 [ACK] Seq=290548 Ack=17201 Win=87 Len=1460 [TCP segment of a reassembled PDU]"
"492","24.109773","172.64.155.249","192.168.0.183","TLSv1.2","792","Application Data"
"493","24.109773","172.64.155.249","192.168.0.183","TLSv1.2","96","Application Data"
"494","24.109773","172.64.155.249","192.168.0.183","TLSv1.2","85","Application Data"
"495","24.109820","192.168.0.183","172.64.155.249","TCP","54","51124  >  443 [ACK] Seq=17201 Ack=292819 Win=514 Len=0"
"496","24.400427","192.168.0.183","172.64.155.249","TLSv1.2","222","Application Data"
"497","24.401402","192.168.0.183","172.64.155.249","TLSv1.2","614","Application Data"
"498","24.417102","172.64.155.249","192.168.0.183","TCP","60","443  >  51124 [ACK] Seq=292819 Ack=17929 Win=88 Len=0"
"499","24.438880","172.64.155.249","192.168.0.183","TLSv1.2","279","Application Data"
"500","24.438880","172.64.155.249","192.168.0.183","TLSv1.2","224","Application Data"
"501","24.438880","172.64.155.249","192.168.0.183","TLSv1.2","85","Application Data"
"502","24.438880","172.64.155.249","192.168.0.183","TLSv1.2","144","Application Data"
"503","24.439026","192.168.0.183","172.64.155.249","TCP","54","51124  >  443 [ACK] Seq=17929 Ack=293335 Win=512 Len=0"
"504","24.523109","192.168.0.183","172.64.155.249","TLSv1.2","489","Application Data"
"505","24.523154","192.168.0.183","172.64.155.249","TLSv1.2","540","Application Data"
"506","24.537427","172.64.155.249","192.168.0.183","TCP","60","443  >  51124 [ACK] Seq=293335 Ack=18850 Win=88 Len=0"
"507","24.563801","172.64.155.249","192.168.0.183","TLSv1.2","144","Application Data"
"508","24.563801","172.64.155.249","192.168.0.183","TLSv1.2","85","Application Data"
"509","24.563833","192.168.0.183","172.64.155.249","TCP","54","51124  >  443 [ACK] Seq=18850 Ack=293456 Win=511 Len=0"
"510","27.347754","192.168.0.183","172.64.155.249","TLSv1.2","166","Application Data"
"511","27.347817","192.168.0.183","172.64.155.249","TLSv1.2","170","Application Data"
"512","27.361675","172.64.155.249","192.168.0.183","TCP","60","443  >  51124 [ACK] Seq=293456 Ack=19078 Win=88 Len=0"
"513","27.363352","192.168.0.183","172.64.155.249","TLSv1.2","217","Application Data"
"514","27.386155","172.64.155.249","192.168.0.183","TLSv1.2","471","Application Data"
"515","27.413710","172.64.155.249","192.168.0.183","TLSv1.2","162","Application Data"
"516","27.413710","172.64.155.249","192.168.0.183","TLSv1.2","100","Application Data"
"517","27.413784","192.168.0.183","172.64.155.249","TCP","54","51124  >  443 [ACK] Seq=19241 Ack=294027 Win=509 Len=0"
"518","27.414471","192.168.0.183","172.64.155.249","TLSv1.2","89","Application Data"
"519","27.416020","172.64.155.249","192.168.0.183","TCP","1514","443  >  51124 [ACK] Seq=294027 Ack=19241 Win=89 Len=1460 [TCP segment of a reassembled PDU]"
"520","27.416020","172.64.155.249","192.168.0.183","TCP","1514","443  >  51124 [ACK] Seq=295487 Ack=19241 Win=89 Len=1460 [TCP segment of a reassembled PDU]"
"521","27.416020","172.64.155.249","192.168.0.183","TLSv1.2","966","Application Data"
"522","27.416020","172.64.155.249","192.168.0.183","TCP","1514","443  >  51124 [ACK] Seq=297859 Ack=19241 Win=89 Len=1460 [TCP segment of a reassembled PDU]"
"523","27.416020","172.64.155.249","192.168.0.183","TCP","1514","443  >  51124 [ACK] Seq=299319 Ack=19241 Win=89 Len=1460 [TCP segment of a reassembled PDU]"
"524","27.416116","192.168.0.183","172.64.155.249","TCP","54","51124  >  443 [ACK] Seq=19276 Ack=300779 Win=514 Len=0"
"525","27.416730","172.64.155.249","192.168.0.183","TCP","1514","443  >  51124 [ACK] Seq=300779 Ack=19241 Win=89 Len=1460 [TCP segment of a reassembled PDU]"
"526","27.416730","172.64.155.249","192.168.0.183","TCP","1514","443  >  51124 [ACK] Seq=302239 Ack=19241 Win=89 Len=1460 [TCP segment of a reassembled PDU]"
"527","27.416730","172.64.155.249","192.168.0.183","TLSv1.2","166","Application Data"
"528","27.416775","192.168.0.183","172.64.155.249","TCP","54","51124  >  443 [ACK] Seq=19276 Ack=303811 Win=514 Len=0"
"529","27.423490","172.64.155.249","192.168.0.183","TCP","1514","443  >  51124 [ACK] Seq=303811 Ack=19241 Win=89 Len=1460 [TCP segment of a reassembled PDU]"
"530","27.423490","172.64.155.249","192.168.0.183","TLSv1.2","756","Application Data"
"531","27.423557","192.168.0.183","172.64.155.249","TCP","54","51124  >  443 [ACK] Seq=19276 Ack=305973 Win=514 Len=0"
"532","27.425604","172.64.155.249","192.168.0.183","TCP","1514","443  >  51124 [ACK] Seq=305973 Ack=19241 Win=89 Len=1460 [TCP segment of a reassembled PDU]"
"533","27.425604","172.64.155.249","192.168.0.183","TLSv1.2","609","Application Data"
"534","27.425604","172.64.155.249","192.168.0.183","TCP","1514","443  >  51124 [ACK] Seq=307988 Ack=19241 Win=89 Len=1460 [TCP segment of a reassembled PDU]"
"535","27.425604","172.64.155.249","192.168.0.183","TLSv1.2","1046","Application Data"
"536","27.425683","192.168.0.183","172.64.155.249","TCP","54","51124  >  443 [ACK] Seq=19276 Ack=310440 Win=514 Len=0"
"537","27.427996","172.64.155.249","192.168.0.183","TCP","1514","443  >  51124 [ACK] Seq=310440 Ack=19276 Win=89 Len=1460 [TCP segment of a reassembled PDU]"
"538","27.427996","172.64.155.249","192.168.0.183","TCP","1514","443  >  51124 [ACK] Seq=311900 Ack=19276 Win=89 Len=1460 [TCP segment of a reassembled PDU]"
"539","27.427996","172.64.155.249","192.168.0.183","TLSv1.2","1228","Application Data"
"540","27.428079","192.168.0.183","172.64.155.249","TCP","54","51124  >  443 [ACK] Seq=19276 Ack=314534 Win=514 Len=0"
"541","27.429805","172.64.155.249","192.168.0.183","TCP","1514","443  >  51124 [ACK] Seq=314534 Ack=19276 Win=89 Len=1460 [TCP segment of a reassembled PDU]"
"542","27.429805","172.64.155.249","192.168.0.183","TCP","1514","443  >  51124 [ACK] Seq=315994 Ack=19276 Win=89 Len=1460 [TCP segment of a reassembled PDU]"
"543","27.429805","172.64.155.249","192.168.0.183","TCP","1514","443  >  51124 [ACK] Seq=317454 Ack=19276 Win=89 Len=1460 [TCP segment of a reassembled PDU]"
"544","27.429805","172.64.155.249","192.168.0.183","TLSv1.2","170","Application Data"
"545","27.429805","172.64.155.249","192.168.0.183","TCP","1514","443  >  51124 [ACK] Seq=319030 Ack=19276 Win=89 Len=1460 [TCP segment of a reassembled PDU]"
"546","27.429805","172.64.155.249","192.168.0.183","TCP","1514","443  >  51124 [ACK] Seq=320490 Ack=19276 Win=89 Len=1460 [TCP segment of a reassembled PDU]"
"547","27.429805","172.64.155.249","192.168.0.183","TCP","1514","443  >  51124 [ACK] Seq=321950 Ack=19276 Win=89 Len=1460 [TCP segment of a reassembled PDU]"
"548","27.429805","172.64.155.249","192.168.0.183","TLSv1.2","103","Application Data"
"549","27.429899","192.168.0.183","172.64.155.249","TCP","54","51124  >  443 [ACK] Seq=19276 Ack=323459 Win=514 Len=0"
"550","27.436967","172.64.155.249","192.168.0.183","TCP","1514","443  >  51124 [ACK] Seq=323459 Ack=19276 Win=89 Len=1460 [TCP segment of a reassembled PDU]"
"551","27.436967","172.64.155.249","192.168.0.183","TCP","1514","443  >  51124 [ACK] Seq=324919 Ack=19276 Win=89 Len=1460 [TCP segment of a reassembled PDU]"
"552","27.436967","172.64.155.249","192.168.0.183","TCP","1514","443  >  51124 [ACK] Seq=326379 Ack=19276 Win=89 Len=1460 [TCP segment of a reassembled PDU]"
"553","27.436967","172.64.155.249","192.168.0.183","TCP","1514","443  >  51124 [ACK] Seq=327839 Ack=19276 Win=89 Len=1460 [TCP segment of a reassembled PDU]"
"554","27.436967","172.64.155.249","192.168.0.183","TCP","1514","443  >  51124 [ACK] Seq=329299 Ack=19276 Win=89 Len=1460 [TCP segment of a reassembled PDU]"
"555","27.436967","172.64.155.249","192.168.0.183","TLSv1.2","613","Application Data"
"556","27.437053","192.168.0.183","172.64.155.249","TCP","54","51124  >  443 [ACK] Seq=19276 Ack=331318 Win=514 Len=0"
"557","27.437300","172.64.155.249","192.168.0.183","TCP","1514","443  >  51124 [ACK] Seq=331318 Ack=19276 Win=89 Len=1460 [TCP segment of a reassembled PDU]"
"558","27.437300","172.64.155.249","192.168.0.183","TCP","1514","443  >  51124 [ACK] Seq=332778 Ack=19276 Win=89 Len=1460 [TCP segment of a reassembled PDU]"
"559","27.437300","172.64.155.249","192.168.0.183","TCP","1514","443  >  51124 [ACK] Seq=334238 Ack=19276 Win=89 Len=1460 [TCP segment of a reassembled PDU]"
"560","27.437300","172.64.155.249","192.168.0.183","TCP","1514","443  >  51124 [ACK] Seq=335698 Ack=19276 Win=89 Len=1460 [TCP segment of a reassembled PDU]"
"561","27.437300","172.64.155.249","192.168.0.183","TCP","1514","443  >  51124 [ACK] Seq=337158 Ack=19276 Win=89 Len=1460 [TCP segment of a reassembled PDU]"
"562","27.437300","172.64.155.249","192.168.0.183","TLSv1.2","876","Application Data"
"563","27.437300","172.64.155.249","192.168.0.183","TLSv1.2","96","Application Data"
"564","27.437300","172.64.155.249","192.168.0.183","TLSv1.2","85","Application Data"
"565","27.437344","192.168.0.183","172.64.155.249","TCP","54","51124  >  443 [ACK] Seq=19276 Ack=339513 Win=514 Len=0"
"566","27.505548","192.168.0.183","172.64.155.249","TLSv1.2","215","Application Data"
"567","27.548105","172.64.155.249","192.168.0.183","TLSv1.2","471","Application Data"
"568","27.548105","172.64.155.249","192.168.0.183","TLSv1.2","203","Application Data"
"569","27.548105","172.64.155.249","192.168.0.183","TLSv1.2","85","Application Data"
"570","27.548200","192.168.0.183","172.64.155.249","TCP","54","51134  >  443 [ACK] Seq=1021 Ack=3831 Win=509 Len=0"
"571","27.549204","192.168.0.183","172.64.155.249","TLSv1.2","89","Application Data"
"572","27.605381","172.64.155.249","192.168.0.183","TCP","60","443  >  51134 [ACK] Seq=3831 Ack=1056 Win=8 Len=0"
"573","27.781540","192.168.0.183","172.64.155.249","TLSv1.2","273","Application Data"
"574","27.818124","172.64.155.249","192.168.0.183","TLSv1.2","152","Application Data"
"575","27.865977","192.168.0.183","172.64.155.249","TCP","54","51124  >  443 [ACK] Seq=19495 Ack=339611 Win=513 Len=0"
"576","28.104568","192.168.0.183","172.64.155.249","TLSv1.2","525","Application Data"
"577","28.104645","192.168.0.183","172.64.155.249","TLSv1.2","634","Application Data"
"578","28.121404","172.64.155.249","192.168.0.183","TCP","60","443  >  51124 [ACK] Seq=339611 Ack=20546 Win=90 Len=0"
"579","28.146789","172.64.155.249","192.168.0.183","TLSv1.2","164","Application Data"
"580","28.146789","172.64.155.249","192.168.0.183","TLSv1.2","85","Application Data"
"581","28.146819","192.168.0.183","172.64.155.249","TCP","54","51124  >  443 [ACK] Seq=20546 Ack=339752 Win=513 Len=0"
"582","32.668969","192.168.0.183","172.64.155.249","TLSv1.2","158","Application Data"
"583","32.724848","172.64.155.249","192.168.0.183","TCP","60","443  >  51124 [ACK] Seq=339752 Ack=20650 Win=90 Len=0"
"584","32.751360","172.64.155.249","192.168.0.183","TLSv1.2","285","Application Data"
"585","32.751360","172.64.155.249","192.168.0.183","TLSv1.2","100","Application Data"
"586","32.751402","192.168.0.183","172.64.155.249","TCP","54","51124  >  443 [ACK] Seq=20650 Ack=340029 Win=512 Len=0"
"587","32.752281","192.168.0.183","172.64.155.249","TLSv1.2","89","Application Data"
"588","32.753224","172.64.155.249","192.168.0.183","TCP","1514","443  >  51124 [ACK] Seq=340029 Ack=20650 Win=90 Len=1460 [TCP segment of a reassembled PDU]"
"589","32.753224","172.64.155.249","192.168.0.183","TCP","1514","443  >  51124 [ACK] Seq=341489 Ack=20650 Win=90 Len=1460 [TCP segment of a reassembled PDU]"
"590","32.753224","172.64.155.249","192.168.0.183","TCP","1514","443  >  51124 [ACK] Seq=342949 Ack=20650 Win=90 Len=1460 [TCP segment of a reassembled PDU]"
"591","32.753224","172.64.155.249","192.168.0.183","TCP","1514","443  >  51124 [ACK] Seq=344409 Ack=20650 Win=90 Len=1460 [TCP segment of a reassembled PDU]"
"592","32.753224","172.64.155.249","192.168.0.183","TCP","1514","443  >  51124 [ACK] Seq=345869 Ack=20650 Win=90 Len=1460 [TCP segment of a reassembled PDU]"
"593","32.753224","172.64.155.249","192.168.0.183","TLSv1.2","1160","Application Data"
"594","32.753299","192.168.0.183","172.64.155.249","TCP","54","51124  >  443 [ACK] Seq=20685 Ack=348435 Win=514 Len=0"
"595","32.762187","172.64.155.249","192.168.0.183","TCP","1514","443  >  51124 [ACK] Seq=348435 Ack=20650 Win=90 Len=1460 [TCP segment of a reassembled PDU]"
"596","32.762187","172.64.155.249","192.168.0.183","TLSv1.2","1298","Application Data"
"597","32.762187","172.64.155.249","192.168.0.183","TCP","1514","443  >  51124 [ACK] Seq=351139 Ack=20650 Win=90 Len=1460 [TCP segment of a reassembled PDU]"
"598","32.762187","172.64.155.249","192.168.0.183","TLSv1.2","231","Application Data"
"599","32.762271","192.168.0.183","172.64.155.249","TCP","54","51124  >  443 [ACK] Seq=20685 Ack=352776 Win=514 Len=0"
"600","32.764581","172.64.155.249","192.168.0.183","TCP","1514","443  >  51124 [ACK] Seq=352776 Ack=20650 Win=90 Len=1460 [TCP segment of a reassembled PDU]"
"601","32.764581","172.64.155.249","192.168.0.183","TCP","1514","443  >  51124 [ACK] Seq=354236 Ack=20650 Win=90 Len=1460 [TCP segment of a reassembled PDU]"
"602","32.764581","172.64.155.249","192.168.0.183","TCP","1514","443  >  51124 [ACK] Seq=355696 Ack=20650 Win=90 Len=1460 [TCP segment of a reassembled PDU]"
"603","32.764581","172.64.155.249","192.168.0.183","TLSv1.2","286","Application Data"
"604","32.764581","172.64.155.249","192.168.0.183","TCP","1514","443  >  51124 [ACK] Seq=357388 Ack=20650 Win=90 Len=1460 [TCP segment of a reassembled PDU]"
"605","32.764581","172.64.155.249","192.168.0.183","TCP","1514","443  >  51124 [ACK] Seq=358848 Ack=20650 Win=90 Len=1460 [TCP segment of a reassembled PDU]"
"606","32.764581","172.64.155.249","192.168.0.183","TCP","1514","443  >  51124 [ACK] Seq=360308 Ack=20650 Win=90 Len=1460 [TCP segment of a reassembled PDU]"
"607","32.764581","172.64.155.249","192.168.0.183","TLSv1.2","117","Application Data"
"608","32.764729","192.168.0.183","172.64.155.249","TCP","54","51124  >  443 [ACK] Seq=20685 Ack=361831 Win=514 Len=0"
"609","32.766201","172.64.155.249","192.168.0.183","TLSv1.2","96","Application Data"
"610","32.766201","172.64.155.249","192.168.0.183","TLSv1.2","85","Application Data"
"611","32.766201","172.64.155.249","192.168.0.183","TCP","60","443  >  51124 [ACK] Seq=361904 Ack=20685 Win=90 Len=0"
"612","32.766311","192.168.0.183","172.64.155.249","TCP","54","51124  >  443 [ACK] Seq=20685 Ack=361904 Win=513 Len=0"
"613","33.057862","192.168.0.183","172.64.155.249","TLSv1.2","184","Application Data"
"614","33.058082","192.168.0.183","172.64.155.249","TLSv1.2","178","Application Data"
"615","33.071158","172.64.155.249","192.168.0.183","TCP","60","443  >  51124 [ACK] Seq=361904 Ack=20939 Win=90 Len=0"
"616","33.094848","172.64.155.249","192.168.0.183","TLSv1.2","144","Application Data"
"617","33.103052","172.64.155.249","192.168.0.183","TLSv1.2","146","Application Data"
"618","33.103052","172.64.155.249","192.168.0.183","TLSv1.2","225","Application Data"
"619","33.103052","172.64.155.249","192.168.0.183","TLSv1.2","85","Application Data"
"620","33.103105","192.168.0.183","172.64.155.249","TCP","54","51124  >  443 [ACK] Seq=20939 Ack=362288 Win=512 Len=0"
"621","33.194375","192.168.0.183","172.64.155.249","TLSv1.2","489","Application Data"
"622","33.194438","192.168.0.183","172.64.155.249","TLSv1.2","538","Application Data"
"623","33.223170","172.64.155.249","192.168.0.183","TCP","60","443  >  51124 [ACK] Seq=362288 Ack=21858 Win=91 Len=0"
"624","33.246173","172.64.155.249","192.168.0.183","TLSv1.2","144","Application Data"
"625","33.246173","172.64.155.249","192.168.0.183","TLSv1.2","85","Application Data"
"626","33.246224","192.168.0.183","172.64.155.249","TCP","54","51124  >  443 [ACK] Seq=21858 Ack=362409 Win=511 Len=0"
