"No.","Time","Source","Destination","Protocol","Length","Info"
"1","0.000000","192.168.0.183","172.64.155.249","TLSv1.2","174","Application Data"
"2","0.000042","192.168.0.183","172.64.155.249","TLSv1.2","93","Application Data"
"3","0.014379","172.64.155.249","192.168.0.183","TCP","60","443  >  51124 [ACK] Seq=1 Ack=160 Win=153 Len=0"
"4","0.014379","172.64.155.249","192.168.0.183","TLSv1.2","93","Application Data"
"5","0.059784","192.168.0.183","172.64.155.249","TCP","54","51124  >  443 [ACK] Seq=160 Ack=40 Win=512 Len=0"
"6","0.100869","172.64.155.249","192.168.0.183","TLSv1.2","326","Application Data"
"7","0.100869","172.64.155.249","192.168.0.183","TLSv1.2","100","Application Data"
"8","0.100869","172.64.155.249","192.168.0.183","TCP","1514","443  >  51124 [ACK] Seq=358 Ack=160 Win=153 Len=1460 [TCP segment of a reassembled PDU]"
"9","0.100869","172.64.155.249","192.168.0.183","TCP","1514","443  >  51124 [ACK] Seq=1818 Ack=160 Win=153 Len=1460 [TCP segment of a reassembled PDU]"
"10","0.100869","172.64.155.249","192.168.0.183","TCP","1514","443  >  51124 [ACK] Seq=3278 Ack=160 Win=153 Len=1460 [TCP segment of a reassembled PDU]"
"11","0.100869","172.64.155.249","192.168.0.183","TLSv1.2","622","Application Data"
"12","0.100869","172.64.155.249","192.168.0.183","TCP","1514","443  >  51124 [ACK] Seq=5306 Ack=160 Win=153 Len=1460 [TCP segment of a reassembled PDU]"
"13","0.100946","192.168.0.183","172.64.155.249","TCP","54","51124  >  443 [ACK] Seq=160 Ack=6766 Win=514 Len=0"
"14","0.102363","172.64.155.249","192.168.0.183","TCP","1514","443  >  51124 [ACK] Seq=6766 Ack=160 Win=153 Len=1460 [TCP segment of a reassembled PDU]"
"15","0.102363","172.64.155.249","192.168.0.183","TLSv1.2","575","Application Data"
"16","0.102407","192.168.0.183","172.64.155.249","TCP","54","51124  >  443 [ACK] Seq=160 Ack=8747 Win=514 Len=0"
"17","0.103019","192.168.0.183","172.64.155.249","TLSv1.2","89","Application Data"
"18","0.113710","172.64.155.249","192.168.0.183","TCP","1514","443  >  51124 [ACK] Seq=8747 Ack=160 Win=153 Len=1460 [TCP segment of a reassembled PDU]"
"19","0.113710","172.64.155.249","192.168.0.183","TLSv1.2","1342","Application Data"
"20","0.113710","172.64.155.249","192.168.0.183","TCP","1514","443  >  51124 [ACK] Seq=11495 Ack=160 Win=153 Len=1460 [TCP segment of a reassembled PDU]"
"21","0.113710","172.64.155.249","192.168.0.183","TCP","1514","443  >  51124 [ACK] Seq=12955 Ack=160 Win=153 Len=1460 [TCP segment of a reassembled PDU]"
"22","0.113710","172.64.155.249","192.168.0.183","TCP","1514","443  >  51124 [ACK] Seq=14415 Ack=160 Win=153 Len=1460 [TCP segment of a reassembled PDU]"
"23","0.113710","172.64.155.249","192.168.0.183","TCP","1514","443  >  51124 [ACK] Seq=15875 Ack=160 Win=153 Len=1460 [TCP segment of a reassembled PDU]"
"24","0.113710","172.64.155.249","192.168.0.183","TLSv1.2","1189","Application Data"
"25","0.113771","192.168.0.183","172.64.155.249","TCP","54","51124  >  443 [ACK] Seq=195 Ack=18470 Win=514 Len=0"
"26","0.115344","172.64.155.249","192.168.0.183","TCP","1514","443  >  51124 [ACK] Seq=18470 Ack=160 Win=153 Len=1460 [TCP segment of a reassembled PDU]"
"27","0.115344","172.64.155.249","192.168.0.183","TCP","1514","443  >  51124 [ACK] Seq=19930 Ack=160 Win=153 Len=1460 [TCP segment of a reassembled PDU]"
"28","0.115344","172.64.155.249","192.168.0.183","TLSv1.2","1020","Application Data"
"29","0.115344","172.64.155.249","192.168.0.183","TLSv1.2","96","Application Data"
"30","0.115344","172.64.155.249","192.168.0.183","TLSv1.2","85","Application Data"
"31","0.115410","192.168.0.183","172.64.155.249","TCP","54","51124  >  443 [ACK] Seq=195 Ack=22429 Win=514 Len=0"
"32","0.158342","172.64.155.249","192.168.0.183","TCP","60","443  >  51124 [ACK] Seq=22429 Ack=195 Win=153 Len=0"
"33","0.369001","192.168.0.183","172.64.155.249","TLSv1.2","216","Application Data"
"34","0.380502","172.64.155.249","192.168.0.183","TCP","60","443  >  51124 [ACK] Seq=22429 Ack=357 Win=153 Len=0"
"35","0.404891","172.64.155.249","192.168.0.183","TLSv1.2","254","Application Data"
"36","0.447245","192.168.0.183","172.64.155.249","TCP","54","51124  >  443 [ACK] Seq=357 Ack=22629 Win=513 Len=0"
"37","0.474858","192.168.0.183","172.64.155.249","TLSv1.2","489","Application Data"
"38","0.474926","192.168.0.183","172.64.155.249","TLSv1.2","545","Application Data"
"39","0.490288","172.64.155.249","192.168.0.183","TCP","60","443  >  51124 [ACK] Seq=22629 Ack=1283 Win=154 Len=0"
"40","0.514242","172.64.155.249","192.168.0.183","TLSv1.2","321","Application Data"
"41","0.514242","172.64.155.249","192.168.0.183","TLSv1.2","85","Application Data"
"42","0.514271","192.168.0.183","172.64.155.249","TCP","54","51124  >  443 [ACK] Seq=1283 Ack=22927 Win=512 Len=0"
"43","2.891751","192.168.0.183","172.64.155.249","TLSv1.2","166","Application Data"
"44","2.891822","192.168.0.183","172.64.155.249","TLSv1.2","170","Application Data"
"45","2.899222","192.168.0.183","172.64.155.249","TLSv1.2","145","Application Data"
"46","2.907107","172.64.155.249","192.168.0.183","TCP","60","443  >  51124 [ACK] Seq=22927 Ack=1511 Win=154 Len=0"
"47","2.930699","172.64.155.249","192.168.0.183","TLSv1.2","279","Application Data"
"48","2.976515","192.168.0.183","172.64.155.249","TCP","54","51124  >  443 [ACK] Seq=1602 Ack=23152 Win=511 Len=0"
"49","3.011457","192.168.0.183","172.64.155.249","TLSv1.2","180","Application Data"
"50","3.049688","172.64.155.249","192.168.0.183","TLSv1.2","147","Application Data"
"51","3.049688","172.64.155.249","192.168.0.183","TCP","1514","443  >  51124 [ACK] Seq=23245 Ack=1728 Win=154 Len=1460 [TCP segment of a reassembled PDU]"
"52","3.049688","172.64.155.249","192.168.0.183","TLSv1.2","703","Application Data"
"53","3.049688","172.64.155.249","192.168.0.183","TLSv1.2","85","Application Data"
"54","3.049756","192.168.0.183","172.64.155.249","TCP","54","51124  >  443 [ACK] Seq=1728 Ack=25385 Win=514 Len=0"
"55","3.112306","172.64.155.249","192.168.0.183","TLSv1.2","169","Application Data"
"56","3.112306","172.64.155.249","192.168.0.183","TLSv1.2","100","Application Data"
"57","3.112306","172.64.155.249","192.168.0.183","TLSv1.2","1323","Application Data"
"58","3.112306","172.64.155.249","192.168.0.183","TCP","1514","443  >  51124 [ACK] Seq=26815 Ack=1728 Win=154 Len=1460 [TCP segment of a reassembled PDU]"
"59","3.112306","172.64.155.249","192.168.0.183","TCP","1514","443  >  51124 [ACK] Seq=28275 Ack=1728 Win=154 Len=1460 [TCP segment of a reassembled PDU]"
"60","3.112306","172.64.155.249","192.168.0.183","TLSv1.2","948","Application Data"
"61","3.112306","172.64.155.249","192.168.0.183","TCP","1514","443  >  51124 [ACK] Seq=30629 Ack=1728 Win=154 Len=1460 [TCP segment of a reassembled PDU]"
"62","3.112306","172.64.155.249","192.168.0.183","TCP","1514","443  >  51124 [ACK] Seq=32089 Ack=1728 Win=154 Len=1460 [TCP segment of a reassembled PDU]"
"63","3.112306","172.64.155.249","192.168.0.183","TLSv1.2","583","Application Data"
"64","3.112371","192.168.0.183","172.64.155.249","TCP","54","51124  >  443 [ACK] Seq=1728 Ack=34078 Win=514 Len=0"
"65","3.114362","172.64.155.249","192.168.0.183","TCP","1514","443  >  51124 [ACK] Seq=34078 Ack=1728 Win=154 Len=1460 [TCP segment of a reassembled PDU]"
"66","3.114362","172.64.155.249","192.168.0.183","TLSv1.2","1118","Application Data"
"67","3.114362","172.64.155.249","192.168.0.183","TCP","1514","443  >  51124 [ACK] Seq=36602 Ack=1728 Win=154 Len=1460 [TCP segment of a reassembled PDU]"
"68","3.114362","172.64.155.249","192.168.0.183","TLSv1.2","229","Application Data"
"69","3.114362","172.64.155.249","192.168.0.183","TCP","1514","443  >  51124 [ACK] Seq=38237 Ack=1728 Win=154 Len=1460 [TCP segment of a reassembled PDU]"
"70","3.114362","172.64.155.249","192.168.0.183","TCP","1514","443  >  51124 [ACK] Seq=39697 Ack=1728 Win=154 Len=1460 [TCP segment of a reassembled PDU]"
"71","3.114432","192.168.0.183","172.64.155.249","TCP","54","51124  >  443 [ACK] Seq=1728 Ack=41157 Win=514 Len=0"
"72","3.115840","172.64.155.249","192.168.0.183","TCP","1514","443  >  51124 [ACK] Seq=41157 Ack=1728 Win=154 Len=1460 [TCP segment of a reassembled PDU]"
"73","3.115840","172.64.155.249","192.168.0.183","TLSv1.2","356","Application Data"
"74","3.115929","192.168.0.183","172.64.155.249","TCP","54","51124  >  443 [ACK] Seq=1728 Ack=42919 Win=514 Len=0"
"75","3.117800","172.64.155.249","192.168.0.183","TCP","1514","443  >  51124 [ACK] Seq=42919 Ack=1728 Win=154 Len=1460 [TCP segment of a reassembled PDU]"
"76","3.117800","172.64.155.249","192.168.0.183","TCP","1514","443  >  51124 [ACK] Seq=44379 Ack=1728 Win=154 Len=1460 [TCP segment of a reassembled PDU]"
"77","3.117800","172.64.155.249","192.168.0.183","TCP","1514","443  >  51124 [ACK] Seq=45839 Ack=1728 Win=154 Len=1460 [TCP segment of a reassembled PDU]"
"78","3.117800","172.64.155.249","192.168.0.183","TCP","1514","443  >  51124 [ACK] Seq=47299 Ack=1728 Win=154 Len=1460 [TCP segment of a reassembled PDU]"
"79","3.117800","172.64.155.249","192.168.0.183","TCP","1514","443  >  51124 [ACK] Seq=48759 Ack=1728 Win=154 Len=1460 [TCP segment of a reassembled PDU]"
"80","3.117800","172.64.155.249","192.168.0.183","TCP","1514","443  >  51124 [PSH, ACK] Seq=50219 Ack=1728 Win=154 Len=1460 [TCP segment of a reassembled PDU]"
"81","3.117800","172.64.155.249","192.168.0.183","TLSv1.2","180","Application Data"
"82","3.117800","172.64.155.249","192.168.0.183","TCP","1514","443  >  51124 [ACK] Seq=51805 Ack=1728 Win=154 Len=1460 [TCP segment of a reassembled PDU]"
"83","3.117800","172.64.155.249","192.168.0.183","TCP","1514","443  >  51124 [ACK] Seq=53265 Ack=1728 Win=154 Len=1460 [TCP segment of a reassembled PDU]"
"84","3.117800","172.64.155.249","192.168.0.183","TCP","1514","443  >  51124 [ACK] Seq=54725 Ack=1728 Win=154 Len=1460 [TCP segment of a reassembled PDU]"
"85","3.117800","172.64.155.249","192.168.0.183","TCP","1514","443  >  51124 [ACK] Seq=56185 Ack=1728 Win=154 Len=1460 [TCP segment of a reassembled PDU]"
"86","3.117800","172.64.155.249","192.168.0.183","TCP","1514","443  >  51124 [ACK] Seq=57645 Ack=1728 Win=154 Len=1460 [TCP segment of a reassembled PDU]"
"87","3.117800","172.64.155.249","192.168.0.183","TLSv1.2","107","Application Data"
"88","3.117800","172.64.155.249","192.168.0.183","TLSv1.2","1139","Application Data"
"89","3.117800","172.64.155.249","192.168.0.183","TLSv1.2","127","Application Data, Application Data"
"90","3.117962","192.168.0.183","172.64.155.249","TCP","54","51124  >  443 [ACK] Seq=1728 Ack=60316 Win=514 Len=0"
"91","3.189510","192.168.0.183","172.64.155.249","TLSv1.2","183","Application Data"
"92","3.189566","192.168.0.183","172.64.155.249","TLSv1.2","93","Application Data"
"93","3.203181","172.64.155.249","192.168.0.183","TCP","60","443  >  51134 [ACK] Seq=1 Ack=169 Win=8 Len=0"
"94","3.203181","172.64.155.249","192.168.0.183","TLSv1.2","93","Application Data"
"95","3.235951","172.64.155.249","192.168.0.183","TLSv1.2","471","Application Data"
"96","3.235951","172.64.155.249","192.168.0.183","TLSv1.2","203","Application Data"
"97","3.235951","172.64.155.249","192.168.0.183","TLSv1.2","85","Application Data"
"98","3.235989","192.168.0.183","172.64.155.249","TCP","54","51134  >  443 [ACK] Seq=169 Ack=637 Win=509 Len=0"
"99","3.236604","192.168.0.183","172.64.155.249","TLSv1.2","89","Application Data"
"100","3.289966","172.64.155.249","192.168.0.183","TCP","60","443  >  51134 [ACK] Seq=637 Ack=204 Win=8 Len=0"
"101","3.546649","192.168.0.183","172.64.155.249","TLSv1.2","533","Application Data"
"102","3.546745","192.168.0.183","172.64.155.249","TLSv1.2","547","Application Data"
"103","3.561080","172.64.155.249","192.168.0.183","TCP","60","443  >  51124 [ACK] Seq=60316 Ack=2700 Win=155 Len=0"
"104","3.586604","172.64.155.249","192.168.0.183","TLSv1.2","255","Application Data"
"105","3.586604","172.64.155.249","192.168.0.183","TLSv1.2","85","Application Data"
"106","3.586648","192.168.0.183","172.64.155.249","TCP","54","51124  >  443 [ACK] Seq=2700 Ack=60548 Win=513 Len=0"
"107","4.910864","192.168.0.183","172.64.155.249","TLSv1.2","774","Application Data"
"108","4.910976","192.168.0.183","172.64.155.249","TLSv1.2","587","Application Data"
"109","4.925721","172.64.155.249","192.168.0.183","TCP","60","443  >  51124 [ACK] Seq=60548 Ack=3953 Win=155 Len=0"
"110","4.938723","192.168.0.183","172.64.155.249","TLSv1.2","429","Application Data"
"111","4.948589","172.64.155.249","192.168.0.183","TLSv1.2","278","Application Data"
"112","4.948589","172.64.155.249","192.168.0.183","TLSv1.2","85","Application Data"
"113","4.948685","192.168.0.183","172.64.155.249","TCP","54","51124  >  443 [ACK] Seq=4328 Ack=60803 Win=512 Len=0"
"114","4.986250","172.64.155.249","192.168.0.183","TLSv1.2","150","Application Data"
"115","4.986250","172.64.155.249","192.168.0.183","TLSv1.2","100","Application Data"
"116","4.986250","172.64.155.249","192.168.0.183","TLSv1.2","1308","Application Data"
"117","4.986298","192.168.0.183","172.64.155.249","TCP","54","51124  >  443 [ACK] Seq=4328 Ack=62199 Win=514 Len=0"
"118","4.988321","172.64.155.249","192.168.0.183","TCP","1514","443  >  51124 [ACK] Seq=62199 Ack=4328 Win=156 Len=1460 [TCP segment of a reassembled PDU]"
"119","4.988321","172.64.155.249","192.168.0.183","TCP","1514","443  >  51124 [ACK] Seq=63659 Ack=4328 Win=156 Len=1460 [TCP segment of a reassembled PDU]"
"120","4.988321","172.64.155.249","192.168.0.183","TCP","1514","443  >  51124 [ACK] Seq=65119 Ack=4328 Win=156 Len=1460 [TCP segment of a reassembled PDU]"
"121","4.988321","172.64.155.249","192.168.0.183","TLSv1.2","683","Application Data"
"122","4.988321","172.64.155.249","192.168.0.183","TCP","1514","443  >  51124 [ACK] Seq=67208 Ack=4328 Win=156 Len=1460 [TCP segment of a reassembled PDU]"
"123","4.988321","172.64.155.249","192.168.0.183","TCP","1514","443  >  51124 [ACK] Seq=68668 Ack=4328 Win=156 Len=1460 [TCP segment of a reassembled PDU]"
"124","4.988321","172.64.155.249","192.168.0.183","TLSv1.2","897","Application Data"
"125","4.988388","192.168.0.183","172.64.155.249","TCP","54","51124  >  443 [ACK] Seq=4328 Ack=70971 Win=514 Len=0"
"126","4.998202","172.64.155.249","192.168.0.183","TCP","1514","443  >  51124 [ACK] Seq=70971 Ack=4328 Win=156 Len=1460 [TCP segment of a reassembled PDU]"
"127","4.998202","172.64.155.249","192.168.0.183","TLSv1.2","1342","Application Data"
"128","4.998202","172.64.155.249","192.168.0.183","TCP","1514","443  >  51124 [ACK] Seq=73719 Ack=4328 Win=156 Len=1460 [TCP segment of a reassembled PDU]"
"129","4.998202","172.64.155.249","192.168.0.183","TLSv1.2","1075","Application Data"
"130","4.998319","192.168.0.183","172.64.155.249","TCP","54","51124  >  443 [ACK] Seq=4328 Ack=76200 Win=514 Len=0"
"131","5.002698","172.64.155.249","192.168.0.183","TCP","1514","443  >  51124 [ACK] Seq=76200 Ack=4328 Win=156 Len=1460 [TCP segment of a reassembled PDU]"
"132","5.002698","172.64.155.249","192.168.0.183","TCP","1514","443  >  51124 [ACK] Seq=77660 Ack=4328 Win=156 Len=1460 [TCP segment of a reassembled PDU]"
"133","5.002698","172.64.155.249","192.168.0.183","TCP","1514","443  >  51124 [ACK] Seq=79120 Ack=4328 Win=156 Len=1460 [TCP segment of a reassembled PDU]"
"134","5.002698","172.64.155.249","192.168.0.183","TCP","1514","443  >  51124 [ACK] Seq=80580 Ack=4328 Win=156 Len=1460 [TCP segment of a reassembled PDU]"
"135","5.002698","172.64.155.249","192.168.0.183","TCP","1514","443  >  51124 [ACK] Seq=82040 Ack=4328 Win=156 Len=1460 [TCP segment of a reassembled PDU]"
"136","5.002698","172.64.155.249","192.168.0.183","TCP","1514","443  >  51124 [PSH, ACK] Seq=83500 Ack=4328 Win=156 Len=1460 [TCP segment of a reassembled PDU]"
"137","5.002698","172.64.155.249","192.168.0.183","TCP","1514","443  >  51124 [ACK] Seq=84960 Ack=4328 Win=156 Len=1460 [TCP segment of a reassembled PDU]"
"138","5.002698","172.64.155.249","192.168.0.183","TCP","1514","443  >  51124 [ACK] Seq=86420 Ack=4328 Win=156 Len=1460 [TCP segment of a reassembled PDU]"
"139","5.002698","172.64.155.249","192.168.0.183","TCP","1514","443  >  51124 [ACK] Seq=87880 Ack=4328 Win=156 Len=1460 [TCP segment of a reassembled PDU]"
"140","5.002698","172.64.155.249","192.168.0.183","TCP","1514","443  >  51124 [ACK] Seq=89340 Ack=4328 Win=156 Len=1460 [TCP segment of a reassembled PDU]"
"141","5.002698","172.64.155.249","192.168.0.183","TCP","1514","443  >  51124 [ACK] Seq=90800 Ack=4328 Win=156 Len=1460 [TCP segment of a reassembled PDU]"
"142","5.002698","172.64.155.249","192.168.0.183","TLSv1.2","400","Application Data"
"143","5.002698","172.64.155.249","192.168.0.183","TLSv1.2","977","Application Data"
"144","5.002798","192.168.0.183","172.64.155.249","TCP","54","51124  >  443 [ACK] Seq=4328 Ack=93529 Win=514 Len=0"
"145","5.007745","172.64.155.249","192.168.0.183","TCP","1514","443  >  51124 [ACK] Seq=93529 Ack=4328 Win=156 Len=1460 [TCP segment of a reassembled PDU]"
"146","5.007745","172.64.155.249","192.168.0.183","TCP","1514","443  >  51124 [ACK] Seq=94989 Ack=4328 Win=156 Len=1460 [TCP segment of a reassembled PDU]"
"147","5.007745","172.64.155.249","192.168.0.183","TCP","1514","443  >  51124 [ACK] Seq=96449 Ack=4328 Win=156 Len=1460 [TCP segment of a reassembled PDU]"
"148","5.007745","172.64.155.249","192.168.0.183","TLSv1.2","159","Application Data"
"149","5.007745","172.64.155.249","192.168.0.183","TCP","1514","443  >  51124 [ACK] Seq=98014 Ack=4328 Win=156 Len=1460 [TCP segment of a reassembled PDU]"
"150","5.007745","172.64.155.249","192.168.0.183","TLSv1.2","839","Application Data"
"151","5.007745","172.64.155.249","192.168.0.183","TLSv1.2","96","Application Data"
"152","5.007745","172.64.155.249","192.168.0.183","TLSv1.2","85","Application Data"
"153","5.007906","192.168.0.183","172.64.155.249","TCP","54","51124  >  443 [ACK] Seq=4328 Ack=100332 Win=514 Len=0"
"154","5.110289","192.168.0.183","172.64.155.249","TLSv1.2","211","Application Data"
"155","5.123333","172.64.155.249","192.168.0.183","TCP","60","443  >  51134 [ACK] Seq=637 Ack=361 Win=8 Len=0"
"156","5.171269","172.64.155.249","192.168.0.183","TLSv1.2","669","Application Data"
"157","5.171269","172.64.155.249","192.168.0.183","TLSv1.2","203","Application Data"
"158","5.171269","172.64.155.249","192.168.0.183","TLSv1.2","85","Application Data"
"159","5.171371","192.168.0.183","172.64.155.249","TCP","54","51134  >  443 [ACK] Seq=361 Ack=1432 Win=514 Len=0"
"160","5.317039","192.168.0.183","172.64.155.249","TLSv1.2","299","Application Data"
"161","5.358261","172.64.155.249","192.168.0.183","TLSv1.2","278","Application Data"
"162","5.403263","192.168.0.183","172.64.155.249","TCP","54","51124  >  443 [ACK] Seq=4573 Ack=100556 Win=513 Len=0"
"163","5.737786","192.168.0.183","172.64.155.249","TLSv1.2","528","Application Data"
"164","5.737872","192.168.0.183","172.64.155.249","TLSv1.2","636","Application Data"
"165","5.751831","172.64.155.249","192.168.0.183","TCP","60","443  >  51124 [ACK] Seq=100556 Ack=5629 Win=157 Len=0"
"166","5.774870","172.64.155.249","192.168.0.183","TLSv1.2","144","Application Data"
"167","5.774870","172.64.155.249","192.168.0.183","TLSv1.2","85","Application Data"
"168","5.774897","192.168.0.183","172.64.155.249","TCP","54","51124  >  443 [ACK] Seq=5629 Ack=100677 Win=512 Len=0"
"169","7.679147","192.168.0.183","172.64.155.249","TLSv1.2","163","Application Data"
"170","7.733757","172.64.155.249","192.168.0.183","TCP","60","443  >  51124 [ACK] Seq=100677 Ack=5738 Win=157 Len=0"
"171","7.747548","172.64.155.249","192.168.0.183","TLSv1.2","305","Application Data"
"172","7.747548","172.64.155.249","192.168.0.183","TLSv1.2","100","Application Data"
"173","7.747548","172.64.155.249","192.168.0.183","TLSv1.2","1269","Application Data"
"174","7.747696","192.168.0.183","172.64.155.249","TCP","54","51124  >  443 [ACK] Seq=5738 Ack=102189 Win=514 Len=0"
"175","7.749495","192.168.0.183","172.64.155.249","TLSv1.2","89","Application Data"
"176","7.751950","172.64.155.249","192.168.0.183","TCP","1514","443  >  51124 [ACK] Seq=102189 Ack=5738 Win=157 Len=1460 [TCP segment of a reassembled PDU]"
"177","7.751950","172.64.155.249","192.168.0.183","TCP","1514","443  >  51124 [ACK] Seq=103649 Ack=5738 Win=157 Len=1460 [TCP segment of a reassembled PDU]"
"178","7.751950","172.64.155.249","192.168.0.183","TCP","1514","443  >  51124 [ACK] Seq=105109 Ack=5738 Win=157 Len=1460 [TCP segment of a reassembled PDU]"
"179","7.751950","172.64.155.249","192.168.0.183","TCP","1514","443  >  51124 [ACK] Seq=106569 Ack=5738 Win=157 Len=1460 [TCP segment of a reassembled PDU]"
"180","7.751950","172.64.155.249","192.168.0.183","TLSv1.2","1446","Application Data"
"181","7.752019","192.168.0.183","172.64.155.249","TCP","54","51124  >  443 [ACK] Seq=5773 Ack=109421 Win=514 Len=0"
"182","7.766847","172.64.155.249","192.168.0.183","TCP","1514","443  >  51124 [ACK] Seq=109421 Ack=5738 Win=157 Len=1460 [TCP segment of a reassembled PDU]"
"183","7.766847","172.64.155.249","192.168.0.183","TLSv1.2","1333","Application Data"
"184","7.766847","172.64.155.249","192.168.0.183","TCP","1514","443  >  51124 [ACK] Seq=112160 Ack=5738 Win=157 Len=1460 [TCP segment of a reassembled PDU]"
"185","7.766847","172.64.155.249","192.168.0.183","TLSv1.2","1080","Application Data"
"186","7.766847","172.64.155.249","192.168.0.183","TLSv1.2","380","Application Data"
"187","7.766847","172.64.155.249","192.168.0.183","TCP","1514","443  >  51124 [ACK] Seq=114972 Ack=5738 Win=157 Len=1460 [TCP segment of a reassembled PDU]"
"188","7.766847","172.64.155.249","192.168.0.183","TCP","1514","443  >  51124 [ACK] Seq=116432 Ack=5738 Win=157 Len=1460 [TCP segment of a reassembled PDU]"
"189","7.766847","172.64.155.249","192.168.0.183","TCP","1514","443  >  51124 [ACK] Seq=117892 Ack=5738 Win=157 Len=1460 [TCP segment of a reassembled PDU]"
"190","7.766847","172.64.155.249","192.168.0.183","TCP","1514","443  >  51124 [ACK] Seq=119352 Ack=5738 Win=157 Len=1460 [TCP segment of a reassembled PDU]"
"191","7.766847","172.64.155.249","192.168.0.183","TLSv1.2","939","Application Data"
"192","7.766847","172.64.155.249","192.168.0.183","TCP","60","443  >  51124 [ACK] Seq=121697 Ack=5773 Win=157 Len=0"
"193","7.766847","172.64.155.249","192.168.0.183","TCP","1514","443  >  51124 [ACK] Seq=121697 Ack=5773 Win=157 Len=1460 [TCP segment of a reassembled PDU]"
"194","7.766847","172.64.155.249","192.168.0.183","TCP","1514","443  >  51124 [ACK] Seq=123157 Ack=5773 Win=157 Len=1460 [TCP segment of a reassembled PDU]"
"195","7.766847","172.64.155.249","192.168.0.183","TLSv1.2","1018","Application Data"
"196","7.766847","172.64.155.249","192.168.0.183","TLSv1.2","96","Application Data"
"197","7.766847","172.64.155.249","192.168.0.183","TLSv1.2","85","Application Data"
"198","7.767007","192.168.0.183","172.64.155.249","TCP","54","51124  >  443 [ACK] Seq=5773 Ack=121697 Win=514 Len=0"
"199","7.767191","192.168.0.183","172.64.155.249","TCP","54","51124  >  443 [ACK] Seq=5773 Ack=125654 Win=514 Len=0"
"200","8.041097","192.168.0.183","172.64.155.249","TLSv1.2","192","Application Data"
"201","8.041323","192.168.0.183","172.64.155.249","TLSv1.2","178","Application Data"
"202","8.054871","172.64.155.249","192.168.0.183","TCP","60","443  >  51124 [ACK] Seq=125654 Ack=6035 Win=157 Len=0"
"203","8.080563","172.64.155.249","192.168.0.183","TLSv1.2","187","Application Data"
"204","8.093726","172.64.155.249","192.168.0.183","TLSv1.2","158","Application Data"
"205","8.093791","192.168.0.183","172.64.155.249","TCP","54","51124  >  443 [ACK] Seq=6035 Ack=125891 Win=513 Len=0"
"206","8.095742","172.64.155.249","192.168.0.183","TLSv1.2","227","Application Data"
"207","8.095742","172.64.155.249","192.168.0.183","TLSv1.2","85","Application Data"
"208","8.095869","192.168.0.183","172.64.155.249","TCP","54","51124  >  443 [ACK] Seq=6035 Ack=126095 Win=512 Len=0"
"209","8.174928","192.168.0.183","172.64.155.249","TLSv1.2","492","Application Data"
"210","8.174997","192.168.0.183","172.64.155.249","TLSv1.2","547","Application Data"
"211","8.190359","172.64.155.249","192.168.0.183","TCP","60","443  >  51124 [ACK] Seq=126095 Ack=6966 Win=158 Len=0"
"212","8.210884","172.64.155.249","192.168.0.183","TLSv1.2","277","Application Data"
"213","8.210884","172.64.155.249","192.168.0.183","TLSv1.2","85","Application Data"
"214","8.210925","192.168.0.183","172.64.155.249","TCP","54","51124  >  443 [ACK] Seq=6966 Ack=126349 Win=511 Len=0"
"215","12.297757","192.168.0.183","172.64.155.249","TLSv1.2","175","Application Data"
"216","12.337489","172.64.155.249","192.168.0.183","TLSv1.2","437","Application Data"
"217","12.337489","172.64.155.249","192.168.0.183","TCP","1514","443  >  51124 [ACK] Seq=126732 Ack=7087 Win=158 Len=1460 [TCP segment of a reassembled PDU]"
"218","12.337489","172.64.155.249","192.168.0.183","TLSv1.2","754","Application Data"
"219","12.337489","172.64.155.249","192.168.0.183","TLSv1.2","85","Application Data"
"220","12.337540","192.168.0.183","172.64.155.249","TCP","54","51124  >  443 [ACK] Seq=7087 Ack=128923 Win=514 Len=0"
"221","12.445757","192.168.0.183","172.64.155.249","TLSv1.2","166","Application Data"
"222","12.445864","192.168.0.183","172.64.155.249","TLSv1.2","170","Application Data"
"223","12.459404","192.168.0.183","172.64.155.249","TLSv1.2","147","Application Data"
"224","12.459437","172.64.155.249","192.168.0.183","TCP","60","443  >  51124 [ACK] Seq=128923 Ack=7315 Win=158 Len=0"
"225","12.485534","172.64.155.249","192.168.0.183","TLSv1.2","165","Application Data"
"226","12.526425","192.168.0.183","172.64.155.249","TCP","54","51124  >  443 [ACK] Seq=7408 Ack=129034 Win=513 Len=0"
"227","12.639293","172.64.155.249","192.168.0.183","TLSv1.2","146","Application Data"
"228","12.639293","172.64.155.249","192.168.0.183","TLSv1.2","100","Application Data"
"229","12.639293","172.64.155.249","192.168.0.183","TLSv1.2","1321","Application Data"
"230","12.639293","172.64.155.249","192.168.0.183","TCP","1514","443  >  51124 [ACK] Seq=130439 Ack=7408 Win=158 Len=1460 [TCP segment of a reassembled PDU]"
"231","12.639293","172.64.155.249","192.168.0.183","TCP","1514","443  >  51124 [ACK] Seq=131899 Ack=7408 Win=158 Len=1460 [TCP segment of a reassembled PDU]"
"232","12.639293","172.64.155.249","192.168.0.183","TCP","1514","443  >  51124 [ACK] Seq=133359 Ack=7408 Win=158 Len=1460 [TCP segment of a reassembled PDU]"
"233","12.639293","172.64.155.249","192.168.0.183","TLSv1.2","609","Application Data"
"234","12.639347","192.168.0.183","172.64.155.249","TCP","54","51124  >  443 [ACK] Seq=7408 Ack=135374 Win=514 Len=0"
"235","12.641451","172.64.155.249","192.168.0.183","TCP","1514","443  >  51124 [ACK] Seq=135374 Ack=7408 Win=158 Len=1460 [TCP segment of a reassembled PDU]"
"236","12.641451","172.64.155.249","192.168.0.183","TCP","1514","443  >  51124 [ACK] Seq=136834 Ack=7408 Win=158 Len=1460 [TCP segment of a reassembled PDU]"
"237","12.641451","172.64.155.249","192.168.0.183","TCP","1514","443  >  51124 [ACK] Seq=138294 Ack=7408 Win=158 Len=1460 [TCP segment of a reassembled PDU]"
"238","12.641451","172.64.155.249","192.168.0.183","TLSv1.2","468","Application Data"
"239","12.641542","192.168.0.183","172.64.155.249","TCP","54","51124  >  443 [ACK] Seq=7408 Ack=140168 Win=514 Len=0"
"240","12.655170","172.64.155.249","192.168.0.183","TCP","1514","443  >  51124 [ACK] Seq=140168 Ack=7408 Win=158 Len=1460 [TCP segment of a reassembled PDU]"
"241","12.655170","172.64.155.249","192.168.0.183","TLSv1.2","275","Application Data"
"242","12.655268","192.168.0.183","172.64.155.249","TCP","54","51124  >  443 [ACK] Seq=7408 Ack=141849 Win=514 Len=0"
"243","12.656628","172.64.155.249","192.168.0.183","TCP","1514","443  >  51124 [ACK] Seq=141849 Ack=7408 Win=158 Len=1460 [TCP segment of a reassembled PDU]"
"244","12.656628","172.64.155.249","192.168.0.183","TCP","1514","443  >  51124 [ACK] Seq=143309 Ack=7408 Win=158 Len=1460 [TCP segment of a reassembled PDU]"
"245","12.656628","172.64.155.249","192.168.0.183","TCP","1514","443  >  51124 [ACK] Seq=144769 Ack=7408 Win=158 Len=1460 [TCP segment of a reassembled PDU]"
"246","12.656628","172.64.155.249","192.168.0.183","TCP","1514","443  >  51124 [ACK] Seq=146229 Ack=7408 Win=158 Len=1460 [TCP segment of a reassembled PDU]"
"247","12.656628","172.64.155.249","192.168.0.183","TCP","1514","443  >  51124 [ACK] Seq=147689 Ack=7408 Win=158 Len=1460 [TCP segment of a reassembled PDU]"
"248","12.656628","172.64.155.249","192.168.0.183","TCP","1514","443  >  51124 [PSH, ACK] Seq=149149 Ack=7408 Win=158 Len=1460 [TCP segment of a reassembled PDU]"
"249","12.656628","172.64.155.249","192.168.0.183","TCP","1514","443  >  51124 [ACK] Seq=150609 Ack=7408 Win=158 Len=1460 [TCP segment of a reassembled PDU]"
"250","12.656628","172.64.155.249","192.168.0.183","TCP","1514","443  >  51124 [ACK] Seq=152069 Ack=7408 Win=158 Len=1460 [TCP segment of a reassembled PDU]"
"251","12.656628","172.64.155.249","192.168.0.183","TCP","1514","443  >  51124 [ACK] Seq=153529 Ack=7408 Win=158 Len=1460 [TCP segment of a reassembled PDU]"
"252","12.656628","172.64.155.249","192.168.0.183","TLSv1.2","795","Application Data"
"253","12.656628","172.64.155.249","192.168.0.183","TCP","1514","443  >  51124 [ACK] Seq=155730 Ack=7408 Win=158 Len=1460 [TCP segment of a reassembled PDU]"
"254","12.656628","172.64.155.249","192.168.0.183","TCP","1514","443  >  51124 [ACK] Seq=157190 Ack=7408 Win=158 Len=1460 [TCP segment of a reassembled PDU]"
"255","12.656628","172.64.155.249","192.168.0.183","TCP","1514","443  >  51124 [ACK] Seq=158650 Ack=7408 Win=158 Len=1460 [TCP segment of a reassembled PDU]"
"256","12.656628","172.64.155.249","192.168.0.183","TCP","1514","443  >  51124 [ACK] Seq=160110 Ack=7408 Win=158 Len=1460 [TCP segment of a reassembled PDU]"
"257","12.656628","172.64.155.249","192.168.0.183","TLSv1.2","382","Application Data"
"258","12.656773","192.168.0.183","172.64.155.249","TCP","54","51124  >  443 [ACK] Seq=7408 Ack=161898 Win=514 Len=0"
"259","12.661469","172.64.155.249","192.168.0.183","TCP","1514","443  >  51124 [ACK] Seq=161898 Ack=7408 Win=158 Len=1460 [TCP segment of a reassembled PDU]"
"260","12.661469","172.64.155.249","192.168.0.183","TLSv1.2","1287","Application Data"
"261","12.661469","172.64.155.249","192.168.0.183","TLSv1.2","96","Application Data"
"262","12.661469","172.64.155.249","192.168.0.183","TLSv1.2","85","Application Data"
"263","12.661685","192.168.0.183","172.64.155.249","TCP","54","51124  >  443 [ACK] Seq=7408 Ack=164664 Win=514 Len=0"
"264","12.734732","192.168.0.183","172.64.155.249","TLSv1.2","184","Application Data"
"265","12.752687","172.64.155.249","192.168.0.183","TCP","60","443  >  51134 [ACK] Seq=1432 Ack=491 Win=8 Len=0"
"266","12.776738","172.64.155.249","192.168.0.183","TLSv1.2","474","Application Data"
"267","12.776738","172.64.155.249","192.168.0.183","TLSv1.2","203","Application Data"
"268","12.776738","172.64.155.249","192.168.0.183","TLSv1.2","85","Application Data"
"269","12.776831","192.168.0.183","172.64.155.249","TCP","54","51134  >  443 [ACK] Seq=491 Ack=2032 Win=511 Len=0"
"270","12.777771","192.168.0.183","172.64.155.249","TLSv1.2","89","Application Data"
"271","12.832397","172.64.155.249","192.168.0.183","TCP","60","443  >  51134 [ACK] Seq=2032 Ack=526 Win=8 Len=0"
"272","13.109409","192.168.0.183","172.64.155.249","TLSv1.2","535","Application Data"
"273","13.109480","192.168.0.183","172.64.155.249","TLSv1.2","550","Application Data"
"274","13.124451","172.64.155.249","192.168.0.183","TCP","60","443  >  51124 [ACK] Seq=164664 Ack=8385 Win=158 Len=0"
"275","13.147700","172.64.155.249","192.168.0.183","TLSv1.2","277","Application Data"
"276","13.147700","172.64.155.249","192.168.0.183","TLSv1.2","85","Application Data"
"277","13.147755","192.168.0.183","172.64.155.249","TCP","54","51124  >  443 [ACK] Seq=8385 Ack=164918 Win=513 Len=0"
"278","14.897783","192.168.0.183","172.64.155.249","TLSv1.2","775","Application Data"
"279","14.897912","192.168.0.183","172.64.155.249","TLSv1.2","590","Application Data"
"280","14.910059","192.168.0.183","172.64.155.249","TLSv1.2","432","Application Data"
"281","14.914766","172.64.155.249","192.168.0.183","TCP","60","443  >  51124 [ACK] Seq=164918 Ack=9642 Win=158 Len=0"
"282","14.939037","172.64.155.249","192.168.0.183","TLSv1.2","279","Application Data"
"283","14.939037","172.64.155.249","192.168.0.183","TLSv1.2","85","Application Data"
"284","14.939071","192.168.0.183","172.64.155.249","TCP","54","51124  >  443 [ACK] Seq=10020 Ack=165174 Win=512 Len=0"
"285","14.967544","172.64.155.249","192.168.0.183","TLSv1.2","150","Application Data"
"286","14.967544","172.64.155.249","192.168.0.183","TLSv1.2","100","Application Data"
"287","14.967544","172.64.155.249","192.168.0.183","TLSv1.2","1312","Application Data"
"288","14.967590","192.168.0.183","172.64.155.249","TCP","54","51124  >  443 [ACK] Seq=10020 Ack=166574 Win=514 Len=0"
"289","14.968544","192.168.0.183","172.64.155.249","TLSv1.2","89","Application Data"
"290","14.969802","172.64.155.249","192.168.0.183","TCP","1514","443  >  51124 [ACK] Seq=166574 Ack=10020 Win=158 Len=1460 [TCP segment of a reassembled PDU]"
"291","14.969802","172.64.155.249","192.168.0.183","TCP","1514","443  >  51124 [ACK] Seq=168034 Ack=10020 Win=158 Len=1460 [TCP segment of a reassembled PDU]"
"292","14.969802","172.64.155.249","192.168.0.183","TCP","1514","443  >  51124 [ACK] Seq=169494 Ack=10020 Win=158 Len=1460 [TCP segment of a reassembled PDU]"
"293","14.969802","172.64.155.249","192.168.0.183","TCP","1514","443  >  51124 [ACK] Seq=170954 Ack=10020 Win=158 Len=1460 [TCP segment of a reassembled PDU]"
"294","14.969802","172.64.155.249","192.168.0.183","TCP","1514","443  >  51124 [ACK] Seq=172414 Ack=10020 Win=158 Len=1460 [TCP segment of a reassembled PDU]"
"295","14.969802","172.64.155.249","192.168.0.183","TCP","1514","443  >  51124 [PSH, ACK] Seq=173874 Ack=10020 Win=158 Len=1460 [TCP segment of a reassembled PDU]"
"296","14.969802","172.64.155.249","192.168.0.183","TLSv1.2","532","Application Data"
"297","14.969859","192.168.0.183","172.64.155.249","TCP","54","51124  >  443 [ACK] Seq=10055 Ack=175812 Win=514 Len=0"
"298","14.976732","172.64.155.249","192.168.0.183","TCP","1514","443  >  51124 [ACK] Seq=175812 Ack=10020 Win=158 Len=1460 [TCP segment of a reassembled PDU]"
"299","14.976732","172.64.155.249","192.168.0.183","TLSv1.2","920","Application Data"
"300","14.976803","192.168.0.183","172.64.155.249","TCP","54","51124  >  443 [ACK] Seq=10055 Ack=178138 Win=514 Len=0"
"301","14.980734","172.64.155.249","192.168.0.183","TCP","1514","443  >  51124 [ACK] Seq=178138 Ack=10020 Win=158 Len=1460 [TCP segment of a reassembled PDU]"
"302","14.980734","172.64.155.249","192.168.0.183","TLSv1.2","1118","Application Data"
"303","14.980734","172.64.155.249","192.168.0.183","TCP","1514","443  >  51124 [ACK] Seq=180662 Ack=10020 Win=158 Len=1460 [TCP segment of a reassembled PDU]"
"304","14.980734","172.64.155.249","192.168.0.183","TLSv1.2","899","Application Data"
"305","14.980831","192.168.0.183","172.64.155.249","TCP","54","51124  >  443 [ACK] Seq=10055 Ack=182967 Win=514 Len=0"
"306","14.981896","172.64.155.249","192.168.0.183","TCP","1514","443  >  51124 [ACK] Seq=182967 Ack=10020 Win=158 Len=1460 [TCP segment of a reassembled PDU]"
"307","14.981896","172.64.155.249","192.168.0.183","TCP","1514","443  >  51124 [ACK] Seq=184427 Ack=10020 Win=158 Len=1460 [TCP segment of a reassembled PDU]"
"308","14.981896","172.64.155.249","192.168.0.183","TLSv1.2","781","Application Data"
"309","14.981970","192.168.0.183","172.64.155.249","TCP","54","51124  >  443 [ACK] Seq=10055 Ack=186614 Win=514 Len=0"
"310","14.984291","172.64.155.249","192.168.0.183","TCP","1514","443  >  51124 [ACK] Seq=186614 Ack=10055 Win=158 Len=1460 [TCP segment of a reassembled PDU]"
"311","14.984291","172.64.155.249","192.168.0.183","TCP","1514","443  >  51124 [ACK] Seq=188074 Ack=10055 Win=158 Len=1460 [TCP segment of a reassembled PDU]"
"312","14.984291","172.64.155.249","192.168.0.183","TCP","1514","443  >  51124 [ACK] Seq=189534 Ack=10055 Win=158 Len=1460 [TCP segment of a reassembled PDU]"
"313","14.984291","172.64.155.249","192.168.0.183","TCP","1514","443  >  51124 [ACK] Seq=190994 Ack=10055 Win=158 Len=1460 [TCP segment of a reassembled PDU]"
"314","14.984291","172.64.155.249","192.168.0.183","TCP","1514","443  >  51124 [ACK] Seq=192454 Ack=10055 Win=158 Len=1460 [TCP segment of a reassembled PDU]"
"315","14.984291","172.64.155.249","192.168.0.183","TCP","1514","443  >  51124 [PSH, ACK] Seq=193914 Ack=10055 Win=158 Len=1460 [TCP segment of a reassembled PDU]"
"316","14.984291","172.64.155.249","192.168.0.183","TLSv1.2","733","Application Data"
"317","14.984291","172.64.155.249","192.168.0.183","TCP","1514","443  >  51124 [ACK] Seq=196053 Ack=10055 Win=158 Len=1460 [TCP segment of a reassembled PDU]"
"318","14.984291","172.64.155.249","192.168.0.183","TCP","1514","443  >  51124 [ACK] Seq=197513 Ack=10055 Win=158 Len=1460 [TCP segment of a reassembled PDU]"
"319","14.984291","172.64.155.249","192.168.0.183","TLSv1.2","948","Application Data"
"320","14.984418","192.168.0.183","172.64.155.249","TCP","54","51124  >  443 [ACK] Seq=10055 Ack=199867 Win=514 Len=0"
"321","14.990240","172.64.155.249","192.168.0.183","TCP","1514","443  >  51124 [ACK] Seq=199867 Ack=10055 Win=158 Len=1460 [TCP segment of a reassembled PDU]"
"322","14.990240","172.64.155.249","192.168.0.183","TCP","1514","443  >  51124 [ACK] Seq=201327 Ack=10055 Win=158 Len=1460 [TCP segment of a reassembled PDU]"
"323","14.990240","172.64.155.249","192.168.0.183","TLSv1.2","741","Application Data"
"324","14.990292","192.168.0.183","172.64.155.249","TCP","54","51124  >  443 [ACK] Seq=10055 Ack=203474 Win=514 Len=0"
"325","14.990362","172.64.155.249","192.168.0.183","TCP","1514","443  >  51124 [ACK] Seq=203474 Ack=10055 Win=158 Len=1460 [TCP segment of a reassembled PDU]"
"326","14.990362","172.64.155.249","192.168.0.183","TCP","1514","443  >  51124 [ACK] Seq=204934 Ack=10055 Win=158 Len=1460 [TCP segment of a reassembled PDU]"
"327","14.990362","172.64.155.249","192.168.0.183","TLSv1.2","1404","Application Data"
"328","14.990362","172.64.155.249","192.168.0.183","TLSv1.2","96","Application Data"
"329","14.990362","172.64.155.249","192.168.0.183","TLSv1.2","85","Application Data"
"330","14.990392","192.168.0.183","172.64.155.249","TCP","54","51124  >  443 [ACK] Seq=10055 Ack=207817 Win=514 Len=0"
"331","15.102753","192.168.0.183","172.64.155.249","TLSv1.2","206","Application Data"
"332","15.116312","172.64.155.249","192.168.0.183","TCP","60","443  >  51134 [ACK] Seq=2032 Ack=678 Win=8 Len=0"
"333","15.143910","172.64.155.249","192.168.0.183","TLSv1.2","474","Application Data"
"334","15.143910","172.64.155.249","192.168.0.183","TLSv1.2","203","Application Data"
"335","15.143910","172.64.155.249","192.168.0.183","TLSv1.2","85","Application Data"
"336","15.144028","192.168.0.183","172.64.155.249","TCP","54","51134  >  443 [ACK] Seq=678 Ack=2632 Win=509 Len=0"
"337","15.326579","192.168.0.183","172.64.155.249","TLSv1.2","289","Application Data"
"338","15.364168","172.64.155.249","192.168.0.183","TLSv1.2","279","Application Data"
"339","15.419473","192.168.0.183","172.64.155.249","TCP","54","51124  >  443 [ACK] Seq=10290 Ack=208042 Win=513 Len=0"
"340","15.551441","192.168.0.183","172.64.155.249","TLSv1.2","522","Application Data"
"341","15.551510","192.168.0.183","172.64.155.249","TLSv1.2","613","Application Data"
"342","15.565358","172.64.155.249","192.168.0.183","TCP","60","443  >  51124 [ACK] Seq=208042 Ack=11317 Win=158 Len=0"
"343","15.587852","172.64.155.249","192.168.0.183","TLSv1.2","144","Application Data"
"344","15.587852","172.64.155.249","192.168.0.183","TLSv1.2","85","Application Data"
"345","15.587881","192.168.0.183","172.64.155.249","TCP","54","51124  >  443 [ACK] Seq=11317 Ack=208163 Win=512 Len=0"
"346","20.029230","192.168.0.183","172.64.155.249","TLSv1.2","159","Application Data"
"347","20.083123","172.64.155.249","192.168.0.183","TCP","60","443  >  51124 [ACK] Seq=208163 Ack=11422 Win=158 Len=0"
"348","22.826878","172.64.155.249","192.168.0.183","TLSv1.2","305","Application Data"
"349","22.826878","172.64.155.249","192.168.0.183","TLSv1.2","100","Application Data"
"350","22.826929","192.168.0.183","172.64.155.249","TCP","54","51124  >  443 [ACK] Seq=11422 Ack=208460 Win=511 Len=0"
"351","22.828011","192.168.0.183","172.64.155.249","TLSv1.2","89","Application Data"
"352","22.830367","172.64.155.249","192.168.0.183","TLSv1.2","1287","Application Data"
"353","22.830367","172.64.155.249","192.168.0.183","TCP","1514","443  >  51124 [ACK] Seq=209693 Ack=11422 Win=158 Len=1460 [TCP segment of a reassembled PDU]"
"354","22.830367","172.64.155.249","192.168.0.183","TCP","1514","443  >  51124 [ACK] Seq=211153 Ack=11422 Win=158 Len=1460 [TCP segment of a reassembled PDU]"
"355","22.830367","172.64.155.249","192.168.0.183","TCP","1514","443  >  51124 [ACK] Seq=212613 Ack=11422 Win=158 Len=1460 [TCP segment of a reassembled PDU]"
"356","22.830367","172.64.155.249","192.168.0.183","TLSv1.2","559","Application Data"
"357","22.830367","172.64.155.249","192.168.0.183","TCP","1514","443  >  51124 [ACK] Seq=214578 Ack=11422 Win=158 Len=1460 [TCP segment of a reassembled PDU]"
"358","22.830413","192.168.0.183","172.64.155.249","TCP","54","51124  >  443 [ACK] Seq=11457 Ack=216038 Win=514 Len=0"
"359","22.832474","172.64.155.249","192.168.0.183","TCP","1514","443  >  51124 [ACK] Seq=216038 Ack=11422 Win=158 Len=1460 [TCP segment of a reassembled PDU]"
"360","22.832474","172.64.155.249","192.168.0.183","TLSv1.2","756","Application Data"
"361","22.832531","192.168.0.183","172.64.155.249","TCP","54","51124  >  443 [ACK] Seq=11457 Ack=218200 Win=514 Len=0"
"362","22.837824","172.64.155.249","192.168.0.183","TCP","1514","443  >  51124 [ACK] Seq=218200 Ack=11422 Win=158 Len=1460 [TCP segment of a reassembled PDU]"
"363","22.837824","172.64.155.249","192.168.0.183","TLSv1.2","1055","Application Data"
"364","22.837909","192.168.0.183","172.64.155.249","TCP","54","51124  >  443 [ACK] Seq=11457 Ack=220661 Win=514 Len=0"
"365","22.840897","172.64.155.249","192.168.0.183","TCP","1514","443  >  51124 [ACK] Seq=220661 Ack=11422 Win=158 Len=1460 [TCP segment of a reassembled PDU]"
"366","22.840897","172.64.155.249","192.168.0.183","TLSv1.2","208","Application Data"
"367","22.840897","172.64.155.249","192.168.0.183","TCP","1514","443  >  51124 [ACK] Seq=222275 Ack=11422 Win=158 Len=1460 [TCP segment of a reassembled PDU]"
"368","22.840897","172.64.155.249","192.168.0.183","TLSv1.2","1046","Application Data"
"369","22.840897","172.64.155.249","192.168.0.183","TCP","60","443  >  51124 [ACK] Seq=224727 Ack=11457 Win=158 Len=0"
"370","22.841013","192.168.0.183","172.64.155.249","TCP","54","51124  >  443 [ACK] Seq=11457 Ack=224727 Win=514 Len=0"
"371","22.842513","172.64.155.249","192.168.0.183","TCP","1514","443  >  51124 [ACK] Seq=224727 Ack=11457 Win=158 Len=1460 [TCP segment of a reassembled PDU]"
"372","22.842513","172.64.155.249","192.168.0.183","TCP","1514","443  >  51124 [ACK] Seq=226187 Ack=11457 Win=158 Len=1460 [TCP segment of a reassembled PDU]"
"373","22.842513","172.64.155.249","192.168.0.183","TCP","1514","443  >  51124 [ACK] Seq=227647 Ack=11457 Win=158 Len=1460 [TCP segment of a reassembled PDU]"
"374","22.842513","172.64.155.249","192.168.0.183","TLSv1.2","148","Application Data"
"375","22.842513","172.64.155.249","192.168.0.183","TCP","1514","443  >  51124 [ACK] Seq=229201 Ack=11457 Win=158 Len=1460 [TCP segment of a reassembled PDU]"
"376","22.842513","172.64.155.249","192.168.0.183","TLSv1.2","801","Application Data"
"377","22.842513","172.64.155.249","192.168.0.183","TLSv1.2","96","Application Data"
"378","22.842513","172.64.155.249","192.168.0.183","TLSv1.2","85","Application Data"
"379","22.842611","192.168.0.183","172.64.155.249","TCP","54","51124  >  443 [ACK] Seq=11457 Ack=231481 Win=514 Len=0"
"380","23.203153","192.168.0.183","172.64.155.249","TLSv1.2","229","Application Data"
"381","23.203308","192.168.0.183","172.64.155.249","TLSv1.2","179","Application Data"
"382","23.216655","172.64.155.249","192.168.0.183","TCP","60","443  >  51124 [ACK] Seq=231481 Ack=11757 Win=158 Len=0"
"383","23.239273","172.64.155.249","192.168.0.183","TLSv1.2","321","Application Data"
"384","23.243544","172.64.155.249","192.168.0.183","TLSv1.2","159","Application Data"
"385","23.243544","172.64.155.249","192.168.0.183","TLSv1.2","227","Application Data"
"386","23.243544","172.64.155.249","192.168.0.183","TLSv1.2","85","Application Data"
"387","23.243659","192.168.0.183","172.64.155.249","TCP","54","51124  >  443 [ACK] Seq=11757 Ack=232057 Win=511 Len=0"
"388","23.321431","192.168.0.183","172.64.155.249","TLSv1.2","449","Application Data"
"389","23.321497","192.168.0.183","172.64.155.249","TLSv1.2","540","Application Data"
"390","23.338868","172.64.155.249","192.168.0.183","TCP","60","443  >  51124 [ACK] Seq=232057 Ack=12638 Win=158 Len=0"
"391","23.360279","172.64.155.249","192.168.0.183","TLSv1.2","145","Application Data"
"392","23.360279","172.64.155.249","192.168.0.183","TLSv1.2","85","Application Data"
"393","23.360343","192.168.0.183","172.64.155.249","TCP","54","51124  >  443 [ACK] Seq=12638 Ack=232179 Win=511 Len=0"
"394","24.817033","192.168.0.183","172.64.155.249","TLSv1.2","166","Application Data"
"395","24.817097","192.168.0.183","172.64.155.249","TLSv1.2","170","Application Data"
"396","24.829102","192.168.0.183","172.64.155.249","TLSv1.2","154","Application Data"
"397","24.832362","172.64.155.249","192.168.0.183","TCP","60","443  >  51124 [ACK] Seq=232179 Ack=12866 Win=158 Len=0"
"398","24.856496","172.64.155.249","192.168.0.183","TLSv1.2","436","Application Data"
"399","24.871807","172.64.155.249","192.168.0.183","TLSv1.2","146","Application Data"
"400","24.871807","172.64.155.249","192.168.0.183","TLSv1.2","100","Application Data"
"401","24.871807","172.64.155.249","192.168.0.183","TLSv1.2","1320","Application Data"
"402","24.871850","192.168.0.183","172.64.155.249","TCP","54","51124  >  443 [ACK] Seq=12966 Ack=233965 Win=514 Len=0"
"403","24.874297","172.64.155.249","192.168.0.183","TCP","1514","443  >  51124 [ACK] Seq=233965 Ack=12966 Win=158 Len=1460 [TCP segment of a reassembled PDU]"
"404","24.874297","172.64.155.249","192.168.0.183","TCP","1514","443  >  51124 [ACK] Seq=235425 Ack=12966 Win=158 Len=1460 [TCP segment of a reassembled PDU]"
"405","24.874297","172.64.155.249","192.168.0.183","TCP","1514","443  >  51124 [ACK] Seq=236885 Ack=12966 Win=158 Len=1460 [TCP segment of a reassembled PDU]"
"406","24.874297","172.64.155.249","192.168.0.183","TLSv1.2","525","Application Data"
"407","24.874297","172.64.155.249","192.168.0.183","TCP","1514","443  >  51124 [ACK] Seq=238816 Ack=12966 Win=158 Len=1460 [TCP segment of a reassembled PDU]"
"408","24.874297","172.64.155.249","192.168.0.183","TCP","1514","443  >  51124 [ACK] Seq=240276 Ack=12966 Win=158 Len=1460 [TCP segment of a reassembled PDU]"
"409","24.874297","172.64.155.249","192.168.0.183","TCP","1514","443  >  51124 [ACK] Seq=241736 Ack=12966 Win=158 Len=1460 [TCP segment of a reassembled PDU]"
"410","24.874297","172.64.155.249","192.168.0.183","TLSv1.2","529","Application Data"
"411","24.874478","192.168.0.183","172.64.155.249","TCP","54","51124  >  443 [ACK] Seq=12966 Ack=243671 Win=514 Len=0"
"412","24.883177","172.64.155.249","192.168.0.183","TCP","1514","443  >  51124 [ACK] Seq=243671 Ack=12966 Win=158 Len=1460 [TCP segment of a reassembled PDU]"
"413","24.883177","172.64.155.249","192.168.0.183","TLSv1.2","355","Application Data"
"414","24.883177","172.64.155.249","192.168.0.183","TCP","1514","443  >  51124 [ACK] Seq=245432 Ack=12966 Win=158 Len=1460 [TCP segment of a reassembled PDU]"
"415","24.883177","172.64.155.249","192.168.0.183","TLSv1.2","75","Application Data"
"416","24.883177","172.64.155.249","192.168.0.183","TLSv1.2","96","Application Data"
"417","24.883177","172.64.155.249","192.168.0.183","TLSv1.2","85","Application Data"
"418","24.883282","192.168.0.183","172.64.155.249","TCP","54","51124  >  443 [ACK] Seq=12966 Ack=246986 Win=514 Len=0"
"419","25.187983","192.168.0.183","172.64.155.249","TLSv1.2","541","Application Data"
"420","25.188050","192.168.0.183","172.64.155.249","TLSv1.2","562","Application Data"
"421","25.200501","172.64.155.249","192.168.0.183","TCP","60","443  >  51124 [ACK] Seq=246986 Ack=13961 Win=158 Len=0"
"422","25.226794","172.64.155.249","192.168.0.183","TLSv1.2","298","Application Data"
"423","25.226794","172.64.155.249","192.168.0.183","TLSv1.2","85","Application Data"
"424","25.226873","192.168.0.183","172.64.155.249","TCP","54","51124  >  443 [ACK] Seq=13961 Ack=247261 Win=512 Len=0"
"425","26.839576","192.168.0.183","172.64.155.249","TLSv1.2","720","Application Data"
"426","26.876886","172.64.155.249","192.168.0.183","TLSv1.2","281","Application Data"
"427","26.876886","172.64.155.249","192.168.0.183","TLSv1.2","100","Application Data"
"428","26.876886","172.64.155.249","192.168.0.183","TCP","1514","443  >  51124 [ACK] Seq=247534 Ack=14627 Win=158 Len=1460 [TCP segment of a reassembled PDU]"
"429","26.876886","172.64.155.249","192.168.0.183","TLSv1.2","568","Application Data"
"430","26.876886","172.64.155.249","192.168.0.183","TLSv1.2","95","Application Data"
"431","26.876886","172.64.155.249","192.168.0.183","TLSv1.2","85","Application Data"
"432","26.876935","192.168.0.183","172.64.155.249","TCP","54","51124  >  443 [ACK] Seq=14627 Ack=249580 Win=514 Len=0"
"433","27.905109","192.168.0.183","172.64.155.249","TLSv1.2","364","Application Data"
"434","27.958771","172.64.155.249","192.168.0.183","TCP","60","443  >  51124 [ACK] Seq=249580 Ack=14937 Win=158 Len=0"
"435","28.031809","172.64.155.249","192.168.0.183","TLSv1.2","284","Application Data"
"436","28.031809","172.64.155.249","192.168.0.183","TLSv1.2","100","Application Data"
"437","28.031809","172.64.155.249","192.168.0.183","TLSv1.2","1308","Application Data"
"438","28.031809","172.64.155.249","192.168.0.183","TCP","1514","443  >  51124 [ACK] Seq=251110 Ack=14937 Win=158 Len=1460 [TCP segment of a reassembled PDU]"
"439","28.031809","172.64.155.249","192.168.0.183","TCP","1514","443  >  51124 [ACK] Seq=252570 Ack=14937 Win=158 Len=1460 [TCP segment of a reassembled PDU]"
"440","28.031860","192.168.0.183","172.64.155.249","TCP","54","51124  >  443 [ACK] Seq=14937 Ack=254030 Win=514 Len=0"
"441","28.031920","172.64.155.249","192.168.0.183","TCP","1514","443  >  51124 [ACK] Seq=254030 Ack=14937 Win=158 Len=1460 [TCP segment of a reassembled PDU]"
"442","28.031920","172.64.155.249","192.168.0.183","TCP","1514","443  >  51124 [ACK] Seq=255490 Ack=14937 Win=158 Len=1460 [TCP segment of a reassembled PDU]"
"443","28.031920","172.64.155.249","192.168.0.183","TCP","1514","443  >  51124 [ACK] Seq=256950 Ack=14937 Win=158 Len=1460 [TCP segment of a reassembled PDU]"
"444","28.031920","172.64.155.249","192.168.0.183","TLSv1.2","1236","Application Data"
"445","28.031939","192.168.0.183","172.64.155.249","TCP","54","51124  >  443 [ACK] Seq=14937 Ack=259592 Win=514 Len=0"
"446","28.032733","192.168.0.183","172.64.155.249","TLSv1.2","89","Application Data"
"447","28.038702","172.64.155.249","192.168.0.183","TCP","1514","443  >  51124 [ACK] Seq=259592 Ack=14937 Win=158 Len=1460 [TCP segment of a reassembled PDU]"
"448","28.038702","172.64.155.249","192.168.0.183","TLSv1.2","1494","Application Data"
"449","28.038781","192.168.0.183","172.64.155.249","TCP","54","51124  >  443 [ACK] Seq=14972 Ack=262492 Win=514 Len=0"
"450","28.040002","172.64.155.249","192.168.0.183","TCP","1514","443  >  51124 [ACK] Seq=262492 Ack=14937 Win=158 Len=1460 [TCP segment of a reassembled PDU]"
"451","28.040002","172.64.155.249","192.168.0.183","TCP","1514","443  >  51124 [ACK] Seq=263952 Ack=14937 Win=158 Len=1460 [TCP segment of a reassembled PDU]"
"452","28.040002","172.64.155.249","192.168.0.183","TLSv1.2","763","Application Data"
"453","28.040177","192.168.0.183","172.64.155.249","TCP","54","51124  >  443 [ACK] Seq=14972 Ack=266121 Win=514 Len=0"
"454","28.042193","172.64.155.249","192.168.0.183","TCP","1514","443  >  51124 [ACK] Seq=266121 Ack=14937 Win=158 Len=1460 [TCP segment of a reassembled PDU]"
"455","28.042193","172.64.155.249","192.168.0.183","TCP","1514","443  >  51124 [ACK] Seq=267581 Ack=14937 Win=158 Len=1460 [TCP segment of a reassembled PDU]"
"456","28.042193","172.64.155.249","192.168.0.183","TCP","1514","443  >  51124 [ACK] Seq=269041 Ack=14937 Win=158 Len=1460 [TCP segment of a reassembled PDU]"
"457","28.042193","172.64.155.249","192.168.0.183","TLSv1.2","87","Application Data"
"458","28.042193","172.64.155.249","192.168.0.183","TCP","1514","443  >  51124 [ACK] Seq=270534 Ack=14937 Win=158 Len=1460 [TCP segment of a reassembled PDU]"
"459","28.042193","172.64.155.249","192.168.0.183","TCP","1514","443  >  51124 [ACK] Seq=271994 Ack=14937 Win=158 Len=1460 [TCP segment of a reassembled PDU]"
"460","28.042267","192.168.0.183","172.64.155.249","TCP","54","51124  >  443 [ACK] Seq=14972 Ack=273454 Win=514 Len=0"
"461","28.043950","172.64.155.249","192.168.0.183","TCP","1514","443  >  51124 [ACK] Seq=273454 Ack=14937 Win=158 Len=1460 [TCP segment of a reassembled PDU]"
"462","28.043950","172.64.155.249","192.168.0.183","TLSv1.2","327","Application Data"
"463","28.043950","172.64.155.249","192.168.0.183","TCP","1514","443  >  51124 [ACK] Seq=275187 Ack=14937 Win=158 Len=1460 [TCP segment of a reassembled PDU]"
"464","28.043950","172.64.155.249","192.168.0.183","TCP","1514","443  >  51124 [ACK] Seq=276647 Ack=14937 Win=158 Len=1460 [TCP segment of a reassembled PDU]"
"465","28.043950","172.64.155.249","192.168.0.183","TCP","1514","443  >  51124 [ACK] Seq=278107 Ack=14937 Win=158 Len=1460 [TCP segment of a reassembled PDU]"
"466","28.043950","172.64.155.249","192.168.0.183","TLSv1.2","939","Application Data"
"467","28.043950","172.64.155.249","192.168.0.183","TCP","1514","443  >  51124 [ACK] Seq=280452 Ack=14937 Win=158 Len=1460 [TCP segment of a reassembled PDU]"
"468","28.043950","172.64.155.249","192.168.0.183","TLSv1.2","1194","Application Data"
"469","28.044077","192.168.0.183","172.64.155.249","TCP","54","51124  >  443 [ACK] Seq=14972 Ack=283052 Win=514 Len=0"
"470","28.046153","172.64.155.249","192.168.0.183","TCP","60","443  >  51124 [ACK] Seq=283052 Ack=14972 Win=158 Len=0"
"471","28.049583","172.64.155.249","192.168.0.183","TCP","1514","443  >  51124 [ACK] Seq=283052 Ack=14972 Win=158 Len=1460 [TCP segment of a reassembled PDU]"
"472","28.049583","172.64.155.249","192.168.0.183","TCP","1514","443  >  51124 [ACK] Seq=284512 Ack=14972 Win=158 Len=1460 [TCP segment of a reassembled PDU]"
"473","28.049583","172.64.155.249","192.168.0.183","TCP","1514","443  >  51124 [ACK] Seq=285972 Ack=14972 Win=158 Len=1460 [TCP segment of a reassembled PDU]"
"474","28.049583","172.64.155.249","192.168.0.183","TCP","1514","443  >  51124 [ACK] Seq=287432 Ack=14972 Win=158 Len=1460 [TCP segment of a reassembled PDU]"
"475","28.049583","172.64.155.249","192.168.0.183","TLSv1.2","1265","Application Data"
"476","28.049583","172.64.155.249","192.168.0.183","TLSv1.2","85","Application Data"
"477","28.049677","192.168.0.183","172.64.155.249","TCP","54","51124  >  443 [ACK] Seq=14972 Ack=290134 Win=514 Len=0"
"478","28.217226","192.168.0.183","172.64.155.249","TLSv1.2","196","Application Data"
"479","28.217280","192.168.0.183","172.64.155.249","TLSv1.2","93","Application Data"
"480","28.257591","172.64.155.249","192.168.0.183","TCP","60","443  >  51134 [ACK] Seq=2632 Ack=859 Win=8 Len=0"
"481","28.257591","172.64.155.249","192.168.0.183","TLSv1.2","93","Application Data"
"482","28.280164","172.64.155.249","192.168.0.183","TLSv1.2","474","Application Data"
"483","28.280164","172.64.155.249","192.168.0.183","TLSv1.2","203","Application Data"
"484","28.280164","172.64.155.249","192.168.0.183","TLSv1.2","85","Application Data"
"485","28.280206","192.168.0.183","172.64.155.249","TCP","54","51134  >  443 [ACK] Seq=859 Ack=3271 Win=514 Len=0"
"486","28.281006","192.168.0.183","172.64.155.249","TLSv1.2","89","Application Data"
"487","28.341993","172.64.155.249","192.168.0.183","TCP","60","443  >  51134 [ACK] Seq=3271 Ack=894 Win=8 Len=0"
"488","28.562675","192.168.0.183","172.64.155.249","TLSv1.2","564","Application Data"
"489","28.562741","192.168.0.183","172.64.155.249","TLSv1.2","546","Application Data"
"490","28.579782","172.64.155.249","192.168.0.183","TCP","60","443  >  51124 [ACK] Seq=290134 Ack=15974 Win=158 Len=0"
"491","28.607087","172.64.155.249","192.168.0.183","TLSv1.2","278","Application Data"
"492","28.607087","172.64.155.249","192.168.0.183","TLSv1.2","85","Application Data"
"493","28.607146","192.168.0.183","172.64.155.249","TCP","54","51124  >  443 [ACK] Seq=15974 Ack=290389 Win=513 Len=0"
"494","29.760176","192.168.0.183","172.64.155.249","TLSv1.2","192","Application Data"
"495","29.808768","172.64.155.249","192.168.0.183","TLSv1.2","279","Application Data"
"496","29.808768","172.64.155.249","192.168.0.183","TLSv1.2","100","Application Data"
"497","29.808823","192.168.0.183","172.64.155.249","TCP","54","51124  >  443 [ACK] Seq=16112 Ack=290660 Win=512 Len=0"
"498","29.811588","172.64.155.249","192.168.0.183","TCP","1514","443  >  51124 [ACK] Seq=290660 Ack=16112 Win=158 Len=1460 [TCP segment of a reassembled PDU]"
"499","29.811588","172.64.155.249","192.168.0.183","TCP","1514","443  >  51124 [ACK] Seq=292120 Ack=16112 Win=158 Len=1460 [TCP segment of a reassembled PDU]"
"500","29.811588","172.64.155.249","192.168.0.183","TCP","1514","443  >  51124 [ACK] Seq=293580 Ack=16112 Win=158 Len=1460 [TCP segment of a reassembled PDU]"
"501","29.811588","172.64.155.249","192.168.0.183","TCP","1514","443  >  51124 [ACK] Seq=295040 Ack=16112 Win=158 Len=1460 [TCP segment of a reassembled PDU]"
"502","29.811588","172.64.155.249","192.168.0.183","TCP","1514","443  >  51124 [ACK] Seq=296500 Ack=16112 Win=158 Len=1460 [TCP segment of a reassembled PDU]"
"503","29.811588","172.64.155.249","192.168.0.183","TLSv1.2","1381","Application Data"
"504","29.811671","192.168.0.183","172.64.155.249","TCP","54","51124  >  443 [ACK] Seq=16112 Ack=299287 Win=514 Len=0"
"505","29.822491","172.64.155.249","192.168.0.183","TLSv1.2","1266","Application Data"
"506","29.822491","172.64.155.249","192.168.0.183","TCP","1514","443  >  51124 [ACK] Seq=300499 Ack=16112 Win=158 Len=1460 [TCP segment of a reassembled PDU]"
"507","29.822491","172.64.155.249","192.168.0.183","TLSv1.2","1509","Application Data"
"508","29.822491","172.64.155.249","192.168.0.183","TCP","1514","443  >  51124 [ACK] Seq=303414 Ack=16112 Win=158 Len=1460 [TCP segment of a reassembled PDU]"
"509","29.822491","172.64.155.249","192.168.0.183","TLSv1.2","1185","Application Data"
"510","29.822704","192.168.0.183","172.64.155.249","TCP","54","51124  >  443 [ACK] Seq=16112 Ack=306005 Win=514 Len=0"
"511","29.824501","172.64.155.249","192.168.0.183","TCP","1514","443  >  51124 [ACK] Seq=306005 Ack=16112 Win=158 Len=1460 [TCP segment of a reassembled PDU]"
"512","29.824501","172.64.155.249","192.168.0.183","TCP","1514","443  >  51124 [ACK] Seq=307465 Ack=16112 Win=158 Len=1460 [TCP segment of a reassembled PDU]"
"513","29.824501","172.64.155.249","192.168.0.183","TCP","1514","443  >  51124 [ACK] Seq=308925 Ack=16112 Win=158 Len=1460 [TCP segment of a reassembled PDU]"
"514","29.824501","172.64.155.249","192.168.0.183","TCP","1514","443  >  51124 [ACK] Seq=310385 Ack=16112 Win=158 Len=1460 [TCP segment of a reassembled PDU]"
"515","29.824501","172.64.155.249","192.168.0.183","TCP","1514","443  >  51124 [ACK] Seq=311845 Ack=16112 Win=158 Len=1460 [TCP segment of a reassembled PDU]"
"516","29.824501","172.64.155.249","192.168.0.183","TCP","1514","443  >  51124 [PSH, ACK] Seq=313305 Ack=16112 Win=158 Len=1460 [TCP segment of a reassembled PDU]"
"517","29.824501","172.64.155.249","192.168.0.183","TCP","1514","443  >  51124 [ACK] Seq=314765 Ack=16112 Win=158 Len=1460 [TCP segment of a reassembled PDU]"
"518","29.824501","172.64.155.249","192.168.0.183","TCP","1514","443  >  51124 [ACK] Seq=316225 Ack=16112 Win=158 Len=1460 [TCP segment of a reassembled PDU]"
"519","29.824501","172.64.155.249","192.168.0.183","TLSv1.2","1499","Application Data"
"520","29.824624","192.168.0.183","172.64.155.249","TCP","54","51124  >  443 [ACK] Seq=16112 Ack=319130 Win=514 Len=0"
"521","29.828400","172.64.155.249","192.168.0.183","TCP","1514","443  >  51124 [ACK] Seq=319130 Ack=16112 Win=158 Len=1460 [TCP segment of a reassembled PDU]"
"522","29.828400","172.64.155.249","192.168.0.183","TCP","1514","443  >  51124 [ACK] Seq=320590 Ack=16112 Win=158 Len=1460 [TCP segment of a reassembled PDU]"
"523","29.828400","172.64.155.249","192.168.0.183","TLSv1.2","932","Application Data"
"524","29.828400","172.64.155.249","192.168.0.183","TCP","1514","443  >  51124 [ACK] Seq=322928 Ack=16112 Win=158 Len=1460 [TCP segment of a reassembled PDU]"
"525","29.828503","192.168.0.183","172.64.155.249","TCP","54","51124  >  443 [ACK] Seq=16112 Ack=324388 Win=514 Len=0"
"526","29.830407","172.64.155.249","192.168.0.183","TCP","1514","443  >  51124 [ACK] Seq=324388 Ack=16112 Win=158 Len=1460 [TCP segment of a reassembled PDU]"
"527","29.830407","172.64.155.249","192.168.0.183","TCP","1514","443  >  51124 [ACK] Seq=325848 Ack=16112 Win=158 Len=1460 [TCP segment of a reassembled PDU]"
"528","29.830407","172.64.155.249","192.168.0.183","TCP","1514","443  >  51124 [ACK] Seq=327308 Ack=16112 Win=158 Len=1460 [TCP segment of a reassembled PDU]"
"529","29.830407","172.64.155.249","192.168.0.183","TCP","1514","443  >  51124 [ACK] Seq=328768 Ack=16112 Win=158 Len=1460 [TCP segment of a reassembled PDU]"
"530","29.830407","172.64.155.249","192.168.0.183","TLSv1.2","443","Application Data"
"531","29.830407","172.64.155.249","192.168.0.183","TLSv1.2","96","Application Data"
"532","29.830407","172.64.155.249","192.168.0.183","TLSv1.2","85","Application Data"
"533","29.830484","192.168.0.183","172.64.155.249","TCP","54","51124  >  443 [ACK] Seq=16112 Ack=330690 Win=514 Len=0"
"534","29.964251","192.168.0.183","172.64.155.249","TLSv1.2","265","Application Data"
"535","29.977961","172.64.155.249","192.168.0.183","TCP","60","443  >  51134 [ACK] Seq=3271 Ack=1105 Win=8 Len=0"
"536","30.000726","172.64.155.249","192.168.0.183","TLSv1.2","472","Application Data"
"537","30.000726","172.64.155.249","192.168.0.183","TLSv1.2","203","Application Data"
"538","30.000726","172.64.155.249","192.168.0.183","TLSv1.2","85","Application Data"
"539","30.000790","192.168.0.183","172.64.155.249","TCP","54","51134  >  443 [ACK] Seq=1105 Ack=3869 Win=511 Len=0"
"540","30.129498","192.168.0.183","172.64.155.249","TLSv1.2","272","Application Data"
"541","30.173130","172.64.155.249","192.168.0.183","TLSv1.2","285","Application Data"
"542","30.222615","192.168.0.183","172.64.155.249","TCP","54","51124  >  443 [ACK] Seq=16330 Ack=330921 Win=513 Len=0"
"543","30.333963","192.168.0.183","172.64.155.249","TLSv1.2","489","Application Data"
"544","30.334025","192.168.0.183","172.64.155.249","TLSv1.2","589","Application Data"
"545","30.348805","172.64.155.249","192.168.0.183","TCP","60","443  >  51124 [ACK] Seq=330921 Ack=17300 Win=158 Len=0"
"546","30.374393","172.64.155.249","192.168.0.183","TLSv1.2","179","Application Data"
"547","30.374393","172.64.155.249","192.168.0.183","TLSv1.2","85","Application Data"
"548","30.374436","192.168.0.183","172.64.155.249","TCP","54","51124  >  443 [ACK] Seq=17300 Ack=331077 Win=512 Len=0"
