"No.","Time","Source","Destination","Protocol","Length","Info"
"1","0.000000","192.168.0.183","172.64.155.249","TLSv1.2","320","Application Data"
"2","0.000054","192.168.0.183","172.64.155.249","TLSv1.2","93","Application Data"
"3","0.000080","192.168.0.183","172.64.155.249","TLSv1.2","626","Application Data"
"4","0.013542","172.64.155.249","192.168.0.183","TCP","60","443  >  51124 [ACK] Seq=1 Ack=306 Win=60 Len=0"
"5","0.013542","172.64.155.249","192.168.0.183","TLSv1.2","93","Application Data"
"6","0.013741","192.168.0.183","172.64.155.249","TLSv1.2","370","Application Data"
"7","0.028580","172.64.155.249","192.168.0.183","TCP","60","443  >  51124 [ACK] Seq=40 Ack=1194 Win=61 Len=0"
"8","0.076168","172.64.155.249","192.168.0.183","TLSv1.2","482","Application Data"
"9","0.076168","172.64.155.249","192.168.0.183","TLSv1.2","85","Application Data"
"10","0.076272","192.168.0.183","172.64.155.249","TCP","54","51124  >  443 [ACK] Seq=1194 Ack=499 Win=511 Len=0"
"11","0.099055","172.64.155.249","192.168.0.183","TLSv1.2","350","Application Data"
"12","0.099055","172.64.155.249","192.168.0.183","TLSv1.2","100","Application Data"
"13","0.099055","172.64.155.249","192.168.0.183","TLSv1.2","1317","Application Data"
"14","0.099083","192.168.0.183","172.64.155.249","TCP","54","51124  >  443 [ACK] Seq=1194 Ack=2104 Win=514 Len=0"
"15","0.099923","192.168.0.183","172.64.155.249","TLSv1.2","89","Application Data"
"16","0.102562","172.64.155.249","192.168.0.183","TCP","1514","443  >  51124 [ACK] Seq=2104 Ack=1194 Win=61 Len=1460 [TCP segment of a reassembled PDU]"
"17","0.102562","172.64.155.249","192.168.0.183","TCP","1514","443  >  51124 [ACK] Seq=3564 Ack=1194 Win=61 Len=1460 [TCP segment of a reassembled PDU]"
"18","0.102562","172.64.155.249","192.168.0.183","TCP","1514","443  >  51124 [ACK] Seq=5024 Ack=1194 Win=61 Len=1460 [TCP segment of a reassembled PDU]"
"19","0.102562","172.64.155.249","192.168.0.183","TCP","1514","443  >  51124 [ACK] Seq=6484 Ack=1194 Win=61 Len=1460 [TCP segment of a reassembled PDU]"
"20","0.102562","172.64.155.249","192.168.0.183","TCP","1514","443  >  51124 [ACK] Seq=7944 Ack=1194 Win=61 Len=1460 [TCP segment of a reassembled PDU]"
"21","0.102562","172.64.155.249","192.168.0.183","TLSv1.2","1369","Application Data"
"22","0.102562","172.64.155.249","192.168.0.183","TLSv1.2","751","Application Data"
"23","0.102642","192.168.0.183","172.64.155.249","TCP","54","51124  >  443 [ACK] Seq=1229 Ack=11416 Win=514 Len=0"
"24","0.111730","172.64.155.249","192.168.0.183","TCP","1514","443  >  51124 [ACK] Seq=11416 Ack=1194 Win=61 Len=1460 [TCP segment of a reassembled PDU]"
"25","0.111730","172.64.155.249","192.168.0.183","TCP","1514","443  >  51124 [ACK] Seq=12876 Ack=1194 Win=61 Len=1460 [TCP segment of a reassembled PDU]"
"26","0.111730","172.64.155.249","192.168.0.183","TCP","1514","443  >  51124 [ACK] Seq=14336 Ack=1194 Win=61 Len=1460 [TCP segment of a reassembled PDU]"
"27","0.111730","172.64.155.249","192.168.0.183","TLSv1.2","606","Application Data"
"28","0.111730","172.64.155.249","192.168.0.183","TCP","1514","443  >  51124 [ACK] Seq=16348 Ack=1194 Win=61 Len=1460 [TCP segment of a reassembled PDU]"
"29","0.111730","172.64.155.249","192.168.0.183","TLSv1.2","1014","Application Data"
"30","0.111875","192.168.0.183","172.64.155.249","TCP","54","51124  >  443 [ACK] Seq=1229 Ack=18768 Win=514 Len=0"
"31","0.114976","172.64.155.249","192.168.0.183","TCP","1514","443  >  51124 [ACK] Seq=18768 Ack=1229 Win=61 Len=1460 [TCP segment of a reassembled PDU]"
"32","0.114976","172.64.155.249","192.168.0.183","TCP","1514","443  >  51124 [ACK] Seq=20228 Ack=1229 Win=61 Len=1460 [TCP segment of a reassembled PDU]"
"33","0.114976","172.64.155.249","192.168.0.183","TCP","1514","443  >  51124 [ACK] Seq=21688 Ack=1229 Win=61 Len=1460 [TCP segment of a reassembled PDU]"
"34","0.114976","172.64.155.249","192.168.0.183","TCP","1514","443  >  51124 [ACK] Seq=23148 Ack=1229 Win=61 Len=1460 [TCP segment of a reassembled PDU]"
"35","0.114976","172.64.155.249","192.168.0.183","TCP","1514","443  >  51124 [ACK] Seq=24608 Ack=1229 Win=61 Len=1460 [TCP segment of a reassembled PDU]"
"36","0.114976","172.64.155.249","192.168.0.183","TLSv1.2","1104","Application Data"
"37","0.114976","172.64.155.249","192.168.0.183","TCP","1514","443  >  51124 [ACK] Seq=27118 Ack=1229 Win=61 Len=1460 [TCP segment of a reassembled PDU]"
"38","0.114976","172.64.155.249","192.168.0.183","TCP","1514","443  >  51124 [ACK] Seq=28578 Ack=1229 Win=61 Len=1460 [TCP segment of a reassembled PDU]"
"39","0.114976","172.64.155.249","192.168.0.183","TLSv1.2","953","Application Data"
"40","0.115065","192.168.0.183","172.64.155.249","TCP","54","51124  >  443 [ACK] Seq=1229 Ack=30937 Win=514 Len=0"
"41","0.122626","172.64.155.249","192.168.0.183","TCP","1514","443  >  51124 [ACK] Seq=30937 Ack=1229 Win=61 Len=1460 [TCP segment of a reassembled PDU]"
"42","0.122626","172.64.155.249","192.168.0.183","TCP","1514","443  >  51124 [ACK] Seq=32397 Ack=1229 Win=61 Len=1460 [TCP segment of a reassembled PDU]"
"43","0.122626","172.64.155.249","192.168.0.183","TCP","1514","443  >  51124 [ACK] Seq=33857 Ack=1229 Win=61 Len=1460 [TCP segment of a reassembled PDU]"
"44","0.122626","172.64.155.249","192.168.0.183","TLSv1.2","827","Application Data"
"45","0.122818","192.168.0.183","172.64.155.249","TCP","54","51124  >  443 [ACK] Seq=1229 Ack=36090 Win=514 Len=0"
"46","0.125201","172.64.155.249","192.168.0.183","TCP","1514","443  >  51124 [ACK] Seq=36090 Ack=1229 Win=61 Len=1460 [TCP segment of a reassembled PDU]"
"47","0.125201","172.64.155.249","192.168.0.183","TCP","1514","443  >  51124 [ACK] Seq=37550 Ack=1229 Win=61 Len=1460 [TCP segment of a reassembled PDU]"
"48","0.125201","172.64.155.249","192.168.0.183","TCP","1514","443  >  51124 [ACK] Seq=39010 Ack=1229 Win=61 Len=1460 [TCP segment of a reassembled PDU]"
"49","0.125201","172.64.155.249","192.168.0.183","TCP","1514","443  >  51124 [ACK] Seq=40470 Ack=1229 Win=61 Len=1460 [TCP segment of a reassembled PDU]"
"50","0.125201","172.64.155.249","192.168.0.183","TCP","1514","443  >  51124 [ACK] Seq=41930 Ack=1229 Win=61 Len=1460 [TCP segment of a reassembled PDU]"
"51","0.125201","172.64.155.249","192.168.0.183","TLSv1.2","562","Application Data"
"52","0.125201","172.64.155.249","192.168.0.183","TLSv1.2","127","Application Data, Application Data"
"53","0.125326","192.168.0.183","172.64.155.249","TCP","54","51124  >  443 [ACK] Seq=1229 Ack=43971 Win=514 Len=0"
"54","0.283286","192.168.0.183","172.64.155.249","TLSv1.2","203","Application Data"
"55","0.283355","192.168.0.183","172.64.155.249","TLSv1.2","93","Application Data"
"56","0.292252","172.64.155.249","192.168.0.183","TCP","60","443  >  51134 [ACK] Seq=1 Ack=189 Win=8 Len=0"
"57","0.292252","172.64.155.249","192.168.0.183","TLSv1.2","93","Application Data"
"58","0.337672","192.168.0.183","172.64.155.249","TCP","54","51134  >  443 [ACK] Seq=189 Ack=40 Win=508 Len=0"
"59","0.360990","172.64.155.249","192.168.0.183","TLSv1.2","471","Application Data"
"60","0.360990","172.64.155.249","192.168.0.183","TLSv1.2","203","Application Data"
"61","0.360990","172.64.155.249","192.168.0.183","TLSv1.2","85","Application Data"
"62","0.361056","192.168.0.183","172.64.155.249","TCP","54","51134  >  443 [ACK] Seq=189 Ack=637 Win=514 Len=0"
"63","0.362035","192.168.0.183","172.64.155.249","TLSv1.2","89","Application Data"
"64","0.416327","172.64.155.249","192.168.0.183","TCP","60","443  >  51134 [ACK] Seq=637 Ack=224 Win=8 Len=0"
"65","0.462692","192.168.0.183","172.64.155.249","TLSv1.2","419","Application Data"
"66","0.498728","172.64.155.249","192.168.0.183","TLSv1.2","152","Application Data"
"67","0.552105","192.168.0.183","172.64.155.249","TCP","54","51124  >  443 [ACK] Seq=1594 Ack=44069 Win=513 Len=0"
"68","0.741841","192.168.0.183","172.64.155.249","TLSv1.2","579","Application Data"
"69","0.741975","192.168.0.183","172.64.155.249","TLSv1.2","632","Application Data"
"70","0.757009","172.64.155.249","192.168.0.183","TCP","60","443  >  51124 [ACK] Seq=44069 Ack=2697 Win=62 Len=0"
"71","0.781149","172.64.155.249","192.168.0.183","TLSv1.2","144","Application Data"
"72","0.781149","172.64.155.249","192.168.0.183","TLSv1.2","85","Application Data"
"73","0.781201","192.168.0.183","172.64.155.249","TCP","54","51124  >  443 [ACK] Seq=2697 Ack=44190 Win=513 Len=0"
"74","3.167558","192.168.0.183","172.64.155.249","TLSv1.2","375","Application Data"
"75","3.221657","172.64.155.249","192.168.0.183","TCP","60","443  >  51124 [ACK] Seq=44190 Ack=3018 Win=62 Len=0"
"76","3.255326","172.64.155.249","192.168.0.183","TLSv1.2","296","Application Data"
"77","3.255326","172.64.155.249","192.168.0.183","TLSv1.2","100","Application Data"
"78","3.255326","172.64.155.249","192.168.0.183","TLSv1.2","1268","Application Data"
"79","3.255326","172.64.155.249","192.168.0.183","TCP","1514","443  >  51124 [ACK] Seq=45692 Ack=3018 Win=62 Len=1460 [TCP segment of a reassembled PDU]"
"80","3.255326","172.64.155.249","192.168.0.183","TCP","1514","443  >  51124 [ACK] Seq=47152 Ack=3018 Win=62 Len=1460 [TCP segment of a reassembled PDU]"
"81","3.255326","172.64.155.249","192.168.0.183","TCP","1514","443  >  51124 [ACK] Seq=48612 Ack=3018 Win=62 Len=1460 [TCP segment of a reassembled PDU]"
"82","3.255326","172.64.155.249","192.168.0.183","TLSv1.2","579","Application Data"
"83","3.255373","192.168.0.183","172.64.155.249","TCP","54","51124  >  443 [ACK] Seq=3018 Ack=50597 Win=514 Len=0"
"84","3.256722","172.64.155.249","192.168.0.183","TCP","1514","443  >  51124 [ACK] Seq=50597 Ack=3018 Win=62 Len=1460 [TCP segment of a reassembled PDU]"
"85","3.256722","172.64.155.249","192.168.0.183","TCP","1514","443  >  51124 [ACK] Seq=52057 Ack=3018 Win=62 Len=1460 [TCP segment of a reassembled PDU]"
"86","3.256722","172.64.155.249","192.168.0.183","TLSv1.2","777","Application Data"
"87","3.256752","192.168.0.183","172.64.155.249","TCP","54","51124  >  443 [ACK] Seq=3018 Ack=54240 Win=514 Len=0"
"88","3.267125","172.64.155.249","192.168.0.183","TCP","1514","443  >  51124 [ACK] Seq=54240 Ack=3018 Win=62 Len=1460 [TCP segment of a reassembled PDU]"
"89","3.267125","172.64.155.249","192.168.0.183","TLSv1.2","1338","Application Data"
"90","3.267125","172.64.155.249","192.168.0.183","TCP","1514","443  >  51124 [ACK] Seq=56984 Ack=3018 Win=62 Len=1460 [TCP segment of a reassembled PDU]"
"91","3.267125","172.64.155.249","192.168.0.183","TLSv1.2","927","Application Data"
"92","3.267125","172.64.155.249","192.168.0.183","TLSv1.2","1350","Application Data"
"93","3.267242","192.168.0.183","172.64.155.249","TCP","54","51124  >  443 [ACK] Seq=3018 Ack=60613 Win=514 Len=0"
"94","3.270500","172.64.155.249","192.168.0.183","TCP","1514","443  >  51124 [ACK] Seq=60613 Ack=3018 Win=62 Len=1460 [TCP segment of a reassembled PDU]"
"95","3.270500","172.64.155.249","192.168.0.183","TCP","1514","443  >  51124 [ACK] Seq=62073 Ack=3018 Win=62 Len=1460 [TCP segment of a reassembled PDU]"
"96","3.270500","172.64.155.249","192.168.0.183","TCP","1514","443  >  51124 [ACK] Seq=63533 Ack=3018 Win=62 Len=1460 [TCP segment of a reassembled PDU]"
"97","3.270500","172.64.155.249","192.168.0.183","TCP","1514","443  >  51124 [ACK] Seq=64993 Ack=3018 Win=62 Len=1460 [TCP segment of a reassembled PDU]"
"98","3.270500","172.64.155.249","192.168.0.183","TLSv1.2","101","Application Data"
"99","3.270500","172.64.155.249","192.168.0.183","TCP","1514","443  >  51124 [ACK] Seq=66500 Ack=3018 Win=62 Len=1460 [TCP segment of a reassembled PDU]"
"100","3.270500","172.64.155.249","192.168.0.183","TLSv1.2","1032","Application Data"
"101","3.270500","172.64.155.249","192.168.0.183","TLSv1.2","96","Application Data"
"102","3.270500","172.64.155.249","192.168.0.183","TLSv1.2","85","Application Data"
"103","3.270598","192.168.0.183","172.64.155.249","TCP","54","51124  >  443 [ACK] Seq=3018 Ack=69011 Win=514 Len=0"
"104","3.552368","192.168.0.183","172.64.155.249","TLSv1.2","300","Application Data"
"105","3.552671","192.168.0.183","172.64.155.249","TLSv1.2","201","Application Data"
"106","3.565089","172.64.155.249","192.168.0.183","TCP","60","443  >  51124 [ACK] Seq=69011 Ack=3411 Win=63 Len=0"
"107","3.591326","172.64.155.249","192.168.0.183","TLSv1.2","144","Application Data"
"108","3.598140","172.64.155.249","192.168.0.183","TLSv1.2","146","Application Data"
"109","3.598140","172.64.155.249","192.168.0.183","TLSv1.2","225","Application Data"
"110","3.598140","172.64.155.249","192.168.0.183","TLSv1.2","85","Application Data"
"111","3.598222","192.168.0.183","172.64.155.249","TCP","54","51124  >  443 [ACK] Seq=3411 Ack=69395 Win=512 Len=0"
"112","3.711639","192.168.0.183","172.64.155.249","TLSv1.2","490","Application Data"
"113","3.711688","192.168.0.183","172.64.155.249","TLSv1.2","544","Application Data"
"114","3.730851","172.64.155.249","192.168.0.183","TCP","60","443  >  51124 [ACK] Seq=69395 Ack=4337 Win=63 Len=0"
"115","3.752278","172.64.155.249","192.168.0.183","TLSv1.2","164","Application Data"
"116","3.752278","172.64.155.249","192.168.0.183","TLSv1.2","85","Application Data"
"117","3.752309","192.168.0.183","172.64.155.249","TCP","54","51124  >  443 [ACK] Seq=4337 Ack=69536 Win=512 Len=0"
"118","8.512088","192.168.0.183","172.64.155.249","TLSv1.2","172","Application Data"
"119","8.512157","192.168.0.183","172.64.155.249","TLSv1.2","170","Application Data"
"120","8.523633","192.168.0.183","172.64.155.249","TLSv1.2","172","Application Data"
"121","8.529455","172.64.155.249","192.168.0.183","TCP","60","443  >  51124 [ACK] Seq=69536 Ack=4571 Win=63 Len=0"
"122","8.547680","172.64.155.249","192.168.0.183","TLSv1.2","279","Application Data"
"123","8.590714","192.168.0.183","172.64.155.249","TCP","54","51124  >  443 [ACK] Seq=4689 Ack=69761 Win=511 Len=0"
"124","8.694940","172.64.155.249","192.168.0.183","TLSv1.2","338","Application Data"
"125","8.694940","172.64.155.249","192.168.0.183","TLSv1.2","100","Application Data"
"126","8.694940","172.64.155.249","192.168.0.183","TLSv1.2","1323","Application Data"
"127","8.694940","172.64.155.249","192.168.0.183","TCP","1514","443  >  51124 [ACK] Seq=71360 Ack=4689 Win=63 Len=1460 [TCP segment of a reassembled PDU]"
"128","8.694988","192.168.0.183","172.64.155.249","TCP","54","51124  >  443 [ACK] Seq=4689 Ack=72820 Win=514 Len=0"
"129","8.695915","192.168.0.183","172.64.155.249","TLSv1.2","89","Application Data"
"130","8.697043","172.64.155.249","192.168.0.183","TCP","1514","443  >  51124 [ACK] Seq=72820 Ack=4689 Win=63 Len=1460 [TCP segment of a reassembled PDU]"
"131","8.697043","172.64.155.249","192.168.0.183","TCP","1514","443  >  51124 [ACK] Seq=74280 Ack=4689 Win=63 Len=1460 [TCP segment of a reassembled PDU]"
"132","8.697043","172.64.155.249","192.168.0.183","TLSv1.2","613","Application Data"
"133","8.697043","172.64.155.249","192.168.0.183","TCP","1514","443  >  51124 [ACK] Seq=76299 Ack=4689 Win=63 Len=1460 [TCP segment of a reassembled PDU]"
"134","8.697043","172.64.155.249","192.168.0.183","TLSv1.2","929","Application Data"
"135","8.697081","192.168.0.183","172.64.155.249","TCP","54","51124  >  443 [ACK] Seq=4724 Ack=78634 Win=514 Len=0"
"136","8.705137","172.64.155.249","192.168.0.183","TCP","1514","443  >  51124 [ACK] Seq=78634 Ack=4689 Win=63 Len=1460 [TCP segment of a reassembled PDU]"
"137","8.705137","172.64.155.249","192.168.0.183","TLSv1.2","1493","Application Data"
"138","8.705207","192.168.0.183","172.64.155.249","TCP","54","51124  >  443 [ACK] Seq=4724 Ack=81533 Win=514 Len=0"
"139","8.706659","172.64.155.249","192.168.0.183","TLSv1.2","1422","Application Data"
"140","8.706659","172.64.155.249","192.168.0.183","TCP","1514","443  >  51124 [ACK] Seq=82901 Ack=4689 Win=63 Len=1460 [TCP segment of a reassembled PDU]"
"141","8.706659","172.64.155.249","192.168.0.183","TCP","1514","443  >  51124 [ACK] Seq=84361 Ack=4689 Win=63 Len=1460 [TCP segment of a reassembled PDU]"
"142","8.706659","172.64.155.249","192.168.0.183","TLSv1.2","504","Application Data"
"143","8.706754","192.168.0.183","172.64.155.249","TCP","54","51124  >  443 [ACK] Seq=4724 Ack=86271 Win=514 Len=0"
"144","8.709401","172.64.155.249","192.168.0.183","TCP","1514","443  >  51124 [ACK] Seq=86271 Ack=4724 Win=63 Len=1460 [TCP segment of a reassembled PDU]"
"145","8.709401","172.64.155.249","192.168.0.183","TCP","1514","443  >  51124 [ACK] Seq=87731 Ack=4724 Win=63 Len=1460 [TCP segment of a reassembled PDU]"
"146","8.709401","172.64.155.249","192.168.0.183","TCP","1514","443  >  51124 [ACK] Seq=89191 Ack=4724 Win=63 Len=1460 [TCP segment of a reassembled PDU]"
"147","8.709401","172.64.155.249","192.168.0.183","TCP","1514","443  >  51124 [ACK] Seq=90651 Ack=4724 Win=63 Len=1460 [TCP segment of a reassembled PDU]"
"148","8.709401","172.64.155.249","192.168.0.183","TCP","1514","443  >  51124 [ACK] Seq=92111 Ack=4724 Win=63 Len=1460 [TCP segment of a reassembled PDU]"
"149","8.709401","172.64.155.249","192.168.0.183","TCP","1514","443  >  51124 [PSH, ACK] Seq=93571 Ack=4724 Win=63 Len=1460 [TCP segment of a reassembled PDU]"
"150","8.709401","172.64.155.249","192.168.0.183","TCP","1514","443  >  51124 [ACK] Seq=95031 Ack=4724 Win=63 Len=1460 [TCP segment of a reassembled PDU]"
"151","8.709401","172.64.155.249","192.168.0.183","TCP","1514","443  >  51124 [ACK] Seq=96491 Ack=4724 Win=63 Len=1460 [TCP segment of a reassembled PDU]"
"152","8.709401","172.64.155.249","192.168.0.183","TCP","1514","443  >  51124 [ACK] Seq=97951 Ack=4724 Win=63 Len=1460 [TCP segment of a reassembled PDU]"
"153","8.709401","172.64.155.249","192.168.0.183","TLSv1.2","1178","Application Data"
"154","8.709503","192.168.0.183","172.64.155.249","TCP","54","51124  >  443 [ACK] Seq=4724 Ack=100535 Win=514 Len=0"
"155","8.716635","172.64.155.249","192.168.0.183","TCP","1514","443  >  51124 [ACK] Seq=100535 Ack=4724 Win=63 Len=1460 [TCP segment of a reassembled PDU]"
"156","8.716635","172.64.155.249","192.168.0.183","TCP","1514","443  >  51124 [ACK] Seq=101995 Ack=4724 Win=63 Len=1460 [TCP segment of a reassembled PDU]"
"157","8.716635","172.64.155.249","192.168.0.183","TLSv1.2","922","Application Data"
"158","8.716635","172.64.155.249","192.168.0.183","TLSv1.2","127","Application Data, Application Data"
"159","8.716706","192.168.0.183","172.64.155.249","TCP","54","51124  >  443 [ACK] Seq=4724 Ack=104396 Win=514 Len=0"
"160","8.773403","192.168.0.183","172.64.155.249","TLSv1.2","185","Application Data"
"161","8.787388","172.64.155.249","192.168.0.183","TCP","60","443  >  51134 [ACK] Seq=637 Ack=355 Win=8 Len=0"
"162","8.814808","172.64.155.249","192.168.0.183","TLSv1.2","472","Application Data"
"163","8.814808","172.64.155.249","192.168.0.183","TLSv1.2","203","Application Data"
"164","8.814808","172.64.155.249","192.168.0.183","TLSv1.2","85","Application Data"
"165","8.814873","192.168.0.183","172.64.155.249","TCP","54","51134  >  443 [ACK] Seq=355 Ack=1235 Win=511 Len=0"
"166","8.815692","192.168.0.183","172.64.155.249","TLSv1.2","89","Application Data"
"167","8.867140","172.64.155.249","192.168.0.183","TCP","60","443  >  51134 [ACK] Seq=1235 Ack=390 Win=8 Len=0"
"168","9.135530","192.168.0.183","172.64.155.249","TLSv1.2","546","Application Data"
"169","9.135588","192.168.0.183","172.64.155.249","TLSv1.2","556","Application Data"
"170","9.149077","172.64.155.249","192.168.0.183","TCP","60","443  >  51124 [ACK] Seq=104396 Ack=5718 Win=64 Len=0"
"171","9.179831","172.64.155.249","192.168.0.183","TLSv1.2","277","Application Data"
"172","9.179831","172.64.155.249","192.168.0.183","TLSv1.2","85","Application Data"
"173","9.179873","192.168.0.183","172.64.155.249","TCP","54","51124  >  443 [ACK] Seq=5718 Ack=104650 Win=513 Len=0"
"174","12.904630","192.168.0.183","172.64.155.249","TLSv1.2","420","Application Data"
"175","12.904764","192.168.0.183","172.64.155.249","TLSv1.2","596","Application Data"
"176","12.917955","192.168.0.183","172.64.155.249","TLSv1.2","416","Application Data"
"177","12.919046","172.64.155.249","192.168.0.183","TCP","60","443  >  51124 [ACK] Seq=104650 Ack=6626 Win=65 Len=0"
"178","12.941790","172.64.155.249","192.168.0.183","TLSv1.2","278","Application Data"
"179","12.941790","172.64.155.249","192.168.0.183","TLSv1.2","85","Application Data"
"180","12.941829","192.168.0.183","172.64.155.249","TCP","54","51124  >  443 [ACK] Seq=6988 Ack=104905 Win=512 Len=0"
"181","12.971790","172.64.155.249","192.168.0.183","TLSv1.2","171","Application Data"
"182","12.971790","172.64.155.249","192.168.0.183","TLSv1.2","100","Application Data"
"183","12.971790","172.64.155.249","192.168.0.183","TLSv1.2","1313","Application Data"
"184","12.971869","192.168.0.183","172.64.155.249","TCP","54","51124  >  443 [ACK] Seq=6988 Ack=106327 Win=514 Len=0"
"185","12.974037","172.64.155.249","192.168.0.183","TCP","1514","443  >  51124 [ACK] Seq=106327 Ack=6988 Win=65 Len=1460 [TCP segment of a reassembled PDU]"
"186","12.974037","172.64.155.249","192.168.0.183","TCP","1514","443  >  51124 [ACK] Seq=107787 Ack=6988 Win=65 Len=1460 [TCP segment of a reassembled PDU]"
"187","12.974037","172.64.155.249","192.168.0.183","TCP","1514","443  >  51124 [ACK] Seq=109247 Ack=6988 Win=65 Len=1460 [TCP segment of a reassembled PDU]"
"188","12.974037","172.64.155.249","192.168.0.183","TLSv1.2","662","Application Data"
"189","12.974037","172.64.155.249","192.168.0.183","TCP","1514","443  >  51124 [ACK] Seq=111315 Ack=6988 Win=65 Len=1460 [TCP segment of a reassembled PDU]"
"190","12.974037","172.64.155.249","192.168.0.183","TLSv1.2","1297","Application Data"
"191","12.974037","172.64.155.249","192.168.0.183","TLSv1.2","1179","Application Data"
"192","12.974109","192.168.0.183","172.64.155.249","TCP","54","51124  >  443 [ACK] Seq=6988 Ack=115143 Win=514 Len=0"
"193","12.983426","172.64.155.249","192.168.0.183","TCP","1514","443  >  51124 [ACK] Seq=115143 Ack=6988 Win=65 Len=1460 [TCP segment of a reassembled PDU]"
"194","12.983426","172.64.155.249","192.168.0.183","TLSv1.2","1140","Application Data"
"195","12.983469","192.168.0.183","172.64.155.249","TCP","54","51124  >  443 [ACK] Seq=6988 Ack=117689 Win=514 Len=0"
"196","12.989777","172.64.155.249","192.168.0.183","TCP","1514","443  >  51124 [ACK] Seq=117689 Ack=6988 Win=65 Len=1460 [TCP segment of a reassembled PDU]"
"197","12.989777","172.64.155.249","192.168.0.183","TCP","1514","443  >  51124 [ACK] Seq=119149 Ack=6988 Win=65 Len=1460 [TCP segment of a reassembled PDU]"
"198","12.989777","172.64.155.249","192.168.0.183","TCP","1514","443  >  51124 [ACK] Seq=120609 Ack=6988 Win=65 Len=1460 [TCP segment of a reassembled PDU]"
"199","12.989777","172.64.155.249","192.168.0.183","TCP","1514","443  >  51124 [ACK] Seq=122069 Ack=6988 Win=65 Len=1460 [TCP segment of a reassembled PDU]"
"200","12.989777","172.64.155.249","192.168.0.183","TCP","1514","443  >  51124 [ACK] Seq=123529 Ack=6988 Win=65 Len=1460 [TCP segment of a reassembled PDU]"
"201","12.989777","172.64.155.249","192.168.0.183","TCP","1514","443  >  51124 [PSH, ACK] Seq=124989 Ack=6988 Win=65 Len=1460 [TCP segment of a reassembled PDU]"
"202","12.989777","172.64.155.249","192.168.0.183","TCP","1514","443  >  51124 [ACK] Seq=126449 Ack=6988 Win=65 Len=1460 [TCP segment of a reassembled PDU]"
"203","12.989777","172.64.155.249","192.168.0.183","TCP","1514","443  >  51124 [ACK] Seq=127909 Ack=6988 Win=65 Len=1460 [TCP segment of a reassembled PDU]"
"204","12.989777","172.64.155.249","192.168.0.183","TCP","1514","443  >  51124 [ACK] Seq=129369 Ack=6988 Win=65 Len=1460 [TCP segment of a reassembled PDU]"
"205","12.989777","172.64.155.249","192.168.0.183","TCP","1514","443  >  51124 [ACK] Seq=130829 Ack=6988 Win=65 Len=1460 [TCP segment of a reassembled PDU]"
"206","12.989777","172.64.155.249","192.168.0.183","TCP","1514","443  >  51124 [ACK] Seq=132289 Ack=6988 Win=65 Len=1460 [TCP segment of a reassembled PDU]"
"207","12.989777","172.64.155.249","192.168.0.183","TLSv1.2","400","Application Data"
"208","12.989777","172.64.155.249","192.168.0.183","TCP","1514","443  >  51124 [ACK] Seq=134095 Ack=6988 Win=65 Len=1460 [TCP segment of a reassembled PDU]"
"209","12.989777","172.64.155.249","192.168.0.183","TLSv1.2","273","Application Data"
"210","12.989949","192.168.0.183","172.64.155.249","TCP","54","51124  >  443 [ACK] Seq=6988 Ack=135774 Win=514 Len=0"
"211","12.993203","172.64.155.249","192.168.0.183","TCP","1514","443  >  51124 [ACK] Seq=135774 Ack=6988 Win=65 Len=1460 [TCP segment of a reassembled PDU]"
"212","12.993203","172.64.155.249","192.168.0.183","TCP","1514","443  >  51124 [ACK] Seq=137234 Ack=6988 Win=65 Len=1460 [TCP segment of a reassembled PDU]"
"213","12.993203","172.64.155.249","192.168.0.183","TLSv1.2","1370","Application Data"
"214","12.993203","172.64.155.249","192.168.0.183","TCP","1514","443  >  51124 [ACK] Seq=140010 Ack=6988 Win=65 Len=1460 [TCP segment of a reassembled PDU]"
"215","12.993203","172.64.155.249","192.168.0.183","TCP","1514","443  >  51124 [ACK] Seq=141470 Ack=6988 Win=65 Len=1460 [TCP segment of a reassembled PDU]"
"216","12.993203","172.64.155.249","192.168.0.183","TLSv1.2","774","Application Data"
"217","12.993275","192.168.0.183","172.64.155.249","TCP","54","51124  >  443 [ACK] Seq=6988 Ack=143650 Win=514 Len=0"
"218","12.995405","172.64.155.249","192.168.0.183","TCP","1514","443  >  51124 [ACK] Seq=143650 Ack=6988 Win=65 Len=1460 [TCP segment of a reassembled PDU]"
"219","12.995405","172.64.155.249","192.168.0.183","TCP","1514","443  >  51124 [ACK] Seq=145110 Ack=6988 Win=65 Len=1460 [TCP segment of a reassembled PDU]"
"220","12.995405","172.64.155.249","192.168.0.183","TCP","1514","443  >  51124 [ACK] Seq=146570 Ack=6988 Win=65 Len=1460 [TCP segment of a reassembled PDU]"
"221","12.995405","172.64.155.249","192.168.0.183","TLSv1.2","1067","Application Data"
"222","12.995405","172.64.155.249","192.168.0.183","TLSv1.2","96","Application Data"
"223","12.995405","172.64.155.249","192.168.0.183","TLSv1.2","85","Application Data"
"224","12.995457","192.168.0.183","172.64.155.249","TCP","54","51124  >  443 [ACK] Seq=6988 Ack=149116 Win=514 Len=0"
"225","13.082421","192.168.0.183","172.64.155.249","TLSv1.2","212","Application Data"
"226","13.082854","192.168.0.183","172.64.155.249","TLSv1.2","261","Application Data"
"227","13.098924","172.64.155.249","192.168.0.183","TCP","60","443  >  51134 [ACK] Seq=1235 Ack=548 Win=8 Len=0"
"228","13.124720","172.64.155.249","192.168.0.183","TLSv1.2","669","Application Data"
"229","13.124720","172.64.155.249","192.168.0.183","TLSv1.2","234","Application Data, Application Data"
"230","13.124818","192.168.0.183","172.64.155.249","TCP","54","51134  >  443 [ACK] Seq=548 Ack=2030 Win=508 Len=0"
"231","13.129823","172.64.155.249","192.168.0.183","TLSv1.2","291","Application Data"
"232","13.129823","172.64.155.249","192.168.0.183","TLSv1.2","151","Application Data, Application Data"
"233","13.129874","192.168.0.183","172.64.155.249","TCP","54","51124  >  443 [ACK] Seq=7195 Ack=149450 Win=512 Len=0"
"234","13.281755","192.168.0.183","172.64.155.249","TLSv1.2","574","Application Data"
"235","13.316704","172.64.155.249","192.168.0.183","TLSv1.2","144","Application Data"
"236","13.366682","192.168.0.183","172.64.155.249","TCP","54","51124  >  443 [ACK] Seq=7715 Ack=149540 Win=512 Len=0"
"237","13.705171","192.168.0.183","172.64.155.249","TLSv1.2","514","Application Data"
"238","13.705244","192.168.0.183","172.64.155.249","TLSv1.2","603","Application Data"
"239","13.726010","172.64.155.249","192.168.0.183","TCP","60","443  >  51124 [ACK] Seq=149540 Ack=8724 Win=66 Len=0"
"240","13.745414","172.64.155.249","192.168.0.183","TLSv1.2","144","Application Data"
"241","13.745414","172.64.155.249","192.168.0.183","TLSv1.2","85","Application Data"
"242","13.745455","192.168.0.183","172.64.155.249","TCP","54","51124  >  443 [ACK] Seq=8724 Ack=149661 Win=511 Len=0"
"243","15.086916","192.168.0.183","172.64.155.249","TLSv1.2","204","Application Data"
"244","15.151090","172.64.155.249","192.168.0.183","TCP","60","443  >  51124 [ACK] Seq=149661 Ack=8874 Win=67 Len=0"
"245","15.151090","172.64.155.249","192.168.0.183","TLSv1.2","280","Application Data"
"246","15.151090","172.64.155.249","192.168.0.183","TLSv1.2","100","Application Data"
"247","15.151090","172.64.155.249","192.168.0.183","TCP","1514","443  >  51124 [ACK] Seq=149933 Ack=8874 Win=67 Len=1460 [TCP segment of a reassembled PDU]"
"248","15.151090","172.64.155.249","192.168.0.183","TCP","1514","443  >  51124 [ACK] Seq=151393 Ack=8874 Win=67 Len=1460 [TCP segment of a reassembled PDU]"
"249","15.151090","172.64.155.249","192.168.0.183","TLSv1.2","842","Application Data"
"250","15.151090","172.64.155.249","192.168.0.183","TCP","1514","443  >  51124 [ACK] Seq=153641 Ack=8874 Win=67 Len=1460 [TCP segment of a reassembled PDU]"
"251","15.151145","192.168.0.183","172.64.155.249","TCP","54","51124  >  443 [ACK] Seq=8874 Ack=155101 Win=514 Len=0"
"252","15.152054","192.168.0.183","172.64.155.249","TLSv1.2","89","Application Data"
"253","15.152778","172.64.155.249","192.168.0.183","TCP","1514","443  >  51124 [ACK] Seq=155101 Ack=8874 Win=67 Len=1460 [TCP segment of a reassembled PDU]"
"254","15.152778","172.64.155.249","192.168.0.183","TLSv1.2","702","Application Data"
"255","15.152810","192.168.0.183","172.64.155.249","TCP","54","51124  >  443 [ACK] Seq=8909 Ack=157209 Win=514 Len=0"
"256","15.162641","172.64.155.249","192.168.0.183","TCP","1514","443  >  51124 [ACK] Seq=157209 Ack=8874 Win=67 Len=1460 [TCP segment of a reassembled PDU]"
"257","15.162641","172.64.155.249","192.168.0.183","TCP","1514","443  >  51124 [ACK] Seq=158669 Ack=8874 Win=67 Len=1460 [TCP segment of a reassembled PDU]"
"258","15.162641","172.64.155.249","192.168.0.183","TCP","1514","443  >  51124 [ACK] Seq=160129 Ack=8874 Win=67 Len=1460 [TCP segment of a reassembled PDU]"
"259","15.162641","172.64.155.249","192.168.0.183","TLSv1.2","510","Application Data"
"260","15.162641","172.64.155.249","192.168.0.183","TLSv1.2","1061","Application Data"
"261","15.162718","192.168.0.183","172.64.155.249","TCP","54","51124  >  443 [ACK] Seq=8909 Ack=163052 Win=514 Len=0"
"262","15.166254","172.64.155.249","192.168.0.183","TCP","60","443  >  51124 [ACK] Seq=163052 Ack=8909 Win=67 Len=0"
"263","15.166254","172.64.155.249","192.168.0.183","TCP","60","[TCP Dup ACK 262#1] 443  >  51124 [ACK] Seq=163052 Ack=8909 Win=67 Len=0"
"264","15.166254","172.64.155.249","192.168.0.183","TCP","1514","443  >  51124 [ACK] Seq=163052 Ack=8909 Win=67 Len=1460 [TCP segment of a reassembled PDU]"
"265","15.166254","172.64.155.249","192.168.0.183","TCP","1514","443  >  51124 [ACK] Seq=164512 Ack=8909 Win=67 Len=1460 [TCP segment of a reassembled PDU]"
"266","15.166254","172.64.155.249","192.168.0.183","TCP","1514","443  >  51124 [ACK] Seq=165972 Ack=8909 Win=67 Len=1460 [TCP segment of a reassembled PDU]"
"267","15.166254","172.64.155.249","192.168.0.183","TCP","1514","443  >  51124 [ACK] Seq=167432 Ack=8909 Win=67 Len=1460 [TCP segment of a reassembled PDU]"
"268","15.166254","172.64.155.249","192.168.0.183","TCP","1514","443  >  51124 [ACK] Seq=168892 Ack=8909 Win=67 Len=1460 [TCP segment of a reassembled PDU]"
"269","15.166254","172.64.155.249","192.168.0.183","TCP","1514","443  >  51124 [PSH, ACK] Seq=170352 Ack=8909 Win=67 Len=1460 [TCP segment of a reassembled PDU]"
"270","15.166254","172.64.155.249","192.168.0.183","TCP","1514","443  >  51124 [ACK] Seq=171812 Ack=8909 Win=67 Len=1460 [TCP segment of a reassembled PDU]"
"271","15.166254","172.64.155.249","192.168.0.183","TLSv1.2","319","Application Data"
"272","15.166254","172.64.155.249","192.168.0.183","TLSv1.2","127","Application Data, Application Data"
"273","15.166395","192.168.0.183","172.64.155.249","TCP","54","51124  >  443 [ACK] Seq=8909 Ack=173610 Win=514 Len=0"
"274","15.367331","192.168.0.183","172.64.155.249","TLSv1.2","218","Application Data"
"275","15.403555","172.64.155.249","192.168.0.183","TLSv1.2","153","Application Data"
"276","15.448724","192.168.0.183","172.64.155.249","TCP","54","51124  >  443 [ACK] Seq=9073 Ack=173709 Win=513 Len=0"
"277","15.532812","192.168.0.183","172.64.155.249","TLSv1.2","498","Application Data"
"278","15.532875","192.168.0.183","172.64.155.249","TLSv1.2","548","Application Data"
"279","15.547310","172.64.155.249","192.168.0.183","TCP","60","443  >  51124 [ACK] Seq=173709 Ack=10011 Win=68 Len=0"
"280","15.584641","172.64.155.249","192.168.0.183","TLSv1.2","144","Application Data"
"281","15.584641","172.64.155.249","192.168.0.183","TLSv1.2","85","Application Data"
"282","15.584675","192.168.0.183","172.64.155.249","TCP","54","51124  >  443 [ACK] Seq=10011 Ack=173830 Win=513 Len=0"
"283","19.954866","192.168.0.183","172.64.155.249","TLSv1.2","166","Application Data"
"284","19.955029","192.168.0.183","172.64.155.249","TLSv1.2","170","Application Data"
"285","19.967486","192.168.0.183","172.64.155.249","TLSv1.2","193","Application Data"
"286","19.968514","172.64.155.249","192.168.0.183","TCP","60","443  >  51124 [ACK] Seq=173830 Ack=10239 Win=68 Len=0"
"287","19.993097","172.64.155.249","192.168.0.183","TLSv1.2","279","Application Data"
"288","20.037491","192.168.0.183","172.64.155.249","TCP","54","51124  >  443 [ACK] Seq=10378 Ack=174055 Win=512 Len=0"
"289","20.154345","172.64.155.249","192.168.0.183","TLSv1.2","185","Application Data"
"290","20.154345","172.64.155.249","192.168.0.183","TLSv1.2","100","Application Data"
"291","20.154345","172.64.155.249","192.168.0.183","TCP","1514","443  >  51124 [ACK] Seq=174232 Ack=10378 Win=68 Len=1460 [TCP segment of a reassembled PDU]"
"292","20.154345","172.64.155.249","192.168.0.183","TCP","1514","443  >  51124 [ACK] Seq=175692 Ack=10378 Win=68 Len=1460 [TCP segment of a reassembled PDU]"
"293","20.154345","172.64.155.249","192.168.0.183","TCP","1514","443  >  51124 [ACK] Seq=177152 Ack=10378 Win=68 Len=1460 [TCP segment of a reassembled PDU]"
"294","20.154345","172.64.155.249","192.168.0.183","TLSv1.2","700","Application Data"
"295","20.154450","192.168.0.183","172.64.155.249","TCP","54","51124  >  443 [ACK] Seq=10378 Ack=179258 Win=514 Len=0"
"296","20.155750","192.168.0.183","172.64.155.249","TLSv1.2","89","Application Data"
"297","20.158239","172.64.155.249","192.168.0.183","TCP","1514","443  >  51124 [ACK] Seq=179258 Ack=10378 Win=68 Len=1460 [TCP segment of a reassembled PDU]"
"298","20.158239","172.64.155.249","192.168.0.183","TCP","1514","443  >  51124 [ACK] Seq=180718 Ack=10378 Win=68 Len=1460 [TCP segment of a reassembled PDU]"
"299","20.158239","172.64.155.249","192.168.0.183","TCP","1514","443  >  51124 [ACK] Seq=182178 Ack=10378 Win=68 Len=1460 [TCP segment of a reassembled PDU]"
"300","20.158239","172.64.155.249","192.168.0.183","TCP","1514","443  >  51124 [ACK] Seq=183638 Ack=10378 Win=68 Len=1460 [TCP segment of a reassembled PDU]"
"301","20.158239","172.64.155.249","192.168.0.183","TLSv1.2","138","Application Data"
"302","20.158339","192.168.0.183","172.64.155.249","TCP","54","51124  >  443 [ACK] Seq=10413 Ack=185182 Win=514 Len=0"
"303","20.176031","172.64.155.249","192.168.0.183","TCP","1514","443  >  51124 [ACK] Seq=185182 Ack=10378 Win=68 Len=1460 [TCP segment of a reassembled PDU]"
"304","20.176031","172.64.155.249","192.168.0.183","TLSv1.2","285","Application Data"
"305","20.176031","172.64.155.249","192.168.0.183","TCP","1514","443  >  51124 [ACK] Seq=186873 Ack=10413 Win=68 Len=1460 [TCP segment of a reassembled PDU]"
"306","20.176031","172.64.155.249","192.168.0.183","TCP","1514","443  >  51124 [ACK] Seq=188333 Ack=10413 Win=68 Len=1460 [TCP segment of a reassembled PDU]"
"307","20.176031","172.64.155.249","192.168.0.183","TCP","1514","443  >  51124 [ACK] Seq=189793 Ack=10413 Win=68 Len=1460 [TCP segment of a reassembled PDU]"
"308","20.176031","172.64.155.249","192.168.0.183","TCP","1514","443  >  51124 [ACK] Seq=191253 Ack=10413 Win=68 Len=1460 [TCP segment of a reassembled PDU]"
"309","20.176031","172.64.155.249","192.168.0.183","TCP","1514","443  >  51124 [ACK] Seq=192713 Ack=10413 Win=68 Len=1460 [TCP segment of a reassembled PDU]"
"310","20.176031","172.64.155.249","192.168.0.183","TCP","1514","443  >  51124 [PSH, ACK] Seq=194173 Ack=10413 Win=68 Len=1460 [TCP segment of a reassembled PDU]"
"311","20.176031","172.64.155.249","192.168.0.183","TCP","1514","443  >  51124 [ACK] Seq=195633 Ack=10413 Win=68 Len=1460 [TCP segment of a reassembled PDU]"
"312","20.176031","172.64.155.249","192.168.0.183","TCP","1514","443  >  51124 [ACK] Seq=197093 Ack=10413 Win=68 Len=1460 [TCP segment of a reassembled PDU]"
"313","20.176031","172.64.155.249","192.168.0.183","TCP","1514","443  >  51124 [ACK] Seq=198553 Ack=10413 Win=68 Len=1460 [TCP segment of a reassembled PDU]"
"314","20.176031","172.64.155.249","192.168.0.183","TLSv1.2","1219","Application Data"
"315","20.176031","172.64.155.249","192.168.0.183","TCP","1514","443  >  51124 [ACK] Seq=201178 Ack=10413 Win=68 Len=1460 [TCP segment of a reassembled PDU]"
"316","20.176031","172.64.155.249","192.168.0.183","TCP","1514","443  >  51124 [ACK] Seq=202638 Ack=10413 Win=68 Len=1460 [TCP segment of a reassembled PDU]"
"317","20.176031","172.64.155.249","192.168.0.183","TCP","1514","443  >  51124 [ACK] Seq=204098 Ack=10413 Win=68 Len=1460 [TCP segment of a reassembled PDU]"
"318","20.176031","172.64.155.249","192.168.0.183","TLSv1.2","738","Application Data"
"319","20.176031","172.64.155.249","192.168.0.183","TLSv1.2","127","Application Data, Application Data"
"320","20.176191","192.168.0.183","172.64.155.249","TCP","54","51124  >  443 [ACK] Seq=10413 Ack=206315 Win=514 Len=0"
"321","20.236331","192.168.0.183","172.64.155.249","TLSv1.2","184","Application Data"
"322","20.279096","172.64.155.249","192.168.0.183","TLSv1.2","473","Application Data"
"323","20.279096","172.64.155.249","192.168.0.183","TLSv1.2","203","Application Data"
"324","20.279096","172.64.155.249","192.168.0.183","TLSv1.2","85","Application Data"
"325","20.279187","192.168.0.183","172.64.155.249","TCP","54","51134  >  443 [ACK] Seq=678 Ack=2629 Win=514 Len=0"
"326","20.280209","192.168.0.183","172.64.155.249","TLSv1.2","89","Application Data"
"327","20.333204","172.64.155.249","192.168.0.183","TCP","60","443  >  51134 [ACK] Seq=2629 Ack=713 Win=8 Len=0"
"328","20.561071","192.168.0.183","172.64.155.249","TLSv1.2","676","Application Data"
"329","20.561134","192.168.0.183","172.64.155.249","TLSv1.2","554","Application Data"
"330","20.572906","172.64.155.249","192.168.0.183","TCP","60","443  >  51124 [ACK] Seq=206315 Ack=11535 Win=69 Len=0"
"331","20.596524","172.64.155.249","192.168.0.183","TLSv1.2","275","Application Data"
"332","20.596524","172.64.155.249","192.168.0.183","TLSv1.2","85","Application Data"
"333","20.596551","192.168.0.183","172.64.155.249","TCP","54","51124  >  443 [ACK] Seq=11535 Ack=206567 Win=513 Len=0"
"334","23.122260","192.168.0.183","172.64.155.249","TLSv1.2","665","Application Data"
"335","23.122408","192.168.0.183","172.64.155.249","TLSv1.2","594","Application Data"
"336","23.137200","172.64.155.249","192.168.0.183","TCP","60","443  >  51124 [ACK] Seq=206567 Ack=12686 Win=69 Len=0"
"337","23.141910","192.168.0.183","172.64.155.249","TLSv1.2","361","Application Data"
"338","23.158624","172.64.155.249","192.168.0.183","TLSv1.2","470","Application Data"
"339","23.158624","172.64.155.249","192.168.0.183","TLSv1.2","85","Application Data"
"340","23.158670","192.168.0.183","172.64.155.249","TCP","54","51124  >  443 [ACK] Seq=12993 Ack=207014 Win=511 Len=0"
"341","23.194967","172.64.155.249","192.168.0.183","TLSv1.2","146","Application Data"
"342","23.194967","172.64.155.249","192.168.0.183","TLSv1.2","100","Application Data"
"343","23.194967","172.64.155.249","192.168.0.183","TLSv1.2","1307","Application Data"
"344","23.195010","192.168.0.183","172.64.155.249","TCP","54","51124  >  443 [ACK] Seq=12993 Ack=208405 Win=514 Len=0"
"345","23.196587","172.64.155.249","192.168.0.183","TCP","1514","443  >  51124 [ACK] Seq=208405 Ack=12993 Win=70 Len=1460 [TCP segment of a reassembled PDU]"
"346","23.196587","172.64.155.249","192.168.0.183","TCP","1514","443  >  51124 [ACK] Seq=209865 Ack=12993 Win=70 Len=1460 [TCP segment of a reassembled PDU]"
"347","23.196587","172.64.155.249","192.168.0.183","TCP","1514","443  >  51124 [ACK] Seq=211325 Ack=12993 Win=70 Len=1460 [TCP segment of a reassembled PDU]"
"348","23.196587","172.64.155.249","192.168.0.183","TLSv1.2","676","Application Data"
"349","23.196587","172.64.155.249","192.168.0.183","TCP","1514","443  >  51124 [ACK] Seq=213407 Ack=12993 Win=70 Len=1460 [TCP segment of a reassembled PDU]"
"350","23.196688","192.168.0.183","172.64.155.249","TCP","54","51124  >  443 [ACK] Seq=12993 Ack=214867 Win=514 Len=0"
"351","23.198331","172.64.155.249","192.168.0.183","TCP","1514","443  >  51124 [ACK] Seq=214867 Ack=12993 Win=70 Len=1460 [TCP segment of a reassembled PDU]"
"352","23.198331","172.64.155.249","192.168.0.183","TLSv1.2","905","Application Data"
"353","23.198397","192.168.0.183","172.64.155.249","TCP","54","51124  >  443 [ACK] Seq=12993 Ack=217178 Win=514 Len=0"
"354","23.209995","172.64.155.249","192.168.0.183","TCP","1514","443  >  51124 [ACK] Seq=217178 Ack=12993 Win=70 Len=1460 [TCP segment of a reassembled PDU]"
"355","23.209995","172.64.155.249","192.168.0.183","TLSv1.2","1171","Application Data"
"356","23.209995","172.64.155.249","192.168.0.183","TCP","1514","443  >  51124 [ACK] Seq=219755 Ack=12993 Win=70 Len=1460 [TCP segment of a reassembled PDU]"
"357","23.209995","172.64.155.249","192.168.0.183","TLSv1.2","1067","Application Data"
"358","23.209995","172.64.155.249","192.168.0.183","TCP","1514","443  >  51124 [ACK] Seq=222228 Ack=12993 Win=70 Len=1460 [TCP segment of a reassembled PDU]"
"359","23.209995","172.64.155.249","192.168.0.183","TLSv1.2","996","Application Data"
"360","23.209995","172.64.155.249","192.168.0.183","TCP","1514","443  >  51124 [ACK] Seq=224630 Ack=12993 Win=70 Len=1460 [TCP segment of a reassembled PDU]"
"361","23.209995","172.64.155.249","192.168.0.183","TCP","1514","443  >  51124 [ACK] Seq=226090 Ack=12993 Win=70 Len=1460 [TCP segment of a reassembled PDU]"
"362","23.209995","172.64.155.249","192.168.0.183","TCP","1514","443  >  51124 [ACK] Seq=227550 Ack=12993 Win=70 Len=1460 [TCP segment of a reassembled PDU]"
"363","23.209995","172.64.155.249","192.168.0.183","TLSv1.2","167","Application Data"
"364","23.210084","192.168.0.183","172.64.155.249","TCP","54","51124  >  443 [ACK] Seq=12993 Ack=229123 Win=514 Len=0"
"365","23.225099","172.64.155.249","192.168.0.183","TCP","1514","443  >  51124 [ACK] Seq=229123 Ack=12993 Win=70 Len=1460 [TCP segment of a reassembled PDU]"
"366","23.225099","172.64.155.249","192.168.0.183","TCP","1514","443  >  51124 [ACK] Seq=230583 Ack=12993 Win=70 Len=1460 [TCP segment of a reassembled PDU]"
"367","23.225099","172.64.155.249","192.168.0.183","TCP","1514","443  >  51124 [ACK] Seq=232043 Ack=12993 Win=70 Len=1460 [TCP segment of a reassembled PDU]"
"368","23.225099","172.64.155.249","192.168.0.183","TCP","1514","443  >  51124 [ACK] Seq=233503 Ack=12993 Win=70 Len=1460 [TCP segment of a reassembled PDU]"
"369","23.225099","172.64.155.249","192.168.0.183","TCP","1514","443  >  51124 [ACK] Seq=234963 Ack=12993 Win=70 Len=1460 [TCP segment of a reassembled PDU]"
"370","23.225099","172.64.155.249","192.168.0.183","TCP","1514","443  >  51124 [PSH, ACK] Seq=236423 Ack=12993 Win=70 Len=1460 [TCP segment of a reassembled PDU]"
"371","23.225099","172.64.155.249","192.168.0.183","TCP","1514","443  >  51124 [ACK] Seq=237883 Ack=12993 Win=70 Len=1460 [TCP segment of a reassembled PDU]"
"372","23.225099","172.64.155.249","192.168.0.183","TCP","1514","443  >  51124 [ACK] Seq=239343 Ack=12993 Win=70 Len=1460 [TCP segment of a reassembled PDU]"
"373","23.225099","172.64.155.249","192.168.0.183","TCP","1514","443  >  51124 [ACK] Seq=240803 Ack=12993 Win=70 Len=1460 [TCP segment of a reassembled PDU]"
"374","23.225099","172.64.155.249","192.168.0.183","TLSv1.2","154","Application Data"
"375","23.225099","172.64.155.249","192.168.0.183","TCP","1514","443  >  51124 [ACK] Seq=242363 Ack=12993 Win=70 Len=1460 [TCP segment of a reassembled PDU]"
"376","23.225099","172.64.155.249","192.168.0.183","TCP","1514","443  >  51124 [ACK] Seq=243823 Ack=12993 Win=70 Len=1460 [TCP segment of a reassembled PDU]"
"377","23.225099","172.64.155.249","192.168.0.183","TLSv1.2","432","Application Data"
"378","23.225099","172.64.155.249","192.168.0.183","TCP","1514","443  >  51124 [ACK] Seq=245661 Ack=12993 Win=70 Len=1460 [TCP segment of a reassembled PDU]"
"379","23.225099","172.64.155.249","192.168.0.183","TCP","1514","443  >  51124 [ACK] Seq=247121 Ack=12993 Win=70 Len=1460 [TCP segment of a reassembled PDU]"
"380","23.225099","172.64.155.249","192.168.0.183","TLSv1.2","821","Application Data"
"381","23.225099","172.64.155.249","192.168.0.183","TLSv1.2","96","Application Data"
"382","23.225099","172.64.155.249","192.168.0.183","TLSv1.2","85","Application Data"
"383","23.225275","192.168.0.183","172.64.155.249","TCP","54","51124  >  443 [ACK] Seq=12993 Ack=245661 Win=514 Len=0"
"384","23.225424","192.168.0.183","172.64.155.249","TCP","54","51124  >  443 [ACK] Seq=12993 Ack=249421 Win=514 Len=0"
"385","23.316435","192.168.0.183","172.64.155.249","TLSv1.2","213","Application Data"
"386","23.330909","172.64.155.249","192.168.0.183","TCP","60","443  >  51134 [ACK] Seq=2629 Ack=872 Win=8 Len=0"
"387","23.357590","172.64.155.249","192.168.0.183","TLSv1.2","471","Application Data"
"388","23.357590","172.64.155.249","192.168.0.183","TLSv1.2","203","Application Data"
"389","23.357590","172.64.155.249","192.168.0.183","TLSv1.2","85","Application Data"
"390","23.357659","192.168.0.183","172.64.155.249","TCP","54","51134  >  443 [ACK] Seq=872 Ack=3226 Win=511 Len=0"
"391","23.455538","192.168.0.183","172.64.155.249","TLSv1.2","301","Application Data"
"392","23.494099","172.64.155.249","192.168.0.183","TLSv1.2","144","Application Data"
"393","23.540874","192.168.0.183","172.64.155.249","TCP","54","51124  >  443 [ACK] Seq=13240 Ack=249511 Win=513 Len=0"
"394","23.848167","192.168.0.183","172.64.155.249","TLSv1.2","521","Application Data"
"395","23.848222","192.168.0.183","172.64.155.249","TLSv1.2","619","Application Data"
"396","23.864720","172.64.155.249","192.168.0.183","TCP","60","443  >  51124 [ACK] Seq=249511 Ack=14272 Win=71 Len=0"
"397","23.888775","172.64.155.249","192.168.0.183","TLSv1.2","144","Application Data"
"398","23.888775","172.64.155.249","192.168.0.183","TLSv1.2","85","Application Data"
"399","23.888846","192.168.0.183","172.64.155.249","TCP","54","51124  >  443 [ACK] Seq=14272 Ack=249632 Win=513 Len=0"
"400","26.249683","192.168.0.183","172.64.155.249","TLSv1.2","143","Application Data"
"401","26.297415","172.64.155.249","192.168.0.183","TCP","60","443  >  51124 [ACK] Seq=249632 Ack=14361 Win=71 Len=0"
"402","26.304123","172.64.155.249","192.168.0.183","TLSv1.2","322","Application Data"
"403","26.304123","172.64.155.249","192.168.0.183","TLSv1.2","100","Application Data"
"404","26.304123","172.64.155.249","192.168.0.183","TLSv1.2","1314","Application Data"
"405","26.304123","172.64.155.249","192.168.0.183","TCP","1514","443  >  51124 [ACK] Seq=251206 Ack=14361 Win=71 Len=1460 [TCP segment of a reassembled PDU]"
"406","26.304191","192.168.0.183","172.64.155.249","TCP","54","51124  >  443 [ACK] Seq=14361 Ack=252666 Win=514 Len=0"
"407","26.305328","192.168.0.183","172.64.155.249","TLSv1.2","89","Application Data"
"408","26.306349","172.64.155.249","192.168.0.183","TCP","1514","443  >  51124 [ACK] Seq=252666 Ack=14361 Win=71 Len=1460 [TCP segment of a reassembled PDU]"
"409","26.306349","172.64.155.249","192.168.0.183","TCP","1514","443  >  51124 [ACK] Seq=254126 Ack=14361 Win=71 Len=1460 [TCP segment of a reassembled PDU]"
"410","26.306349","172.64.155.249","192.168.0.183","TLSv1.2","608","Application Data"
"411","26.306349","172.64.155.249","192.168.0.183","TCP","1514","443  >  51124 [ACK] Seq=256140 Ack=14361 Win=71 Len=1460 [TCP segment of a reassembled PDU]"
"412","26.306349","172.64.155.249","192.168.0.183","TCP","1514","443  >  51124 [ACK] Seq=257600 Ack=14361 Win=71 Len=1460 [TCP segment of a reassembled PDU]"
"413","26.306349","172.64.155.249","192.168.0.183","TLSv1.2","701","Application Data"
"414","26.306415","192.168.0.183","172.64.155.249","TCP","54","51124  >  443 [ACK] Seq=14396 Ack=259707 Win=514 Len=0"
"415","26.314734","172.64.155.249","192.168.0.183","TCP","1514","443  >  51124 [ACK] Seq=259707 Ack=14361 Win=71 Len=1460 [TCP segment of a reassembled PDU]"
"416","26.314734","172.64.155.249","192.168.0.183","TLSv1.2","1077","Application Data"
"417","26.314734","172.64.155.249","192.168.0.183","TCP","1514","443  >  51124 [ACK] Seq=262190 Ack=14361 Win=71 Len=1460 [TCP segment of a reassembled PDU]"
"418","26.314734","172.64.155.249","192.168.0.183","TLSv1.2","141","Application Data"
"419","26.314803","192.168.0.183","172.64.155.249","TCP","54","51124  >  443 [ACK] Seq=14396 Ack=263737 Win=514 Len=0"
"420","26.319789","172.64.155.249","192.168.0.183","TCP","1514","443  >  51124 [ACK] Seq=263737 Ack=14361 Win=71 Len=1460 [TCP segment of a reassembled PDU]"
"421","26.319789","172.64.155.249","192.168.0.183","TCP","1514","443  >  51124 [ACK] Seq=265197 Ack=14361 Win=71 Len=1460 [TCP segment of a reassembled PDU]"
"422","26.319789","172.64.155.249","192.168.0.183","TLSv1.2","225","Application Data"
"423","26.319789","172.64.155.249","192.168.0.183","TLSv1.2","96","Application Data"
"424","26.319789","172.64.155.249","192.168.0.183","TLSv1.2","85","Application Data"
"425","26.319789","172.64.155.249","192.168.0.183","TCP","60","[TCP Dup ACK 424#1] 443  >  51124 [ACK] Seq=266901 Ack=14396 Win=71 Len=0"
"426","26.319890","192.168.0.183","172.64.155.249","TCP","54","51124  >  443 [ACK] Seq=14396 Ack=266901 Win=514 Len=0"
"427","26.572778","192.168.0.183","172.64.155.249","TLSv1.2","213","Application Data"
"428","26.609779","172.64.155.249","192.168.0.183","TLSv1.2","144","Application Data"
"429","26.659730","192.168.0.183","172.64.155.249","TCP","54","51124  >  443 [ACK] Seq=14555 Ack=266991 Win=513 Len=0"
"430","26.707781","192.168.0.183","172.64.155.249","TLSv1.2","534","Application Data"
"431","26.707851","192.168.0.183","172.64.155.249","TLSv1.2","540","Application Data"
"432","26.720795","172.64.155.249","192.168.0.183","TCP","60","443  >  51124 [ACK] Seq=266991 Ack=15521 Win=72 Len=0"
"433","26.744717","172.64.155.249","192.168.0.183","TLSv1.2","144","Application Data"
"434","26.744717","172.64.155.249","192.168.0.183","TLSv1.2","85","Application Data"
"435","26.744749","192.168.0.183","172.64.155.249","TCP","54","51124  >  443 [ACK] Seq=15521 Ack=267112 Win=513 Len=0"
"436","30.709563","192.168.0.183","172.64.155.249","TLSv1.2","340","Application Data"
"437","30.709631","192.168.0.183","172.64.155.249","TLSv1.2","170","Application Data"
"438","30.720518","192.168.0.183","172.64.155.249","TLSv1.2","215","Application Data"
"439","30.723031","172.64.155.249","192.168.0.183","TCP","60","443  >  51124 [ACK] Seq=267112 Ack=15923 Win=72 Len=0"
"440","30.745790","172.64.155.249","192.168.0.183","TLSv1.2","279","Application Data"
"441","30.763212","172.64.155.249","192.168.0.183","TLSv1.2","145","Application Data"
"442","30.763212","172.64.155.249","192.168.0.183","TLSv1.2","100","Application Data"
"443","30.763212","172.64.155.249","192.168.0.183","TLSv1.2","1303","Application Data"
"444","30.763254","192.168.0.183","172.64.155.249","TCP","54","51124  >  443 [ACK] Seq=16084 Ack=268723 Win=514 Len=0"
"445","30.764818","172.64.155.249","192.168.0.183","TCP","1514","443  >  51124 [ACK] Seq=268723 Ack=16084 Win=72 Len=1460 [TCP segment of a reassembled PDU]"
"446","30.764818","172.64.155.249","192.168.0.183","TCP","1514","443  >  51124 [ACK] Seq=270183 Ack=16084 Win=72 Len=1460 [TCP segment of a reassembled PDU]"
"447","30.764818","172.64.155.249","192.168.0.183","TCP","1514","443  >  51124 [ACK] Seq=271643 Ack=16084 Win=72 Len=1460 [TCP segment of a reassembled PDU]"
"448","30.764818","172.64.155.249","192.168.0.183","TLSv1.2","656","Application Data"
"449","30.764818","172.64.155.249","192.168.0.183","TCP","1514","443  >  51124 [ACK] Seq=273705 Ack=16084 Win=72 Len=1460 [TCP segment of a reassembled PDU]"
"450","30.764818","172.64.155.249","192.168.0.183","TLSv1.2","1224","Application Data"
"451","30.764878","192.168.0.183","172.64.155.249","TCP","54","51124  >  443 [ACK] Seq=16084 Ack=276335 Win=514 Len=0"
"452","30.773317","172.64.155.249","192.168.0.183","TCP","1514","443  >  51124 [ACK] Seq=276335 Ack=16084 Win=72 Len=1460 [TCP segment of a reassembled PDU]"
"453","30.773317","172.64.155.249","192.168.0.183","TLSv1.2","1116","Application Data"
"454","30.773401","192.168.0.183","172.64.155.249","TCP","54","51124  >  443 [ACK] Seq=16084 Ack=278857 Win=514 Len=0"
"455","30.775824","172.64.155.249","192.168.0.183","TCP","1514","443  >  51124 [ACK] Seq=278857 Ack=16084 Win=72 Len=1460 [TCP segment of a reassembled PDU]"
"456","30.775824","172.64.155.249","192.168.0.183","TLSv1.2","989","Application Data"
"457","30.775824","172.64.155.249","192.168.0.183","TCP","1514","443  >  51124 [ACK] Seq=281252 Ack=16084 Win=72 Len=1460 [TCP segment of a reassembled PDU]"
"458","30.775913","192.168.0.183","172.64.155.249","TCP","54","51124  >  443 [ACK] Seq=16084 Ack=282712 Win=514 Len=0"
"459","30.778132","172.64.155.249","192.168.0.183","TCP","1514","443  >  51124 [ACK] Seq=282712 Ack=16084 Win=72 Len=1460 [TCP segment of a reassembled PDU]"
"460","30.778132","172.64.155.249","192.168.0.183","TCP","1514","443  >  51124 [ACK] Seq=284172 Ack=16084 Win=72 Len=1460 [TCP segment of a reassembled PDU]"
"461","30.778132","172.64.155.249","192.168.0.183","TLSv1.2","342","Application Data"
"462","30.778132","172.64.155.249","192.168.0.183","TCP","1514","443  >  51124 [ACK] Seq=285920 Ack=16084 Win=72 Len=1460 [TCP segment of a reassembled PDU]"
"463","30.778132","172.64.155.249","192.168.0.183","TCP","1514","443  >  51124 [ACK] Seq=287380 Ack=16084 Win=72 Len=1460 [TCP segment of a reassembled PDU]"
"464","30.778132","172.64.155.249","192.168.0.183","TLSv1.2","1335","Application Data"
"465","30.778203","192.168.0.183","172.64.155.249","TCP","54","51124  >  443 [ACK] Seq=16084 Ack=290121 Win=514 Len=0"
"466","30.779111","172.64.155.249","192.168.0.183","TCP","1514","443  >  51124 [ACK] Seq=290121 Ack=16084 Win=72 Len=1460 [TCP segment of a reassembled PDU]"
"467","30.779111","172.64.155.249","192.168.0.183","TCP","1514","443  >  51124 [ACK] Seq=291581 Ack=16084 Win=72 Len=1460 [TCP segment of a reassembled PDU]"
"468","30.779111","172.64.155.249","192.168.0.183","TCP","1514","443  >  51124 [ACK] Seq=293041 Ack=16084 Win=72 Len=1460 [TCP segment of a reassembled PDU]"
"469","30.779111","172.64.155.249","192.168.0.183","TLSv1.2","586","Application Data"
"470","30.779111","172.64.155.249","192.168.0.183","TCP","1514","443  >  51124 [ACK] Seq=295033 Ack=16084 Win=72 Len=1460 [TCP segment of a reassembled PDU]"
"471","30.779111","172.64.155.249","192.168.0.183","TLSv1.2","1181","Application Data"
"472","30.779172","192.168.0.183","172.64.155.249","TCP","54","51124  >  443 [ACK] Seq=16084 Ack=297620 Win=514 Len=0"
"473","30.784683","172.64.155.249","192.168.0.183","TCP","1514","443  >  51124 [ACK] Seq=297620 Ack=16084 Win=72 Len=1460 [TCP segment of a reassembled PDU]"
"474","30.784683","172.64.155.249","192.168.0.183","TCP","1514","443  >  51124 [ACK] Seq=299080 Ack=16084 Win=72 Len=1460 [TCP segment of a reassembled PDU]"
"475","30.784683","172.64.155.249","192.168.0.183","TLSv1.2","951","Application Data"
"476","30.784883","192.168.0.183","172.64.155.249","TCP","54","51124  >  443 [ACK] Seq=16084 Ack=301437 Win=514 Len=0"
"477","30.788015","172.64.155.249","192.168.0.183","TCP","1514","443  >  51124 [ACK] Seq=301437 Ack=16084 Win=72 Len=1460 [TCP segment of a reassembled PDU]"
"478","30.788015","172.64.155.249","192.168.0.183","TCP","1514","443  >  51124 [ACK] Seq=302897 Ack=16084 Win=72 Len=1460 [TCP segment of a reassembled PDU]"
"479","30.788015","172.64.155.249","192.168.0.183","TCP","1514","443  >  51124 [ACK] Seq=304357 Ack=16084 Win=72 Len=1460 [TCP segment of a reassembled PDU]"
"480","30.788015","172.64.155.249","192.168.0.183","TLSv1.2","181","Application Data"
"481","30.788015","172.64.155.249","192.168.0.183","TCP","1514","443  >  51124 [ACK] Seq=305944 Ack=16084 Win=72 Len=1460 [TCP segment of a reassembled PDU]"
"482","30.788015","172.64.155.249","192.168.0.183","TCP","1514","443  >  51124 [ACK] Seq=307404 Ack=16084 Win=72 Len=1460 [TCP segment of a reassembled PDU]"
"483","30.788015","172.64.155.249","192.168.0.183","TLSv1.2","330","Application Data"
"484","30.788015","172.64.155.249","192.168.0.183","TLSv1.2","96","Application Data"
"485","30.788015","172.64.155.249","192.168.0.183","TLSv1.2","85","Application Data"
"486","30.788096","192.168.0.183","172.64.155.249","TCP","54","51124  >  443 [ACK] Seq=16084 Ack=309213 Win=514 Len=0"
"487","30.852178","192.168.0.183","172.64.155.249","TLSv1.2","207","Application Data"
"488","30.903652","172.64.155.249","192.168.0.183","TLSv1.2","471","Application Data"
"489","30.903652","172.64.155.249","192.168.0.183","TLSv1.2","203","Application Data"
"490","30.903652","172.64.155.249","192.168.0.183","TLSv1.2","85","Application Data"
"491","30.903701","192.168.0.183","172.64.155.249","TCP","54","51134  >  443 [ACK] Seq=1025 Ack=3823 Win=509 Len=0"
"492","30.904678","192.168.0.183","172.64.155.249","TLSv1.2","89","Application Data"
"493","30.964216","172.64.155.249","192.168.0.183","TCP","60","443  >  51134 [ACK] Seq=3823 Ack=1060 Win=8 Len=0"
"494","31.045885","192.168.0.183","172.64.155.249","TLSv1.2","213","Application Data"
"495","31.046003","192.168.0.183","172.64.155.249","TLSv1.2","548","Application Data"
"496","31.085220","172.64.155.249","192.168.0.183","TCP","60","443  >  51124 [ACK] Seq=309213 Ack=16737 Win=73 Len=0"
"497","31.097191","172.64.155.249","192.168.0.183","TLSv1.2","284","Application Data"
"498","31.097191","172.64.155.249","192.168.0.183","TLSv1.2","158","Application Data"
"499","31.097191","172.64.155.249","192.168.0.183","TLSv1.2","563","Application Data"
"500","31.097191","172.64.155.249","192.168.0.183","TLSv1.2","85","Application Data"
"501","31.097258","192.168.0.183","172.64.155.249","TCP","54","51124  >  443 [ACK] Seq=16737 Ack=310087 Win=510 Len=0"
"502","31.464939","192.168.0.183","172.64.155.249","TLSv1.2","489","Application Data"
"503","31.465032","192.168.0.183","172.64.155.249","TLSv1.2","559","Application Data"
"504","31.478560","172.64.155.249","192.168.0.183","TCP","60","443  >  51124 [ACK] Seq=310087 Ack=17677 Win=74 Len=0"
"505","31.502993","172.64.155.249","192.168.0.183","TLSv1.2","144","Application Data"
"506","31.502993","172.64.155.249","192.168.0.183","TLSv1.2","85","Application Data"
"507","31.503041","192.168.0.183","172.64.155.249","TCP","54","51124  >  443 [ACK] Seq=17677 Ack=310208 Win=510 Len=0"
"508","33.546004","192.168.0.183","172.64.155.249","TLSv1.2","309","Application Data"
"509","33.599402","172.64.155.249","192.168.0.183","TCP","60","443  >  51124 [ACK] Seq=310208 Ack=17932 Win=74 Len=0"
"510","33.720704","172.64.155.249","192.168.0.183","TLSv1.2","295","Application Data"
"511","33.720704","172.64.155.249","192.168.0.183","TLSv1.2","100","Application Data"
"512","33.720704","172.64.155.249","192.168.0.183","TCP","1514","443  >  51124 [ACK] Seq=310495 Ack=17932 Win=74 Len=1460 [TCP segment of a reassembled PDU]"
"513","33.720704","172.64.155.249","192.168.0.183","TCP","1514","443  >  51124 [ACK] Seq=311955 Ack=17932 Win=74 Len=1460 [TCP segment of a reassembled PDU]"
"514","33.720704","172.64.155.249","192.168.0.183","TLSv1.2","881","Application Data"
"515","33.720704","172.64.155.249","192.168.0.183","TCP","1514","443  >  51124 [ACK] Seq=314242 Ack=17932 Win=74 Len=1460 [TCP segment of a reassembled PDU]"
"516","33.720704","172.64.155.249","192.168.0.183","TLSv1.2","933","Application Data"
"517","33.720761","192.168.0.183","172.64.155.249","TCP","54","51124  >  443 [ACK] Seq=17932 Ack=316581 Win=514 Len=0"
"518","33.721681","192.168.0.183","172.64.155.249","TLSv1.2","89","Application Data"
"519","33.722992","172.64.155.249","192.168.0.183","TCP","1514","443  >  51124 [ACK] Seq=316581 Ack=17932 Win=74 Len=1460 [TCP segment of a reassembled PDU]"
"520","33.722992","172.64.155.249","192.168.0.183","TLSv1.2","927","Application Data"
"521","33.723073","192.168.0.183","172.64.155.249","TCP","54","51124  >  443 [ACK] Seq=17967 Ack=318914 Win=514 Len=0"
"522","33.731567","172.64.155.249","192.168.0.183","TCP","1514","443  >  51124 [ACK] Seq=318914 Ack=17932 Win=74 Len=1460 [TCP segment of a reassembled PDU]"
"523","33.731567","172.64.155.249","192.168.0.183","TLSv1.2","1364","Application Data"
"524","33.731744","192.168.0.183","172.64.155.249","TCP","54","51124  >  443 [ACK] Seq=17967 Ack=321684 Win=514 Len=0"
"525","33.733322","172.64.155.249","192.168.0.183","TCP","1514","443  >  51124 [ACK] Seq=321684 Ack=17932 Win=74 Len=1460 [TCP segment of a reassembled PDU]"
"526","33.733322","172.64.155.249","192.168.0.183","TCP","1514","443  >  51124 [ACK] Seq=323144 Ack=17932 Win=74 Len=1460 [TCP segment of a reassembled PDU]"
"527","33.733322","172.64.155.249","192.168.0.183","TCP","1514","443  >  51124 [ACK] Seq=324604 Ack=17932 Win=74 Len=1460 [TCP segment of a reassembled PDU]"
"528","33.733322","172.64.155.249","192.168.0.183","TCP","1514","443  >  51124 [ACK] Seq=326064 Ack=17932 Win=74 Len=1460 [TCP segment of a reassembled PDU]"
"529","33.733322","172.64.155.249","192.168.0.183","TLSv1.2","354","Application Data"
"530","33.733322","172.64.155.249","192.168.0.183","TCP","60","443  >  51124 [ACK] Seq=327824 Ack=17967 Win=74 Len=0"
"531","33.733416","192.168.0.183","172.64.155.249","TCP","54","51124  >  443 [ACK] Seq=17967 Ack=327824 Win=514 Len=0"
"532","33.735111","172.64.155.249","192.168.0.183","TCP","1514","443  >  51124 [ACK] Seq=327824 Ack=17967 Win=74 Len=1460 [TCP segment of a reassembled PDU]"
"533","33.735111","172.64.155.249","192.168.0.183","TCP","1514","443  >  51124 [ACK] Seq=329284 Ack=17967 Win=74 Len=1460 [TCP segment of a reassembled PDU]"
"534","33.735111","172.64.155.249","192.168.0.183","TCP","1514","443  >  51124 [ACK] Seq=330744 Ack=17967 Win=74 Len=1460 [TCP segment of a reassembled PDU]"
"535","33.735111","172.64.155.249","192.168.0.183","TLSv1.2","965","Application Data"
"536","33.735111","172.64.155.249","192.168.0.183","TLSv1.2","96","Application Data"
"537","33.735111","172.64.155.249","192.168.0.183","TLSv1.2","85","Application Data"
"538","33.735208","192.168.0.183","172.64.155.249","TCP","54","51124  >  443 [ACK] Seq=17967 Ack=333188 Win=514 Len=0"
"539","33.968244","192.168.0.183","172.64.155.249","TLSv1.2","216","Application Data"
"540","33.968546","192.168.0.183","172.64.155.249","TLSv1.2","178","Application Data"
"541","33.997126","172.64.155.249","192.168.0.183","TCP","60","443  >  51124 [ACK] Seq=333188 Ack=18253 Win=75 Len=0"
"542","34.004655","172.64.155.249","192.168.0.183","TLSv1.2","144","Application Data"
"543","34.011978","172.64.155.249","192.168.0.183","TLSv1.2","146","Application Data"
"544","34.011978","172.64.155.249","192.168.0.183","TLSv1.2","225","Application Data"
"545","34.011978","172.64.155.249","192.168.0.183","TLSv1.2","85","Application Data"
"546","34.012174","192.168.0.183","172.64.155.249","TCP","54","51124  >  443 [ACK] Seq=18253 Ack=333572 Win=512 Len=0"
"547","34.150909","192.168.0.183","172.64.155.249","TLSv1.2","521","Application Data"
"548","34.150985","192.168.0.183","172.64.155.249","TLSv1.2","548","Application Data"
"549","34.168359","172.64.155.249","192.168.0.183","TCP","60","443  >  51124 [ACK] Seq=333572 Ack=19214 Win=75 Len=0"
"550","34.191290","172.64.155.249","192.168.0.183","TLSv1.2","490","Application Data"
"551","34.191290","172.64.155.249","192.168.0.183","TLSv1.2","85","Application Data"
"552","34.191328","192.168.0.183","172.64.155.249","TCP","54","51124  >  443 [ACK] Seq=19214 Ack=334039 Win=510 Len=0"
