"No.","Time","Source","Destination","Protocol","Length","Info"
"1","0.000000","192.168.0.183","172.64.155.249","TLSv1.2","173","Application Data"
"2","0.000059","192.168.0.183","172.64.155.249","TLSv1.2","93","Application Data"
"3","0.013013","172.64.155.249","192.168.0.183","TCP","60","443  >  51124 [ACK] Seq=1 Ack=159 Win=8 Len=0"
"4","0.013013","172.64.155.249","192.168.0.183","TLSv1.2","93","Application Data"
"5","0.036932","172.64.155.249","192.168.0.183","TLSv1.2","349","Application Data"
"6","0.036932","172.64.155.249","192.168.0.183","TLSv1.2","1359","Application Data"
"7","0.036932","172.64.155.249","192.168.0.183","TLSv1.2","962","Application Data, Application Data, Application Data"
"8","0.037038","192.168.0.183","172.64.155.249","TCP","54","51124  >  443 [ACK] Seq=159 Ack=2548 Win=514 Len=0"
"9","0.037946","192.168.0.183","172.64.155.249","TLSv1.2","89","Application Data"
"10","0.094083","172.64.155.249","192.168.0.183","TCP","60","443  >  51124 [ACK] Seq=2548 Ack=194 Win=8 Len=0"
"11","0.354272","192.168.0.183","172.64.155.249","TLSv1.2","172","Application Data"
"12","0.354336","192.168.0.183","172.64.155.249","TLSv1.2","170","Application Data"
"13","0.365503","192.168.0.183","172.64.155.249","TLSv1.2","151","Application Data"
"14","0.368356","172.64.155.249","192.168.0.183","TCP","60","443  >  51124 [ACK] Seq=2548 Ack=428 Win=8 Len=0"
"15","0.380108","172.64.155.249","192.168.0.183","TCP","60","443  >  51124 [ACK] Seq=2548 Ack=525 Win=8 Len=0"
"16","0.392215","172.64.155.249","192.168.0.183","TLSv1.2","145","Application Data"
"17","0.442853","192.168.0.183","172.64.155.249","TCP","54","51124  >  443 [ACK] Seq=525 Ack=2639 Win=513 Len=0"
"18","0.557359","172.64.155.249","192.168.0.183","TLSv1.2","146","Application Data"
"19","0.557359","172.64.155.249","192.168.0.183","TLSv1.2","100","Application Data"
"20","0.557359","172.64.155.249","192.168.0.183","TCP","1514","443  >  51124 [ACK] Seq=2777 Ack=525 Win=8 Len=1460 [TCP segment of a reassembled PDU]"
"21","0.557398","192.168.0.183","172.64.155.249","TCP","54","51124  >  443 [ACK] Seq=525 Ack=4237 Win=514 Len=0"
"22","0.559323","172.64.155.249","192.168.0.183","TCP","1514","443  >  51124 [ACK] Seq=4237 Ack=525 Win=8 Len=1460 [TCP segment of a reassembled PDU]"
"23","0.559323","172.64.155.249","192.168.0.183","TLSv1.2","951","Application Data"
"24","0.559323","172.64.155.249","192.168.0.183","TCP","1514","443  >  51124 [ACK] Seq=6594 Ack=525 Win=8 Len=1460 [TCP segment of a reassembled PDU]"
"25","0.559323","172.64.155.249","192.168.0.183","TCP","1514","443  >  51124 [ACK] Seq=8054 Ack=525 Win=8 Len=1460 [TCP segment of a reassembled PDU]"
"26","0.559323","172.64.155.249","192.168.0.183","TCP","1514","443  >  51124 [ACK] Seq=9514 Ack=525 Win=8 Len=1460 [TCP segment of a reassembled PDU]"
"27","0.559323","172.64.155.249","192.168.0.183","TLSv1.2","307","Application Data"
"28","0.559323","172.64.155.249","192.168.0.183","TCP","1514","443  >  51124 [ACK] Seq=11227 Ack=525 Win=8 Len=1460 [TCP segment of a reassembled PDU]"
"29","0.559323","172.64.155.249","192.168.0.183","TLSv1.2","1116","Application Data"
"30","0.559424","192.168.0.183","172.64.155.249","TCP","54","51124  >  443 [ACK] Seq=525 Ack=13749 Win=514 Len=0"
"31","0.570516","172.64.155.249","192.168.0.183","TCP","1514","443  >  51124 [ACK] Seq=13749 Ack=525 Win=8 Len=1460 [TCP segment of a reassembled PDU]"
"32","0.570516","172.64.155.249","192.168.0.183","TLSv1.2","331","Application Data"
"33","0.570584","192.168.0.183","172.64.155.249","TCP","54","51124  >  443 [ACK] Seq=525 Ack=15486 Win=514 Len=0"
"34","0.571983","172.64.155.249","192.168.0.183","TCP","1514","443  >  51124 [ACK] Seq=15486 Ack=525 Win=8 Len=1460 [TCP segment of a reassembled PDU]"
"35","0.571983","172.64.155.249","192.168.0.183","TCP","1514","443  >  51124 [ACK] Seq=16946 Ack=525 Win=8 Len=1460 [TCP segment of a reassembled PDU]"
"36","0.571983","172.64.155.249","192.168.0.183","TCP","1514","443  >  51124 [ACK] Seq=18406 Ack=525 Win=8 Len=1460 [TCP segment of a reassembled PDU]"
"37","0.571983","172.64.155.249","192.168.0.183","TLSv1.2","1323","Application Data"
"38","0.571983","172.64.155.249","192.168.0.183","TCP","1514","443  >  51124 [ACK] Seq=21135 Ack=525 Win=8 Len=1460 [TCP segment of a reassembled PDU]"
"39","0.572044","192.168.0.183","172.64.155.249","TCP","54","51124  >  443 [ACK] Seq=525 Ack=22595 Win=514 Len=0"
"40","0.574078","172.64.155.249","192.168.0.183","TCP","1514","443  >  51124 [ACK] Seq=22595 Ack=525 Win=8 Len=1460 [TCP segment of a reassembled PDU]"
"41","0.574078","172.64.155.249","192.168.0.183","TCP","1514","443  >  51124 [ACK] Seq=24055 Ack=525 Win=8 Len=1460 [TCP segment of a reassembled PDU]"
"42","0.574078","172.64.155.249","192.168.0.183","TLSv1.2","862","Application Data"
"43","0.574078","172.64.155.249","192.168.0.183","TCP","1514","443  >  51124 [ACK] Seq=26323 Ack=525 Win=8 Len=1460 [TCP segment of a reassembled PDU]"
"44","0.574078","172.64.155.249","192.168.0.183","TCP","1514","443  >  51124 [ACK] Seq=27783 Ack=525 Win=8 Len=1460 [TCP segment of a reassembled PDU]"
"45","0.574078","172.64.155.249","192.168.0.183","TCP","1514","443  >  51124 [ACK] Seq=29243 Ack=525 Win=8 Len=1460 [TCP segment of a reassembled PDU]"
"46","0.574078","172.64.155.249","192.168.0.183","TCP","1514","443  >  51124 [ACK] Seq=30703 Ack=525 Win=8 Len=1460 [TCP segment of a reassembled PDU]"
"47","0.574078","172.64.155.249","192.168.0.183","TCP","1514","443  >  51124 [ACK] Seq=32163 Ack=525 Win=8 Len=1460 [TCP segment of a reassembled PDU]"
"48","0.574078","172.64.155.249","192.168.0.183","TCP","1514","443  >  51124 [PSH, ACK] Seq=33623 Ack=525 Win=8 Len=1460 [TCP segment of a reassembled PDU]"
"49","0.574078","172.64.155.249","192.168.0.183","TCP","1514","443  >  51124 [ACK] Seq=35083 Ack=525 Win=8 Len=1460 [TCP segment of a reassembled PDU]"
"50","0.574078","172.64.155.249","192.168.0.183","TLSv1.2","636","Application Data"
"51","0.574078","172.64.155.249","192.168.0.183","TLSv1.2","127","Application Data, Application Data"
"52","0.574154","192.168.0.183","172.64.155.249","TCP","54","51124  >  443 [ACK] Seq=525 Ack=37198 Win=514 Len=0"
"53","0.637630","192.168.0.183","172.64.155.249","TLSv1.2","184","Application Data"
"54","0.637660","192.168.0.183","172.64.155.249","TLSv1.2","93","Application Data"
"55","0.658433","172.64.155.249","192.168.0.183","TCP","60","443  >  51134 [ACK] Seq=1 Ack=170 Win=8 Len=0"
"56","0.658433","172.64.155.249","192.168.0.183","TLSv1.2","93","Application Data"
"57","0.685458","172.64.155.249","192.168.0.183","TLSv1.2","472","Application Data"
"58","0.685458","172.64.155.249","192.168.0.183","TLSv1.2","234","Application Data, Application Data"
"59","0.685528","192.168.0.183","172.64.155.249","TCP","54","51134  >  443 [ACK] Seq=170 Ack=638 Win=511 Len=0"
"60","0.686583","192.168.0.183","172.64.155.249","TLSv1.2","89","Application Data"
"61","0.739873","172.64.155.249","192.168.0.183","TCP","60","443  >  51134 [ACK] Seq=638 Ack=205 Win=8 Len=0"
"62","1.036220","192.168.0.183","172.64.155.249","TLSv1.2","538","Application Data"
"63","1.036340","192.168.0.183","172.64.155.249","TLSv1.2","546","Application Data"
"64","1.055638","172.64.155.249","192.168.0.183","TCP","60","443  >  51124 [ACK] Seq=37198 Ack=1501 Win=9 Len=0"
"65","1.074189","172.64.155.249","192.168.0.183","TLSv1.2","453","Application Data"
"66","1.074189","172.64.155.249","192.168.0.183","TLSv1.2","85","Application Data"
"67","1.074242","192.168.0.183","172.64.155.249","TCP","54","51124  >  443 [ACK] Seq=1501 Ack=37628 Win=512 Len=0"
"68","2.230575","192.168.0.183","172.64.155.249","TLSv1.2","848","Application Data"
"69","2.230646","192.168.0.183","172.64.155.249","TLSv1.2","586","Application Data"
"70","2.244039","172.64.155.249","192.168.0.183","TCP","60","443  >  51124 [ACK] Seq=37628 Ack=2827 Win=10 Len=0"
"71","2.249315","192.168.0.183","172.64.155.249","TLSv1.2","372","Application Data"
"72","2.268967","172.64.155.249","192.168.0.183","TLSv1.2","277","Application Data"
"73","2.268967","172.64.155.249","192.168.0.183","TLSv1.2","85","Application Data"
"74","2.269010","192.168.0.183","172.64.155.249","TCP","54","51124  >  443 [ACK] Seq=3145 Ack=37882 Win=511 Len=0"
"75","2.300117","172.64.155.249","192.168.0.183","TLSv1.2","152","Application Data"
"76","2.300117","172.64.155.249","192.168.0.183","TLSv1.2","100","Application Data"
"77","2.300117","172.64.155.249","192.168.0.183","TCP","1514","443  >  51124 [ACK] Seq=38026 Ack=3145 Win=10 Len=1460 [TCP segment of a reassembled PDU]"
"78","2.300117","172.64.155.249","192.168.0.183","TCP","1514","443  >  51124 [ACK] Seq=39486 Ack=3145 Win=10 Len=1460 [TCP segment of a reassembled PDU]"
"79","2.300117","172.64.155.249","192.168.0.183","TLSv1.2","967","Application Data"
"80","2.300166","192.168.0.183","172.64.155.249","TCP","54","51124  >  443 [ACK] Seq=3145 Ack=41859 Win=514 Len=0"
"81","2.303497","172.64.155.249","192.168.0.183","TCP","1514","443  >  51124 [ACK] Seq=41859 Ack=3145 Win=10 Len=1460 [TCP segment of a reassembled PDU]"
"82","2.303497","172.64.155.249","192.168.0.183","TCP","1514","443  >  51124 [ACK] Seq=43319 Ack=3145 Win=10 Len=1460 [TCP segment of a reassembled PDU]"
"83","2.303497","172.64.155.249","192.168.0.183","TCP","1514","443  >  51124 [ACK] Seq=44779 Ack=3145 Win=10 Len=1460 [TCP segment of a reassembled PDU]"
"84","2.303497","172.64.155.249","192.168.0.183","TCP","1514","443  >  51124 [ACK] Seq=46239 Ack=3145 Win=10 Len=1460 [TCP segment of a reassembled PDU]"
"85","2.303497","172.64.155.249","192.168.0.183","TLSv1.2","290","Application Data"
"86","2.303544","192.168.0.183","172.64.155.249","TCP","54","51124  >  443 [ACK] Seq=3145 Ack=47935 Win=514 Len=0"
"87","2.311458","172.64.155.249","192.168.0.183","TCP","1514","443  >  51124 [ACK] Seq=47935 Ack=3145 Win=10 Len=1460 [TCP segment of a reassembled PDU]"
"88","2.311458","172.64.155.249","192.168.0.183","TLSv1.2","1124","Application Data"
"89","2.311545","192.168.0.183","172.64.155.249","TCP","54","51124  >  443 [ACK] Seq=3145 Ack=50465 Win=514 Len=0"
"90","2.313475","172.64.155.249","192.168.0.183","TCP","1514","443  >  51124 [ACK] Seq=50465 Ack=3145 Win=10 Len=1460 [TCP segment of a reassembled PDU]"
"91","2.313475","172.64.155.249","192.168.0.183","TCP","1514","443  >  51124 [ACK] Seq=51925 Ack=3145 Win=10 Len=1460 [TCP segment of a reassembled PDU]"
"92","2.313475","172.64.155.249","192.168.0.183","TCP","1514","443  >  51124 [ACK] Seq=53385 Ack=3145 Win=10 Len=1460 [TCP segment of a reassembled PDU]"
"93","2.313475","172.64.155.249","192.168.0.183","TLSv1.2","299","Application Data"
"94","2.313475","172.64.155.249","192.168.0.183","TCP","1514","443  >  51124 [ACK] Seq=55090 Ack=3145 Win=10 Len=1460 [TCP segment of a reassembled PDU]"
"95","2.313475","172.64.155.249","192.168.0.183","TLSv1.2","662","Application Data"
"96","2.313613","192.168.0.183","172.64.155.249","TCP","54","51124  >  443 [ACK] Seq=3145 Ack=57158 Win=514 Len=0"
"97","2.318907","172.64.155.249","192.168.0.183","TCP","1514","443  >  51124 [ACK] Seq=57158 Ack=3145 Win=10 Len=1460 [TCP segment of a reassembled PDU]"
"98","2.318907","172.64.155.249","192.168.0.183","TCP","1514","443  >  51124 [ACK] Seq=58618 Ack=3145 Win=10 Len=1460 [TCP segment of a reassembled PDU]"
"99","2.318907","172.64.155.249","192.168.0.183","TLSv1.2","1167","Application Data"
"100","2.318907","172.64.155.249","192.168.0.183","TCP","1514","443  >  51124 [ACK] Seq=61191 Ack=3145 Win=10 Len=1460 [TCP segment of a reassembled PDU]"
"101","2.318907","172.64.155.249","192.168.0.183","TCP","1514","443  >  51124 [ACK] Seq=62651 Ack=3145 Win=10 Len=1460 [TCP segment of a reassembled PDU]"
"102","2.318907","172.64.155.249","192.168.0.183","TLSv1.2","1079","Application Data"
"103","2.318907","172.64.155.249","192.168.0.183","TCP","1514","443  >  51124 [ACK] Seq=65136 Ack=3145 Win=10 Len=1460 [TCP segment of a reassembled PDU]"
"104","2.318907","172.64.155.249","192.168.0.183","TCP","1514","443  >  51124 [ACK] Seq=66596 Ack=3145 Win=10 Len=1460 [TCP segment of a reassembled PDU]"
"105","2.318907","172.64.155.249","192.168.0.183","TCP","1514","443  >  51124 [ACK] Seq=68056 Ack=3145 Win=10 Len=1460 [TCP segment of a reassembled PDU]"
"106","2.318907","172.64.155.249","192.168.0.183","TCP","1514","443  >  51124 [ACK] Seq=69516 Ack=3145 Win=10 Len=1460 [TCP segment of a reassembled PDU]"
"107","2.318907","172.64.155.249","192.168.0.183","TLSv1.2","899","Application Data"
"108","2.319048","192.168.0.183","172.64.155.249","TCP","54","51124  >  443 [ACK] Seq=3145 Ack=71821 Win=514 Len=0"
"109","2.322513","172.64.155.249","192.168.0.183","TCP","1514","443  >  51124 [ACK] Seq=71821 Ack=3145 Win=10 Len=1460 [TCP segment of a reassembled PDU]"
"110","2.322513","172.64.155.249","192.168.0.183","TCP","1514","443  >  51124 [ACK] Seq=73281 Ack=3145 Win=10 Len=1460 [TCP segment of a reassembled PDU]"
"111","2.322513","172.64.155.249","192.168.0.183","TLSv1.2","858","Application Data"
"112","2.322583","192.168.0.183","172.64.155.249","TCP","54","51124  >  443 [ACK] Seq=3145 Ack=75545 Win=514 Len=0"
"113","2.323877","172.64.155.249","192.168.0.183","TCP","1514","443  >  51124 [ACK] Seq=75545 Ack=3145 Win=10 Len=1460 [TCP segment of a reassembled PDU]"
"114","2.323877","172.64.155.249","192.168.0.183","TCP","1514","443  >  51124 [ACK] Seq=77005 Ack=3145 Win=10 Len=1460 [TCP segment of a reassembled PDU]"
"115","2.323877","172.64.155.249","192.168.0.183","TLSv1.2","446","Application Data"
"116","2.323877","172.64.155.249","192.168.0.183","TLSv1.2","96","Application Data"
"117","2.323877","172.64.155.249","192.168.0.183","TLSv1.2","85","Application Data"
"118","2.323930","192.168.0.183","172.64.155.249","TCP","54","51124  >  443 [ACK] Seq=3145 Ack=78930 Win=514 Len=0"
"119","2.434100","192.168.0.183","172.64.155.249","TLSv1.2","196","Application Data"
"120","2.460596","172.64.155.249","192.168.0.183","TCP","60","443  >  51134 [ACK] Seq=638 Ack=347 Win=8 Len=0"
"121","2.490465","172.64.155.249","192.168.0.183","TLSv1.2","472","Application Data"
"122","2.490465","172.64.155.249","192.168.0.183","TLSv1.2","203","Application Data"
"123","2.490465","172.64.155.249","192.168.0.183","TLSv1.2","85","Application Data"
"124","2.490533","192.168.0.183","172.64.155.249","TCP","54","51134  >  443 [ACK] Seq=347 Ack=1236 Win=509 Len=0"
"125","2.645925","192.168.0.183","172.64.155.249","TLSv1.2","302","Application Data"
"126","2.681565","172.64.155.249","192.168.0.183","TLSv1.2","144","Application Data"
"127","2.727498","192.168.0.183","172.64.155.249","TCP","54","51124  >  443 [ACK] Seq=3393 Ack=79020 Win=513 Len=0"
"128","2.897152","192.168.0.183","172.64.155.249","TLSv1.2","494","Application Data"
"129","2.897447","192.168.0.183","172.64.155.249","TLSv1.2","608","Application Data"
"130","2.910134","172.64.155.249","192.168.0.183","TCP","60","443  >  51124 [ACK] Seq=79020 Ack=4387 Win=11 Len=0"
"131","2.939279","172.64.155.249","192.168.0.183","TLSv1.2","277","Application Data"
"132","2.939279","172.64.155.249","192.168.0.183","TLSv1.2","85","Application Data"
"133","2.939319","192.168.0.183","172.64.155.249","TCP","54","51124  >  443 [ACK] Seq=4387 Ack=79274 Win=512 Len=0"
"134","13.807811","192.168.0.183","172.64.155.249","TLSv1.2","137","Application Data"
"135","13.808055","192.168.0.183","172.64.155.249","TLSv1.2","93","Application Data"
"136","13.822332","172.64.155.249","192.168.0.183","TCP","60","443  >  51124 [ACK] Seq=79274 Ack=4509 Win=11 Len=0"
"137","13.822332","172.64.155.249","192.168.0.183","TLSv1.2","93","Application Data"
"138","13.867437","192.168.0.183","172.64.155.249","TCP","54","51124  >  443 [ACK] Seq=4509 Ack=79313 Win=512 Len=0"
"139","13.878334","172.64.155.249","192.168.0.183","TLSv1.2","279","Application Data"
"140","13.878334","172.64.155.249","192.168.0.183","TLSv1.2","100","Application Data"
"141","13.878334","172.64.155.249","192.168.0.183","TLSv1.2","1293","Application Data"
"142","13.878334","172.64.155.249","192.168.0.183","TCP","1514","443  >  51124 [ACK] Seq=80823 Ack=4509 Win=11 Len=1460 [TCP segment of a reassembled PDU]"
"143","13.878334","172.64.155.249","192.168.0.183","TCP","1514","443  >  51124 [ACK] Seq=82283 Ack=4509 Win=11 Len=1460 [TCP segment of a reassembled PDU]"
"144","13.878334","172.64.155.249","192.168.0.183","TLSv1.2","903","Application Data"
"145","13.878392","192.168.0.183","172.64.155.249","TCP","54","51124  >  443 [ACK] Seq=4509 Ack=84592 Win=514 Len=0"
"146","13.879540","192.168.0.183","172.64.155.249","TLSv1.2","89","Application Data"
"147","13.881704","172.64.155.249","192.168.0.183","TCP","1514","443  >  51124 [ACK] Seq=84592 Ack=4509 Win=11 Len=1460 [TCP segment of a reassembled PDU]"
"148","13.881704","172.64.155.249","192.168.0.183","TCP","1514","443  >  51124 [ACK] Seq=86052 Ack=4509 Win=11 Len=1460 [TCP segment of a reassembled PDU]"
"149","13.881704","172.64.155.249","192.168.0.183","TCP","1514","443  >  51124 [ACK] Seq=87512 Ack=4509 Win=11 Len=1460 [TCP segment of a reassembled PDU]"
"150","13.881704","172.64.155.249","192.168.0.183","TCP","1514","443  >  51124 [ACK] Seq=88972 Ack=4509 Win=11 Len=1460 [TCP segment of a reassembled PDU]"
"151","13.881704","172.64.155.249","192.168.0.183","TLSv1.2","227","Application Data"
"152","13.881799","192.168.0.183","172.64.155.249","TCP","54","51124  >  443 [ACK] Seq=4544 Ack=90605 Win=514 Len=0"
"153","13.887175","172.64.155.249","192.168.0.183","TCP","1514","443  >  51124 [ACK] Seq=90605 Ack=4509 Win=11 Len=1460 [TCP segment of a reassembled PDU]"
"154","13.887175","172.64.155.249","192.168.0.183","TLSv1.2","264","Application Data"
"155","13.887278","192.168.0.183","172.64.155.249","TCP","54","51124  >  443 [ACK] Seq=4544 Ack=92275 Win=514 Len=0"
"156","13.890214","172.64.155.249","192.168.0.183","TCP","1514","443  >  51124 [ACK] Seq=92275 Ack=4509 Win=11 Len=1460 [TCP segment of a reassembled PDU]"
"157","13.890214","172.64.155.249","192.168.0.183","TCP","1514","443  >  51124 [ACK] Seq=93735 Ack=4509 Win=11 Len=1460 [TCP segment of a reassembled PDU]"
"158","13.890214","172.64.155.249","192.168.0.183","TCP","1514","443  >  51124 [ACK] Seq=95195 Ack=4509 Win=11 Len=1460 [TCP segment of a reassembled PDU]"
"159","13.890214","172.64.155.249","192.168.0.183","TCP","1514","443  >  51124 [ACK] Seq=96655 Ack=4509 Win=11 Len=1460 [TCP segment of a reassembled PDU]"
"160","13.890214","172.64.155.249","192.168.0.183","TCP","1514","443  >  51124 [ACK] Seq=98115 Ack=4509 Win=11 Len=1460 [TCP segment of a reassembled PDU]"
"161","13.890214","172.64.155.249","192.168.0.183","TLSv1.2","1325","Application Data"
"162","13.890214","172.64.155.249","192.168.0.183","TLSv1.2","96","Application Data"
"163","13.890214","172.64.155.249","192.168.0.183","TLSv1.2","85","Application Data"
"164","13.890349","192.168.0.183","172.64.155.249","TCP","54","51124  >  443 [ACK] Seq=4544 Ack=100919 Win=514 Len=0"
"165","13.934329","172.64.155.249","192.168.0.183","TCP","60","443  >  51124 [ACK] Seq=100919 Ack=4544 Win=11 Len=0"
"166","14.167225","192.168.0.183","172.64.155.249","TLSv1.2","214","Application Data"
"167","14.184552","172.64.155.249","192.168.0.183","TCP","60","443  >  51124 [ACK] Seq=100919 Ack=4704 Win=12 Len=0"
"168","14.204795","172.64.155.249","192.168.0.183","TLSv1.2","152","Application Data"
"169","14.257310","192.168.0.183","172.64.155.249","TCP","54","51124  >  443 [ACK] Seq=4704 Ack=101017 Win=513 Len=0"
"170","14.285403","192.168.0.183","172.64.155.249","TLSv1.2","490","Application Data"
"171","14.285456","192.168.0.183","172.64.155.249","TLSv1.2","540","Application Data"
"172","14.303345","172.64.155.249","192.168.0.183","TCP","60","443  >  51124 [ACK] Seq=101017 Ack=5626 Win=12 Len=0"
"173","14.333510","172.64.155.249","192.168.0.183","TLSv1.2","144","Application Data"
"174","14.333510","172.64.155.249","192.168.0.183","TLSv1.2","85","Application Data"
"175","14.333549","192.168.0.183","172.64.155.249","TCP","54","51124  >  443 [ACK] Seq=5626 Ack=101138 Win=513 Len=0"
"176","19.437082","192.168.0.183","172.64.155.249","TLSv1.2","166","Application Data"
"177","19.437141","192.168.0.183","172.64.155.249","TLSv1.2","170","Application Data"
"178","19.451134","192.168.0.183","172.64.155.249","TLSv1.2","201","Application Data"
"179","19.451889","172.64.155.249","192.168.0.183","TCP","60","443  >  51124 [ACK] Seq=101138 Ack=5854 Win=12 Len=0"
"180","19.476064","172.64.155.249","192.168.0.183","TLSv1.2","278","Application Data"
"181","19.504678","172.64.155.249","192.168.0.183","TLSv1.2","145","Application Data"
"182","19.504678","172.64.155.249","192.168.0.183","TLSv1.2","100","Application Data"
"183","19.504717","192.168.0.183","172.64.155.249","TCP","54","51124  >  443 [ACK] Seq=6001 Ack=101499 Win=511 Len=0"
"184","19.506414","192.168.0.183","172.64.155.249","TLSv1.2","89","Application Data"
"185","19.508666","172.64.155.249","192.168.0.183","TCP","1514","443  >  51124 [ACK] Seq=101499 Ack=6001 Win=13 Len=1460 [TCP segment of a reassembled PDU]"
"186","19.508666","172.64.155.249","192.168.0.183","TCP","1514","443  >  51124 [ACK] Seq=102959 Ack=6001 Win=13 Len=1460 [TCP segment of a reassembled PDU]"
"187","19.508666","172.64.155.249","192.168.0.183","TCP","1514","443  >  51124 [ACK] Seq=104419 Ack=6001 Win=13 Len=1460 [TCP segment of a reassembled PDU]"
"188","19.508666","172.64.155.249","192.168.0.183","TCP","1514","443  >  51124 [ACK] Seq=105879 Ack=6001 Win=13 Len=1460 [TCP segment of a reassembled PDU]"
"189","19.508666","172.64.155.249","192.168.0.183","TCP","1514","443  >  51124 [ACK] Seq=107339 Ack=6001 Win=13 Len=1460 [TCP segment of a reassembled PDU]"
"190","19.508666","172.64.155.249","192.168.0.183","TCP","1514","443  >  51124 [PSH, ACK] Seq=108799 Ack=6001 Win=13 Len=1460 [TCP segment of a reassembled PDU]"
"191","19.508666","172.64.155.249","192.168.0.183","TLSv1.2","1256","Application Data"
"192","19.508812","192.168.0.183","172.64.155.249","TCP","54","51124  >  443 [ACK] Seq=6036 Ack=111461 Win=514 Len=0"
"193","19.526944","172.64.155.249","192.168.0.183","TCP","1514","443  >  51124 [ACK] Seq=111461 Ack=6001 Win=13 Len=1460 [TCP segment of a reassembled PDU]"
"194","19.526944","172.64.155.249","192.168.0.183","TLSv1.2","1131","Application Data"
"195","19.526944","172.64.155.249","192.168.0.183","TCP","1514","443  >  51124 [ACK] Seq=113998 Ack=6001 Win=13 Len=1460 [TCP segment of a reassembled PDU]"
"196","19.526944","172.64.155.249","192.168.0.183","TCP","1514","443  >  51124 [ACK] Seq=115458 Ack=6001 Win=13 Len=1460 [TCP segment of a reassembled PDU]"
"197","19.526944","172.64.155.249","192.168.0.183","TLSv1.2","1047","Application Data"
"198","19.526944","172.64.155.249","192.168.0.183","TCP","1514","443  >  51124 [ACK] Seq=117911 Ack=6036 Win=13 Len=1460 [TCP segment of a reassembled PDU]"
"199","19.526944","172.64.155.249","192.168.0.183","TCP","1514","443  >  51124 [ACK] Seq=119371 Ack=6036 Win=13 Len=1460 [TCP segment of a reassembled PDU]"
"200","19.526944","172.64.155.249","192.168.0.183","TCP","1514","443  >  51124 [ACK] Seq=120831 Ack=6036 Win=13 Len=1460 [TCP segment of a reassembled PDU]"
"201","19.526944","172.64.155.249","192.168.0.183","TCP","1514","443  >  51124 [ACK] Seq=122291 Ack=6036 Win=13 Len=1460 [TCP segment of a reassembled PDU]"
"202","19.526944","172.64.155.249","192.168.0.183","TCP","1514","443  >  51124 [ACK] Seq=123751 Ack=6036 Win=13 Len=1460 [TCP segment of a reassembled PDU]"
"203","19.526944","172.64.155.249","192.168.0.183","TLSv1.2","1098","Application Data"
"204","19.526944","172.64.155.249","192.168.0.183","TCP","1514","443  >  51124 [ACK] Seq=126255 Ack=6036 Win=13 Len=1460 [TCP segment of a reassembled PDU]"
"205","19.526944","172.64.155.249","192.168.0.183","TCP","1514","443  >  51124 [ACK] Seq=127715 Ack=6036 Win=13 Len=1460 [TCP segment of a reassembled PDU]"
"206","19.526944","172.64.155.249","192.168.0.183","TCP","1514","443  >  51124 [ACK] Seq=129175 Ack=6036 Win=13 Len=1460 [TCP segment of a reassembled PDU]"
"207","19.526944","172.64.155.249","192.168.0.183","TLSv1.2","1494","Application Data"
"208","19.526944","172.64.155.249","192.168.0.183","TCP","1514","443  >  51124 [ACK] Seq=132075 Ack=6036 Win=13 Len=1460 [TCP segment of a reassembled PDU]"
"209","19.526944","172.64.155.249","192.168.0.183","TCP","1514","443  >  51124 [ACK] Seq=133535 Ack=6036 Win=13 Len=1460 [TCP segment of a reassembled PDU]"
"210","19.526944","172.64.155.249","192.168.0.183","TCP","1514","443  >  51124 [ACK] Seq=134995 Ack=6036 Win=13 Len=1460 [TCP segment of a reassembled PDU]"
"211","19.526944","172.64.155.249","192.168.0.183","TLSv1.2","764","Application Data"
"212","19.526944","172.64.155.249","192.168.0.183","TCP","1514","443  >  51124 [ACK] Seq=137165 Ack=6036 Win=13 Len=1460 [TCP segment of a reassembled PDU]"
"213","19.526944","172.64.155.249","192.168.0.183","TLSv1.2","1217","Application Data"
"214","19.527110","192.168.0.183","172.64.155.249","TCP","54","51124  >  443 [ACK] Seq=6036 Ack=113998 Win=514 Len=0"
"215","19.527272","192.168.0.183","172.64.155.249","TCP","54","51124  >  443 [ACK] Seq=6036 Ack=137165 Win=514 Len=0"
"216","19.527350","192.168.0.183","172.64.155.249","TCP","54","51124  >  443 [ACK] Seq=6036 Ack=139788 Win=514 Len=0"
"217","19.529136","172.64.155.249","192.168.0.183","TCP","1514","443  >  51124 [ACK] Seq=139788 Ack=6036 Win=13 Len=1460 [TCP segment of a reassembled PDU]"
"218","19.529136","172.64.155.249","192.168.0.183","TCP","1514","443  >  51124 [ACK] Seq=141248 Ack=6036 Win=13 Len=1460 [TCP segment of a reassembled PDU]"
"219","19.529136","172.64.155.249","192.168.0.183","TCP","1514","443  >  51124 [ACK] Seq=142708 Ack=6036 Win=13 Len=1460 [TCP segment of a reassembled PDU]"
"220","19.529136","172.64.155.249","192.168.0.183","TLSv1.2","502","Application Data"
"221","19.529136","172.64.155.249","192.168.0.183","TLSv1.2","96","Application Data"
"222","19.529136","172.64.155.249","192.168.0.183","TLSv1.2","85","Application Data"
"223","19.529195","192.168.0.183","172.64.155.249","TCP","54","51124  >  443 [ACK] Seq=6036 Ack=144689 Win=514 Len=0"
"224","19.590159","192.168.0.183","172.64.155.249","TLSv1.2","210","Application Data"
"225","19.590327","192.168.0.183","172.64.155.249","TLSv1.2","93","Application Data"
"226","19.591404","192.168.0.183","172.64.155.249","TLSv1.2","293","Application Data"
"227","19.605578","172.64.155.249","192.168.0.183","TCP","60","443  >  51134 [ACK] Seq=1236 Ack=542 Win=8 Len=0"
"228","19.605578","172.64.155.249","192.168.0.183","TLSv1.2","93","Application Data"
"229","19.639095","172.64.155.249","192.168.0.183","TLSv1.2","191","Application Data"
"230","19.639095","172.64.155.249","192.168.0.183","TLSv1.2","120","Application Data"
"231","19.639095","172.64.155.249","192.168.0.183","TLSv1.2","85","Application Data"
"232","19.639095","172.64.155.249","192.168.0.183","TLSv1.2","474","Application Data"
"233","19.639095","172.64.155.249","192.168.0.183","TLSv1.2","203","Application Data"
"234","19.639095","172.64.155.249","192.168.0.183","TLSv1.2","85","Application Data"
"235","19.639565","192.168.0.183","172.64.155.249","TCP","54","51124  >  443 [ACK] Seq=6275 Ack=144923 Win=513 Len=0"
"236","19.639585","192.168.0.183","172.64.155.249","TCP","54","51134  >  443 [ACK] Seq=542 Ack=1875 Win=514 Len=0"
"237","19.644180","192.168.0.183","172.64.155.249","TLSv1.2","89","Application Data"
"238","19.700076","172.64.155.249","192.168.0.183","TCP","60","443  >  51134 [ACK] Seq=1875 Ack=577 Win=8 Len=0"
"239","19.849943","192.168.0.183","172.64.155.249","TLSv1.2","757","Application Data"
"240","19.888893","172.64.155.249","192.168.0.183","TLSv1.2","277","Application Data"
"241","19.938755","192.168.0.183","172.64.155.249","TCP","54","51124  >  443 [ACK] Seq=6978 Ack=145146 Win=512 Len=0"
"242","20.121964","192.168.0.183","172.64.155.249","TLSv1.2","535","Application Data"
"243","20.122042","192.168.0.183","172.64.155.249","TLSv1.2","632","Application Data"
"244","20.139712","172.64.155.249","192.168.0.183","TCP","60","443  >  51124 [ACK] Seq=145146 Ack=8037 Win=14 Len=0"
"245","20.208248","172.64.155.249","192.168.0.183","TLSv1.2","144","Application Data"
"246","20.208248","172.64.155.249","192.168.0.183","TLSv1.2","85","Application Data"
"247","20.208323","192.168.0.183","172.64.155.249","TCP","54","51124  >  443 [ACK] Seq=8037 Ack=145267 Win=511 Len=0"
"248","26.476297","192.168.0.183","172.64.155.249","TLSv1.2","312","Application Data"
"249","26.531980","172.64.155.249","192.168.0.183","TCP","60","443  >  51124 [ACK] Seq=145267 Ack=8295 Win=14 Len=0"
"250","26.554204","172.64.155.249","192.168.0.183","TLSv1.2","472","Application Data"
"251","26.554204","172.64.155.249","192.168.0.183","TLSv1.2","100","Application Data"
"252","26.554204","172.64.155.249","192.168.0.183","TCP","1514","443  >  51124 [ACK] Seq=145731 Ack=8295 Win=14 Len=1460 [TCP segment of a reassembled PDU]"
"253","26.554204","172.64.155.249","192.168.0.183","TCP","1514","443  >  51124 [ACK] Seq=147191 Ack=8295 Win=14 Len=1460 [TCP segment of a reassembled PDU]"
"254","26.554204","172.64.155.249","192.168.0.183","TLSv1.2","873","Application Data"
"255","26.554204","172.64.155.249","192.168.0.183","TCP","1514","443  >  51124 [ACK] Seq=149470 Ack=8295 Win=14 Len=1460 [TCP segment of a reassembled PDU]"
"256","26.554254","192.168.0.183","172.64.155.249","TCP","54","51124  >  443 [ACK] Seq=8295 Ack=150930 Win=514 Len=0"
"257","26.555521","172.64.155.249","192.168.0.183","TCP","1514","443  >  51124 [ACK] Seq=150930 Ack=8295 Win=14 Len=1460 [TCP segment of a reassembled PDU]"
"258","26.555521","172.64.155.249","192.168.0.183","TCP","1514","443  >  51124 [ACK] Seq=152390 Ack=8295 Win=14 Len=1460 [TCP segment of a reassembled PDU]"
"259","26.555521","172.64.155.249","192.168.0.183","TLSv1.2","301","Application Data"
"260","26.555582","192.168.0.183","172.64.155.249","TCP","54","51124  >  443 [ACK] Seq=8295 Ack=154097 Win=514 Len=0"
"261","26.555821","192.168.0.183","172.64.155.249","TLSv1.2","89","Application Data"
"262","26.564585","172.64.155.249","192.168.0.183","TCP","1514","443  >  51124 [ACK] Seq=154097 Ack=8295 Win=14 Len=1460 [TCP segment of a reassembled PDU]"
"263","26.564585","172.64.155.249","192.168.0.183","TCP","1514","443  >  51124 [ACK] Seq=155557 Ack=8295 Win=14 Len=1460 [TCP segment of a reassembled PDU]"
"264","26.564585","172.64.155.249","192.168.0.183","TLSv1.2","1372","Application Data"
"265","26.564649","192.168.0.183","172.64.155.249","TCP","54","51124  >  443 [ACK] Seq=8330 Ack=158335 Win=514 Len=0"
"266","26.568267","172.64.155.249","192.168.0.183","TCP","1514","443  >  51124 [ACK] Seq=158335 Ack=8295 Win=14 Len=1460 [TCP segment of a reassembled PDU]"
"267","26.568267","172.64.155.249","192.168.0.183","TCP","1514","443  >  51124 [ACK] Seq=159795 Ack=8295 Win=14 Len=1460 [TCP segment of a reassembled PDU]"
"268","26.568267","172.64.155.249","192.168.0.183","TCP","1514","443  >  51124 [ACK] Seq=161255 Ack=8295 Win=14 Len=1460 [TCP segment of a reassembled PDU]"
"269","26.568267","172.64.155.249","192.168.0.183","TCP","1514","443  >  51124 [ACK] Seq=162715 Ack=8295 Win=14 Len=1460 [TCP segment of a reassembled PDU]"
"270","26.568267","172.64.155.249","192.168.0.183","TCP","1514","443  >  51124 [ACK] Seq=164175 Ack=8295 Win=14 Len=1460 [TCP segment of a reassembled PDU]"
"271","26.568267","172.64.155.249","192.168.0.183","TCP","1514","443  >  51124 [PSH, ACK] Seq=165635 Ack=8295 Win=14 Len=1460 [TCP segment of a reassembled PDU]"
"272","26.568267","172.64.155.249","192.168.0.183","TLSv1.2","1483","Application Data"
"273","26.568267","172.64.155.249","192.168.0.183","TLSv1.2","127","Application Data, Application Data"
"274","26.568267","172.64.155.249","192.168.0.183","TCP","60","443  >  51124 [ACK] Seq=168597 Ack=8330 Win=14 Len=0"
"275","26.568382","192.168.0.183","172.64.155.249","TCP","54","51124  >  443 [ACK] Seq=8330 Ack=168597 Win=514 Len=0"
"276","26.777907","192.168.0.183","172.64.155.249","TLSv1.2","215","Application Data"
"277","26.778150","192.168.0.183","172.64.155.249","TLSv1.2","178","Application Data"
"278","26.792561","172.64.155.249","192.168.0.183","TCP","60","443  >  51124 [ACK] Seq=168597 Ack=8615 Win=15 Len=0"
"279","26.813632","172.64.155.249","192.168.0.183","TLSv1.2","278","Application Data"
"280","26.819093","172.64.155.249","192.168.0.183","TLSv1.2","152","Application Data"
"281","26.819093","172.64.155.249","192.168.0.183","TLSv1.2","224","Application Data"
"282","26.819093","172.64.155.249","192.168.0.183","TLSv1.2","85","Application Data"
"283","26.819151","192.168.0.183","172.64.155.249","TCP","54","51124  >  443 [ACK] Seq=8615 Ack=169120 Win=512 Len=0"
"284","26.947046","192.168.0.183","172.64.155.249","TLSv1.2","490","Application Data"
"285","26.947098","192.168.0.183","172.64.155.249","TLSv1.2","539","Application Data"
"286","26.962317","172.64.155.249","192.168.0.183","TCP","60","443  >  51124 [ACK] Seq=169120 Ack=9536 Win=15 Len=0"
"287","26.987328","172.64.155.249","192.168.0.183","TLSv1.2","164","Application Data"
"288","26.987328","172.64.155.249","192.168.0.183","TLSv1.2","85","Application Data"
"289","26.987364","192.168.0.183","172.64.155.249","TCP","54","51124  >  443 [ACK] Seq=9536 Ack=169261 Win=511 Len=0"
"290","28.844048","192.168.0.183","172.64.155.249","TLSv1.2","166","Application Data"
"291","28.844121","192.168.0.183","172.64.155.249","TLSv1.2","170","Application Data"
"292","28.856836","192.168.0.183","172.64.155.249","TLSv1.2","170","Application Data"
"293","28.865329","172.64.155.249","192.168.0.183","TCP","60","443  >  51124 [ACK] Seq=169261 Ack=9764 Win=15 Len=0"
"294","28.881729","172.64.155.249","192.168.0.183","TLSv1.2","278","Application Data"
"295","28.923271","192.168.0.183","172.64.155.249","TCP","54","51124  >  443 [ACK] Seq=9880 Ack=169485 Win=510 Len=0"
"296","28.925256","172.64.155.249","192.168.0.183","TCP","60","443  >  51124 [ACK] Seq=169485 Ack=9880 Win=15 Len=0"
"297","29.047612","172.64.155.249","192.168.0.183","TLSv1.2","146","Application Data"
"298","29.047612","172.64.155.249","192.168.0.183","TLSv1.2","100","Application Data"
"299","29.047612","172.64.155.249","192.168.0.183","TLSv1.2","1324","Application Data"
"300","29.047612","172.64.155.249","192.168.0.183","TCP","1514","443  >  51124 [ACK] Seq=170893 Ack=9880 Win=15 Len=1460 [TCP segment of a reassembled PDU]"
"301","29.047686","192.168.0.183","172.64.155.249","TCP","54","51124  >  443 [ACK] Seq=9880 Ack=170893 Win=514 Len=0"
"302","29.047803","192.168.0.183","172.64.155.249","TCP","54","51124  >  443 [ACK] Seq=9880 Ack=172353 Win=514 Len=0"
"303","29.049624","172.64.155.249","192.168.0.183","TCP","1514","443  >  51124 [ACK] Seq=172353 Ack=9880 Win=15 Len=1460 [TCP segment of a reassembled PDU]"
"304","29.049624","172.64.155.249","192.168.0.183","TCP","1514","443  >  51124 [ACK] Seq=173813 Ack=9880 Win=15 Len=1460 [TCP segment of a reassembled PDU]"
"305","29.049624","172.64.155.249","192.168.0.183","TLSv1.2","610","Application Data"
"306","29.049624","172.64.155.249","192.168.0.183","TCP","1514","443  >  51124 [ACK] Seq=175829 Ack=9880 Win=15 Len=1460 [TCP segment of a reassembled PDU]"
"307","29.049624","172.64.155.249","192.168.0.183","TCP","1514","443  >  51124 [ACK] Seq=177289 Ack=9880 Win=15 Len=1460 [TCP segment of a reassembled PDU]"
"308","29.049624","172.64.155.249","192.168.0.183","TLSv1.2","779","Application Data"
"309","29.049706","192.168.0.183","172.64.155.249","TCP","54","51124  >  443 [ACK] Seq=9880 Ack=179474 Win=514 Len=0"
"310","29.058339","172.64.155.249","192.168.0.183","TCP","1514","443  >  51124 [ACK] Seq=179474 Ack=9880 Win=15 Len=1460 [TCP segment of a reassembled PDU]"
"311","29.058339","172.64.155.249","192.168.0.183","TLSv1.2","1514","Application Data"
"312","29.058339","172.64.155.249","192.168.0.183","TCP","1514","443  >  51124 [ACK] Seq=182394 Ack=9880 Win=15 Len=1460 [TCP segment of a reassembled PDU]"
"313","29.058339","172.64.155.249","192.168.0.183","TLSv1.2","959","Application Data"
"314","29.058418","192.168.0.183","172.64.155.249","TCP","54","51124  >  443 [ACK] Seq=9880 Ack=184759 Win=514 Len=0"
"315","29.060406","172.64.155.249","192.168.0.183","TCP","1514","443  >  51124 [ACK] Seq=184759 Ack=9880 Win=15 Len=1460 [TCP segment of a reassembled PDU]"
"316","29.060406","172.64.155.249","192.168.0.183","TLSv1.2","821","Application Data"
"317","29.060406","172.64.155.249","192.168.0.183","TCP","1514","443  >  51124 [ACK] Seq=186986 Ack=9880 Win=15 Len=1460 [TCP segment of a reassembled PDU]"
"318","29.060406","172.64.155.249","192.168.0.183","TCP","1514","443  >  51124 [ACK] Seq=188446 Ack=9880 Win=15 Len=1460 [TCP segment of a reassembled PDU]"
"319","29.060406","172.64.155.249","192.168.0.183","TLSv1.2","1066","Application Data"
"320","29.060555","192.168.0.183","172.64.155.249","TCP","54","51124  >  443 [ACK] Seq=9880 Ack=190918 Win=514 Len=0"
"321","29.061872","172.64.155.249","192.168.0.183","TCP","1514","443  >  51124 [ACK] Seq=190918 Ack=9880 Win=15 Len=1460 [TCP segment of a reassembled PDU]"
"322","29.061872","172.64.155.249","192.168.0.183","TCP","1514","443  >  51124 [ACK] Seq=192378 Ack=9880 Win=15 Len=1460 [TCP segment of a reassembled PDU]"
"323","29.061872","172.64.155.249","192.168.0.183","TCP","1514","443  >  51124 [ACK] Seq=193838 Ack=9880 Win=15 Len=1460 [TCP segment of a reassembled PDU]"
"324","29.061872","172.64.155.249","192.168.0.183","TCP","1514","443  >  51124 [ACK] Seq=195298 Ack=9880 Win=15 Len=1460 [TCP segment of a reassembled PDU]"
"325","29.061872","172.64.155.249","192.168.0.183","TCP","1514","443  >  51124 [ACK] Seq=196758 Ack=9880 Win=15 Len=1460 [TCP segment of a reassembled PDU]"
"326","29.061872","172.64.155.249","192.168.0.183","TCP","1514","443  >  51124 [PSH, ACK] Seq=198218 Ack=9880 Win=15 Len=1460 [TCP segment of a reassembled PDU]"
"327","29.061872","172.64.155.249","192.168.0.183","TLSv1.2","155","Application Data"
"328","29.061872","172.64.155.249","192.168.0.183","TCP","1514","443  >  51124 [ACK] Seq=199779 Ack=9880 Win=15 Len=1460 [TCP segment of a reassembled PDU]"
"329","29.061872","172.64.155.249","192.168.0.183","TLSv1.2","1161","Application Data"
"330","29.061968","192.168.0.183","172.64.155.249","TCP","54","51124  >  443 [ACK] Seq=9880 Ack=202346 Win=514 Len=0"
"331","29.069827","172.64.155.249","192.168.0.183","TCP","1514","443  >  51124 [ACK] Seq=202346 Ack=9880 Win=15 Len=1460 [TCP segment of a reassembled PDU]"
"332","29.069827","172.64.155.249","192.168.0.183","TLSv1.2","478","Application Data"
"333","29.069827","172.64.155.249","192.168.0.183","TLSv1.2","96","Application Data"
"334","29.069827","172.64.155.249","192.168.0.183","TLSv1.2","85","Application Data"
"335","29.069933","192.168.0.183","172.64.155.249","TCP","54","51124  >  443 [ACK] Seq=9880 Ack=204303 Win=514 Len=0"
"336","29.147835","192.168.0.183","172.64.155.249","TLSv1.2","184","Application Data"
"337","29.167206","172.64.155.249","192.168.0.183","TCP","60","443  >  51134 [ACK] Seq=1875 Ack=707 Win=8 Len=0"
"338","29.191406","172.64.155.249","192.168.0.183","TLSv1.2","474","Application Data"
"339","29.191406","172.64.155.249","192.168.0.183","TLSv1.2","203","Application Data"
"340","29.191406","172.64.155.249","192.168.0.183","TLSv1.2","85","Application Data"
"341","29.191450","192.168.0.183","172.64.155.249","TCP","54","51134  >  443 [ACK] Seq=707 Ack=2475 Win=511 Len=0"
"342","29.192384","192.168.0.183","172.64.155.249","TLSv1.2","89","Application Data"
"343","29.268673","172.64.155.249","192.168.0.183","TCP","60","443  >  51134 [ACK] Seq=2475 Ack=742 Win=8 Len=0"
"344","29.566683","192.168.0.183","172.64.155.249","TLSv1.2","537","Application Data"
"345","29.566746","192.168.0.183","172.64.155.249","TLSv1.2","553","Application Data"
"346","29.579908","172.64.155.249","192.168.0.183","TCP","60","443  >  51124 [ACK] Seq=204303 Ack=10862 Win=16 Len=0"
"347","29.606357","172.64.155.249","192.168.0.183","TLSv1.2","144","Application Data"
"348","29.606357","172.64.155.249","192.168.0.183","TLSv1.2","85","Application Data"
"349","29.606447","192.168.0.183","172.64.155.249","TCP","54","51124  >  443 [ACK] Seq=10862 Ack=204424 Win=513 Len=0"
"350","33.055026","192.168.0.183","172.64.155.249","TLSv1.2","802","Application Data"
"351","33.055118","192.168.0.183","172.64.155.249","TLSv1.2","593","Application Data"
"352","33.071886","172.64.155.249","192.168.0.183","TCP","60","443  >  51124 [ACK] Seq=204424 Ack=12149 Win=17 Len=0"
"353","33.094599","172.64.155.249","192.168.0.183","TLSv1.2","278","Application Data"
"354","33.094599","172.64.155.249","192.168.0.183","TLSv1.2","85","Application Data"
"355","33.094639","192.168.0.183","172.64.155.249","TCP","54","51124  >  443 [ACK] Seq=12149 Ack=204679 Win=512 Len=0"
"356","33.593524","192.168.0.183","172.64.155.249","TLSv1.2","227","Application Data"
"357","33.593659","192.168.0.183","172.64.155.249","TLSv1.2","593","Application Data"
"358","33.611473","172.64.155.249","192.168.0.183","TCP","60","443  >  51124 [ACK] Seq=204679 Ack=12861 Win=17 Len=0"
"359","33.615822","192.168.0.183","172.64.155.249","TLSv1.2","387","Application Data"
"360","33.632870","172.64.155.249","192.168.0.183","TLSv1.2","144","Application Data"
"361","33.632870","172.64.155.249","192.168.0.183","TLSv1.2","85","Application Data"
"362","33.633078","192.168.0.183","172.64.155.249","TCP","54","51124  >  443 [ACK] Seq=13194 Ack=204800 Win=512 Len=0"
"363","33.669222","172.64.155.249","192.168.0.183","TLSv1.2","146","Application Data"
"364","33.669222","172.64.155.249","192.168.0.183","TLSv1.2","100","Application Data"
"365","33.669259","192.168.0.183","172.64.155.249","TCP","54","51124  >  443 [ACK] Seq=13194 Ack=204938 Win=511 Len=0"
"366","33.670352","192.168.0.183","172.64.155.249","TLSv1.2","89","Application Data"
"367","33.672549","172.64.155.249","192.168.0.183","TCP","1514","443  >  51124 [ACK] Seq=204938 Ack=13194 Win=18 Len=1460 [TCP segment of a reassembled PDU]"
"368","33.672549","172.64.155.249","192.168.0.183","TCP","1514","443  >  51124 [ACK] Seq=206398 Ack=13194 Win=18 Len=1460 [TCP segment of a reassembled PDU]"
"369","33.672549","172.64.155.249","192.168.0.183","TLSv1.2","933","Application Data"
"370","33.672549","172.64.155.249","192.168.0.183","TCP","1514","443  >  51124 [ACK] Seq=208737 Ack=13194 Win=18 Len=1460 [TCP segment of a reassembled PDU]"
"371","33.672623","192.168.0.183","172.64.155.249","TCP","54","51124  >  443 [ACK] Seq=13229 Ack=210197 Win=514 Len=0"
"372","33.672682","172.64.155.249","192.168.0.183","TCP","1514","443  >  51124 [ACK] Seq=210197 Ack=13194 Win=18 Len=1460 [TCP segment of a reassembled PDU]"
"373","33.672682","172.64.155.249","192.168.0.183","TLSv1.2","734","Application Data"
"374","33.672682","172.64.155.249","192.168.0.183","TCP","1514","443  >  51124 [ACK] Seq=212337 Ack=13194 Win=18 Len=1460 [TCP segment of a reassembled PDU]"
"375","33.672682","172.64.155.249","192.168.0.183","TCP","1514","443  >  51124 [ACK] Seq=213797 Ack=13194 Win=18 Len=1460 [TCP segment of a reassembled PDU]"
"376","33.672682","172.64.155.249","192.168.0.183","TLSv1.2","190","Application Data"
"377","33.672758","192.168.0.183","172.64.155.249","TCP","54","51124  >  443 [ACK] Seq=13229 Ack=215393 Win=514 Len=0"
"378","33.680332","172.64.155.249","192.168.0.183","TCP","1514","443  >  51124 [ACK] Seq=215393 Ack=13194 Win=18 Len=1460 [TCP segment of a reassembled PDU]"
"379","33.680332","172.64.155.249","192.168.0.183","TLSv1.2","927","Application Data"
"380","33.680390","192.168.0.183","172.64.155.249","TCP","54","51124  >  443 [ACK] Seq=13229 Ack=217726 Win=514 Len=0"
"381","33.684401","172.64.155.249","192.168.0.183","TCP","1514","443  >  51124 [ACK] Seq=217726 Ack=13229 Win=18 Len=1460 [TCP segment of a reassembled PDU]"
"382","33.684401","172.64.155.249","192.168.0.183","TCP","1514","443  >  51124 [ACK] Seq=219186 Ack=13229 Win=18 Len=1460 [TCP segment of a reassembled PDU]"
"383","33.684401","172.64.155.249","192.168.0.183","TCP","1514","443  >  51124 [ACK] Seq=220646 Ack=13229 Win=18 Len=1460 [TCP segment of a reassembled PDU]"
"384","33.684401","172.64.155.249","192.168.0.183","TLSv1.2","439","Application Data"
"385","33.684497","192.168.0.183","172.64.155.249","TCP","54","51124  >  443 [ACK] Seq=13229 Ack=222491 Win=514 Len=0"
"386","33.684895","172.64.155.249","192.168.0.183","TCP","1514","443  >  51124 [ACK] Seq=222491 Ack=13229 Win=18 Len=1460 [TCP segment of a reassembled PDU]"
"387","33.684895","172.64.155.249","192.168.0.183","TCP","1514","443  >  51124 [ACK] Seq=223951 Ack=13229 Win=18 Len=1460 [TCP segment of a reassembled PDU]"
"388","33.684895","172.64.155.249","192.168.0.183","TCP","1514","443  >  51124 [ACK] Seq=225411 Ack=13229 Win=18 Len=1460 [TCP segment of a reassembled PDU]"
"389","33.684895","172.64.155.249","192.168.0.183","TLSv1.2","1369","Application Data"
"390","33.684895","172.64.155.249","192.168.0.183","TCP","1514","443  >  51124 [ACK] Seq=228186 Ack=13229 Win=18 Len=1460 [TCP segment of a reassembled PDU]"
"391","33.684999","192.168.0.183","172.64.155.249","TCP","54","51124  >  443 [ACK] Seq=13229 Ack=229646 Win=514 Len=0"
"392","33.686881","172.64.155.249","192.168.0.183","TCP","1514","443  >  51124 [ACK] Seq=229646 Ack=13229 Win=18 Len=1460 [TCP segment of a reassembled PDU]"
"393","33.686881","172.64.155.249","192.168.0.183","TLSv1.2","1462","Application Data"
"394","33.686881","172.64.155.249","192.168.0.183","TCP","1514","443  >  51124 [ACK] Seq=232514 Ack=13229 Win=18 Len=1460 [TCP segment of a reassembled PDU]"
"395","33.686881","172.64.155.249","192.168.0.183","TCP","1514","443  >  51124 [ACK] Seq=233974 Ack=13229 Win=18 Len=1460 [TCP segment of a reassembled PDU]"
"396","33.686881","172.64.155.249","192.168.0.183","TLSv1.2","861","Application Data"
"397","33.687035","192.168.0.183","172.64.155.249","TCP","54","51124  >  443 [ACK] Seq=13229 Ack=232514 Win=514 Len=0"
"398","33.687204","192.168.0.183","172.64.155.249","TCP","54","51124  >  443 [ACK] Seq=13229 Ack=236241 Win=514 Len=0"
"399","33.696057","172.64.155.249","192.168.0.183","TCP","1514","443  >  51124 [ACK] Seq=236241 Ack=13229 Win=18 Len=1460 [TCP segment of a reassembled PDU]"
"400","33.696057","172.64.155.249","192.168.0.183","TCP","1514","443  >  51124 [ACK] Seq=237701 Ack=13229 Win=18 Len=1460 [TCP segment of a reassembled PDU]"
"401","33.696057","172.64.155.249","192.168.0.183","TCP","1514","443  >  51124 [ACK] Seq=239161 Ack=13229 Win=18 Len=1460 [TCP segment of a reassembled PDU]"
"402","33.696057","172.64.155.249","192.168.0.183","TCP","1514","443  >  51124 [ACK] Seq=240621 Ack=13229 Win=18 Len=1460 [TCP segment of a reassembled PDU]"
"403","33.696057","172.64.155.249","192.168.0.183","TCP","1514","443  >  51124 [ACK] Seq=242081 Ack=13229 Win=18 Len=1460 [TCP segment of a reassembled PDU]"
"404","33.696057","172.64.155.249","192.168.0.183","TLSv1.2","330","Application Data"
"405","33.696057","172.64.155.249","192.168.0.183","TCP","1514","443  >  51124 [ACK] Seq=243817 Ack=13229 Win=18 Len=1460 [TCP segment of a reassembled PDU]"
"406","33.696057","172.64.155.249","192.168.0.183","TCP","1514","443  >  51124 [ACK] Seq=245277 Ack=13229 Win=18 Len=1460 [TCP segment of a reassembled PDU]"
"407","33.696057","172.64.155.249","192.168.0.183","TCP","1514","443  >  51124 [ACK] Seq=246737 Ack=13229 Win=18 Len=1460 [TCP segment of a reassembled PDU]"
"408","33.696057","172.64.155.249","192.168.0.183","TCP","1514","443  >  51124 [ACK] Seq=248197 Ack=13229 Win=18 Len=1460 [TCP segment of a reassembled PDU]"
"409","33.696057","172.64.155.249","192.168.0.183","TLSv1.2","257","Application Data"
"410","33.696057","172.64.155.249","192.168.0.183","TLSv1.2","96","Application Data"
"411","33.696057","172.64.155.249","192.168.0.183","TLSv1.2","85","Application Data"
"412","33.696199","192.168.0.183","172.64.155.249","TCP","54","51124  >  443 [ACK] Seq=13229 Ack=249933 Win=514 Len=0"
"413","33.798243","192.168.0.183","172.64.155.249","TLSv1.2","210","Application Data"
"414","33.817902","172.64.155.249","192.168.0.183","TCP","60","443  >  51134 [ACK] Seq=2475 Ack=898 Win=8 Len=0"
"415","33.856400","172.64.155.249","192.168.0.183","TLSv1.2","669","Application Data"
"416","33.856400","172.64.155.249","192.168.0.183","TLSv1.2","203","Application Data"
"417","33.856400","172.64.155.249","192.168.0.183","TLSv1.2","85","Application Data"
"418","33.856445","192.168.0.183","172.64.155.249","TCP","54","51134  >  443 [ACK] Seq=898 Ack=3270 Win=508 Len=0"
"419","34.095848","192.168.0.183","172.64.155.249","TLSv1.2","319","Application Data"
"420","34.095955","192.168.0.183","172.64.155.249","TLSv1.2","178","Application Data"
"421","34.109604","172.64.155.249","192.168.0.183","TCP","60","443  >  51124 [ACK] Seq=249933 Ack=13618 Win=18 Len=0"
"422","34.131435","172.64.155.249","192.168.0.183","TLSv1.2","293","Application Data"
"423","34.131435","172.64.155.249","192.168.0.183","TLSv1.2","686","Application Data"
"424","34.131435","172.64.155.249","192.168.0.183","TLSv1.2","85","Application Data"
"425","34.131435","172.64.155.249","192.168.0.183","TLSv1.2","186","Application Data"
"426","34.131482","192.168.0.183","172.64.155.249","TCP","54","51124  >  443 [ACK] Seq=13618 Ack=250967 Win=510 Len=0"
"427","34.425331","192.168.0.183","172.64.155.249","TLSv1.2","496","Application Data"
"428","34.425420","192.168.0.183","172.64.155.249","TLSv1.2","617","Application Data"
"429","34.438066","172.64.155.249","192.168.0.183","TCP","60","443  >  51124 [ACK] Seq=250967 Ack=14623 Win=19 Len=0"
"430","34.463603","172.64.155.249","192.168.0.183","TLSv1.2","144","Application Data"
"431","34.463603","172.64.155.249","192.168.0.183","TLSv1.2","85","Application Data"
"432","34.463635","192.168.0.183","172.64.155.249","TCP","54","51124  >  443 [ACK] Seq=14623 Ack=251088 Win=509 Len=0"
