"No.","Time","Source","Destination","Protocol","Length","Info"
"1","0.000000","192.168.0.183","172.64.155.249","TCP","55","51124  >  443 [ACK] Seq=1 Ack=1 Win=511 Len=1 [TCP segment of a reassembled PDU]"
"2","0.018988","172.64.155.249","192.168.0.183","TCP","66","443  >  51124 [ACK] Seq=1 Ack=2 Win=136 Len=0 SLE=1 SRE=2"
"3","0.252488","192.168.0.183","172.64.155.249","TLSv1.2","407","Ignored Unknown Record"
"4","0.252559","192.168.0.183","172.64.155.249","TLSv1.2","93","Application Data"
"5","0.252587","192.168.0.183","172.64.155.249","TLSv1.2","170","Application Data"
"6","0.261484","192.168.0.183","172.64.155.249","TLSv1.2","148","Application Data"
"7","0.268537","172.64.155.249","192.168.0.183","TCP","60","443  >  51124 [ACK] Seq=1 Ack=510 Win=137 Len=0"
"8","0.268537","172.64.155.249","192.168.0.183","TLSv1.2","93","Application Data"
"9","0.296442","172.64.155.249","192.168.0.183","TLSv1.2","279","Application Data"
"10","0.296471","192.168.0.183","172.64.155.249","TCP","54","51124  >  443 [ACK] Seq=604 Ack=265 Win=510 Len=0"
"11","0.426756","192.168.0.183","172.64.155.249","TLSv1.2","176","Application Data"
"12","0.453067","172.64.155.249","192.168.0.183","TLSv1.2","326","Application Data"
"13","0.453067","172.64.155.249","192.168.0.183","TLSv1.2","100","Application Data"
"14","0.453067","172.64.155.249","192.168.0.183","TLSv1.2","1324","Application Data"
"15","0.453116","192.168.0.183","172.64.155.249","TCP","54","51124  >  443 [ACK] Seq=726 Ack=1853 Win=514 Len=0"
"16","0.454083","192.168.0.183","172.64.155.249","TLSv1.2","89","Application Data"
"17","0.454921","172.64.155.249","192.168.0.183","TCP","1514","443  >  51124 [ACK] Seq=1853 Ack=726 Win=137 Len=1460 [TCP segment of a reassembled PDU]"
"18","0.454921","172.64.155.249","192.168.0.183","TCP","1514","443  >  51124 [ACK] Seq=3313 Ack=726 Win=137 Len=1460 [TCP segment of a reassembled PDU]"
"19","0.454921","172.64.155.249","192.168.0.183","TCP","1514","443  >  51124 [ACK] Seq=4773 Ack=726 Win=137 Len=1460 [TCP segment of a reassembled PDU]"
"20","0.454921","172.64.155.249","192.168.0.183","TLSv1.2","604","Application Data"
"21","0.454921","172.64.155.249","192.168.0.183","TCP","1514","443  >  51124 [ACK] Seq=6783 Ack=726 Win=137 Len=1460 [TCP segment of a reassembled PDU]"
"22","0.454921","172.64.155.249","192.168.0.183","TCP","1514","443  >  51124 [ACK] Seq=8243 Ack=726 Win=137 Len=1460 [TCP segment of a reassembled PDU]"
"23","0.454921","172.64.155.249","192.168.0.183","TLSv1.2","633","Application Data"
"24","0.454921","172.64.155.249","192.168.0.183","TLSv1.2","1403","Application Data"
"25","0.455038","192.168.0.183","172.64.155.249","TCP","54","51124  >  443 [ACK] Seq=761 Ack=11631 Win=514 Len=0"
"26","0.461529","192.168.0.183","172.64.155.249","TLSv1.2","89","Application Data"
"27","0.466125","172.64.155.249","192.168.0.183","TCP","1514","443  >  51124 [ACK] Seq=11631 Ack=726 Win=137 Len=1460 [TCP segment of a reassembled PDU]"
"28","0.466125","172.64.155.249","192.168.0.183","TLSv1.2","229","Application Data"
"29","0.466125","172.64.155.249","192.168.0.183","TCP","1514","443  >  51124 [ACK] Seq=13266 Ack=726 Win=137 Len=1460 [TCP segment of a reassembled PDU]"
"30","0.466125","172.64.155.249","192.168.0.183","TLSv1.2","1142","Application Data"
"31","0.466125","172.64.155.249","192.168.0.183","TLSv1.2","256","Application Data"
"32","0.466125","172.64.155.249","192.168.0.183","TCP","1514","443  >  51124 [ACK] Seq=16016 Ack=726 Win=137 Len=1460 [TCP segment of a reassembled PDU]"
"33","0.466125","172.64.155.249","192.168.0.183","TLSv1.2","682","Application Data"
"34","0.466125","172.64.155.249","192.168.0.183","TLSv1.2","95","Application Data"
"35","0.466125","172.64.155.249","192.168.0.183","TLSv1.2","85","Application Data"
"36","0.466226","192.168.0.183","172.64.155.249","TCP","54","51124  >  443 [ACK] Seq=796 Ack=18176 Win=514 Len=0"
"37","0.468255","172.64.155.249","192.168.0.183","TCP","1514","443  >  51124 [ACK] Seq=18176 Ack=726 Win=137 Len=1460 [TCP segment of a reassembled PDU]"
"38","0.468255","172.64.155.249","192.168.0.183","TCP","1514","443  >  51124 [ACK] Seq=19636 Ack=726 Win=137 Len=1460 [TCP segment of a reassembled PDU]"
"39","0.468255","172.64.155.249","192.168.0.183","TLSv1.2","1214","Application Data"
"40","0.468255","172.64.155.249","192.168.0.183","TCP","1514","443  >  51124 [ACK] Seq=22256 Ack=726 Win=137 Len=1460 [TCP segment of a reassembled PDU]"
"41","0.468255","172.64.155.249","192.168.0.183","TCP","1514","443  >  51124 [ACK] Seq=23716 Ack=726 Win=137 Len=1460 [TCP segment of a reassembled PDU]"
"42","0.468255","172.64.155.249","192.168.0.183","TCP","1514","443  >  51124 [ACK] Seq=25176 Ack=726 Win=137 Len=1460 [TCP segment of a reassembled PDU]"
"43","0.468255","172.64.155.249","192.168.0.183","TLSv1.2","1023","Application Data"
"44","0.468255","172.64.155.249","192.168.0.183","TCP","1514","443  >  51124 [ACK] Seq=27605 Ack=761 Win=137 Len=1460 [TCP segment of a reassembled PDU]"
"45","0.468255","172.64.155.249","192.168.0.183","TCP","1514","443  >  51124 [ACK] Seq=29065 Ack=761 Win=137 Len=1460 [TCP segment of a reassembled PDU]"
"46","0.468255","172.64.155.249","192.168.0.183","TCP","1514","443  >  51124 [ACK] Seq=30525 Ack=761 Win=137 Len=1460 [TCP segment of a reassembled PDU]"
"47","0.468255","172.64.155.249","192.168.0.183","TLSv1.2","240","Application Data"
"48","0.468255","172.64.155.249","192.168.0.183","TCP","1514","443  >  51124 [ACK] Seq=32171 Ack=761 Win=137 Len=1460 [TCP segment of a reassembled PDU]"
"49","0.468432","192.168.0.183","172.64.155.249","TCP","54","51124  >  443 [ACK] Seq=796 Ack=33631 Win=514 Len=0"
"50","0.470170","172.64.155.249","192.168.0.183","TCP","1514","443  >  51124 [ACK] Seq=33631 Ack=761 Win=137 Len=1460 [TCP segment of a reassembled PDU]"
"51","0.470170","172.64.155.249","192.168.0.183","TLSv1.2","756","Application Data"
"52","0.470271","192.168.0.183","172.64.155.249","TCP","54","51124  >  443 [ACK] Seq=796 Ack=35793 Win=514 Len=0"
"53","0.474895","172.64.155.249","192.168.0.183","TCP","1514","443  >  51124 [ACK] Seq=35793 Ack=796 Win=137 Len=1460 [TCP segment of a reassembled PDU]"
"54","0.474895","172.64.155.249","192.168.0.183","TLSv1.2","841","Application Data"
"55","0.474895","172.64.155.249","192.168.0.183","TLSv1.2","96","Application Data"
"56","0.474895","172.64.155.249","192.168.0.183","TLSv1.2","85","Application Data"
"57","0.474992","192.168.0.183","172.64.155.249","TCP","54","51124  >  443 [ACK] Seq=796 Ack=38113 Win=514 Len=0"
"58","0.548794","192.168.0.183","172.64.155.249","TLSv1.2","184","Application Data"
"59","0.548854","192.168.0.183","172.64.155.249","TLSv1.2","93","Application Data"
"60","0.561498","172.64.155.249","192.168.0.183","TCP","60","443  >  51134 [ACK] Seq=1 Ack=170 Win=8 Len=0"
"61","0.561498","172.64.155.249","192.168.0.183","TLSv1.2","93","Application Data"
"62","0.591872","172.64.155.249","192.168.0.183","TLSv1.2","473","Application Data"
"63","0.591872","172.64.155.249","192.168.0.183","TLSv1.2","203","Application Data"
"64","0.591872","172.64.155.249","192.168.0.183","TLSv1.2","85","Application Data"
"65","0.591926","192.168.0.183","172.64.155.249","TCP","54","51134  >  443 [ACK] Seq=170 Ack=639 Win=514 Len=0"
"66","0.592892","192.168.0.183","172.64.155.249","TLSv1.2","89","Application Data"
"67","0.648805","172.64.155.249","192.168.0.183","TCP","60","443  >  51134 [ACK] Seq=639 Ack=205 Win=8 Len=0"
"68","1.056326","192.168.0.183","172.64.155.249","TLSv1.2","536","Application Data"
"69","1.056390","192.168.0.183","172.64.155.249","TLSv1.2","553","Application Data"
"70","1.074678","172.64.155.249","192.168.0.183","TCP","60","443  >  51124 [ACK] Seq=38113 Ack=1777 Win=138 Len=0"
"71","1.100308","172.64.155.249","192.168.0.183","TLSv1.2","144","Application Data"
"72","1.100308","172.64.155.249","192.168.0.183","TLSv1.2","85","Application Data"
"73","1.100394","192.168.0.183","172.64.155.249","TCP","54","51124  >  443 [ACK] Seq=1777 Ack=38234 Win=513 Len=0"
"74","2.605356","192.168.0.183","172.64.155.249","TLSv1.2","424","Application Data"
"75","2.605422","192.168.0.183","172.64.155.249","TLSv1.2","593","Application Data"
"76","2.620086","172.64.155.249","192.168.0.183","TCP","60","443  >  51124 [ACK] Seq=38234 Ack=2686 Win=138 Len=0"
"77","2.622612","192.168.0.183","172.64.155.249","TLSv1.2","351","Application Data"
"78","2.645025","172.64.155.249","192.168.0.183","TLSv1.2","325","Application Data"
"79","2.645025","172.64.155.249","192.168.0.183","TLSv1.2","85","Application Data"
"80","2.645060","192.168.0.183","172.64.155.249","TCP","54","51124  >  443 [ACK] Seq=2983 Ack=38536 Win=512 Len=0"
"81","2.680312","172.64.155.249","192.168.0.183","TLSv1.2","150","Application Data"
"82","2.680312","172.64.155.249","192.168.0.183","TLSv1.2","100","Application Data"
"83","2.680372","192.168.0.183","172.64.155.249","TCP","54","51124  >  443 [ACK] Seq=2983 Ack=38678 Win=511 Len=0"
"84","2.685028","172.64.155.249","192.168.0.183","TLSv1.2","1306","Application Data"
"85","2.685028","172.64.155.249","192.168.0.183","TCP","1514","443  >  51124 [ACK] Seq=39930 Ack=2983 Win=139 Len=1460 [TCP segment of a reassembled PDU]"
"86","2.685028","172.64.155.249","192.168.0.183","TCP","1514","443  >  51124 [ACK] Seq=41390 Ack=2983 Win=139 Len=1460 [TCP segment of a reassembled PDU]"
"87","2.685028","172.64.155.249","192.168.0.183","TCP","1514","443  >  51124 [ACK] Seq=42850 Ack=2983 Win=139 Len=1460 [TCP segment of a reassembled PDU]"
"88","2.685028","172.64.155.249","192.168.0.183","TLSv1.2","669","Application Data"
"89","2.685275","192.168.0.183","172.64.155.249","TCP","54","51124  >  443 [ACK] Seq=2983 Ack=44925 Win=514 Len=0"
"90","2.685965","172.64.155.249","192.168.0.183","TCP","1514","443  >  51124 [ACK] Seq=44925 Ack=2983 Win=139 Len=1460 [TCP segment of a reassembled PDU]"
"91","2.685965","172.64.155.249","192.168.0.183","TCP","1514","443  >  51124 [ACK] Seq=46385 Ack=2983 Win=139 Len=1460 [TCP segment of a reassembled PDU]"
"92","2.685965","172.64.155.249","192.168.0.183","TLSv1.2","1131","Application Data"
"93","2.686003","192.168.0.183","172.64.155.249","TCP","54","51124  >  443 [ACK] Seq=2983 Ack=48922 Win=514 Len=0"
"94","2.691148","172.64.155.249","192.168.0.183","TCP","1514","443  >  51124 [ACK] Seq=48922 Ack=2983 Win=139 Len=1460 [TCP segment of a reassembled PDU]"
"95","2.691148","172.64.155.249","192.168.0.183","TLSv1.2","1052","Application Data"
"96","2.691214","192.168.0.183","172.64.155.249","TCP","54","51124  >  443 [ACK] Seq=2983 Ack=51380 Win=514 Len=0"
"97","2.696719","172.64.155.249","192.168.0.183","TLSv1.2","1284","Application Data"
"98","2.696719","172.64.155.249","192.168.0.183","TLSv1.2","1301","Application Data"
"99","2.696950","192.168.0.183","172.64.155.249","TCP","54","51124  >  443 [ACK] Seq=2983 Ack=53857 Win=514 Len=0"
"100","2.699041","172.64.155.249","192.168.0.183","TCP","1514","443  >  51124 [ACK] Seq=53857 Ack=2983 Win=139 Len=1460 [TCP segment of a reassembled PDU]"
"101","2.699041","172.64.155.249","192.168.0.183","TCP","1514","443  >  51124 [ACK] Seq=55317 Ack=2983 Win=139 Len=1460 [TCP segment of a reassembled PDU]"
"102","2.699041","172.64.155.249","192.168.0.183","TCP","1514","443  >  51124 [ACK] Seq=56777 Ack=2983 Win=139 Len=1460 [TCP segment of a reassembled PDU]"
"103","2.699041","172.64.155.249","192.168.0.183","TCP","1514","443  >  51124 [ACK] Seq=58237 Ack=2983 Win=139 Len=1460 [TCP segment of a reassembled PDU]"
"104","2.699041","172.64.155.249","192.168.0.183","TCP","1514","443  >  51124 [ACK] Seq=59697 Ack=2983 Win=139 Len=1460 [TCP segment of a reassembled PDU]"
"105","2.699041","172.64.155.249","192.168.0.183","TCP","1514","443  >  51124 [PSH, ACK] Seq=61157 Ack=2983 Win=139 Len=1460 [TCP segment of a reassembled PDU]"
"106","2.699202","192.168.0.183","172.64.155.249","TCP","54","51124  >  443 [ACK] Seq=2983 Ack=62617 Win=514 Len=0"
"107","2.700917","172.64.155.249","192.168.0.183","TCP","1514","443  >  51124 [ACK] Seq=62617 Ack=2983 Win=139 Len=1460 [TCP segment of a reassembled PDU]"
"108","2.700917","172.64.155.249","192.168.0.183","TCP","1514","443  >  51124 [ACK] Seq=64077 Ack=2983 Win=139 Len=1460 [TCP segment of a reassembled PDU]"
"109","2.700917","172.64.155.249","192.168.0.183","TCP","1514","443  >  51124 [ACK] Seq=65537 Ack=2983 Win=139 Len=1460 [TCP segment of a reassembled PDU]"
"110","2.700917","172.64.155.249","192.168.0.183","TCP","1514","443  >  51124 [ACK] Seq=66997 Ack=2983 Win=139 Len=1460 [TCP segment of a reassembled PDU]"
"111","2.700917","172.64.155.249","192.168.0.183","TLSv1.2","921","Application Data"
"112","2.700917","172.64.155.249","192.168.0.183","TCP","1514","443  >  51124 [ACK] Seq=69324 Ack=2983 Win=139 Len=1460 [TCP segment of a reassembled PDU]"
"113","2.700917","172.64.155.249","192.168.0.183","TLSv1.2","1361","Application Data"
"114","2.700917","172.64.155.249","192.168.0.183","TCP","1514","443  >  51124 [ACK] Seq=72091 Ack=2983 Win=139 Len=1460 [TCP segment of a reassembled PDU]"
"115","2.700917","172.64.155.249","192.168.0.183","TLSv1.2","1093","Application Data"
"116","2.700917","172.64.155.249","192.168.0.183","TLSv1.2","1329","Application Data"
"117","2.701070","192.168.0.183","172.64.155.249","TCP","54","51124  >  443 [ACK] Seq=2983 Ack=75865 Win=514 Len=0"
"118","2.706559","172.64.155.249","192.168.0.183","TCP","1514","443  >  51124 [ACK] Seq=75865 Ack=2983 Win=139 Len=1460 [TCP segment of a reassembled PDU]"
"119","2.706559","172.64.155.249","192.168.0.183","TCP","1514","443  >  51124 [ACK] Seq=77325 Ack=2983 Win=139 Len=1460 [TCP segment of a reassembled PDU]"
"120","2.706559","172.64.155.249","192.168.0.183","TCP","1514","443  >  51124 [ACK] Seq=78785 Ack=2983 Win=139 Len=1460 [TCP segment of a reassembled PDU]"
"121","2.706559","172.64.155.249","192.168.0.183","TCP","1514","443  >  51124 [ACK] Seq=80245 Ack=2983 Win=139 Len=1460 [TCP segment of a reassembled PDU]"
"122","2.706559","172.64.155.249","192.168.0.183","TCP","1514","443  >  51124 [ACK] Seq=81705 Ack=2983 Win=139 Len=1460 [TCP segment of a reassembled PDU]"
"123","2.706559","172.64.155.249","192.168.0.183","TLSv1.2","117","Application Data"
"124","2.706559","172.64.155.249","192.168.0.183","TLSv1.2","96","Application Data"
"125","2.706559","172.64.155.249","192.168.0.183","TLSv1.2","85","Application Data"
"126","2.706637","192.168.0.183","172.64.155.249","TCP","54","51124  >  443 [ACK] Seq=2983 Ack=83301 Win=514 Len=0"
"127","2.814076","192.168.0.183","172.64.155.249","TLSv1.2","223","Application Data"
"128","2.832107","172.64.155.249","192.168.0.183","TCP","60","443  >  51134 [ACK] Seq=639 Ack=374 Win=8 Len=0"
"129","2.856525","172.64.155.249","192.168.0.183","TLSv1.2","472","Application Data"
"130","2.856525","172.64.155.249","192.168.0.183","TLSv1.2","203","Application Data"
"131","2.856525","172.64.155.249","192.168.0.183","TLSv1.2","85","Application Data"
"132","2.856561","192.168.0.183","172.64.155.249","TCP","54","51134  >  443 [ACK] Seq=374 Ack=1237 Win=511 Len=0"
"133","3.001812","192.168.0.183","172.64.155.249","TLSv1.2","254","Application Data"
"134","3.038129","172.64.155.249","192.168.0.183","TLSv1.2","152","Application Data"
"135","3.090236","192.168.0.183","172.64.155.249","TCP","54","51124  >  443 [ACK] Seq=3183 Ack=83399 Win=513 Len=0"
"136","3.308181","192.168.0.183","172.64.155.249","TLSv1.2","505","Application Data"
"137","3.308246","192.168.0.183","172.64.155.249","TLSv1.2","599","Application Data"
"138","3.321928","172.64.155.249","192.168.0.183","TCP","60","443  >  51124 [ACK] Seq=83399 Ack=4179 Win=140 Len=0"
"139","3.345848","172.64.155.249","192.168.0.183","TLSv1.2","144","Application Data"
"140","3.345848","172.64.155.249","192.168.0.183","TLSv1.2","85","Application Data"
"141","3.345957","192.168.0.183","172.64.155.249","TCP","54","51124  >  443 [ACK] Seq=4179 Ack=83520 Win=513 Len=0"
"142","7.588579","192.168.0.183","172.64.155.249","TLSv1.2","283","Application Data"
"143","7.643548","172.64.155.249","192.168.0.183","TCP","60","443  >  51124 [ACK] Seq=83520 Ack=4408 Win=140 Len=0"
"144","7.664057","172.64.155.249","192.168.0.183","TLSv1.2","305","Application Data"
"145","7.664057","172.64.155.249","192.168.0.183","TLSv1.2","100","Application Data"
"146","7.664057","172.64.155.249","192.168.0.183","TLSv1.2","1280","Application Data"
"147","7.664057","172.64.155.249","192.168.0.183","TCP","1514","443  >  51124 [ACK] Seq=85043 Ack=4408 Win=140 Len=1460 [TCP segment of a reassembled PDU]"
"148","7.664120","192.168.0.183","172.64.155.249","TCP","54","51124  >  443 [ACK] Seq=4408 Ack=86503 Win=514 Len=0"
"149","7.665435","192.168.0.183","172.64.155.249","TLSv1.2","89","Application Data"
"150","7.665720","172.64.155.249","192.168.0.183","TCP","1514","443  >  51124 [ACK] Seq=86503 Ack=4408 Win=140 Len=1460 [TCP segment of a reassembled PDU]"
"151","7.665720","172.64.155.249","192.168.0.183","TCP","1514","443  >  51124 [ACK] Seq=87963 Ack=4408 Win=140 Len=1460 [TCP segment of a reassembled PDU]"
"152","7.665720","172.64.155.249","192.168.0.183","TLSv1.2","572","Application Data"
"153","7.665720","172.64.155.249","192.168.0.183","TCP","1514","443  >  51124 [ACK] Seq=89941 Ack=4408 Win=140 Len=1460 [TCP segment of a reassembled PDU]"
"154","7.665720","172.64.155.249","192.168.0.183","TCP","1514","443  >  51124 [ACK] Seq=91401 Ack=4408 Win=140 Len=1460 [TCP segment of a reassembled PDU]"
"155","7.665720","172.64.155.249","192.168.0.183","TLSv1.2","743","Application Data"
"156","7.665844","192.168.0.183","172.64.155.249","TCP","54","51124  >  443 [ACK] Seq=4443 Ack=93550 Win=514 Len=0"
"157","7.673265","172.64.155.249","192.168.0.183","TCP","1514","443  >  51124 [ACK] Seq=93550 Ack=4408 Win=140 Len=1460 [TCP segment of a reassembled PDU]"
"158","7.673313","192.168.0.183","172.64.155.249","TCP","54","51124  >  443 [ACK] Seq=4443 Ack=95010 Win=514 Len=0"
"159","7.674994","172.64.155.249","192.168.0.183","TLSv1.2","1045","Application Data"
"160","7.674994","172.64.155.249","192.168.0.183","TCP","1514","443  >  51124 [ACK] Seq=96001 Ack=4408 Win=140 Len=1460 [TCP segment of a reassembled PDU]"
"161","7.674994","172.64.155.249","192.168.0.183","TLSv1.2","198","Application Data"
"162","7.675043","192.168.0.183","172.64.155.249","TCP","54","51124  >  443 [ACK] Seq=4443 Ack=97605 Win=514 Len=0"
"163","7.680157","172.64.155.249","192.168.0.183","TCP","1514","443  >  51124 [ACK] Seq=97605 Ack=4408 Win=140 Len=1460 [TCP segment of a reassembled PDU]"
"164","7.680157","172.64.155.249","192.168.0.183","TCP","1514","443  >  51124 [ACK] Seq=99065 Ack=4408 Win=140 Len=1460 [TCP segment of a reassembled PDU]"
"165","7.680157","172.64.155.249","192.168.0.183","TCP","1514","443  >  51124 [ACK] Seq=100525 Ack=4408 Win=140 Len=1460 [TCP segment of a reassembled PDU]"
"166","7.680157","172.64.155.249","192.168.0.183","TCP","1514","443  >  51124 [ACK] Seq=101985 Ack=4408 Win=140 Len=1460 [TCP segment of a reassembled PDU]"
"167","7.680157","172.64.155.249","192.168.0.183","TCP","1514","443  >  51124 [ACK] Seq=103445 Ack=4408 Win=140 Len=1460 [TCP segment of a reassembled PDU]"
"168","7.680157","172.64.155.249","192.168.0.183","TLSv1.2","1037","Application Data"
"169","7.680157","172.64.155.249","192.168.0.183","TLSv1.2","96","Application Data"
"170","7.680157","172.64.155.249","192.168.0.183","TLSv1.2","85","Application Data"
"171","7.680157","172.64.155.249","192.168.0.183","TCP","60","443  >  51124 [ACK] Seq=105961 Ack=4443 Win=140 Len=0"
"172","7.680289","192.168.0.183","172.64.155.249","TCP","54","51124  >  443 [ACK] Seq=4443 Ack=105961 Win=514 Len=0"
"173","7.960425","192.168.0.183","172.64.155.249","TLSv1.2","255","Application Data"
"174","7.960750","192.168.0.183","172.64.155.249","TLSv1.2","456","Application Data"
"175","7.973587","172.64.155.249","192.168.0.183","TCP","60","443  >  51124 [ACK] Seq=105961 Ack=5046 Win=141 Len=0"
"176","7.997361","172.64.155.249","192.168.0.183","TLSv1.2","145","Application Data"
"177","8.006521","172.64.155.249","192.168.0.183","TLSv1.2","146","Application Data"
"178","8.006521","172.64.155.249","192.168.0.183","TLSv1.2","226","Application Data"
"179","8.006521","172.64.155.249","192.168.0.183","TLSv1.2","85","Application Data"
"180","8.006603","192.168.0.183","172.64.155.249","TCP","54","51124  >  443 [ACK] Seq=5046 Ack=106347 Win=512 Len=0"
"181","8.129869","192.168.0.183","172.64.155.249","TLSv1.2","473","Application Data"
"182","8.130095","192.168.0.183","172.64.155.249","TLSv1.2","543","Application Data"
"183","8.144111","172.64.155.249","192.168.0.183","TCP","60","443  >  51124 [ACK] Seq=106347 Ack=5954 Win=141 Len=0"
"184","8.167218","172.64.155.249","192.168.0.183","TLSv1.2","144","Application Data"
"185","8.167218","172.64.155.249","192.168.0.183","TLSv1.2","85","Application Data"
"186","8.167263","192.168.0.183","172.64.155.249","TCP","54","51124  >  443 [ACK] Seq=5954 Ack=106468 Win=512 Len=0"
"187","10.365107","192.168.0.183","172.64.155.249","TLSv1.2","207","Application Data"
"188","10.365218","192.168.0.183","172.64.155.249","TLSv1.2","170","Application Data"
"189","10.378116","172.64.155.249","192.168.0.183","TCP","60","443  >  51124 [ACK] Seq=106468 Ack=6223 Win=142 Len=0"
"190","10.379515","192.168.0.183","172.64.155.249","TLSv1.2","220","Application Data"
"191","10.411899","172.64.155.249","192.168.0.183","TLSv1.2","279","Application Data"
"192","10.459403","192.168.0.183","172.64.155.249","TCP","54","51124  >  443 [ACK] Seq=6389 Ack=106693 Win=511 Len=0"
"193","10.559738","172.64.155.249","192.168.0.183","TLSv1.2","216","Application Data"
"194","10.559738","172.64.155.249","192.168.0.183","TLSv1.2","100","Application Data"
"195","10.559738","172.64.155.249","192.168.0.183","TCP","1514","443  >  51124 [ACK] Seq=106901 Ack=6389 Win=142 Len=1460 [TCP segment of a reassembled PDU]"
"196","10.559738","172.64.155.249","192.168.0.183","TCP","1514","443  >  51124 [ACK] Seq=108361 Ack=6389 Win=142 Len=1460 [TCP segment of a reassembled PDU]"
"197","10.559738","172.64.155.249","192.168.0.183","TCP","1514","443  >  51124 [ACK] Seq=109821 Ack=6389 Win=142 Len=1460 [TCP segment of a reassembled PDU]"
"198","10.559738","172.64.155.249","192.168.0.183","TLSv1.2","699","Application Data"
"199","10.559784","192.168.0.183","172.64.155.249","TCP","54","51124  >  443 [ACK] Seq=6389 Ack=111926 Win=514 Len=0"
"200","10.561854","172.64.155.249","192.168.0.183","TCP","1514","443  >  51124 [ACK] Seq=111926 Ack=6389 Win=142 Len=1460 [TCP segment of a reassembled PDU]"
"201","10.561854","172.64.155.249","192.168.0.183","TCP","1514","443  >  51124 [ACK] Seq=113386 Ack=6389 Win=142 Len=1460 [TCP segment of a reassembled PDU]"
"202","10.561854","172.64.155.249","192.168.0.183","TCP","1514","443  >  51124 [ACK] Seq=114846 Ack=6389 Win=142 Len=1460 [TCP segment of a reassembled PDU]"
"203","10.561854","172.64.155.249","192.168.0.183","TLSv1.2","439","Application Data"
"204","10.561914","192.168.0.183","172.64.155.249","TCP","54","51124  >  443 [ACK] Seq=6389 Ack=116691 Win=514 Len=0"
"205","10.566139","172.64.155.249","192.168.0.183","TCP","1514","443  >  51124 [ACK] Seq=116691 Ack=6389 Win=142 Len=1460 [TCP segment of a reassembled PDU]"
"206","10.566139","172.64.155.249","192.168.0.183","TLSv1.2","1323","Application Data"
"207","10.566139","172.64.155.249","192.168.0.183","TCP","1514","443  >  51124 [ACK] Seq=119420 Ack=6389 Win=142 Len=1460 [TCP segment of a reassembled PDU]"
"208","10.566219","192.168.0.183","172.64.155.249","TCP","54","51124  >  443 [ACK] Seq=6389 Ack=120880 Win=514 Len=0"
"209","10.568151","172.64.155.249","192.168.0.183","TCP","1514","443  >  51124 [ACK] Seq=120880 Ack=6389 Win=142 Len=1460 [TCP segment of a reassembled PDU]"
"210","10.568151","172.64.155.249","192.168.0.183","TCP","1514","443  >  51124 [ACK] Seq=122340 Ack=6389 Win=142 Len=1460 [TCP segment of a reassembled PDU]"
"211","10.568151","172.64.155.249","192.168.0.183","TLSv1.2","415","Application Data"
"212","10.568151","172.64.155.249","192.168.0.183","TCP","1514","443  >  51124 [ACK] Seq=124161 Ack=6389 Win=142 Len=1460 [TCP segment of a reassembled PDU]"
"213","10.568151","172.64.155.249","192.168.0.183","TCP","1514","443  >  51124 [ACK] Seq=125621 Ack=6389 Win=142 Len=1460 [TCP segment of a reassembled PDU]"
"214","10.568151","172.64.155.249","192.168.0.183","TCP","1514","443  >  51124 [ACK] Seq=127081 Ack=6389 Win=142 Len=1460 [TCP segment of a reassembled PDU]"
"215","10.568151","172.64.155.249","192.168.0.183","TLSv1.2","948","Application Data"
"216","10.568275","192.168.0.183","172.64.155.249","TCP","54","51124  >  443 [ACK] Seq=6389 Ack=129435 Win=514 Len=0"
"217","10.570158","172.64.155.249","192.168.0.183","TCP","1514","443  >  51124 [ACK] Seq=129435 Ack=6389 Win=142 Len=1460 [TCP segment of a reassembled PDU]"
"218","10.570158","172.64.155.249","192.168.0.183","TCP","1514","443  >  51124 [ACK] Seq=130895 Ack=6389 Win=142 Len=1460 [TCP segment of a reassembled PDU]"
"219","10.570158","172.64.155.249","192.168.0.183","TCP","1514","443  >  51124 [ACK] Seq=132355 Ack=6389 Win=142 Len=1460 [TCP segment of a reassembled PDU]"
"220","10.570158","172.64.155.249","192.168.0.183","TCP","1514","443  >  51124 [ACK] Seq=133815 Ack=6389 Win=142 Len=1460 [TCP segment of a reassembled PDU]"
"221","10.570158","172.64.155.249","192.168.0.183","TCP","1514","443  >  51124 [ACK] Seq=135275 Ack=6389 Win=142 Len=1460 [TCP segment of a reassembled PDU]"
"222","10.570158","172.64.155.249","192.168.0.183","TCP","1514","443  >  51124 [PSH, ACK] Seq=136735 Ack=6389 Win=142 Len=1460 [TCP segment of a reassembled PDU]"
"223","10.570158","172.64.155.249","192.168.0.183","TLSv1.2","916","Application Data"
"224","10.570158","172.64.155.249","192.168.0.183","TLSv1.2","127","Application Data, Application Data"
"225","10.570280","192.168.0.183","172.64.155.249","TCP","54","51124  >  443 [ACK] Seq=6389 Ack=139130 Win=514 Len=0"
"226","10.656677","192.168.0.183","172.64.155.249","TLSv1.2","184","Application Data"
"227","10.696429","172.64.155.249","192.168.0.183","TLSv1.2","472","Application Data"
"228","10.696429","172.64.155.249","192.168.0.183","TLSv1.2","203","Application Data"
"229","10.696429","172.64.155.249","192.168.0.183","TLSv1.2","85","Application Data"
"230","10.696566","192.168.0.183","172.64.155.249","TCP","54","51134  >  443 [ACK] Seq=504 Ack=1835 Win=509 Len=0"
"231","10.697712","192.168.0.183","172.64.155.249","TLSv1.2","89","Application Data"
"232","10.752209","172.64.155.249","192.168.0.183","TCP","60","443  >  51134 [ACK] Seq=1835 Ack=539 Win=8 Len=0"
"233","11.104137","192.168.0.183","172.64.155.249","TLSv1.2","536","Application Data"
"234","11.104257","192.168.0.183","172.64.155.249","TLSv1.2","552","Application Data"
"235","11.119848","172.64.155.249","192.168.0.183","TCP","60","443  >  51124 [ACK] Seq=139130 Ack=7369 Win=143 Len=0"
"236","11.147866","172.64.155.249","192.168.0.183","TLSv1.2","274","Application Data"
"237","11.147866","172.64.155.249","192.168.0.183","TLSv1.2","85","Application Data"
"238","11.147924","192.168.0.183","172.64.155.249","TCP","54","51124  >  443 [ACK] Seq=7369 Ack=139381 Win=513 Len=0"
"239","13.063586","192.168.0.183","172.64.155.249","TLSv1.2","404","Application Data"
"240","13.063731","192.168.0.183","172.64.155.249","TLSv1.2","592","Application Data"
"241","13.078636","172.64.155.249","192.168.0.183","TCP","60","443  >  51124 [ACK] Seq=139381 Ack=8257 Win=143 Len=0"
"242","13.080234","192.168.0.183","172.64.155.249","TLSv1.2","468","Application Data"
"243","13.101157","172.64.155.249","192.168.0.183","TLSv1.2","434","Application Data"
"244","13.101157","172.64.155.249","192.168.0.183","TLSv1.2","85","Application Data"
"245","13.101201","192.168.0.183","172.64.155.249","TCP","54","51124  >  443 [ACK] Seq=8671 Ack=139792 Win=511 Len=0"
"246","13.150344","172.64.155.249","192.168.0.183","TLSv1.2","146","Application Data"
"247","13.150344","172.64.155.249","192.168.0.183","TLSv1.2","100","Application Data"
"248","13.150344","172.64.155.249","192.168.0.183","TLSv1.2","1309","Application Data"
"249","13.150380","192.168.0.183","172.64.155.249","TCP","54","51124  >  443 [ACK] Seq=8671 Ack=141185 Win=514 Len=0"
"250","13.151311","192.168.0.183","172.64.155.249","TLSv1.2","89","Application Data"
"251","13.152117","172.64.155.249","192.168.0.183","TCP","1514","443  >  51124 [ACK] Seq=141185 Ack=8671 Win=144 Len=1460 [TCP segment of a reassembled PDU]"
"252","13.152117","172.64.155.249","192.168.0.183","TCP","1514","443  >  51124 [ACK] Seq=142645 Ack=8671 Win=144 Len=1460 [TCP segment of a reassembled PDU]"
"253","13.152117","172.64.155.249","192.168.0.183","TCP","1514","443  >  51124 [ACK] Seq=144105 Ack=8671 Win=144 Len=1460 [TCP segment of a reassembled PDU]"
"254","13.152117","172.64.155.249","192.168.0.183","TLSv1.2","674","Application Data"
"255","13.152117","172.64.155.249","192.168.0.183","TCP","1514","443  >  51124 [ACK] Seq=146185 Ack=8671 Win=144 Len=1460 [TCP segment of a reassembled PDU]"
"256","13.152117","172.64.155.249","192.168.0.183","TCP","1514","443  >  51124 [ACK] Seq=147645 Ack=8671 Win=144 Len=1460 [TCP segment of a reassembled PDU]"
"257","13.152117","172.64.155.249","192.168.0.183","TLSv1.2","911","Application Data"
"258","13.152172","192.168.0.183","172.64.155.249","TCP","54","51124  >  443 [ACK] Seq=8706 Ack=149962 Win=514 Len=0"
"259","13.160973","172.64.155.249","192.168.0.183","TCP","1514","443  >  51124 [ACK] Seq=149962 Ack=8671 Win=144 Len=1460 [TCP segment of a reassembled PDU]"
"260","13.160973","172.64.155.249","192.168.0.183","TLSv1.2","1335","Application Data"
"261","13.161033","192.168.0.183","172.64.155.249","TCP","54","51124  >  443 [ACK] Seq=8706 Ack=152703 Win=514 Len=0"
"262","13.163366","172.64.155.249","192.168.0.183","TCP","1514","443  >  51124 [ACK] Seq=152703 Ack=8671 Win=144 Len=1460 [TCP segment of a reassembled PDU]"
"263","13.163366","172.64.155.249","192.168.0.183","TCP","1514","443  >  51124 [ACK] Seq=154163 Ack=8671 Win=144 Len=1460 [TCP segment of a reassembled PDU]"
"264","13.163366","172.64.155.249","192.168.0.183","TCP","1514","443  >  51124 [ACK] Seq=155623 Ack=8671 Win=144 Len=1460 [TCP segment of a reassembled PDU]"
"265","13.163366","172.64.155.249","192.168.0.183","TLSv1.2","351","Application Data"
"266","13.163456","192.168.0.183","172.64.155.249","TCP","54","51124  >  443 [ACK] Seq=8706 Ack=157380 Win=514 Len=0"
"267","13.165133","172.64.155.249","192.168.0.183","TCP","1514","443  >  51124 [ACK] Seq=157380 Ack=8706 Win=144 Len=1460 [TCP segment of a reassembled PDU]"
"268","13.165133","172.64.155.249","192.168.0.183","TCP","1514","443  >  51124 [ACK] Seq=158840 Ack=8706 Win=144 Len=1460 [TCP segment of a reassembled PDU]"
"269","13.165133","172.64.155.249","192.168.0.183","TCP","1514","443  >  51124 [ACK] Seq=160300 Ack=8706 Win=144 Len=1460 [TCP segment of a reassembled PDU]"
"270","13.165133","172.64.155.249","192.168.0.183","TCP","1514","443  >  51124 [ACK] Seq=161760 Ack=8706 Win=144 Len=1460 [TCP segment of a reassembled PDU]"
"271","13.165133","172.64.155.249","192.168.0.183","TCP","1514","443  >  51124 [ACK] Seq=163220 Ack=8706 Win=144 Len=1460 [TCP segment of a reassembled PDU]"
"272","13.165133","172.64.155.249","192.168.0.183","TLSv1.2","146","Application Data"
"273","13.165133","172.64.155.249","192.168.0.183","TCP","1514","443  >  51124 [ACK] Seq=164772 Ack=8706 Win=144 Len=1460 [TCP segment of a reassembled PDU]"
"274","13.165133","172.64.155.249","192.168.0.183","TCP","1514","443  >  51124 [ACK] Seq=166232 Ack=8706 Win=144 Len=1460 [TCP segment of a reassembled PDU]"
"275","13.165133","172.64.155.249","192.168.0.183","TCP","1514","443  >  51124 [ACK] Seq=167692 Ack=8706 Win=144 Len=1460 [TCP segment of a reassembled PDU]"
"276","13.165133","172.64.155.249","192.168.0.183","TLSv1.2","896","Application Data"
"277","13.165133","172.64.155.249","192.168.0.183","TCP","1514","443  >  51124 [ACK] Seq=169994 Ack=8706 Win=144 Len=1460 [TCP segment of a reassembled PDU]"
"278","13.165133","172.64.155.249","192.168.0.183","TLSv1.2","1113","Application Data"
"279","13.165253","192.168.0.183","172.64.155.249","TCP","54","51124  >  443 [ACK] Seq=8706 Ack=172513 Win=514 Len=0"
"280","13.172726","172.64.155.249","192.168.0.183","TCP","1514","443  >  51124 [ACK] Seq=172513 Ack=8706 Win=144 Len=1460 [TCP segment of a reassembled PDU]"
"281","13.172726","172.64.155.249","192.168.0.183","TCP","1514","443  >  51124 [ACK] Seq=173973 Ack=8706 Win=144 Len=1460 [TCP segment of a reassembled PDU]"
"282","13.172726","172.64.155.249","192.168.0.183","TCP","1514","443  >  51124 [ACK] Seq=175433 Ack=8706 Win=144 Len=1460 [TCP segment of a reassembled PDU]"
"283","13.172726","172.64.155.249","192.168.0.183","TCP","1514","443  >  51124 [ACK] Seq=176893 Ack=8706 Win=144 Len=1460 [TCP segment of a reassembled PDU]"
"284","13.172726","172.64.155.249","192.168.0.183","TLSv1.2","901","Application Data"
"285","13.172726","172.64.155.249","192.168.0.183","TLSv1.2","96","Application Data"
"286","13.172726","172.64.155.249","192.168.0.183","TLSv1.2","85","Application Data"
"287","13.172821","192.168.0.183","172.64.155.249","TCP","54","51124  >  443 [ACK] Seq=8706 Ack=179273 Win=514 Len=0"
"288","13.266347","192.168.0.183","172.64.155.249","TLSv1.2","220","Application Data"
"289","13.281735","172.64.155.249","192.168.0.183","TCP","60","443  >  51134 [ACK] Seq=1835 Ack=705 Win=8 Len=0"
"290","13.308080","172.64.155.249","192.168.0.183","TLSv1.2","474","Application Data"
"291","13.308080","172.64.155.249","192.168.0.183","TLSv1.2","203","Application Data"
"292","13.308080","172.64.155.249","192.168.0.183","TLSv1.2","85","Application Data"
"293","13.308161","192.168.0.183","172.64.155.249","TCP","54","51134  >  443 [ACK] Seq=705 Ack=2435 Win=514 Len=0"
"294","13.457630","192.168.0.183","172.64.155.249","TLSv1.2","286","Application Data"
"295","13.496101","172.64.155.249","192.168.0.183","TLSv1.2","278","Application Data"
"296","13.549931","192.168.0.183","172.64.155.249","TCP","54","51124  >  443 [ACK] Seq=8938 Ack=179497 Win=513 Len=0"
"297","13.892191","192.168.0.183","172.64.155.249","TLSv1.2","767","Application Data"
"298","13.892272","192.168.0.183","172.64.155.249","TLSv1.2","617","Application Data"
"299","13.905470","172.64.155.249","192.168.0.183","TCP","60","443  >  51124 [ACK] Seq=179497 Ack=10214 Win=145 Len=0"
"300","13.932429","172.64.155.249","192.168.0.183","TLSv1.2","144","Application Data"
"301","13.932429","172.64.155.249","192.168.0.183","TLSv1.2","85","Application Data"
"302","13.932471","192.168.0.183","172.64.155.249","TCP","54","51124  >  443 [ACK] Seq=10214 Ack=179618 Win=512 Len=0"
"303","18.566083","192.168.0.183","172.64.155.249","TLSv1.2","161","Application Data"
"304","18.620530","172.64.155.249","192.168.0.183","TCP","60","443  >  51124 [ACK] Seq=179618 Ack=10321 Win=145 Len=0"
"305","18.643116","172.64.155.249","192.168.0.183","TLSv1.2","284","Application Data"
"306","18.643116","172.64.155.249","192.168.0.183","TLSv1.2","100","Application Data"
"307","18.643116","172.64.155.249","192.168.0.183","TLSv1.2","1283","Application Data"
"308","18.643116","172.64.155.249","192.168.0.183","TCP","1514","443  >  51124 [ACK] Seq=181123 Ack=10321 Win=145 Len=1460 [TCP segment of a reassembled PDU]"
"309","18.643116","172.64.155.249","192.168.0.183","TCP","1514","443  >  51124 [ACK] Seq=182583 Ack=10321 Win=145 Len=1460 [TCP segment of a reassembled PDU]"
"310","18.643116","172.64.155.249","192.168.0.183","TCP","1514","443  >  51124 [ACK] Seq=184043 Ack=10321 Win=145 Len=1460 [TCP segment of a reassembled PDU]"
"311","18.643116","172.64.155.249","192.168.0.183","TLSv1.2","562","Application Data"
"312","18.643116","172.64.155.249","192.168.0.183","TCP","1514","443  >  51124 [ACK] Seq=186011 Ack=10321 Win=145 Len=1460 [TCP segment of a reassembled PDU]"
"313","18.643116","172.64.155.249","192.168.0.183","TCP","1514","443  >  51124 [ACK] Seq=187471 Ack=10321 Win=145 Len=1460 [TCP segment of a reassembled PDU]"
"314","18.643116","172.64.155.249","192.168.0.183","TLSv1.2","776","Application Data"
"315","18.643279","192.168.0.183","172.64.155.249","TCP","54","51124  >  443 [ACK] Seq=10321 Ack=189653 Win=514 Len=0"
"316","18.644397","192.168.0.183","172.64.155.249","TLSv1.2","89","Application Data"
"317","18.651564","172.64.155.249","192.168.0.183","TCP","1514","443  >  51124 [ACK] Seq=189653 Ack=10321 Win=145 Len=1460 [TCP segment of a reassembled PDU]"
"318","18.651564","172.64.155.249","192.168.0.183","TLSv1.2","1399","Application Data"
"319","18.651564","172.64.155.249","192.168.0.183","TCP","1514","443  >  51124 [ACK] Seq=192458 Ack=10321 Win=145 Len=1460 [TCP segment of a reassembled PDU]"
"320","18.651688","192.168.0.183","172.64.155.249","TCP","54","51124  >  443 [ACK] Seq=10356 Ack=193918 Win=514 Len=0"
"321","18.653169","172.64.155.249","192.168.0.183","TLSv1.2","1362","Application Data"
"322","18.653169","172.64.155.249","192.168.0.183","TCP","1514","443  >  51124 [ACK] Seq=195226 Ack=10321 Win=145 Len=1460 [TCP segment of a reassembled PDU]"
"323","18.653169","172.64.155.249","192.168.0.183","TLSv1.2","647","Application Data"
"324","18.653221","192.168.0.183","172.64.155.249","TCP","54","51124  >  443 [ACK] Seq=10356 Ack=197279 Win=514 Len=0"
"325","18.655136","172.64.155.249","192.168.0.183","TCP","1514","443  >  51124 [ACK] Seq=197279 Ack=10321 Win=145 Len=1460 [TCP segment of a reassembled PDU]"
"326","18.655136","172.64.155.249","192.168.0.183","TCP","1514","443  >  51124 [ACK] Seq=198739 Ack=10321 Win=145 Len=1460 [TCP segment of a reassembled PDU]"
"327","18.655136","172.64.155.249","192.168.0.183","TCP","1514","443  >  51124 [ACK] Seq=200199 Ack=10321 Win=145 Len=1460 [TCP segment of a reassembled PDU]"
"328","18.655136","172.64.155.249","192.168.0.183","TLSv1.2","1200","Application Data"
"329","18.655136","172.64.155.249","192.168.0.183","TLSv1.2","96","Application Data"
"330","18.655136","172.64.155.249","192.168.0.183","TLSv1.2","85","Application Data"
"331","18.655136","172.64.155.249","192.168.0.183","TCP","60","443  >  51124 [ACK] Seq=202878 Ack=10356 Win=145 Len=0"
"332","18.655136","172.64.155.249","192.168.0.183","TCP","60","[TCP Dup ACK 331#1] 443  >  51124 [ACK] Seq=202878 Ack=10356 Win=145 Len=0"
"333","18.655231","192.168.0.183","172.64.155.249","TCP","54","51124  >  443 [ACK] Seq=10356 Ack=202878 Win=514 Len=0"
"334","18.921136","192.168.0.183","172.64.155.249","TLSv1.2","216","Application Data"
"335","18.933959","172.64.155.249","192.168.0.183","TCP","60","443  >  51124 [ACK] Seq=202878 Ack=10518 Win=145 Len=0"
"336","18.962987","172.64.155.249","192.168.0.183","TLSv1.2","152","Application Data"
"337","19.011901","192.168.0.183","172.64.155.249","TCP","54","51124  >  443 [ACK] Seq=10518 Ack=202976 Win=513 Len=0"
"338","19.039000","192.168.0.183","172.64.155.249","TLSv1.2","515","Application Data"
"339","19.039123","192.168.0.183","172.64.155.249","TLSv1.2","544","Application Data"
"340","19.053942","172.64.155.249","192.168.0.183","TCP","60","443  >  51124 [ACK] Seq=202976 Ack=11469 Win=146 Len=0"
"341","19.074059","172.64.155.249","192.168.0.183","TLSv1.2","144","Application Data"
"342","19.074059","172.64.155.249","192.168.0.183","TLSv1.2","85","Application Data"
"343","19.074156","192.168.0.183","172.64.155.249","TCP","54","51124  >  443 [ACK] Seq=11469 Ack=203097 Win=513 Len=0"
"344","22.293575","192.168.0.183","172.64.155.249","TLSv1.2","237","Application Data"
"345","22.293738","192.168.0.183","172.64.155.249","TLSv1.2","170","Application Data"
"346","22.304734","192.168.0.183","172.64.155.249","TLSv1.2","160","Application Data"
"347","22.307549","172.64.155.249","192.168.0.183","TCP","60","443  >  51124 [ACK] Seq=203097 Ack=11768 Win=146 Len=0"
"348","22.329736","172.64.155.249","192.168.0.183","TLSv1.2","278","Application Data"
"349","22.378340","192.168.0.183","172.64.155.249","TCP","54","51124  >  443 [ACK] Seq=11874 Ack=203321 Win=512 Len=0"
"350","22.478002","172.64.155.249","192.168.0.183","TLSv1.2","194","Application Data"
"351","22.478002","172.64.155.249","192.168.0.183","TLSv1.2","100","Application Data"
"352","22.478002","172.64.155.249","192.168.0.183","TLSv1.2","1329","Application Data"
"353","22.478002","172.64.155.249","192.168.0.183","TCP","1514","443  >  51124 [ACK] Seq=204782 Ack=11874 Win=146 Len=1460 [TCP segment of a reassembled PDU]"
"354","22.478002","172.64.155.249","192.168.0.183","TCP","1514","443  >  51124 [ACK] Seq=206242 Ack=11874 Win=146 Len=1460 [TCP segment of a reassembled PDU]"
"355","22.478002","172.64.155.249","192.168.0.183","TLSv1.2","943","Application Data"
"356","22.478057","192.168.0.183","172.64.155.249","TCP","54","51124  >  443 [ACK] Seq=11874 Ack=208591 Win=514 Len=0"
"357","22.479973","172.64.155.249","192.168.0.183","TCP","1514","443  >  51124 [ACK] Seq=208591 Ack=11874 Win=146 Len=1460 [TCP segment of a reassembled PDU]"
"358","22.479973","172.64.155.249","192.168.0.183","TCP","1514","443  >  51124 [ACK] Seq=210051 Ack=11874 Win=146 Len=1460 [TCP segment of a reassembled PDU]"
"359","22.479973","172.64.155.249","192.168.0.183","TCP","1514","443  >  51124 [ACK] Seq=211511 Ack=11874 Win=146 Len=1460 [TCP segment of a reassembled PDU]"
"360","22.479973","172.64.155.249","192.168.0.183","TLSv1.2","290","Application Data"
"361","22.480028","192.168.0.183","172.64.155.249","TCP","54","51124  >  443 [ACK] Seq=11874 Ack=213207 Win=514 Len=0"
"362","22.489740","172.64.155.249","192.168.0.183","TCP","1514","443  >  51124 [ACK] Seq=213207 Ack=11874 Win=146 Len=1460 [TCP segment of a reassembled PDU]"
"363","22.489740","172.64.155.249","192.168.0.183","TLSv1.2","1170","Application Data"
"364","22.489740","172.64.155.249","192.168.0.183","TCP","1514","443  >  51124 [ACK] Seq=215783 Ack=11874 Win=146 Len=1460 [TCP segment of a reassembled PDU]"
"365","22.489740","172.64.155.249","192.168.0.183","TLSv1.2","370","Application Data"
"366","22.489803","192.168.0.183","172.64.155.249","TCP","54","51124  >  443 [ACK] Seq=11874 Ack=217559 Win=514 Len=0"
"367","22.491531","172.64.155.249","192.168.0.183","TCP","1514","443  >  51124 [ACK] Seq=217559 Ack=11874 Win=146 Len=1460 [TCP segment of a reassembled PDU]"
"368","22.491531","172.64.155.249","192.168.0.183","TCP","1514","443  >  51124 [ACK] Seq=219019 Ack=11874 Win=146 Len=1460 [TCP segment of a reassembled PDU]"
"369","22.491531","172.64.155.249","192.168.0.183","TCP","1514","443  >  51124 [ACK] Seq=220479 Ack=11874 Win=146 Len=1460 [TCP segment of a reassembled PDU]"
"370","22.491531","172.64.155.249","192.168.0.183","TLSv1.2","455","Application Data"
"371","22.491531","172.64.155.249","192.168.0.183","TCP","1514","443  >  51124 [ACK] Seq=222340 Ack=11874 Win=146 Len=1460 [TCP segment of a reassembled PDU]"
"372","22.491531","172.64.155.249","192.168.0.183","TCP","1514","443  >  51124 [ACK] Seq=223800 Ack=11874 Win=146 Len=1460 [TCP segment of a reassembled PDU]"
"373","22.491531","172.64.155.249","192.168.0.183","TCP","1514","443  >  51124 [ACK] Seq=225260 Ack=11874 Win=146 Len=1460 [TCP segment of a reassembled PDU]"
"374","22.491531","172.64.155.249","192.168.0.183","TCP","1514","443  >  51124 [ACK] Seq=226720 Ack=11874 Win=146 Len=1460 [TCP segment of a reassembled PDU]"
"375","22.491531","172.64.155.249","192.168.0.183","TCP","1514","443  >  51124 [ACK] Seq=228180 Ack=11874 Win=146 Len=1460 [TCP segment of a reassembled PDU]"
"376","22.491531","172.64.155.249","192.168.0.183","TCP","1514","443  >  51124 [PSH, ACK] Seq=229640 Ack=11874 Win=146 Len=1460 [TCP segment of a reassembled PDU]"
"377","22.491684","192.168.0.183","172.64.155.249","TCP","54","51124  >  443 [ACK] Seq=11874 Ack=231100 Win=514 Len=0"
"378","22.494234","172.64.155.249","192.168.0.183","TLSv1.2","950","Application Data"
"379","22.494234","172.64.155.249","192.168.0.183","TCP","1514","443  >  51124 [ACK] Seq=231996 Ack=11874 Win=146 Len=1460 [TCP segment of a reassembled PDU]"
"380","22.494234","172.64.155.249","192.168.0.183","TCP","1514","443  >  51124 [ACK] Seq=233456 Ack=11874 Win=146 Len=1460 [TCP segment of a reassembled PDU]"
"381","22.494234","172.64.155.249","192.168.0.183","TLSv1.2","781","Application Data"
"382","22.494234","172.64.155.249","192.168.0.183","TLSv1.2","96","Application Data"
"383","22.494234","172.64.155.249","192.168.0.183","TLSv1.2","85","Application Data"
"384","22.494350","192.168.0.183","172.64.155.249","TCP","54","51124  >  443 [ACK] Seq=11874 Ack=235716 Win=514 Len=0"
"385","22.565579","192.168.0.183","172.64.155.249","TLSv1.2","184","Application Data"
"386","22.602925","172.64.155.249","192.168.0.183","TLSv1.2","668","Application Data"
"387","22.602925","172.64.155.249","192.168.0.183","TLSv1.2","203","Application Data"
"388","22.602925","172.64.155.249","192.168.0.183","TLSv1.2","85","Application Data"
"389","22.603043","192.168.0.183","172.64.155.249","TCP","54","51134  >  443 [ACK] Seq=835 Ack=3229 Win=510 Len=0"
"390","22.605020","192.168.0.183","172.64.155.249","TLSv1.2","89","Application Data"
"391","22.658331","172.64.155.249","192.168.0.183","TCP","60","443  >  51134 [ACK] Seq=3229 Ack=870 Win=8 Len=0"
"392","22.929975","192.168.0.183","172.64.155.249","TLSv1.2","540","Application Data"
"393","22.930045","192.168.0.183","172.64.155.249","TLSv1.2","549","Application Data"
"394","22.944224","172.64.155.249","192.168.0.183","TCP","60","443  >  51124 [ACK] Seq=235716 Ack=12855 Win=147 Len=0"
"395","22.968325","172.64.155.249","192.168.0.183","TLSv1.2","254","Application Data"
"396","22.968325","172.64.155.249","192.168.0.183","TLSv1.2","85","Application Data"
"397","22.968355","192.168.0.183","172.64.155.249","TCP","54","51124  >  443 [ACK] Seq=12855 Ack=235947 Win=513 Len=0"
"398","23.566008","192.168.0.183","172.64.155.249","TLSv1.2","508","Application Data"
"399","23.566447","192.168.0.183","172.64.155.249","TLSv1.2","589","Application Data"
"400","23.580209","172.64.155.249","192.168.0.183","TCP","60","443  >  51124 [ACK] Seq=235947 Ack=13844 Win=147 Len=0"
"401","23.584474","192.168.0.183","172.64.155.249","TLSv1.2","630","Application Data"
"402","23.602841","172.64.155.249","192.168.0.183","TLSv1.2","278","Application Data"
"403","23.602841","172.64.155.249","192.168.0.183","TLSv1.2","85","Application Data"
"404","23.602882","192.168.0.183","172.64.155.249","TCP","54","51124  >  443 [ACK] Seq=14420 Ack=236202 Win=512 Len=0"
"405","23.631248","172.64.155.249","192.168.0.183","TLSv1.2","193","Application Data"
"406","23.631248","172.64.155.249","192.168.0.183","TLSv1.2","100","Application Data"
"407","23.631248","172.64.155.249","192.168.0.183","TLSv1.2","1311","Application Data"
"408","23.631294","192.168.0.183","172.64.155.249","TCP","54","51124  >  443 [ACK] Seq=14420 Ack=237644 Win=514 Len=0"
"409","23.633604","172.64.155.249","192.168.0.183","TCP","1514","443  >  51124 [ACK] Seq=237644 Ack=14420 Win=148 Len=1460 [TCP segment of a reassembled PDU]"
"410","23.633604","172.64.155.249","192.168.0.183","TCP","1514","443  >  51124 [ACK] Seq=239104 Ack=14420 Win=148 Len=1460 [TCP segment of a reassembled PDU]"
"411","23.633604","172.64.155.249","192.168.0.183","TCP","1514","443  >  51124 [ACK] Seq=240564 Ack=14420 Win=148 Len=1460 [TCP segment of a reassembled PDU]"
"412","23.633604","172.64.155.249","192.168.0.183","TLSv1.2","624","Application Data"
"413","23.633604","172.64.155.249","192.168.0.183","TCP","1514","443  >  51124 [ACK] Seq=242594 Ack=14420 Win=148 Len=1460 [TCP segment of a reassembled PDU]"
"414","23.633604","172.64.155.249","192.168.0.183","TCP","1514","443  >  51124 [ACK] Seq=244054 Ack=14420 Win=148 Len=1460 [TCP segment of a reassembled PDU]"
"415","23.633604","172.64.155.249","192.168.0.183","TLSv1.2","1390","Application Data"
"416","23.633666","192.168.0.183","172.64.155.249","TCP","54","51124  >  443 [ACK] Seq=14420 Ack=246850 Win=514 Len=0"
"417","23.648536","172.64.155.249","192.168.0.183","TCP","1514","443  >  51124 [ACK] Seq=246850 Ack=14420 Win=148 Len=1460 [TCP segment of a reassembled PDU]"
"418","23.648536","172.64.155.249","192.168.0.183","TLSv1.2","908","Application Data"
"419","23.648536","172.64.155.249","192.168.0.183","TCP","1514","443  >  51124 [ACK] Seq=249164 Ack=14420 Win=148 Len=1460 [TCP segment of a reassembled PDU]"
"420","23.648536","172.64.155.249","192.168.0.183","TLSv1.2","1099","Application Data"
"421","23.648536","172.64.155.249","192.168.0.183","TCP","1514","443  >  51124 [ACK] Seq=251669 Ack=14420 Win=148 Len=1460 [TCP segment of a reassembled PDU]"
"422","23.648536","172.64.155.249","192.168.0.183","TCP","1514","443  >  51124 [ACK] Seq=253129 Ack=14420 Win=148 Len=1460 [TCP segment of a reassembled PDU]"
"423","23.648536","172.64.155.249","192.168.0.183","TLSv1.2","347","Application Data"
"424","23.648536","172.64.155.249","192.168.0.183","TCP","1514","443  >  51124 [ACK] Seq=254882 Ack=14420 Win=148 Len=1460 [TCP segment of a reassembled PDU]"
"425","23.648536","172.64.155.249","192.168.0.183","TCP","1514","443  >  51124 [ACK] Seq=256342 Ack=14420 Win=148 Len=1460 [TCP segment of a reassembled PDU]"
"426","23.648536","172.64.155.249","192.168.0.183","TLSv1.2","875","Application Data"
"427","23.648536","172.64.155.249","192.168.0.183","TCP","1514","443  >  51124 [ACK] Seq=258623 Ack=14420 Win=148 Len=1460 [TCP segment of a reassembled PDU]"
"428","23.648536","172.64.155.249","192.168.0.183","TCP","1514","443  >  51124 [ACK] Seq=260083 Ack=14420 Win=148 Len=1460 [TCP segment of a reassembled PDU]"
"429","23.648536","172.64.155.249","192.168.0.183","TCP","1514","443  >  51124 [ACK] Seq=261543 Ack=14420 Win=148 Len=1460 [TCP segment of a reassembled PDU]"
"430","23.648536","172.64.155.249","192.168.0.183","TLSv1.2","565","Application Data"
"431","23.648536","172.64.155.249","192.168.0.183","TCP","1514","443  >  51124 [ACK] Seq=263514 Ack=14420 Win=148 Len=1460 [TCP segment of a reassembled PDU]"
"432","23.648536","172.64.155.249","192.168.0.183","TCP","1514","443  >  51124 [ACK] Seq=264974 Ack=14420 Win=148 Len=1460 [TCP segment of a reassembled PDU]"
"433","23.648536","172.64.155.249","192.168.0.183","TCP","1514","443  >  51124 [ACK] Seq=266434 Ack=14420 Win=148 Len=1460 [TCP segment of a reassembled PDU]"
"434","23.648536","172.64.155.249","192.168.0.183","TLSv1.2","826","Application Data"
"435","23.648661","192.168.0.183","172.64.155.249","TCP","54","51124  >  443 [ACK] Seq=14420 Ack=268666 Win=514 Len=0"
"436","23.653231","172.64.155.249","192.168.0.183","TCP","1514","443  >  51124 [ACK] Seq=268666 Ack=14420 Win=148 Len=1460 [TCP segment of a reassembled PDU]"
"437","23.653231","172.64.155.249","192.168.0.183","TCP","1514","443  >  51124 [ACK] Seq=270126 Ack=14420 Win=148 Len=1460 [TCP segment of a reassembled PDU]"
"438","23.653231","172.64.155.249","192.168.0.183","TCP","1514","443  >  51124 [ACK] Seq=271586 Ack=14420 Win=148 Len=1460 [TCP segment of a reassembled PDU]"
"439","23.653231","172.64.155.249","192.168.0.183","TCP","1514","443  >  51124 [ACK] Seq=273046 Ack=14420 Win=148 Len=1460 [TCP segment of a reassembled PDU]"
"440","23.653231","172.64.155.249","192.168.0.183","TCP","1514","443  >  51124 [ACK] Seq=274506 Ack=14420 Win=148 Len=1460 [TCP segment of a reassembled PDU]"
"441","23.653231","172.64.155.249","192.168.0.183","TLSv1.2","389","Application Data"
"442","23.653231","172.64.155.249","192.168.0.183","TLSv1.2","96","Application Data"
"443","23.653231","172.64.155.249","192.168.0.183","TLSv1.2","85","Application Data"
"444","23.653302","192.168.0.183","172.64.155.249","TCP","54","51124  >  443 [ACK] Seq=14420 Ack=276374 Win=514 Len=0"
"445","23.653583","192.168.0.183","172.64.155.249","TLSv1.2","89","Application Data"
"446","23.709331","172.64.155.249","192.168.0.183","TCP","60","443  >  51124 [ACK] Seq=276374 Ack=14455 Win=148 Len=0"
"447","23.749684","192.168.0.183","172.64.155.249","TLSv1.2","216","Application Data"
"448","23.762877","172.64.155.249","192.168.0.183","TCP","60","443  >  51134 [ACK] Seq=3229 Ack=1032 Win=8 Len=0"
"449","23.785514","172.64.155.249","192.168.0.183","TLSv1.2","474","Application Data"
"450","23.785514","172.64.155.249","192.168.0.183","TLSv1.2","203","Application Data"
"451","23.785514","172.64.155.249","192.168.0.183","TLSv1.2","85","Application Data"
"452","23.785567","192.168.0.183","172.64.155.249","TCP","54","51134  >  443 [ACK] Seq=1032 Ack=3829 Win=508 Len=0"
"453","23.949924","192.168.0.183","172.64.155.249","TLSv1.2","293","Application Data"
"454","23.963975","172.64.155.249","192.168.0.183","TCP","60","443  >  51124 [ACK] Seq=276374 Ack=14694 Win=148 Len=0"
"455","23.988638","172.64.155.249","192.168.0.183","TLSv1.2","143","Application Data"
"456","24.044255","192.168.0.183","172.64.155.249","TCP","54","51124  >  443 [ACK] Seq=14694 Ack=276463 Win=513 Len=0"
"457","24.246084","192.168.0.183","172.64.155.249","TLSv1.2","516","Application Data"
"458","24.246203","192.168.0.183","172.64.155.249","TLSv1.2","618","Application Data"
"459","24.264041","172.64.155.249","192.168.0.183","TCP","60","443  >  51124 [ACK] Seq=276463 Ack=15720 Win=149 Len=0"
"460","24.285084","172.64.155.249","192.168.0.183","TLSv1.2","163","Application Data"
"461","24.285084","172.64.155.249","192.168.0.183","TLSv1.2","85","Application Data"
"462","24.285120","192.168.0.183","172.64.155.249","TCP","54","51124  >  443 [ACK] Seq=15720 Ack=276603 Win=513 Len=0"
"463","25.953671","192.168.0.183","172.64.155.249","TLSv1.2","233","Application Data"
"464","26.010573","172.64.155.249","192.168.0.183","TCP","60","443  >  51124 [ACK] Seq=276603 Ack=15899 Win=149 Len=0"
"465","26.114587","172.64.155.249","192.168.0.183","TLSv1.2","437","Application Data"
"466","26.114587","172.64.155.249","192.168.0.183","TLSv1.2","100","Application Data"
"467","26.114587","172.64.155.249","192.168.0.183","TLSv1.2","1288","Application Data"
"468","26.114587","172.64.155.249","192.168.0.183","TCP","1514","443  >  51124 [ACK] Seq=278266 Ack=15899 Win=149 Len=1460 [TCP segment of a reassembled PDU]"
"469","26.114631","192.168.0.183","172.64.155.249","TCP","54","51124  >  443 [ACK] Seq=15899 Ack=279726 Win=514 Len=0"
"470","26.116304","172.64.155.249","192.168.0.183","TCP","1514","443  >  51124 [ACK] Seq=279726 Ack=15899 Win=149 Len=1460 [TCP segment of a reassembled PDU]"
"471","26.116304","172.64.155.249","192.168.0.183","TCP","1514","443  >  51124 [ACK] Seq=281186 Ack=15899 Win=149 Len=1460 [TCP segment of a reassembled PDU]"
"472","26.116304","172.64.155.249","192.168.0.183","TCP","1514","443  >  51124 [ACK] Seq=282646 Ack=15899 Win=149 Len=1460 [TCP segment of a reassembled PDU]"
"473","26.116304","172.64.155.249","192.168.0.183","TCP","1514","443  >  51124 [ACK] Seq=284106 Ack=15899 Win=149 Len=1460 [TCP segment of a reassembled PDU]"
"474","26.116304","172.64.155.249","192.168.0.183","TLSv1.2","1327","Application Data"
"475","26.116357","192.168.0.183","172.64.155.249","TCP","54","51124  >  443 [ACK] Seq=15899 Ack=286839 Win=514 Len=0"
"476","26.122755","172.64.155.249","192.168.0.183","TCP","1514","443  >  51124 [ACK] Seq=286839 Ack=15899 Win=149 Len=1460 [TCP segment of a reassembled PDU]"
"477","26.122755","172.64.155.249","192.168.0.183","TLSv1.2","1430","Application Data"
"478","26.122968","192.168.0.183","172.64.155.249","TCP","54","51124  >  443 [ACK] Seq=15899 Ack=289675 Win=514 Len=0"
"479","26.126317","172.64.155.249","192.168.0.183","TCP","1514","443  >  51124 [ACK] Seq=289675 Ack=15899 Win=149 Len=1460 [TCP segment of a reassembled PDU]"
"480","26.126317","172.64.155.249","192.168.0.183","TCP","1514","443  >  51124 [ACK] Seq=291135 Ack=15899 Win=149 Len=1460 [TCP segment of a reassembled PDU]"
"481","26.126317","172.64.155.249","192.168.0.183","TCP","1514","443  >  51124 [ACK] Seq=292595 Ack=15899 Win=149 Len=1460 [TCP segment of a reassembled PDU]"
"482","26.126317","172.64.155.249","192.168.0.183","TCP","1514","443  >  51124 [ACK] Seq=294055 Ack=15899 Win=149 Len=1460 [TCP segment of a reassembled PDU]"
"483","26.126317","172.64.155.249","192.168.0.183","TCP","1514","443  >  51124 [ACK] Seq=295515 Ack=15899 Win=149 Len=1460 [TCP segment of a reassembled PDU]"
"484","26.126317","172.64.155.249","192.168.0.183","TCP","1514","443  >  51124 [PSH, ACK] Seq=296975 Ack=15899 Win=149 Len=1460 [TCP segment of a reassembled PDU]"
"485","26.126317","172.64.155.249","192.168.0.183","TLSv1.2","895","Application Data"
"486","26.126317","172.64.155.249","192.168.0.183","TLSv1.2","127","Application Data, Application Data"
"487","26.126411","192.168.0.183","172.64.155.249","TCP","54","51124  >  443 [ACK] Seq=15899 Ack=299349 Win=514 Len=0"
"488","26.362351","192.168.0.183","172.64.155.249","TLSv1.2","191","Application Data"
"489","26.362582","192.168.0.183","172.64.155.249","TLSv1.2","178","Application Data"
"490","26.379300","172.64.155.249","192.168.0.183","TCP","60","443  >  51124 [ACK] Seq=299349 Ack=16160 Win=149 Len=0"
"491","26.401380","172.64.155.249","192.168.0.183","TLSv1.2","144","Application Data"
"492","26.403673","172.64.155.249","192.168.0.183","TLSv1.2","146","Application Data"
"493","26.403673","172.64.155.249","192.168.0.183","TLSv1.2","100","Application Data"
"494","26.403673","172.64.155.249","192.168.0.183","TLSv1.2","217","Application Data"
"495","26.403673","172.64.155.249","192.168.0.183","TLSv1.2","85","Application Data"
"496","26.403729","192.168.0.183","172.64.155.249","TCP","54","51124  >  443 [ACK] Seq=16160 Ack=299771 Win=512 Len=0"
"497","26.523844","192.168.0.183","172.64.155.249","TLSv1.2","490","Application Data"
"498","26.523922","192.168.0.183","172.64.155.249","TLSv1.2","545","Application Data"
"499","26.538206","172.64.155.249","192.168.0.183","TCP","60","443  >  51124 [ACK] Seq=299771 Ack=17087 Win=150 Len=0"
"500","26.561511","172.64.155.249","192.168.0.183","TLSv1.2","278","Application Data"
"501","26.561511","172.64.155.249","192.168.0.183","TLSv1.2","85","Application Data"
"502","26.561541","192.168.0.183","172.64.155.249","TCP","54","51124  >  443 [ACK] Seq=17087 Ack=300026 Win=511 Len=0"
"503","29.683596","192.168.0.183","172.64.155.249","TLSv1.2","179","Application Data"
"504","29.683664","192.168.0.183","172.64.155.249","TLSv1.2","170","Application Data"
"505","29.697501","172.64.155.249","192.168.0.183","TCP","60","443  >  51124 [ACK] Seq=300026 Ack=17328 Win=150 Len=0"
"506","29.697562","192.168.0.183","172.64.155.249","TLSv1.2","147","Application Data"
"507","29.726657","172.64.155.249","192.168.0.183","TLSv1.2","279","Application Data"
"508","29.770122","192.168.0.183","172.64.155.249","TCP","54","51124  >  443 [ACK] Seq=17421 Ack=300251 Win=510 Len=0"
"509","29.890809","172.64.155.249","192.168.0.183","TLSv1.2","150","Application Data"
"510","29.890809","172.64.155.249","192.168.0.183","TLSv1.2","100","Application Data"
"511","29.890809","172.64.155.249","192.168.0.183","TLSv1.2","1325","Application Data"
"512","29.890870","192.168.0.183","172.64.155.249","TCP","54","51124  >  443 [ACK] Seq=17421 Ack=301664 Win=514 Len=0"
"513","29.891880","192.168.0.183","172.64.155.249","TLSv1.2","89","Application Data"
"514","29.893164","172.64.155.249","192.168.0.183","TCP","1514","443  >  51124 [ACK] Seq=301664 Ack=17421 Win=150 Len=1460 [TCP segment of a reassembled PDU]"
"515","29.893164","172.64.155.249","192.168.0.183","TCP","1514","443  >  51124 [ACK] Seq=303124 Ack=17421 Win=150 Len=1460 [TCP segment of a reassembled PDU]"
"516","29.893164","172.64.155.249","192.168.0.183","TCP","1514","443  >  51124 [ACK] Seq=304584 Ack=17421 Win=150 Len=1460 [TCP segment of a reassembled PDU]"
"517","29.893164","172.64.155.249","192.168.0.183","TLSv1.2","602","Application Data"
"518","29.893164","172.64.155.249","192.168.0.183","TCP","1514","443  >  51124 [ACK] Seq=306592 Ack=17421 Win=150 Len=1460 [TCP segment of a reassembled PDU]"
"519","29.893164","172.64.155.249","192.168.0.183","TCP","1514","443  >  51124 [ACK] Seq=308052 Ack=17421 Win=150 Len=1460 [TCP segment of a reassembled PDU]"
"520","29.893164","172.64.155.249","192.168.0.183","TLSv1.2","780","Application Data"
"521","29.893269","192.168.0.183","172.64.155.249","TCP","54","51124  >  443 [ACK] Seq=17456 Ack=310238 Win=514 Len=0"
"522","29.906671","172.64.155.249","192.168.0.183","TCP","1514","443  >  51124 [ACK] Seq=310238 Ack=17421 Win=150 Len=1460 [TCP segment of a reassembled PDU]"
"523","29.906671","172.64.155.249","192.168.0.183","TLSv1.2","1353","Application Data"
"524","29.906817","192.168.0.183","172.64.155.249","TCP","54","51124  >  443 [ACK] Seq=17456 Ack=312997 Win=514 Len=0"
"525","29.910882","172.64.155.249","192.168.0.183","TCP","1514","443  >  51124 [ACK] Seq=312997 Ack=17456 Win=150 Len=1460 [TCP segment of a reassembled PDU]"
"526","29.910882","172.64.155.249","192.168.0.183","TCP","1514","443  >  51124 [ACK] Seq=314457 Ack=17456 Win=150 Len=1460 [TCP segment of a reassembled PDU]"
"527","29.910882","172.64.155.249","192.168.0.183","TCP","1514","443  >  51124 [ACK] Seq=315917 Ack=17456 Win=150 Len=1460 [TCP segment of a reassembled PDU]"
"528","29.910882","172.64.155.249","192.168.0.183","TCP","1514","443  >  51124 [ACK] Seq=317377 Ack=17456 Win=150 Len=1460 [TCP segment of a reassembled PDU]"
"529","29.910882","172.64.155.249","192.168.0.183","TCP","1514","443  >  51124 [ACK] Seq=318837 Ack=17456 Win=150 Len=1460 [TCP segment of a reassembled PDU]"
"530","29.910882","172.64.155.249","192.168.0.183","TCP","1514","443  >  51124 [PSH, ACK] Seq=320297 Ack=17456 Win=150 Len=1460 [TCP segment of a reassembled PDU]"
"531","29.910882","172.64.155.249","192.168.0.183","TCP","1514","443  >  51124 [ACK] Seq=321757 Ack=17456 Win=150 Len=1460 [TCP segment of a reassembled PDU]"
"532","29.910882","172.64.155.249","192.168.0.183","TCP","1514","443  >  51124 [ACK] Seq=323217 Ack=17456 Win=150 Len=1460 [TCP segment of a reassembled PDU]"
"533","29.910882","172.64.155.249","192.168.0.183","TCP","1514","443  >  51124 [ACK] Seq=324677 Ack=17456 Win=150 Len=1460 [TCP segment of a reassembled PDU]"
"534","29.910882","172.64.155.249","192.168.0.183","TCP","1514","443  >  51124 [ACK] Seq=326137 Ack=17456 Win=150 Len=1460 [TCP segment of a reassembled PDU]"
"535","29.910882","172.64.155.249","192.168.0.183","TCP","1514","443  >  51124 [ACK] Seq=327597 Ack=17456 Win=150 Len=1460 [TCP segment of a reassembled PDU]"
"536","29.910882","172.64.155.249","192.168.0.183","TLSv1.2","400","Application Data"
"537","29.910882","172.64.155.249","192.168.0.183","TLSv1.2","1514","Application Data"
"538","29.910882","172.64.155.249","192.168.0.183","TLSv1.2","1198","Application Data"
"539","29.911002","192.168.0.183","172.64.155.249","TCP","54","51124  >  443 [ACK] Seq=17456 Ack=332007 Win=514 Len=0"
"540","29.917058","172.64.155.249","192.168.0.183","TCP","1514","443  >  51124 [ACK] Seq=332007 Ack=17456 Win=150 Len=1460 [TCP segment of a reassembled PDU]"
"541","29.917058","172.64.155.249","192.168.0.183","TLSv1.2","1455","Application Data"
"542","29.917058","172.64.155.249","192.168.0.183","TLSv1.2","96","Application Data"
"543","29.917058","172.64.155.249","192.168.0.183","TLSv1.2","85","Application Data"
"544","29.917117","192.168.0.183","172.64.155.249","TCP","54","51124  >  443 [ACK] Seq=17456 Ack=334941 Win=514 Len=0"
"545","29.971413","192.168.0.183","172.64.155.249","TLSv1.2","184","Application Data"
"546","30.019496","172.64.155.249","192.168.0.183","TLSv1.2","474","Application Data"
"547","30.019496","172.64.155.249","192.168.0.183","TLSv1.2","203","Application Data"
"548","30.019496","172.64.155.249","192.168.0.183","TLSv1.2","85","Application Data"
"549","30.019532","192.168.0.183","172.64.155.249","TCP","54","51134  >  443 [ACK] Seq=1162 Ack=4429 Win=514 Len=0"
"550","30.020336","192.168.0.183","172.64.155.249","TLSv1.2","89","Application Data"
"551","30.074144","172.64.155.249","192.168.0.183","TCP","60","443  >  51134 [ACK] Seq=4429 Ack=1197 Win=8 Len=0"
"552","30.374163","192.168.0.183","172.64.155.249","TLSv1.2","541","Application Data"
"553","30.374259","192.168.0.183","172.64.155.249","TLSv1.2","549","Application Data"
"554","30.389177","172.64.155.249","192.168.0.183","TCP","60","443  >  51124 [ACK] Seq=334941 Ack=18438 Win=151 Len=0"
"555","30.410778","172.64.155.249","192.168.0.183","TLSv1.2","144","Application Data"
"556","30.410778","172.64.155.249","192.168.0.183","TLSv1.2","85","Application Data"
"557","30.410811","192.168.0.183","172.64.155.249","TCP","54","51124  >  443 [ACK] Seq=18438 Ack=335062 Win=513 Len=0"
"558","31.828185","192.168.0.183","172.64.155.249","TLSv1.2","785","Application Data"
"559","31.828305","192.168.0.183","172.64.155.249","TLSv1.2","589","Application Data"
"560","31.843549","192.168.0.183","172.64.155.249","TLSv1.2","327","Application Data"
"561","31.844540","172.64.155.249","192.168.0.183","TCP","60","443  >  51124 [ACK] Seq=335062 Ack=19704 Win=152 Len=0"
"562","31.899005","172.64.155.249","192.168.0.183","TCP","60","443  >  51124 [ACK] Seq=335062 Ack=19977 Win=152 Len=0"
"563","33.187632","172.64.155.249","192.168.0.183","TLSv1.2","278","Application Data"
"564","33.187632","172.64.155.249","192.168.0.183","TLSv1.2","85","Application Data"
"565","33.187711","192.168.0.183","172.64.155.249","TCP","54","51124  >  443 [ACK] Seq=19977 Ack=335317 Win=512 Len=0"
"566","35.715884","172.64.155.249","192.168.0.183","TLSv1.2","194","Application Data"
"567","35.715884","172.64.155.249","192.168.0.183","TLSv1.2","100","Application Data"
"568","35.715884","172.64.155.249","192.168.0.183","TLSv1.2","1315","Application Data"
"569","35.715931","192.168.0.183","172.64.155.249","TCP","54","51124  >  443 [ACK] Seq=19977 Ack=336764 Win=514 Len=0"
"570","35.716871","192.168.0.183","172.64.155.249","TLSv1.2","89","Application Data"
"571","35.717606","172.64.155.249","192.168.0.183","TCP","1514","443  >  51124 [ACK] Seq=336764 Ack=19977 Win=152 Len=1460 [TCP segment of a reassembled PDU]"
"572","35.717606","172.64.155.249","192.168.0.183","TLSv1.2","1226","Application Data"
"573","35.717659","192.168.0.183","172.64.155.249","TCP","54","51124  >  443 [ACK] Seq=20012 Ack=339396 Win=514 Len=0"
"574","35.719833","172.64.155.249","192.168.0.183","TCP","1514","443  >  51124 [ACK] Seq=339396 Ack=19977 Win=152 Len=1460 [TCP segment of a reassembled PDU]"
"575","35.719833","172.64.155.249","192.168.0.183","TCP","1514","443  >  51124 [ACK] Seq=340856 Ack=19977 Win=152 Len=1460 [TCP segment of a reassembled PDU]"
"576","35.719833","172.64.155.249","192.168.0.183","TLSv1.2","981","Application Data"
"577","35.719833","172.64.155.249","192.168.0.183","TCP","1514","443  >  51124 [ACK] Seq=343243 Ack=19977 Win=152 Len=1460 [TCP segment of a reassembled PDU]"
"578","35.719833","172.64.155.249","192.168.0.183","TLSv1.2","914","Application Data"
"579","35.720043","192.168.0.183","172.64.155.249","TCP","54","51124  >  443 [ACK] Seq=20012 Ack=345563 Win=514 Len=0"
"580","35.727597","172.64.155.249","192.168.0.183","TCP","1514","443  >  51124 [ACK] Seq=345563 Ack=19977 Win=152 Len=1460 [TCP segment of a reassembled PDU]"
"581","35.727597","172.64.155.249","192.168.0.183","TLSv1.2","1128","Application Data"
"582","35.727681","192.168.0.183","172.64.155.249","TCP","54","51124  >  443 [ACK] Seq=20012 Ack=348097 Win=514 Len=0"
"583","35.728459","172.64.155.249","192.168.0.183","TCP","1514","443  >  51124 [ACK] Seq=348097 Ack=19977 Win=152 Len=1460 [TCP segment of a reassembled PDU]"
"584","35.728459","172.64.155.249","192.168.0.183","TLSv1.2","82","Application Data"
"585","35.728459","172.64.155.249","192.168.0.183","TCP","60","443  >  51124 [ACK] Seq=349585 Ack=20012 Win=152 Len=0"
"586","35.728459","172.64.155.249","192.168.0.183","TCP","60","[TCP Dup ACK 585#1] 443  >  51124 [ACK] Seq=349585 Ack=20012 Win=152 Len=0"
"587","35.728504","192.168.0.183","172.64.155.249","TCP","54","51124  >  443 [ACK] Seq=20012 Ack=349585 Win=514 Len=0"
"588","35.730149","172.64.155.249","192.168.0.183","TCP","1514","443  >  51124 [ACK] Seq=349585 Ack=20012 Win=152 Len=1460 [TCP segment of a reassembled PDU]"
"589","35.730149","172.64.155.249","192.168.0.183","TCP","1514","443  >  51124 [ACK] Seq=351045 Ack=20012 Win=152 Len=1460 [TCP segment of a reassembled PDU]"
"590","35.730149","172.64.155.249","192.168.0.183","TCP","1514","443  >  51124 [ACK] Seq=352505 Ack=20012 Win=152 Len=1460 [TCP segment of a reassembled PDU]"
"591","35.730149","172.64.155.249","192.168.0.183","TLSv1.2","528","Application Data"
"592","35.730149","172.64.155.249","192.168.0.183","TCP","1514","443  >  51124 [ACK] Seq=354439 Ack=20012 Win=152 Len=1460 [TCP segment of a reassembled PDU]"
"593","35.730149","172.64.155.249","192.168.0.183","TLSv1.2","875","Application Data"
"594","35.730197","192.168.0.183","172.64.155.249","TCP","54","51124  >  443 [ACK] Seq=20012 Ack=356720 Win=514 Len=0"
"595","35.731964","172.64.155.249","192.168.0.183","TCP","1514","443  >  51124 [ACK] Seq=356720 Ack=20012 Win=152 Len=1460 [TCP segment of a reassembled PDU]"
"596","35.731964","172.64.155.249","192.168.0.183","TCP","1514","443  >  51124 [ACK] Seq=358180 Ack=20012 Win=152 Len=1460 [TCP segment of a reassembled PDU]"
"597","35.731964","172.64.155.249","192.168.0.183","TCP","1514","443  >  51124 [ACK] Seq=359640 Ack=20012 Win=152 Len=1460 [TCP segment of a reassembled PDU]"
"598","35.731964","172.64.155.249","192.168.0.183","TLSv1.2","433","Application Data"
"599","35.731997","192.168.0.183","172.64.155.249","TCP","54","51124  >  443 [ACK] Seq=20012 Ack=361479 Win=514 Len=0"
"600","35.733501","172.64.155.249","192.168.0.183","TCP","1514","443  >  51124 [ACK] Seq=361479 Ack=20012 Win=152 Len=1460 [TCP segment of a reassembled PDU]"
"601","35.733501","172.64.155.249","192.168.0.183","TCP","1514","443  >  51124 [ACK] Seq=362939 Ack=20012 Win=152 Len=1460 [TCP segment of a reassembled PDU]"
"602","35.733501","172.64.155.249","192.168.0.183","TCP","1514","443  >  51124 [ACK] Seq=364399 Ack=20012 Win=152 Len=1460 [TCP segment of a reassembled PDU]"
"603","35.733501","172.64.155.249","192.168.0.183","TCP","1514","443  >  51124 [ACK] Seq=365859 Ack=20012 Win=152 Len=1460 [TCP segment of a reassembled PDU]"
"604","35.733501","172.64.155.249","192.168.0.183","TLSv1.2","1421","Application Data"
"605","35.733581","192.168.0.183","172.64.155.249","TCP","54","51124  >  443 [ACK] Seq=20012 Ack=368686 Win=514 Len=0"
"606","35.736486","172.64.155.249","192.168.0.183","TCP","1514","443  >  51124 [ACK] Seq=368686 Ack=20012 Win=152 Len=1460 [TCP segment of a reassembled PDU]"
"607","35.736486","172.64.155.249","192.168.0.183","TCP","1514","443  >  51124 [ACK] Seq=370146 Ack=20012 Win=152 Len=1460 [TCP segment of a reassembled PDU]"
"608","35.736486","172.64.155.249","192.168.0.183","TLSv1.2","850","Application Data"
"609","35.736585","192.168.0.183","172.64.155.249","TCP","54","51124  >  443 [ACK] Seq=20012 Ack=372402 Win=514 Len=0"
"610","35.757774","172.64.155.249","192.168.0.183","TCP","1514","443  >  51124 [ACK] Seq=372402 Ack=20012 Win=152 Len=1460 [TCP segment of a reassembled PDU]"
"611","35.757774","172.64.155.249","192.168.0.183","TCP","1514","443  >  51124 [ACK] Seq=373862 Ack=20012 Win=152 Len=1460 [TCP segment of a reassembled PDU]"
"612","35.757774","172.64.155.249","192.168.0.183","TLSv1.2","120","Application Data"
"613","35.757774","172.64.155.249","192.168.0.183","TLSv1.2","96","Application Data"
"614","35.757774","172.64.155.249","192.168.0.183","TLSv1.2","85","Application Data"
"615","35.757878","192.168.0.183","172.64.155.249","TCP","54","51124  >  443 [ACK] Seq=20012 Ack=375461 Win=514 Len=0"
"616","35.842762","192.168.0.183","172.64.155.249","TLSv1.2","210","Application Data"
"617","35.854254","172.64.155.249","192.168.0.183","TCP","60","443  >  51134 [ACK] Seq=4429 Ack=1353 Win=8 Len=0"
"618","35.886052","172.64.155.249","192.168.0.183","TLSv1.2","473","Application Data"
"619","35.886052","172.64.155.249","192.168.0.183","TLSv1.2","234","Application Data, Application Data"
"620","35.886098","192.168.0.183","172.64.155.249","TCP","54","51134  >  443 [ACK] Seq=1353 Ack=5028 Win=511 Len=0"
"621","35.887029","192.168.0.183","172.64.155.249","TLSv1.2","89","Application Data"
"622","35.944240","172.64.155.249","192.168.0.183","TCP","60","443  >  51134 [ACK] Seq=5028 Ack=1388 Win=8 Len=0"
"623","36.028866","192.168.0.183","172.64.155.249","TLSv1.2","309","Application Data"
"624","36.072391","172.64.155.249","192.168.0.183","TLSv1.2","263","Application Data"
"625","36.118697","192.168.0.183","172.64.155.249","TCP","54","51124  >  443 [ACK] Seq=20267 Ack=375670 Win=513 Len=0"
"626","36.316501","192.168.0.183","172.64.155.249","TLSv1.2","545","Application Data"
"627","36.316557","192.168.0.183","172.64.155.249","TLSv1.2","592","Application Data"
"628","36.331462","172.64.155.249","192.168.0.183","TCP","60","443  >  51124 [ACK] Seq=375670 Ack=21296 Win=153 Len=0"
"629","36.354690","172.64.155.249","192.168.0.183","TLSv1.2","143","Application Data"
"630","36.354690","172.64.155.249","192.168.0.183","TLSv1.2","85","Application Data"
"631","36.354791","192.168.0.183","172.64.155.249","TCP","54","51124  >  443 [ACK] Seq=21296 Ack=375790 Win=512 Len=0"
