"No.","Time","Source","Destination","Protocol","Length","Info"
"1","0.000000","192.168.0.183","172.64.155.249","TLSv1.2","272","Application Data"
"2","0.000080","192.168.0.183","172.64.155.249","TLSv1.2","93","Application Data"
"3","0.000108","192.168.0.183","172.64.155.249","TLSv1.2","170","Application Data"
"4","0.010299","192.168.0.183","172.64.155.249","TLSv1.2","534","Application Data"
"5","0.022834","172.64.155.249","192.168.0.183","TCP","60","443  >  51124 [ACK] Seq=1 Ack=258 Win=91 Len=0"
"6","0.022834","172.64.155.249","192.168.0.183","TLSv1.2","93","Application Data"
"7","0.039343","172.64.155.249","192.168.0.183","TCP","60","443  >  51124 [ACK] Seq=40 Ack=854 Win=91 Len=0"
"8","0.043418","172.64.155.249","192.168.0.183","TLSv1.2","279","Application Data"
"9","0.043464","192.168.0.183","172.64.155.249","TCP","54","51124  >  443 [ACK] Seq=854 Ack=265 Win=510 Len=0"
"10","0.182384","192.168.0.183","172.64.155.249","TLSv1.2","401","Application Data"
"11","0.223223","172.64.155.249","192.168.0.183","TLSv1.2","146","Application Data"
"12","0.223223","172.64.155.249","192.168.0.183","TCP","1514","443  >  51124 [ACK] Seq=357 Ack=1201 Win=92 Len=1460 [TCP segment of a reassembled PDU]"
"13","0.223223","172.64.155.249","192.168.0.183","TLSv1.2","751","Application Data"
"14","0.223223","172.64.155.249","192.168.0.183","TLSv1.2","85","Application Data"
"15","0.223282","192.168.0.183","172.64.155.249","TCP","54","51124  >  443 [ACK] Seq=1201 Ack=2545 Win=514 Len=0"
"16","0.224714","192.168.0.183","172.64.155.249","TLSv1.2","89","Application Data"
"17","0.227377","172.64.155.249","192.168.0.183","TLSv1.2","146","Application Data"
"18","0.227377","172.64.155.249","192.168.0.183","TLSv1.2","100","Application Data"
"19","0.227377","172.64.155.249","192.168.0.183","TLSv1.2","1326","Application Data"
"20","0.227422","192.168.0.183","172.64.155.249","TCP","54","51124  >  443 [ACK] Seq=1236 Ack=3955 Win=514 Len=0"
"21","0.231706","172.64.155.249","192.168.0.183","TCP","1514","443  >  51124 [ACK] Seq=3955 Ack=1201 Win=92 Len=1460 [TCP segment of a reassembled PDU]"
"22","0.231706","172.64.155.249","192.168.0.183","TCP","1514","443  >  51124 [ACK] Seq=5415 Ack=1201 Win=92 Len=1460 [TCP segment of a reassembled PDU]"
"23","0.231706","172.64.155.249","192.168.0.183","TCP","1514","443  >  51124 [ACK] Seq=6875 Ack=1201 Win=92 Len=1460 [TCP segment of a reassembled PDU]"
"24","0.231706","172.64.155.249","192.168.0.183","TCP","1514","443  >  51124 [ACK] Seq=8335 Ack=1201 Win=92 Len=1460 [TCP segment of a reassembled PDU]"
"25","0.231706","172.64.155.249","192.168.0.183","TCP","1514","443  >  51124 [ACK] Seq=9795 Ack=1201 Win=92 Len=1460 [TCP segment of a reassembled PDU]"
"26","0.231706","172.64.155.249","192.168.0.183","TLSv1.2","1361","Application Data"
"27","0.231826","192.168.0.183","172.64.155.249","TCP","54","51124  >  443 [ACK] Seq=1236 Ack=12562 Win=514 Len=0"
"28","0.236743","172.64.155.249","192.168.0.183","TCP","1514","443  >  51124 [ACK] Seq=12562 Ack=1201 Win=92 Len=1460 [TCP segment of a reassembled PDU]"
"29","0.236743","172.64.155.249","192.168.0.183","TLSv1.2","1368","Application Data"
"30","0.236824","192.168.0.183","172.64.155.249","TCP","54","51124  >  443 [ACK] Seq=1236 Ack=15336 Win=514 Len=0"
"31","0.240074","172.64.155.249","192.168.0.183","TCP","1514","443  >  51124 [ACK] Seq=15336 Ack=1236 Win=92 Len=1460 [TCP segment of a reassembled PDU]"
"32","0.240074","172.64.155.249","192.168.0.183","TLSv1.2","1005","Application Data"
"33","0.240191","192.168.0.183","172.64.155.249","TCP","54","51124  >  443 [ACK] Seq=1236 Ack=17747 Win=514 Len=0"
"34","0.241077","172.64.155.249","192.168.0.183","TCP","1514","443  >  51124 [ACK] Seq=17747 Ack=1236 Win=92 Len=1460 [TCP segment of a reassembled PDU]"
"35","0.241077","172.64.155.249","192.168.0.183","TCP","1514","443  >  51124 [ACK] Seq=19207 Ack=1236 Win=92 Len=1460 [TCP segment of a reassembled PDU]"
"36","0.241077","172.64.155.249","192.168.0.183","TLSv1.2","1445","Application Data"
"37","0.241077","172.64.155.249","192.168.0.183","TCP","1514","443  >  51124 [ACK] Seq=22058 Ack=1236 Win=92 Len=1460 [TCP segment of a reassembled PDU]"
"38","0.241077","172.64.155.249","192.168.0.183","TCP","1514","443  >  51124 [ACK] Seq=23518 Ack=1236 Win=92 Len=1460 [TCP segment of a reassembled PDU]"
"39","0.241077","172.64.155.249","192.168.0.183","TCP","1514","443  >  51124 [ACK] Seq=24978 Ack=1236 Win=92 Len=1460 [TCP segment of a reassembled PDU]"
"40","0.241077","172.64.155.249","192.168.0.183","TLSv1.2","561","Application Data"
"41","0.241077","172.64.155.249","192.168.0.183","TCP","1514","443  >  51124 [ACK] Seq=26945 Ack=1236 Win=92 Len=1460 [TCP segment of a reassembled PDU]"
"42","0.241077","172.64.155.249","192.168.0.183","TCP","1514","443  >  51124 [ACK] Seq=28405 Ack=1236 Win=92 Len=1460 [TCP segment of a reassembled PDU]"
"43","0.241077","172.64.155.249","192.168.0.183","TCP","1514","443  >  51124 [ACK] Seq=29865 Ack=1236 Win=92 Len=1460 [TCP segment of a reassembled PDU]"
"44","0.241077","172.64.155.249","192.168.0.183","TCP","1514","443  >  51124 [ACK] Seq=31325 Ack=1236 Win=92 Len=1460 [TCP segment of a reassembled PDU]"
"45","0.241077","172.64.155.249","192.168.0.183","TCP","1514","443  >  51124 [ACK] Seq=32785 Ack=1236 Win=92 Len=1460 [TCP segment of a reassembled PDU]"
"46","0.241077","172.64.155.249","192.168.0.183","TLSv1.2","1475","Application Data"
"47","0.241246","192.168.0.183","172.64.155.249","TCP","54","51124  >  443 [ACK] Seq=1236 Ack=35666 Win=514 Len=0"
"48","0.247548","172.64.155.249","192.168.0.183","TCP","1514","443  >  51124 [ACK] Seq=35666 Ack=1236 Win=92 Len=1460 [TCP segment of a reassembled PDU]"
"49","0.247548","172.64.155.249","192.168.0.183","TLSv1.2","244","Application Data"
"50","0.247548","172.64.155.249","192.168.0.183","TLSv1.2","96","Application Data"
"51","0.247548","172.64.155.249","192.168.0.183","TLSv1.2","85","Application Data"
"52","0.247614","192.168.0.183","172.64.155.249","TCP","54","51124  >  443 [ACK] Seq=1236 Ack=37389 Win=514 Len=0"
"53","0.317461","192.168.0.183","172.64.155.249","TLSv1.2","184","Application Data"
"54","0.317511","192.168.0.183","172.64.155.249","TLSv1.2","93","Application Data"
"55","0.331506","172.64.155.249","192.168.0.183","TCP","60","443  >  51134 [ACK] Seq=1 Ack=170 Win=8 Len=0"
"56","0.331506","172.64.155.249","192.168.0.183","TLSv1.2","93","Application Data"
"57","0.364372","172.64.155.249","192.168.0.183","TLSv1.2","670","Application Data"
"58","0.364372","172.64.155.249","192.168.0.183","TLSv1.2","203","Application Data"
"59","0.364372","172.64.155.249","192.168.0.183","TLSv1.2","85","Application Data"
"60","0.364417","192.168.0.183","172.64.155.249","TCP","54","51134  >  443 [ACK] Seq=170 Ack=836 Win=514 Len=0"
"61","0.365225","192.168.0.183","172.64.155.249","TLSv1.2","89","Application Data"
"62","0.417920","172.64.155.249","192.168.0.183","TCP","60","443  >  51134 [ACK] Seq=836 Ack=205 Win=8 Len=0"
"63","0.699727","192.168.0.183","172.64.155.249","TLSv1.2","544","Application Data"
"64","0.699789","192.168.0.183","172.64.155.249","TLSv1.2","549","Application Data"
"65","0.711594","172.64.155.249","192.168.0.183","TCP","60","443  >  51124 [ACK] Seq=37389 Ack=2221 Win=92 Len=0"
"66","0.736655","172.64.155.249","192.168.0.183","TLSv1.2","277","Application Data"
"67","0.736655","172.64.155.249","192.168.0.183","TLSv1.2","85","Application Data"
"68","0.736699","192.168.0.183","172.64.155.249","TCP","54","51124  >  443 [ACK] Seq=2221 Ack=37643 Win=513 Len=0"
"69","2.411612","192.168.0.183","172.64.155.249","TLSv1.2","278","Application Data"
"70","2.411679","192.168.0.183","172.64.155.249","TLSv1.2","589","Application Data"
"71","2.425793","192.168.0.183","172.64.155.249","TLSv1.2","220","Application Data"
"72","2.426021","172.64.155.249","192.168.0.183","TCP","60","443  >  51124 [ACK] Seq=37643 Ack=2980 Win=93 Len=0"
"73","2.449767","172.64.155.249","192.168.0.183","TLSv1.2","278","Application Data"
"74","2.449767","172.64.155.249","192.168.0.183","TLSv1.2","85","Application Data"
"75","2.449812","192.168.0.183","172.64.155.249","TCP","54","51124  >  443 [ACK] Seq=3146 Ack=37898 Win=512 Len=0"
"76","2.476084","172.64.155.249","192.168.0.183","TLSv1.2","165","Application Data"
"77","2.476084","172.64.155.249","192.168.0.183","TLSv1.2","100","Application Data"
"78","2.476128","192.168.0.183","172.64.155.249","TCP","54","51124  >  443 [ACK] Seq=3146 Ack=38055 Win=511 Len=0"
"79","2.476307","172.64.155.249","192.168.0.183","TCP","1514","443  >  51124 [ACK] Seq=38055 Ack=3146 Win=93 Len=1460 [TCP segment of a reassembled PDU]"
"80","2.476307","172.64.155.249","192.168.0.183","TCP","1514","443  >  51124 [ACK] Seq=39515 Ack=3146 Win=93 Len=1460 [TCP segment of a reassembled PDU]"
"81","2.476307","172.64.155.249","192.168.0.183","TCP","1514","443  >  51124 [ACK] Seq=40975 Ack=3146 Win=93 Len=1460 [TCP segment of a reassembled PDU]"
"82","2.476307","172.64.155.249","192.168.0.183","TCP","1514","443  >  51124 [ACK] Seq=42435 Ack=3146 Win=93 Len=1460 [TCP segment of a reassembled PDU]"
"83","2.476307","172.64.155.249","192.168.0.183","TLSv1.2","402","Application Data"
"84","2.476307","172.64.155.249","192.168.0.183","TCP","1514","443  >  51124 [ACK] Seq=44243 Ack=3146 Win=93 Len=1460 [TCP segment of a reassembled PDU]"
"85","2.476307","172.64.155.249","192.168.0.183","TLSv1.2","1051","Application Data"
"86","2.476307","172.64.155.249","192.168.0.183","TCP","1514","443  >  51124 [ACK] Seq=46700 Ack=3146 Win=93 Len=1460 [TCP segment of a reassembled PDU]"
"87","2.476307","172.64.155.249","192.168.0.183","TLSv1.2","378","Application Data"
"88","2.476344","192.168.0.183","172.64.155.249","TCP","54","51124  >  443 [ACK] Seq=3146 Ack=48484 Win=514 Len=0"
"89","2.484681","172.64.155.249","192.168.0.183","TCP","1514","443  >  51124 [ACK] Seq=48484 Ack=3146 Win=93 Len=1460 [TCP segment of a reassembled PDU]"
"90","2.484681","172.64.155.249","192.168.0.183","TLSv1.2","959","Application Data"
"91","2.484741","192.168.0.183","172.64.155.249","TCP","54","51124  >  443 [ACK] Seq=3146 Ack=50849 Win=514 Len=0"
"92","2.486731","172.64.155.249","192.168.0.183","TCP","1514","443  >  51124 [ACK] Seq=50849 Ack=3146 Win=93 Len=1460 [TCP segment of a reassembled PDU]"
"93","2.486731","172.64.155.249","192.168.0.183","TLSv1.2","1042","Application Data"
"94","2.486782","192.168.0.183","172.64.155.249","TCP","54","51124  >  443 [ACK] Seq=3146 Ack=53297 Win=514 Len=0"
"95","2.493961","172.64.155.249","192.168.0.183","TCP","1514","443  >  51124 [ACK] Seq=53297 Ack=3146 Win=93 Len=1460 [TCP segment of a reassembled PDU]"
"96","2.493961","172.64.155.249","192.168.0.183","TCP","1514","443  >  51124 [ACK] Seq=54757 Ack=3146 Win=93 Len=1460 [TCP segment of a reassembled PDU]"
"97","2.493961","172.64.155.249","192.168.0.183","TCP","1514","443  >  51124 [ACK] Seq=56217 Ack=3146 Win=93 Len=1460 [TCP segment of a reassembled PDU]"
"98","2.493961","172.64.155.249","192.168.0.183","TCP","1514","443  >  51124 [ACK] Seq=57677 Ack=3146 Win=93 Len=1460 [TCP segment of a reassembled PDU]"
"99","2.493961","172.64.155.249","192.168.0.183","TCP","1514","443  >  51124 [ACK] Seq=59137 Ack=3146 Win=93 Len=1460 [TCP segment of a reassembled PDU]"
"100","2.493961","172.64.155.249","192.168.0.183","TCP","1514","443  >  51124 [PSH, ACK] Seq=60597 Ack=3146 Win=93 Len=1460 [TCP segment of a reassembled PDU]"
"101","2.493961","172.64.155.249","192.168.0.183","TLSv1.2","483","Application Data"
"102","2.493961","172.64.155.249","192.168.0.183","TCP","1514","443  >  51124 [ACK] Seq=62486 Ack=3146 Win=93 Len=1460 [TCP segment of a reassembled PDU]"
"103","2.493961","172.64.155.249","192.168.0.183","TCP","1514","443  >  51124 [ACK] Seq=63946 Ack=3146 Win=93 Len=1460 [TCP segment of a reassembled PDU]"
"104","2.493961","172.64.155.249","192.168.0.183","TCP","1514","443  >  51124 [ACK] Seq=65406 Ack=3146 Win=93 Len=1460 [TCP segment of a reassembled PDU]"
"105","2.493961","172.64.155.249","192.168.0.183","TLSv1.2","479","Application Data"
"106","2.493961","172.64.155.249","192.168.0.183","TCP","1514","443  >  51124 [ACK] Seq=67291 Ack=3146 Win=93 Len=1460 [TCP segment of a reassembled PDU]"
"107","2.493961","172.64.155.249","192.168.0.183","TCP","1514","443  >  51124 [ACK] Seq=68751 Ack=3146 Win=93 Len=1460 [TCP segment of a reassembled PDU]"
"108","2.493961","172.64.155.249","192.168.0.183","TLSv1.2","777","Application Data"
"109","2.494091","192.168.0.183","172.64.155.249","TCP","54","51124  >  443 [ACK] Seq=3146 Ack=70934 Win=514 Len=0"
"110","2.497090","172.64.155.249","192.168.0.183","TCP","1514","443  >  51124 [ACK] Seq=70934 Ack=3146 Win=93 Len=1460 [TCP segment of a reassembled PDU]"
"111","2.497090","172.64.155.249","192.168.0.183","TCP","1514","443  >  51124 [ACK] Seq=72394 Ack=3146 Win=93 Len=1460 [TCP segment of a reassembled PDU]"
"112","2.497090","172.64.155.249","192.168.0.183","TCP","1514","443  >  51124 [ACK] Seq=73854 Ack=3146 Win=93 Len=1460 [TCP segment of a reassembled PDU]"
"113","2.497090","172.64.155.249","192.168.0.183","TCP","1514","443  >  51124 [ACK] Seq=75314 Ack=3146 Win=93 Len=1460 [TCP segment of a reassembled PDU]"
"114","2.497090","172.64.155.249","192.168.0.183","TLSv1.2","555","Application Data"
"115","2.497090","172.64.155.249","192.168.0.183","TLSv1.2","127","Application Data, Application Data"
"116","2.497164","192.168.0.183","172.64.155.249","TCP","54","51124  >  443 [ACK] Seq=3146 Ack=77348 Win=514 Len=0"
"117","2.577283","192.168.0.183","172.64.155.249","TLSv1.2","211","Application Data"
"118","2.601745","172.64.155.249","192.168.0.183","TCP","60","443  >  51134 [ACK] Seq=836 Ack=362 Win=8 Len=0"
"119","2.623072","172.64.155.249","192.168.0.183","TLSv1.2","473","Application Data"
"120","2.623072","172.64.155.249","192.168.0.183","TLSv1.2","203","Application Data"
"121","2.623072","172.64.155.249","192.168.0.183","TLSv1.2","85","Application Data"
"122","2.623135","192.168.0.183","172.64.155.249","TCP","54","51134  >  443 [ACK] Seq=362 Ack=1435 Win=511 Len=0"
"123","2.761734","192.168.0.183","172.64.155.249","TLSv1.2","267","Application Data"
"124","2.808830","172.64.155.249","192.168.0.183","TLSv1.2","470","Application Data"
"125","2.848765","192.168.0.183","172.64.155.249","TCP","54","51124  >  443 [ACK] Seq=3359 Ack=77764 Win=512 Len=0"
"126","3.007985","192.168.0.183","172.64.155.249","TLSv1.2","512","Application Data"
"127","3.008065","192.168.0.183","172.64.155.249","TLSv1.2","627","Application Data"
"128","3.025985","172.64.155.249","192.168.0.183","TCP","60","443  >  51124 [ACK] Seq=77764 Ack=4390 Win=94 Len=0"
"129","3.046653","172.64.155.249","192.168.0.183","TLSv1.2","144","Application Data"
"130","3.046653","172.64.155.249","192.168.0.183","TLSv1.2","85","Application Data"
"131","3.046692","192.168.0.183","172.64.155.249","TCP","54","51124  >  443 [ACK] Seq=4390 Ack=77885 Win=511 Len=0"
"132","5.095641","192.168.0.183","172.64.155.249","TLSv1.2","142","Application Data"
"133","5.150519","172.64.155.249","192.168.0.183","TCP","60","443  >  51124 [ACK] Seq=77885 Ack=4478 Win=94 Len=0"
"134","5.179071","172.64.155.249","192.168.0.183","TLSv1.2","295","Application Data"
"135","5.179071","172.64.155.249","192.168.0.183","TLSv1.2","100","Application Data"
"136","5.179071","172.64.155.249","192.168.0.183","TLSv1.2","1291","Application Data"
"137","5.179071","172.64.155.249","192.168.0.183","TCP","1514","443  >  51124 [ACK] Seq=79409 Ack=4478 Win=94 Len=1460 [TCP segment of a reassembled PDU]"
"138","5.179154","192.168.0.183","172.64.155.249","TCP","54","51124  >  443 [ACK] Seq=4478 Ack=80869 Win=514 Len=0"
"139","5.184060","172.64.155.249","192.168.0.183","TCP","1514","443  >  51124 [ACK] Seq=80869 Ack=4478 Win=94 Len=1460 [TCP segment of a reassembled PDU]"
"140","5.184060","172.64.155.249","192.168.0.183","TCP","1514","443  >  51124 [ACK] Seq=82329 Ack=4478 Win=94 Len=1460 [TCP segment of a reassembled PDU]"
"141","5.184060","172.64.155.249","192.168.0.183","TLSv1.2","564","Application Data"
"142","5.184060","172.64.155.249","192.168.0.183","TCP","1514","443  >  51124 [ACK] Seq=84299 Ack=4478 Win=94 Len=1460 [TCP segment of a reassembled PDU]"
"143","5.184060","172.64.155.249","192.168.0.183","TCP","1514","443  >  51124 [ACK] Seq=85759 Ack=4478 Win=94 Len=1460 [TCP segment of a reassembled PDU]"
"144","5.184060","172.64.155.249","192.168.0.183","TLSv1.2","777","Application Data"
"145","5.184131","192.168.0.183","172.64.155.249","TCP","54","51124  >  443 [ACK] Seq=4478 Ack=87942 Win=514 Len=0"
"146","5.190175","172.64.155.249","192.168.0.183","TCP","1514","443  >  51124 [ACK] Seq=87942 Ack=4478 Win=94 Len=1460 [TCP segment of a reassembled PDU]"
"147","5.190175","172.64.155.249","192.168.0.183","TLSv1.2","1280","Application Data"
"148","5.190175","172.64.155.249","192.168.0.183","TLSv1.2","927","Application Data"
"149","5.190175","172.64.155.249","192.168.0.183","TCP","1514","443  >  51124 [ACK] Seq=91501 Ack=4478 Win=94 Len=1460 [TCP segment of a reassembled PDU]"
"150","5.190175","172.64.155.249","192.168.0.183","TCP","1514","443  >  51124 [ACK] Seq=92961 Ack=4478 Win=94 Len=1460 [TCP segment of a reassembled PDU]"
"151","5.190175","172.64.155.249","192.168.0.183","TLSv1.2","1063","Application Data"
"152","5.190329","192.168.0.183","172.64.155.249","TCP","54","51124  >  443 [ACK] Seq=4478 Ack=95430 Win=514 Len=0"
"153","5.192323","172.64.155.249","192.168.0.183","TCP","1514","443  >  51124 [ACK] Seq=95430 Ack=4478 Win=94 Len=1460 [TCP segment of a reassembled PDU]"
"154","5.192323","172.64.155.249","192.168.0.183","TCP","1514","443  >  51124 [ACK] Seq=96890 Ack=4478 Win=94 Len=1460 [TCP segment of a reassembled PDU]"
"155","5.192323","172.64.155.249","192.168.0.183","TCP","1514","443  >  51124 [ACK] Seq=98350 Ack=4478 Win=94 Len=1460 [TCP segment of a reassembled PDU]"
"156","5.192323","172.64.155.249","192.168.0.183","TLSv1.2","205","Application Data"
"157","5.192323","172.64.155.249","192.168.0.183","TLSv1.2","96","Application Data"
"158","5.192323","172.64.155.249","192.168.0.183","TLSv1.2","85","Application Data"
"159","5.192395","192.168.0.183","172.64.155.249","TCP","54","51124  >  443 [ACK] Seq=4478 Ack=100034 Win=514 Len=0"
"160","5.419338","192.168.0.183","172.64.155.249","TLSv1.2","191","Application Data"
"161","5.419650","192.168.0.183","172.64.155.249","TLSv1.2","320","Application Data"
"162","5.433597","172.64.155.249","192.168.0.183","TCP","60","443  >  51124 [ACK] Seq=100034 Ack=4881 Win=95 Len=0"
"163","5.456430","172.64.155.249","192.168.0.183","TLSv1.2","152","Application Data"
"164","5.472661","172.64.155.249","192.168.0.183","TLSv1.2","152","Application Data"
"165","5.472661","172.64.155.249","192.168.0.183","TLSv1.2","225","Application Data"
"166","5.472661","172.64.155.249","192.168.0.183","TLSv1.2","85","Application Data"
"167","5.472790","192.168.0.183","172.64.155.249","TCP","54","51124  >  443 [ACK] Seq=4881 Ack=100432 Win=512 Len=0"
"168","5.474851","192.168.0.183","172.64.155.249","TLSv1.2","89","Application Data"
"169","5.525108","172.64.155.249","192.168.0.183","TCP","60","443  >  51124 [ACK] Seq=100432 Ack=4916 Win=95 Len=0"
"170","5.569430","192.168.0.183","172.64.155.249","TLSv1.2","489","Application Data"
"171","5.569493","192.168.0.183","172.64.155.249","TLSv1.2","547","Application Data"
"172","5.590313","172.64.155.249","192.168.0.183","TCP","60","443  >  51124 [ACK] Seq=100432 Ack=5844 Win=96 Len=0"
"173","5.613966","172.64.155.249","192.168.0.183","TLSv1.2","297","Application Data"
"174","5.613966","172.64.155.249","192.168.0.183","TLSv1.2","85","Application Data"
"175","5.614006","192.168.0.183","172.64.155.249","TCP","54","51124  >  443 [ACK] Seq=5844 Ack=100706 Win=511 Len=0"
"176","7.206367","192.168.0.183","172.64.155.249","TLSv1.2","424","Application Data"
"177","7.206454","192.168.0.183","172.64.155.249","TLSv1.2","170","Application Data"
"178","7.217098","192.168.0.183","172.64.155.249","TLSv1.2","480","Application Data"
"179","7.219878","172.64.155.249","192.168.0.183","TCP","60","443  >  51124 [ACK] Seq=100706 Ack=6330 Win=96 Len=0"
"180","7.243537","192.168.0.183","172.64.155.249","TLSv1.2","209","Application Data"
"181","7.245796","172.64.155.249","192.168.0.183","TLSv1.2","277","Application Data"
"182","7.295188","192.168.0.183","172.64.155.249","TCP","54","51124  >  443 [ACK] Seq=6911 Ack=100929 Win=510 Len=0"
"183","7.299528","172.64.155.249","192.168.0.183","TCP","60","443  >  51124 [ACK] Seq=100929 Ack=6911 Win=97 Len=0"
"184","7.308225","172.64.155.249","192.168.0.183","TLSv1.2","146","Application Data"
"185","7.308225","172.64.155.249","192.168.0.183","TLSv1.2","100","Application Data"
"186","7.308225","172.64.155.249","192.168.0.183","TCP","1514","443  >  51124 [ACK] Seq=101067 Ack=6911 Win=97 Len=1460 [TCP segment of a reassembled PDU]"
"187","7.308225","172.64.155.249","192.168.0.183","TLSv1.2","672","Application Data"
"188","7.308225","172.64.155.249","192.168.0.183","TLSv1.2","95","Application Data"
"189","7.308225","172.64.155.249","192.168.0.183","TLSv1.2","85","Application Data"
"190","7.308275","192.168.0.183","172.64.155.249","TCP","54","51124  >  443 [ACK] Seq=6911 Ack=103217 Win=514 Len=0"
"191","7.390859","172.64.155.249","192.168.0.183","TLSv1.2","146","Application Data"
"192","7.390859","172.64.155.249","192.168.0.183","TLSv1.2","100","Application Data"
"193","7.390859","172.64.155.249","192.168.0.183","TLSv1.2","1320","Application Data"
"194","7.390915","192.168.0.183","172.64.155.249","TCP","54","51124  >  443 [ACK] Seq=6911 Ack=104621 Win=514 Len=0"
"195","7.391050","172.64.155.249","192.168.0.183","TCP","1514","443  >  51124 [ACK] Seq=104621 Ack=6911 Win=97 Len=1460 [TCP segment of a reassembled PDU]"
"196","7.391050","172.64.155.249","192.168.0.183","TCP","1514","443  >  51124 [ACK] Seq=106081 Ack=6911 Win=97 Len=1460 [TCP segment of a reassembled PDU]"
"197","7.391050","172.64.155.249","192.168.0.183","TCP","1514","443  >  51124 [ACK] Seq=107541 Ack=6911 Win=97 Len=1460 [TCP segment of a reassembled PDU]"
"198","7.391050","172.64.155.249","192.168.0.183","TLSv1.2","609","Application Data"
"199","7.391050","172.64.155.249","192.168.0.183","TCP","1514","443  >  51124 [ACK] Seq=109556 Ack=6911 Win=97 Len=1460 [TCP segment of a reassembled PDU]"
"200","7.391050","172.64.155.249","192.168.0.183","TLSv1.2","929","Application Data"
"201","7.391082","192.168.0.183","172.64.155.249","TCP","54","51124  >  443 [ACK] Seq=6911 Ack=111891 Win=514 Len=0"
"202","7.399912","172.64.155.249","192.168.0.183","TCP","1514","443  >  51124 [ACK] Seq=111891 Ack=6911 Win=97 Len=1460 [TCP segment of a reassembled PDU]"
"203","7.399912","172.64.155.249","192.168.0.183","TLSv1.2","1429","Application Data"
"204","7.399957","192.168.0.183","172.64.155.249","TCP","54","51124  >  443 [ACK] Seq=6911 Ack=114726 Win=514 Len=0"
"205","7.419311","172.64.155.249","192.168.0.183","TCP","1514","443  >  51124 [ACK] Seq=114726 Ack=6911 Win=97 Len=1460 [TCP segment of a reassembled PDU]"
"206","7.419311","172.64.155.249","192.168.0.183","TCP","1514","443  >  51124 [ACK] Seq=116186 Ack=6911 Win=97 Len=1460 [TCP segment of a reassembled PDU]"
"207","7.419311","172.64.155.249","192.168.0.183","TCP","1514","443  >  51124 [ACK] Seq=117646 Ack=6911 Win=97 Len=1460 [TCP segment of a reassembled PDU]"
"208","7.419311","172.64.155.249","192.168.0.183","TCP","1514","443  >  51124 [ACK] Seq=119106 Ack=6911 Win=97 Len=1460 [TCP segment of a reassembled PDU]"
"209","7.419311","172.64.155.249","192.168.0.183","TCP","1514","443  >  51124 [ACK] Seq=120566 Ack=6911 Win=97 Len=1460 [TCP segment of a reassembled PDU]"
"210","7.419311","172.64.155.249","192.168.0.183","TLSv1.2","666","Application Data"
"211","7.419311","172.64.155.249","192.168.0.183","TCP","1514","443  >  51124 [ACK] Seq=122638 Ack=6911 Win=97 Len=1460 [TCP segment of a reassembled PDU]"
"212","7.419311","172.64.155.249","192.168.0.183","TCP","1514","443  >  51124 [ACK] Seq=124098 Ack=6911 Win=97 Len=1460 [TCP segment of a reassembled PDU]"
"213","7.419311","172.64.155.249","192.168.0.183","TCP","1514","443  >  51124 [ACK] Seq=125558 Ack=6911 Win=97 Len=1460 [TCP segment of a reassembled PDU]"
"214","7.419311","172.64.155.249","192.168.0.183","TCP","1514","443  >  51124 [ACK] Seq=127018 Ack=6911 Win=97 Len=1460 [TCP segment of a reassembled PDU]"
"215","7.419311","172.64.155.249","192.168.0.183","TCP","1514","443  >  51124 [ACK] Seq=128478 Ack=6911 Win=97 Len=1460 [TCP segment of a reassembled PDU]"
"216","7.419311","172.64.155.249","192.168.0.183","TCP","1514","443  >  51124 [PSH, ACK] Seq=129938 Ack=6911 Win=97 Len=1460 [TCP segment of a reassembled PDU]"
"217","7.419311","172.64.155.249","192.168.0.183","TCP","1514","443  >  51124 [ACK] Seq=131398 Ack=6911 Win=97 Len=1460 [TCP segment of a reassembled PDU]"
"218","7.419311","172.64.155.249","192.168.0.183","TLSv1.2","862","Application Data"
"219","7.419311","172.64.155.249","192.168.0.183","TCP","1514","443  >  51124 [ACK] Seq=133666 Ack=6911 Win=97 Len=1460 [TCP segment of a reassembled PDU]"
"220","7.419311","172.64.155.249","192.168.0.183","TCP","1514","443  >  51124 [ACK] Seq=135126 Ack=6911 Win=97 Len=1460 [TCP segment of a reassembled PDU]"
"221","7.419311","172.64.155.249","192.168.0.183","TLSv1.2","1204","Application Data"
"222","7.419311","172.64.155.249","192.168.0.183","TLSv1.2","96","Application Data"
"223","7.419311","172.64.155.249","192.168.0.183","TLSv1.2","85","Application Data"
"224","7.419501","192.168.0.183","172.64.155.249","TCP","54","51124  >  443 [ACK] Seq=6911 Ack=137809 Win=514 Len=0"
"225","7.470877","192.168.0.183","172.64.155.249","TLSv1.2","184","Application Data"
"226","7.510716","172.64.155.249","192.168.0.183","TLSv1.2","471","Application Data"
"227","7.510716","172.64.155.249","192.168.0.183","TLSv1.2","203","Application Data"
"228","7.510716","172.64.155.249","192.168.0.183","TLSv1.2","85","Application Data"
"229","7.510764","192.168.0.183","172.64.155.249","TCP","54","51134  >  443 [ACK] Seq=492 Ack=2032 Win=509 Len=0"
"230","7.511688","192.168.0.183","172.64.155.249","TLSv1.2","89","Application Data"
"231","7.566038","172.64.155.249","192.168.0.183","TCP","60","443  >  51134 [ACK] Seq=2032 Ack=527 Win=8 Len=0"
"232","7.856281","192.168.0.183","172.64.155.249","TLSv1.2","589","Application Data"
"233","7.856419","192.168.0.183","172.64.155.249","TLSv1.2","553","Application Data"
"234","7.869939","172.64.155.249","192.168.0.183","TCP","60","443  >  51124 [ACK] Seq=137809 Ack=7945 Win=97 Len=0"
"235","7.893359","172.64.155.249","192.168.0.183","TLSv1.2","278","Application Data"
"236","7.893359","172.64.155.249","192.168.0.183","TLSv1.2","85","Application Data"
"237","7.893386","192.168.0.183","172.64.155.249","TCP","54","51124  >  443 [ACK] Seq=7945 Ack=138064 Win=513 Len=0"
"238","9.809048","192.168.0.183","172.64.155.249","TLSv1.2","252","Application Data"
"239","9.809173","192.168.0.183","172.64.155.249","TLSv1.2","593","Application Data"
"240","9.826905","192.168.0.183","172.64.155.249","TLSv1.2","215","Application Data"
"241","9.835579","172.64.155.249","192.168.0.183","TCP","60","443  >  51124 [ACK] Seq=138064 Ack=8682 Win=98 Len=0"
"242","9.848316","172.64.155.249","192.168.0.183","TLSv1.2","278","Application Data"
"243","9.848316","172.64.155.249","192.168.0.183","TLSv1.2","85","Application Data"
"244","9.848358","192.168.0.183","172.64.155.249","TCP","54","51124  >  443 [ACK] Seq=8843 Ack=138319 Win=512 Len=0"
"245","9.873341","172.64.155.249","192.168.0.183","TLSv1.2","165","Application Data"
"246","9.873341","172.64.155.249","192.168.0.183","TLSv1.2","100","Application Data"
"247","9.873384","192.168.0.183","172.64.155.249","TCP","54","51124  >  443 [ACK] Seq=8843 Ack=138476 Win=511 Len=0"
"248","9.876105","172.64.155.249","192.168.0.183","TCP","1514","443  >  51124 [ACK] Seq=138476 Ack=8843 Win=98 Len=1460 [TCP segment of a reassembled PDU]"
"249","9.876105","172.64.155.249","192.168.0.183","TCP","1514","443  >  51124 [ACK] Seq=139936 Ack=8843 Win=98 Len=1460 [TCP segment of a reassembled PDU]"
"250","9.876105","172.64.155.249","192.168.0.183","TCP","1514","443  >  51124 [ACK] Seq=141396 Ack=8843 Win=98 Len=1460 [TCP segment of a reassembled PDU]"
"251","9.876105","172.64.155.249","192.168.0.183","TCP","1514","443  >  51124 [ACK] Seq=142856 Ack=8843 Win=98 Len=1460 [TCP segment of a reassembled PDU]"
"252","9.876105","172.64.155.249","192.168.0.183","TCP","1514","443  >  51124 [ACK] Seq=144316 Ack=8843 Win=98 Len=1460 [TCP segment of a reassembled PDU]"
"253","9.876105","172.64.155.249","192.168.0.183","TCP","1514","443  >  51124 [PSH, ACK] Seq=145776 Ack=8843 Win=98 Len=1460 [TCP segment of a reassembled PDU]"
"254","9.876105","172.64.155.249","192.168.0.183","TLSv1.2","214","Application Data"
"255","9.876149","192.168.0.183","172.64.155.249","TCP","54","51124  >  443 [ACK] Seq=8843 Ack=141396 Win=514 Len=0"
"256","9.876222","192.168.0.183","172.64.155.249","TCP","54","51124  >  443 [ACK] Seq=8843 Ack=147396 Win=514 Len=0"
"257","9.883172","172.64.155.249","192.168.0.183","TCP","1514","443  >  51124 [ACK] Seq=147396 Ack=8843 Win=98 Len=1460 [TCP segment of a reassembled PDU]"
"258","9.883172","172.64.155.249","192.168.0.183","TLSv1.2","1005","Application Data"
"259","9.883233","192.168.0.183","172.64.155.249","TCP","54","51124  >  443 [ACK] Seq=8843 Ack=149807 Win=514 Len=0"
"260","9.886004","172.64.155.249","192.168.0.183","TCP","1514","443  >  51124 [ACK] Seq=149807 Ack=8843 Win=98 Len=1460 [TCP segment of a reassembled PDU]"
"261","9.886004","172.64.155.249","192.168.0.183","TCP","1514","443  >  51124 [ACK] Seq=151267 Ack=8843 Win=98 Len=1460 [TCP segment of a reassembled PDU]"
"262","9.886004","172.64.155.249","192.168.0.183","TLSv1.2","961","Application Data"
"263","9.886081","192.168.0.183","172.64.155.249","TCP","54","51124  >  443 [ACK] Seq=8843 Ack=153634 Win=514 Len=0"
"264","9.892988","172.64.155.249","192.168.0.183","TCP","1514","443  >  51124 [ACK] Seq=153634 Ack=8843 Win=98 Len=1460 [TCP segment of a reassembled PDU]"
"265","9.892988","172.64.155.249","192.168.0.183","TCP","1514","443  >  51124 [ACK] Seq=155094 Ack=8843 Win=98 Len=1460 [TCP segment of a reassembled PDU]"
"266","9.892988","172.64.155.249","192.168.0.183","TCP","1514","443  >  51124 [ACK] Seq=156554 Ack=8843 Win=98 Len=1460 [TCP segment of a reassembled PDU]"
"267","9.892988","172.64.155.249","192.168.0.183","TCP","1514","443  >  51124 [ACK] Seq=158014 Ack=8843 Win=98 Len=1460 [TCP segment of a reassembled PDU]"
"268","9.892988","172.64.155.249","192.168.0.183","TCP","1514","443  >  51124 [ACK] Seq=159474 Ack=8843 Win=98 Len=1460 [TCP segment of a reassembled PDU]"
"269","9.892988","172.64.155.249","192.168.0.183","TCP","1514","443  >  51124 [PSH, ACK] Seq=160934 Ack=8843 Win=98 Len=1460 [TCP segment of a reassembled PDU]"
"270","9.892988","172.64.155.249","192.168.0.183","TCP","1514","443  >  51124 [ACK] Seq=162394 Ack=8843 Win=98 Len=1460 [TCP segment of a reassembled PDU]"
"271","9.892988","172.64.155.249","192.168.0.183","TCP","1514","443  >  51124 [ACK] Seq=163854 Ack=8843 Win=98 Len=1460 [TCP segment of a reassembled PDU]"
"272","9.892988","172.64.155.249","192.168.0.183","TCP","1514","443  >  51124 [ACK] Seq=165314 Ack=8843 Win=98 Len=1460 [TCP segment of a reassembled PDU]"
"273","9.892988","172.64.155.249","192.168.0.183","TCP","1514","443  >  51124 [ACK] Seq=166774 Ack=8843 Win=98 Len=1460 [TCP segment of a reassembled PDU]"
"274","9.892988","172.64.155.249","192.168.0.183","TLSv1.2","1187","Application Data"
"275","9.893097","192.168.0.183","172.64.155.249","TCP","54","51124  >  443 [ACK] Seq=8843 Ack=169367 Win=514 Len=0"
"276","9.895676","172.64.155.249","192.168.0.183","TCP","1514","443  >  51124 [ACK] Seq=169367 Ack=8843 Win=98 Len=1460 [TCP segment of a reassembled PDU]"
"277","9.895676","172.64.155.249","192.168.0.183","TCP","1514","443  >  51124 [ACK] Seq=170827 Ack=8843 Win=98 Len=1460 [TCP segment of a reassembled PDU]"
"278","9.895676","172.64.155.249","192.168.0.183","TLSv1.2","481","Application Data"
"279","9.895676","172.64.155.249","192.168.0.183","TLSv1.2","1290","Application Data"
"280","9.895759","192.168.0.183","172.64.155.249","TCP","54","51124  >  443 [ACK] Seq=8843 Ack=173950 Win=514 Len=0"
"281","9.900655","172.64.155.249","192.168.0.183","TCP","1514","443  >  51124 [ACK] Seq=173950 Ack=8843 Win=98 Len=1460 [TCP segment of a reassembled PDU]"
"282","9.900655","172.64.155.249","192.168.0.183","TCP","1514","443  >  51124 [ACK] Seq=175410 Ack=8843 Win=98 Len=1460 [TCP segment of a reassembled PDU]"
"283","9.900655","172.64.155.249","192.168.0.183","TCP","1514","443  >  51124 [ACK] Seq=176870 Ack=8843 Win=98 Len=1460 [TCP segment of a reassembled PDU]"
"284","9.900655","172.64.155.249","192.168.0.183","TLSv1.2","280","Application Data"
"285","9.900655","172.64.155.249","192.168.0.183","TLSv1.2","96","Application Data"
"286","9.900655","172.64.155.249","192.168.0.183","TLSv1.2","85","Application Data"
"287","9.900719","192.168.0.183","172.64.155.249","TCP","54","51124  >  443 [ACK] Seq=8843 Ack=178629 Win=514 Len=0"
"288","9.991447","192.168.0.183","172.64.155.249","TLSv1.2","204","Application Data"
"289","10.009609","172.64.155.249","192.168.0.183","TCP","60","443  >  51134 [ACK] Seq=2032 Ack=677 Win=8 Len=0"
"290","10.033180","172.64.155.249","192.168.0.183","TLSv1.2","474","Application Data"
"291","10.033180","172.64.155.249","192.168.0.183","TLSv1.2","203","Application Data"
"292","10.033180","172.64.155.249","192.168.0.183","TLSv1.2","85","Application Data"
"293","10.033217","192.168.0.183","172.64.155.249","TCP","54","51134  >  443 [ACK] Seq=677 Ack=2632 Win=514 Len=0"
"294","10.182364","192.168.0.183","172.64.155.249","TLSv1.2","382","Application Data"
"295","10.182470","192.168.0.183","172.64.155.249","TLSv1.2","178","Application Data"
"296","10.195970","172.64.155.249","192.168.0.183","TCP","60","443  >  51124 [ACK] Seq=178629 Ack=9295 Win=99 Len=0"
"297","10.228608","172.64.155.249","192.168.0.183","TLSv1.2","144","Application Data"
"298","10.228608","172.64.155.249","192.168.0.183","TLSv1.2","193","Application Data"
"299","10.228608","172.64.155.249","192.168.0.183","TLSv1.2","539","Application Data"
"300","10.228608","172.64.155.249","192.168.0.183","TLSv1.2","85","Application Data"
"301","10.228683","192.168.0.183","172.64.155.249","TCP","54","51124  >  443 [ACK] Seq=9295 Ack=179374 Win=511 Len=0"
"302","10.478502","192.168.0.183","172.64.155.249","TLSv1.2","489","Application Data"
"303","10.478564","192.168.0.183","172.64.155.249","TLSv1.2","612","Application Data"
"304","10.491592","172.64.155.249","192.168.0.183","TCP","60","443  >  51124 [ACK] Seq=179374 Ack=10288 Win=99 Len=0"
"305","10.515024","172.64.155.249","192.168.0.183","TLSv1.2","301","Application Data"
"306","10.515024","172.64.155.249","192.168.0.183","TLSv1.2","85","Application Data"
"307","10.515055","192.168.0.183","172.64.155.249","TCP","54","51124  >  443 [ACK] Seq=10288 Ack=179652 Win=510 Len=0"
"308","12.654363","192.168.0.183","172.64.155.249","TLSv1.2","394","Application Data"
"309","12.710843","172.64.155.249","192.168.0.183","TCP","60","443  >  51124 [ACK] Seq=179652 Ack=10628 Win=100 Len=0"
"310","12.748082","172.64.155.249","192.168.0.183","TLSv1.2","280","Application Data"
"311","12.748082","172.64.155.249","192.168.0.183","TLSv1.2","100","Application Data"
"312","12.748082","172.64.155.249","192.168.0.183","TLSv1.2","1285","Application Data"
"313","12.748082","172.64.155.249","192.168.0.183","TCP","1514","443  >  51124 [ACK] Seq=181155 Ack=10628 Win=100 Len=1460 [TCP segment of a reassembled PDU]"
"314","12.748082","172.64.155.249","192.168.0.183","TCP","1514","443  >  51124 [ACK] Seq=182615 Ack=10628 Win=100 Len=1460 [TCP segment of a reassembled PDU]"
"315","12.748082","172.64.155.249","192.168.0.183","TCP","1514","443  >  51124 [ACK] Seq=184075 Ack=10628 Win=100 Len=1460 [TCP segment of a reassembled PDU]"
"316","12.748082","172.64.155.249","192.168.0.183","TLSv1.2","558","Application Data"
"317","12.748128","192.168.0.183","172.64.155.249","TCP","54","51124  >  443 [ACK] Seq=10628 Ack=186039 Win=514 Len=0"
"318","12.750150","172.64.155.249","192.168.0.183","TCP","1514","443  >  51124 [ACK] Seq=186039 Ack=10628 Win=100 Len=1460 [TCP segment of a reassembled PDU]"
"319","12.750150","172.64.155.249","192.168.0.183","TCP","1514","443  >  51124 [ACK] Seq=187499 Ack=10628 Win=100 Len=1460 [TCP segment of a reassembled PDU]"
"320","12.750150","172.64.155.249","192.168.0.183","TLSv1.2","755","Application Data"
"321","12.750201","192.168.0.183","172.64.155.249","TCP","54","51124  >  443 [ACK] Seq=10628 Ack=189660 Win=514 Len=0"
"322","12.750439","192.168.0.183","172.64.155.249","TLSv1.2","89","Application Data"
"323","12.759872","172.64.155.249","192.168.0.183","TCP","1514","443  >  51124 [ACK] Seq=189660 Ack=10628 Win=100 Len=1460 [TCP segment of a reassembled PDU]"
"324","12.759872","172.64.155.249","192.168.0.183","TLSv1.2","1061","Application Data"
"325","12.759872","172.64.155.249","192.168.0.183","TCP","1514","443  >  51124 [ACK] Seq=192127 Ack=10628 Win=100 Len=1460 [TCP segment of a reassembled PDU]"
"326","12.759941","192.168.0.183","172.64.155.249","TCP","54","51124  >  443 [ACK] Seq=10663 Ack=193587 Win=514 Len=0"
"327","12.762927","172.64.155.249","192.168.0.183","TCP","1514","443  >  51124 [ACK] Seq=193587 Ack=10628 Win=100 Len=1460 [TCP segment of a reassembled PDU]"
"328","12.762927","172.64.155.249","192.168.0.183","TLSv1.2","1248","Application Data"
"329","12.763011","192.168.0.183","172.64.155.249","TCP","54","51124  >  443 [ACK] Seq=10663 Ack=196241 Win=514 Len=0"
"330","12.763789","172.64.155.249","192.168.0.183","TCP","60","443  >  51124 [ACK] Seq=196241 Ack=10663 Win=100 Len=0"
"331","12.763789","172.64.155.249","192.168.0.183","TCP","1514","443  >  51124 [ACK] Seq=196241 Ack=10663 Win=100 Len=1460 [TCP segment of a reassembled PDU]"
"332","12.763789","172.64.155.249","192.168.0.183","TCP","1514","443  >  51124 [ACK] Seq=197701 Ack=10663 Win=100 Len=1460 [TCP segment of a reassembled PDU]"
"333","12.763789","172.64.155.249","192.168.0.183","TCP","1514","443  >  51124 [ACK] Seq=199161 Ack=10663 Win=100 Len=1460 [TCP segment of a reassembled PDU]"
"334","12.763789","172.64.155.249","192.168.0.183","TCP","1514","443  >  51124 [ACK] Seq=200621 Ack=10663 Win=100 Len=1460 [TCP segment of a reassembled PDU]"
"335","12.763789","172.64.155.249","192.168.0.183","TLSv1.2","1205","Application Data"
"336","12.763789","172.64.155.249","192.168.0.183","TLSv1.2","96","Application Data"
"337","12.763789","172.64.155.249","192.168.0.183","TLSv1.2","85","Application Data"
"338","12.763844","192.168.0.183","172.64.155.249","TCP","54","51124  >  443 [ACK] Seq=10663 Ack=203305 Win=514 Len=0"
"339","12.988618","192.168.0.183","172.64.155.249","TLSv1.2","185","Application Data"
"340","12.988938","192.168.0.183","172.64.155.249","TLSv1.2","257","Application Data"
"341","13.001683","172.64.155.249","192.168.0.183","TCP","60","443  >  51124 [ACK] Seq=203305 Ack=10997 Win=101 Len=0"
"342","13.029141","172.64.155.249","192.168.0.183","TLSv1.2","162","Application Data"
"343","13.029141","172.64.155.249","192.168.0.183","TLSv1.2","225","Application Data"
"344","13.029141","172.64.155.249","192.168.0.183","TLSv1.2","85","Application Data"
"345","13.029184","192.168.0.183","172.64.155.249","TCP","54","51124  >  443 [ACK] Seq=10997 Ack=203615 Win=512 Len=0"
"346","13.031656","172.64.155.249","192.168.0.183","TLSv1.2","152","Application Data"
"347","13.031734","192.168.0.183","172.64.155.249","TCP","54","51124  >  443 [ACK] Seq=10997 Ack=203713 Win=512 Len=0"
"348","13.157041","192.168.0.183","172.64.155.249","TLSv1.2","588","Application Data"
"349","13.157112","192.168.0.183","172.64.155.249","TLSv1.2","539","Application Data"
"350","13.170293","172.64.155.249","192.168.0.183","TCP","60","443  >  51124 [ACK] Seq=203713 Ack=12016 Win=101 Len=0"
"351","13.194915","172.64.155.249","192.168.0.183","TLSv1.2","144","Application Data"
"352","13.194915","172.64.155.249","192.168.0.183","TLSv1.2","85","Application Data"
"353","13.194989","192.168.0.183","172.64.155.249","TCP","54","51124  >  443 [ACK] Seq=12016 Ack=203834 Win=511 Len=0"
"354","16.455950","192.168.0.183","172.64.155.249","TLSv1.2","240","Application Data"
"355","16.456146","192.168.0.183","172.64.155.249","TLSv1.2","170","Application Data"
"356","16.469174","192.168.0.183","172.64.155.249","TLSv1.2","299","Application Data"
"357","16.470030","172.64.155.249","192.168.0.183","TCP","60","443  >  51124 [ACK] Seq=203834 Ack=12318 Win=102 Len=0"
"358","16.501297","172.64.155.249","192.168.0.183","TLSv1.2","298","Application Data"
"359","16.546038","192.168.0.183","172.64.155.249","TCP","54","51124  >  443 [ACK] Seq=12563 Ack=204078 Win=511 Len=0"
"360","16.659342","172.64.155.249","192.168.0.183","TLSv1.2","175","Application Data"
"361","16.659342","172.64.155.249","192.168.0.183","TLSv1.2","100","Application Data"
"362","16.659342","172.64.155.249","192.168.0.183","TCP","1514","443  >  51124 [ACK] Seq=204245 Ack=12563 Win=102 Len=1460 [TCP segment of a reassembled PDU]"
"363","16.659342","172.64.155.249","192.168.0.183","TLSv1.2","1157","Application Data"
"364","16.659387","192.168.0.183","172.64.155.249","TCP","54","51124  >  443 [ACK] Seq=12563 Ack=206808 Win=514 Len=0"
"365","16.661993","172.64.155.249","192.168.0.183","TCP","1514","443  >  51124 [ACK] Seq=206808 Ack=12563 Win=102 Len=1460 [TCP segment of a reassembled PDU]"
"366","16.661993","172.64.155.249","192.168.0.183","TCP","1514","443  >  51124 [ACK] Seq=208268 Ack=12563 Win=102 Len=1460 [TCP segment of a reassembled PDU]"
"367","16.661993","172.64.155.249","192.168.0.183","TLSv1.2","734","Application Data"
"368","16.661993","172.64.155.249","192.168.0.183","TCP","1514","443  >  51124 [ACK] Seq=210408 Ack=12563 Win=102 Len=1460 [TCP segment of a reassembled PDU]"
"369","16.661993","172.64.155.249","192.168.0.183","TLSv1.2","928","Application Data"
"370","16.661993","172.64.155.249","192.168.0.183","TCP","1514","443  >  51124 [ACK] Seq=212742 Ack=12563 Win=102 Len=1460 [TCP segment of a reassembled PDU]"
"371","16.661993","172.64.155.249","192.168.0.183","TLSv1.2","1083","Application Data"
"372","16.662075","192.168.0.183","172.64.155.249","TCP","54","51124  >  443 [ACK] Seq=12563 Ack=215231 Win=514 Len=0"
"373","16.672481","172.64.155.249","192.168.0.183","TCP","1514","443  >  51124 [ACK] Seq=215231 Ack=12563 Win=102 Len=1460 [TCP segment of a reassembled PDU]"
"374","16.672481","172.64.155.249","192.168.0.183","TLSv1.2","261","Application Data"
"375","16.672481","172.64.155.249","192.168.0.183","TCP","1514","443  >  51124 [ACK] Seq=216898 Ack=12563 Win=102 Len=1460 [TCP segment of a reassembled PDU]"
"376","16.672481","172.64.155.249","192.168.0.183","TLSv1.2","1050","Application Data"
"377","16.672481","172.64.155.249","192.168.0.183","TCP","1514","443  >  51124 [ACK] Seq=219354 Ack=12563 Win=102 Len=1460 [TCP segment of a reassembled PDU]"
"378","16.672580","192.168.0.183","172.64.155.249","TCP","54","51124  >  443 [ACK] Seq=12563 Ack=220814 Win=514 Len=0"
"379","16.674225","172.64.155.249","192.168.0.183","TLSv1.2","861","Application Data"
"380","16.674225","172.64.155.249","192.168.0.183","TCP","1514","443  >  51124 [ACK] Seq=221621 Ack=12563 Win=102 Len=1460 [TCP segment of a reassembled PDU]"
"381","16.674225","172.64.155.249","192.168.0.183","TCP","1514","443  >  51124 [ACK] Seq=223081 Ack=12563 Win=102 Len=1460 [TCP segment of a reassembled PDU]"
"382","16.674225","172.64.155.249","192.168.0.183","TCP","1514","443  >  51124 [ACK] Seq=224541 Ack=12563 Win=102 Len=1460 [TCP segment of a reassembled PDU]"
"383","16.674225","172.64.155.249","192.168.0.183","TLSv1.2","652","Application Data"
"384","16.674285","192.168.0.183","172.64.155.249","TCP","54","51124  >  443 [ACK] Seq=12563 Ack=226599 Win=514 Len=0"
"385","16.677310","172.64.155.249","192.168.0.183","TCP","1514","443  >  51124 [ACK] Seq=226599 Ack=12563 Win=102 Len=1460 [TCP segment of a reassembled PDU]"
"386","16.677310","172.64.155.249","192.168.0.183","TCP","1514","443  >  51124 [ACK] Seq=228059 Ack=12563 Win=102 Len=1460 [TCP segment of a reassembled PDU]"
"387","16.677310","172.64.155.249","192.168.0.183","TCP","1514","443  >  51124 [ACK] Seq=229519 Ack=12563 Win=102 Len=1460 [TCP segment of a reassembled PDU]"
"388","16.677310","172.64.155.249","192.168.0.183","TCP","1514","443  >  51124 [ACK] Seq=230979 Ack=12563 Win=102 Len=1460 [TCP segment of a reassembled PDU]"
"389","16.677310","172.64.155.249","192.168.0.183","TCP","1514","443  >  51124 [ACK] Seq=232439 Ack=12563 Win=102 Len=1460 [TCP segment of a reassembled PDU]"
"390","16.677310","172.64.155.249","192.168.0.183","TCP","1514","443  >  51124 [PSH, ACK] Seq=233899 Ack=12563 Win=102 Len=1460 [TCP segment of a reassembled PDU]"
"391","16.677310","172.64.155.249","192.168.0.183","TCP","1514","443  >  51124 [ACK] Seq=235359 Ack=12563 Win=102 Len=1460 [TCP segment of a reassembled PDU]"
"392","16.677310","172.64.155.249","192.168.0.183","TLSv1.2","690","Application Data"
"393","16.677370","192.168.0.183","172.64.155.249","TCP","54","51124  >  443 [ACK] Seq=12563 Ack=237455 Win=514 Len=0"
"394","16.680578","172.64.155.249","192.168.0.183","TCP","1514","443  >  51124 [ACK] Seq=237455 Ack=12563 Win=102 Len=1460 [TCP segment of a reassembled PDU]"
"395","16.680578","172.64.155.249","192.168.0.183","TLSv1.2","199","Application Data"
"396","16.680578","172.64.155.249","192.168.0.183","TLSv1.2","96","Application Data"
"397","16.680578","172.64.155.249","192.168.0.183","TLSv1.2","85","Application Data"
"398","16.680658","192.168.0.183","172.64.155.249","TCP","54","51124  >  443 [ACK] Seq=12563 Ack=239133 Win=514 Len=0"
"399","16.740757","192.168.0.183","172.64.155.249","TLSv1.2","184","Application Data"
"400","16.784148","172.64.155.249","192.168.0.183","TLSv1.2","473","Application Data"
"401","16.784148","172.64.155.249","192.168.0.183","TLSv1.2","203","Application Data"
"402","16.784148","172.64.155.249","192.168.0.183","TLSv1.2","85","Application Data"
"403","16.784199","192.168.0.183","172.64.155.249","TCP","54","51134  >  443 [ACK] Seq=807 Ack=3231 Win=511 Len=0"
"404","16.785394","192.168.0.183","172.64.155.249","TLSv1.2","89","Application Data"
"405","16.839907","172.64.155.249","192.168.0.183","TCP","60","443  >  51134 [ACK] Seq=3231 Ack=842 Win=8 Len=0"
"406","17.115527","192.168.0.183","172.64.155.249","TLSv1.2","539","Application Data"
"407","17.115590","192.168.0.183","172.64.155.249","TLSv1.2","549","Application Data"
"408","17.177164","172.64.155.249","192.168.0.183","TCP","60","443  >  51124 [ACK] Seq=239133 Ack=13543 Win=103 Len=0"
"409","17.199893","172.64.155.249","192.168.0.183","TLSv1.2","254","Application Data"
"410","17.199893","172.64.155.249","192.168.0.183","TLSv1.2","85","Application Data"
"411","17.199980","192.168.0.183","172.64.155.249","TCP","54","51124  >  443 [ACK] Seq=13543 Ack=239364 Win=513 Len=0"
"412","18.668770","192.168.0.183","172.64.155.249","TLSv1.2","395","Application Data"
"413","18.669000","192.168.0.183","172.64.155.249","TLSv1.2","589","Application Data"
"414","18.681710","172.64.155.249","192.168.0.183","TCP","60","443  >  51124 [ACK] Seq=239364 Ack=14419 Win=103 Len=0"
"415","18.687671","192.168.0.183","172.64.155.249","TLSv1.2","197","Application Data"
"416","18.706145","172.64.155.249","192.168.0.183","TLSv1.2","277","Application Data"
"417","18.706145","172.64.155.249","192.168.0.183","TLSv1.2","85","Application Data"
"418","18.706186","192.168.0.183","172.64.155.249","TCP","54","51124  >  443 [ACK] Seq=14562 Ack=239618 Win=512 Len=0"
"419","18.740397","172.64.155.249","192.168.0.183","TLSv1.2","146","Application Data"
"420","18.740397","172.64.155.249","192.168.0.183","TLSv1.2","100","Application Data"
"421","18.740397","172.64.155.249","192.168.0.183","TLSv1.2","1305","Application Data"
"422","18.740397","172.64.155.249","192.168.0.183","TCP","1514","443  >  51124 [ACK] Seq=241007 Ack=14562 Win=104 Len=1460 [TCP segment of a reassembled PDU]"
"423","18.740397","172.64.155.249","192.168.0.183","TCP","1514","443  >  51124 [ACK] Seq=242467 Ack=14562 Win=104 Len=1460 [TCP segment of a reassembled PDU]"
"424","18.740397","172.64.155.249","192.168.0.183","TCP","1514","443  >  51124 [ACK] Seq=243927 Ack=14562 Win=104 Len=1460 [TCP segment of a reassembled PDU]"
"425","18.740397","172.64.155.249","192.168.0.183","TLSv1.2","617","Application Data"
"426","18.740448","192.168.0.183","172.64.155.249","TCP","54","51124  >  443 [ACK] Seq=14562 Ack=245950 Win=514 Len=0"
"427","18.741313","192.168.0.183","172.64.155.249","TLSv1.2","89","Application Data"
"428","18.753053","172.64.155.249","192.168.0.183","TCP","1514","443  >  51124 [ACK] Seq=245950 Ack=14562 Win=104 Len=1460 [TCP segment of a reassembled PDU]"
"429","18.753053","172.64.155.249","192.168.0.183","TCP","1514","443  >  51124 [ACK] Seq=247410 Ack=14562 Win=104 Len=1460 [TCP segment of a reassembled PDU]"
"430","18.753053","172.64.155.249","192.168.0.183","TLSv1.2","967","Application Data"
"431","18.753137","192.168.0.183","172.64.155.249","TCP","54","51124  >  443 [ACK] Seq=14597 Ack=249783 Win=514 Len=0"
"432","18.759326","172.64.155.249","192.168.0.183","TCP","1514","443  >  51124 [ACK] Seq=249783 Ack=14562 Win=104 Len=1460 [TCP segment of a reassembled PDU]"
"433","18.759326","172.64.155.249","192.168.0.183","TLSv1.2","1192","Application Data"
"434","18.759326","172.64.155.249","192.168.0.183","TCP","1514","443  >  51124 [ACK] Seq=252381 Ack=14562 Win=104 Len=1460 [TCP segment of a reassembled PDU]"
"435","18.759326","172.64.155.249","192.168.0.183","TCP","1514","443  >  51124 [ACK] Seq=253841 Ack=14562 Win=104 Len=1460 [TCP segment of a reassembled PDU]"
"436","18.759326","172.64.155.249","192.168.0.183","TCP","1514","443  >  51124 [ACK] Seq=255301 Ack=14562 Win=104 Len=1460 [TCP segment of a reassembled PDU]"
"437","18.759326","172.64.155.249","192.168.0.183","TLSv1.2","424","Application Data"
"438","18.759326","172.64.155.249","192.168.0.183","TCP","1514","443  >  51124 [ACK] Seq=257131 Ack=14562 Win=104 Len=1460 [TCP segment of a reassembled PDU]"
"439","18.759326","172.64.155.249","192.168.0.183","TCP","1514","443  >  51124 [ACK] Seq=258591 Ack=14562 Win=104 Len=1460 [TCP segment of a reassembled PDU]"
"440","18.759326","172.64.155.249","192.168.0.183","TCP","1514","443  >  51124 [ACK] Seq=260051 Ack=14562 Win=104 Len=1460 [TCP segment of a reassembled PDU]"
"441","18.759326","172.64.155.249","192.168.0.183","TCP","1514","443  >  51124 [ACK] Seq=261511 Ack=14562 Win=104 Len=1460 [TCP segment of a reassembled PDU]"
"442","18.759326","172.64.155.249","192.168.0.183","TLSv1.2","170","Application Data"
"443","18.759326","172.64.155.249","192.168.0.183","TCP","1514","443  >  51124 [ACK] Seq=263087 Ack=14562 Win=104 Len=1460 [TCP segment of a reassembled PDU]"
"444","18.759326","172.64.155.249","192.168.0.183","TCP","1514","443  >  51124 [ACK] Seq=264547 Ack=14562 Win=104 Len=1460 [TCP segment of a reassembled PDU]"
"445","18.759326","172.64.155.249","192.168.0.183","TCP","1514","443  >  51124 [ACK] Seq=266007 Ack=14562 Win=104 Len=1460 [TCP segment of a reassembled PDU]"
"446","18.759326","172.64.155.249","192.168.0.183","TCP","1514","443  >  51124 [ACK] Seq=267467 Ack=14562 Win=104 Len=1460 [TCP segment of a reassembled PDU]"
"447","18.759326","172.64.155.249","192.168.0.183","TCP","1514","443  >  51124 [ACK] Seq=268927 Ack=14562 Win=104 Len=1460 [TCP segment of a reassembled PDU]"
"448","18.759326","172.64.155.249","192.168.0.183","TLSv1.2","260","Application Data"
"449","18.759326","172.64.155.249","192.168.0.183","TCP","1514","443  >  51124 [ACK] Seq=270593 Ack=14562 Win=104 Len=1460 [TCP segment of a reassembled PDU]"
"450","18.759326","172.64.155.249","192.168.0.183","TLSv1.2","1147","Application Data"
"451","18.759326","172.64.155.249","192.168.0.183","TCP","1514","443  >  51124 [ACK] Seq=273146 Ack=14562 Win=104 Len=1460 [TCP segment of a reassembled PDU]"
"452","18.759326","172.64.155.249","192.168.0.183","TCP","1514","443  >  51124 [ACK] Seq=274606 Ack=14562 Win=104 Len=1460 [TCP segment of a reassembled PDU]"
"453","18.759326","172.64.155.249","192.168.0.183","TCP","1514","443  >  51124 [ACK] Seq=276066 Ack=14562 Win=104 Len=1460 [TCP segment of a reassembled PDU]"
"454","18.759326","172.64.155.249","192.168.0.183","TLSv1.2","814","Application Data"
"455","18.759466","192.168.0.183","172.64.155.249","TCP","54","51124  >  443 [ACK] Seq=14597 Ack=278286 Win=514 Len=0"
"456","18.763208","172.64.155.249","192.168.0.183","TCP","1514","443  >  51124 [ACK] Seq=278286 Ack=14562 Win=104 Len=1460 [TCP segment of a reassembled PDU]"
"457","18.763208","172.64.155.249","192.168.0.183","TLSv1.2","1092","Application Data"
"458","18.763208","172.64.155.249","192.168.0.183","TLSv1.2","1328","Application Data"
"459","18.763208","172.64.155.249","192.168.0.183","TLSv1.2","96","Application Data"
"460","18.763208","172.64.155.249","192.168.0.183","TLSv1.2","85","Application Data"
"461","18.763286","192.168.0.183","172.64.155.249","TCP","54","51124  >  443 [ACK] Seq=14597 Ack=282131 Win=514 Len=0"
"462","18.828841","172.64.155.249","192.168.0.183","TCP","60","443  >  51124 [ACK] Seq=282131 Ack=14597 Win=104 Len=0"
"463","18.864464","192.168.0.183","172.64.155.249","TLSv1.2","203","Application Data"
"464","18.878005","172.64.155.249","192.168.0.183","TCP","60","443  >  51134 [ACK] Seq=3231 Ack=991 Win=8 Len=0"
"465","18.912810","172.64.155.249","192.168.0.183","TLSv1.2","671","Application Data"
"466","18.912810","172.64.155.249","192.168.0.183","TLSv1.2","203","Application Data"
"467","18.912810","172.64.155.249","192.168.0.183","TLSv1.2","85","Application Data"
"468","18.912858","192.168.0.183","172.64.155.249","TCP","54","51134  >  443 [ACK] Seq=991 Ack=4028 Win=508 Len=0"
"469","19.041449","192.168.0.183","172.64.155.249","TLSv1.2","528","Application Data"
"470","19.056916","172.64.155.249","192.168.0.183","TCP","60","443  >  51124 [ACK] Seq=282131 Ack=15071 Win=104 Len=0"
"471","19.080338","172.64.155.249","192.168.0.183","TLSv1.2","144","Application Data"
"472","19.124785","192.168.0.183","172.64.155.249","TCP","54","51124  >  443 [ACK] Seq=15071 Ack=282221 Win=513 Len=0"
"473","19.329406","192.168.0.183","172.64.155.249","TLSv1.2","668","Application Data"
"474","19.329470","192.168.0.183","172.64.155.249","TLSv1.2","592","Application Data"
"475","19.343877","172.64.155.249","192.168.0.183","TCP","60","443  >  51124 [ACK] Seq=282221 Ack=16223 Win=105 Len=0"
"476","19.373328","172.64.155.249","192.168.0.183","TLSv1.2","144","Application Data"
"477","19.373328","172.64.155.249","192.168.0.183","TLSv1.2","85","Application Data"
"478","19.373369","192.168.0.183","172.64.155.249","TCP","54","51124  >  443 [ACK] Seq=16223 Ack=282342 Win=513 Len=0"
"479","22.644051","192.168.0.183","172.64.155.249","TLSv1.2","154","Application Data"
"480","22.699631","172.64.155.249","192.168.0.183","TCP","60","443  >  51124 [ACK] Seq=282342 Ack=16323 Win=105 Len=0"
"481","22.716359","172.64.155.249","192.168.0.183","TLSv1.2","298","Application Data"
"482","22.716359","172.64.155.249","192.168.0.183","TLSv1.2","100","Application Data"
"483","22.716359","172.64.155.249","192.168.0.183","TCP","1514","443  >  51124 [ACK] Seq=282632 Ack=16323 Win=105 Len=1460 [TCP segment of a reassembled PDU]"
"484","22.716359","172.64.155.249","192.168.0.183","TCP","1514","443  >  51124 [ACK] Seq=284092 Ack=16323 Win=105 Len=1460 [TCP segment of a reassembled PDU]"
"485","22.716359","172.64.155.249","192.168.0.183","TLSv1.2","881","Application Data"
"486","22.716469","192.168.0.183","172.64.155.249","TCP","54","51124  >  443 [ACK] Seq=16323 Ack=286379 Win=514 Len=0"
"487","22.719160","172.64.155.249","192.168.0.183","TCP","1514","443  >  51124 [ACK] Seq=286379 Ack=16323 Win=105 Len=1460 [TCP segment of a reassembled PDU]"
"488","22.719160","172.64.155.249","192.168.0.183","TCP","1514","443  >  51124 [ACK] Seq=287839 Ack=16323 Win=105 Len=1460 [TCP segment of a reassembled PDU]"
"489","22.719160","172.64.155.249","192.168.0.183","TLSv1.2","1025","Application Data"
"490","22.719160","172.64.155.249","192.168.0.183","TLSv1.2","867","Application Data"
"491","22.719281","192.168.0.183","172.64.155.249","TCP","54","51124  >  443 [ACK] Seq=16323 Ack=291083 Win=514 Len=0"
"492","22.726350","172.64.155.249","192.168.0.183","TCP","1514","443  >  51124 [ACK] Seq=291083 Ack=16323 Win=105 Len=1460 [TCP segment of a reassembled PDU]"
"493","22.726350","172.64.155.249","192.168.0.183","TLSv1.2","1335","Application Data"
"494","22.726484","192.168.0.183","172.64.155.249","TCP","54","51124  >  443 [ACK] Seq=16323 Ack=293824 Win=514 Len=0"
"495","22.728503","172.64.155.249","192.168.0.183","TCP","1514","443  >  51124 [ACK] Seq=293824 Ack=16323 Win=105 Len=1460 [TCP segment of a reassembled PDU]"
"496","22.728503","172.64.155.249","192.168.0.183","TLSv1.2","1021","Application Data"
"497","22.728503","172.64.155.249","192.168.0.183","TCP","1514","443  >  51124 [ACK] Seq=296251 Ack=16323 Win=105 Len=1460 [TCP segment of a reassembled PDU]"
"498","22.728503","172.64.155.249","192.168.0.183","TCP","1514","443  >  51124 [ACK] Seq=297711 Ack=16323 Win=105 Len=1460 [TCP segment of a reassembled PDU]"
"499","22.728503","172.64.155.249","192.168.0.183","TCP","1514","443  >  51124 [ACK] Seq=299171 Ack=16323 Win=105 Len=1460 [TCP segment of a reassembled PDU]"
"500","22.728503","172.64.155.249","192.168.0.183","TLSv1.2","307","Application Data"
"501","22.728571","192.168.0.183","172.64.155.249","TCP","54","51124  >  443 [ACK] Seq=16323 Ack=300884 Win=514 Len=0"
"502","22.730489","172.64.155.249","192.168.0.183","TCP","1514","443  >  51124 [ACK] Seq=300884 Ack=16323 Win=105 Len=1460 [TCP segment of a reassembled PDU]"
"503","22.730489","172.64.155.249","192.168.0.183","TCP","1514","443  >  51124 [ACK] Seq=302344 Ack=16323 Win=105 Len=1460 [TCP segment of a reassembled PDU]"
"504","22.730489","172.64.155.249","192.168.0.183","TLSv1.2","1022","Application Data"
"505","22.730489","172.64.155.249","192.168.0.183","TLSv1.2","127","Application Data, Application Data"
"506","22.730572","192.168.0.183","172.64.155.249","TCP","54","51124  >  443 [ACK] Seq=16323 Ack=304845 Win=514 Len=0"
"507","22.933764","192.168.0.183","172.64.155.249","TLSv1.2","190","Application Data"
"508","22.934031","192.168.0.183","172.64.155.249","TLSv1.2","182","Application Data"
"509","22.947246","172.64.155.249","192.168.0.183","TCP","60","443  >  51124 [ACK] Seq=304845 Ack=16587 Win=105 Len=0"
"510","22.973107","172.64.155.249","192.168.0.183","TLSv1.2","179","Application Data"
"511","22.976836","172.64.155.249","192.168.0.183","TLSv1.2","303","Application Data"
"512","22.976836","172.64.155.249","192.168.0.183","TLSv1.2","224","Application Data"
"513","22.976836","172.64.155.249","192.168.0.183","TLSv1.2","85","Application Data"
"514","22.976912","192.168.0.183","172.64.155.249","TCP","54","51124  >  443 [ACK] Seq=16587 Ack=305420 Win=511 Len=0"
"515","23.308267","192.168.0.183","172.64.155.249","TLSv1.2","526","Application Data"
"516","23.308332","192.168.0.183","172.64.155.249","TLSv1.2","546","Application Data"
"517","23.321111","172.64.155.249","192.168.0.183","TCP","60","443  >  51124 [ACK] Seq=305420 Ack=17551 Win=106 Len=0"
"518","23.344521","172.64.155.249","192.168.0.183","TLSv1.2","144","Application Data"
"519","23.344521","172.64.155.249","192.168.0.183","TLSv1.2","85","Application Data"
"520","23.344549","192.168.0.183","172.64.155.249","TCP","54","51124  >  443 [ACK] Seq=17551 Ack=305541 Win=511 Len=0"
"521","25.244319","192.168.0.183","172.64.155.249","TLSv1.2","176","Application Data"
"522","25.244430","192.168.0.183","172.64.155.249","TLSv1.2","170","Application Data"
"523","25.258828","192.168.0.183","172.64.155.249","TLSv1.2","315","Application Data"
"524","25.259025","172.64.155.249","192.168.0.183","TCP","60","443  >  51124 [ACK] Seq=305541 Ack=17789 Win=106 Len=0"
"525","25.279583","172.64.155.249","192.168.0.183","TLSv1.2","278","Application Data"
"526","25.314794","172.64.155.249","192.168.0.183","TLSv1.2","162","Application Data"
"527","25.314794","172.64.155.249","192.168.0.183","TLSv1.2","100","Application Data"
"528","25.314794","172.64.155.249","192.168.0.183","TLSv1.2","1313","Application Data"
"529","25.314838","192.168.0.183","172.64.155.249","TCP","54","51124  >  443 [ACK] Seq=18050 Ack=307178 Win=514 Len=0"
"530","25.316260","172.64.155.249","192.168.0.183","TCP","1514","443  >  51124 [ACK] Seq=307178 Ack=18050 Win=106 Len=1460 [TCP segment of a reassembled PDU]"
"531","25.316260","172.64.155.249","192.168.0.183","TCP","1514","443  >  51124 [ACK] Seq=308638 Ack=18050 Win=106 Len=1460 [TCP segment of a reassembled PDU]"
"532","25.316260","172.64.155.249","192.168.0.183","TCP","1514","443  >  51124 [ACK] Seq=310098 Ack=18050 Win=106 Len=1460 [TCP segment of a reassembled PDU]"
"533","25.316260","172.64.155.249","192.168.0.183","TLSv1.2","660","Application Data"
"534","25.316260","172.64.155.249","192.168.0.183","TCP","1514","443  >  51124 [ACK] Seq=312164 Ack=18050 Win=106 Len=1460 [TCP segment of a reassembled PDU]"
"535","25.316260","172.64.155.249","192.168.0.183","TCP","1514","443  >  51124 [ACK] Seq=313624 Ack=18050 Win=106 Len=1460 [TCP segment of a reassembled PDU]"
"536","25.316260","172.64.155.249","192.168.0.183","TLSv1.2","1220","Application Data"
"537","25.316404","192.168.0.183","172.64.155.249","TCP","54","51124  >  443 [ACK] Seq=18050 Ack=316250 Win=514 Len=0"
"538","25.316822","192.168.0.183","172.64.155.249","TLSv1.2","89","Application Data"
"539","25.326223","172.64.155.249","192.168.0.183","TCP","1514","443  >  51124 [ACK] Seq=316250 Ack=18050 Win=106 Len=1460 [TCP segment of a reassembled PDU]"
"540","25.326223","172.64.155.249","192.168.0.183","TLSv1.2","1002","Application Data"
"541","25.326285","192.168.0.183","172.64.155.249","TCP","54","51124  >  443 [ACK] Seq=18085 Ack=318658 Win=514 Len=0"
"542","25.327493","172.64.155.249","192.168.0.183","TCP","1514","443  >  51124 [ACK] Seq=318658 Ack=18050 Win=106 Len=1460 [TCP segment of a reassembled PDU]"
"543","25.327493","172.64.155.249","192.168.0.183","TCP","1514","443  >  51124 [ACK] Seq=320118 Ack=18050 Win=106 Len=1460 [TCP segment of a reassembled PDU]"
"544","25.327493","172.64.155.249","192.168.0.183","TCP","1514","443  >  51124 [ACK] Seq=321578 Ack=18050 Win=106 Len=1460 [TCP segment of a reassembled PDU]"
"545","25.327493","172.64.155.249","192.168.0.183","TLSv1.2","457","Application Data"
"546","25.327539","192.168.0.183","172.64.155.249","TCP","54","51124  >  443 [ACK] Seq=18085 Ack=323441 Win=514 Len=0"
"547","25.332160","172.64.155.249","192.168.0.183","TCP","1514","443  >  51124 [ACK] Seq=323441 Ack=18085 Win=106 Len=1460 [TCP segment of a reassembled PDU]"
"548","25.332160","172.64.155.249","192.168.0.183","TCP","1514","443  >  51124 [ACK] Seq=324901 Ack=18085 Win=106 Len=1460 [TCP segment of a reassembled PDU]"
"549","25.332160","172.64.155.249","192.168.0.183","TCP","1514","443  >  51124 [ACK] Seq=326361 Ack=18085 Win=106 Len=1460 [TCP segment of a reassembled PDU]"
"550","25.332160","172.64.155.249","192.168.0.183","TCP","1514","443  >  51124 [ACK] Seq=327821 Ack=18085 Win=106 Len=1460 [TCP segment of a reassembled PDU]"
"551","25.332160","172.64.155.249","192.168.0.183","TCP","1514","443  >  51124 [ACK] Seq=329281 Ack=18085 Win=106 Len=1460 [TCP segment of a reassembled PDU]"
"552","25.332160","172.64.155.249","192.168.0.183","TCP","1514","443  >  51124 [PSH, ACK] Seq=330741 Ack=18085 Win=106 Len=1460 [TCP segment of a reassembled PDU]"
"553","25.332160","172.64.155.249","192.168.0.183","TCP","1514","443  >  51124 [ACK] Seq=332201 Ack=18085 Win=106 Len=1460 [TCP segment of a reassembled PDU]"
"554","25.332160","172.64.155.249","192.168.0.183","TCP","1514","443  >  51124 [ACK] Seq=333661 Ack=18085 Win=106 Len=1460 [TCP segment of a reassembled PDU]"
"555","25.332160","172.64.155.249","192.168.0.183","TCP","1514","443  >  51124 [ACK] Seq=335121 Ack=18085 Win=106 Len=1460 [TCP segment of a reassembled PDU]"
"556","25.332160","172.64.155.249","192.168.0.183","TLSv1.2","699","Application Data"
"557","25.332279","192.168.0.183","172.64.155.249","TCP","54","51124  >  443 [ACK] Seq=18085 Ack=337226 Win=514 Len=0"
"558","25.336870","172.64.155.249","192.168.0.183","TCP","1514","443  >  51124 [ACK] Seq=337226 Ack=18085 Win=106 Len=1460 [TCP segment of a reassembled PDU]"
"559","25.336870","172.64.155.249","192.168.0.183","TCP","1514","443  >  51124 [ACK] Seq=338686 Ack=18085 Win=106 Len=1460 [TCP segment of a reassembled PDU]"
"560","25.336870","172.64.155.249","192.168.0.183","TCP","1514","443  >  51124 [ACK] Seq=340146 Ack=18085 Win=106 Len=1460 [TCP segment of a reassembled PDU]"
"561","25.336870","172.64.155.249","192.168.0.183","TCP","1514","443  >  51124 [ACK] Seq=341606 Ack=18085 Win=106 Len=1460 [TCP segment of a reassembled PDU]"
"562","25.336870","172.64.155.249","192.168.0.183","TCP","1514","443  >  51124 [ACK] Seq=343066 Ack=18085 Win=106 Len=1460 [TCP segment of a reassembled PDU]"
"563","25.336870","172.64.155.249","192.168.0.183","TLSv1.2","707","Application Data"
"564","25.336988","192.168.0.183","172.64.155.249","TCP","54","51124  >  443 [ACK] Seq=18085 Ack=345179 Win=514 Len=0"
"565","25.338128","172.64.155.249","192.168.0.183","TCP","1514","443  >  51124 [ACK] Seq=345179 Ack=18085 Win=106 Len=1460 [TCP segment of a reassembled PDU]"
"566","25.338128","172.64.155.249","192.168.0.183","TCP","1514","443  >  51124 [ACK] Seq=346639 Ack=18085 Win=106 Len=1460 [TCP segment of a reassembled PDU]"
"567","25.338128","172.64.155.249","192.168.0.183","TLSv1.2","1297","Application Data"
"568","25.338128","172.64.155.249","192.168.0.183","TLSv1.2","96","Application Data"
"569","25.338128","172.64.155.249","192.168.0.183","TLSv1.2","85","Application Data"
"570","25.338231","192.168.0.183","172.64.155.249","TCP","54","51124  >  443 [ACK] Seq=18085 Ack=349415 Win=514 Len=0"
"571","25.516803","192.168.0.183","172.64.155.249","TLSv1.2","232","Application Data"
"572","25.554790","172.64.155.249","192.168.0.183","TLSv1.2","473","Application Data"
"573","25.554790","172.64.155.249","192.168.0.183","TLSv1.2","203","Application Data"
"574","25.554790","172.64.155.249","192.168.0.183","TLSv1.2","85","Application Data"
"575","25.554838","192.168.0.183","172.64.155.249","TCP","54","51134  >  443 [ACK] Seq=1169 Ack=4627 Win=514 Len=0"
"576","25.555868","192.168.0.183","172.64.155.249","TLSv1.2","89","Application Data"
"577","25.609686","172.64.155.249","192.168.0.183","TCP","60","443  >  51134 [ACK] Seq=4627 Ack=1204 Win=8 Len=0"
"578","25.651247","192.168.0.183","172.64.155.249","TLSv1.2","243","Application Data"
"579","25.691084","172.64.155.249","192.168.0.183","TLSv1.2","285","Application Data"
"580","25.737574","192.168.0.183","172.64.155.249","TCP","54","51124  >  443 [ACK] Seq=18274 Ack=349646 Win=513 Len=0"
"581","25.948179","192.168.0.183","172.64.155.249","TLSv1.2","632","Application Data"
"582","25.948256","192.168.0.183","172.64.155.249","TLSv1.2","576","Application Data"
"583","25.966109","172.64.155.249","192.168.0.183","TCP","60","443  >  51124 [ACK] Seq=349646 Ack=19374 Win=107 Len=0"
"584","25.988698","172.64.155.249","192.168.0.183","TLSv1.2","164","Application Data"
"585","25.988698","172.64.155.249","192.168.0.183","TLSv1.2","85","Application Data"
"586","25.988730","192.168.0.183","172.64.155.249","TCP","54","51124  >  443 [ACK] Seq=19374 Ack=349787 Win=512 Len=0"
"587","29.361092","192.168.0.183","172.64.155.249","TLSv1.2","424","Application Data"
"588","29.414538","172.64.155.249","192.168.0.183","TCP","60","443  >  51124 [ACK] Seq=349787 Ack=19744 Win=108 Len=0"
"589","29.437072","172.64.155.249","192.168.0.183","TLSv1.2","285","Application Data"
"590","29.437072","172.64.155.249","192.168.0.183","TLSv1.2","100","Application Data"
"591","29.437072","172.64.155.249","192.168.0.183","TCP","1514","443  >  51124 [ACK] Seq=350064 Ack=19744 Win=108 Len=1460 [TCP segment of a reassembled PDU]"
"592","29.437072","172.64.155.249","192.168.0.183","TLSv1.2","1096","Application Data"
"593","29.437072","172.64.155.249","192.168.0.183","TLSv1.2","1381","Application Data"
"594","29.437115","192.168.0.183","172.64.155.249","TCP","54","51124  >  443 [ACK] Seq=19744 Ack=353893 Win=514 Len=0"
"595","29.439908","172.64.155.249","192.168.0.183","TCP","1514","443  >  51124 [ACK] Seq=353893 Ack=19744 Win=108 Len=1460 [TCP segment of a reassembled PDU]"
"596","29.439908","172.64.155.249","192.168.0.183","TCP","1514","443  >  51124 [ACK] Seq=355353 Ack=19744 Win=108 Len=1460 [TCP segment of a reassembled PDU]"
"597","29.439908","172.64.155.249","192.168.0.183","TCP","1514","443  >  51124 [ACK] Seq=356813 Ack=19744 Win=108 Len=1460 [TCP segment of a reassembled PDU]"
"598","29.439908","172.64.155.249","192.168.0.183","TCP","1514","443  >  51124 [ACK] Seq=358273 Ack=19744 Win=108 Len=1460 [TCP segment of a reassembled PDU]"
"599","29.439908","172.64.155.249","192.168.0.183","TLSv1.2","107","Application Data"
"600","29.439968","192.168.0.183","172.64.155.249","TCP","54","51124  >  443 [ACK] Seq=19744 Ack=359786 Win=514 Len=0"
"601","29.451030","172.64.155.249","192.168.0.183","TCP","1514","443  >  51124 [ACK] Seq=359786 Ack=19744 Win=108 Len=1460 [TCP segment of a reassembled PDU]"
"602","29.451030","172.64.155.249","192.168.0.183","TLSv1.2","1093","Application Data"
"603","29.451030","172.64.155.249","192.168.0.183","TCP","1514","443  >  51124 [ACK] Seq=362285 Ack=19744 Win=108 Len=1460 [TCP segment of a reassembled PDU]"
"604","29.451030","172.64.155.249","192.168.0.183","TLSv1.2","1216","Application Data"
"605","29.451030","172.64.155.249","192.168.0.183","TCP","1514","443  >  51124 [ACK] Seq=364907 Ack=19744 Win=108 Len=1460 [TCP segment of a reassembled PDU]"
"606","29.451030","172.64.155.249","192.168.0.183","TCP","1514","443  >  51124 [ACK] Seq=366367 Ack=19744 Win=108 Len=1460 [TCP segment of a reassembled PDU]"
"607","29.451030","172.64.155.249","192.168.0.183","TLSv1.2","823","Application Data"
"608","29.451641","192.168.0.183","172.64.155.249","TCP","54","51124  >  443 [ACK] Seq=19744 Ack=368596 Win=514 Len=0"
"609","29.451772","172.64.155.249","192.168.0.183","TCP","1514","443  >  51124 [ACK] Seq=368596 Ack=19744 Win=108 Len=1460 [TCP segment of a reassembled PDU]"
"610","29.451772","172.64.155.249","192.168.0.183","TCP","1514","443  >  51124 [ACK] Seq=370056 Ack=19744 Win=108 Len=1460 [TCP segment of a reassembled PDU]"
"611","29.451772","172.64.155.249","192.168.0.183","TCP","1514","443  >  51124 [ACK] Seq=371516 Ack=19744 Win=108 Len=1460 [TCP segment of a reassembled PDU]"
"612","29.451772","172.64.155.249","192.168.0.183","TLSv1.2","1353","Application Data"
"613","29.451772","172.64.155.249","192.168.0.183","TLSv1.2","96","Application Data"
"614","29.451772","172.64.155.249","192.168.0.183","TLSv1.2","85","Application Data"
"615","29.451836","192.168.0.183","172.64.155.249","TCP","54","51124  >  443 [ACK] Seq=19744 Ack=374348 Win=514 Len=0"
"616","29.742156","192.168.0.183","172.64.155.249","TLSv1.2","422","Application Data"
"617","29.742411","192.168.0.183","172.64.155.249","TLSv1.2","177","Application Data"
"618","29.755197","172.64.155.249","192.168.0.183","TCP","60","443  >  51124 [ACK] Seq=374348 Ack=20235 Win=108 Len=0"
"619","29.777359","172.64.155.249","192.168.0.183","TLSv1.2","277","Application Data"
"620","29.781980","172.64.155.249","192.168.0.183","TLSv1.2","146","Application Data"
"621","29.781980","172.64.155.249","192.168.0.183","TLSv1.2","223","Application Data"
"622","29.781980","172.64.155.249","192.168.0.183","TLSv1.2","85","Application Data"
"623","29.782023","192.168.0.183","172.64.155.249","TCP","54","51124  >  443 [ACK] Seq=20235 Ack=374863 Win=512 Len=0"
"624","29.871675","192.168.0.183","172.64.155.249","TLSv1.2","496","Application Data"
"625","29.871741","192.168.0.183","172.64.155.249","TLSv1.2","538","Application Data"
"626","29.885285","172.64.155.249","192.168.0.183","TCP","60","443  >  51124 [ACK] Seq=374863 Ack=21161 Win=109 Len=0"
"627","29.912217","172.64.155.249","192.168.0.183","TLSv1.2","144","Application Data"
"628","29.912217","172.64.155.249","192.168.0.183","TLSv1.2","85","Application Data"
"629","29.912245","192.168.0.183","172.64.155.249","TCP","54","51124  >  443 [ACK] Seq=21161 Ack=374984 Win=511 Len=0"
