"No.","Time","Source","Destination","Protocol","Length","Info"
"1","0.000000","192.168.0.183","172.64.155.249","TLSv1.2","153","Application Data"
"2","0.000064","192.168.0.183","172.64.155.249","TLSv1.2","93","Application Data"
"3","0.016016","172.64.155.249","192.168.0.183","TCP","60","443  >  51124 [ACK] Seq=1 Ack=139 Win=33 Len=0"
"4","0.016016","172.64.155.249","192.168.0.183","TLSv1.2","93","Application Data"
"5","0.056664","172.64.155.249","192.168.0.183","TLSv1.2","296","Application Data"
"6","0.056664","172.64.155.249","192.168.0.183","TLSv1.2","100","Application Data"
"7","0.056664","172.64.155.249","192.168.0.183","TLSv1.2","1279","Application Data"
"8","0.056664","172.64.155.249","192.168.0.183","TCP","1514","443  >  51124 [ACK] Seq=1553 Ack=139 Win=33 Len=1460 [TCP segment of a reassembled PDU]"
"9","0.056664","172.64.155.249","192.168.0.183","TCP","1514","443  >  51124 [ACK] Seq=3013 Ack=139 Win=33 Len=1460 [TCP segment of a reassembled PDU]"
"10","0.056664","172.64.155.249","192.168.0.183","TLSv1.2","907","Application Data"
"11","0.056664","172.64.155.249","192.168.0.183","TCP","1514","443  >  51124 [ACK] Seq=5326 Ack=139 Win=33 Len=1460 [TCP segment of a reassembled PDU]"
"12","0.056664","172.64.155.249","192.168.0.183","TCP","1514","443  >  51124 [ACK] Seq=6786 Ack=139 Win=33 Len=1460 [TCP segment of a reassembled PDU]"
"13","0.056733","192.168.0.183","172.64.155.249","TCP","54","51124  >  443 [ACK] Seq=139 Ack=8246 Win=514 Len=0"
"14","0.057775","192.168.0.183","172.64.155.249","TLSv1.2","89","Application Data"
"15","0.060209","172.64.155.249","192.168.0.183","TCP","1514","443  >  51124 [ACK] Seq=8246 Ack=139 Win=33 Len=1460 [TCP segment of a reassembled PDU]"
"16","0.060209","172.64.155.249","192.168.0.183","TLSv1.2","408","Application Data"
"17","0.060254","192.168.0.183","172.64.155.249","TCP","54","51124  >  443 [ACK] Seq=174 Ack=10060 Win=514 Len=0"
"18","0.066032","172.64.155.249","192.168.0.183","TCP","1514","443  >  51124 [ACK] Seq=10060 Ack=139 Win=33 Len=1460 [TCP segment of a reassembled PDU]"
"19","0.066032","172.64.155.249","192.168.0.183","TLSv1.2","966","Application Data"
"20","0.066032","172.64.155.249","192.168.0.183","TLSv1.2","688","Application Data"
"21","0.066083","192.168.0.183","172.64.155.249","TCP","54","51124  >  443 [ACK] Seq=174 Ack=13066 Win=514 Len=0"
"22","0.067916","172.64.155.249","192.168.0.183","TCP","1514","443  >  51124 [ACK] Seq=13066 Ack=139 Win=33 Len=1460 [TCP segment of a reassembled PDU]"
"23","0.067916","172.64.155.249","192.168.0.183","TCP","1514","443  >  51124 [ACK] Seq=14526 Ack=139 Win=33 Len=1460 [TCP segment of a reassembled PDU]"
"24","0.067916","172.64.155.249","192.168.0.183","TCP","1514","443  >  51124 [ACK] Seq=15986 Ack=139 Win=33 Len=1460 [TCP segment of a reassembled PDU]"
"25","0.067916","172.64.155.249","192.168.0.183","TLSv1.2","1319","Application Data"
"26","0.067916","172.64.155.249","192.168.0.183","TCP","1514","443  >  51124 [ACK] Seq=18711 Ack=139 Win=33 Len=1460 [TCP segment of a reassembled PDU]"
"27","0.067916","172.64.155.249","192.168.0.183","TCP","1514","443  >  51124 [ACK] Seq=20171 Ack=139 Win=33 Len=1460 [TCP segment of a reassembled PDU]"
"28","0.067916","172.64.155.249","192.168.0.183","TLSv1.2","459","Application Data"
"29","0.067916","172.64.155.249","192.168.0.183","TLSv1.2","96","Application Data"
"30","0.067916","172.64.155.249","192.168.0.183","TLSv1.2","85","Application Data"
"31","0.068009","192.168.0.183","172.64.155.249","TCP","54","51124  >  443 [ACK] Seq=174 Ack=22109 Win=514 Len=0"
"32","0.112799","172.64.155.249","192.168.0.183","TCP","60","443  >  51124 [ACK] Seq=22109 Ack=174 Win=33 Len=0"
"33","0.336388","192.168.0.183","172.64.155.249","TLSv1.2","217","Application Data"
"34","0.351963","172.64.155.249","192.168.0.183","TCP","60","443  >  51124 [ACK] Seq=22109 Ack=337 Win=33 Len=0"
"35","0.372651","172.64.155.249","192.168.0.183","TLSv1.2","441","Application Data"
"36","0.412362","192.168.0.183","172.64.155.249","TCP","54","51124  >  443 [ACK] Seq=337 Ack=22496 Win=512 Len=0"
"37","0.449225","192.168.0.183","172.64.155.249","TLSv1.2","489","Application Data"
"38","0.449280","192.168.0.183","172.64.155.249","TLSv1.2","545","Application Data"
"39","0.467470","172.64.155.249","192.168.0.183","TCP","60","443  >  51124 [ACK] Seq=22496 Ack=1263 Win=34 Len=0"
"40","0.489157","172.64.155.249","192.168.0.183","TLSv1.2","143","Application Data"
"41","0.489157","172.64.155.249","192.168.0.183","TLSv1.2","85","Application Data"
"42","0.489240","192.168.0.183","172.64.155.249","TCP","54","51124  >  443 [ACK] Seq=1263 Ack=22616 Win=512 Len=0"
"43","2.522572","192.168.0.183","172.64.155.249","TLSv1.2","208","Application Data"
"44","2.522699","192.168.0.183","172.64.155.249","TLSv1.2","170","Application Data"
"45","2.535131","192.168.0.183","172.64.155.249","TLSv1.2","303","Application Data"
"46","2.535856","172.64.155.249","192.168.0.183","TCP","60","443  >  51124 [ACK] Seq=22616 Ack=1533 Win=34 Len=0"
"47","2.564766","172.64.155.249","192.168.0.183","TLSv1.2","278","Application Data"
"48","2.617958","192.168.0.183","172.64.155.249","TCP","54","51124  >  443 [ACK] Seq=1782 Ack=22840 Win=511 Len=0"
"49","2.721930","172.64.155.249","192.168.0.183","TLSv1.2","162","Application Data"
"50","2.721930","172.64.155.249","192.168.0.183","TLSv1.2","100","Application Data"
"51","2.721930","172.64.155.249","192.168.0.183","TLSv1.2","1321","Application Data"
"52","2.721930","172.64.155.249","192.168.0.183","TCP","1514","443  >  51124 [ACK] Seq=24261 Ack=1782 Win=35 Len=1460 [TCP segment of a reassembled PDU]"
"53","2.721930","172.64.155.249","192.168.0.183","TCP","1514","443  >  51124 [ACK] Seq=25721 Ack=1782 Win=35 Len=1460 [TCP segment of a reassembled PDU]"
"54","2.721930","172.64.155.249","192.168.0.183","TCP","1514","443  >  51124 [ACK] Seq=27181 Ack=1782 Win=35 Len=1460 [TCP segment of a reassembled PDU]"
"55","2.721930","172.64.155.249","192.168.0.183","TLSv1.2","613","Application Data"
"56","2.721990","192.168.0.183","172.64.155.249","TCP","54","51124  >  443 [ACK] Seq=1782 Ack=29200 Win=514 Len=0"
"57","2.722637","172.64.155.249","192.168.0.183","TCP","1514","443  >  51124 [ACK] Seq=29200 Ack=1782 Win=35 Len=1460 [TCP segment of a reassembled PDU]"
"58","2.722637","172.64.155.249","192.168.0.183","TCP","1514","443  >  51124 [ACK] Seq=30660 Ack=1782 Win=35 Len=1460 [TCP segment of a reassembled PDU]"
"59","2.722637","172.64.155.249","192.168.0.183","TLSv1.2","634","Application Data"
"60","2.722704","192.168.0.183","172.64.155.249","TCP","54","51124  >  443 [ACK] Seq=1782 Ack=32700 Win=514 Len=0"
"61","2.737066","172.64.155.249","192.168.0.183","TCP","1514","443  >  51124 [ACK] Seq=32700 Ack=1782 Win=35 Len=1460 [TCP segment of a reassembled PDU]"
"62","2.737066","172.64.155.249","192.168.0.183","TCP","1514","443  >  51124 [ACK] Seq=34160 Ack=1782 Win=35 Len=1460 [TCP segment of a reassembled PDU]"
"63","2.737066","172.64.155.249","192.168.0.183","TCP","1514","443  >  51124 [ACK] Seq=35620 Ack=1782 Win=35 Len=1460 [TCP segment of a reassembled PDU]"
"64","2.737066","172.64.155.249","192.168.0.183","TCP","1514","443  >  51124 [ACK] Seq=37080 Ack=1782 Win=35 Len=1460 [TCP segment of a reassembled PDU]"
"65","2.737066","172.64.155.249","192.168.0.183","TCP","1514","443  >  51124 [ACK] Seq=38540 Ack=1782 Win=35 Len=1460 [TCP segment of a reassembled PDU]"
"66","2.737066","172.64.155.249","192.168.0.183","TCP","1514","443  >  51124 [PSH, ACK] Seq=40000 Ack=1782 Win=35 Len=1460 [TCP segment of a reassembled PDU]"
"67","2.737066","172.64.155.249","192.168.0.183","TCP","1514","443  >  51124 [ACK] Seq=41460 Ack=1782 Win=35 Len=1460 [TCP segment of a reassembled PDU]"
"68","2.737066","172.64.155.249","192.168.0.183","TCP","1514","443  >  51124 [ACK] Seq=42920 Ack=1782 Win=35 Len=1460 [TCP segment of a reassembled PDU]"
"69","2.737066","172.64.155.249","192.168.0.183","TCP","1514","443  >  51124 [ACK] Seq=44380 Ack=1782 Win=35 Len=1460 [TCP segment of a reassembled PDU]"
"70","2.737066","172.64.155.249","192.168.0.183","TCP","1514","443  >  51124 [ACK] Seq=45840 Ack=1782 Win=35 Len=1460 [TCP segment of a reassembled PDU]"
"71","2.737066","172.64.155.249","192.168.0.183","TLSv1.2","301","Application Data"
"72","2.737066","172.64.155.249","192.168.0.183","TCP","1514","443  >  51124 [ACK] Seq=47547 Ack=1782 Win=35 Len=1460 [TCP segment of a reassembled PDU]"
"73","2.737066","172.64.155.249","192.168.0.183","TCP","1514","443  >  51124 [ACK] Seq=49007 Ack=1782 Win=35 Len=1460 [TCP segment of a reassembled PDU]"
"74","2.737066","172.64.155.249","192.168.0.183","TCP","1514","443  >  51124 [ACK] Seq=50467 Ack=1782 Win=35 Len=1460 [TCP segment of a reassembled PDU]"
"75","2.737066","172.64.155.249","192.168.0.183","TCP","1514","443  >  51124 [ACK] Seq=51927 Ack=1782 Win=35 Len=1460 [TCP segment of a reassembled PDU]"
"76","2.737066","172.64.155.249","192.168.0.183","TLSv1.2","78","Application Data"
"77","2.737066","172.64.155.249","192.168.0.183","TLSv1.2","127","Application Data, Application Data"
"78","2.737386","192.168.0.183","172.64.155.249","TCP","54","51124  >  443 [ACK] Seq=1782 Ack=53484 Win=514 Len=0"
"79","2.879227","192.168.0.183","172.64.155.249","TLSv1.2","185","Application Data"
"80","2.879306","192.168.0.183","172.64.155.249","TLSv1.2","93","Application Data"
"81","2.893892","172.64.155.249","192.168.0.183","TCP","60","443  >  51134 [ACK] Seq=1 Ack=171 Win=8 Len=0"
"82","2.893892","172.64.155.249","192.168.0.183","TLSv1.2","93","Application Data"
"83","2.921038","172.64.155.249","192.168.0.183","TLSv1.2","474","Application Data"
"84","2.921038","172.64.155.249","192.168.0.183","TLSv1.2","203","Application Data"
"85","2.921038","172.64.155.249","192.168.0.183","TLSv1.2","85","Application Data"
"86","2.921112","192.168.0.183","172.64.155.249","TCP","54","51134  >  443 [ACK] Seq=171 Ack=640 Win=514 Len=0"
"87","2.922552","192.168.0.183","172.64.155.249","TLSv1.2","89","Application Data"
"88","2.975549","172.64.155.249","192.168.0.183","TCP","60","443  >  51134 [ACK] Seq=640 Ack=206 Win=8 Len=0"
"89","3.199198","192.168.0.183","172.64.155.249","TLSv1.2","603","Application Data"
"90","3.199252","192.168.0.183","172.64.155.249","TLSv1.2","554","Application Data"
"91","3.215426","172.64.155.249","192.168.0.183","TCP","60","443  >  51124 [ACK] Seq=53484 Ack=2831 Win=35 Len=0"
"92","3.236155","172.64.155.249","192.168.0.183","TLSv1.2","165","Application Data"
"93","3.236155","172.64.155.249","192.168.0.183","TLSv1.2","85","Application Data"
"94","3.236252","192.168.0.183","172.64.155.249","TCP","54","51124  >  443 [ACK] Seq=2831 Ack=53626 Win=513 Len=0"
"95","4.452175","192.168.0.183","172.64.155.249","TLSv1.2","732","Application Data"
"96","4.452240","192.168.0.183","172.64.155.249","TLSv1.2","594","Application Data"
"97","4.465003","172.64.155.249","192.168.0.183","TCP","60","443  >  51124 [ACK] Seq=53626 Ack=4049 Win=36 Len=0"
"98","4.486694","172.64.155.249","192.168.0.183","TLSv1.2","277","Application Data"
"99","4.486694","172.64.155.249","192.168.0.183","TLSv1.2","85","Application Data"
"100","4.486780","192.168.0.183","172.64.155.249","TCP","54","51124  >  443 [ACK] Seq=4049 Ack=53880 Win=512 Len=0"
"101","5.016881","192.168.0.183","172.64.155.249","TLSv1.2","265","Application Data"
"102","5.016952","192.168.0.183","172.64.155.249","TLSv1.2","594","Application Data"
"103","5.030407","172.64.155.249","192.168.0.183","TCP","60","443  >  51124 [ACK] Seq=53880 Ack=4800 Win=37 Len=0"
"104","5.031647","192.168.0.183","172.64.155.249","TLSv1.2","205","Application Data"
"105","5.053181","172.64.155.249","192.168.0.183","TLSv1.2","144","Application Data"
"106","5.053181","172.64.155.249","192.168.0.183","TLSv1.2","85","Application Data"
"107","5.053225","192.168.0.183","172.64.155.249","TCP","54","51124  >  443 [ACK] Seq=4951 Ack=54001 Win=512 Len=0"
"108","5.106930","172.64.155.249","192.168.0.183","TLSv1.2","171","Application Data"
"109","5.106930","172.64.155.249","192.168.0.183","TLSv1.2","100","Application Data"
"110","5.106930","172.64.155.249","192.168.0.183","TLSv1.2","1311","Application Data"
"111","5.107011","192.168.0.183","172.64.155.249","TCP","54","51124  >  443 [ACK] Seq=4951 Ack=54164 Win=511 Len=0"
"112","5.108326","192.168.0.183","172.64.155.249","TLSv1.2","89","Application Data"
"113","5.108986","172.64.155.249","192.168.0.183","TCP","1514","443  >  51124 [ACK] Seq=55421 Ack=4951 Win=37 Len=1460 [TCP segment of a reassembled PDU]"
"114","5.108986","172.64.155.249","192.168.0.183","TCP","1514","443  >  51124 [ACK] Seq=56881 Ack=4951 Win=37 Len=1460 [TCP segment of a reassembled PDU]"
"115","5.108986","172.64.155.249","192.168.0.183","TCP","1514","443  >  51124 [ACK] Seq=58341 Ack=4951 Win=37 Len=1460 [TCP segment of a reassembled PDU]"
"116","5.108986","172.64.155.249","192.168.0.183","TLSv1.2","681","Application Data"
"117","5.108986","172.64.155.249","192.168.0.183","TCP","1514","443  >  51124 [ACK] Seq=60428 Ack=4951 Win=37 Len=1460 [TCP segment of a reassembled PDU]"
"118","5.108986","172.64.155.249","192.168.0.183","TCP","1514","443  >  51124 [ACK] Seq=61888 Ack=4951 Win=37 Len=1460 [TCP segment of a reassembled PDU]"
"119","5.108986","172.64.155.249","192.168.0.183","TLSv1.2","1287","Application Data"
"120","5.109047","192.168.0.183","172.64.155.249","TCP","54","51124  >  443 [ACK] Seq=4986 Ack=64581 Win=514 Len=0"
"121","5.116799","172.64.155.249","192.168.0.183","TCP","1514","443  >  51124 [ACK] Seq=64581 Ack=4951 Win=37 Len=1460 [TCP segment of a reassembled PDU]"
"122","5.116799","172.64.155.249","192.168.0.183","TLSv1.2","966","Application Data"
"123","5.116868","192.168.0.183","172.64.155.249","TCP","54","51124  >  443 [ACK] Seq=4986 Ack=66953 Win=514 Len=0"
"124","5.118928","172.64.155.249","192.168.0.183","TCP","1514","443  >  51124 [ACK] Seq=66953 Ack=4951 Win=37 Len=1460 [TCP segment of a reassembled PDU]"
"125","5.118928","172.64.155.249","192.168.0.183","TLSv1.2","1056","Application Data"
"126","5.118989","192.168.0.183","172.64.155.249","TCP","54","51124  >  443 [ACK] Seq=4986 Ack=69415 Win=514 Len=0"
"127","5.121340","172.64.155.249","192.168.0.183","TCP","1514","443  >  51124 [ACK] Seq=69415 Ack=4951 Win=37 Len=1460 [TCP segment of a reassembled PDU]"
"128","5.121340","172.64.155.249","192.168.0.183","TCP","1514","443  >  51124 [ACK] Seq=70875 Ack=4951 Win=37 Len=1460 [TCP segment of a reassembled PDU]"
"129","5.121340","172.64.155.249","192.168.0.183","TCP","1514","443  >  51124 [ACK] Seq=72335 Ack=4951 Win=37 Len=1460 [TCP segment of a reassembled PDU]"
"130","5.121340","172.64.155.249","192.168.0.183","TLSv1.2","228","Application Data"
"131","5.121453","192.168.0.183","172.64.155.249","TCP","54","51124  >  443 [ACK] Seq=4986 Ack=73969 Win=514 Len=0"
"132","5.122799","172.64.155.249","192.168.0.183","TCP","1514","443  >  51124 [ACK] Seq=73969 Ack=4951 Win=37 Len=1460 [TCP segment of a reassembled PDU]"
"133","5.122799","172.64.155.249","192.168.0.183","TCP","1514","443  >  51124 [ACK] Seq=75429 Ack=4951 Win=37 Len=1460 [TCP segment of a reassembled PDU]"
"134","5.122799","172.64.155.249","192.168.0.183","TCP","1514","443  >  51124 [ACK] Seq=76889 Ack=4951 Win=37 Len=1460 [TCP segment of a reassembled PDU]"
"135","5.122799","172.64.155.249","192.168.0.183","TCP","1514","443  >  51124 [ACK] Seq=78349 Ack=4951 Win=37 Len=1460 [TCP segment of a reassembled PDU]"
"136","5.122799","172.64.155.249","192.168.0.183","TCP","1514","443  >  51124 [ACK] Seq=79809 Ack=4951 Win=37 Len=1460 [TCP segment of a reassembled PDU]"
"137","5.122799","172.64.155.249","192.168.0.183","TCP","1514","443  >  51124 [PSH, ACK] Seq=81269 Ack=4951 Win=37 Len=1460 [TCP segment of a reassembled PDU]"
"138","5.122799","172.64.155.249","192.168.0.183","TLSv1.2","877","Application Data"
"139","5.122799","172.64.155.249","192.168.0.183","TCP","1514","443  >  51124 [ACK] Seq=83552 Ack=4951 Win=37 Len=1460 [TCP segment of a reassembled PDU]"
"140","5.122799","172.64.155.249","192.168.0.183","TCP","1514","443  >  51124 [ACK] Seq=85012 Ack=4951 Win=37 Len=1460 [TCP segment of a reassembled PDU]"
"141","5.122799","172.64.155.249","192.168.0.183","TLSv1.2","859","Application Data"
"142","5.122970","192.168.0.183","172.64.155.249","TCP","54","51124  >  443 [ACK] Seq=4986 Ack=87277 Win=514 Len=0"
"143","5.129090","172.64.155.249","192.168.0.183","TCP","1514","443  >  51124 [ACK] Seq=87277 Ack=4986 Win=37 Len=1460 [TCP segment of a reassembled PDU]"
"144","5.129090","172.64.155.249","192.168.0.183","TCP","1514","443  >  51124 [ACK] Seq=88737 Ack=4986 Win=37 Len=1460 [TCP segment of a reassembled PDU]"
"145","5.129090","172.64.155.249","192.168.0.183","TCP","1514","443  >  51124 [ACK] Seq=90197 Ack=4986 Win=37 Len=1460 [TCP segment of a reassembled PDU]"
"146","5.129090","172.64.155.249","192.168.0.183","TCP","1514","443  >  51124 [ACK] Seq=91657 Ack=4986 Win=37 Len=1460 [TCP segment of a reassembled PDU]"
"147","5.129090","172.64.155.249","192.168.0.183","TLSv1.2","645","Application Data"
"148","5.129090","172.64.155.249","192.168.0.183","TLSv1.2","96","Application Data"
"149","5.129090","172.64.155.249","192.168.0.183","TLSv1.2","85","Application Data"
"150","5.129169","192.168.0.183","172.64.155.249","TCP","54","51124  >  443 [ACK] Seq=4986 Ack=93781 Win=514 Len=0"
"151","5.282240","192.168.0.183","172.64.155.249","TLSv1.2","207","Application Data"
"152","5.296691","172.64.155.249","192.168.0.183","TCP","60","443  >  51134 [ACK] Seq=640 Ack=359 Win=8 Len=0"
"153","5.324263","172.64.155.249","192.168.0.183","TLSv1.2","475","Application Data"
"154","5.324263","172.64.155.249","192.168.0.183","TLSv1.2","203","Application Data"
"155","5.324263","172.64.155.249","192.168.0.183","TLSv1.2","85","Application Data"
"156","5.324401","192.168.0.183","172.64.155.249","TCP","54","51134  >  443 [ACK] Seq=359 Ack=1241 Win=511 Len=0"
"157","5.469028","192.168.0.183","172.64.155.249","TLSv1.2","307","Application Data"
"158","5.504783","172.64.155.249","192.168.0.183","TLSv1.2","277","Application Data"
"159","5.556985","192.168.0.183","172.64.155.249","TCP","54","51124  >  443 [ACK] Seq=5239 Ack=94004 Win=513 Len=0"
"160","5.715117","192.168.0.183","172.64.155.249","TLSv1.2","449","Application Data"
"161","5.715178","192.168.0.183","172.64.155.249","TLSv1.2","578","Application Data"
"162","5.728895","172.64.155.249","192.168.0.183","TCP","60","443  >  51124 [ACK] Seq=94004 Ack=6158 Win=38 Len=0"
"163","5.752985","172.64.155.249","192.168.0.183","TLSv1.2","144","Application Data"
"164","5.752985","172.64.155.249","192.168.0.183","TLSv1.2","85","Application Data"
"165","5.753039","192.168.0.183","172.64.155.249","TCP","54","51124  >  443 [ACK] Seq=6158 Ack=94125 Win=512 Len=0"
"166","8.450888","192.168.0.183","172.64.155.249","TLSv1.2","181","Application Data"
"167","8.504814","172.64.155.249","192.168.0.183","TCP","60","443  >  51124 [ACK] Seq=94125 Ack=6285 Win=38 Len=0"
"168","8.853568","172.64.155.249","192.168.0.183","TLSv1.2","279","Application Data"
"169","8.853568","172.64.155.249","192.168.0.183","TLSv1.2","100","Application Data"
"170","8.853568","172.64.155.249","192.168.0.183","TLSv1.2","1283","Application Data"
"171","8.853568","172.64.155.249","192.168.0.183","TCP","1514","443  >  51124 [ACK] Seq=95625 Ack=6285 Win=38 Len=1460 [TCP segment of a reassembled PDU]"
"172","8.853568","172.64.155.249","192.168.0.183","TLSv1.2","1181","Application Data"
"173","8.853640","192.168.0.183","172.64.155.249","TCP","54","51124  >  443 [ACK] Seq=6285 Ack=98212 Win=514 Len=0"
"174","8.855366","172.64.155.249","192.168.0.183","TCP","1514","443  >  51124 [ACK] Seq=98212 Ack=6285 Win=38 Len=1460 [TCP segment of a reassembled PDU]"
"175","8.855366","172.64.155.249","192.168.0.183","TCP","1514","443  >  51124 [ACK] Seq=99672 Ack=6285 Win=38 Len=1460 [TCP segment of a reassembled PDU]"
"176","8.855366","172.64.155.249","192.168.0.183","TCP","1514","443  >  51124 [ACK] Seq=101132 Ack=6285 Win=38 Len=1460 [TCP segment of a reassembled PDU]"
"177","8.855366","172.64.155.249","192.168.0.183","TLSv1.2","301","Application Data"
"178","8.855366","172.64.155.249","192.168.0.183","TCP","1514","443  >  51124 [ACK] Seq=102839 Ack=6285 Win=38 Len=1460 [TCP segment of a reassembled PDU]"
"179","8.855366","172.64.155.249","192.168.0.183","TLSv1.2","1200","Application Data"
"180","8.855458","192.168.0.183","172.64.155.249","TCP","54","51124  >  443 [ACK] Seq=6285 Ack=105445 Win=514 Len=0"
"181","8.864361","172.64.155.249","192.168.0.183","TCP","1514","443  >  51124 [ACK] Seq=105445 Ack=6285 Win=38 Len=1460 [TCP segment of a reassembled PDU]"
"182","8.864361","172.64.155.249","192.168.0.183","TLSv1.2","235","Application Data"
"183","8.864361","172.64.155.249","192.168.0.183","TLSv1.2","184","Application Data"
"184","8.864361","172.64.155.249","192.168.0.183","TCP","1514","443  >  51124 [ACK] Seq=107216 Ack=6285 Win=38 Len=1460 [TCP segment of a reassembled PDU]"
"185","8.864361","172.64.155.249","192.168.0.183","TCP","1514","443  >  51124 [ACK] Seq=108676 Ack=6285 Win=38 Len=1460 [TCP segment of a reassembled PDU]"
"186","8.864420","192.168.0.183","172.64.155.249","TCP","54","51124  >  443 [ACK] Seq=6285 Ack=110136 Win=514 Len=0"
"187","8.865852","172.64.155.249","192.168.0.183","TCP","1514","443  >  51124 [ACK] Seq=110136 Ack=6285 Win=38 Len=1460 [TCP segment of a reassembled PDU]"
"188","8.865852","172.64.155.249","192.168.0.183","TLSv1.2","277","Application Data"
"189","8.865910","192.168.0.183","172.64.155.249","TCP","54","51124  >  443 [ACK] Seq=6285 Ack=111819 Win=514 Len=0"
"190","8.868274","172.64.155.249","192.168.0.183","TCP","1514","443  >  51124 [ACK] Seq=111819 Ack=6285 Win=38 Len=1460 [TCP segment of a reassembled PDU]"
"191","8.868274","172.64.155.249","192.168.0.183","TCP","1514","443  >  51124 [ACK] Seq=113279 Ack=6285 Win=38 Len=1460 [TCP segment of a reassembled PDU]"
"192","8.868274","172.64.155.249","192.168.0.183","TCP","1514","443  >  51124 [ACK] Seq=114739 Ack=6285 Win=38 Len=1460 [TCP segment of a reassembled PDU]"
"193","8.868274","172.64.155.249","192.168.0.183","TLSv1.2","1274","Application Data"
"194","8.868274","172.64.155.249","192.168.0.183","TLSv1.2","96","Application Data"
"195","8.868274","172.64.155.249","192.168.0.183","TLSv1.2","85","Application Data"
"196","8.868486","192.168.0.183","172.64.155.249","TCP","54","51124  >  443 [ACK] Seq=6285 Ack=117492 Win=514 Len=0"
"197","9.191180","192.168.0.183","172.64.155.249","TLSv1.2","216","Application Data"
"198","9.207642","172.64.155.249","192.168.0.183","TCP","60","443  >  51124 [ACK] Seq=117492 Ack=6447 Win=39 Len=0"
"199","9.226624","172.64.155.249","192.168.0.183","TLSv1.2","179","Application Data"
"200","9.279398","192.168.0.183","172.64.155.249","TCP","54","51124  >  443 [ACK] Seq=6447 Ack=117617 Win=513 Len=0"
"201","9.301109","192.168.0.183","172.64.155.249","TLSv1.2","490","Application Data"
"202","9.301206","192.168.0.183","172.64.155.249","TLSv1.2","544","Application Data"
"203","9.314742","172.64.155.249","192.168.0.183","TCP","60","443  >  51124 [ACK] Seq=117617 Ack=7373 Win=39 Len=0"
"204","9.339331","172.64.155.249","192.168.0.183","TLSv1.2","144","Application Data"
"205","9.339331","172.64.155.249","192.168.0.183","TLSv1.2","85","Application Data"
"206","9.339405","192.168.0.183","172.64.155.249","TCP","54","51124  >  443 [ACK] Seq=7373 Ack=117738 Win=513 Len=0"
"207","11.965052","192.168.0.183","172.64.155.249","TLSv1.2","244","Application Data"
"208","12.003960","172.64.155.249","192.168.0.183","TLSv1.2","279","Application Data"
"209","12.003960","172.64.155.249","192.168.0.183","TCP","1514","443  >  51124 [ACK] Seq=117963 Ack=7563 Win=40 Len=1460 [TCP segment of a reassembled PDU]"
"210","12.003960","172.64.155.249","192.168.0.183","TLSv1.2","781","Application Data"
"211","12.003960","172.64.155.249","192.168.0.183","TLSv1.2","126","Application Data, Application Data"
"212","12.004003","192.168.0.183","172.64.155.249","TCP","54","51124  >  443 [ACK] Seq=7563 Ack=120222 Win=514 Len=0"
"213","12.004851","192.168.0.183","172.64.155.249","TLSv1.2","89","Application Data"
"214","12.058768","172.64.155.249","192.168.0.183","TCP","60","443  >  51124 [ACK] Seq=120222 Ack=7598 Win=40 Len=0"
"215","12.153851","192.168.0.183","172.64.155.249","TLSv1.2","166","Application Data"
"216","12.154045","192.168.0.183","172.64.155.249","TLSv1.2","170","Application Data"
"217","12.165806","192.168.0.183","172.64.155.249","TLSv1.2","305","Application Data"
"218","12.168302","172.64.155.249","192.168.0.183","TCP","60","443  >  51124 [ACK] Seq=120222 Ack=7826 Win=40 Len=0"
"219","12.180477","172.64.155.249","192.168.0.183","TCP","60","443  >  51124 [ACK] Seq=120222 Ack=8077 Win=40 Len=0"
"220","12.190802","172.64.155.249","192.168.0.183","TLSv1.2","310","Application Data"
"221","12.233974","192.168.0.183","172.64.155.249","TCP","54","51124  >  443 [ACK] Seq=8077 Ack=120478 Win=513 Len=0"
"222","12.340038","172.64.155.249","192.168.0.183","TLSv1.2","146","Application Data"
"223","12.340038","172.64.155.249","192.168.0.183","TLSv1.2","1333","Application Data"
"224","12.340038","172.64.155.249","192.168.0.183","TCP","1514","443  >  51124 [ACK] Seq=121849 Ack=8077 Win=40 Len=1460 [TCP segment of a reassembled PDU]"
"225","12.340038","172.64.155.249","192.168.0.183","TCP","1514","443  >  51124 [ACK] Seq=123309 Ack=8077 Win=40 Len=1460 [TCP segment of a reassembled PDU]"
"226","12.340038","172.64.155.249","192.168.0.183","TCP","1514","443  >  51124 [ACK] Seq=124769 Ack=8077 Win=40 Len=1460 [TCP segment of a reassembled PDU]"
"227","12.340038","172.64.155.249","192.168.0.183","TLSv1.2","620","Application Data"
"228","12.340093","192.168.0.183","172.64.155.249","TCP","54","51124  >  443 [ACK] Seq=8077 Ack=126795 Win=514 Len=0"
"229","12.341989","172.64.155.249","192.168.0.183","TCP","1514","443  >  51124 [ACK] Seq=126795 Ack=8077 Win=40 Len=1460 [TCP segment of a reassembled PDU]"
"230","12.341989","172.64.155.249","192.168.0.183","TLSv1.2","929","Application Data"
"231","12.342044","192.168.0.183","172.64.155.249","TCP","54","51124  >  443 [ACK] Seq=8077 Ack=129130 Win=514 Len=0"
"232","12.349929","172.64.155.249","192.168.0.183","TCP","1514","443  >  51124 [ACK] Seq=129130 Ack=8077 Win=40 Len=1460 [TCP segment of a reassembled PDU]"
"233","12.349929","172.64.155.249","192.168.0.183","TLSv1.2","1392","Application Data"
"234","12.349998","192.168.0.183","172.64.155.249","TCP","54","51124  >  443 [ACK] Seq=8077 Ack=131928 Win=514 Len=0"
"235","12.352695","172.64.155.249","192.168.0.183","TCP","1514","443  >  51124 [ACK] Seq=131928 Ack=8077 Win=40 Len=1460 [TCP segment of a reassembled PDU]"
"236","12.352695","172.64.155.249","192.168.0.183","TCP","1514","443  >  51124 [ACK] Seq=133388 Ack=8077 Win=40 Len=1460 [TCP segment of a reassembled PDU]"
"237","12.352695","172.64.155.249","192.168.0.183","TCP","1514","443  >  51124 [ACK] Seq=134848 Ack=8077 Win=40 Len=1460 [TCP segment of a reassembled PDU]"
"238","12.352695","172.64.155.249","192.168.0.183","TCP","1514","443  >  51124 [ACK] Seq=136308 Ack=8077 Win=40 Len=1460 [TCP segment of a reassembled PDU]"
"239","12.352695","172.64.155.249","192.168.0.183","TLSv1.2","588","Application Data"
"240","12.352695","172.64.155.249","192.168.0.183","TCP","1514","443  >  51124 [ACK] Seq=138302 Ack=8077 Win=40 Len=1460 [TCP segment of a reassembled PDU]"
"241","12.352695","172.64.155.249","192.168.0.183","TCP","1514","443  >  51124 [ACK] Seq=139762 Ack=8077 Win=40 Len=1460 [TCP segment of a reassembled PDU]"
"242","12.352695","172.64.155.249","192.168.0.183","TLSv1.2","1346","Application Data"
"243","12.352851","192.168.0.183","172.64.155.249","TCP","54","51124  >  443 [ACK] Seq=8077 Ack=142514 Win=514 Len=0"
"244","12.356269","172.64.155.249","192.168.0.183","TCP","1514","443  >  51124 [ACK] Seq=142514 Ack=8077 Win=40 Len=1460 [TCP segment of a reassembled PDU]"
"245","12.356269","172.64.155.249","192.168.0.183","TCP","1514","443  >  51124 [ACK] Seq=143974 Ack=8077 Win=40 Len=1460 [TCP segment of a reassembled PDU]"
"246","12.356269","172.64.155.249","192.168.0.183","TCP","1514","443  >  51124 [ACK] Seq=145434 Ack=8077 Win=40 Len=1460 [TCP segment of a reassembled PDU]"
"247","12.356269","172.64.155.249","192.168.0.183","TCP","1514","443  >  51124 [ACK] Seq=146894 Ack=8077 Win=40 Len=1460 [TCP segment of a reassembled PDU]"
"248","12.356269","172.64.155.249","192.168.0.183","TCP","1514","443  >  51124 [ACK] Seq=148354 Ack=8077 Win=40 Len=1460 [TCP segment of a reassembled PDU]"
"249","12.356269","172.64.155.249","192.168.0.183","TCP","1514","443  >  51124 [PSH, ACK] Seq=149814 Ack=8077 Win=40 Len=1460 [TCP segment of a reassembled PDU]"
"250","12.356269","172.64.155.249","192.168.0.183","TLSv1.2","603","Application Data"
"251","12.356269","172.64.155.249","192.168.0.183","TLSv1.2","127","Application Data, Application Data"
"252","12.356378","192.168.0.183","172.64.155.249","TCP","54","51124  >  443 [ACK] Seq=8077 Ack=151896 Win=514 Len=0"
"253","12.426762","192.168.0.183","172.64.155.249","TLSv1.2","184","Application Data"
"254","12.478555","172.64.155.249","192.168.0.183","TLSv1.2","473","Application Data"
"255","12.478555","172.64.155.249","192.168.0.183","TLSv1.2","203","Application Data"
"256","12.478555","172.64.155.249","192.168.0.183","TLSv1.2","85","Application Data"
"257","12.478609","192.168.0.183","172.64.155.249","TCP","54","51134  >  443 [ACK] Seq=489 Ack=1840 Win=509 Len=0"
"258","12.480006","192.168.0.183","172.64.155.249","TLSv1.2","89","Application Data"
"259","12.534706","172.64.155.249","192.168.0.183","TCP","60","443  >  51134 [ACK] Seq=1840 Ack=524 Win=8 Len=0"
"260","12.779343","192.168.0.183","172.64.155.249","TLSv1.2","1042","Application Data"
"261","12.779404","192.168.0.183","172.64.155.249","TLSv1.2","556","Application Data"
"262","12.793917","172.64.155.249","192.168.0.183","TCP","60","443  >  51124 [ACK] Seq=151896 Ack=9567 Win=41 Len=0"
"263","12.817931","172.64.155.249","192.168.0.183","TLSv1.2","277","Application Data"
"264","12.817931","172.64.155.249","192.168.0.183","TLSv1.2","85","Application Data"
"265","12.817976","192.168.0.183","172.64.155.249","TCP","54","51124  >  443 [ACK] Seq=9567 Ack=152150 Win=513 Len=0"
"266","16.768784","192.168.0.183","172.64.155.249","TLSv1.2","365","Application Data"
"267","16.768875","192.168.0.183","172.64.155.249","TLSv1.2","596","Application Data"
"268","16.781614","192.168.0.183","172.64.155.249","TLSv1.2","221","Application Data"
"269","16.788923","172.64.155.249","192.168.0.183","TCP","60","443  >  51124 [ACK] Seq=152150 Ack=10420 Win=41 Len=0"
"270","16.806650","172.64.155.249","192.168.0.183","TLSv1.2","277","Application Data"
"271","16.806650","172.64.155.249","192.168.0.183","TLSv1.2","85","Application Data"
"272","16.806692","192.168.0.183","172.64.155.249","TCP","54","51124  >  443 [ACK] Seq=10587 Ack=152404 Win=512 Len=0"
"273","16.848589","172.64.155.249","192.168.0.183","TLSv1.2","162","Application Data"
"274","16.848589","172.64.155.249","192.168.0.183","TLSv1.2","100","Application Data"
"275","16.848589","172.64.155.249","192.168.0.183","TLSv1.2","1308","Application Data"
"276","16.848589","172.64.155.249","192.168.0.183","TCP","1514","443  >  51124 [ACK] Seq=153812 Ack=10587 Win=42 Len=1460 [TCP segment of a reassembled PDU]"
"277","16.848589","172.64.155.249","192.168.0.183","TCP","1514","443  >  51124 [ACK] Seq=155272 Ack=10587 Win=42 Len=1460 [TCP segment of a reassembled PDU]"
"278","16.848589","172.64.155.249","192.168.0.183","TLSv1.2","975","Application Data"
"279","16.848664","192.168.0.183","172.64.155.249","TCP","54","51124  >  443 [ACK] Seq=10587 Ack=157653 Win=514 Len=0"
"280","16.850323","172.64.155.249","192.168.0.183","TLSv1.2","1215","Application Data"
"281","16.850323","172.64.155.249","192.168.0.183","TCP","1514","443  >  51124 [ACK] Seq=158814 Ack=10587 Win=42 Len=1460 [TCP segment of a reassembled PDU]"
"282","16.850323","172.64.155.249","192.168.0.183","TCP","1514","443  >  51124 [ACK] Seq=160274 Ack=10587 Win=42 Len=1460 [TCP segment of a reassembled PDU]"
"283","16.850323","172.64.155.249","192.168.0.183","TLSv1.2","778","Application Data"
"284","16.850323","172.64.155.249","192.168.0.183","TLSv1.2","737","Application Data"
"285","16.850409","192.168.0.183","172.64.155.249","TCP","54","51124  >  443 [ACK] Seq=10587 Ack=163141 Win=514 Len=0"
"286","16.858532","172.64.155.249","192.168.0.183","TCP","1514","443  >  51124 [ACK] Seq=163141 Ack=10587 Win=42 Len=1460 [TCP segment of a reassembled PDU]"
"287","16.858532","172.64.155.249","192.168.0.183","TLSv1.2","929","Application Data"
"288","16.858582","192.168.0.183","172.64.155.249","TCP","54","51124  >  443 [ACK] Seq=10587 Ack=165476 Win=514 Len=0"
"289","16.861534","172.64.155.249","192.168.0.183","TCP","1514","443  >  51124 [ACK] Seq=165476 Ack=10587 Win=42 Len=1460 [TCP segment of a reassembled PDU]"
"290","16.861534","172.64.155.249","192.168.0.183","TCP","1514","443  >  51124 [ACK] Seq=166936 Ack=10587 Win=42 Len=1460 [TCP segment of a reassembled PDU]"
"291","16.861534","172.64.155.249","192.168.0.183","TCP","1514","443  >  51124 [ACK] Seq=168396 Ack=10587 Win=42 Len=1460 [TCP segment of a reassembled PDU]"
"292","16.861534","172.64.155.249","192.168.0.183","TLSv1.2","455","Application Data"
"293","16.861534","172.64.155.249","192.168.0.183","TCP","1514","443  >  51124 [ACK] Seq=170257 Ack=10587 Win=42 Len=1460 [TCP segment of a reassembled PDU]"
"294","16.861534","172.64.155.249","192.168.0.183","TCP","1514","443  >  51124 [ACK] Seq=171717 Ack=10587 Win=42 Len=1460 [TCP segment of a reassembled PDU]"
"295","16.861626","192.168.0.183","172.64.155.249","TCP","54","51124  >  443 [ACK] Seq=10587 Ack=173177 Win=514 Len=0"
"296","16.863597","172.64.155.249","192.168.0.183","TCP","1514","443  >  51124 [ACK] Seq=173177 Ack=10587 Win=42 Len=1460 [TCP segment of a reassembled PDU]"
"297","16.863597","172.64.155.249","192.168.0.183","TCP","1514","443  >  51124 [ACK] Seq=174637 Ack=10587 Win=42 Len=1460 [TCP segment of a reassembled PDU]"
"298","16.863597","172.64.155.249","192.168.0.183","TCP","1514","443  >  51124 [ACK] Seq=176097 Ack=10587 Win=42 Len=1460 [TCP segment of a reassembled PDU]"
"299","16.863597","172.64.155.249","192.168.0.183","TLSv1.2","725","Application Data"
"300","16.863597","172.64.155.249","192.168.0.183","TCP","1514","443  >  51124 [ACK] Seq=178228 Ack=10587 Win=42 Len=1460 [TCP segment of a reassembled PDU]"
"301","16.863597","172.64.155.249","192.168.0.183","TCP","1514","443  >  51124 [ACK] Seq=179688 Ack=10587 Win=42 Len=1460 [TCP segment of a reassembled PDU]"
"302","16.863597","172.64.155.249","192.168.0.183","TCP","1514","443  >  51124 [ACK] Seq=181148 Ack=10587 Win=42 Len=1460 [TCP segment of a reassembled PDU]"
"303","16.863597","172.64.155.249","192.168.0.183","TCP","1514","443  >  51124 [ACK] Seq=182608 Ack=10587 Win=42 Len=1460 [TCP segment of a reassembled PDU]"
"304","16.863597","172.64.155.249","192.168.0.183","TLSv1.2","584","Application Data"
"305","16.863725","192.168.0.183","172.64.155.249","TCP","54","51124  >  443 [ACK] Seq=10587 Ack=184598 Win=514 Len=0"
"306","16.869223","172.64.155.249","192.168.0.183","TCP","1514","443  >  51124 [ACK] Seq=184598 Ack=10587 Win=42 Len=1460 [TCP segment of a reassembled PDU]"
"307","16.869223","172.64.155.249","192.168.0.183","TCP","1514","443  >  51124 [ACK] Seq=186058 Ack=10587 Win=42 Len=1460 [TCP segment of a reassembled PDU]"
"308","16.869223","172.64.155.249","192.168.0.183","TCP","1514","443  >  51124 [ACK] Seq=187518 Ack=10587 Win=42 Len=1460 [TCP segment of a reassembled PDU]"
"309","16.869223","172.64.155.249","192.168.0.183","TCP","1514","443  >  51124 [ACK] Seq=188978 Ack=10587 Win=42 Len=1460 [TCP segment of a reassembled PDU]"
"310","16.869223","172.64.155.249","192.168.0.183","TLSv1.2","1153","Application Data"
"311","16.869333","192.168.0.183","172.64.155.249","TCP","54","51124  >  443 [ACK] Seq=10587 Ack=191537 Win=514 Len=0"
"312","16.879789","172.64.155.249","192.168.0.183","TCP","1514","443  >  51124 [ACK] Seq=191537 Ack=10587 Win=42 Len=1460 [TCP segment of a reassembled PDU]"
"313","16.879789","172.64.155.249","192.168.0.183","TCP","1514","443  >  51124 [ACK] Seq=192997 Ack=10587 Win=42 Len=1460 [TCP segment of a reassembled PDU]"
"314","16.879789","172.64.155.249","192.168.0.183","TCP","1514","443  >  51124 [ACK] Seq=194457 Ack=10587 Win=42 Len=1460 [TCP segment of a reassembled PDU]"
"315","16.879789","172.64.155.249","192.168.0.183","TLSv1.2","447","Application Data"
"316","16.879789","172.64.155.249","192.168.0.183","TLSv1.2","85","Application Data"
"317","16.879857","192.168.0.183","172.64.155.249","TCP","54","51124  >  443 [ACK] Seq=10587 Ack=196341 Win=514 Len=0"
"318","16.973281","192.168.0.183","172.64.155.249","TLSv1.2","319","Application Data"
"319","16.973516","192.168.0.183","172.64.155.249","TLSv1.2","245","Application Data"
"320","16.992803","172.64.155.249","192.168.0.183","TCP","60","443  >  51134 [ACK] Seq=1840 Ack=715 Win=8 Len=0"
"321","17.015700","172.64.155.249","192.168.0.183","TLSv1.2","670","Application Data"
"322","17.015700","172.64.155.249","192.168.0.183","TLSv1.2","203","Application Data"
"323","17.015700","172.64.155.249","192.168.0.183","TLSv1.2","85","Application Data"
"324","17.016069","192.168.0.183","172.64.155.249","TCP","54","51134  >  443 [ACK] Seq=715 Ack=2636 Win=514 Len=0"
"325","17.019479","172.64.155.249","192.168.0.183","TLSv1.2","156","Application Data"
"326","17.019479","172.64.155.249","192.168.0.183","TLSv1.2","120","Application Data"
"327","17.019479","172.64.155.249","192.168.0.183","TLSv1.2","85","Application Data"
"328","17.019592","192.168.0.183","172.64.155.249","TCP","54","51124  >  443 [ACK] Seq=10852 Ack=196540 Win=513 Len=0"
"329","17.023197","192.168.0.183","172.64.155.249","TLSv1.2","89","Application Data"
"330","17.077606","172.64.155.249","192.168.0.183","TCP","60","443  >  51124 [ACK] Seq=196540 Ack=10887 Win=42 Len=0"
"331","17.174938","192.168.0.183","172.64.155.249","TLSv1.2","203","Application Data"
"332","17.189051","172.64.155.249","192.168.0.183","TCP","60","443  >  51124 [ACK] Seq=196540 Ack=11036 Win=42 Len=0"
"333","17.212210","172.64.155.249","192.168.0.183","TLSv1.2","145","Application Data"
"334","17.260013","192.168.0.183","172.64.155.249","TCP","54","51124  >  443 [ACK] Seq=11036 Ack=196631 Win=512 Len=0"
"335","17.404715","192.168.0.183","172.64.155.249","TLSv1.2","448","Application Data"
"336","17.404777","192.168.0.183","172.64.155.249","TLSv1.2","618","Application Data"
"337","17.425707","172.64.155.249","192.168.0.183","TCP","60","443  >  51124 [ACK] Seq=196631 Ack=11994 Win=43 Len=0"
"338","17.442661","172.64.155.249","192.168.0.183","TLSv1.2","297","Application Data"
"339","17.442661","172.64.155.249","192.168.0.183","TLSv1.2","85","Application Data"
"340","17.442702","192.168.0.183","172.64.155.249","TCP","54","51124  >  443 [ACK] Seq=11994 Ack=196905 Win=511 Len=0"
"341","19.602292","192.168.0.183","172.64.155.249","TLSv1.2","231","Application Data"
"342","19.602384","192.168.0.183","172.64.155.249","TLSv1.2","275","Application Data"
"343","19.621058","192.168.0.183","172.64.155.249","TLSv1.2","351","Application Data"
"344","19.632224","172.64.155.249","192.168.0.183","TCP","60","443  >  51124 [ACK] Seq=196905 Ack=12392 Win=44 Len=0"
"345","19.639210","172.64.155.249","192.168.0.183","TLSv1.2","278","Application Data"
"346","19.670387","172.64.155.249","192.168.0.183","TLSv1.2","171","Application Data"
"347","19.670387","172.64.155.249","192.168.0.183","TLSv1.2","100","Application Data"
"348","19.670387","172.64.155.249","192.168.0.183","TLSv1.2","1311","Application Data"
"349","19.670432","192.168.0.183","172.64.155.249","TCP","54","51124  >  443 [ACK] Seq=12689 Ack=198549 Win=514 Len=0"
"350","19.672532","172.64.155.249","192.168.0.183","TCP","1514","443  >  51124 [ACK] Seq=198549 Ack=12689 Win=44 Len=1460 [TCP segment of a reassembled PDU]"
"351","19.672532","172.64.155.249","192.168.0.183","TCP","1514","443  >  51124 [ACK] Seq=200009 Ack=12689 Win=44 Len=1460 [TCP segment of a reassembled PDU]"
"352","19.672532","172.64.155.249","192.168.0.183","TCP","1514","443  >  51124 [ACK] Seq=201469 Ack=12689 Win=44 Len=1460 [TCP segment of a reassembled PDU]"
"353","19.672532","172.64.155.249","192.168.0.183","TCP","1514","443  >  51124 [ACK] Seq=202929 Ack=12689 Win=44 Len=1460 [TCP segment of a reassembled PDU]"
"354","19.672532","172.64.155.249","192.168.0.183","TLSv1.2","467","Application Data"
"355","19.672532","172.64.155.249","192.168.0.183","TCP","1514","443  >  51124 [ACK] Seq=204802 Ack=12689 Win=44 Len=1460 [TCP segment of a reassembled PDU]"
"356","19.672532","172.64.155.249","192.168.0.183","TLSv1.2","1487","Application Data"
"357","19.672634","192.168.0.183","172.64.155.249","TCP","54","51124  >  443 [ACK] Seq=12689 Ack=207695 Win=514 Len=0"
"358","19.680155","172.64.155.249","192.168.0.183","TCP","1514","443  >  51124 [ACK] Seq=207695 Ack=12689 Win=44 Len=1460 [TCP segment of a reassembled PDU]"
"359","19.680155","172.64.155.249","192.168.0.183","TLSv1.2","1044","Application Data"
"360","19.680210","192.168.0.183","172.64.155.249","TCP","54","51124  >  443 [ACK] Seq=12689 Ack=210145 Win=514 Len=0"
"361","19.689296","172.64.155.249","192.168.0.183","TCP","1514","443  >  51124 [ACK] Seq=210145 Ack=12689 Win=44 Len=1460 [TCP segment of a reassembled PDU]"
"362","19.689296","172.64.155.249","192.168.0.183","TCP","1514","443  >  51124 [ACK] Seq=211605 Ack=12689 Win=44 Len=1460 [TCP segment of a reassembled PDU]"
"363","19.689296","172.64.155.249","192.168.0.183","TCP","1514","443  >  51124 [ACK] Seq=213065 Ack=12689 Win=44 Len=1460 [TCP segment of a reassembled PDU]"
"364","19.689296","172.64.155.249","192.168.0.183","TCP","1514","443  >  51124 [ACK] Seq=214525 Ack=12689 Win=44 Len=1460 [TCP segment of a reassembled PDU]"
"365","19.689296","172.64.155.249","192.168.0.183","TCP","1514","443  >  51124 [ACK] Seq=215985 Ack=12689 Win=44 Len=1460 [TCP segment of a reassembled PDU]"
"366","19.689296","172.64.155.249","192.168.0.183","TCP","1514","443  >  51124 [PSH, ACK] Seq=217445 Ack=12689 Win=44 Len=1460 [TCP segment of a reassembled PDU]"
"367","19.689296","172.64.155.249","192.168.0.183","TLSv1.2","420","Application Data"
"368","19.689296","172.64.155.249","192.168.0.183","TCP","1514","443  >  51124 [ACK] Seq=219271 Ack=12689 Win=44 Len=1460 [TCP segment of a reassembled PDU]"
"369","19.689387","192.168.0.183","172.64.155.249","TCP","54","51124  >  443 [ACK] Seq=12689 Ack=220731 Win=514 Len=0"
"370","19.689471","172.64.155.249","192.168.0.183","TCP","1514","443  >  51124 [ACK] Seq=220731 Ack=12689 Win=44 Len=1460 [TCP segment of a reassembled PDU]"
"371","19.689471","172.64.155.249","192.168.0.183","TCP","1514","443  >  51124 [ACK] Seq=222191 Ack=12689 Win=44 Len=1460 [TCP segment of a reassembled PDU]"
"372","19.689471","172.64.155.249","192.168.0.183","TLSv1.2","1232","Application Data"
"373","19.689471","172.64.155.249","192.168.0.183","TCP","1514","443  >  51124 [ACK] Seq=224829 Ack=12689 Win=44 Len=1460 [TCP segment of a reassembled PDU]"
"374","19.689471","172.64.155.249","192.168.0.183","TCP","1514","443  >  51124 [ACK] Seq=226289 Ack=12689 Win=44 Len=1460 [TCP segment of a reassembled PDU]"
"375","19.689510","192.168.0.183","172.64.155.249","TCP","54","51124  >  443 [ACK] Seq=12689 Ack=227749 Win=514 Len=0"
"376","19.689654","172.64.155.249","192.168.0.183","TCP","1514","443  >  51124 [ACK] Seq=227749 Ack=12689 Win=44 Len=1460 [TCP segment of a reassembled PDU]"
"377","19.689654","172.64.155.249","192.168.0.183","TLSv1.2","916","Application Data"
"378","19.689654","172.64.155.249","192.168.0.183","TCP","1514","443  >  51124 [ACK] Seq=230071 Ack=12689 Win=44 Len=1460 [TCP segment of a reassembled PDU]"
"379","19.689654","172.64.155.249","192.168.0.183","TLSv1.2","1112","Application Data"
"380","19.689687","192.168.0.183","172.64.155.249","TCP","54","51124  >  443 [ACK] Seq=12689 Ack=232589 Win=514 Len=0"
"381","19.694644","172.64.155.249","192.168.0.183","TCP","1514","443  >  51124 [ACK] Seq=232589 Ack=12689 Win=44 Len=1460 [TCP segment of a reassembled PDU]"
"382","19.694644","172.64.155.249","192.168.0.183","TCP","1514","443  >  51124 [ACK] Seq=234049 Ack=12689 Win=44 Len=1460 [TCP segment of a reassembled PDU]"
"383","19.694644","172.64.155.249","192.168.0.183","TLSv1.2","746","Application Data"
"384","19.694644","172.64.155.249","192.168.0.183","TCP","1514","443  >  51124 [ACK] Seq=236201 Ack=12689 Win=44 Len=1460 [TCP segment of a reassembled PDU]"
"385","19.694644","172.64.155.249","192.168.0.183","TCP","1514","443  >  51124 [ACK] Seq=237661 Ack=12689 Win=44 Len=1460 [TCP segment of a reassembled PDU]"
"386","19.694644","172.64.155.249","192.168.0.183","TCP","1514","443  >  51124 [ACK] Seq=239121 Ack=12689 Win=44 Len=1460 [TCP segment of a reassembled PDU]"
"387","19.694644","172.64.155.249","192.168.0.183","TLSv1.2","60","Application Data"
"388","19.694644","172.64.155.249","192.168.0.183","TLSv1.2","96","Application Data"
"389","19.694644","172.64.155.249","192.168.0.183","TLSv1.2","85","Application Data"
"390","19.694738","192.168.0.183","172.64.155.249","TCP","54","51124  >  443 [ACK] Seq=12689 Ack=240655 Win=514 Len=0"
"391","19.764906","192.168.0.183","172.64.155.249","TLSv1.2","252","Application Data"
"392","19.807286","172.64.155.249","192.168.0.183","TLSv1.2","473","Application Data"
"393","19.807286","172.64.155.249","192.168.0.183","TLSv1.2","203","Application Data"
"394","19.807286","172.64.155.249","192.168.0.183","TLSv1.2","85","Application Data"
"395","19.807334","192.168.0.183","172.64.155.249","TCP","54","51134  >  443 [ACK] Seq=913 Ack=3235 Win=511 Len=0"
"396","19.808235","192.168.0.183","172.64.155.249","TLSv1.2","89","Application Data"
"397","19.866368","172.64.155.249","192.168.0.183","TCP","60","443  >  51134 [ACK] Seq=3235 Ack=948 Win=8 Len=0"
"398","19.989404","192.168.0.183","172.64.155.249","TLSv1.2","758","Application Data"
"399","20.042810","172.64.155.249","192.168.0.183","TCP","60","443  >  51124 [ACK] Seq=240655 Ack=13393 Win=44 Len=0"
"400","20.201779","192.168.0.183","172.64.155.249","TLSv1.2","497","Application Data"
"401","20.201861","192.168.0.183","172.64.155.249","TLSv1.2","617","Application Data"
"402","20.215998","172.64.155.249","192.168.0.183","TCP","60","443  >  51124 [ACK] Seq=240655 Ack=14399 Win=45 Len=0"
"403","20.240992","172.64.155.249","192.168.0.183","TLSv1.2","145","Application Data"
"404","20.240992","172.64.155.249","192.168.0.183","TLSv1.2","85","Application Data"
"405","20.241046","192.168.0.183","172.64.155.249","TCP","54","51124  >  443 [ACK] Seq=14399 Ack=240777 Win=513 Len=0"
"406","21.640695","172.64.155.249","192.168.0.183","TLSv1.2","313","Application Data"
"407","21.685056","192.168.0.183","172.64.155.249","TCP","54","51124  >  443 [ACK] Seq=14399 Ack=241036 Win=512 Len=0"
"408","22.213990","192.168.0.183","172.64.155.249","TLSv1.2","195","Application Data"
"409","22.268610","172.64.155.249","192.168.0.183","TCP","60","443  >  51124 [ACK] Seq=241036 Ack=14540 Win=45 Len=0"
"410","22.506220","172.64.155.249","192.168.0.183","TLSv1.2","437","Application Data"
"411","22.506220","172.64.155.249","192.168.0.183","TLSv1.2","100","Application Data"
"412","22.506220","172.64.155.249","192.168.0.183","TLSv1.2","1277","Application Data"
"413","22.506220","172.64.155.249","192.168.0.183","TCP","1514","443  >  51124 [ACK] Seq=242688 Ack=14540 Win=45 Len=1460 [TCP segment of a reassembled PDU]"
"414","22.506220","172.64.155.249","192.168.0.183","TLSv1.2","1177","Application Data"
"415","22.506270","192.168.0.183","172.64.155.249","TCP","54","51124  >  443 [ACK] Seq=14540 Ack=245271 Win=514 Len=0"
"416","22.507335","192.168.0.183","172.64.155.249","TLSv1.2","89","Application Data"
"417","22.507949","172.64.155.249","192.168.0.183","TCP","1514","443  >  51124 [ACK] Seq=245271 Ack=14540 Win=45 Len=1460 [TCP segment of a reassembled PDU]"
"418","22.507949","172.64.155.249","192.168.0.183","TCP","1514","443  >  51124 [ACK] Seq=246731 Ack=14540 Win=45 Len=1460 [TCP segment of a reassembled PDU]"
"419","22.507949","172.64.155.249","192.168.0.183","TLSv1.2","670","Application Data"
"420","22.507975","192.168.0.183","172.64.155.249","TCP","54","51124  >  443 [ACK] Seq=14575 Ack=248807 Win=514 Len=0"
"421","22.517796","172.64.155.249","192.168.0.183","TCP","1514","443  >  51124 [ACK] Seq=248807 Ack=14540 Win=45 Len=1460 [TCP segment of a reassembled PDU]"
"422","22.517796","172.64.155.249","192.168.0.183","TCP","1514","443  >  51124 [ACK] Seq=250267 Ack=14540 Win=45 Len=1460 [TCP segment of a reassembled PDU]"
"423","22.517796","172.64.155.249","192.168.0.183","TCP","1514","443  >  51124 [ACK] Seq=251727 Ack=14540 Win=45 Len=1460 [TCP segment of a reassembled PDU]"
"424","22.517796","172.64.155.249","192.168.0.183","TLSv1.2","562","Application Data"
"425","22.517796","172.64.155.249","192.168.0.183","TLSv1.2","572","Application Data"
"426","22.517796","172.64.155.249","192.168.0.183","TLSv1.2","1259","Application Data"
"427","22.517796","172.64.155.249","192.168.0.183","TLSv1.2","1413","Application Data"
"428","22.517882","192.168.0.183","172.64.155.249","TCP","54","51124  >  443 [ACK] Seq=14575 Ack=256777 Win=514 Len=0"
"429","22.519836","172.64.155.249","192.168.0.183","TCP","1514","443  >  51124 [ACK] Seq=256777 Ack=14540 Win=45 Len=1460 [TCP segment of a reassembled PDU]"
"430","22.519836","172.64.155.249","192.168.0.183","TCP","1514","443  >  51124 [ACK] Seq=258237 Ack=14540 Win=45 Len=1460 [TCP segment of a reassembled PDU]"
"431","22.519836","172.64.155.249","192.168.0.183","TCP","1514","443  >  51124 [ACK] Seq=259697 Ack=14540 Win=45 Len=1460 [TCP segment of a reassembled PDU]"
"432","22.519836","172.64.155.249","192.168.0.183","TLSv1.2","1393","Application Data"
"433","22.519884","192.168.0.183","172.64.155.249","TCP","54","51124  >  443 [ACK] Seq=14575 Ack=262496 Win=514 Len=0"
"434","22.521493","172.64.155.249","192.168.0.183","TCP","60","443  >  51124 [ACK] Seq=262496 Ack=14575 Win=45 Len=0"
"435","22.521493","172.64.155.249","192.168.0.183","TCP","1514","443  >  51124 [ACK] Seq=262496 Ack=14575 Win=45 Len=1460 [TCP segment of a reassembled PDU]"
"436","22.521493","172.64.155.249","192.168.0.183","TCP","1514","443  >  51124 [ACK] Seq=263956 Ack=14575 Win=45 Len=1460 [TCP segment of a reassembled PDU]"
"437","22.521493","172.64.155.249","192.168.0.183","TLSv1.2","1027","Application Data"
"438","22.521493","172.64.155.249","192.168.0.183","TLSv1.2","96","Application Data"
"439","22.521493","172.64.155.249","192.168.0.183","TLSv1.2","85","Application Data"
"440","22.521546","192.168.0.183","172.64.155.249","TCP","54","51124  >  443 [ACK] Seq=14575 Ack=266462 Win=514 Len=0"
"441","22.809268","192.168.0.183","172.64.155.249","TLSv1.2","203","Application Data"
"442","22.809457","192.168.0.183","172.64.155.249","TLSv1.2","178","Application Data"
"443","22.821939","172.64.155.249","192.168.0.183","TCP","60","443  >  51124 [ACK] Seq=266462 Ack=14848 Win=46 Len=0"
"444","22.845757","172.64.155.249","192.168.0.183","TLSv1.2","154","Application Data"
"445","22.845757","172.64.155.249","192.168.0.183","TLSv1.2","226","Application Data"
"446","22.845757","172.64.155.249","192.168.0.183","TLSv1.2","85","Application Data"
"447","22.845757","172.64.155.249","192.168.0.183","TLSv1.2","144","Application Data"
"448","22.845812","192.168.0.183","172.64.155.249","TCP","54","51124  >  443 [ACK] Seq=14848 Ack=266855 Win=512 Len=0"
"449","22.926755","192.168.0.183","172.64.155.249","TLSv1.2","515","Application Data"
"450","22.926805","192.168.0.183","172.64.155.249","TLSv1.2","543","Application Data"
"451","22.943980","172.64.155.249","192.168.0.183","TCP","60","443  >  51124 [ACK] Seq=266855 Ack=15798 Win=46 Len=0"
"452","22.966614","172.64.155.249","192.168.0.183","TLSv1.2","145","Application Data"
"453","22.966614","172.64.155.249","192.168.0.183","TLSv1.2","85","Application Data"
"454","22.966673","192.168.0.183","172.64.155.249","TCP","54","51124  >  443 [ACK] Seq=15798 Ack=266977 Win=512 Len=0"
"455","26.625054","192.168.0.183","172.64.155.249","TLSv1.2","133","Application Data"
"456","26.625159","192.168.0.183","172.64.155.249","TLSv1.2","170","Application Data"
"457","26.638526","192.168.0.183","172.64.155.249","TLSv1.2","159","Application Data"
"458","26.638841","172.64.155.249","192.168.0.183","TCP","60","443  >  51124 [ACK] Seq=266977 Ack=15993 Win=46 Len=0"
"459","26.663458","172.64.155.249","192.168.0.183","TLSv1.2","279","Application Data"
"460","26.717032","192.168.0.183","172.64.155.249","TCP","54","51124  >  443 [ACK] Seq=16098 Ack=267202 Win=511 Len=0"
"461","26.848918","172.64.155.249","192.168.0.183","TLSv1.2","145","Application Data"
"462","26.848918","172.64.155.249","192.168.0.183","TLSv1.2","100","Application Data"
"463","26.848918","172.64.155.249","192.168.0.183","TLSv1.2","1329","Application Data"
"464","26.848969","192.168.0.183","172.64.155.249","TCP","54","51124  >  443 [ACK] Seq=16098 Ack=268614 Win=514 Len=0"
"465","26.851573","172.64.155.249","192.168.0.183","TCP","1514","443  >  51124 [ACK] Seq=268614 Ack=16098 Win=46 Len=1460 [TCP segment of a reassembled PDU]"
"466","26.851573","172.64.155.249","192.168.0.183","TCP","1514","443  >  51124 [ACK] Seq=270074 Ack=16098 Win=46 Len=1460 [TCP segment of a reassembled PDU]"
"467","26.851573","172.64.155.249","192.168.0.183","TCP","1514","443  >  51124 [ACK] Seq=271534 Ack=16098 Win=46 Len=1460 [TCP segment of a reassembled PDU]"
"468","26.851573","172.64.155.249","192.168.0.183","TLSv1.2","605","Application Data"
"469","26.851573","172.64.155.249","192.168.0.183","TCP","1514","443  >  51124 [ACK] Seq=273545 Ack=16098 Win=46 Len=1460 [TCP segment of a reassembled PDU]"
"470","26.851573","172.64.155.249","192.168.0.183","TCP","1514","443  >  51124 [ACK] Seq=275005 Ack=16098 Win=46 Len=1460 [TCP segment of a reassembled PDU]"
"471","26.851573","172.64.155.249","192.168.0.183","TCP","1514","443  >  51124 [ACK] Seq=276465 Ack=16098 Win=46 Len=1460 [TCP segment of a reassembled PDU]"
"472","26.851573","172.64.155.249","192.168.0.183","TLSv1.2","454","Application Data"
"473","26.851708","192.168.0.183","172.64.155.249","TCP","54","51124  >  443 [ACK] Seq=16098 Ack=278325 Win=514 Len=0"
"474","26.860050","172.64.155.249","192.168.0.183","TCP","1514","443  >  51124 [ACK] Seq=278325 Ack=16098 Win=46 Len=1460 [TCP segment of a reassembled PDU]"
"475","26.860050","172.64.155.249","192.168.0.183","TLSv1.2","269","Application Data"
"476","26.860092","192.168.0.183","172.64.155.249","TCP","54","51124  >  443 [ACK] Seq=16098 Ack=280000 Win=514 Len=0"
"477","26.864562","172.64.155.249","192.168.0.183","TCP","1514","443  >  51124 [ACK] Seq=280000 Ack=16098 Win=46 Len=1460 [TCP segment of a reassembled PDU]"
"478","26.864562","172.64.155.249","192.168.0.183","TCP","1514","443  >  51124 [ACK] Seq=281460 Ack=16098 Win=46 Len=1460 [TCP segment of a reassembled PDU]"
"479","26.864562","172.64.155.249","192.168.0.183","TCP","1514","443  >  51124 [ACK] Seq=282920 Ack=16098 Win=46 Len=1460 [TCP segment of a reassembled PDU]"
"480","26.864562","172.64.155.249","192.168.0.183","TLSv1.2","1183","Application Data"
"481","26.864659","192.168.0.183","172.64.155.249","TCP","54","51124  >  443 [ACK] Seq=16098 Ack=285509 Win=514 Len=0"
"482","26.864906","172.64.155.249","192.168.0.183","TCP","1514","443  >  51124 [ACK] Seq=285509 Ack=16098 Win=46 Len=1460 [TCP segment of a reassembled PDU]"
"483","26.864906","172.64.155.249","192.168.0.183","TCP","1514","443  >  51124 [ACK] Seq=286969 Ack=16098 Win=46 Len=1460 [TCP segment of a reassembled PDU]"
"484","26.864906","172.64.155.249","192.168.0.183","TCP","1514","443  >  51124 [ACK] Seq=288429 Ack=16098 Win=46 Len=1460 [TCP segment of a reassembled PDU]"
"485","26.864906","172.64.155.249","192.168.0.183","TCP","1514","443  >  51124 [ACK] Seq=289889 Ack=16098 Win=46 Len=1460 [TCP segment of a reassembled PDU]"
"486","26.864906","172.64.155.249","192.168.0.183","TCP","1514","443  >  51124 [ACK] Seq=291349 Ack=16098 Win=46 Len=1460 [TCP segment of a reassembled PDU]"
"487","26.864906","172.64.155.249","192.168.0.183","TCP","1514","443  >  51124 [PSH, ACK] Seq=292809 Ack=16098 Win=46 Len=1460 [TCP segment of a reassembled PDU]"
"488","26.864906","172.64.155.249","192.168.0.183","TCP","1514","443  >  51124 [ACK] Seq=294269 Ack=16098 Win=46 Len=1460 [TCP segment of a reassembled PDU]"
"489","26.864906","172.64.155.249","192.168.0.183","TCP","1514","443  >  51124 [ACK] Seq=295729 Ack=16098 Win=46 Len=1460 [TCP segment of a reassembled PDU]"
"490","26.864906","172.64.155.249","192.168.0.183","TCP","1514","443  >  51124 [ACK] Seq=297189 Ack=16098 Win=46 Len=1460 [TCP segment of a reassembled PDU]"
"491","26.864906","172.64.155.249","192.168.0.183","TLSv1.2","1132","Application Data"
"492","26.864906","172.64.155.249","192.168.0.183","TCP","1514","443  >  51124 [ACK] Seq=299727 Ack=16098 Win=46 Len=1460 [TCP segment of a reassembled PDU]"
"493","26.864906","172.64.155.249","192.168.0.183","TLSv1.2","1073","Application Data"
"494","26.864906","172.64.155.249","192.168.0.183","TLSv1.2","127","Application Data, Application Data"
"495","26.865059","192.168.0.183","172.64.155.249","TCP","54","51124  >  443 [ACK] Seq=16098 Ack=302279 Win=514 Len=0"
"496","26.908793","172.64.155.249","192.168.0.183","TCP","127","[TCP Spurious Retransmission] 443  >  51124 [PSH, ACK] Seq=302206 Ack=16098 Win=46 Len=73"
"497","26.908829","192.168.0.183","172.64.155.249","TCP","66","[TCP Dup ACK 495#1] 51124  >  443 [ACK] Seq=16098 Ack=302279 Win=514 Len=0 SLE=302206 SRE=302279"
"498","26.929459","192.168.0.183","172.64.155.249","TLSv1.2","184","Application Data"
"499","26.944206","172.64.155.249","192.168.0.183","TCP","60","443  >  51134 [ACK] Seq=3235 Ack=1078 Win=8 Len=0"
"500","26.968504","172.64.155.249","192.168.0.183","TLSv1.2","476","Application Data"
"501","26.968504","172.64.155.249","192.168.0.183","TLSv1.2","203","Application Data"
"502","26.968504","172.64.155.249","192.168.0.183","TLSv1.2","85","Application Data"
"503","26.968549","192.168.0.183","172.64.155.249","TCP","54","51134  >  443 [ACK] Seq=1078 Ack=3837 Win=509 Len=0"
"504","26.969391","192.168.0.183","172.64.155.249","TLSv1.2","89","Application Data"
"505","27.033291","172.64.155.249","192.168.0.183","TCP","60","443  >  51134 [ACK] Seq=3837 Ack=1113 Win=8 Len=0"
"506","27.362148","192.168.0.183","172.64.155.249","TLSv1.2","541","Application Data"
"507","27.362225","192.168.0.183","172.64.155.249","TLSv1.2","557","Application Data"
"508","27.378344","172.64.155.249","192.168.0.183","TCP","60","443  >  51124 [ACK] Seq=302279 Ack=17088 Win=47 Len=0"
"509","27.402128","172.64.155.249","192.168.0.183","TLSv1.2","278","Application Data"
"510","27.402128","172.64.155.249","192.168.0.183","TLSv1.2","85","Application Data"
"511","27.402188","192.168.0.183","172.64.155.249","TCP","54","51124  >  443 [ACK] Seq=17088 Ack=302534 Win=513 Len=0"
"512","28.841180","192.168.0.183","172.64.155.249","TLSv1.2","789","Application Data"
"513","28.841273","192.168.0.183","172.64.155.249","TLSv1.2","597","Application Data"
"514","28.856307","172.64.155.249","192.168.0.183","TCP","60","443  >  51124 [ACK] Seq=302534 Ack=18366 Win=48 Len=0"
"515","28.859955","192.168.0.183","172.64.155.249","TLSv1.2","373","Application Data"
"516","28.877900","172.64.155.249","192.168.0.183","TLSv1.2","278","Application Data"
"517","28.877900","172.64.155.249","192.168.0.183","TLSv1.2","85","Application Data"
"518","28.877936","192.168.0.183","172.64.155.249","TCP","54","51124  >  443 [ACK] Seq=18685 Ack=302789 Win=512 Len=0"
"519","28.907739","172.64.155.249","192.168.0.183","TLSv1.2","162","Application Data"
"520","28.907739","172.64.155.249","192.168.0.183","TLSv1.2","100","Application Data"
"521","28.907739","172.64.155.249","192.168.0.183","TCP","1514","443  >  51124 [ACK] Seq=302943 Ack=18685 Win=48 Len=1460 [TCP segment of a reassembled PDU]"
"522","28.907739","172.64.155.249","192.168.0.183","TCP","1514","443  >  51124 [ACK] Seq=304403 Ack=18685 Win=48 Len=1460 [TCP segment of a reassembled PDU]"
"523","28.907739","172.64.155.249","192.168.0.183","TLSv1.2","941","Application Data"
"524","28.907785","192.168.0.183","172.64.155.249","TCP","54","51124  >  443 [ACK] Seq=18685 Ack=306750 Win=514 Len=0"
"525","28.908687","192.168.0.183","172.64.155.249","TLSv1.2","89","Application Data"
"526","28.909974","172.64.155.249","192.168.0.183","TCP","1514","443  >  51124 [ACK] Seq=306750 Ack=18685 Win=48 Len=1460 [TCP segment of a reassembled PDU]"
"527","28.909974","172.64.155.249","192.168.0.183","TCP","1514","443  >  51124 [ACK] Seq=308210 Ack=18685 Win=48 Len=1460 [TCP segment of a reassembled PDU]"
"528","28.909974","172.64.155.249","192.168.0.183","TCP","1514","443  >  51124 [ACK] Seq=309670 Ack=18685 Win=48 Len=1460 [TCP segment of a reassembled PDU]"
"529","28.909974","172.64.155.249","192.168.0.183","TCP","1514","443  >  51124 [ACK] Seq=311130 Ack=18685 Win=48 Len=1460 [TCP segment of a reassembled PDU]"
"530","28.909974","172.64.155.249","192.168.0.183","TLSv1.2","193","Application Data"
"531","28.909974","172.64.155.249","192.168.0.183","TLSv1.2","737","Application Data"
"532","28.910056","192.168.0.183","172.64.155.249","TCP","54","51124  >  443 [ACK] Seq=18720 Ack=313412 Win=514 Len=0"
"533","28.917392","172.64.155.249","192.168.0.183","TCP","1514","443  >  51124 [ACK] Seq=313412 Ack=18685 Win=48 Len=1460 [TCP segment of a reassembled PDU]"
"534","28.917392","172.64.155.249","192.168.0.183","TLSv1.2","898","Application Data"
"535","28.917479","192.168.0.183","172.64.155.249","TCP","54","51124  >  443 [ACK] Seq=18720 Ack=315716 Win=514 Len=0"
"536","28.924164","172.64.155.249","192.168.0.183","TCP","1514","443  >  51124 [ACK] Seq=315716 Ack=18685 Win=48 Len=1460 [TCP segment of a reassembled PDU]"
"537","28.924164","172.64.155.249","192.168.0.183","TCP","1514","443  >  51124 [ACK] Seq=317176 Ack=18685 Win=48 Len=1460 [TCP segment of a reassembled PDU]"
"538","28.924164","172.64.155.249","192.168.0.183","TCP","1514","443  >  51124 [ACK] Seq=318636 Ack=18685 Win=48 Len=1460 [TCP segment of a reassembled PDU]"
"539","28.924164","172.64.155.249","192.168.0.183","TLSv1.2","510","Application Data"
"540","28.924164","172.64.155.249","192.168.0.183","TCP","1514","443  >  51124 [ACK] Seq=320552 Ack=18720 Win=48 Len=1460 [TCP segment of a reassembled PDU]"
"541","28.924164","172.64.155.249","192.168.0.183","TCP","1514","443  >  51124 [ACK] Seq=322012 Ack=18720 Win=48 Len=1460 [TCP segment of a reassembled PDU]"
"542","28.924164","172.64.155.249","192.168.0.183","TCP","1514","443  >  51124 [ACK] Seq=323472 Ack=18720 Win=48 Len=1460 [TCP segment of a reassembled PDU]"
"543","28.924164","172.64.155.249","192.168.0.183","TCP","1514","443  >  51124 [ACK] Seq=324932 Ack=18720 Win=48 Len=1460 [TCP segment of a reassembled PDU]"
"544","28.924164","172.64.155.249","192.168.0.183","TCP","1514","443  >  51124 [ACK] Seq=326392 Ack=18720 Win=48 Len=1460 [TCP segment of a reassembled PDU]"
"545","28.924164","172.64.155.249","192.168.0.183","TCP","1514","443  >  51124 [PSH, ACK] Seq=327852 Ack=18720 Win=48 Len=1460 [TCP segment of a reassembled PDU]"
"546","28.924164","172.64.155.249","192.168.0.183","TCP","1514","443  >  51124 [ACK] Seq=329312 Ack=18720 Win=48 Len=1460 [TCP segment of a reassembled PDU]"
"547","28.924164","172.64.155.249","192.168.0.183","TCP","1514","443  >  51124 [ACK] Seq=330772 Ack=18720 Win=48 Len=1460 [TCP segment of a reassembled PDU]"
"548","28.924164","172.64.155.249","192.168.0.183","TCP","1514","443  >  51124 [ACK] Seq=332232 Ack=18720 Win=48 Len=1460 [TCP segment of a reassembled PDU]"
"549","28.924164","172.64.155.249","192.168.0.183","TLSv1.2","970","Application Data"
"550","28.924164","172.64.155.249","192.168.0.183","TCP","1514","443  >  51124 [ACK] Seq=334608 Ack=18720 Win=48 Len=1460 [TCP segment of a reassembled PDU]"
"551","28.924164","172.64.155.249","192.168.0.183","TLSv1.2","1104","Application Data"
"552","28.924306","192.168.0.183","172.64.155.249","TCP","54","51124  >  443 [ACK] Seq=18720 Ack=337118 Win=514 Len=0"
"553","28.928661","172.64.155.249","192.168.0.183","TCP","1514","443  >  51124 [ACK] Seq=337118 Ack=18720 Win=48 Len=1460 [TCP segment of a reassembled PDU]"
"554","28.928661","172.64.155.249","192.168.0.183","TCP","1514","443  >  51124 [ACK] Seq=338578 Ack=18720 Win=48 Len=1460 [TCP segment of a reassembled PDU]"
"555","28.928661","172.64.155.249","192.168.0.183","TLSv1.2","947","Application Data"
"556","28.928728","192.168.0.183","172.64.155.249","TCP","54","51124  >  443 [ACK] Seq=18720 Ack=340931 Win=514 Len=0"
"557","28.934520","172.64.155.249","192.168.0.183","TCP","1514","443  >  51124 [ACK] Seq=340931 Ack=18720 Win=48 Len=1460 [TCP segment of a reassembled PDU]"
"558","28.934520","172.64.155.249","192.168.0.183","TCP","1514","443  >  51124 [ACK] Seq=342391 Ack=18720 Win=48 Len=1460 [TCP segment of a reassembled PDU]"
"559","28.934520","172.64.155.249","192.168.0.183","TLSv1.2","772","Application Data"
"560","28.934520","172.64.155.249","192.168.0.183","TLSv1.2","96","Application Data"
"561","28.934520","172.64.155.249","192.168.0.183","TLSv1.2","85","Application Data"
"562","28.934591","192.168.0.183","172.64.155.249","TCP","54","51124  >  443 [ACK] Seq=18720 Ack=344642 Win=514 Len=0"
"563","29.050963","192.168.0.183","172.64.155.249","TLSv1.2","210","Application Data"
"564","29.064452","172.64.155.249","192.168.0.183","TCP","60","443  >  51134 [ACK] Seq=3837 Ack=1269 Win=8 Len=0"
"565","29.085993","172.64.155.249","192.168.0.183","TLSv1.2","473","Application Data"
"566","29.085993","172.64.155.249","192.168.0.183","TLSv1.2","203","Application Data"
"567","29.085993","172.64.155.249","192.168.0.183","TLSv1.2","85","Application Data"
"568","29.086078","192.168.0.183","172.64.155.249","TCP","54","51134  >  443 [ACK] Seq=1269 Ack=4436 Win=514 Len=0"
"569","29.265023","192.168.0.183","172.64.155.249","TLSv1.2","306","Application Data"
"570","29.299929","172.64.155.249","192.168.0.183","TLSv1.2","144","Application Data"
"571","29.351027","192.168.0.183","172.64.155.249","TCP","54","51124  >  443 [ACK] Seq=18972 Ack=344732 Win=513 Len=0"
"572","29.531592","192.168.0.183","172.64.155.249","TLSv1.2","561","Application Data"
"573","29.531828","192.168.0.183","172.64.155.249","TLSv1.2","635","Application Data"
"574","29.546901","172.64.155.249","192.168.0.183","TCP","60","443  >  51124 [ACK] Seq=344732 Ack=20060 Win=49 Len=0"
"575","29.569105","172.64.155.249","192.168.0.183","TLSv1.2","297","Application Data"
"576","29.569105","172.64.155.249","192.168.0.183","TLSv1.2","85","Application Data"
"577","29.569141","192.168.0.183","172.64.155.249","TCP","54","51124  >  443 [ACK] Seq=20060 Ack=345006 Win=512 Len=0"
