"No.","Time","Source","Destination","Protocol","Length","Info"
"1","0.000000","192.168.0.183","172.64.155.249","TLSv1.2","180","Application Data"
"2","0.000065","192.168.0.183","172.64.155.249","TLSv1.2","93","Application Data"
"3","0.000094","192.168.0.183","172.64.155.249","TLSv1.2","220","Application Data"
"4","0.012150","172.64.155.249","192.168.0.183","TCP","60","443  >  51124 [ACK] Seq=1 Ack=332 Win=19 Len=0"
"5","0.012150","172.64.155.249","192.168.0.183","TLSv1.2","93","Application Data"
"6","0.014939","192.168.0.183","172.64.155.249","TLSv1.2","189","Application Data"
"7","0.039670","172.64.155.249","192.168.0.183","TLSv1.2","278","Application Data"
"8","0.091983","192.168.0.183","172.64.155.249","TCP","54","51124  >  443 [ACK] Seq=467 Ack=264 Win=514 Len=0"
"9","0.176262","172.64.155.249","192.168.0.183","TLSv1.2","338","Application Data"
"10","0.176262","172.64.155.249","192.168.0.183","TLSv1.2","100","Application Data"
"11","0.176262","172.64.155.249","192.168.0.183","TLSv1.2","1315","Application Data"
"12","0.176262","172.64.155.249","192.168.0.183","TCP","1514","443  >  51124 [ACK] Seq=1855 Ack=467 Win=19 Len=1460 [TCP segment of a reassembled PDU]"
"13","0.176262","172.64.155.249","192.168.0.183","TCP","1514","443  >  51124 [ACK] Seq=3315 Ack=467 Win=19 Len=1460 [TCP segment of a reassembled PDU]"
"14","0.176262","172.64.155.249","192.168.0.183","TCP","1514","443  >  51124 [ACK] Seq=4775 Ack=467 Win=19 Len=1460 [TCP segment of a reassembled PDU]"
"15","0.176262","172.64.155.249","192.168.0.183","TLSv1.2","675","Application Data"
"16","0.176361","192.168.0.183","172.64.155.249","TCP","54","51124  >  443 [ACK] Seq=467 Ack=6856 Win=514 Len=0"
"17","0.178017","172.64.155.249","192.168.0.183","TCP","1514","443  >  51124 [ACK] Seq=6856 Ack=467 Win=19 Len=1460 [TCP segment of a reassembled PDU]"
"18","0.178017","172.64.155.249","192.168.0.183","TCP","1514","443  >  51124 [ACK] Seq=8316 Ack=467 Win=19 Len=1460 [TCP segment of a reassembled PDU]"
"19","0.178017","172.64.155.249","192.168.0.183","TLSv1.2","1268","Application Data"
"20","0.178017","172.64.155.249","192.168.0.183","TCP","1514","443  >  51124 [ACK] Seq=10990 Ack=467 Win=19 Len=1460 [TCP segment of a reassembled PDU]"
"21","0.178017","172.64.155.249","192.168.0.183","TLSv1.2","1009","Application Data"
"22","0.178090","192.168.0.183","172.64.155.249","TCP","54","51124  >  443 [ACK] Seq=467 Ack=13405 Win=514 Len=0"
"23","0.178102","192.168.0.183","172.64.155.249","TLSv1.2","89","Application Data"
"24","0.188620","172.64.155.249","192.168.0.183","TCP","1514","443  >  51124 [ACK] Seq=13405 Ack=467 Win=19 Len=1460 [TCP segment of a reassembled PDU]"
"25","0.188620","172.64.155.249","192.168.0.183","TLSv1.2","1144","Application Data"
"26","0.188620","172.64.155.249","192.168.0.183","TCP","1514","443  >  51124 [ACK] Seq=15955 Ack=467 Win=19 Len=1460 [TCP segment of a reassembled PDU]"
"27","0.188620","172.64.155.249","192.168.0.183","TCP","1514","443  >  51124 [ACK] Seq=17415 Ack=467 Win=19 Len=1460 [TCP segment of a reassembled PDU]"
"28","0.188620","172.64.155.249","192.168.0.183","TLSv1.2","672","Application Data"
"29","0.188709","192.168.0.183","172.64.155.249","TCP","54","51124  >  443 [ACK] Seq=502 Ack=19493 Win=514 Len=0"
"30","0.190585","172.64.155.249","192.168.0.183","TCP","1514","443  >  51124 [ACK] Seq=19493 Ack=467 Win=19 Len=1460 [TCP segment of a reassembled PDU]"
"31","0.190585","172.64.155.249","192.168.0.183","TCP","1514","443  >  51124 [ACK] Seq=20953 Ack=467 Win=19 Len=1460 [TCP segment of a reassembled PDU]"
"32","0.190585","172.64.155.249","192.168.0.183","TCP","1514","443  >  51124 [ACK] Seq=22413 Ack=467 Win=19 Len=1460 [TCP segment of a reassembled PDU]"
"33","0.190585","172.64.155.249","192.168.0.183","TCP","1514","443  >  51124 [ACK] Seq=23873 Ack=467 Win=19 Len=1460 [TCP segment of a reassembled PDU]"
"34","0.190585","172.64.155.249","192.168.0.183","TCP","1514","443  >  51124 [ACK] Seq=25333 Ack=467 Win=19 Len=1460 [TCP segment of a reassembled PDU]"
"35","0.190585","172.64.155.249","192.168.0.183","TLSv1.2","100","Application Data"
"36","0.190585","172.64.155.249","192.168.0.183","TCP","1514","443  >  51124 [ACK] Seq=26839 Ack=502 Win=19 Len=1460 [TCP segment of a reassembled PDU]"
"37","0.190585","172.64.155.249","192.168.0.183","TCP","1514","443  >  51124 [ACK] Seq=28299 Ack=502 Win=19 Len=1460 [TCP segment of a reassembled PDU]"
"38","0.190585","172.64.155.249","192.168.0.183","TLSv1.2","837","Application Data"
"39","0.190585","172.64.155.249","192.168.0.183","TCP","1514","443  >  51124 [ACK] Seq=30542 Ack=502 Win=19 Len=1460 [TCP segment of a reassembled PDU]"
"40","0.190585","172.64.155.249","192.168.0.183","TLSv1.2","834","Application Data"
"41","0.190697","192.168.0.183","172.64.155.249","TCP","54","51124  >  443 [ACK] Seq=502 Ack=32782 Win=514 Len=0"
"42","0.192492","172.64.155.249","192.168.0.183","TCP","1514","443  >  51124 [ACK] Seq=32782 Ack=502 Win=19 Len=1460 [TCP segment of a reassembled PDU]"
"43","0.192492","172.64.155.249","192.168.0.183","TLSv1.2","1419","Application Data"
"44","0.192547","192.168.0.183","172.64.155.249","TCP","54","51124  >  443 [ACK] Seq=502 Ack=35607 Win=514 Len=0"
"45","0.200863","172.64.155.249","192.168.0.183","TCP","1514","443  >  51124 [ACK] Seq=35607 Ack=502 Win=19 Len=1460 [TCP segment of a reassembled PDU]"
"46","0.200863","172.64.155.249","192.168.0.183","TCP","1514","443  >  51124 [ACK] Seq=37067 Ack=502 Win=19 Len=1460 [TCP segment of a reassembled PDU]"
"47","0.200863","172.64.155.249","192.168.0.183","TLSv1.2","785","Application Data"
"48","0.200863","172.64.155.249","192.168.0.183","TCP","1514","443  >  51124 [ACK] Seq=39258 Ack=502 Win=19 Len=1460 [TCP segment of a reassembled PDU]"
"49","0.200863","172.64.155.249","192.168.0.183","TCP","1514","443  >  51124 [ACK] Seq=40718 Ack=502 Win=19 Len=1460 [TCP segment of a reassembled PDU]"
"50","0.200863","172.64.155.249","192.168.0.183","TLSv1.2","545","Application Data"
"51","0.200863","172.64.155.249","192.168.0.183","TCP","1514","443  >  51124 [ACK] Seq=42669 Ack=502 Win=19 Len=1460 [TCP segment of a reassembled PDU]"
"52","0.200863","172.64.155.249","192.168.0.183","TCP","1514","443  >  51124 [ACK] Seq=44129 Ack=502 Win=19 Len=1460 [TCP segment of a reassembled PDU]"
"53","0.200863","172.64.155.249","192.168.0.183","TLSv1.2","778","Application Data"
"54","0.200967","192.168.0.183","172.64.155.249","TCP","54","51124  >  443 [ACK] Seq=502 Ack=46313 Win=514 Len=0"
"55","0.203404","172.64.155.249","192.168.0.183","TCP","1514","443  >  51124 [ACK] Seq=46313 Ack=502 Win=19 Len=1460 [TCP segment of a reassembled PDU]"
"56","0.203404","172.64.155.249","192.168.0.183","TCP","1514","443  >  51124 [ACK] Seq=47773 Ack=502 Win=19 Len=1460 [TCP segment of a reassembled PDU]"
"57","0.203404","172.64.155.249","192.168.0.183","TCP","1514","443  >  51124 [ACK] Seq=49233 Ack=502 Win=19 Len=1460 [TCP segment of a reassembled PDU]"
"58","0.203404","172.64.155.249","192.168.0.183","TCP","1514","443  >  51124 [ACK] Seq=50693 Ack=502 Win=19 Len=1460 [TCP segment of a reassembled PDU]"
"59","0.203404","172.64.155.249","192.168.0.183","TCP","1514","443  >  51124 [ACK] Seq=52153 Ack=502 Win=19 Len=1460 [TCP segment of a reassembled PDU]"
"60","0.203404","172.64.155.249","192.168.0.183","TCP","1514","443  >  51124 [PSH, ACK] Seq=53613 Ack=502 Win=19 Len=1460 [TCP segment of a reassembled PDU]"
"61","0.203404","172.64.155.249","192.168.0.183","TLSv1.2","1245","Application Data"
"62","0.203554","192.168.0.183","172.64.155.249","TCP","54","51124  >  443 [ACK] Seq=502 Ack=56264 Win=514 Len=0"
"63","0.207408","172.64.155.249","192.168.0.183","TCP","1514","443  >  51124 [ACK] Seq=56264 Ack=502 Win=19 Len=1460 [TCP segment of a reassembled PDU]"
"64","0.207408","172.64.155.249","192.168.0.183","TCP","1514","443  >  51124 [ACK] Seq=57724 Ack=502 Win=19 Len=1460 [TCP segment of a reassembled PDU]"
"65","0.207408","172.64.155.249","192.168.0.183","TCP","1514","443  >  51124 [ACK] Seq=59184 Ack=502 Win=19 Len=1460 [TCP segment of a reassembled PDU]"
"66","0.207408","172.64.155.249","192.168.0.183","TCP","1514","443  >  51124 [ACK] Seq=60644 Ack=502 Win=19 Len=1460 [TCP segment of a reassembled PDU]"
"67","0.207408","172.64.155.249","192.168.0.183","TLSv1.2","1215","Application Data"
"68","0.207408","172.64.155.249","192.168.0.183","TLSv1.2","1143","Application Data"
"69","0.207408","172.64.155.249","192.168.0.183","TCP","1514","443  >  51124 [ACK] Seq=64354 Ack=502 Win=19 Len=1460 [TCP segment of a reassembled PDU]"
"70","0.207408","172.64.155.249","192.168.0.183","TLSv1.2","754","Application Data"
"71","0.207408","172.64.155.249","192.168.0.183","TCP","1514","443  >  51124 [ACK] Seq=66514 Ack=502 Win=19 Len=1460 [TCP segment of a reassembled PDU]"
"72","0.207408","172.64.155.249","192.168.0.183","TCP","1514","443  >  51124 [ACK] Seq=67974 Ack=502 Win=19 Len=1460 [TCP segment of a reassembled PDU]"
"73","0.207408","172.64.155.249","192.168.0.183","TLSv1.2","368","Application Data"
"74","0.207408","172.64.155.249","192.168.0.183","TCP","1514","443  >  51124 [ACK] Seq=69748 Ack=502 Win=19 Len=1460 [TCP segment of a reassembled PDU]"
"75","0.207501","192.168.0.183","172.64.155.249","TCP","54","51124  >  443 [ACK] Seq=502 Ack=71208 Win=514 Len=0"
"76","0.209698","172.64.155.249","192.168.0.183","TCP","1514","443  >  51124 [ACK] Seq=71208 Ack=502 Win=19 Len=1460 [TCP segment of a reassembled PDU]"
"77","0.209698","172.64.155.249","192.168.0.183","TCP","1514","443  >  51124 [ACK] Seq=72668 Ack=502 Win=19 Len=1460 [TCP segment of a reassembled PDU]"
"78","0.209698","172.64.155.249","192.168.0.183","TLSv1.2","1357","Application Data"
"79","0.209698","172.64.155.249","192.168.0.183","TCP","1514","443  >  51124 [ACK] Seq=75431 Ack=502 Win=19 Len=1460 [TCP segment of a reassembled PDU]"
"80","0.209698","172.64.155.249","192.168.0.183","TCP","1514","443  >  51124 [ACK] Seq=76891 Ack=502 Win=19 Len=1460 [TCP segment of a reassembled PDU]"
"81","0.209698","172.64.155.249","192.168.0.183","TLSv1.2","1464","Application Data"
"82","0.209817","192.168.0.183","172.64.155.249","TCP","54","51124  >  443 [ACK] Seq=502 Ack=79761 Win=514 Len=0"
"83","0.212185","172.64.155.249","192.168.0.183","TCP","1514","443  >  51124 [ACK] Seq=79761 Ack=502 Win=19 Len=1460 [TCP segment of a reassembled PDU]"
"84","0.212185","172.64.155.249","192.168.0.183","TCP","1514","443  >  51124 [ACK] Seq=81221 Ack=502 Win=19 Len=1460 [TCP segment of a reassembled PDU]"
"85","0.212185","172.64.155.249","192.168.0.183","TCP","1514","443  >  51124 [ACK] Seq=82681 Ack=502 Win=19 Len=1460 [TCP segment of a reassembled PDU]"
"86","0.212185","172.64.155.249","192.168.0.183","TLSv1.2","391","Application Data"
"87","0.212185","172.64.155.249","192.168.0.183","TCP","1514","443  >  51124 [ACK] Seq=84478 Ack=502 Win=19 Len=1460 [TCP segment of a reassembled PDU]"
"88","0.212185","172.64.155.249","192.168.0.183","TCP","1514","443  >  51124 [ACK] Seq=85938 Ack=502 Win=19 Len=1460 [TCP segment of a reassembled PDU]"
"89","0.212185","172.64.155.249","192.168.0.183","TLSv1.2","1138","Application Data"
"90","0.212185","172.64.155.249","192.168.0.183","TCP","1514","443  >  51124 [ACK] Seq=88482 Ack=502 Win=19 Len=1460 [TCP segment of a reassembled PDU]"
"91","0.212185","172.64.155.249","192.168.0.183","TCP","1514","443  >  51124 [ACK] Seq=89942 Ack=502 Win=19 Len=1460 [TCP segment of a reassembled PDU]"
"92","0.212185","172.64.155.249","192.168.0.183","TCP","1514","443  >  51124 [ACK] Seq=91402 Ack=502 Win=19 Len=1460 [TCP segment of a reassembled PDU]"
"93","0.212185","172.64.155.249","192.168.0.183","TLSv1.2","177","Application Data"
"94","0.212339","192.168.0.183","172.64.155.249","TCP","54","51124  >  443 [ACK] Seq=502 Ack=92985 Win=514 Len=0"
"95","0.212565","172.64.155.249","192.168.0.183","TCP","1514","443  >  51124 [ACK] Seq=92985 Ack=502 Win=19 Len=1460 [TCP segment of a reassembled PDU]"
"96","0.212565","172.64.155.249","192.168.0.183","TCP","1514","443  >  51124 [ACK] Seq=94445 Ack=502 Win=19 Len=1460 [TCP segment of a reassembled PDU]"
"97","0.212565","172.64.155.249","192.168.0.183","TCP","1514","443  >  51124 [ACK] Seq=95905 Ack=502 Win=19 Len=1460 [TCP segment of a reassembled PDU]"
"98","0.212565","172.64.155.249","192.168.0.183","TLSv1.2","1040","Application Data"
"99","0.212565","172.64.155.249","192.168.0.183","TLSv1.2","96","Application Data"
"100","0.212565","172.64.155.249","192.168.0.183","TLSv1.2","85","Application Data"
"101","0.212657","192.168.0.183","172.64.155.249","TCP","54","51124  >  443 [ACK] Seq=502 Ack=98424 Win=514 Len=0"
"102","0.714284","192.168.0.183","172.64.155.249","TLSv1.2","258","Application Data"
"103","0.714424","192.168.0.183","172.64.155.249","TLSv1.2","93","Application Data"
"104","0.731413","172.64.155.249","192.168.0.183","TCP","60","443  >  51134 [ACK] Seq=1 Ack=244 Win=8 Len=0"
"105","0.731413","172.64.155.249","192.168.0.183","TLSv1.2","93","Application Data"
"106","0.760404","172.64.155.249","192.168.0.183","TLSv1.2","473","Application Data"
"107","0.760404","172.64.155.249","192.168.0.183","TLSv1.2","203","Application Data"
"108","0.760404","172.64.155.249","192.168.0.183","TLSv1.2","85","Application Data"
"109","0.760446","192.168.0.183","172.64.155.249","TCP","54","51134  >  443 [ACK] Seq=244 Ack=639 Win=514 Len=0"
"110","0.761416","192.168.0.183","172.64.155.249","TLSv1.2","89","Application Data"
"111","0.815804","172.64.155.249","192.168.0.183","TCP","60","443  >  51134 [ACK] Seq=639 Ack=279 Win=8 Len=0"
"112","1.123690","192.168.0.183","172.64.155.249","TLSv1.2","274","Application Data"
"113","1.123806","192.168.0.183","172.64.155.249","TLSv1.2","178","Application Data"
"114","1.139456","172.64.155.249","192.168.0.183","TCP","60","443  >  51124 [ACK] Seq=98424 Ack=846 Win=20 Len=0"
"115","1.168923","172.64.155.249","192.168.0.183","TLSv1.2","279","Application Data"
"116","1.168923","172.64.155.249","192.168.0.183","TLSv1.2","686","Application Data"
"117","1.168923","172.64.155.249","192.168.0.183","TLSv1.2","85","Application Data"
"118","1.168923","172.64.155.249","192.168.0.183","TLSv1.2","150","Application Data"
"119","1.169016","192.168.0.183","172.64.155.249","TCP","54","51124  >  443 [ACK] Seq=846 Ack=99408 Win=510 Len=0"
"120","1.716022","192.168.0.183","172.64.155.249","TLSv1.2","489","Application Data"
"121","1.716194","192.168.0.183","172.64.155.249","TLSv1.2","606","Application Data"
"122","1.734508","172.64.155.249","192.168.0.183","TCP","60","443  >  51124 [ACK] Seq=99408 Ack=1833 Win=20 Len=0"
"123","1.757308","172.64.155.249","192.168.0.183","TLSv1.2","297","Application Data"
"124","1.757308","172.64.155.249","192.168.0.183","TLSv1.2","85","Application Data"
"125","1.757366","192.168.0.183","172.64.155.249","TCP","54","51124  >  443 [ACK] Seq=1833 Ack=99682 Win=509 Len=0"
"126","3.514151","192.168.0.183","172.64.155.249","TLSv1.2","696","Application Data"
"127","3.591375","172.64.155.249","192.168.0.183","TCP","60","443  >  51124 [ACK] Seq=99682 Ack=2475 Win=21 Len=0"
"128","3.611108","172.64.155.249","192.168.0.183","TLSv1.2","279","Application Data"
"129","3.611108","172.64.155.249","192.168.0.183","TLSv1.2","100","Application Data"
"130","3.611108","172.64.155.249","192.168.0.183","TLSv1.2","1289","Application Data"
"131","3.611108","172.64.155.249","192.168.0.183","TCP","1514","443  >  51124 [ACK] Seq=101188 Ack=2475 Win=21 Len=1460 [TCP segment of a reassembled PDU]"
"132","3.611155","192.168.0.183","172.64.155.249","TCP","54","51124  >  443 [ACK] Seq=2475 Ack=102648 Win=514 Len=0"
"133","3.613565","172.64.155.249","192.168.0.183","TCP","1514","443  >  51124 [ACK] Seq=102648 Ack=2475 Win=21 Len=1460 [TCP segment of a reassembled PDU]"
"134","3.613565","172.64.155.249","192.168.0.183","TCP","1514","443  >  51124 [ACK] Seq=104108 Ack=2475 Win=21 Len=1460 [TCP segment of a reassembled PDU]"
"135","3.613565","172.64.155.249","192.168.0.183","TCP","1514","443  >  51124 [ACK] Seq=105568 Ack=2475 Win=21 Len=1460 [TCP segment of a reassembled PDU]"
"136","3.613565","172.64.155.249","192.168.0.183","TCP","1514","443  >  51124 [ACK] Seq=107028 Ack=2475 Win=21 Len=1460 [TCP segment of a reassembled PDU]"
"137","3.613565","172.64.155.249","192.168.0.183","TLSv1.2","486","Application Data"
"138","3.613653","192.168.0.183","172.64.155.249","TCP","54","51124  >  443 [ACK] Seq=2475 Ack=108920 Win=514 Len=0"
"139","3.624867","172.64.155.249","192.168.0.183","TCP","1514","443  >  51124 [ACK] Seq=108920 Ack=2475 Win=21 Len=1460 [TCP segment of a reassembled PDU]"
"140","3.624867","172.64.155.249","192.168.0.183","TLSv1.2","859","Application Data"
"141","3.624867","172.64.155.249","192.168.0.183","TCP","1514","443  >  51124 [ACK] Seq=111185 Ack=2475 Win=21 Len=1460 [TCP segment of a reassembled PDU]"
"142","3.624867","172.64.155.249","192.168.0.183","TLSv1.2","71","Application Data"
"143","3.624867","172.64.155.249","192.168.0.183","TCP","1514","443  >  51124 [ACK] Seq=112662 Ack=2475 Win=21 Len=1460 [TCP segment of a reassembled PDU]"
"144","3.624867","172.64.155.249","192.168.0.183","TCP","1514","443  >  51124 [ACK] Seq=114122 Ack=2475 Win=21 Len=1460 [TCP segment of a reassembled PDU]"
"145","3.624867","172.64.155.249","192.168.0.183","TCP","1514","443  >  51124 [ACK] Seq=115582 Ack=2475 Win=21 Len=1460 [TCP segment of a reassembled PDU]"
"146","3.624867","172.64.155.249","192.168.0.183","TCP","1514","443  >  51124 [ACK] Seq=117042 Ack=2475 Win=21 Len=1460 [TCP segment of a reassembled PDU]"
"147","3.624867","172.64.155.249","192.168.0.183","TLSv1.2","397","Application Data"
"148","3.624867","172.64.155.249","192.168.0.183","TCP","1514","443  >  51124 [ACK] Seq=118845 Ack=2475 Win=21 Len=1460 [TCP segment of a reassembled PDU]"
"149","3.625134","192.168.0.183","172.64.155.249","TCP","54","51124  >  443 [ACK] Seq=2475 Ack=120305 Win=514 Len=0"
"150","3.626189","172.64.155.249","192.168.0.183","TCP","1514","443  >  51124 [ACK] Seq=120305 Ack=2475 Win=21 Len=1460 [TCP segment of a reassembled PDU]"
"151","3.626189","172.64.155.249","192.168.0.183","TLSv1.2","1444","Application Data"
"152","3.626189","172.64.155.249","192.168.0.183","TLSv1.2","96","Application Data"
"153","3.626189","172.64.155.249","192.168.0.183","TLSv1.2","85","Application Data"
"154","3.626294","192.168.0.183","172.64.155.249","TCP","54","51124  >  443 [ACK] Seq=2475 Ack=123228 Win=514 Len=0"
"155","3.912971","192.168.0.183","172.64.155.249","TLSv1.2","250","Application Data"
"156","3.913494","192.168.0.183","172.64.155.249","TLSv1.2","221","Application Data"
"157","3.926420","172.64.155.249","192.168.0.183","TCP","60","443  >  51124 [ACK] Seq=123228 Ack=2671 Win=21 Len=0"
"158","3.929442","172.64.155.249","192.168.0.183","TCP","60","443  >  51124 [ACK] Seq=123228 Ack=2838 Win=21 Len=0"
"159","3.951453","172.64.155.249","192.168.0.183","TLSv1.2","144","Application Data"
"160","3.955645","172.64.155.249","192.168.0.183","TLSv1.2","146","Application Data"
"161","3.955645","172.64.155.249","192.168.0.183","TLSv1.2","225","Application Data"
"162","3.955645","172.64.155.249","192.168.0.183","TLSv1.2","85","Application Data"
"163","3.955726","192.168.0.183","172.64.155.249","TCP","54","51124  >  443 [ACK] Seq=2838 Ack=123612 Win=512 Len=0"
"164","4.031128","192.168.0.183","172.64.155.249","TLSv1.2","516","Application Data"
"165","4.031173","192.168.0.183","172.64.155.249","TLSv1.2","546","Application Data"
"166","4.065900","172.64.155.249","192.168.0.183","TCP","60","443  >  51124 [ACK] Seq=123612 Ack=3792 Win=22 Len=0"
"167","4.101145","172.64.155.249","192.168.0.183","TLSv1.2","144","Application Data"
"168","4.101145","172.64.155.249","192.168.0.183","TLSv1.2","85","Application Data"
"169","4.101170","192.168.0.183","172.64.155.249","TCP","54","51124  >  443 [ACK] Seq=3792 Ack=123733 Win=512 Len=0"
"170","6.931475","192.168.0.183","172.64.155.249","TLSv1.2","137","Application Data"
"171","6.931563","192.168.0.183","172.64.155.249","TLSv1.2","170","Application Data"
"172","6.943057","192.168.0.183","172.64.155.249","TLSv1.2","308","Application Data"
"173","6.956540","172.64.155.249","192.168.0.183","TCP","60","443  >  51124 [ACK] Seq=123733 Ack=3991 Win=22 Len=0"
"174","6.991970","172.64.155.249","192.168.0.183","TCP","60","443  >  51124 [ACK] Seq=123733 Ack=4245 Win=22 Len=0"
"175","7.013845","172.64.155.249","192.168.0.183","TLSv1.2","279","Application Data"
"176","7.020862","172.64.155.249","192.168.0.183","TLSv1.2","146","Application Data"
"177","7.020862","172.64.155.249","192.168.0.183","TLSv1.2","100","Application Data"
"178","7.020862","172.64.155.249","192.168.0.183","TLSv1.2","1320","Application Data"
"179","7.020862","172.64.155.249","192.168.0.183","TCP","1514","443  >  51124 [ACK] Seq=125362 Ack=4245 Win=22 Len=1460 [TCP segment of a reassembled PDU]"
"180","7.020862","172.64.155.249","192.168.0.183","TCP","1514","443  >  51124 [ACK] Seq=126822 Ack=4245 Win=22 Len=1460 [TCP segment of a reassembled PDU]"
"181","7.020862","172.64.155.249","192.168.0.183","TCP","1514","443  >  51124 [ACK] Seq=128282 Ack=4245 Win=22 Len=1460 [TCP segment of a reassembled PDU]"
"182","7.020862","172.64.155.249","192.168.0.183","TLSv1.2","518","Application Data"
"183","7.020862","172.64.155.249","192.168.0.183","TCP","1514","443  >  51124 [ACK] Seq=130206 Ack=4245 Win=22 Len=1460 [TCP segment of a reassembled PDU]"
"184","7.020910","192.168.0.183","172.64.155.249","TCP","54","51124  >  443 [ACK] Seq=4245 Ack=131666 Win=514 Len=0"
"185","7.021798","192.168.0.183","172.64.155.249","TLSv1.2","89","Application Data"
"186","7.023732","172.64.155.249","192.168.0.183","TLSv1.2","1467","Application Data"
"187","7.023782","192.168.0.183","172.64.155.249","TCP","54","51124  >  443 [ACK] Seq=4280 Ack=133079 Win=514 Len=0"
"188","7.030897","172.64.155.249","192.168.0.183","TCP","1514","443  >  51124 [ACK] Seq=133079 Ack=4245 Win=22 Len=1460 [TCP segment of a reassembled PDU]"
"189","7.030897","172.64.155.249","192.168.0.183","TLSv1.2","1064","Application Data"
"190","7.030897","172.64.155.249","192.168.0.183","TCP","1514","443  >  51124 [ACK] Seq=135549 Ack=4245 Win=22 Len=1460 [TCP segment of a reassembled PDU]"
"191","7.030897","172.64.155.249","192.168.0.183","TLSv1.2","1417","Application Data"
"192","7.030897","172.64.155.249","192.168.0.183","TLSv1.2","96","Application Data"
"193","7.030897","172.64.155.249","192.168.0.183","TLSv1.2","85","Application Data"
"194","7.031024","192.168.0.183","172.64.155.249","TCP","54","51124  >  443 [ACK] Seq=4280 Ack=138445 Win=514 Len=0"
"195","7.035100","172.64.155.249","192.168.0.183","TCP","60","443  >  51124 [ACK] Seq=138445 Ack=4280 Win=22 Len=0"
"196","7.375837","192.168.0.183","172.64.155.249","TLSv1.2","536","Application Data"
"197","7.375993","192.168.0.183","172.64.155.249","TLSv1.2","557","Application Data"
"198","7.388532","172.64.155.249","192.168.0.183","TCP","60","443  >  51124 [ACK] Seq=138445 Ack=4762 Win=23 Len=0"
"199","7.391005","172.64.155.249","192.168.0.183","TCP","60","443  >  51124 [ACK] Seq=138445 Ack=5265 Win=23 Len=0"
"200","7.415152","172.64.155.249","192.168.0.183","TLSv1.2","144","Application Data"
"201","7.415152","172.64.155.249","192.168.0.183","TLSv1.2","85","Application Data"
"202","7.415184","192.168.0.183","172.64.155.249","TCP","54","51124  >  443 [ACK] Seq=5265 Ack=138566 Win=513 Len=0"
"203","12.953109","192.168.0.183","172.64.155.249","TLSv1.2","214","Application Data"
"204","13.004644","172.64.155.249","192.168.0.183","TLSv1.2","314","Application Data"
"205","13.004644","172.64.155.249","192.168.0.183","TLSv1.2","100","Application Data"
"206","13.004644","172.64.155.249","192.168.0.183","TLSv1.2","1320","Application Data"
"207","13.004644","172.64.155.249","192.168.0.183","TCP","1514","443  >  51124 [ACK] Seq=140138 Ack=5425 Win=23 Len=1460 [TCP segment of a reassembled PDU]"
"208","13.004644","172.64.155.249","192.168.0.183","TLSv1.2","1218","Application Data"
"209","13.004720","192.168.0.183","172.64.155.249","TCP","54","51124  >  443 [ACK] Seq=5425 Ack=142762 Win=514 Len=0"
"210","13.005580","192.168.0.183","172.64.155.249","TLSv1.2","89","Application Data"
"211","13.006287","172.64.155.249","192.168.0.183","TCP","1514","443  >  51124 [ACK] Seq=142762 Ack=5425 Win=23 Len=1460 [TCP segment of a reassembled PDU]"
"212","13.006287","172.64.155.249","192.168.0.183","TCP","1514","443  >  51124 [ACK] Seq=144222 Ack=5425 Win=23 Len=1460 [TCP segment of a reassembled PDU]"
"213","13.006287","172.64.155.249","192.168.0.183","TCP","1514","443  >  51124 [ACK] Seq=145682 Ack=5425 Win=23 Len=1460 [TCP segment of a reassembled PDU]"
"214","13.006287","172.64.155.249","192.168.0.183","TLSv1.2","472","Application Data"
"215","13.006421","192.168.0.183","172.64.155.249","TCP","54","51124  >  443 [ACK] Seq=5460 Ack=147560 Win=514 Len=0"
"216","13.016034","172.64.155.249","192.168.0.183","TCP","1514","443  >  51124 [ACK] Seq=147560 Ack=5425 Win=23 Len=1460 [TCP segment of a reassembled PDU]"
"217","13.016034","172.64.155.249","192.168.0.183","TCP","1514","443  >  51124 [ACK] Seq=149020 Ack=5425 Win=23 Len=1460 [TCP segment of a reassembled PDU]"
"218","13.016034","172.64.155.249","192.168.0.183","TLSv1.2","1184","Application Data"
"219","13.016034","172.64.155.249","192.168.0.183","TCP","1514","443  >  51124 [ACK] Seq=151610 Ack=5425 Win=23 Len=1460 [TCP segment of a reassembled PDU]"
"220","13.016102","192.168.0.183","172.64.155.249","TCP","54","51124  >  443 [ACK] Seq=5460 Ack=153070 Win=514 Len=0"
"221","13.018879","172.64.155.249","192.168.0.183","TCP","1514","443  >  51124 [ACK] Seq=153070 Ack=5425 Win=23 Len=1460 [TCP segment of a reassembled PDU]"
"222","13.018879","172.64.155.249","192.168.0.183","TCP","1514","443  >  51124 [ACK] Seq=154530 Ack=5425 Win=23 Len=1460 [TCP segment of a reassembled PDU]"
"223","13.018879","172.64.155.249","192.168.0.183","TLSv1.2","434","Application Data"
"224","13.018942","192.168.0.183","172.64.155.249","TCP","54","51124  >  443 [ACK] Seq=5460 Ack=156370 Win=514 Len=0"
"225","13.030930","172.64.155.249","192.168.0.183","TCP","1514","443  >  51124 [ACK] Seq=156370 Ack=5425 Win=23 Len=1460 [TCP segment of a reassembled PDU]"
"226","13.030930","172.64.155.249","192.168.0.183","TCP","1514","443  >  51124 [ACK] Seq=157830 Ack=5425 Win=23 Len=1460 [TCP segment of a reassembled PDU]"
"227","13.030930","172.64.155.249","192.168.0.183","TCP","1514","443  >  51124 [ACK] Seq=159290 Ack=5425 Win=23 Len=1460 [TCP segment of a reassembled PDU]"
"228","13.030930","172.64.155.249","192.168.0.183","TCP","1514","443  >  51124 [ACK] Seq=160750 Ack=5425 Win=23 Len=1460 [TCP segment of a reassembled PDU]"
"229","13.030930","172.64.155.249","192.168.0.183","TCP","1514","443  >  51124 [ACK] Seq=162210 Ack=5425 Win=23 Len=1460 [TCP segment of a reassembled PDU]"
"230","13.030930","172.64.155.249","192.168.0.183","TCP","1514","443  >  51124 [PSH, ACK] Seq=163670 Ack=5425 Win=23 Len=1460 [TCP segment of a reassembled PDU]"
"231","13.030930","172.64.155.249","192.168.0.183","TCP","1514","443  >  51124 [ACK] Seq=165130 Ack=5425 Win=23 Len=1460 [TCP segment of a reassembled PDU]"
"232","13.030930","172.64.155.249","192.168.0.183","TLSv1.2","734","Application Data"
"233","13.030930","172.64.155.249","192.168.0.183","TCP","1514","443  >  51124 [ACK] Seq=167270 Ack=5460 Win=23 Len=1460 [TCP segment of a reassembled PDU]"
"234","13.030930","172.64.155.249","192.168.0.183","TCP","1514","443  >  51124 [ACK] Seq=168730 Ack=5460 Win=23 Len=1460 [TCP segment of a reassembled PDU]"
"235","13.030930","172.64.155.249","192.168.0.183","TCP","1514","443  >  51124 [ACK] Seq=170190 Ack=5460 Win=23 Len=1460 [TCP segment of a reassembled PDU]"
"236","13.030930","172.64.155.249","192.168.0.183","TCP","1514","443  >  51124 [ACK] Seq=171650 Ack=5460 Win=23 Len=1460 [TCP segment of a reassembled PDU]"
"237","13.030930","172.64.155.249","192.168.0.183","TCP","1514","443  >  51124 [ACK] Seq=173110 Ack=5460 Win=23 Len=1460 [TCP segment of a reassembled PDU]"
"238","13.030930","172.64.155.249","192.168.0.183","TCP","1514","443  >  51124 [PSH, ACK] Seq=174570 Ack=5460 Win=23 Len=1460 [TCP segment of a reassembled PDU]"
"239","13.030930","172.64.155.249","192.168.0.183","TCP","1514","443  >  51124 [ACK] Seq=176030 Ack=5460 Win=23 Len=1460 [TCP segment of a reassembled PDU]"
"240","13.030930","172.64.155.249","192.168.0.183","TLSv1.2","1093","Application Data"
"241","13.030930","172.64.155.249","192.168.0.183","TCP","1514","443  >  51124 [ACK] Seq=178529 Ack=5460 Win=23 Len=1460 [TCP segment of a reassembled PDU]"
"242","13.030930","172.64.155.249","192.168.0.183","TCP","1514","443  >  51124 [ACK] Seq=179989 Ack=5460 Win=23 Len=1460 [TCP segment of a reassembled PDU]"
"243","13.030930","172.64.155.249","192.168.0.183","TLSv1.2","657","Application Data"
"244","13.030930","172.64.155.249","192.168.0.183","TLSv1.2","96","Application Data"
"245","13.030930","172.64.155.249","192.168.0.183","TLSv1.2","85","Application Data"
"246","13.031089","192.168.0.183","172.64.155.249","TCP","54","51124  >  443 [ACK] Seq=5460 Ack=182125 Win=514 Len=0"
"247","13.101817","192.168.0.183","172.64.155.249","TLSv1.2","206","Application Data"
"248","13.101873","192.168.0.183","172.64.155.249","TLSv1.2","93","Application Data"
"249","13.119029","172.64.155.249","192.168.0.183","TCP","60","443  >  51134 [ACK] Seq=639 Ack=470 Win=8 Len=0"
"250","13.119029","172.64.155.249","192.168.0.183","TLSv1.2","93","Application Data"
"251","13.141344","172.64.155.249","192.168.0.183","TLSv1.2","470","Application Data"
"252","13.141344","172.64.155.249","192.168.0.183","TLSv1.2","203","Application Data"
"253","13.141344","172.64.155.249","192.168.0.183","TLSv1.2","85","Application Data"
"254","13.141419","192.168.0.183","172.64.155.249","TCP","54","51134  >  443 [ACK] Seq=470 Ack=1274 Win=511 Len=0"
"255","13.142341","192.168.0.183","172.64.155.249","TLSv1.2","89","Application Data"
"256","13.195634","172.64.155.249","192.168.0.183","TCP","60","443  >  51134 [ACK] Seq=1274 Ack=505 Win=8 Len=0"
"257","13.398001","192.168.0.183","172.64.155.249","TLSv1.2","295","Application Data"
"258","13.441316","172.64.155.249","192.168.0.183","TLSv1.2","152","Application Data"
"259","13.495627","192.168.0.183","172.64.155.249","TCP","54","51124  >  443 [ACK] Seq=5701 Ack=182223 Win=513 Len=0"
"260","13.689562","192.168.0.183","172.64.155.249","TLSv1.2","489","Application Data"
"261","13.689733","192.168.0.183","172.64.155.249","TLSv1.2","630","Application Data"
"262","13.702500","172.64.155.249","192.168.0.183","TCP","60","443  >  51124 [ACK] Seq=182223 Ack=6712 Win=25 Len=0"
"263","13.741782","172.64.155.249","192.168.0.183","TLSv1.2","482","Application Data"
"264","13.741782","172.64.155.249","192.168.0.183","TLSv1.2","85","Application Data"
"265","13.741977","192.168.0.183","172.64.155.249","TCP","54","51124  >  443 [ACK] Seq=6712 Ack=182682 Win=511 Len=0"
"266","21.739422","192.168.0.183","172.64.155.249","TLSv1.2","749","Application Data"
"267","21.795855","172.64.155.249","192.168.0.183","TCP","60","443  >  51124 [ACK] Seq=182682 Ack=7407 Win=25 Len=0"
"268","21.830036","172.64.155.249","192.168.0.183","TLSv1.2","315","Application Data"
"269","21.830036","172.64.155.249","192.168.0.183","TLSv1.2","100","Application Data"
"270","21.830036","172.64.155.249","192.168.0.183","TCP","1514","443  >  51124 [ACK] Seq=182989 Ack=7407 Win=25 Len=1460 [TCP segment of a reassembled PDU]"
"271","21.830036","172.64.155.249","192.168.0.183","TLSv1.2","1107","Application Data"
"272","21.830036","172.64.155.249","192.168.0.183","TCP","1514","443  >  51124 [ACK] Seq=185502 Ack=7407 Win=25 Len=1460 [TCP segment of a reassembled PDU]"
"273","21.830036","172.64.155.249","192.168.0.183","TLSv1.2","1091","Application Data"
"274","21.830036","172.64.155.249","192.168.0.183","TCP","1514","443  >  51124 [ACK] Seq=187999 Ack=7407 Win=25 Len=1460 [TCP segment of a reassembled PDU]"
"275","21.830036","172.64.155.249","192.168.0.183","TLSv1.2","935","Application Data"
"276","21.830036","172.64.155.249","192.168.0.183","TCP","1514","443  >  51124 [ACK] Seq=190340 Ack=7407 Win=25 Len=1460 [TCP segment of a reassembled PDU]"
"277","21.830036","172.64.155.249","192.168.0.183","TLSv1.2","1056","Application Data"
"278","21.830036","172.64.155.249","192.168.0.183","TLSv1.2","1364","Application Data"
"279","21.830108","192.168.0.183","172.64.155.249","TCP","54","51124  >  443 [ACK] Seq=7407 Ack=194112 Win=514 Len=0"
"280","21.831011","192.168.0.183","172.64.155.249","TLSv1.2","89","Application Data"
"281","21.840186","172.64.155.249","192.168.0.183","TCP","1514","443  >  51124 [ACK] Seq=194112 Ack=7407 Win=25 Len=1460 [TCP segment of a reassembled PDU]"
"282","21.840186","172.64.155.249","192.168.0.183","TLSv1.2","313","Application Data"
"283","21.840186","172.64.155.249","192.168.0.183","TLSv1.2","1308","Application Data"
"284","21.840186","172.64.155.249","192.168.0.183","TCP","1514","443  >  51124 [ACK] Seq=197085 Ack=7407 Win=25 Len=1460 [TCP segment of a reassembled PDU]"
"285","21.840186","172.64.155.249","192.168.0.183","TCP","1514","443  >  51124 [ACK] Seq=198545 Ack=7407 Win=25 Len=1460 [TCP segment of a reassembled PDU]"
"286","21.840186","172.64.155.249","192.168.0.183","TLSv1.2","587","Application Data"
"287","21.840283","192.168.0.183","172.64.155.249","TCP","54","51124  >  443 [ACK] Seq=7442 Ack=200538 Win=514 Len=0"
"288","21.843131","172.64.155.249","192.168.0.183","TCP","1514","443  >  51124 [ACK] Seq=200538 Ack=7407 Win=25 Len=1460 [TCP segment of a reassembled PDU]"
"289","21.843131","172.64.155.249","192.168.0.183","TCP","1514","443  >  51124 [ACK] Seq=201998 Ack=7407 Win=25 Len=1460 [TCP segment of a reassembled PDU]"
"290","21.843131","172.64.155.249","192.168.0.183","TCP","1514","443  >  51124 [ACK] Seq=203458 Ack=7407 Win=25 Len=1460 [TCP segment of a reassembled PDU]"
"291","21.843131","172.64.155.249","192.168.0.183","TLSv1.2","590","Application Data"
"292","21.843131","172.64.155.249","192.168.0.183","TLSv1.2","96","Application Data"
"293","21.843131","172.64.155.249","192.168.0.183","TLSv1.2","85","Application Data"
"294","21.843131","172.64.155.249","192.168.0.183","TCP","60","443  >  51124 [ACK] Seq=205527 Ack=7442 Win=25 Len=0"
"295","21.843235","192.168.0.183","172.64.155.249","TCP","54","51124  >  443 [ACK] Seq=7442 Ack=205527 Win=514 Len=0"
"296","22.091771","192.168.0.183","172.64.155.249","TLSv1.2","289","Application Data"
"297","22.104107","172.64.155.249","192.168.0.183","TCP","60","443  >  51124 [ACK] Seq=205527 Ack=7677 Win=25 Len=0"
"298","22.125864","172.64.155.249","192.168.0.183","TLSv1.2","150","Application Data"
"299","22.176437","192.168.0.183","172.64.155.249","TCP","54","51124  >  443 [ACK] Seq=7677 Ack=205623 Win=513 Len=0"
"300","22.214458","192.168.0.183","172.64.155.249","TLSv1.2","515","Application Data"
"301","22.214520","192.168.0.183","172.64.155.249","TLSv1.2","561","Application Data"
"302","22.232643","172.64.155.249","192.168.0.183","TCP","60","443  >  51124 [ACK] Seq=205623 Ack=8645 Win=26 Len=0"
"303","22.253909","172.64.155.249","192.168.0.183","TLSv1.2","165","Application Data"
"304","22.253909","172.64.155.249","192.168.0.183","TLSv1.2","85","Application Data"
"305","22.253963","192.168.0.183","172.64.155.249","TCP","54","51124  >  443 [ACK] Seq=8645 Ack=205765 Win=513 Len=0"
"306","23.919610","192.168.0.183","172.64.155.249","TLSv1.2","176","Application Data"
"307","23.919728","192.168.0.183","172.64.155.249","TLSv1.2","170","Application Data"
"308","23.931986","172.64.155.249","192.168.0.183","TCP","60","443  >  51124 [ACK] Seq=205765 Ack=8883 Win=26 Len=0"
"309","23.932655","192.168.0.183","172.64.155.249","TLSv1.2","297","Application Data"
"310","23.958322","172.64.155.249","192.168.0.183","TLSv1.2","279","Application Data"
"311","24.005677","192.168.0.183","172.64.155.249","TCP","54","51124  >  443 [ACK] Seq=9126 Ack=205990 Win=512 Len=0"
"312","24.025210","192.168.0.183","172.64.155.249","TLSv1.2","173","Application Data"
"313","24.065764","172.64.155.249","192.168.0.183","TLSv1.2","146","Application Data"
"314","24.065764","172.64.155.249","192.168.0.183","TLSv1.2","100","Application Data"
"315","24.065764","172.64.155.249","192.168.0.183","TCP","1514","443  >  51124 [ACK] Seq=206128 Ack=9245 Win=26 Len=1460 [TCP segment of a reassembled PDU]"
"316","24.065764","172.64.155.249","192.168.0.183","TLSv1.2","631","Application Data"
"317","24.065764","172.64.155.249","192.168.0.183","TLSv1.2","85","Application Data"
"318","24.065812","192.168.0.183","172.64.155.249","TCP","54","51124  >  443 [ACK] Seq=9245 Ack=208196 Win=514 Len=0"
"319","24.124992","172.64.155.249","192.168.0.183","TLSv1.2","146","Application Data"
"320","24.124992","172.64.155.249","192.168.0.183","TLSv1.2","100","Application Data"
"321","24.124992","172.64.155.249","192.168.0.183","TCP","1514","443  >  51124 [ACK] Seq=208334 Ack=9245 Win=26 Len=1460 [TCP segment of a reassembled PDU]"
"322","24.124992","172.64.155.249","192.168.0.183","TCP","1514","443  >  51124 [ACK] Seq=209794 Ack=9245 Win=26 Len=1460 [TCP segment of a reassembled PDU]"
"323","24.125038","192.168.0.183","172.64.155.249","TCP","54","51124  >  443 [ACK] Seq=9245 Ack=211254 Win=514 Len=0"
"324","24.138454","172.64.155.249","192.168.0.183","TCP","1514","443  >  51124 [ACK] Seq=211254 Ack=9245 Win=26 Len=1460 [TCP segment of a reassembled PDU]"
"325","24.138454","172.64.155.249","192.168.0.183","TCP","1514","443  >  51124 [ACK] Seq=212714 Ack=9245 Win=26 Len=1460 [TCP segment of a reassembled PDU]"
"326","24.138454","172.64.155.249","192.168.0.183","TCP","1514","443  >  51124 [ACK] Seq=214174 Ack=9245 Win=26 Len=1460 [TCP segment of a reassembled PDU]"
"327","24.138454","172.64.155.249","192.168.0.183","TCP","1514","443  >  51124 [PSH, ACK] Seq=215634 Ack=9245 Win=26 Len=1460 [TCP segment of a reassembled PDU]"
"328","24.138454","172.64.155.249","192.168.0.183","TLSv1.2","1150","Application Data"
"329","24.138627","192.168.0.183","172.64.155.249","TCP","54","51124  >  443 [ACK] Seq=9245 Ack=218190 Win=514 Len=0"
"330","24.138990","172.64.155.249","192.168.0.183","TCP","1514","443  >  51124 [ACK] Seq=218190 Ack=9245 Win=26 Len=1460 [TCP segment of a reassembled PDU]"
"331","24.138990","172.64.155.249","192.168.0.183","TLSv1.2","1367","Application Data"
"332","24.138990","172.64.155.249","192.168.0.183","TCP","1514","443  >  51124 [ACK] Seq=220963 Ack=9245 Win=26 Len=1460 [TCP segment of a reassembled PDU]"
"333","24.138990","172.64.155.249","192.168.0.183","TCP","1514","443  >  51124 [ACK] Seq=222423 Ack=9245 Win=26 Len=1460 [TCP segment of a reassembled PDU]"
"334","24.138990","172.64.155.249","192.168.0.183","TCP","1514","443  >  51124 [ACK] Seq=223883 Ack=9245 Win=26 Len=1460 [TCP segment of a reassembled PDU]"
"335","24.138990","172.64.155.249","192.168.0.183","TLSv1.2","474","Application Data"
"336","24.138990","172.64.155.249","192.168.0.183","TCP","1514","443  >  51124 [ACK] Seq=225763 Ack=9245 Win=26 Len=1460 [TCP segment of a reassembled PDU]"
"337","24.138990","172.64.155.249","192.168.0.183","TCP","1514","443  >  51124 [ACK] Seq=227223 Ack=9245 Win=26 Len=1460 [TCP segment of a reassembled PDU]"
"338","24.138990","172.64.155.249","192.168.0.183","TCP","1514","443  >  51124 [ACK] Seq=228683 Ack=9245 Win=26 Len=1460 [TCP segment of a reassembled PDU]"
"339","24.138990","172.64.155.249","192.168.0.183","TLSv1.2","727","Application Data"
"340","24.138990","172.64.155.249","192.168.0.183","TCP","1514","443  >  51124 [ACK] Seq=230816 Ack=9245 Win=26 Len=1460 [TCP segment of a reassembled PDU]"
"341","24.138990","172.64.155.249","192.168.0.183","TCP","1514","443  >  51124 [ACK] Seq=232276 Ack=9245 Win=26 Len=1460 [TCP segment of a reassembled PDU]"
"342","24.138990","172.64.155.249","192.168.0.183","TCP","1514","443  >  51124 [ACK] Seq=233736 Ack=9245 Win=26 Len=1460 [TCP segment of a reassembled PDU]"
"343","24.138990","172.64.155.249","192.168.0.183","TLSv1.2","393","Application Data"
"344","24.138990","172.64.155.249","192.168.0.183","TCP","1514","443  >  51124 [ACK] Seq=235535 Ack=9245 Win=26 Len=1460 [TCP segment of a reassembled PDU]"
"345","24.138990","172.64.155.249","192.168.0.183","TCP","1514","443  >  51124 [ACK] Seq=236995 Ack=9245 Win=26 Len=1460 [TCP segment of a reassembled PDU]"
"346","24.138990","172.64.155.249","192.168.0.183","TCP","1514","443  >  51124 [ACK] Seq=238455 Ack=9245 Win=26 Len=1460 [TCP segment of a reassembled PDU]"
"347","24.138990","172.64.155.249","192.168.0.183","TCP","1514","443  >  51124 [ACK] Seq=239915 Ack=9245 Win=26 Len=1460 [TCP segment of a reassembled PDU]"
"348","24.138990","172.64.155.249","192.168.0.183","TCP","1514","443  >  51124 [ACK] Seq=241375 Ack=9245 Win=26 Len=1460 [TCP segment of a reassembled PDU]"
"349","24.138990","172.64.155.249","192.168.0.183","TLSv1.2","481","Application Data"
"350","24.138990","172.64.155.249","192.168.0.183","TLSv1.2","96","Application Data"
"351","24.138990","172.64.155.249","192.168.0.183","TLSv1.2","85","Application Data"
"352","24.139223","192.168.0.183","172.64.155.249","TCP","54","51124  >  443 [ACK] Seq=9245 Ack=243335 Win=514 Len=0"
"353","24.205751","192.168.0.183","172.64.155.249","TLSv1.2","184","Application Data"
"354","24.205814","192.168.0.183","172.64.155.249","TLSv1.2","93","Application Data"
"355","24.219933","172.64.155.249","192.168.0.183","TCP","60","443  >  51134 [ACK] Seq=1274 Ack=674 Win=8 Len=0"
"356","24.219933","172.64.155.249","192.168.0.183","TLSv1.2","93","Application Data"
"357","24.253640","172.64.155.249","192.168.0.183","TLSv1.2","475","Application Data"
"358","24.253640","172.64.155.249","192.168.0.183","TLSv1.2","203","Application Data"
"359","24.253640","172.64.155.249","192.168.0.183","TLSv1.2","85","Application Data"
"360","24.253711","192.168.0.183","172.64.155.249","TCP","54","51134  >  443 [ACK] Seq=674 Ack=1914 Win=509 Len=0"
"361","24.254870","192.168.0.183","172.64.155.249","TLSv1.2","89","Application Data"
"362","24.309138","172.64.155.249","192.168.0.183","TCP","60","443  >  51134 [ACK] Seq=1914 Ack=709 Win=8 Len=0"
"363","24.566444","192.168.0.183","172.64.155.249","TLSv1.2","545","Application Data"
"364","24.566499","192.168.0.183","172.64.155.249","TLSv1.2","546","Application Data"
"365","24.584534","172.64.155.249","192.168.0.183","TCP","60","443  >  51124 [ACK] Seq=243335 Ack=10228 Win=27 Len=0"
"366","24.605338","172.64.155.249","192.168.0.183","TLSv1.2","279","Application Data"
"367","24.605338","172.64.155.249","192.168.0.183","TLSv1.2","85","Application Data"
"368","24.605385","192.168.0.183","172.64.155.249","TCP","54","51124  >  443 [ACK] Seq=10228 Ack=243591 Win=513 Len=0"
"369","28.209047","192.168.0.183","172.64.155.249","TLSv1.2","229","Application Data"
"370","28.209136","192.168.0.183","172.64.155.249","TLSv1.2","586","Application Data"
"371","28.222662","172.64.155.249","192.168.0.183","TCP","60","443  >  51124 [ACK] Seq=243591 Ack=10935 Win=28 Len=0"
"372","28.224729","192.168.0.183","172.64.155.249","TLSv1.2","757","Application Data"
"373","28.245451","172.64.155.249","192.168.0.183","TLSv1.2","278","Application Data"
"374","28.245451","172.64.155.249","192.168.0.183","TLSv1.2","85","Application Data"
"375","28.245494","192.168.0.183","172.64.155.249","TCP","54","51124  >  443 [ACK] Seq=11638 Ack=243846 Win=512 Len=0"
"376","28.284035","172.64.155.249","192.168.0.183","TLSv1.2","146","Application Data"
"377","28.284035","172.64.155.249","192.168.0.183","TLSv1.2","100","Application Data"
"378","28.284248","192.168.0.183","172.64.155.249","TCP","54","51124  >  443 [ACK] Seq=11638 Ack=243984 Win=511 Len=0"
"379","28.286668","192.168.0.183","172.64.155.249","TLSv1.2","89","Application Data"
"380","28.292046","172.64.155.249","192.168.0.183","TCP","1514","443  >  51124 [ACK] Seq=243984 Ack=11638 Win=28 Len=1460 [TCP segment of a reassembled PDU]"
"381","28.292046","172.64.155.249","192.168.0.183","TCP","1514","443  >  51124 [ACK] Seq=245444 Ack=11638 Win=28 Len=1460 [TCP segment of a reassembled PDU]"
"382","28.292046","172.64.155.249","192.168.0.183","TCP","1514","443  >  51124 [ACK] Seq=246904 Ack=11638 Win=28 Len=1460 [TCP segment of a reassembled PDU]"
"383","28.292046","172.64.155.249","192.168.0.183","TCP","1514","443  >  51124 [ACK] Seq=248364 Ack=11638 Win=28 Len=1460 [TCP segment of a reassembled PDU]"
"384","28.292046","172.64.155.249","192.168.0.183","TCP","1514","443  >  51124 [ACK] Seq=249824 Ack=11638 Win=28 Len=1460 [TCP segment of a reassembled PDU]"
"385","28.292046","172.64.155.249","192.168.0.183","TCP","1514","443  >  51124 [PSH, ACK] Seq=251284 Ack=11638 Win=28 Len=1460 [TCP segment of a reassembled PDU]"
"386","28.292046","172.64.155.249","192.168.0.183","TLSv1.2","1252","Application Data"
"387","28.292120","192.168.0.183","172.64.155.249","TCP","54","51124  >  443 [ACK] Seq=11673 Ack=253942 Win=514 Len=0"
"388","28.293844","172.64.155.249","192.168.0.183","TCP","1514","443  >  51124 [ACK] Seq=253942 Ack=11638 Win=28 Len=1460 [TCP segment of a reassembled PDU]"
"389","28.293844","172.64.155.249","192.168.0.183","TLSv1.2","1258","Application Data"
"390","28.293891","192.168.0.183","172.64.155.249","TCP","54","51124  >  443 [ACK] Seq=11673 Ack=256606 Win=514 Len=0"
"391","28.297897","172.64.155.249","192.168.0.183","TCP","1514","443  >  51124 [ACK] Seq=256606 Ack=11638 Win=28 Len=1460 [TCP segment of a reassembled PDU]"
"392","28.297897","172.64.155.249","192.168.0.183","TCP","1514","443  >  51124 [ACK] Seq=258066 Ack=11638 Win=28 Len=1460 [TCP segment of a reassembled PDU]"
"393","28.297897","172.64.155.249","192.168.0.183","TCP","1514","443  >  51124 [ACK] Seq=259526 Ack=11638 Win=28 Len=1460 [TCP segment of a reassembled PDU]"
"394","28.297897","172.64.155.249","192.168.0.183","TCP","1514","443  >  51124 [ACK] Seq=260986 Ack=11638 Win=28 Len=1460 [TCP segment of a reassembled PDU]"
"395","28.297897","172.64.155.249","192.168.0.183","TLSv1.2","1007","Application Data"
"396","28.297973","192.168.0.183","172.64.155.249","TCP","54","51124  >  443 [ACK] Seq=11673 Ack=263399 Win=514 Len=0"
"397","28.300122","172.64.155.249","192.168.0.183","TCP","1514","443  >  51124 [ACK] Seq=263399 Ack=11638 Win=28 Len=1460 [TCP segment of a reassembled PDU]"
"398","28.300122","172.64.155.249","192.168.0.183","TCP","1514","443  >  51124 [ACK] Seq=264859 Ack=11638 Win=28 Len=1460 [TCP segment of a reassembled PDU]"
"399","28.300122","172.64.155.249","192.168.0.183","TCP","1514","443  >  51124 [ACK] Seq=266319 Ack=11638 Win=28 Len=1460 [TCP segment of a reassembled PDU]"
"400","28.300122","172.64.155.249","192.168.0.183","TCP","1514","443  >  51124 [ACK] Seq=267779 Ack=11638 Win=28 Len=1460 [TCP segment of a reassembled PDU]"
"401","28.300122","172.64.155.249","192.168.0.183","TCP","1514","443  >  51124 [ACK] Seq=269239 Ack=11638 Win=28 Len=1460 [TCP segment of a reassembled PDU]"
"402","28.300122","172.64.155.249","192.168.0.183","TCP","1514","443  >  51124 [PSH, ACK] Seq=270699 Ack=11638 Win=28 Len=1460 [TCP segment of a reassembled PDU]"
"403","28.300122","172.64.155.249","192.168.0.183","TCP","1514","443  >  51124 [ACK] Seq=272159 Ack=11638 Win=28 Len=1460 [TCP segment of a reassembled PDU]"
"404","28.300122","172.64.155.249","192.168.0.183","TCP","1514","443  >  51124 [ACK] Seq=273619 Ack=11638 Win=28 Len=1460 [TCP segment of a reassembled PDU]"
"405","28.300122","172.64.155.249","192.168.0.183","TLSv1.2","385","Application Data"
"406","28.300204","192.168.0.183","172.64.155.249","TCP","54","51124  >  443 [ACK] Seq=11673 Ack=275410 Win=514 Len=0"
"407","28.304970","172.64.155.249","192.168.0.183","TCP","1514","443  >  51124 [ACK] Seq=275410 Ack=11673 Win=28 Len=1460 [TCP segment of a reassembled PDU]"
"408","28.304970","172.64.155.249","192.168.0.183","TCP","1514","443  >  51124 [ACK] Seq=276870 Ack=11673 Win=28 Len=1460 [TCP segment of a reassembled PDU]"
"409","28.304970","172.64.155.249","192.168.0.183","TCP","1514","443  >  51124 [ACK] Seq=278330 Ack=11673 Win=28 Len=1460 [TCP segment of a reassembled PDU]"
"410","28.304970","172.64.155.249","192.168.0.183","TLSv1.2","575","Application Data"
"411","28.304970","172.64.155.249","192.168.0.183","TCP","1514","443  >  51124 [ACK] Seq=280311 Ack=11673 Win=28 Len=1460 [TCP segment of a reassembled PDU]"
"412","28.304970","172.64.155.249","192.168.0.183","TLSv1.2","1331","Application Data"
"413","28.305046","192.168.0.183","172.64.155.249","TCP","54","51124  >  443 [ACK] Seq=11673 Ack=283048 Win=514 Len=0"
"414","28.306888","172.64.155.249","192.168.0.183","TCP","1514","443  >  51124 [ACK] Seq=283048 Ack=11673 Win=28 Len=1460 [TCP segment of a reassembled PDU]"
"415","28.306888","172.64.155.249","192.168.0.183","TLSv1.2","839","Application Data"
"416","28.306888","172.64.155.249","192.168.0.183","TLSv1.2","96","Application Data"
"417","28.306888","172.64.155.249","192.168.0.183","TLSv1.2","85","Application Data"
"418","28.306944","192.168.0.183","172.64.155.249","TCP","54","51124  >  443 [ACK] Seq=11673 Ack=285366 Win=514 Len=0"
"419","28.387346","192.168.0.183","172.64.155.249","TLSv1.2","203","Application Data"
"420","28.400574","172.64.155.249","192.168.0.183","TCP","60","443  >  51134 [ACK] Seq=1914 Ack=858 Win=8 Len=0"
"421","28.427081","172.64.155.249","192.168.0.183","TLSv1.2","476","Application Data"
"422","28.427081","172.64.155.249","192.168.0.183","TLSv1.2","203","Application Data"
"423","28.427081","172.64.155.249","192.168.0.183","TLSv1.2","85","Application Data"
"424","28.427122","192.168.0.183","172.64.155.249","TCP","54","51134  >  443 [ACK] Seq=858 Ack=2516 Win=514 Len=0"
"425","28.617329","192.168.0.183","172.64.155.249","TLSv1.2","313","Application Data"
"426","28.617622","192.168.0.183","172.64.155.249","TLSv1.2","179","Application Data"
"427","28.638536","172.64.155.249","192.168.0.183","TCP","60","443  >  51124 [ACK] Seq=285366 Ack=12057 Win=28 Len=0"
"428","28.655082","172.64.155.249","192.168.0.183","TLSv1.2","326","Application Data"
"429","28.655082","172.64.155.249","192.168.0.183","TLSv1.2","617","Application Data"
"430","28.655082","172.64.155.249","192.168.0.183","TLSv1.2","85","Application Data"
"431","28.655125","192.168.0.183","172.64.155.249","TCP","54","51124  >  443 [ACK] Seq=12057 Ack=286232 Win=510 Len=0"
"432","28.660448","172.64.155.249","192.168.0.183","TLSv1.2","152","Application Data"
"433","28.660482","192.168.0.183","172.64.155.249","TCP","54","51124  >  443 [ACK] Seq=12057 Ack=286330 Win=510 Len=0"
"434","28.946463","192.168.0.183","172.64.155.249","TLSv1.2","515","Application Data"
"435","28.946527","192.168.0.183","172.64.155.249","TLSv1.2","601","Application Data"
"436","28.962728","172.64.155.249","192.168.0.183","TCP","60","443  >  51124 [ACK] Seq=286330 Ack=13065 Win=29 Len=0"
"437","28.987890","172.64.155.249","192.168.0.183","TLSv1.2","144","Application Data"
"438","28.987890","172.64.155.249","192.168.0.183","TLSv1.2","85","Application Data"
"439","28.987932","192.168.0.183","172.64.155.249","TCP","54","51124  >  443 [ACK] Seq=13065 Ack=286451 Win=509 Len=0"
"440","31.505004","192.168.0.183","172.64.155.249","TLSv1.2","140","Application Data"
"441","31.561417","172.64.155.249","192.168.0.183","TCP","60","443  >  51124 [ACK] Seq=286451 Ack=13151 Win=29 Len=0"
"442","31.601596","172.64.155.249","192.168.0.183","TLSv1.2","437","Application Data"
"443","31.601596","172.64.155.249","192.168.0.183","TLSv1.2","100","Application Data"
"444","31.601596","172.64.155.249","192.168.0.183","TLSv1.2","1285","Application Data"
"445","31.601657","192.168.0.183","172.64.155.249","TCP","54","51124  >  443 [ACK] Seq=13151 Ack=288111 Win=514 Len=0"
"446","31.603680","172.64.155.249","192.168.0.183","TCP","1514","443  >  51124 [ACK] Seq=288111 Ack=13151 Win=29 Len=1460 [TCP segment of a reassembled PDU]"
"447","31.603680","172.64.155.249","192.168.0.183","TCP","1514","443  >  51124 [ACK] Seq=289571 Ack=13151 Win=29 Len=1460 [TCP segment of a reassembled PDU]"
"448","31.603680","172.64.155.249","192.168.0.183","TCP","1514","443  >  51124 [ACK] Seq=291031 Ack=13151 Win=29 Len=1460 [TCP segment of a reassembled PDU]"
"449","31.603680","172.64.155.249","192.168.0.183","TCP","1514","443  >  51124 [ACK] Seq=292491 Ack=13151 Win=29 Len=1460 [TCP segment of a reassembled PDU]"
"450","31.603680","172.64.155.249","192.168.0.183","TCP","1514","443  >  51124 [ACK] Seq=293951 Ack=13151 Win=29 Len=1460 [TCP segment of a reassembled PDU]"
"451","31.603680","172.64.155.249","192.168.0.183","TCP","1514","443  >  51124 [PSH, ACK] Seq=295411 Ack=13151 Win=29 Len=1460 [TCP segment of a reassembled PDU]"
"452","31.603680","172.64.155.249","192.168.0.183","TLSv1.2","1126","Application Data"
"453","31.603793","192.168.0.183","172.64.155.249","TCP","54","51124  >  443 [ACK] Seq=13151 Ack=297943 Win=514 Len=0"
"454","31.615874","172.64.155.249","192.168.0.183","TCP","1514","443  >  51124 [ACK] Seq=297943 Ack=13151 Win=29 Len=1460 [TCP segment of a reassembled PDU]"
"455","31.615874","172.64.155.249","192.168.0.183","TLSv1.2","287","Application Data"
"456","31.615874","172.64.155.249","192.168.0.183","TCP","1514","443  >  51124 [ACK] Seq=299636 Ack=13151 Win=29 Len=1460 [TCP segment of a reassembled PDU]"
"457","31.615971","192.168.0.183","172.64.155.249","TCP","54","51124  >  443 [ACK] Seq=13151 Ack=301096 Win=514 Len=0"
"458","31.617731","172.64.155.249","192.168.0.183","TCP","1514","443  >  51124 [ACK] Seq=301096 Ack=13151 Win=29 Len=1460 [TCP segment of a reassembled PDU]"
"459","31.617731","172.64.155.249","192.168.0.183","TCP","1514","443  >  51124 [ACK] Seq=302556 Ack=13151 Win=29 Len=1460 [TCP segment of a reassembled PDU]"
"460","31.617731","172.64.155.249","192.168.0.183","TLSv1.2","303","Application Data"
"461","31.617731","172.64.155.249","192.168.0.183","TCP","1514","443  >  51124 [ACK] Seq=304265 Ack=13151 Win=29 Len=1460 [TCP segment of a reassembled PDU]"
"462","31.617731","172.64.155.249","192.168.0.183","TCP","1514","443  >  51124 [ACK] Seq=305725 Ack=13151 Win=29 Len=1460 [TCP segment of a reassembled PDU]"
"463","31.617731","172.64.155.249","192.168.0.183","TCP","1514","443  >  51124 [ACK] Seq=307185 Ack=13151 Win=29 Len=1460 [TCP segment of a reassembled PDU]"
"464","31.617731","172.64.155.249","192.168.0.183","TLSv1.2","695","Application Data"
"465","31.617853","192.168.0.183","172.64.155.249","TCP","54","51124  >  443 [ACK] Seq=13151 Ack=309286 Win=514 Len=0"
"466","31.619132","172.64.155.249","192.168.0.183","TLSv1.2","127","Application Data, Application Data"
"467","31.669259","192.168.0.183","172.64.155.249","TCP","54","51124  >  443 [ACK] Seq=13151 Ack=309359 Win=513 Len=0"
"468","31.893512","192.168.0.183","172.64.155.249","TLSv1.2","198","Application Data"
"469","31.893747","192.168.0.183","172.64.155.249","TLSv1.2","179","Application Data"
"470","31.906197","172.64.155.249","192.168.0.183","TCP","60","443  >  51124 [ACK] Seq=309359 Ack=13420 Win=29 Len=0"
"471","31.929119","172.64.155.249","192.168.0.183","TLSv1.2","144","Application Data"
"472","31.936403","172.64.155.249","192.168.0.183","TLSv1.2","162","Application Data"
"473","31.936403","172.64.155.249","192.168.0.183","TLSv1.2","224","Application Data"
"474","31.936403","172.64.155.249","192.168.0.183","TLSv1.2","85","Application Data"
"475","31.936526","192.168.0.183","172.64.155.249","TCP","54","51124  >  443 [ACK] Seq=13420 Ack=309758 Win=512 Len=0"
"476","32.025115","192.168.0.183","172.64.155.249","TLSv1.2","490","Application Data"
"477","32.025180","192.168.0.183","172.64.155.249","TLSv1.2","544","Application Data"
"478","32.039992","172.64.155.249","192.168.0.183","TCP","60","443  >  51124 [ACK] Seq=309758 Ack=14346 Win=30 Len=0"
"479","32.065224","172.64.155.249","192.168.0.183","TLSv1.2","144","Application Data"
"480","32.065224","172.64.155.249","192.168.0.183","TLSv1.2","85","Application Data"
"481","32.065398","192.168.0.183","172.64.155.249","TCP","54","51124  >  443 [ACK] Seq=14346 Ack=309879 Win=511 Len=0"
"482","34.884339","192.168.0.183","172.64.155.249","TLSv1.2","178","Application Data"
"483","34.884438","192.168.0.183","172.64.155.249","TLSv1.2","170","Application Data"
"484","34.896950","192.168.0.183","172.64.155.249","TLSv1.2","297","Application Data"
"485","34.900572","172.64.155.249","192.168.0.183","TCP","60","443  >  51124 [ACK] Seq=309879 Ack=14586 Win=30 Len=0"
"486","34.922335","172.64.155.249","192.168.0.183","TLSv1.2","300","Application Data"
"487","34.967686","192.168.0.183","172.64.155.249","TCP","54","51124  >  443 [ACK] Seq=14829 Ack=310125 Win=510 Len=0"
"488","35.079505","172.64.155.249","192.168.0.183","TLSv1.2","171","Application Data"
"489","35.079505","172.64.155.249","192.168.0.183","TLSv1.2","100","Application Data"
"490","35.079505","172.64.155.249","192.168.0.183","TCP","1514","443  >  51124 [ACK] Seq=310288 Ack=14829 Win=30 Len=1460 [TCP segment of a reassembled PDU]"
"491","35.079505","172.64.155.249","192.168.0.183","TCP","1514","443  >  51124 [ACK] Seq=311748 Ack=14829 Win=30 Len=1460 [TCP segment of a reassembled PDU]"
"492","35.079505","172.64.155.249","192.168.0.183","TLSv1.2","942","Application Data"
"493","35.079505","172.64.155.249","192.168.0.183","TCP","1514","443  >  51124 [ACK] Seq=314096 Ack=14829 Win=30 Len=1460 [TCP segment of a reassembled PDU]"
"494","35.079505","172.64.155.249","192.168.0.183","TLSv1.2","947","Application Data"
"495","35.079559","192.168.0.183","172.64.155.249","TCP","54","51124  >  443 [ACK] Seq=14829 Ack=316449 Win=514 Len=0"
"496","35.080890","192.168.0.183","172.64.155.249","TLSv1.2","89","Application Data"
"497","35.081903","172.64.155.249","192.168.0.183","TCP","1514","443  >  51124 [ACK] Seq=316449 Ack=14829 Win=30 Len=1460 [TCP segment of a reassembled PDU]"
"498","35.081903","172.64.155.249","192.168.0.183","TCP","1514","443  >  51124 [ACK] Seq=317909 Ack=14829 Win=30 Len=1460 [TCP segment of a reassembled PDU]"
"499","35.081903","172.64.155.249","192.168.0.183","TLSv1.2","633","Application Data"
"500","35.081942","192.168.0.183","172.64.155.249","TCP","54","51124  >  443 [ACK] Seq=14864 Ack=319948 Win=514 Len=0"
"501","35.091808","172.64.155.249","192.168.0.183","TCP","1514","443  >  51124 [ACK] Seq=319948 Ack=14829 Win=30 Len=1460 [TCP segment of a reassembled PDU]"
"502","35.091808","172.64.155.249","192.168.0.183","TLSv1.2","1194","Application Data"
"503","35.091850","192.168.0.183","172.64.155.249","TCP","54","51124  >  443 [ACK] Seq=14864 Ack=322548 Win=514 Len=0"
"504","35.092680","172.64.155.249","192.168.0.183","TCP","1514","443  >  51124 [ACK] Seq=322548 Ack=14829 Win=30 Len=1460 [TCP segment of a reassembled PDU]"
"505","35.092680","172.64.155.249","192.168.0.183","TCP","1514","443  >  51124 [ACK] Seq=324008 Ack=14829 Win=30 Len=1460 [TCP segment of a reassembled PDU]"
"506","35.092680","172.64.155.249","192.168.0.183","TCP","1514","443  >  51124 [ACK] Seq=325468 Ack=14829 Win=30 Len=1460 [TCP segment of a reassembled PDU]"
"507","35.092680","172.64.155.249","192.168.0.183","TLSv1.2","1507","Application Data"
"508","35.092727","192.168.0.183","172.64.155.249","TCP","54","51124  >  443 [ACK] Seq=14864 Ack=328381 Win=514 Len=0"
"509","35.094527","172.64.155.249","192.168.0.183","TCP","1514","443  >  51124 [ACK] Seq=328381 Ack=14829 Win=30 Len=1460 [TCP segment of a reassembled PDU]"
"510","35.094527","172.64.155.249","192.168.0.183","TCP","1514","443  >  51124 [ACK] Seq=329841 Ack=14829 Win=30 Len=1460 [TCP segment of a reassembled PDU]"
"511","35.094527","172.64.155.249","192.168.0.183","TCP","1514","443  >  51124 [ACK] Seq=331301 Ack=14829 Win=30 Len=1460 [TCP segment of a reassembled PDU]"
"512","35.094527","172.64.155.249","192.168.0.183","TCP","1514","443  >  51124 [ACK] Seq=332761 Ack=14829 Win=30 Len=1460 [TCP segment of a reassembled PDU]"
"513","35.094527","172.64.155.249","192.168.0.183","TCP","1514","443  >  51124 [ACK] Seq=334221 Ack=14829 Win=30 Len=1460 [TCP segment of a reassembled PDU]"
"514","35.094527","172.64.155.249","192.168.0.183","TCP","1514","443  >  51124 [PSH, ACK] Seq=335681 Ack=14829 Win=30 Len=1460 [TCP segment of a reassembled PDU]"
"515","35.094527","172.64.155.249","192.168.0.183","TCP","1514","443  >  51124 [ACK] Seq=337141 Ack=14829 Win=30 Len=1460 [TCP segment of a reassembled PDU]"
"516","35.094527","172.64.155.249","192.168.0.183","TCP","1514","443  >  51124 [ACK] Seq=338601 Ack=14829 Win=30 Len=1460 [TCP segment of a reassembled PDU]"
"517","35.094527","172.64.155.249","192.168.0.183","TCP","1514","443  >  51124 [ACK] Seq=340061 Ack=14829 Win=30 Len=1460 [TCP segment of a reassembled PDU]"
"518","35.094527","172.64.155.249","192.168.0.183","TLSv1.2","433","Application Data"
"519","35.094608","192.168.0.183","172.64.155.249","TCP","54","51124  >  443 [ACK] Seq=14864 Ack=341900 Win=514 Len=0"
"520","35.100506","172.64.155.249","192.168.0.183","TCP","1514","443  >  51124 [ACK] Seq=341900 Ack=14864 Win=30 Len=1460 [TCP segment of a reassembled PDU]"
"521","35.100506","172.64.155.249","192.168.0.183","TCP","1514","443  >  51124 [ACK] Seq=343360 Ack=14864 Win=30 Len=1460 [TCP segment of a reassembled PDU]"
"522","35.100506","172.64.155.249","192.168.0.183","TLSv1.2","529","Application Data"
"523","35.100506","172.64.155.249","192.168.0.183","TLSv1.2","96","Application Data"
"524","35.100506","172.64.155.249","192.168.0.183","TLSv1.2","85","Application Data"
"525","35.100633","192.168.0.183","172.64.155.249","TCP","54","51124  >  443 [ACK] Seq=14864 Ack=345368 Win=514 Len=0"
"526","35.270790","192.168.0.183","172.64.155.249","TLSv1.2","184","Application Data"
"527","35.324216","172.64.155.249","192.168.0.183","TLSv1.2","669","Application Data"
"528","35.324216","172.64.155.249","192.168.0.183","TLSv1.2","203","Application Data"
"529","35.324216","172.64.155.249","192.168.0.183","TLSv1.2","85","Application Data"
"530","35.324294","192.168.0.183","172.64.155.249","TCP","54","51134  >  443 [ACK] Seq=988 Ack=3311 Win=510 Len=0"
"531","35.325882","192.168.0.183","172.64.155.249","TLSv1.2","89","Application Data"
"532","35.378926","172.64.155.249","192.168.0.183","TCP","60","443  >  51134 [ACK] Seq=3311 Ack=1023 Win=8 Len=0"
"533","35.578658","192.168.0.183","172.64.155.249","TLSv1.2","533","Application Data"
"534","35.578741","192.168.0.183","172.64.155.249","TLSv1.2","547","Application Data"
"535","35.594014","172.64.155.249","192.168.0.183","TCP","60","443  >  51124 [ACK] Seq=345368 Ack=15836 Win=31 Len=0"
"536","35.617463","172.64.155.249","192.168.0.183","TLSv1.2","278","Application Data"
"537","35.617463","172.64.155.249","192.168.0.183","TLSv1.2","85","Application Data"
"538","35.617500","192.168.0.183","172.64.155.249","TCP","54","51124  >  443 [ACK] Seq=15836 Ack=345623 Win=513 Len=0"
"539","37.253494","192.168.0.183","172.64.155.249","TLSv1.2","791","Application Data"
"540","37.253603","192.168.0.183","172.64.155.249","TLSv1.2","587","Application Data"
"541","37.266268","172.64.155.249","192.168.0.183","TCP","60","443  >  51124 [ACK] Seq=345623 Ack=17106 Win=32 Len=0"
"542","37.268696","192.168.0.183","172.64.155.249","TLSv1.2","236","Application Data"
"543","37.292929","172.64.155.249","192.168.0.183","TLSv1.2","278","Application Data"
"544","37.292929","172.64.155.249","192.168.0.183","TLSv1.2","85","Application Data"
"545","37.292963","192.168.0.183","172.64.155.249","TCP","54","51124  >  443 [ACK] Seq=17288 Ack=345878 Win=512 Len=0"
"546","37.318794","172.64.155.249","192.168.0.183","TLSv1.2","146","Application Data"
"547","37.318794","172.64.155.249","192.168.0.183","TLSv1.2","100","Application Data"
"548","37.318794","172.64.155.249","192.168.0.183","TCP","1514","443  >  51124 [ACK] Seq=346016 Ack=17288 Win=32 Len=1460 [TCP segment of a reassembled PDU]"
"549","37.318794","172.64.155.249","192.168.0.183","TCP","1514","443  >  51124 [ACK] Seq=347476 Ack=17288 Win=32 Len=1460 [TCP segment of a reassembled PDU]"
"550","37.318794","172.64.155.249","192.168.0.183","TLSv1.2","976","Application Data"
"551","37.318841","192.168.0.183","172.64.155.249","TCP","54","51124  >  443 [ACK] Seq=17288 Ack=349858 Win=514 Len=0"
"552","37.321059","172.64.155.249","192.168.0.183","TCP","1514","443  >  51124 [ACK] Seq=349858 Ack=17288 Win=32 Len=1460 [TCP segment of a reassembled PDU]"
"553","37.321059","172.64.155.249","192.168.0.183","TCP","1514","443  >  51124 [ACK] Seq=351318 Ack=17288 Win=32 Len=1460 [TCP segment of a reassembled PDU]"
"554","37.321059","172.64.155.249","192.168.0.183","TLSv1.2","957","Application Data"
"555","37.321059","172.64.155.249","192.168.0.183","TCP","1514","443  >  51124 [ACK] Seq=353681 Ack=17288 Win=32 Len=1460 [TCP segment of a reassembled PDU]"
"556","37.321059","172.64.155.249","192.168.0.183","TLSv1.2","913","Application Data"
"557","37.321167","192.168.0.183","172.64.155.249","TCP","54","51124  >  443 [ACK] Seq=17288 Ack=356000 Win=514 Len=0"
"558","37.329692","172.64.155.249","192.168.0.183","TCP","1514","443  >  51124 [ACK] Seq=356000 Ack=17288 Win=32 Len=1460 [TCP segment of a reassembled PDU]"
"559","37.329692","172.64.155.249","192.168.0.183","TLSv1.2","1383","Application Data"
"560","37.329759","192.168.0.183","172.64.155.249","TCP","54","51124  >  443 [ACK] Seq=17288 Ack=358789 Win=514 Len=0"
"561","37.332390","172.64.155.249","192.168.0.183","TCP","1514","443  >  51124 [ACK] Seq=358789 Ack=17288 Win=32 Len=1460 [TCP segment of a reassembled PDU]"
"562","37.332390","172.64.155.249","192.168.0.183","TCP","1514","443  >  51124 [ACK] Seq=360249 Ack=17288 Win=32 Len=1460 [TCP segment of a reassembled PDU]"
"563","37.332390","172.64.155.249","192.168.0.183","TCP","1514","443  >  51124 [ACK] Seq=361709 Ack=17288 Win=32 Len=1460 [TCP segment of a reassembled PDU]"
"564","37.332390","172.64.155.249","192.168.0.183","TLSv1.2","417","Application Data"
"565","37.332573","192.168.0.183","172.64.155.249","TCP","54","51124  >  443 [ACK] Seq=17288 Ack=363532 Win=514 Len=0"
"566","37.336911","172.64.155.249","192.168.0.183","TCP","1514","443  >  51124 [ACK] Seq=363532 Ack=17288 Win=32 Len=1460 [TCP segment of a reassembled PDU]"
"567","37.336911","172.64.155.249","192.168.0.183","TCP","1514","443  >  51124 [ACK] Seq=364992 Ack=17288 Win=32 Len=1460 [TCP segment of a reassembled PDU]"
"568","37.336911","172.64.155.249","192.168.0.183","TCP","1514","443  >  51124 [ACK] Seq=366452 Ack=17288 Win=32 Len=1460 [TCP segment of a reassembled PDU]"
"569","37.336911","172.64.155.249","192.168.0.183","TCP","1514","443  >  51124 [ACK] Seq=367912 Ack=17288 Win=32 Len=1460 [TCP segment of a reassembled PDU]"
"570","37.336911","172.64.155.249","192.168.0.183","TCP","1514","443  >  51124 [ACK] Seq=369372 Ack=17288 Win=32 Len=1460 [TCP segment of a reassembled PDU]"
"571","37.336911","172.64.155.249","192.168.0.183","TCP","1514","443  >  51124 [PSH, ACK] Seq=370832 Ack=17288 Win=32 Len=1460 [TCP segment of a reassembled PDU]"
"572","37.336911","172.64.155.249","192.168.0.183","TCP","1514","443  >  51124 [ACK] Seq=372292 Ack=17288 Win=32 Len=1460 [TCP segment of a reassembled PDU]"
"573","37.336911","172.64.155.249","192.168.0.183","TCP","1514","443  >  51124 [ACK] Seq=373752 Ack=17288 Win=32 Len=1460 [TCP segment of a reassembled PDU]"
"574","37.336911","172.64.155.249","192.168.0.183","TCP","1514","443  >  51124 [ACK] Seq=375212 Ack=17288 Win=32 Len=1460 [TCP segment of a reassembled PDU]"
"575","37.336911","172.64.155.249","192.168.0.183","TCP","1514","443  >  51124 [ACK] Seq=376672 Ack=17288 Win=32 Len=1460 [TCP segment of a reassembled PDU]"
"576","37.336911","172.64.155.249","192.168.0.183","TLSv1.2","883","Application Data"
"577","37.337039","192.168.0.183","172.64.155.249","TCP","54","51124  >  443 [ACK] Seq=17288 Ack=378961 Win=514 Len=0"
"578","37.340165","172.64.155.249","192.168.0.183","TCP","1514","443  >  51124 [ACK] Seq=378961 Ack=17288 Win=32 Len=1460 [TCP segment of a reassembled PDU]"
"579","37.340165","172.64.155.249","192.168.0.183","TCP","1514","443  >  51124 [ACK] Seq=380421 Ack=17288 Win=32 Len=1460 [TCP segment of a reassembled PDU]"
"580","37.340165","172.64.155.249","192.168.0.183","TCP","1514","443  >  51124 [ACK] Seq=381881 Ack=17288 Win=32 Len=1460 [TCP segment of a reassembled PDU]"
"581","37.340165","172.64.155.249","192.168.0.183","TLSv1.2","586","Application Data"
"582","37.340165","172.64.155.249","192.168.0.183","TCP","1514","443  >  51124 [ACK] Seq=383873 Ack=17288 Win=32 Len=1460 [TCP segment of a reassembled PDU]"
"583","37.340165","172.64.155.249","192.168.0.183","TLSv1.2","1292","Application Data"
"584","37.340165","172.64.155.249","192.168.0.183","TLSv1.2","156","Application Data"
"585","37.340165","172.64.155.249","192.168.0.183","TLSv1.2","96","Application Data"
"586","37.340165","172.64.155.249","192.168.0.183","TLSv1.2","85","Application Data"
"587","37.340262","192.168.0.183","172.64.155.249","TCP","54","51124  >  443 [ACK] Seq=17288 Ack=386746 Win=514 Len=0"
"588","37.427518","192.168.0.183","172.64.155.249","TLSv1.2","197","Application Data"
"589","37.441218","172.64.155.249","192.168.0.183","TCP","60","443  >  51134 [ACK] Seq=3311 Ack=1166 Win=8 Len=0"
"590","37.465926","172.64.155.249","192.168.0.183","TLSv1.2","473","Application Data"
"591","37.465926","172.64.155.249","192.168.0.183","TLSv1.2","203","Application Data"
"592","37.465926","172.64.155.249","192.168.0.183","TLSv1.2","85","Application Data"
"593","37.466013","192.168.0.183","172.64.155.249","TCP","54","51134  >  443 [ACK] Seq=1166 Ack=3910 Win=508 Len=0"
"594","37.784449","192.168.0.183","172.64.155.249","TLSv1.2","277","Application Data"
"595","37.818929","172.64.155.249","192.168.0.183","TLSv1.2","278","Application Data"
"596","37.864899","192.168.0.183","172.64.155.249","TCP","54","51124  >  443 [ACK] Seq=17511 Ack=386970 Win=513 Len=0"
"597","38.009103","192.168.0.183","172.64.155.249","TLSv1.2","521","Application Data"
"598","38.009186","192.168.0.183","172.64.155.249","TLSv1.2","587","Application Data"
"599","38.024284","172.64.155.249","192.168.0.183","TCP","60","443  >  51124 [ACK] Seq=386970 Ack=18511 Win=33 Len=0"
"600","38.050190","172.64.155.249","192.168.0.183","TLSv1.2","179","Application Data"
"601","38.050190","172.64.155.249","192.168.0.183","TLSv1.2","85","Application Data"
"602","38.050352","192.168.0.183","172.64.155.249","TCP","54","51124  >  443 [ACK] Seq=18511 Ack=387126 Win=512 Len=0"
